Sheet: strlen
A1: strlen: &"\x01"{\0,\0,\0,\0,\0} :=> 1; | J1: # | K1: Test Case | L1: N | P1: FINAL
A2: strlen: &"\x01\x01"{\0,\0,\0,\0} :=> 2; | J2: 1 | K2: strlen: &"a"{\0,p,p,p,\0} :=> 1 | L2: 1 | N2: of:=IF([.L2]=1;"";[.L2]) ->  | P2: of:=AVERAGE([.N2:.N6]) -> 0.0814006
A3: strlen: &"\x01\x01\x01"{\0,\0,\0} :=> 3; | J3: 2 | K3: strlen: &"aa"{\0,p,p,\0} :=> 2 | L3: 0.193065 | N3: of:=IF([.L3]=1;"";[.L3]) -> 0.193065
A4: strlen: &"\x01\x01\x01\x01"{\0,\0} :=> 4; | J4: 3 | K4: strlen: &"aaa"{\0,p,\0} :=> 3 | L4: 0.0719654 | N4: of:=IF([.L4]=1;"";[.L4]) -> 0.0719654
A5: strlen: &"\x01\x01\x01\x01\x01"{\0} :=> 5; | J5: 4 | K5: strlen: &"aaaa"{\0,\0} :=> 4 | L5: 0.0372739 | N5: of:=IF([.L5]=1;"";[.L5]) -> 0.0372739
A6: strnlen: &""{\0,\0,\0,\0,\0,\0} 6 :=> 0; 1; | J6: 5 | K6: strlen: &"aaaaa"{\0} :=> 5 | L6: 0.0232981 | N6: of:=IF([.L6]=1;"";[.L6]) -> 0.0232981
A7: strnlen: &"\x01"{\0,\0,\0,\0,\0} 6 :=> 1; | J7: 1 | K7: strnlen: &""{\0,p,p,p,p,\0} 6 :=> 0 | L7: 1 | N7: of:=IF([.L7]=1;"";[.L7]) ->  | P7: of:=AVERAGE([.N7:.N12]) -> 0.0814006
A8: strnlen: &"\x01\x01"{\0,\0,\0,\0} 6 :=> 2; | J8: 2 | K8: strnlen: &"a"{\0,p,p,p,\0} 6 :=> 1 | L8: 1 | N8: of:=IF([.L8]=1;"";[.L8]) -> 
A9: strnlen: &"\x01\x01\x01"{\0,\0,\0} 6 :=> 3; | J9: 3 | K9: strnlen: &"aa"{\0,p,p,\0} 6 :=> 2 | L9: 0.193065 | N9: of:=IF([.L9]=1;"";[.L9]) -> 0.193065
A10: strnlen: &"\x01\x01\x01\x01"{\0,\0} 6 :=> 4; | J10: 4 | K10: strnlen: &"aaa"{\0,p,\0} 6 :=> 3 | L10: 0.0719654 | N10: of:=IF([.L10]=1;"";[.L10]) -> 0.0719654
A11: strnlen: &"\x01\x01\x01\x01\x01"{\0} 6 :=> 5; | J11: 5 | K11: strnlen: &"aaaa"{\0,\0} 6 :=> 4 | L11: 0.0372739 | N11: of:=IF([.L11]=1;"";[.L11]) -> 0.0372739
J12: 6 | K12: strnlen: &"aaaaa"{\0} 6 :=> 5 | L12: 0.0232981 | N12: of:=IF([.L12]=1;"";[.L12]) -> 0.0232981

Sheet: strcmp
A1: # | B1: Test Case | C1: N1 | D1: N2 | L1: FINAL
A2: 1 | B2: strcmp: &"b"{\0,p,p,p,\0} &"b"{\0,p,p,p,\0} :=> 0 | C2: 1 | D2: 1 | F2: of:=IF([.C2]=1;"";[.C2]) ->  | G2: of:=IF([.D2]=1;"";[.D2]) ->  | H2: of:=IF([.E2]=1;"";[.E2]) ->   | I2: of:=AVERAGE([.F2:.F16]) -> 0.04460765 | J2: of:=AVERAGE([.G2:.G16]) -> 0.0427760357142857 | L2: of:=AVERAGE([.I2:.J2]) -> 0.0436918428571429
A3: 2 | B3: strcmp: &"ba"{\0,p,p,\0} &"ba"{\0,p,p,\0} :=> 0 | C3: 0.215236 | D3: 0.215236 | F3: of:=IF([.C3]=1;"";[.C3]) -> 0.215236 | G3: of:=IF([.D3]=1;"";[.D3]) -> 0.215236 | H3: of:=IF([.E3]=1;"";[.E3]) ->  
A4: 3 | B4: strcmp: &"baa"{\0,p,\0} &"baa"{\0,p,\0} :=> 0 | C4: 0.0785043 | D4: 0.0785043 | F4: of:=IF([.C4]=1;"";[.C4]) -> 0.0785043 | G4: of:=IF([.D4]=1;"";[.D4]) -> 0.0785043 | H4: of:=IF([.E4]=1;"";[.E4]) ->  
A5: 4 | B5: strcmp: &"baaa"{\0,\0} &"baaa"{\0,\0} :=> 0 | C5: 0.0400756 | D5: 0.0400756 | F5: of:=IF([.C5]=1;"";[.C5]) -> 0.0400756 | G5: of:=IF([.D5]=1;"";[.D5]) -> 0.0400756 | H5: of:=IF([.E5]=1;"";[.E5]) ->  
A6: 5 | B6: strcmp: &"baaaa"{\0} &"baaaa"{\0} :=> 0 | C6: 0.0247912 | D6: 0.0247912 | F6: of:=IF([.C6]=1;"";[.C6]) -> 0.0247912 | G6: of:=IF([.D6]=1;"";[.D6]) -> 0.0247912 | H6: of:=IF([.E6]=1;"";[.E6]) ->  
A7: 6 | B7: strcmp: &"baaaz"{\0} &"baaaa"{\0} :=> 1 | C7: 0.0255962 | D7: 0.0247912 | F7: of:=IF([.C7]=1;"";[.C7]) -> 0.0255962 | G7: of:=IF([.D7]=1;"";[.D7]) -> 0.0247912 | H7: of:=IF([.E7]=1;"";[.E7]) ->  
A8: 7 | B8: strcmp: &"baaah"{\0} &"baaai"{\0} :=> -1 | C8: 0.0255163 | D8: 0.0266989 | F8: of:=IF([.C8]=1;"";[.C8]) -> 0.0255163 | G8: of:=IF([.D8]=1;"";[.D8]) -> 0.0266989 | H8: of:=IF([.E8]=1;"";[.E8]) ->  
A9: 8 | B9: strcmp: &"baazp"{\0} &"baaap"{\0} :=> 1 | C9: 0.0241976 | D9: 0.0263801 | F9: of:=IF([.C9]=1;"";[.C9]) -> 0.0241976 | G9: of:=IF([.D9]=1;"";[.D9]) -> 0.0263801 | H9: of:=IF([.E9]=1;"";[.E9]) ->  
A10: 9 | B10: strcmp: &"baahp"{\0} &"baaip"{\0} :=> -1 | C10: 0.0247193 | D10: 0.0280782 | F10: of:=IF([.C10]=1;"";[.C10]) -> 0.0247193 | G10: of:=IF([.D10]=1;"";[.D10]) -> 0.0280782 | H10: of:=IF([.E10]=1;"";[.E10]) ->  
A11: 10 | B11: strcmp: &"baxpp"{\0} &"babdh"{\0} :=> 1 | C11: 0.0286338 | D11: 0.0260228 | F11: of:=IF([.C11]=1;"";[.C11]) -> 0.0286338 | G11: of:=IF([.D11]=1;"";[.D11]) -> 0.0260228 | H11: of:=IF([.E11]=1;"";[.E11]) ->  
A12: 11 | B12: strcmp: &"bahpp"{\0} &"baipp"{\0} :=> -1 | C12: 0.0262035 | D12: 0.0297641 | F12: of:=IF([.C12]=1;"";[.C12]) -> 0.0262035 | G12: of:=IF([.D12]=1;"";[.D12]) -> 0.0297641
A13: 12 | B13: strcmp: &"brppp"{\0} &"bhppp"{\0} :=> 1 | C13: 0.0288335 | D13: 0.0242101 | F13: of:=IF([.C13]=1;"";[.C13]) -> 0.0288335 | G13: of:=IF([.D13]=1;"";[.D13]) -> 0.0242101
A14: 13 | B14: strcmp: &"bpppp"{\0} &"bqppp"{\0} :=> -1 | C14: 0.026434 | D14: 0 | F14: of:=IF([.C14]=1;"";[.C14]) -> 0.026434 | G14: of:=IF([.D14]=1;"";[.D14]) -> 0
A15: 14 | B15: strcmp: &"zpppp"{\0} &"apppp"{\0} :=> 1 | C15: 0.0262354 | D15: 0.0295304 | F15: of:=IF([.C15]=1;"";[.C15]) -> 0.0262354 | G15: of:=IF([.D15]=1;"";[.D15]) -> 0.0295304
A16: 15 | B16: strcmp: &"apppp"{\0} &"bdpph"{\0} :=> -1 | C16: 0.0295304 | D16: 0.0247816 | F16: of:=IF([.C16]=1;"";[.C16]) -> 0.0295304 | G16: of:=IF([.D16]=1;"";[.D16]) -> 0.0247816
A17: 1 | B17: strncmp: &""{\0,p,p,p,p,\0} &""{\0,p,p,p,p,\0} 5 :=> 0 | C17: 1 | D17: 1 | F17: of:=IF([.C17]=1;"";[.C17]) ->  | G17: of:=IF([.D17]=1;"";[.D17]) ->  | I17: of:=AVERAGE([.F17:.F32]) -> 0.04460765 | J17: of:=AVERAGE([.G17:.G32]) -> 0.0427760357142857 | L17: of:=AVERAGE([.I17:.J17]) -> 0.0436918428571429
A18: 2 | B18: strncmp: &"b"{\0,p,p,p,\0} &"b"{\0,p,p,p,\0} 5 :=> 0 | C18: 1 | D18: 1 | F18: of:=IF([.C18]=1;"";[.C18]) ->  | G18: of:=IF([.D18]=1;"";[.D18]) -> 
A19: 3 | B19: strncmp: &"ba"{\0,p,p,\0} &"ba"{\0,p,p,\0} 5 :=> 0 | C19: 0.215236 | D19: 0.215236 | F19: of:=IF([.C19]=1;"";[.C19]) -> 0.215236 | G19: of:=IF([.D19]=1;"";[.D19]) -> 0.215236
A20: 4 | B20: strncmp: &"baa"{\0,p,\0} &"baa"{\0,p,\0} 5 :=> 0 | C20: 0.0785043 | D20: 0.0785043 | F20: of:=IF([.C20]=1;"";[.C20]) -> 0.0785043 | G20: of:=IF([.D20]=1;"";[.D20]) -> 0.0785043
A21: 5 | B21: strncmp: &"baaa"{\0,\0} &"baaa"{\0,\0} 5 :=> 0 | C21: 0.0400756 | D21: 0.0400756 | F21: of:=IF([.C21]=1;"";[.C21]) -> 0.0400756 | G21: of:=IF([.D21]=1;"";[.D21]) -> 0.0400756
A22: 6 | B22: strncmp: &"baaaa"{\0} &"baaaa"{\0} 5 :=> 0 | C22: 0.0247912 | D22: 0.0247912 | F22: of:=IF([.C22]=1;"";[.C22]) -> 0.0247912 | G22: of:=IF([.D22]=1;"";[.D22]) -> 0.0247912
A23: 7 | B23: strncmp: &"baaaz"{\0} &"baaaa"{\0} 5 :=> 1 | C23: 0.0255962 | D23: 0.0247912 | F23: of:=IF([.C23]=1;"";[.C23]) -> 0.0255962 | G23: of:=IF([.D23]=1;"";[.D23]) -> 0.0247912
A24: 8 | B24: strncmp: &"baaah"{\0} &"baaai"{\0} 5 :=> -1 | C24: 0.0255163 | D24: 0.0266989 | F24: of:=IF([.C24]=1;"";[.C24]) -> 0.0255163 | G24: of:=IF([.D24]=1;"";[.D24]) -> 0.0266989
A25: 9 | B25: strncmp: &"baazp"{\0} &"baaap"{\0} 5 :=> 1 | C25: 0.0241976 | D25: 0.0263801 | F25: of:=IF([.C25]=1;"";[.C25]) -> 0.0241976 | G25: of:=IF([.D25]=1;"";[.D25]) -> 0.0263801
A26: 10 | B26: strncmp: &"baahp"{\0} &"baaip"{\0} 5 :=> -1 | C26: 0.0247193 | D26: 0.0280782 | F26: of:=IF([.C26]=1;"";[.C26]) -> 0.0247193 | G26: of:=IF([.D26]=1;"";[.D26]) -> 0.0280782
A27: 11 | B27: strncmp: &"baxpp"{\0} &"babdh"{\0} 5 :=> 1 | C27: 0.0286338 | D27: 0.0260228 | F27: of:=IF([.C27]=1;"";[.C27]) -> 0.0286338 | G27: of:=IF([.D27]=1;"";[.D27]) -> 0.0260228
A28: 12 | B28: strncmp: &"bahpp"{\0} &"baipp"{\0} 5 :=> -1 | C28: 0.0262035 | D28: 0.0297641 | F28: of:=IF([.C28]=1;"";[.C28]) -> 0.0262035 | G28: of:=IF([.D28]=1;"";[.D28]) -> 0.0297641
A29: 13 | B29: strncmp: &"brppp"{\0} &"bhppp"{\0} 5 :=> 1 | C29: 0.0288335 | D29: 0.0242101 | F29: of:=IF([.C29]=1;"";[.C29]) -> 0.0288335 | G29: of:=IF([.D29]=1;"";[.D29]) -> 0.0242101
A30: 14 | B30: strncmp: &"bpppp"{\0} &"bqppp"{\0} 5 :=> -1 | C30: 0.026434 | D30: 0 | F30: of:=IF([.C30]=1;"";[.C30]) -> 0.026434 | G30: of:=IF([.D30]=1;"";[.D30]) -> 0
A31: 15 | B31: strncmp: &"zpppp"{\0} &"apppp"{\0} 5 :=> 1 | C31: 0.0262354 | D31: 0.0295304 | F31: of:=IF([.C31]=1;"";[.C31]) -> 0.0262354 | G31: of:=IF([.D31]=1;"";[.D31]) -> 0.0295304
A32: 16 | B32: strncmp: &"apppp"{\0} &"bdpph"{\0} 5 :=> -1 | C32: 0.0295304 | D32: 0.0247816 | F32: of:=IF([.C32]=1;"";[.C32]) -> 0.0295304 | G32: of:=IF([.D32]=1;"";[.D32]) -> 0.0247816
A33: 1 | B33: sysfs_streq: &""{\0,p,p,p,p,\0} &"bpppp"{\0} :=> \0 | C33: 1 | D33: 0.026434 | F33: of:=IF([.C33]=1;"";[.C33]) ->  | G33: of:=IF([.D33]=1;"";[.D33]) -> 0.026434 | I33: of:=AVERAGE([.F33:.F71]) -> 0.0638839965517242 | J33: of:=AVERAGE([.G33:.G71]) -> 0.0414987714285714 | L33: of:=AVERAGE([.I33:.J33]) -> 0.0526913839901478
A34: 2 | B34: sysfs_streq: &""{\0,p,p,p,p,\0} &"\n"{\0,b,b,a,\0} :=> \x01 | C34: 1 | F34: of:=IF([.C34]=1;"";[.C34]) ->  | G34: of:=IF([.D34]=1;"";[.D34]) ->  
A35: 3 | B35: sysfs_streq: &""{\0,p,p,p,p,\0} &"\nabab"{\0} :=> \0 | C35: 1 | F35: of:=IF([.C35]=1;"";[.C35]) ->  | G35: of:=IF([.D35]=1;"";[.D35]) ->  
A36: 4 | B36: sysfs_streq: &""{\0,p,p,p,p,\0} &""{\0,h,a,h,p,\0} :=> \x01 | C36: 1 | D36: 1 | F36: of:=IF([.C36]=1;"";[.C36]) ->  | G36: of:=IF([.D36]=1;"";[.D36]) -> 
A37: 5 | B37: sysfs_streq: &"bpppp"{\0} &"rpppp"{\0} :=> \0 | C37: 0.026434 | D37: 0.029024 | F37: of:=IF([.C37]=1;"";[.C37]) -> 0.026434 | G37: of:=IF([.D37]=1;"";[.D37]) -> 0.029024
A38: 6 | B38: sysfs_streq: &"\n"{\0,p,a,a,\0} &""{\0,a,a,a,b,\0} :=> \x01 | C38: 1 | F38: of:=IF([.C38]=1;"";[.C38]) ->  | G38: of:=IF([.D38]=1;"";[.D38]) ->  
A39: 7 | B39: sysfs_streq: &"\n"{\0,a,a,a,\0} &"abaaa"{\0} :=> \0 | C39: 0.026413 | F39: of:=IF([.C39]=1;"";[.C39]) -> 0.026413 | G39: of:=IF([.D39]=1;"";[.D39]) ->  
A40: 8 | B40: sysfs_streq: &"\nabbb"{\0} &"haaab"{\0} :=> \0 | C40: 0.0269428 | F40: of:=IF([.C40]=1;"";[.C40]) -> 0.0269428 | G40: of:=IF([.D40]=1;"";[.D40]) ->  
A41: 9 | B41: sysfs_streq: &"a"{\0,p,p,p,\0} &"aappp"{\0} :=> \0 | C41: 1 | D41: 0.0278577 | F41: of:=IF([.C41]=1;"";[.C41]) ->  | G41: of:=IF([.D41]=1;"";[.D41]) -> 0.0278577
A42: 10 | B42: sysfs_streq: &"a"{\0,p,p,p,\0} &"a\n"{\0,a,a,\0} :=> \x01 | C42: 1 | F42: of:=IF([.C42]=1;"";[.C42]) ->  | G42: of:=IF([.D42]=1;"";[.D42]) ->  
A43: 11 | B43: sysfs_streq: &"a"{\0,p,p,p,\0} &"a\naab"{\0} :=> \0 | C43: 1 | F43: of:=IF([.C43]=1;"";[.C43]) ->  | G43: of:=IF([.D43]=1;"";[.D43]) ->  
A44: 12 | B44: sysfs_streq: &"a"{\0,p,p,p,\0} &"a"{\0,h,b,p,\0} :=> \x01 | C44: 1 | D44: 1 | F44: of:=IF([.C44]=1;"";[.C44]) ->  | G44: of:=IF([.D44]=1;"";[.D44]) -> 
A45: 13 | B45: sysfs_streq: &"aappp"{\0} &"ahppp"{\0} :=> \0 | C45: 0.0278577 | D45: 0.0261039 | F45: of:=IF([.C45]=1;"";[.C45]) -> 0.0278577 | G45: of:=IF([.D45]=1;"";[.D45]) -> 0.0261039
A46: 14 | B46: sysfs_streq: &"a\n"{\0,b,b,\0} &"a"{\0,b,b,a,\0} :=> \x01 | C46: 1 | F46: of:=IF([.C46]=1;"";[.C46]) ->  | G46: of:=IF([.D46]=1;"";[.D46]) ->  
A47: 15 | B47: sysfs_streq: &"a\n"{\0,b,a,\0} &"aaaab"{\0} :=> \0 | C47: 0.0248222 | F47: of:=IF([.C47]=1;"";[.C47]) -> 0.0248222 | G47: of:=IF([.D47]=1;"";[.D47]) ->  
A48: 16 | B48: sysfs_streq: &"a\nabb"{\0} &"aaabb"{\0} :=> \0 | C48: 0.025536 | F48: of:=IF([.C48]=1;"";[.C48]) -> 0.025536 | G48: of:=IF([.D48]=1;"";[.D48]) ->  
A49: 17 | B49: sysfs_streq: &"aa"{\0,p,p,\0} &"aaapp"{\0} :=> \0 | C49: 0.193065 | D49: 0.0262798 | F49: of:=IF([.C49]=1;"";[.C49]) -> 0.193065 | G49: of:=IF([.D49]=1;"";[.D49]) -> 0.0262798
A50: 18 | B50: sysfs_streq: &"aa"{\0,p,p,\0} &"aa\n"{\0,a,\0} :=> \x01 | C50: 0.193065 | F50: of:=IF([.C50]=1;"";[.C50]) -> 0.193065 | G50: of:=IF([.D50]=1;"";[.D50]) ->  
A51: 19 | B51: sysfs_streq: &"aa"{\0,p,p,\0} &"aa\naa"{\0} :=> \0 | C51: 0.193065 | F51: of:=IF([.C51]=1;"";[.C51]) -> 0.193065 | G51: of:=IF([.D51]=1;"";[.D51]) ->  
A52: 20 | B52: sysfs_streq: &"aa"{\0,p,p,\0} &"aa"{\0,b,h,\0} :=> \x01 | C52: 0.193065 | D52: 0.193065 | F52: of:=IF([.C52]=1;"";[.C52]) -> 0.193065 | G52: of:=IF([.D52]=1;"";[.D52]) -> 0.193065
A53: 21 | B53: sysfs_streq: &"aacpp"{\0} &"aabpp"{\0} :=> \0 | C53: 0.0240986 | D53: 0.0250632 | F53: of:=IF([.C53]=1;"";[.C53]) -> 0.0240986 | G53: of:=IF([.D53]=1;"";[.D53]) -> 0.0250632
A54: 22 | B54: sysfs_streq: &"aa\n"{\0,b,\0} &"aa"{\0,b,b,\0} :=> \x01 | C54: 0.193065 | F54: of:=IF([.C54]=1;"";[.C54]) -> 0.193065 | G54: of:=IF([.D54]=1;"";[.D54]) ->  
A55: 23 | B55: sysfs_streq: &"aa\n"{\0,b,\0} &"aaaab"{\0} :=> \0 | C55: 0.0248222 | F55: of:=IF([.C55]=1;"";[.C55]) -> 0.0248222 | G55: of:=IF([.D55]=1;"";[.D55]) ->  
A56: 24 | B56: sysfs_streq: &"aa\nab"{\0} &"aaabb"{\0} :=> \0 | C56: 0.025536 | F56: of:=IF([.C56]=1;"";[.C56]) -> 0.025536 | G56: of:=IF([.D56]=1;"";[.D56]) ->  
A57: 25 | B57: sysfs_streq: &"aaa"{\0,p,\0} &"aaaap"{\0} :=> \0 | C57: 0.0719654 | D57: 0.0247912 | F57: of:=IF([.C57]=1;"";[.C57]) -> 0.0719654 | G57: of:=IF([.D57]=1;"";[.D57]) -> 0.0247912
A58: 26 | B58: sysfs_streq: &"aaa"{\0,p,\0} &"aaa\n"{\0,\0} :=> \x01 | C58: 0.0719654 | F58: of:=IF([.C58]=1;"";[.C58]) -> 0.0719654 | G58: of:=IF([.D58]=1;"";[.D58]) ->  
A59: 27 | B59: sysfs_streq: &"aaa"{\0,p,\0} &"aaa\na"{\0} :=> \0 | C59: 0.0719654 | F59: of:=IF([.C59]=1;"";[.C59]) -> 0.0719654 | G59: of:=IF([.D59]=1;"";[.D59]) ->  
A60: 28 | B60: sysfs_streq: &"aaa"{\0,p,\0} &"aaa"{\0,h,\0} :=> \x01 | C60: 0.0719654 | D60: 0.0719654 | F60: of:=IF([.C60]=1;"";[.C60]) -> 0.0719654 | G60: of:=IF([.D60]=1;"";[.D60]) -> 0.0719654
A61: 29 | B61: sysfs_streq: &"aaaip"{\0} &"aaahp"{\0} :=> \0 | C61: 0.0263871 | D61: 0.0232304 | F61: of:=IF([.C61]=1;"";[.C61]) -> 0.0263871 | G61: of:=IF([.D61]=1;"";[.D61]) -> 0.0232304
A62: 30 | B62: sysfs_streq: &"aaa\n"{\0,\0} &"aaa"{\0,a,\0} :=> \x01 | C62: 0.0719654 | F62: of:=IF([.C62]=1;"";[.C62]) -> 0.0719654 | G62: of:=IF([.D62]=1;"";[.D62]) ->  
A63: 31 | B63: sysfs_streq: &"aaa\n"{\0,\0} &"aaaab"{\0} :=> \0 | C63: 0.0248222 | F63: of:=IF([.C63]=1;"";[.C63]) -> 0.0248222 | G63: of:=IF([.D63]=1;"";[.D63]) ->  
A64: 32 | B64: sysfs_streq: &"aaa\na"{\0} &"aaaaa"{\0} :=> \0 | C64: 0.0232981 | F64: of:=IF([.C64]=1;"";[.C64]) -> 0.0232981 | G64: of:=IF([.D64]=1;"";[.D64]) ->  
A65: 33 | B65: sysfs_streq: &"aaaa"{\0,\0} &"aaaaa"{\0} :=> \0 | C65: 0.0372739 | D65: 0.0232981 | F65: of:=IF([.C65]=1;"";[.C65]) -> 0.0372739 | G65: of:=IF([.D65]=1;"";[.D65]) -> 0.0232981
A66: 34 | B66: sysfs_streq: &"aaaa"{\0,\0} &"aaaa\n"{\0} :=> \x01 | C66: 0.0372739 | F66: of:=IF([.C66]=1;"";[.C66]) -> 0.0372739 | G66: of:=IF([.D66]=1;"";[.D66]) ->  
A67: 35 | B67: sysfs_streq: &"aaaa"{\0,\0} &"aaaa"{\0,\0} :=> \x01 | C67: 0.0372739 | D67: 0.0372739 | F67: of:=IF([.C67]=1;"";[.C67]) -> 0.0372739 | G67: of:=IF([.D67]=1;"";[.D67]) -> 0.0372739
A68: 36 | B68: sysfs_streq: &"aaaab"{\0} &"aaaaa"{\0} :=> \0 | C68: 0.0248222 | D68: 0.0232981 | F68: of:=IF([.C68]=1;"";[.C68]) -> 0.0248222 | G68: of:=IF([.D68]=1;"";[.D68]) -> 0.0232981
A69: 37 | B69: sysfs_streq: &"aaaa\n"{\0} &"aaaa"{\0,\0} :=> \x01 | C69: 0.0372739 | F69: of:=IF([.C69]=1;"";[.C69]) -> 0.0372739 | G69: of:=IF([.D69]=1;"";[.D69]) ->  
A70: 38 | B70: sysfs_streq: &"aaaa\n"{\0} &"aaaaa"{\0} :=> \0 | C70: 0.0232981 | F70: of:=IF([.C70]=1;"";[.C70]) -> 0.0232981 | G70: of:=IF([.D70]=1;"";[.D70]) ->  
A71: 39 | B71: sysfs_streq: &"aaaaa"{\0} &"aaaaa"{\0} :=> \x01 | C71: 0.0232981 | D71: 0.0232981 | F71: of:=IF([.C71]=1;"";[.C71]) -> 0.0232981 | G71: of:=IF([.D71]=1;"";[.D71]) -> 0.0232981

Sheet: strcpy
A1: # | B1: Test Case | C1: N | O1: FINAL
A2: 1 | B2: strcpy: &""{\0,\x01,\x01,\x01,\x01,\x01} &"a"{\0,p,p,p,\0} :=> &"a"{\0,p,p,p,\0} | C2: 1 | D2: 1 | E2: 1 | G2: of:=IF([.C2]=1;"";[.C2]) ->  | H2: of:=IF([.D2]=1;"";[.D2]) ->  | I2: of:=IF([.E2]=1;"";[.E2]) ->  | K2: of:=AVERAGE([.G2:.G36]) -> 0.0814006 | L2: of:=AVERAGE([.H2:.H36]) -> 0.0814006 | M2: of:=AVERAGE([.I2:.I36]) -> 0.0814006 | O2: of:=AVERAGE([.K2:.M2]) -> 0.0814006
A3: 2 | B3: strcpy: &""{\0,\x01,\x01,\x01,\x01,\x01} &"aa"{\0,p,p,\0} :=> &"aa"{\0,p,p,\0} | C3: 1 | D3: 0.193065 | E3: 0.193065 | G3: of:=IF([.C3]=1;"";[.C3]) ->  | H3: of:=IF([.D3]=1;"";[.D3]) -> 0.193065 | I3: of:=IF([.E3]=1;"";[.E3]) -> 0.193065
A4: 3 | B4: strcpy: &""{\0,\x01,\x01,\x01,\x01,\x01} &"aaa"{\0,p,\0} :=> &"aaa"{\0,p,\0} | C4: 1 | D4: 0.0719654 | E4: 0.0719654 | G4: of:=IF([.C4]=1;"";[.C4]) ->  | H4: of:=IF([.D4]=1;"";[.D4]) -> 0.0719654 | I4: of:=IF([.E4]=1;"";[.E4]) -> 0.0719654
A5: 4 | B5: strcpy: &""{\0,\x01,\x01,\x01,\x01,\x01} &"aaaa"{\0,\0} :=> &"aaaa"{\0,\0} | C5: 1 | D5: 0.0372739 | E5: 0.0372739 | G5: of:=IF([.C5]=1;"";[.C5]) ->  | H5: of:=IF([.D5]=1;"";[.D5]) -> 0.0372739 | I5: of:=IF([.E5]=1;"";[.E5]) -> 0.0372739
A6: 5 | B6: strcpy: &""{\0,\x01,\x01,\x01,\x01,\x01} &"aaaaa"{\0} :=> &"aaaaa"{\0} | C6: 1 | D6: 0.0232981 | E6: 0.0232981 | G6: of:=IF([.C6]=1;"";[.C6]) ->  | H6: of:=IF([.D6]=1;"";[.D6]) -> 0.0232981 | I6: of:=IF([.E6]=1;"";[.E6]) -> 0.0232981
A7: 6 | B7: strcpy: &"a"{\0,\x01,\x01,\x01,\x01} &""{\0,p,p,p,p,\0} :=> &""{\0,\0,p,p,p,\0} | C7: 1 | D7: 1 | E7: 1 | G7: of:=IF([.C7]=1;"";[.C7]) ->  | H7: of:=IF([.D7]=1;"";[.D7]) ->  | I7: of:=IF([.E7]=1;"";[.E7]) -> 
A8: 7 | B8: strcpy: &"a"{\0,\x01,\x01,\x01,\x01} &"a"{\0,p,p,p,\0} :=> &"a"{\0,p,p,p,\0} | C8: 1 | D8: 1 | E8: 1 | G8: of:=IF([.C8]=1;"";[.C8]) ->  | H8: of:=IF([.D8]=1;"";[.D8]) ->  | I8: of:=IF([.E8]=1;"";[.E8]) -> 
A9: 8 | B9: strcpy: &"a"{\0,\x01,\x01,\x01,\x01} &"aa"{\0,p,p,\0} :=> &"aa"{\0,p,p,\0} | C9: 1 | D9: 0.193065 | E9: 0.193065 | G9: of:=IF([.C9]=1;"";[.C9]) ->  | H9: of:=IF([.D9]=1;"";[.D9]) -> 0.193065 | I9: of:=IF([.E9]=1;"";[.E9]) -> 0.193065
A10: 9 | B10: strcpy: &"a"{\0,\x01,\x01,\x01,\x01} &"aaa"{\0,p,\0} :=> &"aaa"{\0,p,\0} | C10: 1 | D10: 0.0719654 | E10: 0.0719654 | G10: of:=IF([.C10]=1;"";[.C10]) ->  | H10: of:=IF([.D10]=1;"";[.D10]) -> 0.0719654 | I10: of:=IF([.E10]=1;"";[.E10]) -> 0.0719654
A11: 10 | B11: strcpy: &"a"{\0,\x01,\x01,\x01,\x01} &"aaaa"{\0,\0} :=> &"aaaa"{\0,\0} | C11: 1 | D11: 0.0372739 | E11: 0.0372739 | G11: of:=IF([.C11]=1;"";[.C11]) ->  | H11: of:=IF([.D11]=1;"";[.D11]) -> 0.0372739 | I11: of:=IF([.E11]=1;"";[.E11]) -> 0.0372739
A12: 11 | B12: strcpy: &"a"{\0,\x01,\x01,\x01,\x01} &"aaaaa"{\0} :=> &"aaaaa"{\0} | C12: 1 | D12: 0.0232981 | E12: 0.0232981 | G12: of:=IF([.C12]=1;"";[.C12]) ->  | H12: of:=IF([.D12]=1;"";[.D12]) -> 0.0232981 | I12: of:=IF([.E12]=1;"";[.E12]) -> 0.0232981
A13: 12 | B13: strcpy: &"aa"{\0,\x01,\x01,\x01} &""{\0,p,p,p,p,\0} :=> &""{\0,a,\0,p,p,\0} | C13: 0.193065 | D13: 1 | E13: 1 | G13: of:=IF([.C13]=1;"";[.C13]) -> 0.193065 | H13: of:=IF([.D13]=1;"";[.D13]) ->  | I13: of:=IF([.E13]=1;"";[.E13]) -> 
A14: 13 | B14: strcpy: &"aa"{\0,\x01,\x01,\x01} &"a"{\0,p,p,p,\0} :=> &"a"{\0,\0,p,p,\0} | C14: 0.193065 | D14: 1 | E14: 1 | G14: of:=IF([.C14]=1;"";[.C14]) -> 0.193065 | H14: of:=IF([.D14]=1;"";[.D14]) ->  | I14: of:=IF([.E14]=1;"";[.E14]) -> 
A15: 14 | B15: strcpy: &"aa"{\0,\x01,\x01,\x01} &"aa"{\0,p,p,\0} :=> &"aa"{\0,p,p,\0} | C15: 0.193065 | D15: 0.193065 | E15: 0.193065 | G15: of:=IF([.C15]=1;"";[.C15]) -> 0.193065 | H15: of:=IF([.D15]=1;"";[.D15]) -> 0.193065 | I15: of:=IF([.E15]=1;"";[.E15]) -> 0.193065
A16: 15 | B16: strcpy: &"aa"{\0,\x01,\x01,\x01} &"aaa"{\0,p,\0} :=> &"aaa"{\0,p,\0} | C16: 0.193065 | D16: 0.0719654 | E16: 0.0719654 | G16: of:=IF([.C16]=1;"";[.C16]) -> 0.193065 | H16: of:=IF([.D16]=1;"";[.D16]) -> 0.0719654 | I16: of:=IF([.E16]=1;"";[.E16]) -> 0.0719654
A17: 16 | B17: strcpy: &"aa"{\0,\x01,\x01,\x01} &"aaaa"{\0,\0} :=> &"aaaa"{\0,\0} | C17: 0.193065 | D17: 0.0372739 | E17: 0.0372739 | G17: of:=IF([.C17]=1;"";[.C17]) -> 0.193065 | H17: of:=IF([.D17]=1;"";[.D17]) -> 0.0372739 | I17: of:=IF([.E17]=1;"";[.E17]) -> 0.0372739
A18: 17 | B18: strcpy: &"aa"{\0,\x01,\x01,\x01} &"aaaaa"{\0} :=> &"aaaaa"{\0} | C18: 0.193065 | D18: 0.0232981 | E18: 0.0232981 | G18: of:=IF([.C18]=1;"";[.C18]) -> 0.193065 | H18: of:=IF([.D18]=1;"";[.D18]) -> 0.0232981 | I18: of:=IF([.E18]=1;"";[.E18]) -> 0.0232981
A19: 18 | B19: strcpy: &"aaa"{\0,\x01,\x01} &""{\0,p,p,p,p,\0} :=> &""{\0,a,a,\0,p,\0} | C19: 0.0719654 | D19: 1 | E19: 1 | G19: of:=IF([.C19]=1;"";[.C19]) -> 0.0719654 | H19: of:=IF([.D19]=1;"";[.D19]) ->  | I19: of:=IF([.E19]=1;"";[.E19]) -> 
A20: 19 | B20: strcpy: &"aaa"{\0,\x01,\x01} &"a"{\0,p,p,p,\0} :=> &"a"{\0,a,\0,p,\0} | C20: 0.0719654 | D20: 1 | E20: 1 | G20: of:=IF([.C20]=1;"";[.C20]) -> 0.0719654 | H20: of:=IF([.D20]=1;"";[.D20]) ->  | I20: of:=IF([.E20]=1;"";[.E20]) -> 
A21: 20 | B21: strcpy: &"aaa"{\0,\x01,\x01} &"aa"{\0,p,p,\0} :=> &"aa"{\0,\0,p,\0} | C21: 0.0719654 | D21: 0.193065 | E21: 0.193065 | G21: of:=IF([.C21]=1;"";[.C21]) -> 0.0719654 | H21: of:=IF([.D21]=1;"";[.D21]) -> 0.193065 | I21: of:=IF([.E21]=1;"";[.E21]) -> 0.193065
A22: 21 | B22: strcpy: &"aaa"{\0,\x01,\x01} &"aaa"{\0,p,\0} :=> &"aaa"{\0,p,\0} | C22: 0.0719654 | D22: 0.0719654 | E22: 0.0719654 | G22: of:=IF([.C22]=1;"";[.C22]) -> 0.0719654 | H22: of:=IF([.D22]=1;"";[.D22]) -> 0.0719654 | I22: of:=IF([.E22]=1;"";[.E22]) -> 0.0719654
A23: 22 | B23: strcpy: &"aaa"{\0,\x01,\x01} &"aaaa"{\0,\0} :=> &"aaaa"{\0,\0} | C23: 0.0719654 | D23: 0.0372739 | E23: 0.0372739 | G23: of:=IF([.C23]=1;"";[.C23]) -> 0.0719654 | H23: of:=IF([.D23]=1;"";[.D23]) -> 0.0372739 | I23: of:=IF([.E23]=1;"";[.E23]) -> 0.0372739
A24: 23 | B24: strcpy: &"aaa"{\0,\x01,\x01} &"aaaaa"{\0} :=> &"aaaaa"{\0} | C24: 0.0719654 | D24: 0.0232981 | E24: 0.0232981 | G24: of:=IF([.C24]=1;"";[.C24]) -> 0.0719654 | H24: of:=IF([.D24]=1;"";[.D24]) -> 0.0232981 | I24: of:=IF([.E24]=1;"";[.E24]) -> 0.0232981
A25: 24 | B25: strcpy: &"aaaa"{\0,\x01} &""{\0,p,p,p,p,\0} :=> &""{\0,a,a,a,\0,\0} | C25: 0.0372739 | D25: 1 | E25: 1 | G25: of:=IF([.C25]=1;"";[.C25]) -> 0.0372739 | H25: of:=IF([.D25]=1;"";[.D25]) ->  | I25: of:=IF([.E25]=1;"";[.E25]) -> 
A26: 25 | B26: strcpy: &"aaaa"{\0,\x01} &"a"{\0,p,p,p,\0} :=> &"a"{\0,a,a,\0,\0} | C26: 0.0372739 | D26: 1 | E26: 1 | G26: of:=IF([.C26]=1;"";[.C26]) -> 0.0372739 | H26: of:=IF([.D26]=1;"";[.D26]) ->  | I26: of:=IF([.E26]=1;"";[.E26]) -> 
A27: 26 | B27: strcpy: &"aaaa"{\0,\x01} &"aa"{\0,p,p,\0} :=> &"aa"{\0,a,\0,\0} | C27: 0.0372739 | D27: 0.193065 | E27: 0.193065 | G27: of:=IF([.C27]=1;"";[.C27]) -> 0.0372739 | H27: of:=IF([.D27]=1;"";[.D27]) -> 0.193065 | I27: of:=IF([.E27]=1;"";[.E27]) -> 0.193065
A28: 27 | B28: strcpy: &"aaaa"{\0,\x01} &"aaa"{\0,p,\0} :=> &"aaa"{\0,\0,\0} | C28: 0.0372739 | D28: 0.0719654 | E28: 0.0719654 | G28: of:=IF([.C28]=1;"";[.C28]) -> 0.0372739 | H28: of:=IF([.D28]=1;"";[.D28]) -> 0.0719654 | I28: of:=IF([.E28]=1;"";[.E28]) -> 0.0719654
A29: 28 | B29: strcpy: &"aaaa"{\0,\x01} &"aaaa"{\0,\0} :=> &"aaaa"{\0,\0} | C29: 0.0372739 | D29: 0.0372739 | E29: 0.0372739 | G29: of:=IF([.C29]=1;"";[.C29]) -> 0.0372739 | H29: of:=IF([.D29]=1;"";[.D29]) -> 0.0372739 | I29: of:=IF([.E29]=1;"";[.E29]) -> 0.0372739
A30: 29 | B30: strcpy: &"aaaa"{\0,\x01} &"aaaaa"{\0} :=> &"aaaaa"{\0} | C30: 0.0372739 | D30: 0.0232981 | E30: 0.0232981 | G30: of:=IF([.C30]=1;"";[.C30]) -> 0.0372739 | H30: of:=IF([.D30]=1;"";[.D30]) -> 0.0232981 | I30: of:=IF([.E30]=1;"";[.E30]) -> 0.0232981
A31: 30 | B31: strcpy: &"aaaaa"{\0} &""{\0,p,p,p,p,\0} :=> &""{\0,a,a,a,a,\0} | C31: 0.0232981 | D31: 1 | E31: 1 | G31: of:=IF([.C31]=1;"";[.C31]) -> 0.0232981 | H31: of:=IF([.D31]=1;"";[.D31]) ->  | I31: of:=IF([.E31]=1;"";[.E31]) -> 
A32: 31 | B32: strcpy: &"aaaaa"{\0} &"a"{\0,p,p,p,\0} :=> &"a"{\0,a,a,a,\0} | C32: 0.0232981 | D32: 1 | E32: 1 | G32: of:=IF([.C32]=1;"";[.C32]) -> 0.0232981 | H32: of:=IF([.D32]=1;"";[.D32]) ->  | I32: of:=IF([.E32]=1;"";[.E32]) -> 
A33: 32 | B33: strcpy: &"aaaaa"{\0} &"aa"{\0,p,p,\0} :=> &"aa"{\0,a,a,\0} | C33: 0.0232981 | D33: 0.193065 | E33: 0.193065 | G33: of:=IF([.C33]=1;"";[.C33]) -> 0.0232981 | H33: of:=IF([.D33]=1;"";[.D33]) -> 0.193065 | I33: of:=IF([.E33]=1;"";[.E33]) -> 0.193065
A34: 33 | B34: strcpy: &"aaaaa"{\0} &"aaa"{\0,p,\0} :=> &"aaa"{\0,a,\0} | C34: 0.0232981 | D34: 0.0719654 | E34: 0.0719654 | G34: of:=IF([.C34]=1;"";[.C34]) -> 0.0232981 | H34: of:=IF([.D34]=1;"";[.D34]) -> 0.0719654 | I34: of:=IF([.E34]=1;"";[.E34]) -> 0.0719654
A35: 34 | B35: strcpy: &"aaaaa"{\0} &"aaaa"{\0,\0} :=> &"aaaa"{\0,\0} | C35: 0.0232981 | D35: 0.0372739 | E35: 0.0372739 | G35: of:=IF([.C35]=1;"";[.C35]) -> 0.0232981 | H35: of:=IF([.D35]=1;"";[.D35]) -> 0.0372739 | I35: of:=IF([.E35]=1;"";[.E35]) -> 0.0372739
A36: 35 | B36: strcpy: &"aaaaa"{\0} &"aaaaa"{\0} :=> &"aaaaa"{\0} | C36: 0.0232981 | D36: 0.0232981 | E36: 0.0232981 | G36: of:=IF([.C36]=1;"";[.C36]) -> 0.0232981 | H36: of:=IF([.D36]=1;"";[.D36]) -> 0.0232981 | I36: of:=IF([.E36]=1;"";[.E36]) -> 0.0232981
A37: 1 | B37: strncpy: &""{\0,\x01,\x01,\x01,\x01,\x01} &""{\0,p,p,p,p,\0} 5 :=> &""{\0,\0,\0,\0,\0,\0} | C37: 1 | D37: 1 | E37: 1 | G37: of:=IF([.C37]=1;"";[.C37]) ->  | H37: of:=IF([.D37]=1;"";[.D37]) ->  | I37: of:=IF([.E37]=1;"";[.E37]) ->  | K37: of:=AVERAGE([.G37:.G72]) -> 0.0814006 | L37: of:=AVERAGE([.H37:.H72]) -> 0.0814006 | M37: of:=AVERAGE([.I37:.I72]) -> 0.0814006 | O37: of:=AVERAGE([.K37:.M37]) -> 0.0814006
A38: 2 | B38: strncpy: &""{\0,\x01,\x01,\x01,\x01,\x01} &"a"{\0,p,p,p,\0} 5 :=> &"a"{\0,\0,\0,\0,\0} | C38: 1 | D38: 1 | E38: 1 | G38: of:=IF([.C38]=1;"";[.C38]) ->  | H38: of:=IF([.D38]=1;"";[.D38]) ->  | I38: of:=IF([.E38]=1;"";[.E38]) -> 
A39: 3 | B39: strncpy: &""{\0,\x01,\x01,\x01,\x01,\x01} &"aa"{\0,p,p,\0} 5 :=> &"aa"{\0,\0,\0,\0} | C39: 1 | D39: 0.193065 | E39: 0.193065 | G39: of:=IF([.C39]=1;"";[.C39]) ->  | H39: of:=IF([.D39]=1;"";[.D39]) -> 0.193065 | I39: of:=IF([.E39]=1;"";[.E39]) -> 0.193065
A40: 4 | B40: strncpy: &""{\0,\x01,\x01,\x01,\x01,\x01} &"aaa"{\0,p,\0} 5 :=> &"aaa"{\0,\0,\0} | C40: 1 | D40: 0.0719654 | E40: 0.0719654 | G40: of:=IF([.C40]=1;"";[.C40]) ->  | H40: of:=IF([.D40]=1;"";[.D40]) -> 0.0719654 | I40: of:=IF([.E40]=1;"";[.E40]) -> 0.0719654
A41: 5 | B41: strncpy: &""{\0,\x01,\x01,\x01,\x01,\x01} &"aaaa"{\0,\0} 5 :=> &"aaaa"{\0,\0} | C41: 1 | D41: 0.0372739 | E41: 0.0372739 | G41: of:=IF([.C41]=1;"";[.C41]) ->  | H41: of:=IF([.D41]=1;"";[.D41]) -> 0.0372739 | I41: of:=IF([.E41]=1;"";[.E41]) -> 0.0372739
A42: 6 | B42: strncpy: &""{\0,\x01,\x01,\x01,\x01,\x01} &"aaaaa"{\0} 5 :=> &"aaaaa"{\0} | C42: 1 | D42: 0.0232981 | E42: 0.0232981 | G42: of:=IF([.C42]=1;"";[.C42]) ->  | H42: of:=IF([.D42]=1;"";[.D42]) -> 0.0232981 | I42: of:=IF([.E42]=1;"";[.E42]) -> 0.0232981
A43: 7 | B43: strncpy: &"a"{\0,\x01,\x01,\x01,\x01} &""{\0,p,p,p,p,\0} 5 :=> &""{\0,\0,\0,\0,\0,\0} | C43: 1 | D43: 1 | E43: 1 | G43: of:=IF([.C43]=1;"";[.C43]) ->  | H43: of:=IF([.D43]=1;"";[.D43]) ->  | I43: of:=IF([.E43]=1;"";[.E43]) -> 
A44: 8 | B44: strncpy: &"a"{\0,\x01,\x01,\x01,\x01} &"a"{\0,p,p,p,\0} 5 :=> &"a"{\0,\0,\0,\0,\0} | C44: 1 | D44: 1 | E44: 1 | G44: of:=IF([.C44]=1;"";[.C44]) ->  | H44: of:=IF([.D44]=1;"";[.D44]) ->  | I44: of:=IF([.E44]=1;"";[.E44]) -> 
A45: 9 | B45: strncpy: &"a"{\0,\x01,\x01,\x01,\x01} &"aa"{\0,p,p,\0} 5 :=> &"aa"{\0,\0,\0,\0} | C45: 1 | D45: 0.193065 | E45: 0.193065 | G45: of:=IF([.C45]=1;"";[.C45]) ->  | H45: of:=IF([.D45]=1;"";[.D45]) -> 0.193065 | I45: of:=IF([.E45]=1;"";[.E45]) -> 0.193065
A46: 10 | B46: strncpy: &"a"{\0,\x01,\x01,\x01,\x01} &"aaa"{\0,p,\0} 5 :=> &"aaa"{\0,\0,\0} | C46: 1 | D46: 0.0719654 | E46: 0.0719654 | G46: of:=IF([.C46]=1;"";[.C46]) ->  | H46: of:=IF([.D46]=1;"";[.D46]) -> 0.0719654 | I46: of:=IF([.E46]=1;"";[.E46]) -> 0.0719654
A47: 11 | B47: strncpy: &"a"{\0,\x01,\x01,\x01,\x01} &"aaaa"{\0,\0} 5 :=> &"aaaa"{\0,\0} | C47: 1 | D47: 0.0372739 | E47: 0.0372739 | G47: of:=IF([.C47]=1;"";[.C47]) ->  | H47: of:=IF([.D47]=1;"";[.D47]) -> 0.0372739 | I47: of:=IF([.E47]=1;"";[.E47]) -> 0.0372739
A48: 12 | B48: strncpy: &"a"{\0,\x01,\x01,\x01,\x01} &"aaaaa"{\0} 5 :=> &"aaaaa"{\0} | C48: 1 | D48: 0.0232981 | E48: 0.0232981 | G48: of:=IF([.C48]=1;"";[.C48]) ->  | H48: of:=IF([.D48]=1;"";[.D48]) -> 0.0232981 | I48: of:=IF([.E48]=1;"";[.E48]) -> 0.0232981
A49: 13 | B49: strncpy: &"aa"{\0,\x01,\x01,\x01} &""{\0,p,p,p,p,\0} 5 :=> &""{\0,\0,\0,\0,\0,\0} | C49: 0.193065 | D49: 1 | E49: 1 | G49: of:=IF([.C49]=1;"";[.C49]) -> 0.193065 | H49: of:=IF([.D49]=1;"";[.D49]) ->  | I49: of:=IF([.E49]=1;"";[.E49]) -> 
A50: 14 | B50: strncpy: &"aa"{\0,\x01,\x01,\x01} &"a"{\0,p,p,p,\0} 5 :=> &"a"{\0,\0,\0,\0,\0} | C50: 0.193065 | D50: 1 | E50: 1 | G50: of:=IF([.C50]=1;"";[.C50]) -> 0.193065 | H50: of:=IF([.D50]=1;"";[.D50]) ->  | I50: of:=IF([.E50]=1;"";[.E50]) -> 
A51: 15 | B51: strncpy: &"aa"{\0,\x01,\x01,\x01} &"aa"{\0,p,p,\0} 5 :=> &"aa"{\0,\0,\0,\0} | C51: 0.193065 | D51: 0.193065 | E51: 0.193065 | G51: of:=IF([.C51]=1;"";[.C51]) -> 0.193065 | H51: of:=IF([.D51]=1;"";[.D51]) -> 0.193065 | I51: of:=IF([.E51]=1;"";[.E51]) -> 0.193065
A52: 16 | B52: strncpy: &"aa"{\0,\x01,\x01,\x01} &"aaa"{\0,p,\0} 5 :=> &"aaa"{\0,\0,\0} | C52: 0.193065 | D52: 0.0719654 | E52: 0.0719654 | G52: of:=IF([.C52]=1;"";[.C52]) -> 0.193065 | H52: of:=IF([.D52]=1;"";[.D52]) -> 0.0719654 | I52: of:=IF([.E52]=1;"";[.E52]) -> 0.0719654
A53: 17 | B53: strncpy: &"aa"{\0,\x01,\x01,\x01} &"aaaa"{\0,\0} 5 :=> &"aaaa"{\0,\0} | C53: 0.193065 | D53: 0.0372739 | E53: 0.0372739 | G53: of:=IF([.C53]=1;"";[.C53]) -> 0.193065 | H53: of:=IF([.D53]=1;"";[.D53]) -> 0.0372739 | I53: of:=IF([.E53]=1;"";[.E53]) -> 0.0372739
A54: 18 | B54: strncpy: &"aa"{\0,\x01,\x01,\x01} &"aaaaa"{\0} 5 :=> &"aaaaa"{\0} | C54: 0.193065 | D54: 0.0232981 | E54: 0.0232981 | G54: of:=IF([.C54]=1;"";[.C54]) -> 0.193065 | H54: of:=IF([.D54]=1;"";[.D54]) -> 0.0232981 | I54: of:=IF([.E54]=1;"";[.E54]) -> 0.0232981
A55: 19 | B55: strncpy: &"aaa"{\0,\x01,\x01} &""{\0,p,p,p,p,\0} 5 :=> &""{\0,\0,\0,\0,\0,\0} | C55: 0.0719654 | D55: 1 | E55: 1 | G55: of:=IF([.C55]=1;"";[.C55]) -> 0.0719654 | H55: of:=IF([.D55]=1;"";[.D55]) ->  | I55: of:=IF([.E55]=1;"";[.E55]) -> 
A56: 20 | B56: strncpy: &"aaa"{\0,\x01,\x01} &"a"{\0,p,p,p,\0} 5 :=> &"a"{\0,\0,\0,\0,\0} | C56: 0.0719654 | D56: 1 | E56: 1 | G56: of:=IF([.C56]=1;"";[.C56]) -> 0.0719654 | H56: of:=IF([.D56]=1;"";[.D56]) ->  | I56: of:=IF([.E56]=1;"";[.E56]) -> 
A57: 21 | B57: strncpy: &"aaa"{\0,\x01,\x01} &"aa"{\0,p,p,\0} 5 :=> &"aa"{\0,\0,\0,\0} | C57: 0.0719654 | D57: 0.193065 | E57: 0.193065 | G57: of:=IF([.C57]=1;"";[.C57]) -> 0.0719654 | H57: of:=IF([.D57]=1;"";[.D57]) -> 0.193065 | I57: of:=IF([.E57]=1;"";[.E57]) -> 0.193065
A58: 22 | B58: strncpy: &"aaa"{\0,\x01,\x01} &"aaa"{\0,p,\0} 5 :=> &"aaa"{\0,\0,\0} | C58: 0.0719654 | D58: 0.0719654 | E58: 0.0719654 | G58: of:=IF([.C58]=1;"";[.C58]) -> 0.0719654 | H58: of:=IF([.D58]=1;"";[.D58]) -> 0.0719654 | I58: of:=IF([.E58]=1;"";[.E58]) -> 0.0719654
A59: 23 | B59: strncpy: &"aaa"{\0,\x01,\x01} &"aaaa"{\0,\0} 5 :=> &"aaaa"{\0,\0} | C59: 0.0719654 | D59: 0.0372739 | E59: 0.0372739 | G59: of:=IF([.C59]=1;"";[.C59]) -> 0.0719654 | H59: of:=IF([.D59]=1;"";[.D59]) -> 0.0372739 | I59: of:=IF([.E59]=1;"";[.E59]) -> 0.0372739
A60: 24 | B60: strncpy: &"aaa"{\0,\x01,\x01} &"aaaaa"{\0} 5 :=> &"aaaaa"{\0} | C60: 0.0719654 | D60: 0.0232981 | E60: 0.0232981 | G60: of:=IF([.C60]=1;"";[.C60]) -> 0.0719654 | H60: of:=IF([.D60]=1;"";[.D60]) -> 0.0232981 | I60: of:=IF([.E60]=1;"";[.E60]) -> 0.0232981
A61: 25 | B61: strncpy: &"aaaa"{\0,\x01} &""{\0,p,p,p,p,\0} 5 :=> &""{\0,\0,\0,\0,\0,\0} | C61: 0.0372739 | D61: 1 | E61: 1 | G61: of:=IF([.C61]=1;"";[.C61]) -> 0.0372739 | H61: of:=IF([.D61]=1;"";[.D61]) ->  | I61: of:=IF([.E61]=1;"";[.E61]) -> 
A62: 26 | B62: strncpy: &"aaaa"{\0,\x01} &"a"{\0,p,p,p,\0} 5 :=> &"a"{\0,\0,\0,\0,\0} | C62: 0.0372739 | D62: 1 | E62: 1 | G62: of:=IF([.C62]=1;"";[.C62]) -> 0.0372739 | H62: of:=IF([.D62]=1;"";[.D62]) ->  | I62: of:=IF([.E62]=1;"";[.E62]) -> 
A63: 27 | B63: strncpy: &"aaaa"{\0,\x01} &"aa"{\0,p,p,\0} 5 :=> &"aa"{\0,\0,\0,\0} | C63: 0.0372739 | D63: 0.193065 | E63: 0.193065 | G63: of:=IF([.C63]=1;"";[.C63]) -> 0.0372739 | H63: of:=IF([.D63]=1;"";[.D63]) -> 0.193065 | I63: of:=IF([.E63]=1;"";[.E63]) -> 0.193065
A64: 28 | B64: strncpy: &"aaaa"{\0,\x01} &"aaa"{\0,p,\0} 5 :=> &"aaa"{\0,\0,\0} | C64: 0.0372739 | D64: 0.0719654 | E64: 0.0719654 | G64: of:=IF([.C64]=1;"";[.C64]) -> 0.0372739 | H64: of:=IF([.D64]=1;"";[.D64]) -> 0.0719654 | I64: of:=IF([.E64]=1;"";[.E64]) -> 0.0719654
A65: 29 | B65: strncpy: &"aaaa"{\0,\x01} &"aaaa"{\0,\0} 5 :=> &"aaaa"{\0,\0} | C65: 0.0372739 | D65: 0.0372739 | E65: 0.0372739 | G65: of:=IF([.C65]=1;"";[.C65]) -> 0.0372739 | H65: of:=IF([.D65]=1;"";[.D65]) -> 0.0372739 | I65: of:=IF([.E65]=1;"";[.E65]) -> 0.0372739
A66: 30 | B66: strncpy: &"aaaa"{\0,\x01} &"aaaaa"{\0} 5 :=> &"aaaaa"{\0} | C66: 0.0372739 | D66: 0.0232981 | E66: 0.0232981 | G66: of:=IF([.C66]=1;"";[.C66]) -> 0.0372739 | H66: of:=IF([.D66]=1;"";[.D66]) -> 0.0232981 | I66: of:=IF([.E66]=1;"";[.E66]) -> 0.0232981
A67: 31 | B67: strncpy: &"aaaaa"{\0} &""{\0,p,p,p,p,\0} 5 :=> &""{\0,\0,\0,\0,\0,\0} | C67: 0.0232981 | D67: 1 | E67: 1 | G67: of:=IF([.C67]=1;"";[.C67]) -> 0.0232981 | H67: of:=IF([.D67]=1;"";[.D67]) ->  | I67: of:=IF([.E67]=1;"";[.E67]) -> 
A68: 32 | B68: strncpy: &"aaaaa"{\0} &"a"{\0,p,p,p,\0} 5 :=> &"a"{\0,\0,\0,\0,\0} | C68: 0.0232981 | D68: 1 | E68: 1 | G68: of:=IF([.C68]=1;"";[.C68]) -> 0.0232981 | H68: of:=IF([.D68]=1;"";[.D68]) ->  | I68: of:=IF([.E68]=1;"";[.E68]) -> 
A69: 33 | B69: strncpy: &"aaaaa"{\0} &"aa"{\0,p,p,\0} 5 :=> &"aa"{\0,\0,\0,\0} | C69: 0.0232981 | D69: 0.193065 | E69: 0.193065 | G69: of:=IF([.C69]=1;"";[.C69]) -> 0.0232981 | H69: of:=IF([.D69]=1;"";[.D69]) -> 0.193065 | I69: of:=IF([.E69]=1;"";[.E69]) -> 0.193065
A70: 34 | B70: strncpy: &"aaaaa"{\0} &"aaa"{\0,p,\0} 5 :=> &"aaa"{\0,\0,\0} | C70: 0.0232981 | D70: 0.0719654 | E70: 0.0719654 | G70: of:=IF([.C70]=1;"";[.C70]) -> 0.0232981 | H70: of:=IF([.D70]=1;"";[.D70]) -> 0.0719654 | I70: of:=IF([.E70]=1;"";[.E70]) -> 0.0719654
A71: 35 | B71: strncpy: &"aaaaa"{\0} &"aaaa"{\0,\0} 5 :=> &"aaaa"{\0,\0} | C71: 0.0232981 | D71: 0.0372739 | E71: 0.0372739 | G71: of:=IF([.C71]=1;"";[.C71]) -> 0.0232981 | H71: of:=IF([.D71]=1;"";[.D71]) -> 0.0372739 | I71: of:=IF([.E71]=1;"";[.E71]) -> 0.0372739
A72: 36 | B72: strncpy: &"aaaaa"{\0} &"aaaaa"{\0} 5 :=> &"aaaaa"{\0} | C72: 0.0232981 | D72: 0.0232981 | E72: 0.0232981 | G72: of:=IF([.C72]=1;"";[.C72]) -> 0.0232981 | H72: of:=IF([.D72]=1;"";[.D72]) -> 0.0232981 | I72: of:=IF([.E72]=1;"";[.E72]) -> 0.0232981

Sheet: strcat
A1: # | B1: Test Case | C1: N
A2: 1 | B2: strcat: &""{\0,\x01,\x01,\x01,\x01,\x01,\x01,\x01,\x01,\x01} &"a"{\0,p,p,\0} :=> &"a"{\0,p,p,p,p,p,p,p,\0} | C2: 1 | D2: 1 | E2: 1 | G2: of:=IF([.C2]=1;"";[.C2]) ->  | H2: of:=IF([.D2]=1;"";[.D2]) ->  | I2: of:=IF([.E2]=1;"";[.E2]) ->  | K2: of:=AVERAGE([.G2:.G41]) -> 0.0572777306451613 | L2: of:=AVERAGE([.H2:.H41]) -> 0.103596248636364 | M2: of:=AVERAGE([.I2:.I41]) -> 0.0379957202702703 | O2: of:=AVERAGE([.K2:.M2]) -> 0.0662898998505984
A3: 2 | B3: strcat: &""{\0,\x01,\x01,\x01,\x01,\x01,\x01,\x01,\x01,\x01} &"aa"{\0,p,\0} :=> &"aa"{\0,p,p,p,p,p,p,\0} | C3: 1 | D3: 0.193065 | E3: 0.193065 | G3: of:=IF([.C3]=1;"";[.C3]) ->  | H3: of:=IF([.D3]=1;"";[.D3]) -> 0.193065 | I3: of:=IF([.E3]=1;"";[.E3]) -> 0.193065
A4: 3 | B4: strcat: &""{\0,\x01,\x01,\x01,\x01,\x01,\x01,\x01,\x01,\x01} &"aaa"{\0,\0} :=> &"aaa"{\0,p,p,p,p,p,\0} | C4: 1 | D4: 0.0719654 | E4: 0.0719654 | G4: of:=IF([.C4]=1;"";[.C4]) ->  | H4: of:=IF([.D4]=1;"";[.D4]) -> 0.0719654 | I4: of:=IF([.E4]=1;"";[.E4]) -> 0.0719654
A5: 4 | B5: strcat: &""{\0,\x01,\x01,\x01,\x01,\x01,\x01,\x01,\x01,\x01} &"aaaa"{\0} :=> &"aaaa"{\0,p,p,p,p,\0} | C5: 1 | D5: 0.0372739 | E5: 0.0372739 | H5: of:=IF([.D5]=1;"";[.D5]) -> 0.0372739 | I5: of:=IF([.E5]=1;"";[.E5]) -> 0.0372739
A6: 5 | B6: strcat: &"a"{\0,\x01,\x01,\x01,\x01,\x01,\x01,\x01,\x01} &""{\0,p,p,p,\0} :=> &"a"{\0,p,p,p,p,p,p,p,\0} | C6: 1 | D6: 1 | E6: 1 | G6: of:=IF([.C6]=1;"";[.C6]) ->  | H6: of:=IF([.D6]=1;"";[.D6]) ->  | I6: of:=IF([.E6]=1;"";[.E6]) -> 
A7: 6 | B7: strcat: &"a"{\0,\x01,\x01,\x01,\x01,\x01,\x01,\x01,\x01} &"a"{\0,p,p,\0} :=> &"aa"{\0,p,p,p,p,p,p,\0} | C7: 1 | D7: 1 | E7: 0.193065 | G7: of:=IF([.C7]=1;"";[.C7]) ->  | H7: of:=IF([.D7]=1;"";[.D7]) ->  | I7: of:=IF([.E7]=1;"";[.E7]) -> 0.193065
A8: 7 | B8: strcat: &"a"{\0,\x01,\x01,\x01,\x01,\x01,\x01,\x01,\x01} &"aa"{\0,p,\0} :=> &"aaa"{\0,p,p,p,p,p,\0} | C8: 1 | D8: 0.193065 | E8: 0.0719654 | G8: of:=IF([.C8]=1;"";[.C8]) ->  | H8: of:=IF([.D8]=1;"";[.D8]) -> 0.193065 | I8: of:=IF([.E8]=1;"";[.E8]) -> 0.0719654
A9: 8 | B9: strcat: &"a"{\0,\x01,\x01,\x01,\x01,\x01,\x01,\x01,\x01} &"aaa"{\0,\0} :=> &"aaaa"{\0,p,p,p,p,\0} | C9: 1 | D9: 0.0719654 | E9: 0.0372739 | G9: of:=IF([.C9]=1;"";[.C9]) ->  | H9: of:=IF([.D9]=1;"";[.D9]) -> 0.0719654 | I9: of:=IF([.E9]=1;"";[.E9]) -> 0.0372739
A10: 9 | B10: strcat: &"a"{\0,\x01,\x01,\x01,\x01,\x01,\x01,\x01,\x01} &"aaaa"{\0} :=> &"aaaaa"{\0,p,p,p,\0} | C10: 1 | D10: 0.0372739 | E10: 0.0232981 | G10: of:=IF([.C10]=1;"";[.C10]) ->  | H10: of:=IF([.D10]=1;"";[.D10]) -> 0.0372739 | I10: of:=IF([.E10]=1;"";[.E10]) -> 0.0232981
A11: 10 | B11: strcat: &"aa"{\0,\x01,\x01,\x01,\x01,\x01,\x01,\x01} &""{\0,p,p,p,\0} :=> &"aa"{\0,p,p,p,p,p,p,\0} | C11: 0.193065 | D11: 1 | E11: 0.193065 | G11: of:=IF([.C11]=1;"";[.C11]) -> 0.193065 | H11: of:=IF([.D11]=1;"";[.D11]) ->  | I11: of:=IF([.E11]=1;"";[.E11]) -> 0.193065
A12: 11 | B12: strcat: &"aa"{\0,\x01,\x01,\x01,\x01,\x01,\x01,\x01} &"a"{\0,p,p,\0} :=> &"aaa"{\0,p,p,p,p,p,\0} | C12: 0.193065 | D12: 1 | E12: 0.0719654 | G12: of:=IF([.C12]=1;"";[.C12]) -> 0.193065 | H12: of:=IF([.D12]=1;"";[.D12]) ->  | I12: of:=IF([.E12]=1;"";[.E12]) -> 0.0719654
A13: 12 | B13: strcat: &"aa"{\0,\x01,\x01,\x01,\x01,\x01,\x01,\x01} &"aa"{\0,p,\0} :=> &"aaaa"{\0,p,p,p,p,\0} | C13: 0.193065 | D13: 0.193065 | E13: 0.0372739 | G13: of:=IF([.C13]=1;"";[.C13]) -> 0.193065 | H13: of:=IF([.D13]=1;"";[.D13]) -> 0.193065 | I13: of:=IF([.E13]=1;"";[.E13]) -> 0.0372739
A14: 13 | B14: strcat: &"aa"{\0,\x01,\x01,\x01,\x01,\x01,\x01,\x01} &"aaa"{\0,\0} :=> &"aaaaa"{\0,p,p,p,\0} | C14: 0.193065 | D14: 0.0719654 | E14: 0.0232981 | G14: of:=IF([.C14]=1;"";[.C14]) -> 0.193065 | H14: of:=IF([.D14]=1;"";[.D14]) -> 0.0719654 | I14: of:=IF([.E14]=1;"";[.E14]) -> 0.0232981
A15: 14 | B15: strcat: &"aa"{\0,\x01,\x01,\x01,\x01,\x01,\x01,\x01} &"aaaa"{\0} :=> &"aaaaaa"{\0,p,p,\0} | C15: 0.193065 | D15: 0.0372739 | E15: 0.0163778 | G15: of:=IF([.C15]=1;"";[.C15]) -> 0.193065 | H15: of:=IF([.D15]=1;"";[.D15]) -> 0.0372739 | I15: of:=IF([.E15]=1;"";[.E15]) -> 0.0163778
A16: 15 | B16: strcat: &"aaa"{\0,\x01,\x01,\x01,\x01,\x01,\x01} &""{\0,p,p,p,\0} :=> &"aaa"{\0,p,p,p,p,p,\0} | C16: 0.0719654 | D16: 1 | E16: 0.0719654 | G16: of:=IF([.C16]=1;"";[.C16]) -> 0.0719654 | H16: of:=IF([.D16]=1;"";[.D16]) ->  | I16: of:=IF([.E16]=1;"";[.E16]) -> 0.0719654
A17: 16 | B17: strcat: &"aaa"{\0,\x01,\x01,\x01,\x01,\x01,\x01} &"a"{\0,p,p,\0} :=> &"aaaa"{\0,p,p,p,p,\0} | C17: 0.0719654 | D17: 1 | E17: 0.0372739 | G17: of:=IF([.C17]=1;"";[.C17]) -> 0.0719654 | H17: of:=IF([.D17]=1;"";[.D17]) ->  | I17: of:=IF([.E17]=1;"";[.E17]) -> 0.0372739
A18: 17 | B18: strcat: &"aaa"{\0,\x01,\x01,\x01,\x01,\x01,\x01} &"aa"{\0,p,\0} :=> &"aaaaa"{\0,p,p,p,\0} | C18: 0.0719654 | D18: 0.193065 | E18: 0.0232981 | G18: of:=IF([.C18]=1;"";[.C18]) -> 0.0719654 | H18: of:=IF([.D18]=1;"";[.D18]) -> 0.193065 | I18: of:=IF([.E18]=1;"";[.E18]) -> 0.0232981
A19: 18 | B19: strcat: &"aaa"{\0,\x01,\x01,\x01,\x01,\x01,\x01} &"aaa"{\0,\0} :=> &"aaaaaa"{\0,p,p,\0} | C19: 0.0719654 | D19: 0.0719654 | E19: 0.0163778 | G19: of:=IF([.C19]=1;"";[.C19]) -> 0.0719654 | H19: of:=IF([.D19]=1;"";[.D19]) -> 0.0719654 | I19: of:=IF([.E19]=1;"";[.E19]) -> 0.0163778
A20: 19 | B20: strcat: &"aaa"{\0,\x01,\x01,\x01,\x01,\x01,\x01} &"aaaa"{\0} :=> &"aaaaaaa"{\0,p,\0} | C20: 0.0719654 | D20: 0.0372739 | E20: 0.0124511 | G20: of:=IF([.C20]=1;"";[.C20]) -> 0.0719654 | H20: of:=IF([.D20]=1;"";[.D20]) -> 0.0372739 | I20: of:=IF([.E20]=1;"";[.E20]) -> 0.0124511
A21: 20 | B21: strcat: &"aaaa"{\0,\x01,\x01,\x01,\x01,\x01} &""{\0,p,p,p,\0} :=> &"aaaa"{\0,p,p,p,p,\0} | C21: 0.0372739 | D21: 1 | E21: 0.0372739 | G21: of:=IF([.C21]=1;"";[.C21]) -> 0.0372739 | H21: of:=IF([.D21]=1;"";[.D21]) ->  | I21: of:=IF([.E21]=1;"";[.E21]) -> 0.0372739
A22: 21 | B22: strcat: &"aaaa"{\0,\x01,\x01,\x01,\x01,\x01} &"a"{\0,p,p,\0} :=> &"aaaaa"{\0,p,p,p,\0} | C22: 0.0372739 | D22: 1 | E22: 0.0232981 | G22: of:=IF([.C22]=1;"";[.C22]) -> 0.0372739 | H22: of:=IF([.D22]=1;"";[.D22]) ->  | I22: of:=IF([.E22]=1;"";[.E22]) -> 0.0232981
A23: 22 | B23: strcat: &"aaaa"{\0,\x01,\x01,\x01,\x01,\x01} &"aa"{\0,p,\0} :=> &"aaaaaa"{\0,p,p,\0} | C23: 0.0372739 | D23: 0.193065 | E23: 0.0163778 | G23: of:=IF([.C23]=1;"";[.C23]) -> 0.0372739 | H23: of:=IF([.D23]=1;"";[.D23]) -> 0.193065 | I23: of:=IF([.E23]=1;"";[.E23]) -> 0.0163778
A24: 23 | B24: strcat: &"aaaa"{\0,\x01,\x01,\x01,\x01,\x01} &"aaa"{\0,\0} :=> &"aaaaaaa"{\0,p,\0} | C24: 0.0372739 | D24: 0.0719654 | E24: 0.0124511 | G24: of:=IF([.C24]=1;"";[.C24]) -> 0.0372739 | H24: of:=IF([.D24]=1;"";[.D24]) -> 0.0719654 | I24: of:=IF([.E24]=1;"";[.E24]) -> 0.0124511
A25: 24 | B25: strcat: &"aaaa"{\0,\x01,\x01,\x01,\x01,\x01} &"aaaa"{\0} :=> &"aaaaaaaa"{\0,\0} | C25: 0.0372739 | D25: 0.0372739 | E25: 0.00999924 | G25: of:=IF([.C25]=1;"";[.C25]) -> 0.0372739 | H25: of:=IF([.D25]=1;"";[.D25]) -> 0.0372739 | I25: of:=IF([.E25]=1;"";[.E25]) -> 0.00999924
A26: 25 | B26: strcat: &"aaaaa"{\0,\x01,\x01,\x01,\x01} &""{\0,p,p,p,\0} :=> &"aaaaa"{\0,p,p,p,\0} | C26: 0.0232981 | D26: 1 | E26: 0.0232981 | G26: of:=IF([.C26]=1;"";[.C26]) -> 0.0232981 | H26: of:=IF([.D26]=1;"";[.D26]) ->  | I26: of:=IF([.E26]=1;"";[.E26]) -> 0.0232981
A27: 26 | B27: strcat: &"aaaaa"{\0,\x01,\x01,\x01,\x01} &"a"{\0,p,p,\0} :=> &"aaaaaa"{\0,p,p,\0} | C27: 0.0232981 | D27: 1 | E27: 0.0163778 | G27: of:=IF([.C27]=1;"";[.C27]) -> 0.0232981 | H27: of:=IF([.D27]=1;"";[.D27]) ->  | I27: of:=IF([.E27]=1;"";[.E27]) -> 0.0163778
A28: 27 | B28: strcat: &"aaaaa"{\0,\x01,\x01,\x01,\x01} &"aa"{\0,p,\0} :=> &"aaaaaaa"{\0,p,\0} | C28: 0.0232981 | D28: 0.193065 | E28: 0.0124511 | G28: of:=IF([.C28]=1;"";[.C28]) -> 0.0232981 | H28: of:=IF([.D28]=1;"";[.D28]) -> 0.193065 | I28: of:=IF([.E28]=1;"";[.E28]) -> 0.0124511
A29: 28 | B29: strcat: &"aaaaa"{\0,\x01,\x01,\x01,\x01} &"aaa"{\0,\0} :=> &"aaaaaaaa"{\0,\0} | C29: 0.0232981 | D29: 0.0719654 | E29: 0.00999924 | G29: of:=IF([.C29]=1;"";[.C29]) -> 0.0232981 | H29: of:=IF([.D29]=1;"";[.D29]) -> 0.0719654 | I29: of:=IF([.E29]=1;"";[.E29]) -> 0.00999924
A30: 29 | B30: strcat: &"aaaaa"{\0,\x01,\x01,\x01,\x01} &"aaaa"{\0} :=> &"aaaaaaaaa"{\0} | C30: 0.0232981 | D30: 0.0372739 | E30: 0.00835687 | G30: of:=IF([.C30]=1;"";[.C30]) -> 0.0232981 | H30: of:=IF([.D30]=1;"";[.D30]) -> 0.0372739 | I30: of:=IF([.E30]=1;"";[.E30]) -> 0.00835687
A31: 30 | B31: strcat: &"aaaaaa"{\0,\x01,\x01,\x01} &""{\0,p,p,p,\0} :=> &"aaaaaa"{\0,p,p,\0} | C31: 0.0163778 | D31: 1 | E31: 0.0163778 | G31: of:=IF([.C31]=1;"";[.C31]) -> 0.0163778 | H31: of:=IF([.D31]=1;"";[.D31]) ->  | I31: of:=IF([.E31]=1;"";[.E31]) -> 0.0163778
A32: 31 | B32: strcat: &"aaaaaa"{\0,\x01,\x01,\x01} &"a"{\0,p,p,\0} :=> &"aaaaaaa"{\0,p,\0} | C32: 0.0163778 | D32: 1 | E32: 0.0124511 | G32: of:=IF([.C32]=1;"";[.C32]) -> 0.0163778 | H32: of:=IF([.D32]=1;"";[.D32]) ->  | I32: of:=IF([.E32]=1;"";[.E32]) -> 0.0124511
A33: 32 | B33: strcat: &"aaaaaa"{\0,\x01,\x01,\x01} &"aa"{\0,p,\0} :=> &"aaaaaaaa"{\0,\0} | C33: 0.0163778 | D33: 0.193065 | E33: 0.00999924 | G33: of:=IF([.C33]=1;"";[.C33]) -> 0.0163778 | H33: of:=IF([.D33]=1;"";[.D33]) -> 0.193065 | I33: of:=IF([.E33]=1;"";[.E33]) -> 0.00999924
A34: 33 | B34: strcat: &"aaaaaa"{\0,\x01,\x01,\x01} &"aaa"{\0,\0} :=> &"aaaaaaaaa"{\0} | C34: 0.0163778 | D34: 0.0719654 | E34: 0.00835687 | G34: of:=IF([.C34]=1;"";[.C34]) -> 0.0163778 | H34: of:=IF([.D34]=1;"";[.D34]) -> 0.0719654 | I34: of:=IF([.E34]=1;"";[.E34]) -> 0.00835687
A35: 34 | B35: strcat: &"aaaaaa"{\0,\x01,\x01,\x01} &&10 :=> &"aaaaaaaaaa"{} | C35: 0.0163778 | D35: 0.00719627 | G35: of:=IF([.C35]=1;"";[.C35]) -> 0.0163778 | H35: of:=IF([.D35]=1;"";[.D35]) -> 0.00719627 | I35: of:=IF([.E35]=1;"";[.E35]) ->  
A36: 35 | B36: strcat: &"aaaaaaa"{\0,\x01,\x01} &""{\0,p,p,p,\0} :=> &"aaaaaaa"{\0,p,\0} | C36: 0.0124511 | D36: 1 | E36: 0.0124511 | G36: of:=IF([.C36]=1;"";[.C36]) -> 0.0124511 | H36: of:=IF([.D36]=1;"";[.D36]) ->  | I36: of:=IF([.E36]=1;"";[.E36]) -> 0.0124511
A37: 36 | B37: strcat: &"aaaaaaa"{\0,\x01,\x01} &"a"{\0,p,p,\0} :=> &"aaaaaaaa"{\0,\0} | C37: 0.0124511 | D37: 1 | E37: 0.00999924 | G37: of:=IF([.C37]=1;"";[.C37]) -> 0.0124511 | H37: of:=IF([.D37]=1;"";[.D37]) ->  | I37: of:=IF([.E37]=1;"";[.E37]) -> 0.00999924
A38: 37 | B38: strcat: &"aaaaaaa"{\0,\x01,\x01} &"aa"{\0,p,\0} :=> &"aaaaaaaaa"{\0} | C38: 0.0124511 | D38: 0.193065 | E38: 0.00835687 | G38: of:=IF([.C38]=1;"";[.C38]) -> 0.0124511 | H38: of:=IF([.D38]=1;"";[.D38]) -> 0.193065 | I38: of:=IF([.E38]=1;"";[.E38]) -> 0.00835687
A39: 38 | B39: strcat: &"aaaaaaaa"{\0,\x01} &""{\0,p,p,p,\0} :=> &"aaaaaaaa"{\0,\0} | C39: 0.00999924 | D39: 1 | E39: 0.00999924 | G39: of:=IF([.C39]=1;"";[.C39]) -> 0.00999924 | H39: of:=IF([.D39]=1;"";[.D39]) ->  | I39: of:=IF([.E39]=1;"";[.E39]) -> 0.00999924
A40: 39 | B40: strcat: &"aaaaaaaa"{\0,\x01} &"a"{\0,p,p,\0} :=> &"aaaaaaaaa"{\0} | C40: 0.00999924 | D40: 1 | E40: 0.00835687 | G40: of:=IF([.C40]=1;"";[.C40]) -> 0.00999924 | H40: of:=IF([.D40]=1;"";[.D40]) ->  | I40: of:=IF([.E40]=1;"";[.E40]) -> 0.00835687
A41: 40 | B41: strcat: &"aaaaaaaaa"{\0} &""{\0,p,p,p,\0} :=> &"aaaaaaaaa"{\0} | C41: 0.00835687 | D41: 1 | E41: 0.00835687 | G41: of:=IF([.C41]=1;"";[.C41]) -> 0.00835687 | H41: of:=IF([.D41]=1;"";[.D41]) ->  | I41: of:=IF([.E41]=1;"";[.E41]) -> 0.00835687
A42: 1 | B42: strncat: &""{\0,\x01,\x01,\x01,\x01,\x01,\x01,\x01,\x01,\x01} &""{\0,p,p,p,\0} 4 :=> &""{\0,p,p,p,p,p,p,p,p,\0} | C42: 1 | D42: 1 | E42: 1 | G42: of:=IF([.C42]=1;"";[.C42]) ->  | H42: of:=IF([.D42]=1;"";[.D42]) ->  | I42: of:=IF([.E42]=1;"";[.E42]) ->  | K42: of:=AVERAGE([.G42:.G82]) -> 0.0572777306451613 | L42: of:=AVERAGE([.H42:.H82]) -> 0.103596248636364 | M42: of:=AVERAGE([.I42:.I82]) -> 0.0379957202702703 | O42: of:=AVERAGE([.K42:.M42]) -> 0.0662898998505984
A43: 2 | B43: strncat: &""{\0,\x01,\x01,\x01,\x01,\x01,\x01,\x01,\x01,\x01} &"a"{\0,p,p,\0} 4 :=> &"a"{\0,p,p,p,p,p,p,p,\0} | C43: 1 | D43: 1 | E43: 1 | G43: of:=IF([.C43]=1;"";[.C43]) ->  | H43: of:=IF([.D43]=1;"";[.D43]) ->  | I43: of:=IF([.E43]=1;"";[.E43]) -> 
A44: 3 | B44: strncat: &""{\0,\x01,\x01,\x01,\x01,\x01,\x01,\x01,\x01,\x01} &"aa"{\0,p,\0} 4 :=> &"aa"{\0,p,p,p,p,p,p,\0} | C44: 1 | D44: 0.193065 | E44: 0.193065 | G44: of:=IF([.C44]=1;"";[.C44]) ->  | H44: of:=IF([.D44]=1;"";[.D44]) -> 0.193065 | I44: of:=IF([.E44]=1;"";[.E44]) -> 0.193065
A45: 4 | B45: strncat: &""{\0,\x01,\x01,\x01,\x01,\x01,\x01,\x01,\x01,\x01} &"aaa"{\0,\0} 4 :=> &"aaa"{\0,p,p,p,p,p,\0} | C45: 1 | D45: 0.0719654 | E45: 0.0719654 | G45: of:=IF([.C45]=1;"";[.C45]) ->  | H45: of:=IF([.D45]=1;"";[.D45]) -> 0.0719654 | I45: of:=IF([.E45]=1;"";[.E45]) -> 0.0719654
A46: 5 | B46: strncat: &""{\0,\x01,\x01,\x01,\x01,\x01,\x01,\x01,\x01,\x01} &"aaaa"{\0} 4 :=> &"aaaa"{\0,p,p,p,p,\0} | C46: 1 | D46: 0.0372739 | E46: 0.0372739 | G46: of:=IF([.C46]=1;"";[.C46]) ->  | H46: of:=IF([.D46]=1;"";[.D46]) -> 0.0372739 | I46: of:=IF([.E46]=1;"";[.E46]) -> 0.0372739
A47: 6 | B47: strncat: &"a"{\0,\x01,\x01,\x01,\x01,\x01,\x01,\x01,\x01} &""{\0,p,p,p,\0} 4 :=> &"a"{\0,p,p,p,p,p,p,p,\0} | C47: 1 | D47: 1 | E47: 1 | G47: of:=IF([.C47]=1;"";[.C47]) ->  | H47: of:=IF([.D47]=1;"";[.D47]) ->  | I47: of:=IF([.E47]=1;"";[.E47]) -> 
A48: 7 | B48: strncat: &"a"{\0,\x01,\x01,\x01,\x01,\x01,\x01,\x01,\x01} &"a"{\0,p,p,\0} 4 :=> &"aa"{\0,p,p,p,p,p,p,\0} | C48: 1 | D48: 1 | E48: 0.193065 | G48: of:=IF([.C48]=1;"";[.C48]) ->  | H48: of:=IF([.D48]=1;"";[.D48]) ->  | I48: of:=IF([.E48]=1;"";[.E48]) -> 0.193065
A49: 8 | B49: strncat: &"a"{\0,\x01,\x01,\x01,\x01,\x01,\x01,\x01,\x01} &"aa"{\0,p,\0} 4 :=> &"aaa"{\0,p,p,p,p,p,\0} | C49: 1 | D49: 0.193065 | E49: 0.0719654 | G49: of:=IF([.C49]=1;"";[.C49]) ->  | H49: of:=IF([.D49]=1;"";[.D49]) -> 0.193065 | I49: of:=IF([.E49]=1;"";[.E49]) -> 0.0719654
A50: 9 | B50: strncat: &"a"{\0,\x01,\x01,\x01,\x01,\x01,\x01,\x01,\x01} &"aaa"{\0,\0} 4 :=> &"aaaa"{\0,p,p,p,p,\0} | C50: 1 | D50: 0.0719654 | E50: 0.0372739 | G50: of:=IF([.C50]=1;"";[.C50]) ->  | H50: of:=IF([.D50]=1;"";[.D50]) -> 0.0719654 | I50: of:=IF([.E50]=1;"";[.E50]) -> 0.0372739
A51: 10 | B51: strncat: &"a"{\0,\x01,\x01,\x01,\x01,\x01,\x01,\x01,\x01} &"aaaa"{\0} 4 :=> &"aaaaa"{\0,p,p,p,\0} | C51: 1 | D51: 0.0372739 | E51: 0.0232981 | G51: of:=IF([.C51]=1;"";[.C51]) ->  | H51: of:=IF([.D51]=1;"";[.D51]) -> 0.0372739 | I51: of:=IF([.E51]=1;"";[.E51]) -> 0.0232981
A52: 11 | B52: strncat: &"aa"{\0,\x01,\x01,\x01,\x01,\x01,\x01,\x01} &""{\0,p,p,p,\0} 4 :=> &"aa"{\0,p,p,p,p,p,p,\0} | C52: 0.193065 | D52: 1 | E52: 0.193065 | G52: of:=IF([.C52]=1;"";[.C52]) -> 0.193065 | H52: of:=IF([.D52]=1;"";[.D52]) ->  | I52: of:=IF([.E52]=1;"";[.E52]) -> 0.193065
A53: 12 | B53: strncat: &"aa"{\0,\x01,\x01,\x01,\x01,\x01,\x01,\x01} &"a"{\0,p,p,\0} 4 :=> &"aaa"{\0,p,p,p,p,p,\0} | C53: 0.193065 | D53: 1 | E53: 0.0719654 | G53: of:=IF([.C53]=1;"";[.C53]) -> 0.193065 | H53: of:=IF([.D53]=1;"";[.D53]) ->  | I53: of:=IF([.E53]=1;"";[.E53]) -> 0.0719654
A54: 13 | B54: strncat: &"aa"{\0,\x01,\x01,\x01,\x01,\x01,\x01,\x01} &"aa"{\0,p,\0} 4 :=> &"aaaa"{\0,p,p,p,p,\0} | C54: 0.193065 | D54: 0.193065 | E54: 0.0372739 | G54: of:=IF([.C54]=1;"";[.C54]) -> 0.193065 | H54: of:=IF([.D54]=1;"";[.D54]) -> 0.193065 | I54: of:=IF([.E54]=1;"";[.E54]) -> 0.0372739
A55: 14 | B55: strncat: &"aa"{\0,\x01,\x01,\x01,\x01,\x01,\x01,\x01} &"aaa"{\0,\0} 4 :=> &"aaaaa"{\0,p,p,p,\0} | C55: 0.193065 | D55: 0.0719654 | E55: 0.0232981 | G55: of:=IF([.C55]=1;"";[.C55]) -> 0.193065 | H55: of:=IF([.D55]=1;"";[.D55]) -> 0.0719654 | I55: of:=IF([.E55]=1;"";[.E55]) -> 0.0232981
A56: 15 | B56: strncat: &"aa"{\0,\x01,\x01,\x01,\x01,\x01,\x01,\x01} &"aaaa"{\0} 4 :=> &"aaaaaa"{\0,p,p,\0} | C56: 0.193065 | D56: 0.0372739 | E56: 0.0163778 | G56: of:=IF([.C56]=1;"";[.C56]) -> 0.193065 | H56: of:=IF([.D56]=1;"";[.D56]) -> 0.0372739 | I56: of:=IF([.E56]=1;"";[.E56]) -> 0.0163778
A57: 16 | B57: strncat: &"aaa"{\0,\x01,\x01,\x01,\x01,\x01,\x01} &""{\0,p,p,p,\0} 4 :=> &"aaa"{\0,p,p,p,p,p,\0} | C57: 0.0719654 | D57: 1 | E57: 0.0719654 | G57: of:=IF([.C57]=1;"";[.C57]) -> 0.0719654 | H57: of:=IF([.D57]=1;"";[.D57]) ->  | I57: of:=IF([.E57]=1;"";[.E57]) -> 0.0719654
A58: 17 | B58: strncat: &"aaa"{\0,\x01,\x01,\x01,\x01,\x01,\x01} &"a"{\0,p,p,\0} 4 :=> &"aaaa"{\0,p,p,p,p,\0} | C58: 0.0719654 | D58: 1 | E58: 0.0372739 | G58: of:=IF([.C58]=1;"";[.C58]) -> 0.0719654 | H58: of:=IF([.D58]=1;"";[.D58]) ->  | I58: of:=IF([.E58]=1;"";[.E58]) -> 0.0372739
A59: 18 | B59: strncat: &"aaa"{\0,\x01,\x01,\x01,\x01,\x01,\x01} &"aa"{\0,p,\0} 4 :=> &"aaaaa"{\0,p,p,p,\0} | C59: 0.0719654 | D59: 0.193065 | E59: 0.0232981 | G59: of:=IF([.C59]=1;"";[.C59]) -> 0.0719654 | H59: of:=IF([.D59]=1;"";[.D59]) -> 0.193065 | I59: of:=IF([.E59]=1;"";[.E59]) -> 0.0232981
A60: 19 | B60: strncat: &"aaa"{\0,\x01,\x01,\x01,\x01,\x01,\x01} &"aaa"{\0,\0} 4 :=> &"aaaaaa"{\0,p,p,\0} | C60: 0.0719654 | D60: 0.0719654 | E60: 0.0163778 | G60: of:=IF([.C60]=1;"";[.C60]) -> 0.0719654 | H60: of:=IF([.D60]=1;"";[.D60]) -> 0.0719654 | I60: of:=IF([.E60]=1;"";[.E60]) -> 0.0163778
A61: 20 | B61: strncat: &"aaa"{\0,\x01,\x01,\x01,\x01,\x01,\x01} &"aaaa"{\0} 4 :=> &"aaaaaaa"{\0,p,\0} | C61: 0.0719654 | D61: 0.0372739 | E61: 0.0124511 | G61: of:=IF([.C61]=1;"";[.C61]) -> 0.0719654 | H61: of:=IF([.D61]=1;"";[.D61]) -> 0.0372739 | I61: of:=IF([.E61]=1;"";[.E61]) -> 0.0124511
A62: 21 | B62: strncat: &"aaaa"{\0,\x01,\x01,\x01,\x01,\x01} &""{\0,p,p,p,\0} 4 :=> &"aaaa"{\0,p,p,p,p,\0} | C62: 0.0372739 | D62: 1 | E62: 0.0372739 | G62: of:=IF([.C62]=1;"";[.C62]) -> 0.0372739 | H62: of:=IF([.D62]=1;"";[.D62]) ->  | I62: of:=IF([.E62]=1;"";[.E62]) -> 0.0372739
A63: 22 | B63: strncat: &"aaaa"{\0,\x01,\x01,\x01,\x01,\x01} &"a"{\0,p,p,\0} 4 :=> &"aaaaa"{\0,p,p,p,\0} | C63: 0.0372739 | D63: 1 | E63: 0.0232981 | G63: of:=IF([.C63]=1;"";[.C63]) -> 0.0372739 | H63: of:=IF([.D63]=1;"";[.D63]) ->  | I63: of:=IF([.E63]=1;"";[.E63]) -> 0.0232981
A64: 23 | B64: strncat: &"aaaa"{\0,\x01,\x01,\x01,\x01,\x01} &"aa"{\0,p,\0} 4 :=> &"aaaaaa"{\0,p,p,\0} | C64: 0.0372739 | D64: 0.193065 | E64: 0.0163778 | G64: of:=IF([.C64]=1;"";[.C64]) -> 0.0372739 | H64: of:=IF([.D64]=1;"";[.D64]) -> 0.193065 | I64: of:=IF([.E64]=1;"";[.E64]) -> 0.0163778
A65: 24 | B65: strncat: &"aaaa"{\0,\x01,\x01,\x01,\x01,\x01} &"aaa"{\0,\0} 4 :=> &"aaaaaaa"{\0,p,\0} | C65: 0.0372739 | D65: 0.0719654 | E65: 0.0124511 | G65: of:=IF([.C65]=1;"";[.C65]) -> 0.0372739 | H65: of:=IF([.D65]=1;"";[.D65]) -> 0.0719654 | I65: of:=IF([.E65]=1;"";[.E65]) -> 0.0124511
A66: 25 | B66: strncat: &"aaaa"{\0,\x01,\x01,\x01,\x01,\x01} &"aaaa"{\0} 4 :=> &"aaaaaaaa"{\0,\0} | C66: 0.0372739 | D66: 0.0372739 | E66: 0.00999924 | G66: of:=IF([.C66]=1;"";[.C66]) -> 0.0372739 | H66: of:=IF([.D66]=1;"";[.D66]) -> 0.0372739 | I66: of:=IF([.E66]=1;"";[.E66]) -> 0.00999924
A67: 26 | B67: strncat: &"aaaaa"{\0,\x01,\x01,\x01,\x01} &""{\0,p,p,p,\0} 4 :=> &"aaaaa"{\0,p,p,p,\0} | C67: 0.0232981 | D67: 1 | E67: 0.0232981 | G67: of:=IF([.C67]=1;"";[.C67]) -> 0.0232981 | H67: of:=IF([.D67]=1;"";[.D67]) ->  | I67: of:=IF([.E67]=1;"";[.E67]) -> 0.0232981
A68: 27 | B68: strncat: &"aaaaa"{\0,\x01,\x01,\x01,\x01} &"a"{\0,p,p,\0} 4 :=> &"aaaaaa"{\0,p,p,\0} | C68: 0.0232981 | D68: 1 | E68: 0.0163778 | G68: of:=IF([.C68]=1;"";[.C68]) -> 0.0232981 | H68: of:=IF([.D68]=1;"";[.D68]) ->  | I68: of:=IF([.E68]=1;"";[.E68]) -> 0.0163778
A69: 28 | B69: strncat: &"aaaaa"{\0,\x01,\x01,\x01,\x01} &"aa"{\0,p,\0} 4 :=> &"aaaaaaa"{\0,p,\0} | C69: 0.0232981 | D69: 0.193065 | E69: 0.0124511 | G69: of:=IF([.C69]=1;"";[.C69]) -> 0.0232981 | H69: of:=IF([.D69]=1;"";[.D69]) -> 0.193065 | I69: of:=IF([.E69]=1;"";[.E69]) -> 0.0124511
A70: 29 | B70: strncat: &"aaaaa"{\0,\x01,\x01,\x01,\x01} &"aaa"{\0,\0} 4 :=> &"aaaaaaaa"{\0,\0} | C70: 0.0232981 | D70: 0.0719654 | E70: 0.00999924 | G70: of:=IF([.C70]=1;"";[.C70]) -> 0.0232981 | H70: of:=IF([.D70]=1;"";[.D70]) -> 0.0719654 | I70: of:=IF([.E70]=1;"";[.E70]) -> 0.00999924
A71: 30 | B71: strncat: &"aaaaa"{\0,\x01,\x01,\x01,\x01} &"aaaa"{\0} 4 :=> &"aaaaaaaaa"{\0} | C71: 0.0232981 | D71: 0.0372739 | E71: 0.00835687 | G71: of:=IF([.C71]=1;"";[.C71]) -> 0.0232981 | H71: of:=IF([.D71]=1;"";[.D71]) -> 0.0372739 | I71: of:=IF([.E71]=1;"";[.E71]) -> 0.00835687
A72: 31 | B72: strncat: &"aaaaaa"{\0,\x01,\x01,\x01} &""{\0,p,p,p,\0} 4 :=> &"aaaaaa"{\0,p,p,\0} | C72: 0.0163778 | D72: 1 | E72: 0.0163778 | G72: of:=IF([.C72]=1;"";[.C72]) -> 0.0163778 | H72: of:=IF([.D72]=1;"";[.D72]) ->  | I72: of:=IF([.E72]=1;"";[.E72]) -> 0.0163778
A73: 32 | B73: strncat: &"aaaaaa"{\0,\x01,\x01,\x01} &"a"{\0,p,p,\0} 4 :=> &"aaaaaaa"{\0,p,\0} | C73: 0.0163778 | D73: 1 | E73: 0.0124511 | G73: of:=IF([.C73]=1;"";[.C73]) -> 0.0163778 | H73: of:=IF([.D73]=1;"";[.D73]) ->  | I73: of:=IF([.E73]=1;"";[.E73]) -> 0.0124511
A74: 33 | B74: strncat: &"aaaaaa"{\0,\x01,\x01,\x01} &"aa"{\0,p,\0} 4 :=> &"aaaaaaaa"{\0,\0} | C74: 0.0163778 | D74: 0.193065 | E74: 0.00999924 | G74: of:=IF([.C74]=1;"";[.C74]) -> 0.0163778 | H74: of:=IF([.D74]=1;"";[.D74]) -> 0.193065 | I74: of:=IF([.E74]=1;"";[.E74]) -> 0.00999924
A75: 34 | B75: strncat: &"aaaaaa"{\0,\x01,\x01,\x01} &"aaa"{\0,\0} 4 :=> &"aaaaaaaaa"{\0} | C75: 0.0163778 | D75: 0.0719654 | E75: 0.00835687 | G75: of:=IF([.C75]=1;"";[.C75]) -> 0.0163778 | H75: of:=IF([.D75]=1;"";[.D75]) -> 0.0719654 | I75: of:=IF([.E75]=1;"";[.E75]) -> 0.00835687
A76: 35 | B76: strncat: &"aaaaaa"{\0,\x01,\x01,\x01} &&10 4 :=> &"aaaaaaaaaa"{} | C76: 0.0163778 | D76: 0.00719627 | G76: of:=IF([.C76]=1;"";[.C76]) -> 0.0163778 | H76: of:=IF([.D76]=1;"";[.D76]) -> 0.00719627 | I76: of:=IF([.E76]=1;"";[.E76]) ->  
A77: 36 | B77: strncat: &"aaaaaaa"{\0,\x01,\x01} &""{\0,p,p,p,\0} 4 :=> &"aaaaaaa"{\0,p,\0} | C77: 0.0124511 | D77: 1 | E77: 0.0124511 | G77: of:=IF([.C77]=1;"";[.C77]) -> 0.0124511 | H77: of:=IF([.D77]=1;"";[.D77]) ->  | I77: of:=IF([.E77]=1;"";[.E77]) -> 0.0124511
A78: 37 | B78: strncat: &"aaaaaaa"{\0,\x01,\x01} &"a"{\0,p,p,\0} 4 :=> &"aaaaaaaa"{\0,\0} | C78: 0.0124511 | D78: 1 | E78: 0.00999924 | G78: of:=IF([.C78]=1;"";[.C78]) -> 0.0124511 | H78: of:=IF([.D78]=1;"";[.D78]) ->  | I78: of:=IF([.E78]=1;"";[.E78]) -> 0.00999924
A79: 38 | B79: strncat: &"aaaaaaa"{\0,\x01,\x01} &"aa"{\0,p,\0} 4 :=> &"aaaaaaaaa"{\0} | C79: 0.0124511 | D79: 0.193065 | E79: 0.00835687 | G79: of:=IF([.C79]=1;"";[.C79]) -> 0.0124511 | H79: of:=IF([.D79]=1;"";[.D79]) -> 0.193065 | I79: of:=IF([.E79]=1;"";[.E79]) -> 0.00835687
A80: 39 | B80: strncat: &"aaaaaaaa"{\0,\x01} &""{\0,p,p,p,\0} 4 :=> &"aaaaaaaa"{\0,\0} | C80: 0.00999924 | D80: 1 | E80: 0.00999924 | G80: of:=IF([.C80]=1;"";[.C80]) -> 0.00999924 | H80: of:=IF([.D80]=1;"";[.D80]) ->  | I80: of:=IF([.E80]=1;"";[.E80]) -> 0.00999924
A81: 40 | B81: strncat: &"aaaaaaaa"{\0,\x01} &"a"{\0,p,p,\0} 4 :=> &"aaaaaaaaa"{\0} | C81: 0.00999924 | D81: 1 | E81: 0.00835687 | G81: of:=IF([.C81]=1;"";[.C81]) -> 0.00999924 | H81: of:=IF([.D81]=1;"";[.D81]) ->  | I81: of:=IF([.E81]=1;"";[.E81]) -> 0.00835687
A82: 41 | B82: strncat: &"aaaaaaaaa"{\0} &""{\0,p,p,p,\0} 4 :=> &"aaaaaaaaa"{\0} | C82: 0.00835687 | D82: 1 | E82: 0.00835687 | G82: of:=IF([.C82]=1;"";[.C82]) -> 0.00835687 | H82: of:=IF([.D82]=1;"";[.D82]) ->  | I82: of:=IF([.E82]=1;"";[.E82]) -> 0.00835687

Sheet: strstr
A1: # | B1: Test Case | C1: N
A2: 1 | B2: strstr: &"p"{\0,h,a,a,\0} &"p"{\0,\0} :=> &"p"{\0,h,a,a,\0} | C2: 1 | D2: 1 | E2: 1 | G2: of:=IF([.C2]=1;"";[.C2]) ->  | H2: of:=IF([.D2]=1;"";[.D2]) ->  | I2: of:=IF([.E2]=1;"";[.E2]) ->  | K2: of:=AVERAGE([.G2:.G19]) -> 0.0728974058823529 | L2: of:=AVERAGE([.H2:.H19]) -> 0.178017444444444 | M2: of:=AVERAGE([.I2:.I19]) -> 0.10255975 | O2: of:=AVERAGE([.K2:.M2]) -> 0.117824866775599
A3: 2 | B3: strstr: &"ba"{\0,h,a,\0} &"b"{\0,\0} :=> &"ba"{\0,h,a,\0} | C3: 0.215236 | D3: 1 | E3: 0.215236 | G3: of:=IF([.C3]=1;"";[.C3]) -> 0.215236 | H3: of:=IF([.D3]=1;"";[.D3]) ->  | I3: of:=IF([.E3]=1;"";[.E3]) -> 0.215236
A4: 3 | B4: strstr: &"of"{\0,b,b,\0} &"f"{\0,\0} :=> &"f"{\0,b,b,\0,54} | C4: 0.22242 | D4: 1 | E4: 1 | G4: of:=IF([.C4]=1;"";[.C4]) -> 0.22242 | H4: of:=IF([.D4]=1;"";[.D4]) ->  | I4: of:=IF([.E4]=1;"";[.E4]) -> 
A5: 4 | B5: strstr: &"paa"{\0,h,\0} &"p"{\0,\0} :=> &"paa"{\0,h,\0} | C5: 0.0793138 | D5: 1 | E5: 0.0793138 | G5: of:=IF([.C5]=1;"";[.C5]) -> 0.0793138 | H5: of:=IF([.D5]=1;"";[.D5]) ->  | I5: of:=IF([.E5]=1;"";[.E5]) -> 0.0793138
A6: 5 | B6: strstr: &"nza"{\0,b,\0} &"z"{\0,\0} :=> &"za"{\0,b,\0,54} | C6: 0.0762921 | D6: 1 | E6: 0.205157 | G6: of:=IF([.C6]=1;"";[.C6]) -> 0.0762921 | H6: of:=IF([.D6]=1;"";[.D6]) ->  | I6: of:=IF([.E6]=1;"";[.E6]) -> 0.205157
A7: 6 | B7: strstr: &"baaa"{\0,\0} &"b"{\0,\0} :=> &"baaa"{\0,\0} | C7: 0.0400756 | D7: 1 | E7: 0.0400756 | G7: of:=IF([.C7]=1;"";[.C7]) -> 0.0400756 | H7: of:=IF([.D7]=1;"";[.D7]) ->  | I7: of:=IF([.E7]=1;"";[.E7]) -> 0.0400756
A8: 7 | B8: strstr: &"ibaa"{\0,\0} &"b"{\0,\0} :=> &"baa"{\0,\0,54} | C8: 0.0424335 | D8: 1 | E8: 0.0785043 | G8: of:=IF([.C8]=1;"";[.C8]) -> 0.0424335 | H8: of:=IF([.D8]=1;"";[.D8]) ->  | I8: of:=IF([.E8]=1;"";[.E8]) -> 0.0785043
A9: 8 | B9: strstr: &"baaaa"{\0} &"b"{\0,\0} :=> &"baaaa"{\0} | C9: 0.0247912 | D9: 1 | E9: 0.0247912 | G9: of:=IF([.C9]=1;"";[.C9]) -> 0.0247912 | H9: of:=IF([.D9]=1;"";[.D9]) ->  | I9: of:=IF([.E9]=1;"";[.E9]) -> 0.0247912
A10: 9 | B10: strstr: &"dpaaa"{\0} &"p"{\0,\0} :=> &"paaa"{\0,54} | C10: 0.0242974 | D10: 1 | E10: 0.0404196 | G10: of:=IF([.C10]=1;"";[.C10]) -> 0.0242974 | H10: of:=IF([.D10]=1;"";[.D10]) ->  | I10: of:=IF([.E10]=1;"";[.E10]) -> 0.0404196
A11: 10 | B11: strstr: &"pa"{\0,d,a,\0} &"pa"{\0} :=> &"pa"{\0,d,a,\0} | C11: 0.218014 | D11: 0.218014 | E11: 0.218014 | G11: of:=IF([.C11]=1;"";[.C11]) -> 0.218014 | H11: of:=IF([.D11]=1;"";[.D11]) -> 0.218014 | I11: of:=IF([.E11]=1;"";[.E11]) -> 0.218014
A12: 11 | B12: strstr: &"kma"{\0,d,\0} &"km"{\0} :=> &"kma"{\0,d,\0} | C12: 0.0777795 | D12: 0.187248 | E12: 0.0777795 | G12: of:=IF([.C12]=1;"";[.C12]) -> 0.0777795 | H12: of:=IF([.D12]=1;"";[.D12]) -> 0.187248 | I12: of:=IF([.E12]=1;"";[.E12]) -> 0.0777795
A13: 12 | B13: strstr: &"pph"{\0,a,\0} &"ph"{\0} :=> &"ph"{\0,a,\0,54} | C13: 0.083632 | D13: 0.210352 | E13: 0.210352 | G13: of:=IF([.C13]=1;"";[.C13]) -> 0.083632 | H13: of:=IF([.D13]=1;"";[.D13]) -> 0.210352 | I13: of:=IF([.E13]=1;"";[.E13]) -> 0.210352
A14: 13 | B14: strstr: &"qpp"{\0,p,\0} &"pp"{\0} :=> &"pp"{\0,p,\0,54} | C14: 0 | D14: 0.213806 | E14: 0.213806 | G14: of:=IF([.C14]=1;"";[.C14]) -> 0 | H14: of:=IF([.D14]=1;"";[.D14]) -> 0.213806 | I14: of:=IF([.E14]=1;"";[.E14]) -> 0.213806
A15: 14 | B15: strstr: &"rzaa"{\0,\0} &"rz"{\0} :=> &"rzaa"{\0,\0} | C15: 0.0384004 | D15: 0.189983 | E15: 0.0384004 | G15: of:=IF([.C15]=1;"";[.C15]) -> 0.0384004 | H15: of:=IF([.D15]=1;"";[.D15]) -> 0.189983 | I15: of:=IF([.E15]=1;"";[.E15]) -> 0.0384004
A16: 15 | B16: strstr: &"rrba"{\0,\0} &"rb"{\0} :=> &"rba"{\0,\0,54} | C16: 0.0447745 | D16: 0.206345 | E16: 0.0827957 | G16: of:=IF([.C16]=1;"";[.C16]) -> 0.0447745 | H16: of:=IF([.D16]=1;"";[.D16]) -> 0.206345 | I16: of:=IF([.E16]=1;"";[.E16]) -> 0.0827957
A17: 16 | B17: strstr: &"jvua"{\0,\0} &"vu"{\0} :=> &"vua"{\0,\0,54} | C17: 0.0264087 | D17: 0.188875 | E17: 0.0764497 | G17: of:=IF([.C17]=1;"";[.C17]) -> 0.0264087 | H17: of:=IF([.D17]=1;"";[.D17]) -> 0.188875 | I17: of:=IF([.E17]=1;"";[.E17]) -> 0.0764497
A18: 17 | B18: strstr: &"dxaaa"{\0} &"dx"{\0} :=> &"dxaaa"{\0} | C18: 0 | D18: 0 | E18: 0 | G18: of:=IF([.C18]=1;"";[.C18]) -> 0 | H18: of:=IF([.D18]=1;"";[.D18]) -> 0 | I18: of:=IF([.E18]=1;"";[.E18]) -> 0
A19: 18 | B19: strstr: &"bbcaa"{\0} &"bc"{\0} :=> &"bcaa"{\0,54} | C19: 0.0253872 | D19: 0.187534 | E19: 0.0398612 | G19: of:=IF([.C19]=1;"";[.C19]) -> 0.0253872 | H19: of:=IF([.D19]=1;"";[.D19]) -> 0.187534 | I19: of:=IF([.E19]=1;"";[.E19]) -> 0.0398612
A20: 19 | B20: strstr: &"cbdaa"{\0} &"bd"{\0} :=> &"bdaa"{\0,54} | C20: 0.0224248 | D20: 0.187032 | E20: 0.0393503 | G20: of:=IF([.C20]=1;"";[.C20]) -> 0.0224248 | H20: of:=IF([.D20]=1;"";[.D20]) -> 0.187032 | I20: of:=IF([.E20]=1;"";[.E20]) -> 0.0393503 | K20: of:=AVERAGE([.G20:.G24]) -> 0.02616504 | L20: of:=AVERAGE([.H20:.H24]) -> 0.197925 | M20: of:=AVERAGE([.I20:.I24]) -> 0.0332309 | O20: of:=AVERAGE([.K20:.M20]) -> 0.0857736466666667
A21: 1 | B21: strnstr: &"ppppp"{\0} &""{\0,p,\0} 2 :=> &"ppppp"{\0} | C21: 0.0294181 | D21: 1 | E21: 0.0294181 | G21: of:=IF([.C21]=1;"";[.C21]) -> 0.0294181 | H21: of:=IF([.D21]=1;"";[.D21]) ->  | I21: of:=IF([.E21]=1;"";[.E21]) -> 0.0294181
A22: 2 | B22: strnstr: &"ybhba"{\0} &"y"{\0,\0} 2 :=> &"ybhba"{\0} | C22: 0.0243968 | D22: 1 | E22: 0.0243968 | G22: of:=IF([.C22]=1;"";[.C22]) -> 0.0243968 | H22: of:=IF([.D22]=1;"";[.D22]) ->  | I22: of:=IF([.E22]=1;"";[.E22]) -> 0.0243968
A23: 3 | B23: strnstr: &"ihabb"{\0} &"h"{\0,\0} 2 :=> &"habb"{\0,54} | C23: 0.0272432 | D23: 1 | E23: 0.045647 | G23: of:=IF([.C23]=1;"";[.C23]) -> 0.0272432 | H23: of:=IF([.D23]=1;"";[.D23]) ->  | I23: of:=IF([.E23]=1;"";[.E23]) -> 0.045647
A24: 4 | B24: strnstr: &"ddapb"{\0} &"dd"{\0} 2 :=> &"ddapb"{\0} | C24: 0.0273423 | D24: 0.208818 | E24: 0.0273423 | G24: of:=IF([.C24]=1;"";[.C24]) -> 0.0273423 | H24: of:=IF([.D24]=1;"";[.D24]) -> 0.208818 | I24: of:=IF([.E24]=1;"";[.E24]) -> 0.0273423
A25: 1 | B25: strpbrk: &"yuaap"{\0} &"aeiou"{\0} :=> &"uaap"{\0,54} | C25: 0.0257799 | D25: 0.0299288 | E25: 0.0427669 | G25: of:=IF([.C25]=1;"";[.C25]) -> 0.0257799 | H25: of:=IF([.D25]=1;"";[.D25]) -> 0.0299288 | I25: of:=IF([.E25]=1;"";[.E25]) -> 0.0427669 | K25: of:=AVERAGE([.G25:.G34]) -> 0.02851578 | L25: of:=AVERAGE([.H25:.H34]) -> 0.0299288 | M25: of:=AVERAGE([.I25:.I34]) -> 0.03635351 | O25: of:=AVERAGE([.K25:.M25]) -> 0.0315993633333333
A26: 2 | B26: strpbrk: &"yopah"{\0} &"aeiou"{\0} :=> &"opah"{\0,54} | C26: 0.0289104 | D26: 0.0299288 | E26: 0.0451391 | G26: of:=IF([.C26]=1;"";[.C26]) -> 0.0289104 | H26: of:=IF([.D26]=1;"";[.D26]) -> 0.0299288 | I26: of:=IF([.E26]=1;"";[.E26]) -> 0.0451391
A27: 3 | B27: strpbrk: &"yiaaa"{\0} &"aeiou"{\0} :=> &"iaaa"{\0,54} | C27: 0.0260203 | D27: 0.0299288 | E27: 0.0403633 | G27: of:=IF([.C27]=1;"";[.C27]) -> 0.0260203 | H27: of:=IF([.D27]=1;"";[.D27]) -> 0.0299288 | I27: of:=IF([.E27]=1;"";[.E27]) -> 0.0403633
A28: 4 | B28: strpbrk: &"yehha"{\0} &"aeiou"{\0} :=> &"ehha"{\0,54} | C28: 0.0271604 | D28: 0.0299288 | E28: 0.041462 | G28: of:=IF([.C28]=1;"";[.C28]) -> 0.0271604 | H28: of:=IF([.D28]=1;"";[.D28]) -> 0.0299288 | I28: of:=IF([.E28]=1;"";[.E28]) -> 0.041462
A29: 5 | B29: strpbrk: &"babab"{\0} &"aeiou"{\0} :=> &"abab"{\0,54} | C29: 0.0299445 | D29: 0.0299288 | E29: 0.0464615 | G29: of:=IF([.C29]=1;"";[.C29]) -> 0.0299445 | H29: of:=IF([.D29]=1;"";[.D29]) -> 0.0299288 | I29: of:=IF([.E29]=1;"";[.E29]) -> 0.0464615
A30: 6 | B30: strpbrk: &"upppp"{\0} &"aeiou"{\0} :=> &"upppp"{\0} | C30: 0.0294558 | D30: 0.0299288 | E30: 0.0294558 | G30: of:=IF([.C30]=1;"";[.C30]) -> 0.0294558 | H30: of:=IF([.D30]=1;"";[.D30]) -> 0.0299288 | I30: of:=IF([.E30]=1;"";[.E30]) -> 0.0294558
A31: 7 | B31: strpbrk: &"opppp"{\0} &"aeiou"{\0} :=> &"opppp"{\0} | C31: 0.0296402 | D31: 0.0299288 | E31: 0.0296402 | G31: of:=IF([.C31]=1;"";[.C31]) -> 0.0296402 | H31: of:=IF([.D31]=1;"";[.D31]) -> 0.0299288 | I31: of:=IF([.E31]=1;"";[.E31]) -> 0.0296402
A32: 8 | B32: strpbrk: &"ipppp"{\0} &"aeiou"{\0} :=> &"ipppp"{\0} | C32: 0.0291855 | D32: 0.0299288 | E32: 0.0291855 | G32: of:=IF([.C32]=1;"";[.C32]) -> 0.0291855 | H32: of:=IF([.D32]=1;"";[.D32]) -> 0.0299288 | I32: of:=IF([.E32]=1;"";[.E32]) -> 0.0291855
A33: 9 | B33: strpbrk: &"epppp"{\0} &"aeiou"{\0} :=> &"epppp"{\0} | C33: 0.0295304 | D33: 0.0299288 | E33: 0.0295304 | G33: of:=IF([.C33]=1;"";[.C33]) -> 0.0295304 | H33: of:=IF([.D33]=1;"";[.D33]) -> 0.0299288 | I33: of:=IF([.E33]=1;"";[.E33]) -> 0.0295304
A34: 10 | B34: strpbrk: &"apppp"{\0} &"aeiou"{\0} :=> &"apppp"{\0} | C34: 0.0295304 | D34: 0.0299288 | E34: 0.0295304 | G34: of:=IF([.C34]=1;"";[.C34]) -> 0.0295304 | H34: of:=IF([.D34]=1;"";[.D34]) -> 0.0299288 | I34: of:=IF([.E34]=1;"";[.E34]) -> 0.0295304