Sheet: strlen
A1: strlen: &"\x01"{\0,\0,\0,\0,\0} :=> 1; | J1: # | K1: Test Case | L1: N | P1: FINAL
A2: strlen: &"\x01\x01"{\0,\0,\0,\0} :=> 2; | J2: 1 | K2: strlen: &"l"{\0,p,e,o,\0} :=> 1 | L2: 1 | N2: of:=IF([.L2]=1;"";[.L2]) ->  | P2: of:=AVERAGE([.N2:.N6]) -> 0.062885975
A3: strlen: &"\x01\x01\x01"{\0,\0,\0} :=> 3; | J3: 2 | K3: strlen: &"hz"{\0,p,i,\0} :=> 2 | L3: 0.14931 | N3: of:=IF([.L3]=1;"";[.L3]) -> 0.14931
A4: strlen: &"\x01\x01\x01\x01"{\0,\0} :=> 4; | J4: 3 | K4: strlen: &"exo"{\0,p,\0} :=> 3 | L4: 0.0785563 | N4: of:=IF([.L4]=1;"";[.L4]) -> 0.0785563
A5: strlen: &"\x01\x01\x01\x01\x01"{\0} :=> 5; | J5: 4 | K5: strlen: &"yljv"{\0,\0} :=> 4 | L5: 0.0236776 | N5: of:=IF([.L5]=1;"";[.L5]) -> 0.0236776
A6: strnlen: &""{\0,\0,\0,\0,\0,\0} 6 :=> 0; 1; | J6: 5 | K6: strlen: &"vbrwq"{\0} :=> 5 | L6: 0 | N6: of:=IF([.L6]=1;"";[.L6]) -> 0
A7: strnlen: &"\x01"{\0,\0,\0,\0,\0} 6 :=> 1; | J7: 1 | K7: strnlen: &""{\0,p,b,l,y,\0} 6 :=> 0 | L7: 1 | N7: of:=IF([.L7]=1;"";[.L7]) ->  | P7: of:=AVERAGE([.N7:.N12]) -> 0.064798675
A8: strnlen: &"\x01\x01"{\0,\0,\0,\0} 6 :=> 2; | J8: 2 | K8: strnlen: &"j"{\0,p,y,b,\0} 6 :=> 1 | L8: 1 | N8: of:=IF([.L8]=1;"";[.L8]) -> 
A9: strnlen: &"\x01\x01\x01"{\0,\0,\0} 6 :=> 3; | J9: 3 | K9: strnlen: &"sv"{\0,p,b,\0} 6 :=> 2 | L9: 0.186599 | N9: of:=IF([.L9]=1;"";[.L9]) -> 0.186599
A10: strnlen: &"\x01\x01\x01\x01"{\0,\0} 6 :=> 4; | J10: 4 | K10: strnlen: &"pvq"{\0,p,\0} 6 :=> 3 | L10: 0 | N10: of:=IF([.L10]=1;"";[.L10]) -> 0
A11: strnlen: &"\x01\x01\x01\x01\x01"{\0} 6 :=> 5; | J11: 5 | K11: strnlen: &"cshr"{\0,\0} 6 :=> 4 | L11: 0.0447558 | N11: of:=IF([.L11]=1;"";[.L11]) -> 0.0447558
J12: 6 | K12: strnlen: &"juiaq"{\0} 6 :=> 5 | L12: 0.0278399 | N12: of:=IF([.L12]=1;"";[.L12]) -> 0.0278399

Sheet: strcmp
A1: # | B1: Test Case | C1: N1 | D1: N2 | L1: FINAL
A2: 1 | B2: strcmp: &"y"{\0,p,u,g,\0} &"y"{\0,p,s,x,\0} :=> 0 | C2: 1 | D2: 1 | F2: of:=IF([.C2]=1;"";[.C2]) ->  | G2: of:=IF([.D2]=1;"";[.D2]) ->  | H2: of:=IF([.E2]=1;"";[.E2]) ->   | I2: of:=AVERAGE([.F2:.F16]) -> 0.0413466 | J2: of:=AVERAGE([.G2:.G16]) -> 0.0372097714285714 | L2: of:=AVERAGE([.I2:.J2]) -> 0.0392781857142857
A3: 2 | B3: strcmp: &"hr"{\0,p,e,\0} &"hr"{\0,p,j,\0} :=> 0 | C3: 0.211356 | D3: 0.211356 | F3: of:=IF([.C3]=1;"";[.C3]) -> 0.211356 | G3: of:=IF([.D3]=1;"";[.D3]) -> 0.211356 | H3: of:=IF([.E3]=1;"";[.E3]) ->  
A4: 3 | B4: strcmp: &"ycn"{\0,p,\0} &"ycn"{\0,p,\0} :=> 0 | C4: 0.0681742 | D4: 0.0681742 | F4: of:=IF([.C4]=1;"";[.C4]) -> 0.0681742 | G4: of:=IF([.D4]=1;"";[.D4]) -> 0.0681742 | H4: of:=IF([.E4]=1;"";[.E4]) ->  
A5: 4 | B5: strcmp: &"puna"{\0,\0} &"puna"{\0,\0} :=> 0 | C5: 0.0468391 | D5: 0.0468391 | F5: of:=IF([.C5]=1;"";[.C5]) -> 0.0468391 | G5: of:=IF([.D5]=1;"";[.D5]) -> 0.0468391 | H5: of:=IF([.E5]=1;"";[.E5]) ->  
A6: 5 | B6: strcmp: &"swktz"{\0} &"swktz"{\0} :=> 0 | C6: 0.0241526 | D6: 0.0241526 | F6: of:=IF([.C6]=1;"";[.C6]) -> 0.0241526 | G6: of:=IF([.D6]=1;"";[.D6]) -> 0.0241526 | H6: of:=IF([.E6]=1;"";[.E6]) ->  
A7: 6 | B7: strcmp: &"zmbet"{\0} &"zmbes"{\0} :=> 1 | C7: 0.0276319 | D7: 0.0279721 | F7: of:=IF([.C7]=1;"";[.C7]) -> 0.0276319 | G7: of:=IF([.D7]=1;"";[.D7]) -> 0.0279721 | H7: of:=IF([.E7]=1;"";[.E7]) ->  
A8: 7 | B8: strcmp: &"pbdsd"{\0} &"pbdsh"{\0} :=> -1 | C8: 0.0246726 | D8: 0.0256672 | F8: of:=IF([.C8]=1;"";[.C8]) -> 0.0246726 | G8: of:=IF([.D8]=1;"";[.D8]) -> 0.0256672 | H8: of:=IF([.E8]=1;"";[.E8]) ->  
A9: 8 | B9: strcmp: &"gckyl"{\0} &"gckpb"{\0} :=> 1 | C9: 0.0235732 | D9: 0.0216079 | F9: of:=IF([.C9]=1;"";[.C9]) -> 0.0235732 | G9: of:=IF([.D9]=1;"";[.D9]) -> 0.0216079 | H9: of:=IF([.E9]=1;"";[.E9]) ->  
A10: 9 | B10: strcmp: &"zzfmu"{\0} &"zzfwq"{\0} :=> -1 | C10: 0.0209094 | D10: 0.0158325 | F10: of:=IF([.C10]=1;"";[.C10]) -> 0.0209094 | G10: of:=IF([.D10]=1;"";[.D10]) -> 0.0158325 | H10: of:=IF([.E10]=1;"";[.E10]) ->  
A11: 10 | B11: strcmp: &"udram"{\0} &"udglu"{\0} :=> 1 | C11: 0.0300863 | D11: 0.0283324 | F11: of:=IF([.C11]=1;"";[.C11]) -> 0.0300863 | G11: of:=IF([.D11]=1;"";[.D11]) -> 0.0283324 | H11: of:=IF([.E11]=1;"";[.E11]) ->  
A12: 11 | B12: strcmp: &"evegm"{\0} &"evvji"{\0} :=> -1 | C12: 0.0286482 | D12: 0.0165841 | F12: of:=IF([.C12]=1;"";[.C12]) -> 0.0286482 | G12: of:=IF([.D12]=1;"";[.D12]) -> 0.0165841
A13: 12 | B13: strcmp: &"iwfgp"{\0} &"ijljd"{\0} :=> 1 | C13: 0.020768 | D13: 0.0164541 | F13: of:=IF([.C13]=1;"";[.C13]) -> 0.020768 | G13: of:=IF([.D13]=1;"";[.D13]) -> 0.0164541
A14: 13 | B14: strcmp: &"gofuo"{\0} &"gvwjb"{\0} :=> -1 | C14: 0.0287124 | D14: 0 | F14: of:=IF([.C14]=1;"";[.C14]) -> 0.0287124 | G14: of:=IF([.D14]=1;"";[.D14]) -> 0
A15: 14 | B15: strcmp: &"qacvb"{\0} &"hubvw"{\0} :=> 1 | C15: 0 | D15: 0 | F15: of:=IF([.C15]=1;"";[.C15]) -> 0 | G15: of:=IF([.D15]=1;"";[.D15]) -> 0
A16: 15 | B16: strcmp: &"inhzi"{\0} &"mqiuj"{\0} :=> -1 | C16: 0.0233285 | D16: 0.0179646 | F16: of:=IF([.C16]=1;"";[.C16]) -> 0.0233285 | G16: of:=IF([.D16]=1;"";[.D16]) -> 0.0179646
A17: 1 | B17: strncmp: &""{\0,p,i,t,l,\0} &""{\0,p,i,b,r,\0} 5 :=> 0 | C17: 1 | D17: 1 | F17: of:=IF([.C17]=1;"";[.C17]) ->  | G17: of:=IF([.D17]=1;"";[.D17]) ->  | I17: of:=AVERAGE([.F17:.F32]) -> 0.03330805 | J17: of:=AVERAGE([.G17:.G32]) -> 0.03538895 | L17: of:=AVERAGE([.I17:.J17]) -> 0.0343485
A18: 2 | B18: strncmp: &"j"{\0,p,s,x,\0} &"j"{\0,p,d,t,\0} 5 :=> 0 | C18: 1 | D18: 1 | F18: of:=IF([.C18]=1;"";[.C18]) ->  | G18: of:=IF([.D18]=1;"";[.D18]) -> 
A19: 3 | B19: strncmp: &"ek"{\0,p,v,\0} &"ek"{\0,p,i,\0} 5 :=> 0 | C19: 0.208143 | D19: 0.208143 | F19: of:=IF([.C19]=1;"";[.C19]) -> 0.208143 | G19: of:=IF([.D19]=1;"";[.D19]) -> 0.208143
A20: 4 | B20: strncmp: &"xxq"{\0,p,\0} &"xxq"{\0,p,\0} 5 :=> 0 | C20: 0.0611298 | D20: 0.0611298 | F20: of:=IF([.C20]=1;"";[.C20]) -> 0.0611298 | G20: of:=IF([.D20]=1;"";[.D20]) -> 0.0611298
A21: 5 | B21: strncmp: &"hxwp"{\0,\0} &"hxwp"{\0,\0} 5 :=> 0 | C21: 0 | D21: 0 | F21: of:=IF([.C21]=1;"";[.C21]) -> 0 | G21: of:=IF([.D21]=1;"";[.D21]) -> 0
A22: 6 | B22: strncmp: &"tjvzd"{\0} &"tjvzd"{\0} 5 :=> 0 | C22: 0.0109441 | D22: 0.0109441 | F22: of:=IF([.C22]=1;"";[.C22]) -> 0.0109441 | G22: of:=IF([.D22]=1;"";[.D22]) -> 0.0109441
A23: 7 | B23: strncmp: &"lyehk"{\0} &"lyeha"{\0} 5 :=> 1 | C23: 0.0266648 | D23: 0.0298759 | F23: of:=IF([.C23]=1;"";[.C23]) -> 0.0266648 | G23: of:=IF([.D23]=1;"";[.D23]) -> 0.0298759
A24: 8 | B24: strncmp: &"ixvbm"{\0} &"ixvbq"{\0} 5 :=> -1 | C24: 0 | D24: 0 | F24: of:=IF([.C24]=1;"";[.C24]) -> 0 | G24: of:=IF([.D24]=1;"";[.D24]) -> 0
A25: 9 | B25: strncmp: &"tymlq"{\0} &"tymez"{\0} 5 :=> 1 | C25: 0.0229857 | D25: 0.02837 | F25: of:=IF([.C25]=1;"";[.C25]) -> 0.0229857 | G25: of:=IF([.D25]=1;"";[.D25]) -> 0.02837
A26: 10 | B26: strncmp: &"njcub"{\0} &"njczz"{\0} 5 :=> -1 | C26: 0.0238407 | D26: 0.020838 | F26: of:=IF([.C26]=1;"";[.C26]) -> 0.0238407 | G26: of:=IF([.D26]=1;"";[.D26]) -> 0.020838
A27: 11 | B27: strncmp: &"ethui"{\0} &"eteek"{\0} 5 :=> 1 | C27: 0.0304312 | D27: 0.0305776 | F27: of:=IF([.C27]=1;"";[.C27]) -> 0.0304312 | G27: of:=IF([.D27]=1;"";[.D27]) -> 0.0305776
A28: 12 | B28: strncmp: &"zqpdw"{\0} &"zqxwu"{\0} 5 :=> -1 | C28: 0 | D28: 0 | F28: of:=IF([.C28]=1;"";[.C28]) -> 0 | G28: of:=IF([.D28]=1;"";[.D28]) -> 0
A29: 13 | B29: strncmp: &"mfctw"{\0} &"maawn"{\0} 5 :=> 1 | C29: 0.0248122 | D29: 0.027793 | F29: of:=IF([.C29]=1;"";[.C29]) -> 0.0248122 | G29: of:=IF([.D29]=1;"";[.D29]) -> 0.027793
A30: 14 | B30: strncmp: &"uqcqr"{\0} &"uzgyx"{\0} 5 :=> -1 | C30: 0 | D30: 0.0211306 | F30: of:=IF([.C30]=1;"";[.C30]) -> 0 | G30: of:=IF([.D30]=1;"";[.D30]) -> 0.0211306
A31: 15 | B31: strncmp: &"ysaor"{\0} &"rtoyb"{\0} 5 :=> 1 | C31: 0.0289337 | D31: 0.0287859 | F31: of:=IF([.C31]=1;"";[.C31]) -> 0.0289337 | G31: of:=IF([.D31]=1;"";[.D31]) -> 0.0287859
A32: 16 | B32: strncmp: &"nbonh"{\0} &"pefmi"{\0} 5 :=> -1 | C32: 0.0284275 | D32: 0.0278574 | F32: of:=IF([.C32]=1;"";[.C32]) -> 0.0284275 | G32: of:=IF([.D32]=1;"";[.D32]) -> 0.0278574
A33: 1 | B33: sysfs_streq: &""{\0,p,l,q,h,\0} &"ftmek"{\0} :=> \0 | C33: 1 | D33: 0.0289439 | F33: of:=IF([.C33]=1;"";[.C33]) ->  | G33: of:=IF([.D33]=1;"";[.D33]) -> 0.0289439 | I33: of:=AVERAGE([.F33:.F71]) -> 0.0557539931034483 | J33: of:=AVERAGE([.G33:.G71]) -> 0.0399718785714286 | L33: of:=AVERAGE([.I33:.J33]) -> 0.0478629358374384
A34: 2 | B34: sysfs_streq: &""{\0,p,v,s,c,\0} &"\n"{\0,b,o,h,\0} :=> \x01 | C34: 1 | F34: of:=IF([.C34]=1;"";[.C34]) ->  | G34: of:=IF([.D34]=1;"";[.D34]) ->  
A35: 3 | B35: sysfs_streq: &""{\0,p,a,j,c,\0} &"\najbz"{\0} :=> \0 | C35: 1 | F35: of:=IF([.C35]=1;"";[.C35]) ->  | G35: of:=IF([.D35]=1;"";[.D35]) ->  
A36: 4 | B36: sysfs_streq: &""{\0,p,z,e,l,\0} &""{\0,h,v,p,i,\0} :=> \x01 | C36: 1 | D36: 1 | F36: of:=IF([.C36]=1;"";[.C36]) ->  | G36: of:=IF([.D36]=1;"";[.D36]) -> 
A37: 5 | B37: sysfs_streq: &"bzcni"{\0} &"ucuzv"{\0} :=> \0 | C37: 0.0185109 | D37: 0.0247672 | F37: of:=IF([.C37]=1;"";[.C37]) -> 0.0185109 | G37: of:=IF([.D37]=1;"";[.D37]) -> 0.0247672
A38: 6 | B38: sysfs_streq: &"\n"{\0,p,o,n,\0} &""{\0,a,o,v,x,\0} :=> \x01 | C38: 1 | F38: of:=IF([.C38]=1;"";[.C38]) ->  | G38: of:=IF([.D38]=1;"";[.D38]) ->  
A39: 7 | B39: sysfs_streq: &"\n"{\0,a,r,d,\0} &"nhcyo"{\0} :=> \0 | C39: 0.0258026 | F39: of:=IF([.C39]=1;"";[.C39]) -> 0.0258026 | G39: of:=IF([.D39]=1;"";[.D39]) ->  
A40: 8 | B40: sysfs_streq: &"\nabyo"{\0} &"yntyj"{\0} :=> \0 | C40: 0.0245185 | F40: of:=IF([.C40]=1;"";[.C40]) -> 0.0245185 | G40: of:=IF([.D40]=1;"";[.D40]) ->  
A41: 9 | B41: sysfs_streq: &"w"{\0,p,w,s,\0} &"wdagm"{\0} :=> \0 | C41: 1 | D41: 0.0269037 | F41: of:=IF([.C41]=1;"";[.C41]) ->  | G41: of:=IF([.D41]=1;"";[.D41]) -> 0.0269037
A42: 10 | B42: sysfs_streq: &"d"{\0,p,l,v,\0} &"d\n"{\0,a,p,\0} :=> \x01 | C42: 1 | F42: of:=IF([.C42]=1;"";[.C42]) ->  | G42: of:=IF([.D42]=1;"";[.D42]) ->  
A43: 11 | B43: sysfs_streq: &"j"{\0,p,g,m,\0} &"j\nazr"{\0} :=> \0 | C43: 1 | F43: of:=IF([.C43]=1;"";[.C43]) ->  | G43: of:=IF([.D43]=1;"";[.D43]) ->  
A44: 12 | B44: sysfs_streq: &"v"{\0,p,w,i,\0} &"v"{\0,h,t,d,\0} :=> \x01 | C44: 1 | D44: 1 | F44: of:=IF([.C44]=1;"";[.C44]) ->  | G44: of:=IF([.D44]=1;"";[.D44]) -> 
A45: 13 | B45: sysfs_streq: &"tvspk"{\0} &"tmnak"{\0} :=> \0 | C45: 0.0233918 | D45: 0.0278384 | F45: of:=IF([.C45]=1;"";[.C45]) -> 0.0233918 | G45: of:=IF([.D45]=1;"";[.D45]) -> 0.0278384
A46: 14 | B46: sysfs_streq: &"u\n"{\0,b,g,\0} &"u"{\0,b,p,q,\0} :=> \x01 | C46: 1 | F46: of:=IF([.C46]=1;"";[.C46]) ->  | G46: of:=IF([.D46]=1;"";[.D46]) ->  
A47: 15 | B47: sysfs_streq: &"q\n"{\0,b,v,\0} &"qvpzq"{\0} :=> \0 | C47: 0 | F47: of:=IF([.C47]=1;"";[.C47]) -> 0 | G47: of:=IF([.D47]=1;"";[.D47]) ->  
A48: 16 | B48: sysfs_streq: &"s\naob"{\0} &"stnwt"{\0} :=> \0 | C48: 0.0267078 | F48: of:=IF([.C48]=1;"";[.C48]) -> 0.0267078 | G48: of:=IF([.D48]=1;"";[.D48]) ->  
A49: 17 | B49: sysfs_streq: &"oz"{\0,p,h,\0} &"ozrpu"{\0} :=> \0 | C49: 0.198819 | D49: 0.0245999 | F49: of:=IF([.C49]=1;"";[.C49]) -> 0.198819 | G49: of:=IF([.D49]=1;"";[.D49]) -> 0.0245999
A50: 18 | B50: sysfs_streq: &"qe"{\0,p,r,\0} &"qe\n"{\0,a,\0} :=> \x01 | C50: 0.106758 | F50: of:=IF([.C50]=1;"";[.C50]) -> 0.106758 | G50: of:=IF([.D50]=1;"";[.D50]) ->  
A51: 19 | B51: sysfs_streq: &"mp"{\0,p,w,\0} &"mp\nae"{\0} :=> \0 | C51: 0.2171 | F51: of:=IF([.C51]=1;"";[.C51]) -> 0.2171 | G51: of:=IF([.D51]=1;"";[.D51]) ->  
A52: 20 | B52: sysfs_streq: &"zu"{\0,p,q,\0} &"zu"{\0,b,c,\0} :=> \x01 | C52: 0.189501 | D52: 0.189501 | F52: of:=IF([.C52]=1;"";[.C52]) -> 0.189501 | G52: of:=IF([.D52]=1;"";[.D52]) -> 0.189501
A53: 21 | B53: sysfs_streq: &"cwdey"{\0} &"cwhrv"{\0} :=> \0 | C53: 0.0238058 | D53: 0.0249339 | F53: of:=IF([.C53]=1;"";[.C53]) -> 0.0238058 | G53: of:=IF([.D53]=1;"";[.D53]) -> 0.0249339
A54: 22 | B54: sysfs_streq: &"vh\n"{\0,b,\0} &"vh"{\0,b,m,\0} :=> \x01 | C54: 0.127187 | F54: of:=IF([.C54]=1;"";[.C54]) -> 0.127187 | G54: of:=IF([.D54]=1;"";[.D54]) ->  
A55: 23 | B55: sysfs_streq: &"tk\n"{\0,b,\0} &"tkrjq"{\0} :=> \0 | C55: 0 | F55: of:=IF([.C55]=1;"";[.C55]) -> 0 | G55: of:=IF([.D55]=1;"";[.D55]) ->  
A56: 24 | B56: sysfs_streq: &"mk\nah"{\0} &"mkpny"{\0} :=> \0 | C56: 0.0214877 | F56: of:=IF([.C56]=1;"";[.C56]) -> 0.0214877 | G56: of:=IF([.D56]=1;"";[.D56]) ->  
A57: 25 | B57: sysfs_streq: &"qzp"{\0,p,\0} &"qzphl"{\0} :=> \0 | C57: 0 | D57: 0 | F57: of:=IF([.C57]=1;"";[.C57]) -> 0 | G57: of:=IF([.D57]=1;"";[.D57]) -> 0
A58: 26 | B58: sysfs_streq: &"afj"{\0,p,\0} &"afj\n"{\0,\0} :=> \x01 | C58: 0.0692198 | F58: of:=IF([.C58]=1;"";[.C58]) -> 0.0692198 | G58: of:=IF([.D58]=1;"";[.D58]) ->  
A59: 27 | B59: sysfs_streq: &"mek"{\0,p,\0} &"mek\na"{\0} :=> \0 | C59: 0.0853262 | F59: of:=IF([.C59]=1;"";[.C59]) -> 0.0853262 | G59: of:=IF([.D59]=1;"";[.D59]) ->  
A60: 28 | B60: sysfs_streq: &"eft"{\0,p,\0} &"eft"{\0,h,\0} :=> \x01 | C60: 0.084417 | D60: 0.084417 | F60: of:=IF([.C60]=1;"";[.C60]) -> 0.084417 | G60: of:=IF([.D60]=1;"";[.D60]) -> 0.084417
A61: 29 | B61: sysfs_streq: &"wdmgb"{\0} &"wdmuv"{\0} :=> \0 | C61: 0.0218842 | D61: 0.0256517 | F61: of:=IF([.C61]=1;"";[.C61]) -> 0.0218842 | G61: of:=IF([.D61]=1;"";[.D61]) -> 0.0256517
A62: 30 | B62: sysfs_streq: &"ixu\n"{\0,\0} &"ixu"{\0,a,\0} :=> \x01 | C62: 0.0764385 | F62: of:=IF([.C62]=1;"";[.C62]) -> 0.0764385 | G62: of:=IF([.D62]=1;"";[.D62]) ->  
A63: 31 | B63: sysfs_streq: &"iib\n"{\0,\0} &"iibba"{\0} :=> \0 | C63: 0.0266375 | F63: of:=IF([.C63]=1;"";[.C63]) -> 0.0266375 | G63: of:=IF([.D63]=1;"";[.D63]) ->  
A64: 32 | B64: sysfs_streq: &"dgr\na"{\0} &"dgrnn"{\0} :=> \0 | C64: 0.0290571 | F64: of:=IF([.C64]=1;"";[.C64]) -> 0.0290571 | G64: of:=IF([.D64]=1;"";[.D64]) ->  
A65: 33 | B65: sysfs_streq: &"hjds"{\0,\0} &"hjdsp"{\0} :=> \0 | C65: 0.0311551 | D65: 0.0212325 | F65: of:=IF([.C65]=1;"";[.C65]) -> 0.0311551 | G65: of:=IF([.D65]=1;"";[.D65]) -> 0.0212325
A66: 34 | B66: sysfs_streq: &"wlox"{\0,\0} &"wlox\n"{\0} :=> \x01 | C66: 0.0427545 | F66: of:=IF([.C66]=1;"";[.C66]) -> 0.0427545 | G66: of:=IF([.D66]=1;"";[.D66]) ->  
A67: 35 | B67: sysfs_streq: &"vtmi"{\0,\0} &"vtmi"{\0,\0} :=> \x01 | C67: 0.0378061 | D67: 0.0378061 | F67: of:=IF([.C67]=1;"";[.C67]) -> 0.0378061 | G67: of:=IF([.D67]=1;"";[.D67]) -> 0.0378061
A68: 36 | B68: sysfs_streq: &"kcghm"{\0} &"kcgha"{\0} :=> \0 | C68: 0.016913 | D68: 0.017967 | F68: of:=IF([.C68]=1;"";[.C68]) -> 0.016913 | G68: of:=IF([.D68]=1;"";[.D68]) -> 0.017967
A69: 37 | B69: sysfs_streq: &"hcig\n"{\0} &"hcig"{\0,\0} :=> \x01 | C69: 0.0424473 | F69: of:=IF([.C69]=1;"";[.C69]) -> 0.0424473 | G69: of:=IF([.D69]=1;"";[.D69]) ->  
A70: 38 | B70: sysfs_streq: &"bhyf\n"{\0} &"bhyfi"{\0} :=> \0 | C70: 0.0241754 | F70: of:=IF([.C70]=1;"";[.C70]) -> 0.0241754 | G70: of:=IF([.D70]=1;"";[.D70]) ->  
A71: 39 | B71: sysfs_streq: &"qadup"{\0} &"qadup"{\0} :=> \x01 | C71: 0.025044 | D71: 0.025044 | F71: of:=IF([.C71]=1;"";[.C71]) -> 0.025044 | G71: of:=IF([.D71]=1;"";[.D71]) -> 0.025044

Sheet: strcpy
A1: # | B1: Test Case | C1: N1 | D1: N2 | E1: N3 | O1: FINAL
A2: 1 | B2: strcpy: &""{\0,\x01,\x01,\x01,\x01,\x01} &"j"{\0,p,d,c,\0} :=> &"j"{\0,p,t,y,\0} | C2: 1 | D2: 1 | E2: 1 | G2: of:=IF([.C2]=1;"";[.C2]) ->  | H2: of:=IF([.D2]=1;"";[.D2]) ->  | I2: of:=IF([.E2]=1;"";[.E2]) ->  | K2: of:=AVERAGE([.G2:.G36]) -> 0.0757917666666666 | L2: of:=AVERAGE([.H2:.H36]) -> 0.0800096125 | M2: of:=AVERAGE([.I2:.I36]) -> 0.0800096125 | O2: of:=AVERAGE([.K2:.M2]) -> 0.0786036638888889
A3: 2 | B3: strcpy: &""{\0,\x01,\x01,\x01,\x01,\x01} &"wb"{\0,p,u,\0} :=> &"wb"{\0,p,h,\0} | C3: 1 | D3: 0.189777 | E3: 0.189777 | G3: of:=IF([.C3]=1;"";[.C3]) ->  | H3: of:=IF([.D3]=1;"";[.D3]) -> 0.189777 | I3: of:=IF([.E3]=1;"";[.E3]) -> 0.189777
A4: 3 | B4: strcpy: &""{\0,\x01,\x01,\x01,\x01,\x01} &"hvn"{\0,p,\0} :=> &"hvn"{\0,p,\0} | C4: 1 | D4: 0.0628457 | E4: 0.0628457 | G4: of:=IF([.C4]=1;"";[.C4]) ->  | H4: of:=IF([.D4]=1;"";[.D4]) -> 0.0628457 | I4: of:=IF([.E4]=1;"";[.E4]) -> 0.0628457
A5: 4 | B5: strcpy: &""{\0,\x01,\x01,\x01,\x01,\x01} &"iwli"{\0,\0} :=> &"iwli"{\0,\0} | C5: 1 | D5: 0.0414498 | E5: 0.0414498 | G5: of:=IF([.C5]=1;"";[.C5]) ->  | H5: of:=IF([.D5]=1;"";[.D5]) -> 0.0414498 | I5: of:=IF([.E5]=1;"";[.E5]) -> 0.0414498
A6: 5 | B6: strcpy: &""{\0,\x01,\x01,\x01,\x01,\x01} &"pmner"{\0} :=> &"pmner"{\0} | C6: 1 | D6: 0.0285348 | E6: 0.0285348 | G6: of:=IF([.C6]=1;"";[.C6]) ->  | H6: of:=IF([.D6]=1;"";[.D6]) -> 0.0285348 | I6: of:=IF([.E6]=1;"";[.E6]) -> 0.0285348
A7: 6 | B7: strcpy: &"i"{\0,\x01,\x01,\x01,\x01} &""{\0,p,y,m,x,\0} :=> &""{\0,\0,p,s,f,\0} | C7: 1 | D7: 1 | E7: 1 | G7: of:=IF([.C7]=1;"";[.C7]) ->  | H7: of:=IF([.D7]=1;"";[.D7]) ->  | I7: of:=IF([.E7]=1;"";[.E7]) -> 
A8: 7 | B8: strcpy: &"t"{\0,\x01,\x01,\x01,\x01} &"k"{\0,p,u,s,\0} :=> &"k"{\0,p,l,x,\0} | C8: 1 | D8: 1 | E8: 1 | G8: of:=IF([.C8]=1;"";[.C8]) ->  | H8: of:=IF([.D8]=1;"";[.D8]) ->  | I8: of:=IF([.E8]=1;"";[.E8]) -> 
A9: 8 | B9: strcpy: &"s"{\0,\x01,\x01,\x01,\x01} &"vu"{\0,p,w,\0} :=> &"vu"{\0,p,g,\0} | C9: 1 | D9: 0.188875 | E9: 0.188875 | G9: of:=IF([.C9]=1;"";[.C9]) ->  | H9: of:=IF([.D9]=1;"";[.D9]) -> 0.188875 | I9: of:=IF([.E9]=1;"";[.E9]) -> 0.188875
A10: 9 | B10: strcpy: &"h"{\0,\x01,\x01,\x01,\x01} &"nnr"{\0,p,\0} :=> &"nnr"{\0,p,\0} | C10: 1 | D10: 0.079806 | E10: 0.079806 | G10: of:=IF([.C10]=1;"";[.C10]) ->  | H10: of:=IF([.D10]=1;"";[.D10]) -> 0.079806 | I10: of:=IF([.E10]=1;"";[.E10]) -> 0.079806
A11: 10 | B11: strcpy: &"x"{\0,\x01,\x01,\x01,\x01} &"gyfl"{\0,\0} :=> &"gyfl"{\0,\0} | C11: 1 | D11: 0.0396788 | E11: 0.0396788 | G11: of:=IF([.C11]=1;"";[.C11]) ->  | H11: of:=IF([.D11]=1;"";[.D11]) -> 0.0396788 | I11: of:=IF([.E11]=1;"";[.E11]) -> 0.0396788
A12: 11 | B12: strcpy: &"v"{\0,\x01,\x01,\x01,\x01} &"psbtf"{\0} :=> &"psbtf"{\0} | C12: 1 | D12: 0.025784 | E12: 0.025784 | G12: of:=IF([.C12]=1;"";[.C12]) ->  | H12: of:=IF([.D12]=1;"";[.D12]) -> 0.025784 | I12: of:=IF([.E12]=1;"";[.E12]) -> 0.025784
A13: 12 | B13: strcpy: &"tr"{\0,\x01,\x01,\x01} &""{\0,p,i,m,a,\0} :=> &""{\0,r,\0,p,u,\0} | C13: 0.218916 | D13: 1 | E13: 1 | G13: of:=IF([.C13]=1;"";[.C13]) -> 0.218916 | H13: of:=IF([.D13]=1;"";[.D13]) ->  | I13: of:=IF([.E13]=1;"";[.E13]) -> 
A14: 13 | B14: strcpy: &"hj"{\0,\x01,\x01,\x01} &"z"{\0,p,m,t,\0} :=> &"z"{\0,\0,p,y,\0} | C14: 0.160216 | D14: 1 | E14: 1 | G14: of:=IF([.C14]=1;"";[.C14]) -> 0.160216 | H14: of:=IF([.D14]=1;"";[.D14]) ->  | I14: of:=IF([.E14]=1;"";[.E14]) -> 
A15: 14 | B15: strcpy: &"xw"{\0,\x01,\x01,\x01} &"zw"{\0,p,z,\0} :=> &"zw"{\0,p,f,\0} | C15: 0.184161 | D15: 0.176969 | E15: 0.176969 | G15: of:=IF([.C15]=1;"";[.C15]) -> 0.184161 | H15: of:=IF([.D15]=1;"";[.D15]) -> 0.176969 | I15: of:=IF([.E15]=1;"";[.E15]) -> 0.176969
A16: 15 | B16: strcpy: &"nr"{\0,\x01,\x01,\x01} &"zkq"{\0,p,\0} :=> &"zkq"{\0,p,\0} | C16: 0.199296 | D16: 0 | E16: 0 | G16: of:=IF([.C16]=1;"";[.C16]) -> 0.199296 | H16: of:=IF([.D16]=1;"";[.D16]) -> 0 | I16: of:=IF([.E16]=1;"";[.E16]) -> 0
A17: 16 | B17: strcpy: &"an"{\0,\x01,\x01,\x01} &"avdg"{\0,\0} :=> &"avdg"{\0,\0} | C17: 0.225766 | D17: 0.0383784 | E17: 0.0383784 | G17: of:=IF([.C17]=1;"";[.C17]) -> 0.225766 | H17: of:=IF([.D17]=1;"";[.D17]) -> 0.0383784 | I17: of:=IF([.E17]=1;"";[.E17]) -> 0.0383784
A18: 17 | B18: strcpy: &"ms"{\0,\x01,\x01,\x01} &"comer"{\0} :=> &"comer"{\0} | C18: 0.211356 | D18: 0.0322194 | E18: 0.0322194 | G18: of:=IF([.C18]=1;"";[.C18]) -> 0.211356 | H18: of:=IF([.D18]=1;"";[.D18]) -> 0.0322194 | I18: of:=IF([.E18]=1;"";[.E18]) -> 0.0322194
A19: 18 | B19: strcpy: &"hvx"{\0,\x01,\x01} &""{\0,p,h,h,q,\0} :=> &""{\0,v,x,\0,p,\0} | C19: 0 | D19: 1 | E19: 1 | G19: of:=IF([.C19]=1;"";[.C19]) -> 0 | H19: of:=IF([.D19]=1;"";[.D19]) ->  | I19: of:=IF([.E19]=1;"";[.E19]) -> 
A20: 19 | B20: strcpy: &"pjr"{\0,\x01,\x01} &"w"{\0,p,d,p,\0} :=> &"w"{\0,r,\0,p,\0} | C20: 0.047503 | D20: 1 | E20: 1 | G20: of:=IF([.C20]=1;"";[.C20]) -> 0.047503 | H20: of:=IF([.D20]=1;"";[.D20]) ->  | I20: of:=IF([.E20]=1;"";[.E20]) -> 
A21: 20 | B21: strcpy: &"bdv"{\0,\x01,\x01} &"bt"{\0,p,k,\0} :=> &"bt"{\0,\0,p,\0} | C21: 0.0734977 | D21: 0.200124 | E21: 0.200124 | G21: of:=IF([.C21]=1;"";[.C21]) -> 0.0734977 | H21: of:=IF([.D21]=1;"";[.D21]) -> 0.200124 | I21: of:=IF([.E21]=1;"";[.E21]) -> 0.200124
A22: 21 | B22: strcpy: &"tli"{\0,\x01,\x01} &"oaj"{\0,p,\0} :=> &"oaj"{\0,p,\0} | C22: 0.0865406 | D22: 0.0804038 | E22: 0.0804038 | G22: of:=IF([.C22]=1;"";[.C22]) -> 0.0865406 | H22: of:=IF([.D22]=1;"";[.D22]) -> 0.0804038 | I22: of:=IF([.E22]=1;"";[.E22]) -> 0.0804038
A23: 22 | B23: strcpy: &"yha"{\0,\x01,\x01} &"cxzk"{\0,\0} :=> &"cxzk"{\0,\0} | C23: 0.0782526 | D23: 0 | E23: 0 | G23: of:=IF([.C23]=1;"";[.C23]) -> 0.0782526 | H23: of:=IF([.D23]=1;"";[.D23]) -> 0 | I23: of:=IF([.E23]=1;"";[.E23]) -> 0
A24: 23 | B24: strcpy: &"olh"{\0,\x01,\x01} &"kudkv"{\0} :=> &"kudkv"{\0} | C24: 0.0790102 | D24: 0.022612 | E24: 0.022612 | G24: of:=IF([.C24]=1;"";[.C24]) -> 0.0790102 | H24: of:=IF([.D24]=1;"";[.D24]) -> 0.022612 | I24: of:=IF([.E24]=1;"";[.E24]) -> 0.022612
A25: 24 | B25: strcpy: &"wvby"{\0,\x01} &""{\0,p,m,d,y,\0} :=> &""{\0,v,b,y,\0,\0} | C25: 0 | D25: 1 | E25: 1 | G25: of:=IF([.C25]=1;"";[.C25]) -> 0 | H25: of:=IF([.D25]=1;"";[.D25]) ->  | I25: of:=IF([.E25]=1;"";[.E25]) -> 
A26: 25 | B26: strcpy: &"ixeb"{\0,\x01} &"g"{\0,p,i,w,\0} :=> &"g"{\0,e,b,\0,\0} | C26: 0.0426862 | D26: 1 | E26: 1 | G26: of:=IF([.C26]=1;"";[.C26]) -> 0.0426862 | H26: of:=IF([.D26]=1;"";[.D26]) ->  | I26: of:=IF([.E26]=1;"";[.E26]) -> 
A27: 26 | B27: strcpy: &"rtab"{\0,\x01} &"au"{\0,p,v,\0} :=> &"au"{\0,b,\0,\0} | C27: 0.0476473 | D27: 0.213806 | E27: 0.213806 | G27: of:=IF([.C27]=1;"";[.C27]) -> 0.0476473 | H27: of:=IF([.D27]=1;"";[.D27]) -> 0.213806 | I27: of:=IF([.E27]=1;"";[.E27]) -> 0.213806
A28: 27 | B28: strcpy: &"jjnf"{\0,\x01} &"buw"{\0,p,\0} :=> &"buw"{\0,\0,\0} | C28: 0.0284252 | D28: 0.0762358 | E28: 0.0762358 | G28: of:=IF([.C28]=1;"";[.C28]) -> 0.0284252 | H28: of:=IF([.D28]=1;"";[.D28]) -> 0.0762358 | I28: of:=IF([.E28]=1;"";[.E28]) -> 0.0762358
A29: 28 | B29: strcpy: &"gyfa"{\0,\x01} &"ppng"{\0,\0} :=> &"ppng"{\0,\0} | C29: 0.0403081 | D29: 0.0419815 | E29: 0.0419815 | G29: of:=IF([.C29]=1;"";[.C29]) -> 0.0403081 | H29: of:=IF([.D29]=1;"";[.D29]) -> 0.0419815 | I29: of:=IF([.E29]=1;"";[.E29]) -> 0.0419815
A30: 29 | B30: strcpy: &"qfke"{\0,\x01} &"epecd"{\0} :=> &"epecd"{\0} | C30: 0.0258291 | D30: 0.027721 | E30: 0.027721 | G30: of:=IF([.C30]=1;"";[.C30]) -> 0.0258291 | H30: of:=IF([.D30]=1;"";[.D30]) -> 0.027721 | I30: of:=IF([.E30]=1;"";[.E30]) -> 0.027721
A31: 30 | B31: strcpy: &"qmzds"{\0} &""{\0,p,w,z,c,\0} :=> &""{\0,m,z,d,s,\0} | C31: 0 | D31: 1 | E31: 1 | G31: of:=IF([.C31]=1;"";[.C31]) -> 0 | H31: of:=IF([.D31]=1;"";[.D31]) ->  | I31: of:=IF([.E31]=1;"";[.E31]) -> 
A32: 31 | B32: strcpy: &"dbxej"{\0} &"j"{\0,p,u,h,\0} :=> &"j"{\0,x,e,j,\0} | C32: 0 | D32: 1 | E32: 1 | G32: of:=IF([.C32]=1;"";[.C32]) -> 0 | H32: of:=IF([.D32]=1;"";[.D32]) ->  | I32: of:=IF([.E32]=1;"";[.E32]) -> 
A33: 32 | B33: strcpy: &"lauvy"{\0} &"ig"{\0,p,c,\0} :=> &"ig"{\0,v,y,\0} | C33: 0.0269524 | D33: 0.2171 | E33: 0.2171 | G33: of:=IF([.C33]=1;"";[.C33]) -> 0.0269524 | H33: of:=IF([.D33]=1;"";[.D33]) -> 0.2171 | I33: of:=IF([.E33]=1;"";[.E33]) -> 0.2171
A34: 33 | B34: strcpy: &"vraha"{\0} &"kdh"{\0,p,\0} :=> &"kdh"{\0,a,\0} | C34: 0.027485 | D34: 0.0707822 | E34: 0.0707822 | G34: of:=IF([.C34]=1;"";[.C34]) -> 0.027485 | H34: of:=IF([.D34]=1;"";[.D34]) -> 0.0707822 | I34: of:=IF([.E34]=1;"";[.E34]) -> 0.0707822
A35: 34 | B35: strcpy: &"yqyyw"{\0} &"ohbt"{\0,\0} :=> &"ohbt"{\0,\0} | C35: 0 | D35: 0.0404735 | E35: 0.0404735 | G35: of:=IF([.C35]=1;"";[.C35]) -> 0 | H35: of:=IF([.D35]=1;"";[.D35]) -> 0.0404735 | I35: of:=IF([.E35]=1;"";[.E35]) -> 0.0404735
A36: 35 | B36: strcpy: &"gqexe"{\0} &"ysyxe"{\0} :=> &"ysyxe"{\0} | C36: 0.015154 | D36: 0.024673 | E36: 0.024673 | G36: of:=IF([.C36]=1;"";[.C36]) -> 0.015154 | H36: of:=IF([.D36]=1;"";[.D36]) -> 0.024673 | I36: of:=IF([.E36]=1;"";[.E36]) -> 0.024673
A37: 1 | B37: strncpy: &""{\0,\x01,\x01,\x01,\x01,\x01} &""{\0,p,j,b,u,\0} 5 :=> &""{\0,\0,\0,\0,\0,\0} | C37: 1 | D37: 1 | E37: 1 | G37: of:=IF([.C37]=1;"";[.C37]) ->  | H37: of:=IF([.D37]=1;"";[.D37]) ->  | I37: of:=IF([.E37]=1;"";[.E37]) ->  | K37: of:=AVERAGE([.G37:.G72]) -> 0.0722238708333333 | L37: of:=AVERAGE([.H37:.H72]) -> 0.0806918916666667 | M37: of:=AVERAGE([.I37:.I72]) -> 0.0806918916666667 | O37: of:=AVERAGE([.K37:.M37]) -> 0.0778692180555556
A38: 2 | B38: strncpy: &""{\0,\x01,\x01,\x01,\x01,\x01} &"v"{\0,p,a,j,\0} 5 :=> &"v"{\0,\0,\0,\0,\0} | C38: 1 | D38: 1 | E38: 1 | G38: of:=IF([.C38]=1;"";[.C38]) ->  | H38: of:=IF([.D38]=1;"";[.D38]) ->  | I38: of:=IF([.E38]=1;"";[.E38]) -> 
A39: 3 | B39: strncpy: &""{\0,\x01,\x01,\x01,\x01,\x01} &"pl"{\0,p,q,\0} 5 :=> &"pl"{\0,\0,\0,\0} | C39: 1 | D39: 0.2171 | E39: 0.2171 | G39: of:=IF([.C39]=1;"";[.C39]) ->  | H39: of:=IF([.D39]=1;"";[.D39]) -> 0.2171 | I39: of:=IF([.E39]=1;"";[.E39]) -> 0.2171
A40: 4 | B40: strncpy: &""{\0,\x01,\x01,\x01,\x01,\x01} &"zrq"{\0,p,\0} 5 :=> &"zrq"{\0,\0,\0} | C40: 1 | D40: 0.0635972 | E40: 0.0635972 | G40: of:=IF([.C40]=1;"";[.C40]) ->  | H40: of:=IF([.D40]=1;"";[.D40]) -> 0.0635972 | I40: of:=IF([.E40]=1;"";[.E40]) -> 0.0635972
A41: 5 | B41: strncpy: &""{\0,\x01,\x01,\x01,\x01,\x01} &"alkn"{\0,\0} 5 :=> &"alkn"{\0,\0} | C41: 1 | D41: 0.0448798 | E41: 0.0448798 | G41: of:=IF([.C41]=1;"";[.C41]) ->  | H41: of:=IF([.D41]=1;"";[.D41]) -> 0.0448798 | I41: of:=IF([.E41]=1;"";[.E41]) -> 0.0448798
A42: 6 | B42: strncpy: &""{\0,\x01,\x01,\x01,\x01,\x01} &"lytiy"{\0} 5 :=> &"lytiy"{\0} | C42: 1 | D42: 0.0274991 | E42: 0.0274991 | G42: of:=IF([.C42]=1;"";[.C42]) ->  | H42: of:=IF([.D42]=1;"";[.D42]) -> 0.0274991 | I42: of:=IF([.E42]=1;"";[.E42]) -> 0.0274991
A43: 7 | B43: strncpy: &"n"{\0,\x01,\x01,\x01,\x01} &""{\0,p,f,l,d,\0} 5 :=> &""{\0,\0,\0,\0,\0,\0} | C43: 1 | D43: 1 | E43: 1 | G43: of:=IF([.C43]=1;"";[.C43]) ->  | H43: of:=IF([.D43]=1;"";[.D43]) ->  | I43: of:=IF([.E43]=1;"";[.E43]) -> 
A44: 8 | B44: strncpy: &"k"{\0,\x01,\x01,\x01,\x01} &"t"{\0,p,i,c,\0} 5 :=> &"t"{\0,\0,\0,\0,\0} | C44: 1 | D44: 1 | E44: 1 | G44: of:=IF([.C44]=1;"";[.C44]) ->  | H44: of:=IF([.D44]=1;"";[.D44]) ->  | I44: of:=IF([.E44]=1;"";[.E44]) -> 
A45: 9 | B45: strncpy: &"b"{\0,\x01,\x01,\x01,\x01} &"zz"{\0,p,n,\0} 5 :=> &"zz"{\0,\0,\0,\0} | C45: 1 | D45: 0.19761 | E45: 0.19761 | G45: of:=IF([.C45]=1;"";[.C45]) ->  | H45: of:=IF([.D45]=1;"";[.D45]) -> 0.19761 | I45: of:=IF([.E45]=1;"";[.E45]) -> 0.19761
A46: 10 | B46: strncpy: &"r"{\0,\x01,\x01,\x01,\x01} &"sni"{\0,p,\0} 5 :=> &"sni"{\0,\0,\0} | C46: 1 | D46: 0.0829902 | E46: 0.0829902 | G46: of:=IF([.C46]=1;"";[.C46]) ->  | H46: of:=IF([.D46]=1;"";[.D46]) -> 0.0829902 | I46: of:=IF([.E46]=1;"";[.E46]) -> 0.0829902
A47: 11 | B47: strncpy: &"m"{\0,\x01,\x01,\x01,\x01} &"mlls"{\0,\0} 5 :=> &"mlls"{\0,\0} | C47: 1 | D47: 0.0436361 | E47: 0.0436361 | G47: of:=IF([.C47]=1;"";[.C47]) ->  | H47: of:=IF([.D47]=1;"";[.D47]) -> 0.0436361 | I47: of:=IF([.E47]=1;"";[.E47]) -> 0.0436361
A48: 12 | B48: strncpy: &"a"{\0,\x01,\x01,\x01,\x01} &"qekgh"{\0} 5 :=> &"qekgh"{\0} | C48: 1 | D48: 0.0181224 | E48: 0.0181224 | G48: of:=IF([.C48]=1;"";[.C48]) ->  | H48: of:=IF([.D48]=1;"";[.D48]) -> 0.0181224 | I48: of:=IF([.E48]=1;"";[.E48]) -> 0.0181224
A49: 13 | B49: strncpy: &"hh"{\0,\x01,\x01,\x01} &""{\0,p,j,m,w,\0} 5 :=> &""{\0,\0,\0,\0,\0,\0} | C49: 0.18491 | D49: 1 | E49: 1 | G49: of:=IF([.C49]=1;"";[.C49]) -> 0.18491 | H49: of:=IF([.D49]=1;"";[.D49]) ->  | I49: of:=IF([.E49]=1;"";[.E49]) -> 
A50: 14 | B50: strncpy: &"ff"{\0,\x01,\x01,\x01} &"h"{\0,p,u,j,\0} 5 :=> &"h"{\0,\0,\0,\0,\0} | C50: 0.214762 | D50: 1 | E50: 1 | G50: of:=IF([.C50]=1;"";[.C50]) -> 0.214762 | H50: of:=IF([.D50]=1;"";[.D50]) ->  | I50: of:=IF([.E50]=1;"";[.E50]) -> 
A51: 15 | B51: strncpy: &"uj"{\0,\x01,\x01,\x01} &"vk"{\0,p,k,\0} 5 :=> &"vk"{\0,\0,\0,\0} | C51: 0.183174 | D51: 0.156421 | E51: 0.156421 | G51: of:=IF([.C51]=1;"";[.C51]) -> 0.183174 | H51: of:=IF([.D51]=1;"";[.D51]) -> 0.156421 | I51: of:=IF([.E51]=1;"";[.E51]) -> 0.156421
A52: 16 | B52: strncpy: &"ub"{\0,\x01,\x01,\x01} &"wqs"{\0,p,\0} 5 :=> &"wqs"{\0,\0,\0} | C52: 0.212346 | D52: 0.0376866 | E52: 0.0376866 | G52: of:=IF([.C52]=1;"";[.C52]) -> 0.212346 | H52: of:=IF([.D52]=1;"";[.D52]) -> 0.0376866 | I52: of:=IF([.E52]=1;"";[.E52]) -> 0.0376866
A53: 17 | B53: strncpy: &"jv"{\0,\x01,\x01,\x01} &"ftpz"{\0,\0} 5 :=> &"ftpz"{\0,\0} | C53: 0.106758 | D53: 0.0351651 | E53: 0.0351651 | G53: of:=IF([.C53]=1;"";[.C53]) -> 0.106758 | H53: of:=IF([.D53]=1;"";[.D53]) -> 0.0351651 | I53: of:=IF([.E53]=1;"";[.E53]) -> 0.0351651
A54: 18 | B54: strncpy: &"qf"{\0,\x01,\x01,\x01} &"uixsz"{\0} 5 :=> &"uixsz"{\0} | C54: 0.106758 | D54: 0.0230036 | E54: 0.0230036 | G54: of:=IF([.C54]=1;"";[.C54]) -> 0.106758 | H54: of:=IF([.D54]=1;"";[.D54]) -> 0.0230036 | I54: of:=IF([.E54]=1;"";[.E54]) -> 0.0230036
A55: 19 | B55: strncpy: &"jsz"{\0,\x01,\x01} &""{\0,p,y,b,c,\0} 5 :=> &""{\0,\0,\0,\0,\0,\0} | C55: 0.0546313 | D55: 1 | E55: 1 | G55: of:=IF([.C55]=1;"";[.C55]) -> 0.0546313 | H55: of:=IF([.D55]=1;"";[.D55]) ->  | I55: of:=IF([.E55]=1;"";[.E55]) -> 
A56: 20 | B56: strncpy: &"ggs"{\0,\x01,\x01} &"y"{\0,p,p,f,\0} 5 :=> &"y"{\0,\0,\0,\0,\0} | C56: 0.081031 | D56: 1 | E56: 1 | G56: of:=IF([.C56]=1;"";[.C56]) -> 0.081031 | H56: of:=IF([.D56]=1;"";[.D56]) ->  | I56: of:=IF([.E56]=1;"";[.E56]) -> 
A57: 21 | B57: strncpy: &"vtw"{\0,\x01,\x01} &"vo"{\0,p,v,\0} 5 :=> &"vo"{\0,\0,\0,\0} | C57: 0.0672998 | D57: 0.210352 | E57: 0.210352 | G57: of:=IF([.C57]=1;"";[.C57]) -> 0.0672998 | H57: of:=IF([.D57]=1;"";[.D57]) -> 0.210352 | I57: of:=IF([.E57]=1;"";[.E57]) -> 0.210352
A58: 22 | B58: strncpy: &"bcl"{\0,\x01,\x01} &"bvl"{\0,p,\0} 5 :=> &"bvl"{\0,\0,\0} | C58: 0.076292 | D58: 0.0663591 | E58: 0.0663591 | G58: of:=IF([.C58]=1;"";[.C58]) -> 0.076292 | H58: of:=IF([.D58]=1;"";[.D58]) -> 0.0663591 | I58: of:=IF([.E58]=1;"";[.E58]) -> 0.0663591
A59: 23 | B59: strncpy: &"aco"{\0,\x01,\x01} &"ihud"{\0,\0} 5 :=> &"ihud"{\0,\0} | C59: 0.0888414 | D59: 0.0411444 | E59: 0.0411444 | G59: of:=IF([.C59]=1;"";[.C59]) -> 0.0888414 | H59: of:=IF([.D59]=1;"";[.D59]) -> 0.0411444 | I59: of:=IF([.E59]=1;"";[.E59]) -> 0.0411444
A60: 24 | B60: strncpy: &"wvb"{\0,\x01,\x01} &"rtddl"{\0} 5 :=> &"rtddl"{\0} | C60: 0 | D60: 0.027215 | E60: 0.027215 | G60: of:=IF([.C60]=1;"";[.C60]) -> 0 | H60: of:=IF([.D60]=1;"";[.D60]) -> 0.027215 | I60: of:=IF([.E60]=1;"";[.E60]) -> 0.027215
A61: 25 | B61: strncpy: &"dinp"{\0,\x01} &""{\0,p,m,f,j,\0} 5 :=> &""{\0,\0,\0,\0,\0,\0} | C61: 0.0456391 | D61: 1 | E61: 1 | G61: of:=IF([.C61]=1;"";[.C61]) -> 0.0456391 | H61: of:=IF([.D61]=1;"";[.D61]) ->  | I61: of:=IF([.E61]=1;"";[.E61]) -> 
A62: 26 | B62: strncpy: &"lpis"{\0,\x01} &"a"{\0,p,g,w,\0} 5 :=> &"a"{\0,\0,\0,\0,\0} | C62: 0.0457202 | D62: 1 | E62: 1 | G62: of:=IF([.C62]=1;"";[.C62]) -> 0.0457202 | H62: of:=IF([.D62]=1;"";[.D62]) ->  | I62: of:=IF([.E62]=1;"";[.E62]) -> 
A63: 27 | B63: strncpy: &"zkbv"{\0,\x01} &"ia"{\0,p,o,\0} 5 :=> &"ia"{\0,\0,\0,\0} | C63: 0.0345029 | D63: 0.217558 | E63: 0.217558 | G63: of:=IF([.C63]=1;"";[.C63]) -> 0.0345029 | H63: of:=IF([.D63]=1;"";[.D63]) -> 0.217558 | I63: of:=IF([.E63]=1;"";[.E63]) -> 0.217558
A64: 28 | B64: strncpy: &"eabh"{\0,\x01} &"pyg"{\0,p,\0} 5 :=> &"pyg"{\0,\0,\0} | C64: 0.0416693 | D64: 0.0725901 | E64: 0.0725901 | G64: of:=IF([.C64]=1;"";[.C64]) -> 0.0416693 | H64: of:=IF([.D64]=1;"";[.D64]) -> 0.0725901 | I64: of:=IF([.E64]=1;"";[.E64]) -> 0.0725901
A65: 29 | B65: strncpy: &"iyyf"{\0,\x01} &"wnxa"{\0,\0} 5 :=> &"wnxa"{\0,\0} | C65: 0.0314745 | D65: 0.0412273 | E65: 0.0412273 | G65: of:=IF([.C65]=1;"";[.C65]) -> 0.0314745 | H65: of:=IF([.D65]=1;"";[.D65]) -> 0.0412273 | I65: of:=IF([.E65]=1;"";[.E65]) -> 0.0412273
A66: 30 | B66: strncpy: &"zpuj"{\0,\x01} &"qnzuf"{\0} 5 :=> &"qnzuf"{\0} | C66: 0.0359696 | D66: 0 | E66: 0 | G66: of:=IF([.C66]=1;"";[.C66]) -> 0.0359696 | H66: of:=IF([.D66]=1;"";[.D66]) -> 0 | I66: of:=IF([.E66]=1;"";[.E66]) -> 0
A67: 31 | B67: strncpy: &"cjwke"{\0} &""{\0,p,a,a,j,\0} 5 :=> &""{\0,\0,\0,\0,\0,\0} | C67: 0 | D67: 1 | E67: 1 | G67: of:=IF([.C67]=1;"";[.C67]) -> 0 | H67: of:=IF([.D67]=1;"";[.D67]) ->  | I67: of:=IF([.E67]=1;"";[.E67]) -> 
A68: 32 | B68: strncpy: &"hizbw"{\0} &"w"{\0,p,o,r,\0} 5 :=> &"w"{\0,\0,\0,\0,\0} | C68: 0.0250648 | D68: 1 | E68: 1 | G68: of:=IF([.C68]=1;"";[.C68]) -> 0.0250648 | H68: of:=IF([.D68]=1;"";[.D68]) ->  | I68: of:=IF([.E68]=1;"";[.E68]) -> 
A69: 33 | B69: strncpy: &"kvssa"{\0} &"ux"{\0,p,d,\0} 5 :=> &"ux"{\0,\0,\0,\0} | C69: 0.0252047 | D69: 0.194231 | E69: 0.194231 | G69: of:=IF([.C69]=1;"";[.C69]) -> 0.0252047 | H69: of:=IF([.D69]=1;"";[.D69]) -> 0.194231 | I69: of:=IF([.E69]=1;"";[.E69]) -> 0.194231
A70: 34 | B70: strncpy: &"hfpix"{\0} &"iqa"{\0,p,\0} 5 :=> &"iqa"{\0,\0,\0} | C70: 0.0223086 | D70: 0.0624013 | E70: 0.0624013 | G70: of:=IF([.C70]=1;"";[.C70]) -> 0.0223086 | H70: of:=IF([.D70]=1;"";[.D70]) -> 0.0624013 | I70: of:=IF([.E70]=1;"";[.E70]) -> 0.0624013
A71: 35 | B71: strncpy: &"pntws"{\0} &"bzrz"{\0,\0} 5 :=> &"bzrz"{\0,\0} | C71: 0.0267007 | D71: 0.028996 | E71: 0.028996 | G71: of:=IF([.C71]=1;"";[.C71]) -> 0.0267007 | H71: of:=IF([.D71]=1;"";[.D71]) -> 0.028996 | I71: of:=IF([.E71]=1;"";[.E71]) -> 0.028996
A72: 36 | B72: strncpy: &"wsgmk"{\0} &"dnsuj"{\0} 5 :=> &"dnsuj"{\0} | C72: 0.022315 | D72: 0.0268201 | E72: 0.0268201 | G72: of:=IF([.C72]=1;"";[.C72]) -> 0.022315 | H72: of:=IF([.D72]=1;"";[.D72]) -> 0.0268201 | I72: of:=IF([.E72]=1;"";[.E72]) -> 0.0268201

Sheet: strcat
A1: # | B1: Test Case | C1: N1 | D1: N2 | E1: N3
A2: 1 | B2: strcat: &""{\0,\x01,\x01,\x01,\x01,\x01,\x01,\x01,\x01,\x01} &"a"{\0,p,x,\0} :=> &"a"{\0,p,z,i,e,t,b,b,\0} | C2: 1 | D2: 1 | E2: 1 | G2: of:=IF([.C2]=1;"";[.C2]) ->  | H2: of:=IF([.D2]=1;"";[.D2]) ->  | I2: of:=IF([.E2]=1;"";[.E2]) ->  | K2: of:=AVERAGE([.G2:.G41]) -> 0.051332035483871 | L2: of:=AVERAGE([.H2:.H41]) -> 0.105573045454545 | M2: of:=AVERAGE([.I2:.I41]) -> 0.0364319964864865 | O2: of:=AVERAGE([.K2:.M2]) -> 0.0644456924749676
A3: 2 | B3: strcat: &""{\0,\x01,\x01,\x01,\x01,\x01,\x01,\x01,\x01,\x01} &"pl"{\0,p,\0} :=> &"pl"{\0,p,w,c,o,o,v,\0} | C3: 1 | D3: 0.2171 | E3: 0.2171 | G3: of:=IF([.C3]=1;"";[.C3]) ->  | H3: of:=IF([.D3]=1;"";[.D3]) -> 0.2171 | I3: of:=IF([.E3]=1;"";[.E3]) -> 0.2171
A4: 3 | B4: strcat: &""{\0,\x01,\x01,\x01,\x01,\x01,\x01,\x01,\x01,\x01} &"kcb"{\0,\0} :=> &"kcb"{\0,p,z,f,s,y,\0} | C4: 1 | D4: 0.0580277 | E4: 0.0580277 | G4: of:=IF([.C4]=1;"";[.C4]) ->  | H4: of:=IF([.D4]=1;"";[.D4]) -> 0.0580277 | I4: of:=IF([.E4]=1;"";[.E4]) -> 0.0580277
A5: 4 | B5: strcat: &""{\0,\x01,\x01,\x01,\x01,\x01,\x01,\x01,\x01,\x01} &"bvvj"{\0} :=> &"bvvj"{\0,p,p,i,s,\0} | C5: 1 | D5: 0.023148 | E5: 0.023148 | H5: of:=IF([.D5]=1;"";[.D5]) -> 0.023148 | I5: of:=IF([.E5]=1;"";[.E5]) -> 0.023148
A6: 5 | B6: strcat: &"b"{\0,\x01,\x01,\x01,\x01,\x01,\x01,\x01,\x01} &""{\0,p,v,d,\0} :=> &"b"{\0,p,n,n,q,x,f,z,\0} | C6: 1 | D6: 1 | E6: 1 | G6: of:=IF([.C6]=1;"";[.C6]) ->  | H6: of:=IF([.D6]=1;"";[.D6]) ->  | I6: of:=IF([.E6]=1;"";[.E6]) -> 
A7: 6 | B7: strcat: &"z"{\0,\x01,\x01,\x01,\x01,\x01,\x01,\x01,\x01} &"m"{\0,p,b,\0} :=> &"zm"{\0,p,k,e,i,c,q,\0} | C7: 1 | D7: 1 | E7: 0.183327 | G7: of:=IF([.C7]=1;"";[.C7]) ->  | H7: of:=IF([.D7]=1;"";[.D7]) ->  | I7: of:=IF([.E7]=1;"";[.E7]) -> 0.183327
A8: 7 | B8: strcat: &"y"{\0,\x01,\x01,\x01,\x01,\x01,\x01,\x01,\x01} &"bs"{\0,p,\0} :=> &"ybs"{\0,p,j,z,e,a,\0} | C8: 1 | D8: 0.209333 | E8: 0.0784505 | G8: of:=IF([.C8]=1;"";[.C8]) ->  | H8: of:=IF([.D8]=1;"";[.D8]) -> 0.209333 | I8: of:=IF([.E8]=1;"";[.E8]) -> 0.0784505
A9: 8 | B9: strcat: &"r"{\0,\x01,\x01,\x01,\x01,\x01,\x01,\x01,\x01} &"krr"{\0,\0} :=> &"rkrr"{\0,p,q,s,w,\0} | C9: 1 | D9: 0.0792923 | E9: 0.0434479 | G9: of:=IF([.C9]=1;"";[.C9]) ->  | H9: of:=IF([.D9]=1;"";[.D9]) -> 0.0792923 | I9: of:=IF([.E9]=1;"";[.E9]) -> 0.0434479
A10: 9 | B10: strcat: &"c"{\0,\x01,\x01,\x01,\x01,\x01,\x01,\x01,\x01} &"vvnw"{\0} :=> &"cvvnw"{\0,p,l,v,\0} | C10: 1 | D10: 0.0334536 | E10: 0.0175587 | G10: of:=IF([.C10]=1;"";[.C10]) ->  | H10: of:=IF([.D10]=1;"";[.D10]) -> 0.0334536 | I10: of:=IF([.E10]=1;"";[.E10]) -> 0.0175587
A11: 10 | B11: strcat: &"ya"{\0,\x01,\x01,\x01,\x01,\x01,\x01,\x01} &""{\0,p,g,w,\0} :=> &"ya"{\0,p,r,f,a,p,j,\0} | C11: 0.20378 | D11: 1 | E11: 0.20378 | G11: of:=IF([.C11]=1;"";[.C11]) -> 0.20378 | H11: of:=IF([.D11]=1;"";[.D11]) ->  | I11: of:=IF([.E11]=1;"";[.E11]) -> 0.20378
A12: 11 | B12: strcat: &"sd"{\0,\x01,\x01,\x01,\x01,\x01,\x01,\x01} &"n"{\0,p,q,\0} :=> &"sdn"{\0,p,f,x,f,f,\0} | C12: 0.203446 | D12: 1 | E12: 0.078359 | G12: of:=IF([.C12]=1;"";[.C12]) -> 0.203446 | H12: of:=IF([.D12]=1;"";[.D12]) ->  | I12: of:=IF([.E12]=1;"";[.E12]) -> 0.078359
A13: 12 | B13: strcat: &"ag"{\0,\x01,\x01,\x01,\x01,\x01,\x01,\x01} &"st"{\0,p,\0} :=> &"agst"{\0,p,z,v,j,\0} | C13: 0.216174 | D13: 0.223271 | E13: 0.0468118 | G13: of:=IF([.C13]=1;"";[.C13]) -> 0.216174 | H13: of:=IF([.D13]=1;"";[.D13]) -> 0.223271 | I13: of:=IF([.E13]=1;"";[.E13]) -> 0.0468118
A14: 13 | B14: strcat: &"ey"{\0,\x01,\x01,\x01,\x01,\x01,\x01,\x01} &"lte"{\0,\0} :=> &"eylte"{\0,p,f,c,\0} | C14: 0.215236 | D14: 0.08753 | E14: 0.0293649 | G14: of:=IF([.C14]=1;"";[.C14]) -> 0.215236 | H14: of:=IF([.D14]=1;"";[.D14]) -> 0.08753 | I14: of:=IF([.E14]=1;"";[.E14]) -> 0.0293649
A15: 14 | B15: strcat: &"qn"{\0,\x01,\x01,\x01,\x01,\x01,\x01,\x01} &"izlg"{\0} :=> &"qnizlg"{\0,p,u,\0} | C15: 0 | D15: 0.0394338 | E15: 0 | G15: of:=IF([.C15]=1;"";[.C15]) -> 0 | H15: of:=IF([.D15]=1;"";[.D15]) -> 0.0394338 | I15: of:=IF([.E15]=1;"";[.E15]) -> 0
A16: 15 | B16: strcat: &"gfd"{\0,\x01,\x01,\x01,\x01,\x01,\x01} &""{\0,p,x,v,\0} :=> &"gfd"{\0,p,o,j,i,y,\0} | C16: 0.0598678 | D16: 1 | E16: 0.0598678 | G16: of:=IF([.C16]=1;"";[.C16]) -> 0.0598678 | H16: of:=IF([.D16]=1;"";[.D16]) ->  | I16: of:=IF([.E16]=1;"";[.E16]) -> 0.0598678
A17: 16 | B17: strcat: &"nmj"{\0,\x01,\x01,\x01,\x01,\x01,\x01} &"e"{\0,p,e,\0} :=> &"nmje"{\0,p,x,d,l,\0} | C17: 0.0658454 | D17: 1 | E17: 0.0360308 | G17: of:=IF([.C17]=1;"";[.C17]) -> 0.0658454 | H17: of:=IF([.D17]=1;"";[.D17]) ->  | I17: of:=IF([.E17]=1;"";[.E17]) -> 0.0360308
A18: 17 | B18: strcat: &"yzb"{\0,\x01,\x01,\x01,\x01,\x01,\x01} &"ou"{\0,p,\0} :=> &"yzbou"{\0,p,y,x,\0} | C18: 0.0671215 | D18: 0.221991 | E18: 0.0255783 | G18: of:=IF([.C18]=1;"";[.C18]) -> 0.0671215 | H18: of:=IF([.D18]=1;"";[.D18]) -> 0.221991 | I18: of:=IF([.E18]=1;"";[.E18]) -> 0.0255783
A19: 18 | B19: strcat: &"dtu"{\0,\x01,\x01,\x01,\x01,\x01,\x01} &"pyu"{\0,\0} :=> &"dtupyu"{\0,p,z,\0} | C19: 0.0783334 | D19: 0.0731093 | E19: 0.0183737 | G19: of:=IF([.C19]=1;"";[.C19]) -> 0.0783334 | H19: of:=IF([.D19]=1;"";[.D19]) -> 0.0731093 | I19: of:=IF([.E19]=1;"";[.E19]) -> 0.0183737
A20: 19 | B20: strcat: &"ocz"{\0,\x01,\x01,\x01,\x01,\x01,\x01} &"hvya"{\0} :=> &"oczhvya"{\0,p,\0} | C20: 0.0745984 | D20: 0.0370042 | E20: 0.0124249 | G20: of:=IF([.C20]=1;"";[.C20]) -> 0.0745984 | H20: of:=IF([.D20]=1;"";[.D20]) -> 0.0370042 | I20: of:=IF([.E20]=1;"";[.E20]) -> 0.0124249
A21: 20 | B21: strcat: &"eqqm"{\0,\x01,\x01,\x01,\x01,\x01} &""{\0,p,h,z,\0} :=> &"eqqm"{\0,p,g,m,i,\0} | C21: 0 | D21: 1 | E21: 0 | G21: of:=IF([.C21]=1;"";[.C21]) -> 0 | H21: of:=IF([.D21]=1;"";[.D21]) ->  | I21: of:=IF([.E21]=1;"";[.E21]) -> 0
A22: 21 | B22: strcat: &"zzmj"{\0,\x01,\x01,\x01,\x01,\x01} &"c"{\0,p,t,\0} :=> &"zzmjc"{\0,p,g,o,\0} | C22: 0.0323885 | D22: 1 | E22: 0.0185133 | G22: of:=IF([.C22]=1;"";[.C22]) -> 0.0323885 | H22: of:=IF([.D22]=1;"";[.D22]) ->  | I22: of:=IF([.E22]=1;"";[.E22]) -> 0.0185133
A23: 22 | B23: strcat: &"xgux"{\0,\x01,\x01,\x01,\x01,\x01} &"on"{\0,p,\0} :=> &"xguxon"{\0,p,n,\0} | C23: 0.0289454 | D23: 0.224943 | E23: 0.0146464 | G23: of:=IF([.C23]=1;"";[.C23]) -> 0.0289454 | H23: of:=IF([.D23]=1;"";[.D23]) -> 0.224943 | I23: of:=IF([.E23]=1;"";[.E23]) -> 0.0146464
A24: 23 | B24: strcat: &"zcet"{\0,\x01,\x01,\x01,\x01,\x01} &"pcd"{\0,\0} :=> &"zcetpcd"{\0,p,\0} | C24: 0.0395821 | D24: 0.0651281 | E24: 0.0122515 | G24: of:=IF([.C24]=1;"";[.C24]) -> 0.0395821 | H24: of:=IF([.D24]=1;"";[.D24]) -> 0.0651281 | I24: of:=IF([.E24]=1;"";[.E24]) -> 0.0122515
A25: 24 | B25: strcat: &"zggz"{\0,\x01,\x01,\x01,\x01,\x01} &"qvcc"{\0} :=> &"zggzqvcc"{\0,\0} | C25: 0.0324245 | D25: 0.0301521 | E25: 0.00743503 | G25: of:=IF([.C25]=1;"";[.C25]) -> 0.0324245 | H25: of:=IF([.D25]=1;"";[.D25]) -> 0.0301521 | I25: of:=IF([.E25]=1;"";[.E25]) -> 0.00743503
A26: 25 | B26: strcat: &"aalau"{\0,\x01,\x01,\x01,\x01} &""{\0,p,l,v,\0} :=> &"aalau"{\0,p,o,o,\0} | C26: 0.0289028 | D26: 1 | E26: 0.0289028 | G26: of:=IF([.C26]=1;"";[.C26]) -> 0.0289028 | H26: of:=IF([.D26]=1;"";[.D26]) ->  | I26: of:=IF([.E26]=1;"";[.E26]) -> 0.0289028
A27: 26 | B27: strcat: &"ssphe"{\0,\x01,\x01,\x01,\x01} &"w"{\0,p,i,\0} :=> &"ssphew"{\0,p,s,\0} | C27: 0.0306469 | D27: 1 | E27: 0.0220049 | G27: of:=IF([.C27]=1;"";[.C27]) -> 0.0306469 | H27: of:=IF([.D27]=1;"";[.D27]) ->  | I27: of:=IF([.E27]=1;"";[.E27]) -> 0.0220049
A28: 27 | B28: strcat: &"lfeel"{\0,\x01,\x01,\x01,\x01} &"tl"{\0,p,\0} :=> &"lfeeltl"{\0,p,\0} | C28: 0.0299965 | D28: 0.211853 | E28: 0.0164935 | G28: of:=IF([.C28]=1;"";[.C28]) -> 0.0299965 | H28: of:=IF([.D28]=1;"";[.D28]) -> 0.211853 | I28: of:=IF([.E28]=1;"";[.E28]) -> 0.0164935
A29: 28 | B29: strcat: &"rbfrn"{\0,\x01,\x01,\x01,\x01} &"jfy"{\0,\0} :=> &"rbfrnjfy"{\0,\0} | C29: 0.0250322 | D29: 0.0570249 | E29: 0.00948168 | G29: of:=IF([.C29]=1;"";[.C29]) -> 0.0250322 | H29: of:=IF([.D29]=1;"";[.D29]) -> 0.0570249 | I29: of:=IF([.E29]=1;"";[.E29]) -> 0.00948168
A30: 29 | B30: strcat: &"tcazj"{\0,\x01,\x01,\x01,\x01} &"avwa"{\0} :=> &"tcazjavwa"{\0} | C30: 0.0192319 | D30: 0 | E30: 0 | G30: of:=IF([.C30]=1;"";[.C30]) -> 0.0192319 | H30: of:=IF([.D30]=1;"";[.D30]) -> 0 | I30: of:=IF([.E30]=1;"";[.E30]) -> 0
A31: 30 | B31: strcat: &"vagbiz"{\0,\x01,\x01,\x01} &""{\0,p,p,u,\0} :=> &"vagbiz"{\0,p,p,\0} | C31: 0.0190922 | D31: 1 | E31: 0.0190922 | G31: of:=IF([.C31]=1;"";[.C31]) -> 0.0190922 | H31: of:=IF([.D31]=1;"";[.D31]) ->  | I31: of:=IF([.E31]=1;"";[.E31]) -> 0.0190922
A32: 31 | B32: strcat: &"uiroyz"{\0,\x01,\x01,\x01} &"h"{\0,p,j,\0} :=> &"uiroyzh"{\0,p,\0} | C32: 0.0199543 | D32: 1 | E32: 0.0145872 | G32: of:=IF([.C32]=1;"";[.C32]) -> 0.0199543 | H32: of:=IF([.D32]=1;"";[.D32]) ->  | I32: of:=IF([.E32]=1;"";[.E32]) -> 0.0145872
A33: 32 | B33: strcat: &"ektjny"{\0,\x01,\x01,\x01} &"sa"{\0,p,\0} :=> &"ektjnysa"{\0,\0} | C33: 0.0149948 | D33: 0.218466 | E33: 0.0101606 | G33: of:=IF([.C33]=1;"";[.C33]) -> 0.0149948 | H33: of:=IF([.D33]=1;"";[.D33]) -> 0.218466 | I33: of:=IF([.E33]=1;"";[.E33]) -> 0.0101606
A34: 33 | B34: strcat: &"rrlzap"{\0,\x01,\x01,\x01} &"rqp"{\0,\0} :=> &"rrlzaprqp"{\0} | C34: 0.0192473 | D34: 0 | E34: 0 | G34: of:=IF([.C34]=1;"";[.C34]) -> 0.0192473 | H34: of:=IF([.D34]=1;"";[.D34]) -> 0 | I34: of:=IF([.E34]=1;"";[.E34]) -> 0
A35: 34 | B35: strcat: &"uuplss"{\0,\x01,\x01,\x01} &&10 :=> &"uuplsszsqz"{} | C35: 0.0197714 | D35: 0 | G35: of:=IF([.C35]=1;"";[.C35]) -> 0.0197714 | H35: of:=IF([.D35]=1;"";[.D35]) -> 0 | I35: of:=IF([.E35]=1;"";[.E35]) ->  
A36: 35 | B36: strcat: &"njbenlx"{\0,\x01,\x01} &""{\0,p,e,e,\0} :=> &"njbenlx"{\0,p,\0} | C36: 0.0114697 | D36: 1 | E36: 0.0114697 | G36: of:=IF([.C36]=1;"";[.C36]) -> 0.0114697 | H36: of:=IF([.D36]=1;"";[.D36]) ->  | I36: of:=IF([.E36]=1;"";[.E36]) -> 0.0114697
A37: 36 | B37: strcat: &"fktwjwh"{\0,\x01,\x01} &"j"{\0,p,j,\0} :=> &"fktwjwhj"{\0,\0} | C37: 0 | D37: 1 | E37: 0 | G37: of:=IF([.C37]=1;"";[.C37]) -> 0 | H37: of:=IF([.D37]=1;"";[.D37]) ->  | I37: of:=IF([.E37]=1;"";[.E37]) -> 0
A38: 37 | B38: strcat: &"yrmugzo"{\0,\x01,\x01} &"va"{\0,p,\0} :=> &"yrmugzova"{\0} | C38: 0.0135946 | D38: 0.212346 | E38: 0.00967856 | G38: of:=IF([.C38]=1;"";[.C38]) -> 0.0135946 | H38: of:=IF([.D38]=1;"";[.D38]) -> 0.212346 | I38: of:=IF([.E38]=1;"";[.E38]) -> 0.00967856
A39: 38 | B39: strcat: &"gmcceawo"{\0,\x01} &""{\0,p,c,y,\0} :=> &"gmcceawo"{\0,\0} | C39: 0.012274 | D39: 1 | E39: 0.012274 | G39: of:=IF([.C39]=1;"";[.C39]) -> 0.012274 | H39: of:=IF([.D39]=1;"";[.D39]) ->  | I39: of:=IF([.E39]=1;"";[.E39]) -> 0.012274
A40: 39 | B40: strcat: &"iqmtolan"{\0,\x01} &"v"{\0,p,g,\0} :=> &"iqmtolanv"{\0} | C40: 0 | D40: 1 | E40: 0 | G40: of:=IF([.C40]=1;"";[.C40]) -> 0 | H40: of:=IF([.D40]=1;"";[.D40]) ->  | I40: of:=IF([.E40]=1;"";[.E40]) -> 0
A41: 40 | B41: strcat: &"jnauucyly"{\0} &""{\0,p,g,j,\0} :=> &"jnauucyly"{\0} | C41: 0.0093415 | D41: 1 | E41: 0.0093415 | G41: of:=IF([.C41]=1;"";[.C41]) -> 0.0093415 | H41: of:=IF([.D41]=1;"";[.D41]) ->  | I41: of:=IF([.E41]=1;"";[.E41]) -> 0.0093415
A42: 1 | B42: strncat: &""{\0,\x01,\x01,\x01,\x01,\x01,\x01,\x01,\x01,\x01} &""{\0,p,s,o,\0} 4 :=> &""{\0,p,u,g,h,l,c,n,d,\0} | C42: 1 | D42: 1 | E42: 1 | G42: of:=IF([.C42]=1;"";[.C42]) ->  | H42: of:=IF([.D42]=1;"";[.D42]) ->  | I42: of:=IF([.E42]=1;"";[.E42]) ->  | K42: of:=AVERAGE([.G42:.G82]) -> 0.0557441816129032 | L42: of:=AVERAGE([.H42:.H82]) -> 0.0853480045454545 | M42: of:=AVERAGE([.I42:.I82]) -> 0.0356072767567567 | O42: of:=AVERAGE([.K42:.M42]) -> 0.0588998209717048
A43: 2 | B43: strncat: &""{\0,\x01,\x01,\x01,\x01,\x01,\x01,\x01,\x01,\x01} &"b"{\0,p,w,\0} 4 :=> &"b"{\0,p,w,f,m,y,l,c,\0} | C43: 1 | D43: 1 | E43: 1 | G43: of:=IF([.C43]=1;"";[.C43]) ->  | H43: of:=IF([.D43]=1;"";[.D43]) ->  | I43: of:=IF([.E43]=1;"";[.E43]) -> 
A44: 3 | B44: strncat: &""{\0,\x01,\x01,\x01,\x01,\x01,\x01,\x01,\x01,\x01} &"fa"{\0,p,\0} 4 :=> &"fa"{\0,p,r,k,f,w,e,\0} | C44: 1 | D44: 0.213806 | E44: 0.213806 | G44: of:=IF([.C44]=1;"";[.C44]) ->  | H44: of:=IF([.D44]=1;"";[.D44]) -> 0.213806 | I44: of:=IF([.E44]=1;"";[.E44]) -> 0.213806
A45: 4 | B45: strncat: &""{\0,\x01,\x01,\x01,\x01,\x01,\x01,\x01,\x01,\x01} &"jha"{\0,\0} 4 :=> &"jha"{\0,p,o,s,d,s,\0} | C45: 1 | D45: 0.0551613 | E45: 0.0551613 | G45: of:=IF([.C45]=1;"";[.C45]) ->  | H45: of:=IF([.D45]=1;"";[.D45]) -> 0.0551613 | I45: of:=IF([.E45]=1;"";[.E45]) -> 0.0551613
A46: 5 | B46: strncat: &""{\0,\x01,\x01,\x01,\x01,\x01,\x01,\x01,\x01,\x01} &"lwvw"{\0} 4 :=> &"lwvw"{\0,p,h,g,x,\0} | C46: 1 | D46: 0 | E46: 0 | G46: of:=IF([.C46]=1;"";[.C46]) ->  | H46: of:=IF([.D46]=1;"";[.D46]) -> 0 | I46: of:=IF([.E46]=1;"";[.E46]) -> 0
A47: 6 | B47: strncat: &"t"{\0,\x01,\x01,\x01,\x01,\x01,\x01,\x01,\x01} &""{\0,p,g,j,\0} 4 :=> &"t"{\0,p,c,g,q,y,k,i,\0} | C47: 1 | D47: 1 | E47: 1 | G47: of:=IF([.C47]=1;"";[.C47]) ->  | H47: of:=IF([.D47]=1;"";[.D47]) ->  | I47: of:=IF([.E47]=1;"";[.E47]) -> 
A48: 7 | B48: strncat: &"m"{\0,\x01,\x01,\x01,\x01,\x01,\x01,\x01,\x01} &"g"{\0,p,l,\0} 4 :=> &"mg"{\0,p,o,x,q,f,m,\0} | C48: 1 | D48: 1 | E48: 0.17338 | G48: of:=IF([.C48]=1;"";[.C48]) ->  | H48: of:=IF([.D48]=1;"";[.D48]) ->  | I48: of:=IF([.E48]=1;"";[.E48]) -> 0.17338
A49: 8 | B49: strncat: &"k"{\0,\x01,\x01,\x01,\x01,\x01,\x01,\x01,\x01} &"ax"{\0,p,\0} 4 :=> &"kax"{\0,p,n,p,o,u,\0} | C49: 1 | D49: 0.206399 | E49: 0.079354 | G49: of:=IF([.C49]=1;"";[.C49]) ->  | H49: of:=IF([.D49]=1;"";[.D49]) -> 0.206399 | I49: of:=IF([.E49]=1;"";[.E49]) -> 0.079354
A50: 9 | B50: strncat: &"b"{\0,\x01,\x01,\x01,\x01,\x01,\x01,\x01,\x01} &"sab"{\0,\0} 4 :=> &"bsab"{\0,p,v,i,r,\0} | C50: 1 | D50: 0.0868156 | E50: 0.0459964 | G50: of:=IF([.C50]=1;"";[.C50]) ->  | H50: of:=IF([.D50]=1;"";[.D50]) -> 0.0868156 | I50: of:=IF([.E50]=1;"";[.E50]) -> 0.0459964
A51: 10 | B51: strncat: &"e"{\0,\x01,\x01,\x01,\x01,\x01,\x01,\x01,\x01} &"rvti"{\0} 4 :=> &"ervti"{\0,p,o,b,\0} | C51: 1 | D51: 0.0399809 | E51: 0.0270831 | G51: of:=IF([.C51]=1;"";[.C51]) ->  | H51: of:=IF([.D51]=1;"";[.D51]) -> 0.0399809 | I51: of:=IF([.E51]=1;"";[.E51]) -> 0.0270831
A52: 11 | B52: strncat: &"nk"{\0,\x01,\x01,\x01,\x01,\x01,\x01,\x01} &""{\0,p,g,w,\0} 4 :=> &"nk"{\0,p,i,k,s,v,o,\0} | C52: 0.210856 | D52: 1 | E52: 0.210856 | G52: of:=IF([.C52]=1;"";[.C52]) -> 0.210856 | H52: of:=IF([.D52]=1;"";[.D52]) ->  | I52: of:=IF([.E52]=1;"";[.E52]) -> 0.210856
A53: 12 | B53: strncat: &"sw"{\0,\x01,\x01,\x01,\x01,\x01,\x01,\x01} &"a"{\0,p,t,\0} 4 :=> &"swa"{\0,p,j,b,y,i,\0} | C53: 0.203725 | D53: 1 | E53: 0.0829359 | G53: of:=IF([.C53]=1;"";[.C53]) -> 0.203725 | H53: of:=IF([.D53]=1;"";[.D53]) ->  | I53: of:=IF([.E53]=1;"";[.E53]) -> 0.0829359
A54: 13 | B54: strncat: &"fu"{\0,\x01,\x01,\x01,\x01,\x01,\x01,\x01} &"xb"{\0,p,\0} 4 :=> &"fuxb"{\0,p,u,c,w,\0} | C54: 0.210856 | D54: 0.163328 | E54: 0.0355013 | G54: of:=IF([.C54]=1;"";[.C54]) -> 0.210856 | H54: of:=IF([.D54]=1;"";[.D54]) -> 0.163328 | I54: of:=IF([.E54]=1;"";[.E54]) -> 0.0355013
A55: 14 | B55: strncat: &"cy"{\0,\x01,\x01,\x01,\x01,\x01,\x01,\x01} &"bzs"{\0,\0} 4 :=> &"cybzs"{\0,p,h,r,\0} | C55: 0.207934 | D55: 0.0544429 | E55: 0.0202238 | G55: of:=IF([.C55]=1;"";[.C55]) -> 0.207934 | H55: of:=IF([.D55]=1;"";[.D55]) -> 0.0544429 | I55: of:=IF([.E55]=1;"";[.E55]) -> 0.0202238
A56: 15 | B56: strncat: &"oo"{\0,\x01,\x01,\x01,\x01,\x01,\x01,\x01} &"hekh"{\0} 4 :=> &"oohekh"{\0,p,o,\0} | C56: 0.216638 | D56: 0.0439463 | E56: 0.0202403 | G56: of:=IF([.C56]=1;"";[.C56]) -> 0.216638 | H56: of:=IF([.D56]=1;"";[.D56]) -> 0.0439463 | I56: of:=IF([.E56]=1;"";[.E56]) -> 0.0202403
A57: 16 | B57: strncat: &"nng"{\0,\x01,\x01,\x01,\x01,\x01,\x01} &""{\0,p,d,p,\0} 4 :=> &"nng"{\0,p,w,m,p,d,\0} | C57: 0.087398 | D57: 1 | E57: 0.087398 | G57: of:=IF([.C57]=1;"";[.C57]) -> 0.087398 | H57: of:=IF([.D57]=1;"";[.D57]) ->  | I57: of:=IF([.E57]=1;"";[.E57]) -> 0.087398
A58: 17 | B58: strncat: &"yja"{\0,\x01,\x01,\x01,\x01,\x01,\x01} &"w"{\0,p,s,\0} 4 :=> &"yjaw"{\0,p,j,a,q,\0} | C58: 0.0622273 | D58: 1 | E58: 0.0350193 | G58: of:=IF([.C58]=1;"";[.C58]) -> 0.0622273 | H58: of:=IF([.D58]=1;"";[.D58]) ->  | I58: of:=IF([.E58]=1;"";[.E58]) -> 0.0350193
A59: 18 | B59: strncat: &"zdh"{\0,\x01,\x01,\x01,\x01,\x01,\x01} &"xp"{\0,p,\0} 4 :=> &"zdhxp"{\0,p,d,l,\0} | C59: 0.0661398 | D59: 0.209845 | E59: 0 | G59: of:=IF([.C59]=1;"";[.C59]) -> 0.0661398 | H59: of:=IF([.D59]=1;"";[.D59]) -> 0.209845 | I59: of:=IF([.E59]=1;"";[.E59]) -> 0
A60: 19 | B60: strncat: &"tzb"{\0,\x01,\x01,\x01,\x01,\x01,\x01} &"cll"{\0,\0} 4 :=> &"tzbcll"{\0,p,j,\0} | C60: 0.0706744 | D60: 0.0870416 | E60: 0.0179746 | G60: of:=IF([.C60]=1;"";[.C60]) -> 0.0706744 | H60: of:=IF([.D60]=1;"";[.D60]) -> 0.0870416 | I60: of:=IF([.E60]=1;"";[.E60]) -> 0.0179746
A61: 20 | B61: strncat: &"qoq"{\0,\x01,\x01,\x01,\x01,\x01,\x01} &"qwbm"{\0} 4 :=> &"qoqqwbm"{\0,p,\0} | C61: 0 | D61: 0.0245665 | E61: 0 | G61: of:=IF([.C61]=1;"";[.C61]) -> 0 | H61: of:=IF([.D61]=1;"";[.D61]) -> 0.0245665 | I61: of:=IF([.E61]=1;"";[.E61]) -> 0
A62: 21 | B62: strncat: &"eags"{\0,\x01,\x01,\x01,\x01,\x01} &""{\0,p,r,r,\0} 4 :=> &"eags"{\0,p,n,j,i,\0} | C62: 0.0465723 | D62: 1 | E62: 0.0465723 | G62: of:=IF([.C62]=1;"";[.C62]) -> 0.0465723 | H62: of:=IF([.D62]=1;"";[.D62]) ->  | I62: of:=IF([.E62]=1;"";[.E62]) -> 0.0465723
A63: 22 | B63: strncat: &"fzbl"{\0,\x01,\x01,\x01,\x01,\x01} &"c"{\0,p,r,\0} 4 :=> &"fzblc"{\0,p,e,q,\0} | C63: 0.032373 | D63: 1 | E63: 0.021046 | G63: of:=IF([.C63]=1;"";[.C63]) -> 0.032373 | H63: of:=IF([.D63]=1;"";[.D63]) ->  | I63: of:=IF([.E63]=1;"";[.E63]) -> 0.021046
A64: 23 | B64: strncat: &"xzwu"{\0,\x01,\x01,\x01,\x01,\x01} &"sk"{\0,p,\0} 4 :=> &"xzwusk"{\0,p,w,\0} | C64: 0 | D64: 0.209333 | E64: 0 | G64: of:=IF([.C64]=1;"";[.C64]) -> 0 | H64: of:=IF([.D64]=1;"";[.D64]) -> 0.209333 | I64: of:=IF([.E64]=1;"";[.E64]) -> 0
A65: 24 | B65: strncat: &"xygi"{\0,\x01,\x01,\x01,\x01,\x01} &"mkq"{\0,\0} 4 :=> &"xygimkq"{\0,p,\0} | C65: 0.0375246 | D65: 0 | E65: 0 | G65: of:=IF([.C65]=1;"";[.C65]) -> 0.0375246 | H65: of:=IF([.D65]=1;"";[.D65]) -> 0 | I65: of:=IF([.E65]=1;"";[.E65]) -> 0
A66: 25 | B66: strncat: &"alnn"{\0,\x01,\x01,\x01,\x01,\x01} &"cnhn"{\0} 4 :=> &"alnncnhn"{\0,\0} | C66: 0.044156 | D66: 0.0377179 | E66: 0.0117229 | G66: of:=IF([.C66]=1;"";[.C66]) -> 0.044156 | H66: of:=IF([.D66]=1;"";[.D66]) -> 0.0377179 | I66: of:=IF([.E66]=1;"";[.E66]) -> 0.0117229
A67: 26 | B67: strncat: &"zarem"{\0,\x01,\x01,\x01,\x01} &""{\0,p,m,e,\0} 4 :=> &"zarem"{\0,p,t,a,\0} | C67: 0.0307241 | D67: 1 | E67: 0.0307241 | G67: of:=IF([.C67]=1;"";[.C67]) -> 0.0307241 | H67: of:=IF([.D67]=1;"";[.D67]) ->  | I67: of:=IF([.E67]=1;"";[.E67]) -> 0.0307241
A68: 27 | B68: strncat: &"lhybu"{\0,\x01,\x01,\x01,\x01} &"p"{\0,p,e,\0} 4 :=> &"lhybup"{\0,p,z,\0} | C68: 0.0259814 | D68: 1 | E68: 0.0189813 | G68: of:=IF([.C68]=1;"";[.C68]) -> 0.0259814 | H68: of:=IF([.D68]=1;"";[.D68]) ->  | I68: of:=IF([.E68]=1;"";[.E68]) -> 0.0189813
A69: 28 | B69: strncat: &"uhted"{\0,\x01,\x01,\x01,\x01} &"bm"{\0,p,\0} 4 :=> &"uhtedbm"{\0,p,\0} | C69: 0.0286002 | D69: 0.190052 | E69: 0.0144912 | G69: of:=IF([.C69]=1;"";[.C69]) -> 0.0286002 | H69: of:=IF([.D69]=1;"";[.D69]) -> 0.190052 | I69: of:=IF([.E69]=1;"";[.E69]) -> 0.0144912
A70: 29 | B70: strncat: &"obyrv"{\0,\x01,\x01,\x01,\x01} &"cjq"{\0,\0} 4 :=> &"obyrvcjq"{\0,\0} | C70: 0.0289442 | D70: 0 | E70: 0 | G70: of:=IF([.C70]=1;"";[.C70]) -> 0.0289442 | H70: of:=IF([.D70]=1;"";[.D70]) -> 0 | I70: of:=IF([.E70]=1;"";[.E70]) -> 0
A71: 30 | B71: strncat: &"ktyhf"{\0,\x01,\x01,\x01,\x01} &"xdvy"{\0} 4 :=> &"ktyhfxdvy"{\0} | C71: 0.02369 | D71: 0 | E71: 0 | G71: of:=IF([.C71]=1;"";[.C71]) -> 0.02369 | H71: of:=IF([.D71]=1;"";[.D71]) -> 0 | I71: of:=IF([.E71]=1;"";[.E71]) -> 0
A72: 31 | B72: strncat: &"rxbpyr"{\0,\x01,\x01,\x01} &""{\0,p,d,z,\0} 4 :=> &"rxbpyr"{\0,p,w,\0} | C72: 0.0146007 | D72: 1 | E72: 0.0146007 | G72: of:=IF([.C72]=1;"";[.C72]) -> 0.0146007 | H72: of:=IF([.D72]=1;"";[.D72]) ->  | I72: of:=IF([.E72]=1;"";[.E72]) -> 0.0146007
A73: 32 | B73: strncat: &"fmrghd"{\0,\x01,\x01,\x01} &"d"{\0,p,m,\0} 4 :=> &"fmrghdd"{\0,p,\0} | C73: 0.0174738 | D73: 1 | E73: 0.0136569 | G73: of:=IF([.C73]=1;"";[.C73]) -> 0.0174738 | H73: of:=IF([.D73]=1;"";[.D73]) ->  | I73: of:=IF([.E73]=1;"";[.E73]) -> 0.0136569
A74: 33 | B74: strncat: &"jfvnoc"{\0,\x01,\x01,\x01} &"qd"{\0,p,\0} 4 :=> &"jfvnocqd"{\0,\0} | C74: 0.0138528 | D74: 0 | E74: 0 | G74: of:=IF([.C74]=1;"";[.C74]) -> 0.0138528 | H74: of:=IF([.D74]=1;"";[.D74]) -> 0 | I74: of:=IF([.E74]=1;"";[.E74]) -> 0
A75: 34 | B75: strncat: &"zqdmaa"{\0,\x01,\x01,\x01} &"abg"{\0,\0} 4 :=> &"zqdmaaabg"{\0} | C75: 0 | D75: 0.0679721 | E75: 0 | G75: of:=IF([.C75]=1;"";[.C75]) -> 0 | H75: of:=IF([.D75]=1;"";[.D75]) -> 0.0679721 | I75: of:=IF([.E75]=1;"";[.E75]) -> 0
A76: 35 | B76: strncat: &"vbbjzc"{\0,\x01,\x01,\x01} &&10 4 :=> &"vbbjzcetbo"{} | C76: 0 | D76: 0 | G76: of:=IF([.C76]=1;"";[.C76]) -> 0 | H76: of:=IF([.D76]=1;"";[.D76]) -> 0 | I76: of:=IF([.E76]=1;"";[.E76]) ->  
A77: 36 | B77: strncat: &"sdxhkkk"{\0,\x01,\x01} &""{\0,p,t,x,\0} 4 :=> &"sdxhkkk"{\0,p,\0} | C77: 0 | D77: 1 | E77: 0 | G77: of:=IF([.C77]=1;"";[.C77]) -> 0 | H77: of:=IF([.D77]=1;"";[.D77]) ->  | I77: of:=IF([.E77]=1;"";[.E77]) -> 0
A78: 37 | B78: strncat: &"mklkoyb"{\0,\x01,\x01} &"h"{\0,p,q,\0} 4 :=> &"mklkoybh"{\0,\0} | C78: 0.0131149 | D78: 1 | E78: 0.0101423 | G78: of:=IF([.C78]=1;"";[.C78]) -> 0.0131149 | H78: of:=IF([.D78]=1;"";[.D78]) ->  | I78: of:=IF([.E78]=1;"";[.E78]) -> 0.0101423
A79: 38 | B79: strncat: &"xqfzfmr"{\0,\x01,\x01} &"km"{\0,p,\0} 4 :=> &"xqfzfmrkm"{\0} | C79: 0.00688811 | D79: 0.187248 | E79: 0.00529688 | G79: of:=IF([.C79]=1;"";[.C79]) -> 0.00688811 | H79: of:=IF([.D79]=1;"";[.D79]) -> 0.187248 | I79: of:=IF([.E79]=1;"";[.E79]) -> 0.00529688
A80: 39 | B80: strncat: &"zsflltum"{\0,\x01} &""{\0,p,d,f,\0} 4 :=> &"zsflltum"{\0,\0} | C80: 0.0120223 | D80: 1 | E80: 0.0120223 | G80: of:=IF([.C80]=1;"";[.C80]) -> 0.0120223 | H80: of:=IF([.D80]=1;"";[.D80]) ->  | I80: of:=IF([.E80]=1;"";[.E80]) -> 0.0120223
A81: 40 | B81: strncat: &"bfbbtkdb"{\0,\x01} &"f"{\0,p,l,\0} 4 :=> &"bfbbtkdbf"{\0} | C81: 0.00892142 | D81: 1 | E81: 0.00710106 | G81: of:=IF([.C81]=1;"";[.C81]) -> 0.00892142 | H81: of:=IF([.D81]=1;"";[.D81]) ->  | I81: of:=IF([.E81]=1;"";[.E81]) -> 0.00710106
A82: 41 | B82: strncat: &"hzbhzkgbj"{\0} &""{\0,p,p,z,\0} 4 :=> &"hzbhzkgbj"{\0} | C82: 0.0061813 | D82: 1 | E82: 0.0061813 | G82: of:=IF([.C82]=1;"";[.C82]) -> 0.0061813 | H82: of:=IF([.D82]=1;"";[.D82]) ->  | I82: of:=IF([.E82]=1;"";[.E82]) -> 0.0061813

Sheet: strstr
A1: # | B1: Test Case | C1: N | G1: N1 | H1: N2 | I1: N3
A2: 1 | B2: strstr: &"l"{\0,h,l,m,\0} &"l"{\0,\0} :=> &"l"{\0,h,l,m,\0} | C2: 1 | D2: 1 | E2: 1 | G2: of:=IF([.C2]=1;"";[.C2]) ->  | H2: of:=IF([.D2]=1;"";[.D2]) ->  | I2: of:=IF([.E2]=1;"";[.E2]) ->  | K2: of:=AVERAGE([.G2:.G19]) -> 0.0708591529411765 | L2: of:=AVERAGE([.H2:.H19]) -> 0.195160888888889 | M2: of:=AVERAGE([.I2:.I19]) -> 0.09240444375 | O2: of:=AVERAGE([.K2:.M2]) -> 0.119474828526688
A3: 2 | B3: strstr: &"th"{\0,h,o,\0} &"t"{\0,\0} :=> &"th"{\0,h,o,\0} | C3: 0.227384 | D3: 1 | E3: 0.227384 | G3: of:=IF([.C3]=1;"";[.C3]) -> 0.227384 | H3: of:=IF([.D3]=1;"";[.D3]) ->  | I3: of:=IF([.E3]=1;"";[.E3]) -> 0.227384
A4: 3 | B4: strstr: &"mi"{\0,b,i,\0} &"i"{\0,\0} :=> &"i"{\0,b,i,\0,54} | C4: 0.218014 | D4: 1 | E4: 1 | G4: of:=IF([.C4]=1;"";[.C4]) -> 0.218014 | H4: of:=IF([.D4]=1;"";[.D4]) ->  | I4: of:=IF([.E4]=1;"";[.E4]) -> 
A5: 4 | B5: strstr: &"mtf"{\0,h,\0} &"m"{\0,\0} :=> &"mtf"{\0,h,\0} | C5: 0.0699304 | D5: 1 | E5: 0.0699304 | G5: of:=IF([.C5]=1;"";[.C5]) -> 0.0699304 | H5: of:=IF([.D5]=1;"";[.D5]) ->  | I5: of:=IF([.E5]=1;"";[.E5]) -> 0.0699304
A6: 5 | B6: strstr: &"vla"{\0,b,\0} &"l"{\0,\0} :=> &"la"{\0,b,\0,54} | C6: 0.0744123 | D6: 1 | E6: 0.22025 | G6: of:=IF([.C6]=1;"";[.C6]) -> 0.0744123 | H6: of:=IF([.D6]=1;"";[.D6]) ->  | I6: of:=IF([.E6]=1;"";[.E6]) -> 0.22025
A7: 6 | B7: strstr: &"ztaj"{\0,\0} &"z"{\0,\0} :=> &"ztaj"{\0,\0} | C7: 0.0392299 | D7: 1 | E7: 0.0392299 | G7: of:=IF([.C7]=1;"";[.C7]) -> 0.0392299 | H7: of:=IF([.D7]=1;"";[.D7]) ->  | I7: of:=IF([.E7]=1;"";[.E7]) -> 0.0392299
A8: 7 | B8: strstr: &"seio"{\0,\0} &"e"{\0,\0} :=> &"eio"{\0,\0,54} | C8: 0.048079 | D8: 1 | E8: 0.087353 | G8: of:=IF([.C8]=1;"";[.C8]) -> 0.048079 | H8: of:=IF([.D8]=1;"";[.D8]) ->  | I8: of:=IF([.E8]=1;"";[.E8]) -> 0.087353
A9: 8 | B9: strstr: &"lqgkc"{\0} &"l"{\0,\0} :=> &"lqgkc"{\0} | C9: 0 | D9: 1 | E9: 0 | G9: of:=IF([.C9]=1;"";[.C9]) -> 0 | H9: of:=IF([.D9]=1;"";[.D9]) ->  | I9: of:=IF([.E9]=1;"";[.E9]) -> 0
A10: 9 | B10: strstr: &"tcwcf"{\0} &"c"{\0,\0} :=> &"cwcf"{\0,54} | C10: 0.0182542 | D10: 1 | E10: 0.0267416 | G10: of:=IF([.C10]=1;"";[.C10]) -> 0.0182542 | H10: of:=IF([.D10]=1;"";[.D10]) ->  | I10: of:=IF([.E10]=1;"";[.E10]) -> 0.0267416
A11: 10 | B11: strstr: &"sz"{\0,d,l,\0} &"sz"{\0} :=> &"sz"{\0,d,l,\0} | C11: 0.183097 | D11: 0.183097 | E11: 0.183097 | G11: of:=IF([.C11]=1;"";[.C11]) -> 0.183097 | H11: of:=IF([.D11]=1;"";[.D11]) -> 0.183097 | I11: of:=IF([.E11]=1;"";[.E11]) -> 0.183097
A12: 11 | B12: strstr: &"yvd"{\0,d,\0} &"yv"{\0} :=> &"yvd"{\0,d,\0} | C12: 0.0609266 | D12: 0.180513 | E12: 0.0609266 | G12: of:=IF([.C12]=1;"";[.C12]) -> 0.0609266 | H12: of:=IF([.D12]=1;"";[.D12]) -> 0.180513 | I12: of:=IF([.E12]=1;"";[.E12]) -> 0.0609266
A13: 12 | B13: strstr: &"ppk"{\0,a,\0} &"pk"{\0} :=> &"pk"{\0,a,\0,54} | C13: 0.0760583 | D13: 0.186816 | E13: 0.186816 | G13: of:=IF([.C13]=1;"";[.C13]) -> 0.0760583 | H13: of:=IF([.D13]=1;"";[.D13]) -> 0.186816 | I13: of:=IF([.E13]=1;"";[.E13]) -> 0.186816
A14: 13 | B14: strstr: &"pce"{\0,p,\0} &"ce"{\0} :=> &"ce"{\0,p,\0,54} | C14: 0.0762859 | D14: 0.221126 | E14: 0.221126 | G14: of:=IF([.C14]=1;"";[.C14]) -> 0.0762859 | H14: of:=IF([.D14]=1;"";[.D14]) -> 0.221126 | I14: of:=IF([.E14]=1;"";[.E14]) -> 0.221126
A15: 14 | B15: strstr: &"irsl"{\0,\0} &"ir"{\0} :=> &"irsl"{\0,\0} | C15: 0.0466615 | D15: 0.217558 | E15: 0.0466615 | G15: of:=IF([.C15]=1;"";[.C15]) -> 0.0466615 | H15: of:=IF([.D15]=1;"";[.D15]) -> 0.217558 | I15: of:=IF([.E15]=1;"";[.E15]) -> 0.0466615
A16: 15 | B16: strstr: &"ffwx"{\0,\0} &"fw"{\0} :=> &"fwx"{\0,\0,54} | C16: 0 | D16: 0.174365 | E16: 0 | G16: of:=IF([.C16]=1;"";[.C16]) -> 0 | H16: of:=IF([.D16]=1;"";[.D16]) -> 0.174365 | I16: of:=IF([.E16]=1;"";[.E16]) -> 0
A17: 16 | B17: strstr: &"lken"{\0,\0} &"ke"{\0} :=> &"ken"{\0,\0,54} | C17: 0.0465311 | D17: 0.217558 | E17: 0.0892137 | G17: of:=IF([.C17]=1;"";[.C17]) -> 0.0465311 | H17: of:=IF([.D17]=1;"";[.D17]) -> 0.217558 | I17: of:=IF([.E17]=1;"";[.E17]) -> 0.0892137
A18: 17 | B18: strstr: &"aqssr"{\0} &"aq"{\0} :=> &"aqssr"{\0} | C18: 0.0197414 | D18: 0.196689 | E18: 0.0197414 | G18: of:=IF([.C18]=1;"";[.C18]) -> 0.0197414 | H18: of:=IF([.D18]=1;"";[.D18]) -> 0.196689 | I18: of:=IF([.E18]=1;"";[.E18]) -> 0.0197414
A19: 18 | B19: strstr: &"kkvqj"{\0} &"kv"{\0} :=> &"kvqj"{\0,54} | C19: 0 | D19: 0.178726 | E19: 0 | G19: of:=IF([.C19]=1;"";[.C19]) -> 0 | H19: of:=IF([.D19]=1;"";[.D19]) -> 0.178726 | I19: of:=IF([.E19]=1;"";[.E19]) -> 0
A20: 19 | B20: strstr: &"wxjku"{\0} &"xj"{\0} :=> &"xjku"{\0,54} | C20: 0 | D20: 0 | E20: 0 | G20: of:=IF([.C20]=1;"";[.C20]) -> 0 | H20: of:=IF([.D20]=1;"";[.D20]) -> 0 | I20: of:=IF([.E20]=1;"";[.E20]) -> 0 | K20: of:=AVERAGE([.G20:.G24]) -> 0.01258744 | L20: of:=AVERAGE([.H20:.H24]) -> 0.106661 | M20: of:=AVERAGE([.I20:.I24]) -> 0.01381086 | O20: of:=AVERAGE([.K20:.M20]) -> 0.0443531
A21: 1 | B21: strnstr: &"dwvps"{\0} &""{\0,p,\0} 2 :=> &"dwvps"{\0} | C21: 0 | D21: 1 | E21: 0 | G21: of:=IF([.C21]=1;"";[.C21]) -> 0 | H21: of:=IF([.D21]=1;"";[.D21]) ->  | I21: of:=IF([.E21]=1;"";[.E21]) -> 0
A22: 2 | B22: strnstr: &"hnyyt"{\0} &"h"{\0,\0} 2 :=> &"hnyyt"{\0} | C22: 0.0236303 | D22: 1 | E22: 0.0236303 | G22: of:=IF([.C22]=1;"";[.C22]) -> 0.0236303 | H22: of:=IF([.D22]=1;"";[.D22]) ->  | I22: of:=IF([.E22]=1;"";[.E22]) -> 0.0236303
A23: 3 | B23: strnstr: &"acyqq"{\0} &"c"{\0,\0} 2 :=> &"cyqq"{\0,54} | C23: 0.016009 | D23: 1 | E23: 0.0221261 | G23: of:=IF([.C23]=1;"";[.C23]) -> 0.016009 | H23: of:=IF([.D23]=1;"";[.D23]) ->  | I23: of:=IF([.E23]=1;"";[.E23]) -> 0.0221261
A24: 4 | B24: strnstr: &"dsdjm"{\0} &"ds"{\0} 2 :=> &"dsdjm"{\0} | C24: 0.0232979 | D24: 0.213322 | E24: 0.0232979 | G24: of:=IF([.C24]=1;"";[.C24]) -> 0.0232979 | H24: of:=IF([.D24]=1;"";[.D24]) -> 0.213322 | I24: of:=IF([.E24]=1;"";[.E24]) -> 0.0232979
A25: 1 | B25: strpbrk: &"fudrd"{\0} &"aeiou"{\0} :=> &"udrd"{\0,54} | C25: 0.0291404 | D25: 0.0299288 | E25: 0.0456304 | G25: of:=IF([.C25]=1;"";[.C25]) -> 0.0291404 | H25: of:=IF([.D25]=1;"";[.D25]) -> 0.0299288 | I25: of:=IF([.E25]=1;"";[.E25]) -> 0.0456304 | K25: of:=AVERAGE([.G25:.G34]) -> 0.01775455 | L25: of:=AVERAGE([.H25:.H34]) -> 0.0299288 | M25: of:=AVERAGE([.I25:.I34]) -> 0.02237769 | O25: of:=AVERAGE([.K25:.M25]) -> 0.02335368
A26: 2 | B26: strpbrk: &"dolnh"{\0} &"aeiou"{\0} :=> &"olnh"{\0,54} | C26: 0.0276084 | D26: 0.0299288 | E26: 0.0422609 | G26: of:=IF([.C26]=1;"";[.C26]) -> 0.0276084 | H26: of:=IF([.D26]=1;"";[.D26]) -> 0.0299288 | I26: of:=IF([.E26]=1;"";[.E26]) -> 0.0422609
A27: 3 | B27: strpbrk: &"sijqd"{\0} &"aeiou"{\0} :=> &"ijqd"{\0,54} | C27: 0 | D27: 0.0299288 | E27: 0 | G27: of:=IF([.C27]=1;"";[.C27]) -> 0 | H27: of:=IF([.D27]=1;"";[.D27]) -> 0.0299288 | I27: of:=IF([.E27]=1;"";[.E27]) -> 0
A28: 4 | B28: strpbrk: &"gehxj"{\0} &"aeiou"{\0} :=> &"ehxj"{\0,54} | C28: 0 | D28: 0.0299288 | E28: 0 | G28: of:=IF([.C28]=1;"";[.C28]) -> 0 | H28: of:=IF([.D28]=1;"";[.D28]) -> 0.0299288 | I28: of:=IF([.E28]=1;"";[.E28]) -> 0
A29: 5 | B29: strpbrk: &"jaixy"{\0} &"aeiou"{\0} :=> &"aixy"{\0,54} | C29: 0.02568 | D29: 0.0299288 | E29: 0.0407689 | G29: of:=IF([.C29]=1;"";[.C29]) -> 0.02568 | H29: of:=IF([.D29]=1;"";[.D29]) -> 0.0299288 | I29: of:=IF([.E29]=1;"";[.E29]) -> 0.0407689
A30: 6 | B30: strpbrk: &"uokqm"{\0} &"aeiou"{\0} :=> &"uokqm"{\0} | C30: 0 | D30: 0.0299288 | E30: 0 | G30: of:=IF([.C30]=1;"";[.C30]) -> 0 | H30: of:=IF([.D30]=1;"";[.D30]) -> 0.0299288 | I30: of:=IF([.E30]=1;"";[.E30]) -> 0
A31: 7 | B31: strpbrk: &"oqavs"{\0} &"aeiou"{\0} :=> &"oqavs"{\0} | C31: 0.0212217 | D31: 0.0299288 | E31: 0.0212217 | G31: of:=IF([.C31]=1;"";[.C31]) -> 0.0212217 | H31: of:=IF([.D31]=1;"";[.D31]) -> 0.0299288 | I31: of:=IF([.E31]=1;"";[.E31]) -> 0.0212217
A32: 8 | B32: strpbrk: &"ijrug"{\0} &"aeiou"{\0} :=> &"ijrug"{\0} | C32: 0.0205297 | D32: 0.0299288 | E32: 0.0205297 | G32: of:=IF([.C32]=1;"";[.C32]) -> 0.0205297 | H32: of:=IF([.D32]=1;"";[.D32]) -> 0.0299288 | I32: of:=IF([.E32]=1;"";[.E32]) -> 0.0205297
A33: 9 | B33: strpbrk: &"evcdw"{\0} &"aeiou"{\0} :=> &"evcdw"{\0} | C33: 0.0238833 | D33: 0.0299288 | E33: 0.0238833 | G33: of:=IF([.C33]=1;"";[.C33]) -> 0.0238833 | H33: of:=IF([.D33]=1;"";[.D33]) -> 0.0299288 | I33: of:=IF([.E33]=1;"";[.E33]) -> 0.0238833
A34: 10 | B34: strpbrk: &"aethy"{\0} &"aeiou"{\0} :=> &"aethy"{\0} | C34: 0.029482 | D34: 0.0299288 | E34: 0.029482 | G34: of:=IF([.C34]=1;"";[.C34]) -> 0.029482 | H34: of:=IF([.D34]=1;"";[.D34]) -> 0.0299288 | I34: of:=IF([.E34]=1;"";[.E34]) -> 0.029482