Sheet: strlen
A1: strlen: &"\x01"{\0,\0,\0,\0,\0} :=> 1; | J1: # | K1: Test Case | L1: N | P1: FINAL
A2: strlen: &"\x01\x01"{\0,\0,\0,\0} :=> 2; | J2: 1 | K2: strlen: &"v"{\0,p,j,n,\0} :=> 1 | L2: 1 | N2: of:=IF([.L2]=1;"";[.L2]) ->  | P2: of:=AVERAGE([.N2:.N6]) -> 0.084268475
A3: strlen: &"\x01\x01\x01"{\0,\0,\0} :=> 3; | J3: 2 | K3: strlen: &"ya"{\0,p,b,\0} :=> 2 | L3: 0.20378 | N3: of:=IF([.L3]=1;"";[.L3]) -> 0.20378
A4: strlen: &"\x01\x01\x01\x01"{\0,\0} :=> 4; | J4: 3 | K4: strlen: &"lgu"{\0,p,\0} :=> 3 | L4: 0.0785301 | N4: of:=IF([.L4]=1;"";[.L4]) -> 0.0785301
A5: strlen: &"\x01\x01\x01\x01\x01"{\0} :=> 5; | J5: 4 | K5: strlen: &"hfyh"{\0,\0} :=> 4 | L5: 0.0362698 | N5: of:=IF([.L5]=1;"";[.L5]) -> 0.0362698
A6: strnlen: &""{\0,\0,\0,\0,\0,\0} 6 :=> 0; 1; | J6: 5 | K6: strlen: &"bfzbs"{\0} :=> 5 | L6: 0.018494 | N6: of:=IF([.L6]=1;"";[.L6]) -> 0.018494
A7: strnlen: &"\x01"{\0,\0,\0,\0,\0} 6 :=> 1; | J7: 1 | K7: strnlen: &""{\0,p,m,g,o,\0} 6 :=> 0 | L7: 1 | N7: of:=IF([.L7]=1;"";[.L7]) ->  | P7: of:=AVERAGE([.N7:.N12]) -> 0.079377875
A8: strnlen: &"\x01\x01"{\0,\0,\0,\0} 6 :=> 2; | J8: 2 | K8: strnlen: &"e"{\0,p,i,y,\0} 6 :=> 1 | L8: 1 | N8: of:=IF([.L8]=1;"";[.L8]) -> 
A9: strnlen: &"\x01\x01\x01"{\0,\0,\0} 6 :=> 3; | J9: 3 | K9: strnlen: &"fp"{\0,p,i,\0} 6 :=> 2 | L9: 0.157396 | N9: of:=IF([.L9]=1;"";[.L9]) -> 0.157396
A10: strnlen: &"\x01\x01\x01\x01"{\0,\0} 6 :=> 4; | J10: 4 | K10: strnlen: &"moe"{\0,p,\0} 6 :=> 3 | L10: 0.0839769 | N10: of:=IF([.L10]=1;"";[.L10]) -> 0.0839769
A11: strnlen: &"\x01\x01\x01\x01\x01"{\0} 6 :=> 5; | J11: 5 | K11: strnlen: &"tioo"{\0,\0} 6 :=> 4 | L11: 0.0485442 | N11: of:=IF([.L11]=1;"";[.L11]) -> 0.0485442
J12: 6 | K12: strnlen: &"torhh"{\0} 6 :=> 5 | L12: 0.0275944 | N12: of:=IF([.L12]=1;"";[.L12]) -> 0.0275944

Sheet: strcmp
A1: # | B1: Test Case | C1: N1 | D1: N2 | L1: FINAL
A2: 1 | B2: strcmp: &"h"{\0,p,h,d,\0} &"h"{\0,p,z,r,\0} :=> 0 | C2: 1 | D2: 1 | F2: of:=IF([.C2]=1;"";[.C2]) ->  | G2: of:=IF([.D2]=1;"";[.D2]) ->  | H2: of:=IF([.E2]=1;"";[.E2]) ->   | I2: of:=AVERAGE([.F2:.F16]) -> 0.0364848714285714 | J2: of:=AVERAGE([.G2:.G16]) -> 0.03607005 | L2: of:=AVERAGE([.I2:.J2]) -> 0.0362774607142857
A3: 2 | B3: strcmp: &"cu"{\0,p,q,\0} &"cu"{\0,p,o,\0} :=> 0 | C3: 0.214286 | D3: 0.214286 | F3: of:=IF([.C3]=1;"";[.C3]) -> 0.214286 | G3: of:=IF([.D3]=1;"";[.D3]) -> 0.214286 | H3: of:=IF([.E3]=1;"";[.E3]) ->  
A4: 3 | B4: strcmp: &"wqf"{\0,p,\0} &"wqf"{\0,p,\0} :=> 0 | C4: 0.0343303 | D4: 0.0343303 | F4: of:=IF([.C4]=1;"";[.C4]) -> 0.0343303 | G4: of:=IF([.D4]=1;"";[.D4]) -> 0.0343303 | H4: of:=IF([.E4]=1;"";[.E4]) ->  
A5: 4 | B5: strcmp: &"nxql"{\0,\0} &"nxql"{\0,\0} :=> 0 | C5: 0.0253241 | D5: 0.0253241 | F5: of:=IF([.C5]=1;"";[.C5]) -> 0.0253241 | G5: of:=IF([.D5]=1;"";[.D5]) -> 0.0253241 | H5: of:=IF([.E5]=1;"";[.E5]) ->  
A6: 5 | B6: strcmp: &"lnjvw"{\0} &"lnjvw"{\0} :=> 0 | C6: 0 | D6: 0 | F6: of:=IF([.C6]=1;"";[.C6]) -> 0 | G6: of:=IF([.D6]=1;"";[.D6]) -> 0 | H6: of:=IF([.E6]=1;"";[.E6]) ->  
A7: 6 | B7: strcmp: &"pwcip"{\0} &"pwcig"{\0} :=> 1 | C7: 0.0246293 | D7: 0.0250434 | F7: of:=IF([.C7]=1;"";[.C7]) -> 0.0246293 | G7: of:=IF([.D7]=1;"";[.D7]) -> 0.0250434 | H7: of:=IF([.E7]=1;"";[.E7]) ->  
A8: 7 | B8: strcmp: &"nexot"{\0} &"nexow"{\0} :=> -1 | C8: 0.0288307 | D8: 0.0287627 | F8: of:=IF([.C8]=1;"";[.C8]) -> 0.0288307 | G8: of:=IF([.D8]=1;"";[.D8]) -> 0.0287627 | H8: of:=IF([.E8]=1;"";[.E8]) ->  
A9: 8 | B9: strcmp: &"yowmv"{\0} &"yowdz"{\0} :=> 1 | C9: 0.0244168 | D9: 0.0251747 | F9: of:=IF([.C9]=1;"";[.C9]) -> 0.0244168 | G9: of:=IF([.D9]=1;"";[.D9]) -> 0.0251747 | H9: of:=IF([.E9]=1;"";[.E9]) ->  
A10: 9 | B10: strcmp: &"gjhan"{\0} &"gjhvh"{\0} :=> -1 | C10: 0.0186057 | D10: 0.0117401 | F10: of:=IF([.C10]=1;"";[.C10]) -> 0.0186057 | G10: of:=IF([.D10]=1;"";[.D10]) -> 0.0117401 | H10: of:=IF([.E10]=1;"";[.E10]) ->  
A11: 10 | B11: strcmp: &"ovwpn"{\0} &"ovrsi"{\0} :=> 1 | C11: 0 | D11: 0.0281655 | F11: of:=IF([.C11]=1;"";[.C11]) -> 0 | G11: of:=IF([.D11]=1;"";[.D11]) -> 0.0281655 | H11: of:=IF([.E11]=1;"";[.E11]) ->  
A12: 11 | B12: strcmp: &"lucro"{\0} &"lusag"{\0} :=> -1 | C12: 0.0300602 | D12: 0.0303348 | F12: of:=IF([.C12]=1;"";[.C12]) -> 0.0300602 | G12: of:=IF([.D12]=1;"";[.D12]) -> 0.0303348
A13: 12 | B13: strcmp: &"yoxep"{\0} &"yeino"{\0} :=> 1 | C13: 0.0277191 | D13: 0.0309835 | F13: of:=IF([.C13]=1;"";[.C13]) -> 0.0277191 | G13: of:=IF([.D13]=1;"";[.D13]) -> 0.0309835
A14: 13 | B14: strcmp: &"eilow"{\0} &"eznzv"{\0} :=> -1 | C14: 0.0306737 | D14: 0.0210884 | F14: of:=IF([.C14]=1;"";[.C14]) -> 0.0306737 | G14: of:=IF([.D14]=1;"";[.D14]) -> 0.0210884
A15: 14 | B15: strcmp: &"gwldy"{\0} &"eobll"{\0} :=> 1 | C15: 0.0259237 | D15: 0.0297472 | F15: of:=IF([.C15]=1;"";[.C15]) -> 0.0259237 | G15: of:=IF([.D15]=1;"";[.D15]) -> 0.0297472
A16: 15 | B16: strcmp: &"ukebd"{\0} &"zfqwb"{\0} :=> -1 | C16: 0.0259886 | D16: 0 | F16: of:=IF([.C16]=1;"";[.C16]) -> 0.0259886 | G16: of:=IF([.D16]=1;"";[.D16]) -> 0
A17: 1 | B17: strncmp: &""{\0,p,x,n,o,\0} &""{\0,p,a,v,e,\0} 5 :=> 0 | C17: 1 | D17: 1 | F17: of:=IF([.C17]=1;"";[.C17]) ->  | G17: of:=IF([.D17]=1;"";[.D17]) ->  | I17: of:=AVERAGE([.F17:.F32]) -> 0.0344320714285714 | J17: of:=AVERAGE([.G17:.G32]) -> 0.0369601142857143 | L17: of:=AVERAGE([.I17:.J17]) -> 0.0356960928571429
A18: 2 | B18: strncmp: &"f"{\0,p,a,s,\0} &"f"{\0,p,w,i,\0} 5 :=> 0 | C18: 1 | D18: 1 | F18: of:=IF([.C18]=1;"";[.C18]) ->  | G18: of:=IF([.D18]=1;"";[.D18]) -> 
A19: 3 | B19: strncmp: &"da"{\0,p,l,\0} &"da"{\0,p,z,\0} 5 :=> 0 | C19: 0.216174 | D19: 0.216174 | F19: of:=IF([.C19]=1;"";[.C19]) -> 0.216174 | G19: of:=IF([.D19]=1;"";[.D19]) -> 0.216174
A20: 4 | B20: strncmp: &"bsu"{\0,p,\0} &"bsu"{\0,p,\0} 5 :=> 0 | C20: 0.0841896 | D20: 0.0841896 | F20: of:=IF([.C20]=1;"";[.C20]) -> 0.0841896 | G20: of:=IF([.D20]=1;"";[.D20]) -> 0.0841896
A21: 5 | B21: strncmp: &"gsnk"{\0,\0} &"gsnk"{\0,\0} 5 :=> 0 | C21: 0.0433366 | D21: 0.0433366 | F21: of:=IF([.C21]=1;"";[.C21]) -> 0.0433366 | G21: of:=IF([.D21]=1;"";[.D21]) -> 0.0433366
A22: 6 | B22: strncmp: &"uqrmn"{\0} &"uqrmn"{\0} 5 :=> 0 | C22: 0 | D22: 0 | F22: of:=IF([.C22]=1;"";[.C22]) -> 0 | G22: of:=IF([.D22]=1;"";[.D22]) -> 0
A23: 7 | B23: strncmp: &"gamme"{\0} &"gammd"{\0} 5 :=> 1 | C23: 0.0303199 | D23: 0.0269768 | F23: of:=IF([.C23]=1;"";[.C23]) -> 0.0303199 | G23: of:=IF([.D23]=1;"";[.D23]) -> 0.0269768
A24: 8 | B24: strncmp: &"cvbul"{\0} &"cvbux"{\0} 5 :=> -1 | C24: 0 | D24: 0 | F24: of:=IF([.C24]=1;"";[.C24]) -> 0 | G24: of:=IF([.D24]=1;"";[.D24]) -> 0
A25: 9 | B25: strncmp: &"pvlcx"{\0} &"pvlap"{\0} 5 :=> 1 | C25: 0.0122518 | D25: 0.0193453 | F25: of:=IF([.C25]=1;"";[.C25]) -> 0.0122518 | G25: of:=IF([.D25]=1;"";[.D25]) -> 0.0193453
A26: 10 | B26: strncmp: &"nrqnr"{\0} &"nrqoh"{\0} 5 :=> -1 | C26: 0 | D26: 0 | F26: of:=IF([.C26]=1;"";[.C26]) -> 0 | G26: of:=IF([.D26]=1;"";[.D26]) -> 0
A27: 11 | B27: strncmp: &"xbces"{\0} &"xbbhl"{\0} 5 :=> 1 | C27: 0.0245066 | D27: 0.0213917 | F27: of:=IF([.C27]=1;"";[.C27]) -> 0.0245066 | G27: of:=IF([.D27]=1;"";[.D27]) -> 0.0213917
A28: 12 | B28: strncmp: &"zuslq"{\0} &"zuzqu"{\0} 5 :=> -1 | C28: 0.0233418 | D28: 0.021592 | F28: of:=IF([.C28]=1;"";[.C28]) -> 0.0233418 | G28: of:=IF([.D28]=1;"";[.D28]) -> 0.021592
A29: 13 | B29: strncmp: &"qzsvm"{\0} &"qqbgf"{\0} 5 :=> 1 | C29: 0 | D29: 0.0129007 | F29: of:=IF([.C29]=1;"";[.C29]) -> 0 | G29: of:=IF([.D29]=1;"";[.D29]) -> 0.0129007
A30: 14 | B30: strncmp: &"lsfnb"{\0} &"lzykw"{\0} 5 :=> -1 | C30: 0.0246118 | D30: 0.0218594 | F30: of:=IF([.C30]=1;"";[.C30]) -> 0.0246118 | G30: of:=IF([.D30]=1;"";[.D30]) -> 0.0218594
A31: 15 | B31: strncmp: &"rzhmn"{\0} &"nxizk"{\0} 5 :=> 1 | C31: 0.0233169 | D31: 0.0240558 | F31: of:=IF([.C31]=1;"";[.C31]) -> 0.0233169 | G31: of:=IF([.D31]=1;"";[.D31]) -> 0.0240558
A32: 16 | B32: strncmp: &"mwxlk"{\0} &"wmazl"{\0} 5 :=> -1 | C32: 0 | D32: 0.0256197 | F32: of:=IF([.C32]=1;"";[.C32]) -> 0 | G32: of:=IF([.D32]=1;"";[.D32]) -> 0.0256197
A33: 1 | B33: sysfs_streq: &""{\0,p,y,b,t,\0} &"dssow"{\0} :=> \0 | C33: 1 | D33: 0.0304502 | F33: of:=IF([.C33]=1;"";[.C33]) ->  | G33: of:=IF([.D33]=1;"";[.D33]) -> 0.0304502 | I33: of:=AVERAGE([.F33:.F71]) -> 0.0586138724137931 | J33: of:=AVERAGE([.G33:.G71]) -> 0.0408190428571428 | L33: of:=AVERAGE([.I33:.J33]) -> 0.049716457635468
A34: 2 | B34: sysfs_streq: &""{\0,p,r,f,f,\0} &"\n"{\0,b,s,e,\0} :=> \x01 | C34: 1 | F34: of:=IF([.C34]=1;"";[.C34]) ->  | G34: of:=IF([.D34]=1;"";[.D34]) ->  
A35: 3 | B35: sysfs_streq: &""{\0,p,i,e,r,\0} &"\naesx"{\0} :=> \0 | C35: 1 | F35: of:=IF([.C35]=1;"";[.C35]) ->  | G35: of:=IF([.D35]=1;"";[.D35]) ->  
A36: 4 | B36: sysfs_streq: &""{\0,p,o,g,l,\0} &""{\0,h,w,p,w,\0} :=> \x01 | C36: 1 | D36: 1 | F36: of:=IF([.C36]=1;"";[.C36]) ->  | G36: of:=IF([.D36]=1;"";[.D36]) -> 
A37: 5 | B37: sysfs_streq: &"qbxjj"{\0} &"nwdwn"{\0} :=> \0 | C37: 0 | D37: 0.0258312 | F37: of:=IF([.C37]=1;"";[.C37]) -> 0 | G37: of:=IF([.D37]=1;"";[.D37]) -> 0.0258312
A38: 6 | B38: sysfs_streq: &"\n"{\0,p,a,o,\0} &""{\0,a,o,f,y,\0} :=> \x01 | C38: 1 | F38: of:=IF([.C38]=1;"";[.C38]) ->  | G38: of:=IF([.D38]=1;"";[.D38]) ->  
A39: 7 | B39: sysfs_streq: &"\n"{\0,a,a,e,\0} &"jsvtz"{\0} :=> \0 | C39: 0.0178879 | F39: of:=IF([.C39]=1;"";[.C39]) -> 0.0178879 | G39: of:=IF([.D39]=1;"";[.D39]) ->  
A40: 8 | B40: sysfs_streq: &"\napvs"{\0} &"nrnui"{\0} :=> \0 | C40: 0.0281446 | F40: of:=IF([.C40]=1;"";[.C40]) -> 0.0281446 | G40: of:=IF([.D40]=1;"";[.D40]) ->  
A41: 9 | B41: sysfs_streq: &"k"{\0,p,p,a,\0} &"knoxh"{\0} :=> \0 | C41: 1 | D41: 0.0268128 | F41: of:=IF([.C41]=1;"";[.C41]) ->  | G41: of:=IF([.D41]=1;"";[.D41]) -> 0.0268128
A42: 10 | B42: sysfs_streq: &"j"{\0,p,j,u,\0} &"j\n"{\0,a,e,\0} :=> \x01 | C42: 1 | F42: of:=IF([.C42]=1;"";[.C42]) ->  | G42: of:=IF([.D42]=1;"";[.D42]) ->  
A43: 11 | B43: sysfs_streq: &"z"{\0,p,d,s,\0} &"z\nama"{\0} :=> \0 | C43: 1 | F43: of:=IF([.C43]=1;"";[.C43]) ->  | G43: of:=IF([.D43]=1;"";[.D43]) ->  
A44: 12 | B44: sysfs_streq: &"n"{\0,p,j,p,\0} &"n"{\0,h,p,o,\0} :=> \x01 | C44: 1 | D44: 1 | F44: of:=IF([.C44]=1;"";[.C44]) ->  | G44: of:=IF([.D44]=1;"";[.D44]) -> 
A45: 13 | B45: sysfs_streq: &"buwge"{\0} &"bllpo"{\0} :=> \0 | C45: 0.0236439 | D45: 0.0298089 | F45: of:=IF([.C45]=1;"";[.C45]) -> 0.0236439 | G45: of:=IF([.D45]=1;"";[.D45]) -> 0.0298089
A46: 14 | B46: sysfs_streq: &"i\n"{\0,b,g,\0} &"i"{\0,b,s,v,\0} :=> \x01 | C46: 1 | F46: of:=IF([.C46]=1;"";[.C46]) ->  | G46: of:=IF([.D46]=1;"";[.D46]) ->  
A47: 15 | B47: sysfs_streq: &"y\n"{\0,b,x,\0} &"yekfe"{\0} :=> \0 | C47: 0.027212 | F47: of:=IF([.C47]=1;"";[.C47]) -> 0.027212 | G47: of:=IF([.D47]=1;"";[.D47]) ->  
A48: 16 | B48: sysfs_streq: &"a\nayv"{\0} &"ahydc"{\0} :=> \0 | C48: 0.0252253 | F48: of:=IF([.C48]=1;"";[.C48]) -> 0.0252253 | G48: of:=IF([.D48]=1;"";[.D48]) ->  
A49: 17 | B49: sysfs_streq: &"xe"{\0,p,m,\0} &"xelwm"{\0} :=> \0 | C49: 0.206238 | D49: 0.0265459 | F49: of:=IF([.C49]=1;"";[.C49]) -> 0.206238 | G49: of:=IF([.D49]=1;"";[.D49]) -> 0.0265459
A50: 18 | B50: sysfs_streq: &"eu"{\0,p,d,\0} &"eu\n"{\0,a,\0} :=> \x01 | C50: 0.204169 | F50: of:=IF([.C50]=1;"";[.C50]) -> 0.204169 | G50: of:=IF([.D50]=1;"";[.D50]) ->  
A51: 19 | B51: sysfs_streq: &"tq"{\0,p,q,\0} &"tq\nam"{\0} :=> \0 | C51: 0.138419 | F51: of:=IF([.C51]=1;"";[.C51]) -> 0.138419 | G51: of:=IF([.D51]=1;"";[.D51]) ->  
A52: 20 | B52: sysfs_streq: &"lo"{\0,p,g,\0} &"lo"{\0,b,b,\0} :=> \x01 | C52: 0.218014 | D52: 0.218014 | F52: of:=IF([.C52]=1;"";[.C52]) -> 0.218014 | G52: of:=IF([.D52]=1;"";[.D52]) -> 0.218014
A53: 21 | B53: sysfs_streq: &"rutqb"{\0} &"ruxmj"{\0} :=> \0 | C53: 0.0181605 | D53: 0.0207072 | F53: of:=IF([.C53]=1;"";[.C53]) -> 0.0181605 | G53: of:=IF([.D53]=1;"";[.D53]) -> 0.0207072
A54: 22 | B54: sysfs_streq: &"lu\n"{\0,b,\0} &"lu"{\0,b,y,\0} :=> \x01 | C54: 0.212836 | F54: of:=IF([.C54]=1;"";[.C54]) -> 0.212836 | G54: of:=IF([.D54]=1;"";[.D54]) ->  
A55: 23 | B55: sysfs_streq: &"gh\n"{\0,b,\0} &"ghzcg"{\0} :=> \0 | C55: 0.0138707 | F55: of:=IF([.C55]=1;"";[.C55]) -> 0.0138707 | G55: of:=IF([.D55]=1;"";[.D55]) ->  
A56: 24 | B56: sysfs_streq: &"ri\nad"{\0} &"riffw"{\0} :=> \0 | C56: 0.0267591 | F56: of:=IF([.C56]=1;"";[.C56]) -> 0.0267591 | G56: of:=IF([.D56]=1;"";[.D56]) ->  
A57: 25 | B57: sysfs_streq: &"kqe"{\0,p,\0} &"kqeue"{\0} :=> \0 | C57: 0 | D57: 0 | F57: of:=IF([.C57]=1;"";[.C57]) -> 0 | G57: of:=IF([.D57]=1;"";[.D57]) -> 0
A58: 26 | B58: sysfs_streq: &"idd"{\0,p,\0} &"idd\n"{\0,\0} :=> \x01 | C58: 0.0850061 | F58: of:=IF([.C58]=1;"";[.C58]) -> 0.0850061 | G58: of:=IF([.D58]=1;"";[.D58]) ->  
A59: 27 | B59: sysfs_streq: &"rah"{\0,p,\0} &"rah\na"{\0} :=> \0 | C59: 0.0836529 | F59: of:=IF([.C59]=1;"";[.C59]) -> 0.0836529 | G59: of:=IF([.D59]=1;"";[.D59]) ->  
A60: 28 | B60: sysfs_streq: &"gsr"{\0,p,\0} &"gsr"{\0,h,\0} :=> \x01 | C60: 0.0795375 | D60: 0.0795375 | F60: of:=IF([.C60]=1;"";[.C60]) -> 0.0795375 | G60: of:=IF([.D60]=1;"";[.D60]) -> 0.0795375
A61: 29 | B61: sysfs_streq: &"kpfhx"{\0} &"kpflo"{\0} :=> \0 | C61: 0 | D61: 0.0250591 | F61: of:=IF([.C61]=1;"";[.C61]) -> 0 | G61: of:=IF([.D61]=1;"";[.D61]) -> 0.0250591
A62: 30 | B62: sysfs_streq: &"ifn\n"{\0,\0} &"ifn"{\0,a,\0} :=> \x01 | C62: 0.0731114 | F62: of:=IF([.C62]=1;"";[.C62]) -> 0.0731114 | G62: of:=IF([.D62]=1;"";[.D62]) ->  
A63: 31 | B63: sysfs_streq: &"ksw\n"{\0,\0} &"kswum"{\0} :=> \0 | C63: 0.0250709 | F63: of:=IF([.C63]=1;"";[.C63]) -> 0.0250709 | G63: of:=IF([.D63]=1;"";[.D63]) ->  
A64: 32 | B64: sysfs_streq: &"qmy\na"{\0} &"qmysp"{\0} :=> \0 | C64: 0 | F64: of:=IF([.C64]=1;"";[.C64]) -> 0 | G64: of:=IF([.D64]=1;"";[.D64]) ->  
A65: 33 | B65: sysfs_streq: &"mojb"{\0,\0} &"mojbp"{\0} :=> \0 | C65: 0.0320892 | D65: 0.0195181 | F65: of:=IF([.C65]=1;"";[.C65]) -> 0.0320892 | G65: of:=IF([.D65]=1;"";[.D65]) -> 0.0195181
A66: 34 | B66: sysfs_streq: &"ljlw"{\0,\0} &"ljlw\n"{\0} :=> \x01 | C66: 0.0288258 | F66: of:=IF([.C66]=1;"";[.C66]) -> 0.0288258 | G66: of:=IF([.D66]=1;"";[.D66]) ->  
A67: 35 | B67: sysfs_streq: &"yjck"{\0,\0} &"yjck"{\0,\0} :=> \x01 | C67: 0.0305072 | D67: 0.0305072 | F67: of:=IF([.C67]=1;"";[.C67]) -> 0.0305072 | G67: of:=IF([.D67]=1;"";[.D67]) -> 0.0305072
A68: 36 | B68: sysfs_streq: &"kpfjd"{\0} &"kpfjt"{\0} :=> \0 | C68: 0.0186028 | D68: 0.0177468 | F68: of:=IF([.C68]=1;"";[.C68]) -> 0.0186028 | G68: of:=IF([.D68]=1;"";[.D68]) -> 0.0177468
A69: 37 | B69: sysfs_streq: &"pkuj\n"{\0} &"pkuj"{\0,\0} :=> \x01 | C69: 0.0352723 | F69: of:=IF([.C69]=1;"";[.C69]) -> 0.0352723 | G69: of:=IF([.D69]=1;"";[.D69]) ->  
A70: 38 | B70: sysfs_streq: &"skwr\n"{\0} &"skwrr"{\0} :=> \0 | C70: 0.0266185 | F70: of:=IF([.C70]=1;"";[.C70]) -> 0.0266185 | G70: of:=IF([.D70]=1;"";[.D70]) ->  
A71: 39 | B71: sysfs_streq: &"azvdf"{\0} &"azvdf"{\0} :=> \x01 | C71: 0.0209277 | D71: 0.0209277 | F71: of:=IF([.C71]=1;"";[.C71]) -> 0.0209277 | G71: of:=IF([.D71]=1;"";[.D71]) -> 0.0209277

Sheet: strcpy
A1: # | B1: Test Case | C1: N1 | D1: N2 | E1: N3 | O1: FINAL
A2: 1 | B2: strcpy: &""{\0,\x01,\x01,\x01,\x01,\x01} &"c"{\0,p,d,r,\0} :=> &"c"{\0,p,c,c,\0} | C2: 1 | D2: 1 | E2: 1 | G2: of:=IF([.C2]=1;"";[.C2]) ->  | H2: of:=IF([.D2]=1;"";[.D2]) ->  | I2: of:=IF([.E2]=1;"";[.E2]) ->  | K2: of:=AVERAGE([.G2:.G36]) -> 0.0782265541666667 | L2: of:=AVERAGE([.H2:.H36]) -> 0.0635304 | M2: of:=AVERAGE([.I2:.I36]) -> 0.0635304 | O2: of:=AVERAGE([.K2:.M2]) -> 0.0684291180555555
A3: 2 | B3: strcpy: &""{\0,\x01,\x01,\x01,\x01,\x01} &"xr"{\0,p,n,\0} :=> &"xr"{\0,p,i,\0} | C3: 1 | D3: 0.127187 | E3: 0.127187 | G3: of:=IF([.C3]=1;"";[.C3]) ->  | H3: of:=IF([.D3]=1;"";[.D3]) -> 0.127187 | I3: of:=IF([.E3]=1;"";[.E3]) -> 0.127187
A4: 3 | B4: strcpy: &""{\0,\x01,\x01,\x01,\x01,\x01} &"veu"{\0,p,\0} :=> &"veu"{\0,p,\0} | C4: 1 | D4: 0.0841511 | E4: 0.0841511 | G4: of:=IF([.C4]=1;"";[.C4]) ->  | H4: of:=IF([.D4]=1;"";[.D4]) -> 0.0841511 | I4: of:=IF([.E4]=1;"";[.E4]) -> 0.0841511
A5: 4 | B5: strcpy: &""{\0,\x01,\x01,\x01,\x01,\x01} &"dpxx"{\0,\0} :=> &"dpxx"{\0,\0} | C5: 1 | D5: 0 | E5: 0 | G5: of:=IF([.C5]=1;"";[.C5]) ->  | H5: of:=IF([.D5]=1;"";[.D5]) -> 0 | I5: of:=IF([.E5]=1;"";[.E5]) -> 0
A6: 5 | B6: strcpy: &""{\0,\x01,\x01,\x01,\x01,\x01} &"zivxz"{\0} :=> &"zivxz"{\0} | C6: 1 | D6: 0 | E6: 0 | G6: of:=IF([.C6]=1;"";[.C6]) ->  | H6: of:=IF([.D6]=1;"";[.D6]) -> 0 | I6: of:=IF([.E6]=1;"";[.E6]) -> 0
A7: 6 | B7: strcpy: &"q"{\0,\x01,\x01,\x01,\x01} &""{\0,p,e,a,g,\0} :=> &""{\0,\0,p,s,j,\0} | C7: 1 | D7: 1 | E7: 1 | G7: of:=IF([.C7]=1;"";[.C7]) ->  | H7: of:=IF([.D7]=1;"";[.D7]) ->  | I7: of:=IF([.E7]=1;"";[.E7]) -> 
A8: 7 | B8: strcpy: &"z"{\0,\x01,\x01,\x01,\x01} &"b"{\0,p,x,v,\0} :=> &"b"{\0,p,m,u,\0} | C8: 1 | D8: 1 | E8: 1 | G8: of:=IF([.C8]=1;"";[.C8]) ->  | H8: of:=IF([.D8]=1;"";[.D8]) ->  | I8: of:=IF([.E8]=1;"";[.E8]) -> 
A9: 8 | B9: strcpy: &"t"{\0,\x01,\x01,\x01,\x01} &"cx"{\0,p,g,\0} :=> &"cx"{\0,p,m,\0} | C9: 1 | D9: 0.106758 | E9: 0.106758 | G9: of:=IF([.C9]=1;"";[.C9]) ->  | H9: of:=IF([.D9]=1;"";[.D9]) -> 0.106758 | I9: of:=IF([.E9]=1;"";[.E9]) -> 0.106758
A10: 9 | B10: strcpy: &"h"{\0,\x01,\x01,\x01,\x01} &"ifz"{\0,p,\0} :=> &"ifz"{\0,p,\0} | C10: 1 | D10: 0.063185 | E10: 0.063185 | G10: of:=IF([.C10]=1;"";[.C10]) ->  | H10: of:=IF([.D10]=1;"";[.D10]) -> 0.063185 | I10: of:=IF([.E10]=1;"";[.E10]) -> 0.063185
A11: 10 | B11: strcpy: &"d"{\0,\x01,\x01,\x01,\x01} &"rstb"{\0,\0} :=> &"rstb"{\0,\0} | C11: 1 | D11: 0.0458418 | E11: 0.0458418 | G11: of:=IF([.C11]=1;"";[.C11]) ->  | H11: of:=IF([.D11]=1;"";[.D11]) -> 0.0458418 | I11: of:=IF([.E11]=1;"";[.E11]) -> 0.0458418
A12: 11 | B12: strcpy: &"n"{\0,\x01,\x01,\x01,\x01} &"ckclj"{\0} :=> &"ckclj"{\0} | C12: 1 | D12: 0.0226432 | E12: 0.0226432 | G12: of:=IF([.C12]=1;"";[.C12]) ->  | H12: of:=IF([.D12]=1;"";[.D12]) -> 0.0226432 | I12: of:=IF([.E12]=1;"";[.E12]) -> 0.0226432
A13: 12 | B13: strcpy: &"zj"{\0,\x01,\x01,\x01} &""{\0,p,l,t,s,\0} :=> &""{\0,j,\0,p,j,\0} | C13: 0.106758 | D13: 1 | E13: 1 | G13: of:=IF([.C13]=1;"";[.C13]) -> 0.106758 | H13: of:=IF([.D13]=1;"";[.D13]) ->  | I13: of:=IF([.E13]=1;"";[.E13]) -> 
A14: 13 | B14: strcpy: &"ir"{\0,\x01,\x01,\x01} &"z"{\0,p,v,s,\0} :=> &"z"{\0,\0,p,d,\0} | C14: 0.217558 | D14: 1 | E14: 1 | G14: of:=IF([.C14]=1;"";[.C14]) -> 0.217558 | H14: of:=IF([.D14]=1;"";[.D14]) ->  | I14: of:=IF([.E14]=1;"";[.E14]) -> 
A15: 14 | B15: strcpy: &"tm"{\0,\x01,\x01,\x01} &"qh"{\0,p,v,\0} :=> &"qh"{\0,p,a,\0} | C15: 0.207409 | D15: 0 | E15: 0 | G15: of:=IF([.C15]=1;"";[.C15]) -> 0.207409 | H15: of:=IF([.D15]=1;"";[.D15]) -> 0 | I15: of:=IF([.E15]=1;"";[.E15]) -> 0
A16: 15 | B16: strcpy: &"bv"{\0,\x01,\x01,\x01} &"yhl"{\0,p,\0} :=> &"yhl"{\0,p,\0} | C16: 0.190869 | D16: 0.0725928 | E16: 0.0725928 | G16: of:=IF([.C16]=1;"";[.C16]) -> 0.190869 | H16: of:=IF([.D16]=1;"";[.D16]) -> 0.0725928 | I16: of:=IF([.E16]=1;"";[.E16]) -> 0.0725928
A17: 16 | B17: strcpy: &"ci"{\0,\x01,\x01,\x01} &"wukl"{\0,\0} :=> &"wukl"{\0,\0} | C17: 0.216638 | D17: 0.0364135 | E17: 0.0364135 | G17: of:=IF([.C17]=1;"";[.C17]) -> 0.216638 | H17: of:=IF([.D17]=1;"";[.D17]) -> 0.0364135 | I17: of:=IF([.E17]=1;"";[.E17]) -> 0.0364135
A18: 17 | B18: strcpy: &"dj"{\0,\x01,\x01,\x01} &"muxgo"{\0} :=> &"muxgo"{\0} | C18: 0.194103 | D18: 0.0198852 | E18: 0.0198852 | G18: of:=IF([.C18]=1;"";[.C18]) -> 0.194103 | H18: of:=IF([.D18]=1;"";[.D18]) -> 0.0198852 | I18: of:=IF([.E18]=1;"";[.E18]) -> 0.0198852
A19: 18 | B19: strcpy: &"bhj"{\0,\x01,\x01} &""{\0,p,x,d,c,\0} :=> &""{\0,h,j,\0,p,\0} | C19: 0.0580845 | D19: 1 | E19: 1 | G19: of:=IF([.C19]=1;"";[.C19]) -> 0.0580845 | H19: of:=IF([.D19]=1;"";[.D19]) ->  | I19: of:=IF([.E19]=1;"";[.E19]) -> 
A20: 19 | B20: strcpy: &"yzv"{\0,\x01,\x01} &"n"{\0,p,e,m,\0} :=> &"n"{\0,v,\0,p,\0} | C20: 0.0646028 | D20: 1 | E20: 1 | G20: of:=IF([.C20]=1;"";[.C20]) -> 0.0646028 | H20: of:=IF([.D20]=1;"";[.D20]) ->  | I20: of:=IF([.E20]=1;"";[.E20]) -> 
A21: 20 | B21: strcpy: &"nfy"{\0,\x01,\x01} &"kb"{\0,p,h,\0} :=> &"kb"{\0,\0,p,\0} | C21: 0.078374 | D21: 0.189015 | E21: 0.189015 | G21: of:=IF([.C21]=1;"";[.C21]) -> 0.078374 | H21: of:=IF([.D21]=1;"";[.D21]) -> 0.189015 | I21: of:=IF([.E21]=1;"";[.E21]) -> 0.189015
A22: 21 | B22: strcpy: &"cdj"{\0,\x01,\x01} &"oii"{\0,p,\0} :=> &"oii"{\0,p,\0} | C22: 0.0687797 | D22: 0.0770616 | E22: 0.0770616 | G22: of:=IF([.C22]=1;"";[.C22]) -> 0.0687797 | H22: of:=IF([.D22]=1;"";[.D22]) -> 0.0770616 | I22: of:=IF([.E22]=1;"";[.E22]) -> 0.0770616
A23: 22 | B23: strcpy: &"ceg"{\0,\x01,\x01} &"awtz"{\0,\0} :=> &"awtz"{\0,\0} | C23: 0.0868842 | D23: 0.0408999 | E23: 0.0408999 | G23: of:=IF([.C23]=1;"";[.C23]) -> 0.0868842 | H23: of:=IF([.D23]=1;"";[.D23]) -> 0.0408999 | I23: of:=IF([.E23]=1;"";[.E23]) -> 0.0408999
A24: 23 | B24: strcpy: &"uan"{\0,\x01,\x01} &"xunbb"{\0} :=> &"xunbb"{\0} | C24: 0.0881785 | D24: 0.026496 | E24: 0.026496 | G24: of:=IF([.C24]=1;"";[.C24]) -> 0.0881785 | H24: of:=IF([.D24]=1;"";[.D24]) -> 0.026496 | I24: of:=IF([.E24]=1;"";[.E24]) -> 0.026496
A25: 24 | B25: strcpy: &"apal"{\0,\x01} &""{\0,p,m,r,w,\0} :=> &""{\0,p,a,l,\0,\0} | C25: 0.0478193 | D25: 1 | E25: 1 | G25: of:=IF([.C25]=1;"";[.C25]) -> 0.0478193 | H25: of:=IF([.D25]=1;"";[.D25]) ->  | I25: of:=IF([.E25]=1;"";[.E25]) -> 
A26: 25 | B26: strcpy: &"nrdu"{\0,\x01} &"l"{\0,p,i,w,\0} :=> &"l"{\0,d,u,\0,\0} | C26: 0.0438759 | D26: 1 | E26: 1 | G26: of:=IF([.C26]=1;"";[.C26]) -> 0.0438759 | H26: of:=IF([.D26]=1;"";[.D26]) ->  | I26: of:=IF([.E26]=1;"";[.E26]) -> 
A27: 26 | B27: strcpy: &"pqql"{\0,\x01} &"ae"{\0,p,i,\0} :=> &"ae"{\0,l,\0,\0} | C27: 0.0160024 | D27: 0.204279 | E27: 0.204279 | G27: of:=IF([.C27]=1;"";[.C27]) -> 0.0160024 | H27: of:=IF([.D27]=1;"";[.D27]) -> 0.204279 | I27: of:=IF([.E27]=1;"";[.E27]) -> 0.204279
A28: 27 | B28: strcpy: &"naex"{\0,\x01} &"xqf"{\0,p,\0} :=> &"xqf"{\0,\0,\0} | C28: 0.0450585 | D28: 0.0410386 | E28: 0.0410386 | G28: of:=IF([.C28]=1;"";[.C28]) -> 0.0450585 | H28: of:=IF([.D28]=1;"";[.D28]) -> 0.0410386 | I28: of:=IF([.E28]=1;"";[.E28]) -> 0.0410386
A29: 28 | B29: strcpy: &"sbaf"{\0,\x01} &"skra"{\0,\0} :=> &"skra"{\0,\0} | C29: 0.0436594 | D29: 0.0437409 | E29: 0.0437409 | G29: of:=IF([.C29]=1;"";[.C29]) -> 0.0436594 | H29: of:=IF([.D29]=1;"";[.D29]) -> 0.0437409 | I29: of:=IF([.E29]=1;"";[.E29]) -> 0.0437409
A30: 29 | B30: strcpy: &"arzn"{\0,\x01} &"bsyjv"{\0} :=> &"bsyjv"{\0} | C30: 0.0376926 | D30: 0.015982 | E30: 0.015982 | G30: of:=IF([.C30]=1;"";[.C30]) -> 0.0376926 | H30: of:=IF([.D30]=1;"";[.D30]) -> 0.015982 | I30: of:=IF([.E30]=1;"";[.E30]) -> 0.015982
A31: 30 | B31: strcpy: &"kigab"{\0} &""{\0,p,o,u,e,\0} :=> &""{\0,i,g,a,b,\0} | C31: 0.0299019 | D31: 1 | E31: 1 | G31: of:=IF([.C31]=1;"";[.C31]) -> 0.0299019 | H31: of:=IF([.D31]=1;"";[.D31]) ->  | I31: of:=IF([.E31]=1;"";[.E31]) -> 
A32: 31 | B32: strcpy: &"zkxkb"{\0} &"z"{\0,p,s,q,\0} :=> &"z"{\0,x,k,b,\0} | C32: 0 | D32: 1 | E32: 1 | G32: of:=IF([.C32]=1;"";[.C32]) -> 0 | H32: of:=IF([.D32]=1;"";[.D32]) ->  | I32: of:=IF([.E32]=1;"";[.E32]) -> 
A33: 32 | B33: strcpy: &"vhblp"{\0} &"wc"{\0,p,c,\0} :=> &"wc"{\0,l,p,\0} | C33: 0.020581 | D33: 0.184011 | E33: 0.184011 | G33: of:=IF([.C33]=1;"";[.C33]) -> 0.020581 | H33: of:=IF([.D33]=1;"";[.D33]) -> 0.184011 | I33: of:=IF([.E33]=1;"";[.E33]) -> 0.184011
A34: 33 | B34: strcpy: &"xzrye"{\0} &"icu"{\0,p,\0} :=> &"icu"{\0,e,\0} | C34: 0 | D34: 0.0873347 | E34: 0.0873347 | G34: of:=IF([.C34]=1;"";[.C34]) -> 0 | H34: of:=IF([.D34]=1;"";[.D34]) -> 0.0873347 | I34: of:=IF([.E34]=1;"";[.E34]) -> 0.0873347
A35: 34 | B35: strcpy: &"gtjvd"{\0} &"czvi"{\0,\0} :=> &"czvi"{\0,\0} | C35: 0.0146076 | D35: 0.0362133 | E35: 0.0362133 | G35: of:=IF([.C35]=1;"";[.C35]) -> 0.0146076 | H35: of:=IF([.D35]=1;"";[.D35]) -> 0.0362133 | I35: of:=IF([.E35]=1;"";[.E35]) -> 0.0362133
A36: 35 | B36: strcpy: &"ibxww"{\0} &"wifpx"{\0} :=> &"wifpx"{\0} | C36: 0 | D36: 0 | E36: 0 | G36: of:=IF([.C36]=1;"";[.C36]) -> 0 | H36: of:=IF([.D36]=1;"";[.D36]) -> 0 | I36: of:=IF([.E36]=1;"";[.E36]) -> 0
A37: 1 | B37: strncpy: &""{\0,\x01,\x01,\x01,\x01,\x01} &""{\0,p,y,d,q,\0} 5 :=> &""{\0,\0,\0,\0,\0,\0} | C37: 1 | D37: 1 | E37: 1 | G37: of:=IF([.C37]=1;"";[.C37]) ->  | H37: of:=IF([.D37]=1;"";[.D37]) ->  | I37: of:=IF([.E37]=1;"";[.E37]) ->  | K37: of:=AVERAGE([.G37:.G72]) -> 0.07412525 | L37: of:=AVERAGE([.H37:.H72]) -> 0.07710635 | M37: of:=AVERAGE([.I37:.I72]) -> 0.07710635 | O37: of:=AVERAGE([.K37:.M37]) -> 0.07611265
A38: 2 | B38: strncpy: &""{\0,\x01,\x01,\x01,\x01,\x01} &"w"{\0,p,w,k,\0} 5 :=> &"w"{\0,\0,\0,\0,\0} | C38: 1 | D38: 1 | E38: 1 | G38: of:=IF([.C38]=1;"";[.C38]) ->  | H38: of:=IF([.D38]=1;"";[.D38]) ->  | I38: of:=IF([.E38]=1;"";[.E38]) -> 
A39: 3 | B39: strncpy: &""{\0,\x01,\x01,\x01,\x01,\x01} &"sz"{\0,p,x,\0} 5 :=> &"sz"{\0,\0,\0,\0} | C39: 1 | D39: 0.183097 | E39: 0.183097 | G39: of:=IF([.C39]=1;"";[.C39]) ->  | H39: of:=IF([.D39]=1;"";[.D39]) -> 0.183097 | I39: of:=IF([.E39]=1;"";[.E39]) -> 0.183097
A40: 4 | B40: strncpy: &""{\0,\x01,\x01,\x01,\x01,\x01} &"wqi"{\0,p,\0} 5 :=> &"wqi"{\0,\0,\0} | C40: 1 | D40: 0.0539936 | E40: 0.0539936 | G40: of:=IF([.C40]=1;"";[.C40]) ->  | H40: of:=IF([.D40]=1;"";[.D40]) -> 0.0539936 | I40: of:=IF([.E40]=1;"";[.E40]) -> 0.0539936
A41: 5 | B41: strncpy: &""{\0,\x01,\x01,\x01,\x01,\x01} &"imae"{\0,\0} 5 :=> &"imae"{\0,\0} | C41: 1 | D41: 0.045572 | E41: 0.045572 | G41: of:=IF([.C41]=1;"";[.C41]) ->  | H41: of:=IF([.D41]=1;"";[.D41]) -> 0.045572 | I41: of:=IF([.E41]=1;"";[.E41]) -> 0.045572
A42: 6 | B42: strncpy: &""{\0,\x01,\x01,\x01,\x01,\x01} &"icmmx"{\0} 5 :=> &"icmmx"{\0} | C42: 1 | D42: 0 | E42: 0 | G42: of:=IF([.C42]=1;"";[.C42]) ->  | H42: of:=IF([.D42]=1;"";[.D42]) -> 0 | I42: of:=IF([.E42]=1;"";[.E42]) -> 0
A43: 7 | B43: strncpy: &"n"{\0,\x01,\x01,\x01,\x01} &""{\0,p,l,w,b,\0} 5 :=> &""{\0,\0,\0,\0,\0,\0} | C43: 1 | D43: 1 | E43: 1 | G43: of:=IF([.C43]=1;"";[.C43]) ->  | H43: of:=IF([.D43]=1;"";[.D43]) ->  | I43: of:=IF([.E43]=1;"";[.E43]) -> 
A44: 8 | B44: strncpy: &"u"{\0,\x01,\x01,\x01,\x01} &"i"{\0,p,e,l,\0} 5 :=> &"i"{\0,\0,\0,\0,\0} | C44: 1 | D44: 1 | E44: 1 | G44: of:=IF([.C44]=1;"";[.C44]) ->  | H44: of:=IF([.D44]=1;"";[.D44]) ->  | I44: of:=IF([.E44]=1;"";[.E44]) -> 
A45: 9 | B45: strncpy: &"e"{\0,\x01,\x01,\x01,\x01} &"aa"{\0,p,i,\0} 5 :=> &"aa"{\0,\0,\0,\0} | C45: 1 | D45: 0.193065 | E45: 0.193065 | G45: of:=IF([.C45]=1;"";[.C45]) ->  | H45: of:=IF([.D45]=1;"";[.D45]) -> 0.193065 | I45: of:=IF([.E45]=1;"";[.E45]) -> 0.193065
A46: 10 | B46: strncpy: &"c"{\0,\x01,\x01,\x01,\x01} &"suz"{\0,p,\0} 5 :=> &"suz"{\0,\0,\0} | C46: 1 | D46: 0.0790199 | E46: 0.0790199 | G46: of:=IF([.C46]=1;"";[.C46]) ->  | H46: of:=IF([.D46]=1;"";[.D46]) -> 0.0790199 | I46: of:=IF([.E46]=1;"";[.E46]) -> 0.0790199
A47: 11 | B47: strncpy: &"b"{\0,\x01,\x01,\x01,\x01} &"npjm"{\0,\0} 5 :=> &"npjm"{\0,\0} | C47: 1 | D47: 0.0317323 | E47: 0.0317323 | G47: of:=IF([.C47]=1;"";[.C47]) ->  | H47: of:=IF([.D47]=1;"";[.D47]) -> 0.0317323 | I47: of:=IF([.E47]=1;"";[.E47]) -> 0.0317323
A48: 12 | B48: strncpy: &"n"{\0,\x01,\x01,\x01,\x01} &"dsbzh"{\0} 5 :=> &"dsbzh"{\0} | C48: 1 | D48: 0.0213662 | E48: 0.0213662 | G48: of:=IF([.C48]=1;"";[.C48]) ->  | H48: of:=IF([.D48]=1;"";[.D48]) -> 0.0213662 | I48: of:=IF([.E48]=1;"";[.E48]) -> 0.0213662
A49: 13 | B49: strncpy: &"by"{\0,\x01,\x01,\x01} &""{\0,p,y,d,r,\0} 5 :=> &""{\0,\0,\0,\0,\0,\0} | C49: 0.215236 | D49: 1 | E49: 1 | G49: of:=IF([.C49]=1;"";[.C49]) -> 0.215236 | H49: of:=IF([.D49]=1;"";[.D49]) ->  | I49: of:=IF([.E49]=1;"";[.E49]) -> 
A50: 14 | B50: strncpy: &"qp"{\0,\x01,\x01,\x01} &"p"{\0,p,y,z,\0} 5 :=> &"p"{\0,\0,\0,\0,\0} | C50: 0 | D50: 1 | E50: 1 | G50: of:=IF([.C50]=1;"";[.C50]) -> 0 | H50: of:=IF([.D50]=1;"";[.D50]) ->  | I50: of:=IF([.E50]=1;"";[.E50]) -> 
A51: 15 | B51: strncpy: &"gi"{\0,\x01,\x01,\x01} &"ae"{\0,p,k,\0} 5 :=> &"ae"{\0,\0,\0,\0} | C51: 0.213322 | D51: 0.204279 | E51: 0.204279 | G51: of:=IF([.C51]=1;"";[.C51]) -> 0.213322 | H51: of:=IF([.D51]=1;"";[.D51]) -> 0.204279 | I51: of:=IF([.E51]=1;"";[.E51]) -> 0.204279
A52: 16 | B52: strncpy: &"io"{\0,\x01,\x01,\x01} &"ofm"{\0,p,\0} 5 :=> &"ofm"{\0,\0,\0} | C52: 0.221126 | D52: 0.0780088 | E52: 0.0780088 | G52: of:=IF([.C52]=1;"";[.C52]) -> 0.221126 | H52: of:=IF([.D52]=1;"";[.D52]) -> 0.0780088 | I52: of:=IF([.E52]=1;"";[.E52]) -> 0.0780088
A53: 17 | B53: strncpy: &"hq"{\0,\x01,\x01,\x01} &"jjin"{\0,\0} 5 :=> &"jjin"{\0,\0} | C53: 0.1762 | D53: 0.0340389 | E53: 0.0340389 | G53: of:=IF([.C53]=1;"";[.C53]) -> 0.1762 | H53: of:=IF([.D53]=1;"";[.D53]) -> 0.0340389 | I53: of:=IF([.E53]=1;"";[.E53]) -> 0.0340389
A54: 18 | B54: strncpy: &"tr"{\0,\x01,\x01,\x01} &"emjlk"{\0} 5 :=> &"emjlk"{\0} | C54: 0.218916 | D54: 0.0198832 | E54: 0.0198832 | G54: of:=IF([.C54]=1;"";[.C54]) -> 0.218916 | H54: of:=IF([.D54]=1;"";[.D54]) -> 0.0198832 | I54: of:=IF([.E54]=1;"";[.E54]) -> 0.0198832
A55: 19 | B55: strncpy: &"ajr"{\0,\x01,\x01} &""{\0,p,z,j,h,\0} 5 :=> &""{\0,\0,\0,\0,\0,\0} | C55: 0.0536589 | D55: 1 | E55: 1 | G55: of:=IF([.C55]=1;"";[.C55]) -> 0.0536589 | H55: of:=IF([.D55]=1;"";[.D55]) ->  | I55: of:=IF([.E55]=1;"";[.E55]) -> 
A56: 20 | B56: strncpy: &"uoj"{\0,\x01,\x01} &"a"{\0,p,p,y,\0} 5 :=> &"a"{\0,\0,\0,\0,\0} | C56: 0.0761496 | D56: 1 | E56: 1 | G56: of:=IF([.C56]=1;"";[.C56]) -> 0.0761496 | H56: of:=IF([.D56]=1;"";[.D56]) ->  | I56: of:=IF([.E56]=1;"";[.E56]) -> 
A57: 21 | B57: strncpy: &"xrx"{\0,\x01,\x01} &"vi"{\0,p,y,\0} 5 :=> &"vi"{\0,\0,\0,\0} | C57: 0.0485402 | D57: 0.218014 | E57: 0.218014 | G57: of:=IF([.C57]=1;"";[.C57]) -> 0.0485402 | H57: of:=IF([.D57]=1;"";[.D57]) -> 0.218014 | I57: of:=IF([.E57]=1;"";[.E57]) -> 0.218014
A58: 22 | B58: strncpy: &"ife"{\0,\x01,\x01} &"rbk"{\0,p,\0} 5 :=> &"rbk"{\0,\0,\0} | C58: 0.0853307 | D58: 0.0656019 | E58: 0.0656019 | G58: of:=IF([.C58]=1;"";[.C58]) -> 0.0853307 | H58: of:=IF([.D58]=1;"";[.D58]) -> 0.0656019 | I58: of:=IF([.E58]=1;"";[.E58]) -> 0.0656019
A59: 23 | B59: strncpy: &"goi"{\0,\x01,\x01} &"exeu"{\0,\0} 5 :=> &"exeu"{\0,\0} | C59: 0.0841133 | D59: 0.0434054 | E59: 0.0434054 | G59: of:=IF([.C59]=1;"";[.C59]) -> 0.0841133 | H59: of:=IF([.D59]=1;"";[.D59]) -> 0.0434054 | I59: of:=IF([.E59]=1;"";[.E59]) -> 0.0434054
A60: 24 | B60: strncpy: &"csk"{\0,\x01,\x01} &"wwdve"{\0} 5 :=> &"wwdve"{\0} | C60: 0.0807033 | D60: 0.0230859 | E60: 0.0230859 | G60: of:=IF([.C60]=1;"";[.C60]) -> 0.0807033 | H60: of:=IF([.D60]=1;"";[.D60]) -> 0.0230859 | I60: of:=IF([.E60]=1;"";[.E60]) -> 0.0230859
A61: 25 | B61: strncpy: &"uxyk"{\0,\x01} &""{\0,p,o,l,c,\0} 5 :=> &""{\0,\0,\0,\0,\0,\0} | C61: 0.0348896 | D61: 1 | E61: 1 | G61: of:=IF([.C61]=1;"";[.C61]) -> 0.0348896 | H61: of:=IF([.D61]=1;"";[.D61]) ->  | I61: of:=IF([.E61]=1;"";[.E61]) -> 
A62: 26 | B62: strncpy: &"joek"{\0,\x01} &"x"{\0,p,w,p,\0} 5 :=> &"x"{\0,\0,\0,\0,\0} | C62: 0.0432359 | D62: 1 | E62: 1 | G62: of:=IF([.C62]=1;"";[.C62]) -> 0.0432359 | H62: of:=IF([.D62]=1;"";[.D62]) ->  | I62: of:=IF([.E62]=1;"";[.E62]) -> 
A63: 27 | B63: strncpy: &"zmvf"{\0,\x01} &"rk"{\0,p,n,\0} 5 :=> &"rk"{\0,\0,\0,\0} | C63: 0 | D63: 0.215236 | E63: 0.215236 | G63: of:=IF([.C63]=1;"";[.C63]) -> 0 | H63: of:=IF([.D63]=1;"";[.D63]) -> 0.215236 | I63: of:=IF([.E63]=1;"";[.E63]) -> 0.215236
A64: 28 | B64: strncpy: &"cleg"{\0,\x01} &"qqe"{\0,p,\0} 5 :=> &"qqe"{\0,\0,\0} | C64: 0.0462409 | D64: 0.0306161 | E64: 0.0306161 | G64: of:=IF([.C64]=1;"";[.C64]) -> 0.0462409 | H64: of:=IF([.D64]=1;"";[.D64]) -> 0.0306161 | I64: of:=IF([.E64]=1;"";[.E64]) -> 0.0306161
A65: 29 | B65: strncpy: &"aqyg"{\0,\x01} &"rqbj"{\0,\0} 5 :=> &"rqbj"{\0,\0} | C65: 0 | D65: 0.0294658 | E65: 0.0294658 | G65: of:=IF([.C65]=1;"";[.C65]) -> 0 | H65: of:=IF([.D65]=1;"";[.D65]) -> 0.0294658 | I65: of:=IF([.E65]=1;"";[.E65]) -> 0.0294658
A66: 30 | B66: strncpy: &"moph"{\0,\x01} &"oesjw"{\0} 5 :=> &"oesjw"{\0} | C66: 0.0462143 | D66: 0 | E66: 0 | G66: of:=IF([.C66]=1;"";[.C66]) -> 0.0462143 | H66: of:=IF([.D66]=1;"";[.D66]) -> 0 | I66: of:=IF([.E66]=1;"";[.E66]) -> 0
A67: 31 | B67: strncpy: &"iewxs"{\0} &""{\0,p,p,q,j,\0} 5 :=> &""{\0,\0,\0,\0,\0,\0} | C67: 0 | D67: 1 | E67: 1 | G67: of:=IF([.C67]=1;"";[.C67]) -> 0 | H67: of:=IF([.D67]=1;"";[.D67]) ->  | I67: of:=IF([.E67]=1;"";[.E67]) -> 
A68: 32 | B68: strncpy: &"fuzmt"{\0} &"a"{\0,p,l,u,\0} 5 :=> &"a"{\0,\0,\0,\0,\0} | C68: 0.0230277 | D68: 1 | E68: 1 | G68: of:=IF([.C68]=1;"";[.C68]) -> 0.0230277 | H68: of:=IF([.D68]=1;"";[.D68]) ->  | I68: of:=IF([.E68]=1;"";[.E68]) -> 
A69: 33 | B69: strncpy: &"onxff"{\0} &"hz"{\0,p,g,\0} 5 :=> &"hz"{\0,\0,\0,\0} | C69: 0.0260529 | D69: 0.14931 | E69: 0.14931 | G69: of:=IF([.C69]=1;"";[.C69]) -> 0.0260529 | H69: of:=IF([.D69]=1;"";[.D69]) -> 0.14931 | I69: of:=IF([.E69]=1;"";[.E69]) -> 0.14931
A70: 34 | B70: strncpy: &"jitrh"{\0} &"uko"{\0,p,\0} 5 :=> &"uko"{\0,\0,\0} | C70: 0.0278003 | D70: 0.0752395 | E70: 0.0752395 | G70: of:=IF([.C70]=1;"";[.C70]) -> 0.0278003 | H70: of:=IF([.D70]=1;"";[.D70]) -> 0.0752395 | I70: of:=IF([.E70]=1;"";[.E70]) -> 0.0752395
A71: 35 | B71: strncpy: &"areex"{\0} &"ihwl"{\0,\0} 5 :=> &"ihwl"{\0,\0} | C71: 0.0316126 | D71: 0.0382187 | E71: 0.0382187 | G71: of:=IF([.C71]=1;"";[.C71]) -> 0.0316126 | H71: of:=IF([.D71]=1;"";[.D71]) -> 0.0382187 | I71: of:=IF([.E71]=1;"";[.E71]) -> 0.0382187
A72: 36 | B72: strncpy: &"roydc"{\0} &"kouvj"{\0} 5 :=> &"kouvj"{\0} | C72: 0.0266358 | D72: 0.0183032 | E72: 0.0183032 | G72: of:=IF([.C72]=1;"";[.C72]) -> 0.0266358 | H72: of:=IF([.D72]=1;"";[.D72]) -> 0.0183032 | I72: of:=IF([.E72]=1;"";[.E72]) -> 0.0183032

Sheet: strcat
A1: # | B1: Test Case | C1: N1 | D1: N2 | E1: N3
A2: 1 | B2: strcat: &""{\0,\x01,\x01,\x01,\x01,\x01,\x01,\x01,\x01,\x01} &"v"{\0,p,e,\0} :=> &"v"{\0,p,r,u,p,e,z,w,\0} | C2: 1 | D2: 1 | E2: 1 | G2: of:=IF([.C2]=1;"";[.C2]) ->  | H2: of:=IF([.D2]=1;"";[.D2]) ->  | I2: of:=IF([.E2]=1;"";[.E2]) ->  | K2: of:=AVERAGE([.G2:.G41]) -> 0.0518848170967742 | L2: of:=AVERAGE([.H2:.H41]) -> 0.101032876363636 | M2: of:=AVERAGE([.I2:.I41]) -> 0.0364437986486487 | O2: of:=AVERAGE([.K2:.M2]) -> 0.0631204973696864
A3: 2 | B3: strcat: &""{\0,\x01,\x01,\x01,\x01,\x01,\x01,\x01,\x01,\x01} &"li"{\0,p,\0} :=> &"li"{\0,p,k,o,f,y,n,\0} | C3: 1 | D3: 0.22156 | E3: 0.22156 | G3: of:=IF([.C3]=1;"";[.C3]) ->  | H3: of:=IF([.D3]=1;"";[.D3]) -> 0.22156 | I3: of:=IF([.E3]=1;"";[.E3]) -> 0.22156
A4: 3 | B4: strcat: &""{\0,\x01,\x01,\x01,\x01,\x01,\x01,\x01,\x01,\x01} &"uhp"{\0,\0} :=> &"uhp"{\0,p,e,u,r,i,\0} | C4: 1 | D4: 0.0666728 | E4: 0.0666728 | G4: of:=IF([.C4]=1;"";[.C4]) ->  | H4: of:=IF([.D4]=1;"";[.D4]) -> 0.0666728 | I4: of:=IF([.E4]=1;"";[.E4]) -> 0.0666728
A5: 4 | B5: strcat: &""{\0,\x01,\x01,\x01,\x01,\x01,\x01,\x01,\x01,\x01} &"iunv"{\0} :=> &"iunv"{\0,p,o,d,l,\0} | C5: 1 | D5: 0.0439862 | E5: 0.0439862 | H5: of:=IF([.D5]=1;"";[.D5]) -> 0.0439862 | I5: of:=IF([.E5]=1;"";[.E5]) -> 0.0439862
A6: 5 | B6: strcat: &"d"{\0,\x01,\x01,\x01,\x01,\x01,\x01,\x01,\x01} &""{\0,p,f,n,\0} :=> &"d"{\0,p,f,s,w,y,b,j,\0} | C6: 1 | D6: 1 | E6: 1 | G6: of:=IF([.C6]=1;"";[.C6]) ->  | H6: of:=IF([.D6]=1;"";[.D6]) ->  | I6: of:=IF([.E6]=1;"";[.E6]) -> 
A7: 6 | B7: strcat: &"d"{\0,\x01,\x01,\x01,\x01,\x01,\x01,\x01,\x01} &"d"{\0,p,y,\0} :=> &"dd"{\0,p,y,r,n,p,y,\0} | C7: 1 | D7: 1 | E7: 0.208818 | G7: of:=IF([.C7]=1;"";[.C7]) ->  | H7: of:=IF([.D7]=1;"";[.D7]) ->  | I7: of:=IF([.E7]=1;"";[.E7]) -> 0.208818
A8: 7 | B8: strcat: &"q"{\0,\x01,\x01,\x01,\x01,\x01,\x01,\x01,\x01} &"ul"{\0,p,\0} :=> &"qul"{\0,p,d,w,h,y,\0} | C8: 1 | D8: 0.217558 | E8: 0.0856044 | G8: of:=IF([.C8]=1;"";[.C8]) ->  | H8: of:=IF([.D8]=1;"";[.D8]) -> 0.217558 | I8: of:=IF([.E8]=1;"";[.E8]) -> 0.0856044
A9: 8 | B9: strcat: &"b"{\0,\x01,\x01,\x01,\x01,\x01,\x01,\x01,\x01} &"yuq"{\0,\0} :=> &"byuq"{\0,p,y,g,y,\0} | C9: 1 | D9: 0.0668414 | E9: 0.0376832 | G9: of:=IF([.C9]=1;"";[.C9]) ->  | H9: of:=IF([.D9]=1;"";[.D9]) -> 0.0668414 | I9: of:=IF([.E9]=1;"";[.E9]) -> 0.0376832
A10: 9 | B10: strcat: &"u"{\0,\x01,\x01,\x01,\x01,\x01,\x01,\x01,\x01} &"rkva"{\0} :=> &"urkva"{\0,p,n,y,\0} | C10: 1 | D10: 0.04056 | E10: 0.0269441 | G10: of:=IF([.C10]=1;"";[.C10]) ->  | H10: of:=IF([.D10]=1;"";[.D10]) -> 0.04056 | I10: of:=IF([.E10]=1;"";[.E10]) -> 0.0269441
A11: 10 | B11: strcat: &"dm"{\0,\x01,\x01,\x01,\x01,\x01,\x01,\x01} &""{\0,p,b,u,\0} :=> &"dm"{\0,p,m,d,w,y,q,\0} | C11: 0.20532 | D11: 1 | E11: 0.20532 | G11: of:=IF([.C11]=1;"";[.C11]) -> 0.20532 | H11: of:=IF([.D11]=1;"";[.D11]) ->  | I11: of:=IF([.E11]=1;"";[.E11]) -> 0.20532
A12: 11 | B12: strcat: &"qf"{\0,\x01,\x01,\x01,\x01,\x01,\x01,\x01} &"p"{\0,p,r,\0} :=> &"qfp"{\0,p,n,w,y,b,\0} | C12: 0.106758 | D12: 1 | E12: 0.0380465 | G12: of:=IF([.C12]=1;"";[.C12]) -> 0.106758 | H12: of:=IF([.D12]=1;"";[.D12]) ->  | I12: of:=IF([.E12]=1;"";[.E12]) -> 0.0380465
A13: 12 | B13: strcat: &"gv"{\0,\x01,\x01,\x01,\x01,\x01,\x01,\x01} &"sb"{\0,p,\0} :=> &"gvsb"{\0,p,p,s,f,\0} | C13: 0.153382 | D13: 0.200533 | E13: 0.0320481 | G13: of:=IF([.C13]=1;"";[.C13]) -> 0.153382 | H13: of:=IF([.D13]=1;"";[.D13]) -> 0.200533 | I13: of:=IF([.E13]=1;"";[.E13]) -> 0.0320481
A14: 13 | B14: strcat: &"tu"{\0,\x01,\x01,\x01,\x01,\x01,\x01,\x01} &"qfk"{\0,\0} :=> &"tuqfk"{\0,p,l,a,\0} | C14: 0.215236 | D14: 0.0421183 | E14: 0.0163086 | G14: of:=IF([.C14]=1;"";[.C14]) -> 0.215236 | H14: of:=IF([.D14]=1;"";[.D14]) -> 0.0421183 | I14: of:=IF([.E14]=1;"";[.E14]) -> 0.0163086
A15: 14 | B15: strcat: &"ra"{\0,\x01,\x01,\x01,\x01,\x01,\x01,\x01} &"vwbd"{\0} :=> &"ravwbd"{\0,p,p,\0} | C15: 0.22156 | D15: 0 | E15: 0 | G15: of:=IF([.C15]=1;"";[.C15]) -> 0.22156 | H15: of:=IF([.D15]=1;"";[.D15]) -> 0 | I15: of:=IF([.E15]=1;"";[.E15]) -> 0
A16: 15 | B16: strcat: &"mww"{\0,\x01,\x01,\x01,\x01,\x01,\x01} &""{\0,p,d,c,\0} :=> &"mww"{\0,p,k,p,l,o,\0} | C16: 0.0551131 | D16: 1 | E16: 0.0551131 | G16: of:=IF([.C16]=1;"";[.C16]) -> 0.0551131 | H16: of:=IF([.D16]=1;"";[.D16]) ->  | I16: of:=IF([.E16]=1;"";[.E16]) -> 0.0551131
A17: 16 | B17: strcat: &"kcc"{\0,\x01,\x01,\x01,\x01,\x01,\x01} &"n"{\0,p,i,\0} :=> &"kccn"{\0,p,h,s,w,\0} | C17: 0.0699697 | D17: 1 | E17: 0.0340082 | G17: of:=IF([.C17]=1;"";[.C17]) -> 0.0699697 | H17: of:=IF([.D17]=1;"";[.D17]) ->  | I17: of:=IF([.E17]=1;"";[.E17]) -> 0.0340082
A18: 17 | B18: strcat: &"jqt"{\0,\x01,\x01,\x01,\x01,\x01,\x01} &"iu"{\0,p,\0} :=> &"jqtiu"{\0,p,l,h,\0} | C18: 0 | D18: 0.20123 | E18: 0 | G18: of:=IF([.C18]=1;"";[.C18]) -> 0 | H18: of:=IF([.D18]=1;"";[.D18]) -> 0.20123 | I18: of:=IF([.E18]=1;"";[.E18]) -> 0
A19: 18 | B19: strcat: &"ewq"{\0,\x01,\x01,\x01,\x01,\x01,\x01} &"swb"{\0,\0} :=> &"ewqswb"{\0,p,f,\0} | C19: 0.0602626 | D19: 0.0741019 | E19: 0.0117677 | G19: of:=IF([.C19]=1;"";[.C19]) -> 0.0602626 | H19: of:=IF([.D19]=1;"";[.D19]) -> 0.0741019 | I19: of:=IF([.E19]=1;"";[.E19]) -> 0.0117677
A20: 19 | B20: strcat: &"egi"{\0,\x01,\x01,\x01,\x01,\x01,\x01} &"wham"{\0} :=> &"egiwham"{\0,p,\0} | C20: 0.0844225 | D20: 0.0481626 | E20: 0.0159712 | G20: of:=IF([.C20]=1;"";[.C20]) -> 0.0844225 | H20: of:=IF([.D20]=1;"";[.D20]) -> 0.0481626 | I20: of:=IF([.E20]=1;"";[.E20]) -> 0.0159712
A21: 20 | B21: strcat: &"ucoo"{\0,\x01,\x01,\x01,\x01,\x01} &""{\0,p,s,c,\0} :=> &"ucoo"{\0,p,r,f,j,\0} | C21: 0.0473648 | D21: 1 | E21: 0.0473648 | G21: of:=IF([.C21]=1;"";[.C21]) -> 0.0473648 | H21: of:=IF([.D21]=1;"";[.D21]) ->  | I21: of:=IF([.E21]=1;"";[.E21]) -> 0.0473648
A22: 21 | B22: strcat: &"hrrl"{\0,\x01,\x01,\x01,\x01,\x01} &"g"{\0,p,k,\0} :=> &"hrrlg"{\0,p,g,x,\0} | C22: 0.0450883 | D22: 1 | E22: 0.0277195 | G22: of:=IF([.C22]=1;"";[.C22]) -> 0.0450883 | H22: of:=IF([.D22]=1;"";[.D22]) ->  | I22: of:=IF([.E22]=1;"";[.E22]) -> 0.0277195
A23: 22 | B23: strcat: &"qqvn"{\0,\x01,\x01,\x01,\x01,\x01} &"lm"{\0,p,\0} :=> &"qqvnlm"{\0,p,s,\0} | C23: 0.0203083 | D23: 0.206613 | E23: 0.0111743 | G23: of:=IF([.C23]=1;"";[.C23]) -> 0.0203083 | H23: of:=IF([.D23]=1;"";[.D23]) -> 0.206613 | I23: of:=IF([.E23]=1;"";[.E23]) -> 0.0111743
A24: 23 | B24: strcat: &"lylc"{\0,\x01,\x01,\x01,\x01,\x01} &"zxq"{\0,\0} :=> &"lylczxq"{\0,p,\0} | C24: 0.0428383 | D24: 0 | E24: 0 | G24: of:=IF([.C24]=1;"";[.C24]) -> 0.0428383 | H24: of:=IF([.D24]=1;"";[.D24]) -> 0 | I24: of:=IF([.E24]=1;"";[.E24]) -> 0
A25: 24 | B25: strcat: &"ftme"{\0,\x01,\x01,\x01,\x01,\x01} &"alsg"{\0} :=> &"ftmealsg"{\0,\0} | C25: 0.0456641 | D25: 0.043286 | E25: 0.0130542 | G25: of:=IF([.C25]=1;"";[.C25]) -> 0.0456641 | H25: of:=IF([.D25]=1;"";[.D25]) -> 0.043286 | I25: of:=IF([.E25]=1;"";[.E25]) -> 0.0130542
A26: 25 | B26: strcat: &"dqldf"{\0,\x01,\x01,\x01,\x01} &""{\0,p,c,p,\0} :=> &"dqldf"{\0,p,f,a,\0} | C26: 0.0188248 | D26: 1 | E26: 0.0188248 | G26: of:=IF([.C26]=1;"";[.C26]) -> 0.0188248 | H26: of:=IF([.D26]=1;"";[.D26]) ->  | I26: of:=IF([.E26]=1;"";[.E26]) -> 0.0188248
A27: 26 | B27: strcat: &"apaup"{\0,\x01,\x01,\x01,\x01} &"a"{\0,p,s,\0} :=> &"apaupa"{\0,p,j,\0} | C27: 0.0298994 | D27: 1 | E27: 0.0216495 | G27: of:=IF([.C27]=1;"";[.C27]) -> 0.0298994 | H27: of:=IF([.D27]=1;"";[.D27]) ->  | I27: of:=IF([.E27]=1;"";[.E27]) -> 0.0216495
A28: 27 | B28: strcat: &"svokc"{\0,\x01,\x01,\x01,\x01} &"gw"{\0,p,\0} :=> &"svokcgw"{\0,p,\0} | C28: 0.0235834 | D28: 0.183021 | E28: 0.00943301 | G28: of:=IF([.C28]=1;"";[.C28]) -> 0.0235834 | H28: of:=IF([.D28]=1;"";[.D28]) -> 0.183021 | I28: of:=IF([.E28]=1;"";[.E28]) -> 0.00943301
A29: 28 | B29: strcat: &"wkcnj"{\0,\x01,\x01,\x01,\x01} &"arc"{\0,\0} :=> &"wkcnjarc"{\0,\0} | C29: 0.0207622 | D29: 0.0880066 | E29: 0.0103483 | G29: of:=IF([.C29]=1;"";[.C29]) -> 0.0207622 | H29: of:=IF([.D29]=1;"";[.D29]) -> 0.0880066 | I29: of:=IF([.E29]=1;"";[.E29]) -> 0.0103483
A30: 29 | B30: strcat: &"wupsu"{\0,\x01,\x01,\x01,\x01} &"cqtv"{\0} :=> &"wupsucqtv"{\0} | C30: 0.0259264 | D30: 0.0295406 | E30: 0.00819071 | G30: of:=IF([.C30]=1;"";[.C30]) -> 0.0259264 | H30: of:=IF([.D30]=1;"";[.D30]) -> 0.0295406 | I30: of:=IF([.E30]=1;"";[.E30]) -> 0.00819071
A31: 30 | B31: strcat: &"vqkgxg"{\0,\x01,\x01,\x01} &""{\0,p,u,j,\0} :=> &"vqkgxg"{\0,p,r,\0} | C31: 0 | D31: 1 | E31: 0 | G31: of:=IF([.C31]=1;"";[.C31]) -> 0 | H31: of:=IF([.D31]=1;"";[.D31]) ->  | I31: of:=IF([.E31]=1;"";[.E31]) -> 0
A32: 31 | B32: strcat: &"awetez"{\0,\x01,\x01,\x01} &"y"{\0,p,j,\0} :=> &"awetezy"{\0,p,\0} | C32: 0.021174 | D32: 1 | E32: 0.0156088 | G32: of:=IF([.C32]=1;"";[.C32]) -> 0.021174 | H32: of:=IF([.D32]=1;"";[.D32]) ->  | I32: of:=IF([.E32]=1;"";[.E32]) -> 0.0156088
A33: 32 | B33: strcat: &"kjzuvg"{\0,\x01,\x01,\x01} &"zo"{\0,p,\0} :=> &"kjzuvgzo"{\0,\0} | C33: 0.0117721 | D33: 0.197793 | E33: 0.00722358 | G33: of:=IF([.C33]=1;"";[.C33]) -> 0.0117721 | H33: of:=IF([.D33]=1;"";[.D33]) -> 0.197793 | I33: of:=IF([.E33]=1;"";[.E33]) -> 0.00722358
A34: 33 | B34: strcat: &"nilxxp"{\0,\x01,\x01,\x01} &"ecm"{\0,\0} :=> &"nilxxpecm"{\0} | C34: 0.0167974 | D34: 0.0735271 | E34: 0.00900406 | G34: of:=IF([.C34]=1;"";[.C34]) -> 0.0167974 | H34: of:=IF([.D34]=1;"";[.D34]) -> 0.0735271 | I34: of:=IF([.E34]=1;"";[.E34]) -> 0.00900406
A35: 34 | B35: strcat: &"fukcpf"{\0,\x01,\x01,\x01} &&10 :=> &"fukcpfznpk"{} | C35: 0.0147336 | D35: 0.00588078 | G35: of:=IF([.C35]=1;"";[.C35]) -> 0.0147336 | H35: of:=IF([.D35]=1;"";[.D35]) -> 0.00588078 | I35: of:=IF([.E35]=1;"";[.E35]) ->  
A36: 35 | B36: strcat: &"mivtofj"{\0,\x01,\x01} &""{\0,p,m,s,\0} :=> &"mivtofj"{\0,p,\0} | C36: 0.0136847 | D36: 1 | E36: 0.0136847 | G36: of:=IF([.C36]=1;"";[.C36]) -> 0.0136847 | H36: of:=IF([.D36]=1;"";[.D36]) ->  | I36: of:=IF([.E36]=1;"";[.E36]) -> 0.0136847
A37: 36 | B37: strcat: &"lpvvyft"{\0,\x01,\x01} &"w"{\0,p,f,\0} :=> &"lpvvyftw"{\0,\0} | C37: 0.0102294 | D37: 1 | E37: 0.00867876 | G37: of:=IF([.C37]=1;"";[.C37]) -> 0.0102294 | H37: of:=IF([.D37]=1;"";[.D37]) ->  | I37: of:=IF([.E37]=1;"";[.E37]) -> 0.00867876
A38: 37 | B38: strcat: &"chqzezv"{\0,\x01,\x01} &"xv"{\0,p,\0} :=> &"chqzezvxv"{\0} | C38: 0 | D38: 0.171731 | E38: 0 | G38: of:=IF([.C38]=1;"";[.C38]) -> 0 | H38: of:=IF([.D38]=1;"";[.D38]) -> 0.171731 | I38: of:=IF([.E38]=1;"";[.E38]) -> 0
A39: 38 | B39: strcat: &"hckspysj"{\0,\x01} &""{\0,p,h,v,\0} :=> &"hckspysj"{\0,\0} | C39: 0.0111135 | D39: 1 | E39: 0.0111135 | G39: of:=IF([.C39]=1;"";[.C39]) -> 0.0111135 | H39: of:=IF([.D39]=1;"";[.D39]) ->  | I39: of:=IF([.E39]=1;"";[.E39]) -> 0.0111135
A40: 39 | B40: strcat: &"voojfdoi"{\0,\x01} &"t"{\0,p,d,\0} :=> &"voojfdoit"{\0} | C40: 0.00974728 | D40: 1 | E40: 0.00860248 | G40: of:=IF([.C40]=1;"";[.C40]) -> 0.00974728 | H40: of:=IF([.D40]=1;"";[.D40]) ->  | I40: of:=IF([.E40]=1;"";[.E40]) -> 0.00860248
A41: 40 | B41: strcat: &"cjldtufbs"{\0} &""{\0,p,o,a,\0} :=> &"cjldtufbs"{\0} | C41: 0.00689345 | D41: 1 | E41: 0.00689345 | G41: of:=IF([.C41]=1;"";[.C41]) -> 0.00689345 | H41: of:=IF([.D41]=1;"";[.D41]) ->  | I41: of:=IF([.E41]=1;"";[.E41]) -> 0.00689345
A42: 1 | B42: strncat: &""{\0,\x01,\x01,\x01,\x01,\x01,\x01,\x01,\x01,\x01} &""{\0,p,y,y,\0} 4 :=> &""{\0,p,b,w,d,n,k,s,j,\0} | C42: 1 | D42: 1 | E42: 1 | G42: of:=IF([.C42]=1;"";[.C42]) ->  | H42: of:=IF([.D42]=1;"";[.D42]) ->  | I42: of:=IF([.E42]=1;"";[.E42]) ->  | K42: of:=AVERAGE([.G42:.G82]) -> 0.0516694716129032 | L42: of:=AVERAGE([.H42:.H82]) -> 0.0849884931818182 | M42: of:=AVERAGE([.I42:.I82]) -> 0.0295487943243243 | O42: of:=AVERAGE([.K42:.M42]) -> 0.0554022530396819
A43: 2 | B43: strncat: &""{\0,\x01,\x01,\x01,\x01,\x01,\x01,\x01,\x01,\x01} &"v"{\0,p,y,\0} 4 :=> &"v"{\0,p,h,j,x,c,d,a,\0} | C43: 1 | D43: 1 | E43: 1 | G43: of:=IF([.C43]=1;"";[.C43]) ->  | H43: of:=IF([.D43]=1;"";[.D43]) ->  | I43: of:=IF([.E43]=1;"";[.E43]) -> 
A44: 3 | B44: strncat: &""{\0,\x01,\x01,\x01,\x01,\x01,\x01,\x01,\x01,\x01} &"qd"{\0,p,\0} 4 :=> &"qd"{\0,p,f,o,s,m,k,\0} | C44: 1 | D44: 0 | E44: 0 | G44: of:=IF([.C44]=1;"";[.C44]) ->  | H44: of:=IF([.D44]=1;"";[.D44]) -> 0 | I44: of:=IF([.E44]=1;"";[.E44]) -> 0
A45: 4 | B45: strncat: &""{\0,\x01,\x01,\x01,\x01,\x01,\x01,\x01,\x01,\x01} &"xbi"{\0,\0} 4 :=> &"xbi"{\0,p,z,e,v,r,\0} | C45: 1 | D45: 0.0680589 | E45: 0.0680589 | G45: of:=IF([.C45]=1;"";[.C45]) ->  | H45: of:=IF([.D45]=1;"";[.D45]) -> 0.0680589 | I45: of:=IF([.E45]=1;"";[.E45]) -> 0.0680589
A46: 5 | B46: strncat: &""{\0,\x01,\x01,\x01,\x01,\x01,\x01,\x01,\x01,\x01} &"ygnk"{\0} 4 :=> &"ygnk"{\0,p,y,h,w,\0} | C46: 1 | D46: 0.0408096 | E46: 0.0408096 | G46: of:=IF([.C46]=1;"";[.C46]) ->  | H46: of:=IF([.D46]=1;"";[.D46]) -> 0.0408096 | I46: of:=IF([.E46]=1;"";[.E46]) -> 0.0408096
A47: 6 | B47: strncat: &"g"{\0,\x01,\x01,\x01,\x01,\x01,\x01,\x01,\x01} &""{\0,p,n,t,\0} 4 :=> &"g"{\0,p,l,u,u,c,c,l,\0} | C47: 1 | D47: 1 | E47: 1 | G47: of:=IF([.C47]=1;"";[.C47]) ->  | H47: of:=IF([.D47]=1;"";[.D47]) ->  | I47: of:=IF([.E47]=1;"";[.E47]) -> 
A48: 7 | B48: strncat: &"i"{\0,\x01,\x01,\x01,\x01,\x01,\x01,\x01,\x01} &"a"{\0,p,y,\0} 4 :=> &"ia"{\0,p,k,w,q,x,x,\0} | C48: 1 | D48: 1 | E48: 0.217558 | G48: of:=IF([.C48]=1;"";[.C48]) ->  | H48: of:=IF([.D48]=1;"";[.D48]) ->  | I48: of:=IF([.E48]=1;"";[.E48]) -> 0.217558
A49: 8 | B49: strncat: &"p"{\0,\x01,\x01,\x01,\x01,\x01,\x01,\x01,\x01} &"ue"{\0,p,\0} 4 :=> &"pue"{\0,p,t,n,c,q,\0} | C49: 1 | D49: 0.214286 | E49: 0.0845727 | G49: of:=IF([.C49]=1;"";[.C49]) ->  | H49: of:=IF([.D49]=1;"";[.D49]) -> 0.214286 | I49: of:=IF([.E49]=1;"";[.E49]) -> 0.0845727
A50: 9 | B50: strncat: &"x"{\0,\x01,\x01,\x01,\x01,\x01,\x01,\x01,\x01} &"nrs"{\0,\0} 4 :=> &"xnrs"{\0,p,u,x,y,\0} | C50: 1 | D50: 0.0820223 | E50: 0.0356555 | G50: of:=IF([.C50]=1;"";[.C50]) ->  | H50: of:=IF([.D50]=1;"";[.D50]) -> 0.0820223 | I50: of:=IF([.E50]=1;"";[.E50]) -> 0.0356555
A51: 10 | B51: strncat: &"q"{\0,\x01,\x01,\x01,\x01,\x01,\x01,\x01,\x01} &"pqyf"{\0} 4 :=> &"qpqyf"{\0,p,q,s,\0} | C51: 1 | D51: 0 | E51: 0 | G51: of:=IF([.C51]=1;"";[.C51]) ->  | H51: of:=IF([.D51]=1;"";[.D51]) -> 0 | I51: of:=IF([.E51]=1;"";[.E51]) -> 0
A52: 11 | B52: strncat: &"jr"{\0,\x01,\x01,\x01,\x01,\x01,\x01,\x01} &""{\0,p,p,n,\0} 4 :=> &"jr"{\0,p,l,e,t,p,m,\0} | C52: 0.127187 | D52: 1 | E52: 0.127187 | G52: of:=IF([.C52]=1;"";[.C52]) -> 0.127187 | H52: of:=IF([.D52]=1;"";[.D52]) ->  | I52: of:=IF([.E52]=1;"";[.E52]) -> 0.127187
A53: 12 | B53: strncat: &"wt"{\0,\x01,\x01,\x01,\x01,\x01,\x01,\x01} &"e"{\0,p,y,\0} 4 :=> &"wte"{\0,p,w,j,i,b,\0} | C53: 0.196192 | D53: 1 | E53: 0.08201 | G53: of:=IF([.C53]=1;"";[.C53]) -> 0.196192 | H53: of:=IF([.D53]=1;"";[.D53]) ->  | I53: of:=IF([.E53]=1;"";[.E53]) -> 0.08201
A54: 13 | B54: strncat: &"td"{\0,\x01,\x01,\x01,\x01,\x01,\x01,\x01} &"wf"{\0,p,\0} 4 :=> &"tdwf"{\0,p,k,i,c,\0} | C54: 0.192671 | D54: 0.184985 | E54: 0.0372045 | G54: of:=IF([.C54]=1;"";[.C54]) -> 0.192671 | H54: of:=IF([.D54]=1;"";[.D54]) -> 0.184985 | I54: of:=IF([.E54]=1;"";[.E54]) -> 0.0372045
A55: 14 | B55: strncat: &"dp"{\0,\x01,\x01,\x01,\x01,\x01,\x01,\x01} &"okm"{\0,\0} 4 :=> &"dpokm"{\0,p,w,z,\0} | C55: 0.184011 | D55: 0.0754997 | E55: 0.0251439 | G55: of:=IF([.C55]=1;"";[.C55]) -> 0.184011 | H55: of:=IF([.D55]=1;"";[.D55]) -> 0.0754997 | I55: of:=IF([.E55]=1;"";[.E55]) -> 0.0251439
A56: 15 | B56: strncat: &"te"{\0,\x01,\x01,\x01,\x01,\x01,\x01,\x01} &"pfru"{\0} 4 :=> &"tepfru"{\0,p,w,\0} | C56: 0.223692 | D56: 0.0419639 | E56: 0.0203442 | G56: of:=IF([.C56]=1;"";[.C56]) -> 0.223692 | H56: of:=IF([.D56]=1;"";[.D56]) -> 0.0419639 | I56: of:=IF([.E56]=1;"";[.E56]) -> 0.0203442
A57: 16 | B57: strncat: &"oua"{\0,\x01,\x01,\x01,\x01,\x01,\x01} &""{\0,p,d,e,\0} 4 :=> &"oua"{\0,p,z,a,o,h,\0} | C57: 0.0869971 | D57: 1 | E57: 0.0869971 | G57: of:=IF([.C57]=1;"";[.C57]) -> 0.0869971 | H57: of:=IF([.D57]=1;"";[.D57]) ->  | I57: of:=IF([.E57]=1;"";[.E57]) -> 0.0869971
A58: 17 | B58: strncat: &"dlt"{\0,\x01,\x01,\x01,\x01,\x01,\x01} &"l"{\0,p,e,\0} 4 :=> &"dltl"{\0,p,w,n,e,\0} | C58: 0.0822767 | D58: 1 | E58: 0.0443357 | G58: of:=IF([.C58]=1;"";[.C58]) -> 0.0822767 | H58: of:=IF([.D58]=1;"";[.D58]) ->  | I58: of:=IF([.E58]=1;"";[.E58]) -> 0.0443357
A59: 18 | B59: strncat: &"avj"{\0,\x01,\x01,\x01,\x01,\x01,\x01} &"qr"{\0,p,\0} 4 :=> &"avjqr"{\0,p,e,j,\0} | C59: 0.0490414 | D59: 0 | E59: 0 | G59: of:=IF([.C59]=1;"";[.C59]) -> 0.0490414 | H59: of:=IF([.D59]=1;"";[.D59]) -> 0 | I59: of:=IF([.E59]=1;"";[.E59]) -> 0
A60: 19 | B60: strncat: &"xkf"{\0,\x01,\x01,\x01,\x01,\x01,\x01} &"czw"{\0,\0} 4 :=> &"xkfczw"{\0,p,j,\0} | C60: 0 | D60: 0.0640108 | E60: 0 | G60: of:=IF([.C60]=1;"";[.C60]) -> 0 | H60: of:=IF([.D60]=1;"";[.D60]) -> 0.0640108 | I60: of:=IF([.E60]=1;"";[.E60]) -> 0
A61: 20 | B61: strncat: &"nhd"{\0,\x01,\x01,\x01,\x01,\x01,\x01} &"mkaw"{\0} 4 :=> &"nhdmkaw"{\0,p,\0} | C61: 0.0759077 | D61: 0.0374855 | E61: 0.013231 | G61: of:=IF([.C61]=1;"";[.C61]) -> 0.0759077 | H61: of:=IF([.D61]=1;"";[.D61]) -> 0.0374855 | I61: of:=IF([.E61]=1;"";[.E61]) -> 0.013231
A62: 21 | B62: strncat: &"gcme"{\0,\x01,\x01,\x01,\x01,\x01} &""{\0,p,n,w,\0} 4 :=> &"gcme"{\0,p,l,e,l,\0} | C62: 0.0338151 | D62: 1 | E62: 0.0338151 | G62: of:=IF([.C62]=1;"";[.C62]) -> 0.0338151 | H62: of:=IF([.D62]=1;"";[.D62]) ->  | I62: of:=IF([.E62]=1;"";[.E62]) -> 0.0338151
A63: 22 | B63: strncat: &"avbg"{\0,\x01,\x01,\x01,\x01,\x01} &"o"{\0,p,s,\0} 4 :=> &"avbgo"{\0,p,x,s,\0} | C63: 0 | D63: 1 | E63: 0 | G63: of:=IF([.C63]=1;"";[.C63]) -> 0 | H63: of:=IF([.D63]=1;"";[.D63]) ->  | I63: of:=IF([.E63]=1;"";[.E63]) -> 0
A64: 23 | B64: strncat: &"uzgz"{\0,\x01,\x01,\x01,\x01,\x01} &"pp"{\0,p,\0} 4 :=> &"uzgzpp"{\0,p,y,\0} | C64: 0.0310852 | D64: 0.213806 | E64: 0.0143193 | G64: of:=IF([.C64]=1;"";[.C64]) -> 0.0310852 | H64: of:=IF([.D64]=1;"";[.D64]) -> 0.213806 | I64: of:=IF([.E64]=1;"";[.E64]) -> 0.0143193
A65: 24 | B65: strncat: &"gkst"{\0,\x01,\x01,\x01,\x01,\x01} &"lnv"{\0,\0} 4 :=> &"gkstlnv"{\0,p,\0} | C65: 0.0403687 | D65: 0.0777436 | E65: 0.0142843 | G65: of:=IF([.C65]=1;"";[.C65]) -> 0.0403687 | H65: of:=IF([.D65]=1;"";[.D65]) -> 0.0777436 | I65: of:=IF([.E65]=1;"";[.E65]) -> 0.0142843
A66: 25 | B66: strncat: &"alxl"{\0,\x01,\x01,\x01,\x01,\x01} &"otgl"{\0} 4 :=> &"alxlotgl"{\0,\0} | C66: 0.0338475 | D66: 0.0429411 | E66: 0.0107853 | G66: of:=IF([.C66]=1;"";[.C66]) -> 0.0338475 | H66: of:=IF([.D66]=1;"";[.D66]) -> 0.0429411 | I66: of:=IF([.E66]=1;"";[.E66]) -> 0.0107853
A67: 26 | B67: strncat: &"wugpi"{\0,\x01,\x01,\x01,\x01} &""{\0,p,g,u,\0} 4 :=> &"wugpi"{\0,p,p,k,\0} | C67: 0.0233617 | D67: 1 | E67: 0.0233617 | G67: of:=IF([.C67]=1;"";[.C67]) -> 0.0233617 | H67: of:=IF([.D67]=1;"";[.D67]) ->  | I67: of:=IF([.E67]=1;"";[.E67]) -> 0.0233617
A68: 27 | B68: strncat: &"esjml"{\0,\x01,\x01,\x01,\x01} &"y"{\0,p,g,\0} 4 :=> &"esjmly"{\0,p,m,\0} | C68: 0.0212922 | D68: 1 | E68: 0.0161022 | G68: of:=IF([.C68]=1;"";[.C68]) -> 0.0212922 | H68: of:=IF([.D68]=1;"";[.D68]) ->  | I68: of:=IF([.E68]=1;"";[.E68]) -> 0.0161022
A69: 28 | B69: strncat: &"eydhb"{\0,\x01,\x01,\x01,\x01} &"nu"{\0,p,\0} 4 :=> &"eydhbnu"{\0,p,\0} | C69: 0.0254357 | D69: 0.211853 | E69: 0.013473 | G69: of:=IF([.C69]=1;"";[.C69]) -> 0.0254357 | H69: of:=IF([.D69]=1;"";[.D69]) -> 0.211853 | I69: of:=IF([.E69]=1;"";[.E69]) -> 0.013473
A70: 29 | B70: strncat: &"iidww"{\0,\x01,\x01,\x01,\x01} &"vhy"{\0,\0} 4 :=> &"iidwwvhy"{\0,\0} | C70: 0.0224097 | D70: 0.0542518 | E70: 0.00666611 | G70: of:=IF([.C70]=1;"";[.C70]) -> 0.0224097 | H70: of:=IF([.D70]=1;"";[.D70]) -> 0.0542518 | I70: of:=IF([.E70]=1;"";[.E70]) -> 0.00666611
A71: 30 | B71: strncat: &"zeczm"{\0,\x01,\x01,\x01,\x01} &"irvu"{\0} 4 :=> &"zeczmirvu"{\0} | C71: 0.0246266 | D71: 0.0434287 | E71: 0.00983482 | G71: of:=IF([.C71]=1;"";[.C71]) -> 0.0246266 | H71: of:=IF([.D71]=1;"";[.D71]) -> 0.0434287 | I71: of:=IF([.E71]=1;"";[.E71]) -> 0.00983482
A72: 31 | B72: strncat: &"owrpsq"{\0,\x01,\x01,\x01} &""{\0,p,p,u,\0} 4 :=> &"owrpsq"{\0,p,s,\0} | C72: 0.0197323 | D72: 1 | E72: 0.0197323 | G72: of:=IF([.C72]=1;"";[.C72]) -> 0.0197323 | H72: of:=IF([.D72]=1;"";[.D72]) ->  | I72: of:=IF([.E72]=1;"";[.E72]) -> 0.0197323
A73: 32 | B73: strncat: &"iewqwd"{\0,\x01,\x01,\x01} &"h"{\0,p,d,\0} 4 :=> &"iewqwdh"{\0,p,\0} | C73: 0.0116905 | D73: 1 | E73: 0.0092502 | G73: of:=IF([.C73]=1;"";[.C73]) -> 0.0116905 | H73: of:=IF([.D73]=1;"";[.D73]) ->  | I73: of:=IF([.E73]=1;"";[.E73]) -> 0.0092502
A74: 33 | B74: strncat: &"pihlby"{\0,\x01,\x01,\x01} &"ys"{\0,p,\0} 4 :=> &"pihlbyys"{\0,\0} | C74: 0.0187089 | D74: 0.211853 | E74: 0.0106919 | G74: of:=IF([.C74]=1;"";[.C74]) -> 0.0187089 | H74: of:=IF([.D74]=1;"";[.D74]) -> 0.211853 | I74: of:=IF([.E74]=1;"";[.E74]) -> 0.0106919
A75: 34 | B75: strncat: &"eayclv"{\0,\x01,\x01,\x01} &"jxf"{\0,\0} 4 :=> &"eayclvjxf"{\0} | C75: 0.0206255 | D75: 0 | E75: 0 | G75: of:=IF([.C75]=1;"";[.C75]) -> 0.0206255 | H75: of:=IF([.D75]=1;"";[.D75]) -> 0 | I75: of:=IF([.E75]=1;"";[.E75]) -> 0
A76: 35 | B76: strncat: &"hjlxwr"{\0,\x01,\x01,\x01} &&10 4 :=> &"hjlxwrjtnr"{} | C76: 0.0118668 | D76: 0.00533295 | G76: of:=IF([.C76]=1;"";[.C76]) -> 0.0118668 | H76: of:=IF([.D76]=1;"";[.D76]) -> 0.00533295 | I76: of:=IF([.E76]=1;"";[.E76]) ->  
A77: 36 | B77: strncat: &"bxstptz"{\0,\x01,\x01} &""{\0,p,e,u,\0} 4 :=> &"bxstptz"{\0,p,\0} | C77: 0 | D77: 1 | E77: 0 | G77: of:=IF([.C77]=1;"";[.C77]) -> 0 | H77: of:=IF([.D77]=1;"";[.D77]) ->  | I77: of:=IF([.E77]=1;"";[.E77]) -> 0
A78: 37 | B78: strncat: &"mnkvgbs"{\0,\x01,\x01} &"x"{\0,p,t,\0} 4 :=> &"mnkvgbsx"{\0,\0} | C78: 0.011952 | D78: 1 | E78: 0 | G78: of:=IF([.C78]=1;"";[.C78]) -> 0.011952 | H78: of:=IF([.D78]=1;"";[.D78]) ->  | I78: of:=IF([.E78]=1;"";[.E78]) -> 0
A79: 38 | B79: strncat: &"mukffjs"{\0,\x01,\x01} &"nj"{\0,p,\0} 4 :=> &"mukffjsnj"{\0} | C79: 0.011233 | D79: 0.199415 | E79: 0.00792851 | G79: of:=IF([.C79]=1;"";[.C79]) -> 0.011233 | H79: of:=IF([.D79]=1;"";[.D79]) -> 0.199415 | I79: of:=IF([.E79]=1;"";[.E79]) -> 0.00792851
A80: 39 | B80: strncat: &"llgozhld"{\0,\x01} &""{\0,p,o,j,\0} 4 :=> &"llgozhld"{\0,\0} | C80: 0.0117989 | D80: 1 | E80: 0.0117989 | G80: of:=IF([.C80]=1;"";[.C80]) -> 0.0117989 | H80: of:=IF([.D80]=1;"";[.D80]) ->  | I80: of:=IF([.E80]=1;"";[.E80]) -> 0.0117989
A81: 40 | B81: strncat: &"dsvsbtkv"{\0,\x01} &"c"{\0,p,d,\0} 4 :=> &"dsvsbtkvc"{\0} | C81: 0.00992742 | D81: 1 | E81: 0.00815365 | G81: of:=IF([.C81]=1;"";[.C81]) -> 0.00992742 | H81: of:=IF([.D81]=1;"";[.D81]) ->  | I81: of:=IF([.E81]=1;"";[.E81]) -> 0.00815365
A82: 41 | B82: strncat: &"nzxrdhwut"{\0} &""{\0,p,o,y,\0} 4 :=> &"nzxrdhwut"{\0} | C82: 0 | D82: 1 | E82: 0 | G82: of:=IF([.C82]=1;"";[.C82]) -> 0 | H82: of:=IF([.D82]=1;"";[.D82]) ->  | I82: of:=IF([.E82]=1;"";[.E82]) -> 0

Sheet: strstr
A1: # | B1: Test Case | C1: N | G1: N1 | H1: N2 | I1: N3
A2: 1 | B2: strstr: &"n"{\0,h,l,r,\0} &"n"{\0,\0} :=> &"n"{\0,h,l,r,\0} | C2: 1 | D2: 1 | E2: 1 | G2: of:=IF([.C2]=1;"";[.C2]) ->  | H2: of:=IF([.D2]=1;"";[.D2]) ->  | I2: of:=IF([.E2]=1;"";[.E2]) ->  | K2: of:=AVERAGE([.G2:.G19]) -> 0.0740773352941176 | L2: of:=AVERAGE([.H2:.H19]) -> 0.187519444444444 | M2: of:=AVERAGE([.I2:.I19]) -> 0.09584181875 | O2: of:=AVERAGE([.K2:.M2]) -> 0.119146199496187
A3: 2 | B3: strstr: &"ft"{\0,h,i,\0} &"f"{\0,\0} :=> &"ft"{\0,h,i,\0} | C3: 0.212346 | D3: 1 | E3: 0.212346 | G3: of:=IF([.C3]=1;"";[.C3]) -> 0.212346 | H3: of:=IF([.D3]=1;"";[.D3]) ->  | I3: of:=IF([.E3]=1;"";[.E3]) -> 0.212346
A4: 3 | B4: strstr: &"ge"{\0,b,f,\0} &"e"{\0,\0} :=> &"e"{\0,b,f,\0,54} | C4: 0.218916 | D4: 1 | E4: 1 | G4: of:=IF([.C4]=1;"";[.C4]) -> 0.218916 | H4: of:=IF([.D4]=1;"";[.D4]) ->  | I4: of:=IF([.E4]=1;"";[.E4]) -> 
A5: 4 | B5: strstr: &"ngh"{\0,h,\0} &"n"{\0,\0} :=> &"ngh"{\0,h,\0} | C5: 0.0886448 | D5: 1 | E5: 0.0886448 | G5: of:=IF([.C5]=1;"";[.C5]) -> 0.0886448 | H5: of:=IF([.D5]=1;"";[.D5]) ->  | I5: of:=IF([.E5]=1;"";[.E5]) -> 0.0886448
A6: 5 | B6: strstr: &"ruj"{\0,b,\0} &"u"{\0,\0} :=> &"uj"{\0,b,\0,54} | C6: 0.0747343 | D6: 1 | E6: 0.183174 | G6: of:=IF([.C6]=1;"";[.C6]) -> 0.0747343 | H6: of:=IF([.D6]=1;"";[.D6]) ->  | I6: of:=IF([.E6]=1;"";[.E6]) -> 0.183174
A7: 6 | B7: strstr: &"cwpb"{\0,\0} &"c"{\0,\0} :=> &"cwpb"{\0,\0} | C7: 0.0301677 | D7: 1 | E7: 0.0301677 | G7: of:=IF([.C7]=1;"";[.C7]) -> 0.0301677 | H7: of:=IF([.D7]=1;"";[.D7]) ->  | I7: of:=IF([.E7]=1;"";[.E7]) -> 0.0301677
A8: 7 | B8: strstr: &"sjcw"{\0,\0} &"j"{\0,\0} :=> &"jcw"{\0,\0,54} | C8: 0.0256623 | D8: 1 | E8: 0.0515685 | G8: of:=IF([.C8]=1;"";[.C8]) -> 0.0256623 | H8: of:=IF([.D8]=1;"";[.D8]) ->  | I8: of:=IF([.E8]=1;"";[.E8]) -> 0.0515685
A9: 8 | B9: strstr: &"cemca"{\0} &"c"{\0,\0} :=> &"cemca"{\0} | C9: 0.0280944 | D9: 1 | E9: 0.0280944 | G9: of:=IF([.C9]=1;"";[.C9]) -> 0.0280944 | H9: of:=IF([.D9]=1;"";[.D9]) ->  | I9: of:=IF([.E9]=1;"";[.E9]) -> 0.0280944
A10: 9 | B10: strstr: &"uwosc"{\0} &"w"{\0,\0} :=> &"wosc"{\0,54} | C10: 0.0276902 | D10: 1 | E10: 0.0466537 | G10: of:=IF([.C10]=1;"";[.C10]) -> 0.0276902 | H10: of:=IF([.D10]=1;"";[.D10]) ->  | I10: of:=IF([.E10]=1;"";[.E10]) -> 0.0466537
A11: 10 | B11: strstr: &"gs"{\0,d,z,\0} &"gs"{\0} :=> &"gs"{\0,d,z,\0} | C11: 0.209845 | D11: 0.209845 | E11: 0.209845 | G11: of:=IF([.C11]=1;"";[.C11]) -> 0.209845 | H11: of:=IF([.D11]=1;"";[.D11]) -> 0.209845 | I11: of:=IF([.E11]=1;"";[.E11]) -> 0.209845
A12: 11 | B12: strstr: &"vav"{\0,d,\0} &"va"{\0} :=> &"vav"{\0,d,\0} | C12: 0.0850115 | D12: 0.212346 | E12: 0.0850115 | G12: of:=IF([.C12]=1;"";[.C12]) -> 0.0850115 | H12: of:=IF([.D12]=1;"";[.D12]) -> 0.212346 | I12: of:=IF([.E12]=1;"";[.E12]) -> 0.0850115
A13: 12 | B13: strstr: &"zzk"{\0,a,\0} &"zk"{\0} :=> &"zk"{\0,a,\0,54} | C13: 0.0685945 | D13: 0.177645 | E13: 0.177645 | G13: of:=IF([.C13]=1;"";[.C13]) -> 0.0685945 | H13: of:=IF([.D13]=1;"";[.D13]) -> 0.177645 | I13: of:=IF([.E13]=1;"";[.E13]) -> 0.177645
A14: 13 | B14: strstr: &"fmg"{\0,p,\0} &"mg"{\0} :=> &"mg"{\0,p,\0,54} | C14: 0.063915 | D14: 0.17338 | E14: 0.17338 | G14: of:=IF([.C14]=1;"";[.C14]) -> 0.063915 | H14: of:=IF([.D14]=1;"";[.D14]) -> 0.17338 | I14: of:=IF([.E14]=1;"";[.E14]) -> 0.17338
A15: 14 | B15: strstr: &"rcck"{\0,\0} &"rc"{\0} :=> &"rcck"{\0,\0} | C15: 0.0454886 | D15: 0.214286 | E15: 0.0454886 | G15: of:=IF([.C15]=1;"";[.C15]) -> 0.0454886 | H15: of:=IF([.D15]=1;"";[.D15]) -> 0.214286 | I15: of:=IF([.E15]=1;"";[.E15]) -> 0.0454886
A16: 15 | B16: strstr: &"ggwy"{\0,\0} &"gw"{\0} :=> &"gwy"{\0,\0,54} | C16: 0.0384038 | D16: 0.183021 | E16: 0.0708135 | G16: of:=IF([.C16]=1;"";[.C16]) -> 0.0384038 | H16: of:=IF([.D16]=1;"";[.D16]) -> 0.183021 | I16: of:=IF([.E16]=1;"";[.E16]) -> 0.0708135
A17: 16 | B17: strstr: &"wxym"{\0,\0} &"xy"{\0} :=> &"xym"{\0,\0,54} | C17: 0 | D17: 0.183327 | E17: 0.0726081 | G17: of:=IF([.C17]=1;"";[.C17]) -> 0 | H17: of:=IF([.D17]=1;"";[.D17]) -> 0.183327 | I17: of:=IF([.E17]=1;"";[.E17]) -> 0.0726081
A18: 17 | B18: strstr: &"zrpgm"{\0} &"zr"{\0} :=> &"zrpgm"{\0} | C18: 0.0231843 | D18: 0.172927 | E18: 0.0231843 | G18: of:=IF([.C18]=1;"";[.C18]) -> 0.0231843 | H18: of:=IF([.D18]=1;"";[.D18]) -> 0.172927 | I18: of:=IF([.E18]=1;"";[.E18]) -> 0.0231843
A19: 18 | B19: strstr: &"jjdfl"{\0} &"jd"{\0} :=> &"jdfl"{\0,54} | C19: 0.0186163 | D19: 0.160898 | E19: 0.034844 | G19: of:=IF([.C19]=1;"";[.C19]) -> 0.0186163 | H19: of:=IF([.D19]=1;"";[.D19]) -> 0.160898 | I19: of:=IF([.E19]=1;"";[.E19]) -> 0.034844
A20: 19 | B20: strstr: &"vcnyn"{\0} &"cn"{\0} :=> &"cnyn"{\0,54} | C20: 0.0233331 | D20: 0.174276 | E20: 0.0385966 | G20: of:=IF([.C20]=1;"";[.C20]) -> 0.0233331 | H20: of:=IF([.D20]=1;"";[.D20]) -> 0.174276 | I20: of:=IF([.E20]=1;"";[.E20]) -> 0.0385966 | K20: of:=AVERAGE([.G20:.G24]) -> 0.025051 | L20: of:=AVERAGE([.H20:.H24]) -> 0.1855135 | M20: of:=AVERAGE([.I20:.I24]) -> 0.0301337 | O20: of:=AVERAGE([.K20:.M20]) -> 0.0802327333333333
A21: 1 | B21: strnstr: &"uxuow"{\0} &""{\0,p,\0} 2 :=> &"uxuow"{\0} | C21: 0.0258615 | D21: 1 | E21: 0.0258615 | G21: of:=IF([.C21]=1;"";[.C21]) -> 0.0258615 | H21: of:=IF([.D21]=1;"";[.D21]) ->  | I21: of:=IF([.E21]=1;"";[.E21]) -> 0.0258615
A22: 2 | B22: strnstr: &"goixi"{\0} &"g"{\0,\0} 2 :=> &"goixi"{\0} | C22: 0.0277194 | D22: 1 | E22: 0.0277194 | G22: of:=IF([.C22]=1;"";[.C22]) -> 0.0277194 | H22: of:=IF([.D22]=1;"";[.D22]) ->  | I22: of:=IF([.E22]=1;"";[.E22]) -> 0.0277194
A23: 3 | B23: strnstr: &"bazhz"{\0} &"a"{\0,\0} 2 :=> &"azhz"{\0,54} | C23: 0.0216161 | D23: 1 | E23: 0.0317661 | G23: of:=IF([.C23]=1;"";[.C23]) -> 0.0216161 | H23: of:=IF([.D23]=1;"";[.D23]) ->  | I23: of:=IF([.E23]=1;"";[.E23]) -> 0.0317661
A24: 4 | B24: strnstr: &"xuiio"{\0} &"xu"{\0} 2 :=> &"xuiio"{\0} | C24: 0.0267249 | D24: 0.196751 | E24: 0.0267249 | G24: of:=IF([.C24]=1;"";[.C24]) -> 0.0267249 | H24: of:=IF([.D24]=1;"";[.D24]) -> 0.196751 | I24: of:=IF([.E24]=1;"";[.E24]) -> 0.0267249
A25: 1 | B25: strpbrk: &"nurmj"{\0} &"aeiou"{\0} :=> &"urmj"{\0,54} | C25: 0.0253082 | D25: 0.0299288 | E25: 0.0385877 | G25: of:=IF([.C25]=1;"";[.C25]) -> 0.0253082 | H25: of:=IF([.D25]=1;"";[.D25]) -> 0.0299288 | I25: of:=IF([.E25]=1;"";[.E25]) -> 0.0385877 | K25: of:=AVERAGE([.G25:.G34]) -> 0.0257427 | L25: of:=AVERAGE([.H25:.H34]) -> 0.0299288 | M25: of:=AVERAGE([.I25:.I34]) -> 0.03204948 | O25: of:=AVERAGE([.K25:.M25]) -> 0.0292403266666667
A26: 2 | B26: strpbrk: &"goczz"{\0} &"aeiou"{\0} :=> &"oczz"{\0,54} | C26: 0.0256451 | D26: 0.0299288 | E26: 0.0390075 | G26: of:=IF([.C26]=1;"";[.C26]) -> 0.0256451 | H26: of:=IF([.D26]=1;"";[.D26]) -> 0.0299288 | I26: of:=IF([.E26]=1;"";[.E26]) -> 0.0390075
A27: 3 | B27: strpbrk: &"dixmc"{\0} &"aeiou"{\0} :=> &"ixmc"{\0,54} | C27: 0.0232037 | D27: 0.0299288 | E27: 0.0341165 | G27: of:=IF([.C27]=1;"";[.C27]) -> 0.0232037 | H27: of:=IF([.D27]=1;"";[.D27]) -> 0.0299288 | I27: of:=IF([.E27]=1;"";[.E27]) -> 0.0341165
A28: 4 | B28: strpbrk: &"deabz"{\0} &"aeiou"{\0} :=> &"eabz"{\0,54} | C28: 0.0251776 | D28: 0.0299288 | E28: 0.0372268 | G28: of:=IF([.C28]=1;"";[.C28]) -> 0.0251776 | H28: of:=IF([.D28]=1;"";[.D28]) -> 0.0299288 | I28: of:=IF([.E28]=1;"";[.E28]) -> 0.0372268
A29: 5 | B29: strpbrk: &"maaml"{\0} &"aeiou"{\0} :=> &"aaml"{\0,54} | C29: 0.0267429 | D29: 0.0299288 | E29: 0.0402068 | G29: of:=IF([.C29]=1;"";[.C29]) -> 0.0267429 | H29: of:=IF([.D29]=1;"";[.D29]) -> 0.0299288 | I29: of:=IF([.E29]=1;"";[.E29]) -> 0.0402068
A30: 6 | B30: strpbrk: &"uivid"{\0} &"aeiou"{\0} :=> &"uivid"{\0} | C30: 0.0303312 | D30: 0.0299288 | E30: 0.0303312 | G30: of:=IF([.C30]=1;"";[.C30]) -> 0.0303312 | H30: of:=IF([.D30]=1;"";[.D30]) -> 0.0299288 | I30: of:=IF([.E30]=1;"";[.E30]) -> 0.0303312
A31: 7 | B31: strpbrk: &"otlwb"{\0} &"aeiou"{\0} :=> &"otlwb"{\0} | C31: 0.0266676 | D31: 0.0299288 | E31: 0.0266676 | G31: of:=IF([.C31]=1;"";[.C31]) -> 0.0266676 | H31: of:=IF([.D31]=1;"";[.D31]) -> 0.0299288 | I31: of:=IF([.E31]=1;"";[.E31]) -> 0.0266676
A32: 8 | B32: strpbrk: &"ixcnc"{\0} &"aeiou"{\0} :=> &"ixcnc"{\0} | C32: 0.025129 | D32: 0.0299288 | E32: 0.025129 | G32: of:=IF([.C32]=1;"";[.C32]) -> 0.025129 | H32: of:=IF([.D32]=1;"";[.D32]) -> 0.0299288 | I32: of:=IF([.E32]=1;"";[.E32]) -> 0.025129
A33: 9 | B33: strpbrk: &"exazs"{\0} &"aeiou"{\0} :=> &"exazs"{\0} | C33: 0.0249053 | D33: 0.0299288 | E33: 0.0249053 | G33: of:=IF([.C33]=1;"";[.C33]) -> 0.0249053 | H33: of:=IF([.D33]=1;"";[.D33]) -> 0.0299288 | I33: of:=IF([.E33]=1;"";[.E33]) -> 0.0249053
A34: 10 | B34: strpbrk: &"amlpj"{\0} &"aeiou"{\0} :=> &"amlpj"{\0} | C34: 0.0243164 | D34: 0.0299288 | E34: 0.0243164 | G34: of:=IF([.C34]=1;"";[.C34]) -> 0.0243164 | H34: of:=IF([.D34]=1;"";[.D34]) -> 0.0299288 | I34: of:=IF([.E34]=1;"";[.E34]) -> 0.0243164