Sheet: strlen
A1: strlen: &"\x01"{\0,\0,\0,\0,\0} :=> 1; | J1: # | K1: Test Case | L1: N | P1: FINAL
A2: strlen: &"\x01\x01"{\0,\0,\0,\0} :=> 2; | J2: 1 | K2: strlen: &"c"{\0,p,f,b,\0} :=> 1 | L2: 1 | N2: of:=IF([.L2]=1;"";[.L2]) ->  | P2: of:=AVERAGE([.N2:.N6]) -> 0.0856219
A3: strlen: &"\x01\x01\x01"{\0,\0,\0} :=> 3; | J3: 2 | K3: strlen: &"jo"{\0,p,d,\0} :=> 2 | L3: 0.2083 | N3: of:=IF([.L3]=1;"";[.L3]) -> 0.2083
A4: strlen: &"\x01\x01\x01\x01"{\0,\0} :=> 4; | J4: 3 | K4: strlen: &"vuq"{\0,p,\0} :=> 3 | L4: 0.0672236 | N4: of:=IF([.L4]=1;"";[.L4]) -> 0.0672236
A5: strlen: &"\x01\x01\x01\x01\x01"{\0} :=> 5; | J5: 4 | K5: strlen: &"nxom"{\0,\0} :=> 4 | L5: 0.0409873 | N5: of:=IF([.L5]=1;"";[.L5]) -> 0.0409873
A6: strnlen: &""{\0,\0,\0,\0,\0,\0} 6 :=> 0; 1; | J6: 5 | K6: strlen: &"fsrtd"{\0} :=> 5 | L6: 0.0259767 | N6: of:=IF([.L6]=1;"";[.L6]) -> 0.0259767
A7: strnlen: &"\x01"{\0,\0,\0,\0,\0} 6 :=> 1; | J7: 1 | K7: strnlen: &""{\0,p,t,e,q,\0} 6 :=> 0 | L7: 1 | N7: of:=IF([.L7]=1;"";[.L7]) ->  | P7: of:=AVERAGE([.N7:.N12]) -> 0.082646025
A8: strnlen: &"\x01\x01"{\0,\0,\0,\0} 6 :=> 2; | J8: 2 | K8: strnlen: &"o"{\0,p,z,s,\0} 6 :=> 1 | L8: 1 | N8: of:=IF([.L8]=1;"";[.L8]) -> 
A9: strnlen: &"\x01\x01\x01"{\0,\0,\0} 6 :=> 3; | J9: 3 | K9: strnlen: &"yz"{\0,p,i,\0} 6 :=> 2 | L9: 0.187462 | N9: of:=IF([.L9]=1;"";[.L9]) -> 0.187462
A10: strnlen: &"\x01\x01\x01\x01"{\0,\0} 6 :=> 4; | J10: 4 | K10: strnlen: &"snn"{\0,p,\0} 6 :=> 3 | L10: 0.0812747 | N10: of:=IF([.L10]=1;"";[.L10]) -> 0.0812747
A11: strnlen: &"\x01\x01\x01\x01\x01"{\0} 6 :=> 5; | J11: 5 | K11: strnlen: &"ulmg"{\0,\0} 6 :=> 4 | L11: 0.0393086 | N11: of:=IF([.L11]=1;"";[.L11]) -> 0.0393086
J12: 6 | K12: strnlen: &"rlrzc"{\0} 6 :=> 5 | L12: 0.0225388 | N12: of:=IF([.L12]=1;"";[.L12]) -> 0.0225388

Sheet: strcmp
A1: # | B1: Test Case | C1: N1 | D1: N2 | L1: FINAL
A2: 1 | B2: strcmp: &"v"{\0,p,v,r,\0} &"v"{\0,p,w,t,\0} :=> 0 | C2: 1 | D2: 1 | F2: of:=IF([.C2]=1;"";[.C2]) ->  | G2: of:=IF([.D2]=1;"";[.D2]) ->  | H2: of:=IF([.E2]=1;"";[.E2]) ->   | I2: of:=AVERAGE([.F2:.F16]) -> 0.0388158214285714 | J2: of:=AVERAGE([.G2:.G16]) -> 0.0408668928571429 | L2: of:=AVERAGE([.I2:.J2]) -> 0.0398413571428571
A3: 2 | B3: strcmp: &"we"{\0,p,x,\0} &"we"{\0,p,t,\0} :=> 0 | C3: 0.2171 | D3: 0.2171 | F3: of:=IF([.C3]=1;"";[.C3]) -> 0.2171 | G3: of:=IF([.D3]=1;"";[.D3]) -> 0.2171 | H3: of:=IF([.E3]=1;"";[.E3]) ->  
A4: 3 | B4: strcmp: &"rrb"{\0,p,\0} &"rrb"{\0,p,\0} :=> 0 | C4: 0.0822063 | D4: 0.0822063 | F4: of:=IF([.C4]=1;"";[.C4]) -> 0.0822063 | G4: of:=IF([.D4]=1;"";[.D4]) -> 0.0822063 | H4: of:=IF([.E4]=1;"";[.E4]) ->  
A5: 4 | B5: strcmp: &"emhm"{\0,\0} &"emhm"{\0,\0} :=> 0 | C5: 0.039631 | D5: 0.039631 | F5: of:=IF([.C5]=1;"";[.C5]) -> 0.039631 | G5: of:=IF([.D5]=1;"";[.D5]) -> 0.039631 | H5: of:=IF([.E5]=1;"";[.E5]) ->  
A6: 5 | B6: strcmp: &"fwyzc"{\0} &"fwyzc"{\0} :=> 0 | C6: 0.0199517 | D6: 0.0199517 | F6: of:=IF([.C6]=1;"";[.C6]) -> 0.0199517 | G6: of:=IF([.D6]=1;"";[.D6]) -> 0.0199517 | H6: of:=IF([.E6]=1;"";[.E6]) ->  
A7: 6 | B7: strcmp: &"bnbyb"{\0} &"bnbya"{\0} :=> 1 | C7: 0.0246627 | D7: 0.0250472 | F7: of:=IF([.C7]=1;"";[.C7]) -> 0.0246627 | G7: of:=IF([.D7]=1;"";[.D7]) -> 0.0250472 | H7: of:=IF([.E7]=1;"";[.E7]) ->  
A8: 7 | B8: strcmp: &"wtayf"{\0} &"wtays"{\0} :=> -1 | C8: 0.0265972 | D8: 0.0286556 | F8: of:=IF([.C8]=1;"";[.C8]) -> 0.0265972 | G8: of:=IF([.D8]=1;"";[.D8]) -> 0.0286556 | H8: of:=IF([.E8]=1;"";[.E8]) ->  
A9: 8 | B9: strcmp: &"zkdjg"{\0} &"zkdfi"{\0} :=> 1 | C9: 0 | D9: 0.0234648 | F9: of:=IF([.C9]=1;"";[.C9]) -> 0 | G9: of:=IF([.D9]=1;"";[.D9]) -> 0.0234648 | H9: of:=IF([.E9]=1;"";[.E9]) ->  
A10: 9 | B10: strcmp: &"nvftg"{\0} &"nvfuc"{\0} :=> -1 | C10: 0 | D10: 0 | F10: of:=IF([.C10]=1;"";[.C10]) -> 0 | G10: of:=IF([.D10]=1;"";[.D10]) -> 0 | H10: of:=IF([.E10]=1;"";[.E10]) ->  
A11: 10 | B11: strcmp: &"rnrku"{\0} &"rngaf"{\0} :=> 1 | C11: 0.0269384 | D11: 0.0302243 | F11: of:=IF([.C11]=1;"";[.C11]) -> 0.0269384 | G11: of:=IF([.D11]=1;"";[.D11]) -> 0.0302243 | H11: of:=IF([.E11]=1;"";[.E11]) ->  
A12: 11 | B12: strcmp: &"iqgbg"{\0} &"iqoqz"{\0} :=> -1 | C12: 0 | D12: 0 | F12: of:=IF([.C12]=1;"";[.C12]) -> 0 | G12: of:=IF([.D12]=1;"";[.D12]) -> 0
A13: 12 | B13: strcmp: &"ouvex"{\0} &"odjpg"{\0} :=> 1 | C13: 0.0290038 | D13: 0.0201398 | F13: of:=IF([.C13]=1;"";[.C13]) -> 0.0290038 | G13: of:=IF([.D13]=1;"";[.D13]) -> 0.0201398
A14: 13 | B14: strcmp: &"mlgal"{\0} &"mtrrm"{\0} :=> -1 | C14: 0.0271063 | D14: 0.0272383 | F14: of:=IF([.C14]=1;"";[.C14]) -> 0.0271063 | G14: of:=IF([.D14]=1;"";[.D14]) -> 0.0272383
A15: 14 | B15: strcmp: &"ovlaj"{\0} &"dehsc"{\0} :=> 1 | C15: 0.0261656 | D15: 0.0285781 | F15: of:=IF([.C15]=1;"";[.C15]) -> 0.0261656 | G15: of:=IF([.D15]=1;"";[.D15]) -> 0.0285781
A16: 15 | B16: strcmp: &"mdcku"{\0} &"scoap"{\0} :=> -1 | C16: 0.0240585 | D16: 0.0298994 | F16: of:=IF([.C16]=1;"";[.C16]) -> 0.0240585 | G16: of:=IF([.D16]=1;"";[.D16]) -> 0.0298994
A17: 1 | B17: strncmp: &""{\0,p,k,l,h,\0} &""{\0,p,t,h,a,\0} 5 :=> 0 | C17: 1 | D17: 1 | F17: of:=IF([.C17]=1;"";[.C17]) ->  | G17: of:=IF([.D17]=1;"";[.D17]) ->  | I17: of:=AVERAGE([.F17:.F32]) -> 0.0356883428571429 | J17: of:=AVERAGE([.G17:.G32]) -> 0.03547655 | L17: of:=AVERAGE([.I17:.J17]) -> 0.0355824464285714
A18: 2 | B18: strncmp: &"r"{\0,p,r,y,\0} &"r"{\0,p,d,w,\0} 5 :=> 0 | C18: 1 | D18: 1 | F18: of:=IF([.C18]=1;"";[.C18]) ->  | G18: of:=IF([.D18]=1;"";[.D18]) -> 
A19: 3 | B19: strncmp: &"vr"{\0,p,q,\0} &"vr"{\0,p,e,\0} 5 :=> 0 | C19: 0.185059 | D19: 0.185059 | F19: of:=IF([.C19]=1;"";[.C19]) -> 0.185059 | G19: of:=IF([.D19]=1;"";[.D19]) -> 0.185059
A20: 4 | B20: strncmp: &"iwf"{\0,p,\0} &"iwf"{\0,p,\0} 5 :=> 0 | C20: 0.0682345 | D20: 0.0682345 | F20: of:=IF([.C20]=1;"";[.C20]) -> 0.0682345 | G20: of:=IF([.D20]=1;"";[.D20]) -> 0.0682345
A21: 5 | B21: strncmp: &"hwwq"{\0,\0} &"hwwq"{\0,\0} 5 :=> 0 | C21: 0.0259968 | D21: 0.0259968 | F21: of:=IF([.C21]=1;"";[.C21]) -> 0.0259968 | G21: of:=IF([.D21]=1;"";[.D21]) -> 0.0259968
A22: 6 | B22: strncmp: &"zvcci"{\0} &"zvcci"{\0} 5 :=> 0 | C22: 0.0239161 | D22: 0.0239161 | F22: of:=IF([.C22]=1;"";[.C22]) -> 0.0239161 | G22: of:=IF([.D22]=1;"";[.D22]) -> 0.0239161
A23: 7 | B23: strncmp: &"joldn"{\0} &"joldc"{\0} 5 :=> 1 | C23: 0.0288331 | D23: 0.0281424 | F23: of:=IF([.C23]=1;"";[.C23]) -> 0.0288331 | G23: of:=IF([.D23]=1;"";[.D23]) -> 0.0281424
A24: 8 | B24: strncmp: &"ymbzs"{\0} &"ymbzw"{\0} 5 :=> -1 | C24: 0.0208645 | D24: 0.0209996 | F24: of:=IF([.C24]=1;"";[.C24]) -> 0.0208645 | G24: of:=IF([.D24]=1;"";[.D24]) -> 0.0209996
A25: 9 | B25: strncmp: &"cacqu"{\0} &"cacge"{\0} 5 :=> 1 | C25: 0.0287664 | D25: 0.020647 | F25: of:=IF([.C25]=1;"";[.C25]) -> 0.0287664 | G25: of:=IF([.D25]=1;"";[.D25]) -> 0.020647
A26: 10 | B26: strncmp: &"qdkkr"{\0} &"qdkxn"{\0} 5 :=> -1 | C26: 0 | D26: 0 | F26: of:=IF([.C26]=1;"";[.C26]) -> 0 | G26: of:=IF([.D26]=1;"";[.D26]) -> 0
A27: 11 | B27: strncmp: &"ysmyy"{\0} &"ysbkw"{\0} 5 :=> 1 | C27: 0.0239963 | D27: 0.022476 | F27: of:=IF([.C27]=1;"";[.C27]) -> 0.0239963 | G27: of:=IF([.D27]=1;"";[.D27]) -> 0.022476
A28: 12 | B28: strncmp: &"hbpog"{\0} &"hbtbr"{\0} 5 :=> -1 | C28: 0.0254304 | D28: 0.0259111 | F28: of:=IF([.C28]=1;"";[.C28]) -> 0.0254304 | G28: of:=IF([.D28]=1;"";[.D28]) -> 0.0259111
A29: 13 | B29: strncmp: &"hjstr"{\0} &"hhtma"{\0} 5 :=> 1 | C29: 0.0206997 | D29: 0.0270376 | F29: of:=IF([.C29]=1;"";[.C29]) -> 0.0206997 | G29: of:=IF([.D29]=1;"";[.D29]) -> 0.0270376
A30: 14 | B30: strncmp: &"hgkrl"{\0} &"hoesy"{\0} 5 :=> -1 | C30: 0.0222205 | D30: 0.0296157 | F30: of:=IF([.C30]=1;"";[.C30]) -> 0.0222205 | G30: of:=IF([.D30]=1;"";[.D30]) -> 0.0296157
A31: 15 | B31: strncmp: &"gjqpr"{\0} &"dlijv"{\0} 5 :=> 1 | C31: 0 | D31: 0.0186359 | F31: of:=IF([.C31]=1;"";[.C31]) -> 0 | G31: of:=IF([.D31]=1;"";[.D31]) -> 0.0186359
A32: 16 | B32: strncmp: &"yizga"{\0} &"zxvqk"{\0} 5 :=> -1 | C32: 0.0256195 | D32: 0 | F32: of:=IF([.C32]=1;"";[.C32]) -> 0.0256195 | G32: of:=IF([.D32]=1;"";[.D32]) -> 0
A33: 1 | B33: sysfs_streq: &""{\0,p,m,u,e,\0} &"wgzby"{\0} :=> \0 | C33: 1 | D33: 0.0196549 | F33: of:=IF([.C33]=1;"";[.C33]) ->  | G33: of:=IF([.D33]=1;"";[.D33]) -> 0.0196549 | I33: of:=AVERAGE([.F33:.F71]) -> 0.0583540965517241 | J33: of:=AVERAGE([.G33:.G71]) -> 0.0394063928571429 | L33: of:=AVERAGE([.I33:.J33]) -> 0.0488802447044335
A34: 2 | B34: sysfs_streq: &""{\0,p,q,l,o,\0} &"\n"{\0,b,h,p,\0} :=> \x01 | C34: 1 | F34: of:=IF([.C34]=1;"";[.C34]) ->  | G34: of:=IF([.D34]=1;"";[.D34]) ->  
A35: 3 | B35: sysfs_streq: &""{\0,p,a,u,u,\0} &"\nasdh"{\0} :=> \0 | C35: 1 | F35: of:=IF([.C35]=1;"";[.C35]) ->  | G35: of:=IF([.D35]=1;"";[.D35]) ->  
A36: 4 | B36: sysfs_streq: &""{\0,p,j,j,u,\0} &""{\0,h,r,e,p,\0} :=> \x01 | C36: 1 | D36: 1 | F36: of:=IF([.C36]=1;"";[.C36]) ->  | G36: of:=IF([.D36]=1;"";[.D36]) -> 
A37: 5 | B37: sysfs_streq: &"intmy"{\0} &"jqtui"{\0} :=> \0 | C37: 0.0300802 | D37: 0 | F37: of:=IF([.C37]=1;"";[.C37]) -> 0.0300802 | G37: of:=IF([.D37]=1;"";[.D37]) -> 0
A38: 6 | B38: sysfs_streq: &"\n"{\0,p,t,g,\0} &""{\0,a,c,e,i,\0} :=> \x01 | C38: 1 | F38: of:=IF([.C38]=1;"";[.C38]) ->  | G38: of:=IF([.D38]=1;"";[.D38]) ->  
A39: 7 | B39: sysfs_streq: &"\n"{\0,a,x,a,\0} &"rjbdg"{\0} :=> \0 | C39: 0.0184255 | F39: of:=IF([.C39]=1;"";[.C39]) -> 0.0184255 | G39: of:=IF([.D39]=1;"";[.D39]) ->  
A40: 8 | B40: sysfs_streq: &"\naocb"{\0} &"hqsyn"{\0} :=> \0 | C40: 0.018067 | F40: of:=IF([.C40]=1;"";[.C40]) -> 0.018067 | G40: of:=IF([.D40]=1;"";[.D40]) ->  
A41: 9 | B41: sysfs_streq: &"k"{\0,p,m,d,\0} &"kkqmh"{\0} :=> \0 | C41: 1 | D41: 0 | F41: of:=IF([.C41]=1;"";[.C41]) ->  | G41: of:=IF([.D41]=1;"";[.D41]) -> 0
A42: 10 | B42: sysfs_streq: &"o"{\0,p,t,u,\0} &"o\n"{\0,a,j,\0} :=> \x01 | C42: 1 | F42: of:=IF([.C42]=1;"";[.C42]) ->  | G42: of:=IF([.D42]=1;"";[.D42]) ->  
A43: 11 | B43: sysfs_streq: &"x"{\0,p,k,j,\0} &"x\naqq"{\0} :=> \0 | C43: 1 | F43: of:=IF([.C43]=1;"";[.C43]) ->  | G43: of:=IF([.D43]=1;"";[.D43]) ->  
A44: 12 | B44: sysfs_streq: &"j"{\0,p,m,p,\0} &"j"{\0,h,b,w,\0} :=> \x01 | C44: 1 | D44: 1 | F44: of:=IF([.C44]=1;"";[.C44]) ->  | G44: of:=IF([.D44]=1;"";[.D44]) -> 
A45: 13 | B45: sysfs_streq: &"hhqhy"{\0} &"hdlfi"{\0} :=> \0 | C45: 0 | D45: 0.0273466 | F45: of:=IF([.C45]=1;"";[.C45]) -> 0 | G45: of:=IF([.D45]=1;"";[.D45]) -> 0.0273466
A46: 14 | B46: sysfs_streq: &"v\n"{\0,b,x,\0} &"v"{\0,b,h,u,\0} :=> \x01 | C46: 1 | F46: of:=IF([.C46]=1;"";[.C46]) ->  | G46: of:=IF([.D46]=1;"";[.D46]) ->  
A47: 15 | B47: sysfs_streq: &"l\n"{\0,b,t,\0} &"lqytc"{\0} :=> \0 | C47: 0 | F47: of:=IF([.C47]=1;"";[.C47]) -> 0 | G47: of:=IF([.D47]=1;"";[.D47]) ->  
A48: 16 | B48: sysfs_streq: &"z\nazr"{\0} &"zcmws"{\0} :=> \0 | C48: 0.019587 | F48: of:=IF([.C48]=1;"";[.C48]) -> 0.019587 | G48: of:=IF([.D48]=1;"";[.D48]) ->  
A49: 17 | B49: sysfs_streq: &"jm"{\0,p,v,\0} &"jmssj"{\0} :=> \0 | C49: 0.164925 | D49: 0.0221978 | F49: of:=IF([.C49]=1;"";[.C49]) -> 0.164925 | G49: of:=IF([.D49]=1;"";[.D49]) -> 0.0221978
A50: 18 | B50: sysfs_streq: &"jt"{\0,p,x,\0} &"jt\n"{\0,a,\0} :=> \x01 | C50: 0.148166 | F50: of:=IF([.C50]=1;"";[.C50]) -> 0.148166 | G50: of:=IF([.D50]=1;"";[.D50]) ->  
A51: 19 | B51: sysfs_streq: &"pw"{\0,p,m,\0} &"pw\nap"{\0} :=> \0 | C51: 0.18217 | F51: of:=IF([.C51]=1;"";[.C51]) -> 0.18217 | G51: of:=IF([.D51]=1;"";[.D51]) ->  
A52: 20 | B52: sysfs_streq: &"rg"{\0,p,g,\0} &"rg"{\0,b,k,\0} :=> \x01 | C52: 0.213322 | D52: 0.213322 | F52: of:=IF([.C52]=1;"";[.C52]) -> 0.213322 | G52: of:=IF([.D52]=1;"";[.D52]) -> 0.213322
A53: 21 | B53: sysfs_streq: &"aolds"{\0} &"aosmt"{\0} :=> \0 | C53: 0.0285597 | D53: 0.025425 | F53: of:=IF([.C53]=1;"";[.C53]) -> 0.0285597 | G53: of:=IF([.D53]=1;"";[.D53]) -> 0.025425
A54: 22 | B54: sysfs_streq: &"fr\n"{\0,b,\0} &"fr"{\0,b,l,\0} :=> \x01 | C54: 0.215706 | F54: of:=IF([.C54]=1;"";[.C54]) -> 0.215706 | G54: of:=IF([.D54]=1;"";[.D54]) ->  
A55: 23 | B55: sysfs_streq: &"ay\n"{\0,b,\0} &"aydbg"{\0} :=> \0 | C55: 0.0226477 | F55: of:=IF([.C55]=1;"";[.C55]) -> 0.0226477 | G55: of:=IF([.D55]=1;"";[.D55]) ->  
A56: 24 | B56: sysfs_streq: &"gr\naw"{\0} &"gregi"{\0} :=> \0 | C56: 0.0303149 | F56: of:=IF([.C56]=1;"";[.C56]) -> 0.0303149 | G56: of:=IF([.D56]=1;"";[.D56]) ->  
A57: 25 | B57: sysfs_streq: &"lbs"{\0,p,\0} &"lbsvo"{\0} :=> \0 | C57: 0.0791628 | D57: 0.0256873 | F57: of:=IF([.C57]=1;"";[.C57]) -> 0.0791628 | G57: of:=IF([.D57]=1;"";[.D57]) -> 0.0256873
A58: 26 | B58: sysfs_streq: &"ffx"{\0,p,\0} &"ffx\n"{\0,\0} :=> \x01 | C58: 0.0561203 | F58: of:=IF([.C58]=1;"";[.C58]) -> 0.0561203 | G58: of:=IF([.D58]=1;"";[.D58]) ->  
A59: 27 | B59: sysfs_streq: &"jhu"{\0,p,\0} &"jhu\na"{\0} :=> \0 | C59: 0.0524687 | F59: of:=IF([.C59]=1;"";[.C59]) -> 0.0524687 | G59: of:=IF([.D59]=1;"";[.D59]) ->  
A60: 28 | B60: sysfs_streq: &"aar"{\0,p,\0} &"aar"{\0,h,\0} :=> \x01 | C60: 0.0809623 | D60: 0.0809623 | F60: of:=IF([.C60]=1;"";[.C60]) -> 0.0809623 | G60: of:=IF([.D60]=1;"";[.D60]) -> 0.0809623
A61: 29 | B61: sysfs_streq: &"chleq"{\0} &"chlvo"{\0} :=> \0 | C61: 0.0287265 | D61: 0.0281705 | F61: of:=IF([.C61]=1;"";[.C61]) -> 0.0287265 | G61: of:=IF([.D61]=1;"";[.D61]) -> 0.0281705
A62: 30 | B62: sysfs_streq: &"xbf\n"{\0,\0} &"xbf"{\0,a,\0} :=> \x01 | C62: 0.0552703 | F62: of:=IF([.C62]=1;"";[.C62]) -> 0.0552703 | G62: of:=IF([.D62]=1;"";[.D62]) ->  
A63: 31 | B63: sysfs_streq: &"kjz\n"{\0,\0} &"kjzxq"{\0} :=> \0 | C63: 0 | F63: of:=IF([.C63]=1;"";[.C63]) -> 0 | G63: of:=IF([.D63]=1;"";[.D63]) ->  
A64: 32 | B64: sysfs_streq: &"yll\na"{\0} &"yllqt"{\0} :=> \0 | C64: 0.0192167 | F64: of:=IF([.C64]=1;"";[.C64]) -> 0.0192167 | G64: of:=IF([.D64]=1;"";[.D64]) ->  
A65: 33 | B65: sysfs_streq: &"odya"{\0,\0} &"odyah"{\0} :=> \0 | C65: 0.0436242 | D65: 0.0274411 | F65: of:=IF([.C65]=1;"";[.C65]) -> 0.0436242 | G65: of:=IF([.D65]=1;"";[.D65]) -> 0.0274411
A66: 34 | B66: sysfs_streq: &"azea"{\0,\0} &"azea\n"{\0} :=> \x01 | C66: 0.0446854 | F66: of:=IF([.C66]=1;"";[.C66]) -> 0.0446854 | G66: of:=IF([.D66]=1;"";[.D66]) ->  
A67: 35 | B67: sysfs_streq: &"piyg"{\0,\0} &"piyg"{\0,\0} :=> \x01 | C67: 0.0382116 | D67: 0.0382116 | F67: of:=IF([.C67]=1;"";[.C67]) -> 0.0382116 | G67: of:=IF([.D67]=1;"";[.D67]) -> 0.0382116
A68: 36 | B68: sysfs_streq: &"qicjn"{\0} &"qicju"{\0} :=> \0 | C68: 0.0169123 | D68: 0.0197834 | F68: of:=IF([.C68]=1;"";[.C68]) -> 0.0169123 | G68: of:=IF([.D68]=1;"";[.D68]) -> 0.0197834
A69: 37 | B69: sysfs_streq: &"kvym\n"{\0} &"kvym"{\0,\0} :=> \x01 | C69: 0.0375052 | F69: of:=IF([.C69]=1;"";[.C69]) -> 0.0375052 | G69: of:=IF([.D69]=1;"";[.D69]) ->  
A70: 38 | B70: sysfs_streq: &"yxfa\n"{\0} &"yxfal"{\0} :=> \0 | C70: 0.0239445 | F70: of:=IF([.C70]=1;"";[.C70]) -> 0.0239445 | G70: of:=IF([.D70]=1;"";[.D70]) ->  
A71: 39 | B71: sysfs_streq: &"kyzgi"{\0} &"kyzgi"{\0} :=> \x01 | C71: 0.023487 | D71: 0.023487 | F71: of:=IF([.C71]=1;"";[.C71]) -> 0.023487 | G71: of:=IF([.D71]=1;"";[.D71]) -> 0.023487

Sheet: strcpy
A1: # | B1: Test Case | C1: N1 | D1: N2 | E1: N3 | O1: FINAL
A2: 1 | B2: strcpy: &""{\0,\x01,\x01,\x01,\x01,\x01} &"y"{\0,p,e,z,\0} :=> &"y"{\0,p,d,u,\0} | C2: 1 | D2: 1 | E2: 1 | G2: of:=IF([.C2]=1;"";[.C2]) ->  | H2: of:=IF([.D2]=1;"";[.D2]) ->  | I2: of:=IF([.E2]=1;"";[.E2]) ->  | K2: of:=AVERAGE([.G2:.G36]) -> 0.0849946 | L2: of:=AVERAGE([.H2:.H36]) -> 0.07090265 | M2: of:=AVERAGE([.I2:.I36]) -> 0.07090265 | O2: of:=AVERAGE([.K2:.M2]) -> 0.0755999666666667
A3: 2 | B3: strcpy: &""{\0,\x01,\x01,\x01,\x01,\x01} &"si"{\0,p,h,\0} :=> &"si"{\0,p,z,\0} | C3: 1 | D3: 0.22025 | E3: 0.22025 | G3: of:=IF([.C3]=1;"";[.C3]) ->  | H3: of:=IF([.D3]=1;"";[.D3]) -> 0.22025 | I3: of:=IF([.E3]=1;"";[.E3]) -> 0.22025
A4: 3 | B4: strcpy: &""{\0,\x01,\x01,\x01,\x01,\x01} &"esw"{\0,p,\0} :=> &"esw"{\0,p,\0} | C4: 1 | D4: 0.084646 | E4: 0.084646 | G4: of:=IF([.C4]=1;"";[.C4]) ->  | H4: of:=IF([.D4]=1;"";[.D4]) -> 0.084646 | I4: of:=IF([.E4]=1;"";[.E4]) -> 0.084646
A5: 4 | B5: strcpy: &""{\0,\x01,\x01,\x01,\x01,\x01} &"zspw"{\0,\0} :=> &"zspw"{\0,\0} | C5: 1 | D5: 0.036054 | E5: 0.036054 | G5: of:=IF([.C5]=1;"";[.C5]) ->  | H5: of:=IF([.D5]=1;"";[.D5]) -> 0.036054 | I5: of:=IF([.E5]=1;"";[.E5]) -> 0.036054
A6: 5 | B6: strcpy: &""{\0,\x01,\x01,\x01,\x01,\x01} &"qotzt"{\0} :=> &"qotzt"{\0} | C6: 1 | D6: 0 | E6: 0 | G6: of:=IF([.C6]=1;"";[.C6]) ->  | H6: of:=IF([.D6]=1;"";[.D6]) -> 0 | I6: of:=IF([.E6]=1;"";[.E6]) -> 0
A7: 6 | B7: strcpy: &"q"{\0,\x01,\x01,\x01,\x01} &""{\0,p,g,o,m,\0} :=> &""{\0,\0,p,c,h,\0} | C7: 1 | D7: 1 | E7: 1 | G7: of:=IF([.C7]=1;"";[.C7]) ->  | H7: of:=IF([.D7]=1;"";[.D7]) ->  | I7: of:=IF([.E7]=1;"";[.E7]) -> 
A8: 7 | B8: strcpy: &"i"{\0,\x01,\x01,\x01,\x01} &"x"{\0,p,u,g,\0} :=> &"x"{\0,p,d,j,\0} | C8: 1 | D8: 1 | E8: 1 | G8: of:=IF([.C8]=1;"";[.C8]) ->  | H8: of:=IF([.D8]=1;"";[.D8]) ->  | I8: of:=IF([.E8]=1;"";[.E8]) -> 
A9: 8 | B9: strcpy: &"x"{\0,\x01,\x01,\x01,\x01} &"jx"{\0,p,s,\0} :=> &"jx"{\0,p,v,\0} | C9: 1 | D9: 0 | E9: 0 | G9: of:=IF([.C9]=1;"";[.C9]) ->  | H9: of:=IF([.D9]=1;"";[.D9]) -> 0 | I9: of:=IF([.E9]=1;"";[.E9]) -> 0
A10: 9 | B10: strcpy: &"z"{\0,\x01,\x01,\x01,\x01} &"qwp"{\0,p,\0} :=> &"qwp"{\0,p,\0} | C10: 1 | D10: 0.0422879 | E10: 0.0422879 | G10: of:=IF([.C10]=1;"";[.C10]) ->  | H10: of:=IF([.D10]=1;"";[.D10]) -> 0.0422879 | I10: of:=IF([.E10]=1;"";[.E10]) -> 0.0422879
A11: 10 | B11: strcpy: &"l"{\0,\x01,\x01,\x01,\x01} &"jjkf"{\0,\0} :=> &"jjkf"{\0,\0} | C11: 1 | D11: 0.0270104 | E11: 0.0270104 | G11: of:=IF([.C11]=1;"";[.C11]) ->  | H11: of:=IF([.D11]=1;"";[.D11]) -> 0.0270104 | I11: of:=IF([.E11]=1;"";[.E11]) -> 0.0270104
A12: 11 | B12: strcpy: &"a"{\0,\x01,\x01,\x01,\x01} &"sdjeu"{\0} :=> &"sdjeu"{\0} | C12: 1 | D12: 0.0257318 | E12: 0.0257318 | G12: of:=IF([.C12]=1;"";[.C12]) ->  | H12: of:=IF([.D12]=1;"";[.D12]) -> 0.0257318 | I12: of:=IF([.E12]=1;"";[.E12]) -> 0.0257318
A13: 12 | B13: strcpy: &"an"{\0,\x01,\x01,\x01} &""{\0,p,i,u,z,\0} :=> &""{\0,n,\0,p,c,\0} | C13: 0.225766 | D13: 1 | E13: 1 | G13: of:=IF([.C13]=1;"";[.C13]) -> 0.225766 | H13: of:=IF([.D13]=1;"";[.D13]) ->  | I13: of:=IF([.E13]=1;"";[.E13]) -> 
A14: 13 | B14: strcpy: &"nl"{\0,\x01,\x01,\x01} &"c"{\0,p,l,r,\0} :=> &"c"{\0,\0,p,k,\0} | C14: 0.208818 | D14: 1 | E14: 1 | G14: of:=IF([.C14]=1;"";[.C14]) -> 0.208818 | H14: of:=IF([.D14]=1;"";[.D14]) ->  | I14: of:=IF([.E14]=1;"";[.E14]) -> 
A15: 14 | B15: strcpy: &"mu"{\0,\x01,\x01,\x01} &"ei"{\0,p,u,\0} :=> &"ei"{\0,p,g,\0} | C15: 0.211853 | D15: 0.214762 | E15: 0.214762 | G15: of:=IF([.C15]=1;"";[.C15]) -> 0.211853 | H15: of:=IF([.D15]=1;"";[.D15]) -> 0.214762 | I15: of:=IF([.E15]=1;"";[.E15]) -> 0.214762
A16: 15 | B16: strcpy: &"te"{\0,\x01,\x01,\x01} &"ctz"{\0,p,\0} :=> &"ctz"{\0,p,\0} | C16: 0.223692 | D16: 0.0817034 | E16: 0.0817034 | G16: of:=IF([.C16]=1;"";[.C16]) -> 0.223692 | H16: of:=IF([.D16]=1;"";[.D16]) -> 0.0817034 | I16: of:=IF([.E16]=1;"";[.E16]) -> 0.0817034
A17: 16 | B17: strcpy: &"xb"{\0,\x01,\x01,\x01} &"bady"{\0,\0} :=> &"bady"{\0,\0} | C17: 0.163328 | D17: 0.0457629 | E17: 0.0457629 | G17: of:=IF([.C17]=1;"";[.C17]) -> 0.163328 | H17: of:=IF([.D17]=1;"";[.D17]) -> 0.0457629 | I17: of:=IF([.E17]=1;"";[.E17]) -> 0.0457629
A18: 17 | B18: strcpy: &"ax"{\0,\x01,\x01,\x01} &"gnbgb"{\0} :=> &"gnbgb"{\0} | C18: 0.206399 | D18: 0.021464 | E18: 0.021464 | G18: of:=IF([.C18]=1;"";[.C18]) -> 0.206399 | H18: of:=IF([.D18]=1;"";[.D18]) -> 0.021464 | I18: of:=IF([.E18]=1;"";[.E18]) -> 0.021464
A19: 18 | B19: strcpy: &"emw"{\0,\x01,\x01} &""{\0,p,n,a,o,\0} :=> &""{\0,m,w,\0,p,\0} | C19: 0.0730166 | D19: 1 | E19: 1 | G19: of:=IF([.C19]=1;"";[.C19]) -> 0.0730166 | H19: of:=IF([.D19]=1;"";[.D19]) ->  | I19: of:=IF([.E19]=1;"";[.E19]) -> 
A20: 19 | B20: strcpy: &"oeh"{\0,\x01,\x01} &"w"{\0,p,l,s,\0} :=> &"w"{\0,h,\0,p,\0} | C20: 0.0799059 | D20: 1 | E20: 1 | G20: of:=IF([.C20]=1;"";[.C20]) -> 0.0799059 | H20: of:=IF([.D20]=1;"";[.D20]) ->  | I20: of:=IF([.E20]=1;"";[.E20]) -> 
A21: 20 | B21: strcpy: &"llg"{\0,\x01,\x01} &"fv"{\0,p,a,\0} :=> &"fv"{\0,\0,p,\0} | C21: 0.0814208 | D21: 0.163651 | E21: 0.163651 | G21: of:=IF([.C21]=1;"";[.C21]) -> 0.0814208 | H21: of:=IF([.D21]=1;"";[.D21]) -> 0.163651 | I21: of:=IF([.E21]=1;"";[.E21]) -> 0.163651
A22: 21 | B22: strcpy: &"ydc"{\0,\x01,\x01} &"vcn"{\0,p,\0} :=> &"vcn"{\0,p,\0} | C22: 0.0733874 | D22: 0.0637223 | E22: 0.0637223 | G22: of:=IF([.C22]=1;"";[.C22]) -> 0.0733874 | H22: of:=IF([.D22]=1;"";[.D22]) -> 0.0637223 | I22: of:=IF([.E22]=1;"";[.E22]) -> 0.0637223
A23: 22 | B23: strcpy: &"rgl"{\0,\x01,\x01} &"lhxm"{\0,\0} :=> &"lhxm"{\0,\0} | C23: 0.0828119 | D23: 0 | E23: 0 | G23: of:=IF([.C23]=1;"";[.C23]) -> 0.0828119 | H23: of:=IF([.D23]=1;"";[.D23]) -> 0 | I23: of:=IF([.E23]=1;"";[.E23]) -> 0
A24: 23 | B24: strcpy: &"sex"{\0,\x01,\x01} &"plboa"{\0} :=> &"plboa"{\0} | C24: 0.0876264 | D24: 0.0285316 | E24: 0.0285316 | G24: of:=IF([.C24]=1;"";[.C24]) -> 0.0876264 | H24: of:=IF([.D24]=1;"";[.D24]) -> 0.0285316 | I24: of:=IF([.E24]=1;"";[.E24]) -> 0.0285316
A25: 24 | B25: strcpy: &"vdsy"{\0,\x01} &""{\0,p,r,c,g,\0} :=> &""{\0,d,s,y,\0,\0} | C25: 0.0379884 | D25: 1 | E25: 1 | G25: of:=IF([.C25]=1;"";[.C25]) -> 0.0379884 | H25: of:=IF([.D25]=1;"";[.D25]) ->  | I25: of:=IF([.E25]=1;"";[.E25]) -> 
A26: 25 | B26: strcpy: &"ulhp"{\0,\x01} &"o"{\0,p,r,t,\0} :=> &"o"{\0,h,p,\0,\0} | C26: 0.0387186 | D26: 1 | E26: 1 | G26: of:=IF([.C26]=1;"";[.C26]) -> 0.0387186 | H26: of:=IF([.D26]=1;"";[.D26]) ->  | I26: of:=IF([.E26]=1;"";[.E26]) -> 
A27: 26 | B27: strcpy: &"upww"{\0,\x01} &"ny"{\0,p,s,\0} :=> &"ny"{\0,w,\0,\0} | C27: 0.0329734 | D27: 0.213806 | E27: 0.213806 | G27: of:=IF([.C27]=1;"";[.C27]) -> 0.0329734 | H27: of:=IF([.D27]=1;"";[.D27]) -> 0.213806 | I27: of:=IF([.E27]=1;"";[.E27]) -> 0.213806
A28: 27 | B28: strcpy: &"npav"{\0,\x01} &"bsx"{\0,p,\0} :=> &"bsx"{\0,\0,\0} | C28: 0.0441092 | D28: 0 | E28: 0 | G28: of:=IF([.C28]=1;"";[.C28]) -> 0.0441092 | H28: of:=IF([.D28]=1;"";[.D28]) -> 0 | I28: of:=IF([.E28]=1;"";[.E28]) -> 0
A29: 28 | B29: strcpy: &"peqb"{\0,\x01} &"liwp"{\0,\0} :=> &"liwp"{\0,\0} | C29: 0.0339213 | D29: 0.0383254 | E29: 0.0383254 | G29: of:=IF([.C29]=1;"";[.C29]) -> 0.0339213 | H29: of:=IF([.D29]=1;"";[.D29]) -> 0.0383254 | I29: of:=IF([.E29]=1;"";[.E29]) -> 0.0383254
A30: 29 | B30: strcpy: &"lzac"{\0,\x01} &"pwwcq"{\0} :=> &"pwwcq"{\0} | C30: 0.0410533 | D30: 0.0194032 | E30: 0.0194032 | G30: of:=IF([.C30]=1;"";[.C30]) -> 0.0410533 | H30: of:=IF([.D30]=1;"";[.D30]) -> 0.0194032 | I30: of:=IF([.E30]=1;"";[.E30]) -> 0.0194032
A31: 30 | B31: strcpy: &"adwko"{\0} &""{\0,p,d,l,p,\0} :=> &""{\0,d,w,k,o,\0} | C31: 0.0259379 | D31: 1 | E31: 1 | G31: of:=IF([.C31]=1;"";[.C31]) -> 0.0259379 | H31: of:=IF([.D31]=1;"";[.D31]) ->  | I31: of:=IF([.E31]=1;"";[.E31]) -> 
A32: 31 | B32: strcpy: &"qcnnx"{\0} &"y"{\0,p,c,k,\0} :=> &"y"{\0,n,n,x,\0} | C32: 0 | D32: 1 | E32: 1 | G32: of:=IF([.C32]=1;"";[.C32]) -> 0 | H32: of:=IF([.D32]=1;"";[.D32]) ->  | I32: of:=IF([.E32]=1;"";[.E32]) -> 
A33: 32 | B33: strcpy: &"vnkca"{\0} &"ct"{\0,p,j,\0} :=> &"ct"{\0,c,a,\0} | C33: 0.0235132 | D33: 0.218466 | E33: 0.218466 | G33: of:=IF([.C33]=1;"";[.C33]) -> 0.0235132 | H33: of:=IF([.D33]=1;"";[.D33]) -> 0.218466 | I33: of:=IF([.E33]=1;"";[.E33]) -> 0.218466
A34: 33 | B34: strcpy: &"soqls"{\0} &"goa"{\0,p,\0} :=> &"goa"{\0,s,\0} | C34: 0.0197563 | D34: 0.0836407 | E34: 0.0836407 | G34: of:=IF([.C34]=1;"";[.C34]) -> 0.0197563 | H34: of:=IF([.D34]=1;"";[.D34]) -> 0.0836407 | I34: of:=IF([.E34]=1;"";[.E34]) -> 0.0836407
A35: 34 | B35: strcpy: &"vprfa"{\0} &"bitc"{\0,\0} :=> &"bitc"{\0,\0} | C35: 0 | D35: 0.0458956 | E35: 0.0458956 | G35: of:=IF([.C35]=1;"";[.C35]) -> 0 | H35: of:=IF([.D35]=1;"";[.D35]) -> 0.0458956 | I35: of:=IF([.E35]=1;"";[.E35]) -> 0.0458956
A36: 35 | B36: strcpy: &"cezrz"{\0} &"unldz"{\0} :=> &"unldz"{\0} | C36: 0.0238738 | D36: 0.0265494 | E36: 0.0265494 | G36: of:=IF([.C36]=1;"";[.C36]) -> 0.0238738 | H36: of:=IF([.D36]=1;"";[.D36]) -> 0.0265494 | I36: of:=IF([.E36]=1;"";[.E36]) -> 0.0265494
A37: 1 | B37: strncpy: &""{\0,\x01,\x01,\x01,\x01,\x01} &""{\0,p,w,r,y,\0} 5 :=> &""{\0,\0,\0,\0,\0,\0} | C37: 1 | D37: 1 | E37: 1 | G37: of:=IF([.C37]=1;"";[.C37]) ->  | H37: of:=IF([.D37]=1;"";[.D37]) ->  | I37: of:=IF([.E37]=1;"";[.E37]) ->  | K37: of:=AVERAGE([.G37:.G72]) -> 0.0818942333333333 | L37: of:=AVERAGE([.H37:.H72]) -> 0.0534352541666667 | M37: of:=AVERAGE([.I37:.I72]) -> 0.0534352541666667 | O37: of:=AVERAGE([.K37:.M37]) -> 0.0629215805555556
A38: 2 | B38: strncpy: &""{\0,\x01,\x01,\x01,\x01,\x01} &"m"{\0,p,r,g,\0} 5 :=> &"m"{\0,\0,\0,\0,\0} | C38: 1 | D38: 1 | E38: 1 | G38: of:=IF([.C38]=1;"";[.C38]) ->  | H38: of:=IF([.D38]=1;"";[.D38]) ->  | I38: of:=IF([.E38]=1;"";[.E38]) -> 
A39: 3 | B39: strncpy: &""{\0,\x01,\x01,\x01,\x01,\x01} &"pq"{\0,p,m,\0} 5 :=> &"pq"{\0,\0,\0,\0} | C39: 1 | D39: 0.140671 | E39: 0.140671 | G39: of:=IF([.C39]=1;"";[.C39]) ->  | H39: of:=IF([.D39]=1;"";[.D39]) -> 0.140671 | I39: of:=IF([.E39]=1;"";[.E39]) -> 0.140671
A40: 4 | B40: strncpy: &""{\0,\x01,\x01,\x01,\x01,\x01} &"zjy"{\0,p,\0} 5 :=> &"zjy"{\0,\0,\0} | C40: 1 | D40: 0.0320829 | E40: 0.0320829 | G40: of:=IF([.C40]=1;"";[.C40]) ->  | H40: of:=IF([.D40]=1;"";[.D40]) -> 0.0320829 | I40: of:=IF([.E40]=1;"";[.E40]) -> 0.0320829
A41: 5 | B41: strncpy: &""{\0,\x01,\x01,\x01,\x01,\x01} &"zoin"{\0,\0} 5 :=> &"zoin"{\0,\0} | C41: 1 | D41: 0.0449073 | E41: 0.0449073 | G41: of:=IF([.C41]=1;"";[.C41]) ->  | H41: of:=IF([.D41]=1;"";[.D41]) -> 0.0449073 | I41: of:=IF([.E41]=1;"";[.E41]) -> 0.0449073
A42: 6 | B42: strncpy: &""{\0,\x01,\x01,\x01,\x01,\x01} &"jwdew"{\0} 5 :=> &"jwdew"{\0} | C42: 1 | D42: 0 | E42: 0 | G42: of:=IF([.C42]=1;"";[.C42]) ->  | H42: of:=IF([.D42]=1;"";[.D42]) -> 0 | I42: of:=IF([.E42]=1;"";[.E42]) -> 0
A43: 7 | B43: strncpy: &"d"{\0,\x01,\x01,\x01,\x01} &""{\0,p,p,m,h,\0} 5 :=> &""{\0,\0,\0,\0,\0,\0} | C43: 1 | D43: 1 | E43: 1 | G43: of:=IF([.C43]=1;"";[.C43]) ->  | H43: of:=IF([.D43]=1;"";[.D43]) ->  | I43: of:=IF([.E43]=1;"";[.E43]) -> 
A44: 8 | B44: strncpy: &"s"{\0,\x01,\x01,\x01,\x01} &"d"{\0,p,e,v,\0} 5 :=> &"d"{\0,\0,\0,\0,\0} | C44: 1 | D44: 1 | E44: 1 | G44: of:=IF([.C44]=1;"";[.C44]) ->  | H44: of:=IF([.D44]=1;"";[.D44]) ->  | I44: of:=IF([.E44]=1;"";[.E44]) -> 
A45: 9 | B45: strncpy: &"k"{\0,\x01,\x01,\x01,\x01} &"yj"{\0,p,s,\0} 5 :=> &"yj"{\0,\0,\0,\0} | C45: 1 | D45: 0.155302 | E45: 0.155302 | G45: of:=IF([.C45]=1;"";[.C45]) ->  | H45: of:=IF([.D45]=1;"";[.D45]) -> 0.155302 | I45: of:=IF([.E45]=1;"";[.E45]) -> 0.155302
A46: 10 | B46: strncpy: &"u"{\0,\x01,\x01,\x01,\x01} &"bjg"{\0,p,\0} 5 :=> &"bjg"{\0,\0,\0} | C46: 1 | D46: 0 | E46: 0 | G46: of:=IF([.C46]=1;"";[.C46]) ->  | H46: of:=IF([.D46]=1;"";[.D46]) -> 0 | I46: of:=IF([.E46]=1;"";[.E46]) -> 0
A47: 11 | B47: strncpy: &"k"{\0,\x01,\x01,\x01,\x01} &"reeu"{\0,\0} 5 :=> &"reeu"{\0,\0} | C47: 1 | D47: 0.0466398 | E47: 0.0466398 | G47: of:=IF([.C47]=1;"";[.C47]) ->  | H47: of:=IF([.D47]=1;"";[.D47]) -> 0.0466398 | I47: of:=IF([.E47]=1;"";[.E47]) -> 0.0466398
A48: 12 | B48: strncpy: &"s"{\0,\x01,\x01,\x01,\x01} &"caqwf"{\0} 5 :=> &"caqwf"{\0} | C48: 1 | D48: 0.0176397 | E48: 0.0176397 | G48: of:=IF([.C48]=1;"";[.C48]) ->  | H48: of:=IF([.D48]=1;"";[.D48]) -> 0.0176397 | I48: of:=IF([.E48]=1;"";[.E48]) -> 0.0176397
A49: 13 | B49: strncpy: &"hf"{\0,\x01,\x01,\x01} &""{\0,p,w,i,b,\0} 5 :=> &""{\0,\0,\0,\0,\0,\0} | C49: 0.187748 | D49: 1 | E49: 1 | G49: of:=IF([.C49]=1;"";[.C49]) -> 0.187748 | H49: of:=IF([.D49]=1;"";[.D49]) ->  | I49: of:=IF([.E49]=1;"";[.E49]) -> 
A50: 14 | B50: strncpy: &"mq"{\0,\x01,\x01,\x01} &"r"{\0,p,e,h,\0} 5 :=> &"r"{\0,\0,\0,\0,\0} | C50: 0.127187 | D50: 1 | E50: 1 | G50: of:=IF([.C50]=1;"";[.C50]) -> 0.127187 | H50: of:=IF([.D50]=1;"";[.D50]) ->  | I50: of:=IF([.E50]=1;"";[.E50]) -> 
A51: 15 | B51: strncpy: &"sb"{\0,\x01,\x01,\x01} &"ry"{\0,p,j,\0} 5 :=> &"ry"{\0,\0,\0,\0} | C51: 0.200533 | D51: 0.216174 | E51: 0.216174 | G51: of:=IF([.C51]=1;"";[.C51]) -> 0.200533 | H51: of:=IF([.D51]=1;"";[.D51]) -> 0.216174 | I51: of:=IF([.E51]=1;"";[.E51]) -> 0.216174
A52: 16 | B52: strncpy: &"mi"{\0,\x01,\x01,\x01} &"jgv"{\0,p,\0} 5 :=> &"jgv"{\0,\0,\0} | C52: 0.218014 | D52: 0 | E52: 0 | G52: of:=IF([.C52]=1;"";[.C52]) -> 0.218014 | H52: of:=IF([.D52]=1;"";[.D52]) -> 0 | I52: of:=IF([.E52]=1;"";[.E52]) -> 0
A53: 17 | B53: strncpy: &"ns"{\0,\x01,\x01,\x01} &"dudt"{\0,\0} 5 :=> &"dudt"{\0,\0} | C53: 0.219808 | D53: 0.0424359 | E53: 0.0424359 | G53: of:=IF([.C53]=1;"";[.C53]) -> 0.219808 | H53: of:=IF([.D53]=1;"";[.D53]) -> 0.0424359 | I53: of:=IF([.E53]=1;"";[.E53]) -> 0.0424359
A54: 18 | B54: strncpy: &"dh"{\0,\x01,\x01,\x01} &"xzaxb"{\0} 5 :=> &"xzaxb"{\0} | C54: 0.194167 | D54: 0 | E54: 0 | G54: of:=IF([.C54]=1;"";[.C54]) -> 0.194167 | H54: of:=IF([.D54]=1;"";[.D54]) -> 0 | I54: of:=IF([.E54]=1;"";[.E54]) -> 0
A55: 19 | B55: strncpy: &"ekd"{\0,\x01,\x01} &""{\0,p,o,g,e,\0} 5 :=> &""{\0,\0,\0,\0,\0,\0} | C55: 0.0748297 | D55: 1 | E55: 1 | G55: of:=IF([.C55]=1;"";[.C55]) -> 0.0748297 | H55: of:=IF([.D55]=1;"";[.D55]) ->  | I55: of:=IF([.E55]=1;"";[.E55]) -> 
A56: 20 | B56: strncpy: &"ycs"{\0,\x01,\x01} &"h"{\0,p,o,j,\0} 5 :=> &"h"{\0,\0,\0,\0,\0} | C56: 0.0777769 | D56: 1 | E56: 1 | G56: of:=IF([.C56]=1;"";[.C56]) -> 0.0777769 | H56: of:=IF([.D56]=1;"";[.D56]) ->  | I56: of:=IF([.E56]=1;"";[.E56]) -> 
A57: 21 | B57: strncpy: &"zaf"{\0,\x01,\x01} &"ou"{\0,p,w,\0} 5 :=> &"ou"{\0,\0,\0,\0} | C57: 0.0812233 | D57: 0.221991 | E57: 0.221991 | G57: of:=IF([.C57]=1;"";[.C57]) -> 0.0812233 | H57: of:=IF([.D57]=1;"";[.D57]) -> 0.221991 | I57: of:=IF([.E57]=1;"";[.E57]) -> 0.221991
A58: 22 | B58: strncpy: &"ggr"{\0,\x01,\x01} &"wmc"{\0,p,\0} 5 :=> &"wmc"{\0,\0,\0} | C58: 0.0825466 | D58: 0.0684967 | E58: 0.0684967 | G58: of:=IF([.C58]=1;"";[.C58]) -> 0.0825466 | H58: of:=IF([.D58]=1;"";[.D58]) -> 0.0684967 | I58: of:=IF([.E58]=1;"";[.E58]) -> 0.0684967
A59: 23 | B59: strncpy: &"gnm"{\0,\x01,\x01} &"prgo"{\0,\0} 5 :=> &"prgo"{\0,\0} | C59: 0.0815909 | D59: 0.0462986 | E59: 0.0462986 | G59: of:=IF([.C59]=1;"";[.C59]) -> 0.0815909 | H59: of:=IF([.D59]=1;"";[.D59]) -> 0.0462986 | I59: of:=IF([.E59]=1;"";[.E59]) -> 0.0462986
A60: 24 | B60: strncpy: &"pzo"{\0,\x01,\x01} &"myken"{\0} 5 :=> &"myken"{\0} | C60: 0.0634886 | D60: 0.027451 | E60: 0.027451 | G60: of:=IF([.C60]=1;"";[.C60]) -> 0.0634886 | H60: of:=IF([.D60]=1;"";[.D60]) -> 0.027451 | I60: of:=IF([.E60]=1;"";[.E60]) -> 0.027451
A61: 25 | B61: strncpy: &"peau"{\0,\x01} &""{\0,p,j,t,q,\0} 5 :=> &""{\0,\0,\0,\0,\0,\0} | C61: 0.0476193 | D61: 1 | E61: 1 | G61: of:=IF([.C61]=1;"";[.C61]) -> 0.0476193 | H61: of:=IF([.D61]=1;"";[.D61]) ->  | I61: of:=IF([.E61]=1;"";[.E61]) -> 
A62: 26 | B62: strncpy: &"flky"{\0,\x01} &"b"{\0,p,a,q,\0} 5 :=> &"b"{\0,\0,\0,\0,\0} | C62: 0.0421316 | D62: 1 | E62: 1 | G62: of:=IF([.C62]=1;"";[.C62]) -> 0.0421316 | H62: of:=IF([.D62]=1;"";[.D62]) ->  | I62: of:=IF([.E62]=1;"";[.E62]) -> 
A63: 27 | B63: strncpy: &"lfaq"{\0,\x01} &"qy"{\0,p,b,\0} 5 :=> &"qy"{\0,\0,\0,\0} | C63: 0.0424937 | D63: 0 | E63: 0 | G63: of:=IF([.C63]=1;"";[.C63]) -> 0.0424937 | H63: of:=IF([.D63]=1;"";[.D63]) -> 0 | I63: of:=IF([.E63]=1;"";[.E63]) -> 0
A64: 28 | B64: strncpy: &"hywv"{\0,\x01} &"voa"{\0,p,\0} 5 :=> &"voa"{\0,\0,\0} | C64: 0.026586 | D64: 0.0827077 | E64: 0.0827077 | G64: of:=IF([.C64]=1;"";[.C64]) -> 0.026586 | H64: of:=IF([.D64]=1;"";[.D64]) -> 0.0827077 | I64: of:=IF([.E64]=1;"";[.E64]) -> 0.0827077
A65: 29 | B65: strncpy: &"tvll"{\0,\x01} &"vpef"{\0,\0} 5 :=> &"vpef"{\0,\0} | C65: 0.0376143 | D65: 0 | E65: 0 | G65: of:=IF([.C65]=1;"";[.C65]) -> 0.0376143 | H65: of:=IF([.D65]=1;"";[.D65]) -> 0 | I65: of:=IF([.E65]=1;"";[.E65]) -> 0
A66: 30 | B66: strncpy: &"orst"{\0,\x01} &"zyzlk"{\0} 5 :=> &"zyzlk"{\0} | C66: 0.0495231 | D66: 0.0234932 | E66: 0.0234932 | G66: of:=IF([.C66]=1;"";[.C66]) -> 0.0495231 | H66: of:=IF([.D66]=1;"";[.D66]) -> 0.0234932 | I66: of:=IF([.E66]=1;"";[.E66]) -> 0.0234932
A67: 31 | B67: strncpy: &"owusd"{\0} &""{\0,p,w,t,a,\0} 5 :=> &""{\0,\0,\0,\0,\0,\0} | C67: 0.0259445 | D67: 1 | E67: 1 | G67: of:=IF([.C67]=1;"";[.C67]) -> 0.0259445 | H67: of:=IF([.D67]=1;"";[.D67]) ->  | I67: of:=IF([.E67]=1;"";[.E67]) -> 
A68: 32 | B68: strncpy: &"sottv"{\0} &"e"{\0,p,v,g,\0} 5 :=> &"e"{\0,\0,\0,\0,\0} | C68: 0.0280332 | D68: 1 | E68: 1 | G68: of:=IF([.C68]=1;"";[.C68]) -> 0.0280332 | H68: of:=IF([.D68]=1;"";[.D68]) ->  | I68: of:=IF([.E68]=1;"";[.E68]) -> 
A69: 33 | B69: strncpy: &"ummvq"{\0} &"qd"{\0,p,x,\0} 5 :=> &"qd"{\0,\0,\0,\0} | C69: 0 | D69: 0 | E69: 0 | G69: of:=IF([.C69]=1;"";[.C69]) -> 0 | H69: of:=IF([.D69]=1;"";[.D69]) -> 0 | I69: of:=IF([.E69]=1;"";[.E69]) -> 0
A70: 34 | B70: strncpy: &"bbvpd"{\0} &"las"{\0,p,\0} 5 :=> &"las"{\0,\0,\0} | C70: 0 | D70: 0.0895513 | E70: 0.0895513 | G70: of:=IF([.C70]=1;"";[.C70]) -> 0 | H70: of:=IF([.D70]=1;"";[.D70]) -> 0.0895513 | I70: of:=IF([.E70]=1;"";[.E70]) -> 0.0895513
A71: 35 | B71: strncpy: &"eocub"{\0} &"nnfq"{\0,\0} 5 :=> &"nnfq"{\0,\0} | C71: 0.0291856 | D71: 0 | E71: 0 | G71: of:=IF([.C71]=1;"";[.C71]) -> 0.0291856 | H71: of:=IF([.D71]=1;"";[.D71]) -> 0 | I71: of:=IF([.E71]=1;"";[.E71]) -> 0
A72: 36 | B72: strncpy: &"wnedz"{\0} &"iibbu"{\0} 5 :=> &"iibbu"{\0} | C72: 0.0274173 | D72: 0.026604 | E72: 0.026604 | G72: of:=IF([.C72]=1;"";[.C72]) -> 0.0274173 | H72: of:=IF([.D72]=1;"";[.D72]) -> 0.026604 | I72: of:=IF([.E72]=1;"";[.E72]) -> 0.026604

Sheet: strcat
A1: # | B1: Test Case | C1: N1 | D1: N2 | E1: N3
A2: 1 | B2: strcat: &""{\0,\x01,\x01,\x01,\x01,\x01,\x01,\x01,\x01,\x01} &"x"{\0,p,m,\0} :=> &"x"{\0,p,y,k,s,u,x,n,\0} | C2: 1 | D2: 1 | E2: 1 | G2: of:=IF([.C2]=1;"";[.C2]) ->  | H2: of:=IF([.D2]=1;"";[.D2]) ->  | I2: of:=IF([.E2]=1;"";[.E2]) ->  | K2: of:=AVERAGE([.G2:.G41]) -> 0.0564627829032258 | L2: of:=AVERAGE([.H2:.H41]) -> 0.0785012863636364 | M2: of:=AVERAGE([.I2:.I41]) -> 0.0291970694594595 | O2: of:=AVERAGE([.K2:.M2]) -> 0.0547203795754405
A3: 2 | B3: strcat: &""{\0,\x01,\x01,\x01,\x01,\x01,\x01,\x01,\x01,\x01} &"hx"{\0,p,\0} :=> &"hx"{\0,p,y,r,p,s,r,\0} | C3: 1 | D3: 0 | E3: 0 | G3: of:=IF([.C3]=1;"";[.C3]) ->  | H3: of:=IF([.D3]=1;"";[.D3]) -> 0 | I3: of:=IF([.E3]=1;"";[.E3]) -> 0
A4: 3 | B4: strcat: &""{\0,\x01,\x01,\x01,\x01,\x01,\x01,\x01,\x01,\x01} &"dwv"{\0,\0} :=> &"dwv"{\0,p,u,k,g,z,\0} | C4: 1 | D4: 0.0463313 | E4: 0.0463313 | G4: of:=IF([.C4]=1;"";[.C4]) ->  | H4: of:=IF([.D4]=1;"";[.D4]) -> 0.0463313 | I4: of:=IF([.E4]=1;"";[.E4]) -> 0.0463313
A5: 4 | B5: strcat: &""{\0,\x01,\x01,\x01,\x01,\x01,\x01,\x01,\x01,\x01} &"ijpo"{\0} :=> &"ijpo"{\0,p,m,s,i,\0} | C5: 1 | D5: 0.0312392 | E5: 0.0312392 | H5: of:=IF([.D5]=1;"";[.D5]) -> 0.0312392 | I5: of:=IF([.E5]=1;"";[.E5]) -> 0.0312392
A6: 5 | B6: strcat: &"x"{\0,\x01,\x01,\x01,\x01,\x01,\x01,\x01,\x01} &""{\0,p,p,k,\0} :=> &"x"{\0,p,h,g,q,o,l,l,\0} | C6: 1 | D6: 1 | E6: 1 | G6: of:=IF([.C6]=1;"";[.C6]) ->  | H6: of:=IF([.D6]=1;"";[.D6]) ->  | I6: of:=IF([.E6]=1;"";[.E6]) -> 
A7: 6 | B7: strcat: &"u"{\0,\x01,\x01,\x01,\x01,\x01,\x01,\x01,\x01} &"d"{\0,p,x,\0} :=> &"ud"{\0,p,p,p,w,g,h,\0} | C7: 1 | D7: 1 | E7: 0.212836 | G7: of:=IF([.C7]=1;"";[.C7]) ->  | H7: of:=IF([.D7]=1;"";[.D7]) ->  | I7: of:=IF([.E7]=1;"";[.E7]) -> 0.212836
A8: 7 | B8: strcat: &"a"{\0,\x01,\x01,\x01,\x01,\x01,\x01,\x01,\x01} &"xa"{\0,p,\0} :=> &"axa"{\0,p,d,x,f,e,\0} | C8: 1 | D8: 0.203502 | E8: 0.0791809 | G8: of:=IF([.C8]=1;"";[.C8]) ->  | H8: of:=IF([.D8]=1;"";[.D8]) -> 0.203502 | I8: of:=IF([.E8]=1;"";[.E8]) -> 0.0791809
A9: 8 | B9: strcat: &"n"{\0,\x01,\x01,\x01,\x01,\x01,\x01,\x01,\x01} &"eqm"{\0,\0} :=> &"neqm"{\0,p,o,f,q,\0} | C9: 1 | D9: 0 | E9: 0 | G9: of:=IF([.C9]=1;"";[.C9]) ->  | H9: of:=IF([.D9]=1;"";[.D9]) -> 0 | I9: of:=IF([.E9]=1;"";[.E9]) -> 0
A10: 9 | B10: strcat: &"m"{\0,\x01,\x01,\x01,\x01,\x01,\x01,\x01,\x01} &"qukn"{\0} :=> &"mqukn"{\0,p,w,o,\0} | C10: 1 | D10: 0.0423371 | E10: 0.0204718 | G10: of:=IF([.C10]=1;"";[.C10]) ->  | H10: of:=IF([.D10]=1;"";[.D10]) -> 0.0423371 | I10: of:=IF([.E10]=1;"";[.E10]) -> 0.0204718
A11: 10 | B11: strcat: &"ji"{\0,\x01,\x01,\x01,\x01,\x01,\x01,\x01} &""{\0,p,s,n,\0} :=> &"ji"{\0,p,a,m,d,t,o,\0} | C11: 0.192142 | D11: 1 | E11: 0.192142 | G11: of:=IF([.C11]=1;"";[.C11]) -> 0.192142 | H11: of:=IF([.D11]=1;"";[.D11]) ->  | I11: of:=IF([.E11]=1;"";[.E11]) -> 0.192142
A12: 11 | B12: strcat: &"np"{\0,\x01,\x01,\x01,\x01,\x01,\x01,\x01} &"k"{\0,p,y,\0} :=> &"npk"{\0,p,r,c,x,h,\0} | C12: 0.196565 | D12: 1 | E12: 0.071111 | G12: of:=IF([.C12]=1;"";[.C12]) -> 0.196565 | H12: of:=IF([.D12]=1;"";[.D12]) ->  | I12: of:=IF([.E12]=1;"";[.E12]) -> 0.071111
A13: 12 | B13: strcat: &"sc"{\0,\x01,\x01,\x01,\x01,\x01,\x01,\x01} &"hp"{\0,p,\0} :=> &"schp"{\0,p,c,w,b,\0} | C13: 0.213806 | D13: 0.182636 | E13: 0.0419772 | G13: of:=IF([.C13]=1;"";[.C13]) -> 0.213806 | H13: of:=IF([.D13]=1;"";[.D13]) -> 0.182636 | I13: of:=IF([.E13]=1;"";[.E13]) -> 0.0419772
A14: 13 | B14: strcat: &"ta"{\0,\x01,\x01,\x01,\x01,\x01,\x01,\x01} &"xua"{\0,\0} :=> &"taxua"{\0,p,r,v,\0} | C14: 0.22025 | D14: 0.0789895 | E14: 0.0278918 | G14: of:=IF([.C14]=1;"";[.C14]) -> 0.22025 | H14: of:=IF([.D14]=1;"";[.D14]) -> 0.0789895 | I14: of:=IF([.E14]=1;"";[.E14]) -> 0.0278918
A15: 14 | B15: strcat: &"ah"{\0,\x01,\x01,\x01,\x01,\x01,\x01,\x01} &"vouz"{\0} :=> &"ahvouz"{\0,p,t,\0} | C15: 0.203053 | D15: 0.0433656 | E15: 0.0180011 | G15: of:=IF([.C15]=1;"";[.C15]) -> 0.203053 | H15: of:=IF([.D15]=1;"";[.D15]) -> 0.0433656 | I15: of:=IF([.E15]=1;"";[.E15]) -> 0.0180011
A16: 15 | B16: strcat: &"cxn"{\0,\x01,\x01,\x01,\x01,\x01,\x01} &""{\0,p,g,e,\0} :=> &"cxn"{\0,p,i,p,x,o,\0} | C16: 0.0372684 | D16: 1 | E16: 0.0372684 | G16: of:=IF([.C16]=1;"";[.C16]) -> 0.0372684 | H16: of:=IF([.D16]=1;"";[.D16]) ->  | I16: of:=IF([.E16]=1;"";[.E16]) -> 0.0372684
A17: 16 | B17: strcat: &"pdu"{\0,\x01,\x01,\x01,\x01,\x01,\x01} &"v"{\0,p,s,\0} :=> &"pduv"{\0,p,a,w,h,\0} | C17: 0.0743045 | D17: 1 | E17: 0.03822 | G17: of:=IF([.C17]=1;"";[.C17]) -> 0.0743045 | H17: of:=IF([.D17]=1;"";[.D17]) ->  | I17: of:=IF([.E17]=1;"";[.E17]) -> 0.03822
A18: 17 | B18: strcat: &"ths"{\0,\x01,\x01,\x01,\x01,\x01,\x01} &"ja"{\0,p,\0} :=> &"thsja"{\0,p,g,c,\0} | C18: 0.0859493 | D18: 0.200124 | E18: 0.0248743 | G18: of:=IF([.C18]=1;"";[.C18]) -> 0.0859493 | H18: of:=IF([.D18]=1;"";[.D18]) -> 0.200124 | I18: of:=IF([.E18]=1;"";[.E18]) -> 0.0248743
A19: 18 | B19: strcat: &"whg"{\0,\x01,\x01,\x01,\x01,\x01,\x01} &"wem"{\0,\0} :=> &"whgwem"{\0,p,j,\0} | C19: 0.0740634 | D19: 0.0871192 | E19: 0.0182946 | G19: of:=IF([.C19]=1;"";[.C19]) -> 0.0740634 | H19: of:=IF([.D19]=1;"";[.D19]) -> 0.0871192 | I19: of:=IF([.E19]=1;"";[.E19]) -> 0.0182946
A20: 19 | B20: strcat: &"avr"{\0,\x01,\x01,\x01,\x01,\x01,\x01} &"dtcx"{\0} :=> &"avrdtcx"{\0,p,\0} | C20: 0.0761536 | D20: 0.0262835 | E20: 0.0107036 | G20: of:=IF([.C20]=1;"";[.C20]) -> 0.0761536 | H20: of:=IF([.D20]=1;"";[.D20]) -> 0.0262835 | I20: of:=IF([.E20]=1;"";[.E20]) -> 0.0107036
A21: 20 | B21: strcat: &"qlvs"{\0,\x01,\x01,\x01,\x01,\x01} &""{\0,p,p,z,\0} :=> &"qlvs"{\0,p,j,n,q,\0} | C21: 0.0277037 | D21: 1 | E21: 0.0277037 | G21: of:=IF([.C21]=1;"";[.C21]) -> 0.0277037 | H21: of:=IF([.D21]=1;"";[.D21]) ->  | I21: of:=IF([.E21]=1;"";[.E21]) -> 0.0277037
A22: 21 | B22: strcat: &"ztnf"{\0,\x01,\x01,\x01,\x01,\x01} &"a"{\0,p,z,\0} :=> &"ztnfa"{\0,p,t,y,\0} | C22: 0.0378665 | D22: 1 | E22: 0.0250331 | G22: of:=IF([.C22]=1;"";[.C22]) -> 0.0378665 | H22: of:=IF([.D22]=1;"";[.D22]) ->  | I22: of:=IF([.E22]=1;"";[.E22]) -> 0.0250331
A23: 22 | B23: strcat: &"omhz"{\0,\x01,\x01,\x01,\x01,\x01} &"nx"{\0,p,\0} :=> &"omhznx"{\0,p,z,\0} | C23: 0.0328286 | D23: 0.194167 | E23: 0.0141022 | G23: of:=IF([.C23]=1;"";[.C23]) -> 0.0328286 | H23: of:=IF([.D23]=1;"";[.D23]) -> 0.194167 | I23: of:=IF([.E23]=1;"";[.E23]) -> 0.0141022
A24: 23 | B24: strcat: &"phge"{\0,\x01,\x01,\x01,\x01,\x01} &"qmy"{\0,\0} :=> &"phgeqmy"{\0,p,\0} | C24: 0.0405351 | D24: 0 | E24: 0 | G24: of:=IF([.C24]=1;"";[.C24]) -> 0.0405351 | H24: of:=IF([.D24]=1;"";[.D24]) -> 0 | I24: of:=IF([.E24]=1;"";[.E24]) -> 0
A25: 24 | B25: strcat: &"yvqh"{\0,\x01,\x01,\x01,\x01,\x01} &"ghhg"{\0} :=> &"yvqhghhg"{\0,\0} | C25: 0 | D25: 0.0369384 | E25: 0 | G25: of:=IF([.C25]=1;"";[.C25]) -> 0 | H25: of:=IF([.D25]=1;"";[.D25]) -> 0.0369384 | I25: of:=IF([.E25]=1;"";[.E25]) -> 0
A26: 25 | B26: strcat: &"xbylt"{\0,\x01,\x01,\x01,\x01} &""{\0,p,q,d,\0} :=> &"xbylt"{\0,p,d,l,\0} | C26: 0.0245345 | D26: 1 | E26: 0.0245345 | G26: of:=IF([.C26]=1;"";[.C26]) -> 0.0245345 | H26: of:=IF([.D26]=1;"";[.D26]) ->  | I26: of:=IF([.E26]=1;"";[.E26]) -> 0.0245345
A27: 26 | B27: strcat: &"hahoj"{\0,\x01,\x01,\x01,\x01} &"r"{\0,p,f,\0} :=> &"hahojr"{\0,p,b,\0} | C27: 0.0285879 | D27: 1 | E27: 0.0158994 | G27: of:=IF([.C27]=1;"";[.C27]) -> 0.0285879 | H27: of:=IF([.D27]=1;"";[.D27]) ->  | I27: of:=IF([.E27]=1;"";[.E27]) -> 0.0158994
A28: 27 | B28: strcat: &"fsmdt"{\0,\x01,\x01,\x01,\x01} &"px"{\0,p,\0} :=> &"fsmdtpx"{\0,p,\0} | C28: 0.0237559 | D28: 0 | E28: 0 | G28: of:=IF([.C28]=1;"";[.C28]) -> 0.0237559 | H28: of:=IF([.D28]=1;"";[.D28]) -> 0 | I28: of:=IF([.E28]=1;"";[.E28]) -> 0
A29: 28 | B29: strcat: &"sinjx"{\0,\x01,\x01,\x01,\x01} &"pho"{\0,\0} :=> &"sinjxpho"{\0,\0} | C29: 0 | D29: 0.0855052 | E29: 0 | G29: of:=IF([.C29]=1;"";[.C29]) -> 0 | H29: of:=IF([.D29]=1;"";[.D29]) -> 0.0855052 | I29: of:=IF([.E29]=1;"";[.E29]) -> 0
A30: 29 | B30: strcat: &"knrfm"{\0,\x01,\x01,\x01,\x01} &"yryx"{\0} :=> &"knrfmyryx"{\0} | C30: 0.025065 | D30: 0.0381202 | E30: 0.00909753 | G30: of:=IF([.C30]=1;"";[.C30]) -> 0.025065 | H30: of:=IF([.D30]=1;"";[.D30]) -> 0.0381202 | I30: of:=IF([.E30]=1;"";[.E30]) -> 0.00909753
A31: 30 | B31: strcat: &"dofgpm"{\0,\x01,\x01,\x01} &""{\0,p,f,r,\0} :=> &"dofgpm"{\0,p,x,\0} | C31: 0.0177055 | D31: 1 | E31: 0.0177055 | G31: of:=IF([.C31]=1;"";[.C31]) -> 0.0177055 | H31: of:=IF([.D31]=1;"";[.D31]) ->  | I31: of:=IF([.E31]=1;"";[.E31]) -> 0.0177055
A32: 31 | B32: strcat: &"rmpoem"{\0,\x01,\x01,\x01} &"u"{\0,p,f,\0} :=> &"rmpoemu"{\0,p,\0} | C32: 0.0214363 | D32: 1 | E32: 0.0164831 | G32: of:=IF([.C32]=1;"";[.C32]) -> 0.0214363 | H32: of:=IF([.D32]=1;"";[.D32]) ->  | I32: of:=IF([.E32]=1;"";[.E32]) -> 0.0164831
A33: 32 | B33: strcat: &"izbpza"{\0,\x01,\x01,\x01} &"jc"{\0,p,\0} :=> &"izbpzajc"{\0,\0} | C33: 0.0149533 | D33: 0.159409 | E33: 0.00878696 | G33: of:=IF([.C33]=1;"";[.C33]) -> 0.0149533 | H33: of:=IF([.D33]=1;"";[.D33]) -> 0.159409 | I33: of:=IF([.E33]=1;"";[.E33]) -> 0.00878696
A34: 33 | B34: strcat: &"gujlox"{\0,\x01,\x01,\x01} &"nyf"{\0,\0} :=> &"gujloxnyf"{\0} | C34: 0.0157157 | D34: 0.0757741 | E34: 0.00763576 | G34: of:=IF([.C34]=1;"";[.C34]) -> 0.0157157 | H34: of:=IF([.D34]=1;"";[.D34]) -> 0.0757741 | I34: of:=IF([.E34]=1;"";[.E34]) -> 0.00763576
A35: 34 | B35: strcat: &"ahvmad"{\0,\x01,\x01,\x01} &&10 :=> &"ahvmadzqrh"{} | C35: 0.0158338 | D35: 0 | G35: of:=IF([.C35]=1;"";[.C35]) -> 0.0158338 | H35: of:=IF([.D35]=1;"";[.D35]) -> 0 | I35: of:=IF([.E35]=1;"";[.E35]) ->  
A36: 35 | B36: strcat: &"oqkxeuf"{\0,\x01,\x01} &""{\0,p,x,g,\0} :=> &"oqkxeuf"{\0,p,\0} | C36: 0 | D36: 1 | E36: 0 | G36: of:=IF([.C36]=1;"";[.C36]) -> 0 | H36: of:=IF([.D36]=1;"";[.D36]) ->  | I36: of:=IF([.E36]=1;"";[.E36]) -> 0
A37: 36 | B37: strcat: &"ktyftko"{\0,\x01,\x01} &"n"{\0,p,f,\0} :=> &"ktyftkon"{\0,\0} | C37: 0.0132532 | D37: 1 | E37: 0.0112439 | G37: of:=IF([.C37]=1;"";[.C37]) -> 0.0132532 | H37: of:=IF([.D37]=1;"";[.D37]) ->  | I37: of:=IF([.E37]=1;"";[.E37]) -> 0.0112439
A38: 37 | B38: strcat: &"jmwyrhv"{\0,\x01,\x01} &"tg"{\0,p,\0} :=> &"jmwyrhvtg"{\0} | C38: 0.0112784 | D38: 0.195187 | E38: 0.00726893 | G38: of:=IF([.C38]=1;"";[.C38]) -> 0.0112784 | H38: of:=IF([.D38]=1;"";[.D38]) -> 0.195187 | I38: of:=IF([.E38]=1;"";[.E38]) -> 0.00726893
A39: 38 | B39: strcat: &"npwbrhuv"{\0,\x01} &""{\0,p,t,e,\0} :=> &"npwbrhuv"{\0,\0} | C39: 0.0106456 | D39: 1 | E39: 0.0106456 | G39: of:=IF([.C39]=1;"";[.C39]) -> 0.0106456 | H39: of:=IF([.D39]=1;"";[.D39]) ->  | I39: of:=IF([.E39]=1;"";[.E39]) -> 0.0106456
A40: 39 | B40: strcat: &"svubccwk"{\0,\x01} &"h"{\0,p,x,\0} :=> &"svubccwkh"{\0} | C40: 0.00945512 | D40: 1 | E40: 0.00797124 | G40: of:=IF([.C40]=1;"";[.C40]) -> 0.00945512 | H40: of:=IF([.D40]=1;"";[.D40]) ->  | I40: of:=IF([.E40]=1;"";[.E40]) -> 0.00797124
A41: 40 | B41: strcat: &"qecjfnpoo"{\0} &""{\0,p,v,h,\0} :=> &"qecjfnpoo"{\0} | C41: 0.00563695 | D41: 1 | E41: 0.00563695 | G41: of:=IF([.C41]=1;"";[.C41]) -> 0.00563695 | H41: of:=IF([.D41]=1;"";[.D41]) ->  | I41: of:=IF([.E41]=1;"";[.E41]) -> 0.00563695
A42: 1 | B42: strncat: &""{\0,\x01,\x01,\x01,\x01,\x01,\x01,\x01,\x01,\x01} &""{\0,p,z,v,\0} 4 :=> &""{\0,p,i,j,w,x,a,i,v,\0} | C42: 1 | D42: 1 | E42: 1 | G42: of:=IF([.C42]=1;"";[.C42]) ->  | H42: of:=IF([.D42]=1;"";[.D42]) ->  | I42: of:=IF([.E42]=1;"";[.E42]) ->  | K42: of:=AVERAGE([.G42:.G82]) -> 0.0532017451612903 | L42: of:=AVERAGE([.H42:.H82]) -> 0.0861780363636364 | M42: of:=AVERAGE([.I42:.I82]) -> 0.0353375648648649 | O42: of:=AVERAGE([.K42:.M42]) -> 0.0582391154632638
A43: 2 | B43: strncat: &""{\0,\x01,\x01,\x01,\x01,\x01,\x01,\x01,\x01,\x01} &"y"{\0,p,s,\0} 4 :=> &"y"{\0,p,p,d,r,g,u,o,\0} | C43: 1 | D43: 1 | E43: 1 | G43: of:=IF([.C43]=1;"";[.C43]) ->  | H43: of:=IF([.D43]=1;"";[.D43]) ->  | I43: of:=IF([.E43]=1;"";[.E43]) -> 
A44: 3 | B44: strncat: &""{\0,\x01,\x01,\x01,\x01,\x01,\x01,\x01,\x01,\x01} &"fe"{\0,p,\0} 4 :=> &"fe"{\0,p,b,x,g,e,c,\0} | C44: 1 | D44: 0.215706 | E44: 0.215706 | G44: of:=IF([.C44]=1;"";[.C44]) ->  | H44: of:=IF([.D44]=1;"";[.D44]) -> 0.215706 | I44: of:=IF([.E44]=1;"";[.E44]) -> 0.215706
A45: 4 | B45: strncat: &""{\0,\x01,\x01,\x01,\x01,\x01,\x01,\x01,\x01,\x01} &"wek"{\0,\0} 4 :=> &"wek"{\0,p,v,d,a,f,\0} | C45: 1 | D45: 0.0839492 | E45: 0.0839492 | G45: of:=IF([.C45]=1;"";[.C45]) ->  | H45: of:=IF([.D45]=1;"";[.D45]) -> 0.0839492 | I45: of:=IF([.E45]=1;"";[.E45]) -> 0.0839492
A46: 5 | B46: strncat: &""{\0,\x01,\x01,\x01,\x01,\x01,\x01,\x01,\x01,\x01} &"ywrg"{\0} 4 :=> &"ywrg"{\0,p,s,x,y,\0} | C46: 1 | D46: 0.0421697 | E46: 0.0421697 | G46: of:=IF([.C46]=1;"";[.C46]) ->  | H46: of:=IF([.D46]=1;"";[.D46]) -> 0.0421697 | I46: of:=IF([.E46]=1;"";[.E46]) -> 0.0421697
A47: 6 | B47: strncat: &"l"{\0,\x01,\x01,\x01,\x01,\x01,\x01,\x01,\x01} &""{\0,p,b,f,\0} 4 :=> &"l"{\0,p,r,e,i,j,v,v,\0} | C47: 1 | D47: 1 | E47: 1 | G47: of:=IF([.C47]=1;"";[.C47]) ->  | H47: of:=IF([.D47]=1;"";[.D47]) ->  | I47: of:=IF([.E47]=1;"";[.E47]) -> 
A48: 7 | B48: strncat: &"r"{\0,\x01,\x01,\x01,\x01,\x01,\x01,\x01,\x01} &"e"{\0,p,c,\0} 4 :=> &"re"{\0,p,h,u,g,m,f,\0} | C48: 1 | D48: 1 | E48: 0.225356 | G48: of:=IF([.C48]=1;"";[.C48]) ->  | H48: of:=IF([.D48]=1;"";[.D48]) ->  | I48: of:=IF([.E48]=1;"";[.E48]) -> 0.225356
A49: 8 | B49: strncat: &"g"{\0,\x01,\x01,\x01,\x01,\x01,\x01,\x01,\x01} &"cz"{\0,p,\0} 4 :=> &"gcz"{\0,p,l,u,y,f,\0} | C49: 1 | D49: 0.181936 | E49: 0.0593831 | G49: of:=IF([.C49]=1;"";[.C49]) ->  | H49: of:=IF([.D49]=1;"";[.D49]) -> 0.181936 | I49: of:=IF([.E49]=1;"";[.E49]) -> 0.0593831
A50: 9 | B50: strncat: &"x"{\0,\x01,\x01,\x01,\x01,\x01,\x01,\x01,\x01} &"ufg"{\0,\0} 4 :=> &"xufg"{\0,p,n,i,x,\0} | C50: 1 | D50: 0.0721911 | E50: 0.0378455 | G50: of:=IF([.C50]=1;"";[.C50]) ->  | H50: of:=IF([.D50]=1;"";[.D50]) -> 0.0721911 | I50: of:=IF([.E50]=1;"";[.E50]) -> 0.0378455
A51: 10 | B51: strncat: &"a"{\0,\x01,\x01,\x01,\x01,\x01,\x01,\x01,\x01} &"mfoc"{\0} 4 :=> &"amfoc"{\0,p,u,y,\0} | C51: 1 | D51: 0.0437714 | E51: 0.0286271 | G51: of:=IF([.C51]=1;"";[.C51]) ->  | H51: of:=IF([.D51]=1;"";[.D51]) -> 0.0437714 | I51: of:=IF([.E51]=1;"";[.E51]) -> 0.0286271
A52: 11 | B52: strncat: &"pn"{\0,\x01,\x01,\x01,\x01,\x01,\x01,\x01} &""{\0,p,h,k,\0} 4 :=> &"pn"{\0,p,x,y,i,s,p,\0} | C52: 0.180192 | D52: 1 | E52: 0.180192 | G52: of:=IF([.C52]=1;"";[.C52]) -> 0.180192 | H52: of:=IF([.D52]=1;"";[.D52]) ->  | I52: of:=IF([.E52]=1;"";[.E52]) -> 0.180192
A53: 12 | B53: strncat: &"gb"{\0,\x01,\x01,\x01,\x01,\x01,\x01,\x01} &"c"{\0,p,p,\0} 4 :=> &"gbc"{\0,p,g,w,s,l,\0} | C53: 0.178229 | D53: 1 | E53: 0.0659549 | G53: of:=IF([.C53]=1;"";[.C53]) -> 0.178229 | H53: of:=IF([.D53]=1;"";[.D53]) ->  | I53: of:=IF([.E53]=1;"";[.E53]) -> 0.0659549
A54: 13 | B54: strncat: &"hk"{\0,\x01,\x01,\x01,\x01,\x01,\x01,\x01} &"xs"{\0,p,\0} 4 :=> &"hkxs"{\0,p,z,i,a,\0} | C54: 0.182636 | D54: 0.171077 | E54: 0 | G54: of:=IF([.C54]=1;"";[.C54]) -> 0.182636 | H54: of:=IF([.D54]=1;"";[.D54]) -> 0.171077 | I54: of:=IF([.E54]=1;"";[.E54]) -> 0
A55: 14 | B55: strncat: &"ra"{\0,\x01,\x01,\x01,\x01,\x01,\x01,\x01} &"psj"{\0,\0} 4 :=> &"rapsj"{\0,p,x,s,\0} | C55: 0.22156 | D55: 0.0684605 | E55: 0.0258806 | G55: of:=IF([.C55]=1;"";[.C55]) -> 0.22156 | H55: of:=IF([.D55]=1;"";[.D55]) -> 0.0684605 | I55: of:=IF([.E55]=1;"";[.E55]) -> 0.0258806
A56: 15 | B56: strncat: &"ky"{\0,\x01,\x01,\x01,\x01,\x01,\x01,\x01} &"jfxt"{\0} 4 :=> &"kyjfxt"{\0,p,c,\0} | C56: 0.201172 | D56: 0.0239363 | E56: 0.0107564 | G56: of:=IF([.C56]=1;"";[.C56]) -> 0.201172 | H56: of:=IF([.D56]=1;"";[.D56]) -> 0.0239363 | I56: of:=IF([.E56]=1;"";[.E56]) -> 0.0107564
A57: 16 | B57: strncat: &"cnz"{\0,\x01,\x01,\x01,\x01,\x01,\x01} &""{\0,p,m,a,\0} 4 :=> &"cnz"{\0,p,m,a,d,a,\0} | C57: 0.0669578 | D57: 1 | E57: 0.0669578 | G57: of:=IF([.C57]=1;"";[.C57]) -> 0.0669578 | H57: of:=IF([.D57]=1;"";[.D57]) ->  | I57: of:=IF([.E57]=1;"";[.E57]) -> 0.0669578
A58: 17 | B58: strncat: &"ckn"{\0,\x01,\x01,\x01,\x01,\x01,\x01} &"t"{\0,p,a,\0} 4 :=> &"cknt"{\0,p,v,l,k,\0} | C58: 0.0830859 | D58: 1 | E58: 0.0462321 | G58: of:=IF([.C58]=1;"";[.C58]) -> 0.0830859 | H58: of:=IF([.D58]=1;"";[.D58]) ->  | I58: of:=IF([.E58]=1;"";[.E58]) -> 0.0462321
A59: 18 | B59: strncat: &"lcn"{\0,\x01,\x01,\x01,\x01,\x01,\x01} &"dh"{\0,p,\0} 4 :=> &"lcndh"{\0,p,m,a,\0} | C59: 0.0681097 | D59: 0.194167 | E59: 0.0244452 | G59: of:=IF([.C59]=1;"";[.C59]) -> 0.0681097 | H59: of:=IF([.D59]=1;"";[.D59]) -> 0.194167 | I59: of:=IF([.E59]=1;"";[.E59]) -> 0.0244452
A60: 19 | B60: strncat: &"osq"{\0,\x01,\x01,\x01,\x01,\x01,\x01} &"wbl"{\0,\0} 4 :=> &"osqwbl"{\0,p,m,\0} | C60: 0.0809658 | D60: 0.0775684 | E60: 0.0137386 | G60: of:=IF([.C60]=1;"";[.C60]) -> 0.0809658 | H60: of:=IF([.D60]=1;"";[.D60]) -> 0.0775684 | I60: of:=IF([.E60]=1;"";[.E60]) -> 0.0137386
A61: 20 | B61: strncat: &"rit"{\0,\x01,\x01,\x01,\x01,\x01,\x01} &"csio"{\0} 4 :=> &"ritcsio"{\0,p,\0} | C61: 0.0899739 | D61: 0.0464395 | E61: 0.0168454 | G61: of:=IF([.C61]=1;"";[.C61]) -> 0.0899739 | H61: of:=IF([.D61]=1;"";[.D61]) -> 0.0464395 | I61: of:=IF([.E61]=1;"";[.E61]) -> 0.0168454
A62: 21 | B62: strncat: &"euid"{\0,\x01,\x01,\x01,\x01,\x01} &""{\0,p,o,q,\0} 4 :=> &"euid"{\0,p,q,l,v,\0} | C62: 0.0449488 | D62: 1 | E62: 0.0449488 | G62: of:=IF([.C62]=1;"";[.C62]) -> 0.0449488 | H62: of:=IF([.D62]=1;"";[.D62]) ->  | I62: of:=IF([.E62]=1;"";[.E62]) -> 0.0449488
A63: 22 | B63: strncat: &"xzzh"{\0,\x01,\x01,\x01,\x01,\x01} &"l"{\0,p,j,\0} 4 :=> &"xzzhl"{\0,p,k,d,\0} | C63: 0 | D63: 1 | E63: 0 | G63: of:=IF([.C63]=1;"";[.C63]) -> 0 | H63: of:=IF([.D63]=1;"";[.D63]) ->  | I63: of:=IF([.E63]=1;"";[.E63]) -> 0
A64: 23 | B64: strncat: &"zsya"{\0,\x01,\x01,\x01,\x01,\x01} &"yz"{\0,p,\0} 4 :=> &"zsyayz"{\0,p,x,\0} | C64: 0.0379081 | D64: 0.187462 | E64: 0.0173679 | G64: of:=IF([.C64]=1;"";[.C64]) -> 0.0379081 | H64: of:=IF([.D64]=1;"";[.D64]) -> 0.187462 | I64: of:=IF([.E64]=1;"";[.E64]) -> 0.0173679
A65: 24 | B65: strncat: &"zmbt"{\0,\x01,\x01,\x01,\x01,\x01} &"tfa"{\0,\0} 4 :=> &"zmbttfa"{\0,p,\0} | C65: 0.0392379 | D65: 0.0795148 | E65: 0.0142931 | G65: of:=IF([.C65]=1;"";[.C65]) -> 0.0392379 | H65: of:=IF([.D65]=1;"";[.D65]) -> 0.0795148 | I65: of:=IF([.E65]=1;"";[.E65]) -> 0.0142931
A66: 25 | B66: strncat: &"fkqf"{\0,\x01,\x01,\x01,\x01,\x01} &"cppy"{\0} 4 :=> &"fkqfcppy"{\0,\0} | C66: 0 | D66: 0.036835 | E66: 0 | G66: of:=IF([.C66]=1;"";[.C66]) -> 0 | H66: of:=IF([.D66]=1;"";[.D66]) -> 0.036835 | I66: of:=IF([.E66]=1;"";[.E66]) -> 0
A67: 26 | B67: strncat: &"xmbqq"{\0,\x01,\x01,\x01,\x01} &""{\0,p,t,e,\0} 4 :=> &"xmbqq"{\0,p,i,r,\0} | C67: 0 | D67: 1 | E67: 0 | G67: of:=IF([.C67]=1;"";[.C67]) -> 0 | H67: of:=IF([.D67]=1;"";[.D67]) ->  | I67: of:=IF([.E67]=1;"";[.E67]) -> 0
A68: 27 | B68: strncat: &"ibajd"{\0,\x01,\x01,\x01,\x01} &"q"{\0,p,o,\0} 4 :=> &"ibajdq"{\0,p,j,\0} | C68: 0.0241474 | D68: 1 | E68: 0.0167362 | G68: of:=IF([.C68]=1;"";[.C68]) -> 0.0241474 | H68: of:=IF([.D68]=1;"";[.D68]) ->  | I68: of:=IF([.E68]=1;"";[.E68]) -> 0.0167362
A69: 28 | B69: strncat: &"jepet"{\0,\x01,\x01,\x01,\x01} &"cx"{\0,p,\0} 4 :=> &"jepetcx"{\0,p,\0} | C69: 0.0296912 | D69: 0.106758 | E69: 0.0119259 | G69: of:=IF([.C69]=1;"";[.C69]) -> 0.0296912 | H69: of:=IF([.D69]=1;"";[.D69]) -> 0.106758 | I69: of:=IF([.E69]=1;"";[.E69]) -> 0.0119259
A70: 29 | B70: strncat: &"jtwuh"{\0,\x01,\x01,\x01,\x01} &"oez"{\0,\0} 4 :=> &"jtwuhoez"{\0,\0} | C70: 0.019296 | D70: 0.0782509 | E70: 0.00962473 | G70: of:=IF([.C70]=1;"";[.C70]) -> 0.019296 | H70: of:=IF([.D70]=1;"";[.D70]) -> 0.0782509 | I70: of:=IF([.E70]=1;"";[.E70]) -> 0.00962473
A71: 30 | B71: strncat: &"bzkln"{\0,\x01,\x01,\x01,\x01} &"kqxe"{\0} 4 :=> &"bzklnkqxe"{\0} | C71: 0.0200259 | D71: 0 | E71: 0 | G71: of:=IF([.C71]=1;"";[.C71]) -> 0.0200259 | H71: of:=IF([.D71]=1;"";[.D71]) -> 0 | I71: of:=IF([.E71]=1;"";[.E71]) -> 0
A72: 31 | B72: strncat: &"tecwmj"{\0,\x01,\x01,\x01} &""{\0,p,l,o,\0} 4 :=> &"tecwmj"{\0,p,e,\0} | C72: 0.0153264 | D72: 1 | E72: 0.0153264 | G72: of:=IF([.C72]=1;"";[.C72]) -> 0.0153264 | H72: of:=IF([.D72]=1;"";[.D72]) ->  | I72: of:=IF([.E72]=1;"";[.E72]) -> 0.0153264
A73: 32 | B73: strncat: &"mimiua"{\0,\x01,\x01,\x01} &"p"{\0,p,g,\0} 4 :=> &"mimiuap"{\0,p,\0} | C73: 0.0210224 | D73: 1 | E73: 0.0163143 | G73: of:=IF([.C73]=1;"";[.C73]) -> 0.0210224 | H73: of:=IF([.D73]=1;"";[.D73]) ->  | I73: of:=IF([.E73]=1;"";[.E73]) -> 0.0163143
A74: 33 | B74: strncat: &"pybjet"{\0,\x01,\x01,\x01} &"qx"{\0,p,\0} 4 :=> &"pybjetqx"{\0,\0} | C74: 0.018916 | D74: 0 | E74: 0 | G74: of:=IF([.C74]=1;"";[.C74]) -> 0.018916 | H74: of:=IF([.D74]=1;"";[.D74]) -> 0 | I74: of:=IF([.E74]=1;"";[.E74]) -> 0
A75: 34 | B75: strncat: &"qkpuob"{\0,\x01,\x01,\x01} &"qjb"{\0,\0} 4 :=> &"qkpuobqjb"{\0} | C75: 0 | D75: 0 | E75: 0 | G75: of:=IF([.C75]=1;"";[.C75]) -> 0 | H75: of:=IF([.D75]=1;"";[.D75]) -> 0 | I75: of:=IF([.E75]=1;"";[.E75]) -> 0
A76: 35 | B76: strncat: &"cmxmqj"{\0,\x01,\x01,\x01} &&10 4 :=> &"cmxmqjfpdn"{} | C76: 0 | D76: 0 | G76: of:=IF([.C76]=1;"";[.C76]) -> 0 | H76: of:=IF([.D76]=1;"";[.D76]) -> 0 | I76: of:=IF([.E76]=1;"";[.E76]) ->  
A77: 36 | B77: strncat: &"nokqyya"{\0,\x01,\x01} &""{\0,p,u,h,\0} 4 :=> &"nokqyya"{\0,p,\0} | C77: 0 | D77: 1 | E77: 0 | G77: of:=IF([.C77]=1;"";[.C77]) -> 0 | H77: of:=IF([.D77]=1;"";[.D77]) ->  | I77: of:=IF([.E77]=1;"";[.E77]) -> 0
A78: 37 | B78: strncat: &"izbvtmj"{\0,\x01,\x01} &"l"{\0,p,b,\0} 4 :=> &"izbvtmjl"{\0,\0} | C78: 0.0110396 | D78: 1 | E78: 0.00801964 | G78: of:=IF([.C78]=1;"";[.C78]) -> 0.0110396 | H78: of:=IF([.D78]=1;"";[.D78]) ->  | I78: of:=IF([.E78]=1;"";[.E78]) -> 0.00801964
A79: 38 | B79: strncat: &"vggewip"{\0,\x01,\x01} &"zh"{\0,p,\0} 4 :=> &"vggewipzh"{\0} | C79: 0.0148123 | D79: 0.185724 | E79: 0.00889333 | G79: of:=IF([.C79]=1;"";[.C79]) -> 0.0148123 | H79: of:=IF([.D79]=1;"";[.D79]) -> 0.185724 | I79: of:=IF([.E79]=1;"";[.E79]) -> 0.00889333
A80: 39 | B80: strncat: &"chcxvwbs"{\0,\x01} &""{\0,p,y,p,\0} 4 :=> &"chcxvwbs"{\0,\0} | C80: 0 | D80: 1 | E80: 0 | G80: of:=IF([.C80]=1;"";[.C80]) -> 0 | H80: of:=IF([.D80]=1;"";[.D80]) ->  | I80: of:=IF([.E80]=1;"";[.E80]) -> 0
A81: 40 | B81: strncat: &"xtmpxvdv"{\0,\x01} &"g"{\0,p,q,\0} 4 :=> &"xtmpxvdvg"{\0} | C81: 0 | D81: 1 | E81: 0 | G81: of:=IF([.C81]=1;"";[.C81]) -> 0 | H81: of:=IF([.D81]=1;"";[.D81]) ->  | I81: of:=IF([.E81]=1;"";[.E81]) -> 0
A82: 41 | B82: strncat: &"gjfgqzkgt"{\0} &""{\0,p,y,g,\0} 4 :=> &"gjfgqzkgt"{\0} | C82: 0 | D82: 1 | E82: 0 | G82: of:=IF([.C82]=1;"";[.C82]) -> 0 | H82: of:=IF([.D82]=1;"";[.D82]) ->  | I82: of:=IF([.E82]=1;"";[.E82]) -> 0

Sheet: strstr
A1: # | B1: Test Case | C1: N | G1: N1 | H1: N2 | I1: N3
A2: 1 | B2: strstr: &"t"{\0,h,b,d,\0} &"t"{\0,\0} :=> &"t"{\0,h,b,d,\0} | C2: 1 | D2: 1 | E2: 1 | G2: of:=IF([.C2]=1;"";[.C2]) ->  | H2: of:=IF([.D2]=1;"";[.D2]) ->  | I2: of:=IF([.E2]=1;"";[.E2]) ->  | K2: of:=AVERAGE([.G2:.G19]) -> 0.0611159764705882 | L2: of:=AVERAGE([.H2:.H19]) -> 0.201263555555556 | M2: of:=AVERAGE([.I2:.I19]) -> 0.07493038125 | O2: of:=AVERAGE([.K2:.M2]) -> 0.112436637758715
A3: 2 | B3: strstr: &"yk"{\0,h,j,\0} &"y"{\0,\0} :=> &"yk"{\0,h,j,\0} | C3: 0.183021 | D3: 1 | E3: 0.183021 | G3: of:=IF([.C3]=1;"";[.C3]) -> 0.183021 | H3: of:=IF([.D3]=1;"";[.D3]) ->  | I3: of:=IF([.E3]=1;"";[.E3]) -> 0.183021
A4: 3 | B4: strstr: &"fu"{\0,b,w,\0} &"u"{\0,\0} :=> &"u"{\0,b,w,\0,54} | C4: 0.210856 | D4: 1 | E4: 1 | G4: of:=IF([.C4]=1;"";[.C4]) -> 0.210856 | H4: of:=IF([.D4]=1;"";[.D4]) ->  | I4: of:=IF([.E4]=1;"";[.E4]) -> 
A5: 4 | B5: strstr: &"hxa"{\0,h,\0} &"h"{\0,\0} :=> &"hxa"{\0,h,\0} | C5: 0 | D5: 1 | E5: 0 | G5: of:=IF([.C5]=1;"";[.C5]) -> 0 | H5: of:=IF([.D5]=1;"";[.D5]) ->  | I5: of:=IF([.E5]=1;"";[.E5]) -> 0
A6: 5 | B6: strstr: &"pqz"{\0,b,\0} &"q"{\0,\0} :=> &"qz"{\0,b,\0,54} | C6: 0 | D6: 1 | E6: 0 | G6: of:=IF([.C6]=1;"";[.C6]) -> 0 | H6: of:=IF([.D6]=1;"";[.D6]) ->  | I6: of:=IF([.E6]=1;"";[.E6]) -> 0
A7: 6 | B7: strstr: &"hjbt"{\0,\0} &"h"{\0,\0} :=> &"hjbt"{\0,\0} | C7: 0.0261577 | D7: 1 | E7: 0.0261577 | G7: of:=IF([.C7]=1;"";[.C7]) -> 0.0261577 | H7: of:=IF([.D7]=1;"";[.D7]) ->  | I7: of:=IF([.E7]=1;"";[.E7]) -> 0.0261577
A8: 7 | B8: strstr: &"rngv"{\0,\0} &"n"{\0,\0} :=> &"ngv"{\0,\0,54} | C8: 0.0379297 | D8: 1 | E8: 0.067249 | G8: of:=IF([.C8]=1;"";[.C8]) -> 0.0379297 | H8: of:=IF([.D8]=1;"";[.D8]) ->  | I8: of:=IF([.E8]=1;"";[.E8]) -> 0.067249
A9: 8 | B9: strstr: &"tpzfs"{\0} &"t"{\0,\0} :=> &"tpzfs"{\0} | C9: 0.0183047 | D9: 1 | E9: 0.0183047 | G9: of:=IF([.C9]=1;"";[.C9]) -> 0.0183047 | H9: of:=IF([.D9]=1;"";[.D9]) ->  | I9: of:=IF([.E9]=1;"";[.E9]) -> 0.0183047
A10: 9 | B10: strstr: &"wygqo"{\0} &"y"{\0,\0} :=> &"ygqo"{\0,54} | C10: 0 | D10: 1 | E10: 0 | G10: of:=IF([.C10]=1;"";[.C10]) -> 0 | H10: of:=IF([.D10]=1;"";[.D10]) ->  | I10: of:=IF([.E10]=1;"";[.E10]) -> 0
A11: 10 | B11: strstr: &"uj"{\0,d,z,\0} &"uj"{\0} :=> &"uj"{\0,d,z,\0} | C11: 0.183174 | D11: 0.183174 | E11: 0.183174 | G11: of:=IF([.C11]=1;"";[.C11]) -> 0.183174 | H11: of:=IF([.D11]=1;"";[.D11]) -> 0.183174 | I11: of:=IF([.E11]=1;"";[.E11]) -> 0.183174
A12: 11 | B12: strstr: &"ftv"{\0,d,\0} &"ft"{\0} :=> &"ftv"{\0,d,\0} | C12: 0.0756894 | D12: 0.212346 | E12: 0.0756894 | G12: of:=IF([.C12]=1;"";[.C12]) -> 0.0756894 | H12: of:=IF([.D12]=1;"";[.D12]) -> 0.212346 | I12: of:=IF([.E12]=1;"";[.E12]) -> 0.0756894
A13: 12 | B13: strstr: &"nnc"{\0,a,\0} &"nc"{\0} :=> &"nc"{\0,a,\0,54} | C13: 0.0860317 | D13: 0.218916 | E13: 0.218916 | G13: of:=IF([.C13]=1;"";[.C13]) -> 0.0860317 | H13: of:=IF([.D13]=1;"";[.D13]) -> 0.218916 | I13: of:=IF([.E13]=1;"";[.E13]) -> 0.218916
A14: 13 | B14: strstr: &"zfb"{\0,p,\0} &"fb"{\0} :=> &"fb"{\0,p,\0,54} | C14: 0.0523174 | D14: 0.168873 | E14: 0.168873 | G14: of:=IF([.C14]=1;"";[.C14]) -> 0.0523174 | H14: of:=IF([.D14]=1;"";[.D14]) -> 0.168873 | I14: of:=IF([.E14]=1;"";[.E14]) -> 0.168873
A15: 14 | B15: strstr: &"htvn"{\0,\0} &"ht"{\0} :=> &"htvn"{\0,\0} | C15: 0.0370576 | D15: 0.214286 | E15: 0.0370576 | G15: of:=IF([.C15]=1;"";[.C15]) -> 0.0370576 | H15: of:=IF([.D15]=1;"";[.D15]) -> 0.214286 | I15: of:=IF([.E15]=1;"";[.E15]) -> 0.0370576
A16: 15 | B16: strstr: &"oolg"{\0,\0} &"ol"{\0} :=> &"olg"{\0,\0,54} | C16: 0.044252 | D16: 0.218466 | E16: 0.0806365 | G16: of:=IF([.C16]=1;"";[.C16]) -> 0.044252 | H16: of:=IF([.D16]=1;"";[.D16]) -> 0.218466 | I16: of:=IF([.E16]=1;"";[.E16]) -> 0.0806365
A17: 16 | B17: strstr: &"vgys"{\0,\0} &"gy"{\0} :=> &"gys"{\0,\0,54} | C17: 0.0378555 | D17: 0.203557 | E17: 0.0808681 | G17: of:=IF([.C17]=1;"";[.C17]) -> 0.0378555 | H17: of:=IF([.D17]=1;"";[.D17]) -> 0.203557 | I17: of:=IF([.E17]=1;"";[.E17]) -> 0.0808681
A18: 17 | B18: strstr: &"emhdq"{\0} &"em"{\0} :=> &"emhdq"{\0} | C18: 0.0239742 | D18: 0.218014 | E18: 0.0239742 | G18: of:=IF([.C18]=1;"";[.C18]) -> 0.0239742 | H18: of:=IF([.D18]=1;"";[.D18]) -> 0.218014 | I18: of:=IF([.E18]=1;"";[.E18]) -> 0.0239742
A19: 18 | B19: strstr: &"zztdc"{\0} &"zt"{\0} :=> &"ztdc"{\0,54} | C19: 0.0223507 | D19: 0.17374 | E19: 0.0349649 | G19: of:=IF([.C19]=1;"";[.C19]) -> 0.0223507 | H19: of:=IF([.D19]=1;"";[.D19]) -> 0.17374 | I19: of:=IF([.E19]=1;"";[.E19]) -> 0.0349649
A20: 19 | B20: strstr: &"kfeuq"{\0} &"fe"{\0} :=> &"feuq"{\0,54} | C20: 0.0243948 | D20: 0.215706 | E20: 0.0399379 | G20: of:=IF([.C20]=1;"";[.C20]) -> 0.0243948 | H20: of:=IF([.D20]=1;"";[.D20]) -> 0.215706 | I20: of:=IF([.E20]=1;"";[.E20]) -> 0.0399379 | K20: of:=AVERAGE([.G20:.G24]) -> 0.01813508 | L20: of:=AVERAGE([.H20:.H24]) -> 0.210972 | M20: of:=AVERAGE([.I20:.I24]) -> 0.0212437 | O20: of:=AVERAGE([.K20:.M20]) -> 0.08345026
A21: 1 | B21: strnstr: &"euihg"{\0} &""{\0,p,\0} 2 :=> &"euihg"{\0} | C21: 0.0237727 | D21: 1 | E21: 0.0237727 | G21: of:=IF([.C21]=1;"";[.C21]) -> 0.0237727 | H21: of:=IF([.D21]=1;"";[.D21]) ->  | I21: of:=IF([.E21]=1;"";[.E21]) -> 0.0237727
A22: 2 | B22: strnstr: &"bpvia"{\0} &"b"{\0,\0} 2 :=> &"bpvia"{\0} | C22: 0.0194044 | D22: 1 | E22: 0.0194044 | G22: of:=IF([.C22]=1;"";[.C22]) -> 0.0194044 | H22: of:=IF([.D22]=1;"";[.D22]) ->  | I22: of:=IF([.E22]=1;"";[.E22]) -> 0.0194044
A23: 3 | B23: strnstr: &"egbxt"{\0} &"g"{\0,\0} 2 :=> &"gbxt"{\0,54} | C23: 0 | D23: 1 | E23: 0 | G23: of:=IF([.C23]=1;"";[.C23]) -> 0 | H23: of:=IF([.D23]=1;"";[.D23]) ->  | I23: of:=IF([.E23]=1;"";[.E23]) -> 0
A24: 4 | B24: strnstr: &"xezdt"{\0} &"xe"{\0} 2 :=> &"xezdt"{\0} | C24: 0.0231035 | D24: 0.206238 | E24: 0.0231035 | G24: of:=IF([.C24]=1;"";[.C24]) -> 0.0231035 | H24: of:=IF([.D24]=1;"";[.D24]) -> 0.206238 | I24: of:=IF([.E24]=1;"";[.E24]) -> 0.0231035
A25: 1 | B25: strpbrk: &"vugdq"{\0} &"aeiou"{\0} :=> &"ugdq"{\0,54} | C25: 0.0238455 | D25: 0.0299288 | E25: 0.038862 | G25: of:=IF([.C25]=1;"";[.C25]) -> 0.0238455 | H25: of:=IF([.D25]=1;"";[.D25]) -> 0.0299288 | I25: of:=IF([.E25]=1;"";[.E25]) -> 0.038862 | K25: of:=AVERAGE([.G25:.G34]) -> 0.02448949 | L25: of:=AVERAGE([.H25:.H34]) -> 0.0299288 | M25: of:=AVERAGE([.I25:.I34]) -> 0.03067491 | O25: of:=AVERAGE([.K25:.M25]) -> 0.0283644
A26: 2 | B26: strpbrk: &"botid"{\0} &"aeiou"{\0} :=> &"otid"{\0,54} | C26: 0.0312101 | D26: 0.0299288 | E26: 0.0486896 | G26: of:=IF([.C26]=1;"";[.C26]) -> 0.0312101 | H26: of:=IF([.D26]=1;"";[.D26]) -> 0.0299288 | I26: of:=IF([.E26]=1;"";[.E26]) -> 0.0486896
A27: 3 | B27: strpbrk: &"difkq"{\0} &"aeiou"{\0} :=> &"ifkq"{\0,54} | C27: 0 | D27: 0.0299288 | E27: 0 | G27: of:=IF([.C27]=1;"";[.C27]) -> 0 | H27: of:=IF([.D27]=1;"";[.D27]) -> 0.0299288 | I27: of:=IF([.E27]=1;"";[.E27]) -> 0
A28: 4 | B28: strpbrk: &"newsn"{\0} &"aeiou"{\0} :=> &"ewsn"{\0,54} | C28: 0.0289331 | D28: 0.0299288 | E28: 0.0437825 | G28: of:=IF([.C28]=1;"";[.C28]) -> 0.0289331 | H28: of:=IF([.D28]=1;"";[.D28]) -> 0.0299288 | I28: of:=IF([.E28]=1;"";[.E28]) -> 0.0437825
A29: 5 | B29: strpbrk: &"capuv"{\0} &"aeiou"{\0} :=> &"apuv"{\0,54} | C29: 0.0281902 | D29: 0.0299288 | E29: 0.042699 | G29: of:=IF([.C29]=1;"";[.C29]) -> 0.0281902 | H29: of:=IF([.D29]=1;"";[.D29]) -> 0.0299288 | I29: of:=IF([.E29]=1;"";[.E29]) -> 0.042699
A30: 6 | B30: strpbrk: &"uaiuf"{\0} &"aeiou"{\0} :=> &"uaiuf"{\0} | C30: 0.0280285 | D30: 0.0299288 | E30: 0.0280285 | G30: of:=IF([.C30]=1;"";[.C30]) -> 0.0280285 | H30: of:=IF([.D30]=1;"";[.D30]) -> 0.0299288 | I30: of:=IF([.E30]=1;"";[.E30]) -> 0.0280285
A31: 7 | B31: strpbrk: &"oumfj"{\0} &"aeiou"{\0} :=> &"oumfj"{\0} | C31: 0.0247708 | D31: 0.0299288 | E31: 0.0247708 | G31: of:=IF([.C31]=1;"";[.C31]) -> 0.0247708 | H31: of:=IF([.D31]=1;"";[.D31]) -> 0.0299288 | I31: of:=IF([.E31]=1;"";[.E31]) -> 0.0247708
A32: 8 | B32: strpbrk: &"ixqid"{\0} &"aeiou"{\0} :=> &"ixqid"{\0} | C32: 0.0239753 | D32: 0.0299288 | E32: 0.0239753 | G32: of:=IF([.C32]=1;"";[.C32]) -> 0.0239753 | H32: of:=IF([.D32]=1;"";[.D32]) -> 0.0299288 | I32: of:=IF([.E32]=1;"";[.E32]) -> 0.0239753
A33: 9 | B33: strpbrk: &"eorwa"{\0} &"aeiou"{\0} :=> &"eorwa"{\0} | C33: 0.0293977 | D33: 0.0299288 | E33: 0.0293977 | G33: of:=IF([.C33]=1;"";[.C33]) -> 0.0293977 | H33: of:=IF([.D33]=1;"";[.D33]) -> 0.0299288 | I33: of:=IF([.E33]=1;"";[.E33]) -> 0.0293977
A34: 10 | B34: strpbrk: &"azpor"{\0} &"aeiou"{\0} :=> &"azpor"{\0} | C34: 0.0265437 | D34: 0.0299288 | E34: 0.0265437 | G34: of:=IF([.C34]=1;"";[.C34]) -> 0.0265437 | H34: of:=IF([.D34]=1;"";[.D34]) -> 0.0299288 | I34: of:=IF([.E34]=1;"";[.E34]) -> 0.0265437