Sheet: strlen
A1: strlen: &"\x01"{\0,\0,\0,\0,\0} :=> 1; | J1: # | K1: Test Case | L1: N | P1: FINAL
A2: strlen: &"\x01\x01"{\0,\0,\0,\0} :=> 2; | J2: 1 | K2: strlen: &"w"{\0,p,w,n,\0} :=> 1 | L2: 1 | N2: of:=IF([.L2]=1;"";[.L2]) ->  | P2: of:=AVERAGE([.N2:.N6]) -> 0.076350825
A3: strlen: &"\x01\x01\x01"{\0,\0,\0} :=> 3; | J3: 2 | K3: strlen: &"uj"{\0,p,m,\0} :=> 2 | L3: 0.183174 | N3: of:=IF([.L3]=1;"";[.L3]) -> 0.183174
A4: strlen: &"\x01\x01\x01\x01"{\0,\0} :=> 4; | J4: 3 | K4: strlen: &"zrm"{\0,p,\0} :=> 3 | L4: 0.0717556 | N4: of:=IF([.L4]=1;"";[.L4]) -> 0.0717556
A5: strlen: &"\x01\x01\x01\x01\x01"{\0} :=> 5; | J5: 4 | K5: strlen: &"jrmd"{\0,\0} :=> 4 | L5: 0.0289779 | N5: of:=IF([.L5]=1;"";[.L5]) -> 0.0289779
A6: strnlen: &""{\0,\0,\0,\0,\0,\0} 6 :=> 0; 1; | J6: 5 | K6: strlen: &"jzmit"{\0} :=> 5 | L6: 0.0214958 | N6: of:=IF([.L6]=1;"";[.L6]) -> 0.0214958
A7: strnlen: &"\x01"{\0,\0,\0,\0,\0} 6 :=> 1; | J7: 1 | K7: strnlen: &""{\0,p,r,u,g,\0} 6 :=> 0 | L7: 1 | N7: of:=IF([.L7]=1;"";[.L7]) ->  | P7: of:=AVERAGE([.N7:.N12]) -> 0.0651836
A8: strnlen: &"\x01\x01"{\0,\0,\0,\0} 6 :=> 2; | J8: 2 | K8: strnlen: &"z"{\0,p,p,p,\0} 6 :=> 1 | L8: 1 | N8: of:=IF([.L8]=1;"";[.L8]) -> 
A9: strnlen: &"\x01\x01\x01"{\0,\0,\0} 6 :=> 3; | J9: 3 | K9: strnlen: &"qa"{\0,p,k,\0} 6 :=> 2 | L9: 0.157876 | N9: of:=IF([.L9]=1;"";[.L9]) -> 0.157876
A10: strnlen: &"\x01\x01\x01\x01"{\0,\0} 6 :=> 4; | J10: 4 | K10: strnlen: &"owk"{\0,p,\0} 6 :=> 3 | L10: 0.078636 | N10: of:=IF([.L10]=1;"";[.L10]) -> 0.078636
A11: strnlen: &"\x01\x01\x01\x01\x01"{\0} 6 :=> 5; | J11: 5 | K11: strnlen: &"mhqo"{\0,\0} 6 :=> 4 | L11: 0 | N11: of:=IF([.L11]=1;"";[.L11]) -> 0
J12: 6 | K12: strnlen: &"ykbuo"{\0} 6 :=> 5 | L12: 0.0242224 | N12: of:=IF([.L12]=1;"";[.L12]) -> 0.0242224

Sheet: strcmp
A1: # | B1: Test Case | C1: N1 | D1: N2 | L1: FINAL
A2: 1 | B2: strcmp: &"r"{\0,p,q,n,\0} &"r"{\0,p,u,m,\0} :=> 0 | C2: 1 | D2: 1 | F2: of:=IF([.C2]=1;"";[.C2]) ->  | G2: of:=IF([.D2]=1;"";[.D2]) ->  | H2: of:=IF([.E2]=1;"";[.E2]) ->   | I2: of:=AVERAGE([.F2:.F16]) -> 0.0392282 | J2: of:=AVERAGE([.G2:.G16]) -> 0.041578 | L2: of:=AVERAGE([.I2:.J2]) -> 0.0404031
A3: 2 | B3: strcmp: &"sp"{\0,p,e,\0} &"sp"{\0,p,a,\0} :=> 0 | C3: 0.214762 | D3: 0.214762 | F3: of:=IF([.C3]=1;"";[.C3]) -> 0.214762 | G3: of:=IF([.D3]=1;"";[.D3]) -> 0.214762 | H3: of:=IF([.E3]=1;"";[.E3]) ->  
A4: 3 | B4: strcmp: &"afy"{\0,p,\0} &"afy"{\0,p,\0} :=> 0 | C4: 0.0789793 | D4: 0.0789793 | F4: of:=IF([.C4]=1;"";[.C4]) -> 0.0789793 | G4: of:=IF([.D4]=1;"";[.D4]) -> 0.0789793 | H4: of:=IF([.E4]=1;"";[.E4]) ->  
A5: 4 | B5: strcmp: &"wldc"{\0,\0} &"wldc"{\0,\0} :=> 0 | C5: 0.0419265 | D5: 0.0419265 | F5: of:=IF([.C5]=1;"";[.C5]) -> 0.0419265 | G5: of:=IF([.D5]=1;"";[.D5]) -> 0.0419265 | H5: of:=IF([.E5]=1;"";[.E5]) ->  
A6: 5 | B6: strcmp: &"adzpb"{\0} &"adzpb"{\0} :=> 0 | C6: 0.0221593 | D6: 0.0221593 | F6: of:=IF([.C6]=1;"";[.C6]) -> 0.0221593 | G6: of:=IF([.D6]=1;"";[.D6]) -> 0.0221593 | H6: of:=IF([.E6]=1;"";[.E6]) ->  
A7: 6 | B7: strcmp: &"eazmq"{\0} &"eazmi"{\0} :=> 1 | C7: 0.0199041 | D7: 0.0270819 | F7: of:=IF([.C7]=1;"";[.C7]) -> 0.0199041 | G7: of:=IF([.D7]=1;"";[.D7]) -> 0.0270819 | H7: of:=IF([.E7]=1;"";[.E7]) ->  
A8: 7 | B8: strcmp: &"wzwbn"{\0} &"wzwbw"{\0} :=> -1 | C8: 0.0177517 | D8: 0.0181615 | F8: of:=IF([.C8]=1;"";[.C8]) -> 0.0177517 | G8: of:=IF([.D8]=1;"";[.D8]) -> 0.0181615 | H8: of:=IF([.E8]=1;"";[.E8]) ->  
A9: 8 | B9: strcmp: &"vgutf"{\0} &"vgukl"{\0} :=> 1 | C9: 0.0249565 | D9: 0.0239221 | F9: of:=IF([.C9]=1;"";[.C9]) -> 0.0249565 | G9: of:=IF([.D9]=1;"";[.D9]) -> 0.0239221 | H9: of:=IF([.E9]=1;"";[.E9]) ->  
A10: 9 | B10: strcmp: &"kazpx"{\0} &"kazvc"{\0} :=> -1 | C10: 0 | D10: 0.0227216 | F10: of:=IF([.C10]=1;"";[.C10]) -> 0 | G10: of:=IF([.D10]=1;"";[.D10]) -> 0.0227216 | H10: of:=IF([.E10]=1;"";[.E10]) ->  
A11: 10 | B11: strcmp: &"mprej"{\0} &"mpetu"{\0} :=> 1 | C11: 0.0293537 | D11: 0.0306762 | F11: of:=IF([.C11]=1;"";[.C11]) -> 0.0293537 | G11: of:=IF([.D11]=1;"";[.D11]) -> 0.0306762 | H11: of:=IF([.E11]=1;"";[.E11]) ->  
A12: 11 | B12: strcmp: &"lvdpp"{\0} &"lvpbu"{\0} :=> -1 | C12: 0.0230112 | D12: 0 | F12: of:=IF([.C12]=1;"";[.C12]) -> 0.0230112 | G12: of:=IF([.D12]=1;"";[.D12]) -> 0
A13: 12 | B13: strcmp: &"okimr"{\0} &"ohggj"{\0} :=> 1 | C13: 0.0268426 | D13: 0.0210567 | F13: of:=IF([.C13]=1;"";[.C13]) -> 0.0268426 | G13: of:=IF([.D13]=1;"";[.D13]) -> 0.0210567
A14: 13 | B14: strcmp: &"nbpdw"{\0} &"ndmyd"{\0} :=> -1 | C14: 0.0223848 | D14: 0.0275536 | F14: of:=IF([.C14]=1;"";[.C14]) -> 0.0223848 | G14: of:=IF([.D14]=1;"";[.D14]) -> 0.0275536
A15: 14 | B15: strcmp: &"zxvcs"{\0} &"uenoq"{\0} :=> 1 | C15: 0 | D15: 0.0282338 | F15: of:=IF([.C15]=1;"";[.C15]) -> 0 | G15: of:=IF([.D15]=1;"";[.D15]) -> 0.0282338
A16: 15 | B16: strcmp: &"cmisp"{\0} &"yolfh"{\0} :=> -1 | C16: 0.0271631 | D16: 0.0248575 | F16: of:=IF([.C16]=1;"";[.C16]) -> 0.0271631 | G16: of:=IF([.D16]=1;"";[.D16]) -> 0.0248575
A17: 1 | B17: strncmp: &""{\0,p,b,r,s,\0} &""{\0,p,l,w,f,\0} 5 :=> 0 | C17: 1 | D17: 1 | F17: of:=IF([.C17]=1;"";[.C17]) ->  | G17: of:=IF([.D17]=1;"";[.D17]) ->  | I17: of:=AVERAGE([.F17:.F32]) -> 0.0366930428571429 | J17: of:=AVERAGE([.G17:.G32]) -> 0.0339304714285714 | L17: of:=AVERAGE([.I17:.J17]) -> 0.0353117571428571
A18: 2 | B18: strncmp: &"r"{\0,p,d,j,\0} &"r"{\0,p,k,g,\0} 5 :=> 0 | C18: 1 | D18: 1 | F18: of:=IF([.C18]=1;"";[.C18]) ->  | G18: of:=IF([.D18]=1;"";[.D18]) -> 
A19: 3 | B19: strncmp: &"ov"{\0,p,g,\0} &"ov"{\0,p,i,\0} 5 :=> 0 | C19: 0.215706 | D19: 0.215706 | F19: of:=IF([.C19]=1;"";[.C19]) -> 0.215706 | G19: of:=IF([.D19]=1;"";[.D19]) -> 0.215706
A20: 4 | B20: strncmp: &"hyw"{\0,p,\0} &"hyw"{\0,p,\0} 5 :=> 0 | C20: 0.0770659 | D20: 0.0770659 | F20: of:=IF([.C20]=1;"";[.C20]) -> 0.0770659 | G20: of:=IF([.D20]=1;"";[.D20]) -> 0.0770659
A21: 5 | B21: strncmp: &"lpfr"{\0,\0} &"lpfr"{\0,\0} 5 :=> 0 | C21: 0.040951 | D21: 0.040951 | F21: of:=IF([.C21]=1;"";[.C21]) -> 0.040951 | G21: of:=IF([.D21]=1;"";[.D21]) -> 0.040951
A22: 6 | B22: strncmp: &"rjjyo"{\0} &"rjjyo"{\0} 5 :=> 0 | C22: 0.0157227 | D22: 0.0157227 | F22: of:=IF([.C22]=1;"";[.C22]) -> 0.0157227 | G22: of:=IF([.D22]=1;"";[.D22]) -> 0.0157227
A23: 7 | B23: strncmp: &"qqtqw"{\0} &"qqtqf"{\0} 5 :=> 1 | C23: 0.0086506 | D23: 0.0086506 | F23: of:=IF([.C23]=1;"";[.C23]) -> 0.0086506 | G23: of:=IF([.D23]=1;"";[.D23]) -> 0.0086506
A24: 8 | B24: strncmp: &"qzxpo"{\0} &"qzxpv"{\0} 5 :=> -1 | C24: 0 | D24: 0 | F24: of:=IF([.C24]=1;"";[.C24]) -> 0 | G24: of:=IF([.D24]=1;"";[.D24]) -> 0
A25: 9 | B25: strncmp: &"mwmvz"{\0} &"mwmhp"{\0} 5 :=> 1 | C25: 0.0155348 | D25: 0.0204457 | F25: of:=IF([.C25]=1;"";[.C25]) -> 0.0155348 | G25: of:=IF([.D25]=1;"";[.D25]) -> 0.0204457
A26: 10 | B26: strncmp: &"gufic"{\0} &"gufys"{\0} 5 :=> -1 | C26: 0.0293224 | D26: 0.027091 | F26: of:=IF([.C26]=1;"";[.C26]) -> 0.0293224 | G26: of:=IF([.D26]=1;"";[.D26]) -> 0.027091
A27: 11 | B27: strncmp: &"vwptz"{\0} &"vwmut"{\0} 5 :=> 1 | C27: 0 | D27: 0 | F27: of:=IF([.C27]=1;"";[.C27]) -> 0 | G27: of:=IF([.D27]=1;"";[.D27]) -> 0
A28: 12 | B28: strncmp: &"lekcb"{\0} &"lepfv"{\0} 5 :=> -1 | C28: 0.0223545 | D28: 0.0237288 | F28: of:=IF([.C28]=1;"";[.C28]) -> 0.0223545 | G28: of:=IF([.D28]=1;"";[.D28]) -> 0.0237288
A29: 13 | B29: strncmp: &"nicej"{\0} &"naydn"{\0} 5 :=> 1 | C29: 0.0293425 | D29: 0.0278126 | F29: of:=IF([.C29]=1;"";[.C29]) -> 0.0293425 | G29: of:=IF([.D29]=1;"";[.D29]) -> 0.0278126
A30: 14 | B30: strncmp: &"awzbo"{\0} &"aziqe"{\0} 5 :=> -1 | C30: 0.021248 | D30: 0.0178523 | F30: of:=IF([.C30]=1;"";[.C30]) -> 0.021248 | G30: of:=IF([.D30]=1;"";[.D30]) -> 0.0178523
A31: 15 | B31: strncmp: &"tipvu"{\0} &"sfqyh"{\0} 5 :=> 1 | C31: 0.0200323 | D31: 0 | F31: of:=IF([.C31]=1;"";[.C31]) -> 0.0200323 | G31: of:=IF([.D31]=1;"";[.D31]) -> 0
A32: 16 | B32: strncmp: &"okcvv"{\0} &"qcfyv"{\0} 5 :=> -1 | C32: 0.0177719 | D32: 0 | F32: of:=IF([.C32]=1;"";[.C32]) -> 0.0177719 | G32: of:=IF([.D32]=1;"";[.D32]) -> 0
A33: 1 | B33: sysfs_streq: &""{\0,p,g,n,j,\0} &"hfeph"{\0} :=> \0 | C33: 1 | D33: 0.0273005 | F33: of:=IF([.C33]=1;"";[.C33]) ->  | G33: of:=IF([.D33]=1;"";[.D33]) -> 0.0273005 | I33: of:=AVERAGE([.F33:.F71]) -> 0.0615119793103448 | J33: of:=AVERAGE([.G33:.G71]) -> 0.0363863 | L33: of:=AVERAGE([.I33:.J33]) -> 0.0489491396551724
A34: 2 | B34: sysfs_streq: &""{\0,p,e,o,d,\0} &"\n"{\0,b,i,u,\0} :=> \x01 | C34: 1 | F34: of:=IF([.C34]=1;"";[.C34]) ->  | G34: of:=IF([.D34]=1;"";[.D34]) ->  
A35: 3 | B35: sysfs_streq: &""{\0,p,k,a,d,\0} &"\nabfe"{\0} :=> \0 | C35: 1 | F35: of:=IF([.C35]=1;"";[.C35]) ->  | G35: of:=IF([.D35]=1;"";[.D35]) ->  
A36: 4 | B36: sysfs_streq: &""{\0,p,s,r,t,\0} &""{\0,h,c,a,n,\0} :=> \x01 | C36: 1 | D36: 1 | F36: of:=IF([.C36]=1;"";[.C36]) ->  | G36: of:=IF([.D36]=1;"";[.D36]) -> 
A37: 5 | B37: sysfs_streq: &"jppgu"{\0} &"ojfzl"{\0} :=> \0 | C37: 0.0210902 | D37: 0.0168999 | F37: of:=IF([.C37]=1;"";[.C37]) -> 0.0210902 | G37: of:=IF([.D37]=1;"";[.D37]) -> 0.0168999
A38: 6 | B38: sysfs_streq: &"\n"{\0,p,r,n,\0} &""{\0,a,d,s,k,\0} :=> \x01 | C38: 1 | F38: of:=IF([.C38]=1;"";[.C38]) ->  | G38: of:=IF([.D38]=1;"";[.D38]) ->  
A39: 7 | B39: sysfs_streq: &"\n"{\0,a,f,r,\0} &"hwdlg"{\0} :=> \0 | C39: 0.0250547 | F39: of:=IF([.C39]=1;"";[.C39]) -> 0.0250547 | G39: of:=IF([.D39]=1;"";[.D39]) ->  
A40: 8 | B40: sysfs_streq: &"\namll"{\0} &"zhatz"{\0} :=> \0 | C40: 0.0275083 | F40: of:=IF([.C40]=1;"";[.C40]) -> 0.0275083 | G40: of:=IF([.D40]=1;"";[.D40]) ->  
A41: 9 | B41: sysfs_streq: &"s"{\0,p,x,g,\0} &"ssynu"{\0} :=> \0 | C41: 1 | D41: 0.0283072 | F41: of:=IF([.C41]=1;"";[.C41]) ->  | G41: of:=IF([.D41]=1;"";[.D41]) -> 0.0283072
A42: 10 | B42: sysfs_streq: &"y"{\0,p,p,u,\0} &"y\n"{\0,a,e,\0} :=> \x01 | C42: 1 | F42: of:=IF([.C42]=1;"";[.C42]) ->  | G42: of:=IF([.D42]=1;"";[.D42]) ->  
A43: 11 | B43: sysfs_streq: &"a"{\0,p,c,b,\0} &"a\nade"{\0} :=> \0 | C43: 1 | F43: of:=IF([.C43]=1;"";[.C43]) ->  | G43: of:=IF([.D43]=1;"";[.D43]) ->  
A44: 12 | B44: sysfs_streq: &"b"{\0,p,p,g,\0} &"b"{\0,h,r,v,\0} :=> \x01 | C44: 1 | D44: 1 | F44: of:=IF([.C44]=1;"";[.C44]) ->  | G44: of:=IF([.D44]=1;"";[.D44]) -> 
A45: 13 | B45: sysfs_streq: &"acqoe"{\0} &"axgwy"{\0} :=> \0 | C45: 0 | D45: 0.0182303 | F45: of:=IF([.C45]=1;"";[.C45]) -> 0 | G45: of:=IF([.D45]=1;"";[.D45]) -> 0.0182303
A46: 14 | B46: sysfs_streq: &"g\n"{\0,b,t,\0} &"g"{\0,b,v,k,\0} :=> \x01 | C46: 1 | F46: of:=IF([.C46]=1;"";[.C46]) ->  | G46: of:=IF([.D46]=1;"";[.D46]) ->  
A47: 15 | B47: sysfs_streq: &"m\n"{\0,b,q,\0} &"mpovh"{\0} :=> \0 | C47: 0.0224151 | F47: of:=IF([.C47]=1;"";[.C47]) -> 0.0224151 | G47: of:=IF([.D47]=1;"";[.D47]) ->  
A48: 16 | B48: sysfs_streq: &"v\naza"{\0} &"vhthr"{\0} :=> \0 | C48: 0.0225264 | F48: of:=IF([.C48]=1;"";[.C48]) -> 0.0225264 | G48: of:=IF([.D48]=1;"";[.D48]) ->  
A49: 17 | B49: sysfs_streq: &"zu"{\0,p,g,\0} &"zupct"{\0} :=> \0 | C49: 0.189501 | D49: 0.0253314 | F49: of:=IF([.C49]=1;"";[.C49]) -> 0.189501 | G49: of:=IF([.D49]=1;"";[.D49]) -> 0.0253314
A50: 18 | B50: sysfs_streq: &"ur"{\0,p,u,\0} &"ur\n"{\0,a,\0} :=> \x01 | C50: 0.219364 | F50: of:=IF([.C50]=1;"";[.C50]) -> 0.219364 | G50: of:=IF([.D50]=1;"";[.D50]) ->  
A51: 19 | B51: sysfs_streq: &"au"{\0,p,k,\0} &"au\nae"{\0} :=> \0 | C51: 0.213806 | F51: of:=IF([.C51]=1;"";[.C51]) -> 0.213806 | G51: of:=IF([.D51]=1;"";[.D51]) ->  
A52: 20 | B52: sysfs_streq: &"pv"{\0,p,l,\0} &"pv"{\0,b,e,\0} :=> \x01 | C52: 0.11996 | D52: 0.11996 | F52: of:=IF([.C52]=1;"";[.C52]) -> 0.11996 | G52: of:=IF([.D52]=1;"";[.D52]) -> 0.11996
A53: 21 | B53: sysfs_streq: &"pgyqi"{\0} &"pghmn"{\0} :=> \0 | C53: 0.019181 | D53: 0.0259004 | F53: of:=IF([.C53]=1;"";[.C53]) -> 0.019181 | G53: of:=IF([.D53]=1;"";[.D53]) -> 0.0259004
A54: 22 | B54: sysfs_streq: &"lc\n"{\0,b,\0} &"lc"{\0,b,b,\0} :=> \x01 | C54: 0.199652 | F54: of:=IF([.C54]=1;"";[.C54]) -> 0.199652 | G54: of:=IF([.D54]=1;"";[.D54]) ->  
A55: 23 | B55: sysfs_streq: &"gl\n"{\0,b,\0} &"glphm"{\0} :=> \0 | C55: 0.0270647 | F55: of:=IF([.C55]=1;"";[.C55]) -> 0.0270647 | G55: of:=IF([.D55]=1;"";[.D55]) ->  
A56: 24 | B56: sysfs_streq: &"ta\nak"{\0} &"taokr"{\0} :=> \0 | C56: 0.0269865 | F56: of:=IF([.C56]=1;"";[.C56]) -> 0.0269865 | G56: of:=IF([.D56]=1;"";[.D56]) ->  
A57: 25 | B57: sysfs_streq: &"jka"{\0,p,\0} &"jkauh"{\0} :=> \0 | C57: 0.0657341 | D57: 0.0226273 | F57: of:=IF([.C57]=1;"";[.C57]) -> 0.0657341 | G57: of:=IF([.D57]=1;"";[.D57]) -> 0.0226273
A58: 26 | B58: sysfs_streq: &"wol"{\0,p,\0} &"wol\n"{\0,\0} :=> \x01 | C58: 0.0871155 | F58: of:=IF([.C58]=1;"";[.C58]) -> 0.0871155 | G58: of:=IF([.D58]=1;"";[.D58]) ->  
A59: 27 | B59: sysfs_streq: &"zmn"{\0,p,\0} &"zmn\na"{\0} :=> \0 | C59: 0.0700818 | F59: of:=IF([.C59]=1;"";[.C59]) -> 0.0700818 | G59: of:=IF([.D59]=1;"";[.D59]) ->  
A60: 28 | B60: sysfs_streq: &"wtp"{\0,p,\0} &"wtp"{\0,h,\0} :=> \x01 | C60: 0.0727976 | D60: 0.0727976 | F60: of:=IF([.C60]=1;"";[.C60]) -> 0.0727976 | G60: of:=IF([.D60]=1;"";[.D60]) -> 0.0727976
A61: 29 | B61: sysfs_streq: &"kadld"{\0} &"kadtw"{\0} :=> \0 | C61: 0.0287556 | D61: 0.0270981 | F61: of:=IF([.C61]=1;"";[.C61]) -> 0.0287556 | G61: of:=IF([.D61]=1;"";[.D61]) -> 0.0270981
A62: 30 | B62: sysfs_streq: &"kur\n"{\0,\0} &"kur"{\0,a,\0} :=> \x01 | C62: 0.0798785 | F62: of:=IF([.C62]=1;"";[.C62]) -> 0.0798785 | G62: of:=IF([.D62]=1;"";[.D62]) ->  
A63: 31 | B63: sysfs_streq: &"neo\n"{\0,\0} &"neoyv"{\0} :=> \0 | C63: 0.0266181 | F63: of:=IF([.C63]=1;"";[.C63]) -> 0.0266181 | G63: of:=IF([.D63]=1;"";[.D63]) ->  
A64: 32 | B64: sysfs_streq: &"efa\na"{\0} &"efawm"{\0} :=> \0 | C64: 0.0275302 | F64: of:=IF([.C64]=1;"";[.C64]) -> 0.0275302 | G64: of:=IF([.D64]=1;"";[.D64]) ->  
A65: 33 | B65: sysfs_streq: &"iczu"{\0,\0} &"iczud"{\0} :=> \0 | C65: 0.0387865 | D65: 0.0254873 | F65: of:=IF([.C65]=1;"";[.C65]) -> 0.0387865 | G65: of:=IF([.D65]=1;"";[.D65]) -> 0.0254873
A66: 34 | B66: sysfs_streq: &"ywvb"{\0,\0} &"ywvb\n"{\0} :=> \x01 | C66: 0 | F66: of:=IF([.C66]=1;"";[.C66]) -> 0 | G66: of:=IF([.D66]=1;"";[.D66]) ->  
A67: 35 | B67: sysfs_streq: &"conz"{\0,\0} &"conz"{\0,\0} :=> \x01 | C67: 0.0456091 | D67: 0.0456091 | F67: of:=IF([.C67]=1;"";[.C67]) -> 0.0456091 | G67: of:=IF([.D67]=1;"";[.D67]) -> 0.0456091
A68: 36 | B68: sysfs_streq: &"htdiw"{\0} &"htdic"{\0} :=> \0 | C68: 0.0261803 | D68: 0.0287108 | F68: of:=IF([.C68]=1;"";[.C68]) -> 0.0261803 | G68: of:=IF([.D68]=1;"";[.D68]) -> 0.0287108
A69: 37 | B69: sysfs_streq: &"yxra\n"{\0} &"yxra"{\0,\0} :=> \x01 | C69: 0.0284 | F69: of:=IF([.C69]=1;"";[.C69]) -> 0.0284 | G69: of:=IF([.D69]=1;"";[.D69]) ->  
A70: 38 | B70: sysfs_streq: &"poyd\n"{\0} &"poydv"{\0} :=> \0 | C70: 0.0271019 | F70: of:=IF([.C70]=1;"";[.C70]) -> 0.0271019 | G70: of:=IF([.D70]=1;"";[.D70]) ->  
A71: 39 | B71: sysfs_streq: &"zpbal"{\0} &"zpbal"{\0} :=> \x01 | C71: 0.0251483 | D71: 0.0251483 | F71: of:=IF([.C71]=1;"";[.C71]) -> 0.0251483 | G71: of:=IF([.D71]=1;"";[.D71]) -> 0.0251483

Sheet: strcpy
A1: # | B1: Test Case | C1: N1 | D1: N2 | E1: N3 | O1: FINAL
A2: 1 | B2: strcpy: &""{\0,\x01,\x01,\x01,\x01,\x01} &"s"{\0,p,n,d,\0} :=> &"s"{\0,p,b,w,\0} | C2: 1 | D2: 1 | E2: 1 | G2: of:=IF([.C2]=1;"";[.C2]) ->  | H2: of:=IF([.D2]=1;"";[.D2]) ->  | I2: of:=IF([.E2]=1;"";[.E2]) ->  | K2: of:=AVERAGE([.G2:.G36]) -> 0.0788890541666667 | L2: of:=AVERAGE([.H2:.H36]) -> 0.0706712416666667 | M2: of:=AVERAGE([.I2:.I36]) -> 0.0706712416666667 | O2: of:=AVERAGE([.K2:.M2]) -> 0.0734105125
A3: 2 | B3: strcpy: &""{\0,\x01,\x01,\x01,\x01,\x01} &"iy"{\0,p,x,\0} :=> &"iy"{\0,p,r,\0} | C3: 1 | D3: 0.188384 | E3: 0.188384 | G3: of:=IF([.C3]=1;"";[.C3]) ->  | H3: of:=IF([.D3]=1;"";[.D3]) -> 0.188384 | I3: of:=IF([.E3]=1;"";[.E3]) -> 0.188384
A4: 3 | B4: strcpy: &""{\0,\x01,\x01,\x01,\x01,\x01} &"bjv"{\0,p,\0} :=> &"bjv"{\0,p,\0} | C4: 1 | D4: 0.0456874 | E4: 0.0456874 | G4: of:=IF([.C4]=1;"";[.C4]) ->  | H4: of:=IF([.D4]=1;"";[.D4]) -> 0.0456874 | I4: of:=IF([.E4]=1;"";[.E4]) -> 0.0456874
A5: 4 | B5: strcpy: &""{\0,\x01,\x01,\x01,\x01,\x01} &"htvi"{\0,\0} :=> &"htvi"{\0,\0} | C5: 1 | D5: 0.0424115 | E5: 0.0424115 | G5: of:=IF([.C5]=1;"";[.C5]) ->  | H5: of:=IF([.D5]=1;"";[.D5]) -> 0.0424115 | I5: of:=IF([.E5]=1;"";[.E5]) -> 0.0424115
A6: 5 | B6: strcpy: &""{\0,\x01,\x01,\x01,\x01,\x01} &"ontou"{\0} :=> &"ontou"{\0} | C6: 1 | D6: 0.0324765 | E6: 0.0324765 | G6: of:=IF([.C6]=1;"";[.C6]) ->  | H6: of:=IF([.D6]=1;"";[.D6]) -> 0.0324765 | I6: of:=IF([.E6]=1;"";[.E6]) -> 0.0324765
A7: 6 | B7: strcpy: &"f"{\0,\x01,\x01,\x01,\x01} &""{\0,p,q,p,x,\0} :=> &""{\0,\0,p,c,z,\0} | C7: 1 | D7: 1 | E7: 1 | G7: of:=IF([.C7]=1;"";[.C7]) ->  | H7: of:=IF([.D7]=1;"";[.D7]) ->  | I7: of:=IF([.E7]=1;"";[.E7]) -> 
A8: 7 | B8: strcpy: &"f"{\0,\x01,\x01,\x01,\x01} &"y"{\0,p,e,s,\0} :=> &"y"{\0,p,r,l,\0} | C8: 1 | D8: 1 | E8: 1 | G8: of:=IF([.C8]=1;"";[.C8]) ->  | H8: of:=IF([.D8]=1;"";[.D8]) ->  | I8: of:=IF([.E8]=1;"";[.E8]) -> 
A9: 8 | B9: strcpy: &"l"{\0,\x01,\x01,\x01,\x01} &"vb"{\0,p,w,\0} :=> &"vb"{\0,p,x,\0} | C9: 1 | D9: 0 | E9: 0 | G9: of:=IF([.C9]=1;"";[.C9]) ->  | H9: of:=IF([.D9]=1;"";[.D9]) -> 0 | I9: of:=IF([.E9]=1;"";[.E9]) -> 0
A10: 9 | B10: strcpy: &"z"{\0,\x01,\x01,\x01,\x01} &"mbp"{\0,p,\0} :=> &"mbp"{\0,p,\0} | C10: 1 | D10: 0.0724119 | E10: 0.0724119 | G10: of:=IF([.C10]=1;"";[.C10]) ->  | H10: of:=IF([.D10]=1;"";[.D10]) -> 0.0724119 | I10: of:=IF([.E10]=1;"";[.E10]) -> 0.0724119
A11: 10 | B11: strcpy: &"g"{\0,\x01,\x01,\x01,\x01} &"kckj"{\0,\0} :=> &"kckj"{\0,\0} | C11: 1 | D11: 0.0331721 | E11: 0.0331721 | G11: of:=IF([.C11]=1;"";[.C11]) ->  | H11: of:=IF([.D11]=1;"";[.D11]) -> 0.0331721 | I11: of:=IF([.E11]=1;"";[.E11]) -> 0.0331721
A12: 11 | B12: strcpy: &"v"{\0,\x01,\x01,\x01,\x01} &"rrfgs"{\0} :=> &"rrfgs"{\0} | C12: 1 | D12: 0.0260921 | E12: 0.0260921 | G12: of:=IF([.C12]=1;"";[.C12]) ->  | H12: of:=IF([.D12]=1;"";[.D12]) -> 0.0260921 | I12: of:=IF([.E12]=1;"";[.E12]) -> 0.0260921
A13: 12 | B13: strcpy: &"uk"{\0,\x01,\x01,\x01} &""{\0,p,y,k,z,\0} :=> &""{\0,k,\0,p,t,\0} | C13: 0.197488 | D13: 1 | E13: 1 | G13: of:=IF([.C13]=1;"";[.C13]) -> 0.197488 | H13: of:=IF([.D13]=1;"";[.D13]) ->  | I13: of:=IF([.E13]=1;"";[.E13]) -> 
A14: 13 | B14: strcpy: &"lj"{\0,\x01,\x01,\x01} &"f"{\0,p,o,m,\0} :=> &"f"{\0,\0,p,m,\0} | C14: 0.167887 | D14: 1 | E14: 1 | G14: of:=IF([.C14]=1;"";[.C14]) -> 0.167887 | H14: of:=IF([.D14]=1;"";[.D14]) ->  | I14: of:=IF([.E14]=1;"";[.E14]) -> 
A15: 14 | B15: strcpy: &"of"{\0,\x01,\x01,\x01} &"kp"{\0,p,m,\0} :=> &"kp"{\0,p,z,\0} | C15: 0.22242 | D15: 0.185577 | E15: 0.185577 | G15: of:=IF([.C15]=1;"";[.C15]) -> 0.22242 | H15: of:=IF([.D15]=1;"";[.D15]) -> 0.185577 | I15: of:=IF([.E15]=1;"";[.E15]) -> 0.185577
A16: 15 | B16: strcpy: &"bp"{\0,\x01,\x01,\x01} &"zva"{\0,p,\0} :=> &"zva"{\0,p,\0} | C16: 0.177308 | D16: 0.0713765 | E16: 0.0713765 | G16: of:=IF([.C16]=1;"";[.C16]) -> 0.177308 | H16: of:=IF([.D16]=1;"";[.D16]) -> 0.0713765 | I16: of:=IF([.E16]=1;"";[.E16]) -> 0.0713765
A17: 16 | B17: strcpy: &"az"{\0,\x01,\x01,\x01} &"qgoa"{\0,\0} :=> &"qgoa"{\0,\0} | C17: 0.204169 | D17: 0 | E17: 0 | G17: of:=IF([.C17]=1;"";[.C17]) -> 0.204169 | H17: of:=IF([.D17]=1;"";[.D17]) -> 0 | I17: of:=IF([.E17]=1;"";[.E17]) -> 0
A18: 17 | B18: strcpy: &"pe"{\0,\x01,\x01,\x01} &"cjcdm"{\0} :=> &"cjcdm"{\0} | C18: 0.219364 | D18: 0.0159069 | E18: 0.0159069 | G18: of:=IF([.C18]=1;"";[.C18]) -> 0.219364 | H18: of:=IF([.D18]=1;"";[.D18]) -> 0.0159069 | I18: of:=IF([.E18]=1;"";[.E18]) -> 0.0159069
A19: 18 | B19: strcpy: &"kpl"{\0,\x01,\x01} &""{\0,p,v,l,e,\0} :=> &""{\0,p,l,\0,p,\0} | C19: 0.0765854 | D19: 1 | E19: 1 | G19: of:=IF([.C19]=1;"";[.C19]) -> 0.0765854 | H19: of:=IF([.D19]=1;"";[.D19]) ->  | I19: of:=IF([.E19]=1;"";[.E19]) -> 
A20: 19 | B20: strcpy: &"xfe"{\0,\x01,\x01} &"b"{\0,p,h,f,\0} :=> &"b"{\0,e,\0,p,\0} | C20: 0.0743915 | D20: 1 | E20: 1 | G20: of:=IF([.C20]=1;"";[.C20]) -> 0.0743915 | H20: of:=IF([.D20]=1;"";[.D20]) ->  | I20: of:=IF([.E20]=1;"";[.E20]) -> 
A21: 20 | B21: strcpy: &"umn"{\0,\x01,\x01} &"bs"{\0,p,k,\0} :=> &"bs"{\0,\0,p,\0} | C21: 0.079114 | D21: 0.209333 | E21: 0.209333 | G21: of:=IF([.C21]=1;"";[.C21]) -> 0.079114 | H21: of:=IF([.D21]=1;"";[.D21]) -> 0.209333 | I21: of:=IF([.E21]=1;"";[.E21]) -> 0.209333
A22: 21 | B22: strcpy: &"hcj"{\0,\x01,\x01} &"ond"{\0,p,\0} :=> &"ond"{\0,p,\0} | C22: 0.0477238 | D22: 0.0914912 | E22: 0.0914912 | G22: of:=IF([.C22]=1;"";[.C22]) -> 0.0477238 | H22: of:=IF([.D22]=1;"";[.D22]) -> 0.0914912 | I22: of:=IF([.E22]=1;"";[.E22]) -> 0.0914912
A23: 22 | B23: strcpy: &"kdp"{\0,\x01,\x01} &"drxu"{\0,\0} :=> &"drxu"{\0,\0} | C23: 0.0678045 | D23: 0.0382024 | E23: 0.0382024 | G23: of:=IF([.C23]=1;"";[.C23]) -> 0.0678045 | H23: of:=IF([.D23]=1;"";[.D23]) -> 0.0382024 | I23: of:=IF([.E23]=1;"";[.E23]) -> 0.0382024
A24: 23 | B24: strcpy: &"ama"{\0,\x01,\x01} &"tlnst"{\0} :=> &"tlnst"{\0} | C24: 0.0876984 | D24: 0.0289675 | E24: 0.0289675 | G24: of:=IF([.C24]=1;"";[.C24]) -> 0.0876984 | H24: of:=IF([.D24]=1;"";[.D24]) -> 0.0289675 | I24: of:=IF([.E24]=1;"";[.E24]) -> 0.0289675
A25: 24 | B25: strcpy: &"umsi"{\0,\x01} &""{\0,p,r,l,p,\0} :=> &""{\0,m,s,i,\0,\0} | C25: 0.0462003 | D25: 1 | E25: 1 | G25: of:=IF([.C25]=1;"";[.C25]) -> 0.0462003 | H25: of:=IF([.D25]=1;"";[.D25]) ->  | I25: of:=IF([.E25]=1;"";[.E25]) -> 
A26: 25 | B26: strcpy: &"zqsx"{\0,\x01} &"u"{\0,p,p,r,\0} :=> &"u"{\0,s,x,\0,\0} | C26: 0 | D26: 1 | E26: 1 | G26: of:=IF([.C26]=1;"";[.C26]) -> 0 | H26: of:=IF([.D26]=1;"";[.D26]) ->  | I26: of:=IF([.E26]=1;"";[.E26]) -> 
A27: 26 | B27: strcpy: &"ktfe"{\0,\x01} &"ar"{\0,p,f,\0} :=> &"ar"{\0,e,\0,\0} | C27: 0.0403391 | D27: 0.223692 | E27: 0.223692 | G27: of:=IF([.C27]=1;"";[.C27]) -> 0.0403391 | H27: of:=IF([.D27]=1;"";[.D27]) -> 0.223692 | I27: of:=IF([.E27]=1;"";[.E27]) -> 0.223692
A28: 27 | B28: strcpy: &"ucur"{\0,\x01} &"wxp"{\0,p,\0} :=> &"wxp"{\0,\0,\0} | C28: 0.04671 | D28: 0 | E28: 0 | G28: of:=IF([.C28]=1;"";[.C28]) -> 0.04671 | H28: of:=IF([.D28]=1;"";[.D28]) -> 0 | I28: of:=IF([.E28]=1;"";[.E28]) -> 0
A29: 28 | B29: strcpy: &"tlph"{\0,\x01} &"zvtd"{\0,\0} :=> &"zvtd"{\0,\0} | C29: 0.0437925 | D29: 0.0309384 | E29: 0.0309384 | G29: of:=IF([.C29]=1;"";[.C29]) -> 0.0437925 | H29: of:=IF([.D29]=1;"";[.D29]) -> 0.0309384 | I29: of:=IF([.E29]=1;"";[.E29]) -> 0.0309384
A30: 29 | B30: strcpy: &"cqzu"{\0,\x01} &"acjzw"{\0} :=> &"acjzw"{\0} | C30: 0 | D30: 0.0148225 | E30: 0.0148225 | G30: of:=IF([.C30]=1;"";[.C30]) -> 0 | H30: of:=IF([.D30]=1;"";[.D30]) -> 0.0148225 | I30: of:=IF([.E30]=1;"";[.E30]) -> 0.0148225
A31: 30 | B31: strcpy: &"oxdde"{\0} &""{\0,p,x,a,i,\0} :=> &""{\0,x,d,d,e,\0} | C31: 0 | D31: 1 | E31: 1 | G31: of:=IF([.C31]=1;"";[.C31]) -> 0 | H31: of:=IF([.D31]=1;"";[.D31]) ->  | I31: of:=IF([.E31]=1;"";[.E31]) -> 
A32: 31 | B32: strcpy: &"zqtzf"{\0} &"b"{\0,p,f,f,\0} :=> &"b"{\0,t,z,f,\0} | C32: 0.0149531 | D32: 1 | E32: 1 | G32: of:=IF([.C32]=1;"";[.C32]) -> 0.0149531 | H32: of:=IF([.D32]=1;"";[.D32]) ->  | I32: of:=IF([.E32]=1;"";[.E32]) -> 
A33: 32 | B33: strcpy: &"ysslg"{\0} &"yk"{\0,p,g,\0} :=> &"yk"{\0,l,g,\0} | C33: 0.0280189 | D33: 0.183021 | E33: 0.183021 | G33: of:=IF([.C33]=1;"";[.C33]) -> 0.0280189 | H33: of:=IF([.D33]=1;"";[.D33]) -> 0.183021 | I33: of:=IF([.E33]=1;"";[.E33]) -> 0.183021
A34: 33 | B34: strcpy: &"ynysj"{\0} &"mer"{\0,p,\0} :=> &"mer"{\0,j,\0} | C34: 0.0247281 | D34: 0.0911898 | E34: 0.0911898 | G34: of:=IF([.C34]=1;"";[.C34]) -> 0.0247281 | H34: of:=IF([.D34]=1;"";[.D34]) -> 0.0911898 | I34: of:=IF([.E34]=1;"";[.E34]) -> 0.0911898
A35: 34 | B35: strcpy: &"jqfus"{\0} &"ncci"{\0,\0} :=> &"ncci"{\0,\0} | C35: 0 | D35: 0.0463418 | E35: 0.0463418 | G35: of:=IF([.C35]=1;"";[.C35]) -> 0 | H35: of:=IF([.D35]=1;"";[.D35]) -> 0.0463418 | I35: of:=IF([.E35]=1;"";[.E35]) -> 0.0463418
A36: 35 | B36: strcpy: &"ackuv"{\0} &"hcuwr"{\0} :=> &"hcuwr"{\0} | C36: 0.0266417 | D36: 0.0246143 | E36: 0.0246143 | G36: of:=IF([.C36]=1;"";[.C36]) -> 0.0266417 | H36: of:=IF([.D36]=1;"";[.D36]) -> 0.0246143 | I36: of:=IF([.E36]=1;"";[.E36]) -> 0.0246143
A37: 1 | B37: strncpy: &""{\0,\x01,\x01,\x01,\x01,\x01} &""{\0,p,m,d,m,\0} 5 :=> &""{\0,\0,\0,\0,\0,\0} | C37: 1 | D37: 1 | E37: 1 | G37: of:=IF([.C37]=1;"";[.C37]) ->  | H37: of:=IF([.D37]=1;"";[.D37]) ->  | I37: of:=IF([.E37]=1;"";[.E37]) ->  | K37: of:=AVERAGE([.G37:.G72]) -> 0.0832478541666667 | L37: of:=AVERAGE([.H37:.H72]) -> 0.06895145 | M37: of:=AVERAGE([.I37:.I72]) -> 0.06895145 | O37: of:=AVERAGE([.K37:.M37]) -> 0.0737169180555555
A38: 2 | B38: strncpy: &""{\0,\x01,\x01,\x01,\x01,\x01} &"d"{\0,p,s,z,\0} 5 :=> &"d"{\0,\0,\0,\0,\0} | C38: 1 | D38: 1 | E38: 1 | G38: of:=IF([.C38]=1;"";[.C38]) ->  | H38: of:=IF([.D38]=1;"";[.D38]) ->  | I38: of:=IF([.E38]=1;"";[.E38]) -> 
A39: 3 | B39: strncpy: &""{\0,\x01,\x01,\x01,\x01,\x01} &"rr"{\0,p,q,\0} 5 :=> &"rr"{\0,\0,\0,\0} | C39: 1 | D39: 0.213322 | E39: 0.213322 | G39: of:=IF([.C39]=1;"";[.C39]) ->  | H39: of:=IF([.D39]=1;"";[.D39]) -> 0.213322 | I39: of:=IF([.E39]=1;"";[.E39]) -> 0.213322
A40: 4 | B40: strncpy: &""{\0,\x01,\x01,\x01,\x01,\x01} &"ykc"{\0,p,\0} 5 :=> &"ykc"{\0,\0,\0} | C40: 1 | D40: 0.0625969 | E40: 0.0625969 | G40: of:=IF([.C40]=1;"";[.C40]) ->  | H40: of:=IF([.D40]=1;"";[.D40]) -> 0.0625969 | I40: of:=IF([.E40]=1;"";[.E40]) -> 0.0625969
A41: 5 | B41: strncpy: &""{\0,\x01,\x01,\x01,\x01,\x01} &"lret"{\0,\0} 5 :=> &"lret"{\0,\0} | C41: 1 | D41: 0.0460934 | E41: 0.0460934 | G41: of:=IF([.C41]=1;"";[.C41]) ->  | H41: of:=IF([.D41]=1;"";[.D41]) -> 0.0460934 | I41: of:=IF([.E41]=1;"";[.E41]) -> 0.0460934
A42: 6 | B42: strncpy: &""{\0,\x01,\x01,\x01,\x01,\x01} &"uegmr"{\0} 5 :=> &"uegmr"{\0} | C42: 1 | D42: 0.0254351 | E42: 0.0254351 | G42: of:=IF([.C42]=1;"";[.C42]) ->  | H42: of:=IF([.D42]=1;"";[.D42]) -> 0.0254351 | I42: of:=IF([.E42]=1;"";[.E42]) -> 0.0254351
A43: 7 | B43: strncpy: &"w"{\0,\x01,\x01,\x01,\x01} &""{\0,p,m,d,s,\0} 5 :=> &""{\0,\0,\0,\0,\0,\0} | C43: 1 | D43: 1 | E43: 1 | G43: of:=IF([.C43]=1;"";[.C43]) ->  | H43: of:=IF([.D43]=1;"";[.D43]) ->  | I43: of:=IF([.E43]=1;"";[.E43]) -> 
A44: 8 | B44: strncpy: &"x"{\0,\x01,\x01,\x01,\x01} &"q"{\0,p,c,o,\0} 5 :=> &"q"{\0,\0,\0,\0,\0} | C44: 1 | D44: 1 | E44: 1 | G44: of:=IF([.C44]=1;"";[.C44]) ->  | H44: of:=IF([.D44]=1;"";[.D44]) ->  | I44: of:=IF([.E44]=1;"";[.E44]) -> 
A45: 9 | B45: strncpy: &"t"{\0,\x01,\x01,\x01,\x01} &"hf"{\0,p,u,\0} 5 :=> &"hf"{\0,\0,\0,\0} | C45: 1 | D45: 0.187748 | E45: 0.187748 | G45: of:=IF([.C45]=1;"";[.C45]) ->  | H45: of:=IF([.D45]=1;"";[.D45]) -> 0.187748 | I45: of:=IF([.E45]=1;"";[.E45]) -> 0.187748
A46: 10 | B46: strncpy: &"h"{\0,\x01,\x01,\x01,\x01} &"guu"{\0,p,\0} 5 :=> &"guu"{\0,\0,\0} | C46: 1 | D46: 0.0727382 | E46: 0.0727382 | G46: of:=IF([.C46]=1;"";[.C46]) ->  | H46: of:=IF([.D46]=1;"";[.D46]) -> 0.0727382 | I46: of:=IF([.E46]=1;"";[.E46]) -> 0.0727382
A47: 11 | B47: strncpy: &"k"{\0,\x01,\x01,\x01,\x01} &"fvvo"{\0,\0} 5 :=> &"fvvo"{\0,\0} | C47: 1 | D47: 0.0328347 | E47: 0.0328347 | G47: of:=IF([.C47]=1;"";[.C47]) ->  | H47: of:=IF([.D47]=1;"";[.D47]) -> 0.0328347 | I47: of:=IF([.E47]=1;"";[.E47]) -> 0.0328347
A48: 12 | B48: strncpy: &"w"{\0,\x01,\x01,\x01,\x01} &"iyzho"{\0} 5 :=> &"iyzho"{\0} | C48: 1 | D48: 0.0237956 | E48: 0.0237956 | G48: of:=IF([.C48]=1;"";[.C48]) ->  | H48: of:=IF([.D48]=1;"";[.D48]) -> 0.0237956 | I48: of:=IF([.E48]=1;"";[.E48]) -> 0.0237956
A49: 13 | B49: strncpy: &"bn"{\0,\x01,\x01,\x01} &""{\0,p,s,r,m,\0} 5 :=> &""{\0,\0,\0,\0,\0,\0} | C49: 0.180192 | D49: 1 | E49: 1 | G49: of:=IF([.C49]=1;"";[.C49]) -> 0.180192 | H49: of:=IF([.D49]=1;"";[.D49]) ->  | I49: of:=IF([.E49]=1;"";[.E49]) -> 
A50: 14 | B50: strncpy: &"ru"{\0,\x01,\x01,\x01} &"h"{\0,p,f,p,\0} 5 :=> &"h"{\0,\0,\0,\0,\0} | C50: 0.213322 | D50: 1 | E50: 1 | G50: of:=IF([.C50]=1;"";[.C50]) -> 0.213322 | H50: of:=IF([.D50]=1;"";[.D50]) ->  | I50: of:=IF([.E50]=1;"";[.E50]) -> 
A51: 15 | B51: strncpy: &"dq"{\0,\x01,\x01,\x01} &"mw"{\0,p,c,\0} 5 :=> &"mw"{\0,\0,\0,\0} | C51: 0.189362 | D51: 0.174098 | E51: 0.174098 | G51: of:=IF([.C51]=1;"";[.C51]) -> 0.189362 | H51: of:=IF([.D51]=1;"";[.D51]) -> 0.174098 | I51: of:=IF([.E51]=1;"";[.E51]) -> 0.174098
A52: 16 | B52: strncpy: &"nd"{\0,\x01,\x01,\x01} &"epz"{\0,p,\0} 5 :=> &"epz"{\0,\0,\0} | C52: 0.223692 | D52: 0.0679296 | E52: 0.0679296 | G52: of:=IF([.C52]=1;"";[.C52]) -> 0.223692 | H52: of:=IF([.D52]=1;"";[.D52]) -> 0.0679296 | I52: of:=IF([.E52]=1;"";[.E52]) -> 0.0679296
A53: 17 | B53: strncpy: &"op"{\0,\x01,\x01,\x01} &"pdfr"{\0,\0} 5 :=> &"pdfr"{\0,\0} | C53: 0.216638 | D53: 0.0386348 | E53: 0.0386348 | G53: of:=IF([.C53]=1;"";[.C53]) -> 0.216638 | H53: of:=IF([.D53]=1;"";[.D53]) -> 0.0386348 | I53: of:=IF([.E53]=1;"";[.E53]) -> 0.0386348
A54: 18 | B54: strncpy: &"oh"{\0,\x01,\x01,\x01} &"ovuil"{\0} 5 :=> &"ovuil"{\0} | C54: 0.205266 | D54: 0.027907 | E54: 0.027907 | G54: of:=IF([.C54]=1;"";[.C54]) -> 0.205266 | H54: of:=IF([.D54]=1;"";[.D54]) -> 0.027907 | I54: of:=IF([.E54]=1;"";[.E54]) -> 0.027907
A55: 19 | B55: strncpy: &"lcm"{\0,\x01,\x01} &""{\0,p,d,i,e,\0} 5 :=> &""{\0,\0,\0,\0,\0,\0} | C55: 0.0680819 | D55: 1 | E55: 1 | G55: of:=IF([.C55]=1;"";[.C55]) -> 0.0680819 | H55: of:=IF([.D55]=1;"";[.D55]) ->  | I55: of:=IF([.E55]=1;"";[.E55]) -> 
A56: 20 | B56: strncpy: &"lee"{\0,\x01,\x01} &"s"{\0,p,q,n,\0} 5 :=> &"s"{\0,\0,\0,\0,\0} | C56: 0.087702 | D56: 1 | E56: 1 | G56: of:=IF([.C56]=1;"";[.C56]) -> 0.087702 | H56: of:=IF([.D56]=1;"";[.D56]) ->  | I56: of:=IF([.E56]=1;"";[.E56]) -> 
A57: 21 | B57: strncpy: &"xwf"{\0,\x01,\x01} &"vf"{\0,p,j,\0} 5 :=> &"vf"{\0,\0,\0,\0} | C57: 0.0669681 | D57: 0 | E57: 0 | G57: of:=IF([.C57]=1;"";[.C57]) -> 0.0669681 | H57: of:=IF([.D57]=1;"";[.D57]) -> 0 | I57: of:=IF([.E57]=1;"";[.E57]) -> 0
A58: 22 | B58: strncpy: &"bko"{\0,\x01,\x01} &"sst"{\0,p,\0} 5 :=> &"sst"{\0,\0,\0} | C58: 0.0638637 | D58: 0.0893898 | E58: 0.0893898 | G58: of:=IF([.C58]=1;"";[.C58]) -> 0.0638637 | H58: of:=IF([.D58]=1;"";[.D58]) -> 0.0893898 | I58: of:=IF([.E58]=1;"";[.E58]) -> 0.0893898
A59: 23 | B59: strncpy: &"opu"{\0,\x01,\x01} &"kndi"{\0,\0} 5 :=> &"kndi"{\0,\0} | C59: 0.0853147 | D59: 0.0468759 | E59: 0.0468759 | G59: of:=IF([.C59]=1;"";[.C59]) -> 0.0853147 | H59: of:=IF([.D59]=1;"";[.D59]) -> 0.0468759 | I59: of:=IF([.E59]=1;"";[.E59]) -> 0.0468759
A60: 24 | B60: strncpy: &"kvs"{\0,\x01,\x01} &"cswxe"{\0} 5 :=> &"cswxe"{\0} | C60: 0.0658178 | D60: 0 | E60: 0 | G60: of:=IF([.C60]=1;"";[.C60]) -> 0.0658178 | H60: of:=IF([.D60]=1;"";[.D60]) -> 0 | I60: of:=IF([.E60]=1;"";[.E60]) -> 0
A61: 25 | B61: strncpy: &"rklu"{\0,\x01} &""{\0,p,f,d,f,\0} 5 :=> &""{\0,\0,\0,\0,\0,\0} | C61: 0.0443834 | D61: 1 | E61: 1 | G61: of:=IF([.C61]=1;"";[.C61]) -> 0.0443834 | H61: of:=IF([.D61]=1;"";[.D61]) ->  | I61: of:=IF([.E61]=1;"";[.E61]) -> 
A62: 26 | B62: strncpy: &"bbul"{\0,\x01} &"z"{\0,p,a,w,\0} 5 :=> &"z"{\0,\0,\0,\0,\0} | C62: 0.0447907 | D62: 1 | E62: 1 | G62: of:=IF([.C62]=1;"";[.C62]) -> 0.0447907 | H62: of:=IF([.D62]=1;"";[.D62]) ->  | I62: of:=IF([.E62]=1;"";[.E62]) -> 
A63: 27 | B63: strncpy: &"kkhn"{\0,\x01} &"gx"{\0,p,g,\0} 5 :=> &"gx"{\0,\0,\0,\0} | C63: 0.0383763 | D63: 0.140671 | E63: 0.140671 | G63: of:=IF([.C63]=1;"";[.C63]) -> 0.0383763 | H63: of:=IF([.D63]=1;"";[.D63]) -> 0.140671 | I63: of:=IF([.E63]=1;"";[.E63]) -> 0.140671
A64: 28 | B64: strncpy: &"amsz"{\0,\x01} &"uin"{\0,p,\0} 5 :=> &"uin"{\0,\0,\0} | C64: 0.0413855 | D64: 0.0882697 | E64: 0.0882697 | G64: of:=IF([.C64]=1;"";[.C64]) -> 0.0413855 | H64: of:=IF([.D64]=1;"";[.D64]) -> 0.0882697 | I64: of:=IF([.E64]=1;"";[.E64]) -> 0.0882697
A65: 29 | B65: strncpy: &"sncj"{\0,\x01} &"bjit"{\0,\0} 5 :=> &"bjit"{\0,\0} | C65: 0.0306062 | D65: 0.0415575 | E65: 0.0415575 | G65: of:=IF([.C65]=1;"";[.C65]) -> 0.0306062 | H65: of:=IF([.D65]=1;"";[.D65]) -> 0.0415575 | I65: of:=IF([.E65]=1;"";[.E65]) -> 0.0415575
A66: 30 | B66: strncpy: &"fxdo"{\0,\x01} &"btydk"{\0} 5 :=> &"btydk"{\0} | C66: 0 | D66: 0.0244485 | E66: 0.0244485 | G66: of:=IF([.C66]=1;"";[.C66]) -> 0 | H66: of:=IF([.D66]=1;"";[.D66]) -> 0.0244485 | I66: of:=IF([.E66]=1;"";[.E66]) -> 0.0244485
A67: 31 | B67: strncpy: &"gwavf"{\0} &""{\0,p,u,w,t,\0} 5 :=> &""{\0,\0,\0,\0,\0,\0} | C67: 0 | D67: 1 | E67: 1 | G67: of:=IF([.C67]=1;"";[.C67]) -> 0 | H67: of:=IF([.D67]=1;"";[.D67]) ->  | I67: of:=IF([.E67]=1;"";[.E67]) -> 
A68: 32 | B68: strncpy: &"ipoja"{\0} &"m"{\0,p,h,x,\0} 5 :=> &"m"{\0,\0,\0,\0,\0} | C68: 0.0273411 | D68: 1 | E68: 1 | G68: of:=IF([.C68]=1;"";[.C68]) -> 0.0273411 | H68: of:=IF([.D68]=1;"";[.D68]) ->  | I68: of:=IF([.E68]=1;"";[.E68]) -> 
A69: 33 | B69: strncpy: &"lozno"{\0} &"oi"{\0,p,j,\0} 5 :=> &"oi"{\0,\0,\0,\0} | C69: 0.0255302 | D69: 0.212346 | E69: 0.212346 | G69: of:=IF([.C69]=1;"";[.C69]) -> 0.0255302 | H69: of:=IF([.D69]=1;"";[.D69]) -> 0.212346 | I69: of:=IF([.E69]=1;"";[.E69]) -> 0.212346
A70: 34 | B70: strncpy: &"ciexw"{\0} &"qdj"{\0,p,\0} 5 :=> &"qdj"{\0,\0,\0} | C70: 0.0276249 | D70: 0 | E70: 0 | G70: of:=IF([.C70]=1;"";[.C70]) -> 0.0276249 | H70: of:=IF([.D70]=1;"";[.D70]) -> 0 | I70: of:=IF([.E70]=1;"";[.E70]) -> 0
A71: 35 | B71: strncpy: &"bpwih"{\0} &"gtkr"{\0,\0} 5 :=> &"gtkr"{\0,\0} | C71: 0.0226441 | D71: 0.0381431 | E71: 0.0381431 | G71: of:=IF([.C71]=1;"";[.C71]) -> 0.0226441 | H71: of:=IF([.D71]=1;"";[.D71]) -> 0.0381431 | I71: of:=IF([.E71]=1;"";[.E71]) -> 0.0381431
A72: 36 | B72: strncpy: &"iryms"{\0} &"hqzmb"{\0} 5 :=> &"hqzmb"{\0} | C72: 0.0290459 | D72: 0 | E72: 0 | G72: of:=IF([.C72]=1;"";[.C72]) -> 0.0290459 | H72: of:=IF([.D72]=1;"";[.D72]) -> 0 | I72: of:=IF([.E72]=1;"";[.E72]) -> 0

Sheet: strcat
A1: # | B1: Test Case | C1: N1 | D1: N2 | E1: N3
A2: 1 | B2: strcat: &""{\0,\x01,\x01,\x01,\x01,\x01,\x01,\x01,\x01,\x01} &"a"{\0,p,x,\0} :=> &"a"{\0,p,d,j,o,j,j,d,\0} | C2: 1 | D2: 1 | E2: 1 | G2: of:=IF([.C2]=1;"";[.C2]) ->  | H2: of:=IF([.D2]=1;"";[.D2]) ->  | I2: of:=IF([.E2]=1;"";[.E2]) ->  | K2: of:=AVERAGE([.G2:.G41]) -> 0.0474145738709677 | L2: of:=AVERAGE([.H2:.H41]) -> 0.0944512977272727 | M2: of:=AVERAGE([.I2:.I41]) -> 0.032157407027027 | O2: of:=AVERAGE([.K2:.M2]) -> 0.0580077595417558
A3: 2 | B3: strcat: &""{\0,\x01,\x01,\x01,\x01,\x01,\x01,\x01,\x01,\x01} &"np"{\0,p,\0} :=> &"np"{\0,p,a,g,o,k,n,\0} | C3: 1 | D3: 0.196565 | E3: 0.196565 | G3: of:=IF([.C3]=1;"";[.C3]) ->  | H3: of:=IF([.D3]=1;"";[.D3]) -> 0.196565 | I3: of:=IF([.E3]=1;"";[.E3]) -> 0.196565
A4: 3 | B4: strcat: &""{\0,\x01,\x01,\x01,\x01,\x01,\x01,\x01,\x01,\x01} &"gel"{\0,\0} :=> &"gel"{\0,p,s,h,b,s,\0} | C4: 1 | D4: 0.0882791 | E4: 0.0882791 | G4: of:=IF([.C4]=1;"";[.C4]) ->  | H4: of:=IF([.D4]=1;"";[.D4]) -> 0.0882791 | I4: of:=IF([.E4]=1;"";[.E4]) -> 0.0882791
A5: 4 | B5: strcat: &""{\0,\x01,\x01,\x01,\x01,\x01,\x01,\x01,\x01,\x01} &"srxz"{\0} :=> &"srxz"{\0,p,w,i,x,\0} | C5: 1 | D5: 0 | E5: 0 | H5: of:=IF([.D5]=1;"";[.D5]) -> 0 | I5: of:=IF([.E5]=1;"";[.E5]) -> 0
A6: 5 | B6: strcat: &"z"{\0,\x01,\x01,\x01,\x01,\x01,\x01,\x01,\x01} &""{\0,p,a,i,\0} :=> &"z"{\0,p,b,t,e,b,m,w,\0} | C6: 1 | D6: 1 | E6: 1 | G6: of:=IF([.C6]=1;"";[.C6]) ->  | H6: of:=IF([.D6]=1;"";[.D6]) ->  | I6: of:=IF([.E6]=1;"";[.E6]) -> 
A7: 6 | B7: strcat: &"y"{\0,\x01,\x01,\x01,\x01,\x01,\x01,\x01,\x01} &"x"{\0,p,e,\0} :=> &"yx"{\0,p,u,e,l,g,s,\0} | C7: 1 | D7: 1 | E7: 0.169842 | G7: of:=IF([.C7]=1;"";[.C7]) ->  | H7: of:=IF([.D7]=1;"";[.D7]) ->  | I7: of:=IF([.E7]=1;"";[.E7]) -> 0.169842
A8: 7 | B8: strcat: &"g"{\0,\x01,\x01,\x01,\x01,\x01,\x01,\x01,\x01} &"fe"{\0,p,\0} :=> &"gfe"{\0,p,c,o,p,p,\0} | C8: 1 | D8: 0.215706 | E8: 0.0759485 | G8: of:=IF([.C8]=1;"";[.C8]) ->  | H8: of:=IF([.D8]=1;"";[.D8]) -> 0.215706 | I8: of:=IF([.E8]=1;"";[.E8]) -> 0.0759485
A9: 8 | B9: strcat: &"q"{\0,\x01,\x01,\x01,\x01,\x01,\x01,\x01,\x01} &"cxs"{\0,\0} :=> &"qcxs"{\0,p,l,j,o,\0} | C9: 1 | D9: 0.0406699 | E9: 0 | G9: of:=IF([.C9]=1;"";[.C9]) ->  | H9: of:=IF([.D9]=1;"";[.D9]) -> 0.0406699 | I9: of:=IF([.E9]=1;"";[.E9]) -> 0
A10: 9 | B10: strcat: &"h"{\0,\x01,\x01,\x01,\x01,\x01,\x01,\x01,\x01} &"shdc"{\0} :=> &"hshdc"{\0,p,u,i,\0} | C10: 1 | D10: 0.0411455 | E10: 0.0262172 | G10: of:=IF([.C10]=1;"";[.C10]) ->  | H10: of:=IF([.D10]=1;"";[.D10]) -> 0.0411455 | I10: of:=IF([.E10]=1;"";[.E10]) -> 0.0262172
A11: 10 | B11: strcat: &"lg"{\0,\x01,\x01,\x01,\x01,\x01,\x01,\x01} &""{\0,p,b,o,\0} :=> &"lg"{\0,p,u,y,z,i,t,\0} | C11: 0.196689 | D11: 1 | E11: 0.196689 | G11: of:=IF([.C11]=1;"";[.C11]) -> 0.196689 | H11: of:=IF([.D11]=1;"";[.D11]) ->  | I11: of:=IF([.E11]=1;"";[.E11]) -> 0.196689
A12: 11 | B12: strcat: &"wc"{\0,\x01,\x01,\x01,\x01,\x01,\x01,\x01} &"f"{\0,p,a,\0} :=> &"wcf"{\0,p,v,y,f,u,\0} | C12: 0.184011 | D12: 1 | E12: 0.0578428 | G12: of:=IF([.C12]=1;"";[.C12]) -> 0.184011 | H12: of:=IF([.D12]=1;"";[.D12]) ->  | I12: of:=IF([.E12]=1;"";[.E12]) -> 0.0578428
A13: 12 | B13: strcat: &"cl"{\0,\x01,\x01,\x01,\x01,\x01,\x01,\x01} &"vw"{\0,p,\0} :=> &"clvw"{\0,p,h,v,r,\0} | C13: 0.213806 | D13: 0 | E13: 0 | G13: of:=IF([.C13]=1;"";[.C13]) -> 0.213806 | H13: of:=IF([.D13]=1;"";[.D13]) -> 0 | I13: of:=IF([.E13]=1;"";[.E13]) -> 0
A14: 13 | B14: strcat: &"al"{\0,\x01,\x01,\x01,\x01,\x01,\x01,\x01} &"sin"{\0,\0} :=> &"alsin"{\0,p,k,j,\0} | C14: 0.222847 | D14: 0.0908885 | E14: 0.031752 | G14: of:=IF([.C14]=1;"";[.C14]) -> 0.222847 | H14: of:=IF([.D14]=1;"";[.D14]) -> 0.0908885 | I14: of:=IF([.E14]=1;"";[.E14]) -> 0.031752
A15: 14 | B15: strcat: &"vw"{\0,\x01,\x01,\x01,\x01,\x01,\x01,\x01} &"uxig"{\0} :=> &"vwuxig"{\0,p,a,\0} | C15: 0 | D15: 0.0419144 | E15: 0 | G15: of:=IF([.C15]=1;"";[.C15]) -> 0 | H15: of:=IF([.D15]=1;"";[.D15]) -> 0.0419144 | I15: of:=IF([.E15]=1;"";[.E15]) -> 0
A16: 15 | B16: strcat: &"jmf"{\0,\x01,\x01,\x01,\x01,\x01,\x01} &""{\0,p,b,y,\0} :=> &"jmf"{\0,p,i,j,i,n,\0} | C16: 0.0638011 | D16: 1 | E16: 0.0638011 | G16: of:=IF([.C16]=1;"";[.C16]) -> 0.0638011 | H16: of:=IF([.D16]=1;"";[.D16]) ->  | I16: of:=IF([.E16]=1;"";[.E16]) -> 0.0638011
A17: 16 | B17: strcat: &"gki"{\0,\x01,\x01,\x01,\x01,\x01,\x01} &"e"{\0,p,o,\0} :=> &"gkie"{\0,p,q,e,j,\0} | C17: 0.0711589 | D17: 1 | E17: 0.0400972 | G17: of:=IF([.C17]=1;"";[.C17]) -> 0.0711589 | H17: of:=IF([.D17]=1;"";[.D17]) ->  | I17: of:=IF([.E17]=1;"";[.E17]) -> 0.0400972
A18: 17 | B18: strcat: &"asc"{\0,\x01,\x01,\x01,\x01,\x01,\x01} &"ab"{\0,p,\0} :=> &"ascab"{\0,p,j,p,\0} | C18: 0.087449 | D18: 0.215706 | E18: 0.0307246 | G18: of:=IF([.C18]=1;"";[.C18]) -> 0.087449 | H18: of:=IF([.D18]=1;"";[.D18]) -> 0.215706 | I18: of:=IF([.E18]=1;"";[.E18]) -> 0.0307246
A19: 18 | B19: strcat: &"qcf"{\0,\x01,\x01,\x01,\x01,\x01,\x01} &"mgt"{\0,\0} :=> &"qcfmgt"{\0,p,g,\0} | C19: 0 | D19: 0.0692328 | E19: 0 | G19: of:=IF([.C19]=1;"";[.C19]) -> 0 | H19: of:=IF([.D19]=1;"";[.D19]) -> 0.0692328 | I19: of:=IF([.E19]=1;"";[.E19]) -> 0
A20: 19 | B20: strcat: &"ttt"{\0,\x01,\x01,\x01,\x01,\x01,\x01} &"crvl"{\0} :=> &"tttcrvl"{\0,p,\0} | C20: 0.0856374 | D20: 0.0410865 | E20: 0.0151044 | G20: of:=IF([.C20]=1;"";[.C20]) -> 0.0856374 | H20: of:=IF([.D20]=1;"";[.D20]) -> 0.0410865 | I20: of:=IF([.E20]=1;"";[.E20]) -> 0.0151044
A21: 20 | B21: strcat: &"yqki"{\0,\x01,\x01,\x01,\x01,\x01} &""{\0,p,y,b,\0} :=> &"yqki"{\0,p,k,q,r,\0} | C21: 0 | D21: 1 | E21: 0 | G21: of:=IF([.C21]=1;"";[.C21]) -> 0 | H21: of:=IF([.D21]=1;"";[.D21]) ->  | I21: of:=IF([.E21]=1;"";[.E21]) -> 0
A22: 21 | B22: strcat: &"xfse"{\0,\x01,\x01,\x01,\x01,\x01} &"o"{\0,p,z,\0} :=> &"xfseo"{\0,p,b,y,\0} | C22: 0.0397184 | D22: 1 | E22: 0.0259078 | G22: of:=IF([.C22]=1;"";[.C22]) -> 0.0397184 | H22: of:=IF([.D22]=1;"";[.D22]) ->  | I22: of:=IF([.E22]=1;"";[.E22]) -> 0.0259078
A23: 22 | B23: strcat: &"bzej"{\0,\x01,\x01,\x01,\x01,\x01} &"pz"{\0,p,\0} :=> &"bzejpz"{\0,p,h,\0} | C23: 0.0333839 | D23: 0.161124 | E23: 0.0113875 | G23: of:=IF([.C23]=1;"";[.C23]) -> 0.0333839 | H23: of:=IF([.D23]=1;"";[.D23]) -> 0.161124 | I23: of:=IF([.E23]=1;"";[.E23]) -> 0.0113875
A24: 23 | B24: strcat: &"jfkw"{\0,\x01,\x01,\x01,\x01,\x01} &"nkp"{\0,\0} :=> &"jfkwnkp"{\0,p,\0} | C24: 0.0284502 | D24: 0.0748182 | E24: 0.0110738 | G24: of:=IF([.C24]=1;"";[.C24]) -> 0.0284502 | H24: of:=IF([.D24]=1;"";[.D24]) -> 0.0748182 | I24: of:=IF([.E24]=1;"";[.E24]) -> 0.0110738
A25: 24 | B25: strcat: &"muuv"{\0,\x01,\x01,\x01,\x01,\x01} &"dtch"{\0} :=> &"muuvdtch"{\0,\0} | C25: 0.0376063 | D25: 0.0425952 | E25: 0.0102937 | G25: of:=IF([.C25]=1;"";[.C25]) -> 0.0376063 | H25: of:=IF([.D25]=1;"";[.D25]) -> 0.0425952 | I25: of:=IF([.E25]=1;"";[.E25]) -> 0.0102937
A26: 25 | B26: strcat: &"sgime"{\0,\x01,\x01,\x01,\x01} &""{\0,p,y,u,\0} :=> &"sgime"{\0,p,j,v,\0} | C26: 0.0281188 | D26: 1 | E26: 0.0281188 | G26: of:=IF([.C26]=1;"";[.C26]) -> 0.0281188 | H26: of:=IF([.D26]=1;"";[.D26]) ->  | I26: of:=IF([.E26]=1;"";[.E26]) -> 0.0281188
A27: 26 | B27: strcat: &"bzefb"{\0,\x01,\x01,\x01,\x01} &"f"{\0,p,p,\0} :=> &"bzefbf"{\0,p,c,\0} | C27: 0.0207628 | D27: 1 | E27: 0.0136506 | G27: of:=IF([.C27]=1;"";[.C27]) -> 0.0207628 | H27: of:=IF([.D27]=1;"";[.D27]) ->  | I27: of:=IF([.E27]=1;"";[.E27]) -> 0.0136506
A28: 27 | B28: strcat: &"lcyjt"{\0,\x01,\x01,\x01,\x01} &"ib"{\0,p,\0} :=> &"lcyjtib"{\0,p,\0} | C28: 0.0188087 | D28: 0.210352 | E28: 0.0116819 | G28: of:=IF([.C28]=1;"";[.C28]) -> 0.0188087 | H28: of:=IF([.D28]=1;"";[.D28]) -> 0.210352 | I28: of:=IF([.E28]=1;"";[.E28]) -> 0.0116819
A29: 28 | B29: strcat: &"jwnrh"{\0,\x01,\x01,\x01,\x01} &"iap"{\0,\0} :=> &"jwnrhiap"{\0,\0} | C29: 0 | D29: 0.0863757 | E29: 0 | G29: of:=IF([.C29]=1;"";[.C29]) -> 0 | H29: of:=IF([.D29]=1;"";[.D29]) -> 0.0863757 | I29: of:=IF([.E29]=1;"";[.E29]) -> 0
A30: 29 | B30: strcat: &"qlakz"{\0,\x01,\x01,\x01,\x01} &"aqoz"{\0} :=> &"qlakzaqoz"{\0} | C30: 0.0174178 | D30: 0 | E30: 0 | G30: of:=IF([.C30]=1;"";[.C30]) -> 0.0174178 | H30: of:=IF([.D30]=1;"";[.D30]) -> 0 | I30: of:=IF([.E30]=1;"";[.E30]) -> 0
A31: 30 | B31: strcat: &"lqlxlb"{\0,\x01,\x01,\x01} &""{\0,p,q,t,\0} :=> &"lqlxlb"{\0,p,o,\0} | C31: 0.0103532 | D31: 1 | E31: 0.0103532 | G31: of:=IF([.C31]=1;"";[.C31]) -> 0.0103532 | H31: of:=IF([.D31]=1;"";[.D31]) ->  | I31: of:=IF([.E31]=1;"";[.E31]) -> 0.0103532
A32: 31 | B32: strcat: &"hbgsvc"{\0,\x01,\x01,\x01} &"b"{\0,p,k,\0} :=> &"hbgsvcb"{\0,p,\0} | C32: 0.0151465 | D32: 1 | E32: 0.0108752 | G32: of:=IF([.C32]=1;"";[.C32]) -> 0.0151465 | H32: of:=IF([.D32]=1;"";[.D32]) ->  | I32: of:=IF([.E32]=1;"";[.E32]) -> 0.0108752
A33: 32 | B33: strcat: &"wvmwws"{\0,\x01,\x01,\x01} &"vn"{\0,p,\0} :=> &"wvmwwsvn"{\0,\0} | C33: 0.00930463 | D33: 0.178063 | E33: 0.00607509 | G33: of:=IF([.C33]=1;"";[.C33]) -> 0.00930463 | H33: of:=IF([.D33]=1;"";[.D33]) -> 0.178063 | I33: of:=IF([.E33]=1;"";[.E33]) -> 0.00607509
A34: 33 | B34: strcat: &"xpvzbh"{\0,\x01,\x01,\x01} &"jiw"{\0,\0} :=> &"xpvzbhjiw"{\0} | C34: 0.00989696 | D34: 0.0703386 | E34: 0.00535775 | G34: of:=IF([.C34]=1;"";[.C34]) -> 0.00989696 | H34: of:=IF([.D34]=1;"";[.D34]) -> 0.0703386 | I34: of:=IF([.E34]=1;"";[.E34]) -> 0.00535775
A35: 34 | B35: strcat: &"vrbnbd"{\0,\x01,\x01,\x01} &&10 :=> &"vrbnbddzsy"{} | C35: 0.0160246 | D35: 0.00699115 | G35: of:=IF([.C35]=1;"";[.C35]) -> 0.0160246 | H35: of:=IF([.D35]=1;"";[.D35]) -> 0.00699115 | I35: of:=IF([.E35]=1;"";[.E35]) ->  
A36: 35 | B36: strcat: &"mcuiodm"{\0,\x01,\x01} &""{\0,p,z,n,\0} :=> &"mcuiodm"{\0,p,\0} | C36: 0.0151664 | D36: 1 | E36: 0.0151664 | G36: of:=IF([.C36]=1;"";[.C36]) -> 0.0151664 | H36: of:=IF([.D36]=1;"";[.D36]) ->  | I36: of:=IF([.E36]=1;"";[.E36]) -> 0.0151664
A37: 36 | B37: strcat: &"ictvsbj"{\0,\x01,\x01} &"j"{\0,p,y,\0} :=> &"ictvsbjj"{\0,\0} | C37: 0.0139586 | D37: 1 | E37: 0.00986295 | G37: of:=IF([.C37]=1;"";[.C37]) -> 0.0139586 | H37: of:=IF([.D37]=1;"";[.D37]) ->  | I37: of:=IF([.E37]=1;"";[.E37]) -> 0.00986295
A38: 37 | B38: strcat: &"xuyyzwa"{\0,\x01,\x01} &"lv"{\0,p,\0} :=> &"xuyyzwalv"{\0} | C38: 0.0118156 | D38: 0.206077 | E38: 0.00863747 | G38: of:=IF([.C38]=1;"";[.C38]) -> 0.0118156 | H38: of:=IF([.D38]=1;"";[.D38]) -> 0.206077 | I38: of:=IF([.E38]=1;"";[.E38]) -> 0.00863747
A39: 38 | B39: strcat: &"kkkginen"{\0,\x01} &""{\0,p,f,c,\0} :=> &"kkkginen"{\0,\0} | C39: 0.0119205 | D39: 1 | E39: 0.0119205 | G39: of:=IF([.C39]=1;"";[.C39]) -> 0.0119205 | H39: of:=IF([.D39]=1;"";[.D39]) ->  | I39: of:=IF([.E39]=1;"";[.E39]) -> 0.0119205
A40: 39 | B40: strcat: &"qstjwkfb"{\0,\x01} &"f"{\0,p,c,\0} :=> &"qstjwkfbf"{\0} | C40: 0 | D40: 1 | E40: 0 | G40: of:=IF([.C40]=1;"";[.C40]) -> 0 | H40: of:=IF([.D40]=1;"";[.D40]) ->  | I40: of:=IF([.E40]=1;"";[.E40]) -> 0
A41: 40 | B41: strcat: &"xwwvojmai"{\0} &""{\0,p,b,b,\0} :=> &"xwwvojmai"{\0} | C41: 0.0065985 | D41: 1 | E41: 0.0065985 | G41: of:=IF([.C41]=1;"";[.C41]) -> 0.0065985 | H41: of:=IF([.D41]=1;"";[.D41]) ->  | I41: of:=IF([.E41]=1;"";[.E41]) -> 0.0065985
A42: 1 | B42: strncat: &""{\0,\x01,\x01,\x01,\x01,\x01,\x01,\x01,\x01,\x01} &""{\0,p,a,c,\0} 4 :=> &""{\0,p,u,t,j,c,r,q,q,\0} | C42: 1 | D42: 1 | E42: 1 | G42: of:=IF([.C42]=1;"";[.C42]) ->  | H42: of:=IF([.D42]=1;"";[.D42]) ->  | I42: of:=IF([.E42]=1;"";[.E42]) ->  | K42: of:=AVERAGE([.G42:.G82]) -> 0.0464238735483871 | L42: of:=AVERAGE([.H42:.H82]) -> 0.102106017272727 | M42: of:=AVERAGE([.I42:.I82]) -> 0.0345045556756757 | O42: of:=AVERAGE([.K42:.M42]) -> 0.0610114821655967
A43: 2 | B43: strncat: &""{\0,\x01,\x01,\x01,\x01,\x01,\x01,\x01,\x01,\x01} &"c"{\0,p,s,\0} 4 :=> &"c"{\0,p,l,c,h,b,m,q,\0} | C43: 1 | D43: 1 | E43: 1 | G43: of:=IF([.C43]=1;"";[.C43]) ->  | H43: of:=IF([.D43]=1;"";[.D43]) ->  | I43: of:=IF([.E43]=1;"";[.E43]) -> 
A44: 3 | B44: strncat: &""{\0,\x01,\x01,\x01,\x01,\x01,\x01,\x01,\x01,\x01} &"nc"{\0,p,\0} 4 :=> &"nc"{\0,p,b,l,r,d,x,\0} | C44: 1 | D44: 0.218916 | E44: 0.218916 | G44: of:=IF([.C44]=1;"";[.C44]) ->  | H44: of:=IF([.D44]=1;"";[.D44]) -> 0.218916 | I44: of:=IF([.E44]=1;"";[.E44]) -> 0.218916
A45: 4 | B45: strncat: &""{\0,\x01,\x01,\x01,\x01,\x01,\x01,\x01,\x01,\x01} &"roo"{\0,\0} 4 :=> &"roo"{\0,p,r,y,x,w,\0} | C45: 1 | D45: 0.0881009 | E45: 0.0881009 | G45: of:=IF([.C45]=1;"";[.C45]) ->  | H45: of:=IF([.D45]=1;"";[.D45]) -> 0.0881009 | I45: of:=IF([.E45]=1;"";[.E45]) -> 0.0881009
A46: 5 | B46: strncat: &""{\0,\x01,\x01,\x01,\x01,\x01,\x01,\x01,\x01,\x01} &"vjex"{\0} 4 :=> &"vjex"{\0,p,w,l,m,\0} | C46: 1 | D46: 0.0280635 | E46: 0.0280635 | G46: of:=IF([.C46]=1;"";[.C46]) ->  | H46: of:=IF([.D46]=1;"";[.D46]) -> 0.0280635 | I46: of:=IF([.E46]=1;"";[.E46]) -> 0.0280635
A47: 6 | B47: strncat: &"c"{\0,\x01,\x01,\x01,\x01,\x01,\x01,\x01,\x01} &""{\0,p,d,k,\0} 4 :=> &"c"{\0,p,y,z,l,i,f,y,\0} | C47: 1 | D47: 1 | E47: 1 | G47: of:=IF([.C47]=1;"";[.C47]) ->  | H47: of:=IF([.D47]=1;"";[.D47]) ->  | I47: of:=IF([.E47]=1;"";[.E47]) -> 
A48: 7 | B48: strncat: &"h"{\0,\x01,\x01,\x01,\x01,\x01,\x01,\x01,\x01} &"w"{\0,p,a,\0} 4 :=> &"hw"{\0,p,c,e,m,i,z,\0} | C48: 1 | D48: 1 | E48: 0.197427 | G48: of:=IF([.C48]=1;"";[.C48]) ->  | H48: of:=IF([.D48]=1;"";[.D48]) ->  | I48: of:=IF([.E48]=1;"";[.E48]) -> 0.197427
A49: 8 | B49: strncat: &"f"{\0,\x01,\x01,\x01,\x01,\x01,\x01,\x01,\x01} &"df"{\0,p,\0} 4 :=> &"fdf"{\0,p,c,g,h,b,\0} | C49: 1 | D49: 0.193586 | E49: 0.0621245 | G49: of:=IF([.C49]=1;"";[.C49]) ->  | H49: of:=IF([.D49]=1;"";[.D49]) -> 0.193586 | I49: of:=IF([.E49]=1;"";[.E49]) -> 0.0621245
A50: 9 | B50: strncat: &"b"{\0,\x01,\x01,\x01,\x01,\x01,\x01,\x01,\x01} &"swi"{\0,\0} 4 :=> &"bswi"{\0,p,g,w,g,\0} | C50: 1 | D50: 0.0829359 | E50: 0.044277 | G50: of:=IF([.C50]=1;"";[.C50]) ->  | H50: of:=IF([.D50]=1;"";[.D50]) -> 0.0829359 | I50: of:=IF([.E50]=1;"";[.E50]) -> 0.044277
A51: 10 | B51: strncat: &"f"{\0,\x01,\x01,\x01,\x01,\x01,\x01,\x01,\x01} &"fwfu"{\0} 4 :=> &"ffwfu"{\0,p,q,o,\0} | C51: 1 | D51: 0.0358966 | E51: 0.0239738 | G51: of:=IF([.C51]=1;"";[.C51]) ->  | H51: of:=IF([.D51]=1;"";[.D51]) -> 0.0358966 | I51: of:=IF([.E51]=1;"";[.E51]) -> 0.0239738
A52: 11 | B52: strncat: &"ip"{\0,\x01,\x01,\x01,\x01,\x01,\x01,\x01} &""{\0,p,h,c,\0} 4 :=> &"ip"{\0,p,l,t,h,m,c,\0} | C52: 0.210856 | D52: 1 | E52: 0.210856 | G52: of:=IF([.C52]=1;"";[.C52]) -> 0.210856 | H52: of:=IF([.D52]=1;"";[.D52]) ->  | I52: of:=IF([.E52]=1;"";[.E52]) -> 0.210856
A53: 12 | B53: strncat: &"uy"{\0,\x01,\x01,\x01,\x01,\x01,\x01,\x01} &"g"{\0,p,b,\0} 4 :=> &"uyg"{\0,p,y,z,r,f,\0} | C53: 0.202489 | D53: 1 | E53: 0.0725253 | G53: of:=IF([.C53]=1;"";[.C53]) -> 0.202489 | H53: of:=IF([.D53]=1;"";[.D53]) ->  | I53: of:=IF([.E53]=1;"";[.E53]) -> 0.0725253
A54: 13 | B54: strncat: &"jq"{\0,\x01,\x01,\x01,\x01,\x01,\x01,\x01} &"nl"{\0,p,\0} 4 :=> &"jqnl"{\0,p,n,e,a,\0} | C54: 0 | D54: 0.208818 | E54: 0 | G54: of:=IF([.C54]=1;"";[.C54]) -> 0 | H54: of:=IF([.D54]=1;"";[.D54]) -> 0.208818 | I54: of:=IF([.E54]=1;"";[.E54]) -> 0
A55: 14 | B55: strncat: &"ow"{\0,\x01,\x01,\x01,\x01,\x01,\x01,\x01} &"pyn"{\0,\0} 4 :=> &"owpyn"{\0,p,e,g,\0} | C55: 0.218014 | D55: 0.0780483 | E55: 0.0253949 | G55: of:=IF([.C55]=1;"";[.C55]) -> 0.218014 | H55: of:=IF([.D55]=1;"";[.D55]) -> 0.0780483 | I55: of:=IF([.E55]=1;"";[.E55]) -> 0.0253949
A56: 15 | B56: strncat: &"bh"{\0,\x01,\x01,\x01,\x01,\x01,\x01,\x01} &"oioh"{\0} 4 :=> &"bhoioh"{\0,p,r,\0} | C56: 0.17798 | D56: 0.0452897 | E56: 0.0194181 | G56: of:=IF([.C56]=1;"";[.C56]) -> 0.17798 | H56: of:=IF([.D56]=1;"";[.D56]) -> 0.0452897 | I56: of:=IF([.E56]=1;"";[.E56]) -> 0.0194181
A57: 16 | B57: strncat: &"zed"{\0,\x01,\x01,\x01,\x01,\x01,\x01} &""{\0,p,p,h,\0} 4 :=> &"zed"{\0,p,u,h,f,z,\0} | C57: 0.0862057 | D57: 1 | E57: 0.0862057 | G57: of:=IF([.C57]=1;"";[.C57]) -> 0.0862057 | H57: of:=IF([.D57]=1;"";[.D57]) ->  | I57: of:=IF([.E57]=1;"";[.E57]) -> 0.0862057
A58: 17 | B58: strncat: &"avk"{\0,\x01,\x01,\x01,\x01,\x01,\x01} &"d"{\0,p,s,\0} 4 :=> &"avkd"{\0,p,q,w,v,\0} | C58: 0.06657 | D58: 1 | E58: 0.0343204 | G58: of:=IF([.C58]=1;"";[.C58]) -> 0.06657 | H58: of:=IF([.D58]=1;"";[.D58]) ->  | I58: of:=IF([.E58]=1;"";[.E58]) -> 0.0343204
A59: 18 | B59: strncat: &"zgf"{\0,\x01,\x01,\x01,\x01,\x01,\x01} &"nu"{\0,p,\0} 4 :=> &"zgfnu"{\0,p,f,u,\0} | C59: 0.0642945 | D59: 0.211853 | E59: 0.0216261 | G59: of:=IF([.C59]=1;"";[.C59]) -> 0.0642945 | H59: of:=IF([.D59]=1;"";[.D59]) -> 0.211853 | I59: of:=IF([.E59]=1;"";[.E59]) -> 0.0216261
A60: 19 | B60: strncat: &"hnk"{\0,\x01,\x01,\x01,\x01,\x01,\x01} &"wkt"{\0,\0} 4 :=> &"hnkwkt"{\0,p,p,\0} | C60: 0.0815799 | D60: 0.0704989 | E60: 0.0173869 | G60: of:=IF([.C60]=1;"";[.C60]) -> 0.0815799 | H60: of:=IF([.D60]=1;"";[.D60]) -> 0.0704989 | I60: of:=IF([.E60]=1;"";[.E60]) -> 0.0173869
A61: 20 | B61: strncat: &"ngu"{\0,\x01,\x01,\x01,\x01,\x01,\x01} &"zckj"{\0} 4 :=> &"nguzckj"{\0,p,\0} | C61: 0.0869115 | D61: 0.0320338 | E61: 0.0125083 | G61: of:=IF([.C61]=1;"";[.C61]) -> 0.0869115 | H61: of:=IF([.D61]=1;"";[.D61]) -> 0.0320338 | I61: of:=IF([.E61]=1;"";[.E61]) -> 0.0125083
A62: 21 | B62: strncat: &"juql"{\0,\x01,\x01,\x01,\x01,\x01} &""{\0,p,x,w,\0} 4 :=> &"juql"{\0,p,g,a,s,\0} | C62: 0.0274171 | D62: 1 | E62: 0.0274171 | G62: of:=IF([.C62]=1;"";[.C62]) -> 0.0274171 | H62: of:=IF([.D62]=1;"";[.D62]) ->  | I62: of:=IF([.E62]=1;"";[.E62]) -> 0.0274171
A63: 22 | B63: strncat: &"nxdp"{\0,\x01,\x01,\x01,\x01,\x01} &"d"{\0,p,g,\0} 4 :=> &"nxdpd"{\0,p,b,w,\0} | C63: 0 | D63: 1 | E63: 0 | G63: of:=IF([.C63]=1;"";[.C63]) -> 0 | H63: of:=IF([.D63]=1;"";[.D63]) ->  | I63: of:=IF([.E63]=1;"";[.E63]) -> 0
A64: 23 | B64: strncat: &"wkgp"{\0,\x01,\x01,\x01,\x01,\x01} &"wf"{\0,p,\0} 4 :=> &"wkgpwf"{\0,p,f,\0} | C64: 0.0341335 | D64: 0.184985 | E64: 0.0145778 | G64: of:=IF([.C64]=1;"";[.C64]) -> 0.0341335 | H64: of:=IF([.D64]=1;"";[.D64]) -> 0.184985 | I64: of:=IF([.E64]=1;"";[.E64]) -> 0.0145778
A65: 24 | B65: strncat: &"hebj"{\0,\x01,\x01,\x01,\x01,\x01} &"qyp"{\0,\0} 4 :=> &"hebjqyp"{\0,p,\0} | C65: 0.0445435 | D65: 0 | E65: 0 | G65: of:=IF([.C65]=1;"";[.C65]) -> 0.0445435 | H65: of:=IF([.D65]=1;"";[.D65]) -> 0 | I65: of:=IF([.E65]=1;"";[.E65]) -> 0
A66: 25 | B66: strncat: &"lsbh"{\0,\x01,\x01,\x01,\x01,\x01} &"aigv"{\0} 4 :=> &"lsbhaigv"{\0,\0} | C66: 0.0388755 | D66: 0.037698 | E66: 0.0109345 | G66: of:=IF([.C66]=1;"";[.C66]) -> 0.0388755 | H66: of:=IF([.D66]=1;"";[.D66]) -> 0.037698 | I66: of:=IF([.E66]=1;"";[.E66]) -> 0.0109345
A67: 26 | B67: strncat: &"dxsky"{\0,\x01,\x01,\x01,\x01} &""{\0,p,c,n,\0} 4 :=> &"dxsky"{\0,p,o,b,\0} | C67: 0 | D67: 1 | E67: 0 | G67: of:=IF([.C67]=1;"";[.C67]) -> 0 | H67: of:=IF([.D67]=1;"";[.D67]) ->  | I67: of:=IF([.E67]=1;"";[.E67]) -> 0
A68: 27 | B68: strncat: &"ggxgl"{\0,\x01,\x01,\x01,\x01} &"h"{\0,p,j,\0} 4 :=> &"ggxglh"{\0,p,i,\0} | C68: 0.0160533 | D68: 1 | E68: 0.0117822 | G68: of:=IF([.C68]=1;"";[.C68]) -> 0.0160533 | H68: of:=IF([.D68]=1;"";[.D68]) ->  | I68: of:=IF([.E68]=1;"";[.E68]) -> 0.0117822
A69: 28 | B69: strncat: &"pwqpq"{\0,\x01,\x01,\x01,\x01} &"pi"{\0,p,\0} 4 :=> &"pwqpqpi"{\0,p,\0} | C69: 0 | D69: 0.213322 | E69: 0 | G69: of:=IF([.C69]=1;"";[.C69]) -> 0 | H69: of:=IF([.D69]=1;"";[.D69]) -> 0.213322 | I69: of:=IF([.E69]=1;"";[.E69]) -> 0
A70: 29 | B70: strncat: &"kqnpo"{\0,\x01,\x01,\x01,\x01} &"ncx"{\0,\0} 4 :=> &"kqnponcx"{\0,\0} | C70: 0 | D70: 0.0495385 | E70: 0 | G70: of:=IF([.C70]=1;"";[.C70]) -> 0 | H70: of:=IF([.D70]=1;"";[.D70]) -> 0.0495385 | I70: of:=IF([.E70]=1;"";[.E70]) -> 0
A71: 30 | B71: strncat: &"zjgjl"{\0,\x01,\x01,\x01,\x01} &"utfq"{\0} 4 :=> &"zjgjlutfq"{\0} | C71: 0 | D71: 0 | E71: 0 | G71: of:=IF([.C71]=1;"";[.C71]) -> 0 | H71: of:=IF([.D71]=1;"";[.D71]) -> 0 | I71: of:=IF([.E71]=1;"";[.E71]) -> 0
A72: 31 | B72: strncat: &"xflqzu"{\0,\x01,\x01,\x01} &""{\0,p,p,z,\0} 4 :=> &"xflqzu"{\0,p,l,\0} | C72: 0 | D72: 1 | E72: 0 | G72: of:=IF([.C72]=1;"";[.C72]) -> 0 | H72: of:=IF([.D72]=1;"";[.D72]) ->  | I72: of:=IF([.E72]=1;"";[.E72]) -> 0
A73: 32 | B73: strncat: &"dpqhlt"{\0,\x01,\x01,\x01} &"l"{\0,p,n,\0} 4 :=> &"dpqhltl"{\0,p,\0} | C73: 0 | D73: 1 | E73: 0 | G73: of:=IF([.C73]=1;"";[.C73]) -> 0 | H73: of:=IF([.D73]=1;"";[.D73]) ->  | I73: of:=IF([.E73]=1;"";[.E73]) -> 0
A74: 33 | B74: strncat: &"nfzfpi"{\0,\x01,\x01,\x01} &"dm"{\0,p,\0} 4 :=> &"nfzfpidm"{\0,\0} | C74: 0.0124217 | D74: 0.20532 | E74: 0.00865238 | G74: of:=IF([.C74]=1;"";[.C74]) -> 0.0124217 | H74: of:=IF([.D74]=1;"";[.D74]) -> 0.20532 | I74: of:=IF([.E74]=1;"";[.E74]) -> 0.00865238
A75: 34 | B75: strncat: &"jtsjbc"{\0,\x01,\x01,\x01} &"xqt"{\0,\0} 4 :=> &"jtsjbcxqt"{\0} | C75: 0.0115873 | D75: 0.0505161 | E75: 0.00445992 | G75: of:=IF([.C75]=1;"";[.C75]) -> 0.0115873 | H75: of:=IF([.D75]=1;"";[.D75]) -> 0.0505161 | I75: of:=IF([.E75]=1;"";[.E75]) -> 0.00445992
A76: 35 | B76: strncat: &"xclhbg"{\0,\x01,\x01,\x01} &&10 4 :=> &"xclhbgazie"{} | C76: 0.0163117 | D76: 0.00802718 | G76: of:=IF([.C76]=1;"";[.C76]) -> 0.0163117 | H76: of:=IF([.D76]=1;"";[.D76]) -> 0.00802718 | I76: of:=IF([.E76]=1;"";[.E76]) ->  
A77: 36 | B77: strncat: &"unpqspj"{\0,\x01,\x01} &""{\0,p,s,g,\0} 4 :=> &"unpqspj"{\0,p,\0} | C77: 0.00934256 | D77: 1 | E77: 0.00934256 | G77: of:=IF([.C77]=1;"";[.C77]) -> 0.00934256 | H77: of:=IF([.D77]=1;"";[.D77]) ->  | I77: of:=IF([.E77]=1;"";[.E77]) -> 0.00934256
A78: 37 | B78: strncat: &"qhrgnzk"{\0,\x01,\x01} &"m"{\0,p,m,\0} 4 :=> &"qhrgnzkm"{\0,\0} | C78: 0 | D78: 1 | E78: 0 | G78: of:=IF([.C78]=1;"";[.C78]) -> 0 | H78: of:=IF([.D78]=1;"";[.D78]) ->  | I78: of:=IF([.E78]=1;"";[.E78]) -> 0
A79: 38 | B79: strncat: &"nyahyxq"{\0,\x01,\x01} &"bb"{\0,p,\0} 4 :=> &"nyahyxqbb"{\0} | C79: 0.0126344 | D79: 0.202885 | E79: 0.00763003 | G79: of:=IF([.C79]=1;"";[.C79]) -> 0.0126344 | H79: of:=IF([.D79]=1;"";[.D79]) -> 0.202885 | I79: of:=IF([.E79]=1;"";[.E79]) -> 0.00763003
A80: 39 | B80: strncat: &"xmmgxkmw"{\0,\x01} &""{\0,p,n,d,\0} 4 :=> &"xmmgxkmw"{\0,\0} | C80: 0 | D80: 1 | E80: 0 | G80: of:=IF([.C80]=1;"";[.C80]) -> 0 | H80: of:=IF([.D80]=1;"";[.D80]) ->  | I80: of:=IF([.E80]=1;"";[.E80]) -> 0
A81: 40 | B81: strncat: &"xvshreok"{\0,\x01} &"m"{\0,p,m,\0} 4 :=> &"xvshreokm"{\0} | C81: 0.0117164 | D81: 1 | E81: 0.00954515 | G81: of:=IF([.C81]=1;"";[.C81]) -> 0.0117164 | H81: of:=IF([.D81]=1;"";[.D81]) ->  | I81: of:=IF([.E81]=1;"";[.E81]) -> 0.00954515
A82: 41 | B82: strncat: &"bkefkfrny"{\0} &""{\0,p,j,b,\0} 4 :=> &"bkefkfrny"{\0} | C82: 0.00920252 | D82: 1 | E82: 0.00920252 | G82: of:=IF([.C82]=1;"";[.C82]) -> 0.00920252 | H82: of:=IF([.D82]=1;"";[.D82]) ->  | I82: of:=IF([.E82]=1;"";[.E82]) -> 0.00920252

Sheet: strstr
A1: # | B1: Test Case | C1: N | G1: N1 | H1: N2 | I1: N3
A2: 1 | B2: strstr: &"w"{\0,h,u,s,\0} &"w"{\0,\0} :=> &"w"{\0,h,u,s,\0} | C2: 1 | D2: 1 | E2: 1 | G2: of:=IF([.C2]=1;"";[.C2]) ->  | H2: of:=IF([.D2]=1;"";[.D2]) ->  | I2: of:=IF([.E2]=1;"";[.E2]) ->  | K2: of:=AVERAGE([.G2:.G19]) -> 0.0586698823529412 | L2: of:=AVERAGE([.H2:.H19]) -> 0.166329666666667 | M2: of:=AVERAGE([.I2:.I19]) -> 0.0806471125 | O2: of:=AVERAGE([.K2:.M2]) -> 0.101882220506536
A3: 2 | B3: strstr: &"ov"{\0,h,e,\0} &"o"{\0,\0} :=> &"ov"{\0,h,e,\0} | C3: 0.215706 | D3: 1 | E3: 0.215706 | G3: of:=IF([.C3]=1;"";[.C3]) -> 0.215706 | H3: of:=IF([.D3]=1;"";[.D3]) ->  | I3: of:=IF([.E3]=1;"";[.E3]) -> 0.215706
A4: 3 | B4: strstr: &"qw"{\0,b,y,\0} &"w"{\0,\0} :=> &"w"{\0,b,y,\0,54} | C4: 0.106758 | D4: 1 | E4: 1 | G4: of:=IF([.C4]=1;"";[.C4]) -> 0.106758 | H4: of:=IF([.D4]=1;"";[.D4]) ->  | I4: of:=IF([.E4]=1;"";[.E4]) -> 
A5: 4 | B5: strstr: &"xje"{\0,h,\0} &"x"{\0,\0} :=> &"xje"{\0,h,\0} | C5: 0 | D5: 1 | E5: 0 | G5: of:=IF([.C5]=1;"";[.C5]) -> 0 | H5: of:=IF([.D5]=1;"";[.D5]) ->  | I5: of:=IF([.E5]=1;"";[.E5]) -> 0
A6: 5 | B6: strstr: &"azt"{\0,b,\0} &"z"{\0,\0} :=> &"zt"{\0,b,\0,54} | C6: 0.0691689 | D6: 1 | E6: 0.17374 | G6: of:=IF([.C6]=1;"";[.C6]) -> 0.0691689 | H6: of:=IF([.D6]=1;"";[.D6]) ->  | I6: of:=IF([.E6]=1;"";[.E6]) -> 0.17374
A7: 6 | B7: strstr: &"sfom"{\0,\0} &"s"{\0,\0} :=> &"sfom"{\0,\0} | C7: 0.045596 | D7: 1 | E7: 0.045596 | G7: of:=IF([.C7]=1;"";[.C7]) -> 0.045596 | H7: of:=IF([.D7]=1;"";[.D7]) ->  | I7: of:=IF([.E7]=1;"";[.E7]) -> 0.045596
A8: 7 | B8: strstr: &"bwca"{\0,\0} &"w"{\0,\0} :=> &"wca"{\0,\0,54} | C8: 0.038605 | D8: 1 | E8: 0.0768262 | G8: of:=IF([.C8]=1;"";[.C8]) -> 0.038605 | H8: of:=IF([.D8]=1;"";[.D8]) ->  | I8: of:=IF([.E8]=1;"";[.E8]) -> 0.0768262
A9: 8 | B9: strstr: &"mbphu"{\0} &"m"{\0,\0} :=> &"mbphu"{\0} | C9: 0.0257394 | D9: 1 | E9: 0.0257394 | G9: of:=IF([.C9]=1;"";[.C9]) -> 0.0257394 | H9: of:=IF([.D9]=1;"";[.D9]) ->  | I9: of:=IF([.E9]=1;"";[.E9]) -> 0.0257394
A10: 9 | B10: strstr: &"nklmg"{\0} &"k"{\0,\0} :=> &"klmg"{\0,54} | C10: 0.0247258 | D10: 1 | E10: 0.0376719 | G10: of:=IF([.C10]=1;"";[.C10]) -> 0.0247258 | H10: of:=IF([.D10]=1;"";[.D10]) ->  | I10: of:=IF([.E10]=1;"";[.E10]) -> 0.0376719
A11: 10 | B11: strstr: &"kz"{\0,d,l,\0} &"kz"{\0} :=> &"kz"{\0,d,l,\0} | C11: 0.148166 | D11: 0.148166 | E11: 0.148166 | G11: of:=IF([.C11]=1;"";[.C11]) -> 0.148166 | H11: of:=IF([.D11]=1;"";[.D11]) -> 0.148166 | I11: of:=IF([.E11]=1;"";[.E11]) -> 0.148166
A12: 11 | B12: strstr: &"nrj"{\0,d,\0} &"nr"{\0} :=> &"nrj"{\0,d,\0} | C12: 0.0698035 | D12: 0.199296 | E12: 0.0698035 | G12: of:=IF([.C12]=1;"";[.C12]) -> 0.0698035 | H12: of:=IF([.D12]=1;"";[.D12]) -> 0.199296 | I12: of:=IF([.E12]=1;"";[.E12]) -> 0.0698035
A13: 12 | B13: strstr: &"xxr"{\0,a,\0} &"xr"{\0} :=> &"xr"{\0,a,\0,54} | C13: 0.0477897 | D13: 0.127187 | E13: 0.127187 | G13: of:=IF([.C13]=1;"";[.C13]) -> 0.0477897 | H13: of:=IF([.D13]=1;"";[.D13]) -> 0.127187 | I13: of:=IF([.E13]=1;"";[.E13]) -> 0.127187
A14: 13 | B14: strstr: &"tzu"{\0,p,\0} &"zu"{\0} :=> &"zu"{\0,p,\0,54} | C14: 0.0729157 | D14: 0.189501 | E14: 0.189501 | G14: of:=IF([.C14]=1;"";[.C14]) -> 0.0729157 | H14: of:=IF([.D14]=1;"";[.D14]) -> 0.189501 | I14: of:=IF([.E14]=1;"";[.E14]) -> 0.189501
A15: 14 | B15: strstr: &"ngft"{\0,\0} &"ng"{\0} :=> &"ngft"{\0,\0} | C15: 0.0425052 | D15: 0.223271 | E15: 0.0425052 | G15: of:=IF([.C15]=1;"";[.C15]) -> 0.0425052 | H15: of:=IF([.D15]=1;"";[.D15]) -> 0.223271 | I15: of:=IF([.E15]=1;"";[.E15]) -> 0.0425052
A16: 15 | B16: strstr: &"ssxb"{\0,\0} &"sx"{\0} :=> &"sxb"{\0,\0,54} | C16: 0 | D16: 0 | E16: 0 | G16: of:=IF([.C16]=1;"";[.C16]) -> 0 | H16: of:=IF([.D16]=1;"";[.D16]) -> 0 | I16: of:=IF([.E16]=1;"";[.E16]) -> 0
A17: 16 | B17: strstr: &"rdii"{\0,\0} &"di"{\0} :=> &"dii"{\0,\0,54} | C17: 0.0434233 | D17: 0.218916 | E17: 0.0789632 | G17: of:=IF([.C17]=1;"";[.C17]) -> 0.0434233 | H17: of:=IF([.D17]=1;"";[.D17]) -> 0.218916 | I17: of:=IF([.E17]=1;"";[.E17]) -> 0.0789632
A18: 17 | B18: strstr: &"zmlgp"{\0} &"zm"{\0} :=> &"zmlgp"{\0} | C18: 0.0217206 | D18: 0.183327 | E18: 0.0217206 | G18: of:=IF([.C18]=1;"";[.C18]) -> 0.0217206 | H18: of:=IF([.D18]=1;"";[.D18]) -> 0.183327 | I18: of:=IF([.E18]=1;"";[.E18]) -> 0.0217206
A19: 18 | B19: strstr: &"ttcnw"{\0} &"tc"{\0} :=> &"tcnw"{\0,54} | C19: 0.0247649 | D19: 0.207303 | E19: 0.0372278 | G19: of:=IF([.C19]=1;"";[.C19]) -> 0.0247649 | H19: of:=IF([.D19]=1;"";[.D19]) -> 0.207303 | I19: of:=IF([.E19]=1;"";[.E19]) -> 0.0372278
A20: 19 | B20: strstr: &"wkizm"{\0} &"ki"{\0} :=> &"kizm"{\0,54} | C20: 0.0249261 | D20: 0.213322 | E20: 0.0406195 | G20: of:=IF([.C20]=1;"";[.C20]) -> 0.0249261 | H20: of:=IF([.D20]=1;"";[.D20]) -> 0.213322 | I20: of:=IF([.E20]=1;"";[.E20]) -> 0.0406195 | K20: of:=AVERAGE([.G20:.G24]) -> 0.02094866 | L20: of:=AVERAGE([.H20:.H24]) -> 0.200428 | M20: of:=AVERAGE([.I20:.I24]) -> 0.02727658 | O20: of:=AVERAGE([.K20:.M20]) -> 0.0828844133333333
A21: 1 | B21: strnstr: &"idiwd"{\0} &""{\0,p,\0} 2 :=> &"idiwd"{\0} | C21: 0.026845 | D21: 1 | E21: 0.026845 | G21: of:=IF([.C21]=1;"";[.C21]) -> 0.026845 | H21: of:=IF([.D21]=1;"";[.D21]) ->  | I21: of:=IF([.E21]=1;"";[.E21]) -> 0.026845
A22: 2 | B22: strnstr: &"hfuyc"{\0} &"h"{\0,\0} 2 :=> &"hfuyc"{\0} | C22: 0.0252763 | D22: 1 | E22: 0.0252763 | G22: of:=IF([.C22]=1;"";[.C22]) -> 0.0252763 | H22: of:=IF([.D22]=1;"";[.D22]) ->  | I22: of:=IF([.E22]=1;"";[.E22]) -> 0.0252763
A23: 3 | B23: strnstr: &"xesvi"{\0} &"e"{\0,\0} 2 :=> &"esvi"{\0,54} | C23: 0.0276959 | D23: 1 | E23: 0.0436421 | G23: of:=IF([.C23]=1;"";[.C23]) -> 0.0276959 | H23: of:=IF([.D23]=1;"";[.D23]) ->  | I23: of:=IF([.E23]=1;"";[.E23]) -> 0.0436421
A24: 4 | B24: strnstr: &"bcnxk"{\0} &"bc"{\0} 2 :=> &"bcnxk"{\0} | C24: 0 | D24: 0.187534 | E24: 0 | G24: of:=IF([.C24]=1;"";[.C24]) -> 0 | H24: of:=IF([.D24]=1;"";[.D24]) -> 0.187534 | I24: of:=IF([.E24]=1;"";[.E24]) -> 0
A25: 1 | B25: strpbrk: &"kubrb"{\0} &"aeiou"{\0} :=> &"ubrb"{\0,54} | C25: 0.0269517 | D25: 0.0299288 | E25: 0.0440997 | G25: of:=IF([.C25]=1;"";[.C25]) -> 0.0269517 | H25: of:=IF([.D25]=1;"";[.D25]) -> 0.0299288 | I25: of:=IF([.E25]=1;"";[.E25]) -> 0.0440997 | K25: of:=AVERAGE([.G25:.G34]) -> 0.01867306 | L25: of:=AVERAGE([.H25:.H34]) -> 0.0299288 | M25: of:=AVERAGE([.I25:.I34]) -> 0.02500289 | O25: of:=AVERAGE([.K25:.M25]) -> 0.0245349166666667
A26: 2 | B26: strpbrk: &"xomrv"{\0} &"aeiou"{\0} :=> &"omrv"{\0,54} | C26: 0.026249 | D26: 0.0299288 | E26: 0.0427516 | G26: of:=IF([.C26]=1;"";[.C26]) -> 0.026249 | H26: of:=IF([.D26]=1;"";[.D26]) -> 0.0299288 | I26: of:=IF([.E26]=1;"";[.E26]) -> 0.0427516
A27: 3 | B27: strpbrk: &"hirrw"{\0} &"aeiou"{\0} :=> &"irrw"{\0,54} | C27: 0.0292253 | D27: 0.0299288 | E27: 0.0444152 | G27: of:=IF([.C27]=1;"";[.C27]) -> 0.0292253 | H27: of:=IF([.D27]=1;"";[.D27]) -> 0.0299288 | I27: of:=IF([.E27]=1;"";[.E27]) -> 0.0444152
A28: 4 | B28: strpbrk: &"weutd"{\0} &"aeiou"{\0} :=> &"eutd"{\0,54} | C28: 0.0276697 | D28: 0.0299288 | E28: 0.0421275 | G28: of:=IF([.C28]=1;"";[.C28]) -> 0.0276697 | H28: of:=IF([.D28]=1;"";[.D28]) -> 0.0299288 | I28: of:=IF([.E28]=1;"";[.E28]) -> 0.0421275
A29: 5 | B29: strpbrk: &"faqov"{\0} &"aeiou"{\0} :=> &"aqov"{\0,54} | C29: 0 | D29: 0.0299288 | E29: 0 | G29: of:=IF([.C29]=1;"";[.C29]) -> 0 | H29: of:=IF([.D29]=1;"";[.D29]) -> 0.0299288 | I29: of:=IF([.E29]=1;"";[.E29]) -> 0
A30: 6 | B30: strpbrk: &"uqcth"{\0} &"aeiou"{\0} :=> &"uqcth"{\0} | C30: 0 | D30: 0.0299288 | E30: 0 | G30: of:=IF([.C30]=1;"";[.C30]) -> 0 | H30: of:=IF([.D30]=1;"";[.D30]) -> 0.0299288 | I30: of:=IF([.E30]=1;"";[.E30]) -> 0
A31: 7 | B31: strpbrk: &"ofhot"{\0} &"aeiou"{\0} :=> &"ofhot"{\0} | C31: 0.0264227 | D31: 0.0299288 | E31: 0.0264227 | G31: of:=IF([.C31]=1;"";[.C31]) -> 0.0264227 | H31: of:=IF([.D31]=1;"";[.D31]) -> 0.0299288 | I31: of:=IF([.E31]=1;"";[.E31]) -> 0.0264227
A32: 8 | B32: strpbrk: &"ilrdv"{\0} &"aeiou"{\0} :=> &"ilrdv"{\0} | C32: 0.0282793 | D32: 0.0299288 | E32: 0.0282793 | G32: of:=IF([.C32]=1;"";[.C32]) -> 0.0282793 | H32: of:=IF([.D32]=1;"";[.D32]) -> 0.0299288 | I32: of:=IF([.E32]=1;"";[.E32]) -> 0.0282793
A33: 9 | B33: strpbrk: &"eqgje"{\0} &"aeiou"{\0} :=> &"eqgje"{\0} | C33: 0 | D33: 0.0299288 | E33: 0 | G33: of:=IF([.C33]=1;"";[.C33]) -> 0 | H33: of:=IF([.D33]=1;"";[.D33]) -> 0.0299288 | I33: of:=IF([.E33]=1;"";[.E33]) -> 0
A34: 10 | B34: strpbrk: &"ahcff"{\0} &"aeiou"{\0} :=> &"ahcff"{\0} | C34: 0.0219329 | D34: 0.0299288 | E34: 0.0219329 | G34: of:=IF([.C34]=1;"";[.C34]) -> 0.0219329 | H34: of:=IF([.D34]=1;"";[.D34]) -> 0.0299288 | I34: of:=IF([.E34]=1;"";[.E34]) -> 0.0219329