Sheet: strlen
A1: strlen: &"\x01"{\0,\0,\0,\0,\0} :=> 1; | J1: # | K1: Test Case | L1: N | P1: FINAL
A2: strlen: &"\x01\x01"{\0,\0,\0,\0} :=> 2; | J2: 1 | K2: strlen: &"o"{\0,p,e,d,\0} :=> 1 | L2: 1 | N2: of:=IF([.L2]=1;"";[.L2]) ->  | P2: of:=AVERAGE([.N2:.N6]) -> 0.071304975
A3: strlen: &"\x01\x01\x01"{\0,\0,\0} :=> 3; | J3: 2 | K3: strlen: &"pq"{\0,p,h,\0} :=> 2 | L3: 0.140671 | N3: of:=IF([.L3]=1;"";[.L3]) -> 0.140671
A4: strlen: &"\x01\x01\x01\x01"{\0,\0} :=> 4; | J4: 3 | K4: strlen: &"fil"{\0,p,\0} :=> 3 | L4: 0.0879818 | N4: of:=IF([.L4]=1;"";[.L4]) -> 0.0879818
A5: strlen: &"\x01\x01\x01\x01\x01"{\0} :=> 5; | J5: 4 | K5: strlen: &"vlhw"{\0,\0} :=> 4 | L5: 0.0354686 | N5: of:=IF([.L5]=1;"";[.L5]) -> 0.0354686
A6: strnlen: &""{\0,\0,\0,\0,\0,\0} 6 :=> 0; 1; | J6: 5 | K6: strlen: &"yavmr"{\0} :=> 5 | L6: 0.0210985 | N6: of:=IF([.L6]=1;"";[.L6]) -> 0.0210985
A7: strnlen: &"\x01"{\0,\0,\0,\0,\0} 6 :=> 1; | J7: 1 | K7: strnlen: &""{\0,p,c,l,g,\0} 6 :=> 0 | L7: 1 | N7: of:=IF([.L7]=1;"";[.L7]) ->  | P7: of:=AVERAGE([.N7:.N12]) -> 0.078636675
A8: strnlen: &"\x01\x01"{\0,\0,\0,\0} 6 :=> 2; | J8: 2 | K8: strnlen: &"r"{\0,p,e,f,\0} 6 :=> 1 | L8: 1 | N8: of:=IF([.L8]=1;"";[.L8]) -> 
A9: strnlen: &"\x01\x01\x01"{\0,\0,\0} 6 :=> 3; | J9: 3 | K9: strnlen: &"vo"{\0,p,e,\0} 6 :=> 2 | L9: 0.210352 | N9: of:=IF([.L9]=1;"";[.L9]) -> 0.210352
A10: strnlen: &"\x01\x01\x01\x01"{\0,\0} 6 :=> 4; | J10: 4 | K10: strnlen: &"jup"{\0,p,\0} 6 :=> 3 | L10: 0.0832931 | N10: of:=IF([.L10]=1;"";[.L10]) -> 0.0832931
A11: strnlen: &"\x01\x01\x01\x01\x01"{\0} 6 :=> 5; | J11: 5 | K11: strnlen: &"wrvb"{\0,\0} 6 :=> 4 | L11: 0 | N11: of:=IF([.L11]=1;"";[.L11]) -> 0
J12: 6 | K12: strnlen: &"tgkyx"{\0} 6 :=> 5 | L12: 0.0209016 | N12: of:=IF([.L12]=1;"";[.L12]) -> 0.0209016

Sheet: strcmp
A1: # | B1: Test Case | C1: N1 | D1: N2 | L1: FINAL
A2: 1 | B2: strcmp: &"v"{\0,p,s,x,\0} &"v"{\0,p,v,j,\0} :=> 0 | C2: 1 | D2: 1 | F2: of:=IF([.C2]=1;"";[.C2]) ->  | G2: of:=IF([.D2]=1;"";[.D2]) ->  | H2: of:=IF([.E2]=1;"";[.E2]) ->   | I2: of:=AVERAGE([.F2:.F16]) -> 0.0328881642857143 | J2: of:=AVERAGE([.G2:.G16]) -> 0.03755635 | L2: of:=AVERAGE([.I2:.J2]) -> 0.0352222571428571
A3: 2 | B3: strcmp: &"hv"{\0,p,m,\0} &"hv"{\0,p,z,\0} :=> 0 | C3: 0.176714 | D3: 0.176714 | F3: of:=IF([.C3]=1;"";[.C3]) -> 0.176714 | G3: of:=IF([.D3]=1;"";[.D3]) -> 0.176714 | H3: of:=IF([.E3]=1;"";[.E3]) ->  
A4: 3 | B4: strcmp: &"pfw"{\0,p,\0} &"pfw"{\0,p,\0} :=> 0 | C4: 0.0646098 | D4: 0.0646098 | F4: of:=IF([.C4]=1;"";[.C4]) -> 0.0646098 | G4: of:=IF([.D4]=1;"";[.D4]) -> 0.0646098 | H4: of:=IF([.E4]=1;"";[.E4]) ->  
A5: 4 | B5: strcmp: &"ferx"{\0,\0} &"ferx"{\0,\0} :=> 0 | C5: 0.0424287 | D5: 0.0424287 | F5: of:=IF([.C5]=1;"";[.C5]) -> 0.0424287 | G5: of:=IF([.D5]=1;"";[.D5]) -> 0.0424287 | H5: of:=IF([.E5]=1;"";[.E5]) ->  
A6: 5 | B6: strcmp: &"phhrq"{\0} &"phhrq"{\0} :=> 0 | C6: 0.0245102 | D6: 0.0245102 | F6: of:=IF([.C6]=1;"";[.C6]) -> 0.0245102 | G6: of:=IF([.D6]=1;"";[.D6]) -> 0.0245102 | H6: of:=IF([.E6]=1;"";[.E6]) ->  
A7: 6 | B7: strcmp: &"fzpwf"{\0} &"fzpwd"{\0} :=> 1 | C7: 0.0178733 | D7: 0.0184876 | F7: of:=IF([.C7]=1;"";[.C7]) -> 0.0178733 | G7: of:=IF([.D7]=1;"";[.D7]) -> 0.0184876 | H7: of:=IF([.E7]=1;"";[.E7]) ->  
A8: 7 | B8: strcmp: &"qhqap"{\0} &"qhqaz"{\0} :=> -1 | C8: 0 | D8: 0 | F8: of:=IF([.C8]=1;"";[.C8]) -> 0 | G8: of:=IF([.D8]=1;"";[.D8]) -> 0 | H8: of:=IF([.E8]=1;"";[.E8]) ->  
A9: 8 | B9: strcmp: &"yrwde"{\0} &"yrwai"{\0} :=> 1 | C9: 0.0268228 | D9: 0.0283885 | F9: of:=IF([.C9]=1;"";[.C9]) -> 0.0268228 | G9: of:=IF([.D9]=1;"";[.D9]) -> 0.0283885 | H9: of:=IF([.E9]=1;"";[.E9]) ->  
A10: 9 | B10: strcmp: &"vegrr"{\0} &"vegup"{\0} :=> -1 | C10: 0.0300555 | D10: 0.0298589 | F10: of:=IF([.C10]=1;"";[.C10]) -> 0.0300555 | G10: of:=IF([.D10]=1;"";[.D10]) -> 0.0298589 | H10: of:=IF([.E10]=1;"";[.E10]) ->  
A11: 10 | B11: strcmp: &"lzzpi"{\0} &"lzbbn"{\0} :=> 1 | C11: 0.0230751 | D11: 0.0217715 | F11: of:=IF([.C11]=1;"";[.C11]) -> 0.0230751 | G11: of:=IF([.D11]=1;"";[.D11]) -> 0.0217715 | H11: of:=IF([.E11]=1;"";[.E11]) ->  
A12: 11 | B12: strcmp: &"bsagu"{\0} &"bscnn"{\0} :=> -1 | C12: 0.0294168 | D12: 0.0257934 | F12: of:=IF([.C12]=1;"";[.C12]) -> 0.0294168 | G12: of:=IF([.D12]=1;"";[.D12]) -> 0.0257934
A13: 12 | B13: strcmp: &"grwpm"{\0} &"gaohd"{\0} :=> 1 | C13: 0.0249281 | D13: 0.0260983 | F13: of:=IF([.C13]=1;"";[.C13]) -> 0.0249281 | G13: of:=IF([.D13]=1;"";[.D13]) -> 0.0260983
A14: 13 | B14: strcmp: &"pxhby"{\0} &"pydgn"{\0} :=> -1 | C14: 0 | D14: 0.0264051 | F14: of:=IF([.C14]=1;"";[.C14]) -> 0 | G14: of:=IF([.D14]=1;"";[.D14]) -> 0.0264051
A15: 14 | B15: strcmp: &"lbxjj"{\0} &"ekvjr"{\0} :=> 1 | C15: 0 | D15: 0.0130685 | F15: of:=IF([.C15]=1;"";[.C15]) -> 0 | G15: of:=IF([.D15]=1;"";[.D15]) -> 0.0130685
A16: 15 | B16: strcmp: &"liavw"{\0} &"onwij"{\0} :=> -1 | C16: 0 | D16: 0.0276544 | F16: of:=IF([.C16]=1;"";[.C16]) -> 0 | G16: of:=IF([.D16]=1;"";[.D16]) -> 0.0276544
A17: 1 | B17: strncmp: &""{\0,p,z,k,u,\0} &""{\0,p,j,h,r,\0} 5 :=> 0 | C17: 1 | D17: 1 | F17: of:=IF([.C17]=1;"";[.C17]) ->  | G17: of:=IF([.D17]=1;"";[.D17]) ->  | I17: of:=AVERAGE([.F17:.F32]) -> 0.0388340928571429 | J17: of:=AVERAGE([.G17:.G32]) -> 0.0422646785714286 | L17: of:=AVERAGE([.I17:.J17]) -> 0.0405493857142857
A18: 2 | B18: strncmp: &"w"{\0,p,k,r,\0} &"w"{\0,p,p,p,\0} 5 :=> 0 | C18: 1 | D18: 1 | F18: of:=IF([.C18]=1;"";[.C18]) ->  | G18: of:=IF([.D18]=1;"";[.D18]) -> 
A19: 3 | B19: strncmp: &"il"{\0,p,z,\0} &"il"{\0,p,f,\0} 5 :=> 0 | C19: 0.22025 | D19: 0.22025 | F19: of:=IF([.C19]=1;"";[.C19]) -> 0.22025 | G19: of:=IF([.D19]=1;"";[.D19]) -> 0.22025
A20: 4 | B20: strncmp: &"vae"{\0,p,\0} &"vae"{\0,p,\0} 5 :=> 0 | C20: 0.0812483 | D20: 0.0812483 | F20: of:=IF([.C20]=1;"";[.C20]) -> 0.0812483 | G20: of:=IF([.D20]=1;"";[.D20]) -> 0.0812483
A21: 5 | B21: strncmp: &"qick"{\0,\0} &"qick"{\0,\0} 5 :=> 0 | C21: 0.0431609 | D21: 0.0431609 | F21: of:=IF([.C21]=1;"";[.C21]) -> 0.0431609 | G21: of:=IF([.D21]=1;"";[.D21]) -> 0.0431609
A22: 6 | B22: strncmp: &"estlt"{\0} &"estlt"{\0} 5 :=> 0 | C22: 0.0307357 | D22: 0.0307357 | F22: of:=IF([.C22]=1;"";[.C22]) -> 0.0307357 | G22: of:=IF([.D22]=1;"";[.D22]) -> 0.0307357
A23: 7 | B23: strncmp: &"mojgs"{\0} &"mojgr"{\0} 5 :=> 1 | C23: 0 | D23: 0 | F23: of:=IF([.C23]=1;"";[.C23]) -> 0 | G23: of:=IF([.D23]=1;"";[.D23]) -> 0
A24: 8 | B24: strncmp: &"douhk"{\0} &"douhr"{\0} 5 :=> -1 | C24: 0.0254243 | D24: 0.0276373 | F24: of:=IF([.C24]=1;"";[.C24]) -> 0.0254243 | G24: of:=IF([.D24]=1;"";[.D24]) -> 0.0276373
A25: 9 | B25: strncmp: &"vybym"{\0} &"vybfb"{\0} 5 :=> 1 | C25: 0.0264508 | D25: 0.0202425 | F25: of:=IF([.C25]=1;"";[.C25]) -> 0.0264508 | G25: of:=IF([.D25]=1;"";[.D25]) -> 0.0202425
A26: 10 | B26: strncmp: &"nosgs"{\0} &"noszq"{\0} 5 :=> -1 | C26: 0.0276663 | D26: 0.022986 | F26: of:=IF([.C26]=1;"";[.C26]) -> 0.0276663 | G26: of:=IF([.D26]=1;"";[.D26]) -> 0.022986
A27: 11 | B27: strncmp: &"gkzvv"{\0} &"gkeik"{\0} 5 :=> 1 | C27: 0.0165856 | D27: 0.0260866 | F27: of:=IF([.C27]=1;"";[.C27]) -> 0.0165856 | G27: of:=IF([.D27]=1;"";[.D27]) -> 0.0260866
A28: 12 | B28: strncmp: &"wuexa"{\0} &"wunhg"{\0} 5 :=> -1 | C28: 0.0253847 | D28: 0.0229835 | F28: of:=IF([.C28]=1;"";[.C28]) -> 0.0253847 | G28: of:=IF([.D28]=1;"";[.D28]) -> 0.0229835
A29: 13 | B29: strncmp: &"dzcbb"{\0} &"dbjsv"{\0} 5 :=> 1 | C29: 0.0189151 | D29: 0.0195972 | F29: of:=IF([.C29]=1;"";[.C29]) -> 0.0189151 | G29: of:=IF([.D29]=1;"";[.D29]) -> 0.0195972
A30: 14 | B30: strncmp: &"svwxr"{\0} &"swcln"{\0} 5 :=> -1 | C30: 0 | D30: 0.0249653 | F30: of:=IF([.C30]=1;"";[.C30]) -> 0 | G30: of:=IF([.D30]=1;"";[.D30]) -> 0.0249653
A31: 15 | B31: strncmp: &"ijgqb"{\0} &"beyff"{\0} 5 :=> 1 | C31: 0 | D31: 0.0277715 | F31: of:=IF([.C31]=1;"";[.C31]) -> 0 | G31: of:=IF([.D31]=1;"";[.D31]) -> 0.0277715
A32: 16 | B32: strncmp: &"osflf"{\0} &"sllmz"{\0} 5 :=> -1 | C32: 0.0278556 | D32: 0.0240407 | F32: of:=IF([.C32]=1;"";[.C32]) -> 0.0278556 | G32: of:=IF([.D32]=1;"";[.D32]) -> 0.0240407
A33: 1 | B33: sysfs_streq: &""{\0,p,o,s,v,\0} &"dgenw"{\0} :=> \0 | C33: 1 | D33: 0.0288793 | F33: of:=IF([.C33]=1;"";[.C33]) ->  | G33: of:=IF([.D33]=1;"";[.D33]) -> 0.0288793 | I33: of:=AVERAGE([.F33:.F71]) -> 0.0572673965517241 | J33: of:=AVERAGE([.G33:.G71]) -> 0.0384478142857143 | L33: of:=AVERAGE([.I33:.J33]) -> 0.0478576054187192
A34: 2 | B34: sysfs_streq: &""{\0,p,p,r,h,\0} &"\n"{\0,b,z,e,\0} :=> \x01 | C34: 1 | F34: of:=IF([.C34]=1;"";[.C34]) ->  | G34: of:=IF([.D34]=1;"";[.D34]) ->  
A35: 3 | B35: sysfs_streq: &""{\0,p,x,e,x,\0} &"\naxse"{\0} :=> \0 | C35: 1 | F35: of:=IF([.C35]=1;"";[.C35]) ->  | G35: of:=IF([.D35]=1;"";[.D35]) ->  
A36: 4 | B36: sysfs_streq: &""{\0,p,s,y,g,\0} &""{\0,h,j,i,g,\0} :=> \x01 | C36: 1 | D36: 1 | F36: of:=IF([.C36]=1;"";[.C36]) ->  | G36: of:=IF([.D36]=1;"";[.D36]) -> 
A37: 5 | B37: sysfs_streq: &"igpop"{\0} &"hkvrh"{\0} :=> \0 | C37: 0.0271903 | D37: 0.0216275 | F37: of:=IF([.C37]=1;"";[.C37]) -> 0.0271903 | G37: of:=IF([.D37]=1;"";[.D37]) -> 0.0216275
A38: 6 | B38: sysfs_streq: &"\n"{\0,p,g,e,\0} &""{\0,a,n,t,l,\0} :=> \x01 | C38: 1 | F38: of:=IF([.C38]=1;"";[.C38]) ->  | G38: of:=IF([.D38]=1;"";[.D38]) ->  
A39: 7 | B39: sysfs_streq: &"\n"{\0,a,m,x,\0} &"cuxso"{\0} :=> \0 | C39: 0.0248227 | F39: of:=IF([.C39]=1;"";[.C39]) -> 0.0248227 | G39: of:=IF([.D39]=1;"";[.D39]) ->  
A40: 8 | B40: sysfs_streq: &"\naxct"{\0} &"zsbuw"{\0} :=> \0 | C40: 0.0234541 | F40: of:=IF([.C40]=1;"";[.C40]) -> 0.0234541 | G40: of:=IF([.D40]=1;"";[.D40]) ->  
A41: 9 | B41: sysfs_streq: &"t"{\0,p,o,y,\0} &"tbasl"{\0} :=> \0 | C41: 1 | D41: 0.0287714 | F41: of:=IF([.C41]=1;"";[.C41]) ->  | G41: of:=IF([.D41]=1;"";[.D41]) -> 0.0287714
A42: 10 | B42: sysfs_streq: &"e"{\0,p,r,m,\0} &"e\n"{\0,a,g,\0} :=> \x01 | C42: 1 | F42: of:=IF([.C42]=1;"";[.C42]) ->  | G42: of:=IF([.D42]=1;"";[.D42]) ->  
A43: 11 | B43: sysfs_streq: &"z"{\0,p,n,j,\0} &"z\nawp"{\0} :=> \0 | C43: 1 | F43: of:=IF([.C43]=1;"";[.C43]) ->  | G43: of:=IF([.D43]=1;"";[.D43]) ->  
A44: 12 | B44: sysfs_streq: &"k"{\0,p,h,g,\0} &"k"{\0,h,f,y,\0} :=> \x01 | C44: 1 | D44: 1 | F44: of:=IF([.C44]=1;"";[.C44]) ->  | G44: of:=IF([.D44]=1;"";[.D44]) -> 
A45: 13 | B45: sysfs_streq: &"obygv"{\0} &"otvvc"{\0} :=> \0 | C45: 0.0223994 | D45: 0.0224252 | F45: of:=IF([.C45]=1;"";[.C45]) -> 0.0223994 | G45: of:=IF([.D45]=1;"";[.D45]) -> 0.0224252
A46: 14 | B46: sysfs_streq: &"o\n"{\0,b,i,\0} &"o"{\0,b,j,b,\0} :=> \x01 | C46: 1 | F46: of:=IF([.C46]=1;"";[.C46]) ->  | G46: of:=IF([.D46]=1;"";[.D46]) ->  
A47: 15 | B47: sysfs_streq: &"n\n"{\0,b,x,\0} &"nwswk"{\0} :=> \0 | C47: 0.0253591 | F47: of:=IF([.C47]=1;"";[.C47]) -> 0.0253591 | G47: of:=IF([.D47]=1;"";[.D47]) ->  
A48: 16 | B48: sysfs_streq: &"o\nayu"{\0} &"osjbr"{\0} :=> \0 | C48: 0.0194714 | F48: of:=IF([.C48]=1;"";[.C48]) -> 0.0194714 | G48: of:=IF([.D48]=1;"";[.D48]) ->  
A49: 17 | B49: sysfs_streq: &"es"{\0,p,f,\0} &"eswup"{\0} :=> \0 | C49: 0.224112 | D49: 0.0260267 | F49: of:=IF([.C49]=1;"";[.C49]) -> 0.224112 | G49: of:=IF([.D49]=1;"";[.D49]) -> 0.0260267
A50: 18 | B50: sysfs_streq: &"fv"{\0,p,y,\0} &"fv\n"{\0,a,\0} :=> \x01 | C50: 0.163651 | F50: of:=IF([.C50]=1;"";[.C50]) -> 0.163651 | G50: of:=IF([.D50]=1;"";[.D50]) ->  
A51: 19 | B51: sysfs_streq: &"tb"{\0,p,y,\0} &"tb\nag"{\0} :=> \0 | C51: 0.199593 | F51: of:=IF([.C51]=1;"";[.C51]) -> 0.199593 | G51: of:=IF([.D51]=1;"";[.D51]) ->  
A52: 20 | B52: sysfs_streq: &"hj"{\0,p,h,\0} &"hj"{\0,b,h,\0} :=> \x01 | C52: 0.160216 | D52: 0.160216 | F52: of:=IF([.C52]=1;"";[.C52]) -> 0.160216 | G52: of:=IF([.D52]=1;"";[.D52]) -> 0.160216
A53: 21 | B53: sysfs_streq: &"ofzug"{\0} &"ofece"{\0} :=> \0 | C53: 0.022775 | D53: 0.0313213 | F53: of:=IF([.C53]=1;"";[.C53]) -> 0.022775 | G53: of:=IF([.D53]=1;"";[.D53]) -> 0.0313213
A54: 22 | B54: sysfs_streq: &"kc\n"{\0,b,\0} &"kc"{\0,b,g,\0} :=> \x01 | C54: 0.171077 | F54: of:=IF([.C54]=1;"";[.C54]) -> 0.171077 | G54: of:=IF([.D54]=1;"";[.D54]) ->  
A55: 23 | B55: sysfs_streq: &"pg\n"{\0,b,\0} &"pghom"{\0} :=> \0 | C55: 0.0291559 | F55: of:=IF([.C55]=1;"";[.C55]) -> 0.0291559 | G55: of:=IF([.D55]=1;"";[.D55]) ->  
A56: 24 | B56: sysfs_streq: &"op\nal"{\0} &"opkoz"{\0} :=> \0 | C56: 0.0253054 | F56: of:=IF([.C56]=1;"";[.C56]) -> 0.0253054 | G56: of:=IF([.D56]=1;"";[.D56]) ->  
A57: 25 | B57: sysfs_streq: &"sea"{\0,p,\0} &"seasw"{\0} :=> \0 | C57: 0.0898383 | D57: 0.0305209 | F57: of:=IF([.C57]=1;"";[.C57]) -> 0.0898383 | G57: of:=IF([.D57]=1;"";[.D57]) -> 0.0305209
A58: 26 | B58: sysfs_streq: &"ifj"{\0,p,\0} &"ifj\n"{\0,\0} :=> \x01 | C58: 0.0698609 | F58: of:=IF([.C58]=1;"";[.C58]) -> 0.0698609 | G58: of:=IF([.D58]=1;"";[.D58]) ->  
A59: 27 | B59: sysfs_streq: &"vvm"{\0,p,\0} &"vvm\na"{\0} :=> \0 | C59: 0.0526138 | F59: of:=IF([.C59]=1;"";[.C59]) -> 0.0526138 | G59: of:=IF([.D59]=1;"";[.D59]) ->  
A60: 28 | B60: sysfs_streq: &"sap"{\0,p,\0} &"sap"{\0,h,\0} :=> \x01 | C60: 0.0866641 | D60: 0.0866641 | F60: of:=IF([.C60]=1;"";[.C60]) -> 0.0866641 | G60: of:=IF([.D60]=1;"";[.D60]) -> 0.0866641
A61: 29 | B61: sysfs_streq: &"rrvqy"{\0} &"rrvka"{\0} :=> \0 | C61: 0 | D61: 0.0243381 | F61: of:=IF([.C61]=1;"";[.C61]) -> 0 | G61: of:=IF([.D61]=1;"";[.D61]) -> 0.0243381
A62: 30 | B62: sysfs_streq: &"cvf\n"{\0,\0} &"cvf"{\0,a,\0} :=> \x01 | C62: 0 | F62: of:=IF([.C62]=1;"";[.C62]) -> 0 | G62: of:=IF([.D62]=1;"";[.D62]) ->  
A63: 31 | B63: sysfs_streq: &"jyr\n"{\0,\0} &"jyrsd"{\0} :=> \0 | C63: 0.0209671 | F63: of:=IF([.C63]=1;"";[.C63]) -> 0.0209671 | G63: of:=IF([.D63]=1;"";[.D63]) ->  
A64: 32 | B64: sysfs_streq: &"bgd\na"{\0} &"bgdpw"{\0} :=> \0 | C64: 0.019533 | F64: of:=IF([.C64]=1;"";[.C64]) -> 0.019533 | G64: of:=IF([.D64]=1;"";[.D64]) ->  
A65: 33 | B65: sysfs_streq: &"ryhr"{\0,\0} &"ryhrh"{\0} :=> \0 | C65: 0.0416029 | D65: 0.0262634 | F65: of:=IF([.C65]=1;"";[.C65]) -> 0.0416029 | G65: of:=IF([.D65]=1;"";[.D65]) -> 0.0262634
A66: 34 | B66: sysfs_streq: &"proy"{\0,\0} &"proy\n"{\0} :=> \x01 | C66: 0.046617 | F66: of:=IF([.C66]=1;"";[.C66]) -> 0.046617 | G66: of:=IF([.D66]=1;"";[.D66]) ->  
A67: 35 | B67: sysfs_streq: &"zqfl"{\0,\0} &"zqfl"{\0,\0} :=> \x01 | C67: 0.022947 | D67: 0.022947 | F67: of:=IF([.C67]=1;"";[.C67]) -> 0.022947 | G67: of:=IF([.D67]=1;"";[.D67]) -> 0.022947
A68: 36 | B68: sysfs_streq: &"yhbxn"{\0} &"yhbxz"{\0} :=> \0 | C68: 0 | D68: 0 | F68: of:=IF([.C68]=1;"";[.C68]) -> 0 | G68: of:=IF([.D68]=1;"";[.D68]) -> 0
A69: 37 | B69: sysfs_streq: &"saak\n"{\0} &"saak"{\0,\0} :=> \x01 | C69: 0.0432596 | F69: of:=IF([.C69]=1;"";[.C69]) -> 0.0432596 | G69: of:=IF([.D69]=1;"";[.D69]) ->  
A70: 38 | B70: sysfs_streq: &"njqf\n"{\0} &"njqfg"{\0} :=> \0 | C70: 0 | F70: of:=IF([.C70]=1;"";[.C70]) -> 0 | G70: of:=IF([.D70]=1;"";[.D70]) ->  
A71: 39 | B71: sysfs_streq: &"orlnf"{\0} &"orlnf"{\0} :=> \x01 | C71: 0.0282685 | D71: 0.0282685 | F71: of:=IF([.C71]=1;"";[.C71]) -> 0.0282685 | G71: of:=IF([.D71]=1;"";[.D71]) -> 0.0282685

Sheet: strcpy
A1: # | B1: Test Case | C1: N1 | D1: N2 | E1: N3 | O1: FINAL
A2: 1 | B2: strcpy: &""{\0,\x01,\x01,\x01,\x01,\x01} &"d"{\0,p,x,p,\0} :=> &"d"{\0,p,p,z,\0} | C2: 1 | D2: 1 | E2: 1 | G2: of:=IF([.C2]=1;"";[.C2]) ->  | H2: of:=IF([.D2]=1;"";[.D2]) ->  | I2: of:=IF([.E2]=1;"";[.E2]) ->  | K2: of:=AVERAGE([.G2:.G36]) -> 0.0782191166666667 | L2: of:=AVERAGE([.H2:.H36]) -> 0.081575575 | M2: of:=AVERAGE([.I2:.I36]) -> 0.081575575 | O2: of:=AVERAGE([.K2:.M2]) -> 0.0804567555555555
A3: 2 | B3: strcpy: &""{\0,\x01,\x01,\x01,\x01,\x01} &"dh"{\0,p,c,\0} :=> &"dh"{\0,p,x,\0} | C3: 1 | D3: 0.194167 | E3: 0.194167 | G3: of:=IF([.C3]=1;"";[.C3]) ->  | H3: of:=IF([.D3]=1;"";[.D3]) -> 0.194167 | I3: of:=IF([.E3]=1;"";[.E3]) -> 0.194167
A4: 3 | B4: strcpy: &""{\0,\x01,\x01,\x01,\x01,\x01} &"cna"{\0,p,\0} :=> &"cna"{\0,p,\0} | C4: 1 | D4: 0.0730763 | E4: 0.0730763 | G4: of:=IF([.C4]=1;"";[.C4]) ->  | H4: of:=IF([.D4]=1;"";[.D4]) -> 0.0730763 | I4: of:=IF([.E4]=1;"";[.E4]) -> 0.0730763
A5: 4 | B5: strcpy: &""{\0,\x01,\x01,\x01,\x01,\x01} &"cfly"{\0,\0} :=> &"cfly"{\0,\0} | C5: 1 | D5: 0.0367069 | E5: 0.0367069 | G5: of:=IF([.C5]=1;"";[.C5]) ->  | H5: of:=IF([.D5]=1;"";[.D5]) -> 0.0367069 | I5: of:=IF([.E5]=1;"";[.E5]) -> 0.0367069
A6: 5 | B6: strcpy: &""{\0,\x01,\x01,\x01,\x01,\x01} &"zrmff"{\0} :=> &"zrmff"{\0} | C6: 1 | D6: 0.0248077 | E6: 0.0248077 | G6: of:=IF([.C6]=1;"";[.C6]) ->  | H6: of:=IF([.D6]=1;"";[.D6]) -> 0.0248077 | I6: of:=IF([.E6]=1;"";[.E6]) -> 0.0248077
A7: 6 | B7: strcpy: &"r"{\0,\x01,\x01,\x01,\x01} &""{\0,p,q,s,i,\0} :=> &""{\0,\0,p,j,n,\0} | C7: 1 | D7: 1 | E7: 1 | G7: of:=IF([.C7]=1;"";[.C7]) ->  | H7: of:=IF([.D7]=1;"";[.D7]) ->  | I7: of:=IF([.E7]=1;"";[.E7]) -> 
A8: 7 | B8: strcpy: &"g"{\0,\x01,\x01,\x01,\x01} &"n"{\0,p,k,s,\0} :=> &"n"{\0,p,l,r,\0} | C8: 1 | D8: 1 | E8: 1 | G8: of:=IF([.C8]=1;"";[.C8]) ->  | H8: of:=IF([.D8]=1;"";[.D8]) ->  | I8: of:=IF([.E8]=1;"";[.E8]) -> 
A9: 8 | B9: strcpy: &"n"{\0,\x01,\x01,\x01,\x01} &"hr"{\0,p,q,\0} :=> &"hr"{\0,p,m,\0} | C9: 1 | D9: 0.211356 | E9: 0.211356 | G9: of:=IF([.C9]=1;"";[.C9]) ->  | H9: of:=IF([.D9]=1;"";[.D9]) -> 0.211356 | I9: of:=IF([.E9]=1;"";[.E9]) -> 0.211356
A10: 9 | B10: strcpy: &"g"{\0,\x01,\x01,\x01,\x01} &"oad"{\0,p,\0} :=> &"oad"{\0,p,\0} | C10: 1 | D10: 0.0852504 | E10: 0.0852504 | G10: of:=IF([.C10]=1;"";[.C10]) ->  | H10: of:=IF([.D10]=1;"";[.D10]) -> 0.0852504 | I10: of:=IF([.E10]=1;"";[.E10]) -> 0.0852504
A11: 10 | B11: strcpy: &"h"{\0,\x01,\x01,\x01,\x01} &"jkec"{\0,\0} :=> &"jkec"{\0,\0} | C11: 1 | D11: 0.0393311 | E11: 0.0393311 | G11: of:=IF([.C11]=1;"";[.C11]) ->  | H11: of:=IF([.D11]=1;"";[.D11]) -> 0.0393311 | I11: of:=IF([.E11]=1;"";[.E11]) -> 0.0393311
A12: 11 | B12: strcpy: &"y"{\0,\x01,\x01,\x01,\x01} &"krjth"{\0} :=> &"krjth"{\0} | C12: 1 | D12: 0.0213897 | E12: 0.0213897 | G12: of:=IF([.C12]=1;"";[.C12]) ->  | H12: of:=IF([.D12]=1;"";[.D12]) -> 0.0213897 | I12: of:=IF([.E12]=1;"";[.E12]) -> 0.0213897
A13: 12 | B13: strcpy: &"xv"{\0,\x01,\x01,\x01} &""{\0,p,w,i,n,\0} :=> &""{\0,v,\0,p,u,\0} | C13: 0.171731 | D13: 1 | E13: 1 | G13: of:=IF([.C13]=1;"";[.C13]) -> 0.171731 | H13: of:=IF([.D13]=1;"";[.D13]) ->  | I13: of:=IF([.E13]=1;"";[.E13]) -> 
A14: 13 | B14: strcpy: &"aw"{\0,\x01,\x01,\x01} &"n"{\0,p,k,j,\0} :=> &"n"{\0,\0,p,p,\0} | C14: 0.210856 | D14: 1 | E14: 1 | G14: of:=IF([.C14]=1;"";[.C14]) -> 0.210856 | H14: of:=IF([.D14]=1;"";[.D14]) ->  | I14: of:=IF([.E14]=1;"";[.E14]) -> 
A15: 14 | B15: strcpy: &"mm"{\0,\x01,\x01,\x01} &"gj"{\0,p,h,\0} :=> &"gj"{\0,p,k,\0} | C15: 0.212346 | D15: 0.155302 | E15: 0.155302 | G15: of:=IF([.C15]=1;"";[.C15]) -> 0.212346 | H15: of:=IF([.D15]=1;"";[.D15]) -> 0.155302 | I15: of:=IF([.E15]=1;"";[.E15]) -> 0.155302
A16: 15 | B16: strcpy: &"cf"{\0,\x01,\x01,\x01} &"lae"{\0,p,\0} :=> &"lae"{\0,p,\0} | C16: 0.154159 | D16: 0.0836588 | E16: 0.0836588 | G16: of:=IF([.C16]=1;"";[.C16]) -> 0.154159 | H16: of:=IF([.D16]=1;"";[.D16]) -> 0.0836588 | I16: of:=IF([.E16]=1;"";[.E16]) -> 0.0836588
A17: 16 | B17: strcpy: &"ez"{\0,\x01,\x01,\x01} &"vjav"{\0,\0} :=> &"vjav"{\0,\0} | C17: 0.199593 | D17: 0.0277333 | E17: 0.0277333 | G17: of:=IF([.C17]=1;"";[.C17]) -> 0.199593 | H17: of:=IF([.D17]=1;"";[.D17]) -> 0.0277333 | I17: of:=IF([.E17]=1;"";[.E17]) -> 0.0277333
A18: 17 | B18: strcpy: &"da"{\0,\x01,\x01,\x01} &"xbtcf"{\0} :=> &"xbtcf"{\0} | C18: 0.216174 | D18: 0.019794 | E18: 0.019794 | G18: of:=IF([.C18]=1;"";[.C18]) -> 0.216174 | H18: of:=IF([.D18]=1;"";[.D18]) -> 0.019794 | I18: of:=IF([.E18]=1;"";[.E18]) -> 0.019794
A19: 18 | B19: strcpy: &"knm"{\0,\x01,\x01} &""{\0,p,r,j,x,\0} :=> &""{\0,n,m,\0,p,\0} | C19: 0.080627 | D19: 1 | E19: 1 | G19: of:=IF([.C19]=1;"";[.C19]) -> 0.080627 | H19: of:=IF([.D19]=1;"";[.D19]) ->  | I19: of:=IF([.E19]=1;"";[.E19]) -> 
A20: 19 | B20: strcpy: &"tin"{\0,\x01,\x01} &"v"{\0,p,w,b,\0} :=> &"v"{\0,n,\0,p,\0} | C20: 0.0918844 | D20: 1 | E20: 1 | G20: of:=IF([.C20]=1;"";[.C20]) -> 0.0918844 | H20: of:=IF([.D20]=1;"";[.D20]) ->  | I20: of:=IF([.E20]=1;"";[.E20]) -> 
A21: 20 | B21: strcpy: &"goz"{\0,\x01,\x01} &"kk"{\0,p,f,\0} :=> &"kk"{\0,\0,p,\0} | C21: 0.0797986 | D21: 0.186454 | E21: 0.186454 | G21: of:=IF([.C21]=1;"";[.C21]) -> 0.0797986 | H21: of:=IF([.D21]=1;"";[.D21]) -> 0.186454 | I21: of:=IF([.E21]=1;"";[.E21]) -> 0.186454
A22: 21 | B22: strcpy: &"dcs"{\0,\x01,\x01} &"hsq"{\0,p,\0} :=> &"hsq"{\0,p,\0} | C22: 0.0763497 | D22: 0.0771037 | E22: 0.0771037 | G22: of:=IF([.C22]=1;"";[.C22]) -> 0.0763497 | H22: of:=IF([.D22]=1;"";[.D22]) -> 0.0771037 | I22: of:=IF([.E22]=1;"";[.E22]) -> 0.0771037
A23: 22 | B23: strcpy: &"coe"{\0,\x01,\x01} &"iqby"{\0,\0} :=> &"iqby"{\0,\0} | C23: 0.0850679 | D23: 0.032598 | E23: 0.032598 | G23: of:=IF([.C23]=1;"";[.C23]) -> 0.0850679 | H23: of:=IF([.D23]=1;"";[.D23]) -> 0.032598 | I23: of:=IF([.E23]=1;"";[.E23]) -> 0.032598
A24: 23 | B24: strcpy: &"lig"{\0,\x01,\x01} &"gfhmn"{\0} :=> &"gfhmn"{\0} | C24: 0.088251 | D24: 0.021214 | E24: 0.021214 | G24: of:=IF([.C24]=1;"";[.C24]) -> 0.088251 | H24: of:=IF([.D24]=1;"";[.D24]) -> 0.021214 | I24: of:=IF([.E24]=1;"";[.E24]) -> 0.021214
A25: 24 | B25: strcpy: &"duqc"{\0,\x01} &""{\0,p,u,r,n,\0} :=> &""{\0,u,q,c,\0,\0} | C25: 0 | D25: 1 | E25: 1 | G25: of:=IF([.C25]=1;"";[.C25]) -> 0 | H25: of:=IF([.D25]=1;"";[.D25]) ->  | I25: of:=IF([.E25]=1;"";[.E25]) -> 
A26: 25 | B26: strcpy: &"vxdb"{\0,\x01} &"y"{\0,p,n,w,\0} :=> &"y"{\0,d,b,\0,\0} | C26: 0 | D26: 1 | E26: 1 | G26: of:=IF([.C26]=1;"";[.C26]) -> 0 | H26: of:=IF([.D26]=1;"";[.D26]) ->  | I26: of:=IF([.E26]=1;"";[.E26]) -> 
A27: 26 | B27: strcpy: &"ehqf"{\0,\x01} &"tz"{\0,p,l,\0} :=> &"tz"{\0,f,\0,\0} | C27: 0.0245815 | D27: 0.199947 | E27: 0.199947 | G27: of:=IF([.C27]=1;"";[.C27]) -> 0.0245815 | H27: of:=IF([.D27]=1;"";[.D27]) -> 0.199947 | I27: of:=IF([.E27]=1;"";[.E27]) -> 0.199947
A28: 27 | B28: strcpy: &"fhjf"{\0,\x01} &"ttx"{\0,p,\0} :=> &"ttx"{\0,\0,\0} | C28: 0.0236909 | D28: 0.0648096 | E28: 0.0648096 | G28: of:=IF([.C28]=1;"";[.C28]) -> 0.0236909 | H28: of:=IF([.D28]=1;"";[.D28]) -> 0.0648096 | I28: of:=IF([.E28]=1;"";[.E28]) -> 0.0648096
A29: 28 | B29: strcpy: &"hzxd"{\0,\x01} &"awrx"{\0,\0} :=> &"awrx"{\0,\0} | C29: 0 | D29: 0.0392423 | E29: 0.0392423 | G29: of:=IF([.C29]=1;"";[.C29]) -> 0 | H29: of:=IF([.D29]=1;"";[.D29]) -> 0.0392423 | I29: of:=IF([.E29]=1;"";[.E29]) -> 0.0392423
A30: 29 | B30: strcpy: &"dpcz"{\0,\x01} &"rgsyj"{\0} :=> &"rgsyj"{\0} | C30: 0.0332751 | D30: 0.02377 | E30: 0.02377 | G30: of:=IF([.C30]=1;"";[.C30]) -> 0.0332751 | H30: of:=IF([.D30]=1;"";[.D30]) -> 0.02377 | I30: of:=IF([.E30]=1;"";[.E30]) -> 0.02377
A31: 30 | B31: strcpy: &"fkoks"{\0} &""{\0,p,b,h,r,\0} :=> &""{\0,k,o,k,s,\0} | C31: 0.0251587 | D31: 1 | E31: 1 | G31: of:=IF([.C31]=1;"";[.C31]) -> 0.0251587 | H31: of:=IF([.D31]=1;"";[.D31]) ->  | I31: of:=IF([.E31]=1;"";[.E31]) -> 
A32: 31 | B32: strcpy: &"akdil"{\0} &"q"{\0,p,d,v,\0} :=> &"q"{\0,d,i,l,\0} | C32: 0.0281453 | D32: 1 | E32: 1 | G32: of:=IF([.C32]=1;"";[.C32]) -> 0.0281453 | H32: of:=IF([.D32]=1;"";[.D32]) ->  | I32: of:=IF([.E32]=1;"";[.E32]) -> 
A33: 32 | B33: strcpy: &"wzikk"{\0} &"ik"{\0,p,z,\0} :=> &"ik"{\0,k,k,\0} | C33: 0.0207345 | D33: 0.210352 | E33: 0.210352 | G33: of:=IF([.C33]=1;"";[.C33]) -> 0.0207345 | H33: of:=IF([.D33]=1;"";[.D33]) -> 0.210352 | I33: of:=IF([.E33]=1;"";[.E33]) -> 0.210352
A34: 33 | B34: strcpy: &"rllkp"{\0} &"mkt"{\0,p,\0} :=> &"mkt"{\0,p,\0} | C34: 0.0269608 | D34: 0.0638252 | E34: 0.0638252 | G34: of:=IF([.C34]=1;"";[.C34]) -> 0.0269608 | H34: of:=IF([.D34]=1;"";[.D34]) -> 0.0638252 | I34: of:=IF([.E34]=1;"";[.E34]) -> 0.0638252
A35: 34 | B35: strcpy: &"katve"{\0} &"cntd"{\0,\0} :=> &"cntd"{\0,\0} | C35: 0.0278744 | D35: 0.0382566 | E35: 0.0382566 | G35: of:=IF([.C35]=1;"";[.C35]) -> 0.0278744 | H35: of:=IF([.D35]=1;"";[.D35]) -> 0.0382566 | I35: of:=IF([.E35]=1;"";[.E35]) -> 0.0382566
A36: 35 | B36: strcpy: &"eoqha"{\0} &"zsill"{\0} :=> &"zsill"{\0} | C36: 0 | D36: 0.0276682 | E36: 0.0276682 | G36: of:=IF([.C36]=1;"";[.C36]) -> 0 | H36: of:=IF([.D36]=1;"";[.D36]) -> 0.0276682 | I36: of:=IF([.E36]=1;"";[.E36]) -> 0.0276682
A37: 1 | B37: strncpy: &""{\0,\x01,\x01,\x01,\x01,\x01} &""{\0,p,b,p,k,\0} 5 :=> &""{\0,\0,\0,\0,\0,\0} | C37: 1 | D37: 1 | E37: 1 | G37: of:=IF([.C37]=1;"";[.C37]) ->  | H37: of:=IF([.D37]=1;"";[.D37]) ->  | I37: of:=IF([.E37]=1;"";[.E37]) ->  | K37: of:=AVERAGE([.G37:.G72]) -> 0.0825220416666667 | L37: of:=AVERAGE([.H37:.H72]) -> 0.0634550583333333 | M37: of:=AVERAGE([.I37:.I72]) -> 0.0634550583333333 | O37: of:=AVERAGE([.K37:.M37]) -> 0.0698107194444444
A38: 2 | B38: strncpy: &""{\0,\x01,\x01,\x01,\x01,\x01} &"w"{\0,p,i,p,\0} 5 :=> &"w"{\0,\0,\0,\0,\0} | C38: 1 | D38: 1 | E38: 1 | G38: of:=IF([.C38]=1;"";[.C38]) ->  | H38: of:=IF([.D38]=1;"";[.D38]) ->  | I38: of:=IF([.E38]=1;"";[.E38]) -> 
A39: 3 | B39: strncpy: &""{\0,\x01,\x01,\x01,\x01,\x01} &"jy"{\0,p,m,\0} 5 :=> &"jy"{\0,\0,\0,\0} | C39: 1 | D39: 0.127187 | E39: 0.127187 | G39: of:=IF([.C39]=1;"";[.C39]) ->  | H39: of:=IF([.D39]=1;"";[.D39]) -> 0.127187 | I39: of:=IF([.E39]=1;"";[.E39]) -> 0.127187
A40: 4 | B40: strncpy: &""{\0,\x01,\x01,\x01,\x01,\x01} &"nim"{\0,p,\0} 5 :=> &"nim"{\0,\0,\0} | C40: 1 | D40: 0.0872639 | E40: 0.0872639 | G40: of:=IF([.C40]=1;"";[.C40]) ->  | H40: of:=IF([.D40]=1;"";[.D40]) -> 0.0872639 | I40: of:=IF([.E40]=1;"";[.E40]) -> 0.0872639
A41: 5 | B41: strncpy: &""{\0,\x01,\x01,\x01,\x01,\x01} &"yhdw"{\0,\0} 5 :=> &"yhdw"{\0,\0} | C41: 1 | D41: 0.0377327 | E41: 0.0377327 | G41: of:=IF([.C41]=1;"";[.C41]) ->  | H41: of:=IF([.D41]=1;"";[.D41]) -> 0.0377327 | I41: of:=IF([.E41]=1;"";[.E41]) -> 0.0377327
A42: 6 | B42: strncpy: &""{\0,\x01,\x01,\x01,\x01,\x01} &"mjkwu"{\0} 5 :=> &"mjkwu"{\0} | C42: 1 | D42: 0.0177536 | E42: 0.0177536 | G42: of:=IF([.C42]=1;"";[.C42]) ->  | H42: of:=IF([.D42]=1;"";[.D42]) -> 0.0177536 | I42: of:=IF([.E42]=1;"";[.E42]) -> 0.0177536
A43: 7 | B43: strncpy: &"g"{\0,\x01,\x01,\x01,\x01} &""{\0,p,y,t,i,\0} 5 :=> &""{\0,\0,\0,\0,\0,\0} | C43: 1 | D43: 1 | E43: 1 | G43: of:=IF([.C43]=1;"";[.C43]) ->  | H43: of:=IF([.D43]=1;"";[.D43]) ->  | I43: of:=IF([.E43]=1;"";[.E43]) -> 
A44: 8 | B44: strncpy: &"n"{\0,\x01,\x01,\x01,\x01} &"v"{\0,p,a,c,\0} 5 :=> &"v"{\0,\0,\0,\0,\0} | C44: 1 | D44: 1 | E44: 1 | G44: of:=IF([.C44]=1;"";[.C44]) ->  | H44: of:=IF([.D44]=1;"";[.D44]) ->  | I44: of:=IF([.E44]=1;"";[.E44]) -> 
A45: 9 | B45: strncpy: &"i"{\0,\x01,\x01,\x01,\x01} &"fq"{\0,p,u,\0} 5 :=> &"fq"{\0,\0,\0,\0} | C45: 1 | D45: 0 | E45: 0 | G45: of:=IF([.C45]=1;"";[.C45]) ->  | H45: of:=IF([.D45]=1;"";[.D45]) -> 0 | I45: of:=IF([.E45]=1;"";[.E45]) -> 0
A46: 10 | B46: strncpy: &"t"{\0,\x01,\x01,\x01,\x01} &"gng"{\0,p,\0} 5 :=> &"gng"{\0,\0,\0} | C46: 1 | D46: 0.086581 | E46: 0.086581 | G46: of:=IF([.C46]=1;"";[.C46]) ->  | H46: of:=IF([.D46]=1;"";[.D46]) -> 0.086581 | I46: of:=IF([.E46]=1;"";[.E46]) -> 0.086581
A47: 11 | B47: strncpy: &"x"{\0,\x01,\x01,\x01,\x01} &"isqj"{\0,\0} 5 :=> &"isqj"{\0,\0} | C47: 1 | D47: 0 | E47: 0 | G47: of:=IF([.C47]=1;"";[.C47]) ->  | H47: of:=IF([.D47]=1;"";[.D47]) -> 0 | I47: of:=IF([.E47]=1;"";[.E47]) -> 0
A48: 12 | B48: strncpy: &"h"{\0,\x01,\x01,\x01,\x01} &"uqswg"{\0} 5 :=> &"uqswg"{\0} | C48: 1 | D48: 0.0160027 | E48: 0.0160027 | G48: of:=IF([.C48]=1;"";[.C48]) ->  | H48: of:=IF([.D48]=1;"";[.D48]) -> 0.0160027 | I48: of:=IF([.E48]=1;"";[.E48]) -> 0.0160027
A49: 13 | B49: strncpy: &"on"{\0,\x01,\x01,\x01} &""{\0,p,s,o,o,\0} 5 :=> &""{\0,\0,\0,\0,\0,\0} | C49: 0.224943 | D49: 1 | E49: 1 | G49: of:=IF([.C49]=1;"";[.C49]) -> 0.224943 | H49: of:=IF([.D49]=1;"";[.D49]) ->  | I49: of:=IF([.E49]=1;"";[.E49]) -> 
A50: 14 | B50: strncpy: &"nv"{\0,\x01,\x01,\x01} &"p"{\0,p,b,b,\0} 5 :=> &"p"{\0,\0,\0,\0,\0} | C50: 0.209845 | D50: 1 | E50: 1 | G50: of:=IF([.C50]=1;"";[.C50]) -> 0.209845 | H50: of:=IF([.D50]=1;"";[.D50]) ->  | I50: of:=IF([.E50]=1;"";[.E50]) -> 
A51: 15 | B51: strncpy: &"yv"{\0,\x01,\x01,\x01} &"ps"{\0,p,m,\0} 5 :=> &"ps"{\0,\0,\0,\0} | C51: 0.180513 | D51: 0.209333 | E51: 0.209333 | G51: of:=IF([.C51]=1;"";[.C51]) -> 0.180513 | H51: of:=IF([.D51]=1;"";[.D51]) -> 0.209333 | I51: of:=IF([.E51]=1;"";[.E51]) -> 0.209333
A52: 16 | B52: strncpy: &"iu"{\0,\x01,\x01,\x01} &"mmh"{\0,p,\0} 5 :=> &"mmh"{\0,\0,\0} | C52: 0.20123 | D52: 0.0735939 | E52: 0.0735939 | G52: of:=IF([.C52]=1;"";[.C52]) -> 0.20123 | H52: of:=IF([.D52]=1;"";[.D52]) -> 0.0735939 | I52: of:=IF([.E52]=1;"";[.E52]) -> 0.0735939
A53: 17 | B53: strncpy: &"rr"{\0,\x01,\x01,\x01} &"rplp"{\0,\0} 5 :=> &"rplp"{\0,\0} | C53: 0.213322 | D53: 0.044296 | E53: 0.044296 | G53: of:=IF([.C53]=1;"";[.C53]) -> 0.213322 | H53: of:=IF([.D53]=1;"";[.D53]) -> 0.044296 | I53: of:=IF([.E53]=1;"";[.E53]) -> 0.044296
A54: 18 | B54: strncpy: &"yw"{\0,\x01,\x01,\x01} &"ovmnn"{\0} 5 :=> &"ovmnn"{\0} | C54: 0.197243 | D54: 0.0225922 | E54: 0.0225922 | G54: of:=IF([.C54]=1;"";[.C54]) -> 0.197243 | H54: of:=IF([.D54]=1;"";[.D54]) -> 0.0225922 | I54: of:=IF([.E54]=1;"";[.E54]) -> 0.0225922
A55: 19 | B55: strncpy: &"ibr"{\0,\x01,\x01} &""{\0,p,x,d,o,\0} 5 :=> &""{\0,\0,\0,\0,\0,\0} | C55: 0.0828646 | D55: 1 | E55: 1 | G55: of:=IF([.C55]=1;"";[.C55]) -> 0.0828646 | H55: of:=IF([.D55]=1;"";[.D55]) ->  | I55: of:=IF([.E55]=1;"";[.E55]) -> 
A56: 20 | B56: strncpy: &"zpg"{\0,\x01,\x01} &"b"{\0,p,f,q,\0} 5 :=> &"b"{\0,\0,\0,\0,\0} | C56: 0.0672614 | D56: 1 | E56: 1 | G56: of:=IF([.C56]=1;"";[.C56]) -> 0.0672614 | H56: of:=IF([.D56]=1;"";[.D56]) ->  | I56: of:=IF([.E56]=1;"";[.E56]) -> 
A57: 21 | B57: strncpy: &"tzp"{\0,\x01,\x01} &"zy"{\0,p,d,\0} 5 :=> &"zy"{\0,\0,\0,\0} | C57: 0.0684114 | D57: 0.192076 | E57: 0.192076 | G57: of:=IF([.C57]=1;"";[.C57]) -> 0.0684114 | H57: of:=IF([.D57]=1;"";[.D57]) -> 0.192076 | I57: of:=IF([.E57]=1;"";[.E57]) -> 0.192076
A58: 22 | B58: strncpy: &"pml"{\0,\x01,\x01} &"ckn"{\0,p,\0} 5 :=> &"ckn"{\0,\0,\0} | C58: 0.0739762 | D58: 0.0830859 | E58: 0.0830859 | G58: of:=IF([.C58]=1;"";[.C58]) -> 0.0739762 | H58: of:=IF([.D58]=1;"";[.D58]) -> 0.0830859 | I58: of:=IF([.E58]=1;"";[.E58]) -> 0.0830859
A59: 23 | B59: strncpy: &"hco"{\0,\x01,\x01} &"qctm"{\0,\0} 5 :=> &"qctm"{\0,\0} | C59: 0.0779647 | D59: 0 | E59: 0 | G59: of:=IF([.C59]=1;"";[.C59]) -> 0.0779647 | H59: of:=IF([.D59]=1;"";[.D59]) -> 0 | I59: of:=IF([.E59]=1;"";[.E59]) -> 0
A60: 24 | B60: strncpy: &"zpq"{\0,\x01,\x01} &"jvryn"{\0} 5 :=> &"jvryn"{\0} | C60: 0.0516369 | D60: 0.0178198 | E60: 0.0178198 | G60: of:=IF([.C60]=1;"";[.C60]) -> 0.0516369 | H60: of:=IF([.D60]=1;"";[.D60]) -> 0.0178198 | I60: of:=IF([.E60]=1;"";[.E60]) -> 0.0178198
A61: 25 | B61: strncpy: &"pwqb"{\0,\x01} &""{\0,p,p,l,c,\0} 5 :=> &""{\0,\0,\0,\0,\0,\0} | C61: 0.0230099 | D61: 1 | E61: 1 | G61: of:=IF([.C61]=1;"";[.C61]) -> 0.0230099 | H61: of:=IF([.D61]=1;"";[.D61]) ->  | I61: of:=IF([.E61]=1;"";[.E61]) -> 
A62: 26 | B62: strncpy: &"caji"{\0,\x01} &"x"{\0,p,j,a,\0} 5 :=> &"x"{\0,\0,\0,\0,\0} | C62: 0.0418972 | D62: 1 | E62: 1 | G62: of:=IF([.C62]=1;"";[.C62]) -> 0.0418972 | H62: of:=IF([.D62]=1;"";[.D62]) ->  | I62: of:=IF([.E62]=1;"";[.E62]) -> 
A63: 27 | B63: strncpy: &"giii"{\0,\x01} &"cn"{\0,p,k,\0} 5 :=> &"cn"{\0,\0,\0,\0} | C63: 0.0393274 | D63: 0.174276 | E63: 0.174276 | G63: of:=IF([.C63]=1;"";[.C63]) -> 0.0393274 | H63: of:=IF([.D63]=1;"";[.D63]) -> 0.174276 | I63: of:=IF([.E63]=1;"";[.E63]) -> 0.174276
A64: 28 | B64: strncpy: &"ngos"{\0,\x01} &"pxk"{\0,p,\0} 5 :=> &"pxk"{\0,\0,\0} | C64: 0.0475294 | D64: 0 | E64: 0 | G64: of:=IF([.C64]=1;"";[.C64]) -> 0.0475294 | H64: of:=IF([.D64]=1;"";[.D64]) -> 0 | I64: of:=IF([.E64]=1;"";[.E64]) -> 0
A65: 29 | B65: strncpy: &"apjp"{\0,\x01} &"vzcc"{\0,\0} 5 :=> &"vzcc"{\0,\0} | C65: 0.0290522 | D65: 0.0256027 | E65: 0.0256027 | G65: of:=IF([.C65]=1;"";[.C65]) -> 0.0290522 | H65: of:=IF([.D65]=1;"";[.D65]) -> 0.0256027 | I65: of:=IF([.E65]=1;"";[.E65]) -> 0.0256027
A66: 30 | B66: strncpy: &"rixe"{\0,\x01} &"aklvb"{\0} 5 :=> &"aklvb"{\0} | C66: 0.0442746 | D66: 0 | E66: 0 | G66: of:=IF([.C66]=1;"";[.C66]) -> 0.0442746 | H66: of:=IF([.D66]=1;"";[.D66]) -> 0 | I66: of:=IF([.E66]=1;"";[.E66]) -> 0
A67: 31 | B67: strncpy: &"xgfct"{\0} &""{\0,p,d,t,c,\0} 5 :=> &""{\0,\0,\0,\0,\0,\0} | C67: 0.017464 | D67: 1 | E67: 1 | G67: of:=IF([.C67]=1;"";[.C67]) -> 0.017464 | H67: of:=IF([.D67]=1;"";[.D67]) ->  | I67: of:=IF([.E67]=1;"";[.E67]) -> 
A68: 32 | B68: strncpy: &"fvalw"{\0} &"h"{\0,p,q,p,\0} 5 :=> &"h"{\0,\0,\0,\0,\0} | C68: 0.0247868 | D68: 1 | E68: 1 | G68: of:=IF([.C68]=1;"";[.C68]) -> 0.0247868 | H68: of:=IF([.D68]=1;"";[.D68]) ->  | I68: of:=IF([.E68]=1;"";[.E68]) -> 
A69: 33 | B69: strncpy: &"hrksr"{\0} &"zv"{\0,p,b,\0} 5 :=> &"zv"{\0,\0,\0,\0} | C69: 0.0281184 | D69: 0.17374 | E69: 0.17374 | G69: of:=IF([.C69]=1;"";[.C69]) -> 0.0281184 | H69: of:=IF([.D69]=1;"";[.D69]) -> 0.17374 | I69: of:=IF([.E69]=1;"";[.E69]) -> 0.17374
A70: 34 | B70: strncpy: &"cizcd"{\0} &"mux"{\0,p,\0} 5 :=> &"mux"{\0,\0,\0} | C70: 0.0227828 | D70: 0.0778901 | E70: 0.0778901 | G70: of:=IF([.C70]=1;"";[.C70]) -> 0.0227828 | H70: of:=IF([.D70]=1;"";[.D70]) -> 0.0778901 | I70: of:=IF([.E70]=1;"";[.E70]) -> 0.0778901
A71: 35 | B71: strncpy: &"uaqze"{\0} &"wavz"{\0,\0} 5 :=> &"wavz"{\0,\0} | C71: 0 | D71: 0.0317797 | E71: 0.0317797 | G71: of:=IF([.C71]=1;"";[.C71]) -> 0 | H71: of:=IF([.D71]=1;"";[.D71]) -> 0.0317797 | I71: of:=IF([.E71]=1;"";[.E71]) -> 0.0317797
A72: 36 | B72: strncpy: &"sjdzj"{\0} &"iuuym"{\0} 5 :=> &"iuuym"{\0} | C72: 0.0130751 | D72: 0.0243152 | E72: 0.0243152 | G72: of:=IF([.C72]=1;"";[.C72]) -> 0.0130751 | H72: of:=IF([.D72]=1;"";[.D72]) -> 0.0243152 | I72: of:=IF([.E72]=1;"";[.E72]) -> 0.0243152

Sheet: strcat
A1: # | B1: Test Case | C1: N1 | D1: N2 | E1: N3
A2: 1 | B2: strcat: &""{\0,\x01,\x01,\x01,\x01,\x01,\x01,\x01,\x01,\x01} &"v"{\0,p,g,\0} :=> &"v"{\0,p,k,q,q,d,n,n,\0} | C2: 1 | D2: 1 | E2: 1 | G2: of:=IF([.C2]=1;"";[.C2]) ->  | H2: of:=IF([.D2]=1;"";[.D2]) ->  | I2: of:=IF([.E2]=1;"";[.E2]) ->  | K2: of:=AVERAGE([.G2:.G41]) -> 0.0487826967741936 | L2: of:=AVERAGE([.H2:.H41]) -> 0.0958054345454545 | M2: of:=AVERAGE([.I2:.I41]) -> 0.0325679294594595 | O2: of:=AVERAGE([.K2:.M2]) -> 0.0590520202597025
A3: 2 | B3: strcat: &""{\0,\x01,\x01,\x01,\x01,\x01,\x01,\x01,\x01,\x01} &"ng"{\0,p,\0} :=> &"ng"{\0,p,l,n,k,b,j,\0} | C3: 1 | D3: 0.223271 | E3: 0.223271 | G3: of:=IF([.C3]=1;"";[.C3]) ->  | H3: of:=IF([.D3]=1;"";[.D3]) -> 0.223271 | I3: of:=IF([.E3]=1;"";[.E3]) -> 0.223271
A4: 3 | B4: strcat: &""{\0,\x01,\x01,\x01,\x01,\x01,\x01,\x01,\x01,\x01} &"xlp"{\0,\0} :=> &"xlp"{\0,p,z,s,p,q,\0} | C4: 1 | D4: 0.0701902 | E4: 0.0701902 | G4: of:=IF([.C4]=1;"";[.C4]) ->  | H4: of:=IF([.D4]=1;"";[.D4]) -> 0.0701902 | I4: of:=IF([.E4]=1;"";[.E4]) -> 0.0701902
A5: 4 | B5: strcat: &""{\0,\x01,\x01,\x01,\x01,\x01,\x01,\x01,\x01,\x01} &"vetx"{\0} :=> &"vetx"{\0,p,x,x,f,\0} | C5: 1 | D5: 0.0379685 | E5: 0.0379685 | H5: of:=IF([.D5]=1;"";[.D5]) -> 0.0379685 | I5: of:=IF([.E5]=1;"";[.E5]) -> 0.0379685
A6: 5 | B6: strcat: &"u"{\0,\x01,\x01,\x01,\x01,\x01,\x01,\x01,\x01} &""{\0,p,b,j,\0} :=> &"u"{\0,p,h,x,d,m,c,r,\0} | C6: 1 | D6: 1 | E6: 1 | G6: of:=IF([.C6]=1;"";[.C6]) ->  | H6: of:=IF([.D6]=1;"";[.D6]) ->  | I6: of:=IF([.E6]=1;"";[.E6]) -> 
A7: 6 | B7: strcat: &"p"{\0,\x01,\x01,\x01,\x01,\x01,\x01,\x01,\x01} &"p"{\0,p,r,\0} :=> &"pp"{\0,p,n,k,e,j,l,\0} | C7: 1 | D7: 1 | E7: 0.213806 | G7: of:=IF([.C7]=1;"";[.C7]) ->  | H7: of:=IF([.D7]=1;"";[.D7]) ->  | I7: of:=IF([.E7]=1;"";[.E7]) -> 0.213806
A8: 7 | B8: strcat: &"u"{\0,\x01,\x01,\x01,\x01,\x01,\x01,\x01,\x01} &"hw"{\0,p,\0} :=> &"uhw"{\0,p,f,y,w,g,\0} | C8: 1 | D8: 0.197427 | E8: 0.0709588 | G8: of:=IF([.C8]=1;"";[.C8]) ->  | H8: of:=IF([.D8]=1;"";[.D8]) -> 0.197427 | I8: of:=IF([.E8]=1;"";[.E8]) -> 0.0709588
A9: 8 | B9: strcat: &"r"{\0,\x01,\x01,\x01,\x01,\x01,\x01,\x01,\x01} &"zjo"{\0,\0} :=> &"rzjo"{\0,p,p,k,r,\0} | C9: 1 | D9: 0.047607 | E9: 0.0261338 | G9: of:=IF([.C9]=1;"";[.C9]) ->  | H9: of:=IF([.D9]=1;"";[.D9]) -> 0.047607 | I9: of:=IF([.E9]=1;"";[.E9]) -> 0.0261338
A10: 9 | B10: strcat: &"q"{\0,\x01,\x01,\x01,\x01,\x01,\x01,\x01,\x01} &"wgto"{\0} :=> &"qwgto"{\0,p,r,p,\0} | C10: 1 | D10: 0.0380922 | E10: 0.016919 | G10: of:=IF([.C10]=1;"";[.C10]) ->  | H10: of:=IF([.D10]=1;"";[.D10]) -> 0.0380922 | I10: of:=IF([.E10]=1;"";[.E10]) -> 0.016919
A11: 10 | B11: strcat: &"cg"{\0,\x01,\x01,\x01,\x01,\x01,\x01,\x01} &""{\0,p,o,c,\0} :=> &"cg"{\0,p,p,d,t,m,x,\0} | C11: 0.106758 | D11: 1 | E11: 0.106758 | G11: of:=IF([.C11]=1;"";[.C11]) -> 0.106758 | H11: of:=IF([.D11]=1;"";[.D11]) ->  | I11: of:=IF([.E11]=1;"";[.E11]) -> 0.106758
A12: 11 | B12: strcat: &"yc"{\0,\x01,\x01,\x01,\x01,\x01,\x01,\x01} &"y"{\0,p,w,\0} :=> &"ycy"{\0,p,z,b,l,p,\0} | C12: 0.199888 | D12: 1 | E12: 0.0785182 | G12: of:=IF([.C12]=1;"";[.C12]) -> 0.199888 | H12: of:=IF([.D12]=1;"";[.D12]) ->  | I12: of:=IF([.E12]=1;"";[.E12]) -> 0.0785182
A13: 12 | B13: strcat: &"dd"{\0,\x01,\x01,\x01,\x01,\x01,\x01,\x01} &"nm"{\0,p,\0} :=> &"ddnm"{\0,p,j,j,q,\0} | C13: 0.208818 | D13: 0.207303 | E13: 0.0426931 | G13: of:=IF([.C13]=1;"";[.C13]) -> 0.208818 | H13: of:=IF([.D13]=1;"";[.D13]) -> 0.207303 | I13: of:=IF([.E13]=1;"";[.E13]) -> 0.0426931
A14: 13 | B14: strcat: &"mw"{\0,\x01,\x01,\x01,\x01,\x01,\x01,\x01} &"iwv"{\0,\0} :=> &"mwiwv"{\0,p,b,y,\0} | C14: 0.174098 | D14: 0.0439557 | E14: 0.0165729 | G14: of:=IF([.C14]=1;"";[.C14]) -> 0.174098 | H14: of:=IF([.D14]=1;"";[.D14]) -> 0.0439557 | I14: of:=IF([.E14]=1;"";[.E14]) -> 0.0165729
A15: 14 | B15: strcat: &"jj"{\0,\x01,\x01,\x01,\x01,\x01,\x01,\x01} &"nhwj"{\0} :=> &"jjnhwj"{\0,p,u,\0} | C15: 0.144251 | D15: 0 | E15: 0 | G15: of:=IF([.C15]=1;"";[.C15]) -> 0.144251 | H15: of:=IF([.D15]=1;"";[.D15]) -> 0 | I15: of:=IF([.E15]=1;"";[.E15]) -> 0
A16: 15 | B16: strcat: &"zqn"{\0,\x01,\x01,\x01,\x01,\x01,\x01} &""{\0,p,r,p,\0} :=> &"zqn"{\0,p,d,v,a,t,\0} | C16: 0 | D16: 1 | E16: 0 | G16: of:=IF([.C16]=1;"";[.C16]) -> 0 | H16: of:=IF([.D16]=1;"";[.D16]) ->  | I16: of:=IF([.E16]=1;"";[.E16]) -> 0
A17: 16 | B17: strcat: &"yjo"{\0,\x01,\x01,\x01,\x01,\x01,\x01} &"c"{\0,p,k,\0} :=> &"yjoc"{\0,p,l,w,x,\0} | C17: 0.0642529 | D17: 1 | E17: 0.0363557 | G17: of:=IF([.C17]=1;"";[.C17]) -> 0.0642529 | H17: of:=IF([.D17]=1;"";[.D17]) ->  | I17: of:=IF([.E17]=1;"";[.E17]) -> 0.0363557
A18: 17 | B18: strcat: &"ffk"{\0,\x01,\x01,\x01,\x01,\x01,\x01} &"lv"{\0,p,\0} :=> &"ffklv"{\0,p,t,n,\0} | C18: 0.0736744 | D18: 0.206077 | E18: 0.0253862 | G18: of:=IF([.C18]=1;"";[.C18]) -> 0.0736744 | H18: of:=IF([.D18]=1;"";[.D18]) -> 0.206077 | I18: of:=IF([.E18]=1;"";[.E18]) -> 0.0253862
A19: 18 | B19: strcat: &"rbe"{\0,\x01,\x01,\x01,\x01,\x01,\x01} &"ubs"{\0,\0} :=> &"rbeubs"{\0,p,x,\0} | C19: 0.0841998 | D19: 0.0828526 | E19: 0.0202887 | G19: of:=IF([.C19]=1;"";[.C19]) -> 0.0841998 | H19: of:=IF([.D19]=1;"";[.D19]) -> 0.0828526 | I19: of:=IF([.E19]=1;"";[.E19]) -> 0.0202887
A20: 19 | B20: strcat: &"rnx"{\0,\x01,\x01,\x01,\x01,\x01,\x01} &"mfqy"{\0} :=> &"rnxmfqy"{\0,p,\0} | C20: 0.0790006 | D20: 0 | E20: 0 | G20: of:=IF([.C20]=1;"";[.C20]) -> 0.0790006 | H20: of:=IF([.D20]=1;"";[.D20]) -> 0 | I20: of:=IF([.E20]=1;"";[.E20]) -> 0
A21: 20 | B21: strcat: &"mapj"{\0,\x01,\x01,\x01,\x01,\x01} &""{\0,p,h,i,\0} :=> &"mapj"{\0,p,z,p,o,\0} | C21: 0.0407717 | D21: 1 | E21: 0.0407717 | G21: of:=IF([.C21]=1;"";[.C21]) -> 0.0407717 | H21: of:=IF([.D21]=1;"";[.D21]) ->  | I21: of:=IF([.E21]=1;"";[.E21]) -> 0.0407717
A22: 21 | B22: strcat: &"hnkj"{\0,\x01,\x01,\x01,\x01,\x01} &"f"{\0,p,a,\0} :=> &"hnkjf"{\0,p,o,m,\0} | C22: 0.0371269 | D22: 1 | E22: 0.0193766 | G22: of:=IF([.C22]=1;"";[.C22]) -> 0.0371269 | H22: of:=IF([.D22]=1;"";[.D22]) ->  | I22: of:=IF([.E22]=1;"";[.E22]) -> 0.0193766
A23: 22 | B23: strcat: &"lapa"{\0,\x01,\x01,\x01,\x01,\x01} &"lx"{\0,p,\0} :=> &"lapalx"{\0,p,i,\0} | C23: 0.0474471 | D23: 0.159059 | E23: 0.0191399 | G23: of:=IF([.C23]=1;"";[.C23]) -> 0.0474471 | H23: of:=IF([.D23]=1;"";[.D23]) -> 0.159059 | I23: of:=IF([.E23]=1;"";[.E23]) -> 0.0191399
A24: 23 | B24: strcat: &"ryps"{\0,\x01,\x01,\x01,\x01,\x01} &"jjc"{\0,\0} :=> &"rypsjjc"{\0,p,\0} | C24: 0.04354 | D24: 0.0488996 | E24: 0.0104544 | G24: of:=IF([.C24]=1;"";[.C24]) -> 0.04354 | H24: of:=IF([.D24]=1;"";[.D24]) -> 0.0488996 | I24: of:=IF([.E24]=1;"";[.E24]) -> 0.0104544
A25: 24 | B25: strcat: &"gqxq"{\0,\x01,\x01,\x01,\x01,\x01} &"tvdp"{\0} :=> &"gqxqtvdp"{\0,\0} | C25: 0 | D25: 0.0321659 | E25: 0 | G25: of:=IF([.C25]=1;"";[.C25]) -> 0 | H25: of:=IF([.D25]=1;"";[.D25]) -> 0.0321659 | I25: of:=IF([.E25]=1;"";[.E25]) -> 0
A26: 25 | B26: strcat: &"tsksw"{\0,\x01,\x01,\x01,\x01} &""{\0,p,w,j,\0} :=> &"tsksw"{\0,p,x,z,\0} | C26: 0.0284314 | D26: 1 | E26: 0.0284314 | G26: of:=IF([.C26]=1;"";[.C26]) -> 0.0284314 | H26: of:=IF([.D26]=1;"";[.D26]) ->  | I26: of:=IF([.E26]=1;"";[.E26]) -> 0.0284314
A27: 26 | B27: strcat: &"yowdu"{\0,\x01,\x01,\x01,\x01} &"r"{\0,p,d,\0} :=> &"yowdur"{\0,p,g,\0} | C27: 0.0281044 | D27: 1 | E27: 0.0205712 | G27: of:=IF([.C27]=1;"";[.C27]) -> 0.0281044 | H27: of:=IF([.D27]=1;"";[.D27]) ->  | I27: of:=IF([.E27]=1;"";[.E27]) -> 0.0205712
A28: 27 | B28: strcat: &"frwit"{\0,\x01,\x01,\x01,\x01} &"yv"{\0,p,\0} :=> &"frwityv"{\0,p,\0} | C28: 0.0296459 | D28: 0.180513 | E28: 0.0153118 | G28: of:=IF([.C28]=1;"";[.C28]) -> 0.0296459 | H28: of:=IF([.D28]=1;"";[.D28]) -> 0.180513 | I28: of:=IF([.E28]=1;"";[.E28]) -> 0.0153118
A29: 28 | B29: strcat: &"rxvge"{\0,\x01,\x01,\x01,\x01} &"qrd"{\0,\0} :=> &"rxvgeqrd"{\0,\0} | C29: 0.0209146 | D29: 0 | E29: 0 | G29: of:=IF([.C29]=1;"";[.C29]) -> 0.0209146 | H29: of:=IF([.D29]=1;"";[.D29]) -> 0 | I29: of:=IF([.E29]=1;"";[.E29]) -> 0
A30: 29 | B30: strcat: &"osxcw"{\0,\x01,\x01,\x01,\x01} &"dgzc"{\0} :=> &"osxcwdgzc"{\0} | C30: 0 | D30: 0.0309616 | E30: 0 | G30: of:=IF([.C30]=1;"";[.C30]) -> 0 | H30: of:=IF([.D30]=1;"";[.D30]) -> 0.0309616 | I30: of:=IF([.E30]=1;"";[.E30]) -> 0
A31: 30 | B31: strcat: &"dwnkqw"{\0,\x01,\x01,\x01} &""{\0,p,c,e,\0} :=> &"dwnkqw"{\0,p,k,\0} | C31: 0 | D31: 1 | E31: 0 | G31: of:=IF([.C31]=1;"";[.C31]) -> 0 | H31: of:=IF([.D31]=1;"";[.D31]) ->  | I31: of:=IF([.E31]=1;"";[.E31]) -> 0
A32: 31 | B32: strcat: &"zoesmn"{\0,\x01,\x01,\x01} &"j"{\0,p,z,\0} :=> &"zoesmnj"{\0,p,\0} | C32: 0.0194299 | D32: 1 | E32: 0.0147035 | G32: of:=IF([.C32]=1;"";[.C32]) -> 0.0194299 | H32: of:=IF([.D32]=1;"";[.D32]) ->  | I32: of:=IF([.E32]=1;"";[.E32]) -> 0.0147035
A33: 32 | B33: strcat: &"bfwnlc"{\0,\x01,\x01,\x01} &"ue"{\0,p,\0} :=> &"bfwnlcue"{\0,\0} | C33: 0.0158962 | D33: 0.214286 | E33: 0.0106128 | G33: of:=IF([.C33]=1;"";[.C33]) -> 0.0158962 | H33: of:=IF([.D33]=1;"";[.D33]) -> 0.214286 | I33: of:=IF([.E33]=1;"";[.E33]) -> 0.0106128
A34: 33 | B34: strcat: &"qzlgde"{\0,\x01,\x01,\x01} &"gmk"{\0,\0} :=> &"qzlgdegmk"{\0} | C34: 0 | D34: 0.065079 | E34: 0 | G34: of:=IF([.C34]=1;"";[.C34]) -> 0 | H34: of:=IF([.D34]=1;"";[.D34]) -> 0.065079 | I34: of:=IF([.E34]=1;"";[.E34]) -> 0
A35: 34 | B35: strcat: &"kicyep"{\0,\x01,\x01,\x01} &&10 :=> &"kicyepiavy"{} | C35: 0.0213374 | D35: 0.00966526 | G35: of:=IF([.C35]=1;"";[.C35]) -> 0.0213374 | H35: of:=IF([.D35]=1;"";[.D35]) -> 0.00966526 | I35: of:=IF([.E35]=1;"";[.E35]) ->  
A36: 35 | B36: strcat: &"epzldol"{\0,\x01,\x01} &""{\0,p,d,i,\0} :=> &"epzldol"{\0,p,\0} | C36: 0.0140049 | D36: 1 | E36: 0.0140049 | G36: of:=IF([.C36]=1;"";[.C36]) -> 0.0140049 | H36: of:=IF([.D36]=1;"";[.D36]) ->  | I36: of:=IF([.E36]=1;"";[.E36]) -> 0.0140049
A37: 36 | B37: strcat: &"yxzmtse"{\0,\x01,\x01} &"u"{\0,p,i,\0} :=> &"yxzmtseu"{\0,\0} | C37: 0 | D37: 1 | E37: 0 | G37: of:=IF([.C37]=1;"";[.C37]) -> 0 | H37: of:=IF([.D37]=1;"";[.D37]) ->  | I37: of:=IF([.E37]=1;"";[.E37]) -> 0
A38: 37 | B38: strcat: &"exrteam"{\0,\x01,\x01} &"oi"{\0,p,\0} :=> &"exrteamoi"{\0} | C38: 0.0137249 | D38: 0.212346 | E38: 0.00979222 | G38: of:=IF([.C38]=1;"";[.C38]) -> 0.0137249 | H38: of:=IF([.D38]=1;"";[.D38]) -> 0.212346 | I38: of:=IF([.E38]=1;"";[.E38]) -> 0.00979222
A39: 38 | B39: strcat: &"qgfhljka"{\0,\x01} &""{\0,p,a,l,\0} :=> &"qgfhljka"{\0,\0} | C39: 0 | D39: 1 | E39: 0 | G39: of:=IF([.C39]=1;"";[.C39]) -> 0 | H39: of:=IF([.D39]=1;"";[.D39]) ->  | I39: of:=IF([.E39]=1;"";[.E39]) -> 0
A40: 39 | B40: strcat: &"lauqlpjy"{\0,\x01} &"r"{\0,p,g,\0} :=> &"lauqlpjyr"{\0} | C40: 0.00737373 | D40: 1 | E40: 0.006449 | G40: of:=IF([.C40]=1;"";[.C40]) -> 0.00737373 | H40: of:=IF([.D40]=1;"";[.D40]) ->  | I40: of:=IF([.E40]=1;"";[.E40]) -> 0.006449
A41: 40 | B41: strcat: &"uoxekrecb"{\0} &""{\0,p,w,q,\0} :=> &"uoxekrecb"{\0} | C41: 0.00957387 | D41: 1 | E41: 0.00957387 | G41: of:=IF([.C41]=1;"";[.C41]) -> 0.00957387 | H41: of:=IF([.D41]=1;"";[.D41]) ->  | I41: of:=IF([.E41]=1;"";[.E41]) -> 0.00957387
A42: 1 | B42: strncat: &""{\0,\x01,\x01,\x01,\x01,\x01,\x01,\x01,\x01,\x01} &""{\0,p,x,o,\0} 4 :=> &""{\0,p,r,l,s,i,c,g,c,\0} | C42: 1 | D42: 1 | E42: 1 | G42: of:=IF([.C42]=1;"";[.C42]) ->  | H42: of:=IF([.D42]=1;"";[.D42]) ->  | I42: of:=IF([.E42]=1;"";[.E42]) ->  | K42: of:=AVERAGE([.G42:.G82]) -> 0.0577504267741936 | L42: of:=AVERAGE([.H42:.H82]) -> 0.105346827272727 | M42: of:=AVERAGE([.I42:.I82]) -> 0.0374223962162162 | O42: of:=AVERAGE([.K42:.M42]) -> 0.0668398834210457
A43: 2 | B43: strncat: &""{\0,\x01,\x01,\x01,\x01,\x01,\x01,\x01,\x01,\x01} &"x"{\0,p,j,\0} 4 :=> &"x"{\0,p,g,f,b,w,g,y,\0} | C43: 1 | D43: 1 | E43: 1 | G43: of:=IF([.C43]=1;"";[.C43]) ->  | H43: of:=IF([.D43]=1;"";[.D43]) ->  | I43: of:=IF([.E43]=1;"";[.E43]) -> 
A44: 3 | B44: strncat: &""{\0,\x01,\x01,\x01,\x01,\x01,\x01,\x01,\x01,\x01} &"ak"{\0,p,\0} 4 :=> &"ak"{\0,p,n,s,o,r,d,\0} | C44: 1 | D44: 0.213322 | E44: 0.213322 | G44: of:=IF([.C44]=1;"";[.C44]) ->  | H44: of:=IF([.D44]=1;"";[.D44]) -> 0.213322 | I44: of:=IF([.E44]=1;"";[.E44]) -> 0.213322
A45: 4 | B45: strncat: &""{\0,\x01,\x01,\x01,\x01,\x01,\x01,\x01,\x01,\x01} &"ayb"{\0,\0} 4 :=> &"ayb"{\0,p,b,l,p,c,\0} | C45: 1 | D45: 0.0810423 | E45: 0.0810423 | G45: of:=IF([.C45]=1;"";[.C45]) ->  | H45: of:=IF([.D45]=1;"";[.D45]) -> 0.0810423 | I45: of:=IF([.E45]=1;"";[.E45]) -> 0.0810423
A46: 5 | B46: strncat: &""{\0,\x01,\x01,\x01,\x01,\x01,\x01,\x01,\x01,\x01} &"tvhh"{\0} 4 :=> &"tvhh"{\0,p,m,e,n,\0} | C46: 1 | D46: 0.0268391 | E46: 0.0268391 | G46: of:=IF([.C46]=1;"";[.C46]) ->  | H46: of:=IF([.D46]=1;"";[.D46]) -> 0.0268391 | I46: of:=IF([.E46]=1;"";[.E46]) -> 0.0268391
A47: 6 | B47: strncat: &"c"{\0,\x01,\x01,\x01,\x01,\x01,\x01,\x01,\x01} &""{\0,p,l,p,\0} 4 :=> &"c"{\0,p,c,o,g,t,z,y,\0} | C47: 1 | D47: 1 | E47: 1 | G47: of:=IF([.C47]=1;"";[.C47]) ->  | H47: of:=IF([.D47]=1;"";[.D47]) ->  | I47: of:=IF([.E47]=1;"";[.E47]) -> 
A48: 7 | B48: strncat: &"l"{\0,\x01,\x01,\x01,\x01,\x01,\x01,\x01,\x01} &"g"{\0,p,e,\0} 4 :=> &"lg"{\0,p,s,n,j,h,e,\0} | C48: 1 | D48: 1 | E48: 0.196689 | G48: of:=IF([.C48]=1;"";[.C48]) ->  | H48: of:=IF([.D48]=1;"";[.D48]) ->  | I48: of:=IF([.E48]=1;"";[.E48]) -> 0.196689
A49: 8 | B49: strncat: &"a"{\0,\x01,\x01,\x01,\x01,\x01,\x01,\x01,\x01} &"ct"{\0,p,\0} 4 :=> &"act"{\0,p,o,f,y,n,\0} | C49: 1 | D49: 0.218466 | E49: 0.0878477 | G49: of:=IF([.C49]=1;"";[.C49]) ->  | H49: of:=IF([.D49]=1;"";[.D49]) -> 0.218466 | I49: of:=IF([.E49]=1;"";[.E49]) -> 0.0878477
A50: 9 | B50: strncat: &"u"{\0,\x01,\x01,\x01,\x01,\x01,\x01,\x01,\x01} &"dbm"{\0,\0} 4 :=> &"udbm"{\0,p,a,l,s,\0} | C50: 1 | D50: 0.070969 | E50: 0.0393176 | G50: of:=IF([.C50]=1;"";[.C50]) ->  | H50: of:=IF([.D50]=1;"";[.D50]) -> 0.070969 | I50: of:=IF([.E50]=1;"";[.E50]) -> 0.0393176
A51: 10 | B51: strncat: &"p"{\0,\x01,\x01,\x01,\x01,\x01,\x01,\x01,\x01} &"rdco"{\0} 4 :=> &"prdco"{\0,p,d,q,\0} | C51: 1 | D51: 0.0443968 | E51: 0.0290806 | G51: of:=IF([.C51]=1;"";[.C51]) ->  | H51: of:=IF([.D51]=1;"";[.D51]) -> 0.0443968 | I51: of:=IF([.E51]=1;"";[.E51]) -> 0.0290806
A52: 11 | B52: strncat: &"uf"{\0,\x01,\x01,\x01,\x01,\x01,\x01,\x01} &""{\0,p,x,a,\0} 4 :=> &"uf"{\0,p,i,v,x,a,b,\0} | C52: 0.203947 | D52: 1 | E52: 0.203947 | G52: of:=IF([.C52]=1;"";[.C52]) -> 0.203947 | H52: of:=IF([.D52]=1;"";[.D52]) ->  | I52: of:=IF([.E52]=1;"";[.E52]) -> 0.203947
A53: 12 | B53: strncat: &"pr"{\0,\x01,\x01,\x01,\x01,\x01,\x01,\x01} &"z"{\0,p,q,\0} 4 :=> &"prz"{\0,p,p,n,o,p,\0} | C53: 0.218916 | D53: 1 | E53: 0.0785587 | G53: of:=IF([.C53]=1;"";[.C53]) -> 0.218916 | H53: of:=IF([.D53]=1;"";[.D53]) ->  | I53: of:=IF([.E53]=1;"";[.E53]) -> 0.0785587
A54: 13 | B54: strncat: &"rr"{\0,\x01,\x01,\x01,\x01,\x01,\x01,\x01} &"eu"{\0,p,\0} 4 :=> &"rreu"{\0,p,u,e,q,\0} | C54: 0.213322 | D54: 0.204169 | E54: 0.0458419 | G54: of:=IF([.C54]=1;"";[.C54]) -> 0.213322 | H54: of:=IF([.D54]=1;"";[.D54]) -> 0.204169 | I54: of:=IF([.E54]=1;"";[.E54]) -> 0.0458419
A55: 14 | B55: strncat: &"na"{\0,\x01,\x01,\x01,\x01,\x01,\x01,\x01} &"oot"{\0,\0} 4 :=> &"naoot"{\0,p,k,x,\0} | C55: 0.218014 | D55: 0.0872591 | E55: 0.0288809 | G55: of:=IF([.C55]=1;"";[.C55]) -> 0.218014 | H55: of:=IF([.D55]=1;"";[.D55]) -> 0.0872591 | I55: of:=IF([.E55]=1;"";[.E55]) -> 0.0288809
A56: 15 | B56: strncat: &"je"{\0,\x01,\x01,\x01,\x01,\x01,\x01,\x01} &"vljy"{\0} 4 :=> &"jevljy"{\0,p,x,\0} | C56: 0.205048 | D56: 0.024214 | E56: 0.0129234 | G56: of:=IF([.C56]=1;"";[.C56]) -> 0.205048 | H56: of:=IF([.D56]=1;"";[.D56]) -> 0.024214 | I56: of:=IF([.E56]=1;"";[.E56]) -> 0.0129234
A57: 16 | B57: strncat: &"ijf"{\0,\x01,\x01,\x01,\x01,\x01,\x01} &""{\0,p,g,q,\0} 4 :=> &"ijf"{\0,p,p,k,h,r,\0} | C57: 0.0556034 | D57: 1 | E57: 0.0556034 | G57: of:=IF([.C57]=1;"";[.C57]) -> 0.0556034 | H57: of:=IF([.D57]=1;"";[.D57]) ->  | I57: of:=IF([.E57]=1;"";[.E57]) -> 0.0556034
A58: 17 | B58: strncat: &"lhj"{\0,\x01,\x01,\x01,\x01,\x01,\x01} &"f"{\0,p,b,\0} 4 :=> &"lhjf"{\0,p,a,g,e,\0} | C58: 0.061651 | D58: 1 | E58: 0.0265309 | G58: of:=IF([.C58]=1;"";[.C58]) -> 0.061651 | H58: of:=IF([.D58]=1;"";[.D58]) ->  | I58: of:=IF([.E58]=1;"";[.E58]) -> 0.0265309
A59: 18 | B59: strncat: &"qvk"{\0,\x01,\x01,\x01,\x01,\x01,\x01} &"eh"{\0,p,\0} 4 :=> &"qvkeh"{\0,p,f,m,\0} | C59: 0.0458097 | D59: 0.204884 | E59: 0.0186891 | G59: of:=IF([.C59]=1;"";[.C59]) -> 0.0458097 | H59: of:=IF([.D59]=1;"";[.D59]) -> 0.204884 | I59: of:=IF([.E59]=1;"";[.E59]) -> 0.0186891
A60: 19 | B60: strncat: &"hrq"{\0,\x01,\x01,\x01,\x01,\x01,\x01} &"ugr"{\0,\0} 4 :=> &"hrqugr"{\0,p,k,\0} | C60: 0.0746724 | D60: 0.0850319 | E60: 0.0195315 | G60: of:=IF([.C60]=1;"";[.C60]) -> 0.0746724 | H60: of:=IF([.D60]=1;"";[.D60]) -> 0.0850319 | I60: of:=IF([.E60]=1;"";[.E60]) -> 0.0195315
A61: 20 | B61: strncat: &"upu"{\0,\x01,\x01,\x01,\x01,\x01,\x01} &"mjtz"{\0} 4 :=> &"upumjtz"{\0,p,\0} | C61: 0.0845727 | D61: 0.0283232 | E61: 0.0118551 | G61: of:=IF([.C61]=1;"";[.C61]) -> 0.0845727 | H61: of:=IF([.D61]=1;"";[.D61]) -> 0.0283232 | I61: of:=IF([.E61]=1;"";[.E61]) -> 0.0118551
A62: 21 | B62: strncat: &"vybb"{\0,\x01,\x01,\x01,\x01,\x01} &""{\0,p,m,y,\0} 4 :=> &"vybb"{\0,p,e,u,u,\0} | C62: 0.0398473 | D62: 1 | E62: 0.0398473 | G62: of:=IF([.C62]=1;"";[.C62]) -> 0.0398473 | H62: of:=IF([.D62]=1;"";[.D62]) ->  | I62: of:=IF([.E62]=1;"";[.E62]) -> 0.0398473
A63: 22 | B63: strncat: &"komq"{\0,\x01,\x01,\x01,\x01,\x01} &"r"{\0,p,b,\0} 4 :=> &"komqr"{\0,p,m,s,\0} | C63: 0.0315374 | D63: 1 | E63: 0 | G63: of:=IF([.C63]=1;"";[.C63]) -> 0.0315374 | H63: of:=IF([.D63]=1;"";[.D63]) ->  | I63: of:=IF([.E63]=1;"";[.E63]) -> 0
A64: 23 | B64: strncat: &"kjoc"{\0,\x01,\x01,\x01,\x01,\x01} &"wv"{\0,p,\0} 4 :=> &"kjocwv"{\0,p,a,\0} | C64: 0.0377129 | D64: 0.106758 | E64: 0.0109787 | G64: of:=IF([.C64]=1;"";[.C64]) -> 0.0377129 | H64: of:=IF([.D64]=1;"";[.D64]) -> 0.106758 | I64: of:=IF([.E64]=1;"";[.E64]) -> 0.0109787
A65: 24 | B65: strncat: &"dolv"{\0,\x01,\x01,\x01,\x01,\x01} &"bix"{\0,\0} 4 :=> &"dolvbix"{\0,p,\0} | C65: 0.045452 | D65: 0.0813982 | E65: 0 | G65: of:=IF([.C65]=1;"";[.C65]) -> 0.045452 | H65: of:=IF([.D65]=1;"";[.D65]) -> 0.0813982 | I65: of:=IF([.E65]=1;"";[.E65]) -> 0
A66: 25 | B66: strncat: &"olbn"{\0,\x01,\x01,\x01,\x01,\x01} &"foeg"{\0} 4 :=> &"olbnfoeg"{\0,\0} | C66: 0.0396542 | D66: 0.0455545 | E66: 0.01209 | G66: of:=IF([.C66]=1;"";[.C66]) -> 0.0396542 | H66: of:=IF([.D66]=1;"";[.D66]) -> 0.0455545 | I66: of:=IF([.E66]=1;"";[.E66]) -> 0.01209
A67: 26 | B67: strncat: &"mzhpy"{\0,\x01,\x01,\x01,\x01} &""{\0,p,f,b,\0} 4 :=> &"mzhpy"{\0,p,i,z,\0} | C67: 0.0198545 | D67: 1 | E67: 0.0198545 | G67: of:=IF([.C67]=1;"";[.C67]) -> 0.0198545 | H67: of:=IF([.D67]=1;"";[.D67]) ->  | I67: of:=IF([.E67]=1;"";[.E67]) -> 0.0198545
A68: 27 | B68: strncat: &"xnszj"{\0,\x01,\x01,\x01,\x01} &"d"{\0,p,d,\0} 4 :=> &"xnszjd"{\0,p,w,\0} | C68: 0.0152135 | D68: 1 | E68: 0.0102974 | G68: of:=IF([.C68]=1;"";[.C68]) -> 0.0152135 | H68: of:=IF([.D68]=1;"";[.D68]) ->  | I68: of:=IF([.E68]=1;"";[.E68]) -> 0.0102974
A69: 28 | B69: strncat: &"pjdcc"{\0,\x01,\x01,\x01,\x01} &"mp"{\0,p,\0} 4 :=> &"pjdccmp"{\0,p,\0} | C69: 0.0209395 | D69: 0.2171 | E69: 0.0115329 | G69: of:=IF([.C69]=1;"";[.C69]) -> 0.0209395 | H69: of:=IF([.D69]=1;"";[.D69]) -> 0.2171 | I69: of:=IF([.E69]=1;"";[.E69]) -> 0.0115329
A70: 29 | B70: strncat: &"nkpus"{\0,\x01,\x01,\x01,\x01} &"hcq"{\0,\0} 4 :=> &"nkpushcq"{\0,\0} | C70: 0.0272438 | D70: 0.0707377 | E70: 0.011612 | G70: of:=IF([.C70]=1;"";[.C70]) -> 0.0272438 | H70: of:=IF([.D70]=1;"";[.D70]) -> 0.0707377 | I70: of:=IF([.E70]=1;"";[.E70]) -> 0.011612
A71: 30 | B71: strncat: &"tqgvb"{\0,\x01,\x01,\x01,\x01} &"fmuf"{\0} 4 :=> &"tqgvbfmuf"{\0} | C71: 0 | D71: 0.0400287 | E71: 0 | G71: of:=IF([.C71]=1;"";[.C71]) -> 0 | H71: of:=IF([.D71]=1;"";[.D71]) -> 0.0400287 | I71: of:=IF([.E71]=1;"";[.E71]) -> 0
A72: 31 | B72: strncat: &"ipgdhh"{\0,\x01,\x01,\x01} &""{\0,p,m,y,\0} 4 :=> &"ipgdhh"{\0,p,m,\0} | C72: 0.0167457 | D72: 1 | E72: 0.0167457 | G72: of:=IF([.C72]=1;"";[.C72]) -> 0.0167457 | H72: of:=IF([.D72]=1;"";[.D72]) ->  | I72: of:=IF([.E72]=1;"";[.E72]) -> 0.0167457
A73: 32 | B73: strncat: &"snrnsa"{\0,\x01,\x01,\x01} &"o"{\0,p,v,\0} 4 :=> &"snrnsao"{\0,p,\0} | C73: 0.0205161 | D73: 1 | E73: 0.0153032 | G73: of:=IF([.C73]=1;"";[.C73]) -> 0.0205161 | H73: of:=IF([.D73]=1;"";[.D73]) ->  | I73: of:=IF([.E73]=1;"";[.E73]) -> 0.0153032
A74: 33 | B74: strncat: &"xfegcg"{\0,\x01,\x01,\x01} &"vc"{\0,p,\0} 4 :=> &"xfegcgvc"{\0,\0} | C74: 0.0119399 | D74: 0.183708 | E74: 0.00694322 | G74: of:=IF([.C74]=1;"";[.C74]) -> 0.0119399 | H74: of:=IF([.D74]=1;"";[.D74]) -> 0.183708 | I74: of:=IF([.E74]=1;"";[.E74]) -> 0.00694322
A75: 34 | B75: strncat: &"mmyxqr"{\0,\x01,\x01,\x01} &"bmf"{\0,\0} 4 :=> &"mmyxqrbmf"{\0} | C75: 0 | D75: 0.0714655 | E75: 0 | G75: of:=IF([.C75]=1;"";[.C75]) -> 0 | H75: of:=IF([.D75]=1;"";[.D75]) -> 0.0714655 | I75: of:=IF([.E75]=1;"";[.E75]) -> 0
A76: 35 | B76: strncat: &"poynee"{\0,\x01,\x01,\x01} &&10 4 :=> &"poyneeqbre"{} | C76: 0.0211317 | D76: 0.0084612 | G76: of:=IF([.C76]=1;"";[.C76]) -> 0.0211317 | H76: of:=IF([.D76]=1;"";[.D76]) -> 0.0084612 | I76: of:=IF([.E76]=1;"";[.E76]) ->  
A77: 36 | B77: strncat: &"nxuzitm"{\0,\x01,\x01} &""{\0,p,h,q,\0} 4 :=> &"nxuzitm"{\0,p,\0} | C77: 0.0141581 | D77: 1 | E77: 0.0141581 | G77: of:=IF([.C77]=1;"";[.C77]) -> 0.0141581 | H77: of:=IF([.D77]=1;"";[.D77]) ->  | I77: of:=IF([.E77]=1;"";[.E77]) -> 0.0141581
A78: 37 | B78: strncat: &"maxjkdd"{\0,\x01,\x01} &"e"{\0,p,u,\0} 4 :=> &"maxjkdde"{\0,\0} | C78: 0 | D78: 1 | E78: 0 | G78: of:=IF([.C78]=1;"";[.C78]) -> 0 | H78: of:=IF([.D78]=1;"";[.D78]) ->  | I78: of:=IF([.E78]=1;"";[.E78]) -> 0
A79: 38 | B79: strncat: &"yueguyc"{\0,\x01,\x01} &"xc"{\0,p,\0} 4 :=> &"yueguycxc"{\0} | C79: 0.0145332 | D79: 0.203502 | E79: 0.00779361 | G79: of:=IF([.C79]=1;"";[.C79]) -> 0.0145332 | H79: of:=IF([.D79]=1;"";[.D79]) -> 0.203502 | I79: of:=IF([.E79]=1;"";[.E79]) -> 0.00779361
A80: 39 | B80: strncat: &"biardahd"{\0,\x01} &""{\0,p,c,l,\0} 4 :=> &"biardahd"{\0,\0} | C80: 0.0129988 | D80: 1 | E80: 0.0129988 | G80: of:=IF([.C80]=1;"";[.C80]) -> 0.0129988 | H80: of:=IF([.D80]=1;"";[.D80]) ->  | I80: of:=IF([.E80]=1;"";[.E80]) -> 0.0129988
A81: 40 | B81: strncat: &"nwyhtvku"{\0,\x01} &"b"{\0,p,h,\0} 4 :=> &"nwyhtvkub"{\0} | C81: 0.00956208 | D81: 1 | E81: 0.00830668 | G81: of:=IF([.C81]=1;"";[.C81]) -> 0.00956208 | H81: of:=IF([.D81]=1;"";[.D81]) ->  | I81: of:=IF([.E81]=1;"";[.E81]) -> 0.00830668
A82: 41 | B82: strncat: &"aegffdlin"{\0} &""{\0,p,v,c,\0} 4 :=> &"aegffdlin"{\0} | C82: 0.00966635 | D82: 1 | E82: 0.00966635 | G82: of:=IF([.C82]=1;"";[.C82]) -> 0.00966635 | H82: of:=IF([.D82]=1;"";[.D82]) ->  | I82: of:=IF([.E82]=1;"";[.E82]) -> 0.00966635

Sheet: strstr
A1: # | B1: Test Case | C1: N | G1: N1 | H1: N2 | I1: N3
A2: 1 | B2: strstr: &"l"{\0,h,x,o,\0} &"l"{\0,\0} :=> &"l"{\0,h,x,o,\0} | C2: 1 | D2: 1 | E2: 1 | G2: of:=IF([.C2]=1;"";[.C2]) ->  | H2: of:=IF([.D2]=1;"";[.D2]) ->  | I2: of:=IF([.E2]=1;"";[.E2]) ->  | K2: of:=AVERAGE([.G2:.G19]) -> 0.0600314882352941 | L2: of:=AVERAGE([.H2:.H19]) -> 0.202898111111111 | M2: of:=AVERAGE([.I2:.I19]) -> 0.09494571875 | O2: of:=AVERAGE([.K2:.M2]) -> 0.119291772698802
A3: 2 | B3: strstr: &"mj"{\0,h,g,\0} &"m"{\0,\0} :=> &"mj"{\0,h,g,\0} | C3: 0.160898 | D3: 1 | E3: 0.160898 | G3: of:=IF([.C3]=1;"";[.C3]) -> 0.160898 | H3: of:=IF([.D3]=1;"";[.D3]) ->  | I3: of:=IF([.E3]=1;"";[.E3]) -> 0.160898
A4: 3 | B4: strstr: &"jq"{\0,b,e,\0} &"q"{\0,\0} :=> &"q"{\0,b,e,\0,54} | C4: 0 | D4: 1 | E4: 1 | G4: of:=IF([.C4]=1;"";[.C4]) -> 0 | H4: of:=IF([.D4]=1;"";[.D4]) ->  | I4: of:=IF([.E4]=1;"";[.E4]) -> 
A5: 4 | B5: strstr: &"mle"{\0,h,\0} &"m"{\0,\0} :=> &"mle"{\0,h,\0} | C5: 0.078945 | D5: 1 | E5: 0.078945 | G5: of:=IF([.C5]=1;"";[.C5]) -> 0.078945 | H5: of:=IF([.D5]=1;"";[.D5]) ->  | I5: of:=IF([.E5]=1;"";[.E5]) -> 0.078945
A6: 5 | B6: strstr: &"amn"{\0,b,\0} &"m"{\0,\0} :=> &"mn"{\0,b,\0,54} | C6: 0.0803682 | D6: 1 | E6: 0.196689 | G6: of:=IF([.C6]=1;"";[.C6]) -> 0.0803682 | H6: of:=IF([.D6]=1;"";[.D6]) ->  | I6: of:=IF([.E6]=1;"";[.E6]) -> 0.196689
A7: 6 | B7: strstr: &"lekg"{\0,\0} &"l"{\0,\0} :=> &"lekg"{\0,\0} | C7: 0.0414462 | D7: 1 | E7: 0.0414462 | G7: of:=IF([.C7]=1;"";[.C7]) -> 0.0414462 | H7: of:=IF([.D7]=1;"";[.D7]) ->  | I7: of:=IF([.E7]=1;"";[.E7]) -> 0.0414462
A8: 7 | B8: strstr: &"qwek"{\0,\0} &"w"{\0,\0} :=> &"wek"{\0,\0,54} | C8: 0.0285505 | D8: 1 | E8: 0.0839492 | G8: of:=IF([.C8]=1;"";[.C8]) -> 0.0285505 | H8: of:=IF([.D8]=1;"";[.D8]) ->  | I8: of:=IF([.E8]=1;"";[.E8]) -> 0.0839492
A9: 8 | B9: strstr: &"kymdf"{\0} &"k"{\0,\0} :=> &"kymdf"{\0} | C9: 0.0238356 | D9: 1 | E9: 0.0238356 | G9: of:=IF([.C9]=1;"";[.C9]) -> 0.0238356 | H9: of:=IF([.D9]=1;"";[.D9]) ->  | I9: of:=IF([.E9]=1;"";[.E9]) -> 0.0238356
A10: 9 | B10: strstr: &"iweph"{\0} &"w"{\0,\0} :=> &"weph"{\0,54} | C10: 0.0274659 | D10: 1 | E10: 0.045886 | G10: of:=IF([.C10]=1;"";[.C10]) -> 0.0274659 | H10: of:=IF([.D10]=1;"";[.D10]) ->  | I10: of:=IF([.E10]=1;"";[.E10]) -> 0.045886
A11: 10 | B11: strstr: &"mp"{\0,d,w,\0} &"mp"{\0} :=> &"mp"{\0,d,w,\0} | C11: 0.2171 | D11: 0.2171 | E11: 0.2171 | G11: of:=IF([.C11]=1;"";[.C11]) -> 0.2171 | H11: of:=IF([.D11]=1;"";[.D11]) -> 0.2171 | I11: of:=IF([.E11]=1;"";[.E11]) -> 0.2171
A12: 11 | B12: strstr: &"xcm"{\0,d,\0} &"xc"{\0} :=> &"xcm"{\0,d,\0} | C12: 0.06913 | D12: 0.203502 | E12: 0.06913 | G12: of:=IF([.C12]=1;"";[.C12]) -> 0.06913 | H12: of:=IF([.D12]=1;"";[.D12]) -> 0.203502 | I12: of:=IF([.E12]=1;"";[.E12]) -> 0.06913
A13: 12 | B13: strstr: &"wwq"{\0,a,\0} &"wq"{\0} :=> &"wq"{\0,a,\0,54} | C13: 0.0458752 | D13: 0.138419 | E13: 0.138419 | G13: of:=IF([.C13]=1;"";[.C13]) -> 0.0458752 | H13: of:=IF([.D13]=1;"";[.D13]) -> 0.138419 | I13: of:=IF([.E13]=1;"";[.E13]) -> 0.138419
A14: 13 | B14: strstr: &"len"{\0,p,\0} &"en"{\0} :=> &"en"{\0,p,\0,54} | C14: 0.0893632 | D14: 0.224112 | E14: 0.224112 | G14: of:=IF([.C14]=1;"";[.C14]) -> 0.0893632 | H14: of:=IF([.D14]=1;"";[.D14]) -> 0.224112 | I14: of:=IF([.E14]=1;"";[.E14]) -> 0.224112
A15: 14 | B15: strstr: &"stnk"{\0,\0} &"st"{\0} :=> &"stnk"{\0,\0} | C15: 0.0449753 | D15: 0.223271 | E15: 0.0449753 | G15: of:=IF([.C15]=1;"";[.C15]) -> 0.0449753 | H15: of:=IF([.D15]=1;"";[.D15]) -> 0.223271 | I15: of:=IF([.E15]=1;"";[.E15]) -> 0.0449753
A16: 15 | B16: strstr: &"eeiz"{\0,\0} &"ei"{\0} :=> &"eiz"{\0,\0,54} | C16: 0.0459251 | D16: 0.214762 | E16: 0.0836059 | G16: of:=IF([.C16]=1;"";[.C16]) -> 0.0459251 | H16: of:=IF([.D16]=1;"";[.D16]) -> 0.214762 | I16: of:=IF([.E16]=1;"";[.E16]) -> 0.0836059
A17: 16 | B17: strstr: &"hkif"{\0,\0} &"ki"{\0} :=> &"kif"{\0,\0,54} | C17: 0.0410923 | D17: 0.213322 | E17: 0.0845755 | G17: of:=IF([.C17]=1;"";[.C17]) -> 0.0410923 | H17: of:=IF([.D17]=1;"";[.D17]) -> 0.213322 | I17: of:=IF([.E17]=1;"";[.E17]) -> 0.0845755
A18: 17 | B18: strstr: &"lchfs"{\0} &"lc"{\0} :=> &"lchfs"{\0} | C18: 0.0255648 | D18: 0.199652 | E18: 0.0255648 | G18: of:=IF([.C18]=1;"";[.C18]) -> 0.0255648 | H18: of:=IF([.D18]=1;"";[.D18]) -> 0.199652 | I18: of:=IF([.E18]=1;"";[.E18]) -> 0.0255648
A19: 18 | B19: strstr: &"iijqa"{\0} &"ij"{\0} :=> &"ijqa"{\0,54} | C19: 0 | D19: 0.191943 | E19: 0 | G19: of:=IF([.C19]=1;"";[.C19]) -> 0 | H19: of:=IF([.D19]=1;"";[.D19]) -> 0.191943 | I19: of:=IF([.E19]=1;"";[.E19]) -> 0
A20: 19 | B20: strstr: &"tvqbd"{\0} &"vq"{\0} :=> &"vqbd"{\0,54} | C20: 0 | D20: 0 | E20: 0 | G20: of:=IF([.C20]=1;"";[.C20]) -> 0 | H20: of:=IF([.D20]=1;"";[.D20]) -> 0 | I20: of:=IF([.E20]=1;"";[.E20]) -> 0 | K20: of:=AVERAGE([.G20:.G24]) -> 0.01522558 | L20: of:=AVERAGE([.H20:.H24]) -> 0.1002665 | M20: of:=AVERAGE([.I20:.I24]) -> 0.01812288 | O20: of:=AVERAGE([.K20:.M20]) -> 0.04453832
A21: 1 | B21: strnstr: &"bemqq"{\0} &""{\0,p,\0} 2 :=> &"bemqq"{\0} | C21: 0.0161437 | D21: 1 | E21: 0.0161437 | G21: of:=IF([.C21]=1;"";[.C21]) -> 0.0161437 | H21: of:=IF([.D21]=1;"";[.D21]) ->  | I21: of:=IF([.E21]=1;"";[.E21]) -> 0.0161437
A22: 2 | B22: strnstr: &"brnvj"{\0} &"b"{\0,\0} 2 :=> &"brnvj"{\0} | C22: 0.0195415 | D22: 1 | E22: 0.0195415 | G22: of:=IF([.C22]=1;"";[.C22]) -> 0.0195415 | H22: of:=IF([.D22]=1;"";[.D22]) ->  | I22: of:=IF([.E22]=1;"";[.E22]) -> 0.0195415
A23: 3 | B23: strnstr: &"zjvys"{\0} &"j"{\0,\0} 2 :=> &"jvys"{\0,54} | C23: 0.012652 | D23: 1 | E23: 0.0271385 | G23: of:=IF([.C23]=1;"";[.C23]) -> 0.012652 | H23: of:=IF([.D23]=1;"";[.D23]) ->  | I23: of:=IF([.E23]=1;"";[.E23]) -> 0.0271385
A24: 4 | B24: strnstr: &"sbatg"{\0} &"sb"{\0} 2 :=> &"sbatg"{\0} | C24: 0.0277907 | D24: 0.200533 | E24: 0.0277907 | G24: of:=IF([.C24]=1;"";[.C24]) -> 0.0277907 | H24: of:=IF([.D24]=1;"";[.D24]) -> 0.200533 | I24: of:=IF([.E24]=1;"";[.E24]) -> 0.0277907
A25: 1 | B25: strpbrk: &"suzdi"{\0} &"aeiou"{\0} :=> &"uzdi"{\0,54} | C25: 0.025114 | D25: 0.0299288 | E25: 0.0376772 | G25: of:=IF([.C25]=1;"";[.C25]) -> 0.025114 | H25: of:=IF([.D25]=1;"";[.D25]) -> 0.0299288 | I25: of:=IF([.E25]=1;"";[.E25]) -> 0.0376772 | K25: of:=AVERAGE([.G25:.G34]) -> 0.02299548 | L25: of:=AVERAGE([.H25:.H34]) -> 0.0299288 | M25: of:=AVERAGE([.I25:.I34]) -> 0.02946644 | O25: of:=AVERAGE([.K25:.M25]) -> 0.0274635733333333
A26: 2 | B26: strpbrk: &"loeik"{\0} &"aeiou"{\0} :=> &"oeik"{\0,54} | C26: 0.0290347 | D26: 0.0299288 | E26: 0.0444373 | G26: of:=IF([.C26]=1;"";[.C26]) -> 0.0290347 | H26: of:=IF([.D26]=1;"";[.D26]) -> 0.0299288 | I26: of:=IF([.E26]=1;"";[.E26]) -> 0.0444373
A27: 3 | B27: strpbrk: &"yihbt"{\0} &"aeiou"{\0} :=> &"ihbt"{\0,54} | C27: 0.0247527 | D27: 0.0299288 | E27: 0.0380787 | G27: of:=IF([.C27]=1;"";[.C27]) -> 0.0247527 | H27: of:=IF([.D27]=1;"";[.D27]) -> 0.0299288 | I27: of:=IF([.E27]=1;"";[.E27]) -> 0.0380787
A28: 4 | B28: strpbrk: &"keznj"{\0} &"aeiou"{\0} :=> &"eznj"{\0,54} | C28: 0.024258 | D28: 0.0299288 | E28: 0.0360812 | G28: of:=IF([.C28]=1;"";[.C28]) -> 0.024258 | H28: of:=IF([.D28]=1;"";[.D28]) -> 0.0299288 | I28: of:=IF([.E28]=1;"";[.E28]) -> 0.0360812
A29: 5 | B29: strpbrk: &"paspq"{\0} &"aeiou"{\0} :=> &"aspq"{\0,54} | C29: 0.0240142 | D29: 0.0299288 | E29: 0.0356088 | G29: of:=IF([.C29]=1;"";[.C29]) -> 0.0240142 | H29: of:=IF([.D29]=1;"";[.D29]) -> 0.0299288 | I29: of:=IF([.E29]=1;"";[.E29]) -> 0.0356088
A30: 6 | B30: strpbrk: &"uvpyy"{\0} &"aeiou"{\0} :=> &"uvpyy"{\0} | C30: 0 | D30: 0.0299288 | E30: 0 | G30: of:=IF([.C30]=1;"";[.C30]) -> 0 | H30: of:=IF([.D30]=1;"";[.D30]) -> 0.0299288 | I30: of:=IF([.E30]=1;"";[.E30]) -> 0
A31: 7 | B31: strpbrk: &"oceem"{\0} &"aeiou"{\0} :=> &"oceem"{\0} | C31: 0.0307769 | D31: 0.0299288 | E31: 0.0307769 | G31: of:=IF([.C31]=1;"";[.C31]) -> 0.0307769 | H31: of:=IF([.D31]=1;"";[.D31]) -> 0.0299288 | I31: of:=IF([.E31]=1;"";[.E31]) -> 0.0307769
A32: 8 | B32: strpbrk: &"iacbp"{\0} &"aeiou"{\0} :=> &"iacbp"{\0} | C32: 0.0234557 | D32: 0.0299288 | E32: 0.0234557 | G32: of:=IF([.C32]=1;"";[.C32]) -> 0.0234557 | H32: of:=IF([.D32]=1;"";[.D32]) -> 0.0299288 | I32: of:=IF([.E32]=1;"";[.E32]) -> 0.0234557
A33: 9 | B33: strpbrk: &"eaxfu"{\0} &"aeiou"{\0} :=> &"eaxfu"{\0} | C33: 0.0264667 | D33: 0.0299288 | E33: 0.0264667 | G33: of:=IF([.C33]=1;"";[.C33]) -> 0.0264667 | H33: of:=IF([.D33]=1;"";[.D33]) -> 0.0299288 | I33: of:=IF([.E33]=1;"";[.E33]) -> 0.0264667
A34: 10 | B34: strpbrk: &"auhbk"{\0} &"aeiou"{\0} :=> &"auhbk"{\0} | C34: 0.0220819 | D34: 0.0299288 | E34: 0.0220819 | G34: of:=IF([.C34]=1;"";[.C34]) -> 0.0220819 | H34: of:=IF([.D34]=1;"";[.D34]) -> 0.0299288 | I34: of:=IF([.E34]=1;"";[.E34]) -> 0.0220819