Sheet: strlen
A1: strlen: &"\x01"{\0,\0,\0,\0,\0} :=> 1; | J1: # | K1: Test Case | L1: N | P1: FINAL
A2: strlen: &"\x01\x01"{\0,\0,\0,\0} :=> 2; | J2: 1 | K2: strlen: &"t"{\0,p,p,p,\0} :=> 1 | L2: 1 | N2: of:=IF([.L2]=1;"";[.L2]) ->  | P2: of:=AVERAGE([.N2:.N6]) -> 0.084616775
A3: strlen: &"\x01\x01\x01"{\0,\0,\0} :=> 3; | J3: 2 | K3: strlen: &"sz"{\0,p,v,\0} :=> 2 | L3: 0.183097 | N3: of:=IF([.L3]=1;"";[.L3]) -> 0.183097
A4: strlen: &"\x01\x01\x01\x01"{\0,\0} :=> 4; | J4: 3 | K4: strlen: &"rox"{\0,p,\0} :=> 3 | L4: 0.0828791 | N4: of:=IF([.L4]=1;"";[.L4]) -> 0.0828791
A5: strlen: &"\x01\x01\x01\x01\x01"{\0} :=> 5; | J5: 4 | K5: strlen: &"ycua"{\0,\0} :=> 4 | L5: 0.0436399 | N5: of:=IF([.L5]=1;"";[.L5]) -> 0.0436399
A6: strnlen: &""{\0,\0,\0,\0,\0,\0} 6 :=> 0; 1; | J6: 5 | K6: strlen: &"gnbee"{\0} :=> 5 | L6: 0.0288511 | N6: of:=IF([.L6]=1;"";[.L6]) -> 0.0288511
A7: strnlen: &"\x01"{\0,\0,\0,\0,\0} 6 :=> 1; | J7: 1 | K7: strnlen: &""{\0,p,t,a,u,\0} 6 :=> 0 | L7: 1 | N7: of:=IF([.L7]=1;"";[.L7]) ->  | P7: of:=AVERAGE([.N7:.N12]) -> 0.090551725
A8: strnlen: &"\x01\x01"{\0,\0,\0,\0} 6 :=> 2; | J8: 2 | K8: strnlen: &"g"{\0,p,b,f,\0} 6 :=> 1 | L8: 1 | N8: of:=IF([.L8]=1;"";[.L8]) -> 
A9: strnlen: &"\x01\x01\x01"{\0,\0,\0} 6 :=> 3; | J9: 3 | K9: strnlen: &"kn"{\0,p,o,\0} 6 :=> 2 | L9: 0.20725 | N9: of:=IF([.L9]=1;"";[.L9]) -> 0.20725
A10: strnlen: &"\x01\x01\x01\x01"{\0,\0} 6 :=> 4; | J10: 4 | K10: strnlen: &"nor"{\0,p,\0} 6 :=> 3 | L10: 0.0895116 | N10: of:=IF([.L10]=1;"";[.L10]) -> 0.0895116
A11: strnlen: &"\x01\x01\x01\x01\x01"{\0} 6 :=> 5; | J11: 5 | K11: strnlen: &"lrtg"{\0,\0} 6 :=> 4 | L11: 0.0418251 | N11: of:=IF([.L11]=1;"";[.L11]) -> 0.0418251
J12: 6 | K12: strnlen: &"wgnrp"{\0} 6 :=> 5 | L12: 0.0236202 | N12: of:=IF([.L12]=1;"";[.L12]) -> 0.0236202

Sheet: strcmp
A1: # | B1: Test Case | C1: N1 | D1: N2 | L1: FINAL
A2: 1 | B2: strcmp: &"h"{\0,p,n,b,\0} &"h"{\0,p,e,i,\0} :=> 0 | C2: 1 | D2: 1 | F2: of:=IF([.C2]=1;"";[.C2]) ->  | G2: of:=IF([.D2]=1;"";[.D2]) ->  | H2: of:=IF([.E2]=1;"";[.E2]) ->   | I2: of:=AVERAGE([.F2:.F16]) -> 0.0358315285714286 | J2: of:=AVERAGE([.G2:.G16]) -> 0.0380006214285714 | L2: of:=AVERAGE([.I2:.J2]) -> 0.036916075
A3: 2 | B3: strcmp: &"mi"{\0,p,s,\0} &"mi"{\0,p,o,\0} :=> 0 | C3: 0.218014 | D3: 0.218014 | F3: of:=IF([.C3]=1;"";[.C3]) -> 0.218014 | G3: of:=IF([.D3]=1;"";[.D3]) -> 0.218014 | H3: of:=IF([.E3]=1;"";[.E3]) ->  
A4: 3 | B4: strcmp: &"znq"{\0,p,\0} &"znq"{\0,p,\0} :=> 0 | C4: 0.0656357 | D4: 0.0656357 | F4: of:=IF([.C4]=1;"";[.C4]) -> 0.0656357 | G4: of:=IF([.D4]=1;"";[.D4]) -> 0.0656357 | H4: of:=IF([.E4]=1;"";[.E4]) ->  
A5: 4 | B5: strcmp: &"zelr"{\0,\0} &"zelr"{\0,\0} :=> 0 | C5: 0.0438691 | D5: 0.0438691 | F5: of:=IF([.C5]=1;"";[.C5]) -> 0.0438691 | G5: of:=IF([.D5]=1;"";[.D5]) -> 0.0438691 | H5: of:=IF([.E5]=1;"";[.E5]) ->  
A6: 5 | B6: strcmp: &"skmaw"{\0} &"skmaw"{\0} :=> 0 | C6: 0.0271253 | D6: 0.0271253 | F6: of:=IF([.C6]=1;"";[.C6]) -> 0.0271253 | G6: of:=IF([.D6]=1;"";[.D6]) -> 0.0271253 | H6: of:=IF([.E6]=1;"";[.E6]) ->  
A7: 6 | B7: strcmp: &"jtadr"{\0} &"jtadf"{\0} :=> 1 | C7: 0.024437 | D7: 0.0232097 | F7: of:=IF([.C7]=1;"";[.C7]) -> 0.024437 | G7: of:=IF([.D7]=1;"";[.D7]) -> 0.0232097 | H7: of:=IF([.E7]=1;"";[.E7]) ->  
A8: 7 | B8: strcmp: &"xtxur"{\0} &"xtxuy"{\0} :=> -1 | C8: 0.0229889 | D8: 0.021961 | F8: of:=IF([.C8]=1;"";[.C8]) -> 0.0229889 | G8: of:=IF([.D8]=1;"";[.D8]) -> 0.021961 | H8: of:=IF([.E8]=1;"";[.E8]) ->  
A9: 8 | B9: strcmp: &"djkld"{\0} &"djkjw"{\0} :=> 1 | C9: 0.0234566 | D9: 0 | F9: of:=IF([.C9]=1;"";[.C9]) -> 0.0234566 | G9: of:=IF([.D9]=1;"";[.D9]) -> 0 | H9: of:=IF([.E9]=1;"";[.E9]) ->  
A10: 9 | B10: strcmp: &"fnxvp"{\0} &"fnxzx"{\0} :=> -1 | C10: 0 | D10: 0 | F10: of:=IF([.C10]=1;"";[.C10]) -> 0 | G10: of:=IF([.D10]=1;"";[.D10]) -> 0 | H10: of:=IF([.E10]=1;"";[.E10]) ->  
A11: 10 | B11: strcmp: &"qahxc"{\0} &"qadxy"{\0} :=> 1 | C11: 0 | D11: 0 | F11: of:=IF([.C11]=1;"";[.C11]) -> 0 | G11: of:=IF([.D11]=1;"";[.D11]) -> 0 | H11: of:=IF([.E11]=1;"";[.E11]) ->  
A12: 11 | B12: strcmp: &"xchzw"{\0} &"xcwam"{\0} :=> -1 | C12: 0.0212666 | D12: 0.024258 | F12: of:=IF([.C12]=1;"";[.C12]) -> 0.0212666 | G12: of:=IF([.D12]=1;"";[.D12]) -> 0.024258
A13: 12 | B13: strcmp: &"ruyaa"{\0} &"rahni"{\0} :=> 1 | C13: 0.0261406 | D13: 0.0289536 | F13: of:=IF([.C13]=1;"";[.C13]) -> 0.0261406 | G13: of:=IF([.D13]=1;"";[.D13]) -> 0.0289536
A14: 13 | B14: strcmp: &"oviao"{\0} &"oyqtd"{\0} :=> -1 | C14: 0.0287076 | D14: 0.016132 | F14: of:=IF([.C14]=1;"";[.C14]) -> 0.0287076 | G14: of:=IF([.D14]=1;"";[.D14]) -> 0.016132
A15: 14 | B15: strcmp: &"bsxut"{\0} &"amils"{\0} :=> 1 | C15: 0 | D15: 0.0306371 | F15: of:=IF([.C15]=1;"";[.C15]) -> 0 | G15: of:=IF([.D15]=1;"";[.D15]) -> 0.0306371
A16: 15 | B16: strcmp: &"dpqhd"{\0} &"sinta"{\0} :=> -1 | C16: 0 | D16: 0.0322132 | F16: of:=IF([.C16]=1;"";[.C16]) -> 0 | G16: of:=IF([.D16]=1;"";[.D16]) -> 0.0322132
A17: 1 | B17: strncmp: &""{\0,p,y,q,f,\0} &""{\0,p,v,g,r,\0} 5 :=> 0 | C17: 1 | D17: 1 | F17: of:=IF([.C17]=1;"";[.C17]) ->  | G17: of:=IF([.D17]=1;"";[.D17]) ->  | I17: of:=AVERAGE([.F17:.F32]) -> 0.0331708 | J17: of:=AVERAGE([.G17:.G32]) -> 0.0359195 | L17: of:=AVERAGE([.I17:.J17]) -> 0.03454515
A18: 2 | B18: strncmp: &"w"{\0,p,s,h,\0} &"w"{\0,p,n,h,\0} 5 :=> 0 | C18: 1 | D18: 1 | F18: of:=IF([.C18]=1;"";[.C18]) ->  | G18: of:=IF([.D18]=1;"";[.D18]) -> 
A19: 3 | B19: strncmp: &"ut"{\0,p,v,\0} &"ut"{\0,p,g,\0} 5 :=> 0 | C19: 0.219808 | D19: 0.219808 | F19: of:=IF([.C19]=1;"";[.C19]) -> 0.219808 | G19: of:=IF([.D19]=1;"";[.D19]) -> 0.219808
A20: 4 | B20: strncmp: &"zyx"{\0,p,\0} &"zyx"{\0,p,\0} 5 :=> 0 | C20: 0.0646865 | D20: 0.0646865 | F20: of:=IF([.C20]=1;"";[.C20]) -> 0.0646865 | G20: of:=IF([.D20]=1;"";[.D20]) -> 0.0646865
A21: 5 | B21: strncmp: &"kayv"{\0,\0} &"kayv"{\0,\0} 5 :=> 0 | C21: 0.0401018 | D21: 0.0401018 | F21: of:=IF([.C21]=1;"";[.C21]) -> 0.0401018 | G21: of:=IF([.D21]=1;"";[.D21]) -> 0.0401018
A22: 6 | B22: strncmp: &"wvgcl"{\0} &"wvgcl"{\0} 5 :=> 0 | C22: 0.0148018 | D22: 0.0148018 | F22: of:=IF([.C22]=1;"";[.C22]) -> 0.0148018 | G22: of:=IF([.D22]=1;"";[.D22]) -> 0.0148018
A23: 7 | B23: strncmp: &"adyqk"{\0} &"adyqi"{\0} 5 :=> 1 | C23: 0 | D23: 0.0206873 | F23: of:=IF([.C23]=1;"";[.C23]) -> 0 | G23: of:=IF([.D23]=1;"";[.D23]) -> 0.0206873
A24: 8 | B24: strncmp: &"qpvpo"{\0} &"qpvpt"{\0} 5 :=> -1 | C24: 0 | D24: 0 | F24: of:=IF([.C24]=1;"";[.C24]) -> 0 | G24: of:=IF([.D24]=1;"";[.D24]) -> 0
A25: 9 | B25: strncmp: &"vcinu"{\0} &"vciic"{\0} 5 :=> 1 | C25: 0.0279481 | D25: 0.0260223 | F25: of:=IF([.C25]=1;"";[.C25]) -> 0.0279481 | G25: of:=IF([.D25]=1;"";[.D25]) -> 0.0260223
A26: 10 | B26: strncmp: &"ncukd"{\0} &"ncuzg"{\0} 5 :=> -1 | C26: 0.0265126 | D26: 0.0251565 | F26: of:=IF([.C26]=1;"";[.C26]) -> 0.0265126 | G26: of:=IF([.D26]=1;"";[.D26]) -> 0.0251565
A27: 11 | B27: strncmp: &"azvbd"{\0} &"azhtf"{\0} 5 :=> 1 | C27: 0 | D27: 0.0252977 | F27: of:=IF([.C27]=1;"";[.C27]) -> 0 | G27: of:=IF([.D27]=1;"";[.D27]) -> 0.0252977
A28: 12 | B28: strncmp: &"nvkqi"{\0} &"nvqqb"{\0} 5 :=> -1 | C28: 0 | D28: 0 | F28: of:=IF([.C28]=1;"";[.C28]) -> 0 | G28: of:=IF([.D28]=1;"";[.D28]) -> 0
A29: 13 | B29: strncmp: &"gqzuk"{\0} &"gpsyo"{\0} 5 :=> 1 | C29: 0 | D29: 0.0254897 | F29: of:=IF([.C29]=1;"";[.C29]) -> 0 | G29: of:=IF([.D29]=1;"";[.D29]) -> 0.0254897
A30: 14 | B30: strncmp: &"ptfkj"{\0} &"putqy"{\0} 5 :=> -1 | C30: 0.0216124 | D30: 0 | F30: of:=IF([.C30]=1;"";[.C30]) -> 0.0216124 | G30: of:=IF([.D30]=1;"";[.D30]) -> 0
A31: 15 | B31: strncmp: &"ugnmp"{\0} &"cnvvh"{\0} 5 :=> 1 | C31: 0.028887 | D31: 0.0170431 | F31: of:=IF([.C31]=1;"";[.C31]) -> 0.028887 | G31: of:=IF([.D31]=1;"";[.D31]) -> 0.0170431
A32: 16 | B32: strncmp: &"ijbao"{\0} &"mmbvd"{\0} 5 :=> -1 | C32: 0.020033 | D32: 0.0237783 | F32: of:=IF([.C32]=1;"";[.C32]) -> 0.020033 | G32: of:=IF([.D32]=1;"";[.D32]) -> 0.0237783
A33: 1 | B33: sysfs_streq: &""{\0,p,o,a,x,\0} &"xyxse"{\0} :=> \0 | C33: 1 | D33: 0.0212477 | F33: of:=IF([.C33]=1;"";[.C33]) ->  | G33: of:=IF([.D33]=1;"";[.D33]) -> 0.0212477 | I33: of:=AVERAGE([.F33:.F71]) -> 0.0541886448275862 | J33: of:=AVERAGE([.G33:.G71]) -> 0.0390407642857143 | L33: of:=AVERAGE([.I33:.J33]) -> 0.0466147045566502
A34: 2 | B34: sysfs_streq: &""{\0,p,l,j,j,\0} &"\n"{\0,b,a,y,\0} :=> \x01 | C34: 1 | F34: of:=IF([.C34]=1;"";[.C34]) ->  | G34: of:=IF([.D34]=1;"";[.D34]) ->  
A35: 3 | B35: sysfs_streq: &""{\0,p,m,m,x,\0} &"\natav"{\0} :=> \0 | C35: 1 | F35: of:=IF([.C35]=1;"";[.C35]) ->  | G35: of:=IF([.D35]=1;"";[.D35]) ->  
A36: 4 | B36: sysfs_streq: &""{\0,p,f,v,x,\0} &""{\0,h,q,i,e,\0} :=> \x01 | C36: 1 | D36: 1 | F36: of:=IF([.C36]=1;"";[.C36]) ->  | G36: of:=IF([.D36]=1;"";[.D36]) -> 
A37: 5 | B37: sysfs_streq: &"xuylu"{\0} &"nciou"{\0} :=> \0 | C37: 0.026353 | D37: 0.0312912 | F37: of:=IF([.C37]=1;"";[.C37]) -> 0.026353 | G37: of:=IF([.D37]=1;"";[.D37]) -> 0.0312912
A38: 6 | B38: sysfs_streq: &"\n"{\0,p,o,a,\0} &""{\0,a,w,f,x,\0} :=> \x01 | C38: 1 | F38: of:=IF([.C38]=1;"";[.C38]) ->  | G38: of:=IF([.D38]=1;"";[.D38]) ->  
A39: 7 | B39: sysfs_streq: &"\n"{\0,a,v,r,\0} &"ykget"{\0} :=> \0 | C39: 0.0255631 | F39: of:=IF([.C39]=1;"";[.C39]) -> 0.0255631 | G39: of:=IF([.D39]=1;"";[.D39]) ->  
A40: 8 | B40: sysfs_streq: &"\nakap"{\0} &"cfuyw"{\0} :=> \0 | C40: 0.0224125 | F40: of:=IF([.C40]=1;"";[.C40]) -> 0.0224125 | G40: of:=IF([.D40]=1;"";[.D40]) ->  
A41: 9 | B41: sysfs_streq: &"g"{\0,p,r,m,\0} &"gdyqg"{\0} :=> \0 | C41: 1 | D41: 0 | F41: of:=IF([.C41]=1;"";[.C41]) ->  | G41: of:=IF([.D41]=1;"";[.D41]) -> 0
A42: 10 | B42: sysfs_streq: &"r"{\0,p,m,t,\0} &"r\n"{\0,a,o,\0} :=> \x01 | C42: 1 | F42: of:=IF([.C42]=1;"";[.C42]) ->  | G42: of:=IF([.D42]=1;"";[.D42]) ->  
A43: 11 | B43: sysfs_streq: &"v"{\0,p,y,g,\0} &"v\naed"{\0} :=> \0 | C43: 1 | F43: of:=IF([.C43]=1;"";[.C43]) ->  | G43: of:=IF([.D43]=1;"";[.D43]) ->  
A44: 12 | B44: sysfs_streq: &"s"{\0,p,c,p,\0} &"s"{\0,h,q,u,\0} :=> \x01 | C44: 1 | D44: 1 | F44: of:=IF([.C44]=1;"";[.C44]) ->  | G44: of:=IF([.D44]=1;"";[.D44]) -> 
A45: 13 | B45: sysfs_streq: &"pzzwi"{\0} &"peezi"{\0} :=> \0 | C45: 0.0217413 | D45: 0.028202 | F45: of:=IF([.C45]=1;"";[.C45]) -> 0.0217413 | G45: of:=IF([.D45]=1;"";[.D45]) -> 0.028202
A46: 14 | B46: sysfs_streq: &"h\n"{\0,b,t,\0} &"h"{\0,b,k,x,\0} :=> \x01 | C46: 1 | F46: of:=IF([.C46]=1;"";[.C46]) ->  | G46: of:=IF([.D46]=1;"";[.D46]) ->  
A47: 15 | B47: sysfs_streq: &"x\n"{\0,b,p,\0} &"xqhrr"{\0} :=> \0 | C47: 0 | F47: of:=IF([.C47]=1;"";[.C47]) -> 0 | G47: of:=IF([.D47]=1;"";[.D47]) ->  
A48: 16 | B48: sysfs_streq: &"j\naxg"{\0} &"jimhw"{\0} :=> \0 | C48: 0.0242166 | F48: of:=IF([.C48]=1;"";[.C48]) -> 0.0242166 | G48: of:=IF([.D48]=1;"";[.D48]) ->  
A49: 17 | B49: sysfs_streq: &"ku"{\0,p,l,\0} &"kuqwy"{\0} :=> \0 | C49: 0.193586 | D49: 0.0163498 | F49: of:=IF([.C49]=1;"";[.C49]) -> 0.193586 | G49: of:=IF([.D49]=1;"";[.D49]) -> 0.0163498
A50: 18 | B50: sysfs_streq: &"jq"{\0,p,i,\0} &"jq\n"{\0,a,\0} :=> \x01 | C50: 0 | F50: of:=IF([.C50]=1;"";[.C50]) -> 0 | G50: of:=IF([.D50]=1;"";[.D50]) ->  
A51: 19 | B51: sysfs_streq: &"kf"{\0,p,g,\0} &"kf\nad"{\0} :=> \0 | C51: 0.188665 | F51: of:=IF([.C51]=1;"";[.C51]) -> 0.188665 | G51: of:=IF([.D51]=1;"";[.D51]) ->  
A52: 20 | B52: sysfs_streq: &"pj"{\0,p,f,\0} &"pj"{\0,b,r,\0} :=> \x01 | C52: 0.174365 | D52: 0.174365 | F52: of:=IF([.C52]=1;"";[.C52]) -> 0.174365 | G52: of:=IF([.D52]=1;"";[.D52]) -> 0.174365
A53: 21 | B53: sysfs_streq: &"knmgh"{\0} &"knvcc"{\0} :=> \0 | C53: 0.0253791 | D53: 0.0259748 | F53: of:=IF([.C53]=1;"";[.C53]) -> 0.0253791 | G53: of:=IF([.D53]=1;"";[.D53]) -> 0.0259748
A54: 22 | B54: sysfs_streq: &"sw\n"{\0,b,\0} &"sw"{\0,b,c,\0} :=> \x01 | C54: 0.203725 | F54: of:=IF([.C54]=1;"";[.C54]) -> 0.203725 | G54: of:=IF([.D54]=1;"";[.D54]) ->  
A55: 23 | B55: sysfs_streq: &"wp\n"{\0,b,\0} &"wptim"{\0} :=> \0 | C55: 0.0272828 | F55: of:=IF([.C55]=1;"";[.C55]) -> 0.0272828 | G55: of:=IF([.D55]=1;"";[.D55]) ->  
A56: 24 | B56: sysfs_streq: &"vy\nax"{\0} &"vywge"{\0} :=> \0 | C56: 0.0232811 | F56: of:=IF([.C56]=1;"";[.C56]) -> 0.0232811 | G56: of:=IF([.D56]=1;"";[.D56]) ->  
A57: 25 | B57: sysfs_streq: &"xnw"{\0,p,\0} &"xnwsw"{\0} :=> \0 | C57: 0.0612896 | D57: 0.0223715 | F57: of:=IF([.C57]=1;"";[.C57]) -> 0.0612896 | G57: of:=IF([.D57]=1;"";[.D57]) -> 0.0223715
A58: 26 | B58: sysfs_streq: &"fgw"{\0,p,\0} &"fgw\n"{\0,\0} :=> \x01 | C58: 0.0662018 | F58: of:=IF([.C58]=1;"";[.C58]) -> 0.0662018 | G58: of:=IF([.D58]=1;"";[.D58]) ->  
A59: 27 | B59: sysfs_streq: &"rjc"{\0,p,\0} &"rjc\na"{\0} :=> \0 | C59: 0.0583831 | F59: of:=IF([.C59]=1;"";[.C59]) -> 0.0583831 | G59: of:=IF([.D59]=1;"";[.D59]) ->  
A60: 28 | B60: sysfs_streq: &"baz"{\0,p,\0} &"baz"{\0,h,\0} :=> \x01 | C60: 0.0820961 | D60: 0.0820961 | F60: of:=IF([.C60]=1;"";[.C60]) -> 0.0820961 | G60: of:=IF([.D60]=1;"";[.D60]) -> 0.0820961
A61: 29 | B61: sysfs_streq: &"yppwh"{\0} &"ypptg"{\0} :=> \0 | C61: 0.0261877 | D61: 0.02669 | F61: of:=IF([.C61]=1;"";[.C61]) -> 0.0261877 | G61: of:=IF([.D61]=1;"";[.D61]) -> 0.02669
A62: 30 | B62: sysfs_streq: &"zzq\n"{\0,\0} &"zzq"{\0,a,\0} :=> \x01 | C62: 0.0617994 | F62: of:=IF([.C62]=1;"";[.C62]) -> 0.0617994 | G62: of:=IF([.D62]=1;"";[.D62]) ->  
A63: 31 | B63: sysfs_streq: &"sdd\n"{\0,\0} &"sddyq"{\0} :=> \0 | C63: 0.0210886 | F63: of:=IF([.C63]=1;"";[.C63]) -> 0.0210886 | G63: of:=IF([.D63]=1;"";[.D63]) ->  
A64: 32 | B64: sysfs_streq: &"vvh\na"{\0} &"vvhij"{\0} :=> \0 | C64: 0.018536 | F64: of:=IF([.C64]=1;"";[.C64]) -> 0.018536 | G64: of:=IF([.D64]=1;"";[.D64]) ->  
A65: 33 | B65: sysfs_streq: &"yegj"{\0,\0} &"yegjo"{\0} :=> \0 | C65: 0.037047 | D65: 0.0242045 | F65: of:=IF([.C65]=1;"";[.C65]) -> 0.037047 | G65: of:=IF([.D65]=1;"";[.D65]) -> 0.0242045
A66: 34 | B66: sysfs_streq: &"ayuf"{\0,\0} &"ayuf\n"{\0} :=> \x01 | C66: 0.0411201 | F66: of:=IF([.C66]=1;"";[.C66]) -> 0.0411201 | G66: of:=IF([.D66]=1;"";[.D66]) ->  
A67: 35 | B67: sysfs_streq: &"cttz"{\0,\0} &"cttz"{\0,\0} :=> \x01 | C67: 0.0445461 | D67: 0.0445461 | F67: of:=IF([.C67]=1;"";[.C67]) -> 0.0445461 | G67: of:=IF([.D67]=1;"";[.D67]) -> 0.0445461
A68: 36 | B68: sysfs_streq: &"baqas"{\0} &"baqao"{\0} :=> \0 | C68: 0.0242162 | D68: 0.0225078 | F68: of:=IF([.C68]=1;"";[.C68]) -> 0.0242162 | G68: of:=IF([.D68]=1;"";[.D68]) -> 0.0225078
A69: 37 | B69: sysfs_streq: &"qwdu\n"{\0} &"qwdu"{\0,\0} :=> \x01 | C69: 0.0271334 | F69: of:=IF([.C69]=1;"";[.C69]) -> 0.0271334 | G69: of:=IF([.D69]=1;"";[.D69]) ->  
A70: 38 | B70: sysfs_streq: &"bgxo\n"{\0} &"bgxoi"{\0} :=> \0 | C70: 0.0185309 | F70: of:=IF([.C70]=1;"";[.C70]) -> 0.0185309 | G70: of:=IF([.D70]=1;"";[.D70]) ->  
A71: 39 | B71: sysfs_streq: &"dtcix"{\0} &"dtcix"{\0} :=> \x01 | C71: 0.0267242 | D71: 0.0267242 | F71: of:=IF([.C71]=1;"";[.C71]) -> 0.0267242 | G71: of:=IF([.D71]=1;"";[.D71]) -> 0.0267242

Sheet: strcpy
A1: # | B1: Test Case | C1: N1 | D1: N2 | E1: N3 | O1: FINAL
A2: 1 | B2: strcpy: &""{\0,\x01,\x01,\x01,\x01,\x01} &"w"{\0,p,a,z,\0} :=> &"w"{\0,p,k,j,\0} | C2: 1 | D2: 1 | E2: 1 | G2: of:=IF([.C2]=1;"";[.C2]) ->  | H2: of:=IF([.D2]=1;"";[.D2]) ->  | I2: of:=IF([.E2]=1;"";[.E2]) ->  | K2: of:=AVERAGE([.G2:.G36]) -> 0.069468475 | L2: of:=AVERAGE([.H2:.H36]) -> 0.0699054041666667 | M2: of:=AVERAGE([.I2:.I36]) -> 0.0699054041666667 | O2: of:=AVERAGE([.K2:.M2]) -> 0.0697597611111111
A3: 2 | B3: strcpy: &""{\0,\x01,\x01,\x01,\x01,\x01} &"yo"{\0,p,g,\0} :=> &"yo"{\0,p,v,\0} | C3: 1 | D3: 0.211356 | E3: 0.211356 | G3: of:=IF([.C3]=1;"";[.C3]) ->  | H3: of:=IF([.D3]=1;"";[.D3]) -> 0.211356 | I3: of:=IF([.E3]=1;"";[.E3]) -> 0.211356
A4: 3 | B4: strcpy: &""{\0,\x01,\x01,\x01,\x01,\x01} &"lpt"{\0,p,\0} :=> &"lpt"{\0,p,\0} | C4: 1 | D4: 0.0810686 | E4: 0.0810686 | G4: of:=IF([.C4]=1;"";[.C4]) ->  | H4: of:=IF([.D4]=1;"";[.D4]) -> 0.0810686 | I4: of:=IF([.E4]=1;"";[.E4]) -> 0.0810686
A5: 4 | B5: strcpy: &""{\0,\x01,\x01,\x01,\x01,\x01} &"ablk"{\0,\0} :=> &"ablk"{\0,\0} | C5: 1 | D5: 0.0451025 | E5: 0.0451025 | G5: of:=IF([.C5]=1;"";[.C5]) ->  | H5: of:=IF([.D5]=1;"";[.D5]) -> 0.0451025 | I5: of:=IF([.E5]=1;"";[.E5]) -> 0.0451025
A6: 5 | B6: strcpy: &""{\0,\x01,\x01,\x01,\x01,\x01} &"xzejy"{\0} :=> &"xzejy"{\0} | C6: 1 | D6: 0 | E6: 0 | G6: of:=IF([.C6]=1;"";[.C6]) ->  | H6: of:=IF([.D6]=1;"";[.D6]) -> 0 | I6: of:=IF([.E6]=1;"";[.E6]) -> 0
A7: 6 | B7: strcpy: &"g"{\0,\x01,\x01,\x01,\x01} &""{\0,p,j,w,z,\0} :=> &""{\0,\0,p,q,u,\0} | C7: 1 | D7: 1 | E7: 1 | G7: of:=IF([.C7]=1;"";[.C7]) ->  | H7: of:=IF([.D7]=1;"";[.D7]) ->  | I7: of:=IF([.E7]=1;"";[.E7]) -> 
A8: 7 | B8: strcpy: &"h"{\0,\x01,\x01,\x01,\x01} &"p"{\0,p,j,n,\0} :=> &"p"{\0,p,n,r,\0} | C8: 1 | D8: 1 | E8: 1 | G8: of:=IF([.C8]=1;"";[.C8]) ->  | H8: of:=IF([.D8]=1;"";[.D8]) ->  | I8: of:=IF([.E8]=1;"";[.E8]) -> 
A9: 8 | B9: strcpy: &"d"{\0,\x01,\x01,\x01,\x01} &"nz"{\0,p,m,\0} :=> &"nz"{\0,p,j,\0} | C9: 1 | D9: 0.19544 | E9: 0.19544 | G9: of:=IF([.C9]=1;"";[.C9]) ->  | H9: of:=IF([.D9]=1;"";[.D9]) -> 0.19544 | I9: of:=IF([.E9]=1;"";[.E9]) -> 0.19544
A10: 9 | B10: strcpy: &"z"{\0,\x01,\x01,\x01,\x01} &"jin"{\0,p,\0} :=> &"jin"{\0,p,\0} | C10: 1 | D10: 0.0814844 | E10: 0.0814844 | G10: of:=IF([.C10]=1;"";[.C10]) ->  | H10: of:=IF([.D10]=1;"";[.D10]) -> 0.0814844 | I10: of:=IF([.E10]=1;"";[.E10]) -> 0.0814844
A11: 10 | B11: strcpy: &"r"{\0,\x01,\x01,\x01,\x01} &"hxqs"{\0,\0} :=> &"hxqs"{\0,\0} | C11: 1 | D11: 0 | E11: 0 | G11: of:=IF([.C11]=1;"";[.C11]) ->  | H11: of:=IF([.D11]=1;"";[.D11]) -> 0 | I11: of:=IF([.E11]=1;"";[.E11]) -> 0
A12: 11 | B12: strcpy: &"x"{\0,\x01,\x01,\x01,\x01} &"rrrrv"{\0} :=> &"rrrrv"{\0} | C12: 1 | D12: 0.0298058 | E12: 0.0298058 | G12: of:=IF([.C12]=1;"";[.C12]) ->  | H12: of:=IF([.D12]=1;"";[.D12]) -> 0.0298058 | I12: of:=IF([.E12]=1;"";[.E12]) -> 0.0298058
A13: 12 | B13: strcpy: &"qk"{\0,\x01,\x01,\x01} &""{\0,p,n,d,y,\0} :=> &""{\0,k,\0,p,w,\0} | C13: 0 | D13: 1 | E13: 1 | G13: of:=IF([.C13]=1;"";[.C13]) -> 0 | H13: of:=IF([.D13]=1;"";[.D13]) ->  | I13: of:=IF([.E13]=1;"";[.E13]) -> 
A14: 13 | B14: strcpy: &"go"{\0,\x01,\x01,\x01} &"u"{\0,p,a,f,\0} :=> &"u"{\0,\0,p,w,\0} | C14: 0.213322 | D14: 1 | E14: 1 | G14: of:=IF([.C14]=1;"";[.C14]) -> 0.213322 | H14: of:=IF([.D14]=1;"";[.D14]) ->  | I14: of:=IF([.E14]=1;"";[.E14]) -> 
A15: 14 | B15: strcpy: &"op"{\0,\x01,\x01,\x01} &"am"{\0,p,q,\0} :=> &"am"{\0,p,c,\0} | C15: 0.216638 | D15: 0.217558 | E15: 0.217558 | G15: of:=IF([.C15]=1;"";[.C15]) -> 0.216638 | H15: of:=IF([.D15]=1;"";[.D15]) -> 0.217558 | I15: of:=IF([.E15]=1;"";[.E15]) -> 0.217558
A16: 15 | B16: strcpy: &"eg"{\0,\x01,\x01,\x01} &"dxi"{\0,p,\0} :=> &"dxi"{\0,p,\0} | C16: 0.213322 | D16: 0 | E16: 0 | G16: of:=IF([.C16]=1;"";[.C16]) -> 0.213322 | H16: of:=IF([.D16]=1;"";[.D16]) -> 0 | I16: of:=IF([.E16]=1;"";[.E16]) -> 0
A17: 16 | B17: strcpy: &"np"{\0,\x01,\x01,\x01} &"fsfd"{\0,\0} :=> &"fsfd"{\0,\0} | C17: 0.196565 | D17: 0.0343495 | E17: 0.0343495 | G17: of:=IF([.C17]=1;"";[.C17]) -> 0.196565 | H17: of:=IF([.D17]=1;"";[.D17]) -> 0.0343495 | I17: of:=IF([.E17]=1;"";[.E17]) -> 0.0343495
A18: 17 | B18: strcpy: &"fa"{\0,\x01,\x01,\x01} &"xjxbc"{\0} :=> &"xjxbc"{\0} | C18: 0.213806 | D18: 0 | E18: 0 | G18: of:=IF([.C18]=1;"";[.C18]) -> 0.213806 | H18: of:=IF([.D18]=1;"";[.D18]) -> 0 | I18: of:=IF([.E18]=1;"";[.E18]) -> 0
A19: 18 | B19: strcpy: &"lvd"{\0,\x01,\x01} &""{\0,p,s,r,q,\0} :=> &""{\0,v,d,\0,p,\0} | C19: 0.0677367 | D19: 1 | E19: 1 | G19: of:=IF([.C19]=1;"";[.C19]) -> 0.0677367 | H19: of:=IF([.D19]=1;"";[.D19]) ->  | I19: of:=IF([.E19]=1;"";[.E19]) -> 
A20: 19 | B20: strcpy: &"ydk"{\0,\x01,\x01} &"k"{\0,p,l,t,\0} :=> &"k"{\0,k,\0,p,\0} | C20: 0.068458 | D20: 1 | E20: 1 | G20: of:=IF([.C20]=1;"";[.C20]) -> 0.068458 | H20: of:=IF([.D20]=1;"";[.D20]) ->  | I20: of:=IF([.E20]=1;"";[.E20]) -> 
A21: 20 | B21: strcpy: &"wza"{\0,\x01,\x01} &"wq"{\0,p,e,\0} :=> &"wq"{\0,\0,p,\0} | C21: 0.0593067 | D21: 0.138419 | E21: 0.138419 | G21: of:=IF([.C21]=1;"";[.C21]) -> 0.0593067 | H21: of:=IF([.D21]=1;"";[.D21]) -> 0.138419 | I21: of:=IF([.E21]=1;"";[.E21]) -> 0.138419
A22: 21 | B22: strcpy: &"xle"{\0,\x01,\x01} &"syy"{\0,p,\0} :=> &"syy"{\0,p,\0} | C22: 0.0735475 | D22: 0.0652771 | E22: 0.0652771 | G22: of:=IF([.C22]=1;"";[.C22]) -> 0.0735475 | H22: of:=IF([.D22]=1;"";[.D22]) -> 0.0652771 | I22: of:=IF([.E22]=1;"";[.E22]) -> 0.0652771
A23: 22 | B23: strcpy: &"lqj"{\0,\x01,\x01} &"icvw"{\0,\0} :=> &"icvw"{\0,\0} | C23: 0 | D23: 0 | E23: 0 | G23: of:=IF([.C23]=1;"";[.C23]) -> 0 | H23: of:=IF([.D23]=1;"";[.D23]) -> 0 | I23: of:=IF([.E23]=1;"";[.E23]) -> 0
A24: 23 | B24: strcpy: &"fgz"{\0,\x01,\x01} &"qbxen"{\0} :=> &"qbxen"{\0} | C24: 0.0599848 | D24: 0 | E24: 0 | G24: of:=IF([.C24]=1;"";[.C24]) -> 0.0599848 | H24: of:=IF([.D24]=1;"";[.D24]) -> 0 | I24: of:=IF([.E24]=1;"";[.E24]) -> 0
A25: 24 | B25: strcpy: &"zmcw"{\0,\x01} &""{\0,p,x,l,e,\0} :=> &""{\0,m,c,w,\0,\0} | C25: 0.0297904 | D25: 1 | E25: 1 | G25: of:=IF([.C25]=1;"";[.C25]) -> 0.0297904 | H25: of:=IF([.D25]=1;"";[.D25]) ->  | I25: of:=IF([.E25]=1;"";[.E25]) -> 
A26: 25 | B26: strcpy: &"adfp"{\0,\x01} &"x"{\0,p,v,j,\0} :=> &"x"{\0,f,p,\0,\0} | C26: 0.0353862 | D26: 1 | E26: 1 | G26: of:=IF([.C26]=1;"";[.C26]) -> 0.0353862 | H26: of:=IF([.D26]=1;"";[.D26]) ->  | I26: of:=IF([.E26]=1;"";[.E26]) -> 
A27: 26 | B27: strcpy: &"eayj"{\0,\x01} &"vj"{\0,p,d,\0} :=> &"vj"{\0,j,\0,\0} | C27: 0.0383208 | D27: 0.106758 | E27: 0.106758 | G27: of:=IF([.C27]=1;"";[.C27]) -> 0.0383208 | H27: of:=IF([.D27]=1;"";[.D27]) -> 0.106758 | I27: of:=IF([.E27]=1;"";[.E27]) -> 0.106758
A28: 27 | B28: strcpy: &"xuoo"{\0,\x01} &"lwk"{\0,p,\0} :=> &"lwk"{\0,\0,\0} | C28: 0.0417559 | D28: 0.0733782 | E28: 0.0733782 | G28: of:=IF([.C28]=1;"";[.C28]) -> 0.0417559 | H28: of:=IF([.D28]=1;"";[.D28]) -> 0.0733782 | I28: of:=IF([.E28]=1;"";[.E28]) -> 0.0733782
A29: 28 | B29: strcpy: &"pczx"{\0,\x01} &"prkf"{\0,\0} :=> &"prkf"{\0,\0} | C29: 0 | D29: 0.0429131 | E29: 0.0429131 | G29: of:=IF([.C29]=1;"";[.C29]) -> 0 | H29: of:=IF([.D29]=1;"";[.D29]) -> 0.0429131 | I29: of:=IF([.E29]=1;"";[.E29]) -> 0.0429131
A30: 29 | B30: strcpy: &"gjcj"{\0,\x01} &"spdqs"{\0} :=> &"spdqs"{\0} | C30: 0.020661 | D30: 0.0180307 | E30: 0.0180307 | G30: of:=IF([.C30]=1;"";[.C30]) -> 0.020661 | H30: of:=IF([.D30]=1;"";[.D30]) -> 0.0180307 | I30: of:=IF([.E30]=1;"";[.E30]) -> 0.0180307
A31: 30 | B31: strcpy: &"bzvgz"{\0} &""{\0,p,c,c,v,\0} :=> &""{\0,z,v,g,z,\0} | C31: 0.0160223 | D31: 1 | E31: 1 | G31: of:=IF([.C31]=1;"";[.C31]) -> 0.0160223 | H31: of:=IF([.D31]=1;"";[.D31]) ->  | I31: of:=IF([.E31]=1;"";[.E31]) -> 
A32: 31 | B32: strcpy: &"uilwv"{\0} &"p"{\0,p,l,t,\0} :=> &"p"{\0,l,w,v,\0} | C32: 0.0192886 | D32: 1 | E32: 1 | G32: of:=IF([.C32]=1;"";[.C32]) -> 0.0192886 | H32: of:=IF([.D32]=1;"";[.D32]) ->  | I32: of:=IF([.E32]=1;"";[.E32]) -> 
A33: 32 | B33: strcpy: &"ynspm"{\0} &"ry"{\0,p,v,\0} :=> &"ry"{\0,p,m,\0} | C33: 0.0281195 | D33: 0.216174 | E33: 0.216174 | G33: of:=IF([.C33]=1;"";[.C33]) -> 0.0281195 | H33: of:=IF([.D33]=1;"";[.D33]) -> 0.216174 | I33: of:=IF([.E33]=1;"";[.E33]) -> 0.216174
A34: 33 | B34: strcpy: &"jkoli"{\0} &"gka"{\0,p,\0} :=> &"gka"{\0,i,\0} | C34: 0.0250323 | D34: 0.0686756 | E34: 0.0686756 | G34: of:=IF([.C34]=1;"";[.C34]) -> 0.0250323 | H34: of:=IF([.D34]=1;"";[.D34]) -> 0.0686756 | I34: of:=IF([.E34]=1;"";[.E34]) -> 0.0686756
A35: 34 | B35: strcpy: &"bugkx"{\0} &"yjsd"{\0,\0} :=> &"yjsd"{\0,\0} | C35: 0 | D35: 0.0274894 | E35: 0.0274894 | G35: of:=IF([.C35]=1;"";[.C35]) -> 0 | H35: of:=IF([.D35]=1;"";[.D35]) -> 0.0274894 | I35: of:=IF([.E35]=1;"";[.E35]) -> 0.0274894
A36: 35 | B36: strcpy: &"gidsa"{\0} &"yggtp"{\0} :=> &"yggtp"{\0} | C36: 0.0301797 | D36: 0.0244498 | E36: 0.0244498 | G36: of:=IF([.C36]=1;"";[.C36]) -> 0.0301797 | H36: of:=IF([.D36]=1;"";[.D36]) -> 0.0244498 | I36: of:=IF([.E36]=1;"";[.E36]) -> 0.0244498
A37: 1 | B37: strncpy: &""{\0,\x01,\x01,\x01,\x01,\x01} &""{\0,p,e,g,j,\0} 5 :=> &""{\0,\0,\0,\0,\0,\0} | C37: 1 | D37: 1 | E37: 1 | G37: of:=IF([.C37]=1;"";[.C37]) ->  | H37: of:=IF([.D37]=1;"";[.D37]) ->  | I37: of:=IF([.E37]=1;"";[.E37]) ->  | K37: of:=AVERAGE([.G37:.G72]) -> 0.0796245125 | L37: of:=AVERAGE([.H37:.H72]) -> 0.0794999541666667 | M37: of:=AVERAGE([.I37:.I72]) -> 0.0794999541666667 | O37: of:=AVERAGE([.K37:.M37]) -> 0.0795414736111111
A38: 2 | B38: strncpy: &""{\0,\x01,\x01,\x01,\x01,\x01} &"r"{\0,p,x,c,\0} 5 :=> &"r"{\0,\0,\0,\0,\0} | C38: 1 | D38: 1 | E38: 1 | G38: of:=IF([.C38]=1;"";[.C38]) ->  | H38: of:=IF([.D38]=1;"";[.D38]) ->  | I38: of:=IF([.E38]=1;"";[.E38]) -> 
A39: 3 | B39: strncpy: &""{\0,\x01,\x01,\x01,\x01,\x01} &"nr"{\0,p,e,\0} 5 :=> &"nr"{\0,\0,\0,\0} | C39: 1 | D39: 0.199296 | E39: 0.199296 | G39: of:=IF([.C39]=1;"";[.C39]) ->  | H39: of:=IF([.D39]=1;"";[.D39]) -> 0.199296 | I39: of:=IF([.E39]=1;"";[.E39]) -> 0.199296
A40: 4 | B40: strncpy: &""{\0,\x01,\x01,\x01,\x01,\x01} &"wyg"{\0,p,\0} 5 :=> &"wyg"{\0,\0,\0} | C40: 1 | D40: 0.0716943 | E40: 0.0716943 | G40: of:=IF([.C40]=1;"";[.C40]) ->  | H40: of:=IF([.D40]=1;"";[.D40]) -> 0.0716943 | I40: of:=IF([.E40]=1;"";[.E40]) -> 0.0716943
A41: 5 | B41: strncpy: &""{\0,\x01,\x01,\x01,\x01,\x01} &"kdcr"{\0,\0} 5 :=> &"kdcr"{\0,\0} | C41: 1 | D41: 0.0395644 | E41: 0.0395644 | G41: of:=IF([.C41]=1;"";[.C41]) ->  | H41: of:=IF([.D41]=1;"";[.D41]) -> 0.0395644 | I41: of:=IF([.E41]=1;"";[.E41]) -> 0.0395644
A42: 6 | B42: strncpy: &""{\0,\x01,\x01,\x01,\x01,\x01} &"xzkvi"{\0} 5 :=> &"xzkvi"{\0} | C42: 1 | D42: 0 | E42: 0 | G42: of:=IF([.C42]=1;"";[.C42]) ->  | H42: of:=IF([.D42]=1;"";[.D42]) -> 0 | I42: of:=IF([.E42]=1;"";[.E42]) -> 0
A43: 7 | B43: strncpy: &"j"{\0,\x01,\x01,\x01,\x01} &""{\0,p,i,j,p,\0} 5 :=> &""{\0,\0,\0,\0,\0,\0} | C43: 1 | D43: 1 | E43: 1 | G43: of:=IF([.C43]=1;"";[.C43]) ->  | H43: of:=IF([.D43]=1;"";[.D43]) ->  | I43: of:=IF([.E43]=1;"";[.E43]) -> 
A44: 8 | B44: strncpy: &"s"{\0,\x01,\x01,\x01,\x01} &"y"{\0,p,o,x,\0} 5 :=> &"y"{\0,\0,\0,\0,\0} | C44: 1 | D44: 1 | E44: 1 | G44: of:=IF([.C44]=1;"";[.C44]) ->  | H44: of:=IF([.D44]=1;"";[.D44]) ->  | I44: of:=IF([.E44]=1;"";[.E44]) -> 
A45: 9 | B45: strncpy: &"n"{\0,\x01,\x01,\x01,\x01} &"zs"{\0,p,t,\0} 5 :=> &"zs"{\0,\0,\0,\0} | C45: 1 | D45: 0.174983 | E45: 0.174983 | G45: of:=IF([.C45]=1;"";[.C45]) ->  | H45: of:=IF([.D45]=1;"";[.D45]) -> 0.174983 | I45: of:=IF([.E45]=1;"";[.E45]) -> 0.174983
A46: 10 | B46: strncpy: &"v"{\0,\x01,\x01,\x01,\x01} &"rha"{\0,p,\0} 5 :=> &"rha"{\0,\0,\0} | C46: 1 | D46: 0.0836658 | E46: 0.0836658 | G46: of:=IF([.C46]=1;"";[.C46]) ->  | H46: of:=IF([.D46]=1;"";[.D46]) -> 0.0836658 | I46: of:=IF([.E46]=1;"";[.E46]) -> 0.0836658
A47: 11 | B47: strncpy: &"i"{\0,\x01,\x01,\x01,\x01} &"ldzn"{\0,\0} 5 :=> &"ldzn"{\0,\0} | C47: 1 | D47: 0.0351539 | E47: 0.0351539 | G47: of:=IF([.C47]=1;"";[.C47]) ->  | H47: of:=IF([.D47]=1;"";[.D47]) -> 0.0351539 | I47: of:=IF([.E47]=1;"";[.E47]) -> 0.0351539
A48: 12 | B48: strncpy: &"v"{\0,\x01,\x01,\x01,\x01} &"mmiis"{\0} 5 :=> &"mmiis"{\0} | C48: 1 | D48: 0.0284647 | E48: 0.0284647 | G48: of:=IF([.C48]=1;"";[.C48]) ->  | H48: of:=IF([.D48]=1;"";[.D48]) -> 0.0284647 | I48: of:=IF([.E48]=1;"";[.E48]) -> 0.0284647
A49: 13 | B49: strncpy: &"wh"{\0,\x01,\x01,\x01} &""{\0,p,x,z,u,\0} 5 :=> &""{\0,\0,\0,\0,\0,\0} | C49: 0.218014 | D49: 1 | E49: 1 | G49: of:=IF([.C49]=1;"";[.C49]) -> 0.218014 | H49: of:=IF([.D49]=1;"";[.D49]) ->  | I49: of:=IF([.E49]=1;"";[.E49]) -> 
A50: 14 | B50: strncpy: &"vc"{\0,\x01,\x01,\x01} &"h"{\0,p,x,c,\0} 5 :=> &"h"{\0,\0,\0,\0,\0} | C50: 0.183708 | D50: 1 | E50: 1 | G50: of:=IF([.C50]=1;"";[.C50]) -> 0.183708 | H50: of:=IF([.D50]=1;"";[.D50]) ->  | I50: of:=IF([.E50]=1;"";[.E50]) -> 
A51: 15 | B51: strncpy: &"mo"{\0,\x01,\x01,\x01} &"aa"{\0,p,v,\0} 5 :=> &"aa"{\0,\0,\0,\0} | C51: 0.218014 | D51: 0.193065 | E51: 0.193065 | G51: of:=IF([.C51]=1;"";[.C51]) -> 0.218014 | H51: of:=IF([.D51]=1;"";[.D51]) -> 0.193065 | I51: of:=IF([.E51]=1;"";[.E51]) -> 0.193065
A52: 16 | B52: strncpy: &"ed"{\0,\x01,\x01,\x01} &"hzn"{\0,p,\0} 5 :=> &"hzn"{\0,\0,\0} | C52: 0.223692 | D52: 0.053467 | E52: 0.053467 | G52: of:=IF([.C52]=1;"";[.C52]) -> 0.223692 | H52: of:=IF([.D52]=1;"";[.D52]) -> 0.053467 | I52: of:=IF([.E52]=1;"";[.E52]) -> 0.053467
A53: 17 | B53: strncpy: &"xy"{\0,\x01,\x01,\x01} &"ttdt"{\0,\0} 5 :=> &"ttdt"{\0,\0} | C53: 0.183327 | D53: 0.0399484 | E53: 0.0399484 | G53: of:=IF([.C53]=1;"";[.C53]) -> 0.183327 | H53: of:=IF([.D53]=1;"";[.D53]) -> 0.0399484 | I53: of:=IF([.E53]=1;"";[.E53]) -> 0.0399484
A54: 18 | B54: strncpy: &"ro"{\0,\x01,\x01,\x01} &"olgqf"{\0} 5 :=> &"olgqf"{\0} | C54: 0.22156 | D54: 0.0148939 | E54: 0.0148939 | G54: of:=IF([.C54]=1;"";[.C54]) -> 0.22156 | H54: of:=IF([.D54]=1;"";[.D54]) -> 0.0148939 | I54: of:=IF([.E54]=1;"";[.E54]) -> 0.0148939
A55: 19 | B55: strncpy: &"sti"{\0,\x01,\x01} &""{\0,p,z,o,t,\0} 5 :=> &""{\0,\0,\0,\0,\0,\0} | C55: 0.0908094 | D55: 1 | E55: 1 | G55: of:=IF([.C55]=1;"";[.C55]) -> 0.0908094 | H55: of:=IF([.D55]=1;"";[.D55]) ->  | I55: of:=IF([.E55]=1;"";[.E55]) -> 
A56: 20 | B56: strncpy: &"ssi"{\0,\x01,\x01} &"m"{\0,p,b,a,\0} 5 :=> &"m"{\0,\0,\0,\0,\0} | C56: 0.088421 | D56: 1 | E56: 1 | G56: of:=IF([.C56]=1;"";[.C56]) -> 0.088421 | H56: of:=IF([.D56]=1;"";[.D56]) ->  | I56: of:=IF([.E56]=1;"";[.E56]) -> 
A57: 21 | B57: strncpy: &"pjj"{\0,\x01,\x01} &"bh"{\0,p,k,\0} 5 :=> &"bh"{\0,\0,\0,\0} | C57: 0.0525368 | D57: 0.17798 | E57: 0.17798 | G57: of:=IF([.C57]=1;"";[.C57]) -> 0.0525368 | H57: of:=IF([.D57]=1;"";[.D57]) -> 0.17798 | I57: of:=IF([.E57]=1;"";[.E57]) -> 0.17798
A58: 22 | B58: strncpy: &"fyf"{\0,\x01,\x01} &"fjd"{\0,p,\0} 5 :=> &"fjd"{\0,\0,\0} | C58: 0.0712864 | D58: 0.0556493 | E58: 0.0556493 | G58: of:=IF([.C58]=1;"";[.C58]) -> 0.0712864 | H58: of:=IF([.D58]=1;"";[.D58]) -> 0.0556493 | I58: of:=IF([.E58]=1;"";[.E58]) -> 0.0556493
A59: 23 | B59: strncpy: &"pzc"{\0,\x01,\x01} &"yrhy"{\0,\0} 5 :=> &"yrhy"{\0,\0} | C59: 0.0542105 | D59: 0.0414089 | E59: 0.0414089 | G59: of:=IF([.C59]=1;"";[.C59]) -> 0.0542105 | H59: of:=IF([.D59]=1;"";[.D59]) -> 0.0414089 | I59: of:=IF([.E59]=1;"";[.E59]) -> 0.0414089
A60: 24 | B60: strncpy: &"iiv"{\0,\x01,\x01} &"nphdu"{\0} 5 :=> &"nphdu"{\0} | C60: 0.0783051 | D60: 0.0263983 | E60: 0.0263983 | G60: of:=IF([.C60]=1;"";[.C60]) -> 0.0783051 | H60: of:=IF([.D60]=1;"";[.D60]) -> 0.0263983 | I60: of:=IF([.E60]=1;"";[.E60]) -> 0.0263983
A61: 25 | B61: strncpy: &"bhzr"{\0,\x01} &""{\0,p,q,f,i,\0} 5 :=> &""{\0,\0,\0,\0,\0,\0} | C61: 0.0276406 | D61: 1 | E61: 1 | G61: of:=IF([.C61]=1;"";[.C61]) -> 0.0276406 | H61: of:=IF([.D61]=1;"";[.D61]) ->  | I61: of:=IF([.E61]=1;"";[.E61]) -> 
A62: 26 | B62: strncpy: &"saic"{\0,\x01} &"s"{\0,p,l,p,\0} 5 :=> &"s"{\0,\0,\0,\0,\0} | C62: 0.0483741 | D62: 1 | E62: 1 | G62: of:=IF([.C62]=1;"";[.C62]) -> 0.0483741 | H62: of:=IF([.D62]=1;"";[.D62]) ->  | I62: of:=IF([.E62]=1;"";[.E62]) -> 
A63: 27 | B63: strncpy: &"qhmm"{\0,\x01} &"xm"{\0,p,w,\0} 5 :=> &"xm"{\0,\0,\0,\0} | C63: 0 | D63: 0.169553 | E63: 0.169553 | G63: of:=IF([.C63]=1;"";[.C63]) -> 0 | H63: of:=IF([.D63]=1;"";[.D63]) -> 0.169553 | I63: of:=IF([.E63]=1;"";[.E63]) -> 0.169553
A64: 28 | B64: strncpy: &"gczk"{\0,\x01} &"lrr"{\0,p,\0} 5 :=> &"lrr"{\0,\0,\0} | C64: 0.0300437 | D64: 0.0802361 | E64: 0.0802361 | G64: of:=IF([.C64]=1;"";[.C64]) -> 0.0300437 | H64: of:=IF([.D64]=1;"";[.D64]) -> 0.0802361 | I64: of:=IF([.E64]=1;"";[.E64]) -> 0.0802361
A65: 29 | B65: strncpy: &"xnsb"{\0,\x01} &"sodg"{\0,\0} 5 :=> &"sodg"{\0,\0} | C65: 0.035755 | D65: 0.0455176 | E65: 0.0455176 | G65: of:=IF([.C65]=1;"";[.C65]) -> 0.035755 | H65: of:=IF([.D65]=1;"";[.D65]) -> 0.0455176 | I65: of:=IF([.E65]=1;"";[.E65]) -> 0.0455176
A66: 30 | B66: strncpy: &"qncn"{\0,\x01} &"ugyoy"{\0} 5 :=> &"ugyoy"{\0} | C66: 0 | D66: 0.0279353 | E66: 0.0279353 | G66: of:=IF([.C66]=1;"";[.C66]) -> 0 | H66: of:=IF([.D66]=1;"";[.D66]) -> 0.0279353 | I66: of:=IF([.E66]=1;"";[.E66]) -> 0.0279353
A67: 31 | B67: strncpy: &"qyvzz"{\0} &""{\0,p,e,v,i,\0} 5 :=> &""{\0,\0,\0,\0,\0,\0} | C67: 0 | D67: 1 | E67: 1 | G67: of:=IF([.C67]=1;"";[.C67]) -> 0 | H67: of:=IF([.D67]=1;"";[.D67]) ->  | I67: of:=IF([.E67]=1;"";[.E67]) -> 
A68: 32 | B68: strncpy: &"jzuuk"{\0} &"f"{\0,p,i,m,\0} 5 :=> &"f"{\0,\0,\0,\0,\0} | C68: 0.0182508 | D68: 1 | E68: 1 | G68: of:=IF([.C68]=1;"";[.C68]) -> 0.0182508 | H68: of:=IF([.D68]=1;"";[.D68]) ->  | I68: of:=IF([.E68]=1;"";[.E68]) -> 
A69: 33 | B69: strncpy: &"aydml"{\0} &"yb"{\0,p,p,\0} 5 :=> &"yb"{\0,\0,\0,\0} | C69: 0.0259719 | D69: 0.198338 | E69: 0.198338 | G69: of:=IF([.C69]=1;"";[.C69]) -> 0.0259719 | H69: of:=IF([.D69]=1;"";[.D69]) -> 0.198338 | I69: of:=IF([.E69]=1;"";[.E69]) -> 0.198338
A70: 34 | B70: strncpy: &"ekqcl"{\0} &"gne"{\0,p,\0} 5 :=> &"gne"{\0,\0,\0} | C70: 0 | D70: 0.0860498 | E70: 0.0860498 | G70: of:=IF([.C70]=1;"";[.C70]) -> 0 | H70: of:=IF([.D70]=1;"";[.D70]) -> 0.0860498 | I70: of:=IF([.E70]=1;"";[.E70]) -> 0.0860498
A71: 35 | B71: strncpy: &"yyjjm"{\0} &"wwya"{\0,\0} 5 :=> &"wwya"{\0,\0} | C71: 0.0142673 | D71: 0.0338887 | E71: 0.0338887 | G71: of:=IF([.C71]=1;"";[.C71]) -> 0.0142673 | H71: of:=IF([.D71]=1;"";[.D71]) -> 0.0338887 | I71: of:=IF([.E71]=1;"";[.E71]) -> 0.0338887
A72: 36 | B72: strncpy: &"aaxac"{\0} &"jutic"{\0} 5 :=> &"jutic"{\0} | C72: 0.0268007 | D72: 0.0308475 | E72: 0.0308475 | G72: of:=IF([.C72]=1;"";[.C72]) -> 0.0268007 | H72: of:=IF([.D72]=1;"";[.D72]) -> 0.0308475 | I72: of:=IF([.E72]=1;"";[.E72]) -> 0.0308475

Sheet: strcat
A1: # | B1: Test Case | C1: N1 | D1: N2 | E1: N3
A2: 1 | B2: strcat: &""{\0,\x01,\x01,\x01,\x01,\x01,\x01,\x01,\x01,\x01} &"f"{\0,p,f,\0} :=> &"f"{\0,p,f,a,y,l,t,s,\0} | C2: 1 | D2: 1 | E2: 1 | G2: of:=IF([.C2]=1;"";[.C2]) ->  | H2: of:=IF([.D2]=1;"";[.D2]) ->  | I2: of:=IF([.E2]=1;"";[.E2]) ->  | K2: of:=AVERAGE([.G2:.G41]) -> 0.0484044603225807 | L2: of:=AVERAGE([.H2:.H41]) -> 0.0904417772727273 | M2: of:=AVERAGE([.I2:.I41]) -> 0.0295856256756757 | O2: of:=AVERAGE([.K2:.M2]) -> 0.0561439544236612
A3: 2 | B3: strcat: &""{\0,\x01,\x01,\x01,\x01,\x01,\x01,\x01,\x01,\x01} &"wb"{\0,p,\0} :=> &"wb"{\0,p,e,n,f,b,j,\0} | C3: 1 | D3: 0.189777 | E3: 0.189777 | G3: of:=IF([.C3]=1;"";[.C3]) ->  | H3: of:=IF([.D3]=1;"";[.D3]) -> 0.189777 | I3: of:=IF([.E3]=1;"";[.E3]) -> 0.189777
A4: 3 | B4: strcat: &""{\0,\x01,\x01,\x01,\x01,\x01,\x01,\x01,\x01,\x01} &"mkt"{\0,\0} :=> &"mkt"{\0,p,v,k,k,m,\0} | C4: 1 | D4: 0.0638252 | E4: 0.0638252 | G4: of:=IF([.C4]=1;"";[.C4]) ->  | H4: of:=IF([.D4]=1;"";[.D4]) -> 0.0638252 | I4: of:=IF([.E4]=1;"";[.E4]) -> 0.0638252
A5: 4 | B5: strcat: &""{\0,\x01,\x01,\x01,\x01,\x01,\x01,\x01,\x01,\x01} &"nctw"{\0} :=> &"nctw"{\0,p,g,s,p,\0} | C5: 1 | D5: 0.0466766 | E5: 0.0466766 | H5: of:=IF([.D5]=1;"";[.D5]) -> 0.0466766 | I5: of:=IF([.E5]=1;"";[.E5]) -> 0.0466766
A6: 5 | B6: strcat: &"b"{\0,\x01,\x01,\x01,\x01,\x01,\x01,\x01,\x01} &""{\0,p,k,n,\0} :=> &"b"{\0,p,m,f,m,l,g,p,\0} | C6: 1 | D6: 1 | E6: 1 | G6: of:=IF([.C6]=1;"";[.C6]) ->  | H6: of:=IF([.D6]=1;"";[.D6]) ->  | I6: of:=IF([.E6]=1;"";[.E6]) -> 
A7: 6 | B7: strcat: &"i"{\0,\x01,\x01,\x01,\x01,\x01,\x01,\x01,\x01} &"h"{\0,p,s,\0} :=> &"ih"{\0,p,a,l,c,r,i,\0} | C7: 1 | D7: 1 | E7: 0.187319 | G7: of:=IF([.C7]=1;"";[.C7]) ->  | H7: of:=IF([.D7]=1;"";[.D7]) ->  | I7: of:=IF([.E7]=1;"";[.E7]) -> 0.187319
A8: 7 | B8: strcat: &"b"{\0,\x01,\x01,\x01,\x01,\x01,\x01,\x01,\x01} &"hy"{\0,p,\0} :=> &"bhy"{\0,p,w,c,q,v,\0} | C8: 1 | D8: 0.205862 | E8: 0.0709833 | G8: of:=IF([.C8]=1;"";[.C8]) ->  | H8: of:=IF([.D8]=1;"";[.D8]) -> 0.205862 | I8: of:=IF([.E8]=1;"";[.E8]) -> 0.0709833
A9: 8 | B9: strcat: &"s"{\0,\x01,\x01,\x01,\x01,\x01,\x01,\x01,\x01} &"vrm"{\0,\0} :=> &"svrm"{\0,p,u,q,h,\0} | C9: 1 | D9: 0.0757556 | E9: 0.0380293 | G9: of:=IF([.C9]=1;"";[.C9]) ->  | H9: of:=IF([.D9]=1;"";[.D9]) -> 0.0757556 | I9: of:=IF([.E9]=1;"";[.E9]) -> 0.0380293
A10: 9 | B10: strcat: &"m"{\0,\x01,\x01,\x01,\x01,\x01,\x01,\x01,\x01} &"wcct"{\0} :=> &"mwcct"{\0,p,o,v,\0} | C10: 1 | D10: 0.0415065 | E10: 0.0240822 | G10: of:=IF([.C10]=1;"";[.C10]) ->  | H10: of:=IF([.D10]=1;"";[.D10]) -> 0.0415065 | I10: of:=IF([.E10]=1;"";[.E10]) -> 0.0240822
A11: 10 | B11: strcat: &"xd"{\0,\x01,\x01,\x01,\x01,\x01,\x01,\x01} &""{\0,p,i,s,\0} :=> &"xd"{\0,p,a,w,z,x,h,\0} | C11: 0 | D11: 1 | E11: 0 | G11: of:=IF([.C11]=1;"";[.C11]) -> 0 | H11: of:=IF([.D11]=1;"";[.D11]) ->  | I11: of:=IF([.E11]=1;"";[.E11]) -> 0
A12: 11 | B12: strcat: &"kc"{\0,\x01,\x01,\x01,\x01,\x01,\x01,\x01} &"v"{\0,p,r,\0} :=> &"kcv"{\0,p,u,z,j,w,\0} | C12: 0.171077 | D12: 1 | E12: 0.0500623 | G12: of:=IF([.C12]=1;"";[.C12]) -> 0.171077 | H12: of:=IF([.D12]=1;"";[.D12]) ->  | I12: of:=IF([.E12]=1;"";[.E12]) -> 0.0500623
A13: 12 | B13: strcat: &"pp"{\0,\x01,\x01,\x01,\x01,\x01,\x01,\x01} &"rc"{\0,p,\0} :=> &"pprc"{\0,p,x,f,u,\0} | C13: 0.213806 | D13: 0.214286 | E13: 0.0465079 | G13: of:=IF([.C13]=1;"";[.C13]) -> 0.213806 | H13: of:=IF([.D13]=1;"";[.D13]) -> 0.214286 | I13: of:=IF([.E13]=1;"";[.E13]) -> 0.0465079
A14: 13 | B14: strcat: &"kd"{\0,\x01,\x01,\x01,\x01,\x01,\x01,\x01} &"kqk"{\0,\0} :=> &"kdkqk"{\0,p,p,h,\0} | C14: 0.188031 | D14: 0 | E14: 0 | G14: of:=IF([.C14]=1;"";[.C14]) -> 0.188031 | H14: of:=IF([.D14]=1;"";[.D14]) -> 0 | I14: of:=IF([.E14]=1;"";[.E14]) -> 0
A15: 14 | B15: strcat: &"tv"{\0,\x01,\x01,\x01,\x01,\x01,\x01,\x01} &"pasl"{\0} :=> &"tvpasl"{\0,p,m,\0} | C15: 0.18696 | D15: 0.047033 | E15: 0 | G15: of:=IF([.C15]=1;"";[.C15]) -> 0.18696 | H15: of:=IF([.D15]=1;"";[.D15]) -> 0.047033 | I15: of:=IF([.E15]=1;"";[.E15]) -> 0
A16: 15 | B16: strcat: &"qih"{\0,\x01,\x01,\x01,\x01,\x01,\x01} &""{\0,p,r,y,\0} :=> &"qih"{\0,p,q,t,m,g,\0} | C16: 0.0687782 | D16: 1 | E16: 0.0687782 | G16: of:=IF([.C16]=1;"";[.C16]) -> 0.0687782 | H16: of:=IF([.D16]=1;"";[.D16]) ->  | I16: of:=IF([.E16]=1;"";[.E16]) -> 0.0687782
A17: 16 | B17: strcat: &"vyn"{\0,\x01,\x01,\x01,\x01,\x01,\x01} &"k"{\0,p,v,\0} :=> &"vynk"{\0,p,e,d,t,\0} | C17: 0.0764908 | D17: 1 | E17: 0.0415909 | G17: of:=IF([.C17]=1;"";[.C17]) -> 0.0764908 | H17: of:=IF([.D17]=1;"";[.D17]) ->  | I17: of:=IF([.E17]=1;"";[.E17]) -> 0.0415909
A18: 17 | B18: strcat: &"jaq"{\0,\x01,\x01,\x01,\x01,\x01,\x01} &"lz"{\0,p,\0} :=> &"jaqlz"{\0,p,i,j,\0} | C18: 0.0751731 | D18: 0.185207 | E18: 0.0178831 | G18: of:=IF([.C18]=1;"";[.C18]) -> 0.0751731 | H18: of:=IF([.D18]=1;"";[.D18]) -> 0.185207 | I18: of:=IF([.E18]=1;"";[.E18]) -> 0.0178831
A19: 18 | B19: strcat: &"dbe"{\0,\x01,\x01,\x01,\x01,\x01,\x01} &"sds"{\0,\0} :=> &"dbesds"{\0,p,k,\0} | C19: 0.0797272 | D19: 0.0812808 | E19: 0.0202992 | G19: of:=IF([.C19]=1;"";[.C19]) -> 0.0797272 | H19: of:=IF([.D19]=1;"";[.D19]) -> 0.0812808 | I19: of:=IF([.E19]=1;"";[.E19]) -> 0.0202992
A20: 19 | B20: strcat: &"fbf"{\0,\x01,\x01,\x01,\x01,\x01,\x01} &"mowf"{\0} :=> &"fbfmowf"{\0,p,\0} | C20: 0.0567663 | D20: 0.0425993 | E20: 0.0117156 | G20: of:=IF([.C20]=1;"";[.C20]) -> 0.0567663 | H20: of:=IF([.D20]=1;"";[.D20]) -> 0.0425993 | I20: of:=IF([.E20]=1;"";[.E20]) -> 0.0117156
A21: 20 | B21: strcat: &"ephi"{\0,\x01,\x01,\x01,\x01,\x01} &""{\0,p,v,m,\0} :=> &"ephi"{\0,p,p,h,l,\0} | C21: 0.0463904 | D21: 1 | E21: 0.0463904 | G21: of:=IF([.C21]=1;"";[.C21]) -> 0.0463904 | H21: of:=IF([.D21]=1;"";[.D21]) ->  | I21: of:=IF([.E21]=1;"";[.E21]) -> 0.0463904
A22: 21 | B22: strcat: &"yjpz"{\0,\x01,\x01,\x01,\x01,\x01} &"j"{\0,p,f,\0} :=> &"yjpzj"{\0,p,e,s,\0} | C22: 0.0221728 | D22: 1 | E22: 0.0106398 | G22: of:=IF([.C22]=1;"";[.C22]) -> 0.0221728 | H22: of:=IF([.D22]=1;"";[.D22]) ->  | I22: of:=IF([.E22]=1;"";[.E22]) -> 0.0106398
A23: 22 | B23: strcat: &"ortm"{\0,\x01,\x01,\x01,\x01,\x01} &"ys"{\0,p,\0} :=> &"ortmys"{\0,p,d,\0} | C23: 0.0469584 | D23: 0.211853 | E23: 0.0211481 | G23: of:=IF([.C23]=1;"";[.C23]) -> 0.0469584 | H23: of:=IF([.D23]=1;"";[.D23]) -> 0.211853 | I23: of:=IF([.E23]=1;"";[.E23]) -> 0.0211481
A24: 23 | B24: strcat: &"rgvf"{\0,\x01,\x01,\x01,\x01,\x01} &"qwd"{\0,\0} :=> &"rgvfqwd"{\0,p,\0} | C24: 0 | D24: 0.0453917 | E24: 0 | G24: of:=IF([.C24]=1;"";[.C24]) -> 0 | H24: of:=IF([.D24]=1;"";[.D24]) -> 0.0453917 | I24: of:=IF([.E24]=1;"";[.E24]) -> 0
A25: 24 | B25: strcat: &"uysg"{\0,\x01,\x01,\x01,\x01,\x01} &"ydnh"{\0} :=> &"uysgydnh"{\0,\0} | C25: 0.0402403 | D25: 0.0403364 | E25: 0.0112122 | G25: of:=IF([.C25]=1;"";[.C25]) -> 0.0402403 | H25: of:=IF([.D25]=1;"";[.D25]) -> 0.0403364 | I25: of:=IF([.E25]=1;"";[.E25]) -> 0.0112122
A26: 25 | B26: strcat: &"awwnw"{\0,\x01,\x01,\x01,\x01} &""{\0,p,z,x,\0} :=> &"awwnw"{\0,p,p,q,\0} | C26: 0.0230372 | D26: 1 | E26: 0.0230372 | G26: of:=IF([.C26]=1;"";[.C26]) -> 0.0230372 | H26: of:=IF([.D26]=1;"";[.D26]) ->  | I26: of:=IF([.E26]=1;"";[.E26]) -> 0.0230372
A27: 26 | B27: strcat: &"uxbzl"{\0,\x01,\x01,\x01,\x01} &"j"{\0,p,j,\0} :=> &"uxbzlj"{\0,p,k,\0} | C27: 0.0182569 | D27: 1 | E27: 0.0123383 | G27: of:=IF([.C27]=1;"";[.C27]) -> 0.0182569 | H27: of:=IF([.D27]=1;"";[.D27]) ->  | I27: of:=IF([.E27]=1;"";[.E27]) -> 0.0123383
A28: 27 | B28: strcat: &"ofhse"{\0,\x01,\x01,\x01,\x01} &"np"{\0,p,\0} :=> &"ofhsenp"{\0,p,\0} | C28: 0.0255696 | D28: 0.196565 | E28: 0.0144173 | G28: of:=IF([.C28]=1;"";[.C28]) -> 0.0255696 | H28: of:=IF([.D28]=1;"";[.D28]) -> 0.196565 | I28: of:=IF([.E28]=1;"";[.E28]) -> 0.0144173
A29: 28 | B29: strcat: &"muigu"{\0,\x01,\x01,\x01,\x01} &"axz"{\0,\0} :=> &"muiguaxz"{\0,\0} | C29: 0.0292128 | D29: 0 | E29: 0 | G29: of:=IF([.C29]=1;"";[.C29]) -> 0.0292128 | H29: of:=IF([.D29]=1;"";[.D29]) -> 0 | I29: of:=IF([.E29]=1;"";[.E29]) -> 0
A30: 29 | B30: strcat: &"oayoz"{\0,\x01,\x01,\x01,\x01} &"oyzp"{\0} :=> &"oayozoyzp"{\0} | C30: 0.0281261 | D30: 0.0359174 | E30: 0.00931389 | G30: of:=IF([.C30]=1;"";[.C30]) -> 0.0281261 | H30: of:=IF([.D30]=1;"";[.D30]) -> 0.0359174 | I30: of:=IF([.E30]=1;"";[.E30]) -> 0.00931389
A31: 30 | B31: strcat: &"cwnzyk"{\0,\x01,\x01,\x01} &""{\0,p,m,b,\0} :=> &"cwnzyk"{\0,p,u,\0} | C31: 0.0149794 | D31: 1 | E31: 0.0149794 | G31: of:=IF([.C31]=1;"";[.C31]) -> 0.0149794 | H31: of:=IF([.D31]=1;"";[.D31]) ->  | I31: of:=IF([.E31]=1;"";[.E31]) -> 0.0149794
A32: 31 | B32: strcat: &"xrhkvz"{\0,\x01,\x01,\x01} &"l"{\0,p,i,\0} :=> &"xrhkvzl"{\0,p,\0} | C32: 0.010028 | D32: 1 | E32: 0.00799724 | G32: of:=IF([.C32]=1;"";[.C32]) -> 0.010028 | H32: of:=IF([.D32]=1;"";[.D32]) ->  | I32: of:=IF([.E32]=1;"";[.E32]) -> 0.00799724
A33: 32 | B33: strcat: &"skvsdt"{\0,\x01,\x01,\x01} &"nu"{\0,p,\0} :=> &"skvsdtnu"{\0,\0} | C33: 0.0165336 | D33: 0.211853 | E33: 0.0106602 | G33: of:=IF([.C33]=1;"";[.C33]) -> 0.0165336 | H33: of:=IF([.D33]=1;"";[.D33]) -> 0.211853 | I33: of:=IF([.E33]=1;"";[.E33]) -> 0.0106602
A34: 33 | B34: strcat: &"xajdud"{\0,\x01,\x01,\x01} &"wqi"{\0,\0} :=> &"xajdudwqi"{\0} | C34: 0.0173742 | D34: 0.0539936 | E34: 0.0077734 | G34: of:=IF([.C34]=1;"";[.C34]) -> 0.0173742 | H34: of:=IF([.D34]=1;"";[.D34]) -> 0.0539936 | I34: of:=IF([.E34]=1;"";[.E34]) -> 0.0077734
A35: 34 | B35: strcat: &"nwjntz"{\0,\x01,\x01,\x01} &&10 :=> &"nwjntzaxns"{} | C35: 0 | D35: 0 | G35: of:=IF([.C35]=1;"";[.C35]) -> 0 | H35: of:=IF([.D35]=1;"";[.D35]) -> 0 | I35: of:=IF([.E35]=1;"";[.E35]) ->  
A36: 35 | B36: strcat: &"rujvhgy"{\0,\x01,\x01} &""{\0,p,r,c,\0} :=> &"rujvhgy"{\0,p,\0} | C36: 0.00799999 | D36: 1 | E36: 0.00799999 | G36: of:=IF([.C36]=1;"";[.C36]) -> 0.00799999 | H36: of:=IF([.D36]=1;"";[.D36]) ->  | I36: of:=IF([.E36]=1;"";[.E36]) -> 0.00799999
A37: 36 | B37: strcat: &"jkzxvxe"{\0,\x01,\x01} &"v"{\0,p,j,\0} :=> &"jkzxvxev"{\0,\0} | C37: 0 | D37: 1 | E37: 0 | G37: of:=IF([.C37]=1;"";[.C37]) -> 0 | H37: of:=IF([.D37]=1;"";[.D37]) ->  | I37: of:=IF([.E37]=1;"";[.E37]) -> 0
A38: 37 | B38: strcat: &"opogntj"{\0,\x01,\x01} &"xj"{\0,p,\0} :=> &"opogntjxj"{\0} | C38: 0.0149648 | D38: 0 | E38: 0 | G38: of:=IF([.C38]=1;"";[.C38]) -> 0.0149648 | H38: of:=IF([.D38]=1;"";[.D38]) -> 0 | I38: of:=IF([.E38]=1;"";[.E38]) -> 0
A39: 38 | B39: strcat: &"soymtefs"{\0,\x01} &""{\0,p,v,b,\0} :=> &"soymtefs"{\0,\0} | C39: 0.0120902 | D39: 1 | E39: 0.0120902 | G39: of:=IF([.C39]=1;"";[.C39]) -> 0.0120902 | H39: of:=IF([.D39]=1;"";[.D39]) ->  | I39: of:=IF([.E39]=1;"";[.E39]) -> 0.0120902
A40: 39 | B40: strcat: &"iftmjnbj"{\0,\x01} &"b"{\0,p,g,\0} :=> &"iftmjnbjb"{\0} | C40: 0.00979398 | D40: 1 | E40: 0.00714073 | G40: of:=IF([.C40]=1;"";[.C40]) -> 0.00979398 | H40: of:=IF([.D40]=1;"";[.D40]) ->  | I40: of:=IF([.E40]=1;"";[.E40]) -> 0.00714073
A41: 40 | B41: strcat: &"crqcbbucw"{\0} &""{\0,p,j,a,\0} :=> &"crqcbbucw"{\0} | C41: 0 | D41: 1 | E41: 0 | G41: of:=IF([.C41]=1;"";[.C41]) -> 0 | H41: of:=IF([.D41]=1;"";[.D41]) ->  | I41: of:=IF([.E41]=1;"";[.E41]) -> 0
A42: 1 | B42: strncat: &""{\0,\x01,\x01,\x01,\x01,\x01,\x01,\x01,\x01,\x01} &""{\0,p,h,h,\0} 4 :=> &""{\0,p,f,a,q,c,n,h,o,\0} | C42: 1 | D42: 1 | E42: 1 | G42: of:=IF([.C42]=1;"";[.C42]) ->  | H42: of:=IF([.D42]=1;"";[.D42]) ->  | I42: of:=IF([.E42]=1;"";[.E42]) ->  | K42: of:=AVERAGE([.G42:.G82]) -> 0.0518055161290323 | L42: of:=AVERAGE([.H42:.H82]) -> 0.0990227545454545 | M42: of:=AVERAGE([.I42:.I82]) -> 0.0363502748648649 | O42: of:=AVERAGE([.K42:.M42]) -> 0.0623928485131172
A43: 2 | B43: strncat: &""{\0,\x01,\x01,\x01,\x01,\x01,\x01,\x01,\x01,\x01} &"m"{\0,p,m,\0} 4 :=> &"m"{\0,p,o,c,w,t,g,r,\0} | C43: 1 | D43: 1 | E43: 1 | G43: of:=IF([.C43]=1;"";[.C43]) ->  | H43: of:=IF([.D43]=1;"";[.D43]) ->  | I43: of:=IF([.E43]=1;"";[.E43]) -> 
A44: 3 | B44: strncat: &""{\0,\x01,\x01,\x01,\x01,\x01,\x01,\x01,\x01,\x01} &"mm"{\0,p,\0} 4 :=> &"mm"{\0,p,z,d,q,k,w,\0} | C44: 1 | D44: 0.212346 | E44: 0.212346 | G44: of:=IF([.C44]=1;"";[.C44]) ->  | H44: of:=IF([.D44]=1;"";[.D44]) -> 0.212346 | I44: of:=IF([.E44]=1;"";[.E44]) -> 0.212346
A45: 4 | B45: strncat: &""{\0,\x01,\x01,\x01,\x01,\x01,\x01,\x01,\x01,\x01} &"err"{\0,\0} 4 :=> &"err"{\0,p,t,p,q,p,\0} | C45: 1 | D45: 0.0884673 | E45: 0.0884673 | G45: of:=IF([.C45]=1;"";[.C45]) ->  | H45: of:=IF([.D45]=1;"";[.D45]) -> 0.0884673 | I45: of:=IF([.E45]=1;"";[.E45]) -> 0.0884673
A46: 5 | B46: strncat: &""{\0,\x01,\x01,\x01,\x01,\x01,\x01,\x01,\x01,\x01} &"ziji"{\0} 4 :=> &"ziji"{\0,p,i,c,m,\0} | C46: 1 | D46: 0.0382059 | E46: 0.0382059 | G46: of:=IF([.C46]=1;"";[.C46]) ->  | H46: of:=IF([.D46]=1;"";[.D46]) -> 0.0382059 | I46: of:=IF([.E46]=1;"";[.E46]) -> 0.0382059
A47: 6 | B47: strncat: &"k"{\0,\x01,\x01,\x01,\x01,\x01,\x01,\x01,\x01} &""{\0,p,m,p,\0} 4 :=> &"k"{\0,p,j,t,e,u,w,h,\0} | C47: 1 | D47: 1 | E47: 1 | G47: of:=IF([.C47]=1;"";[.C47]) ->  | H47: of:=IF([.D47]=1;"";[.D47]) ->  | I47: of:=IF([.E47]=1;"";[.E47]) -> 
A48: 7 | B48: strncat: &"r"{\0,\x01,\x01,\x01,\x01,\x01,\x01,\x01,\x01} &"m"{\0,p,v,\0} 4 :=> &"rm"{\0,p,g,g,u,x,v,\0} | C48: 1 | D48: 1 | E48: 0.214762 | G48: of:=IF([.C48]=1;"";[.C48]) ->  | H48: of:=IF([.D48]=1;"";[.D48]) ->  | I48: of:=IF([.E48]=1;"";[.E48]) -> 0.214762
A49: 8 | B49: strncat: &"d"{\0,\x01,\x01,\x01,\x01,\x01,\x01,\x01,\x01} &"rz"{\0,p,\0} 4 :=> &"drz"{\0,p,a,d,l,g,\0} | C49: 1 | D49: 0.189983 | E49: 0.0765243 | G49: of:=IF([.C49]=1;"";[.C49]) ->  | H49: of:=IF([.D49]=1;"";[.D49]) -> 0.189983 | I49: of:=IF([.E49]=1;"";[.E49]) -> 0.0765243
A50: 9 | B50: strncat: &"a"{\0,\x01,\x01,\x01,\x01,\x01,\x01,\x01,\x01} &"dzn"{\0,\0} 4 :=> &"adzn"{\0,p,h,d,v,\0} | C50: 1 | D50: 0.0609689 | E50: 0.0352517 | G50: of:=IF([.C50]=1;"";[.C50]) ->  | H50: of:=IF([.D50]=1;"";[.D50]) -> 0.0609689 | I50: of:=IF([.E50]=1;"";[.E50]) -> 0.0352517
A51: 10 | B51: strncat: &"s"{\0,\x01,\x01,\x01,\x01,\x01,\x01,\x01,\x01} &"omqb"{\0} 4 :=> &"somqb"{\0,p,x,v,\0} | C51: 1 | D51: 0.0247142 | E51: 0.0175597 | G51: of:=IF([.C51]=1;"";[.C51]) ->  | H51: of:=IF([.D51]=1;"";[.D51]) -> 0.0247142 | I51: of:=IF([.E51]=1;"";[.E51]) -> 0.0175597
A52: 11 | B52: strncat: &"ks"{\0,\x01,\x01,\x01,\x01,\x01,\x01,\x01} &""{\0,p,j,y,\0} 4 :=> &"ks"{\0,p,h,n,i,f,p,\0} | C52: 0.210856 | D52: 1 | E52: 0.210856 | G52: of:=IF([.C52]=1;"";[.C52]) -> 0.210856 | H52: of:=IF([.D52]=1;"";[.D52]) ->  | I52: of:=IF([.E52]=1;"";[.E52]) -> 0.210856
A53: 12 | B53: strncat: &"vt"{\0,\x01,\x01,\x01,\x01,\x01,\x01,\x01} &"v"{\0,p,m,\0} 4 :=> &"vtv"{\0,p,y,z,g,t,\0} | C53: 0.162567 | D53: 1 | E53: 0.0611259 | G53: of:=IF([.C53]=1;"";[.C53]) -> 0.162567 | H53: of:=IF([.D53]=1;"";[.D53]) ->  | I53: of:=IF([.E53]=1;"";[.E53]) -> 0.0611259
A54: 13 | B54: strncat: &"rc"{\0,\x01,\x01,\x01,\x01,\x01,\x01,\x01} &"ad"{\0,p,\0} 4 :=> &"rcad"{\0,p,z,m,j,\0} | C54: 0.214286 | D54: 0.218466 | E54: 0.0473094 | G54: of:=IF([.C54]=1;"";[.C54]) -> 0.214286 | H54: of:=IF([.D54]=1;"";[.D54]) -> 0.218466 | I54: of:=IF([.E54]=1;"";[.E54]) -> 0.0473094
A55: 14 | B55: strncat: &"rm"{\0,\x01,\x01,\x01,\x01,\x01,\x01,\x01} &"xpq"{\0,\0} 4 :=> &"rmxpq"{\0,p,g,w,\0} | C55: 0.214762 | D55: 0.0597147 | E55: 0 | G55: of:=IF([.C55]=1;"";[.C55]) -> 0.214762 | H55: of:=IF([.D55]=1;"";[.D55]) -> 0.0597147 | I55: of:=IF([.E55]=1;"";[.E55]) -> 0
A56: 15 | B56: strncat: &"nv"{\0,\x01,\x01,\x01,\x01,\x01,\x01,\x01} &"fmnx"{\0} 4 :=> &"nvfmnx"{\0,p,p,\0} | C56: 0.209845 | D56: 0.0368672 | E56: 0 | G56: of:=IF([.C56]=1;"";[.C56]) -> 0.209845 | H56: of:=IF([.D56]=1;"";[.D56]) -> 0.0368672 | I56: of:=IF([.E56]=1;"";[.E56]) -> 0
A57: 16 | B57: strncat: &"rjo"{\0,\x01,\x01,\x01,\x01,\x01,\x01} &""{\0,p,l,r,\0} 4 :=> &"rjo"{\0,p,r,t,q,w,\0} | C57: 0.072315 | D57: 1 | E57: 0.072315 | G57: of:=IF([.C57]=1;"";[.C57]) -> 0.072315 | H57: of:=IF([.D57]=1;"";[.D57]) ->  | I57: of:=IF([.E57]=1;"";[.E57]) -> 0.072315
A58: 17 | B58: strncat: &"wxc"{\0,\x01,\x01,\x01,\x01,\x01,\x01} &"k"{\0,p,s,\0} 4 :=> &"wxck"{\0,p,v,s,u,\0} | C58: 0 | D58: 1 | E58: 0 | G58: of:=IF([.C58]=1;"";[.C58]) -> 0 | H58: of:=IF([.D58]=1;"";[.D58]) ->  | I58: of:=IF([.E58]=1;"";[.E58]) -> 0
A59: 18 | B59: strncat: &"wsy"{\0,\x01,\x01,\x01,\x01,\x01,\x01} &"fn"{\0,p,\0} 4 :=> &"wsyfn"{\0,p,g,q,\0} | C59: 0.0808541 | D59: 0.177812 | E59: 0.0236428 | G59: of:=IF([.C59]=1;"";[.C59]) -> 0.0808541 | H59: of:=IF([.D59]=1;"";[.D59]) -> 0.177812 | I59: of:=IF([.E59]=1;"";[.E59]) -> 0.0236428
A60: 19 | B60: strncat: &"vqm"{\0,\x01,\x01,\x01,\x01,\x01,\x01} &"zoi"{\0,\0} 4 :=> &"vqmzoi"{\0,p,o,\0} | C60: 0 | D60: 0.0791779 | E60: 0 | G60: of:=IF([.C60]=1;"";[.C60]) -> 0 | H60: of:=IF([.D60]=1;"";[.D60]) -> 0.0791779 | I60: of:=IF([.E60]=1;"";[.E60]) -> 0
A61: 20 | B61: strncat: &"dkb"{\0,\x01,\x01,\x01,\x01,\x01,\x01} &"bvmz"{\0} 4 :=> &"dkbbvmz"{\0,p,\0} | C61: 0.0666171 | D61: 0.0262377 | E61: 0.00964935 | G61: of:=IF([.C61]=1;"";[.C61]) -> 0.0666171 | H61: of:=IF([.D61]=1;"";[.D61]) -> 0.0262377 | I61: of:=IF([.E61]=1;"";[.E61]) -> 0.00964935
A62: 21 | B62: strncat: &"fgay"{\0,\x01,\x01,\x01,\x01,\x01} &""{\0,p,w,n,\0} 4 :=> &"fgay"{\0,p,h,v,u,\0} | C62: 0.0420072 | D62: 1 | E62: 0.0420072 | G62: of:=IF([.C62]=1;"";[.C62]) -> 0.0420072 | H62: of:=IF([.D62]=1;"";[.D62]) ->  | I62: of:=IF([.E62]=1;"";[.E62]) -> 0.0420072
A63: 22 | B63: strncat: &"uzkp"{\0,\x01,\x01,\x01,\x01,\x01} &"w"{\0,p,n,\0} 4 :=> &"uzkpw"{\0,p,v,o,\0} | C63: 0.0343828 | D63: 1 | E63: 0.0210306 | G63: of:=IF([.C63]=1;"";[.C63]) -> 0.0343828 | H63: of:=IF([.D63]=1;"";[.D63]) ->  | I63: of:=IF([.E63]=1;"";[.E63]) -> 0.0210306
A64: 23 | B64: strncat: &"sbra"{\0,\x01,\x01,\x01,\x01,\x01} &"cq"{\0,p,\0} 4 :=> &"sbracq"{\0,p,j,\0} | C64: 0.0445104 | D64: 0.196192 | E64: 0.0200829 | G64: of:=IF([.C64]=1;"";[.C64]) -> 0.0445104 | H64: of:=IF([.D64]=1;"";[.D64]) -> 0.196192 | I64: of:=IF([.E64]=1;"";[.E64]) -> 0.0200829
A65: 24 | B65: strncat: &"vqgz"{\0,\x01,\x01,\x01,\x01,\x01} &"zoi"{\0,\0} 4 :=> &"vqgzzoi"{\0,p,\0} | C65: 0 | D65: 0.0791779 | E65: 0 | G65: of:=IF([.C65]=1;"";[.C65]) -> 0 | H65: of:=IF([.D65]=1;"";[.D65]) -> 0.0791779 | I65: of:=IF([.E65]=1;"";[.E65]) -> 0
A66: 25 | B66: strncat: &"jtti"{\0,\x01,\x01,\x01,\x01,\x01} &"fscz"{\0} 4 :=> &"jttifscz"{\0,\0} | C66: 0.0370109 | D66: 0.0389971 | E66: 0.0106568 | G66: of:=IF([.C66]=1;"";[.C66]) -> 0.0370109 | H66: of:=IF([.D66]=1;"";[.D66]) -> 0.0389971 | I66: of:=IF([.E66]=1;"";[.E66]) -> 0.0106568
A67: 26 | B67: strncat: &"warqf"{\0,\x01,\x01,\x01,\x01} &""{\0,p,u,x,\0} 4 :=> &"warqf"{\0,p,a,h,\0} | C67: 0.0189016 | D67: 1 | E67: 0.0189016 | G67: of:=IF([.C67]=1;"";[.C67]) -> 0.0189016 | H67: of:=IF([.D67]=1;"";[.D67]) ->  | I67: of:=IF([.E67]=1;"";[.E67]) -> 0.0189016
A68: 27 | B68: strncat: &"zfigb"{\0,\x01,\x01,\x01,\x01} &"w"{\0,p,x,\0} 4 :=> &"zfigbw"{\0,p,y,\0} | C68: 0.0219053 | D68: 1 | E68: 0.015294 | G68: of:=IF([.C68]=1;"";[.C68]) -> 0.0219053 | H68: of:=IF([.D68]=1;"";[.D68]) ->  | I68: of:=IF([.E68]=1;"";[.E68]) -> 0.015294
A69: 28 | B69: strncat: &"xjyfa"{\0,\x01,\x01,\x01,\x01} &"ku"{\0,p,\0} 4 :=> &"xjyfaku"{\0,p,\0} | C69: 0 | D69: 0.193586 | E69: 0 | G69: of:=IF([.C69]=1;"";[.C69]) -> 0 | H69: of:=IF([.D69]=1;"";[.D69]) -> 0.193586 | I69: of:=IF([.E69]=1;"";[.E69]) -> 0
A70: 29 | B70: strncat: &"wgilw"{\0,\x01,\x01,\x01,\x01} &"zuq"{\0,\0} 4 :=> &"wgilwzuq"{\0,\0} | C70: 0.0245923 | D70: 0.0674016 | E70: 0.00890456 | G70: of:=IF([.C70]=1;"";[.C70]) -> 0.0245923 | H70: of:=IF([.D70]=1;"";[.D70]) -> 0.0674016 | I70: of:=IF([.E70]=1;"";[.E70]) -> 0.00890456
A71: 30 | B71: strncat: &"ueqjg"{\0,\x01,\x01,\x01,\x01} &"yodw"{\0} 4 :=> &"ueqjgyodw"{\0} | C71: 0 | D71: 0.0437129 | E71: 0 | G71: of:=IF([.C71]=1;"";[.C71]) -> 0 | H71: of:=IF([.D71]=1;"";[.D71]) -> 0.0437129 | I71: of:=IF([.E71]=1;"";[.E71]) -> 0
A72: 31 | B72: strncat: &"mouhdl"{\0,\x01,\x01,\x01} &""{\0,p,g,a,\0} 4 :=> &"mouhdl"{\0,p,z,\0} | C72: 0.0190873 | D72: 1 | E72: 0.0190873 | G72: of:=IF([.C72]=1;"";[.C72]) -> 0.0190873 | H72: of:=IF([.D72]=1;"";[.D72]) ->  | I72: of:=IF([.E72]=1;"";[.E72]) -> 0.0190873
A73: 32 | B73: strncat: &"oknhay"{\0,\x01,\x01,\x01} &"q"{\0,p,v,\0} 4 :=> &"oknhayq"{\0,p,\0} | C73: 0.0207991 | D73: 1 | E73: 0.0130015 | G73: of:=IF([.C73]=1;"";[.C73]) -> 0.0207991 | H73: of:=IF([.D73]=1;"";[.D73]) ->  | I73: of:=IF([.E73]=1;"";[.E73]) -> 0.0130015
A74: 33 | B74: strncat: &"rgifyh"{\0,\x01,\x01,\x01} &"cg"{\0,p,\0} 4 :=> &"rgifyhcg"{\0,\0} | C74: 0.0189199 | D74: 0.106758 | E74: 0.00872263 | G74: of:=IF([.C74]=1;"";[.C74]) -> 0.0189199 | H74: of:=IF([.D74]=1;"";[.D74]) -> 0.106758 | I74: of:=IF([.E74]=1;"";[.E74]) -> 0.00872263
A75: 34 | B75: strncat: &"ixxfwh"{\0,\x01,\x01,\x01} &"cym"{\0,\0} 4 :=> &"ixxfwhcym"{\0} | C75: 0.0156753 | D75: 0.0803053 | E75: 0.00839281 | G75: of:=IF([.C75]=1;"";[.C75]) -> 0.0156753 | H75: of:=IF([.D75]=1;"";[.D75]) -> 0.0803053 | I75: of:=IF([.E75]=1;"";[.E75]) -> 0.00839281
A76: 35 | B76: strncat: &"nyebgw"{\0,\x01,\x01,\x01} &&10 4 :=> &"nyebgwomxv"{} | C76: 0.0168427 | D76: 0 | G76: of:=IF([.C76]=1;"";[.C76]) -> 0.0168427 | H76: of:=IF([.D76]=1;"";[.D76]) -> 0 | I76: of:=IF([.E76]=1;"";[.E76]) ->  
A77: 36 | B77: strncat: &"qbjklpb"{\0,\x01,\x01} &""{\0,p,c,u,\0} 4 :=> &"qbjklpb"{\0,p,\0} | C77: 0.0105249 | D77: 1 | E77: 0.0105249 | G77: of:=IF([.C77]=1;"";[.C77]) -> 0.0105249 | H77: of:=IF([.D77]=1;"";[.D77]) ->  | I77: of:=IF([.E77]=1;"";[.E77]) -> 0.0105249
A78: 37 | B78: strncat: &"xpfvmvp"{\0,\x01,\x01} &"p"{\0,p,u,\0} 4 :=> &"xpfvmvpp"{\0,\0} | C78: 0 | D78: 1 | E78: 0 | G78: of:=IF([.C78]=1;"";[.C78]) -> 0 | H78: of:=IF([.D78]=1;"";[.D78]) ->  | I78: of:=IF([.E78]=1;"";[.E78]) -> 0
A79: 38 | B79: strncat: &"olimohb"{\0,\x01,\x01} &"lq"{\0,p,\0} 4 :=> &"olimohblq"{\0} | C79: 0.016168 | D79: 0.159409 | E79: 0.0100491 | G79: of:=IF([.C79]=1;"";[.C79]) -> 0.016168 | H79: of:=IF([.D79]=1;"";[.D79]) -> 0.159409 | I79: of:=IF([.E79]=1;"";[.E79]) -> 0.0100491
A80: 39 | B80: strncat: &"pihatcdn"{\0,\x01} &""{\0,p,v,m,\0} 4 :=> &"pihatcdn"{\0,\0} | C80: 0.0118627 | D80: 1 | E80: 0.0118627 | G80: of:=IF([.C80]=1;"";[.C80]) -> 0.0118627 | H80: of:=IF([.D80]=1;"";[.D80]) ->  | I80: of:=IF([.E80]=1;"";[.E80]) -> 0.0118627
A81: 40 | B81: strncat: &"ndsqimfc"{\0,\x01} &"m"{\0,p,j,\0} 4 :=> &"ndsqimfcm"{\0} | C81: 0.011114 | D81: 1 | E81: 0.00886182 | G81: of:=IF([.C81]=1;"";[.C81]) -> 0.011114 | H81: of:=IF([.D81]=1;"";[.D81]) ->  | I81: of:=IF([.E81]=1;"";[.E81]) -> 0.00886182
A82: 41 | B82: strncat: &"etdfuuiub"{\0} &""{\0,p,z,n,\0} 4 :=> &"etdfuuiub"{\0} | C82: 0.0095644 | D82: 1 | E82: 0.0095644 | G82: of:=IF([.C82]=1;"";[.C82]) -> 0.0095644 | H82: of:=IF([.D82]=1;"";[.D82]) ->  | I82: of:=IF([.E82]=1;"";[.E82]) -> 0.0095644

Sheet: strstr
A1: # | B1: Test Case | C1: N | G1: N1 | H1: N2 | I1: N3
A2: 1 | B2: strstr: &"e"{\0,h,w,d,\0} &"e"{\0,\0} :=> &"e"{\0,h,w,d,\0} | C2: 1 | D2: 1 | E2: 1 | G2: of:=IF([.C2]=1;"";[.C2]) ->  | H2: of:=IF([.D2]=1;"";[.D2]) ->  | I2: of:=IF([.E2]=1;"";[.E2]) ->  | K2: of:=AVERAGE([.G2:.G19]) -> 0.0475477941176471 | L2: of:=AVERAGE([.H2:.H19]) -> 0.146218333333333 | M2: of:=AVERAGE([.I2:.I19]) -> 0.0674549875 | O2: of:=AVERAGE([.K2:.M2]) -> 0.0870737049836601
A3: 2 | B3: strstr: &"ru"{\0,h,x,\0} &"r"{\0,\0} :=> &"ru"{\0,h,x,\0} | C3: 0.213322 | D3: 1 | E3: 0.213322 | G3: of:=IF([.C3]=1;"";[.C3]) -> 0.213322 | H3: of:=IF([.D3]=1;"";[.D3]) ->  | I3: of:=IF([.E3]=1;"";[.E3]) -> 0.213322
A4: 3 | B4: strstr: &"qf"{\0,b,f,\0} &"f"{\0,\0} :=> &"f"{\0,b,f,\0,54} | C4: 0.106758 | D4: 1 | E4: 1 | G4: of:=IF([.C4]=1;"";[.C4]) -> 0.106758 | H4: of:=IF([.D4]=1;"";[.D4]) ->  | I4: of:=IF([.E4]=1;"";[.E4]) -> 
A5: 4 | B5: strstr: &"buf"{\0,h,\0} &"b"{\0,\0} :=> &"buf"{\0,h,\0} | C5: 0.0818804 | D5: 1 | E5: 0.0818804 | G5: of:=IF([.C5]=1;"";[.C5]) -> 0.0818804 | H5: of:=IF([.D5]=1;"";[.D5]) ->  | I5: of:=IF([.E5]=1;"";[.E5]) -> 0.0818804
A6: 5 | B6: strstr: &"nzm"{\0,b,\0} &"z"{\0,\0} :=> &"zm"{\0,b,\0,54} | C6: 0.0697255 | D6: 1 | E6: 0.183327 | G6: of:=IF([.C6]=1;"";[.C6]) -> 0.0697255 | H6: of:=IF([.D6]=1;"";[.D6]) ->  | I6: of:=IF([.E6]=1;"";[.E6]) -> 0.183327
A7: 6 | B7: strstr: &"zlgp"{\0,\0} &"z"{\0,\0} :=> &"zlgp"{\0,\0} | C7: 0.0353352 | D7: 1 | E7: 0.0353352 | G7: of:=IF([.C7]=1;"";[.C7]) -> 0.0353352 | H7: of:=IF([.D7]=1;"";[.D7]) ->  | I7: of:=IF([.E7]=1;"";[.E7]) -> 0.0353352
A8: 7 | B8: strstr: &"zqxc"{\0,\0} &"q"{\0,\0} :=> &"qxc"{\0,\0,54} | C8: 0 | D8: 1 | E8: 0 | G8: of:=IF([.C8]=1;"";[.C8]) -> 0 | H8: of:=IF([.D8]=1;"";[.D8]) ->  | I8: of:=IF([.E8]=1;"";[.E8]) -> 0
A9: 8 | B9: strstr: &"sezmc"{\0} &"s"{\0,\0} :=> &"sezmc"{\0} | C9: 0.0241348 | D9: 1 | E9: 0.0241348 | G9: of:=IF([.C9]=1;"";[.C9]) -> 0.0241348 | H9: of:=IF([.D9]=1;"";[.D9]) ->  | I9: of:=IF([.E9]=1;"";[.E9]) -> 0.0241348
A10: 9 | B10: strstr: &"zijgi"{\0} &"i"{\0,\0} :=> &"ijgi"{\0,54} | C10: 0 | D10: 1 | E10: 0 | G10: of:=IF([.C10]=1;"";[.C10]) -> 0 | H10: of:=IF([.D10]=1;"";[.D10]) ->  | I10: of:=IF([.E10]=1;"";[.E10]) -> 0
A11: 10 | B11: strstr: &"wj"{\0,d,i,\0} &"wj"{\0} :=> &"wj"{\0,d,i,\0} | C11: 0 | D11: 0 | E11: 0 | G11: of:=IF([.C11]=1;"";[.C11]) -> 0 | H11: of:=IF([.D11]=1;"";[.D11]) -> 0 | I11: of:=IF([.E11]=1;"";[.E11]) -> 0
A12: 11 | B12: strstr: &"zop"{\0,d,\0} &"zo"{\0} :=> &"zop"{\0,d,\0} | C12: 0.0804557 | D12: 0.197793 | E12: 0.0804557 | G12: of:=IF([.C12]=1;"";[.C12]) -> 0.0804557 | H12: of:=IF([.D12]=1;"";[.D12]) -> 0.197793 | I12: of:=IF([.E12]=1;"";[.E12]) -> 0.0804557
A13: 12 | B13: strstr: &"zzl"{\0,a,\0} &"zl"{\0} :=> &"zl"{\0,a,\0,54} | C13: 0.0724428 | D13: 0.190189 | E13: 0.190189 | G13: of:=IF([.C13]=1;"";[.C13]) -> 0.0724428 | H13: of:=IF([.D13]=1;"";[.D13]) -> 0.190189 | I13: of:=IF([.E13]=1;"";[.E13]) -> 0.190189
A14: 13 | B14: strstr: &"mgd"{\0,p,\0} &"gd"{\0} :=> &"gd"{\0,p,\0,54} | C14: 0.0649799 | D14: 0.189224 | E14: 0.189224 | G14: of:=IF([.C14]=1;"";[.C14]) -> 0.0649799 | H14: of:=IF([.D14]=1;"";[.D14]) -> 0.189224 | I14: of:=IF([.E14]=1;"";[.E14]) -> 0.189224
A15: 14 | B15: strstr: &"jzms"{\0,\0} &"jz"{\0} :=> &"jzms"{\0,\0} | C15: 0.0302061 | D15: 0.135488 | E15: 0.0302061 | G15: of:=IF([.C15]=1;"";[.C15]) -> 0.0302061 | H15: of:=IF([.D15]=1;"";[.D15]) -> 0.135488 | I15: of:=IF([.E15]=1;"";[.E15]) -> 0.0302061
A16: 15 | B16: strstr: &"qqcw"{\0,\0} &"qc"{\0} :=> &"qcw"{\0,\0,54} | C16: 0 | D16: 0 | E16: 0 | G16: of:=IF([.C16]=1;"";[.C16]) -> 0 | H16: of:=IF([.D16]=1;"";[.D16]) -> 0 | I16: of:=IF([.E16]=1;"";[.E16]) -> 0
A17: 16 | B17: strstr: &"xajh"{\0,\0} &"aj"{\0} :=> &"ajh"{\0,\0,54} | C17: 0.0290721 | D17: 0.203053 | E17: 0.0512056 | G17: of:=IF([.C17]=1;"";[.C17]) -> 0.0290721 | H17: of:=IF([.D17]=1;"";[.D17]) -> 0.203053 | I17: of:=IF([.E17]=1;"";[.E17]) -> 0.0512056
A18: 17 | B18: strstr: &"dqgtt"{\0} &"dq"{\0} :=> &"dqgtt"{\0} | C18: 0 | D18: 0.189362 | E18: 0 | G18: of:=IF([.C18]=1;"";[.C18]) -> 0 | H18: of:=IF([.D18]=1;"";[.D18]) -> 0.189362 | I18: of:=IF([.E18]=1;"";[.E18]) -> 0
A19: 18 | B19: strstr: &"ttwfq"{\0} &"tw"{\0} :=> &"twfq"{\0,54} | C19: 0 | D19: 0.210856 | E19: 0 | G19: of:=IF([.C19]=1;"";[.C19]) -> 0 | H19: of:=IF([.D19]=1;"";[.D19]) -> 0.210856 | I19: of:=IF([.E19]=1;"";[.E19]) -> 0
A20: 19 | B20: strstr: &"qacmp"{\0} &"ac"{\0} :=> &"acmp"{\0,54} | C20: 0.0224985 | D20: 0.218916 | E20: 0.0409231 | G20: of:=IF([.C20]=1;"";[.C20]) -> 0.0224985 | H20: of:=IF([.D20]=1;"";[.D20]) -> 0.218916 | I20: of:=IF([.E20]=1;"";[.E20]) -> 0.0409231 | K20: of:=AVERAGE([.G20:.G24]) -> 0.01468486 | L20: of:=AVERAGE([.H20:.H24]) -> 0.2082325 | M20: of:=AVERAGE([.I20:.I24]) -> 0.02055514 | O20: of:=AVERAGE([.K20:.M20]) -> 0.0811575
A21: 1 | B21: strnstr: &"xdcqh"{\0} &""{\0,p,\0} 2 :=> &"xdcqh"{\0} | C21: 0 | D21: 1 | E21: 0 | G21: of:=IF([.C21]=1;"";[.C21]) -> 0 | H21: of:=IF([.D21]=1;"";[.D21]) ->  | I21: of:=IF([.E21]=1;"";[.E21]) -> 0
A22: 2 | B22: strnstr: &"bomep"{\0} &"b"{\0,\0} 2 :=> &"bomep"{\0} | C22: 0.030844 | D22: 1 | E22: 0.030844 | G22: of:=IF([.C22]=1;"";[.C22]) -> 0.030844 | H22: of:=IF([.D22]=1;"";[.D22]) ->  | I22: of:=IF([.E22]=1;"";[.E22]) -> 0.030844
A23: 3 | B23: strnstr: &"cqbcc"{\0} &"q"{\0,\0} 2 :=> &"qbcc"{\0,54} | C23: 0.0200818 | D23: 1 | E23: 0.0310086 | G23: of:=IF([.C23]=1;"";[.C23]) -> 0.0200818 | H23: of:=IF([.D23]=1;"";[.D23]) ->  | I23: of:=IF([.E23]=1;"";[.E23]) -> 0.0310086
A24: 4 | B24: strnstr: &"iqypr"{\0} &"iq"{\0} 2 :=> &"iqypr"{\0} | C24: 0 | D24: 0.197549 | E24: 0 | G24: of:=IF([.C24]=1;"";[.C24]) -> 0 | H24: of:=IF([.D24]=1;"";[.D24]) -> 0.197549 | I24: of:=IF([.E24]=1;"";[.E24]) -> 0
A25: 1 | B25: strpbrk: &"vughr"{\0} &"aeiou"{\0} :=> &"ughr"{\0,54} | C25: 0.0274318 | D25: 0.0299288 | E25: 0.0457628 | G25: of:=IF([.C25]=1;"";[.C25]) -> 0.0274318 | H25: of:=IF([.D25]=1;"";[.D25]) -> 0.0299288 | I25: of:=IF([.E25]=1;"";[.E25]) -> 0.0457628 | K25: of:=AVERAGE([.G25:.G34]) -> 0.02352402 | L25: of:=AVERAGE([.H25:.H34]) -> 0.0299288 | M25: of:=AVERAGE([.I25:.I34]) -> 0.03005833 | O25: of:=AVERAGE([.K25:.M25]) -> 0.02783705
A26: 2 | B26: strpbrk: &"dodwf"{\0} &"aeiou"{\0} :=> &"odwf"{\0,54} | C26: 0.0263356 | D26: 0.0299288 | E26: 0.0399967 | G26: of:=IF([.C26]=1;"";[.C26]) -> 0.0263356 | H26: of:=IF([.D26]=1;"";[.D26]) -> 0.0299288 | I26: of:=IF([.E26]=1;"";[.E26]) -> 0.0399967
A27: 3 | B27: strpbrk: &"gicqe"{\0} &"aeiou"{\0} :=> &"icqe"{\0,54} | C27: 0.0191958 | D27: 0.0299288 | E27: 0.0278216 | G27: of:=IF([.C27]=1;"";[.C27]) -> 0.0191958 | H27: of:=IF([.D27]=1;"";[.D27]) -> 0.0299288 | I27: of:=IF([.E27]=1;"";[.E27]) -> 0.0278216
A28: 4 | B28: strpbrk: &"bezcc"{\0} &"aeiou"{\0} :=> &"ezcc"{\0,54} | C28: 0.0243246 | D28: 0.0299288 | E28: 0.0359494 | G28: of:=IF([.C28]=1;"";[.C28]) -> 0.0243246 | H28: of:=IF([.D28]=1;"";[.D28]) -> 0.0299288 | I28: of:=IF([.E28]=1;"";[.E28]) -> 0.0359494
A29: 5 | B29: strpbrk: &"lahcy"{\0} &"aeiou"{\0} :=> &"ahcy"{\0,54} | C29: 0.0264009 | D29: 0.0299288 | E29: 0.0395013 | G29: of:=IF([.C29]=1;"";[.C29]) -> 0.0264009 | H29: of:=IF([.D29]=1;"";[.D29]) -> 0.0299288 | I29: of:=IF([.E29]=1;"";[.E29]) -> 0.0395013
A30: 6 | B30: strpbrk: &"uqewt"{\0} &"aeiou"{\0} :=> &"uqewt"{\0} | C30: 0.0172226 | D30: 0.0299288 | E30: 0.0172226 | G30: of:=IF([.C30]=1;"";[.C30]) -> 0.0172226 | H30: of:=IF([.D30]=1;"";[.D30]) -> 0.0299288 | I30: of:=IF([.E30]=1;"";[.E30]) -> 0.0172226
A31: 7 | B31: strpbrk: &"ocxeh"{\0} &"aeiou"{\0} :=> &"ocxeh"{\0} | C31: 0.0189364 | D31: 0.0299288 | E31: 0.0189364 | G31: of:=IF([.C31]=1;"";[.C31]) -> 0.0189364 | H31: of:=IF([.D31]=1;"";[.D31]) -> 0.0299288 | I31: of:=IF([.E31]=1;"";[.E31]) -> 0.0189364
A32: 8 | B32: strpbrk: &"iivgn"{\0} &"aeiou"{\0} :=> &"iivgn"{\0} | C32: 0.0242312 | D32: 0.0299288 | E32: 0.0242312 | G32: of:=IF([.C32]=1;"";[.C32]) -> 0.0242312 | H32: of:=IF([.D32]=1;"";[.D32]) -> 0.0299288 | I32: of:=IF([.E32]=1;"";[.E32]) -> 0.0242312
A33: 9 | B33: strpbrk: &"evyzr"{\0} &"aeiou"{\0} :=> &"evyzr"{\0} | C33: 0.0232586 | D33: 0.0299288 | E33: 0.0232586 | G33: of:=IF([.C33]=1;"";[.C33]) -> 0.0232586 | H33: of:=IF([.D33]=1;"";[.D33]) -> 0.0299288 | I33: of:=IF([.E33]=1;"";[.E33]) -> 0.0232586
A34: 10 | B34: strpbrk: &"acakp"{\0} &"aeiou"{\0} :=> &"acakp"{\0} | C34: 0.0279027 | D34: 0.0299288 | E34: 0.0279027 | G34: of:=IF([.C34]=1;"";[.C34]) -> 0.0279027 | H34: of:=IF([.D34]=1;"";[.D34]) -> 0.0299288 | I34: of:=IF([.E34]=1;"";[.E34]) -> 0.0279027