Sheet: strlen
A1: strlen: &"\x01"{\0,\0,\0,\0,\0} :=> 1; | J1: # | K1: Test Case | L1: N | P1: FINAL
A2: strlen: &"\x01\x01"{\0,\0,\0,\0} :=> 2; | J2: 1 | K2: strlen: &"f"{\0,p,r,b,\0} :=> 1 | L2: 1 | N2: of:=IF([.L2]=1;"";[.L2]) ->  | P2: of:=AVERAGE([.N2:.N6]) -> 0.081098825
A3: strlen: &"\x01\x01\x01"{\0,\0,\0} :=> 3; | J3: 2 | K3: strlen: &"bd"{\0,p,f,\0} :=> 2 | L3: 0.187032 | N3: of:=IF([.L3]=1;"";[.L3]) -> 0.187032
A4: strlen: &"\x01\x01\x01\x01"{\0,\0} :=> 4; | J4: 3 | K4: strlen: &"hva"{\0,p,\0} :=> 3 | L4: 0.0723523 | N4: of:=IF([.L4]=1;"";[.L4]) -> 0.0723523
A5: strlen: &"\x01\x01\x01\x01\x01"{\0} :=> 5; | J5: 4 | K5: strlen: &"bgon"{\0,\0} :=> 4 | L5: 0.0390637 | N5: of:=IF([.L5]=1;"";[.L5]) -> 0.0390637
A6: strnlen: &""{\0,\0,\0,\0,\0,\0} 6 :=> 0; 1; | J6: 5 | K6: strlen: &"iorlq"{\0} :=> 5 | L6: 0.0259473 | N6: of:=IF([.L6]=1;"";[.L6]) -> 0.0259473
A7: strnlen: &"\x01"{\0,\0,\0,\0,\0} 6 :=> 1; | J7: 1 | K7: strnlen: &""{\0,p,u,s,u,\0} 6 :=> 0 | L7: 1 | N7: of:=IF([.L7]=1;"";[.L7]) ->  | P7: of:=AVERAGE([.N7:.N12]) -> 0.0729055
A8: strnlen: &"\x01\x01"{\0,\0,\0,\0} 6 :=> 2; | J8: 2 | K8: strnlen: &"o"{\0,p,h,a,\0} 6 :=> 1 | L8: 1 | N8: of:=IF([.L8]=1;"";[.L8]) -> 
A9: strnlen: &"\x01\x01\x01"{\0,\0,\0} 6 :=> 3; | J9: 3 | K9: strnlen: &"cv"{\0,p,s,\0} 6 :=> 2 | L9: 0.138419 | N9: of:=IF([.L9]=1;"";[.L9]) -> 0.138419
A10: strnlen: &"\x01\x01\x01\x01"{\0,\0} 6 :=> 4; | J10: 4 | K10: strnlen: &"sma"{\0,p,\0} 6 :=> 3 | L10: 0.0848685 | N10: of:=IF([.L10]=1;"";[.L10]) -> 0.0848685
A11: strnlen: &"\x01\x01\x01\x01\x01"{\0} 6 :=> 5; | J11: 5 | K11: strnlen: &"anyf"{\0,\0} 6 :=> 4 | L11: 0.043189 | N11: of:=IF([.L11]=1;"";[.L11]) -> 0.043189
J12: 6 | K12: strnlen: &"jihej"{\0} 6 :=> 5 | L12: 0.0251455 | N12: of:=IF([.L12]=1;"";[.L12]) -> 0.0251455

Sheet: strcmp
A1: # | B1: Test Case | C1: N1 | D1: N2 | L1: FINAL
A2: 1 | B2: strcmp: &"q"{\0,p,w,g,\0} &"q"{\0,p,n,p,\0} :=> 0 | C2: 1 | D2: 1 | F2: of:=IF([.C2]=1;"";[.C2]) ->  | G2: of:=IF([.D2]=1;"";[.D2]) ->  | H2: of:=IF([.E2]=1;"";[.E2]) ->   | I2: of:=AVERAGE([.F2:.F16]) -> 0.03716395 | J2: of:=AVERAGE([.G2:.G16]) -> 0.0326511142857143 | L2: of:=AVERAGE([.I2:.J2]) -> 0.0349075321428571
A3: 2 | B3: strcmp: &"kj"{\0,p,g,\0} &"kj"{\0,p,l,\0} :=> 0 | C3: 0.164079 | D3: 0.164079 | F3: of:=IF([.C3]=1;"";[.C3]) -> 0.164079 | G3: of:=IF([.D3]=1;"";[.D3]) -> 0.164079 | H3: of:=IF([.E3]=1;"";[.E3]) ->  
A4: 3 | B4: strcmp: &"bjk"{\0,p,\0} &"bjk"{\0,p,\0} :=> 0 | C4: 0.0641304 | D4: 0.0641304 | F4: of:=IF([.C4]=1;"";[.C4]) -> 0.0641304 | G4: of:=IF([.D4]=1;"";[.D4]) -> 0.0641304 | H4: of:=IF([.E4]=1;"";[.E4]) ->  
A5: 4 | B5: strcmp: &"cifi"{\0,\0} &"cifi"{\0,\0} :=> 0 | C5: 0.0466537 | D5: 0.0466537 | F5: of:=IF([.C5]=1;"";[.C5]) -> 0.0466537 | G5: of:=IF([.D5]=1;"";[.D5]) -> 0.0466537 | H5: of:=IF([.E5]=1;"";[.E5]) ->  
A6: 5 | B6: strcmp: &"qvezs"{\0} &"qvezs"{\0} :=> 0 | C6: 0.0198578 | D6: 0.0198578 | F6: of:=IF([.C6]=1;"";[.C6]) -> 0.0198578 | G6: of:=IF([.D6]=1;"";[.D6]) -> 0.0198578 | H6: of:=IF([.E6]=1;"";[.E6]) ->  
A7: 6 | B7: strcmp: &"fcqbj"{\0} &"fcqbe"{\0} :=> 1 | C7: 0.0185297 | D7: 0.019678 | F7: of:=IF([.C7]=1;"";[.C7]) -> 0.0185297 | G7: of:=IF([.D7]=1;"";[.D7]) -> 0.019678 | H7: of:=IF([.E7]=1;"";[.E7]) ->  
A8: 7 | B8: strcmp: &"qzhmh"{\0} &"qzhmq"{\0} :=> -1 | C8: 0 | D8: 0 | F8: of:=IF([.C8]=1;"";[.C8]) -> 0 | G8: of:=IF([.D8]=1;"";[.D8]) -> 0 | H8: of:=IF([.E8]=1;"";[.E8]) ->  
A9: 8 | B9: strcmp: &"cznrw"{\0} &"czngd"{\0} :=> 1 | C9: 0.0220255 | D9: 0.0226612 | F9: of:=IF([.C9]=1;"";[.C9]) -> 0.0220255 | G9: of:=IF([.D9]=1;"";[.D9]) -> 0.0226612 | H9: of:=IF([.E9]=1;"";[.E9]) ->  
A10: 9 | B10: strcmp: &"ktgro"{\0} &"ktgzq"{\0} :=> -1 | C10: 0.0267243 | D10: 0.0185969 | F10: of:=IF([.C10]=1;"";[.C10]) -> 0.0267243 | G10: of:=IF([.D10]=1;"";[.D10]) -> 0.0185969 | H10: of:=IF([.E10]=1;"";[.E10]) ->  
A11: 10 | B11: strcmp: &"zbody"{\0} &"zbbsx"{\0} :=> 1 | C11: 0.0266495 | D11: 0 | F11: of:=IF([.C11]=1;"";[.C11]) -> 0.0266495 | G11: of:=IF([.D11]=1;"";[.D11]) -> 0 | H11: of:=IF([.E11]=1;"";[.E11]) ->  
A12: 11 | B12: strcmp: &"ichol"{\0} &"icpxz"{\0} :=> -1 | C12: 0.0314086 | D12: 0 | F12: of:=IF([.C12]=1;"";[.C12]) -> 0.0314086 | G12: of:=IF([.D12]=1;"";[.D12]) -> 0
A13: 12 | B13: strcmp: &"odfcj"{\0} &"obcdp"{\0} :=> 1 | C13: 0.0177574 | D13: 0.0226608 | F13: of:=IF([.C13]=1;"";[.C13]) -> 0.0177574 | G13: of:=IF([.D13]=1;"";[.D13]) -> 0.0226608
A14: 13 | B14: strcmp: &"ongrx"{\0} &"ouwfu"{\0} :=> -1 | C14: 0.02813 | D14: 0.0253913 | F14: of:=IF([.C14]=1;"";[.C14]) -> 0.02813 | G14: of:=IF([.D14]=1;"";[.D14]) -> 0.0253913
A15: 14 | B15: strcmp: &"bslcs"{\0} &"azebm"{\0} :=> 1 | C15: 0.0270693 | D15: 0.0261119 | F15: of:=IF([.C15]=1;"";[.C15]) -> 0.0270693 | G15: of:=IF([.D15]=1;"";[.D15]) -> 0.0261119
A16: 15 | B16: strcmp: &"xhaeq"{\0} &"zworr"{\0} :=> -1 | C16: 0.0272801 | D16: 0.0272946 | F16: of:=IF([.C16]=1;"";[.C16]) -> 0.0272801 | G16: of:=IF([.D16]=1;"";[.D16]) -> 0.0272946
A17: 1 | B17: strncmp: &""{\0,p,j,d,k,\0} &""{\0,p,t,y,i,\0} 5 :=> 0 | C17: 1 | D17: 1 | F17: of:=IF([.C17]=1;"";[.C17]) ->  | G17: of:=IF([.D17]=1;"";[.D17]) ->  | I17: of:=AVERAGE([.F17:.F32]) -> 0.0380243285714286 | J17: of:=AVERAGE([.G17:.G32]) -> 0.0373041071428571 | L17: of:=AVERAGE([.I17:.J17]) -> 0.0376642178571429
A18: 2 | B18: strncmp: &"b"{\0,p,v,l,\0} &"b"{\0,p,x,g,\0} 5 :=> 0 | C18: 1 | D18: 1 | F18: of:=IF([.C18]=1;"";[.C18]) ->  | G18: of:=IF([.D18]=1;"";[.D18]) -> 
A19: 3 | B19: strncmp: &"ym"{\0,p,g,\0} &"ym"{\0,p,x,\0} 5 :=> 0 | C19: 0.205591 | D19: 0.205591 | F19: of:=IF([.C19]=1;"";[.C19]) -> 0.205591 | G19: of:=IF([.D19]=1;"";[.D19]) -> 0.205591
A20: 4 | B20: strncmp: &"ixq"{\0,p,\0} &"ixq"{\0,p,\0} 5 :=> 0 | C20: 0.0689685 | D20: 0.0689685 | F20: of:=IF([.C20]=1;"";[.C20]) -> 0.0689685 | G20: of:=IF([.D20]=1;"";[.D20]) -> 0.0689685
A21: 5 | B21: strncmp: &"twrf"{\0,\0} &"twrf"{\0,\0} 5 :=> 0 | C21: 0.0431067 | D21: 0.0431067 | F21: of:=IF([.C21]=1;"";[.C21]) -> 0.0431067 | G21: of:=IF([.D21]=1;"";[.D21]) -> 0.0431067
A22: 6 | B22: strncmp: &"bsqtb"{\0} &"bsqtb"{\0} 5 :=> 0 | C22: 0.0208925 | D22: 0.0208925 | F22: of:=IF([.C22]=1;"";[.C22]) -> 0.0208925 | G22: of:=IF([.D22]=1;"";[.D22]) -> 0.0208925
A23: 7 | B23: strncmp: &"vpdob"{\0} &"vpdoa"{\0} 5 :=> 1 | C23: 0 | D23: 0 | F23: of:=IF([.C23]=1;"";[.C23]) -> 0 | G23: of:=IF([.D23]=1;"";[.D23]) -> 0
A24: 8 | B24: strncmp: &"aztcp"{\0} &"aztct"{\0} 5 :=> -1 | C24: 0.0214213 | D24: 0.0253139 | F24: of:=IF([.C24]=1;"";[.C24]) -> 0.0214213 | G24: of:=IF([.D24]=1;"";[.D24]) -> 0.0253139
A25: 9 | B25: strncmp: &"hhksp"{\0} &"hhkit"{\0} 5 :=> 1 | C25: 0.0246114 | D25: 0.0253043 | F25: of:=IF([.C25]=1;"";[.C25]) -> 0.0246114 | G25: of:=IF([.D25]=1;"";[.D25]) -> 0.0253043
A26: 10 | B26: strncmp: &"ecdja"{\0} &"ecdsm"{\0} 5 :=> -1 | C26: 0.024796 | D26: 0.0268144 | F26: of:=IF([.C26]=1;"";[.C26]) -> 0.024796 | G26: of:=IF([.D26]=1;"";[.D26]) -> 0.0268144
A27: 11 | B27: strncmp: &"sqvry"{\0} &"sqrtf"{\0} 5 :=> 1 | C27: 0.0201324 | D27: 0 | F27: of:=IF([.C27]=1;"";[.C27]) -> 0.0201324 | G27: of:=IF([.D27]=1;"";[.D27]) -> 0
A28: 12 | B28: strncmp: &"whfmg"{\0} &"whutw"{\0} 5 :=> -1 | C28: 0.0225813 | D28: 0.029623 | F28: of:=IF([.C28]=1;"";[.C28]) -> 0.0225813 | G28: of:=IF([.D28]=1;"";[.D28]) -> 0.029623
A29: 13 | B29: strncmp: &"ytzjb"{\0} &"yrwfp"{\0} 5 :=> 1 | C29: 0.0139914 | D29: 0.0213291 | F29: of:=IF([.C29]=1;"";[.C29]) -> 0.0139914 | G29: of:=IF([.D29]=1;"";[.D29]) -> 0.0213291
A30: 14 | B30: strncmp: &"yjequ"{\0} &"yuimp"{\0} 5 :=> -1 | C30: 0.0233476 | D30: 0.0276673 | F30: of:=IF([.C30]=1;"";[.C30]) -> 0.0233476 | G30: of:=IF([.D30]=1;"";[.D30]) -> 0.0276673
A31: 15 | B31: strncmp: &"wwfrh"{\0} &"nnwrk"{\0} 5 :=> 1 | C31: 0.0217901 | D31: 0.0276468 | F31: of:=IF([.C31]=1;"";[.C31]) -> 0.0217901 | G31: of:=IF([.D31]=1;"";[.D31]) -> 0.0276468
A32: 16 | B32: strncmp: &"aicja"{\0} &"ulwjm"{\0} 5 :=> -1 | C32: 0.0211104 | D32: 0 | F32: of:=IF([.C32]=1;"";[.C32]) -> 0.0211104 | G32: of:=IF([.D32]=1;"";[.D32]) -> 0
A33: 1 | B33: sysfs_streq: &""{\0,p,v,m,i,\0} &"qmjtu"{\0} :=> \0 | C33: 1 | D33: 0 | F33: of:=IF([.C33]=1;"";[.C33]) ->  | G33: of:=IF([.D33]=1;"";[.D33]) -> 0 | I33: of:=AVERAGE([.F33:.F71]) -> 0.0593187448275862 | J33: of:=AVERAGE([.G33:.G71]) -> 0.0370207857142857 | L33: of:=AVERAGE([.I33:.J33]) -> 0.048169765270936
A34: 2 | B34: sysfs_streq: &""{\0,p,k,p,s,\0} &"\n"{\0,b,q,a,\0} :=> \x01 | C34: 1 | F34: of:=IF([.C34]=1;"";[.C34]) ->  | G34: of:=IF([.D34]=1;"";[.D34]) ->  
A35: 3 | B35: sysfs_streq: &""{\0,p,i,q,z,\0} &"\nabry"{\0} :=> \0 | C35: 1 | F35: of:=IF([.C35]=1;"";[.C35]) ->  | G35: of:=IF([.D35]=1;"";[.D35]) ->  
A36: 4 | B36: sysfs_streq: &""{\0,p,d,c,a,\0} &""{\0,h,c,x,x,\0} :=> \x01 | C36: 1 | D36: 1 | F36: of:=IF([.C36]=1;"";[.C36]) ->  | G36: of:=IF([.D36]=1;"";[.D36]) -> 
A37: 5 | B37: sysfs_streq: &"drkav"{\0} &"lpfem"{\0} :=> \0 | C37: 0.0287836 | D37: 0.0270709 | F37: of:=IF([.C37]=1;"";[.C37]) -> 0.0287836 | G37: of:=IF([.D37]=1;"";[.D37]) -> 0.0270709
A38: 6 | B38: sysfs_streq: &"\n"{\0,p,m,d,\0} &""{\0,a,q,i,i,\0} :=> \x01 | C38: 1 | F38: of:=IF([.C38]=1;"";[.C38]) ->  | G38: of:=IF([.D38]=1;"";[.D38]) ->  
A39: 7 | B39: sysfs_streq: &"\n"{\0,a,k,g,\0} &"khwao"{\0} :=> \0 | C39: 0.0256665 | F39: of:=IF([.C39]=1;"";[.C39]) -> 0.0256665 | G39: of:=IF([.D39]=1;"";[.D39]) ->  
A40: 8 | B40: sysfs_streq: &"\nazru"{\0} &"fvjzx"{\0} :=> \0 | C40: 0 | F40: of:=IF([.C40]=1;"";[.C40]) -> 0 | G40: of:=IF([.D40]=1;"";[.D40]) ->  
A41: 9 | B41: sysfs_streq: &"r"{\0,p,n,d,\0} &"rauuh"{\0} :=> \0 | C41: 1 | D41: 0.0249886 | F41: of:=IF([.C41]=1;"";[.C41]) ->  | G41: of:=IF([.D41]=1;"";[.D41]) -> 0.0249886
A42: 10 | B42: sysfs_streq: &"i"{\0,p,b,f,\0} &"i\n"{\0,a,r,\0} :=> \x01 | C42: 1 | F42: of:=IF([.C42]=1;"";[.C42]) ->  | G42: of:=IF([.D42]=1;"";[.D42]) ->  
A43: 11 | B43: sysfs_streq: &"p"{\0,p,i,i,\0} &"p\navj"{\0} :=> \0 | C43: 1 | F43: of:=IF([.C43]=1;"";[.C43]) ->  | G43: of:=IF([.D43]=1;"";[.D43]) ->  
A44: 12 | B44: sysfs_streq: &"p"{\0,p,l,s,\0} &"p"{\0,h,g,r,\0} :=> \x01 | C44: 1 | D44: 1 | F44: of:=IF([.C44]=1;"";[.C44]) ->  | G44: of:=IF([.D44]=1;"";[.D44]) -> 
A45: 13 | B45: sysfs_streq: &"rqaew"{\0} &"rlozq"{\0} :=> \0 | C45: 0.0222796 | D45: 0.0237342 | F45: of:=IF([.C45]=1;"";[.C45]) -> 0.0222796 | G45: of:=IF([.D45]=1;"";[.D45]) -> 0.0237342
A46: 14 | B46: sysfs_streq: &"r\n"{\0,b,s,\0} &"r"{\0,b,b,j,\0} :=> \x01 | C46: 1 | F46: of:=IF([.C46]=1;"";[.C46]) ->  | G46: of:=IF([.D46]=1;"";[.D46]) ->  
A47: 15 | B47: sysfs_streq: &"d\n"{\0,b,o,\0} &"dsjhy"{\0} :=> \0 | C47: 0.0179618 | F47: of:=IF([.C47]=1;"";[.C47]) -> 0.0179618 | G47: of:=IF([.D47]=1;"";[.D47]) ->  
A48: 16 | B48: sysfs_streq: &"o\nall"{\0} &"onzjf"{\0} :=> \0 | C48: 0.0152293 | F48: of:=IF([.C48]=1;"";[.C48]) -> 0.0152293 | G48: of:=IF([.D48]=1;"";[.D48]) ->  
A49: 17 | B49: sysfs_streq: &"ex"{\0,p,o,\0} &"exesg"{\0} :=> \0 | C49: 0.214762 | D49: 0.0275912 | F49: of:=IF([.C49]=1;"";[.C49]) -> 0.214762 | G49: of:=IF([.D49]=1;"";[.D49]) -> 0.0275912
A50: 18 | B50: sysfs_streq: &"pr"{\0,p,p,\0} &"pr\n"{\0,a,\0} :=> \x01 | C50: 0.218916 | F50: of:=IF([.C50]=1;"";[.C50]) -> 0.218916 | G50: of:=IF([.D50]=1;"";[.D50]) ->  
A51: 19 | B51: sysfs_streq: &"ep"{\0,p,j,\0} &"ep\nat"{\0} :=> \0 | C51: 0.215236 | F51: of:=IF([.C51]=1;"";[.C51]) -> 0.215236 | G51: of:=IF([.D51]=1;"";[.D51]) ->  
A52: 20 | B52: sysfs_streq: &"dh"{\0,p,z,\0} &"dh"{\0,b,l,\0} :=> \x01 | C52: 0.194167 | D52: 0.194167 | F52: of:=IF([.C52]=1;"";[.C52]) -> 0.194167 | G52: of:=IF([.D52]=1;"";[.D52]) -> 0.194167
A53: 21 | B53: sysfs_streq: &"rzhra"{\0} &"rzibo"{\0} :=> \0 | C53: 0.0257239 | D53: 0.0265435 | F53: of:=IF([.C53]=1;"";[.C53]) -> 0.0257239 | G53: of:=IF([.D53]=1;"";[.D53]) -> 0.0265435
A54: 22 | B54: sysfs_streq: &"se\n"{\0,b,\0} &"se"{\0,b,i,\0} :=> \x01 | C54: 0.221991 | F54: of:=IF([.C54]=1;"";[.C54]) -> 0.221991 | G54: of:=IF([.D54]=1;"";[.D54]) ->  
A55: 23 | B55: sysfs_streq: &"ih\n"{\0,b,\0} &"ihqaa"{\0} :=> \0 | C55: 0.0193733 | F55: of:=IF([.C55]=1;"";[.C55]) -> 0.0193733 | G55: of:=IF([.D55]=1;"";[.D55]) ->  
A56: 24 | B56: sysfs_streq: &"ex\naz"{\0} &"expks"{\0} :=> \0 | C56: 0.0268007 | F56: of:=IF([.C56]=1;"";[.C56]) -> 0.0268007 | G56: of:=IF([.D56]=1;"";[.D56]) ->  
A57: 25 | B57: sysfs_streq: &"hhd"{\0,p,\0} &"hhdsc"{\0} :=> \0 | C57: 0.0703692 | D57: 0.0257305 | F57: of:=IF([.C57]=1;"";[.C57]) -> 0.0703692 | G57: of:=IF([.D57]=1;"";[.D57]) -> 0.0257305
A58: 26 | B58: sysfs_streq: &"gfp"{\0,p,\0} &"gfp\n"{\0,\0} :=> \x01 | C58: 0.0590233 | F58: of:=IF([.C58]=1;"";[.C58]) -> 0.0590233 | G58: of:=IF([.D58]=1;"";[.D58]) ->  
A59: 27 | B59: sysfs_streq: &"sfh"{\0,p,\0} &"sfh\na"{\0} :=> \0 | C59: 0.06445 | F59: of:=IF([.C59]=1;"";[.C59]) -> 0.06445 | G59: of:=IF([.D59]=1;"";[.D59]) ->  
A60: 28 | B60: sysfs_streq: &"egv"{\0,p,\0} &"egv"{\0,h,\0} :=> \x01 | C60: 0.0648409 | D60: 0.0648409 | F60: of:=IF([.C60]=1;"";[.C60]) -> 0.0648409 | G60: of:=IF([.D60]=1;"";[.D60]) -> 0.0648409
A61: 29 | B61: sysfs_streq: &"bozkt"{\0} &"bozae"{\0} :=> \0 | C61: 0.0238642 | D61: 0.0269909 | F61: of:=IF([.C61]=1;"";[.C61]) -> 0.0238642 | G61: of:=IF([.D61]=1;"";[.D61]) -> 0.0269909
A62: 30 | B62: sysfs_streq: &"isj\n"{\0,\0} &"isj"{\0,a,\0} :=> \x01 | C62: 0.0719738 | F62: of:=IF([.C62]=1;"";[.C62]) -> 0.0719738 | G62: of:=IF([.D62]=1;"";[.D62]) ->  
A63: 31 | B63: sysfs_streq: &"lph\n"{\0,\0} &"lphru"{\0} :=> \0 | C63: 0.0282811 | F63: of:=IF([.C63]=1;"";[.C63]) -> 0.0282811 | G63: of:=IF([.D63]=1;"";[.D63]) ->  
A64: 32 | B64: sysfs_streq: &"dkv\na"{\0} &"dkvxa"{\0} :=> \0 | C64: 0 | F64: of:=IF([.C64]=1;"";[.C64]) -> 0 | G64: of:=IF([.D64]=1;"";[.D64]) ->  
A65: 33 | B65: sysfs_streq: &"grxo"{\0,\0} &"grxot"{\0} :=> \0 | C65: 0.0381453 | D65: 0.0255334 | F65: of:=IF([.C65]=1;"";[.C65]) -> 0.0381453 | G65: of:=IF([.D65]=1;"";[.D65]) -> 0.0255334
A66: 34 | B66: sysfs_streq: &"bqzc"{\0,\0} &"bqzc\n"{\0} :=> \x01 | C66: 0 | F66: of:=IF([.C66]=1;"";[.C66]) -> 0 | G66: of:=IF([.D66]=1;"";[.D66]) ->  
A67: 35 | B67: sysfs_streq: &"kjyn"{\0,\0} &"kjyn"{\0,\0} :=> \x01 | C67: 0.0262246 | D67: 0.0262246 | F67: of:=IF([.C67]=1;"";[.C67]) -> 0.0262246 | G67: of:=IF([.D67]=1;"";[.D67]) -> 0.0262246
A68: 36 | B68: sysfs_streq: &"cleyx"{\0} &"cleyj"{\0} :=> \0 | C68: 0.0261805 | D68: 0.0248753 | F68: of:=IF([.C68]=1;"";[.C68]) -> 0.0261805 | G68: of:=IF([.D68]=1;"";[.D68]) -> 0.0248753
A69: 37 | B69: sysfs_streq: &"qopq\n"{\0} &"qopq"{\0,\0} :=> \x01 | C69: 0 | F69: of:=IF([.C69]=1;"";[.C69]) -> 0 | G69: of:=IF([.D69]=1;"";[.D69]) ->  
A70: 38 | B70: sysfs_streq: &"cmzx\n"{\0} &"cmzxd"{\0} :=> \0 | C70: 0 | F70: of:=IF([.C70]=1;"";[.C70]) -> 0 | G70: of:=IF([.D70]=1;"";[.D70]) ->  
A71: 39 | B71: sysfs_streq: &"hqvwi"{\0} &"hqvwi"{\0} :=> \x01 | C71: 0 | D71: 0 | F71: of:=IF([.C71]=1;"";[.C71]) -> 0 | G71: of:=IF([.D71]=1;"";[.D71]) -> 0

Sheet: strcpy
A1: # | B1: Test Case | C1: N1 | D1: N2 | E1: N3 | O1: FINAL
A2: 1 | B2: strcpy: &""{\0,\x01,\x01,\x01,\x01,\x01} &"f"{\0,p,c,d,\0} :=> &"f"{\0,p,u,n,\0} | C2: 1 | D2: 1 | E2: 1 | G2: of:=IF([.C2]=1;"";[.C2]) ->  | H2: of:=IF([.D2]=1;"";[.D2]) ->  | I2: of:=IF([.E2]=1;"";[.E2]) ->  | K2: of:=AVERAGE([.G2:.G36]) -> 0.0673329541666667 | L2: of:=AVERAGE([.H2:.H36]) -> 0.0759967541666667 | M2: of:=AVERAGE([.I2:.I36]) -> 0.0759967541666667 | O2: of:=AVERAGE([.K2:.M2]) -> 0.0731088208333333
A3: 2 | B3: strcpy: &""{\0,\x01,\x01,\x01,\x01,\x01} &"de"{\0,p,e,\0} :=> &"de"{\0,p,d,\0} | C3: 1 | D3: 0.22156 | E3: 0.22156 | G3: of:=IF([.C3]=1;"";[.C3]) ->  | H3: of:=IF([.D3]=1;"";[.D3]) -> 0.22156 | I3: of:=IF([.E3]=1;"";[.E3]) -> 0.22156
A4: 3 | B4: strcpy: &""{\0,\x01,\x01,\x01,\x01,\x01} &"ahi"{\0,p,\0} :=> &"ahi"{\0,p,\0} | C4: 1 | D4: 0.0833898 | E4: 0.0833898 | G4: of:=IF([.C4]=1;"";[.C4]) ->  | H4: of:=IF([.D4]=1;"";[.D4]) -> 0.0833898 | I4: of:=IF([.E4]=1;"";[.E4]) -> 0.0833898
A5: 4 | B5: strcpy: &""{\0,\x01,\x01,\x01,\x01,\x01} &"idfg"{\0,\0} :=> &"idfg"{\0,\0} | C5: 1 | D5: 0.0393553 | E5: 0.0393553 | G5: of:=IF([.C5]=1;"";[.C5]) ->  | H5: of:=IF([.D5]=1;"";[.D5]) -> 0.0393553 | I5: of:=IF([.E5]=1;"";[.E5]) -> 0.0393553
A6: 5 | B6: strcpy: &""{\0,\x01,\x01,\x01,\x01,\x01} &"jjdqn"{\0} :=> &"jjdqn"{\0} | C6: 1 | D6: 0 | E6: 0 | G6: of:=IF([.C6]=1;"";[.C6]) ->  | H6: of:=IF([.D6]=1;"";[.D6]) -> 0 | I6: of:=IF([.E6]=1;"";[.E6]) -> 0
A7: 6 | B7: strcpy: &"q"{\0,\x01,\x01,\x01,\x01} &""{\0,p,h,y,t,\0} :=> &""{\0,\0,p,e,f,\0} | C7: 1 | D7: 1 | E7: 1 | G7: of:=IF([.C7]=1;"";[.C7]) ->  | H7: of:=IF([.D7]=1;"";[.D7]) ->  | I7: of:=IF([.E7]=1;"";[.E7]) -> 
A8: 7 | B8: strcpy: &"r"{\0,\x01,\x01,\x01,\x01} &"t"{\0,p,z,a,\0} :=> &"t"{\0,p,p,k,\0} | C8: 1 | D8: 1 | E8: 1 | G8: of:=IF([.C8]=1;"";[.C8]) ->  | H8: of:=IF([.D8]=1;"";[.D8]) ->  | I8: of:=IF([.E8]=1;"";[.E8]) -> 
A9: 8 | B9: strcpy: &"a"{\0,\x01,\x01,\x01,\x01} &"rr"{\0,p,k,\0} :=> &"rr"{\0,p,f,\0} | C9: 1 | D9: 0.213322 | E9: 0.213322 | G9: of:=IF([.C9]=1;"";[.C9]) ->  | H9: of:=IF([.D9]=1;"";[.D9]) -> 0.213322 | I9: of:=IF([.E9]=1;"";[.E9]) -> 0.213322
A10: 9 | B10: strcpy: &"p"{\0,\x01,\x01,\x01,\x01} &"kxm"{\0,p,\0} :=> &"kxm"{\0,p,\0} | C10: 1 | D10: 0 | E10: 0 | G10: of:=IF([.C10]=1;"";[.C10]) ->  | H10: of:=IF([.D10]=1;"";[.D10]) -> 0 | I10: of:=IF([.E10]=1;"";[.E10]) -> 0
A11: 10 | B11: strcpy: &"v"{\0,\x01,\x01,\x01,\x01} &"bqnt"{\0,\0} :=> &"bqnt"{\0,\0} | C11: 1 | D11: 0 | E11: 0 | G11: of:=IF([.C11]=1;"";[.C11]) ->  | H11: of:=IF([.D11]=1;"";[.D11]) -> 0 | I11: of:=IF([.E11]=1;"";[.E11]) -> 0
A12: 11 | B12: strcpy: &"f"{\0,\x01,\x01,\x01,\x01} &"tnqqj"{\0} :=> &"tnqqj"{\0} | C12: 1 | D12: 0 | E12: 0 | G12: of:=IF([.C12]=1;"";[.C12]) ->  | H12: of:=IF([.D12]=1;"";[.D12]) -> 0 | I12: of:=IF([.E12]=1;"";[.E12]) -> 0
A13: 12 | B13: strcpy: &"bc"{\0,\x01,\x01,\x01} &""{\0,p,u,k,n,\0} :=> &""{\0,c,\0,p,l,\0} | C13: 0.187534 | D13: 1 | E13: 1 | G13: of:=IF([.C13]=1;"";[.C13]) -> 0.187534 | H13: of:=IF([.D13]=1;"";[.D13]) ->  | I13: of:=IF([.E13]=1;"";[.E13]) -> 
A14: 13 | B14: strcpy: &"wf"{\0,\x01,\x01,\x01} &"w"{\0,p,a,w,\0} :=> &"w"{\0,\0,p,o,\0} | C14: 0.184985 | D14: 1 | E14: 1 | G14: of:=IF([.C14]=1;"";[.C14]) -> 0.184985 | H14: of:=IF([.D14]=1;"";[.D14]) ->  | I14: of:=IF([.E14]=1;"";[.E14]) -> 
A15: 14 | B15: strcpy: &"vt"{\0,\x01,\x01,\x01} &"um"{\0,p,z,\0} :=> &"um"{\0,p,o,\0} | C15: 0.162567 | D15: 0.213322 | E15: 0.213322 | G15: of:=IF([.C15]=1;"";[.C15]) -> 0.162567 | H15: of:=IF([.D15]=1;"";[.D15]) -> 0.213322 | I15: of:=IF([.E15]=1;"";[.E15]) -> 0.213322
A16: 15 | B16: strcpy: &"sc"{\0,\x01,\x01,\x01} &"fgf"{\0,p,\0} :=> &"fgf"{\0,p,\0} | C16: 0.213806 | D16: 0.0667266 | E16: 0.0667266 | G16: of:=IF([.C16]=1;"";[.C16]) -> 0.213806 | H16: of:=IF([.D16]=1;"";[.D16]) -> 0.0667266 | I16: of:=IF([.E16]=1;"";[.E16]) -> 0.0667266
A17: 16 | B17: strcpy: &"qx"{\0,\x01,\x01,\x01} &"fezh"{\0,\0} :=> &"fezh"{\0,\0} | C17: 0 | D17: 0.0399868 | E17: 0.0399868 | G17: of:=IF([.C17]=1;"";[.C17]) -> 0 | H17: of:=IF([.D17]=1;"";[.D17]) -> 0.0399868 | I17: of:=IF([.E17]=1;"";[.E17]) -> 0.0399868
A18: 17 | B18: strcpy: &"qu"{\0,\x01,\x01,\x01} &"cyfsj"{\0} :=> &"cyfsj"{\0} | C18: 0.212836 | D18: 0.0222369 | E18: 0.0222369 | G18: of:=IF([.C18]=1;"";[.C18]) -> 0.212836 | H18: of:=IF([.D18]=1;"";[.D18]) -> 0.0222369 | I18: of:=IF([.E18]=1;"";[.E18]) -> 0.0222369
A19: 18 | B19: strcpy: &"igd"{\0,\x01,\x01} &""{\0,p,f,d,d,\0} :=> &""{\0,g,d,\0,p,\0} | C19: 0.077787 | D19: 1 | E19: 1 | G19: of:=IF([.C19]=1;"";[.C19]) -> 0.077787 | H19: of:=IF([.D19]=1;"";[.D19]) ->  | I19: of:=IF([.E19]=1;"";[.E19]) -> 
A20: 19 | B20: strcpy: &"dsj"{\0,\x01,\x01} &"z"{\0,p,z,j,\0} :=> &"z"{\0,j,\0,p,\0} | C20: 0.0695022 | D20: 1 | E20: 1 | G20: of:=IF([.C20]=1;"";[.C20]) -> 0.0695022 | H20: of:=IF([.D20]=1;"";[.D20]) ->  | I20: of:=IF([.E20]=1;"";[.E20]) -> 
A21: 20 | B21: strcpy: &"ttc"{\0,\x01,\x01} &"zj"{\0,p,g,\0} :=> &"zj"{\0,\0,p,\0} | C21: 0.0831029 | D21: 0.106758 | E21: 0.106758 | G21: of:=IF([.C21]=1;"";[.C21]) -> 0.0831029 | H21: of:=IF([.D21]=1;"";[.D21]) -> 0.106758 | I21: of:=IF([.E21]=1;"";[.E21]) -> 0.106758
A22: 21 | B22: strcpy: &"tdn"{\0,\x01,\x01} &"yys"{\0,p,\0} :=> &"yys"{\0,p,\0} | C22: 0.075021 | D22: 0.0665023 | E22: 0.0665023 | G22: of:=IF([.C22]=1;"";[.C22]) -> 0.075021 | H22: of:=IF([.D22]=1;"";[.D22]) -> 0.0665023 | I22: of:=IF([.E22]=1;"";[.E22]) -> 0.0665023
A23: 22 | B23: strcpy: &"aqm"{\0,\x01,\x01} &"epgh"{\0,\0} :=> &"epgh"{\0,\0} | C23: 0 | D23: 0.0436758 | E23: 0.0436758 | G23: of:=IF([.C23]=1;"";[.C23]) -> 0 | H23: of:=IF([.D23]=1;"";[.D23]) -> 0.0436758 | I23: of:=IF([.E23]=1;"";[.E23]) -> 0.0436758
A24: 23 | B24: strcpy: &"mbv"{\0,\x01,\x01} &"wsptj"{\0} :=> &"wsptj"{\0} | C24: 0.0768097 | D24: 0.0250303 | E24: 0.0250303 | G24: of:=IF([.C24]=1;"";[.C24]) -> 0.0768097 | H24: of:=IF([.D24]=1;"";[.D24]) -> 0.0250303 | I24: of:=IF([.E24]=1;"";[.E24]) -> 0.0250303
A25: 24 | B25: strcpy: &"crbx"{\0,\x01} &""{\0,p,q,r,l,\0} :=> &""{\0,r,b,x,\0,\0} | C25: 0 | D25: 1 | E25: 1 | G25: of:=IF([.C25]=1;"";[.C25]) -> 0 | H25: of:=IF([.D25]=1;"";[.D25]) ->  | I25: of:=IF([.E25]=1;"";[.E25]) -> 
A26: 25 | B26: strcpy: &"zdzf"{\0,\x01} &"x"{\0,p,h,s,\0} :=> &"x"{\0,z,f,\0,\0} | C26: 0.0272697 | D26: 1 | E26: 1 | G26: of:=IF([.C26]=1;"";[.C26]) -> 0.0272697 | H26: of:=IF([.D26]=1;"";[.D26]) ->  | I26: of:=IF([.E26]=1;"";[.E26]) -> 
A27: 26 | B27: strcpy: &"hgsx"{\0,\x01} &"pb"{\0,p,g,\0} :=> &"pb"{\0,x,\0,\0} | C27: 0 | D27: 0.189224 | E27: 0.189224 | G27: of:=IF([.C27]=1;"";[.C27]) -> 0 | H27: of:=IF([.D27]=1;"";[.D27]) -> 0.189224 | I27: of:=IF([.E27]=1;"";[.E27]) -> 0.189224
A28: 27 | B28: strcpy: &"krid"{\0,\x01} &"zim"{\0,p,\0} :=> &"zim"{\0,\0,\0} | C28: 0.0451291 | D28: 0.0821198 | E28: 0.0821198 | G28: of:=IF([.C28]=1;"";[.C28]) -> 0.0451291 | H28: of:=IF([.D28]=1;"";[.D28]) -> 0.0821198 | I28: of:=IF([.E28]=1;"";[.E28]) -> 0.0821198
A29: 28 | B29: strcpy: &"viga"{\0,\x01} &"zjuy"{\0,\0} :=> &"zjuy"{\0,\0} | C29: 0.0469935 | D29: 0.0273137 | E29: 0.0273137 | G29: of:=IF([.C29]=1;"";[.C29]) -> 0.0469935 | H29: of:=IF([.D29]=1;"";[.D29]) -> 0.0273137 | I29: of:=IF([.E29]=1;"";[.E29]) -> 0.0273137
A30: 29 | B30: strcpy: &"sjlb"{\0,\x01} &"capfr"{\0} :=> &"capfr"{\0} | C30: 0.0288189 | D30: 0.0279157 | E30: 0.0279157 | G30: of:=IF([.C30]=1;"";[.C30]) -> 0.0288189 | H30: of:=IF([.D30]=1;"";[.D30]) -> 0.0279157 | I30: of:=IF([.E30]=1;"";[.E30]) -> 0.0279157
A31: 30 | B31: strcpy: &"ofkxe"{\0} &""{\0,p,w,t,l,\0} :=> &""{\0,f,k,x,e,\0} | C31: 0 | D31: 1 | E31: 1 | G31: of:=IF([.C31]=1;"";[.C31]) -> 0 | H31: of:=IF([.D31]=1;"";[.D31]) ->  | I31: of:=IF([.E31]=1;"";[.E31]) -> 
A32: 31 | B32: strcpy: &"njfyl"{\0} &"p"{\0,p,v,d,\0} :=> &"p"{\0,f,y,l,\0} | C32: 0.0206995 | D32: 1 | E32: 1 | G32: of:=IF([.C32]=1;"";[.C32]) -> 0.0206995 | H32: of:=IF([.D32]=1;"";[.D32]) ->  | I32: of:=IF([.E32]=1;"";[.E32]) -> 
A33: 32 | B33: strcpy: &"hiexe"{\0} &"li"{\0,p,i,\0} :=> &"li"{\0,x,e,\0} | C33: 0.0297849 | D33: 0.22156 | E33: 0.22156 | G33: of:=IF([.C33]=1;"";[.C33]) -> 0.0297849 | H33: of:=IF([.D33]=1;"";[.D33]) -> 0.22156 | I33: of:=IF([.E33]=1;"";[.E33]) -> 0.22156
A34: 33 | B34: strcpy: &"nbtjl"{\0} &"pmu"{\0,p,\0} :=> &"pmu"{\0,l,\0} | C34: 0.019024 | D34: 0.0800538 | E34: 0.0800538 | G34: of:=IF([.C34]=1;"";[.C34]) -> 0.019024 | H34: of:=IF([.D34]=1;"";[.D34]) -> 0.0800538 | I34: of:=IF([.E34]=1;"";[.E34]) -> 0.0800538
A35: 34 | B35: strcpy: &"trsng"{\0} &"pcpy"{\0,\0} :=> &"pcpy"{\0,\0} | C35: 0.0302562 | D35: 0.0330009 | E35: 0.0330009 | G35: of:=IF([.C35]=1;"";[.C35]) -> 0.0302562 | H35: of:=IF([.D35]=1;"";[.D35]) -> 0.0330009 | I35: of:=IF([.E35]=1;"";[.E35]) -> 0.0330009
A36: 35 | B36: strcpy: &"rgwun"{\0} &"xefzp"{\0} :=> &"xefzp"{\0} | C36: 0.0240643 | D36: 0.0208684 | E36: 0.0208684 | G36: of:=IF([.C36]=1;"";[.C36]) -> 0.0240643 | H36: of:=IF([.D36]=1;"";[.D36]) -> 0.0208684 | I36: of:=IF([.E36]=1;"";[.E36]) -> 0.0208684
A37: 1 | B37: strncpy: &""{\0,\x01,\x01,\x01,\x01,\x01} &""{\0,p,e,j,q,\0} 5 :=> &""{\0,\0,\0,\0,\0,\0} | C37: 1 | D37: 1 | E37: 1 | G37: of:=IF([.C37]=1;"";[.C37]) ->  | H37: of:=IF([.D37]=1;"";[.D37]) ->  | I37: of:=IF([.E37]=1;"";[.E37]) ->  | K37: of:=AVERAGE([.G37:.G72]) -> 0.0816352083333333 | L37: of:=AVERAGE([.H37:.H72]) -> 0.0803740333333333 | M37: of:=AVERAGE([.I37:.I72]) -> 0.0803740333333333 | O37: of:=AVERAGE([.K37:.M37]) -> 0.080794425
A38: 2 | B38: strncpy: &""{\0,\x01,\x01,\x01,\x01,\x01} &"b"{\0,p,a,p,\0} 5 :=> &"b"{\0,\0,\0,\0,\0} | C38: 1 | D38: 1 | E38: 1 | G38: of:=IF([.C38]=1;"";[.C38]) ->  | H38: of:=IF([.D38]=1;"";[.D38]) ->  | I38: of:=IF([.E38]=1;"";[.E38]) -> 
A39: 3 | B39: strncpy: &""{\0,\x01,\x01,\x01,\x01,\x01} &"ai"{\0,p,h,\0} 5 :=> &"ai"{\0,\0,\0,\0} | C39: 1 | D39: 0.219808 | E39: 0.219808 | G39: of:=IF([.C39]=1;"";[.C39]) ->  | H39: of:=IF([.D39]=1;"";[.D39]) -> 0.219808 | I39: of:=IF([.E39]=1;"";[.E39]) -> 0.219808
A40: 4 | B40: strncpy: &""{\0,\x01,\x01,\x01,\x01,\x01} &"kao"{\0,p,\0} 5 :=> &"kao"{\0,\0,\0} | C40: 1 | D40: 0.0760433 | E40: 0.0760433 | G40: of:=IF([.C40]=1;"";[.C40]) ->  | H40: of:=IF([.D40]=1;"";[.D40]) -> 0.0760433 | I40: of:=IF([.E40]=1;"";[.E40]) -> 0.0760433
A41: 5 | B41: strncpy: &""{\0,\x01,\x01,\x01,\x01,\x01} &"nxph"{\0,\0} 5 :=> &"nxph"{\0,\0} | C41: 1 | D41: 0.0418806 | E41: 0.0418806 | G41: of:=IF([.C41]=1;"";[.C41]) ->  | H41: of:=IF([.D41]=1;"";[.D41]) -> 0.0418806 | I41: of:=IF([.E41]=1;"";[.E41]) -> 0.0418806
A42: 6 | B42: strncpy: &""{\0,\x01,\x01,\x01,\x01,\x01} &"mdozk"{\0} 5 :=> &"mdozk"{\0} | C42: 1 | D42: 0.0231397 | E42: 0.0231397 | G42: of:=IF([.C42]=1;"";[.C42]) ->  | H42: of:=IF([.D42]=1;"";[.D42]) -> 0.0231397 | I42: of:=IF([.E42]=1;"";[.E42]) -> 0.0231397
A43: 7 | B43: strncpy: &"p"{\0,\x01,\x01,\x01,\x01} &""{\0,p,v,t,m,\0} 5 :=> &""{\0,\0,\0,\0,\0,\0} | C43: 1 | D43: 1 | E43: 1 | G43: of:=IF([.C43]=1;"";[.C43]) ->  | H43: of:=IF([.D43]=1;"";[.D43]) ->  | I43: of:=IF([.E43]=1;"";[.E43]) -> 
A44: 8 | B44: strncpy: &"p"{\0,\x01,\x01,\x01,\x01} &"l"{\0,p,s,x,\0} 5 :=> &"l"{\0,\0,\0,\0,\0} | C44: 1 | D44: 1 | E44: 1 | G44: of:=IF([.C44]=1;"";[.C44]) ->  | H44: of:=IF([.D44]=1;"";[.D44]) ->  | I44: of:=IF([.E44]=1;"";[.E44]) -> 
A45: 9 | B45: strncpy: &"d"{\0,\x01,\x01,\x01,\x01} &"we"{\0,p,q,\0} 5 :=> &"we"{\0,\0,\0,\0} | C45: 1 | D45: 0.2171 | E45: 0.2171 | G45: of:=IF([.C45]=1;"";[.C45]) ->  | H45: of:=IF([.D45]=1;"";[.D45]) -> 0.2171 | I45: of:=IF([.E45]=1;"";[.E45]) -> 0.2171
A46: 10 | B46: strncpy: &"v"{\0,\x01,\x01,\x01,\x01} &"evl"{\0,p,\0} 5 :=> &"evl"{\0,\0,\0} | C46: 1 | D46: 0.0733085 | E46: 0.0733085 | G46: of:=IF([.C46]=1;"";[.C46]) ->  | H46: of:=IF([.D46]=1;"";[.D46]) -> 0.0733085 | I46: of:=IF([.E46]=1;"";[.E46]) -> 0.0733085
A47: 11 | B47: strncpy: &"q"{\0,\x01,\x01,\x01,\x01} &"snjn"{\0,\0} 5 :=> &"snjn"{\0,\0} | C47: 1 | D47: 0.0346605 | E47: 0.0346605 | G47: of:=IF([.C47]=1;"";[.C47]) ->  | H47: of:=IF([.D47]=1;"";[.D47]) -> 0.0346605 | I47: of:=IF([.E47]=1;"";[.E47]) -> 0.0346605
A48: 12 | B48: strncpy: &"a"{\0,\x01,\x01,\x01,\x01} &"yralm"{\0} 5 :=> &"yralm"{\0} | C48: 1 | D48: 0.0292431 | E48: 0.0292431 | G48: of:=IF([.C48]=1;"";[.C48]) ->  | H48: of:=IF([.D48]=1;"";[.D48]) -> 0.0292431 | I48: of:=IF([.E48]=1;"";[.E48]) -> 0.0292431
A49: 13 | B49: strncpy: &"kn"{\0,\x01,\x01,\x01} &""{\0,p,t,a,u,\0} 5 :=> &""{\0,\0,\0,\0,\0,\0} | C49: 0.20725 | D49: 1 | E49: 1 | G49: of:=IF([.C49]=1;"";[.C49]) -> 0.20725 | H49: of:=IF([.D49]=1;"";[.D49]) ->  | I49: of:=IF([.E49]=1;"";[.E49]) -> 
A50: 14 | B50: strncpy: &"ss"{\0,\x01,\x01,\x01} &"c"{\0,p,x,j,\0} 5 :=> &"c"{\0,\0,\0,\0,\0} | C50: 0.218916 | D50: 1 | E50: 1 | G50: of:=IF([.C50]=1;"";[.C50]) -> 0.218916 | H50: of:=IF([.D50]=1;"";[.D50]) ->  | I50: of:=IF([.E50]=1;"";[.E50]) -> 
A51: 15 | B51: strncpy: &"lv"{\0,\x01,\x01,\x01} &"kf"{\0,p,s,\0} 5 :=> &"kf"{\0,\0,\0,\0} | C51: 0.206077 | D51: 0.188665 | E51: 0.188665 | G51: of:=IF([.C51]=1;"";[.C51]) -> 0.206077 | H51: of:=IF([.D51]=1;"";[.D51]) -> 0.188665 | I51: of:=IF([.E51]=1;"";[.E51]) -> 0.188665
A52: 16 | B52: strncpy: &"aw"{\0,\x01,\x01,\x01} &"gyj"{\0,p,\0} 5 :=> &"gyj"{\0,\0,\0} | C52: 0.210856 | D52: 0.06308 | E52: 0.06308 | G52: of:=IF([.C52]=1;"";[.C52]) -> 0.210856 | H52: of:=IF([.D52]=1;"";[.D52]) -> 0.06308 | I52: of:=IF([.E52]=1;"";[.E52]) -> 0.06308
A53: 17 | B53: strncpy: &"ie"{\0,\x01,\x01,\x01} &"aroz"{\0,\0} 5 :=> &"aroz"{\0,\0} | C53: 0.218466 | D53: 0.0459621 | E53: 0.0459621 | G53: of:=IF([.C53]=1;"";[.C53]) -> 0.218466 | H53: of:=IF([.D53]=1;"";[.D53]) -> 0.0459621 | I53: of:=IF([.E53]=1;"";[.E53]) -> 0.0459621
A54: 18 | B54: strncpy: &"wz"{\0,\x01,\x01,\x01} &"xtmfr"{\0} 5 :=> &"xtmfr"{\0} | C54: 0.142657 | D54: 0.0270175 | E54: 0.0270175 | G54: of:=IF([.C54]=1;"";[.C54]) -> 0.142657 | H54: of:=IF([.D54]=1;"";[.D54]) -> 0.0270175 | I54: of:=IF([.E54]=1;"";[.E54]) -> 0.0270175
A55: 19 | B55: strncpy: &"eho"{\0,\x01,\x01} &""{\0,p,e,x,h,\0} 5 :=> &""{\0,\0,\0,\0,\0,\0} | C55: 0.0837222 | D55: 1 | E55: 1 | G55: of:=IF([.C55]=1;"";[.C55]) -> 0.0837222 | H55: of:=IF([.D55]=1;"";[.D55]) ->  | I55: of:=IF([.E55]=1;"";[.E55]) -> 
A56: 20 | B56: strncpy: &"hmk"{\0,\x01,\x01} &"y"{\0,p,r,w,\0} 5 :=> &"y"{\0,\0,\0,\0,\0} | C56: 0.0665721 | D56: 1 | E56: 1 | G56: of:=IF([.C56]=1;"";[.C56]) -> 0.0665721 | H56: of:=IF([.D56]=1;"";[.D56]) ->  | I56: of:=IF([.E56]=1;"";[.E56]) -> 
A57: 21 | B57: strncpy: &"etp"{\0,\x01,\x01} &"ju"{\0,p,v,\0} 5 :=> &"ju"{\0,\0,\0,\0} | C57: 0.0795982 | D57: 0.208818 | E57: 0.208818 | G57: of:=IF([.C57]=1;"";[.C57]) -> 0.0795982 | H57: of:=IF([.D57]=1;"";[.D57]) -> 0.208818 | I57: of:=IF([.E57]=1;"";[.E57]) -> 0.208818
A58: 22 | B58: strncpy: &"iks"{\0,\x01,\x01} &"lek"{\0,p,\0} 5 :=> &"lek"{\0,\0,\0} | C58: 0.0827077 | D58: 0.0842319 | E58: 0.0842319 | G58: of:=IF([.C58]=1;"";[.C58]) -> 0.0827077 | H58: of:=IF([.D58]=1;"";[.D58]) -> 0.0842319 | I58: of:=IF([.E58]=1;"";[.E58]) -> 0.0842319
A59: 23 | B59: strncpy: &"xsv"{\0,\x01,\x01} &"ksah"{\0,\0} 5 :=> &"ksah"{\0,\0} | C59: 0.0635742 | D59: 0.0443936 | E59: 0.0443936 | G59: of:=IF([.C59]=1;"";[.C59]) -> 0.0635742 | H59: of:=IF([.D59]=1;"";[.D59]) -> 0.0443936 | I59: of:=IF([.E59]=1;"";[.E59]) -> 0.0443936
A60: 24 | B60: strncpy: &"izv"{\0,\x01,\x01} &"vghdk"{\0} 5 :=> &"vghdk"{\0} | C60: 0.0705652 | D60: 0.0224156 | E60: 0.0224156 | G60: of:=IF([.C60]=1;"";[.C60]) -> 0.0705652 | H60: of:=IF([.D60]=1;"";[.D60]) -> 0.0224156 | I60: of:=IF([.E60]=1;"";[.E60]) -> 0.0224156
A61: 25 | B61: strncpy: &"pddf"{\0,\x01} &""{\0,p,n,e,e,\0} 5 :=> &""{\0,\0,\0,\0,\0,\0} | C61: 0.0378079 | D61: 1 | E61: 1 | G61: of:=IF([.C61]=1;"";[.C61]) -> 0.0378079 | H61: of:=IF([.D61]=1;"";[.D61]) ->  | I61: of:=IF([.E61]=1;"";[.E61]) -> 
A62: 26 | B62: strncpy: &"xzvo"{\0,\x01} &"n"{\0,p,j,e,\0} 5 :=> &"n"{\0,\0,\0,\0,\0} | C62: 0 | D62: 1 | E62: 1 | G62: of:=IF([.C62]=1;"";[.C62]) -> 0 | H62: of:=IF([.D62]=1;"";[.D62]) ->  | I62: of:=IF([.E62]=1;"";[.E62]) -> 
A63: 27 | B63: strncpy: &"ovaz"{\0,\x01} &"nz"{\0,p,t,\0} 5 :=> &"nz"{\0,\0,\0,\0} | C63: 0.0443878 | D63: 0.19544 | E63: 0.19544 | G63: of:=IF([.C63]=1;"";[.C63]) -> 0.0443878 | H63: of:=IF([.D63]=1;"";[.D63]) -> 0.19544 | I63: of:=IF([.E63]=1;"";[.E63]) -> 0.19544
A64: 28 | B64: strncpy: &"uxnt"{\0,\x01} &"fvw"{\0,p,\0} 5 :=> &"fvw"{\0,\0,\0} | C64: 0.0353237 | D64: 0 | E64: 0 | G64: of:=IF([.C64]=1;"";[.C64]) -> 0.0353237 | H64: of:=IF([.D64]=1;"";[.D64]) -> 0 | I64: of:=IF([.E64]=1;"";[.E64]) -> 0
A65: 29 | B65: strncpy: &"npus"{\0,\x01} &"xlzb"{\0,\0} 5 :=> &"xlzb"{\0,\0} | C65: 0.043834 | D65: 0.0327616 | E65: 0.0327616 | G65: of:=IF([.C65]=1;"";[.C65]) -> 0.043834 | H65: of:=IF([.D65]=1;"";[.D65]) -> 0.0327616 | I65: of:=IF([.E65]=1;"";[.E65]) -> 0.0327616
A66: 30 | B66: strncpy: &"maek"{\0,\x01} &"iagpq"{\0} 5 :=> &"iagpq"{\0} | C66: 0.0443099 | D66: 0.0211677 | E66: 0.0211677 | G66: of:=IF([.C66]=1;"";[.C66]) -> 0.0443099 | H66: of:=IF([.D66]=1;"";[.D66]) -> 0.0211677 | I66: of:=IF([.E66]=1;"";[.E66]) -> 0.0211677
A67: 31 | B67: strncpy: &"cfkqj"{\0} &""{\0,p,g,v,w,\0} 5 :=> &""{\0,\0,\0,\0,\0,\0} | C67: 0 | D67: 1 | E67: 1 | G67: of:=IF([.C67]=1;"";[.C67]) -> 0 | H67: of:=IF([.D67]=1;"";[.D67]) ->  | I67: of:=IF([.E67]=1;"";[.E67]) -> 
A68: 32 | B68: strncpy: &"kieaj"{\0} &"b"{\0,p,a,w,\0} 5 :=> &"b"{\0,\0,\0,\0,\0} | C68: 0.0294742 | D68: 1 | E68: 1 | G68: of:=IF([.C68]=1;"";[.C68]) -> 0.0294742 | H68: of:=IF([.D68]=1;"";[.D68]) ->  | I68: of:=IF([.E68]=1;"";[.E68]) -> 
A69: 33 | B69: strncpy: &"uiqmw"{\0} &"rp"{\0,p,r,\0} 5 :=> &"rp"{\0,\0,\0,\0} | C69: 0 | D69: 0.208818 | E69: 0.208818 | G69: of:=IF([.C69]=1;"";[.C69]) -> 0 | H69: of:=IF([.D69]=1;"";[.D69]) -> 0.208818 | I69: of:=IF([.E69]=1;"";[.E69]) -> 0.208818
A70: 34 | B70: strncpy: &"hurnc"{\0} &"gqp"{\0,p,\0} 5 :=> &"gqp"{\0,\0,\0} | C70: 0.0300467 | D70: 0 | E70: 0 | G70: of:=IF([.C70]=1;"";[.C70]) -> 0.0300467 | H70: of:=IF([.D70]=1;"";[.D70]) -> 0 | I70: of:=IF([.E70]=1;"";[.E70]) -> 0
A71: 35 | B71: strncpy: &"alvmr"{\0} &"pdsu"{\0,\0} 5 :=> &"pdsu"{\0,\0} | C71: 0.0216061 | D71: 0.0413367 | E71: 0.0413367 | G71: of:=IF([.C71]=1;"";[.C71]) -> 0.0216061 | H71: of:=IF([.D71]=1;"";[.D71]) -> 0.0413367 | I71: of:=IF([.E71]=1;"";[.E71]) -> 0.0413367
A72: 36 | B72: strncpy: &"vmbsv"{\0} &"ulmiv"{\0} 5 :=> &"ulmiv"{\0} | C72: 0.0214931 | D72: 0.0296854 | E72: 0.0296854 | G72: of:=IF([.C72]=1;"";[.C72]) -> 0.0214931 | H72: of:=IF([.D72]=1;"";[.D72]) -> 0.0296854 | I72: of:=IF([.E72]=1;"";[.E72]) -> 0.0296854

Sheet: strcat
A1: # | B1: Test Case | C1: N1 | D1: N2 | E1: N3
A2: 1 | B2: strcat: &""{\0,\x01,\x01,\x01,\x01,\x01,\x01,\x01,\x01,\x01} &"v"{\0,p,l,\0} :=> &"v"{\0,p,k,m,m,c,q,t,\0} | C2: 1 | D2: 1 | E2: 1 | G2: of:=IF([.C2]=1;"";[.C2]) ->  | H2: of:=IF([.D2]=1;"";[.D2]) ->  | I2: of:=IF([.E2]=1;"";[.E2]) ->  | K2: of:=AVERAGE([.G2:.G41]) -> 0.0521519293548387 | L2: of:=AVERAGE([.H2:.H41]) -> 0.094867365 | M2: of:=AVERAGE([.I2:.I41]) -> 0.0359086924324324 | O2: of:=AVERAGE([.K2:.M2]) -> 0.060975995595757
A3: 2 | B3: strcat: &""{\0,\x01,\x01,\x01,\x01,\x01,\x01,\x01,\x01,\x01} &"sf"{\0,p,\0} :=> &"sf"{\0,p,a,d,g,h,t,\0} | C3: 1 | D3: 0.200708 | E3: 0.200708 | G3: of:=IF([.C3]=1;"";[.C3]) ->  | H3: of:=IF([.D3]=1;"";[.D3]) -> 0.200708 | I3: of:=IF([.E3]=1;"";[.E3]) -> 0.200708
A4: 3 | B4: strcat: &""{\0,\x01,\x01,\x01,\x01,\x01,\x01,\x01,\x01,\x01} &"agk"{\0,\0} :=> &"agk"{\0,p,p,c,q,f,\0} | C4: 1 | D4: 0.0719187 | E4: 0.0719187 | G4: of:=IF([.C4]=1;"";[.C4]) ->  | H4: of:=IF([.D4]=1;"";[.D4]) -> 0.0719187 | I4: of:=IF([.E4]=1;"";[.E4]) -> 0.0719187
A5: 4 | B5: strcat: &""{\0,\x01,\x01,\x01,\x01,\x01,\x01,\x01,\x01,\x01} &"winl"{\0} :=> &"winl"{\0,p,f,s,v,\0} | C5: 1 | D5: 0.0474514 | E5: 0.0474514 | H5: of:=IF([.D5]=1;"";[.D5]) -> 0.0474514 | I5: of:=IF([.E5]=1;"";[.E5]) -> 0.0474514
A6: 5 | B6: strcat: &"f"{\0,\x01,\x01,\x01,\x01,\x01,\x01,\x01,\x01} &""{\0,p,l,r,\0} :=> &"f"{\0,p,v,n,x,a,d,r,\0} | C6: 1 | D6: 1 | E6: 1 | G6: of:=IF([.C6]=1;"";[.C6]) ->  | H6: of:=IF([.D6]=1;"";[.D6]) ->  | I6: of:=IF([.E6]=1;"";[.E6]) -> 
A7: 6 | B7: strcat: &"h"{\0,\x01,\x01,\x01,\x01,\x01,\x01,\x01,\x01} &"c"{\0,p,y,\0} :=> &"hc"{\0,p,c,e,p,a,p,\0} | C7: 1 | D7: 1 | E7: 0.185944 | G7: of:=IF([.C7]=1;"";[.C7]) ->  | H7: of:=IF([.D7]=1;"";[.D7]) ->  | I7: of:=IF([.E7]=1;"";[.E7]) -> 0.185944
A8: 7 | B8: strcat: &"x"{\0,\x01,\x01,\x01,\x01,\x01,\x01,\x01,\x01} &"lo"{\0,p,\0} :=> &"xlo"{\0,p,e,w,x,p,\0} | C8: 1 | D8: 0.218014 | E8: 0.0735475 | G8: of:=IF([.C8]=1;"";[.C8]) ->  | H8: of:=IF([.D8]=1;"";[.D8]) -> 0.218014 | I8: of:=IF([.E8]=1;"";[.E8]) -> 0.0735475
A9: 8 | B9: strcat: &"r"{\0,\x01,\x01,\x01,\x01,\x01,\x01,\x01,\x01} &"iae"{\0,\0} :=> &"riae"{\0,p,s,d,h,\0} | C9: 1 | D9: 0.0828398 | E9: 0.0458802 | G9: of:=IF([.C9]=1;"";[.C9]) ->  | H9: of:=IF([.D9]=1;"";[.D9]) -> 0.0828398 | I9: of:=IF([.E9]=1;"";[.E9]) -> 0.0458802
A10: 9 | B10: strcat: &"v"{\0,\x01,\x01,\x01,\x01,\x01,\x01,\x01,\x01} &"ewhe"{\0} :=> &"vewhe"{\0,p,s,r,\0} | C10: 1 | D10: 0.0484797 | E10: 0.0316093 | G10: of:=IF([.C10]=1;"";[.C10]) ->  | H10: of:=IF([.D10]=1;"";[.D10]) -> 0.0484797 | I10: of:=IF([.E10]=1;"";[.E10]) -> 0.0316093
A11: 10 | B11: strcat: &"zn"{\0,\x01,\x01,\x01,\x01,\x01,\x01,\x01} &""{\0,p,m,r,\0} :=> &"zn"{\0,p,h,i,u,b,x,\0} | C11: 0.172194 | D11: 1 | E11: 0.172194 | G11: of:=IF([.C11]=1;"";[.C11]) -> 0.172194 | H11: of:=IF([.D11]=1;"";[.D11]) ->  | I11: of:=IF([.E11]=1;"";[.E11]) -> 0.172194
A12: 11 | B12: strcat: &"tf"{\0,\x01,\x01,\x01,\x01,\x01,\x01,\x01} &"r"{\0,p,x,\0} :=> &"tfr"{\0,p,c,k,x,k,\0} | C12: 0.197488 | D12: 1 | E12: 0.0800798 | G12: of:=IF([.C12]=1;"";[.C12]) -> 0.197488 | H12: of:=IF([.D12]=1;"";[.D12]) ->  | I12: of:=IF([.E12]=1;"";[.E12]) -> 0.0800798
A13: 12 | B13: strcat: &"cg"{\0,\x01,\x01,\x01,\x01,\x01,\x01,\x01} &"jw"{\0,p,\0} :=> &"cgjw"{\0,p,a,z,b,\0} | C13: 0.106758 | D13: 0 | E13: 0 | G13: of:=IF([.C13]=1;"";[.C13]) -> 0.106758 | H13: of:=IF([.D13]=1;"";[.D13]) -> 0 | I13: of:=IF([.E13]=1;"";[.E13]) -> 0
A14: 13 | B14: strcat: &"zm"{\0,\x01,\x01,\x01,\x01,\x01,\x01,\x01} &"bmb"{\0,\0} :=> &"zmbmb"{\0,p,c,c,\0} | C14: 0.183327 | D14: 0.0765464 | E14: 0.0249268 | G14: of:=IF([.C14]=1;"";[.C14]) -> 0.183327 | H14: of:=IF([.D14]=1;"";[.D14]) -> 0.0765464 | I14: of:=IF([.E14]=1;"";[.E14]) -> 0.0249268
A15: 14 | B15: strcat: &"hu"{\0,\x01,\x01,\x01,\x01,\x01,\x01,\x01} &"ginp"{\0} :=> &"huginp"{\0,p,c,\0} | C15: 0.209333 | D15: 0.0448583 | E15: 0.020621 | G15: of:=IF([.C15]=1;"";[.C15]) -> 0.209333 | H15: of:=IF([.D15]=1;"";[.D15]) -> 0.0448583 | I15: of:=IF([.E15]=1;"";[.E15]) -> 0.020621
A16: 15 | B16: strcat: &"rya"{\0,\x01,\x01,\x01,\x01,\x01,\x01} &""{\0,p,p,y,\0} :=> &"rya"{\0,p,p,s,n,z,\0} | C16: 0.0822568 | D16: 1 | E16: 0.0822568 | G16: of:=IF([.C16]=1;"";[.C16]) -> 0.0822568 | H16: of:=IF([.D16]=1;"";[.D16]) ->  | I16: of:=IF([.E16]=1;"";[.E16]) -> 0.0822568
A17: 16 | B17: strcat: &"dbc"{\0,\x01,\x01,\x01,\x01,\x01,\x01} &"y"{\0,p,n,\0} :=> &"dbcy"{\0,p,e,x,n,\0} | C17: 0.0702159 | D17: 1 | E17: 0.0383689 | G17: of:=IF([.C17]=1;"";[.C17]) -> 0.0702159 | H17: of:=IF([.D17]=1;"";[.D17]) ->  | I17: of:=IF([.E17]=1;"";[.E17]) -> 0.0383689
A18: 17 | B18: strcat: &"bej"{\0,\x01,\x01,\x01,\x01,\x01,\x01} &"qw"{\0,p,\0} :=> &"bejqw"{\0,p,r,i,\0} | C18: 0.0802638 | D18: 0.106758 | E18: 0 | G18: of:=IF([.C18]=1;"";[.C18]) -> 0.0802638 | H18: of:=IF([.D18]=1;"";[.D18]) -> 0.106758 | I18: of:=IF([.E18]=1;"";[.E18]) -> 0
A19: 18 | B19: strcat: &"puh"{\0,\x01,\x01,\x01,\x01,\x01,\x01} &"max"{\0,\0} :=> &"puhmax"{\0,p,p,\0} | C19: 0.0753558 | D19: 0.084081 | E19: 0.0189306 | G19: of:=IF([.C19]=1;"";[.C19]) -> 0.0753558 | H19: of:=IF([.D19]=1;"";[.D19]) -> 0.084081 | I19: of:=IF([.E19]=1;"";[.E19]) -> 0.0189306
A20: 19 | B20: strcat: &"zpn"{\0,\x01,\x01,\x01,\x01,\x01,\x01} &"qvsf"{\0} :=> &"zpnqvsf"{\0,p,\0} | C20: 0.0629484 | D20: 0.0295215 | E20: 0.00989157 | G20: of:=IF([.C20]=1;"";[.C20]) -> 0.0629484 | H20: of:=IF([.D20]=1;"";[.D20]) -> 0.0295215 | I20: of:=IF([.E20]=1;"";[.E20]) -> 0.00989157
A21: 20 | B21: strcat: &"cdmh"{\0,\x01,\x01,\x01,\x01,\x01} &""{\0,p,l,k,\0} :=> &"cdmh"{\0,p,y,b,g,\0} | C21: 0.0356305 | D21: 1 | E21: 0.0356305 | G21: of:=IF([.C21]=1;"";[.C21]) -> 0.0356305 | H21: of:=IF([.D21]=1;"";[.D21]) ->  | I21: of:=IF([.E21]=1;"";[.E21]) -> 0.0356305
A22: 21 | B22: strcat: &"ptrg"{\0,\x01,\x01,\x01,\x01,\x01} &"c"{\0,p,a,\0} :=> &"ptrgc"{\0,p,u,e,\0} | C22: 0.0458678 | D22: 1 | E22: 0.0250997 | G22: of:=IF([.C22]=1;"";[.C22]) -> 0.0458678 | H22: of:=IF([.D22]=1;"";[.D22]) ->  | I22: of:=IF([.E22]=1;"";[.E22]) -> 0.0250997
A23: 22 | B23: strcat: &"ihhs"{\0,\x01,\x01,\x01,\x01,\x01} &"zn"{\0,p,\0} :=> &"ihhszn"{\0,p,t,\0} | C23: 0.0369027 | D23: 0.172194 | E23: 0.0149501 | G23: of:=IF([.C23]=1;"";[.C23]) -> 0.0369027 | H23: of:=IF([.D23]=1;"";[.D23]) -> 0.172194 | I23: of:=IF([.E23]=1;"";[.E23]) -> 0.0149501
A24: 23 | B24: strcat: &"tbsc"{\0,\x01,\x01,\x01,\x01,\x01} &"adf"{\0,\0} :=> &"tbscadf"{\0,p,\0} | C24: 0.0430528 | D24: 0.0796171 | E24: 0.0153588 | G24: of:=IF([.C24]=1;"";[.C24]) -> 0.0430528 | H24: of:=IF([.D24]=1;"";[.D24]) -> 0.0796171 | I24: of:=IF([.E24]=1;"";[.E24]) -> 0.0153588
A25: 24 | B25: strcat: &"qtxl"{\0,\x01,\x01,\x01,\x01,\x01} &"clcd"{\0} :=> &"qtxlclcd"{\0,\0} | C25: 0.0238986 | D25: 0.0391494 | E25: 0.00799406 | G25: of:=IF([.C25]=1;"";[.C25]) -> 0.0238986 | H25: of:=IF([.D25]=1;"";[.D25]) -> 0.0391494 | I25: of:=IF([.E25]=1;"";[.E25]) -> 0.00799406
A26: 25 | B26: strcat: &"uphqa"{\0,\x01,\x01,\x01,\x01} &""{\0,p,k,k,\0} :=> &"uphqa"{\0,p,p,v,\0} | C26: 0.0219717 | D26: 1 | E26: 0.0219717 | G26: of:=IF([.C26]=1;"";[.C26]) -> 0.0219717 | H26: of:=IF([.D26]=1;"";[.D26]) ->  | I26: of:=IF([.E26]=1;"";[.E26]) -> 0.0219717
A27: 26 | B27: strcat: &"ydimf"{\0,\x01,\x01,\x01,\x01} &"s"{\0,p,i,\0} :=> &"ydimfs"{\0,p,e,\0} | C27: 0.0270745 | D27: 1 | E27: 0.0189145 | G27: of:=IF([.C27]=1;"";[.C27]) -> 0.0270745 | H27: of:=IF([.D27]=1;"";[.D27]) ->  | I27: of:=IF([.E27]=1;"";[.E27]) -> 0.0189145
A28: 27 | B28: strcat: &"uecxk"{\0,\x01,\x01,\x01,\x01} &"ty"{\0,p,\0} :=> &"uecxkty"{\0,p,\0} | C28: 0 | D28: 0.215706 | E28: 0 | G28: of:=IF([.C28]=1;"";[.C28]) -> 0 | H28: of:=IF([.D28]=1;"";[.D28]) -> 0.215706 | I28: of:=IF([.E28]=1;"";[.E28]) -> 0
A29: 28 | B29: strcat: &"zqfon"{\0,\x01,\x01,\x01,\x01} &"neg"{\0,\0} :=> &"zqfonneg"{\0,\0} | C29: 0.017274 | D29: 0.0870206 | E29: 0.00927266 | G29: of:=IF([.C29]=1;"";[.C29]) -> 0.017274 | H29: of:=IF([.D29]=1;"";[.D29]) -> 0.0870206 | I29: of:=IF([.E29]=1;"";[.E29]) -> 0.00927266
A30: 29 | B30: strcat: &"vxzia"{\0,\x01,\x01,\x01,\x01} &"zosw"{\0} :=> &"vxziazosw"{\0} | C30: 0 | D30: 0.0425161 | E30: 0 | G30: of:=IF([.C30]=1;"";[.C30]) -> 0 | H30: of:=IF([.D30]=1;"";[.D30]) -> 0.0425161 | I30: of:=IF([.E30]=1;"";[.E30]) -> 0
A31: 30 | B31: strcat: &"ogzcgx"{\0,\x01,\x01,\x01} &""{\0,p,r,k,\0} :=> &"ogzcgx"{\0,p,n,\0} | C31: 0.00913091 | D31: 1 | E31: 0.00913091 | G31: of:=IF([.C31]=1;"";[.C31]) -> 0.00913091 | H31: of:=IF([.D31]=1;"";[.D31]) ->  | I31: of:=IF([.E31]=1;"";[.E31]) -> 0.00913091
A32: 31 | B32: strcat: &"rjftqw"{\0,\x01,\x01,\x01} &"k"{\0,p,m,\0} :=> &"rjftqwk"{\0,p,\0} | C32: 0.00891449 | D32: 1 | E32: 0.00721651 | G32: of:=IF([.C32]=1;"";[.C32]) -> 0.00891449 | H32: of:=IF([.D32]=1;"";[.D32]) ->  | I32: of:=IF([.E32]=1;"";[.E32]) -> 0.00721651
A33: 32 | B33: strcat: &"puhzef"{\0,\x01,\x01,\x01} &"qt"{\0,p,\0} :=> &"puhzefqt"{\0,\0} | C33: 0.0162414 | D33: 0.138419 | E33: 0 | G33: of:=IF([.C33]=1;"";[.C33]) -> 0.0162414 | H33: of:=IF([.D33]=1;"";[.D33]) -> 0.138419 | I33: of:=IF([.E33]=1;"";[.E33]) -> 0
A34: 33 | B34: strcat: &"malyat"{\0,\x01,\x01,\x01} &"nkw"{\0,\0} :=> &"malyatnkw"{\0} | C34: 0.0221052 | D34: 0.0765204 | E34: 0.0108766 | G34: of:=IF([.C34]=1;"";[.C34]) -> 0.0221052 | H34: of:=IF([.D34]=1;"";[.D34]) -> 0.0765204 | I34: of:=IF([.E34]=1;"";[.E34]) -> 0.0108766
A35: 34 | B35: strcat: &"hzrdpi"{\0,\x01,\x01,\x01} &&10 :=> &"hzrdpipkhp"{} | C35: 0.0148019 | D35: 0.00674863 | G35: of:=IF([.C35]=1;"";[.C35]) -> 0.0148019 | H35: of:=IF([.D35]=1;"";[.D35]) -> 0.00674863 | I35: of:=IF([.E35]=1;"";[.E35]) ->  
A36: 35 | B36: strcat: &"ztmzmil"{\0,\x01,\x01} &""{\0,p,f,s,\0} :=> &"ztmzmil"{\0,p,\0} | C36: 0.0120876 | D36: 1 | E36: 0.0120876 | G36: of:=IF([.C36]=1;"";[.C36]) -> 0.0120876 | H36: of:=IF([.D36]=1;"";[.D36]) ->  | I36: of:=IF([.E36]=1;"";[.E36]) -> 0.0120876
A37: 36 | B37: strcat: &"twkqdgd"{\0,\x01,\x01} &"f"{\0,p,v,\0} :=> &"twkqdgdf"{\0,\0} | C37: 0 | D37: 1 | E37: 0 | G37: of:=IF([.C37]=1;"";[.C37]) -> 0 | H37: of:=IF([.D37]=1;"";[.D37]) ->  | I37: of:=IF([.E37]=1;"";[.E37]) -> 0
A38: 37 | B38: strcat: &"korrrrr"{\0,\x01,\x01} &"ow"{\0,p,\0} :=> &"korrrrrow"{\0} | C38: 0.0161209 | D38: 0.218014 | E38: 0.0113439 | G38: of:=IF([.C38]=1;"";[.C38]) -> 0.0161209 | H38: of:=IF([.D38]=1;"";[.D38]) -> 0.218014 | I38: of:=IF([.E38]=1;"";[.E38]) -> 0.0113439
A39: 38 | B39: strcat: &"apczhvhi"{\0,\x01} &""{\0,p,u,i,\0} :=> &"apczhvhi"{\0,\0} | C39: 0.0084381 | D39: 1 | E39: 0.0084381 | G39: of:=IF([.C39]=1;"";[.C39]) -> 0.0084381 | H39: of:=IF([.D39]=1;"";[.D39]) ->  | I39: of:=IF([.E39]=1;"";[.E39]) -> 0.0084381
A40: 39 | B40: strcat: &"zlnjjmhk"{\0,\x01} &"l"{\0,p,i,\0} :=> &"zlnjjmhkl"{\0} | C40: 0.00805287 | D40: 1 | E40: 0.00700427 | G40: of:=IF([.C40]=1;"";[.C40]) -> 0.00805287 | H40: of:=IF([.D40]=1;"";[.D40]) ->  | I40: of:=IF([.E40]=1;"";[.E40]) -> 0.00700427
A41: 40 | B41: strcat: &"cpufgargp"{\0} &""{\0,p,v,p,\0} :=> &"cpufgargp"{\0} | C41: 0.00900314 | D41: 1 | E41: 0.00900314 | G41: of:=IF([.C41]=1;"";[.C41]) -> 0.00900314 | H41: of:=IF([.D41]=1;"";[.D41]) ->  | I41: of:=IF([.E41]=1;"";[.E41]) -> 0.00900314
A42: 1 | B42: strncat: &""{\0,\x01,\x01,\x01,\x01,\x01,\x01,\x01,\x01,\x01} &""{\0,p,f,k,\0} 4 :=> &""{\0,p,l,o,k,q,c,p,p,\0} | C42: 1 | D42: 1 | E42: 1 | G42: of:=IF([.C42]=1;"";[.C42]) ->  | H42: of:=IF([.D42]=1;"";[.D42]) ->  | I42: of:=IF([.E42]=1;"";[.E42]) ->  | K42: of:=AVERAGE([.G42:.G82]) -> 0.0540501516129032 | L42: of:=AVERAGE([.H42:.H82]) -> 0.0989950590909091 | M42: of:=AVERAGE([.I42:.I82]) -> 0.0345213451351351 | O42: of:=AVERAGE([.K42:.M42]) -> 0.0625221852796492
A43: 2 | B43: strncat: &""{\0,\x01,\x01,\x01,\x01,\x01,\x01,\x01,\x01,\x01} &"u"{\0,p,r,\0} 4 :=> &"u"{\0,p,w,v,x,z,x,i,\0} | C43: 1 | D43: 1 | E43: 1 | G43: of:=IF([.C43]=1;"";[.C43]) ->  | H43: of:=IF([.D43]=1;"";[.D43]) ->  | I43: of:=IF([.E43]=1;"";[.E43]) -> 
A44: 3 | B44: strncat: &""{\0,\x01,\x01,\x01,\x01,\x01,\x01,\x01,\x01,\x01} &"or"{\0,p,\0} 4 :=> &"or"{\0,p,y,u,f,r,c,\0} | C44: 1 | D44: 0.224112 | E44: 0.224112 | G44: of:=IF([.C44]=1;"";[.C44]) ->  | H44: of:=IF([.D44]=1;"";[.D44]) -> 0.224112 | I44: of:=IF([.E44]=1;"";[.E44]) -> 0.224112
A45: 4 | B45: strncat: &""{\0,\x01,\x01,\x01,\x01,\x01,\x01,\x01,\x01,\x01} &"bag"{\0,\0} 4 :=> &"bag"{\0,p,p,x,i,i,\0} | C45: 1 | D45: 0.0859358 | E45: 0.0859358 | G45: of:=IF([.C45]=1;"";[.C45]) ->  | H45: of:=IF([.D45]=1;"";[.D45]) -> 0.0859358 | I45: of:=IF([.E45]=1;"";[.E45]) -> 0.0859358
A46: 5 | B46: strncat: &""{\0,\x01,\x01,\x01,\x01,\x01,\x01,\x01,\x01,\x01} &"phxq"{\0} 4 :=> &"phxq"{\0,p,z,z,e,\0} | C46: 1 | D46: 0 | E46: 0 | G46: of:=IF([.C46]=1;"";[.C46]) ->  | H46: of:=IF([.D46]=1;"";[.D46]) -> 0 | I46: of:=IF([.E46]=1;"";[.E46]) -> 0
A47: 6 | B47: strncat: &"c"{\0,\x01,\x01,\x01,\x01,\x01,\x01,\x01,\x01} &""{\0,p,r,o,\0} 4 :=> &"c"{\0,p,g,b,t,s,z,k,\0} | C47: 1 | D47: 1 | E47: 1 | G47: of:=IF([.C47]=1;"";[.C47]) ->  | H47: of:=IF([.D47]=1;"";[.D47]) ->  | I47: of:=IF([.E47]=1;"";[.E47]) -> 
A48: 7 | B48: strncat: &"j"{\0,\x01,\x01,\x01,\x01,\x01,\x01,\x01,\x01} &"r"{\0,p,c,\0} 4 :=> &"jr"{\0,p,z,v,w,n,e,\0} | C48: 1 | D48: 1 | E48: 0.127187 | G48: of:=IF([.C48]=1;"";[.C48]) ->  | H48: of:=IF([.D48]=1;"";[.D48]) ->  | I48: of:=IF([.E48]=1;"";[.E48]) -> 0.127187
A49: 8 | B49: strncat: &"v"{\0,\x01,\x01,\x01,\x01,\x01,\x01,\x01,\x01} &"cu"{\0,p,\0} 4 :=> &"vcu"{\0,p,l,w,f,h,\0} | C49: 1 | D49: 0.214286 | E49: 0.0751789 | G49: of:=IF([.C49]=1;"";[.C49]) ->  | H49: of:=IF([.D49]=1;"";[.D49]) -> 0.214286 | I49: of:=IF([.E49]=1;"";[.E49]) -> 0.0751789
A50: 9 | B50: strncat: &"y"{\0,\x01,\x01,\x01,\x01,\x01,\x01,\x01,\x01} &"wss"{\0,\0} 4 :=> &"ywss"{\0,p,s,w,g,\0} | C50: 1 | D50: 0.0845616 | E50: 0.0432493 | G50: of:=IF([.C50]=1;"";[.C50]) ->  | H50: of:=IF([.D50]=1;"";[.D50]) -> 0.0845616 | I50: of:=IF([.E50]=1;"";[.E50]) -> 0.0432493
A51: 10 | B51: strncat: &"d"{\0,\x01,\x01,\x01,\x01,\x01,\x01,\x01,\x01} &"dlie"{\0} 4 :=> &"ddlie"{\0,p,c,e,\0} | C51: 1 | D51: 0.0464819 | E51: 0.0294421 | G51: of:=IF([.C51]=1;"";[.C51]) ->  | H51: of:=IF([.D51]=1;"";[.D51]) -> 0.0464819 | I51: of:=IF([.E51]=1;"";[.E51]) -> 0.0294421
A52: 11 | B52: strncat: &"dm"{\0,\x01,\x01,\x01,\x01,\x01,\x01,\x01} &""{\0,p,y,x,\0} 4 :=> &"dm"{\0,p,a,i,g,r,o,\0} | C52: 0.20532 | D52: 1 | E52: 0.20532 | G52: of:=IF([.C52]=1;"";[.C52]) -> 0.20532 | H52: of:=IF([.D52]=1;"";[.D52]) ->  | I52: of:=IF([.E52]=1;"";[.E52]) -> 0.20532
A53: 12 | B53: strncat: &"po"{\0,\x01,\x01,\x01,\x01,\x01,\x01,\x01} &"d"{\0,p,q,\0} 4 :=> &"pod"{\0,p,w,m,y,x,\0} | C53: 0.218014 | D53: 1 | E53: 0.0863681 | G53: of:=IF([.C53]=1;"";[.C53]) -> 0.218014 | H53: of:=IF([.D53]=1;"";[.D53]) ->  | I53: of:=IF([.E53]=1;"";[.E53]) -> 0.0863681
A54: 13 | B54: strncat: &"xm"{\0,\x01,\x01,\x01,\x01,\x01,\x01,\x01} &"eo"{\0,p,\0} 4 :=> &"xmeo"{\0,p,n,u,h,\0} | C54: 0.169553 | D54: 0.211356 | E54: 0.0397991 | G54: of:=IF([.C54]=1;"";[.C54]) -> 0.169553 | H54: of:=IF([.D54]=1;"";[.D54]) -> 0.211356 | I54: of:=IF([.E54]=1;"";[.E54]) -> 0.0397991
A55: 14 | B55: strncat: &"iu"{\0,\x01,\x01,\x01,\x01,\x01,\x01,\x01} &"fbi"{\0,\0} 4 :=> &"iufbi"{\0,p,n,k,\0} | C55: 0.20123 | D55: 0.069901 | E55: 0.024109 | G55: of:=IF([.C55]=1;"";[.C55]) -> 0.20123 | H55: of:=IF([.D55]=1;"";[.D55]) -> 0.069901 | I55: of:=IF([.E55]=1;"";[.E55]) -> 0.024109
A56: 15 | B56: strncat: &"tm"{\0,\x01,\x01,\x01,\x01,\x01,\x01,\x01} &"advf"{\0} 4 :=> &"tmadvf"{\0,p,x,\0} | C56: 0.207409 | D56: 0 | E56: 0 | G56: of:=IF([.C56]=1;"";[.C56]) -> 0.207409 | H56: of:=IF([.D56]=1;"";[.D56]) -> 0 | I56: of:=IF([.E56]=1;"";[.E56]) -> 0
A57: 16 | B57: strncat: &"bkb"{\0,\x01,\x01,\x01,\x01,\x01,\x01} &""{\0,p,h,d,\0} 4 :=> &"bkb"{\0,p,r,d,s,b,\0} | C57: 0.0611557 | D57: 1 | E57: 0.0611557 | G57: of:=IF([.C57]=1;"";[.C57]) -> 0.0611557 | H57: of:=IF([.D57]=1;"";[.D57]) ->  | I57: of:=IF([.E57]=1;"";[.E57]) -> 0.0611557
A58: 17 | B58: strncat: &"fte"{\0,\x01,\x01,\x01,\x01,\x01,\x01} &"n"{\0,p,p,\0} 4 :=> &"ften"{\0,p,n,y,i,\0} | C58: 0.0873688 | D58: 1 | E58: 0.048392 | G58: of:=IF([.C58]=1;"";[.C58]) -> 0.0873688 | H58: of:=IF([.D58]=1;"";[.D58]) ->  | I58: of:=IF([.E58]=1;"";[.E58]) -> 0.048392
A59: 18 | B59: strncat: &"qkn"{\0,\x01,\x01,\x01,\x01,\x01,\x01} &"ob"{\0,p,\0} 4 :=> &"qknob"{\0,p,s,l,\0} | C59: 0 | D59: 0.211356 | E59: 0 | G59: of:=IF([.C59]=1;"";[.C59]) -> 0 | H59: of:=IF([.D59]=1;"";[.D59]) -> 0.211356 | I59: of:=IF([.E59]=1;"";[.E59]) -> 0
A60: 19 | B60: strncat: &"ztc"{\0,\x01,\x01,\x01,\x01,\x01,\x01} &"nzk"{\0,\0} 4 :=> &"ztcnzk"{\0,p,s,\0} | C60: 0.0700171 | D60: 0.0679912 | E60: 0.0147623 | G60: of:=IF([.C60]=1;"";[.C60]) -> 0.0700171 | H60: of:=IF([.D60]=1;"";[.D60]) -> 0.0679912 | I60: of:=IF([.E60]=1;"";[.E60]) -> 0.0147623
A61: 20 | B61: strncat: &"asf"{\0,\x01,\x01,\x01,\x01,\x01,\x01} &"pruq"{\0} 4 :=> &"asfpruq"{\0,p,\0} | C61: 0.0831364 | D61: 0.0415299 | E61: 0.0132404 | G61: of:=IF([.C61]=1;"";[.C61]) -> 0.0831364 | H61: of:=IF([.D61]=1;"";[.D61]) -> 0.0415299 | I61: of:=IF([.E61]=1;"";[.E61]) -> 0.0132404
A62: 21 | B62: strncat: &"bxwq"{\0,\x01,\x01,\x01,\x01,\x01} &""{\0,p,a,g,\0} 4 :=> &"bxwq"{\0,p,j,i,o,\0} | C62: 0 | D62: 1 | E62: 0 | G62: of:=IF([.C62]=1;"";[.C62]) -> 0 | H62: of:=IF([.D62]=1;"";[.D62]) ->  | I62: of:=IF([.E62]=1;"";[.E62]) -> 0
A63: 22 | B63: strncat: &"ylcq"{\0,\x01,\x01,\x01,\x01,\x01} &"i"{\0,p,p,\0} 4 :=> &"ylcqi"{\0,p,k,a,\0} | C63: 0.0398747 | D63: 1 | E63: 0.0243149 | G63: of:=IF([.C63]=1;"";[.C63]) -> 0.0398747 | H63: of:=IF([.D63]=1;"";[.D63]) ->  | I63: of:=IF([.E63]=1;"";[.E63]) -> 0.0243149
A64: 23 | B64: strncat: &"zqit"{\0,\x01,\x01,\x01,\x01,\x01} &"we"{\0,p,\0} 4 :=> &"zqitwe"{\0,p,c,\0} | C64: 0.0349493 | D64: 0.2171 | E64: 0.0172942 | G64: of:=IF([.C64]=1;"";[.C64]) -> 0.0349493 | H64: of:=IF([.D64]=1;"";[.D64]) -> 0.2171 | I64: of:=IF([.E64]=1;"";[.E64]) -> 0.0172942
A65: 24 | B65: strncat: &"idtq"{\0,\x01,\x01,\x01,\x01,\x01} &"pni"{\0,\0} 4 :=> &"idtqpni"{\0,p,\0} | C65: 0.0324967 | D65: 0.0751789 | E65: 0 | G65: of:=IF([.C65]=1;"";[.C65]) -> 0.0324967 | H65: of:=IF([.D65]=1;"";[.D65]) -> 0.0751789 | I65: of:=IF([.E65]=1;"";[.E65]) -> 0
A66: 25 | B66: strncat: &"ezyp"{\0,\x01,\x01,\x01,\x01,\x01} &"xyvy"{\0} 4 :=> &"ezypxyvy"{\0,\0} | C66: 0.0389828 | D66: 0.0349772 | E66: 0 | G66: of:=IF([.C66]=1;"";[.C66]) -> 0.0389828 | H66: of:=IF([.D66]=1;"";[.D66]) -> 0.0349772 | I66: of:=IF([.E66]=1;"";[.E66]) -> 0
A67: 26 | B67: strncat: &"yzroe"{\0,\x01,\x01,\x01,\x01} &""{\0,p,b,w,\0} 4 :=> &"yzroe"{\0,p,t,f,\0} | C67: 0.0242416 | D67: 1 | E67: 0.0242416 | G67: of:=IF([.C67]=1;"";[.C67]) -> 0.0242416 | H67: of:=IF([.D67]=1;"";[.D67]) ->  | I67: of:=IF([.E67]=1;"";[.E67]) -> 0.0242416
A68: 27 | B68: strncat: &"drhjl"{\0,\x01,\x01,\x01,\x01} &"o"{\0,p,c,\0} 4 :=> &"drhjlo"{\0,p,c,\0} | C68: 0.0192983 | D68: 1 | E68: 0.0147595 | G68: of:=IF([.C68]=1;"";[.C68]) -> 0.0192983 | H68: of:=IF([.D68]=1;"";[.D68]) ->  | I68: of:=IF([.E68]=1;"";[.E68]) -> 0.0147595
A69: 28 | B69: strncat: &"bpymd"{\0,\x01,\x01,\x01,\x01} &"bb"{\0,p,\0} 4 :=> &"bpymdbb"{\0,p,\0} | C69: 0.022768 | D69: 0.202885 | E69: 0.0124934 | G69: of:=IF([.C69]=1;"";[.C69]) -> 0.022768 | H69: of:=IF([.D69]=1;"";[.D69]) -> 0.202885 | I69: of:=IF([.E69]=1;"";[.E69]) -> 0.0124934
A70: 29 | B70: strncat: &"kvvtj"{\0,\x01,\x01,\x01,\x01} &"usl"{\0,\0} 4 :=> &"kvvtjusl"{\0,\0} | C70: 0.0174829 | D70: 0.0853668 | E70: 0.00919141 | G70: of:=IF([.C70]=1;"";[.C70]) -> 0.0174829 | H70: of:=IF([.D70]=1;"";[.D70]) -> 0.0853668 | I70: of:=IF([.E70]=1;"";[.E70]) -> 0.00919141
A71: 30 | B71: strncat: &"icpwo"{\0,\x01,\x01,\x01,\x01} &"nfsx"{\0} 4 :=> &"icpwonfsx"{\0} | C71: 0.0236495 | D71: 0 | E71: 0 | G71: of:=IF([.C71]=1;"";[.C71]) -> 0.0236495 | H71: of:=IF([.D71]=1;"";[.D71]) -> 0 | I71: of:=IF([.E71]=1;"";[.E71]) -> 0
A72: 31 | B72: strncat: &"pjtraf"{\0,\x01,\x01,\x01} &""{\0,p,c,w,\0} 4 :=> &"pjtraf"{\0,p,m,\0} | C72: 0.016274 | D72: 1 | E72: 0.016274 | G72: of:=IF([.C72]=1;"";[.C72]) -> 0.016274 | H72: of:=IF([.D72]=1;"";[.D72]) ->  | I72: of:=IF([.E72]=1;"";[.E72]) -> 0.016274
A73: 32 | B73: strncat: &"rfderp"{\0,\x01,\x01,\x01} &"w"{\0,p,p,\0} 4 :=> &"rfderpw"{\0,p,\0} | C73: 0.0185947 | D73: 1 | E73: 0.0135832 | G73: of:=IF([.C73]=1;"";[.C73]) -> 0.0185947 | H73: of:=IF([.D73]=1;"";[.D73]) ->  | I73: of:=IF([.E73]=1;"";[.E73]) -> 0.0135832
A74: 33 | B74: strncat: &"geodmf"{\0,\x01,\x01,\x01} &"he"{\0,p,\0} 4 :=> &"geodmfhe"{\0,\0} | C74: 0.0199166 | D74: 0.226983 | E74: 0.011624 | G74: of:=IF([.C74]=1;"";[.C74]) -> 0.0199166 | H74: of:=IF([.D74]=1;"";[.D74]) -> 0.226983 | I74: of:=IF([.E74]=1;"";[.E74]) -> 0.011624
A75: 34 | B75: strncat: &"kjdyyv"{\0,\x01,\x01,\x01} &"nps"{\0,\0} 4 :=> &"kjdyyvnps"{\0} | C75: 0.0125761 | D75: 0.077889 | E75: 0.0069416 | G75: of:=IF([.C75]=1;"";[.C75]) -> 0.0125761 | H75: of:=IF([.D75]=1;"";[.D75]) -> 0.077889 | I75: of:=IF([.E75]=1;"";[.E75]) -> 0.0069416
A76: 35 | B76: strncat: &"aykxuu"{\0,\x01,\x01,\x01} &&10 4 :=> &"aykxuuclni"{} | C76: 0 | D76: 0 | G76: of:=IF([.C76]=1;"";[.C76]) -> 0 | H76: of:=IF([.D76]=1;"";[.D76]) -> 0 | I76: of:=IF([.E76]=1;"";[.E76]) ->  
A77: 36 | B77: strncat: &"zkhncsa"{\0,\x01,\x01} &""{\0,p,m,q,\0} 4 :=> &"zkhncsa"{\0,p,\0} | C77: 0.0142709 | D77: 1 | E77: 0.0142709 | G77: of:=IF([.C77]=1;"";[.C77]) -> 0.0142709 | H77: of:=IF([.D77]=1;"";[.D77]) ->  | I77: of:=IF([.E77]=1;"";[.E77]) -> 0.0142709
A78: 37 | B78: strncat: &"fwrjcvy"{\0,\x01,\x01} &"a"{\0,p,k,\0} 4 :=> &"fwrjcvya"{\0,\0} | C78: 0.0095004 | D78: 1 | E78: 0.00801 | G78: of:=IF([.C78]=1;"";[.C78]) -> 0.0095004 | H78: of:=IF([.D78]=1;"";[.D78]) ->  | I78: of:=IF([.E78]=1;"";[.E78]) -> 0.00801
A79: 38 | B79: strncat: &"koqjlhz"{\0,\x01,\x01} &"vp"{\0,p,\0} 4 :=> &"koqjlhzvp"{\0} | C79: 0 | D79: 0 | E79: 0 | G79: of:=IF([.C79]=1;"";[.C79]) -> 0 | H79: of:=IF([.D79]=1;"";[.D79]) -> 0 | I79: of:=IF([.E79]=1;"";[.E79]) -> 0
A80: 39 | B80: strncat: &"xrjmzmvi"{\0,\x01} &""{\0,p,i,r,\0} 4 :=> &"xrjmzmvi"{\0,\0} | C80: 0.00687377 | D80: 1 | E80: 0.00687377 | G80: of:=IF([.C80]=1;"";[.C80]) -> 0.00687377 | H80: of:=IF([.D80]=1;"";[.D80]) ->  | I80: of:=IF([.E80]=1;"";[.E80]) -> 0.00687377
A81: 40 | B81: strncat: &"etfgsgbo"{\0,\x01} &"s"{\0,p,k,\0} 4 :=> &"etfgsgbos"{\0} | C81: 0.0107804 | D81: 1 | E81: 0.00934556 | G81: of:=IF([.C81]=1;"";[.C81]) -> 0.0107804 | H81: of:=IF([.D81]=1;"";[.D81]) ->  | I81: of:=IF([.E81]=1;"";[.E81]) -> 0.00934556
A82: 41 | B82: strncat: &"rbskhulpw"{\0} &""{\0,p,u,p,\0} 4 :=> &"rbskhulpw"{\0} | C82: 0.00982003 | D82: 1 | E82: 0.00982003 | G82: of:=IF([.C82]=1;"";[.C82]) -> 0.00982003 | H82: of:=IF([.D82]=1;"";[.D82]) ->  | I82: of:=IF([.E82]=1;"";[.E82]) -> 0.00982003

Sheet: strstr
A1: # | B1: Test Case | C1: N | G1: N1 | H1: N2 | I1: N3
A2: 1 | B2: strstr: &"g"{\0,h,p,a,\0} &"g"{\0,\0} :=> &"g"{\0,h,p,a,\0} | C2: 1 | D2: 1 | E2: 1 | G2: of:=IF([.C2]=1;"";[.C2]) ->  | H2: of:=IF([.D2]=1;"";[.D2]) ->  | I2: of:=IF([.E2]=1;"";[.E2]) ->  | K2: of:=AVERAGE([.G2:.G19]) -> 0.0695027588235294 | L2: of:=AVERAGE([.H2:.H19]) -> 0.202495 | M2: of:=AVERAGE([.I2:.I19]) -> 0.090146125 | O2: of:=AVERAGE([.K2:.M2]) -> 0.120714627941176
A3: 2 | B3: strstr: &"fw"{\0,h,k,\0} &"f"{\0,\0} :=> &"fw"{\0,h,k,\0} | C3: 0.174365 | D3: 1 | E3: 0.174365 | G3: of:=IF([.C3]=1;"";[.C3]) -> 0.174365 | H3: of:=IF([.D3]=1;"";[.D3]) ->  | I3: of:=IF([.E3]=1;"";[.E3]) -> 0.174365
A4: 3 | B4: strstr: &"fs"{\0,b,c,\0} &"s"{\0,\0} :=> &"s"{\0,b,c,\0,54} | C4: 0.197975 | D4: 1 | E4: 1 | G4: of:=IF([.C4]=1;"";[.C4]) -> 0.197975 | H4: of:=IF([.D4]=1;"";[.D4]) ->  | I4: of:=IF([.E4]=1;"";[.E4]) -> 
A5: 4 | B5: strstr: &"cts"{\0,h,\0} &"c"{\0,\0} :=> &"cts"{\0,h,\0} | C5: 0.0878477 | D5: 1 | E5: 0.0878477 | G5: of:=IF([.C5]=1;"";[.C5]) -> 0.0878477 | H5: of:=IF([.D5]=1;"";[.D5]) ->  | I5: of:=IF([.E5]=1;"";[.E5]) -> 0.0878477
A6: 5 | B6: strstr: &"ykk"{\0,b,\0} &"k"{\0,\0} :=> &"kk"{\0,b,\0,54} | C6: 0.0670591 | D6: 1 | E6: 0.186454 | G6: of:=IF([.C6]=1;"";[.C6]) -> 0.0670591 | H6: of:=IF([.D6]=1;"";[.D6]) ->  | I6: of:=IF([.E6]=1;"";[.E6]) -> 0.186454
A7: 6 | B7: strstr: &"bphp"{\0,\0} &"b"{\0,\0} :=> &"bphp"{\0,\0} | C7: 0.0359341 | D7: 1 | E7: 0.0359341 | G7: of:=IF([.C7]=1;"";[.C7]) -> 0.0359341 | H7: of:=IF([.D7]=1;"";[.D7]) ->  | I7: of:=IF([.E7]=1;"";[.E7]) -> 0.0359341
A8: 7 | B8: strstr: &"ejsz"{\0,\0} &"j"{\0,\0} :=> &"jsz"{\0,\0,54} | C8: 0.0297581 | D8: 1 | E8: 0.0546313 | G8: of:=IF([.C8]=1;"";[.C8]) -> 0.0297581 | H8: of:=IF([.D8]=1;"";[.D8]) ->  | I8: of:=IF([.E8]=1;"";[.E8]) -> 0.0546313
A9: 8 | B9: strstr: &"mcxfk"{\0} &"m"{\0,\0} :=> &"mcxfk"{\0} | C9: 0.0147629 | D9: 1 | E9: 0.0147629 | G9: of:=IF([.C9]=1;"";[.C9]) -> 0.0147629 | H9: of:=IF([.D9]=1;"";[.D9]) ->  | I9: of:=IF([.E9]=1;"";[.E9]) -> 0.0147629
A10: 9 | B10: strstr: &"kcnfd"{\0} &"c"{\0,\0} :=> &"cnfd"{\0,54} | C10: 0.0193063 | D10: 1 | E10: 0.032448 | G10: of:=IF([.C10]=1;"";[.C10]) -> 0.0193063 | H10: of:=IF([.D10]=1;"";[.D10]) ->  | I10: of:=IF([.E10]=1;"";[.E10]) -> 0.032448
A11: 10 | B11: strstr: &"uv"{\0,d,q,\0} &"uv"{\0} :=> &"uv"{\0,d,q,\0} | C11: 0.192605 | D11: 0.192605 | E11: 0.192605 | G11: of:=IF([.C11]=1;"";[.C11]) -> 0.192605 | H11: of:=IF([.D11]=1;"";[.D11]) -> 0.192605 | I11: of:=IF([.E11]=1;"";[.E11]) -> 0.192605
A12: 11 | B12: strstr: &"top"{\0,d,\0} &"to"{\0} :=> &"top"{\0,d,\0} | C12: 0.0886448 | D12: 0.223271 | E12: 0.0886448 | G12: of:=IF([.C12]=1;"";[.C12]) -> 0.0886448 | H12: of:=IF([.D12]=1;"";[.D12]) -> 0.223271 | I12: of:=IF([.E12]=1;"";[.E12]) -> 0.0886448
A13: 12 | B13: strstr: &"xxs"{\0,a,\0} &"xs"{\0} :=> &"xs"{\0,a,\0,54} | C13: 0.0605806 | D13: 0.171077 | E13: 0.171077 | G13: of:=IF([.C13]=1;"";[.C13]) -> 0.0605806 | H13: of:=IF([.D13]=1;"";[.D13]) -> 0.171077 | I13: of:=IF([.E13]=1;"";[.E13]) -> 0.171077
A14: 13 | B14: strstr: &"bhy"{\0,p,\0} &"hy"{\0} :=> &"hy"{\0,p,\0,54} | C14: 0.0709833 | D14: 0.205862 | E14: 0.205862 | G14: of:=IF([.C14]=1;"";[.C14]) -> 0.0709833 | H14: of:=IF([.D14]=1;"";[.D14]) -> 0.205862 | I14: of:=IF([.E14]=1;"";[.E14]) -> 0.205862
A15: 14 | B15: strstr: &"coee"{\0,\0} &"co"{\0} :=> &"coee"{\0,\0} | C15: 0.0465933 | D15: 0.22156 | E15: 0.0465933 | G15: of:=IF([.C15]=1;"";[.C15]) -> 0.0465933 | H15: of:=IF([.D15]=1;"";[.D15]) -> 0.22156 | I15: of:=IF([.E15]=1;"";[.E15]) -> 0.0465933
A16: 15 | B16: strstr: &"xxqh"{\0,\0} &"xq"{\0} :=> &"xqh"{\0,\0,54} | C16: 0 | D16: 0.173018 | E16: 0 | G16: of:=IF([.C16]=1;"";[.C16]) -> 0 | H16: of:=IF([.D16]=1;"";[.D16]) -> 0.173018 | I16: of:=IF([.E16]=1;"";[.E16]) -> 0
A17: 16 | B17: strstr: &"aeos"{\0,\0} &"eo"{\0} :=> &"eos"{\0,\0,54} | C17: 0.0445187 | D17: 0.211356 | E17: 0.0851279 | G17: of:=IF([.C17]=1;"";[.C17]) -> 0.0445187 | H17: of:=IF([.D17]=1;"";[.D17]) -> 0.211356 | I17: of:=IF([.E17]=1;"";[.E17]) -> 0.0851279
A18: 17 | B18: strstr: &"wnwuq"{\0} &"wn"{\0} :=> &"wnwuq"{\0} | C18: 0.0225855 | D18: 0.211853 | E18: 0.0225855 | G18: of:=IF([.C18]=1;"";[.C18]) -> 0.0225855 | H18: of:=IF([.D18]=1;"";[.D18]) -> 0.211853 | I18: of:=IF([.E18]=1;"";[.E18]) -> 0.0225855
A19: 18 | B19: strstr: &"mmbrh"{\0} &"mb"{\0} :=> &"mbrh"{\0,54} | C19: 0.0280275 | D19: 0.211853 | E19: 0.0433995 | G19: of:=IF([.C19]=1;"";[.C19]) -> 0.0280275 | H19: of:=IF([.D19]=1;"";[.D19]) -> 0.211853 | I19: of:=IF([.E19]=1;"";[.E19]) -> 0.0433995
A20: 19 | B20: strstr: &"xvpqk"{\0} &"vp"{\0} :=> &"vpqk"{\0,54} | C20: 0 | D20: 0 | E20: 0 | G20: of:=IF([.C20]=1;"";[.C20]) -> 0 | H20: of:=IF([.D20]=1;"";[.D20]) -> 0 | I20: of:=IF([.E20]=1;"";[.E20]) -> 0 | K20: of:=AVERAGE([.G20:.G24]) -> 0.01600574 | L20: of:=AVERAGE([.H20:.H24]) -> 0.0902965 | M20: of:=AVERAGE([.I20:.I24]) -> 0.01867806 | O20: of:=AVERAGE([.K20:.M20]) -> 0.0416601
A21: 1 | B21: strnstr: &"yuthw"{\0} &""{\0,p,\0} 2 :=> &"yuthw"{\0} | C21: 0.0274443 | D21: 1 | E21: 0.0274443 | G21: of:=IF([.C21]=1;"";[.C21]) -> 0.0274443 | H21: of:=IF([.D21]=1;"";[.D21]) ->  | I21: of:=IF([.E21]=1;"";[.E21]) -> 0.0274443
A22: 2 | B22: strnstr: &"luruv"{\0} &"l"{\0,\0} 2 :=> &"luruv"{\0} | C22: 0.0280143 | D22: 1 | E22: 0.0280143 | G22: of:=IF([.C22]=1;"";[.C22]) -> 0.0280143 | H22: of:=IF([.D22]=1;"";[.D22]) ->  | I22: of:=IF([.E22]=1;"";[.E22]) -> 0.0280143
A23: 3 | B23: strnstr: &"axpdf"{\0} &"x"{\0,\0} 2 :=> &"xpdf"{\0,54} | C23: 0.0245701 | D23: 1 | E23: 0.0379317 | G23: of:=IF([.C23]=1;"";[.C23]) -> 0.0245701 | H23: of:=IF([.D23]=1;"";[.D23]) ->  | I23: of:=IF([.E23]=1;"";[.E23]) -> 0.0379317
A24: 4 | B24: strnstr: &"mdwxl"{\0} &"md"{\0} 2 :=> &"mdwxl"{\0} | C24: 0 | D24: 0.180593 | E24: 0 | G24: of:=IF([.C24]=1;"";[.C24]) -> 0 | H24: of:=IF([.D24]=1;"";[.D24]) -> 0.180593 | I24: of:=IF([.E24]=1;"";[.E24]) -> 0
A25: 1 | B25: strpbrk: &"butgj"{\0} &"aeiou"{\0} :=> &"utgj"{\0,54} | C25: 0.0236945 | D25: 0.0299288 | E25: 0.0354092 | G25: of:=IF([.C25]=1;"";[.C25]) -> 0.0236945 | H25: of:=IF([.D25]=1;"";[.D25]) -> 0.0299288 | I25: of:=IF([.E25]=1;"";[.E25]) -> 0.0354092 | K25: of:=AVERAGE([.G25:.G34]) -> 0.02442496 | L25: of:=AVERAGE([.H25:.H34]) -> 0.0299288 | M25: of:=AVERAGE([.I25:.I34]) -> 0.03122298 | O25: of:=AVERAGE([.K25:.M25]) -> 0.02852558
A26: 2 | B26: strpbrk: &"fordz"{\0} &"aeiou"{\0} :=> &"ordz"{\0,54} | C26: 0.0276395 | D26: 0.0299288 | E26: 0.0417276 | G26: of:=IF([.C26]=1;"";[.C26]) -> 0.0276395 | H26: of:=IF([.D26]=1;"";[.D26]) -> 0.0299288 | I26: of:=IF([.E26]=1;"";[.E26]) -> 0.0417276
A27: 3 | B27: strpbrk: &"tilcf"{\0} &"aeiou"{\0} :=> &"ilcf"{\0,54} | C27: 0.0244662 | D27: 0.0299288 | E27: 0.0358184 | G27: of:=IF([.C27]=1;"";[.C27]) -> 0.0244662 | H27: of:=IF([.D27]=1;"";[.D27]) -> 0.0299288 | I27: of:=IF([.E27]=1;"";[.E27]) -> 0.0358184
A28: 4 | B28: strpbrk: &"redss"{\0} &"aeiou"{\0} :=> &"edss"{\0,54} | C28: 0.0314913 | D28: 0.0299288 | E28: 0.0477871 | G28: of:=IF([.C28]=1;"";[.C28]) -> 0.0314913 | H28: of:=IF([.D28]=1;"";[.D28]) -> 0.0299288 | I28: of:=IF([.E28]=1;"";[.E28]) -> 0.0477871
A29: 5 | B29: strpbrk: &"nauva"{\0} &"aeiou"{\0} :=> &"auva"{\0,54} | C29: 0.027915 | D29: 0.0299288 | E29: 0.0424444 | G29: of:=IF([.C29]=1;"";[.C29]) -> 0.027915 | H29: of:=IF([.D29]=1;"";[.D29]) -> 0.0299288 | I29: of:=IF([.E29]=1;"";[.E29]) -> 0.0424444
A30: 6 | B30: strpbrk: &"uuezx"{\0} &"aeiou"{\0} :=> &"uuezx"{\0} | C30: 0 | D30: 0.0299288 | E30: 0 | G30: of:=IF([.C30]=1;"";[.C30]) -> 0 | H30: of:=IF([.D30]=1;"";[.D30]) -> 0.0299288 | I30: of:=IF([.E30]=1;"";[.E30]) -> 0
A31: 7 | B31: strpbrk: &"oyzef"{\0} &"aeiou"{\0} :=> &"oyzef"{\0} | C31: 0.0265015 | D31: 0.0299288 | E31: 0.0265015 | G31: of:=IF([.C31]=1;"";[.C31]) -> 0.0265015 | H31: of:=IF([.D31]=1;"";[.D31]) -> 0.0299288 | I31: of:=IF([.E31]=1;"";[.E31]) -> 0.0265015
A32: 8 | B32: strpbrk: &"itnnu"{\0} &"aeiou"{\0} :=> &"itnnu"{\0} | C32: 0.0289822 | D32: 0.0299288 | E32: 0.0289822 | G32: of:=IF([.C32]=1;"";[.C32]) -> 0.0289822 | H32: of:=IF([.D32]=1;"";[.D32]) -> 0.0299288 | I32: of:=IF([.E32]=1;"";[.E32]) -> 0.0289822
A33: 9 | B33: strpbrk: &"eugsi"{\0} &"aeiou"{\0} :=> &"eugsi"{\0} | C33: 0.0288335 | D33: 0.0299288 | E33: 0.0288335 | G33: of:=IF([.C33]=1;"";[.C33]) -> 0.0288335 | H33: of:=IF([.D33]=1;"";[.D33]) -> 0.0299288 | I33: of:=IF([.E33]=1;"";[.E33]) -> 0.0288335
A34: 10 | B34: strpbrk: &"appji"{\0} &"aeiou"{\0} :=> &"appji"{\0} | C34: 0.0247259 | D34: 0.0299288 | E34: 0.0247259 | G34: of:=IF([.C34]=1;"";[.C34]) -> 0.0247259 | H34: of:=IF([.D34]=1;"";[.D34]) -> 0.0299288 | I34: of:=IF([.E34]=1;"";[.E34]) -> 0.0247259