Sheet: strlen
A1: strlen: &"\x01"{\0,\0,\0,\0,\0} :=> 1; | J1: # | K1: Test Case | L1: N | P1: FINAL
A2: strlen: &"\x01\x01"{\0,\0,\0,\0} :=> 2; | J2: 1 | K2: strlen: &"h"{\0,p,b,t,\0} :=> 1 | L2: 1 | N2: of:=IF([.L2]=1;"";[.L2]) ->  | P2: of:=AVERAGE([.N2:.N6]) -> 0.085075025
A3: strlen: &"\x01\x01\x01"{\0,\0,\0} :=> 3; | J3: 2 | K3: strlen: &"xp"{\0,p,c,\0} :=> 2 | L3: 0.209845 | N3: of:=IF([.L3]=1;"";[.L3]) -> 0.209845
A4: strlen: &"\x01\x01\x01\x01"{\0,\0} :=> 4; | J4: 3 | K4: strlen: &"swh"{\0,p,\0} :=> 3 | L4: 0.0827984 | N4: of:=IF([.L4]=1;"";[.L4]) -> 0.0827984
A5: strlen: &"\x01\x01\x01\x01\x01"{\0} :=> 5; | J5: 4 | K5: strlen: &"mpai"{\0,\0} :=> 4 | L5: 0.0476567 | N5: of:=IF([.L5]=1;"";[.L5]) -> 0.0476567
A6: strnlen: &""{\0,\0,\0,\0,\0,\0} 6 :=> 0; 1; | J6: 5 | K6: strlen: &"nccvx"{\0} :=> 5 | L6: 0 | N6: of:=IF([.L6]=1;"";[.L6]) -> 0
A7: strnlen: &"\x01"{\0,\0,\0,\0,\0} 6 :=> 1; | J7: 1 | K7: strnlen: &""{\0,p,b,m,x,\0} 6 :=> 0 | L7: 1 | N7: of:=IF([.L7]=1;"";[.L7]) ->  | P7: of:=AVERAGE([.N7:.N12]) -> 0.0921408
A8: strnlen: &"\x01\x01"{\0,\0,\0,\0} 6 :=> 2; | J8: 2 | K8: strnlen: &"b"{\0,p,b,y,\0} 6 :=> 1 | L8: 1 | N8: of:=IF([.L8]=1;"";[.L8]) -> 
A9: strnlen: &"\x01\x01\x01"{\0,\0,\0} 6 :=> 3; | J9: 3 | K9: strnlen: &"hi"{\0,p,y,\0} 6 :=> 2 | L9: 0.220689 | N9: of:=IF([.L9]=1;"";[.L9]) -> 0.220689
A10: strnlen: &"\x01\x01\x01\x01"{\0,\0} 6 :=> 4; | J10: 4 | K10: strnlen: &"vif"{\0,p,\0} 6 :=> 3 | L10: 0.0860602 | N10: of:=IF([.L10]=1;"";[.L10]) -> 0.0860602
A11: strnlen: &"\x01\x01\x01\x01\x01"{\0} 6 :=> 5; | J11: 5 | K11: strnlen: &"rxsr"{\0,\0} 6 :=> 4 | L11: 0.0336353 | N11: of:=IF([.L11]=1;"";[.L11]) -> 0.0336353
J12: 6 | K12: strnlen: &"culgu"{\0} 6 :=> 5 | L12: 0.0281787 | N12: of:=IF([.L12]=1;"";[.L12]) -> 0.0281787

Sheet: strcmp
A1: # | B1: Test Case | C1: N1 | D1: N2 | L1: FINAL
A2: 1 | B2: strcmp: &"s"{\0,p,m,p,\0} &"s"{\0,p,e,x,\0} :=> 0 | C2: 1 | D2: 1 | F2: of:=IF([.C2]=1;"";[.C2]) ->  | G2: of:=IF([.D2]=1;"";[.D2]) ->  | H2: of:=IF([.E2]=1;"";[.E2]) ->   | I2: of:=AVERAGE([.F2:.F16]) -> 0.0398458571428571 | J2: of:=AVERAGE([.G2:.G16]) -> 0.0423825714285714 | L2: of:=AVERAGE([.I2:.J2]) -> 0.0411142142857143
A3: 2 | B3: strcmp: &"sc"{\0,p,t,\0} &"sc"{\0,p,g,\0} :=> 0 | C3: 0.213806 | D3: 0.213806 | F3: of:=IF([.C3]=1;"";[.C3]) -> 0.213806 | G3: of:=IF([.D3]=1;"";[.D3]) -> 0.213806 | H3: of:=IF([.E3]=1;"";[.E3]) ->  
A4: 3 | B4: strcmp: &"cly"{\0,p,\0} &"cly"{\0,p,\0} :=> 0 | C4: 0.0862031 | D4: 0.0862031 | F4: of:=IF([.C4]=1;"";[.C4]) -> 0.0862031 | G4: of:=IF([.D4]=1;"";[.D4]) -> 0.0862031 | H4: of:=IF([.E4]=1;"";[.E4]) ->  
A5: 4 | B5: strcmp: &"ksuq"{\0,\0} &"ksuq"{\0,\0} :=> 0 | C5: 0.0409228 | D5: 0.0409228 | F5: of:=IF([.C5]=1;"";[.C5]) -> 0.0409228 | G5: of:=IF([.D5]=1;"";[.D5]) -> 0.0409228 | H5: of:=IF([.E5]=1;"";[.E5]) ->  
A6: 5 | B6: strcmp: &"mygpp"{\0} &"mygpp"{\0} :=> 0 | C6: 0.0240045 | D6: 0.0240045 | F6: of:=IF([.C6]=1;"";[.C6]) -> 0.0240045 | G6: of:=IF([.D6]=1;"";[.D6]) -> 0.0240045 | H6: of:=IF([.E6]=1;"";[.E6]) ->  
A7: 6 | B7: strcmp: &"dpqzk"{\0} &"dpqzh"{\0} :=> 1 | C7: 0 | D7: 0 | F7: of:=IF([.C7]=1;"";[.C7]) -> 0 | G7: of:=IF([.D7]=1;"";[.D7]) -> 0 | H7: of:=IF([.E7]=1;"";[.E7]) ->  
A8: 7 | B8: strcmp: &"ociwg"{\0} &"ociwq"{\0} :=> -1 | C8: 0.0236165 | D8: 0.0215432 | F8: of:=IF([.C8]=1;"";[.C8]) -> 0.0236165 | G8: of:=IF([.D8]=1;"";[.D8]) -> 0.0215432 | H8: of:=IF([.E8]=1;"";[.E8]) ->  
A9: 8 | B9: strcmp: &"amauh"{\0} &"amaeu"{\0} :=> 1 | C9: 0.0278011 | D9: 0.0286117 | F9: of:=IF([.C9]=1;"";[.C9]) -> 0.0278011 | G9: of:=IF([.D9]=1;"";[.D9]) -> 0.0286117 | H9: of:=IF([.E9]=1;"";[.E9]) ->  
A10: 9 | B10: strcmp: &"ldvsr"{\0} &"ldvyh"{\0} :=> -1 | C10: 0.0258927 | D10: 0.0255627 | F10: of:=IF([.C10]=1;"";[.C10]) -> 0.0258927 | G10: of:=IF([.D10]=1;"";[.D10]) -> 0.0255627 | H10: of:=IF([.E10]=1;"";[.E10]) ->  
A11: 10 | B11: strcmp: &"prdzd"{\0} &"prbaj"{\0} :=> 1 | C11: 0.0237638 | D11: 0.0284782 | F11: of:=IF([.C11]=1;"";[.C11]) -> 0.0237638 | G11: of:=IF([.D11]=1;"";[.D11]) -> 0.0284782 | H11: of:=IF([.E11]=1;"";[.E11]) ->  
A12: 11 | B12: strcmp: &"kybtf"{\0} &"kyeav"{\0} :=> -1 | C12: 0.0250467 | D12: 0.0292907 | F12: of:=IF([.C12]=1;"";[.C12]) -> 0.0250467 | G12: of:=IF([.D12]=1;"";[.D12]) -> 0.0292907
A13: 12 | B13: strcmp: &"iptmr"{\0} &"ijtey"{\0} :=> 1 | C13: 0.0259074 | D13: 0.023105 | F13: of:=IF([.C13]=1;"";[.C13]) -> 0.0259074 | G13: of:=IF([.D13]=1;"";[.D13]) -> 0.023105
A14: 13 | B14: strcmp: &"bhsgj"{\0} &"breqv"{\0} :=> -1 | C14: 0.0200091 | D14: 0.0227026 | F14: of:=IF([.C14]=1;"";[.C14]) -> 0.0200091 | G14: of:=IF([.D14]=1;"";[.D14]) -> 0.0227026
A15: 14 | B15: strcmp: &"sajpg"{\0} &"dhlxh"{\0} :=> 1 | C15: 0.0208683 | D15: 0.0216809 | F15: of:=IF([.C15]=1;"";[.C15]) -> 0.0208683 | G15: of:=IF([.D15]=1;"";[.D15]) -> 0.0216809
A16: 15 | B16: strcmp: &"upxhi"{\0} &"zhitn"{\0} :=> -1 | C16: 0 | D16: 0.0274446 | F16: of:=IF([.C16]=1;"";[.C16]) -> 0 | G16: of:=IF([.D16]=1;"";[.D16]) -> 0.0274446
A17: 1 | B17: strncmp: &""{\0,p,k,n,i,\0} &""{\0,p,q,j,w,\0} 5 :=> 0 | C17: 1 | D17: 1 | F17: of:=IF([.C17]=1;"";[.C17]) ->  | G17: of:=IF([.D17]=1;"";[.D17]) ->  | I17: of:=AVERAGE([.F17:.F32]) -> 0.0370852 | J17: of:=AVERAGE([.G17:.G32]) -> 0.0356652142857143 | L17: of:=AVERAGE([.I17:.J17]) -> 0.0363752071428571
A18: 2 | B18: strncmp: &"i"{\0,p,r,x,\0} &"i"{\0,p,b,e,\0} 5 :=> 0 | C18: 1 | D18: 1 | F18: of:=IF([.C18]=1;"";[.C18]) ->  | G18: of:=IF([.D18]=1;"";[.D18]) -> 
A19: 3 | B19: strncmp: &"ks"{\0,p,e,\0} &"ks"{\0,p,u,\0} 5 :=> 0 | C19: 0.210856 | D19: 0.210856 | F19: of:=IF([.C19]=1;"";[.C19]) -> 0.210856 | G19: of:=IF([.D19]=1;"";[.D19]) -> 0.210856
A20: 4 | B20: strncmp: &"iyb"{\0,p,\0} &"iyb"{\0,p,\0} 5 :=> 0 | C20: 0.0721043 | D20: 0.0721043 | F20: of:=IF([.C20]=1;"";[.C20]) -> 0.0721043 | G20: of:=IF([.D20]=1;"";[.D20]) -> 0.0721043
A21: 5 | B21: strncmp: &"vmcv"{\0,\0} &"vmcv"{\0,\0} 5 :=> 0 | C21: 0.0237997 | D21: 0.0237997 | F21: of:=IF([.C21]=1;"";[.C21]) -> 0.0237997 | G21: of:=IF([.D21]=1;"";[.D21]) -> 0.0237997
A22: 6 | B22: strncmp: &"qhshs"{\0} &"qhshs"{\0} 5 :=> 0 | C22: 0 | D22: 0 | F22: of:=IF([.C22]=1;"";[.C22]) -> 0 | G22: of:=IF([.D22]=1;"";[.D22]) -> 0
A23: 7 | B23: strncmp: &"rvvsu"{\0} &"rvvsq"{\0} 5 :=> 1 | C23: 0.0246937 | D23: 0.0234914 | F23: of:=IF([.C23]=1;"";[.C23]) -> 0.0246937 | G23: of:=IF([.D23]=1;"";[.D23]) -> 0.0234914
A24: 8 | B24: strncmp: &"meaxk"{\0} &"meaxv"{\0} 5 :=> -1 | C24: 0 | D24: 0.026495 | F24: of:=IF([.C24]=1;"";[.C24]) -> 0 | G24: of:=IF([.D24]=1;"";[.D24]) -> 0.026495
A25: 9 | B25: strncmp: &"ybzii"{\0} &"ybzeq"{\0} 5 :=> 1 | C25: 0.0209547 | D25: 0.022239 | F25: of:=IF([.C25]=1;"";[.C25]) -> 0.0209547 | G25: of:=IF([.D25]=1;"";[.D25]) -> 0.022239
A26: 10 | B26: strncmp: &"wyjsy"{\0} &"wyjuf"{\0} 5 :=> -1 | C26: 0.0184716 | D26: 0.0226274 | F26: of:=IF([.C26]=1;"";[.C26]) -> 0.0184716 | G26: of:=IF([.D26]=1;"";[.D26]) -> 0.0226274
A27: 11 | B27: strncmp: &"chwlz"{\0} &"chsid"{\0} 5 :=> 1 | C27: 0.0254987 | D27: 0.0301565 | F27: of:=IF([.C27]=1;"";[.C27]) -> 0.0254987 | G27: of:=IF([.D27]=1;"";[.D27]) -> 0.0301565
A28: 12 | B28: strncmp: &"omhan"{\0} &"omvep"{\0} 5 :=> -1 | C28: 0.0287249 | D28: 0.0269444 | F28: of:=IF([.C28]=1;"";[.C28]) -> 0.0287249 | G28: of:=IF([.D28]=1;"";[.D28]) -> 0.0269444
A29: 13 | B29: strncmp: &"cifub"{\0} &"cfzff"{\0} 5 :=> 1 | C29: 0.029291 | D29: 0.0160889 | F29: of:=IF([.C29]=1;"";[.C29]) -> 0.029291 | G29: of:=IF([.D29]=1;"";[.D29]) -> 0.0160889
A30: 14 | B30: strncmp: &"ojzix"{\0} &"orngx"{\0} 5 :=> -1 | C30: 0.0205978 | D30: 0.0245104 | F30: of:=IF([.C30]=1;"";[.C30]) -> 0.0205978 | G30: of:=IF([.D30]=1;"";[.D30]) -> 0.0245104
A31: 15 | B31: strncmp: &"wviba"{\0} &"fgcqz"{\0} 5 :=> 1 | C31: 0.0198935 | D31: 0 | F31: of:=IF([.C31]=1;"";[.C31]) -> 0.0198935 | G31: of:=IF([.D31]=1;"";[.D31]) -> 0
A32: 16 | B32: strncmp: &"vleja"{\0} &"xzdah"{\0} 5 :=> -1 | C32: 0.0243069 | D32: 0 | F32: of:=IF([.C32]=1;"";[.C32]) -> 0.0243069 | G32: of:=IF([.D32]=1;"";[.D32]) -> 0
A33: 1 | B33: sysfs_streq: &""{\0,p,i,y,x,\0} &"ukujl"{\0} :=> \0 | C33: 1 | D33: 0.0195375 | F33: of:=IF([.C33]=1;"";[.C33]) ->  | G33: of:=IF([.D33]=1;"";[.D33]) -> 0.0195375 | I33: of:=AVERAGE([.F33:.F71]) -> 0.0563630344827586 | J33: of:=AVERAGE([.G33:.G71]) -> 0.0321292214285714 | L33: of:=AVERAGE([.I33:.J33]) -> 0.044246127955665
A34: 2 | B34: sysfs_streq: &""{\0,p,h,c,s,\0} &"\n"{\0,b,h,e,\0} :=> \x01 | C34: 1 | F34: of:=IF([.C34]=1;"";[.C34]) ->  | G34: of:=IF([.D34]=1;"";[.D34]) ->  
A35: 3 | B35: sysfs_streq: &""{\0,p,y,h,l,\0} &"\nadji"{\0} :=> \0 | C35: 1 | F35: of:=IF([.C35]=1;"";[.C35]) ->  | G35: of:=IF([.D35]=1;"";[.D35]) ->  
A36: 4 | B36: sysfs_streq: &""{\0,p,e,d,m,\0} &""{\0,h,z,w,o,\0} :=> \x01 | C36: 1 | D36: 1 | F36: of:=IF([.C36]=1;"";[.C36]) ->  | G36: of:=IF([.D36]=1;"";[.D36]) -> 
A37: 5 | B37: sysfs_streq: &"gmxpx"{\0} &"joree"{\0} :=> \0 | C37: 0 | D37: 0.0310987 | F37: of:=IF([.C37]=1;"";[.C37]) -> 0 | G37: of:=IF([.D37]=1;"";[.D37]) -> 0.0310987
A38: 6 | B38: sysfs_streq: &"\n"{\0,p,z,p,\0} &""{\0,a,g,a,y,\0} :=> \x01 | C38: 1 | F38: of:=IF([.C38]=1;"";[.C38]) ->  | G38: of:=IF([.D38]=1;"";[.D38]) ->  
A39: 7 | B39: sysfs_streq: &"\n"{\0,a,e,m,\0} &"yaoln"{\0} :=> \0 | C39: 0.0261837 | F39: of:=IF([.C39]=1;"";[.C39]) -> 0.0261837 | G39: of:=IF([.D39]=1;"";[.D39]) ->  
A40: 8 | B40: sysfs_streq: &"\naamj"{\0} &"mkowf"{\0} :=> \0 | C40: 0.0229899 | F40: of:=IF([.C40]=1;"";[.C40]) -> 0.0229899 | G40: of:=IF([.D40]=1;"";[.D40]) ->  
A41: 9 | B41: sysfs_streq: &"i"{\0,p,u,j,\0} &"ilzds"{\0} :=> \0 | C41: 1 | D41: 0.0243706 | F41: of:=IF([.C41]=1;"";[.C41]) ->  | G41: of:=IF([.D41]=1;"";[.D41]) -> 0.0243706
A42: 10 | B42: sysfs_streq: &"y"{\0,p,e,a,\0} &"y\n"{\0,a,g,\0} :=> \x01 | C42: 1 | F42: of:=IF([.C42]=1;"";[.C42]) ->  | G42: of:=IF([.D42]=1;"";[.D42]) ->  
A43: 11 | B43: sysfs_streq: &"r"{\0,p,h,b,\0} &"r\nazv"{\0} :=> \0 | C43: 1 | F43: of:=IF([.C43]=1;"";[.C43]) ->  | G43: of:=IF([.D43]=1;"";[.D43]) ->  
A44: 12 | B44: sysfs_streq: &"i"{\0,p,c,q,\0} &"i"{\0,h,a,f,\0} :=> \x01 | C44: 1 | D44: 1 | F44: of:=IF([.C44]=1;"";[.C44]) ->  | G44: of:=IF([.D44]=1;"";[.D44]) -> 
A45: 13 | B45: sysfs_streq: &"etwwg"{\0} &"eezdb"{\0} :=> \0 | C45: 0.0209468 | D45: 0.0239187 | F45: of:=IF([.C45]=1;"";[.C45]) -> 0.0209468 | G45: of:=IF([.D45]=1;"";[.D45]) -> 0.0239187
A46: 14 | B46: sysfs_streq: &"j\n"{\0,b,x,\0} &"j"{\0,b,v,s,\0} :=> \x01 | C46: 1 | F46: of:=IF([.C46]=1;"";[.C46]) ->  | G46: of:=IF([.D46]=1;"";[.D46]) ->  
A47: 15 | B47: sysfs_streq: &"a\n"{\0,b,n,\0} &"awlix"{\0} :=> \0 | C47: 0.0280959 | F47: of:=IF([.C47]=1;"";[.C47]) -> 0.0280959 | G47: of:=IF([.D47]=1;"";[.D47]) ->  
A48: 16 | B48: sysfs_streq: &"t\naot"{\0} &"tcyth"{\0} :=> \0 | C48: 0.0285323 | F48: of:=IF([.C48]=1;"";[.C48]) -> 0.0285323 | G48: of:=IF([.D48]=1;"";[.D48]) ->  
A49: 17 | B49: sysfs_streq: &"td"{\0,p,o,\0} &"tdwiy"{\0} :=> \0 | C49: 0.192671 | D49: 0.0252244 | F49: of:=IF([.C49]=1;"";[.C49]) -> 0.192671 | G49: of:=IF([.D49]=1;"";[.D49]) -> 0.0252244
A50: 18 | B50: sysfs_streq: &"mr"{\0,p,u,\0} &"mr\n"{\0,a,\0} :=> \x01 | C50: 0.181858 | F50: of:=IF([.C50]=1;"";[.C50]) -> 0.181858 | G50: of:=IF([.D50]=1;"";[.D50]) ->  
A51: 19 | B51: sysfs_streq: &"me"{\0,p,o,\0} &"me\nac"{\0} :=> \0 | C51: 0.22156 | F51: of:=IF([.C51]=1;"";[.C51]) -> 0.22156 | G51: of:=IF([.D51]=1;"";[.D51]) ->  
A52: 20 | B52: sysfs_streq: &"eh"{\0,p,l,\0} &"eh"{\0,b,t,\0} :=> \x01 | C52: 0.204884 | D52: 0.204884 | F52: of:=IF([.C52]=1;"";[.C52]) -> 0.204884 | G52: of:=IF([.D52]=1;"";[.D52]) -> 0.204884
A53: 21 | B53: sysfs_streq: &"tiixh"{\0} &"tiyep"{\0} :=> \0 | C53: 0.0261891 | D53: 0.0282657 | F53: of:=IF([.C53]=1;"";[.C53]) -> 0.0261891 | G53: of:=IF([.D53]=1;"";[.D53]) -> 0.0282657
A54: 22 | B54: sysfs_streq: &"ad\n"{\0,b,\0} &"ad"{\0,b,n,\0} :=> \x01 | C54: 0.218466 | F54: of:=IF([.C54]=1;"";[.C54]) -> 0.218466 | G54: of:=IF([.D54]=1;"";[.D54]) ->  
A55: 23 | B55: sysfs_streq: &"cb\n"{\0,b,\0} &"cbqqm"{\0} :=> \0 | C55: 0 | F55: of:=IF([.C55]=1;"";[.C55]) -> 0 | G55: of:=IF([.D55]=1;"";[.D55]) ->  
A56: 24 | B56: sysfs_streq: &"ss\nav"{\0} &"ssieu"{\0} :=> \0 | C56: 0.0299056 | F56: of:=IF([.C56]=1;"";[.C56]) -> 0.0299056 | G56: of:=IF([.D56]=1;"";[.D56]) ->  
A57: 25 | B57: sysfs_streq: &"xig"{\0,p,\0} &"xigda"{\0} :=> \0 | C57: 0.0824482 | D57: 0.0270754 | F57: of:=IF([.C57]=1;"";[.C57]) -> 0.0824482 | G57: of:=IF([.D57]=1;"";[.D57]) -> 0.0270754
A58: 26 | B58: sysfs_streq: &"sqe"{\0,p,\0} &"sqe\n"{\0,\0} :=> \x01 | C58: 0.0458102 | F58: of:=IF([.C58]=1;"";[.C58]) -> 0.0458102 | G58: of:=IF([.D58]=1;"";[.D58]) ->  
A59: 27 | B59: sysfs_streq: &"jpf"{\0,p,\0} &"jpf\na"{\0} :=> \0 | C59: 0.0516949 | F59: of:=IF([.C59]=1;"";[.C59]) -> 0.0516949 | G59: of:=IF([.D59]=1;"";[.D59]) ->  
A60: 28 | B60: sysfs_streq: &"uqr"{\0,p,\0} &"uqr"{\0,h,\0} :=> \x01 | C60: 0 | D60: 0 | F60: of:=IF([.C60]=1;"";[.C60]) -> 0 | G60: of:=IF([.D60]=1;"";[.D60]) -> 0
A61: 29 | B61: sysfs_streq: &"zccit"{\0} &"zccys"{\0} :=> \0 | C61: 0.0256915 | D61: 0.0243814 | F61: of:=IF([.C61]=1;"";[.C61]) -> 0.0256915 | G61: of:=IF([.D61]=1;"";[.D61]) -> 0.0243814
A62: 30 | B62: sysfs_streq: &"njh\n"{\0,\0} &"njh"{\0,a,\0} :=> \x01 | C62: 0.0504703 | F62: of:=IF([.C62]=1;"";[.C62]) -> 0.0504703 | G62: of:=IF([.D62]=1;"";[.D62]) ->  
A63: 31 | B63: sysfs_streq: &"smh\n"{\0,\0} &"smhsr"{\0} :=> \0 | C63: 0.0248276 | F63: of:=IF([.C63]=1;"";[.C63]) -> 0.0248276 | G63: of:=IF([.D63]=1;"";[.D63]) ->  
A64: 32 | B64: sysfs_streq: &"rgh\na"{\0} &"rghfn"{\0} :=> \0 | C64: 0.0247354 | F64: of:=IF([.C64]=1;"";[.C64]) -> 0.0247354 | G64: of:=IF([.D64]=1;"";[.D64]) ->  
A65: 33 | B65: sysfs_streq: &"zraf"{\0,\0} &"zrafp"{\0} :=> \0 | C65: 0.0403254 | D65: 0.0221779 | F65: of:=IF([.C65]=1;"";[.C65]) -> 0.0403254 | G65: of:=IF([.D65]=1;"";[.D65]) -> 0.0221779
A66: 34 | B66: sysfs_streq: &"twwy"{\0,\0} &"twwy\n"{\0} :=> \x01 | C66: 0.0346687 | F66: of:=IF([.C66]=1;"";[.C66]) -> 0.0346687 | G66: of:=IF([.D66]=1;"";[.D66]) ->  
A67: 35 | B67: sysfs_streq: &"yxdq"{\0,\0} &"yxdq"{\0,\0} :=> \x01 | C67: 0 | D67: 0 | F67: of:=IF([.C67]=1;"";[.C67]) -> 0 | G67: of:=IF([.D67]=1;"";[.D67]) -> 0
A68: 36 | B68: sysfs_streq: &"rvuvg"{\0} &"rvuvz"{\0} :=> \0 | C68: 0.0230973 | D68: 0.0188748 | F68: of:=IF([.C68]=1;"";[.C68]) -> 0.0230973 | G68: of:=IF([.D68]=1;"";[.D68]) -> 0.0188748
A69: 37 | B69: sysfs_streq: &"wjdv\n"{\0} &"wjdv"{\0,\0} :=> \x01 | C69: 0 | F69: of:=IF([.C69]=1;"";[.C69]) -> 0 | G69: of:=IF([.D69]=1;"";[.D69]) ->  
A70: 38 | B70: sysfs_streq: &"izou\n"{\0} &"izouc"{\0} :=> \0 | C70: 0.0284762 | F70: of:=IF([.C70]=1;"";[.C70]) -> 0.0284762 | G70: of:=IF([.D70]=1;"";[.D70]) ->  
A71: 39 | B71: sysfs_streq: &"wxrck"{\0} &"wxrck"{\0} :=> \x01 | C71: 0 | D71: 0 | F71: of:=IF([.C71]=1;"";[.C71]) -> 0 | G71: of:=IF([.D71]=1;"";[.D71]) -> 0

Sheet: strcpy
A1: # | B1: Test Case | C1: N1 | D1: N2 | E1: N3 | O1: FINAL
A2: 1 | B2: strcpy: &""{\0,\x01,\x01,\x01,\x01,\x01} &"n"{\0,p,j,s,\0} :=> &"n"{\0,p,t,y,\0} | C2: 1 | D2: 1 | E2: 1 | G2: of:=IF([.C2]=1;"";[.C2]) ->  | H2: of:=IF([.D2]=1;"";[.D2]) ->  | I2: of:=IF([.E2]=1;"";[.E2]) ->  | K2: of:=AVERAGE([.G2:.G36]) -> 0.0789820041666667 | L2: of:=AVERAGE([.H2:.H36]) -> 0.0776929083333333 | M2: of:=AVERAGE([.I2:.I36]) -> 0.0776929083333333 | O2: of:=AVERAGE([.K2:.M2]) -> 0.0781226069444444
A3: 2 | B3: strcpy: &""{\0,\x01,\x01,\x01,\x01,\x01} &"ll"{\0,p,n,\0} :=> &"ll"{\0,p,d,\0} | C3: 1 | D3: 0.221126 | E3: 0.221126 | G3: of:=IF([.C3]=1;"";[.C3]) ->  | H3: of:=IF([.D3]=1;"";[.D3]) -> 0.221126 | I3: of:=IF([.E3]=1;"";[.E3]) -> 0.221126
A4: 3 | B4: strcpy: &""{\0,\x01,\x01,\x01,\x01,\x01} &"bbf"{\0,p,\0} :=> &"bbf"{\0,p,\0} | C4: 1 | D4: 0.0657419 | E4: 0.0657419 | G4: of:=IF([.C4]=1;"";[.C4]) ->  | H4: of:=IF([.D4]=1;"";[.D4]) -> 0.0657419 | I4: of:=IF([.E4]=1;"";[.E4]) -> 0.0657419
A5: 4 | B5: strcpy: &""{\0,\x01,\x01,\x01,\x01,\x01} &"lsqx"{\0,\0} :=> &"lsqx"{\0,\0} | C5: 1 | D5: 0 | E5: 0 | G5: of:=IF([.C5]=1;"";[.C5]) ->  | H5: of:=IF([.D5]=1;"";[.D5]) -> 0 | I5: of:=IF([.E5]=1;"";[.E5]) -> 0
A6: 5 | B6: strcpy: &""{\0,\x01,\x01,\x01,\x01,\x01} &"cbwmw"{\0} :=> &"cbwmw"{\0} | C6: 1 | D6: 0.019819 | E6: 0.019819 | G6: of:=IF([.C6]=1;"";[.C6]) ->  | H6: of:=IF([.D6]=1;"";[.D6]) -> 0.019819 | I6: of:=IF([.E6]=1;"";[.E6]) -> 0.019819
A7: 6 | B7: strcpy: &"d"{\0,\x01,\x01,\x01,\x01} &""{\0,p,m,k,r,\0} :=> &""{\0,\0,p,r,i,\0} | C7: 1 | D7: 1 | E7: 1 | G7: of:=IF([.C7]=1;"";[.C7]) ->  | H7: of:=IF([.D7]=1;"";[.D7]) ->  | I7: of:=IF([.E7]=1;"";[.E7]) -> 
A8: 7 | B8: strcpy: &"v"{\0,\x01,\x01,\x01,\x01} &"g"{\0,p,z,v,\0} :=> &"g"{\0,p,d,z,\0} | C8: 1 | D8: 1 | E8: 1 | G8: of:=IF([.C8]=1;"";[.C8]) ->  | H8: of:=IF([.D8]=1;"";[.D8]) ->  | I8: of:=IF([.E8]=1;"";[.E8]) -> 
A9: 8 | B9: strcpy: &"c"{\0,\x01,\x01,\x01,\x01} &"vg"{\0,p,i,\0} :=> &"vg"{\0,p,s,\0} | C9: 1 | D9: 0.170794 | E9: 0.170794 | G9: of:=IF([.C9]=1;"";[.C9]) ->  | H9: of:=IF([.D9]=1;"";[.D9]) -> 0.170794 | I9: of:=IF([.E9]=1;"";[.E9]) -> 0.170794
A10: 9 | B10: strcpy: &"g"{\0,\x01,\x01,\x01,\x01} &"pnk"{\0,p,\0} :=> &"pnk"{\0,p,\0} | C10: 1 | D10: 0.0730763 | E10: 0.0730763 | G10: of:=IF([.C10]=1;"";[.C10]) ->  | H10: of:=IF([.D10]=1;"";[.D10]) -> 0.0730763 | I10: of:=IF([.E10]=1;"";[.E10]) -> 0.0730763
A11: 10 | B11: strcpy: &"r"{\0,\x01,\x01,\x01,\x01} &"kzdn"{\0,\0} :=> &"kzdn"{\0,\0} | C11: 1 | D11: 0.0300753 | E11: 0.0300753 | G11: of:=IF([.C11]=1;"";[.C11]) ->  | H11: of:=IF([.D11]=1;"";[.D11]) -> 0.0300753 | I11: of:=IF([.E11]=1;"";[.E11]) -> 0.0300753
A12: 11 | B12: strcpy: &"g"{\0,\x01,\x01,\x01,\x01} &"htruq"{\0} :=> &"htruq"{\0} | C12: 1 | D12: 0.0271299 | E12: 0.0271299 | G12: of:=IF([.C12]=1;"";[.C12]) ->  | H12: of:=IF([.D12]=1;"";[.D12]) -> 0.0271299 | I12: of:=IF([.E12]=1;"";[.E12]) -> 0.0271299
A13: 12 | B13: strcpy: &"bm"{\0,\x01,\x01,\x01} &""{\0,p,m,w,u,\0} :=> &""{\0,m,\0,p,j,\0} | C13: 0.190052 | D13: 1 | E13: 1 | G13: of:=IF([.C13]=1;"";[.C13]) -> 0.190052 | H13: of:=IF([.D13]=1;"";[.D13]) ->  | I13: of:=IF([.E13]=1;"";[.E13]) -> 
A14: 13 | B14: strcpy: &"it"{\0,\x01,\x01,\x01} &"d"{\0,p,a,u,\0} :=> &"d"{\0,\0,p,g,\0} | C14: 0.222847 | D14: 1 | E14: 1 | G14: of:=IF([.C14]=1;"";[.C14]) -> 0.222847 | H14: of:=IF([.D14]=1;"";[.D14]) ->  | I14: of:=IF([.E14]=1;"";[.E14]) -> 
A15: 14 | B15: strcpy: &"va"{\0,\x01,\x01,\x01} &"js"{\0,p,r,\0} :=> &"js"{\0,p,j,\0} | C15: 0.212346 | D15: 0.144251 | E15: 0.144251 | G15: of:=IF([.C15]=1;"";[.C15]) -> 0.212346 | H15: of:=IF([.D15]=1;"";[.D15]) -> 0.144251 | I15: of:=IF([.E15]=1;"";[.E15]) -> 0.144251
A16: 15 | B16: strcpy: &"bm"{\0,\x01,\x01,\x01} &"yiq"{\0,p,\0} :=> &"yiq"{\0,p,\0} | C16: 0.190052 | D16: 0.0777666 | E16: 0.0777666 | G16: of:=IF([.C16]=1;"";[.C16]) -> 0.190052 | H16: of:=IF([.D16]=1;"";[.D16]) -> 0.0777666 | I16: of:=IF([.E16]=1;"";[.E16]) -> 0.0777666
A17: 16 | B17: strcpy: &"qa"{\0,\x01,\x01,\x01} &"dfuv"{\0,\0} :=> &"dfuv"{\0,\0} | C17: 0.157876 | D17: 0.0395383 | E17: 0.0395383 | G17: of:=IF([.C17]=1;"";[.C17]) -> 0.157876 | H17: of:=IF([.D17]=1;"";[.D17]) -> 0.0395383 | I17: of:=IF([.E17]=1;"";[.E17]) -> 0.0395383
A18: 17 | B18: strcpy: &"gs"{\0,\x01,\x01,\x01} &"alauw"{\0} :=> &"alauw"{\0} | C18: 0.209845 | D18: 0.0283393 | E18: 0.0283393 | G18: of:=IF([.C18]=1;"";[.C18]) -> 0.209845 | H18: of:=IF([.D18]=1;"";[.D18]) -> 0.0283393 | I18: of:=IF([.E18]=1;"";[.E18]) -> 0.0283393
A19: 18 | B19: strcpy: &"ngd"{\0,\x01,\x01} &""{\0,p,a,t,s,\0} :=> &""{\0,g,d,\0,p,\0} | C19: 0.079551 | D19: 1 | E19: 1 | G19: of:=IF([.C19]=1;"";[.C19]) -> 0.079551 | H19: of:=IF([.D19]=1;"";[.D19]) ->  | I19: of:=IF([.E19]=1;"";[.E19]) -> 
A20: 19 | B20: strcpy: &"mxc"{\0,\x01,\x01} &"s"{\0,p,c,z,\0} :=> &"s"{\0,c,\0,p,\0} | C20: 0 | D20: 1 | E20: 1 | G20: of:=IF([.C20]=1;"";[.C20]) -> 0 | H20: of:=IF([.D20]=1;"";[.D20]) ->  | I20: of:=IF([.E20]=1;"";[.E20]) -> 
A21: 20 | B21: strcpy: &"vmo"{\0,\x01,\x01} &"sd"{\0,p,o,\0} :=> &"sd"{\0,\0,p,\0} | C21: 0.0633548 | D21: 0.203446 | E21: 0.203446 | G21: of:=IF([.C21]=1;"";[.C21]) -> 0.0633548 | H21: of:=IF([.D21]=1;"";[.D21]) -> 0.203446 | I21: of:=IF([.E21]=1;"";[.E21]) -> 0.203446
A22: 21 | B22: strcpy: &"cib"{\0,\x01,\x01} &"rbh"{\0,p,\0} :=> &"rbh"{\0,p,\0} | C22: 0.0845172 | D22: 0.0711168 | E22: 0.0711168 | G22: of:=IF([.C22]=1;"";[.C22]) -> 0.0845172 | H22: of:=IF([.D22]=1;"";[.D22]) -> 0.0711168 | I22: of:=IF([.E22]=1;"";[.E22]) -> 0.0711168
A23: 22 | B23: strcpy: &"osy"{\0,\x01,\x01} &"zivl"{\0,\0} :=> &"zivl"{\0,\0} | C23: 0.0837166 | D23: 0.0391307 | E23: 0.0391307 | G23: of:=IF([.C23]=1;"";[.C23]) -> 0.0837166 | H23: of:=IF([.D23]=1;"";[.D23]) -> 0.0391307 | I23: of:=IF([.E23]=1;"";[.E23]) -> 0.0391307
A24: 23 | B24: strcpy: &"kel"{\0,\x01,\x01} &"xmwwi"{\0} :=> &"xmwwi"{\0} | C24: 0.0878406 | D24: 0.0191869 | E24: 0.0191869 | G24: of:=IF([.C24]=1;"";[.C24]) -> 0.0878406 | H24: of:=IF([.D24]=1;"";[.D24]) -> 0.0191869 | I24: of:=IF([.E24]=1;"";[.E24]) -> 0.0191869
A25: 24 | B25: strcpy: &"zyaj"{\0,\x01} &""{\0,p,s,g,j,\0} :=> &""{\0,y,a,j,\0,\0} | C25: 0.0398257 | D25: 1 | E25: 1 | G25: of:=IF([.C25]=1;"";[.C25]) -> 0.0398257 | H25: of:=IF([.D25]=1;"";[.D25]) ->  | I25: of:=IF([.E25]=1;"";[.E25]) -> 
A26: 25 | B26: strcpy: &"qqjt"{\0,\x01} &"u"{\0,p,k,f,\0} :=> &"u"{\0,j,t,\0,\0} | C26: 0 | D26: 1 | E26: 1 | G26: of:=IF([.C26]=1;"";[.C26]) -> 0 | H26: of:=IF([.D26]=1;"";[.D26]) ->  | I26: of:=IF([.E26]=1;"";[.E26]) -> 
A27: 26 | B27: strcpy: &"svcm"{\0,\x01} &"jj"{\0,p,f,\0} :=> &"jj"{\0,m,\0,\0} | C27: 0.0329131 | D27: 0.144251 | E27: 0.144251 | G27: of:=IF([.C27]=1;"";[.C27]) -> 0.0329131 | H27: of:=IF([.D27]=1;"";[.D27]) -> 0.144251 | I27: of:=IF([.E27]=1;"";[.E27]) -> 0.144251
A28: 27 | B28: strcpy: &"pnqq"{\0,\x01} &"yvt"{\0,p,\0} :=> &"yvt"{\0,\0,\0} | C28: 0.0259091 | D28: 0.0594336 | E28: 0.0594336 | G28: of:=IF([.C28]=1;"";[.C28]) -> 0.0259091 | H28: of:=IF([.D28]=1;"";[.D28]) -> 0.0594336 | I28: of:=IF([.E28]=1;"";[.E28]) -> 0.0594336
A29: 28 | B29: strcpy: &"rltb"{\0,\x01} &"puzp"{\0,\0} :=> &"puzp"{\0,\0} | C29: 0.0433334 | D29: 0.037295 | E29: 0.037295 | G29: of:=IF([.C29]=1;"";[.C29]) -> 0.0433334 | H29: of:=IF([.D29]=1;"";[.D29]) -> 0.037295 | I29: of:=IF([.E29]=1;"";[.E29]) -> 0.037295
A30: 29 | B30: strcpy: &"cigu"{\0,\x01} &"mcobw"{\0} :=> &"mcobw"{\0} | C30: 0.0462316 | D30: 0.025235 | E30: 0.025235 | G30: of:=IF([.C30]=1;"";[.C30]) -> 0.0462316 | H30: of:=IF([.D30]=1;"";[.D30]) -> 0.025235 | I30: of:=IF([.E30]=1;"";[.E30]) -> 0.025235
A31: 30 | B31: strcpy: &"yezcd"{\0} &""{\0,p,l,i,p,\0} :=> &""{\0,e,z,c,d,\0} | C31: 0.0220887 | D31: 1 | E31: 1 | G31: of:=IF([.C31]=1;"";[.C31]) -> 0.0220887 | H31: of:=IF([.D31]=1;"";[.D31]) ->  | I31: of:=IF([.E31]=1;"";[.E31]) -> 
A32: 31 | B32: strcpy: &"uqmsb"{\0} &"i"{\0,p,l,b,\0} :=> &"i"{\0,m,s,b,\0} | C32: 0 | D32: 1 | E32: 1 | G32: of:=IF([.C32]=1;"";[.C32]) -> 0 | H32: of:=IF([.D32]=1;"";[.D32]) ->  | I32: of:=IF([.E32]=1;"";[.E32]) -> 
A33: 32 | B33: strcpy: &"ahfgd"{\0} &"ee"{\0,p,h,\0} :=> &"ee"{\0,g,d,\0} | C33: 0.0226613 | D33: 0.218916 | E33: 0.218916 | G33: of:=IF([.C33]=1;"";[.C33]) -> 0.0226613 | H33: of:=IF([.D33]=1;"";[.D33]) -> 0.218916 | I33: of:=IF([.E33]=1;"";[.E33]) -> 0.218916
A34: 33 | B34: strcpy: &"zodgt"{\0} &"dua"{\0,p,\0} :=> &"dua"{\0,t,\0} | C34: 0.0270534 | D34: 0.0842685 | E34: 0.0842685 | G34: of:=IF([.C34]=1;"";[.C34]) -> 0.0270534 | H34: of:=IF([.D34]=1;"";[.D34]) -> 0.0842685 | I34: of:=IF([.E34]=1;"";[.E34]) -> 0.0842685
A35: 34 | B35: strcpy: &"ushog"{\0} &"yhuj"{\0,\0} :=> &"yhuj"{\0,\0} | C35: 0.0304672 | D35: 0.0370152 | E35: 0.0370152 | G35: of:=IF([.C35]=1;"";[.C35]) -> 0.0304672 | H35: of:=IF([.D35]=1;"";[.D35]) -> 0.0370152 | I35: of:=IF([.E35]=1;"";[.E35]) -> 0.0370152
A36: 35 | B36: strcpy: &"rltkj"{\0} &"keoxa"{\0} :=> &"keoxa"{\0} | C36: 0.0230864 | D36: 0.0276775 | E36: 0.0276775 | G36: of:=IF([.C36]=1;"";[.C36]) -> 0.0230864 | H36: of:=IF([.D36]=1;"";[.D36]) -> 0.0276775 | I36: of:=IF([.E36]=1;"";[.E36]) -> 0.0276775
A37: 1 | B37: strncpy: &""{\0,\x01,\x01,\x01,\x01,\x01} &""{\0,p,o,w,l,\0} 5 :=> &""{\0,\0,\0,\0,\0,\0} | C37: 1 | D37: 1 | E37: 1 | G37: of:=IF([.C37]=1;"";[.C37]) ->  | H37: of:=IF([.D37]=1;"";[.D37]) ->  | I37: of:=IF([.E37]=1;"";[.E37]) ->  | K37: of:=AVERAGE([.G37:.G72]) -> 0.075775375 | L37: of:=AVERAGE([.H37:.H72]) -> 0.0825733958333333 | M37: of:=AVERAGE([.I37:.I72]) -> 0.0825733958333333 | O37: of:=AVERAGE([.K37:.M37]) -> 0.0803073888888889
A38: 2 | B38: strncpy: &""{\0,\x01,\x01,\x01,\x01,\x01} &"u"{\0,p,u,k,\0} 5 :=> &"u"{\0,\0,\0,\0,\0} | C38: 1 | D38: 1 | E38: 1 | G38: of:=IF([.C38]=1;"";[.C38]) ->  | H38: of:=IF([.D38]=1;"";[.D38]) ->  | I38: of:=IF([.E38]=1;"";[.E38]) -> 
A39: 3 | B39: strncpy: &""{\0,\x01,\x01,\x01,\x01,\x01} &"is"{\0,p,p,\0} 5 :=> &"is"{\0,\0,\0,\0} | C39: 1 | D39: 0.222847 | E39: 0.222847 | G39: of:=IF([.C39]=1;"";[.C39]) ->  | H39: of:=IF([.D39]=1;"";[.D39]) -> 0.222847 | I39: of:=IF([.E39]=1;"";[.E39]) -> 0.222847
A40: 4 | B40: strncpy: &""{\0,\x01,\x01,\x01,\x01,\x01} &"jtf"{\0,p,\0} 5 :=> &"jtf"{\0,\0,\0} | C40: 1 | D40: 0.0592968 | E40: 0.0592968 | G40: of:=IF([.C40]=1;"";[.C40]) ->  | H40: of:=IF([.D40]=1;"";[.D40]) -> 0.0592968 | I40: of:=IF([.E40]=1;"";[.E40]) -> 0.0592968
A41: 5 | B41: strncpy: &""{\0,\x01,\x01,\x01,\x01,\x01} &"lbwy"{\0,\0} 5 :=> &"lbwy"{\0,\0} | C41: 1 | D41: 0.0383435 | E41: 0.0383435 | G41: of:=IF([.C41]=1;"";[.C41]) ->  | H41: of:=IF([.D41]=1;"";[.D41]) -> 0.0383435 | I41: of:=IF([.E41]=1;"";[.E41]) -> 0.0383435
A42: 6 | B42: strncpy: &""{\0,\x01,\x01,\x01,\x01,\x01} &"tkjqh"{\0} 5 :=> &"tkjqh"{\0} | C42: 1 | D42: 0 | E42: 0 | G42: of:=IF([.C42]=1;"";[.C42]) ->  | H42: of:=IF([.D42]=1;"";[.D42]) -> 0 | I42: of:=IF([.E42]=1;"";[.E42]) -> 0
A43: 7 | B43: strncpy: &"x"{\0,\x01,\x01,\x01,\x01} &""{\0,p,e,z,n,\0} 5 :=> &""{\0,\0,\0,\0,\0,\0} | C43: 1 | D43: 1 | E43: 1 | G43: of:=IF([.C43]=1;"";[.C43]) ->  | H43: of:=IF([.D43]=1;"";[.D43]) ->  | I43: of:=IF([.E43]=1;"";[.E43]) -> 
A44: 8 | B44: strncpy: &"x"{\0,\x01,\x01,\x01,\x01} &"r"{\0,p,t,v,\0} 5 :=> &"r"{\0,\0,\0,\0,\0} | C44: 1 | D44: 1 | E44: 1 | G44: of:=IF([.C44]=1;"";[.C44]) ->  | H44: of:=IF([.D44]=1;"";[.D44]) ->  | I44: of:=IF([.E44]=1;"";[.E44]) -> 
A45: 9 | B45: strncpy: &"k"{\0,\x01,\x01,\x01,\x01} &"ws"{\0,p,c,\0} 5 :=> &"ws"{\0,\0,\0,\0} | C45: 1 | D45: 0.2083 | E45: 0.2083 | G45: of:=IF([.C45]=1;"";[.C45]) ->  | H45: of:=IF([.D45]=1;"";[.D45]) -> 0.2083 | I45: of:=IF([.E45]=1;"";[.E45]) -> 0.2083
A46: 10 | B46: strncpy: &"s"{\0,\x01,\x01,\x01,\x01} &"xpr"{\0,p,\0} 5 :=> &"xpr"{\0,\0,\0} | C46: 1 | D46: 0.085063 | E46: 0.085063 | G46: of:=IF([.C46]=1;"";[.C46]) ->  | H46: of:=IF([.D46]=1;"";[.D46]) -> 0.085063 | I46: of:=IF([.E46]=1;"";[.E46]) -> 0.085063
A47: 11 | B47: strncpy: &"h"{\0,\x01,\x01,\x01,\x01} &"vrsy"{\0,\0} 5 :=> &"vrsy"{\0,\0} | C47: 1 | D47: 0.0414423 | E47: 0.0414423 | G47: of:=IF([.C47]=1;"";[.C47]) ->  | H47: of:=IF([.D47]=1;"";[.D47]) -> 0.0414423 | I47: of:=IF([.E47]=1;"";[.E47]) -> 0.0414423
A48: 12 | B48: strncpy: &"f"{\0,\x01,\x01,\x01,\x01} &"ufbrr"{\0} 5 :=> &"ufbrr"{\0} | C48: 1 | D48: 0.0248273 | E48: 0.0248273 | G48: of:=IF([.C48]=1;"";[.C48]) ->  | H48: of:=IF([.D48]=1;"";[.D48]) -> 0.0248273 | I48: of:=IF([.E48]=1;"";[.E48]) -> 0.0248273
A49: 13 | B49: strncpy: &"zr"{\0,\x01,\x01,\x01} &""{\0,p,q,c,w,\0} 5 :=> &""{\0,\0,\0,\0,\0,\0} | C49: 0.172927 | D49: 1 | E49: 1 | G49: of:=IF([.C49]=1;"";[.C49]) -> 0.172927 | H49: of:=IF([.D49]=1;"";[.D49]) ->  | I49: of:=IF([.E49]=1;"";[.E49]) -> 
A50: 14 | B50: strncpy: &"kw"{\0,\x01,\x01,\x01} &"j"{\0,p,p,g,\0} 5 :=> &"j"{\0,\0,\0,\0,\0} | C50: 0.190869 | D50: 1 | E50: 1 | G50: of:=IF([.C50]=1;"";[.C50]) -> 0.190869 | H50: of:=IF([.D50]=1;"";[.D50]) ->  | I50: of:=IF([.E50]=1;"";[.E50]) -> 
A51: 15 | B51: strncpy: &"ln"{\0,\x01,\x01,\x01} &"sl"{\0,p,o,\0} 5 :=> &"sl"{\0,\0,\0,\0} | C51: 0.195629 | D51: 0.210352 | E51: 0.210352 | G51: of:=IF([.C51]=1;"";[.C51]) -> 0.195629 | H51: of:=IF([.D51]=1;"";[.D51]) -> 0.210352 | I51: of:=IF([.E51]=1;"";[.E51]) -> 0.210352
A52: 16 | B52: strncpy: &"sr"{\0,\x01,\x01,\x01} &"ivg"{\0,p,\0} 5 :=> &"ivg"{\0,\0,\0} | C52: 0.201288 | D52: 0.0715428 | E52: 0.0715428 | G52: of:=IF([.C52]=1;"";[.C52]) -> 0.201288 | H52: of:=IF([.D52]=1;"";[.D52]) -> 0.0715428 | I52: of:=IF([.E52]=1;"";[.E52]) -> 0.0715428
A53: 17 | B53: strncpy: &"uv"{\0,\x01,\x01,\x01} &"xxto"{\0,\0} 5 :=> &"xxto"{\0,\0} | C53: 0.192605 | D53: 0.0403954 | E53: 0.0403954 | G53: of:=IF([.C53]=1;"";[.C53]) -> 0.192605 | H53: of:=IF([.D53]=1;"";[.D53]) -> 0.0403954 | I53: of:=IF([.E53]=1;"";[.E53]) -> 0.0403954
A54: 18 | B54: strncpy: &"zq"{\0,\x01,\x01,\x01} &"khkbm"{\0} 5 :=> &"khkbm"{\0} | C54: 0.155927 | D54: 0.0222252 | E54: 0.0222252 | G54: of:=IF([.C54]=1;"";[.C54]) -> 0.155927 | H54: of:=IF([.D54]=1;"";[.D54]) -> 0.0222252 | I54: of:=IF([.E54]=1;"";[.E54]) -> 0.0222252
A55: 19 | B55: strncpy: &"sqz"{\0,\x01,\x01} &""{\0,p,m,i,j,\0} 5 :=> &""{\0,\0,\0,\0,\0,\0} | C55: 0 | D55: 1 | E55: 1 | G55: of:=IF([.C55]=1;"";[.C55]) -> 0 | H55: of:=IF([.D55]=1;"";[.D55]) ->  | I55: of:=IF([.E55]=1;"";[.E55]) -> 
A56: 20 | B56: strncpy: &"npf"{\0,\x01,\x01} &"a"{\0,p,g,v,\0} 5 :=> &"a"{\0,\0,\0,\0,\0} | C56: 0.071111 | D56: 1 | E56: 1 | G56: of:=IF([.C56]=1;"";[.C56]) -> 0.071111 | H56: of:=IF([.D56]=1;"";[.D56]) ->  | I56: of:=IF([.E56]=1;"";[.E56]) -> 
A57: 21 | B57: strncpy: &"oag"{\0,\x01,\x01} &"sl"{\0,p,f,\0} 5 :=> &"sl"{\0,\0,\0,\0} | C57: 0.0845339 | D57: 0.210352 | E57: 0.210352 | G57: of:=IF([.C57]=1;"";[.C57]) -> 0.0845339 | H57: of:=IF([.D57]=1;"";[.D57]) -> 0.210352 | I57: of:=IF([.E57]=1;"";[.E57]) -> 0.210352
A58: 22 | B58: strncpy: &"rno"{\0,\x01,\x01} &"ckx"{\0,p,\0} 5 :=> &"ckx"{\0,\0,\0} | C58: 0.0868156 | D58: 0 | E58: 0 | G58: of:=IF([.C58]=1;"";[.C58]) -> 0.0868156 | H58: of:=IF([.D58]=1;"";[.D58]) -> 0 | I58: of:=IF([.E58]=1;"";[.E58]) -> 0
A59: 23 | B59: strncpy: &"utt"{\0,\x01,\x01} &"zphi"{\0,\0} 5 :=> &"zphi"{\0,\0} | C59: 0.0870897 | D59: 0.0404094 | E59: 0.0404094 | G59: of:=IF([.C59]=1;"";[.C59]) -> 0.0870897 | H59: of:=IF([.D59]=1;"";[.D59]) -> 0.0404094 | I59: of:=IF([.E59]=1;"";[.E59]) -> 0.0404094
A60: 24 | B60: strncpy: &"hyx"{\0,\x01,\x01} &"eqtpm"{\0} 5 :=> &"eqtpm"{\0} | C60: 0.0683747 | D60: 0.0204228 | E60: 0.0204228 | G60: of:=IF([.C60]=1;"";[.C60]) -> 0.0683747 | H60: of:=IF([.D60]=1;"";[.D60]) -> 0.0204228 | I60: of:=IF([.E60]=1;"";[.E60]) -> 0.0204228
A61: 25 | B61: strncpy: &"lifw"{\0,\x01} &""{\0,p,q,c,n,\0} 5 :=> &""{\0,\0,\0,\0,\0,\0} | C61: 0.0408613 | D61: 1 | E61: 1 | G61: of:=IF([.C61]=1;"";[.C61]) -> 0.0408613 | H61: of:=IF([.D61]=1;"";[.D61]) ->  | I61: of:=IF([.E61]=1;"";[.E61]) -> 
A62: 26 | B62: strncpy: &"jdhp"{\0,\x01} &"u"{\0,p,e,d,\0} 5 :=> &"u"{\0,\0,\0,\0,\0} | C62: 0.0319306 | D62: 1 | E62: 1 | G62: of:=IF([.C62]=1;"";[.C62]) -> 0.0319306 | H62: of:=IF([.D62]=1;"";[.D62]) ->  | I62: of:=IF([.E62]=1;"";[.E62]) -> 
A63: 27 | B63: strncpy: &"obfl"{\0,\x01} &"ct"{\0,p,q,\0} 5 :=> &"ct"{\0,\0,\0,\0} | C63: 0.0374304 | D63: 0.218466 | E63: 0.218466 | G63: of:=IF([.C63]=1;"";[.C63]) -> 0.0374304 | H63: of:=IF([.D63]=1;"";[.D63]) -> 0.218466 | I63: of:=IF([.E63]=1;"";[.E63]) -> 0.218466
A64: 28 | B64: strncpy: &"ldsx"{\0,\x01} &"pka"{\0,p,\0} 5 :=> &"pka"{\0,\0,\0} | C64: 0 | D64: 0.0732713 | E64: 0.0732713 | G64: of:=IF([.C64]=1;"";[.C64]) -> 0 | H64: of:=IF([.D64]=1;"";[.D64]) -> 0.0732713 | I64: of:=IF([.E64]=1;"";[.E64]) -> 0.0732713
A65: 29 | B65: strncpy: &"zdli"{\0,\x01} &"lpod"{\0,\0} 5 :=> &"lpod"{\0,\0} | C65: 0.0397463 | D65: 0.0452592 | E65: 0.0452592 | G65: of:=IF([.C65]=1;"";[.C65]) -> 0.0397463 | H65: of:=IF([.D65]=1;"";[.D65]) -> 0.0452592 | I65: of:=IF([.E65]=1;"";[.E65]) -> 0.0452592
A66: 30 | B66: strncpy: &"frfv"{\0,\x01} &"wvxbv"{\0} 5 :=> &"wvxbv"{\0} | C66: 0.0375636 | D66: 0 | E66: 0 | G66: of:=IF([.C66]=1;"";[.C66]) -> 0.0375636 | H66: of:=IF([.D66]=1;"";[.D66]) -> 0 | I66: of:=IF([.E66]=1;"";[.E66]) -> 0
A67: 31 | B67: strncpy: &"xkxjo"{\0} &""{\0,p,e,c,l,\0} 5 :=> &""{\0,\0,\0,\0,\0,\0} | C67: 0 | D67: 1 | E67: 1 | G67: of:=IF([.C67]=1;"";[.C67]) -> 0 | H67: of:=IF([.D67]=1;"";[.D67]) ->  | I67: of:=IF([.E67]=1;"";[.E67]) -> 
A68: 32 | B68: strncpy: &"thpch"{\0} &"a"{\0,p,a,y,\0} 5 :=> &"a"{\0,\0,\0,\0,\0} | C68: 0.0257777 | D68: 1 | E68: 1 | G68: of:=IF([.C68]=1;"";[.C68]) -> 0.0257777 | H68: of:=IF([.D68]=1;"";[.D68]) ->  | I68: of:=IF([.E68]=1;"";[.E68]) -> 
A69: 33 | B69: strncpy: &"wfnlp"{\0} &"ch"{\0,p,j,\0} 5 :=> &"ch"{\0,\0,\0,\0} | C69: 0.0235191 | D69: 0.22025 | E69: 0.22025 | G69: of:=IF([.C69]=1;"";[.C69]) -> 0.0235191 | H69: of:=IF([.D69]=1;"";[.D69]) -> 0.22025 | I69: of:=IF([.E69]=1;"";[.E69]) -> 0.22025
A70: 34 | B70: strncpy: &"pkbzo"{\0} &"ehj"{\0,p,\0} 5 :=> &"ehj"{\0,\0,\0} | C70: 0.0198492 | D70: 0.0650085 | E70: 0.0650085 | G70: of:=IF([.C70]=1;"";[.C70]) -> 0.0198492 | H70: of:=IF([.D70]=1;"";[.D70]) -> 0.0650085 | I70: of:=IF([.E70]=1;"";[.E70]) -> 0.0650085
A71: 35 | B71: strncpy: &"tpinv"{\0} &"xuhh"{\0,\0} 5 :=> &"xuhh"{\0,\0} | C71: 0.0283183 | D71: 0.0357124 | E71: 0.0357124 | G71: of:=IF([.C71]=1;"";[.C71]) -> 0.0283183 | H71: of:=IF([.D71]=1;"";[.D71]) -> 0.0357124 | I71: of:=IF([.E71]=1;"";[.E71]) -> 0.0357124
A72: 36 | B72: strncpy: &"ynchv"{\0} &"nwnld"{\0} 5 :=> &"nwnld"{\0} | C72: 0.0264426 | D72: 0.0279746 | E72: 0.0279746 | G72: of:=IF([.C72]=1;"";[.C72]) -> 0.0264426 | H72: of:=IF([.D72]=1;"";[.D72]) -> 0.0279746 | I72: of:=IF([.E72]=1;"";[.E72]) -> 0.0279746

Sheet: strcat
A1: # | B1: Test Case | C1: N1 | D1: N2 | E1: N3
A2: 1 | B2: strcat: &""{\0,\x01,\x01,\x01,\x01,\x01,\x01,\x01,\x01,\x01} &"r"{\0,p,x,\0} :=> &"r"{\0,p,e,d,w,a,i,v,\0} | C2: 1 | D2: 1 | E2: 1 | G2: of:=IF([.C2]=1;"";[.C2]) ->  | H2: of:=IF([.D2]=1;"";[.D2]) ->  | I2: of:=IF([.E2]=1;"";[.E2]) ->  | K2: of:=AVERAGE([.G2:.G41]) -> 0.0505461648387097 | L2: of:=AVERAGE([.H2:.H41]) -> 0.0991910181818182 | M2: of:=AVERAGE([.I2:.I41]) -> 0.0311771672972973 | O2: of:=AVERAGE([.K2:.M2]) -> 0.060304783439275
A3: 2 | B3: strcat: &""{\0,\x01,\x01,\x01,\x01,\x01,\x01,\x01,\x01,\x01} &"dx"{\0,p,\0} :=> &"dx"{\0,p,l,a,g,l,w,\0} | C3: 1 | D3: 0 | E3: 0 | G3: of:=IF([.C3]=1;"";[.C3]) ->  | H3: of:=IF([.D3]=1;"";[.D3]) -> 0 | I3: of:=IF([.E3]=1;"";[.E3]) -> 0
A4: 3 | B4: strcat: &""{\0,\x01,\x01,\x01,\x01,\x01,\x01,\x01,\x01,\x01} &"uzn"{\0,\0} :=> &"uzn"{\0,p,u,d,e,a,\0} | C4: 1 | D4: 0.0657601 | E4: 0.0657601 | G4: of:=IF([.C4]=1;"";[.C4]) ->  | H4: of:=IF([.D4]=1;"";[.D4]) -> 0.0657601 | I4: of:=IF([.E4]=1;"";[.E4]) -> 0.0657601
A5: 4 | B5: strcat: &""{\0,\x01,\x01,\x01,\x01,\x01,\x01,\x01,\x01,\x01} &"ttnn"{\0} :=> &"ttnn"{\0,p,u,p,b,\0} | C5: 1 | D5: 0.0441641 | E5: 0.0441641 | H5: of:=IF([.D5]=1;"";[.D5]) -> 0.0441641 | I5: of:=IF([.E5]=1;"";[.E5]) -> 0.0441641
A6: 5 | B6: strcat: &"g"{\0,\x01,\x01,\x01,\x01,\x01,\x01,\x01,\x01} &""{\0,p,k,v,\0} :=> &"g"{\0,p,d,w,z,k,g,c,\0} | C6: 1 | D6: 1 | E6: 1 | G6: of:=IF([.C6]=1;"";[.C6]) ->  | H6: of:=IF([.D6]=1;"";[.D6]) ->  | I6: of:=IF([.E6]=1;"";[.E6]) -> 
A7: 6 | B7: strcat: &"m"{\0,\x01,\x01,\x01,\x01,\x01,\x01,\x01,\x01} &"d"{\0,p,z,\0} :=> &"md"{\0,p,m,q,h,c,j,\0} | C7: 1 | D7: 1 | E7: 0.180593 | G7: of:=IF([.C7]=1;"";[.C7]) ->  | H7: of:=IF([.D7]=1;"";[.D7]) ->  | I7: of:=IF([.E7]=1;"";[.E7]) -> 0.180593
A8: 7 | B8: strcat: &"j"{\0,\x01,\x01,\x01,\x01,\x01,\x01,\x01,\x01} &"ra"{\0,p,\0} :=> &"jra"{\0,p,z,x,o,z,\0} | C8: 1 | D8: 0.22156 | E8: 0.0575369 | G8: of:=IF([.C8]=1;"";[.C8]) ->  | H8: of:=IF([.D8]=1;"";[.D8]) -> 0.22156 | I8: of:=IF([.E8]=1;"";[.E8]) -> 0.0575369
A9: 8 | B9: strcat: &"m"{\0,\x01,\x01,\x01,\x01,\x01,\x01,\x01,\x01} &"ork"{\0,\0} :=> &"mork"{\0,p,i,z,o,\0} | C9: 1 | D9: 0.0884511 | E9: 0.0480001 | G9: of:=IF([.C9]=1;"";[.C9]) ->  | H9: of:=IF([.D9]=1;"";[.D9]) -> 0.0884511 | I9: of:=IF([.E9]=1;"";[.E9]) -> 0.0480001
A10: 9 | B10: strcat: &"h"{\0,\x01,\x01,\x01,\x01,\x01,\x01,\x01,\x01} &"wgmj"{\0} :=> &"hwgmj"{\0,p,p,f,\0} | C10: 1 | D10: 0.0296178 | E10: 0.0193766 | G10: of:=IF([.C10]=1;"";[.C10]) ->  | H10: of:=IF([.D10]=1;"";[.D10]) -> 0.0296178 | I10: of:=IF([.E10]=1;"";[.E10]) -> 0.0193766
A11: 10 | B11: strcat: &"by"{\0,\x01,\x01,\x01,\x01,\x01,\x01,\x01} &""{\0,p,u,g,\0} :=> &"by"{\0,p,c,q,h,s,n,\0} | C11: 0.215236 | D11: 1 | E11: 0.215236 | G11: of:=IF([.C11]=1;"";[.C11]) -> 0.215236 | H11: of:=IF([.D11]=1;"";[.D11]) ->  | I11: of:=IF([.E11]=1;"";[.E11]) -> 0.215236
A12: 11 | B12: strcat: &"ke"{\0,\x01,\x01,\x01,\x01,\x01,\x01,\x01} &"w"{\0,p,k,\0} :=> &"kew"{\0,p,d,o,r,z,\0} | C12: 0.217558 | D12: 1 | E12: 0.0865267 | G12: of:=IF([.C12]=1;"";[.C12]) -> 0.217558 | H12: of:=IF([.D12]=1;"";[.D12]) ->  | I12: of:=IF([.E12]=1;"";[.E12]) -> 0.0865267
A13: 12 | B13: strcat: &"la"{\0,\x01,\x01,\x01,\x01,\x01,\x01,\x01} &"jc"{\0,p,\0} :=> &"lajc"{\0,p,c,j,h,\0} | C13: 0.22025 | D13: 0.159409 | E13: 0.0370418 | G13: of:=IF([.C13]=1;"";[.C13]) -> 0.22025 | H13: of:=IF([.D13]=1;"";[.D13]) -> 0.159409 | I13: of:=IF([.E13]=1;"";[.E13]) -> 0.0370418
A14: 13 | B14: strcat: &"vp"{\0,\x01,\x01,\x01,\x01,\x01,\x01,\x01} &"ioy"{\0,\0} :=> &"vpioy"{\0,p,q,w,\0} | C14: 0 | D14: 0.0849864 | E14: 0 | G14: of:=IF([.C14]=1;"";[.C14]) -> 0 | H14: of:=IF([.D14]=1;"";[.D14]) -> 0.0849864 | I14: of:=IF([.E14]=1;"";[.E14]) -> 0
A15: 14 | B15: strcat: &"mw"{\0,\x01,\x01,\x01,\x01,\x01,\x01,\x01} &"bfbj"{\0} :=> &"mwbfbj"{\0,p,g,\0} | C15: 0.174098 | D15: 0.0310912 | E15: 0.0134585 | G15: of:=IF([.C15]=1;"";[.C15]) -> 0.174098 | H15: of:=IF([.D15]=1;"";[.D15]) -> 0.0310912 | I15: of:=IF([.E15]=1;"";[.E15]) -> 0.0134585
A16: 15 | B16: strcat: &"mci"{\0,\x01,\x01,\x01,\x01,\x01,\x01} &""{\0,p,b,f,\0} :=> &"mci"{\0,p,a,z,u,a,\0} | C16: 0.0752529 | D16: 1 | E16: 0.0752529 | G16: of:=IF([.C16]=1;"";[.C16]) -> 0.0752529 | H16: of:=IF([.D16]=1;"";[.D16]) ->  | I16: of:=IF([.E16]=1;"";[.E16]) -> 0.0752529
A17: 16 | B17: strcat: &"sdg"{\0,\x01,\x01,\x01,\x01,\x01,\x01} &"o"{\0,p,t,\0} :=> &"sdgo"{\0,p,j,f,n,\0} | C17: 0.0794731 | D17: 1 | E17: 0.0432721 | G17: of:=IF([.C17]=1;"";[.C17]) -> 0.0794731 | H17: of:=IF([.D17]=1;"";[.D17]) ->  | I17: of:=IF([.E17]=1;"";[.E17]) -> 0.0432721
A18: 17 | B18: strcat: &"iaq"{\0,\x01,\x01,\x01,\x01,\x01,\x01} &"qi"{\0,p,\0} :=> &"iaqqi"{\0,p,i,u,\0} | C18: 0.0803682 | D18: 0.188031 | E18: 0.0189203 | G18: of:=IF([.C18]=1;"";[.C18]) -> 0.0803682 | H18: of:=IF([.D18]=1;"";[.D18]) -> 0.188031 | I18: of:=IF([.E18]=1;"";[.E18]) -> 0.0189203
A19: 18 | B19: strcat: &"gip"{\0,\x01,\x01,\x01,\x01,\x01,\x01} &"rsy"{\0,\0} :=> &"giprsy"{\0,p,u,\0} | C19: 0.0836407 | D19: 0.0845443 | E19: 0.0211874 | G19: of:=IF([.C19]=1;"";[.C19]) -> 0.0836407 | H19: of:=IF([.D19]=1;"";[.D19]) -> 0.0845443 | I19: of:=IF([.E19]=1;"";[.E19]) -> 0.0211874
A20: 19 | B20: strcat: &"aup"{\0,\x01,\x01,\x01,\x01,\x01,\x01} &"ksjt"{\0} :=> &"aupksjt"{\0,p,\0} | C20: 0.0848808 | D20: 0.030116 | E20: 0.0116666 | G20: of:=IF([.C20]=1;"";[.C20]) -> 0.0848808 | H20: of:=IF([.D20]=1;"";[.D20]) -> 0.030116 | I20: of:=IF([.E20]=1;"";[.E20]) -> 0.0116666
A21: 20 | B21: strcat: &"istk"{\0,\x01,\x01,\x01,\x01,\x01} &""{\0,p,e,u,\0} :=> &"istk"{\0,p,n,f,w,\0} | C21: 0.043824 | D21: 1 | E21: 0.043824 | G21: of:=IF([.C21]=1;"";[.C21]) -> 0.043824 | H21: of:=IF([.D21]=1;"";[.D21]) ->  | I21: of:=IF([.E21]=1;"";[.E21]) -> 0.043824
A22: 21 | B22: strcat: &"ewin"{\0,\x01,\x01,\x01,\x01,\x01} &"g"{\0,p,g,\0} :=> &"ewing"{\0,p,l,y,\0} | C22: 0.0484892 | D22: 1 | E22: 0.0317186 | G22: of:=IF([.C22]=1;"";[.C22]) -> 0.0484892 | H22: of:=IF([.D22]=1;"";[.D22]) ->  | I22: of:=IF([.E22]=1;"";[.E22]) -> 0.0317186
A23: 22 | B23: strcat: &"mwvd"{\0,\x01,\x01,\x01,\x01,\x01} &"hl"{\0,p,\0} :=> &"mwvdhl"{\0,p,g,\0} | C23: 0.0213368 | D23: 0.202885 | E23: 0.0110805 | G23: of:=IF([.C23]=1;"";[.C23]) -> 0.0213368 | H23: of:=IF([.D23]=1;"";[.D23]) -> 0.202885 | I23: of:=IF([.E23]=1;"";[.E23]) -> 0.0110805
A24: 23 | B24: strcat: &"thrc"{\0,\x01,\x01,\x01,\x01,\x01} &"inh"{\0,\0} :=> &"thrcinh"{\0,p,\0} | C24: 0.0473346 | D24: 0.085241 | E24: 0.0168839 | G24: of:=IF([.C24]=1;"";[.C24]) -> 0.0473346 | H24: of:=IF([.D24]=1;"";[.D24]) -> 0.085241 | I24: of:=IF([.E24]=1;"";[.E24]) -> 0.0168839
A25: 24 | B25: strcat: &"lvxb"{\0,\x01,\x01,\x01,\x01,\x01} &"yulm"{\0} :=> &"lvxbyulm"{\0,\0} | C25: 0 | D25: 0.0414198 | E25: 0 | G25: of:=IF([.C25]=1;"";[.C25]) -> 0 | H25: of:=IF([.D25]=1;"";[.D25]) -> 0.0414198 | I25: of:=IF([.E25]=1;"";[.E25]) -> 0
A26: 25 | B26: strcat: &"jrcdb"{\0,\x01,\x01,\x01,\x01} &""{\0,p,o,u,\0} :=> &"jrcdb"{\0,p,l,q,\0} | C26: 0.0187856 | D26: 1 | E26: 0.0187856 | G26: of:=IF([.C26]=1;"";[.C26]) -> 0.0187856 | H26: of:=IF([.D26]=1;"";[.D26]) ->  | I26: of:=IF([.E26]=1;"";[.E26]) -> 0.0187856
A27: 26 | B27: strcat: &"eqoel"{\0,\x01,\x01,\x01,\x01} &"z"{\0,p,u,\0} :=> &"eqoelz"{\0,p,h,\0} | C27: 0 | D27: 1 | E27: 0 | G27: of:=IF([.C27]=1;"";[.C27]) -> 0 | H27: of:=IF([.D27]=1;"";[.D27]) ->  | I27: of:=IF([.E27]=1;"";[.E27]) -> 0
A28: 27 | B28: strcat: &"wkyow"{\0,\x01,\x01,\x01,\x01} &"rz"{\0,p,\0} :=> &"wkyowrz"{\0,p,\0} | C28: 0.0267603 | D28: 0.189983 | E28: 0.0141657 | G28: of:=IF([.C28]=1;"";[.C28]) -> 0.0267603 | H28: of:=IF([.D28]=1;"";[.D28]) -> 0.189983 | I28: of:=IF([.E28]=1;"";[.E28]) -> 0.0141657
A29: 28 | B29: strcat: &"lnsje"{\0,\x01,\x01,\x01,\x01} &"ann"{\0,\0} :=> &"lnsjeann"{\0,\0} | C29: 0.0241084 | D29: 0.0881785 | E29: 0.0119783 | G29: of:=IF([.C29]=1;"";[.C29]) -> 0.0241084 | H29: of:=IF([.D29]=1;"";[.D29]) -> 0.0881785 | I29: of:=IF([.E29]=1;"";[.E29]) -> 0.0119783
A30: 29 | B30: strcat: &"uoslv"{\0,\x01,\x01,\x01,\x01} &"zysc"{\0} :=> &"uoslvzysc"{\0} | C30: 0.0277597 | D30: 0.042301 | E30: 0.00841952 | G30: of:=IF([.C30]=1;"";[.C30]) -> 0.0277597 | H30: of:=IF([.D30]=1;"";[.D30]) -> 0.042301 | I30: of:=IF([.E30]=1;"";[.E30]) -> 0.00841952
A31: 30 | B31: strcat: &"pjphxn"{\0,\x01,\x01,\x01} &""{\0,p,e,r,\0} :=> &"pjphxn"{\0,p,g,\0} | C31: 0 | D31: 1 | E31: 0 | G31: of:=IF([.C31]=1;"";[.C31]) -> 0 | H31: of:=IF([.D31]=1;"";[.D31]) ->  | I31: of:=IF([.E31]=1;"";[.E31]) -> 0
A32: 31 | B32: strcat: &"usexlm"{\0,\x01,\x01,\x01} &"m"{\0,p,h,\0} :=> &"usexlmm"{\0,p,\0} | C32: 0.0194837 | D32: 1 | E32: 0.0151571 | G32: of:=IF([.C32]=1;"";[.C32]) -> 0.0194837 | H32: of:=IF([.D32]=1;"";[.D32]) ->  | I32: of:=IF([.E32]=1;"";[.E32]) -> 0.0151571
A33: 32 | B33: strcat: &"estyct"{\0,\x01,\x01,\x01} &"ad"{\0,p,\0} :=> &"estyctad"{\0,\0} | C33: 0.0217103 | D33: 0.218466 | E33: 0.0138756 | G33: of:=IF([.C33]=1;"";[.C33]) -> 0.0217103 | H33: of:=IF([.D33]=1;"";[.D33]) -> 0.218466 | I33: of:=IF([.E33]=1;"";[.E33]) -> 0.0138756
A34: 33 | B34: strcat: &"hvibgz"{\0,\x01,\x01,\x01} &"ufg"{\0,\0} :=> &"hvibgzufg"{\0} | C34: 0.0145247 | D34: 0.0721911 | E34: 0.00761716 | G34: of:=IF([.C34]=1;"";[.C34]) -> 0.0145247 | H34: of:=IF([.D34]=1;"";[.D34]) -> 0.0721911 | I34: of:=IF([.E34]=1;"";[.E34]) -> 0.00761716
A35: 34 | B35: strcat: &"jgqigq"{\0,\x01,\x01,\x01} &&10 :=> &"jgqigqwejw"{} | C35: 0 | D35: 0 | G35: of:=IF([.C35]=1;"";[.C35]) -> 0 | H35: of:=IF([.D35]=1;"";[.D35]) -> 0 | I35: of:=IF([.E35]=1;"";[.E35]) ->  
A36: 35 | B36: strcat: &"dhksksi"{\0,\x01,\x01} &""{\0,p,s,x,\0} :=> &"dhksksi"{\0,p,\0} | C36: 0.0144764 | D36: 1 | E36: 0.0144764 | G36: of:=IF([.C36]=1;"";[.C36]) -> 0.0144764 | H36: of:=IF([.D36]=1;"";[.D36]) ->  | I36: of:=IF([.E36]=1;"";[.E36]) -> 0.0144764
A37: 36 | B37: strcat: &"iojxxkm"{\0,\x01,\x01} &"w"{\0,p,e,\0} :=> &"iojxxkmw"{\0,\0} | C37: 0 | D37: 1 | E37: 0 | G37: of:=IF([.C37]=1;"";[.C37]) -> 0 | H37: of:=IF([.D37]=1;"";[.D37]) ->  | I37: of:=IF([.E37]=1;"";[.E37]) -> 0
A38: 37 | B38: strcat: &"sqclxyj"{\0,\x01,\x01} &"cl"{\0,p,\0} :=> &"sqclxyjcl"{\0} | C38: 0 | D38: 0.213806 | E38: 0 | G38: of:=IF([.C38]=1;"";[.C38]) -> 0 | H38: of:=IF([.D38]=1;"";[.D38]) -> 0.213806 | I38: of:=IF([.E38]=1;"";[.E38]) -> 0
A39: 38 | B39: strcat: &"rczwlqfu"{\0,\x01} &""{\0,p,l,x,\0} :=> &"rczwlqfu"{\0,\0} | C39: 0.00757971 | D39: 1 | E39: 0.00757971 | G39: of:=IF([.C39]=1;"";[.C39]) -> 0.00757971 | H39: of:=IF([.D39]=1;"";[.D39]) ->  | I39: of:=IF([.E39]=1;"";[.E39]) -> 0.00757971
A40: 39 | B40: strcat: &"qrzqukfb"{\0,\x01} &"y"{\0,p,p,\0} :=> &"qrzqukfby"{\0} | C40: 0 | D40: 1 | E40: 0 | G40: of:=IF([.C40]=1;"";[.C40]) -> 0 | H40: of:=IF([.D40]=1;"";[.D40]) ->  | I40: of:=IF([.E40]=1;"";[.E40]) -> 0
A41: 40 | B41: strcat: &"ofgsruqgb"{\0} &""{\0,p,a,w,\0} :=> &"ofgsruqgb"{\0} | C41: 0 | D41: 1 | E41: 0 | G41: of:=IF([.C41]=1;"";[.C41]) -> 0 | H41: of:=IF([.D41]=1;"";[.D41]) ->  | I41: of:=IF([.E41]=1;"";[.E41]) -> 0
A42: 1 | B42: strncat: &""{\0,\x01,\x01,\x01,\x01,\x01,\x01,\x01,\x01,\x01} &""{\0,p,b,m,\0} 4 :=> &""{\0,p,g,f,i,v,x,n,t,\0} | C42: 1 | D42: 1 | E42: 1 | G42: of:=IF([.C42]=1;"";[.C42]) ->  | H42: of:=IF([.D42]=1;"";[.D42]) ->  | I42: of:=IF([.E42]=1;"";[.E42]) ->  | K42: of:=AVERAGE([.G42:.G82]) -> 0.0458570251612903 | L42: of:=AVERAGE([.H42:.H82]) -> 0.0852152372727273 | M42: of:=AVERAGE([.I42:.I82]) -> 0.0296366562162162 | O42: of:=AVERAGE([.K42:.M42]) -> 0.0535696395500779
A43: 2 | B43: strncat: &""{\0,\x01,\x01,\x01,\x01,\x01,\x01,\x01,\x01,\x01} &"b"{\0,p,f,\0} 4 :=> &"b"{\0,p,r,d,b,r,t,b,\0} | C43: 1 | D43: 1 | E43: 1 | G43: of:=IF([.C43]=1;"";[.C43]) ->  | H43: of:=IF([.D43]=1;"";[.D43]) ->  | I43: of:=IF([.E43]=1;"";[.E43]) -> 
A44: 3 | B44: strncat: &""{\0,\x01,\x01,\x01,\x01,\x01,\x01,\x01,\x01,\x01} &"zf"{\0,p,\0} 4 :=> &"zf"{\0,p,z,c,x,j,d,\0} | C44: 1 | D44: 0.148166 | E44: 0.148166 | G44: of:=IF([.C44]=1;"";[.C44]) ->  | H44: of:=IF([.D44]=1;"";[.D44]) -> 0.148166 | I44: of:=IF([.E44]=1;"";[.E44]) -> 0.148166
A45: 4 | B45: strncat: &""{\0,\x01,\x01,\x01,\x01,\x01,\x01,\x01,\x01,\x01} &"oic"{\0,\0} 4 :=> &"oic"{\0,p,k,r,j,a,\0} | C45: 1 | D45: 0.0867018 | E45: 0.0867018 | G45: of:=IF([.C45]=1;"";[.C45]) ->  | H45: of:=IF([.D45]=1;"";[.D45]) -> 0.0867018 | I45: of:=IF([.E45]=1;"";[.E45]) -> 0.0867018
A46: 5 | B46: strncat: &""{\0,\x01,\x01,\x01,\x01,\x01,\x01,\x01,\x01,\x01} &"zxhv"{\0} 4 :=> &"zxhv"{\0,p,r,j,k,\0} | C46: 1 | D46: 0 | E46: 0 | G46: of:=IF([.C46]=1;"";[.C46]) ->  | H46: of:=IF([.D46]=1;"";[.D46]) -> 0 | I46: of:=IF([.E46]=1;"";[.E46]) -> 0
A47: 6 | B47: strncat: &"o"{\0,\x01,\x01,\x01,\x01,\x01,\x01,\x01,\x01} &""{\0,p,w,p,\0} 4 :=> &"o"{\0,p,w,x,s,c,b,r,\0} | C47: 1 | D47: 1 | E47: 1 | G47: of:=IF([.C47]=1;"";[.C47]) ->  | H47: of:=IF([.D47]=1;"";[.D47]) ->  | I47: of:=IF([.E47]=1;"";[.E47]) -> 
A48: 7 | B48: strncat: &"m"{\0,\x01,\x01,\x01,\x01,\x01,\x01,\x01,\x01} &"v"{\0,p,l,\0} 4 :=> &"mv"{\0,p,u,z,v,d,r,\0} | C48: 1 | D48: 1 | E48: 0.169938 | G48: of:=IF([.C48]=1;"";[.C48]) ->  | H48: of:=IF([.D48]=1;"";[.D48]) ->  | I48: of:=IF([.E48]=1;"";[.E48]) -> 0.169938
A49: 8 | B49: strncat: &"a"{\0,\x01,\x01,\x01,\x01,\x01,\x01,\x01,\x01} &"fi"{\0,p,\0} 4 :=> &"afi"{\0,p,z,p,h,c,\0} | C49: 1 | D49: 0.217558 | E49: 0.0851279 | G49: of:=IF([.C49]=1;"";[.C49]) ->  | H49: of:=IF([.D49]=1;"";[.D49]) -> 0.217558 | I49: of:=IF([.E49]=1;"";[.E49]) -> 0.0851279
A50: 9 | B50: strncat: &"c"{\0,\x01,\x01,\x01,\x01,\x01,\x01,\x01,\x01} &"rdx"{\0,\0} 4 :=> &"crdx"{\0,p,t,e,w,\0} | C50: 1 | D50: 0 | E50: 0 | G50: of:=IF([.C50]=1;"";[.C50]) ->  | H50: of:=IF([.D50]=1;"";[.D50]) -> 0 | I50: of:=IF([.E50]=1;"";[.E50]) -> 0
A51: 10 | B51: strncat: &"l"{\0,\x01,\x01,\x01,\x01,\x01,\x01,\x01,\x01} &"blxo"{\0} 4 :=> &"lblxo"{\0,p,v,y,\0} | C51: 1 | D51: 0.0353421 | E51: 0.022751 | G51: of:=IF([.C51]=1;"";[.C51]) ->  | H51: of:=IF([.D51]=1;"";[.D51]) -> 0.0353421 | I51: of:=IF([.E51]=1;"";[.E51]) -> 0.022751
A52: 11 | B52: strncat: &"bt"{\0,\x01,\x01,\x01,\x01,\x01,\x01,\x01} &""{\0,p,d,i,\0} 4 :=> &"bt"{\0,p,g,f,p,p,q,\0} | C52: 0.200124 | D52: 1 | E52: 0.200124 | G52: of:=IF([.C52]=1;"";[.C52]) -> 0.200124 | H52: of:=IF([.D52]=1;"";[.D52]) ->  | I52: of:=IF([.E52]=1;"";[.E52]) -> 0.200124
A53: 12 | B53: strncat: &"kd"{\0,\x01,\x01,\x01,\x01,\x01,\x01,\x01} &"x"{\0,p,g,\0} 4 :=> &"kdx"{\0,p,v,e,n,d,\0} | C53: 0.188031 | D53: 1 | E53: 0 | G53: of:=IF([.C53]=1;"";[.C53]) -> 0.188031 | H53: of:=IF([.D53]=1;"";[.D53]) ->  | I53: of:=IF([.E53]=1;"";[.E53]) -> 0
A54: 13 | B54: strncat: &"mb"{\0,\x01,\x01,\x01,\x01,\x01,\x01,\x01} &"cp"{\0,p,\0} 4 :=> &"mbcp"{\0,p,e,r,x,\0} | C54: 0.211853 | D54: 0.163112 | E54: 0.0347589 | G54: of:=IF([.C54]=1;"";[.C54]) -> 0.211853 | H54: of:=IF([.D54]=1;"";[.D54]) -> 0.163112 | I54: of:=IF([.E54]=1;"";[.E54]) -> 0.0347589
A55: 14 | B55: strncat: &"js"{\0,\x01,\x01,\x01,\x01,\x01,\x01,\x01} &"iiw"{\0,\0} 4 :=> &"jsiiw"{\0,p,u,x,\0} | C55: 0.144251 | D55: 0.0700644 | E55: 0.020863 | G55: of:=IF([.C55]=1;"";[.C55]) -> 0.144251 | H55: of:=IF([.D55]=1;"";[.D55]) -> 0.0700644 | I55: of:=IF([.E55]=1;"";[.E55]) -> 0.020863
A56: 15 | B56: strncat: &"qo"{\0,\x01,\x01,\x01,\x01,\x01,\x01,\x01} &"pyob"{\0} 4 :=> &"qopyob"{\0,p,h,\0} | C56: 0 | D56: 0.0434454 | E56: 0 | G56: of:=IF([.C56]=1;"";[.C56]) -> 0 | H56: of:=IF([.D56]=1;"";[.D56]) -> 0.0434454 | I56: of:=IF([.E56]=1;"";[.E56]) -> 0
A57: 16 | B57: strncat: &"pzy"{\0,\x01,\x01,\x01,\x01,\x01,\x01} &""{\0,p,h,h,\0} 4 :=> &"pzy"{\0,p,i,m,n,l,\0} | C57: 0.0620163 | D57: 1 | E57: 0.0620163 | G57: of:=IF([.C57]=1;"";[.C57]) -> 0.0620163 | H57: of:=IF([.D57]=1;"";[.D57]) ->  | I57: of:=IF([.E57]=1;"";[.E57]) -> 0.0620163
A58: 17 | B58: strncat: &"wrl"{\0,\x01,\x01,\x01,\x01,\x01,\x01} &"h"{\0,p,s,\0} 4 :=> &"wrlh"{\0,p,k,w,z,\0} | C58: 0.0817344 | D58: 1 | E58: 0.0412557 | G58: of:=IF([.C58]=1;"";[.C58]) -> 0.0817344 | H58: of:=IF([.D58]=1;"";[.D58]) ->  | I58: of:=IF([.E58]=1;"";[.E58]) -> 0.0412557
A59: 18 | B59: strncat: &"bzh"{\0,\x01,\x01,\x01,\x01,\x01,\x01} &"kz"{\0,p,\0} 4 :=> &"bzhkz"{\0,p,p,x,\0} | C59: 0.0571003 | D59: 0.148166 | E59: 0.0164466 | G59: of:=IF([.C59]=1;"";[.C59]) -> 0.0571003 | H59: of:=IF([.D59]=1;"";[.D59]) -> 0.148166 | I59: of:=IF([.E59]=1;"";[.E59]) -> 0.0164466
A60: 19 | B60: strncat: &"yfu"{\0,\x01,\x01,\x01,\x01,\x01,\x01} &"aws"{\0,\0} 4 :=> &"yfuaws"{\0,p,f,\0} | C60: 0.0749366 | D60: 0.0820615 | E60: 0.0191445 | G60: of:=IF([.C60]=1;"";[.C60]) -> 0.0749366 | H60: of:=IF([.D60]=1;"";[.D60]) -> 0.0820615 | I60: of:=IF([.E60]=1;"";[.E60]) -> 0.0191445
A61: 20 | B61: strncat: &"juj"{\0,\x01,\x01,\x01,\x01,\x01,\x01} &"xydl"{\0} 4 :=> &"jujxydl"{\0,p,\0} | C61: 0.0734693 | D61: 0.0380523 | E61: 0 | G61: of:=IF([.C61]=1;"";[.C61]) -> 0.0734693 | H61: of:=IF([.D61]=1;"";[.D61]) -> 0.0380523 | I61: of:=IF([.E61]=1;"";[.E61]) -> 0
A62: 21 | B62: strncat: &"cdiy"{\0,\x01,\x01,\x01,\x01,\x01} &""{\0,p,d,l,\0} 4 :=> &"cdiy"{\0,p,a,k,o,\0} | C62: 0.03826 | D62: 1 | E62: 0.03826 | G62: of:=IF([.C62]=1;"";[.C62]) -> 0.03826 | H62: of:=IF([.D62]=1;"";[.D62]) ->  | I62: of:=IF([.E62]=1;"";[.E62]) -> 0.03826
A63: 22 | B63: strncat: &"pjwv"{\0,\x01,\x01,\x01,\x01,\x01} &"z"{\0,p,p,\0} 4 :=> &"pjwvz"{\0,p,f,y,\0} | C63: 0 | D63: 1 | E63: 0 | G63: of:=IF([.C63]=1;"";[.C63]) -> 0 | H63: of:=IF([.D63]=1;"";[.D63]) ->  | I63: of:=IF([.E63]=1;"";[.E63]) -> 0
A64: 23 | B64: strncat: &"vibw"{\0,\x01,\x01,\x01,\x01,\x01} &"uv"{\0,p,\0} 4 :=> &"vibwuv"{\0,p,t,\0} | C64: 0.0419765 | D64: 0.192605 | E64: 0.0168978 | G64: of:=IF([.C64]=1;"";[.C64]) -> 0.0419765 | H64: of:=IF([.D64]=1;"";[.D64]) -> 0.192605 | I64: of:=IF([.E64]=1;"";[.E64]) -> 0.0168978
A65: 24 | B65: strncat: &"cdbg"{\0,\x01,\x01,\x01,\x01,\x01} &"uhv"{\0,\0} 4 :=> &"cdbguhv"{\0,p,\0} | C65: 0.0316378 | D65: 0.0649378 | E65: 0.0109754 | G65: of:=IF([.C65]=1;"";[.C65]) -> 0.0316378 | H65: of:=IF([.D65]=1;"";[.D65]) -> 0.0649378 | I65: of:=IF([.E65]=1;"";[.E65]) -> 0.0109754
A66: 25 | B66: strncat: &"jvyu"{\0,\x01,\x01,\x01,\x01,\x01} &"kahx"{\0} 4 :=> &"jvyukahx"{\0,\0} | C66: 0.0250197 | D66: 0 | E66: 0 | G66: of:=IF([.C66]=1;"";[.C66]) -> 0.0250197 | H66: of:=IF([.D66]=1;"";[.D66]) -> 0 | I66: of:=IF([.E66]=1;"";[.E66]) -> 0
A67: 26 | B67: strncat: &"phrig"{\0,\x01,\x01,\x01,\x01} &""{\0,p,s,n,\0} 4 :=> &"phrig"{\0,p,e,a,\0} | C67: 0.0297757 | D67: 1 | E67: 0.0297757 | G67: of:=IF([.C67]=1;"";[.C67]) -> 0.0297757 | H67: of:=IF([.D67]=1;"";[.D67]) ->  | I67: of:=IF([.E67]=1;"";[.E67]) -> 0.0297757
A68: 27 | B68: strncat: &"yrwjk"{\0,\x01,\x01,\x01,\x01} &"y"{\0,p,h,\0} 4 :=> &"yrwjky"{\0,p,j,\0} | C68: 0 | D68: 1 | E68: 0 | G68: of:=IF([.C68]=1;"";[.C68]) -> 0 | H68: of:=IF([.D68]=1;"";[.D68]) ->  | I68: of:=IF([.E68]=1;"";[.E68]) -> 0
A69: 28 | B69: strncat: &"ugxjz"{\0,\x01,\x01,\x01,\x01} &"lz"{\0,p,\0} 4 :=> &"ugxjzlz"{\0,p,\0} | C69: 0 | D69: 0.185207 | E69: 0 | G69: of:=IF([.C69]=1;"";[.C69]) -> 0 | H69: of:=IF([.D69]=1;"";[.D69]) -> 0.185207 | I69: of:=IF([.E69]=1;"";[.E69]) -> 0
A70: 29 | B70: strncat: &"nbkbr"{\0,\x01,\x01,\x01,\x01} &"fke"{\0,\0} 4 :=> &"nbkbrfke"{\0,\0} | C70: 0.0222573 | D70: 0.0744407 | E70: 0.0101131 | G70: of:=IF([.C70]=1;"";[.C70]) -> 0.0222573 | H70: of:=IF([.D70]=1;"";[.D70]) -> 0.0744407 | I70: of:=IF([.E70]=1;"";[.E70]) -> 0.0101131
A71: 30 | B71: strncat: &"vluwq"{\0,\x01,\x01,\x01,\x01} &"wwpb"{\0} 4 :=> &"vluwqwwpb"{\0} | C71: 0.0189701 | D71: 0.0300663 | E71: 0.0052575 | G71: of:=IF([.C71]=1;"";[.C71]) -> 0.0189701 | H71: of:=IF([.D71]=1;"";[.D71]) -> 0.0300663 | I71: of:=IF([.E71]=1;"";[.E71]) -> 0.0052575
A72: 31 | B72: strncat: &"psqjjq"{\0,\x01,\x01,\x01} &""{\0,p,y,m,\0} 4 :=> &"psqjjq"{\0,p,w,\0} | C72: 0 | D72: 1 | E72: 0 | G72: of:=IF([.C72]=1;"";[.C72]) -> 0 | H72: of:=IF([.D72]=1;"";[.D72]) ->  | I72: of:=IF([.E72]=1;"";[.E72]) -> 0
A73: 32 | B73: strncat: &"xwgupc"{\0,\x01,\x01,\x01} &"i"{\0,p,u,\0} 4 :=> &"xwgupci"{\0,p,\0} | C73: 0.0156793 | D73: 1 | E73: 0.0126072 | G73: of:=IF([.C73]=1;"";[.C73]) -> 0.0156793 | H73: of:=IF([.D73]=1;"";[.D73]) ->  | I73: of:=IF([.E73]=1;"";[.E73]) -> 0.0126072
A74: 33 | B74: strncat: &"adkagl"{\0,\x01,\x01,\x01} &"dw"{\0,p,\0} 4 :=> &"adkagldw"{\0,\0} | C74: 0.0189563 | D74: 0.201345 | E74: 0.0119897 | G74: of:=IF([.C74]=1;"";[.C74]) -> 0.0189563 | H74: of:=IF([.D74]=1;"";[.D74]) -> 0.201345 | I74: of:=IF([.E74]=1;"";[.E74]) -> 0.0119897
A75: 34 | B75: strncat: &"mcazxf"{\0,\x01,\x01,\x01} &"gro"{\0,\0} 4 :=> &"mcazxfgro"{\0} | C75: 0 | D75: 0.0874901 | E75: 0 | G75: of:=IF([.C75]=1;"";[.C75]) -> 0 | H75: of:=IF([.D75]=1;"";[.D75]) -> 0.0874901 | I75: of:=IF([.E75]=1;"";[.E75]) -> 0
A76: 35 | B76: strncat: &"sykkcp"{\0,\x01,\x01,\x01} &&10 4 :=> &"sykkcpbzmy"{} | C76: 0.0140393 | D76: 0.00597382 | G76: of:=IF([.C76]=1;"";[.C76]) -> 0.0140393 | H76: of:=IF([.D76]=1;"";[.D76]) -> 0.00597382 | I76: of:=IF([.E76]=1;"";[.E76]) ->  
A77: 36 | B77: strncat: &"yiyghfp"{\0,\x01,\x01} &""{\0,p,w,b,\0} 4 :=> &"yiyghfp"{\0,p,\0} | C77: 0.0118804 | D77: 1 | E77: 0.0118804 | G77: of:=IF([.C77]=1;"";[.C77]) -> 0.0118804 | H77: of:=IF([.D77]=1;"";[.D77]) ->  | I77: of:=IF([.E77]=1;"";[.E77]) -> 0.0118804
A78: 37 | B78: strncat: &"yincaav"{\0,\x01,\x01} &"r"{\0,p,m,\0} 4 :=> &"yincaavr"{\0,\0} | C78: 0.016274 | D78: 1 | E78: 0.0125104 | G78: of:=IF([.C78]=1;"";[.C78]) -> 0.016274 | H78: of:=IF([.D78]=1;"";[.D78]) ->  | I78: of:=IF([.E78]=1;"";[.E78]) -> 0.0125104
A79: 38 | B79: strncat: &"yozexgl"{\0,\x01,\x01} &"qh"{\0,p,\0} 4 :=> &"yozexglqh"{\0} | C79: 0.0119346 | D79: 0 | E79: 0 | G79: of:=IF([.C79]=1;"";[.C79]) -> 0.0119346 | H79: of:=IF([.D79]=1;"";[.D79]) -> 0 | I79: of:=IF([.E79]=1;"";[.E79]) -> 0
A80: 39 | B80: strncat: &"agfrwlvh"{\0,\x01} &""{\0,p,f,j,\0} 4 :=> &"agfrwlvh"{\0,\0} | C80: 0.00967416 | D80: 1 | E80: 0.00967416 | G80: of:=IF([.C80]=1;"";[.C80]) -> 0.00967416 | H80: of:=IF([.D80]=1;"";[.D80]) ->  | I80: of:=IF([.E80]=1;"";[.E80]) -> 0.00967416
A81: 40 | B81: strncat: &"nzyaieef"{\0,\x01} &"m"{\0,p,p,\0} 4 :=> &"nzyaieefm"{\0} | C81: 0.012432 | D81: 1 | E81: 0.0100365 | G81: of:=IF([.C81]=1;"";[.C81]) -> 0.012432 | H81: of:=IF([.D81]=1;"";[.D81]) ->  | I81: of:=IF([.E81]=1;"";[.E81]) -> 0.0100365
A82: 41 | B82: strncat: &"qunyluyyh"{\0} &""{\0,p,w,e,\0} 4 :=> &"qunyluyyh"{\0} | C82: 0.00928472 | D82: 1 | E82: 0.00928472 | G82: of:=IF([.C82]=1;"";[.C82]) -> 0.00928472 | H82: of:=IF([.D82]=1;"";[.D82]) ->  | I82: of:=IF([.E82]=1;"";[.E82]) -> 0.00928472

Sheet: strstr
A1: # | B1: Test Case | C1: N | G1: N1 | H1: N2 | I1: N3
A2: 1 | B2: strstr: &"e"{\0,h,y,r,\0} &"e"{\0,\0} :=> &"e"{\0,h,y,r,\0} | C2: 1 | D2: 1 | E2: 1 | G2: of:=IF([.C2]=1;"";[.C2]) ->  | H2: of:=IF([.D2]=1;"";[.D2]) ->  | I2: of:=IF([.E2]=1;"";[.E2]) ->  | K2: of:=AVERAGE([.G2:.G19]) -> 0.0664546176470588 | L2: of:=AVERAGE([.H2:.H19]) -> 0.199966666666667 | M2: of:=AVERAGE([.I2:.I19]) -> 0.0920705875 | O2: of:=AVERAGE([.K2:.M2]) -> 0.119497290604575
A3: 2 | B3: strstr: &"cb"{\0,h,v,\0} &"c"{\0,\0} :=> &"cb"{\0,h,v,\0} | C3: 0.166477 | D3: 1 | E3: 0.166477 | G3: of:=IF([.C3]=1;"";[.C3]) -> 0.166477 | H3: of:=IF([.D3]=1;"";[.D3]) ->  | I3: of:=IF([.E3]=1;"";[.E3]) -> 0.166477
A4: 3 | B4: strstr: &"uw"{\0,b,w,\0} &"w"{\0,\0} :=> &"w"{\0,b,w,\0,54} | C4: 0.186527 | D4: 1 | E4: 1 | G4: of:=IF([.C4]=1;"";[.C4]) -> 0.186527 | H4: of:=IF([.D4]=1;"";[.D4]) ->  | I4: of:=IF([.E4]=1;"";[.E4]) -> 
A5: 4 | B5: strstr: &"ltq"{\0,h,\0} &"l"{\0,\0} :=> &"ltq"{\0,h,\0} | C5: 0.0596202 | D5: 1 | E5: 0.0596202 | G5: of:=IF([.C5]=1;"";[.C5]) -> 0.0596202 | H5: of:=IF([.D5]=1;"";[.D5]) ->  | I5: of:=IF([.E5]=1;"";[.E5]) -> 0.0596202
A6: 5 | B6: strstr: &"nzl"{\0,b,\0} &"z"{\0,\0} :=> &"zl"{\0,b,\0,54} | C6: 0.0718057 | D6: 1 | E6: 0.190189 | G6: of:=IF([.C6]=1;"";[.C6]) -> 0.0718057 | H6: of:=IF([.D6]=1;"";[.D6]) ->  | I6: of:=IF([.E6]=1;"";[.E6]) -> 0.190189
A7: 6 | B7: strstr: &"znbh"{\0,\0} &"z"{\0,\0} :=> &"znbh"{\0,\0} | C7: 0.0334402 | D7: 1 | E7: 0.0334402 | G7: of:=IF([.C7]=1;"";[.C7]) -> 0.0334402 | H7: of:=IF([.D7]=1;"";[.D7]) ->  | I7: of:=IF([.E7]=1;"";[.E7]) -> 0.0334402
A8: 7 | B8: strstr: &"lkng"{\0,\0} &"k"{\0,\0} :=> &"kng"{\0,\0,54} | C8: 0.0449367 | D8: 1 | E8: 0.0855581 | G8: of:=IF([.C8]=1;"";[.C8]) -> 0.0449367 | H8: of:=IF([.D8]=1;"";[.D8]) ->  | I8: of:=IF([.E8]=1;"";[.E8]) -> 0.0855581
A9: 8 | B9: strstr: &"qhnun"{\0} &"q"{\0,\0} :=> &"qhnun"{\0} | C9: 0 | D9: 1 | E9: 0 | G9: of:=IF([.C9]=1;"";[.C9]) -> 0 | H9: of:=IF([.D9]=1;"";[.D9]) ->  | I9: of:=IF([.E9]=1;"";[.E9]) -> 0
A10: 9 | B10: strstr: &"vdgci"{\0} &"d"{\0,\0} :=> &"dgci"{\0,54} | C10: 0.0215695 | D10: 1 | E10: 0.0374237 | G10: of:=IF([.C10]=1;"";[.C10]) -> 0.0215695 | H10: of:=IF([.D10]=1;"";[.D10]) ->  | I10: of:=IF([.E10]=1;"";[.E10]) -> 0.0374237
A11: 10 | B11: strstr: &"bw"{\0,d,y,\0} &"bw"{\0} :=> &"bw"{\0,d,y,\0} | C11: 0.187534 | D11: 0.187534 | E11: 0.187534 | G11: of:=IF([.C11]=1;"";[.C11]) -> 0.187534 | H11: of:=IF([.D11]=1;"";[.D11]) -> 0.187534 | I11: of:=IF([.E11]=1;"";[.E11]) -> 0.187534
A12: 11 | B12: strstr: &"ggw"{\0,d,\0} &"gg"{\0} :=> &"ggw"{\0,d,\0} | C12: 0.0726328 | D12: 0.206023 | E12: 0.0726328 | G12: of:=IF([.C12]=1;"";[.C12]) -> 0.0726328 | H12: of:=IF([.D12]=1;"";[.D12]) -> 0.206023 | I12: of:=IF([.E12]=1;"";[.E12]) -> 0.0726328
A13: 12 | B13: strstr: &"ssr"{\0,a,\0} &"sr"{\0} :=> &"sr"{\0,a,\0,54} | C13: 0.0822767 | D13: 0.201288 | E13: 0.201288 | G13: of:=IF([.C13]=1;"";[.C13]) -> 0.0822767 | H13: of:=IF([.D13]=1;"";[.D13]) -> 0.201288 | I13: of:=IF([.E13]=1;"";[.E13]) -> 0.201288
A14: 13 | B14: strstr: &"rdb"{\0,p,\0} &"db"{\0} :=> &"db"{\0,p,\0,54} | C14: 0.0786708 | D14: 0.192737 | E14: 0.192737 | G14: of:=IF([.C14]=1;"";[.C14]) -> 0.0786708 | H14: of:=IF([.D14]=1;"";[.D14]) -> 0.192737 | I14: of:=IF([.E14]=1;"";[.E14]) -> 0.192737
A15: 14 | B15: strstr: &"mefh"{\0,\0} &"me"{\0} :=> &"mefh"{\0,\0} | C15: 0.0389312 | D15: 0.22156 | E15: 0.0389312 | G15: of:=IF([.C15]=1;"";[.C15]) -> 0.0389312 | H15: of:=IF([.D15]=1;"";[.D15]) -> 0.22156 | I15: of:=IF([.E15]=1;"";[.E15]) -> 0.0389312
A16: 15 | B16: strstr: &"bbcc"{\0,\0} &"bc"{\0} :=> &"bcc"{\0,\0,54} | C16: 0.0400114 | D16: 0.187534 | E16: 0.0753045 | G16: of:=IF([.C16]=1;"";[.C16]) -> 0.0400114 | H16: of:=IF([.D16]=1;"";[.D16]) -> 0.187534 | I16: of:=IF([.E16]=1;"";[.E16]) -> 0.0753045
A17: 16 | B17: strstr: &"qprj"{\0,\0} &"pr"{\0} :=> &"prj"{\0,\0,54} | C17: 0 | D17: 0.218916 | E17: 0.0752489 | G17: of:=IF([.C17]=1;"";[.C17]) -> 0 | H17: of:=IF([.D17]=1;"";[.D17]) -> 0.218916 | I17: of:=IF([.E17]=1;"";[.E17]) -> 0.0752489
A18: 17 | B18: strstr: &"xwqug"{\0} &"xw"{\0} :=> &"xwqug"{\0} | C18: 0.0210159 | D18: 0.184161 | E18: 0.0210159 | G18: of:=IF([.C18]=1;"";[.C18]) -> 0.0210159 | H18: of:=IF([.D18]=1;"";[.D18]) -> 0.184161 | I18: of:=IF([.E18]=1;"";[.E18]) -> 0.0210159
A19: 18 | B19: strstr: &"llwbh"{\0} &"lw"{\0} :=> &"lwbh"{\0,54} | C19: 0.0242794 | D19: 0.199947 | E19: 0.0357289 | G19: of:=IF([.C19]=1;"";[.C19]) -> 0.0242794 | H19: of:=IF([.D19]=1;"";[.D19]) -> 0.199947 | I19: of:=IF([.E19]=1;"";[.E19]) -> 0.0357289
A20: 19 | B20: strstr: &"xhexh"{\0} &"he"{\0} :=> &"hexh"{\0,54} | C20: 0.0275517 | D20: 0.226983 | E20: 0.0449507 | G20: of:=IF([.C20]=1;"";[.C20]) -> 0.0275517 | H20: of:=IF([.D20]=1;"";[.D20]) -> 0.226983 | I20: of:=IF([.E20]=1;"";[.E20]) -> 0.0449507 | K20: of:=AVERAGE([.G20:.G24]) -> 0.02530116 | L20: of:=AVERAGE([.H20:.H24]) -> 0.205155 | M20: of:=AVERAGE([.I20:.I24]) -> 0.03204078 | O20: of:=AVERAGE([.K20:.M20]) -> 0.08749898
A21: 1 | B21: strnstr: &"gcovu"{\0} &""{\0,p,\0} 2 :=> &"gcovu"{\0} | C21: 0.0239155 | D21: 1 | E21: 0.0239155 | G21: of:=IF([.C21]=1;"";[.C21]) -> 0.0239155 | H21: of:=IF([.D21]=1;"";[.D21]) ->  | I21: of:=IF([.E21]=1;"";[.E21]) -> 0.0239155
A22: 2 | B22: strnstr: &"ufokn"{\0} &"u"{\0,\0} 2 :=> &"ufokn"{\0} | C22: 0.0283912 | D22: 1 | E22: 0.0283912 | G22: of:=IF([.C22]=1;"";[.C22]) -> 0.0283912 | H22: of:=IF([.D22]=1;"";[.D22]) ->  | I22: of:=IF([.E22]=1;"";[.E22]) -> 0.0283912
A23: 3 | B23: strnstr: &"kgbop"{\0} &"g"{\0,\0} 2 :=> &"gbop"{\0,54} | C23: 0.0247892 | D23: 1 | E23: 0.0410883 | G23: of:=IF([.C23]=1;"";[.C23]) -> 0.0247892 | H23: of:=IF([.D23]=1;"";[.D23]) ->  | I23: of:=IF([.E23]=1;"";[.E23]) -> 0.0410883
A24: 4 | B24: strnstr: &"xymhk"{\0} &"xy"{\0} 2 :=> &"xymhk"{\0} | C24: 0.0218582 | D24: 0.183327 | E24: 0.0218582 | G24: of:=IF([.C24]=1;"";[.C24]) -> 0.0218582 | H24: of:=IF([.D24]=1;"";[.D24]) -> 0.183327 | I24: of:=IF([.E24]=1;"";[.E24]) -> 0.0218582
A25: 1 | B25: strpbrk: &"guyzw"{\0} &"aeiou"{\0} :=> &"uyzw"{\0,54} | C25: 0.0235886 | D25: 0.0299288 | E25: 0.0356021 | G25: of:=IF([.C25]=1;"";[.C25]) -> 0.0235886 | H25: of:=IF([.D25]=1;"";[.D25]) -> 0.0299288 | I25: of:=IF([.E25]=1;"";[.E25]) -> 0.0356021 | K25: of:=AVERAGE([.G25:.G34]) -> 0.0190133 | L25: of:=AVERAGE([.H25:.H34]) -> 0.0299288 | M25: of:=AVERAGE([.I25:.I34]) -> 0.02478575 | O25: of:=AVERAGE([.K25:.M25]) -> 0.02457595
A26: 2 | B26: strpbrk: &"wotqp"{\0} &"aeiou"{\0} :=> &"otqp"{\0,54} | C26: 0 | D26: 0.0299288 | E26: 0 | G26: of:=IF([.C26]=1;"";[.C26]) -> 0 | H26: of:=IF([.D26]=1;"";[.D26]) -> 0.0299288 | I26: of:=IF([.E26]=1;"";[.E26]) -> 0
A27: 3 | B27: strpbrk: &"wivub"{\0} &"aeiou"{\0} :=> &"ivub"{\0,54} | C27: 0.0278461 | D27: 0.0299288 | E27: 0.0422639 | G27: of:=IF([.C27]=1;"";[.C27]) -> 0.0278461 | H27: of:=IF([.D27]=1;"";[.D27]) -> 0.0299288 | I27: of:=IF([.E27]=1;"";[.E27]) -> 0.0422639
A28: 4 | B28: strpbrk: &"sehum"{\0} &"aeiou"{\0} :=> &"ehum"{\0,54} | C28: 0.0289436 | D28: 0.0299288 | E28: 0.0437443 | G28: of:=IF([.C28]=1;"";[.C28]) -> 0.0289436 | H28: of:=IF([.D28]=1;"";[.D28]) -> 0.0299288 | I28: of:=IF([.E28]=1;"";[.E28]) -> 0.0437443
A29: 5 | B29: strpbrk: &"maero"{\0} &"aeiou"{\0} :=> &"aero"{\0,54} | C29: 0.0306527 | D29: 0.0299288 | E29: 0.0471452 | G29: of:=IF([.C29]=1;"";[.C29]) -> 0.0306527 | H29: of:=IF([.D29]=1;"";[.D29]) -> 0.0299288 | I29: of:=IF([.E29]=1;"";[.E29]) -> 0.0471452
A30: 6 | B30: strpbrk: &"ucnit"{\0} &"aeiou"{\0} :=> &"ucnit"{\0} | C30: 0.0272032 | D30: 0.0299288 | E30: 0.0272032 | G30: of:=IF([.C30]=1;"";[.C30]) -> 0.0272032 | H30: of:=IF([.D30]=1;"";[.D30]) -> 0.0299288 | I30: of:=IF([.E30]=1;"";[.E30]) -> 0.0272032
A31: 7 | B31: strpbrk: &"ogozv"{\0} &"aeiou"{\0} :=> &"ogozv"{\0} | C31: 0.0248692 | D31: 0.0299288 | E31: 0.0248692 | G31: of:=IF([.C31]=1;"";[.C31]) -> 0.0248692 | H31: of:=IF([.D31]=1;"";[.D31]) -> 0.0299288 | I31: of:=IF([.E31]=1;"";[.E31]) -> 0.0248692
A32: 8 | B32: strpbrk: &"igbxm"{\0} &"aeiou"{\0} :=> &"igbxm"{\0} | C32: 0 | D32: 0.0299288 | E32: 0 | G32: of:=IF([.C32]=1;"";[.C32]) -> 0 | H32: of:=IF([.D32]=1;"";[.D32]) -> 0.0299288 | I32: of:=IF([.E32]=1;"";[.E32]) -> 0
A33: 9 | B33: strpbrk: &"etptn"{\0} &"aeiou"{\0} :=> &"etptn"{\0} | C33: 0.0270296 | D33: 0.0299288 | E33: 0.0270296 | G33: of:=IF([.C33]=1;"";[.C33]) -> 0.0270296 | H33: of:=IF([.D33]=1;"";[.D33]) -> 0.0299288 | I33: of:=IF([.E33]=1;"";[.E33]) -> 0.0270296
A34: 10 | B34: strpbrk: &"aubqr"{\0} &"aeiou"{\0} :=> &"aubqr"{\0} | C34: 0 | D34: 0.0299288 | E34: 0 | G34: of:=IF([.C34]=1;"";[.C34]) -> 0 | H34: of:=IF([.D34]=1;"";[.D34]) -> 0.0299288 | I34: of:=IF([.E34]=1;"";[.E34]) -> 0