Sheet: strlen
A1: strlen: &"\x01"{\0,\0,\0,\0,\0} :=> 1; | J1: # | K1: Test Case | L1: N | P1: FINAL
A2: strlen: &"\x01\x01"{\0,\0,\0,\0} :=> 2; | J2: 1 | K2: strlen: &"n"{\0,p,a,t,\0} :=> 1 | L2: 1 | N2: of:=IF([.L2]=1;"";[.L2]) ->  | P2: of:=AVERAGE([.N2:.N6]) -> 0.08117485
A3: strlen: &"\x01\x01\x01"{\0,\0,\0} :=> 3; | J3: 2 | K3: strlen: &"it"{\0,p,h,\0} :=> 2 | L3: 0.222847 | N3: of:=IF([.L3]=1;"";[.L3]) -> 0.222847
A4: strlen: &"\x01\x01\x01\x01"{\0,\0} :=> 4; | J4: 3 | K4: strlen: &"bao"{\0,p,\0} :=> 3 | L4: 0.0793578 | N4: of:=IF([.L4]=1;"";[.L4]) -> 0.0793578
A5: strlen: &"\x01\x01\x01\x01\x01"{\0} :=> 5; | J5: 4 | K5: strlen: &"dqrt"{\0,\0} :=> 4 | L5: 0 | N5: of:=IF([.L5]=1;"";[.L5]) -> 0
A6: strnlen: &""{\0,\0,\0,\0,\0,\0} 6 :=> 0; 1; | J6: 5 | K6: strlen: &"udkwp"{\0} :=> 5 | L6: 0.0224946 | N6: of:=IF([.L6]=1;"";[.L6]) -> 0.0224946
A7: strnlen: &"\x01"{\0,\0,\0,\0,\0} 6 :=> 1; | J7: 1 | K7: strnlen: &""{\0,p,z,l,n,\0} 6 :=> 0 | L7: 1 | N7: of:=IF([.L7]=1;"";[.L7]) ->  | P7: of:=AVERAGE([.N7:.N12]) -> 0.078651175
A8: strnlen: &"\x01\x01"{\0,\0,\0,\0} 6 :=> 2; | J8: 2 | K8: strnlen: &"o"{\0,p,l,a,\0} 6 :=> 1 | L8: 1 | N8: of:=IF([.L8]=1;"";[.L8]) -> 
A9: strnlen: &"\x01\x01\x01"{\0,\0,\0} 6 :=> 3; | J9: 3 | K9: strnlen: &"nj"{\0,p,j,\0} 6 :=> 2 | L9: 0.199415 | N9: of:=IF([.L9]=1;"";[.L9]) -> 0.199415
A10: strnlen: &"\x01\x01\x01\x01"{\0,\0} 6 :=> 4; | J10: 4 | K10: strnlen: &"mwl"{\0,p,\0} 6 :=> 3 | L10: 0.0687027 | N10: of:=IF([.L10]=1;"";[.L10]) -> 0.0687027
A11: strnlen: &"\x01\x01\x01\x01\x01"{\0} 6 :=> 5; | J11: 5 | K11: strnlen: &"omqw"{\0,\0} 6 :=> 4 | L11: 0.020785 | N11: of:=IF([.L11]=1;"";[.L11]) -> 0.020785
J12: 6 | K12: strnlen: &"psfmb"{\0} 6 :=> 5 | L12: 0.025702 | N12: of:=IF([.L12]=1;"";[.L12]) -> 0.025702

Sheet: strcmp
A1: # | B1: Test Case | C1: N1 | D1: N2 | L1: FINAL
A2: 1 | B2: strcmp: &"e"{\0,p,c,v,\0} &"e"{\0,p,y,g,\0} :=> 0 | C2: 1 | D2: 1 | F2: of:=IF([.C2]=1;"";[.C2]) ->  | G2: of:=IF([.D2]=1;"";[.D2]) ->  | H2: of:=IF([.E2]=1;"";[.E2]) ->   | I2: of:=AVERAGE([.F2:.F16]) -> 0.03650505 | J2: of:=AVERAGE([.G2:.G16]) -> 0.0384541214285714 | L2: of:=AVERAGE([.I2:.J2]) -> 0.0374795857142857
A3: 2 | B3: strcmp: &"np"{\0,p,q,\0} &"np"{\0,p,d,\0} :=> 0 | C3: 0.196565 | D3: 0.196565 | F3: of:=IF([.C3]=1;"";[.C3]) -> 0.196565 | G3: of:=IF([.D3]=1;"";[.D3]) -> 0.196565 | H3: of:=IF([.E3]=1;"";[.E3]) ->  
A4: 3 | B4: strcmp: &"fep"{\0,p,\0} &"fep"{\0,p,\0} :=> 0 | C4: 0.0857871 | D4: 0.0857871 | F4: of:=IF([.C4]=1;"";[.C4]) -> 0.0857871 | G4: of:=IF([.D4]=1;"";[.D4]) -> 0.0857871 | H4: of:=IF([.E4]=1;"";[.E4]) ->  
A5: 4 | B5: strcmp: &"blam"{\0,\0} &"blam"{\0,\0} :=> 0 | C5: 0.04745 | D5: 0.04745 | F5: of:=IF([.C5]=1;"";[.C5]) -> 0.04745 | G5: of:=IF([.D5]=1;"";[.D5]) -> 0.04745 | H5: of:=IF([.E5]=1;"";[.E5]) ->  
A6: 5 | B6: strcmp: &"mkgra"{\0} &"mkgra"{\0} :=> 0 | C6: 0.0242704 | D6: 0.0242704 | F6: of:=IF([.C6]=1;"";[.C6]) -> 0.0242704 | G6: of:=IF([.D6]=1;"";[.D6]) -> 0.0242704 | H6: of:=IF([.E6]=1;"";[.E6]) ->  
A7: 6 | B7: strcmp: &"nhqus"{\0} &"nhqul"{\0} :=> 1 | C7: 0.0259011 | D7: 0.025779 | F7: of:=IF([.C7]=1;"";[.C7]) -> 0.0259011 | G7: of:=IF([.D7]=1;"";[.D7]) -> 0.025779 | H7: of:=IF([.E7]=1;"";[.E7]) ->  
A8: 7 | B8: strcmp: &"vbvzv"{\0} &"vbvzy"{\0} :=> -1 | C8: 0 | D8: 0 | F8: of:=IF([.C8]=1;"";[.C8]) -> 0 | G8: of:=IF([.D8]=1;"";[.D8]) -> 0 | H8: of:=IF([.E8]=1;"";[.E8]) ->  
A9: 8 | B9: strcmp: &"lswxn"{\0} &"lswps"{\0} :=> 1 | C9: 0 | D9: 0.0256604 | F9: of:=IF([.C9]=1;"";[.C9]) -> 0 | G9: of:=IF([.D9]=1;"";[.D9]) -> 0.0256604 | H9: of:=IF([.E9]=1;"";[.E9]) ->  
A10: 9 | B10: strcmp: &"wytfe"{\0} &"wytgr"{\0} :=> -1 | C10: 0.026306 | D10: 0.026065 | F10: of:=IF([.C10]=1;"";[.C10]) -> 0.026306 | G10: of:=IF([.D10]=1;"";[.D10]) -> 0.026065 | H10: of:=IF([.E10]=1;"";[.E10]) ->  
A11: 10 | B11: strcmp: &"ayfrj"{\0} &"aybva"{\0} :=> 1 | C11: 0.0250224 | D11: 0.0266044 | F11: of:=IF([.C11]=1;"";[.C11]) -> 0.0250224 | G11: of:=IF([.D11]=1;"";[.D11]) -> 0.0266044 | H11: of:=IF([.E11]=1;"";[.E11]) ->  
A12: 11 | B12: strcmp: &"qhkik"{\0} &"qhwiv"{\0} :=> -1 | C12: 0 | D12: 0 | F12: of:=IF([.C12]=1;"";[.C12]) -> 0 | G12: of:=IF([.D12]=1;"";[.D12]) -> 0
A13: 12 | B13: strcmp: &"vjimz"{\0} &"vhlvq"{\0} :=> 1 | C13: 0.0154901 | D13: 0 | F13: of:=IF([.C13]=1;"";[.C13]) -> 0.0154901 | G13: of:=IF([.D13]=1;"";[.D13]) -> 0
A14: 13 | B14: strcmp: &"gwkup"{\0} &"gyefn"{\0} :=> -1 | C14: 0.0238753 | D14: 0.0258755 | F14: of:=IF([.C14]=1;"";[.C14]) -> 0.0238753 | G14: of:=IF([.D14]=1;"";[.D14]) -> 0.0258755
A15: 14 | B15: strcmp: &"zfznz"{\0} &"ksdrt"{\0} :=> 1 | C15: 0.0162401 | D15: 0.028604 | F15: of:=IF([.C15]=1;"";[.C15]) -> 0.0162401 | G15: of:=IF([.D15]=1;"";[.D15]) -> 0.028604
A16: 15 | B16: strcmp: &"ngpnm"{\0} &"ytvoy"{\0} :=> -1 | C16: 0.0241632 | D16: 0.0256969 | F16: of:=IF([.C16]=1;"";[.C16]) -> 0.0241632 | G16: of:=IF([.D16]=1;"";[.D16]) -> 0.0256969
A17: 1 | B17: strncmp: &""{\0,p,y,u,f,\0} &""{\0,p,d,v,n,\0} 5 :=> 0 | C17: 1 | D17: 1 | F17: of:=IF([.C17]=1;"";[.C17]) ->  | G17: of:=IF([.D17]=1;"";[.D17]) ->  | I17: of:=AVERAGE([.F17:.F32]) -> 0.0361966642857143 | J17: of:=AVERAGE([.G17:.G32]) -> 0.0350584142857143 | L17: of:=AVERAGE([.I17:.J17]) -> 0.0356275392857143
A18: 2 | B18: strncmp: &"x"{\0,p,r,x,\0} &"x"{\0,p,m,j,\0} 5 :=> 0 | C18: 1 | D18: 1 | F18: of:=IF([.C18]=1;"";[.C18]) ->  | G18: of:=IF([.D18]=1;"";[.D18]) -> 
A19: 3 | B19: strncmp: &"km"{\0,p,x,\0} &"km"{\0,p,b,\0} 5 :=> 0 | C19: 0.187248 | D19: 0.187248 | F19: of:=IF([.C19]=1;"";[.C19]) -> 0.187248 | G19: of:=IF([.D19]=1;"";[.D19]) -> 0.187248
A20: 4 | B20: strncmp: &"hch"{\0,p,\0} &"hch"{\0,p,\0} 5 :=> 0 | C20: 0.0775958 | D20: 0.0775958 | F20: of:=IF([.C20]=1;"";[.C20]) -> 0.0775958 | G20: of:=IF([.D20]=1;"";[.D20]) -> 0.0775958
A21: 5 | B21: strncmp: &"qfbk"{\0,\0} &"qfbk"{\0,\0} 5 :=> 0 | C21: 0.0203395 | D21: 0.0203395 | F21: of:=IF([.C21]=1;"";[.C21]) -> 0.0203395 | G21: of:=IF([.D21]=1;"";[.D21]) -> 0.0203395
A22: 6 | B22: strncmp: &"aqrqn"{\0} &"aqrqn"{\0} 5 :=> 0 | C22: 0 | D22: 0 | F22: of:=IF([.C22]=1;"";[.C22]) -> 0 | G22: of:=IF([.D22]=1;"";[.D22]) -> 0
A23: 7 | B23: strncmp: &"gbnfg"{\0} &"gbnfd"{\0} 5 :=> 1 | C23: 0.0217668 | D23: 0.0201441 | F23: of:=IF([.C23]=1;"";[.C23]) -> 0.0217668 | G23: of:=IF([.D23]=1;"";[.D23]) -> 0.0201441
A24: 8 | B24: strncmp: &"jagoq"{\0} &"jagoy"{\0} 5 :=> -1 | C24: 0.0262385 | D24: 0.0279874 | F24: of:=IF([.C24]=1;"";[.C24]) -> 0.0262385 | G24: of:=IF([.D24]=1;"";[.D24]) -> 0.0279874
A25: 9 | B25: strncmp: &"pmbrq"{\0} &"pmbjq"{\0} 5 :=> 1 | C25: 0.0258117 | D25: 0 | F25: of:=IF([.C25]=1;"";[.C25]) -> 0.0258117 | G25: of:=IF([.D25]=1;"";[.D25]) -> 0
A26: 10 | B26: strncmp: &"mgjii"{\0} &"mgjmq"{\0} 5 :=> -1 | C26: 0.019188 | D26: 0.0139298 | F26: of:=IF([.C26]=1;"";[.C26]) -> 0.019188 | G26: of:=IF([.D26]=1;"";[.D26]) -> 0.0139298
A27: 11 | B27: strncmp: &"unqic"{\0} &"undce"{\0} 5 :=> 1 | C27: 0.026634 | D27: 0.0295863 | F27: of:=IF([.C27]=1;"";[.C27]) -> 0.026634 | G27: of:=IF([.D27]=1;"";[.D27]) -> 0.0295863
A28: 12 | B28: strncmp: &"wzboj"{\0} &"wzrcj"{\0} 5 :=> -1 | C28: 0.0206057 | D28: 0.0148825 | F28: of:=IF([.C28]=1;"";[.C28]) -> 0.0206057 | G28: of:=IF([.D28]=1;"";[.D28]) -> 0.0148825
A29: 13 | B29: strncmp: &"upalb"{\0} &"ugeci"{\0} 5 :=> 1 | C29: 0.0294073 | D29: 0.0305221 | F29: of:=IF([.C29]=1;"";[.C29]) -> 0.0294073 | G29: of:=IF([.D29]=1;"";[.D29]) -> 0.0305221
A30: 14 | B30: strncmp: &"yjumv"{\0} &"ykiql"{\0} 5 :=> -1 | C30: 0.0211773 | D30: 0.0184683 | F30: of:=IF([.C30]=1;"";[.C30]) -> 0.0211773 | G30: of:=IF([.D30]=1;"";[.D30]) -> 0.0184683
A31: 15 | B31: strncmp: &"tbcjm"{\0} &"rrywk"{\0} 5 :=> 1 | C31: 0.0162619 | D31: 0.0264723 | F31: of:=IF([.C31]=1;"";[.C31]) -> 0.0162619 | G31: of:=IF([.D31]=1;"";[.D31]) -> 0.0264723
A32: 16 | B32: strncmp: &"xgjmn"{\0} &"zstdq"{\0} 5 :=> -1 | C32: 0.0144788 | D32: 0.0236417 | F32: of:=IF([.C32]=1;"";[.C32]) -> 0.0144788 | G32: of:=IF([.D32]=1;"";[.D32]) -> 0.0236417
A33: 1 | B33: sysfs_streq: &""{\0,p,o,i,l,\0} &"ijneu"{\0} :=> \0 | C33: 1 | D33: 0.0231891 | F33: of:=IF([.C33]=1;"";[.C33]) ->  | G33: of:=IF([.D33]=1;"";[.D33]) -> 0.0231891 | I33: of:=AVERAGE([.F33:.F71]) -> 0.0585015103448276 | J33: of:=AVERAGE([.G33:.G71]) -> 0.0347488571428571 | L33: of:=AVERAGE([.I33:.J33]) -> 0.0466251837438424
A34: 2 | B34: sysfs_streq: &""{\0,p,x,b,h,\0} &"\n"{\0,b,i,l,\0} :=> \x01 | C34: 1 | F34: of:=IF([.C34]=1;"";[.C34]) ->  | G34: of:=IF([.D34]=1;"";[.D34]) ->  
A35: 3 | B35: sysfs_streq: &""{\0,p,i,e,r,\0} &"\naywx"{\0} :=> \0 | C35: 1 | F35: of:=IF([.C35]=1;"";[.C35]) ->  | G35: of:=IF([.D35]=1;"";[.D35]) ->  
A36: 4 | B36: sysfs_streq: &""{\0,p,n,f,w,\0} &""{\0,h,x,c,j,\0} :=> \x01 | C36: 1 | D36: 1 | F36: of:=IF([.C36]=1;"";[.C36]) ->  | G36: of:=IF([.D36]=1;"";[.D36]) -> 
A37: 5 | B37: sysfs_streq: &"xlxbq"{\0} &"plkpm"{\0} :=> \0 | C37: 0 | D37: 0.0258549 | F37: of:=IF([.C37]=1;"";[.C37]) -> 0 | G37: of:=IF([.D37]=1;"";[.D37]) -> 0.0258549
A38: 6 | B38: sysfs_streq: &"\n"{\0,p,v,o,\0} &""{\0,a,f,a,o,\0} :=> \x01 | C38: 1 | F38: of:=IF([.C38]=1;"";[.C38]) ->  | G38: of:=IF([.D38]=1;"";[.D38]) ->  
A39: 7 | B39: sysfs_streq: &"\n"{\0,a,m,n,\0} &"wdjmz"{\0} :=> \0 | C39: 0.0188563 | F39: of:=IF([.C39]=1;"";[.C39]) -> 0.0188563 | G39: of:=IF([.D39]=1;"";[.D39]) ->  
A40: 8 | B40: sysfs_streq: &"\nacnn"{\0} &"bubav"{\0} :=> \0 | C40: 0.0296764 | F40: of:=IF([.C40]=1;"";[.C40]) -> 0.0296764 | G40: of:=IF([.D40]=1;"";[.D40]) ->  
A41: 9 | B41: sysfs_streq: &"y"{\0,p,k,u,\0} &"ytdzc"{\0} :=> \0 | C41: 1 | D41: 0.0205164 | F41: of:=IF([.C41]=1;"";[.C41]) ->  | G41: of:=IF([.D41]=1;"";[.D41]) -> 0.0205164
A42: 10 | B42: sysfs_streq: &"c"{\0,p,e,x,\0} &"c\n"{\0,a,l,\0} :=> \x01 | C42: 1 | F42: of:=IF([.C42]=1;"";[.C42]) ->  | G42: of:=IF([.D42]=1;"";[.D42]) ->  
A43: 11 | B43: sysfs_streq: &"f"{\0,p,d,q,\0} &"f\nadw"{\0} :=> \0 | C43: 1 | F43: of:=IF([.C43]=1;"";[.C43]) ->  | G43: of:=IF([.D43]=1;"";[.D43]) ->  
A44: 12 | B44: sysfs_streq: &"w"{\0,p,t,e,\0} &"w"{\0,h,y,h,\0} :=> \x01 | C44: 1 | D44: 1 | F44: of:=IF([.C44]=1;"";[.C44]) ->  | G44: of:=IF([.D44]=1;"";[.D44]) -> 
A45: 13 | B45: sysfs_streq: &"gohbk"{\0} &"gcpio"{\0} :=> \0 | C45: 0.0233667 | D45: 0.0218293 | F45: of:=IF([.C45]=1;"";[.C45]) -> 0.0233667 | G45: of:=IF([.D45]=1;"";[.D45]) -> 0.0218293
A46: 14 | B46: sysfs_streq: &"s\n"{\0,b,z,\0} &"s"{\0,b,h,g,\0} :=> \x01 | C46: 1 | F46: of:=IF([.C46]=1;"";[.C46]) ->  | G46: of:=IF([.D46]=1;"";[.D46]) ->  
A47: 15 | B47: sysfs_streq: &"r\n"{\0,b,u,\0} &"rhxeq"{\0} :=> \0 | C47: 0 | F47: of:=IF([.C47]=1;"";[.C47]) -> 0 | G47: of:=IF([.D47]=1;"";[.D47]) ->  
A48: 16 | B48: sysfs_streq: &"m\naoj"{\0} &"motcc"{\0} :=> \0 | C48: 0.02935 | F48: of:=IF([.C48]=1;"";[.C48]) -> 0.02935 | G48: of:=IF([.D48]=1;"";[.D48]) ->  
A49: 17 | B49: sysfs_streq: &"ng"{\0,p,u,\0} &"ngqee"{\0} :=> \0 | C49: 0.223271 | D49: 0.0160316 | F49: of:=IF([.C49]=1;"";[.C49]) -> 0.223271 | G49: of:=IF([.D49]=1;"";[.D49]) -> 0.0160316
A50: 18 | B50: sysfs_streq: &"hh"{\0,p,p,\0} &"hh\n"{\0,a,\0} :=> \x01 | C50: 0.18491 | F50: of:=IF([.C50]=1;"";[.C50]) -> 0.18491 | G50: of:=IF([.D50]=1;"";[.D50]) ->  
A51: 19 | B51: sysfs_streq: &"rl"{\0,p,u,\0} &"rl\nac"{\0} :=> \0 | C51: 0.212346 | F51: of:=IF([.C51]=1;"";[.C51]) -> 0.212346 | G51: of:=IF([.D51]=1;"";[.D51]) ->  
A52: 20 | B52: sysfs_streq: &"zk"{\0,p,l,\0} &"zk"{\0,b,m,\0} :=> \x01 | C52: 0.177645 | D52: 0.177645 | F52: of:=IF([.C52]=1;"";[.C52]) -> 0.177645 | G52: of:=IF([.D52]=1;"";[.D52]) -> 0.177645
A53: 21 | B53: sysfs_streq: &"fdmbg"{\0} &"fdlss"{\0} :=> \0 | C53: 0.0206123 | D53: 0.0248883 | F53: of:=IF([.C53]=1;"";[.C53]) -> 0.0206123 | G53: of:=IF([.D53]=1;"";[.D53]) -> 0.0248883
A54: 22 | B54: sysfs_streq: &"rf\n"{\0,b,\0} &"rf"{\0,b,m,\0} :=> \x01 | C54: 0.206238 | F54: of:=IF([.C54]=1;"";[.C54]) -> 0.206238 | G54: of:=IF([.D54]=1;"";[.D54]) ->  
A55: 23 | B55: sysfs_streq: &"nu\n"{\0,b,\0} &"nuqqj"{\0} :=> \0 | C55: 0 | F55: of:=IF([.C55]=1;"";[.C55]) -> 0 | G55: of:=IF([.D55]=1;"";[.D55]) ->  
A56: 24 | B56: sysfs_streq: &"zz\nav"{\0} &"zzwxu"{\0} :=> \0 | C56: 0 | F56: of:=IF([.C56]=1;"";[.C56]) -> 0 | G56: of:=IF([.D56]=1;"";[.D56]) ->  
A57: 25 | B57: sysfs_streq: &"fmq"{\0,p,\0} &"fmqft"{\0} :=> \0 | C57: 0.0498836 | D57: 0.0134966 | F57: of:=IF([.C57]=1;"";[.C57]) -> 0.0498836 | G57: of:=IF([.D57]=1;"";[.D57]) -> 0.0134966
A58: 26 | B58: sysfs_streq: &"ycn"{\0,p,\0} &"ycn\n"{\0,\0} :=> \x01 | C58: 0.0681742 | F58: of:=IF([.C58]=1;"";[.C58]) -> 0.0681742 | G58: of:=IF([.D58]=1;"";[.D58]) ->  
A59: 27 | B59: sysfs_streq: &"alc"{\0,p,\0} &"alc\na"{\0} :=> \0 | C59: 0.0829133 | F59: of:=IF([.C59]=1;"";[.C59]) -> 0.0829133 | G59: of:=IF([.D59]=1;"";[.D59]) ->  
A60: 28 | B60: sysfs_streq: &"alr"{\0,p,\0} &"alr"{\0,h,\0} :=> \x01 | C60: 0.0830894 | D60: 0.0830894 | F60: of:=IF([.C60]=1;"";[.C60]) -> 0.0830894 | G60: of:=IF([.D60]=1;"";[.D60]) -> 0.0830894
A61: 29 | B61: sysfs_streq: &"qjlca"{\0} &"qjlfl"{\0} :=> \0 | C61: 0 | D61: 0 | F61: of:=IF([.C61]=1;"";[.C61]) -> 0 | G61: of:=IF([.D61]=1;"";[.D61]) -> 0
A62: 30 | B62: sysfs_streq: &"rfg\n"{\0,\0} &"rfg"{\0,a,\0} :=> \x01 | C62: 0.0728392 | F62: of:=IF([.C62]=1;"";[.C62]) -> 0.0728392 | G62: of:=IF([.D62]=1;"";[.D62]) ->  
A63: 31 | B63: sysfs_streq: &"rkj\n"{\0,\0} &"rkjqx"{\0} :=> \0 | C63: 0 | F63: of:=IF([.C63]=1;"";[.C63]) -> 0 | G63: of:=IF([.D63]=1;"";[.D63]) ->  
A64: 32 | B64: sysfs_streq: &"qsr\na"{\0} &"qsrnm"{\0} :=> \0 | C64: 0.0201723 | F64: of:=IF([.C64]=1;"";[.C64]) -> 0.0201723 | G64: of:=IF([.D64]=1;"";[.D64]) ->  
A65: 33 | B65: sysfs_streq: &"fkrs"{\0,\0} &"fkrsu"{\0} :=> \0 | C65: 0.0392107 | D65: 0.0259876 | F65: of:=IF([.C65]=1;"";[.C65]) -> 0.0392107 | G65: of:=IF([.D65]=1;"";[.D65]) -> 0.0259876
A66: 34 | B66: sysfs_streq: &"boks"{\0,\0} &"boks\n"{\0} :=> \x01 | C66: 0.0452108 | F66: of:=IF([.C66]=1;"";[.C66]) -> 0.0452108 | G66: of:=IF([.D66]=1;"";[.D66]) ->  
A67: 35 | B67: sysfs_streq: &"imjh"{\0,\0} &"imjh"{\0,\0} :=> \x01 | C67: 0.0259915 | D67: 0.0259915 | F67: of:=IF([.C67]=1;"";[.C67]) -> 0.0259915 | G67: of:=IF([.D67]=1;"";[.D67]) -> 0.0259915
A68: 36 | B68: sysfs_streq: &"mnshe"{\0} &"mnshl"{\0} :=> \0 | C68: 0.0298166 | D68: 0.0279643 | F68: of:=IF([.C68]=1;"";[.C68]) -> 0.0298166 | G68: of:=IF([.D68]=1;"";[.D68]) -> 0.0279643
A69: 37 | B69: sysfs_streq: &"vgki\n"{\0} &"vgki"{\0,\0} :=> \x01 | C69: 0.0340282 | F69: of:=IF([.C69]=1;"";[.C69]) -> 0.0340282 | G69: of:=IF([.D69]=1;"";[.D69]) ->  
A70: 38 | B70: sysfs_streq: &"kuej\n"{\0} &"kuejh"{\0} :=> \0 | C70: 0.0189423 | F70: of:=IF([.C70]=1;"";[.C70]) -> 0.0189423 | G70: of:=IF([.D70]=1;"";[.D70]) ->  
A71: 39 | B71: sysfs_streq: &"dkqpy"{\0} &"dkqpy"{\0} :=> \x01 | C71: 0 | D71: 0 | F71: of:=IF([.C71]=1;"";[.C71]) -> 0 | G71: of:=IF([.D71]=1;"";[.D71]) -> 0

Sheet: strcpy
A1: # | B1: Test Case | C1: N1 | D1: N2 | E1: N3 | O1: FINAL
A2: 1 | B2: strcpy: &""{\0,\x01,\x01,\x01,\x01,\x01} &"a"{\0,p,t,y,\0} :=> &"a"{\0,p,l,e,\0} | C2: 1 | D2: 1 | E2: 1 | G2: of:=IF([.C2]=1;"";[.C2]) ->  | H2: of:=IF([.D2]=1;"";[.D2]) ->  | I2: of:=IF([.E2]=1;"";[.E2]) ->  | K2: of:=AVERAGE([.G2:.G36]) -> 0.0738283708333333 | L2: of:=AVERAGE([.H2:.H36]) -> 0.071107525 | M2: of:=AVERAGE([.I2:.I36]) -> 0.071107525 | O2: of:=AVERAGE([.K2:.M2]) -> 0.0720144736111111
A3: 2 | B3: strcpy: &""{\0,\x01,\x01,\x01,\x01,\x01} &"bx"{\0,p,w,\0} :=> &"bx"{\0,p,v,\0} | C3: 1 | D3: 0 | E3: 0 | G3: of:=IF([.C3]=1;"";[.C3]) ->  | H3: of:=IF([.D3]=1;"";[.D3]) -> 0 | I3: of:=IF([.E3]=1;"";[.E3]) -> 0
A4: 3 | B4: strcpy: &""{\0,\x01,\x01,\x01,\x01,\x01} &"adc"{\0,p,\0} :=> &"adc"{\0,p,\0} | C4: 1 | D4: 0.0801852 | E4: 0.0801852 | G4: of:=IF([.C4]=1;"";[.C4]) ->  | H4: of:=IF([.D4]=1;"";[.D4]) -> 0.0801852 | I4: of:=IF([.E4]=1;"";[.E4]) -> 0.0801852
A5: 4 | B5: strcpy: &""{\0,\x01,\x01,\x01,\x01,\x01} &"dxdn"{\0,\0} :=> &"dxdn"{\0,\0} | C5: 1 | D5: 0 | E5: 0 | G5: of:=IF([.C5]=1;"";[.C5]) ->  | H5: of:=IF([.D5]=1;"";[.D5]) -> 0 | I5: of:=IF([.E5]=1;"";[.E5]) -> 0
A6: 5 | B6: strcpy: &""{\0,\x01,\x01,\x01,\x01,\x01} &"hbygd"{\0} :=> &"hbygd"{\0} | C6: 1 | D6: 0.0243458 | E6: 0.0243458 | G6: of:=IF([.C6]=1;"";[.C6]) ->  | H6: of:=IF([.D6]=1;"";[.D6]) -> 0.0243458 | I6: of:=IF([.E6]=1;"";[.E6]) -> 0.0243458
A7: 6 | B7: strcpy: &"j"{\0,\x01,\x01,\x01,\x01} &""{\0,p,p,i,t,\0} :=> &""{\0,\0,p,i,v,\0} | C7: 1 | D7: 1 | E7: 1 | G7: of:=IF([.C7]=1;"";[.C7]) ->  | H7: of:=IF([.D7]=1;"";[.D7]) ->  | I7: of:=IF([.E7]=1;"";[.E7]) -> 
A8: 7 | B8: strcpy: &"m"{\0,\x01,\x01,\x01,\x01} &"a"{\0,p,u,v,\0} :=> &"a"{\0,p,e,y,\0} | C8: 1 | D8: 1 | E8: 1 | G8: of:=IF([.C8]=1;"";[.C8]) ->  | H8: of:=IF([.D8]=1;"";[.D8]) ->  | I8: of:=IF([.E8]=1;"";[.E8]) -> 
A9: 8 | B9: strcpy: &"u"{\0,\x01,\x01,\x01,\x01} &"yg"{\0,p,z,\0} :=> &"yg"{\0,p,q,\0} | C9: 1 | D9: 0.185871 | E9: 0.185871 | G9: of:=IF([.C9]=1;"";[.C9]) ->  | H9: of:=IF([.D9]=1;"";[.D9]) -> 0.185871 | I9: of:=IF([.E9]=1;"";[.E9]) -> 0.185871
A10: 9 | B10: strcpy: &"t"{\0,\x01,\x01,\x01,\x01} &"ugw"{\0,p,\0} :=> &"ugw"{\0,p,\0} | C10: 1 | D10: 0.0748196 | E10: 0.0748196 | G10: of:=IF([.C10]=1;"";[.C10]) ->  | H10: of:=IF([.D10]=1;"";[.D10]) -> 0.0748196 | I10: of:=IF([.E10]=1;"";[.E10]) -> 0.0748196
A11: 10 | B11: strcpy: &"p"{\0,\x01,\x01,\x01,\x01} &"szvr"{\0,\0} :=> &"szvr"{\0,\0} | C11: 1 | D11: 0.0326033 | E11: 0.0326033 | G11: of:=IF([.C11]=1;"";[.C11]) ->  | H11: of:=IF([.D11]=1;"";[.D11]) -> 0.0326033 | I11: of:=IF([.E11]=1;"";[.E11]) -> 0.0326033
A12: 11 | B12: strcpy: &"p"{\0,\x01,\x01,\x01,\x01} &"deesd"{\0} :=> &"deesd"{\0} | C12: 1 | D12: 0.0303861 | E12: 0.0303861 | G12: of:=IF([.C12]=1;"";[.C12]) ->  | H12: of:=IF([.D12]=1;"";[.D12]) -> 0.0303861 | I12: of:=IF([.E12]=1;"";[.E12]) -> 0.0303861
A13: 12 | B13: strcpy: &"tx"{\0,\x01,\x01,\x01} &""{\0,p,j,p,g,\0} :=> &""{\0,x,\0,p,v,\0} | C13: 0.151927 | D13: 1 | E13: 1 | G13: of:=IF([.C13]=1;"";[.C13]) -> 0.151927 | H13: of:=IF([.D13]=1;"";[.D13]) ->  | I13: of:=IF([.E13]=1;"";[.E13]) -> 
A14: 13 | B14: strcpy: &"xp"{\0,\x01,\x01,\x01} &"z"{\0,p,i,g,\0} :=> &"z"{\0,\0,p,l,\0} | C14: 0.209845 | D14: 1 | E14: 1 | G14: of:=IF([.C14]=1;"";[.C14]) -> 0.209845 | H14: of:=IF([.D14]=1;"";[.D14]) ->  | I14: of:=IF([.E14]=1;"";[.E14]) -> 
A15: 14 | B15: strcpy: &"yi"{\0,\x01,\x01,\x01} &"ok"{\0,p,u,\0} :=> &"ok"{\0,p,g,\0} | C15: 0.207882 | D15: 0.211356 | E15: 0.211356 | G15: of:=IF([.C15]=1;"";[.C15]) -> 0.207882 | H15: of:=IF([.D15]=1;"";[.D15]) -> 0.211356 | I15: of:=IF([.E15]=1;"";[.E15]) -> 0.211356
A16: 15 | B16: strcpy: &"ci"{\0,\x01,\x01,\x01} &"fqo"{\0,p,\0} :=> &"fqo"{\0,p,\0} | C16: 0.216638 | D16: 0 | E16: 0 | G16: of:=IF([.C16]=1;"";[.C16]) -> 0.216638 | H16: of:=IF([.D16]=1;"";[.D16]) -> 0 | I16: of:=IF([.E16]=1;"";[.E16]) -> 0
A17: 16 | B17: strcpy: &"ve"{\0,\x01,\x01,\x01} &"hcxv"{\0,\0} :=> &"hcxv"{\0,\0} | C17: 0.221991 | D17: 0.022651 | E17: 0.022651 | G17: of:=IF([.C17]=1;"";[.C17]) -> 0.221991 | H17: of:=IF([.D17]=1;"";[.D17]) -> 0.022651 | I17: of:=IF([.E17]=1;"";[.E17]) -> 0.022651
A18: 17 | B18: strcpy: &"qa"{\0,\x01,\x01,\x01} &"ueynj"{\0} :=> &"ueynj"{\0} | C18: 0.157876 | D18: 0.0276233 | E18: 0.0276233 | G18: of:=IF([.C18]=1;"";[.C18]) -> 0.157876 | H18: of:=IF([.D18]=1;"";[.D18]) -> 0.0276233 | I18: of:=IF([.E18]=1;"";[.E18]) -> 0.0276233
A19: 18 | B19: strcpy: &"wyx"{\0,\x01,\x01} &""{\0,p,q,g,m,\0} :=> &""{\0,y,x,\0,p,\0} | C19: 0.0667039 | D19: 1 | E19: 1 | G19: of:=IF([.C19]=1;"";[.C19]) -> 0.0667039 | H19: of:=IF([.D19]=1;"";[.D19]) ->  | I19: of:=IF([.E19]=1;"";[.E19]) -> 
A20: 19 | B20: strcpy: &"arn"{\0,\x01,\x01} &"c"{\0,p,c,l,\0} :=> &"c"{\0,n,\0,p,\0} | C20: 0.0884731 | D20: 1 | E20: 1 | G20: of:=IF([.C20]=1;"";[.C20]) -> 0.0884731 | H20: of:=IF([.D20]=1;"";[.D20]) ->  | I20: of:=IF([.E20]=1;"";[.E20]) -> 
A21: 20 | B21: strcpy: &"rqe"{\0,\x01,\x01} &"su"{\0,p,j,\0} :=> &"su"{\0,\0,p,\0} | C21: 0.0432383 | D21: 0.216638 | E21: 0.216638 | G21: of:=IF([.C21]=1;"";[.C21]) -> 0.0432383 | H21: of:=IF([.D21]=1;"";[.D21]) -> 0.216638 | I21: of:=IF([.E21]=1;"";[.E21]) -> 0.216638
A22: 21 | B22: strcpy: &"nla"{\0,\x01,\x01} &"mhe"{\0,p,\0} :=> &"mhe"{\0,p,\0} | C22: 0.0851427 | D22: 0.0776249 | E22: 0.0776249 | G22: of:=IF([.C22]=1;"";[.C22]) -> 0.0851427 | H22: of:=IF([.D22]=1;"";[.D22]) -> 0.0776249 | I22: of:=IF([.E22]=1;"";[.E22]) -> 0.0776249
A23: 22 | B23: strcpy: &"tvx"{\0,\x01,\x01} &"sdnz"{\0,\0} :=> &"sdnz"{\0,\0} | C23: 0 | D23: 0.0403413 | E23: 0.0403413 | G23: of:=IF([.C23]=1;"";[.C23]) -> 0 | H23: of:=IF([.D23]=1;"";[.D23]) -> 0.0403413 | I23: of:=IF([.E23]=1;"";[.E23]) -> 0.0403413
A24: 23 | B24: strcpy: &"jbg"{\0,\x01,\x01} &"ttabn"{\0} :=> &"ttabn"{\0} | C24: 0.0458729 | D24: 0.0273771 | E24: 0.0273771 | G24: of:=IF([.C24]=1;"";[.C24]) -> 0.0458729 | H24: of:=IF([.D24]=1;"";[.D24]) -> 0.0273771 | I24: of:=IF([.E24]=1;"";[.E24]) -> 0.0273771
A25: 24 | B25: strcpy: &"wiyz"{\0,\x01} &""{\0,p,g,h,i,\0} :=> &""{\0,i,y,z,\0,\0} | C25: 0.0390447 | D25: 1 | E25: 1 | G25: of:=IF([.C25]=1;"";[.C25]) -> 0.0390447 | H25: of:=IF([.D25]=1;"";[.D25]) ->  | I25: of:=IF([.E25]=1;"";[.E25]) -> 
A26: 25 | B26: strcpy: &"hetu"{\0,\x01} &"i"{\0,p,o,s,\0} :=> &"i"{\0,t,u,\0,\0} | C26: 0.0486088 | D26: 1 | E26: 1 | G26: of:=IF([.C26]=1;"";[.C26]) -> 0.0486088 | H26: of:=IF([.D26]=1;"";[.D26]) ->  | I26: of:=IF([.E26]=1;"";[.E26]) -> 
A27: 26 | B27: strcpy: &"zxzz"{\0,\x01} &"nz"{\0,p,w,\0} :=> &"nz"{\0,z,\0,\0} | C27: 0 | D27: 0.19544 | E27: 0.19544 | G27: of:=IF([.C27]=1;"";[.C27]) -> 0 | H27: of:=IF([.D27]=1;"";[.D27]) -> 0.19544 | I27: of:=IF([.E27]=1;"";[.E27]) -> 0.19544
A28: 27 | B28: strcpy: &"kegx"{\0,\x01} &"dnh"{\0,p,\0} :=> &"dnh"{\0,\0,\0} | C28: 0.034931 | D28: 0.0783072 | E28: 0.0783072 | G28: of:=IF([.C28]=1;"";[.C28]) -> 0.034931 | H28: of:=IF([.D28]=1;"";[.D28]) -> 0.0783072 | I28: of:=IF([.E28]=1;"";[.E28]) -> 0.0783072
A29: 28 | B29: strcpy: &"pepg"{\0,\x01} &"frad"{\0,\0} :=> &"frad"{\0,\0} | C29: 0.0440414 | D29: 0.0477704 | E29: 0.0477704 | G29: of:=IF([.C29]=1;"";[.C29]) -> 0.0440414 | H29: of:=IF([.D29]=1;"";[.D29]) -> 0.0477704 | I29: of:=IF([.E29]=1;"";[.E29]) -> 0.0477704
A30: 29 | B30: strcpy: &"ojxf"{\0,\x01} &"idqgd"{\0} :=> &"idqgd"{\0} | C30: 0 | D30: 0 | E30: 0 | G30: of:=IF([.C30]=1;"";[.C30]) -> 0 | H30: of:=IF([.D30]=1;"";[.D30]) -> 0 | I30: of:=IF([.E30]=1;"";[.E30]) -> 0
A31: 30 | B31: strcpy: &"upwqd"{\0} &""{\0,p,f,o,y,\0} :=> &""{\0,p,w,q,d,\0} | C31: 0 | D31: 1 | E31: 1 | G31: of:=IF([.C31]=1;"";[.C31]) -> 0 | H31: of:=IF([.D31]=1;"";[.D31]) ->  | I31: of:=IF([.E31]=1;"";[.E31]) -> 
A32: 31 | B32: strcpy: &"ctych"{\0} &"i"{\0,p,r,o,\0} :=> &"i"{\0,y,c,h,\0} | C32: 0.0292974 | D32: 1 | E32: 1 | G32: of:=IF([.C32]=1;"";[.C32]) -> 0.0292974 | H32: of:=IF([.D32]=1;"";[.D32]) ->  | I32: of:=IF([.E32]=1;"";[.E32]) -> 
A33: 32 | B33: strcpy: &"jjioz"{\0} &"du"{\0,p,t,\0} :=> &"du"{\0,o,z,\0} | C33: 0.0216155 | D33: 0.213322 | E33: 0.213322 | G33: of:=IF([.C33]=1;"";[.C33]) -> 0.0216155 | H33: of:=IF([.D33]=1;"";[.D33]) -> 0.213322 | I33: of:=IF([.E33]=1;"";[.E33]) -> 0.213322
A34: 33 | B34: strcpy: &"eikkz"{\0} &"vdp"{\0,p,\0} :=> &"vdp"{\0,z,\0} | C34: 0.0219129 | D34: 0.0618692 | E34: 0.0618692 | G34: of:=IF([.C34]=1;"";[.C34]) -> 0.0219129 | H34: of:=IF([.D34]=1;"";[.D34]) -> 0.0618692 | I34: of:=IF([.E34]=1;"";[.E34]) -> 0.0618692
A35: 34 | B35: strcpy: &"xglxp"{\0} &"evzi"{\0,\0} :=> &"evzi"{\0,\0} | C35: 0.0174025 | D35: 0.0302107 | E35: 0.0302107 | G35: of:=IF([.C35]=1;"";[.C35]) -> 0.0174025 | H35: of:=IF([.D35]=1;"";[.D35]) -> 0.0302107 | I35: of:=IF([.E35]=1;"";[.E35]) -> 0.0302107
A36: 35 | B36: strcpy: &"jtdcd"{\0} &"fahoz"{\0} :=> &"fahoz"{\0} | C36: 0.0194368 | D36: 0.0278385 | E36: 0.0278385 | G36: of:=IF([.C36]=1;"";[.C36]) -> 0.0194368 | H36: of:=IF([.D36]=1;"";[.D36]) -> 0.0278385 | I36: of:=IF([.E36]=1;"";[.E36]) -> 0.0278385
A37: 1 | B37: strncpy: &""{\0,\x01,\x01,\x01,\x01,\x01} &""{\0,p,l,o,u,\0} 5 :=> &""{\0,\0,\0,\0,\0,\0} | C37: 1 | D37: 1 | E37: 1 | G37: of:=IF([.C37]=1;"";[.C37]) ->  | H37: of:=IF([.D37]=1;"";[.D37]) ->  | I37: of:=IF([.E37]=1;"";[.E37]) ->  | K37: of:=AVERAGE([.G37:.G72]) -> 0.06625545 | L37: of:=AVERAGE([.H37:.H72]) -> 0.0561491458333333 | M37: of:=AVERAGE([.I37:.I72]) -> 0.0561491458333333 | O37: of:=AVERAGE([.K37:.M37]) -> 0.0595179138888889
A38: 2 | B38: strncpy: &""{\0,\x01,\x01,\x01,\x01,\x01} &"c"{\0,p,b,p,\0} 5 :=> &"c"{\0,\0,\0,\0,\0} | C38: 1 | D38: 1 | E38: 1 | G38: of:=IF([.C38]=1;"";[.C38]) ->  | H38: of:=IF([.D38]=1;"";[.D38]) ->  | I38: of:=IF([.E38]=1;"";[.E38]) -> 
A39: 3 | B39: strncpy: &""{\0,\x01,\x01,\x01,\x01,\x01} &"ry"{\0,p,h,\0} 5 :=> &"ry"{\0,\0,\0,\0} | C39: 1 | D39: 0.216174 | E39: 0.216174 | G39: of:=IF([.C39]=1;"";[.C39]) ->  | H39: of:=IF([.D39]=1;"";[.D39]) -> 0.216174 | I39: of:=IF([.E39]=1;"";[.E39]) -> 0.216174
A40: 4 | B40: strncpy: &""{\0,\x01,\x01,\x01,\x01,\x01} &"jmf"{\0,p,\0} 5 :=> &"jmf"{\0,\0,\0} | C40: 1 | D40: 0.0638011 | E40: 0.0638011 | G40: of:=IF([.C40]=1;"";[.C40]) ->  | H40: of:=IF([.D40]=1;"";[.D40]) -> 0.0638011 | I40: of:=IF([.E40]=1;"";[.E40]) -> 0.0638011
A41: 5 | B41: strncpy: &""{\0,\x01,\x01,\x01,\x01,\x01} &"ikid"{\0,\0} 5 :=> &"ikid"{\0,\0} | C41: 1 | D41: 0.0459922 | E41: 0.0459922 | G41: of:=IF([.C41]=1;"";[.C41]) ->  | H41: of:=IF([.D41]=1;"";[.D41]) -> 0.0459922 | I41: of:=IF([.E41]=1;"";[.E41]) -> 0.0459922
A42: 6 | B42: strncpy: &""{\0,\x01,\x01,\x01,\x01,\x01} &"tijcc"{\0} 5 :=> &"tijcc"{\0} | C42: 1 | D42: 0.0237516 | E42: 0.0237516 | G42: of:=IF([.C42]=1;"";[.C42]) ->  | H42: of:=IF([.D42]=1;"";[.D42]) -> 0.0237516 | I42: of:=IF([.E42]=1;"";[.E42]) -> 0.0237516
A43: 7 | B43: strncpy: &"g"{\0,\x01,\x01,\x01,\x01} &""{\0,p,k,i,c,\0} 5 :=> &""{\0,\0,\0,\0,\0,\0} | C43: 1 | D43: 1 | E43: 1 | G43: of:=IF([.C43]=1;"";[.C43]) ->  | H43: of:=IF([.D43]=1;"";[.D43]) ->  | I43: of:=IF([.E43]=1;"";[.E43]) -> 
A44: 8 | B44: strncpy: &"n"{\0,\x01,\x01,\x01,\x01} &"m"{\0,p,r,g,\0} 5 :=> &"m"{\0,\0,\0,\0,\0} | C44: 1 | D44: 1 | E44: 1 | G44: of:=IF([.C44]=1;"";[.C44]) ->  | H44: of:=IF([.D44]=1;"";[.D44]) ->  | I44: of:=IF([.E44]=1;"";[.E44]) -> 
A45: 9 | B45: strncpy: &"f"{\0,\x01,\x01,\x01,\x01} &"jz"{\0,p,l,\0} 5 :=> &"jz"{\0,\0,\0,\0} | C45: 1 | D45: 0.135488 | E45: 0.135488 | G45: of:=IF([.C45]=1;"";[.C45]) ->  | H45: of:=IF([.D45]=1;"";[.D45]) -> 0.135488 | I45: of:=IF([.E45]=1;"";[.E45]) -> 0.135488
A46: 10 | B46: strncpy: &"v"{\0,\x01,\x01,\x01,\x01} &"xgl"{\0,p,\0} 5 :=> &"xgl"{\0,\0,\0} | C46: 1 | D46: 0.0522508 | E46: 0.0522508 | G46: of:=IF([.C46]=1;"";[.C46]) ->  | H46: of:=IF([.D46]=1;"";[.D46]) -> 0.0522508 | I46: of:=IF([.E46]=1;"";[.E46]) -> 0.0522508
A47: 11 | B47: strncpy: &"u"{\0,\x01,\x01,\x01,\x01} &"cggz"{\0,\0} 5 :=> &"cggz"{\0,\0} | C47: 1 | D47: 0.0233088 | E47: 0.0233088 | G47: of:=IF([.C47]=1;"";[.C47]) ->  | H47: of:=IF([.D47]=1;"";[.D47]) -> 0.0233088 | I47: of:=IF([.E47]=1;"";[.E47]) -> 0.0233088
A48: 12 | B48: strncpy: &"y"{\0,\x01,\x01,\x01,\x01} &"fbxcw"{\0} 5 :=> &"fbxcw"{\0} | C48: 1 | D48: 0 | E48: 0 | G48: of:=IF([.C48]=1;"";[.C48]) ->  | H48: of:=IF([.D48]=1;"";[.D48]) -> 0 | I48: of:=IF([.E48]=1;"";[.E48]) -> 0
A49: 13 | B49: strncpy: &"hk"{\0,\x01,\x01,\x01} &""{\0,p,x,g,r,\0} 5 :=> &""{\0,\0,\0,\0,\0,\0} | C49: 0.182636 | D49: 1 | E49: 1 | G49: of:=IF([.C49]=1;"";[.C49]) -> 0.182636 | H49: of:=IF([.D49]=1;"";[.D49]) ->  | I49: of:=IF([.E49]=1;"";[.E49]) -> 
A50: 14 | B50: strncpy: &"nd"{\0,\x01,\x01,\x01} &"k"{\0,p,q,g,\0} 5 :=> &"k"{\0,\0,\0,\0,\0} | C50: 0.223692 | D50: 1 | E50: 1 | G50: of:=IF([.C50]=1;"";[.C50]) -> 0.223692 | H50: of:=IF([.D50]=1;"";[.D50]) ->  | I50: of:=IF([.E50]=1;"";[.E50]) -> 
A51: 15 | B51: strncpy: &"aw"{\0,\x01,\x01,\x01} &"wj"{\0,p,r,\0} 5 :=> &"wj"{\0,\0,\0,\0} | C51: 0.210856 | D51: 0 | E51: 0 | G51: of:=IF([.C51]=1;"";[.C51]) -> 0.210856 | H51: of:=IF([.D51]=1;"";[.D51]) -> 0 | I51: of:=IF([.E51]=1;"";[.E51]) -> 0
A52: 16 | B52: strncpy: &"tl"{\0,\x01,\x01,\x01} &"eqq"{\0,p,\0} 5 :=> &"eqq"{\0,\0,\0} | C52: 0.211853 | D52: 0.0517496 | E52: 0.0517496 | G52: of:=IF([.C52]=1;"";[.C52]) -> 0.211853 | H52: of:=IF([.D52]=1;"";[.D52]) -> 0.0517496 | I52: of:=IF([.E52]=1;"";[.E52]) -> 0.0517496
A53: 17 | B53: strncpy: &"vf"{\0,\x01,\x01,\x01} &"hfjb"{\0,\0} 5 :=> &"hfjb"{\0,\0} | C53: 0 | D53: 0.0258719 | E53: 0.0258719 | G53: of:=IF([.C53]=1;"";[.C53]) -> 0 | H53: of:=IF([.D53]=1;"";[.D53]) -> 0.0258719 | I53: of:=IF([.E53]=1;"";[.E53]) -> 0.0258719
A54: 18 | B54: strncpy: &"uc"{\0,\x01,\x01,\x01} &"rdxjl"{\0} 5 :=> &"rdxjl"{\0} | C54: 0.214762 | D54: 0 | E54: 0 | G54: of:=IF([.C54]=1;"";[.C54]) -> 0.214762 | H54: of:=IF([.D54]=1;"";[.D54]) -> 0 | I54: of:=IF([.E54]=1;"";[.E54]) -> 0
A55: 19 | B55: strncpy: &"poo"{\0,\x01,\x01} &""{\0,p,f,h,x,\0} 5 :=> &""{\0,\0,\0,\0,\0,\0} | C55: 0.0869711 | D55: 1 | E55: 1 | G55: of:=IF([.C55]=1;"";[.C55]) -> 0.0869711 | H55: of:=IF([.D55]=1;"";[.D55]) ->  | I55: of:=IF([.E55]=1;"";[.E55]) -> 
A56: 20 | B56: strncpy: &"grc"{\0,\x01,\x01} &"h"{\0,p,k,v,\0} 5 :=> &"h"{\0,\0,\0,\0,\0} | C56: 0.0851845 | D56: 1 | E56: 1 | G56: of:=IF([.C56]=1;"";[.C56]) -> 0.0851845 | H56: of:=IF([.D56]=1;"";[.D56]) ->  | I56: of:=IF([.E56]=1;"";[.E56]) -> 
A57: 21 | B57: strncpy: &"fvp"{\0,\x01,\x01} &"ih"{\0,p,p,\0} 5 :=> &"ih"{\0,\0,\0,\0} | C57: 0 | D57: 0.187319 | E57: 0.187319 | G57: of:=IF([.C57]=1;"";[.C57]) -> 0 | H57: of:=IF([.D57]=1;"";[.D57]) -> 0.187319 | I57: of:=IF([.E57]=1;"";[.E57]) -> 0.187319
A58: 22 | B58: strncpy: &"zqh"{\0,\x01,\x01} &"lig"{\0,p,\0} 5 :=> &"lig"{\0,\0,\0} | C58: 0 | D58: 0.088251 | E58: 0.088251 | G58: of:=IF([.C58]=1;"";[.C58]) -> 0 | H58: of:=IF([.D58]=1;"";[.D58]) -> 0.088251 | I58: of:=IF([.E58]=1;"";[.E58]) -> 0.088251
A59: 23 | B59: strncpy: &"uqm"{\0,\x01,\x01} &"hrfh"{\0,\0} 5 :=> &"hrfh"{\0,\0} | C59: 0 | D59: 0.0367761 | E59: 0.0367761 | G59: of:=IF([.C59]=1;"";[.C59]) -> 0 | H59: of:=IF([.D59]=1;"";[.D59]) -> 0.0367761 | I59: of:=IF([.E59]=1;"";[.E59]) -> 0.0367761
A60: 24 | B60: strncpy: &"xxr"{\0,\x01,\x01} &"ukdrq"{\0} 5 :=> &"ukdrq"{\0} | C60: 0.0477897 | D60: 0.0239014 | E60: 0.0239014 | G60: of:=IF([.C60]=1;"";[.C60]) -> 0.0477897 | H60: of:=IF([.D60]=1;"";[.D60]) -> 0.0239014 | I60: of:=IF([.E60]=1;"";[.E60]) -> 0.0239014
A61: 25 | B61: strncpy: &"fcev"{\0,\x01} &""{\0,p,k,s,s,\0} 5 :=> &""{\0,\0,\0,\0,\0,\0} | C61: 0.0409253 | D61: 1 | E61: 1 | G61: of:=IF([.C61]=1;"";[.C61]) -> 0.0409253 | H61: of:=IF([.D61]=1;"";[.D61]) ->  | I61: of:=IF([.E61]=1;"";[.E61]) -> 
A62: 26 | B62: strncpy: &"oymr"{\0,\x01} &"w"{\0,p,s,w,\0} 5 :=> &"w"{\0,\0,\0,\0,\0} | C62: 0.0391913 | D62: 1 | E62: 1 | G62: of:=IF([.C62]=1;"";[.C62]) -> 0.0391913 | H62: of:=IF([.D62]=1;"";[.D62]) ->  | I62: of:=IF([.E62]=1;"";[.E62]) -> 
A63: 27 | B63: strncpy: &"xbpy"{\0,\x01} &"fq"{\0,p,x,\0} 5 :=> &"fq"{\0,\0,\0,\0} | C63: 0.0325425 | D63: 0 | E63: 0 | G63: of:=IF([.C63]=1;"";[.C63]) -> 0.0325425 | H63: of:=IF([.D63]=1;"";[.D63]) -> 0 | I63: of:=IF([.E63]=1;"";[.E63]) -> 0
A64: 28 | B64: strncpy: &"bkpq"{\0,\x01} &"jjp"{\0,p,\0} 5 :=> &"jjp"{\0,\0,\0} | C64: 0.0260327 | D64: 0.0420351 | E64: 0.0420351 | G64: of:=IF([.C64]=1;"";[.C64]) -> 0.0260327 | H64: of:=IF([.D64]=1;"";[.D64]) -> 0.0420351 | I64: of:=IF([.E64]=1;"";[.E64]) -> 0.0420351
A65: 29 | B65: strncpy: &"rmry"{\0,\x01} &"fyuq"{\0,\0} 5 :=> &"fyuq"{\0,\0} | C65: 0.0414631 | D65: 0.0356551 | E65: 0.0356551 | G65: of:=IF([.C65]=1;"";[.C65]) -> 0.0414631 | H65: of:=IF([.D65]=1;"";[.D65]) -> 0.0356551 | I65: of:=IF([.E65]=1;"";[.E65]) -> 0.0356551
A66: 30 | B66: strncpy: &"wofb"{\0,\x01} &"tcrzj"{\0} 5 :=> &"tcrzj"{\0} | C66: 0.0404556 | D66: 0.0181902 | E66: 0.0181902 | G66: of:=IF([.C66]=1;"";[.C66]) -> 0.0404556 | H66: of:=IF([.D66]=1;"";[.D66]) -> 0.0181902 | I66: of:=IF([.E66]=1;"";[.E66]) -> 0.0181902
A67: 31 | B67: strncpy: &"vmapj"{\0} &""{\0,p,t,q,o,\0} 5 :=> &""{\0,\0,\0,\0,\0,\0} | C67: 0.0214297 | D67: 1 | E67: 1 | G67: of:=IF([.C67]=1;"";[.C67]) -> 0.0214297 | H67: of:=IF([.D67]=1;"";[.D67]) ->  | I67: of:=IF([.E67]=1;"";[.E67]) -> 
A68: 32 | B68: strncpy: &"nitsr"{\0} &"m"{\0,p,k,b,\0} 5 :=> &"m"{\0,\0,\0,\0,\0} | C68: 0.0298631 | D68: 1 | E68: 1 | G68: of:=IF([.C68]=1;"";[.C68]) -> 0.0298631 | H68: of:=IF([.D68]=1;"";[.D68]) ->  | I68: of:=IF([.E68]=1;"";[.E68]) -> 
A69: 33 | B69: strncpy: &"akcki"{\0} &"sz"{\0,p,w,\0} 5 :=> &"sz"{\0,\0,\0,\0} | C69: 0.0259308 | D69: 0.183097 | E69: 0.183097 | G69: of:=IF([.C69]=1;"";[.C69]) -> 0.0259308 | H69: of:=IF([.D69]=1;"";[.D69]) -> 0.183097 | I69: of:=IF([.E69]=1;"";[.E69]) -> 0.183097
A70: 34 | B70: strncpy: &"ijmqd"{\0} &"sfg"{\0,p,\0} 5 :=> &"sfg"{\0,\0,\0} | C70: 0 | D70: 0.0712725 | E70: 0.0712725 | G70: of:=IF([.C70]=1;"";[.C70]) -> 0 | H70: of:=IF([.D70]=1;"";[.D70]) -> 0.0712725 | I70: of:=IF([.E70]=1;"";[.E70]) -> 0.0712725
A71: 35 | B71: strncpy: &"nphap"{\0} &"pemx"{\0,\0} 5 :=> &"pemx"{\0,\0} | C71: 0.0285524 | D71: 0 | E71: 0 | G71: of:=IF([.C71]=1;"";[.C71]) -> 0.0285524 | H71: of:=IF([.D71]=1;"";[.D71]) -> 0 | I71: of:=IF([.E71]=1;"";[.E71]) -> 0
A72: 36 | B72: strncpy: &"tzdvw"{\0} &"yftpj"{\0} 5 :=> &"yftpj"{\0} | C72: 0 | D72: 0.0226941 | E72: 0.0226941 | G72: of:=IF([.C72]=1;"";[.C72]) -> 0 | H72: of:=IF([.D72]=1;"";[.D72]) -> 0.0226941 | I72: of:=IF([.E72]=1;"";[.E72]) -> 0.0226941

Sheet: strcat
A1: # | B1: Test Case | C1: N1 | D1: N2 | E1: N3
A2: 1 | B2: strcat: &""{\0,\x01,\x01,\x01,\x01,\x01,\x01,\x01,\x01,\x01} &"h"{\0,p,f,\0} :=> &"h"{\0,p,k,g,k,k,u,k,\0} | C2: 1 | D2: 1 | E2: 1 | G2: of:=IF([.C2]=1;"";[.C2]) ->  | H2: of:=IF([.D2]=1;"";[.D2]) ->  | I2: of:=IF([.E2]=1;"";[.E2]) ->  | K2: of:=AVERAGE([.G2:.G41]) -> 0.0469768980645161 | L2: of:=AVERAGE([.H2:.H41]) -> 0.0970154963636364 | M2: of:=AVERAGE([.I2:.I41]) -> 0.0339751502702703 | O2: of:=AVERAGE([.K2:.M2]) -> 0.0593225148994743
A3: 2 | B3: strcat: &""{\0,\x01,\x01,\x01,\x01,\x01,\x01,\x01,\x01,\x01} &"sp"{\0,p,\0} :=> &"sp"{\0,p,k,l,j,d,d,\0} | C3: 1 | D3: 0.214762 | E3: 0.214762 | G3: of:=IF([.C3]=1;"";[.C3]) ->  | H3: of:=IF([.D3]=1;"";[.D3]) -> 0.214762 | I3: of:=IF([.E3]=1;"";[.E3]) -> 0.214762
A4: 3 | B4: strcat: &""{\0,\x01,\x01,\x01,\x01,\x01,\x01,\x01,\x01,\x01} &"ufs"{\0,\0} :=> &"ufs"{\0,p,g,u,h,q,\0} | C4: 1 | D4: 0.0767189 | E4: 0.0767189 | G4: of:=IF([.C4]=1;"";[.C4]) ->  | H4: of:=IF([.D4]=1;"";[.D4]) -> 0.0767189 | I4: of:=IF([.E4]=1;"";[.E4]) -> 0.0767189
A5: 4 | B5: strcat: &""{\0,\x01,\x01,\x01,\x01,\x01,\x01,\x01,\x01,\x01} &"zlin"{\0} :=> &"zlin"{\0,p,m,y,h,\0} | C5: 1 | D5: 0.0450053 | E5: 0.0450053 | H5: of:=IF([.D5]=1;"";[.D5]) -> 0.0450053 | I5: of:=IF([.E5]=1;"";[.E5]) -> 0.0450053
A6: 5 | B6: strcat: &"m"{\0,\x01,\x01,\x01,\x01,\x01,\x01,\x01,\x01} &""{\0,p,h,c,\0} :=> &"m"{\0,p,h,f,s,u,v,h,\0} | C6: 1 | D6: 1 | E6: 1 | G6: of:=IF([.C6]=1;"";[.C6]) ->  | H6: of:=IF([.D6]=1;"";[.D6]) ->  | I6: of:=IF([.E6]=1;"";[.E6]) -> 
A7: 6 | B7: strcat: &"k"{\0,\x01,\x01,\x01,\x01,\x01,\x01,\x01,\x01} &"w"{\0,p,j,\0} :=> &"kw"{\0,p,g,k,i,f,j,\0} | C7: 1 | D7: 1 | E7: 0.190869 | G7: of:=IF([.C7]=1;"";[.C7]) ->  | H7: of:=IF([.D7]=1;"";[.D7]) ->  | I7: of:=IF([.E7]=1;"";[.E7]) -> 0.190869
A8: 7 | B8: strcat: &"z"{\0,\x01,\x01,\x01,\x01,\x01,\x01,\x01,\x01} &"bh"{\0,p,\0} :=> &"zbh"{\0,p,b,c,z,d,\0} | C8: 1 | D8: 0.17798 | E8: 0.0643912 | G8: of:=IF([.C8]=1;"";[.C8]) ->  | H8: of:=IF([.D8]=1;"";[.D8]) -> 0.17798 | I8: of:=IF([.E8]=1;"";[.E8]) -> 0.0643912
A9: 8 | B9: strcat: &"h"{\0,\x01,\x01,\x01,\x01,\x01,\x01,\x01,\x01} &"cna"{\0,\0} :=> &"hcna"{\0,p,h,y,h,\0} | C9: 1 | D9: 0.0730763 | E9: 0.0368187 | G9: of:=IF([.C9]=1;"";[.C9]) ->  | H9: of:=IF([.D9]=1;"";[.D9]) -> 0.0730763 | I9: of:=IF([.E9]=1;"";[.E9]) -> 0.0368187
A10: 9 | B10: strcat: &"f"{\0,\x01,\x01,\x01,\x01,\x01,\x01,\x01,\x01} &"jnym"{\0} :=> &"fjnym"{\0,p,t,b,\0} | C10: 1 | D10: 0.0365101 | E10: 0.0211389 | G10: of:=IF([.C10]=1;"";[.C10]) ->  | H10: of:=IF([.D10]=1;"";[.D10]) -> 0.0365101 | I10: of:=IF([.E10]=1;"";[.E10]) -> 0.0211389
A11: 10 | B11: strcat: &"yg"{\0,\x01,\x01,\x01,\x01,\x01,\x01,\x01} &""{\0,p,n,h,\0} :=> &"yg"{\0,p,g,e,d,h,q,\0} | C11: 0.185871 | D11: 1 | E11: 0.185871 | G11: of:=IF([.C11]=1;"";[.C11]) -> 0.185871 | H11: of:=IF([.D11]=1;"";[.D11]) ->  | I11: of:=IF([.E11]=1;"";[.E11]) -> 0.185871
A12: 11 | B12: strcat: &"xq"{\0,\x01,\x01,\x01,\x01,\x01,\x01,\x01} &"s"{\0,p,p,\0} :=> &"xqs"{\0,p,a,c,l,p,\0} | C12: 0.173018 | D12: 1 | E12: 0.0450507 | G12: of:=IF([.C12]=1;"";[.C12]) -> 0.173018 | H12: of:=IF([.D12]=1;"";[.D12]) ->  | I12: of:=IF([.E12]=1;"";[.E12]) -> 0.0450507
A13: 12 | B13: strcat: &"jx"{\0,\x01,\x01,\x01,\x01,\x01,\x01,\x01} &"nr"{\0,p,\0} :=> &"jxnr"{\0,p,d,k,s,\0} | C13: 0 | D13: 0.199296 | E13: 0 | G13: of:=IF([.C13]=1;"";[.C13]) -> 0 | H13: of:=IF([.D13]=1;"";[.D13]) -> 0.199296 | I13: of:=IF([.E13]=1;"";[.E13]) -> 0
A14: 13 | B14: strcat: &"nm"{\0,\x01,\x01,\x01,\x01,\x01,\x01,\x01} &"mkh"{\0,\0} :=> &"nmmkh"{\0,p,k,d,\0} | C14: 0.207303 | D14: 0.0651129 | E14: 0.0238541 | G14: of:=IF([.C14]=1;"";[.C14]) -> 0.207303 | H14: of:=IF([.D14]=1;"";[.D14]) -> 0.0651129 | I14: of:=IF([.E14]=1;"";[.E14]) -> 0.0238541
A15: 14 | B15: strcat: &"oj"{\0,\x01,\x01,\x01,\x01,\x01,\x01,\x01} &"ovnu"{\0} :=> &"ojovnu"{\0,p,k,\0} | C15: 0.199829 | D15: 0.0404558 | E15: 0.0184039 | G15: of:=IF([.C15]=1;"";[.C15]) -> 0.199829 | H15: of:=IF([.D15]=1;"";[.D15]) -> 0.0404558 | I15: of:=IF([.E15]=1;"";[.E15]) -> 0.0184039
A16: 15 | B16: strcat: &"rzt"{\0,\x01,\x01,\x01,\x01,\x01,\x01} &""{\0,p,u,s,\0} :=> &"rzt"{\0,p,o,h,t,c,\0} | C16: 0.0652968 | D16: 1 | E16: 0.0652968 | G16: of:=IF([.C16]=1;"";[.C16]) -> 0.0652968 | H16: of:=IF([.D16]=1;"";[.D16]) ->  | I16: of:=IF([.E16]=1;"";[.E16]) -> 0.0652968
A17: 16 | B17: strcat: &"yhx"{\0,\x01,\x01,\x01,\x01,\x01,\x01} &"a"{\0,p,m,\0} :=> &"yhxa"{\0,p,b,g,p,\0} | C17: 0 | D17: 1 | E17: 0 | G17: of:=IF([.C17]=1;"";[.C17]) -> 0 | H17: of:=IF([.D17]=1;"";[.D17]) ->  | I17: of:=IF([.E17]=1;"";[.E17]) -> 0
A18: 17 | B18: strcat: &"rko"{\0,\x01,\x01,\x01,\x01,\x01,\x01} &"ld"{\0,p,\0} :=> &"rkold"{\0,p,h,t,\0} | C18: 0.0806018 | D18: 0.217558 | E18: 0.0290265 | G18: of:=IF([.C18]=1;"";[.C18]) -> 0.0806018 | H18: of:=IF([.D18]=1;"";[.D18]) -> 0.217558 | I18: of:=IF([.E18]=1;"";[.E18]) -> 0.0290265
A19: 18 | B19: strcat: &"jla"{\0,\x01,\x01,\x01,\x01,\x01,\x01} &"nvd"{\0,\0} :=> &"jlanvd"{\0,p,g,\0} | C19: 0.0638742 | D19: 0.0687256 | E19: 0.0159719 | G19: of:=IF([.C19]=1;"";[.C19]) -> 0.0638742 | H19: of:=IF([.D19]=1;"";[.D19]) -> 0.0687256 | I19: of:=IF([.E19]=1;"";[.E19]) -> 0.0159719
A20: 19 | B20: strcat: &"mmb"{\0,\x01,\x01,\x01,\x01,\x01,\x01} &"ztpk"{\0} :=> &"mmbztpk"{\0,p,\0} | C20: 0.0836494 | D20: 0.033951 | E20: 0.0113796 | G20: of:=IF([.C20]=1;"";[.C20]) -> 0.0836494 | H20: of:=IF([.D20]=1;"";[.D20]) -> 0.033951 | I20: of:=IF([.E20]=1;"";[.E20]) -> 0.0113796
A21: 20 | B21: strcat: &"iyzw"{\0,\x01,\x01,\x01,\x01,\x01} &""{\0,p,p,v,\0} :=> &"iyzw"{\0,p,r,k,y,\0} | C21: 0.033929 | D21: 1 | E21: 0.033929 | G21: of:=IF([.C21]=1;"";[.C21]) -> 0.033929 | H21: of:=IF([.D21]=1;"";[.D21]) ->  | I21: of:=IF([.E21]=1;"";[.E21]) -> 0.033929
A22: 21 | B22: strcat: &"dqik"{\0,\x01,\x01,\x01,\x01,\x01} &"z"{\0,p,f,\0} :=> &"dqikz"{\0,p,t,m,\0} | C22: 0.0382807 | D22: 1 | E22: 0.0204906 | G22: of:=IF([.C22]=1;"";[.C22]) -> 0.0382807 | H22: of:=IF([.D22]=1;"";[.D22]) ->  | I22: of:=IF([.E22]=1;"";[.E22]) -> 0.0204906
A23: 22 | B23: strcat: &"goxp"{\0,\x01,\x01,\x01,\x01,\x01} &"qc"{\0,p,\0} :=> &"goxpqc"{\0,p,q,\0} | C23: 0.0432182 | D23: 0 | E23: 0 | G23: of:=IF([.C23]=1;"";[.C23]) -> 0.0432182 | H23: of:=IF([.D23]=1;"";[.D23]) -> 0 | I23: of:=IF([.E23]=1;"";[.E23]) -> 0
A24: 23 | B24: strcat: &"rdtj"{\0,\x01,\x01,\x01,\x01,\x01} &"zng"{\0,\0} :=> &"rdtjzng"{\0,p,\0} | C24: 0.0364779 | D24: 0.07377 | E24: 0.010631 | G24: of:=IF([.C24]=1;"";[.C24]) -> 0.0364779 | H24: of:=IF([.D24]=1;"";[.D24]) -> 0.07377 | I24: of:=IF([.E24]=1;"";[.E24]) -> 0.010631
A25: 24 | B25: strcat: &"xhns"{\0,\x01,\x01,\x01,\x01,\x01} &"nbse"{\0} :=> &"xhnsnbse"{\0,\0} | C25: 0.0429003 | D25: 0.0441361 | E25: 0.0123059 | G25: of:=IF([.C25]=1;"";[.C25]) -> 0.0429003 | H25: of:=IF([.D25]=1;"";[.D25]) -> 0.0441361 | I25: of:=IF([.E25]=1;"";[.E25]) -> 0.0123059
A26: 25 | B26: strcat: &"nosih"{\0,\x01,\x01,\x01,\x01} &""{\0,p,y,r,\0} :=> &"nosih"{\0,p,e,o,\0} | C26: 0.0283683 | D26: 1 | E26: 0.0283683 | G26: of:=IF([.C26]=1;"";[.C26]) -> 0.0283683 | H26: of:=IF([.D26]=1;"";[.D26]) ->  | I26: of:=IF([.E26]=1;"";[.E26]) -> 0.0283683
A27: 26 | B27: strcat: &"ypfzx"{\0,\x01,\x01,\x01,\x01} &"o"{\0,p,o,\0} :=> &"ypfzxo"{\0,p,t,\0} | C27: 0 | D27: 1 | E27: 0 | G27: of:=IF([.C27]=1;"";[.C27]) -> 0 | H27: of:=IF([.D27]=1;"";[.D27]) ->  | I27: of:=IF([.E27]=1;"";[.E27]) -> 0
A28: 27 | B28: strcat: &"fipwu"{\0,\x01,\x01,\x01,\x01} &"kr"{\0,p,\0} :=> &"fipwukr"{\0,p,\0} | C28: 0.0237847 | D28: 0.197243 | E28: 0.0129031 | G28: of:=IF([.C28]=1;"";[.C28]) -> 0.0237847 | H28: of:=IF([.D28]=1;"";[.D28]) -> 0.197243 | I28: of:=IF([.E28]=1;"";[.E28]) -> 0.0129031
A29: 28 | B29: strcat: &"tuseh"{\0,\x01,\x01,\x01,\x01} &"ezi"{\0,\0} :=> &"tusehezi"{\0,\0} | C29: 0.0298802 | D29: 0.0767781 | E29: 0.0131155 | G29: of:=IF([.C29]=1;"";[.C29]) -> 0.0298802 | H29: of:=IF([.D29]=1;"";[.D29]) -> 0.0767781 | I29: of:=IF([.E29]=1;"";[.E29]) -> 0.0131155
A30: 29 | B30: strcat: &"bistu"{\0,\x01,\x01,\x01,\x01} &"ibts"{\0} :=> &"bistuibts"{\0} | C30: 0.0309151 | D30: 0.0439557 | E30: 0.0113322 | G30: of:=IF([.C30]=1;"";[.C30]) -> 0.0309151 | H30: of:=IF([.D30]=1;"";[.D30]) -> 0.0439557 | I30: of:=IF([.E30]=1;"";[.E30]) -> 0.0113322
A31: 30 | B31: strcat: &"ivngok"{\0,\x01,\x01,\x01} &""{\0,p,z,y,\0} :=> &"ivngok"{\0,p,i,\0} | C31: 0.0197059 | D31: 1 | E31: 0.0197059 | G31: of:=IF([.C31]=1;"";[.C31]) -> 0.0197059 | H31: of:=IF([.D31]=1;"";[.D31]) ->  | I31: of:=IF([.E31]=1;"";[.E31]) -> 0.0197059
A32: 31 | B32: strcat: &"bgzlms"{\0,\x01,\x01,\x01} &"k"{\0,p,b,\0} :=> &"bgzlmsk"{\0,p,\0} | C32: 0.014704 | D32: 1 | E32: 0.0117275 | G32: of:=IF([.C32]=1;"";[.C32]) -> 0.014704 | H32: of:=IF([.D32]=1;"";[.D32]) ->  | I32: of:=IF([.E32]=1;"";[.E32]) -> 0.0117275
A33: 32 | B33: strcat: &"jghzep"{\0,\x01,\x01,\x01} &"ih"{\0,p,\0} :=> &"jghzepih"{\0,\0} | C33: 0 | D33: 0.187319 | E33: 0 | G33: of:=IF([.C33]=1;"";[.C33]) -> 0 | H33: of:=IF([.D33]=1;"";[.D33]) -> 0.187319 | I33: of:=IF([.E33]=1;"";[.E33]) -> 0
A34: 33 | B34: strcat: &"vfgegw"{\0,\x01,\x01,\x01} &"fjf"{\0,\0} :=> &"vfgegwfjf"{\0} | C34: 0 | D34: 0.0499784 | E34: 0 | G34: of:=IF([.C34]=1;"";[.C34]) -> 0 | H34: of:=IF([.D34]=1;"";[.D34]) -> 0.0499784 | I34: of:=IF([.E34]=1;"";[.E34]) -> 0
A35: 34 | B35: strcat: &"wzbzip"{\0,\x01,\x01,\x01} &&10 :=> &"wzbzipzctr"{} | C35: 0.0129163 | D35: 0.00593172 | G35: of:=IF([.C35]=1;"";[.C35]) -> 0.0129163 | H35: of:=IF([.D35]=1;"";[.D35]) -> 0.00593172 | I35: of:=IF([.E35]=1;"";[.E35]) ->  
A36: 35 | B36: strcat: &"azlcbuw"{\0,\x01,\x01} &""{\0,p,u,t,\0} :=> &"azlcbuw"{\0,p,\0} | C36: 0.012442 | D36: 1 | E36: 0.012442 | G36: of:=IF([.C36]=1;"";[.C36]) -> 0.012442 | H36: of:=IF([.D36]=1;"";[.D36]) ->  | I36: of:=IF([.E36]=1;"";[.E36]) -> 0.012442
A37: 36 | B37: strcat: &"ommbuvb"{\0,\x01,\x01} &"q"{\0,p,z,\0} :=> &"ommbuvbq"{\0,\0} | C37: 0 | D37: 1 | E37: 0 | G37: of:=IF([.C37]=1;"";[.C37]) -> 0 | H37: of:=IF([.D37]=1;"";[.D37]) ->  | I37: of:=IF([.E37]=1;"";[.E37]) -> 0
A38: 37 | B38: strcat: &"wrzdzsj"{\0,\x01,\x01} &"lv"{\0,p,\0} :=> &"wrzdzsjlv"{\0} | C38: 0.0104328 | D38: 0.206077 | E38: 0.00668582 | G38: of:=IF([.C38]=1;"";[.C38]) -> 0.0104328 | H38: of:=IF([.D38]=1;"";[.D38]) -> 0.206077 | I38: of:=IF([.E38]=1;"";[.E38]) -> 0.00668582
A39: 38 | B39: strcat: &"ntxolmkz"{\0,\x01} &""{\0,p,n,r,\0} :=> &"ntxolmkz"{\0,\0} | C39: 0.00886344 | D39: 1 | E39: 0.00886344 | G39: of:=IF([.C39]=1;"";[.C39]) -> 0.00886344 | H39: of:=IF([.D39]=1;"";[.D39]) ->  | I39: of:=IF([.E39]=1;"";[.E39]) -> 0.00886344
A40: 39 | B40: strcat: &"cpmjgfxr"{\0,\x01} &"f"{\0,p,q,\0} :=> &"cpmjgfxrf"{\0} | C40: 0 | D40: 1 | E40: 0 | G40: of:=IF([.C40]=1;"";[.C40]) -> 0 | H40: of:=IF([.D40]=1;"";[.D40]) ->  | I40: of:=IF([.E40]=1;"";[.E40]) -> 0
A41: 40 | B41: strcat: &"akezatbnm"{\0} &""{\0,p,d,p,\0} :=> &"akezatbnm"{\0} | C41: 0.0100218 | D41: 1 | E41: 0.0100218 | G41: of:=IF([.C41]=1;"";[.C41]) -> 0.0100218 | H41: of:=IF([.D41]=1;"";[.D41]) ->  | I41: of:=IF([.E41]=1;"";[.E41]) -> 0.0100218
A42: 1 | B42: strncat: &""{\0,\x01,\x01,\x01,\x01,\x01,\x01,\x01,\x01,\x01} &""{\0,p,r,g,\0} 4 :=> &""{\0,p,n,x,o,x,g,e,p,\0} | C42: 1 | D42: 1 | E42: 1 | G42: of:=IF([.C42]=1;"";[.C42]) ->  | H42: of:=IF([.D42]=1;"";[.D42]) ->  | I42: of:=IF([.E42]=1;"";[.E42]) ->  | K42: of:=AVERAGE([.G42:.G82]) -> 0.0441200580645161 | L42: of:=AVERAGE([.H42:.H82]) -> 0.104573631818182 | M42: of:=AVERAGE([.I42:.I82]) -> 0.0345557608108108 | O42: of:=AVERAGE([.K42:.M42]) -> 0.0610831502311696
A43: 2 | B43: strncat: &""{\0,\x01,\x01,\x01,\x01,\x01,\x01,\x01,\x01,\x01} &"v"{\0,p,u,\0} 4 :=> &"v"{\0,p,m,k,t,d,r,g,\0} | C43: 1 | D43: 1 | E43: 1 | G43: of:=IF([.C43]=1;"";[.C43]) ->  | H43: of:=IF([.D43]=1;"";[.D43]) ->  | I43: of:=IF([.E43]=1;"";[.E43]) -> 
A44: 3 | B44: strncat: &""{\0,\x01,\x01,\x01,\x01,\x01,\x01,\x01,\x01,\x01} &"rk"{\0,p,\0} 4 :=> &"rk"{\0,p,i,c,c,t,v,\0} | C44: 1 | D44: 0.215236 | E44: 0.215236 | G44: of:=IF([.C44]=1;"";[.C44]) ->  | H44: of:=IF([.D44]=1;"";[.D44]) -> 0.215236 | I44: of:=IF([.E44]=1;"";[.E44]) -> 0.215236
A45: 4 | B45: strncat: &""{\0,\x01,\x01,\x01,\x01,\x01,\x01,\x01,\x01,\x01} &"clz"{\0,\0} 4 :=> &"clz"{\0,p,b,s,s,k,\0} | C45: 1 | D45: 0.0755339 | E45: 0.0755339 | G45: of:=IF([.C45]=1;"";[.C45]) ->  | H45: of:=IF([.D45]=1;"";[.D45]) -> 0.0755339 | I45: of:=IF([.E45]=1;"";[.E45]) -> 0.0755339
A46: 5 | B46: strncat: &""{\0,\x01,\x01,\x01,\x01,\x01,\x01,\x01,\x01,\x01} &"bccl"{\0} 4 :=> &"bccl"{\0,p,l,i,n,\0} | C46: 1 | D46: 0.0414346 | E46: 0.0414346 | G46: of:=IF([.C46]=1;"";[.C46]) ->  | H46: of:=IF([.D46]=1;"";[.D46]) -> 0.0414346 | I46: of:=IF([.E46]=1;"";[.E46]) -> 0.0414346
A47: 6 | B47: strncat: &"d"{\0,\x01,\x01,\x01,\x01,\x01,\x01,\x01,\x01} &""{\0,p,w,g,\0} 4 :=> &"d"{\0,p,f,f,k,i,y,f,\0} | C47: 1 | D47: 1 | E47: 1 | G47: of:=IF([.C47]=1;"";[.C47]) ->  | H47: of:=IF([.D47]=1;"";[.D47]) ->  | I47: of:=IF([.E47]=1;"";[.E47]) -> 
A48: 7 | B48: strncat: &"x"{\0,\x01,\x01,\x01,\x01,\x01,\x01,\x01,\x01} &"u"{\0,p,n,\0} 4 :=> &"xu"{\0,p,s,o,h,z,w,\0} | C48: 1 | D48: 1 | E48: 0.196751 | G48: of:=IF([.C48]=1;"";[.C48]) ->  | H48: of:=IF([.D48]=1;"";[.D48]) ->  | I48: of:=IF([.E48]=1;"";[.E48]) -> 0.196751
A49: 8 | B49: strncat: &"t"{\0,\x01,\x01,\x01,\x01,\x01,\x01,\x01,\x01} &"bo"{\0,p,\0} 4 :=> &"tbo"{\0,p,y,h,k,c,\0} | C49: 1 | D49: 0.215706 | E49: 0.0807619 | G49: of:=IF([.C49]=1;"";[.C49]) ->  | H49: of:=IF([.D49]=1;"";[.D49]) -> 0.215706 | I49: of:=IF([.E49]=1;"";[.E49]) -> 0.0807619
A50: 9 | B50: strncat: &"s"{\0,\x01,\x01,\x01,\x01,\x01,\x01,\x01,\x01} &"hjb"{\0,\0} 4 :=> &"shjb"{\0,p,i,v,n,\0} | C50: 1 | D50: 0.0457173 | E50: 0.0276942 | G50: of:=IF([.C50]=1;"";[.C50]) ->  | H50: of:=IF([.D50]=1;"";[.D50]) -> 0.0457173 | I50: of:=IF([.E50]=1;"";[.E50]) -> 0.0276942
A51: 10 | B51: strncat: &"b"{\0,\x01,\x01,\x01,\x01,\x01,\x01,\x01,\x01} &"grmy"{\0} 4 :=> &"bgrmy"{\0,p,c,b,\0} | C51: 1 | D51: 0.0450715 | E51: 0.024706 | G51: of:=IF([.C51]=1;"";[.C51]) ->  | H51: of:=IF([.D51]=1;"";[.D51]) -> 0.0450715 | I51: of:=IF([.E51]=1;"";[.E51]) -> 0.024706
A52: 11 | B52: strncat: &"pm"{\0,\x01,\x01,\x01,\x01,\x01,\x01,\x01} &""{\0,p,r,c,\0} 4 :=> &"pm"{\0,p,w,h,k,f,y,\0} | C52: 0.200999 | D52: 1 | E52: 0.200999 | G52: of:=IF([.C52]=1;"";[.C52]) -> 0.200999 | H52: of:=IF([.D52]=1;"";[.D52]) ->  | I52: of:=IF([.E52]=1;"";[.E52]) -> 0.200999
A53: 12 | B53: strncat: &"oz"{\0,\x01,\x01,\x01,\x01,\x01,\x01,\x01} &"t"{\0,p,n,\0} 4 :=> &"ozt"{\0,p,o,f,k,v,\0} | C53: 0.198819 | D53: 1 | E53: 0.0677152 | G53: of:=IF([.C53]=1;"";[.C53]) -> 0.198819 | H53: of:=IF([.D53]=1;"";[.D53]) ->  | I53: of:=IF([.E53]=1;"";[.E53]) -> 0.0677152
A54: 13 | B54: strncat: &"im"{\0,\x01,\x01,\x01,\x01,\x01,\x01,\x01} &"ia"{\0,p,\0} 4 :=> &"imia"{\0,p,r,v,m,\0} | C54: 0.2171 | D54: 0.217558 | E54: 0.0473309 | G54: of:=IF([.C54]=1;"";[.C54]) -> 0.2171 | H54: of:=IF([.D54]=1;"";[.D54]) -> 0.217558 | I54: of:=IF([.E54]=1;"";[.E54]) -> 0.0473309
A55: 14 | B55: strncat: &"ms"{\0,\x01,\x01,\x01,\x01,\x01,\x01,\x01} &"tef"{\0,\0} 4 :=> &"mstef"{\0,p,b,s,\0} | C55: 0.211356 | D55: 0.0880066 | E55: 0.0307808 | G55: of:=IF([.C55]=1;"";[.C55]) -> 0.211356 | H55: of:=IF([.D55]=1;"";[.D55]) -> 0.0880066 | I55: of:=IF([.E55]=1;"";[.E55]) -> 0.0307808
A56: 15 | B56: strncat: &"qd"{\0,\x01,\x01,\x01,\x01,\x01,\x01,\x01} &"qqda"{\0} 4 :=> &"qdqqda"{\0,p,c,\0} | C56: 0 | D56: 0 | E56: 0 | G56: of:=IF([.C56]=1;"";[.C56]) -> 0 | H56: of:=IF([.D56]=1;"";[.D56]) -> 0 | I56: of:=IF([.E56]=1;"";[.E56]) -> 0
A57: 16 | B57: strncat: &"lbh"{\0,\x01,\x01,\x01,\x01,\x01,\x01} &""{\0,p,p,o,\0} 4 :=> &"lbh"{\0,p,i,g,q,e,\0} | C57: 0.0695259 | D57: 1 | E57: 0.0695259 | G57: of:=IF([.C57]=1;"";[.C57]) -> 0.0695259 | H57: of:=IF([.D57]=1;"";[.D57]) ->  | I57: of:=IF([.E57]=1;"";[.E57]) -> 0.0695259
A58: 17 | B58: strncat: &"nhx"{\0,\x01,\x01,\x01,\x01,\x01,\x01} &"r"{\0,p,s,\0} 4 :=> &"nhxr"{\0,p,q,k,v,\0} | C58: 0 | D58: 1 | E58: 0 | G58: of:=IF([.C58]=1;"";[.C58]) -> 0 | H58: of:=IF([.D58]=1;"";[.D58]) ->  | I58: of:=IF([.E58]=1;"";[.E58]) -> 0
A59: 18 | B59: strncat: &"jdt"{\0,\x01,\x01,\x01,\x01,\x01,\x01} &"ea"{\0,p,\0} 4 :=> &"jdtea"{\0,p,o,c,\0} | C59: 0.0620663 | D59: 0.22156 | E59: 0.0246673 | G59: of:=IF([.C59]=1;"";[.C59]) -> 0.0620663 | H59: of:=IF([.D59]=1;"";[.D59]) -> 0.22156 | I59: of:=IF([.E59]=1;"";[.E59]) -> 0.0246673
A60: 19 | B60: strncat: &"qpx"{\0,\x01,\x01,\x01,\x01,\x01,\x01} &"okn"{\0,\0} 4 :=> &"qpxokn"{\0,p,l,\0} | C60: 0 | D60: 0.0818856 | E60: 0 | G60: of:=IF([.C60]=1;"";[.C60]) -> 0 | H60: of:=IF([.D60]=1;"";[.D60]) -> 0.0818856 | I60: of:=IF([.E60]=1;"";[.E60]) -> 0
A61: 20 | B61: strncat: &"olh"{\0,\x01,\x01,\x01,\x01,\x01,\x01} &"nycq"{\0} 4 :=> &"olhnycq"{\0,p,\0} | C61: 0.0790102 | D61: 0.0412723 | E61: 0.0144705 | G61: of:=IF([.C61]=1;"";[.C61]) -> 0.0790102 | H61: of:=IF([.D61]=1;"";[.D61]) -> 0.0412723 | I61: of:=IF([.E61]=1;"";[.E61]) -> 0.0144705
A62: 21 | B62: strncat: &"alqz"{\0,\x01,\x01,\x01,\x01,\x01} &""{\0,p,d,n,\0} 4 :=> &"alqz"{\0,p,e,w,c,\0} | C62: 0 | D62: 1 | E62: 0 | G62: of:=IF([.C62]=1;"";[.C62]) -> 0 | H62: of:=IF([.D62]=1;"";[.D62]) ->  | I62: of:=IF([.E62]=1;"";[.E62]) -> 0
A63: 22 | B63: strncat: &"panw"{\0,\x01,\x01,\x01,\x01,\x01} &"n"{\0,p,z,\0} 4 :=> &"panwn"{\0,p,z,t,\0} | C63: 0.0457509 | D63: 1 | E63: 0.0292852 | G63: of:=IF([.C63]=1;"";[.C63]) -> 0.0457509 | H63: of:=IF([.D63]=1;"";[.D63]) ->  | I63: of:=IF([.E63]=1;"";[.E63]) -> 0.0292852
A64: 23 | B64: strncat: &"ddtt"{\0,\x01,\x01,\x01,\x01,\x01} &"eq"{\0,p,\0} 4 :=> &"ddtteq"{\0,p,a,\0} | C64: 0.0421504 | D64: 0.205754 | E64: 0.0199572 | G64: of:=IF([.C64]=1;"";[.C64]) -> 0.0421504 | H64: of:=IF([.D64]=1;"";[.D64]) -> 0.205754 | I64: of:=IF([.E64]=1;"";[.E64]) -> 0.0199572
A65: 24 | B65: strncat: &"davz"{\0,\x01,\x01,\x01,\x01,\x01} &"jtv"{\0,\0} 4 :=> &"davzjtv"{\0,p,\0} | C65: 0.0315569 | D65: 0.0567542 | E65: 0.00750501 | G65: of:=IF([.C65]=1;"";[.C65]) -> 0.0315569 | H65: of:=IF([.D65]=1;"";[.D65]) -> 0.0567542 | I65: of:=IF([.E65]=1;"";[.E65]) -> 0.00750501
A66: 25 | B66: strncat: &"agaq"{\0,\x01,\x01,\x01,\x01,\x01} &"qdbo"{\0} 4 :=> &"agaqqdbo"{\0,\0} | C66: 0.043752 | D66: 0 | E66: 0 | G66: of:=IF([.C66]=1;"";[.C66]) -> 0.043752 | H66: of:=IF([.D66]=1;"";[.D66]) -> 0 | I66: of:=IF([.E66]=1;"";[.E66]) -> 0
A67: 26 | B67: strncat: &"gezcq"{\0,\x01,\x01,\x01,\x01} &""{\0,p,c,x,\0} 4 :=> &"gezcq"{\0,p,z,d,\0} | C67: 0.0233208 | D67: 1 | E67: 0.0233208 | G67: of:=IF([.C67]=1;"";[.C67]) -> 0.0233208 | H67: of:=IF([.D67]=1;"";[.D67]) ->  | I67: of:=IF([.E67]=1;"";[.E67]) -> 0.0233208
A68: 27 | B68: strncat: &"zgbts"{\0,\x01,\x01,\x01,\x01} &"s"{\0,p,v,\0} 4 :=> &"zgbtss"{\0,p,w,\0} | C68: 0.0230898 | D68: 1 | E68: 0.0173034 | G68: of:=IF([.C68]=1;"";[.C68]) -> 0.0230898 | H68: of:=IF([.D68]=1;"";[.D68]) ->  | I68: of:=IF([.E68]=1;"";[.E68]) -> 0.0173034
A69: 28 | B69: strncat: &"yldyg"{\0,\x01,\x01,\x01,\x01} &"ht"{\0,p,\0} 4 :=> &"yldyght"{\0,p,\0} | C69: 0.0262455 | D69: 0.214286 | E69: 0.0150595 | G69: of:=IF([.C69]=1;"";[.C69]) -> 0.0262455 | H69: of:=IF([.D69]=1;"";[.D69]) -> 0.214286 | I69: of:=IF([.E69]=1;"";[.E69]) -> 0.0150595
A70: 29 | B70: strncat: &"joikl"{\0,\x01,\x01,\x01,\x01} &"emd"{\0,\0} 4 :=> &"joiklemd"{\0,\0} | C70: 0.0278539 | D70: 0.0751878 | E70: 0.0121587 | G70: of:=IF([.C70]=1;"";[.C70]) -> 0.0278539 | H70: of:=IF([.D70]=1;"";[.D70]) -> 0.0751878 | I70: of:=IF([.E70]=1;"";[.E70]) -> 0.0121587
A71: 30 | B71: strncat: &"mkxnz"{\0,\x01,\x01,\x01,\x01} &"owup"{\0} 4 :=> &"mkxnzowup"{\0} | C71: 0 | D71: 0.0401765 | E71: 0 | G71: of:=IF([.C71]=1;"";[.C71]) -> 0 | H71: of:=IF([.D71]=1;"";[.D71]) -> 0.0401765 | I71: of:=IF([.E71]=1;"";[.E71]) -> 0
A72: 31 | B72: strncat: &"jsboka"{\0,\x01,\x01,\x01} &""{\0,p,y,q,\0} 4 :=> &"jsboka"{\0,p,h,\0} | C72: 0.0164047 | D72: 1 | E72: 0.0164047 | G72: of:=IF([.C72]=1;"";[.C72]) -> 0.0164047 | H72: of:=IF([.D72]=1;"";[.D72]) ->  | I72: of:=IF([.E72]=1;"";[.E72]) -> 0.0164047
A73: 32 | B73: strncat: &"zbtzvw"{\0,\x01,\x01,\x01} &"t"{\0,p,s,\0} 4 :=> &"zbtzvwt"{\0,p,\0} | C73: 0 | D73: 1 | E73: 0 | G73: of:=IF([.C73]=1;"";[.C73]) -> 0 | H73: of:=IF([.D73]=1;"";[.D73]) ->  | I73: of:=IF([.E73]=1;"";[.E73]) -> 0
A74: 33 | B74: strncat: &"mqgffj"{\0,\x01,\x01,\x01} &"vz"{\0,p,\0} 4 :=> &"mqgffjvz"{\0,\0} | C74: 0 | D74: 0.11996 | E74: 0 | G74: of:=IF([.C74]=1;"";[.C74]) -> 0 | H74: of:=IF([.D74]=1;"";[.D74]) -> 0.11996 | I74: of:=IF([.E74]=1;"";[.E74]) -> 0
A75: 34 | B75: strncat: &"nxovag"{\0,\x01,\x01,\x01} &"ngt"{\0,\0} 4 :=> &"nxovagngt"{\0} | C75: 0.0192953 | D75: 0.0847576 | E75: 0.0104632 | G75: of:=IF([.C75]=1;"";[.C75]) -> 0.0192953 | H75: of:=IF([.D75]=1;"";[.D75]) -> 0.0847576 | I75: of:=IF([.E75]=1;"";[.E75]) -> 0.0104632
A76: 35 | B76: strncat: &"zfddck"{\0,\x01,\x01,\x01} &&10 4 :=> &"zfddckxpew"{} | C76: 0.0144356 | D76: 0 | G76: of:=IF([.C76]=1;"";[.C76]) -> 0.0144356 | H76: of:=IF([.D76]=1;"";[.D76]) -> 0 | I76: of:=IF([.E76]=1;"";[.E76]) ->  
A77: 36 | B77: strncat: &"jgoocky"{\0,\x01,\x01} &""{\0,p,a,h,\0} 4 :=> &"jgoocky"{\0,p,\0} | C77: 0 | D77: 1 | E77: 0 | G77: of:=IF([.C77]=1;"";[.C77]) -> 0 | H77: of:=IF([.D77]=1;"";[.D77]) ->  | I77: of:=IF([.E77]=1;"";[.E77]) -> 0
A78: 37 | B78: strncat: &"ebrxijg"{\0,\x01,\x01} &"a"{\0,p,x,\0} 4 :=> &"ebrxijga"{\0,\0} | C78: 0 | D78: 1 | E78: 0 | G78: of:=IF([.C78]=1;"";[.C78]) -> 0 | H78: of:=IF([.D78]=1;"";[.D78]) ->  | I78: of:=IF([.E78]=1;"";[.E78]) -> 0
A79: 38 | B79: strncat: &"nuisfyw"{\0,\x01,\x01} &"gr"{\0,p,\0} 4 :=> &"nuisfywgr"{\0} | C79: 0.0149896 | D79: 0.214762 | E79: 0.00949824 | G79: of:=IF([.C79]=1;"";[.C79]) -> 0.0149896 | H79: of:=IF([.D79]=1;"";[.D79]) -> 0.214762 | I79: of:=IF([.E79]=1;"";[.E79]) -> 0.00949824
A80: 39 | B80: strncat: &"bqnejpzn"{\0,\x01} &""{\0,p,x,v,\0} 4 :=> &"bqnejpzn"{\0,\0} | C80: 0 | D80: 1 | E80: 0 | G80: of:=IF([.C80]=1;"";[.C80]) -> 0 | H80: of:=IF([.D80]=1;"";[.D80]) ->  | I80: of:=IF([.E80]=1;"";[.E80]) -> 0
A81: 40 | B81: strncat: &"tkwjsoaf"{\0,\x01} &"x"{\0,p,g,\0} 4 :=> &"tkwjsoafx"{\0} | C81: 0 | D81: 1 | E81: 0 | G81: of:=IF([.C81]=1;"";[.C81]) -> 0 | H81: of:=IF([.D81]=1;"";[.D81]) ->  | I81: of:=IF([.E81]=1;"";[.E81]) -> 0
A82: 41 | B82: strncat: &"eipjgeusx"{\0} &""{\0,p,p,t,\0} 4 :=> &"eipjgeusx"{\0} | C82: 0 | D82: 1 | E82: 0 | G82: of:=IF([.C82]=1;"";[.C82]) -> 0 | H82: of:=IF([.D82]=1;"";[.D82]) ->  | I82: of:=IF([.E82]=1;"";[.E82]) -> 0

Sheet: strstr
A1: # | B1: Test Case | C1: N | G1: N1 | H1: N2 | I1: N3
A2: 1 | B2: strstr: &"n"{\0,h,c,q,\0} &"n"{\0,\0} :=> &"n"{\0,h,c,q,\0} | C2: 1 | D2: 1 | E2: 1 | G2: of:=IF([.C2]=1;"";[.C2]) ->  | H2: of:=IF([.D2]=1;"";[.D2]) ->  | I2: of:=IF([.E2]=1;"";[.E2]) ->  | K2: of:=AVERAGE([.G2:.G19]) -> 0.0774512823529412 | L2: of:=AVERAGE([.H2:.H19]) -> 0.198725555555556 | M2: of:=AVERAGE([.I2:.I19]) -> 0.10136994375 | O2: of:=AVERAGE([.K2:.M2]) -> 0.125848927219499
A3: 2 | B3: strstr: &"co"{\0,h,f,\0} &"c"{\0,\0} :=> &"co"{\0,h,f,\0} | C3: 0.22156 | D3: 1 | E3: 0.22156 | G3: of:=IF([.C3]=1;"";[.C3]) -> 0.22156 | H3: of:=IF([.D3]=1;"";[.D3]) ->  | I3: of:=IF([.E3]=1;"";[.E3]) -> 0.22156
A4: 3 | B4: strstr: &"nh"{\0,b,h,\0} &"h"{\0,\0} :=> &"h"{\0,b,h,\0,54} | C4: 0.203278 | D4: 1 | E4: 1 | G4: of:=IF([.C4]=1;"";[.C4]) -> 0.203278 | H4: of:=IF([.D4]=1;"";[.D4]) ->  | I4: of:=IF([.E4]=1;"";[.E4]) -> 
A5: 4 | B5: strstr: &"zbn"{\0,h,\0} &"z"{\0,\0} :=> &"zbn"{\0,h,\0} | C5: 0.0650307 | D5: 1 | E5: 0.0650307 | G5: of:=IF([.C5]=1;"";[.C5]) -> 0.0650307 | H5: of:=IF([.D5]=1;"";[.D5]) ->  | I5: of:=IF([.E5]=1;"";[.E5]) -> 0.0650307
A6: 5 | B6: strstr: &"meb"{\0,b,\0} &"e"{\0,\0} :=> &"eb"{\0,b,\0,54} | C6: 0.0857163 | D6: 1 | E6: 0.209333 | G6: of:=IF([.C6]=1;"";[.C6]) -> 0.0857163 | H6: of:=IF([.D6]=1;"";[.D6]) ->  | I6: of:=IF([.E6]=1;"";[.E6]) -> 0.209333
A7: 6 | B7: strstr: &"ebab"{\0,\0} &"e"{\0,\0} :=> &"ebab"{\0,\0} | C7: 0.0455418 | D7: 1 | E7: 0.0455418 | G7: of:=IF([.C7]=1;"";[.C7]) -> 0.0455418 | H7: of:=IF([.D7]=1;"";[.D7]) ->  | I7: of:=IF([.E7]=1;"";[.E7]) -> 0.0455418
A8: 7 | B8: strstr: &"temm"{\0,\0} &"e"{\0,\0} :=> &"emm"{\0,\0,54} | C8: 0.0475101 | D8: 1 | E8: 0.0855899 | G8: of:=IF([.C8]=1;"";[.C8]) -> 0.0475101 | H8: of:=IF([.D8]=1;"";[.D8]) ->  | I8: of:=IF([.E8]=1;"";[.E8]) -> 0.0855899
A9: 8 | B9: strstr: &"yukdp"{\0} &"y"{\0,\0} :=> &"yukdp"{\0} | C9: 0.0222461 | D9: 1 | E9: 0.0222461 | G9: of:=IF([.C9]=1;"";[.C9]) -> 0.0222461 | H9: of:=IF([.D9]=1;"";[.D9]) ->  | I9: of:=IF([.E9]=1;"";[.E9]) -> 0.0222461
A10: 9 | B10: strstr: &"aluwf"{\0} &"l"{\0,\0} :=> &"luwf"{\0,54} | C10: 0.0255834 | D10: 1 | E10: 0.0377817 | G10: of:=IF([.C10]=1;"";[.C10]) -> 0.0255834 | H10: of:=IF([.D10]=1;"";[.D10]) ->  | I10: of:=IF([.E10]=1;"";[.E10]) -> 0.0377817
A11: 10 | B11: strstr: &"he"{\0,d,m,\0} &"he"{\0} :=> &"he"{\0,d,m,\0} | C11: 0.226983 | D11: 0.226983 | E11: 0.226983 | G11: of:=IF([.C11]=1;"";[.C11]) -> 0.226983 | H11: of:=IF([.D11]=1;"";[.D11]) -> 0.226983 | I11: of:=IF([.E11]=1;"";[.E11]) -> 0.226983
A12: 11 | B12: strstr: &"urw"{\0,d,\0} &"ur"{\0} :=> &"urw"{\0,d,\0} | C12: 0.082543 | D12: 0.219364 | E12: 0.082543 | G12: of:=IF([.C12]=1;"";[.C12]) -> 0.082543 | H12: of:=IF([.D12]=1;"";[.D12]) -> 0.219364 | I12: of:=IF([.E12]=1;"";[.E12]) -> 0.082543
A13: 12 | B13: strstr: &"zza"{\0,a,\0} &"za"{\0} :=> &"za"{\0,a,\0,54} | C13: 0.0769691 | D13: 0.205157 | E13: 0.205157 | G13: of:=IF([.C13]=1;"";[.C13]) -> 0.0769691 | H13: of:=IF([.D13]=1;"";[.D13]) -> 0.205157 | I13: of:=IF([.E13]=1;"";[.E13]) -> 0.205157
A14: 13 | B14: strstr: &"qii"{\0,p,\0} &"ii"{\0} :=> &"ii"{\0,p,\0,54} | C14: 0.0699176 | D14: 0.191207 | E14: 0.191207 | G14: of:=IF([.C14]=1;"";[.C14]) -> 0.0699176 | H14: of:=IF([.D14]=1;"";[.D14]) -> 0.191207 | I14: of:=IF([.E14]=1;"";[.E14]) -> 0.191207
A15: 14 | B15: strstr: &"uzly"{\0,\0} &"uz"{\0} :=> &"uzly"{\0,\0} | C15: 0.0401177 | D15: 0.193391 | E15: 0.0401177 | G15: of:=IF([.C15]=1;"";[.C15]) -> 0.0401177 | H15: of:=IF([.D15]=1;"";[.D15]) -> 0.193391 | I15: of:=IF([.E15]=1;"";[.E15]) -> 0.0401177
A16: 15 | B16: strstr: &"ggrj"{\0,\0} &"gr"{\0} :=> &"grj"{\0,\0,54} | C16: 0.0398854 | D16: 0.214762 | E16: 0.0741044 | G16: of:=IF([.C16]=1;"";[.C16]) -> 0.0398854 | H16: of:=IF([.D16]=1;"";[.D16]) -> 0.214762 | I16: of:=IF([.E16]=1;"";[.E16]) -> 0.0741044
A17: 16 | B17: strstr: &"zqba"{\0,\0} &"qb"{\0} :=> &"qba"{\0,\0,54} | C17: 0.0278412 | D17: 0.138419 | E17: 0.0601574 | G17: of:=IF([.C17]=1;"";[.C17]) -> 0.0278412 | H17: of:=IF([.D17]=1;"";[.D17]) -> 0.138419 | I17: of:=IF([.E17]=1;"";[.E17]) -> 0.0601574
A18: 17 | B18: strstr: &"wcgjm"{\0} &"wc"{\0} :=> &"wcgjm"{\0} | C18: 0.0130395 | D18: 0.184011 | E18: 0.0130395 | G18: of:=IF([.C18]=1;"";[.C18]) -> 0.0130395 | H18: of:=IF([.D18]=1;"";[.D18]) -> 0.184011 | I18: of:=IF([.E18]=1;"";[.E18]) -> 0.0130395
A19: 18 | B19: strstr: &"yyefg"{\0} &"ye"{\0} :=> &"yefg"{\0,54} | C19: 0.0229089 | D19: 0.215236 | E19: 0.0415269 | G19: of:=IF([.C19]=1;"";[.C19]) -> 0.0229089 | H19: of:=IF([.D19]=1;"";[.D19]) -> 0.215236 | I19: of:=IF([.E19]=1;"";[.E19]) -> 0.0415269
A20: 19 | B20: strstr: &"ailup"{\0} &"il"{\0} :=> &"ilup"{\0,54} | C20: 0.0303588 | D20: 0.22025 | E20: 0.0465553 | G20: of:=IF([.C20]=1;"";[.C20]) -> 0.0303588 | H20: of:=IF([.D20]=1;"";[.D20]) -> 0.22025 | I20: of:=IF([.E20]=1;"";[.E20]) -> 0.0465553 | K20: of:=AVERAGE([.G20:.G24]) -> 0.0146838 | L20: of:=AVERAGE([.H20:.H24]) -> 0.22025 | M20: of:=AVERAGE([.I20:.I24]) -> 0.02249024 | O20: of:=AVERAGE([.K20:.M20]) -> 0.0858080133333333
A21: 1 | B21: strnstr: &"osgzb"{\0} &""{\0,p,\0} 2 :=> &"osgzb"{\0} | C21: 0.0214997 | D21: 1 | E21: 0.0214997 | G21: of:=IF([.C21]=1;"";[.C21]) -> 0.0214997 | H21: of:=IF([.D21]=1;"";[.D21]) ->  | I21: of:=IF([.E21]=1;"";[.E21]) -> 0.0214997
A22: 2 | B22: strnstr: &"vbirm"{\0} &"v"{\0,\0} 2 :=> &"vbirm"{\0} | C22: 0 | D22: 1 | E22: 0 | G22: of:=IF([.C22]=1;"";[.C22]) -> 0 | H22: of:=IF([.D22]=1;"";[.D22]) ->  | I22: of:=IF([.E22]=1;"";[.E22]) -> 0
A23: 3 | B23: strnstr: &"vfxrg"{\0} &"f"{\0,\0} 2 :=> &"fxrg"{\0,54} | C23: 0 | D23: 1 | E23: 0.0228357 | G23: of:=IF([.C23]=1;"";[.C23]) -> 0 | H23: of:=IF([.D23]=1;"";[.D23]) ->  | I23: of:=IF([.E23]=1;"";[.E23]) -> 0.0228357
A24: 4 | B24: strnstr: &"chzrg"{\0} &"ch"{\0} 2 :=> &"chzrg"{\0} | C24: 0.0215605 | D24: 0.22025 | E24: 0.0215605 | G24: of:=IF([.C24]=1;"";[.C24]) -> 0.0215605 | H24: of:=IF([.D24]=1;"";[.D24]) -> 0.22025 | I24: of:=IF([.E24]=1;"";[.E24]) -> 0.0215605
A25: 1 | B25: strpbrk: &"tunup"{\0} &"aeiou"{\0} :=> &"unup"{\0,54} | C25: 0.0297784 | D25: 0.0299288 | E25: 0.0461609 | G25: of:=IF([.C25]=1;"";[.C25]) -> 0.0297784 | H25: of:=IF([.D25]=1;"";[.D25]) -> 0.0299288 | I25: of:=IF([.E25]=1;"";[.E25]) -> 0.0461609 | K25: of:=AVERAGE([.G25:.G34]) -> 0.02653762 | L25: of:=AVERAGE([.H25:.H34]) -> 0.0299288 | M25: of:=AVERAGE([.I25:.I34]) -> 0.03270867 | O25: of:=AVERAGE([.K25:.M25]) -> 0.02972503
A26: 2 | B26: strpbrk: &"lobjy"{\0} &"aeiou"{\0} :=> &"objy"{\0,54} | C26: 0.0210111 | D26: 0.0299288 | E26: 0.0304697 | G26: of:=IF([.C26]=1;"";[.C26]) -> 0.0210111 | H26: of:=IF([.D26]=1;"";[.D26]) -> 0.0299288 | I26: of:=IF([.E26]=1;"";[.E26]) -> 0.0304697
A27: 3 | B27: strpbrk: &"vifps"{\0} &"aeiou"{\0} :=> &"ifps"{\0,54} | C27: 0.0246712 | D27: 0.0299288 | E27: 0.036748 | G27: of:=IF([.C27]=1;"";[.C27]) -> 0.0246712 | H27: of:=IF([.D27]=1;"";[.D27]) -> 0.0299288 | I27: of:=IF([.E27]=1;"";[.E27]) -> 0.036748
A28: 4 | B28: strpbrk: &"leaqs"{\0} &"aeiou"{\0} :=> &"eaqs"{\0,54} | C28: 0.0208049 | D28: 0.0299288 | E28: 0.0301212 | G28: of:=IF([.C28]=1;"";[.C28]) -> 0.0208049 | H28: of:=IF([.D28]=1;"";[.D28]) -> 0.0299288 | I28: of:=IF([.E28]=1;"";[.E28]) -> 0.0301212
A29: 5 | B29: strpbrk: &"haake"{\0} &"aeiou"{\0} :=> &"aake"{\0,54} | C29: 0.0286633 | D29: 0.0299288 | E29: 0.0431396 | G29: of:=IF([.C29]=1;"";[.C29]) -> 0.0286633 | H29: of:=IF([.D29]=1;"";[.D29]) -> 0.0299288 | I29: of:=IF([.E29]=1;"";[.E29]) -> 0.0431396
A30: 6 | B30: strpbrk: &"ulbde"{\0} &"aeiou"{\0} :=> &"ulbde"{\0} | C30: 0.0270857 | D30: 0.0299288 | E30: 0.0270857 | G30: of:=IF([.C30]=1;"";[.C30]) -> 0.0270857 | H30: of:=IF([.D30]=1;"";[.D30]) -> 0.0299288 | I30: of:=IF([.E30]=1;"";[.E30]) -> 0.0270857
A31: 7 | B31: strpbrk: &"oaned"{\0} &"aeiou"{\0} :=> &"oaned"{\0} | C31: 0.0315308 | D31: 0.0299288 | E31: 0.0315308 | G31: of:=IF([.C31]=1;"";[.C31]) -> 0.0315308 | H31: of:=IF([.D31]=1;"";[.D31]) -> 0.0299288 | I31: of:=IF([.E31]=1;"";[.E31]) -> 0.0315308
A32: 8 | B32: strpbrk: &"iiueo"{\0} &"aeiou"{\0} :=> &"iiueo"{\0} | C32: 0.0265182 | D32: 0.0299288 | E32: 0.0265182 | G32: of:=IF([.C32]=1;"";[.C32]) -> 0.0265182 | H32: of:=IF([.D32]=1;"";[.D32]) -> 0.0299288 | I32: of:=IF([.E32]=1;"";[.E32]) -> 0.0265182
A33: 9 | B33: strpbrk: &"ecasb"{\0} &"aeiou"{\0} :=> &"ecasb"{\0} | C33: 0.0299403 | D33: 0.0299288 | E33: 0.0299403 | G33: of:=IF([.C33]=1;"";[.C33]) -> 0.0299403 | H33: of:=IF([.D33]=1;"";[.D33]) -> 0.0299288 | I33: of:=IF([.E33]=1;"";[.E33]) -> 0.0299403
A34: 10 | B34: strpbrk: &"armtk"{\0} &"aeiou"{\0} :=> &"armtk"{\0} | C34: 0.0253723 | D34: 0.0299288 | E34: 0.0253723 | G34: of:=IF([.C34]=1;"";[.C34]) -> 0.0253723 | H34: of:=IF([.D34]=1;"";[.D34]) -> 0.0299288 | I34: of:=IF([.E34]=1;"";[.E34]) -> 0.0253723