Sheet: Sheet1
A1: Function | B1: E1 | C1: E2 | D1: E3 | E1: E4 | F1: E5 | G1: E6 | H1: E7 | I1: E8 | J1: E9 | K1: E10 | L1: M | M1: D | N1: Sigma
A2: strlen | B2: 0.08 | C2: 0.07 | D2: 0.08 | E2: 0.08 | F2: 0.08 | L2: of:=AVERAGE([.B2:.F2]) -> 0.078 | M2: of:=VARPA([.B2:.F2]) -> 0.000016
A3: strnlen | B3: 0.08 | C3: 0.08 | D3: 0.08 | E3: 0.09 | F3: 0.09 | L3: of:=AVERAGE([.B3:.F3]) -> 0.084 | M3: of:=VARPA([.B3:.F3]) -> 0.000024
A4: strcmp | B4: 0.04 | C4: 0.04 | D4: 0.04 | E4: 0.04 | F4: 0.04 | L4: of:=AVERAGE([.B4:.F4]) -> 0.04 | M4: of:=VARPA([.B4:.F4]) -> 0
A5: strncmp | B5: 0.04 | C5: 0.04 | D5: 0.04 | E5: 0.04 | F5: 0.03 | L5: of:=AVERAGE([.B5:.F5]) -> 0.038 | M5: of:=VARPA([.B5:.F5]) -> 0.000016
A6: sysfs_streq | B6: 0.05 | C6: 0.05 | D6: 0.05 | E6: 0.05 | F6: 0.05 | L6: of:=AVERAGE([.B6:.F6]) -> 0.05 | M6: of:=VARPA([.B6:.F6]) -> 0
A7: strcpy | B7: 0.07 | C7: 0.08 | D7: 0.07 | E7: 0.08 | F7: 0.07 | L7: of:=AVERAGE([.B7:.F7]) -> 0.074 | M7: of:=VARPA([.B7:.F7]) -> 0.000024
A8: strncpy | B8: 0.06 | C8: 0.07 | D8: 0.08 | E8: 0.06 | F8: 0.08 | L8: of:=AVERAGE([.B8:.F8]) -> 0.07 | M8: of:=VARPA([.B8:.F8]) -> 0.00008
A9: strcat | B9: 0.06 | C9: 0.06 | D9: 0.06 | E9: 0.05 | F9: 0.06 | L9: of:=AVERAGE([.B9:.F9]) -> 0.058 | M9: of:=VARPA([.B9:.F9]) -> 0.000016
A10: strncat | B10: 0.06 | C10: 0.07 | D10: 0.06 | E10: 0.06 | F10: 0.06 | L10: of:=AVERAGE([.B10:.F10]) -> 0.062 | M10: of:=VARPA([.B10:.F10]) -> 0.000016
A11: strstr | B11: 0.13 | C11: 0.12 | D11: 0.12 | E11: 0.11 | F11: 0.09 | L11: of:=AVERAGE([.B11:.F11]) -> 0.114 | M11: of:=VARPA([.B11:.F11]) -> 0.000184
A12: strnstr | B12: 0.09 | C12: 0.04 | D12: 0.08 | E12: 0.08 | F12: 0.08 | L12: of:=AVERAGE([.B12:.F12]) -> 0.074 | M12: of:=VARPA([.B12:.F12]) -> 0.000304
A13: strpbrk | B13: 0.03 | C13: 0.03 | D13: 0.03 | E13: 0.03 | F13: 0.03 | L13: of:=AVERAGE([.B13:.F13]) -> 0.03 | M13: of:=VARPA([.B13:.F13]) -> 0