Sheet: strlen
A1: strlen: &"\x01"{\0,\0,\0,\0,\0} :=> 1; | J1: # | K1: Test Case | L1: N | P1: FINAL
A2: strlen: &"\x01\x01"{\0,\0,\0,\0} :=> 2; | J2: 1 | K2: strlen: &"p"{\0,p,r,e,\0} :=> 1 | L2: 1 | N2: of:=IF([.L2]=1;"";[.L2]) ->  | P2: of:=AVERAGE([.N2:.N6]) -> 0.095242025
A3: strlen: &"\x01\x01\x01"{\0,\0,\0} :=> 3; | J3: 2 | K3: strlen: &"qu"{\0,p,r,\0} :=> 2 | L3: 0.212836 | N3: of:=IF([.L3]=1;"";[.L3]) -> 0.212836
A4: strlen: &"\x01\x01\x01\x01"{\0,\0} :=> 4; | J4: 3 | K4: strlen: &"jut"{\0,p,\0} :=> 3 | L4: 0.0850061 | N4: of:=IF([.L4]=1;"";[.L4]) -> 0.0850061
A5: strlen: &"\x01\x01\x01\x01\x01"{\0} :=> 5; | J5: 4 | K5: strlen: &"hest"{\0,\0} :=> 4 | L5: 0.0505273 | N5: of:=IF([.L5]=1;"";[.L5]) -> 0.0505273
A6: strnlen: &""{\0,\0,\0,\0,\0,\0} 6 :=> 0; 1; | J6: 5 | K6: strlen: &"besth"{\0} :=> 5 | L6: 0.0325987 | N6: of:=IF([.L6]=1;"";[.L6]) -> 0.0325987
A7: strnlen: &"\x01"{\0,\0,\0,\0,\0} 6 :=> 1; | J7: 1 | K7: strnlen: &""{\0,p,r,e,s,\0} 6 :=> 0 | L7: 1 | N7: of:=IF([.L7]=1;"";[.L7]) ->  | P7: of:=AVERAGE([.N7:.N12]) -> 0.0980317
A8: strnlen: &"\x01\x01"{\0,\0,\0,\0} 6 :=> 2; | J8: 2 | K8: strnlen: &"l"{\0,p,r,e,\0} 6 :=> 1 | L8: 1 | N8: of:=IF([.L8]=1;"";[.L8]) -> 
A9: strnlen: &"\x01\x01\x01"{\0,\0,\0} 6 :=> 3; | J9: 3 | K9: strnlen: &"wi"{\0,p,r,\0} 6 :=> 2 | L9: 0.218466 | N9: of:=IF([.L9]=1;"";[.L9]) -> 0.218466
A10: strnlen: &"\x01\x01\x01\x01"{\0,\0} 6 :=> 4; | J10: 4 | K10: strnlen: &"for"{\0,p,\0} 6 :=> 3 | L10: 0.0899511 | N10: of:=IF([.L10]=1;"";[.L10]) -> 0.0899511
A11: strnlen: &"\x01\x01\x01\x01\x01"{\0} 6 :=> 5; | J11: 5 | K11: strnlen: &"sthe"{\0,\0} 6 :=> 4 | L11: 0.051018 | N11: of:=IF([.L11]=1;"";[.L11]) -> 0.051018
J12: 6 | K12: strnlen: &"dinth"{\0} 6 :=> 5 | L12: 0.0326917 | N12: of:=IF([.L12]=1;"";[.L12]) -> 0.0326917

Sheet: strcmp
A1: # | B1: Test Case | C1: N1 | D1: N2 | L1: FINAL
A2: 1 | B2: strcmp: &"o"{\0,p,r,e,\0} &"o"{\0,p,r,e,\0} :=> 0 | C2: 1 | D2: 1 | F2: of:=IF([.C2]=1;"";[.C2]) ->  | G2: of:=IF([.D2]=1;"";[.D2]) ->  | H2: of:=IF([.E2]=1;"";[.E2]) ->   | I2: of:=AVERAGE([.F2:.F16]) -> 0.0519838571428571 | J2: of:=AVERAGE([.G2:.G16]) -> 0.0485374357142857 | L2: of:=AVERAGE([.I2:.J2]) -> 0.0502606464285714
A3: 2 | B3: strcmp: &"th"{\0,p,r,\0} &"th"{\0,p,r,\0} :=> 0 | C3: 0.227384 | D3: 0.227384 | F3: of:=IF([.C3]=1;"";[.C3]) -> 0.227384 | G3: of:=IF([.D3]=1;"";[.D3]) -> 0.227384 | H3: of:=IF([.E3]=1;"";[.E3]) ->  
A4: 3 | B4: strcmp: &"ges"{\0,p,\0} &"ges"{\0,p,\0} :=> 0 | C4: 0.0896591 | D4: 0.0896591 | F4: of:=IF([.C4]=1;"";[.C4]) -> 0.0896591 | G4: of:=IF([.D4]=1;"";[.D4]) -> 0.0896591 | H4: of:=IF([.E4]=1;"";[.E4]) ->  
A5: 4 | B5: strcmp: &"nthe"{\0,\0} &"nthe"{\0,\0} :=> 0 | C5: 0.0509534 | D5: 0.0509534 | F5: of:=IF([.C5]=1;"";[.C5]) -> 0.0509534 | G5: of:=IF([.D5]=1;"";[.D5]) -> 0.0509534 | H5: of:=IF([.E5]=1;"";[.E5]) ->  
A6: 5 | B6: strcmp: &"inthe"{\0} &"inthe"{\0} :=> 0 | C6: 0.0333747 | D6: 0.0333747 | F6: of:=IF([.C6]=1;"";[.C6]) -> 0.0333747 | G6: of:=IF([.D6]=1;"";[.D6]) -> 0.0333747 | H6: of:=IF([.E6]=1;"";[.E6]) ->  
A7: 6 | B7: strcmp: &"yesth"{\0} &"yestd"{\0} :=> 1 | C7: 0.0322095 | D7: 0.0293003 | F7: of:=IF([.C7]=1;"";[.C7]) -> 0.0322095 | G7: of:=IF([.D7]=1;"";[.D7]) -> 0.0293003 | H7: of:=IF([.E7]=1;"";[.E7]) ->  
A8: 7 | B8: strcmp: &"nthes"{\0} &"nthew"{\0} :=> -1 | C8: 0.0331665 | D8: 0.0324499 | F8: of:=IF([.C8]=1;"";[.C8]) -> 0.0331665 | G8: of:=IF([.D8]=1;"";[.D8]) -> 0.0324499 | H8: of:=IF([.E8]=1;"";[.E8]) ->  
A9: 8 | B9: strcmp: &"dinth"{\0} &"dindi"{\0} :=> 1 | C9: 0.0326917 | D9: 0.0320597 | F9: of:=IF([.C9]=1;"";[.C9]) -> 0.0326917 | G9: of:=IF([.D9]=1;"";[.D9]) -> 0.0320597 | H9: of:=IF([.E9]=1;"";[.E9]) ->  
A10: 9 | B10: strcmp: &"resth"{\0} &"resve"{\0} :=> -1 | C10: 0.0330663 | D10: 0.0294376 | F10: of:=IF([.C10]=1;"";[.C10]) -> 0.0330663 | G10: of:=IF([.D10]=1;"";[.D10]) -> 0.0294376 | H10: of:=IF([.E10]=1;"";[.E10]) ->  
A11: 10 | B11: strcmp: &"besth"{\0} &"bequt"{\0} :=> 1 | C11: 0.0325987 | D11: 0.029628 | F11: of:=IF([.C11]=1;"";[.C11]) -> 0.0325987 | G11: of:=IF([.D11]=1;"";[.D11]) -> 0.029628 | H11: of:=IF([.E11]=1;"";[.E11]) ->  
A12: 11 | B12: strcmp: &"prest"{\0} &"prges"{\0} :=> -1 | C12: 0.0323569 | D12: 0.0310071 | F12: of:=IF([.C12]=1;"";[.C12]) -> 0.0323569 | G12: of:=IF([.D12]=1;"";[.D12]) -> 0.0310071
A13: 12 | B13: strcmp: &"besth"{\0} &"bdint"{\0} :=> 1 | C13: 0.0325987 | D13: 0.0292385 | F13: of:=IF([.C13]=1;"";[.C13]) -> 0.0325987 | G13: of:=IF([.D13]=1;"";[.D13]) -> 0.0292385
A14: 13 | B14: strcmp: &"juthe"{\0} &"jwint"{\0} :=> -1 | C14: 0.0316047 | D14: 0 | F14: of:=IF([.C14]=1;"";[.C14]) -> 0.0316047 | G14: of:=IF([.D14]=1;"";[.D14]) -> 0
A15: 14 | B15: strcmp: &"uthes"{\0} &"inthe"{\0} :=> 1 | C15: 0.0329073 | D15: 0.0333747 | F15: of:=IF([.C15]=1;"";[.C15]) -> 0.0329073 | G15: of:=IF([.D15]=1;"";[.D15]) -> 0.0333747
A16: 15 | B16: strcmp: &"sthes"{\0} &"zesth"{\0} :=> -1 | C16: 0.0332025 | D16: 0.0316571 | F16: of:=IF([.C16]=1;"";[.C16]) -> 0.0332025 | G16: of:=IF([.D16]=1;"";[.D16]) -> 0.0316571
A17: 1 | B17: strncmp: &""{\0,p,r,e,s,\0} &""{\0,p,r,e,s,\0} 5 :=> 0 | C17: 1 | D17: 1 | F17: of:=IF([.C17]=1;"";[.C17]) ->  | G17: of:=IF([.D17]=1;"";[.D17]) ->  | I17: of:=AVERAGE([.F17:.F32]) -> 0.0512087285714286 | J17: of:=AVERAGE([.G17:.G32]) -> 0.0498345357142857 | L17: of:=AVERAGE([.I17:.J17]) -> 0.0505216321428571
A18: 2 | B18: strncmp: &"j"{\0,p,r,e,\0} &"j"{\0,p,r,e,\0} 5 :=> 0 | C18: 1 | D18: 1 | F18: of:=IF([.C18]=1;"";[.C18]) ->  | G18: of:=IF([.D18]=1;"";[.D18]) -> 
A19: 3 | B19: strncmp: &"st"{\0,p,r,\0} &"st"{\0,p,r,\0} 5 :=> 0 | C19: 0.223271 | D19: 0.223271 | F19: of:=IF([.C19]=1;"";[.C19]) -> 0.223271 | G19: of:=IF([.D19]=1;"";[.D19]) -> 0.223271
A20: 4 | B20: strncmp: &"win"{\0,p,\0} &"win"{\0,p,\0} 5 :=> 0 | C20: 0.0902992 | D20: 0.0902992 | F20: of:=IF([.C20]=1;"";[.C20]) -> 0.0902992 | G20: of:=IF([.D20]=1;"";[.D20]) -> 0.0902992
A21: 5 | B21: strncmp: &"lyes"{\0,\0} &"lyes"{\0,\0} 5 :=> 0 | C21: 0.0480665 | D21: 0.0480665 | F21: of:=IF([.C21]=1;"";[.C21]) -> 0.0480665 | G21: of:=IF([.D21]=1;"";[.D21]) -> 0.0480665
A22: 6 | B22: strncmp: &"yesth"{\0} &"yesth"{\0} 5 :=> 0 | C22: 0.0322095 | D22: 0.0322095 | F22: of:=IF([.C22]=1;"";[.C22]) -> 0.0322095 | G22: of:=IF([.D22]=1;"";[.D22]) -> 0.0322095
A23: 7 | B23: strncmp: &"resth"{\0} &"restd"{\0} 5 :=> 1 | C23: 0.0330663 | D23: 0.0300798 | F23: of:=IF([.C23]=1;"";[.C23]) -> 0.0330663 | G23: of:=IF([.D23]=1;"";[.D23]) -> 0.0300798
A24: 8 | B24: strncmp: &"nthes"{\0} &"nthew"{\0} 5 :=> -1 | C24: 0.0331665 | D24: 0.0324499 | F24: of:=IF([.C24]=1;"";[.C24]) -> 0.0331665 | G24: of:=IF([.D24]=1;"";[.D24]) -> 0.0324499
A25: 9 | B25: strncmp: &"xpres"{\0} &"xprdi"{\0} 5 :=> 1 | C25: 0.0312303 | D25: 0.0300907 | F25: of:=IF([.C25]=1;"";[.C25]) -> 0.0312303 | G25: of:=IF([.D25]=1;"";[.D25]) -> 0.0300907
A26: 10 | B26: strncmp: &"yesth"{\0} &"yesve"{\0} 5 :=> -1 | C26: 0.0322095 | D26: 0.0286748 | F26: of:=IF([.C26]=1;"";[.C26]) -> 0.0322095 | G26: of:=IF([.D26]=1;"";[.D26]) -> 0.0286748
A27: 11 | B27: strncmp: &"uthes"{\0} &"utdin"{\0} 5 :=> 1 | C27: 0.0329073 | D27: 0.0295066 | F27: of:=IF([.C27]=1;"";[.C27]) -> 0.0329073 | G27: of:=IF([.D27]=1;"";[.D27]) -> 0.0295066
A28: 12 | B28: strncmp: &"lyest"{\0} &"lyges"{\0} 5 :=> -1 | C28: 0.0314814 | D28: 0.0286263 | F28: of:=IF([.C28]=1;"";[.C28]) -> 0.0314814 | G28: of:=IF([.D28]=1;"";[.D28]) -> 0.0286263
A29: 13 | B29: strncmp: &"winth"{\0} &"whest"{\0} 5 :=> 1 | C29: 0.0326533 | D29: 0.0324136 | F29: of:=IF([.C29]=1;"";[.C29]) -> 0.0326533 | G29: of:=IF([.D29]=1;"";[.D29]) -> 0.0324136
A30: 14 | B30: strncmp: &"prest"{\0} &"pzest"{\0} 5 :=> -1 | C30: 0.0323569 | D30: 0.0260007 | F30: of:=IF([.C30]=1;"";[.C30]) -> 0.0323569 | G30: of:=IF([.D30]=1;"";[.D30]) -> 0.0260007
A31: 15 | B31: strncmp: &"gesth"{\0} &"cthes"{\0} 5 :=> 1 | C31: 0.0325231 | D31: 0.0327924 | F31: of:=IF([.C31]=1;"";[.C31]) -> 0.0325231 | G31: of:=IF([.D31]=1;"";[.D31]) -> 0.0327924
A32: 16 | B32: strncmp: &"lyest"{\0} &"thest"{\0} 5 :=> -1 | C32: 0.0314814 | D32: 0.0332025 | F32: of:=IF([.C32]=1;"";[.C32]) -> 0.0314814 | G32: of:=IF([.D32]=1;"";[.D32]) -> 0.0332025
A33: 1 | B33: sysfs_streq: &""{\0,p,r,e,s,\0} &"gesth"{\0} :=> \0 | C33: 1 | D33: 0.0325231 | F33: of:=IF([.C33]=1;"";[.C33]) ->  | G33: of:=IF([.D33]=1;"";[.D33]) -> 0.0325231 | I33: of:=AVERAGE([.F33:.F71]) -> 0.0773899068965517 | J33: of:=AVERAGE([.G33:.G71]) -> 0.0507523071428571 | L33: of:=AVERAGE([.I33:.J33]) -> 0.0640711070197044
A34: 2 | B34: sysfs_streq: &""{\0,p,r,e,s,\0} &"\n"{\0,b,e,s,\0} :=> \x01 | C34: 1 | F34: of:=IF([.C34]=1;"";[.C34]) ->  | G34: of:=IF([.D34]=1;"";[.D34]) ->  
A35: 3 | B35: sysfs_streq: &""{\0,p,r,e,s,\0} &"\nathe"{\0} :=> \0 | C35: 1 | F35: of:=IF([.C35]=1;"";[.C35]) ->  | G35: of:=IF([.D35]=1;"";[.D35]) ->  
A36: 4 | B36: sysfs_streq: &""{\0,p,r,e,s,\0} &""{\0,h,e,s,t,\0} :=> \x01 | C36: 1 | D36: 1 | F36: of:=IF([.C36]=1;"";[.C36]) ->  | G36: of:=IF([.D36]=1;"";[.D36]) -> 
A37: 5 | B37: sysfs_streq: &"gesth"{\0} &"quthe"{\0} :=> \0 | C37: 0.0325231 | D37: 0.0319508 | F37: of:=IF([.C37]=1;"";[.C37]) -> 0.0325231 | G37: of:=IF([.D37]=1;"";[.D37]) -> 0.0319508
A38: 6 | B38: sysfs_streq: &"\n"{\0,p,r,e,\0} &""{\0,a,t,h,e,\0} :=> \x01 | C38: 1 | F38: of:=IF([.C38]=1;"";[.C38]) ->  | G38: of:=IF([.D38]=1;"";[.D38]) ->  
A39: 7 | B39: sysfs_streq: &"\n"{\0,a,t,h,\0} &"athes"{\0} :=> \0 | C39: 0.0333093 | F39: of:=IF([.C39]=1;"";[.C39]) -> 0.0333093 | G39: of:=IF([.D39]=1;"";[.D39]) ->  
A40: 8 | B40: sysfs_streq: &"\nathe"{\0} &"thest"{\0} :=> \0 | C40: 0.0332025 | F40: of:=IF([.C40]=1;"";[.C40]) -> 0.0332025 | G40: of:=IF([.D40]=1;"";[.D40]) ->  
A41: 9 | B41: sysfs_streq: &"x"{\0,p,r,e,\0} &"xpres"{\0} :=> \0 | C41: 1 | D41: 0.0312303 | F41: of:=IF([.C41]=1;"";[.C41]) ->  | G41: of:=IF([.D41]=1;"";[.D41]) -> 0.0312303
A42: 10 | B42: sysfs_streq: &"y"{\0,p,r,e,\0} &"y\n"{\0,a,t,\0} :=> \x01 | C42: 1 | F42: of:=IF([.C42]=1;"";[.C42]) ->  | G42: of:=IF([.D42]=1;"";[.D42]) ->  
A43: 11 | B43: sysfs_streq: &"y"{\0,p,r,e,\0} &"y\nath"{\0} :=> \0 | C43: 1 | F43: of:=IF([.C43]=1;"";[.C43]) ->  | G43: of:=IF([.D43]=1;"";[.D43]) ->  
A44: 12 | B44: sysfs_streq: &"j"{\0,p,r,e,\0} &"j"{\0,h,e,s,\0} :=> \x01 | C44: 1 | D44: 1 | F44: of:=IF([.C44]=1;"";[.C44]) ->  | G44: of:=IF([.D44]=1;"";[.D44]) -> 
A45: 13 | B45: sysfs_streq: &"thest"{\0} &"tlyes"{\0} :=> \0 | C45: 0.0332025 | D45: 0.0305511 | F45: of:=IF([.C45]=1;"";[.C45]) -> 0.0332025 | G45: of:=IF([.D45]=1;"";[.D45]) -> 0.0305511
A46: 14 | B46: sysfs_streq: &"z\n"{\0,b,e,\0} &"z"{\0,b,e,s,\0} :=> \x01 | C46: 1 | F46: of:=IF([.C46]=1;"";[.C46]) ->  | G46: of:=IF([.D46]=1;"";[.D46]) ->  
A47: 15 | B47: sysfs_streq: &"b\n"{\0,b,e,\0} &"besth"{\0} :=> \0 | C47: 0.0325987 | F47: of:=IF([.C47]=1;"";[.C47]) -> 0.0325987 | G47: of:=IF([.D47]=1;"";[.D47]) ->  
A48: 16 | B48: sysfs_streq: &"h\nath"{\0} &"hesth"{\0} :=> \0 | C48: 0.0332025 | F48: of:=IF([.C48]=1;"";[.C48]) -> 0.0332025 | G48: of:=IF([.D48]=1;"";[.D48]) ->  
A49: 17 | B49: sysfs_streq: &"be"{\0,p,r,\0} &"besth"{\0} :=> \0 | C49: 0.219808 | D49: 0.0325987 | F49: of:=IF([.C49]=1;"";[.C49]) -> 0.219808 | G49: of:=IF([.D49]=1;"";[.D49]) -> 0.0325987
A50: 18 | B50: sysfs_streq: &"st"{\0,p,r,\0} &"st\n"{\0,a,\0} :=> \x01 | C50: 0.223271 | F50: of:=IF([.C50]=1;"";[.C50]) -> 0.223271 | G50: of:=IF([.D50]=1;"";[.D50]) ->  
A51: 19 | B51: sysfs_streq: &"ye"{\0,p,r,\0} &"ye\nat"{\0} :=> \0 | C51: 0.215236 | F51: of:=IF([.C51]=1;"";[.C51]) -> 0.215236 | G51: of:=IF([.D51]=1;"";[.D51]) ->  
A52: 20 | B52: sysfs_streq: &"re"{\0,p,r,\0} &"re"{\0,b,e,\0} :=> \x01 | C52: 0.225356 | D52: 0.225356 | F52: of:=IF([.C52]=1;"";[.C52]) -> 0.225356 | G52: of:=IF([.D52]=1;"";[.D52]) -> 0.225356
A53: 21 | B53: sysfs_streq: &"thest"{\0} &"thuth"{\0} :=> \0 | C53: 0.0332025 | D53: 0.0316812 | F53: of:=IF([.C53]=1;"";[.C53]) -> 0.0332025 | G53: of:=IF([.D53]=1;"";[.D53]) -> 0.0316812
A54: 22 | B54: sysfs_streq: &"he\n"{\0,b,\0} &"he"{\0,b,e,\0} :=> \x01 | C54: 0.226983 | F54: of:=IF([.C54]=1;"";[.C54]) -> 0.226983 | G54: of:=IF([.D54]=1;"";[.D54]) ->  
A55: 23 | B55: sysfs_streq: &"ve\n"{\0,b,\0} &"vesth"{\0} :=> \0 | C55: 0.0327833 | F55: of:=IF([.C55]=1;"";[.C55]) -> 0.0327833 | G55: of:=IF([.D55]=1;"";[.D55]) ->  
A56: 24 | B56: sysfs_streq: &"st\nat"{\0} &"sthes"{\0} :=> \0 | C56: 0.0332025 | F56: of:=IF([.C56]=1;"";[.C56]) -> 0.0332025 | G56: of:=IF([.D56]=1;"";[.D56]) ->  
A57: 25 | B57: sysfs_streq: &"res"{\0,p,\0} &"resth"{\0} :=> \0 | C57: 0.0917628 | D57: 0.0330663 | F57: of:=IF([.C57]=1;"";[.C57]) -> 0.0917628 | G57: of:=IF([.D57]=1;"";[.D57]) -> 0.0330663
A58: 26 | B58: sysfs_streq: &"kes"{\0,p,\0} &"kes\n"{\0,\0} :=> \x01 | C58: 0.0892137 | F58: of:=IF([.C58]=1;"";[.C58]) -> 0.0892137 | G58: of:=IF([.D58]=1;"";[.D58]) ->  
A59: 27 | B59: sysfs_streq: &"cth"{\0,p,\0} &"cth\na"{\0} :=> \0 | C59: 0.0905558 | F59: of:=IF([.C59]=1;"";[.C59]) -> 0.0905558 | G59: of:=IF([.D59]=1;"";[.D59]) ->  
A60: 28 | B60: sysfs_streq: &"qut"{\0,p,\0} &"qut"{\0,h,\0} :=> \x01 | C60: 0.086312 | D60: 0.086312 | F60: of:=IF([.C60]=1;"";[.C60]) -> 0.086312 | G60: of:=IF([.D60]=1;"";[.D60]) -> 0.086312
A61: 29 | B61: sysfs_streq: &"mesth"{\0} &"mesdi"{\0} :=> \0 | C61: 0.0327469 | D61: 0.0303861 | F61: of:=IF([.C61]=1;"";[.C61]) -> 0.0327469 | G61: of:=IF([.D61]=1;"";[.D61]) -> 0.0303861
A62: 30 | B62: sysfs_streq: &"ves\n"{\0,\0} &"ves"{\0,a,\0} :=> \x01 | C62: 0.0906651 | F62: of:=IF([.C62]=1;"";[.C62]) -> 0.0906651 | G62: of:=IF([.D62]=1;"";[.D62]) ->  
A63: 31 | B63: sysfs_streq: &"lye\n"{\0,\0} &"lyest"{\0} :=> \0 | C63: 0.0314814 | F63: of:=IF([.C63]=1;"";[.C63]) -> 0.0314814 | G63: of:=IF([.D63]=1;"";[.D63]) ->  
A64: 32 | B64: sysfs_streq: &"res\na"{\0} &"resth"{\0} :=> \0 | C64: 0.0330663 | F64: of:=IF([.C64]=1;"";[.C64]) -> 0.0330663 | G64: of:=IF([.D64]=1;"";[.D64]) ->  
A65: 33 | B65: sysfs_streq: &"vest"{\0,\0} &"vesth"{\0} :=> \0 | C65: 0.0497838 | D65: 0.0327833 | F65: of:=IF([.C65]=1;"";[.C65]) -> 0.0497838 | G65: of:=IF([.D65]=1;"";[.D65]) -> 0.0327833
A66: 34 | B66: sysfs_streq: &"lyes"{\0,\0} &"lyes\n"{\0} :=> \x01 | C66: 0.0480665 | F66: of:=IF([.C66]=1;"";[.C66]) -> 0.0480665 | G66: of:=IF([.D66]=1;"";[.D66]) ->  
A67: 35 | B67: sysfs_streq: &"zest"{\0,\0} &"zest"{\0,\0} :=> \x01 | C67: 0.0477944 | D67: 0.0477944 | F67: of:=IF([.C67]=1;"";[.C67]) -> 0.0477944 | G67: of:=IF([.D67]=1;"";[.D67]) -> 0.0477944
A68: 36 | B68: sysfs_streq: &"orest"{\0} &"oresd"{\0} :=> \0 | C68: 0.0327935 | D68: 0.0310965 | F68: of:=IF([.C68]=1;"";[.C68]) -> 0.0327935 | G68: of:=IF([.D68]=1;"";[.D68]) -> 0.0310965
A69: 37 | B69: sysfs_streq: &"xpre\n"{\0} &"xpre"{\0,\0} :=> \x01 | C69: 0.0475003 | F69: of:=IF([.C69]=1;"";[.C69]) -> 0.0475003 | G69: of:=IF([.D69]=1;"";[.D69]) ->  
A70: 38 | B70: sysfs_streq: &"lyes\n"{\0} &"lyest"{\0} :=> \0 | C70: 0.0314814 | F70: of:=IF([.C70]=1;"";[.C70]) -> 0.0314814 | G70: of:=IF([.D70]=1;"";[.D70]) ->  
A71: 39 | B71: sysfs_streq: &"thest"{\0} &"thest"{\0} :=> \x01 | C71: 0.0332025 | D71: 0.0332025 | F71: of:=IF([.C71]=1;"";[.C71]) -> 0.0332025 | G71: of:=IF([.D71]=1;"";[.D71]) -> 0.0332025

Sheet: strcpy
A1: # | B1: Test Case | C1: N1 | D1: N2 | E1: N3 | O1: FINAL
A2: 1 | B2: strcpy: &""{\0,\x01,\x01,\x01,\x01,\x01} &"l"{\0,p,r,e,\0} :=> &"l"{\0,p,r,e,\0} | C2: 1 | D2: 1 | E2: 1 | G2: of:=IF([.C2]=1;"";[.C2]) ->  | H2: of:=IF([.D2]=1;"";[.D2]) ->  | I2: of:=IF([.E2]=1;"";[.E2]) ->  | K2: of:=AVERAGE([.G2:.G36]) -> 0.0979778208333333 | L2: of:=AVERAGE([.H2:.H36]) -> 0.097876075 | M2: of:=AVERAGE([.I2:.I36]) -> 0.097876075 | O2: of:=AVERAGE([.K2:.M2]) -> 0.0979099902777778
A3: 2 | B3: strcpy: &""{\0,\x01,\x01,\x01,\x01,\x01} &"fo"{\0,p,r,\0} :=> &"fo"{\0,p,r,\0} | C3: 1 | D3: 0.219808 | E3: 0.219808 | G3: of:=IF([.C3]=1;"";[.C3]) ->  | H3: of:=IF([.D3]=1;"";[.D3]) -> 0.219808 | I3: of:=IF([.E3]=1;"";[.E3]) -> 0.219808
A4: 3 | B4: strcpy: &""{\0,\x01,\x01,\x01,\x01,\x01} &"for"{\0,p,\0} :=> &"for"{\0,p,\0} | C4: 1 | D4: 0.0899511 | E4: 0.0899511 | G4: of:=IF([.C4]=1;"";[.C4]) ->  | H4: of:=IF([.D4]=1;"";[.D4]) -> 0.0899511 | I4: of:=IF([.E4]=1;"";[.E4]) -> 0.0899511
A5: 4 | B5: strcpy: &""{\0,\x01,\x01,\x01,\x01,\x01} &"inth"{\0,\0} :=> &"inth"{\0,\0} | C5: 1 | D5: 0.050893 | E5: 0.050893 | G5: of:=IF([.C5]=1;"";[.C5]) ->  | H5: of:=IF([.D5]=1;"";[.D5]) -> 0.050893 | I5: of:=IF([.E5]=1;"";[.E5]) -> 0.050893
A6: 5 | B6: strcpy: &""{\0,\x01,\x01,\x01,\x01,\x01} &"resth"{\0} :=> &"resth"{\0} | C6: 1 | D6: 0.0330663 | E6: 0.0330663 | G6: of:=IF([.C6]=1;"";[.C6]) ->  | H6: of:=IF([.D6]=1;"";[.D6]) -> 0.0330663 | I6: of:=IF([.E6]=1;"";[.E6]) -> 0.0330663
A7: 6 | B7: strcpy: &"v"{\0,\x01,\x01,\x01,\x01} &""{\0,p,r,e,s,\0} :=> &""{\0,\0,p,r,e,\0} | C7: 1 | D7: 1 | E7: 1 | G7: of:=IF([.C7]=1;"";[.C7]) ->  | H7: of:=IF([.D7]=1;"";[.D7]) ->  | I7: of:=IF([.E7]=1;"";[.E7]) -> 
A8: 7 | B8: strcpy: &"e"{\0,\x01,\x01,\x01,\x01} &"i"{\0,p,r,e,\0} :=> &"i"{\0,p,r,e,\0} | C8: 1 | D8: 1 | E8: 1 | G8: of:=IF([.C8]=1;"";[.C8]) ->  | H8: of:=IF([.D8]=1;"";[.D8]) ->  | I8: of:=IF([.E8]=1;"";[.E8]) -> 
A9: 8 | B9: strcpy: &"h"{\0,\x01,\x01,\x01,\x01} &"ju"{\0,p,r,\0} :=> &"ju"{\0,p,r,\0} | C9: 1 | D9: 0.208818 | E9: 0.208818 | G9: of:=IF([.C9]=1;"";[.C9]) ->  | H9: of:=IF([.D9]=1;"";[.D9]) -> 0.208818 | I9: of:=IF([.E9]=1;"";[.E9]) -> 0.208818
A10: 9 | B10: strcpy: &"h"{\0,\x01,\x01,\x01,\x01} &"din"{\0,p,\0} :=> &"din"{\0,p,\0} | C10: 1 | D10: 0.090448 | E10: 0.090448 | G10: of:=IF([.C10]=1;"";[.C10]) ->  | H10: of:=IF([.D10]=1;"";[.D10]) -> 0.090448 | I10: of:=IF([.E10]=1;"";[.E10]) -> 0.090448
A11: 10 | B11: strcpy: &"f"{\0,\x01,\x01,\x01,\x01} &"uthe"{\0,\0} :=> &"uthe"{\0,\0} | C11: 1 | D11: 0.0504892 | E11: 0.0504892 | G11: of:=IF([.C11]=1;"";[.C11]) ->  | H11: of:=IF([.D11]=1;"";[.D11]) -> 0.0504892 | I11: of:=IF([.E11]=1;"";[.E11]) -> 0.0504892
A12: 11 | B12: strcpy: &"e"{\0,\x01,\x01,\x01,\x01} &"sthes"{\0} :=> &"sthes"{\0} | C12: 1 | D12: 0.0332025 | E12: 0.0332025 | G12: of:=IF([.C12]=1;"";[.C12]) ->  | H12: of:=IF([.D12]=1;"";[.D12]) -> 0.0332025 | I12: of:=IF([.E12]=1;"";[.E12]) -> 0.0332025
A13: 12 | B13: strcpy: &"di"{\0,\x01,\x01,\x01} &""{\0,p,r,e,s,\0} :=> &""{\0,i,\0,p,r,\0} | C13: 0.218916 | D13: 1 | E13: 1 | G13: of:=IF([.C13]=1;"";[.C13]) -> 0.218916 | H13: of:=IF([.D13]=1;"";[.D13]) ->  | I13: of:=IF([.E13]=1;"";[.E13]) -> 
A14: 13 | B14: strcpy: &"di"{\0,\x01,\x01,\x01} &"a"{\0,p,r,e,\0} :=> &"a"{\0,\0,p,r,\0} | C14: 0.218916 | D14: 1 | E14: 1 | G14: of:=IF([.C14]=1;"";[.C14]) -> 0.218916 | H14: of:=IF([.D14]=1;"";[.D14]) ->  | I14: of:=IF([.E14]=1;"";[.E14]) -> 
A15: 14 | B15: strcpy: &"th"{\0,\x01,\x01,\x01} &"at"{\0,p,r,\0} :=> &"at"{\0,p,r,\0} | C15: 0.227384 | D15: 0.224529 | E15: 0.224529 | G15: of:=IF([.C15]=1;"";[.C15]) -> 0.227384 | H15: of:=IF([.D15]=1;"";[.D15]) -> 0.224529 | I15: of:=IF([.E15]=1;"";[.E15]) -> 0.224529
A16: 15 | B16: strcpy: &"xp"{\0,\x01,\x01,\x01} &"win"{\0,p,\0} :=> &"win"{\0,p,\0} | C16: 0.209845 | D16: 0.0902992 | E16: 0.0902992 | G16: of:=IF([.C16]=1;"";[.C16]) -> 0.209845 | H16: of:=IF([.D16]=1;"";[.D16]) -> 0.0902992 | I16: of:=IF([.E16]=1;"";[.E16]) -> 0.0902992
A17: 16 | B17: strcpy: &"nt"{\0,\x01,\x01,\x01} &"thes"{\0,\0} :=> &"thes"{\0,\0} | C17: 0.222847 | D17: 0.051146 | E17: 0.051146 | G17: of:=IF([.C17]=1;"";[.C17]) -> 0.222847 | H17: of:=IF([.D17]=1;"";[.D17]) -> 0.051146 | I17: of:=IF([.E17]=1;"";[.E17]) -> 0.051146
A18: 17 | B18: strcpy: &"ve"{\0,\x01,\x01,\x01} &"orest"{\0} :=> &"orest"{\0} | C18: 0.221991 | D18: 0.0327935 | E18: 0.0327935 | G18: of:=IF([.C18]=1;"";[.C18]) -> 0.221991 | H18: of:=IF([.D18]=1;"";[.D18]) -> 0.0327935 | I18: of:=IF([.E18]=1;"";[.E18]) -> 0.0327935
A19: 18 | B19: strcpy: &"uth"{\0,\x01,\x01} &""{\0,p,r,e,s,\0} :=> &""{\0,t,h,\0,p,\0} | C19: 0.0910004 | D19: 1 | E19: 1 | G19: of:=IF([.C19]=1;"";[.C19]) -> 0.0910004 | H19: of:=IF([.D19]=1;"";[.D19]) ->  | I19: of:=IF([.E19]=1;"";[.E19]) -> 
A20: 19 | B20: strcpy: &"cth"{\0,\x01,\x01} &"g"{\0,p,r,e,\0} :=> &"g"{\0,h,\0,p,\0} | C20: 0.0905558 | D20: 1 | E20: 1 | G20: of:=IF([.C20]=1;"";[.C20]) -> 0.0905558 | H20: of:=IF([.D20]=1;"";[.D20]) ->  | I20: of:=IF([.E20]=1;"";[.E20]) -> 
A21: 20 | B21: strcpy: &"qut"{\0,\x01,\x01} &"qu"{\0,p,r,\0} :=> &"qu"{\0,\0,p,\0} | C21: 0.086312 | D21: 0.212836 | E21: 0.212836 | G21: of:=IF([.C21]=1;"";[.C21]) -> 0.086312 | H21: of:=IF([.D21]=1;"";[.D21]) -> 0.212836 | I21: of:=IF([.E21]=1;"";[.E21]) -> 0.212836
A22: 21 | B22: strcpy: &"ges"{\0,\x01,\x01} &"ath"{\0,p,\0} :=> &"ath"{\0,p,\0} | C22: 0.0896591 | D22: 0.0925605 | E22: 0.0925605 | G22: of:=IF([.C22]=1;"";[.C22]) -> 0.0896591 | H22: of:=IF([.D22]=1;"";[.D22]) -> 0.0925605 | I22: of:=IF([.E22]=1;"";[.E22]) -> 0.0925605
A23: 22 | B23: strcpy: &"win"{\0,\x01,\x01} &"dint"{\0,\0} :=> &"dint"{\0,\0} | C23: 0.0902992 | D23: 0.0496215 | E23: 0.0496215 | G23: of:=IF([.C23]=1;"";[.C23]) -> 0.0902992 | H23: of:=IF([.D23]=1;"";[.D23]) -> 0.0496215 | I23: of:=IF([.E23]=1;"";[.E23]) -> 0.0496215
A24: 23 | B24: strcpy: &"uth"{\0,\x01,\x01} &"mesth"{\0} :=> &"mesth"{\0} | C24: 0.0910004 | D24: 0.0327469 | E24: 0.0327469 | G24: of:=IF([.C24]=1;"";[.C24]) -> 0.0910004 | H24: of:=IF([.D24]=1;"";[.D24]) -> 0.0327469 | I24: of:=IF([.E24]=1;"";[.E24]) -> 0.0327469
A25: 24 | B25: strcpy: &"inth"{\0,\x01} &""{\0,p,r,e,s,\0} :=> &""{\0,n,t,h,\0,\0} | C25: 0.050893 | D25: 1 | E25: 1 | G25: of:=IF([.C25]=1;"";[.C25]) -> 0.050893 | H25: of:=IF([.D25]=1;"";[.D25]) ->  | I25: of:=IF([.E25]=1;"";[.E25]) -> 
A26: 25 | B26: strcpy: &"mest"{\0,\x01} &"f"{\0,p,r,e,\0} :=> &"f"{\0,s,t,\0,\0} | C26: 0.0497193 | D26: 1 | E26: 1 | G26: of:=IF([.C26]=1;"";[.C26]) -> 0.0497193 | H26: of:=IF([.D26]=1;"";[.D26]) ->  | I26: of:=IF([.E26]=1;"";[.E26]) -> 
A27: 26 | B27: strcpy: &"lyes"{\0,\x01} &"nt"{\0,p,r,\0} :=> &"nt"{\0,s,\0,\0} | C27: 0.0480665 | D27: 0.222847 | E27: 0.222847 | G27: of:=IF([.C27]=1;"";[.C27]) -> 0.0480665 | H27: of:=IF([.D27]=1;"";[.D27]) -> 0.222847 | I27: of:=IF([.E27]=1;"";[.E27]) -> 0.222847
A28: 27 | B28: strcpy: &"sthe"{\0,\x01} &"int"{\0,p,\0} :=> &"int"{\0,\0,\0} | C28: 0.051018 | D28: 0.0917447 | E28: 0.0917447 | G28: of:=IF([.C28]=1;"";[.C28]) -> 0.051018 | H28: of:=IF([.D28]=1;"";[.D28]) -> 0.0917447 | I28: of:=IF([.E28]=1;"";[.E28]) -> 0.0917447
A29: 28 | B29: strcpy: &"yest"{\0,\x01} &"uthe"{\0,\0} :=> &"uthe"{\0,\0} | C29: 0.0487686 | D29: 0.0504892 | E29: 0.0504892 | G29: of:=IF([.C29]=1;"";[.C29]) -> 0.0487686 | H29: of:=IF([.D29]=1;"";[.D29]) -> 0.0504892 | I29: of:=IF([.E29]=1;"";[.E29]) -> 0.0504892
A30: 29 | B30: strcpy: &"mest"{\0,\x01} &"yesth"{\0} :=> &"yesth"{\0} | C30: 0.0497193 | D30: 0.0322095 | E30: 0.0322095 | G30: of:=IF([.C30]=1;"";[.C30]) -> 0.0497193 | H30: of:=IF([.D30]=1;"";[.D30]) -> 0.0322095 | I30: of:=IF([.E30]=1;"";[.E30]) -> 0.0322095
A31: 30 | B31: strcpy: &"orest"{\0} &""{\0,p,r,e,s,\0} :=> &""{\0,r,e,s,t,\0} | C31: 0.0327935 | D31: 1 | E31: 1 | G31: of:=IF([.C31]=1;"";[.C31]) -> 0.0327935 | H31: of:=IF([.D31]=1;"";[.D31]) ->  | I31: of:=IF([.E31]=1;"";[.E31]) -> 
A32: 31 | B32: strcpy: &"vesth"{\0} &"p"{\0,p,r,e,\0} :=> &"p"{\0,s,t,h,\0} | C32: 0.0327833 | D32: 1 | E32: 1 | G32: of:=IF([.C32]=1;"";[.C32]) -> 0.0327833 | H32: of:=IF([.D32]=1;"";[.D32]) ->  | I32: of:=IF([.E32]=1;"";[.E32]) -> 
A33: 32 | B33: strcpy: &"hesth"{\0} &"ut"{\0,p,r,\0} :=> &"ut"{\0,t,h,\0} | C33: 0.0332025 | D33: 0.219808 | E33: 0.219808 | G33: of:=IF([.C33]=1;"";[.C33]) -> 0.0332025 | H33: of:=IF([.D33]=1;"";[.D33]) -> 0.219808 | I33: of:=IF([.E33]=1;"";[.E33]) -> 0.219808
A34: 33 | B34: strcpy: &"dinth"{\0} &"xpr"{\0,p,\0} :=> &"xpr"{\0,h,\0} | C34: 0.0326917 | D34: 0.085063 | E34: 0.085063 | G34: of:=IF([.C34]=1;"";[.C34]) -> 0.0326917 | H34: of:=IF([.D34]=1;"";[.D34]) -> 0.085063 | I34: of:=IF([.E34]=1;"";[.E34]) -> 0.085063
A35: 34 | B35: strcpy: &"lyest"{\0} &"uthe"{\0,\0} :=> &"uthe"{\0,\0} | C35: 0.0314814 | D35: 0.0504892 | E35: 0.0504892 | G35: of:=IF([.C35]=1;"";[.C35]) -> 0.0314814 | H35: of:=IF([.D35]=1;"";[.D35]) -> 0.0504892 | I35: of:=IF([.E35]=1;"";[.E35]) -> 0.0504892
A36: 35 | B36: strcpy: &"juthe"{\0} &"nthes"{\0} :=> &"nthes"{\0} | C36: 0.0316047 | D36: 0.0331665 | E36: 0.0331665 | G36: of:=IF([.C36]=1;"";[.C36]) -> 0.0316047 | H36: of:=IF([.D36]=1;"";[.D36]) -> 0.0331665 | I36: of:=IF([.E36]=1;"";[.E36]) -> 0.0331665
A37: 1 | B37: strncpy: &""{\0,\x01,\x01,\x01,\x01,\x01} &""{\0,p,r,e,s,\0} 5 :=> &""{\0,\0,\0,\0,\0,\0} | C37: 1 | D37: 1 | E37: 1 | G37: of:=IF([.C37]=1;"";[.C37]) ->  | H37: of:=IF([.D37]=1;"";[.D37]) ->  | I37: of:=IF([.E37]=1;"";[.E37]) ->  | K37: of:=AVERAGE([.G37:.G72]) -> 0.0980884125 | L37: of:=AVERAGE([.H37:.H72]) -> 0.0979991333333333 | M37: of:=AVERAGE([.I37:.I72]) -> 0.0979991333333333 | O37: of:=AVERAGE([.K37:.M37]) -> 0.0980288930555555
A38: 2 | B38: strncpy: &""{\0,\x01,\x01,\x01,\x01,\x01} &"f"{\0,p,r,e,\0} 5 :=> &"f"{\0,\0,\0,\0,\0} | C38: 1 | D38: 1 | E38: 1 | G38: of:=IF([.C38]=1;"";[.C38]) ->  | H38: of:=IF([.D38]=1;"";[.D38]) ->  | I38: of:=IF([.E38]=1;"";[.E38]) -> 
A39: 3 | B39: strncpy: &""{\0,\x01,\x01,\x01,\x01,\x01} &"be"{\0,p,r,\0} 5 :=> &"be"{\0,\0,\0,\0} | C39: 1 | D39: 0.219808 | E39: 0.219808 | G39: of:=IF([.C39]=1;"";[.C39]) ->  | H39: of:=IF([.D39]=1;"";[.D39]) -> 0.219808 | I39: of:=IF([.E39]=1;"";[.E39]) -> 0.219808
A40: 4 | B40: strncpy: &""{\0,\x01,\x01,\x01,\x01,\x01} &"jut"{\0,p,\0} 5 :=> &"jut"{\0,\0,\0} | C40: 1 | D40: 0.0850061 | E40: 0.0850061 | G40: of:=IF([.C40]=1;"";[.C40]) ->  | H40: of:=IF([.D40]=1;"";[.D40]) -> 0.0850061 | I40: of:=IF([.E40]=1;"";[.E40]) -> 0.0850061
A41: 5 | B41: strncpy: &""{\0,\x01,\x01,\x01,\x01,\x01} &"sthe"{\0,\0} 5 :=> &"sthe"{\0,\0} | C41: 1 | D41: 0.051018 | E41: 0.051018 | G41: of:=IF([.C41]=1;"";[.C41]) ->  | H41: of:=IF([.D41]=1;"";[.D41]) -> 0.051018 | I41: of:=IF([.E41]=1;"";[.E41]) -> 0.051018
A42: 6 | B42: strncpy: &""{\0,\x01,\x01,\x01,\x01,\x01} &"dinth"{\0} 5 :=> &"dinth"{\0} | C42: 1 | D42: 0.0326917 | E42: 0.0326917 | G42: of:=IF([.C42]=1;"";[.C42]) ->  | H42: of:=IF([.D42]=1;"";[.D42]) -> 0.0326917 | I42: of:=IF([.E42]=1;"";[.E42]) -> 0.0326917
A43: 7 | B43: strncpy: &"l"{\0,\x01,\x01,\x01,\x01} &""{\0,p,r,e,s,\0} 5 :=> &""{\0,\0,\0,\0,\0,\0} | C43: 1 | D43: 1 | E43: 1 | G43: of:=IF([.C43]=1;"";[.C43]) ->  | H43: of:=IF([.D43]=1;"";[.D43]) ->  | I43: of:=IF([.E43]=1;"";[.E43]) -> 
A44: 8 | B44: strncpy: &"s"{\0,\x01,\x01,\x01,\x01} &"e"{\0,p,r,e,\0} 5 :=> &"e"{\0,\0,\0,\0,\0} | C44: 1 | D44: 1 | E44: 1 | G44: of:=IF([.C44]=1;"";[.C44]) ->  | H44: of:=IF([.D44]=1;"";[.D44]) ->  | I44: of:=IF([.E44]=1;"";[.E44]) -> 
A45: 9 | B45: strncpy: &"p"{\0,\x01,\x01,\x01,\x01} &"ge"{\0,p,r,\0} 5 :=> &"ge"{\0,\0,\0,\0} | C45: 1 | D45: 0.218916 | E45: 0.218916 | G45: of:=IF([.C45]=1;"";[.C45]) ->  | H45: of:=IF([.D45]=1;"";[.D45]) -> 0.218916 | I45: of:=IF([.E45]=1;"";[.E45]) -> 0.218916
A46: 10 | B46: strncpy: &"i"{\0,\x01,\x01,\x01,\x01} &"uth"{\0,p,\0} 5 :=> &"uth"{\0,\0,\0} | C46: 1 | D46: 0.0910004 | E46: 0.0910004 | G46: of:=IF([.C46]=1;"";[.C46]) ->  | H46: of:=IF([.D46]=1;"";[.D46]) -> 0.0910004 | I46: of:=IF([.E46]=1;"";[.E46]) -> 0.0910004
A47: 11 | B47: strncpy: &"k"{\0,\x01,\x01,\x01,\x01} &"nthe"{\0,\0} 5 :=> &"nthe"{\0,\0} | C47: 1 | D47: 0.0509534 | E47: 0.0509534 | G47: of:=IF([.C47]=1;"";[.C47]) ->  | H47: of:=IF([.D47]=1;"";[.D47]) -> 0.0509534 | I47: of:=IF([.E47]=1;"";[.E47]) -> 0.0509534
A48: 12 | B48: strncpy: &"z"{\0,\x01,\x01,\x01,\x01} &"quthe"{\0} 5 :=> &"quthe"{\0} | C48: 1 | D48: 0.0319508 | E48: 0.0319508 | G48: of:=IF([.C48]=1;"";[.C48]) ->  | H48: of:=IF([.D48]=1;"";[.D48]) -> 0.0319508 | I48: of:=IF([.E48]=1;"";[.E48]) -> 0.0319508
A49: 13 | B49: strncpy: &"ze"{\0,\x01,\x01,\x01} &""{\0,p,r,e,s,\0} 5 :=> &""{\0,\0,\0,\0,\0,\0} | C49: 0.208818 | D49: 1 | E49: 1 | G49: of:=IF([.C49]=1;"";[.C49]) -> 0.208818 | H49: of:=IF([.D49]=1;"";[.D49]) ->  | I49: of:=IF([.E49]=1;"";[.E49]) -> 
A50: 14 | B50: strncpy: &"ct"{\0,\x01,\x01,\x01} &"b"{\0,p,r,e,\0} 5 :=> &"b"{\0,\0,\0,\0,\0} | C50: 0.218466 | D50: 1 | E50: 1 | G50: of:=IF([.C50]=1;"";[.C50]) -> 0.218466 | H50: of:=IF([.D50]=1;"";[.D50]) ->  | I50: of:=IF([.E50]=1;"";[.E50]) -> 
A51: 15 | B51: strncpy: &"me"{\0,\x01,\x01,\x01} &"ju"{\0,p,r,\0} 5 :=> &"ju"{\0,\0,\0,\0} | C51: 0.22156 | D51: 0.208818 | E51: 0.208818 | G51: of:=IF([.C51]=1;"";[.C51]) -> 0.22156 | H51: of:=IF([.D51]=1;"";[.D51]) -> 0.208818 | I51: of:=IF([.E51]=1;"";[.E51]) -> 0.208818
A52: 16 | B52: strncpy: &"he"{\0,\x01,\x01,\x01} &"win"{\0,p,\0} 5 :=> &"win"{\0,\0,\0} | C52: 0.226983 | D52: 0.0902992 | E52: 0.0902992 | G52: of:=IF([.C52]=1;"";[.C52]) -> 0.226983 | H52: of:=IF([.D52]=1;"";[.D52]) -> 0.0902992 | I52: of:=IF([.E52]=1;"";[.E52]) -> 0.0902992
A53: 17 | B53: strncpy: &"pr"{\0,\x01,\x01,\x01} &"sthe"{\0,\0} 5 :=> &"sthe"{\0,\0} | C53: 0.218916 | D53: 0.051018 | E53: 0.051018 | G53: of:=IF([.C53]=1;"";[.C53]) -> 0.218916 | H53: of:=IF([.D53]=1;"";[.D53]) -> 0.051018 | I53: of:=IF([.E53]=1;"";[.E53]) -> 0.051018
A54: 18 | B54: strncpy: &"ve"{\0,\x01,\x01,\x01} &"resth"{\0} 5 :=> &"resth"{\0} | C54: 0.221991 | D54: 0.0330663 | E54: 0.0330663 | G54: of:=IF([.C54]=1;"";[.C54]) -> 0.221991 | H54: of:=IF([.D54]=1;"";[.D54]) -> 0.0330663 | I54: of:=IF([.E54]=1;"";[.E54]) -> 0.0330663
A55: 19 | B55: strncpy: &"the"{\0,\x01,\x01} &""{\0,p,r,e,s,\0} 5 :=> &""{\0,\0,\0,\0,\0,\0} | C55: 0.093369 | D55: 1 | E55: 1 | G55: of:=IF([.C55]=1;"";[.C55]) -> 0.093369 | H55: of:=IF([.D55]=1;"";[.D55]) ->  | I55: of:=IF([.E55]=1;"";[.E55]) -> 
A56: 20 | B56: strncpy: &"ges"{\0,\x01,\x01} &"u"{\0,p,r,e,\0} 5 :=> &"u"{\0,\0,\0,\0,\0} | C56: 0.0896591 | D56: 1 | E56: 1 | G56: of:=IF([.C56]=1;"";[.C56]) -> 0.0896591 | H56: of:=IF([.D56]=1;"";[.D56]) ->  | I56: of:=IF([.E56]=1;"";[.E56]) -> 
A57: 21 | B57: strncpy: &"ore"{\0,\x01,\x01} &"es"{\0,p,r,\0} 5 :=> &"es"{\0,\0,\0,\0} | C57: 0.0917628 | D57: 0.224112 | E57: 0.224112 | G57: of:=IF([.C57]=1;"";[.C57]) -> 0.0917628 | H57: of:=IF([.D57]=1;"";[.D57]) -> 0.224112 | I57: of:=IF([.E57]=1;"";[.E57]) -> 0.224112
A58: 22 | B58: strncpy: &"jut"{\0,\x01,\x01} &"kes"{\0,p,\0} 5 :=> &"kes"{\0,\0,\0} | C58: 0.0850061 | D58: 0.0892137 | E58: 0.0892137 | G58: of:=IF([.C58]=1;"";[.C58]) -> 0.0850061 | H58: of:=IF([.D58]=1;"";[.D58]) -> 0.0892137 | I58: of:=IF([.E58]=1;"";[.E58]) -> 0.0892137
A59: 23 | B59: strncpy: &"sth"{\0,\x01,\x01} &"hest"{\0,\0} 5 :=> &"hest"{\0,\0} | C59: 0.0921454 | D59: 0.0505273 | E59: 0.0505273 | G59: of:=IF([.C59]=1;"";[.C59]) -> 0.0921454 | H59: of:=IF([.D59]=1;"";[.D59]) -> 0.0505273 | I59: of:=IF([.E59]=1;"";[.E59]) -> 0.0505273
A60: 24 | B60: strncpy: &"the"{\0,\x01,\x01} &"juthe"{\0} 5 :=> &"juthe"{\0} | C60: 0.093369 | D60: 0.0316047 | E60: 0.0316047 | G60: of:=IF([.C60]=1;"";[.C60]) -> 0.093369 | H60: of:=IF([.D60]=1;"";[.D60]) -> 0.0316047 | I60: of:=IF([.E60]=1;"";[.E60]) -> 0.0316047
A61: 25 | B61: strncpy: &"juth"{\0,\x01} &""{\0,p,r,e,s,\0} 5 :=> &""{\0,\0,\0,\0,\0,\0} | C61: 0.0477583 | D61: 1 | E61: 1 | G61: of:=IF([.C61]=1;"";[.C61]) -> 0.0477583 | H61: of:=IF([.D61]=1;"";[.D61]) ->  | I61: of:=IF([.E61]=1;"";[.E61]) -> 
A62: 26 | B62: strncpy: &"inth"{\0,\x01} &"y"{\0,p,r,e,\0} 5 :=> &"y"{\0,\0,\0,\0,\0} | C62: 0.050893 | D62: 1 | E62: 1 | G62: of:=IF([.C62]=1;"";[.C62]) -> 0.050893 | H62: of:=IF([.D62]=1;"";[.D62]) ->  | I62: of:=IF([.E62]=1;"";[.E62]) -> 
A63: 27 | B63: strncpy: &"wint"{\0,\x01} &"in"{\0,p,r,\0} 5 :=> &"in"{\0,\0,\0,\0} | C63: 0.0495535 | D63: 0.226579 | E63: 0.226579 | G63: of:=IF([.C63]=1;"";[.C63]) -> 0.0495535 | H63: of:=IF([.D63]=1;"";[.D63]) -> 0.226579 | I63: of:=IF([.E63]=1;"";[.E63]) -> 0.226579
A64: 28 | B64: strncpy: &"kest"{\0,\x01} &"mes"{\0,p,\0} 5 :=> &"mes"{\0,\0,\0} | C64: 0.0491188 | D64: 0.0905241 | E64: 0.0905241 | G64: of:=IF([.C64]=1;"";[.C64]) -> 0.0491188 | H64: of:=IF([.D64]=1;"";[.D64]) -> 0.0905241 | I64: of:=IF([.E64]=1;"";[.E64]) -> 0.0905241
A65: 29 | B65: strncpy: &"dint"{\0,\x01} &"best"{\0,\0} 5 :=> &"best"{\0,\0} | C65: 0.0496215 | D65: 0.0494569 | E65: 0.0494569 | G65: of:=IF([.C65]=1;"";[.C65]) -> 0.0496215 | H65: of:=IF([.D65]=1;"";[.D65]) -> 0.0494569 | I65: of:=IF([.E65]=1;"";[.E65]) -> 0.0494569
A66: 30 | B66: strncpy: &"best"{\0,\x01} &"gesth"{\0} 5 :=> &"gesth"{\0} | C66: 0.0494569 | D66: 0.0325231 | E66: 0.0325231 | G66: of:=IF([.C66]=1;"";[.C66]) -> 0.0494569 | H66: of:=IF([.D66]=1;"";[.D66]) -> 0.0325231 | I66: of:=IF([.E66]=1;"";[.E66]) -> 0.0325231
A67: 31 | B67: strncpy: &"kesth"{\0} &""{\0,p,r,e,s,\0} 5 :=> &""{\0,\0,\0,\0,\0,\0} | C67: 0.0324076 | D67: 1 | E67: 1 | G67: of:=IF([.C67]=1;"";[.C67]) -> 0.0324076 | H67: of:=IF([.D67]=1;"";[.D67]) ->  | I67: of:=IF([.E67]=1;"";[.E67]) -> 
A68: 32 | B68: strncpy: &"orest"{\0} &"o"{\0,p,r,e,\0} 5 :=> &"o"{\0,\0,\0,\0,\0} | C68: 0.0327935 | D68: 1 | E68: 1 | G68: of:=IF([.C68]=1;"";[.C68]) -> 0.0327935 | H68: of:=IF([.D68]=1;"";[.D68]) ->  | I68: of:=IF([.E68]=1;"";[.E68]) -> 
A69: 33 | B69: strncpy: &"sthes"{\0} &"pr"{\0,p,r,\0} 5 :=> &"pr"{\0,\0,\0,\0} | C69: 0.0332025 | D69: 0.218916 | E69: 0.218916 | G69: of:=IF([.C69]=1;"";[.C69]) -> 0.0332025 | H69: of:=IF([.D69]=1;"";[.D69]) -> 0.218916 | I69: of:=IF([.E69]=1;"";[.E69]) -> 0.218916
A70: 34 | B70: strncpy: &"prest"{\0} &"nth"{\0,p,\0} 5 :=> &"nth"{\0,\0,\0} | C70: 0.0323569 | D70: 0.0920054 | E70: 0.0920054 | G70: of:=IF([.C70]=1;"";[.C70]) -> 0.0323569 | H70: of:=IF([.D70]=1;"";[.D70]) -> 0.0920054 | I70: of:=IF([.E70]=1;"";[.E70]) -> 0.0920054
A71: 35 | B71: strncpy: &"juthe"{\0} &"yest"{\0,\0} 5 :=> &"yest"{\0,\0} | C71: 0.0316047 | D71: 0.0487686 | E71: 0.0487686 | G71: of:=IF([.C71]=1;"";[.C71]) -> 0.0316047 | H71: of:=IF([.D71]=1;"";[.D71]) -> 0.0487686 | I71: of:=IF([.E71]=1;"";[.E71]) -> 0.0487686
A72: 36 | B72: strncpy: &"athes"{\0} &"hesth"{\0} 5 :=> &"hesth"{\0} | C72: 0.0333093 | D72: 0.0332025 | E72: 0.0332025 | G72: of:=IF([.C72]=1;"";[.C72]) -> 0.0333093 | H72: of:=IF([.D72]=1;"";[.D72]) -> 0.0332025 | I72: of:=IF([.E72]=1;"";[.E72]) -> 0.0332025

Sheet: strcat
A1: # | B1: Test Case | C1: N1 | D1: N2 | E1: N3
A2: 1 | B2: strcat: &""{\0,\x01,\x01,\x01,\x01,\x01,\x01,\x01,\x01,\x01} &"w"{\0,p,r,\0} :=> &"w"{\0,p,r,e,s,t,h,e,\0} | C2: 1 | D2: 1 | E2: 1 | G2: of:=IF([.C2]=1;"";[.C2]) ->  | H2: of:=IF([.D2]=1;"";[.D2]) ->  | I2: of:=IF([.E2]=1;"";[.E2]) ->  | K2: of:=AVERAGE([.G2:.G41]) -> 0.0700109709677419 | L2: of:=AVERAGE([.H2:.H41]) -> 0.12343805 | M2: of:=AVERAGE([.I2:.I41]) -> 0.0468204081081081 | O2: of:=AVERAGE([.K2:.M2]) -> 0.08008980969195
A3: 2 | B3: strcat: &""{\0,\x01,\x01,\x01,\x01,\x01,\x01,\x01,\x01,\x01} &"es"{\0,p,\0} :=> &"es"{\0,p,r,e,s,t,h,\0} | C3: 1 | D3: 0.224112 | E3: 0.224112 | G3: of:=IF([.C3]=1;"";[.C3]) ->  | H3: of:=IF([.D3]=1;"";[.D3]) -> 0.224112 | I3: of:=IF([.E3]=1;"";[.E3]) -> 0.224112
A4: 3 | B4: strcat: &""{\0,\x01,\x01,\x01,\x01,\x01,\x01,\x01,\x01,\x01} &"mes"{\0,\0} :=> &"mes"{\0,p,r,e,s,t,\0} | C4: 1 | D4: 0.0905241 | E4: 0.0905241 | G4: of:=IF([.C4]=1;"";[.C4]) ->  | H4: of:=IF([.D4]=1;"";[.D4]) -> 0.0905241 | I4: of:=IF([.E4]=1;"";[.E4]) -> 0.0905241
A5: 4 | B5: strcat: &""{\0,\x01,\x01,\x01,\x01,\x01,\x01,\x01,\x01,\x01} &"mest"{\0} :=> &"mest"{\0,p,r,e,s,\0} | C5: 1 | D5: 0.0497193 | E5: 0.0497193 | H5: of:=IF([.D5]=1;"";[.D5]) -> 0.0497193 | I5: of:=IF([.E5]=1;"";[.E5]) -> 0.0497193
A6: 5 | B6: strcat: &"p"{\0,\x01,\x01,\x01,\x01,\x01,\x01,\x01,\x01} &""{\0,p,r,e,\0} :=> &"p"{\0,p,r,e,s,t,h,e,\0} | C6: 1 | D6: 1 | E6: 1 | G6: of:=IF([.C6]=1;"";[.C6]) ->  | H6: of:=IF([.D6]=1;"";[.D6]) ->  | I6: of:=IF([.E6]=1;"";[.E6]) -> 
A7: 6 | B7: strcat: &"r"{\0,\x01,\x01,\x01,\x01,\x01,\x01,\x01,\x01} &"k"{\0,p,r,\0} :=> &"rk"{\0,p,r,e,s,t,h,\0} | C7: 1 | D7: 1 | E7: 0.215236 | G7: of:=IF([.C7]=1;"";[.C7]) ->  | H7: of:=IF([.D7]=1;"";[.D7]) ->  | I7: of:=IF([.E7]=1;"";[.E7]) -> 0.215236
A8: 7 | B8: strcat: &"n"{\0,\x01,\x01,\x01,\x01,\x01,\x01,\x01,\x01} &"th"{\0,p,\0} :=> &"nth"{\0,p,r,e,s,t,\0} | C8: 1 | D8: 0.227384 | E8: 0.0920054 | G8: of:=IF([.C8]=1;"";[.C8]) ->  | H8: of:=IF([.D8]=1;"";[.D8]) -> 0.227384 | I8: of:=IF([.E8]=1;"";[.E8]) -> 0.0920054
A9: 8 | B9: strcat: &"h"{\0,\x01,\x01,\x01,\x01,\x01,\x01,\x01,\x01} &"win"{\0,\0} :=> &"hwin"{\0,p,r,e,s,\0} | C9: 1 | D9: 0.0902992 | E9: 0.0457096 | G9: of:=IF([.C9]=1;"";[.C9]) ->  | H9: of:=IF([.D9]=1;"";[.D9]) -> 0.0902992 | I9: of:=IF([.E9]=1;"";[.E9]) -> 0.0457096
A10: 9 | B10: strcat: &"n"{\0,\x01,\x01,\x01,\x01,\x01,\x01,\x01,\x01} &"fore"{\0} :=> &"nfore"{\0,p,r,e,\0} | C10: 1 | D10: 0.0497643 | E10: 0.0312594 | G10: of:=IF([.C10]=1;"";[.C10]) ->  | H10: of:=IF([.D10]=1;"";[.D10]) -> 0.0497643 | I10: of:=IF([.E10]=1;"";[.E10]) -> 0.0312594
A11: 10 | B11: strcat: &"or"{\0,\x01,\x01,\x01,\x01,\x01,\x01,\x01} &""{\0,p,r,e,\0} :=> &"or"{\0,p,r,e,s,t,h,\0} | C11: 0.224112 | D11: 1 | E11: 0.224112 | G11: of:=IF([.C11]=1;"";[.C11]) -> 0.224112 | H11: of:=IF([.D11]=1;"";[.D11]) ->  | I11: of:=IF([.E11]=1;"";[.E11]) -> 0.224112
A12: 11 | B12: strcat: &"xp"{\0,\x01,\x01,\x01,\x01,\x01,\x01,\x01} &"d"{\0,p,r,\0} :=> &"xpd"{\0,p,r,e,s,t,\0} | C12: 0.209845 | D12: 1 | E12: 0.0733338 | G12: of:=IF([.C12]=1;"";[.C12]) -> 0.209845 | H12: of:=IF([.D12]=1;"";[.D12]) ->  | I12: of:=IF([.E12]=1;"";[.E12]) -> 0.0733338
A13: 12 | B13: strcat: &"me"{\0,\x01,\x01,\x01,\x01,\x01,\x01,\x01} &"re"{\0,p,\0} :=> &"mere"{\0,p,r,e,s,\0} | C13: 0.22156 | D13: 0.225356 | E13: 0.0503347 | G13: of:=IF([.C13]=1;"";[.C13]) -> 0.22156 | H13: of:=IF([.D13]=1;"";[.D13]) -> 0.225356 | I13: of:=IF([.E13]=1;"";[.E13]) -> 0.0503347
A14: 13 | B14: strcat: &"fo"{\0,\x01,\x01,\x01,\x01,\x01,\x01,\x01} &"ges"{\0,\0} :=> &"foges"{\0,p,r,e,\0} | C14: 0.219808 | D14: 0.0896591 | E14: 0.0309152 | G14: of:=IF([.C14]=1;"";[.C14]) -> 0.219808 | H14: of:=IF([.D14]=1;"";[.D14]) -> 0.0896591 | I14: of:=IF([.E14]=1;"";[.E14]) -> 0.0309152
A15: 14 | B15: strcat: &"ly"{\0,\x01,\x01,\x01,\x01,\x01,\x01,\x01} &"xpre"{\0} :=> &"lyxpre"{\0,p,r,\0} | C15: 0.218466 | D15: 0.0475003 | E15: 0.0195991 | G15: of:=IF([.C15]=1;"";[.C15]) -> 0.218466 | H15: of:=IF([.D15]=1;"";[.D15]) -> 0.0475003 | I15: of:=IF([.E15]=1;"";[.E15]) -> 0.0195991
A16: 15 | B16: strcat: &"ath"{\0,\x01,\x01,\x01,\x01,\x01,\x01} &""{\0,p,r,e,\0} :=> &"ath"{\0,p,r,e,s,t,\0} | C16: 0.0925605 | D16: 1 | E16: 0.0925605 | G16: of:=IF([.C16]=1;"";[.C16]) -> 0.0925605 | H16: of:=IF([.D16]=1;"";[.D16]) ->  | I16: of:=IF([.E16]=1;"";[.E16]) -> 0.0925605
A17: 16 | B17: strcat: &"zes"{\0,\x01,\x01,\x01,\x01,\x01,\x01} &"k"{\0,p,r,\0} :=> &"zesk"{\0,p,r,e,s,\0} | C17: 0.0863349 | D17: 1 | E17: 0.0457841 | G17: of:=IF([.C17]=1;"";[.C17]) -> 0.0863349 | H17: of:=IF([.D17]=1;"";[.D17]) ->  | I17: of:=IF([.E17]=1;"";[.E17]) -> 0.0457841
A18: 17 | B18: strcat: &"ath"{\0,\x01,\x01,\x01,\x01,\x01,\x01} &"or"{\0,p,\0} :=> &"athor"{\0,p,r,e,\0} | C18: 0.0925605 | D18: 0.224112 | E18: 0.0327035 | G18: of:=IF([.C18]=1;"";[.C18]) -> 0.0925605 | H18: of:=IF([.D18]=1;"";[.D18]) -> 0.224112 | I18: of:=IF([.E18]=1;"";[.E18]) -> 0.0327035
A19: 18 | B19: strcat: &"for"{\0,\x01,\x01,\x01,\x01,\x01,\x01} &"pre"{\0,\0} :=> &"forpre"{\0,p,r,\0} | C19: 0.0899511 | D19: 0.090057 | E19: 0.0225274 | G19: of:=IF([.C19]=1;"";[.C19]) -> 0.0899511 | H19: of:=IF([.D19]=1;"";[.D19]) -> 0.090057 | I19: of:=IF([.E19]=1;"";[.E19]) -> 0.0225274
A20: 19 | B20: strcat: &"ges"{\0,\x01,\x01,\x01,\x01,\x01,\x01} &"lyes"{\0} :=> &"geslyes"{\0,p,\0} | C20: 0.0896591 | D20: 0.0480665 | E20: 0.017315 | G20: of:=IF([.C20]=1;"";[.C20]) -> 0.0896591 | H20: of:=IF([.D20]=1;"";[.D20]) -> 0.0480665 | I20: of:=IF([.E20]=1;"";[.E20]) -> 0.017315
A21: 20 | B21: strcat: &"best"{\0,\x01,\x01,\x01,\x01,\x01} &""{\0,p,r,e,\0} :=> &"best"{\0,p,r,e,s,\0} | C21: 0.0494569 | D21: 1 | E21: 0.0494569 | G21: of:=IF([.C21]=1;"";[.C21]) -> 0.0494569 | H21: of:=IF([.D21]=1;"";[.D21]) ->  | I21: of:=IF([.E21]=1;"";[.E21]) -> 0.0494569
A22: 21 | B22: strcat: &"ores"{\0,\x01,\x01,\x01,\x01,\x01} &"f"{\0,p,r,\0} :=> &"oresf"{\0,p,r,e,\0} | C22: 0.0504117 | D22: 1 | E22: 0.0308567 | G22: of:=IF([.C22]=1;"";[.C22]) -> 0.0504117 | H22: of:=IF([.D22]=1;"";[.D22]) ->  | I22: of:=IF([.E22]=1;"";[.E22]) -> 0.0308567
A23: 22 | B23: strcat: &"pres"{\0,\x01,\x01,\x01,\x01,\x01} &"wi"{\0,p,\0} :=> &"preswi"{\0,p,r,\0} | C23: 0.0496296 | D23: 0.218466 | E23: 0.022183 | G23: of:=IF([.C23]=1;"";[.C23]) -> 0.0496296 | H23: of:=IF([.D23]=1;"";[.D23]) -> 0.218466 | I23: of:=IF([.E23]=1;"";[.E23]) -> 0.022183
A24: 23 | B24: strcat: &"juth"{\0,\x01,\x01,\x01,\x01,\x01} &"the"{\0,\0} :=> &"juththe"{\0,p,\0} | C24: 0.0477583 | D24: 0.093369 | E24: 0.0177795 | G24: of:=IF([.C24]=1;"";[.C24]) -> 0.0477583 | H24: of:=IF([.D24]=1;"";[.D24]) -> 0.093369 | I24: of:=IF([.E24]=1;"";[.E24]) -> 0.0177795
A25: 24 | B25: strcat: &"quth"{\0,\x01,\x01,\x01,\x01,\x01} &"yest"{\0} :=> &"quthyest"{\0,\0} | C25: 0.0483689 | D25: 0.0487686 | E25: 0.0140946 | G25: of:=IF([.C25]=1;"";[.C25]) -> 0.0483689 | H25: of:=IF([.D25]=1;"";[.D25]) -> 0.0487686 | I25: of:=IF([.E25]=1;"";[.E25]) -> 0.0140946
A26: 25 | B26: strcat: &"orest"{\0,\x01,\x01,\x01,\x01} &""{\0,p,r,e,\0} :=> &"orest"{\0,p,r,e,\0} | C26: 0.0327935 | D26: 1 | E26: 0.0327935 | G26: of:=IF([.C26]=1;"";[.C26]) -> 0.0327935 | H26: of:=IF([.D26]=1;"";[.D26]) ->  | I26: of:=IF([.E26]=1;"";[.E26]) -> 0.0327935
A27: 26 | B27: strcat: &"lyest"{\0,\x01,\x01,\x01,\x01} &"w"{\0,p,r,\0} :=> &"lyestw"{\0,p,r,\0} | C27: 0.0314814 | D27: 1 | E27: 0.0222736 | G27: of:=IF([.C27]=1;"";[.C27]) -> 0.0314814 | H27: of:=IF([.D27]=1;"";[.D27]) ->  | I27: of:=IF([.E27]=1;"";[.E27]) -> 0.0222736
A28: 27 | B28: strcat: &"quthe"{\0,\x01,\x01,\x01,\x01} &"me"{\0,p,\0} :=> &"qutheme"{\0,p,\0} | C28: 0.0319508 | D28: 0.22156 | E28: 0.0178615 | G28: of:=IF([.C28]=1;"";[.C28]) -> 0.0319508 | H28: of:=IF([.D28]=1;"";[.D28]) -> 0.22156 | I28: of:=IF([.E28]=1;"";[.E28]) -> 0.0178615
A29: 28 | B29: strcat: &"uthes"{\0,\x01,\x01,\x01,\x01} &"xpr"{\0,\0} :=> &"uthesxpr"{\0,\0} | C29: 0.0329073 | D29: 0.085063 | E29: 0 | G29: of:=IF([.C29]=1;"";[.C29]) -> 0.0329073 | H29: of:=IF([.D29]=1;"";[.D29]) -> 0.085063 | I29: of:=IF([.E29]=1;"";[.E29]) -> 0
A30: 29 | B30: strcat: &"uthes"{\0,\x01,\x01,\x01,\x01} &"yest"{\0} :=> &"uthesyest"{\0} | C30: 0.0329073 | D30: 0.0487686 | E30: 0.0123637 | G30: of:=IF([.C30]=1;"";[.C30]) -> 0.0329073 | H30: of:=IF([.D30]=1;"";[.D30]) -> 0.0487686 | I30: of:=IF([.E30]=1;"";[.E30]) -> 0.0123637
A31: 30 | B31: strcat: &"lyesth"{\0,\x01,\x01,\x01} &""{\0,p,r,e,\0} :=> &"lyesth"{\0,p,r,\0} | C31: 0.0231301 | D31: 1 | E31: 0.0231301 | G31: of:=IF([.C31]=1;"";[.C31]) -> 0.0231301 | H31: of:=IF([.D31]=1;"";[.D31]) ->  | I31: of:=IF([.E31]=1;"";[.E31]) -> 0.0231301
A32: 31 | B32: strcat: &"esthes"{\0,\x01,\x01,\x01} &"i"{\0,p,r,\0} :=> &"esthesi"{\0,p,\0} | C32: 0.0240579 | D32: 1 | E32: 0.0185815 | G32: of:=IF([.C32]=1;"";[.C32]) -> 0.0240579 | H32: of:=IF([.D32]=1;"";[.D32]) ->  | I32: of:=IF([.E32]=1;"";[.E32]) -> 0.0185815
A33: 32 | B33: strcat: &"kesthe"{\0,\x01,\x01,\x01} &"in"{\0,p,\0} :=> &"kesthein"{\0,\0} | C33: 0.0237035 | D33: 0.226579 | E33: 0.0149528 | G33: of:=IF([.C33]=1;"";[.C33]) -> 0.0237035 | H33: of:=IF([.D33]=1;"";[.D33]) -> 0.226579 | I33: of:=IF([.E33]=1;"";[.E33]) -> 0.0149528
A34: 33 | B34: strcat: &"cthest"{\0,\x01,\x01,\x01} &"lye"{\0,\0} :=> &"cthestlye"{\0} | C34: 0.0237529 | D34: 0.0866641 | E34: 0.0123261 | G34: of:=IF([.C34]=1;"";[.C34]) -> 0.0237529 | H34: of:=IF([.D34]=1;"";[.D34]) -> 0.0866641 | I34: of:=IF([.E34]=1;"";[.E34]) -> 0.0123261
A35: 34 | B35: strcat: &"dinthe"{\0,\x01,\x01,\x01} &&10 :=> &"dinthesthe"{} | C35: 0.0238852 | D35: 0.011379 | G35: of:=IF([.C35]=1;"";[.C35]) -> 0.0238852 | H35: of:=IF([.D35]=1;"";[.D35]) -> 0.011379 | I35: of:=IF([.E35]=1;"";[.E35]) ->  
A36: 35 | B36: strcat: &"hesthes"{\0,\x01,\x01} &""{\0,p,r,e,\0} :=> &"hesthes"{\0,p,\0} | C36: 0.0188318 | D36: 1 | E36: 0.0188318 | G36: of:=IF([.C36]=1;"";[.C36]) -> 0.0188318 | H36: of:=IF([.D36]=1;"";[.D36]) ->  | I36: of:=IF([.E36]=1;"";[.E36]) -> 0.0188318
A37: 36 | B37: strcat: &"gesthes"{\0,\x01,\x01} &"b"{\0,p,r,\0} :=> &"gesthesb"{\0,\0} | C37: 0.0185314 | D37: 1 | E37: 0.0145208 | G37: of:=IF([.C37]=1;"";[.C37]) -> 0.0185314 | H37: of:=IF([.D37]=1;"";[.D37]) ->  | I37: of:=IF([.E37]=1;"";[.E37]) -> 0.0145208
A38: 37 | B38: strcat: &"mesthes"{\0,\x01,\x01} &"wi"{\0,p,\0} :=> &"mestheswi"{\0} | C38: 0.0186305 | D38: 0.218466 | E38: 0.0123951 | G38: of:=IF([.C38]=1;"";[.C38]) -> 0.0186305 | H38: of:=IF([.D38]=1;"";[.D38]) -> 0.218466 | I38: of:=IF([.E38]=1;"";[.E38]) -> 0.0123951
A39: 38 | B39: strcat: &"yesthest"{\0,\x01} &""{\0,p,r,e,\0} :=> &"yesthest"{\0,\0} | C39: 0.0150558 | D39: 1 | E39: 0.0150558 | G39: of:=IF([.C39]=1;"";[.C39]) -> 0.0150558 | H39: of:=IF([.D39]=1;"";[.D39]) ->  | I39: of:=IF([.E39]=1;"";[.E39]) -> 0.0150558
A40: 39 | B40: strcat: &"kesthest"{\0,\x01} &"v"{\0,p,r,\0} :=> &"kesthestv"{\0} | C40: 0.0151206 | D40: 1 | E40: 0.0120294 | G40: of:=IF([.C40]=1;"";[.C40]) -> 0.0151206 | H40: of:=IF([.D40]=1;"";[.D40]) ->  | I40: of:=IF([.E40]=1;"";[.E40]) -> 0.0120294
A41: 40 | B41: strcat: &"thesthest"{\0} &""{\0,p,r,e,\0} :=> &"thesthest"{\0} | C41: 0.0131176 | D41: 1 | E41: 0.0131176 | G41: of:=IF([.C41]=1;"";[.C41]) -> 0.0131176 | H41: of:=IF([.D41]=1;"";[.D41]) ->  | I41: of:=IF([.E41]=1;"";[.E41]) -> 0.0131176
A42: 1 | B42: strncat: &""{\0,\x01,\x01,\x01,\x01,\x01,\x01,\x01,\x01,\x01} &""{\0,p,r,e,\0} 4 :=> &""{\0,p,r,e,s,t,h,e,s,\0} | C42: 1 | D42: 1 | E42: 1 | G42: of:=IF([.C42]=1;"";[.C42]) ->  | H42: of:=IF([.D42]=1;"";[.D42]) ->  | I42: of:=IF([.E42]=1;"";[.E42]) ->  | K42: of:=AVERAGE([.G42:.G82]) -> 0.0705197483870968 | L42: of:=AVERAGE([.H42:.H82]) -> 0.123077481818182 | M42: of:=AVERAGE([.I42:.I82]) -> 0.0474759243243243 | O42: of:=AVERAGE([.K42:.M42]) -> 0.0803577181765343
A43: 2 | B43: strncat: &""{\0,\x01,\x01,\x01,\x01,\x01,\x01,\x01,\x01,\x01} &"r"{\0,p,r,\0} 4 :=> &"r"{\0,p,r,e,s,t,h,e,\0} | C43: 1 | D43: 1 | E43: 1 | G43: of:=IF([.C43]=1;"";[.C43]) ->  | H43: of:=IF([.D43]=1;"";[.D43]) ->  | I43: of:=IF([.E43]=1;"";[.E43]) -> 
A44: 3 | B44: strncat: &""{\0,\x01,\x01,\x01,\x01,\x01,\x01,\x01,\x01,\x01} &"fo"{\0,p,\0} 4 :=> &"fo"{\0,p,r,e,s,t,h,\0} | C44: 1 | D44: 0.219808 | E44: 0.219808 | G44: of:=IF([.C44]=1;"";[.C44]) ->  | H44: of:=IF([.D44]=1;"";[.D44]) -> 0.219808 | I44: of:=IF([.E44]=1;"";[.E44]) -> 0.219808
A45: 4 | B45: strncat: &""{\0,\x01,\x01,\x01,\x01,\x01,\x01,\x01,\x01,\x01} &"ves"{\0,\0} 4 :=> &"ves"{\0,p,r,e,s,t,\0} | C45: 1 | D45: 0.0906651 | E45: 0.0906651 | G45: of:=IF([.C45]=1;"";[.C45]) ->  | H45: of:=IF([.D45]=1;"";[.D45]) -> 0.0906651 | I45: of:=IF([.E45]=1;"";[.E45]) -> 0.0906651
A46: 5 | B46: strncat: &""{\0,\x01,\x01,\x01,\x01,\x01,\x01,\x01,\x01,\x01} &"athe"{\0} 4 :=> &"athe"{\0,p,r,e,s,\0} | C46: 1 | D46: 0.0512095 | E46: 0.0512095 | G46: of:=IF([.C46]=1;"";[.C46]) ->  | H46: of:=IF([.D46]=1;"";[.D46]) -> 0.0512095 | I46: of:=IF([.E46]=1;"";[.E46]) -> 0.0512095
A47: 6 | B47: strncat: &"j"{\0,\x01,\x01,\x01,\x01,\x01,\x01,\x01,\x01} &""{\0,p,r,e,\0} 4 :=> &"j"{\0,p,r,e,s,t,h,e,\0} | C47: 1 | D47: 1 | E47: 1 | G47: of:=IF([.C47]=1;"";[.C47]) ->  | H47: of:=IF([.D47]=1;"";[.D47]) ->  | I47: of:=IF([.E47]=1;"";[.E47]) -> 
A48: 7 | B48: strncat: &"o"{\0,\x01,\x01,\x01,\x01,\x01,\x01,\x01,\x01} &"i"{\0,p,r,\0} 4 :=> &"oi"{\0,p,r,e,s,t,h,\0} | C48: 1 | D48: 1 | E48: 0.212346 | G48: of:=IF([.C48]=1;"";[.C48]) ->  | H48: of:=IF([.D48]=1;"";[.D48]) ->  | I48: of:=IF([.E48]=1;"";[.E48]) -> 0.212346
A49: 8 | B49: strncat: &"k"{\0,\x01,\x01,\x01,\x01,\x01,\x01,\x01,\x01} &"es"{\0,p,\0} 4 :=> &"kes"{\0,p,r,e,s,t,\0} | C49: 1 | D49: 0.224112 | E49: 0.0892137 | G49: of:=IF([.C49]=1;"";[.C49]) ->  | H49: of:=IF([.D49]=1;"";[.D49]) -> 0.224112 | I49: of:=IF([.E49]=1;"";[.E49]) -> 0.0892137
A50: 9 | B50: strncat: &"p"{\0,\x01,\x01,\x01,\x01,\x01,\x01,\x01,\x01} &"the"{\0,\0} 4 :=> &"pthe"{\0,p,r,e,s,\0} | C50: 1 | D50: 0.093369 | E50: 0.0490306 | G50: of:=IF([.C50]=1;"";[.C50]) ->  | H50: of:=IF([.D50]=1;"";[.D50]) -> 0.093369 | I50: of:=IF([.E50]=1;"";[.E50]) -> 0.0490306
A51: 10 | B51: strncat: &"p"{\0,\x01,\x01,\x01,\x01,\x01,\x01,\x01,\x01} &"sthe"{\0} 4 :=> &"psthe"{\0,p,r,e,\0} | C51: 1 | D51: 0.051018 | E51: 0.0319332 | G51: of:=IF([.C51]=1;"";[.C51]) ->  | H51: of:=IF([.D51]=1;"";[.D51]) -> 0.051018 | I51: of:=IF([.E51]=1;"";[.E51]) -> 0.0319332
A52: 11 | B52: strncat: &"be"{\0,\x01,\x01,\x01,\x01,\x01,\x01,\x01} &""{\0,p,r,e,\0} 4 :=> &"be"{\0,p,r,e,s,t,h,\0} | C52: 0.219808 | D52: 1 | E52: 0.219808 | G52: of:=IF([.C52]=1;"";[.C52]) -> 0.219808 | H52: of:=IF([.D52]=1;"";[.D52]) ->  | I52: of:=IF([.E52]=1;"";[.E52]) -> 0.219808
A53: 12 | B53: strncat: &"fo"{\0,\x01,\x01,\x01,\x01,\x01,\x01,\x01} &"u"{\0,p,r,\0} 4 :=> &"fou"{\0,p,r,e,s,t,\0} | C53: 0.219808 | D53: 1 | E53: 0.0892696 | G53: of:=IF([.C53]=1;"";[.C53]) -> 0.219808 | H53: of:=IF([.D53]=1;"";[.D53]) ->  | I53: of:=IF([.E53]=1;"";[.E53]) -> 0.0892696
A54: 13 | B54: strncat: &"di"{\0,\x01,\x01,\x01,\x01,\x01,\x01,\x01} &"fo"{\0,p,\0} 4 :=> &"difo"{\0,p,r,e,s,\0} | C54: 0.218916 | D54: 0.219808 | E54: 0.0473036 | G54: of:=IF([.C54]=1;"";[.C54]) -> 0.218916 | H54: of:=IF([.D54]=1;"";[.D54]) -> 0.219808 | I54: of:=IF([.E54]=1;"";[.E54]) -> 0.0473036
A55: 14 | B55: strncat: &"ge"{\0,\x01,\x01,\x01,\x01,\x01,\x01,\x01} &"ges"{\0,\0} 4 :=> &"geges"{\0,p,r,e,\0} | C55: 0.218916 | D55: 0.0896591 | E55: 0.0310071 | G55: of:=IF([.C55]=1;"";[.C55]) -> 0.218916 | H55: of:=IF([.D55]=1;"";[.D55]) -> 0.0896591 | I55: of:=IF([.E55]=1;"";[.E55]) -> 0.0310071
A56: 15 | B56: strncat: &"pr"{\0,\x01,\x01,\x01,\x01,\x01,\x01,\x01} &"gest"{\0} 4 :=> &"prgest"{\0,p,r,\0} | C56: 0.218916 | D56: 0.049323 | E56: 0.0226175 | G56: of:=IF([.C56]=1;"";[.C56]) -> 0.218916 | H56: of:=IF([.D56]=1;"";[.D56]) -> 0.049323 | I56: of:=IF([.E56]=1;"";[.E56]) -> 0.0226175
A57: 16 | B57: strncat: &"uth"{\0,\x01,\x01,\x01,\x01,\x01,\x01} &""{\0,p,r,e,\0} 4 :=> &"uth"{\0,p,r,e,s,t,\0} | C57: 0.0910004 | D57: 1 | E57: 0.0910004 | G57: of:=IF([.C57]=1;"";[.C57]) -> 0.0910004 | H57: of:=IF([.D57]=1;"";[.D57]) ->  | I57: of:=IF([.E57]=1;"";[.E57]) -> 0.0910004
A58: 17 | B58: strncat: &"the"{\0,\x01,\x01,\x01,\x01,\x01,\x01} &"m"{\0,p,r,\0} 4 :=> &"them"{\0,p,r,e,s,\0} | C58: 0.093369 | D58: 1 | E58: 0.050214 | G58: of:=IF([.C58]=1;"";[.C58]) -> 0.093369 | H58: of:=IF([.D58]=1;"";[.D58]) ->  | I58: of:=IF([.E58]=1;"";[.E58]) -> 0.050214
A59: 18 | B59: strncat: &"hes"{\0,\x01,\x01,\x01,\x01,\x01,\x01} &"ge"{\0,p,\0} 4 :=> &"hesge"{\0,p,r,e,\0} | C59: 0.0922924 | D59: 0.218916 | E59: 0.0294653 | G59: of:=IF([.C59]=1;"";[.C59]) -> 0.0922924 | H59: of:=IF([.D59]=1;"";[.D59]) -> 0.218916 | I59: of:=IF([.E59]=1;"";[.E59]) -> 0.0294653
A60: 19 | B60: strncat: &"the"{\0,\x01,\x01,\x01,\x01,\x01,\x01} &"din"{\0,\0} 4 :=> &"thedin"{\0,p,r,\0} | C60: 0.093369 | D60: 0.090448 | E60: 0.0239305 | G60: of:=IF([.C60]=1;"";[.C60]) -> 0.093369 | H60: of:=IF([.D60]=1;"";[.D60]) -> 0.090448 | I60: of:=IF([.E60]=1;"";[.E60]) -> 0.0239305
A61: 20 | B61: strncat: &"for"{\0,\x01,\x01,\x01,\x01,\x01,\x01} &"thes"{\0} 4 :=> &"forthes"{\0,p,\0} | C61: 0.0899511 | D61: 0.051146 | E61: 0.0184031 | G61: of:=IF([.C61]=1;"";[.C61]) -> 0.0899511 | H61: of:=IF([.D61]=1;"";[.D61]) -> 0.051146 | I61: of:=IF([.E61]=1;"";[.E61]) -> 0.0184031
A62: 21 | B62: strncat: &"fore"{\0,\x01,\x01,\x01,\x01,\x01} &""{\0,p,r,e,\0} 4 :=> &"fore"{\0,p,r,e,s,\0} | C62: 0.0497643 | D62: 1 | E62: 0.0497643 | G62: of:=IF([.C62]=1;"";[.C62]) -> 0.0497643 | H62: of:=IF([.D62]=1;"";[.D62]) ->  | I62: of:=IF([.E62]=1;"";[.E62]) -> 0.0497643
A63: 22 | B63: strncat: &"gest"{\0,\x01,\x01,\x01,\x01,\x01} &"w"{\0,p,r,\0} 4 :=> &"gestw"{\0,p,r,e,\0} | C63: 0.049323 | D63: 1 | E63: 0.0311504 | G63: of:=IF([.C63]=1;"";[.C63]) -> 0.049323 | H63: of:=IF([.D63]=1;"";[.D63]) ->  | I63: of:=IF([.E63]=1;"";[.E63]) -> 0.0311504
A64: 23 | B64: strncat: &"nthe"{\0,\x01,\x01,\x01,\x01,\x01} &"re"{\0,p,\0} 4 :=> &"nthere"{\0,p,r,\0} | C64: 0.0509534 | D64: 0.225356 | E64: 0.0242122 | G64: of:=IF([.C64]=1;"";[.C64]) -> 0.0509534 | H64: of:=IF([.D64]=1;"";[.D64]) -> 0.225356 | I64: of:=IF([.E64]=1;"";[.E64]) -> 0.0242122
A65: 24 | B65: strncat: &"fore"{\0,\x01,\x01,\x01,\x01,\x01} &"win"{\0,\0} 4 :=> &"forewin"{\0,p,\0} | C65: 0.0497643 | D65: 0.0902992 | E65: 0.0179905 | G65: of:=IF([.C65]=1;"";[.C65]) -> 0.0497643 | H65: of:=IF([.D65]=1;"";[.D65]) -> 0.0902992 | I65: of:=IF([.E65]=1;"";[.E65]) -> 0.0179905
A66: 25 | B66: strncat: &"zest"{\0,\x01,\x01,\x01,\x01,\x01} &"cthe"{\0} 4 :=> &"zestcthe"{\0,\0} | C66: 0.0477944 | D66: 0.0502835 | E66: 0.014293 | G66: of:=IF([.C66]=1;"";[.C66]) -> 0.0477944 | H66: of:=IF([.D66]=1;"";[.D66]) -> 0.0502835 | I66: of:=IF([.E66]=1;"";[.E66]) -> 0.014293
A67: 26 | B67: strncat: &"fores"{\0,\x01,\x01,\x01,\x01} &""{\0,p,r,e,\0} 4 :=> &"fores"{\0,p,r,e,\0} | C67: 0.0325019 | D67: 1 | E67: 0.0325019 | G67: of:=IF([.C67]=1;"";[.C67]) -> 0.0325019 | H67: of:=IF([.D67]=1;"";[.D67]) ->  | I67: of:=IF([.E67]=1;"";[.E67]) -> 0.0325019
A68: 27 | B68: strncat: &"fores"{\0,\x01,\x01,\x01,\x01} &"j"{\0,p,r,\0} 4 :=> &"foresj"{\0,p,r,\0} | C68: 0.0325019 | D68: 1 | E68: 0.020401 | G68: of:=IF([.C68]=1;"";[.C68]) -> 0.0325019 | H68: of:=IF([.D68]=1;"";[.D68]) ->  | I68: of:=IF([.E68]=1;"";[.E68]) -> 0.020401
A69: 28 | B69: strncat: &"besth"{\0,\x01,\x01,\x01,\x01} &"ge"{\0,p,\0} 4 :=> &"besthge"{\0,p,\0} | C69: 0.0325987 | D69: 0.218916 | E69: 0.0164589 | G69: of:=IF([.C69]=1;"";[.C69]) -> 0.0325987 | H69: of:=IF([.D69]=1;"";[.D69]) -> 0.218916 | I69: of:=IF([.E69]=1;"";[.E69]) -> 0.0164589
A70: 29 | B70: strncat: &"dinth"{\0,\x01,\x01,\x01,\x01} &"din"{\0,\0} 4 :=> &"dinthdin"{\0,\0} | C70: 0.0326917 | D70: 0.090448 | E70: 0.0142959 | G70: of:=IF([.C70]=1;"";[.C70]) -> 0.0326917 | H70: of:=IF([.D70]=1;"";[.D70]) -> 0.090448 | I70: of:=IF([.E70]=1;"";[.E70]) -> 0.0142959
A71: 30 | B71: strncat: &"dinth"{\0,\x01,\x01,\x01,\x01} &"lyes"{\0} 4 :=> &"dinthlyes"{\0} | C71: 0.0326917 | D71: 0.0480665 | E71: 0.0121266 | G71: of:=IF([.C71]=1;"";[.C71]) -> 0.0326917 | H71: of:=IF([.D71]=1;"";[.D71]) -> 0.0480665 | I71: of:=IF([.E71]=1;"";[.E71]) -> 0.0121266
A72: 31 | B72: strncat: &"athest"{\0,\x01,\x01,\x01} &""{\0,p,r,e,\0} 4 :=> &"athest"{\0,p,r,\0} | C72: 0.0240802 | D72: 1 | E72: 0.0240802 | G72: of:=IF([.C72]=1;"";[.C72]) -> 0.0240802 | H72: of:=IF([.D72]=1;"";[.D72]) ->  | I72: of:=IF([.E72]=1;"";[.E72]) -> 0.0240802
A73: 32 | B73: strncat: &"besthe"{\0,\x01,\x01,\x01} &"m"{\0,p,r,\0} 4 :=> &"besthem"{\0,p,\0} | C73: 0.0238258 | D73: 1 | E73: 0.0183387 | G73: of:=IF([.C73]=1;"";[.C73]) -> 0.0238258 | H73: of:=IF([.D73]=1;"";[.D73]) ->  | I73: of:=IF([.E73]=1;"";[.E73]) -> 0.0183387
A74: 33 | B74: strncat: &"mesthe"{\0,\x01,\x01,\x01} &"qu"{\0,p,\0} 4 :=> &"mesthequ"{\0,\0} | C74: 0.0239205 | D74: 0.212836 | E74: 0.0144402 | G74: of:=IF([.C74]=1;"";[.C74]) -> 0.0239205 | H74: of:=IF([.D74]=1;"";[.D74]) -> 0.212836 | I74: of:=IF([.E74]=1;"";[.E74]) -> 0.0144402
A75: 34 | B75: strncat: &"vesthe"{\0,\x01,\x01,\x01} &"sth"{\0,\0} 4 :=> &"vesthesth"{\0} | C75: 0.0239438 | D75: 0.0921454 | E75: 0.013012 | G75: of:=IF([.C75]=1;"";[.C75]) -> 0.0239438 | H75: of:=IF([.D75]=1;"";[.D75]) -> 0.0921454 | I75: of:=IF([.E75]=1;"";[.E75]) -> 0.013012
A76: 35 | B76: strncat: &"oresth"{\0,\x01,\x01,\x01} &&10 4 :=> &"oresthesth"{} | C76: 0.0239715 | D76: 0.0114063 | G76: of:=IF([.C76]=1;"";[.C76]) -> 0.0239715 | H76: of:=IF([.D76]=1;"";[.D76]) -> 0.0114063 | I76: of:=IF([.E76]=1;"";[.E76]) ->  
A77: 36 | B77: strncat: &"resthes"{\0,\x01,\x01} &""{\0,p,r,e,\0} 4 :=> &"resthes"{\0,p,\0} | C77: 0.0187717 | D77: 1 | E77: 0.0187717 | G77: of:=IF([.C77]=1;"";[.C77]) -> 0.0187717 | H77: of:=IF([.D77]=1;"";[.D77]) ->  | I77: of:=IF([.E77]=1;"";[.E77]) -> 0.0187717
A78: 37 | B78: strncat: &"hesthes"{\0,\x01,\x01} &"d"{\0,p,r,\0} 4 :=> &"hesthesd"{\0,\0} | C78: 0.0188318 | D78: 1 | E78: 0.0148178 | G78: of:=IF([.C78]=1;"";[.C78]) -> 0.0188318 | H78: of:=IF([.D78]=1;"";[.D78]) ->  | I78: of:=IF([.E78]=1;"";[.E78]) -> 0.0148178
A79: 38 | B79: strncat: &"mesthes"{\0,\x01,\x01} &"ct"{\0,p,\0} 4 :=> &"mesthesct"{\0} | C79: 0.0186305 | D79: 0.218466 | E79: 0.0126147 | G79: of:=IF([.C79]=1;"";[.C79]) -> 0.0186305 | H79: of:=IF([.D79]=1;"";[.D79]) -> 0.218466 | I79: of:=IF([.E79]=1;"";[.E79]) -> 0.0126147
A80: 39 | B80: strncat: &"uthesthe"{\0,\x01} &""{\0,p,r,e,\0} 4 :=> &"uthesthe"{\0,\0} | C80: 0.0153723 | D80: 1 | E80: 0.0153723 | G80: of:=IF([.C80]=1;"";[.C80]) -> 0.0153723 | H80: of:=IF([.D80]=1;"";[.D80]) ->  | I80: of:=IF([.E80]=1;"";[.E80]) -> 0.0153723
A81: 40 | B81: strncat: &"kesthest"{\0,\x01} &"v"{\0,p,r,\0} 4 :=> &"kesthestv"{\0} | C81: 0.0151206 | D81: 1 | E81: 0.0120294 | G81: of:=IF([.C81]=1;"";[.C81]) -> 0.0151206 | H81: of:=IF([.D81]=1;"";[.D81]) ->  | I81: of:=IF([.E81]=1;"";[.E81]) -> 0.0120294
A82: 41 | B82: strncat: &"juthesthe"{\0} &""{\0,p,r,e,\0} 4 :=> &"juthesthe"{\0} | C82: 0.0127123 | D82: 1 | E82: 0.0127123 | G82: of:=IF([.C82]=1;"";[.C82]) -> 0.0127123 | H82: of:=IF([.D82]=1;"";[.D82]) ->  | I82: of:=IF([.E82]=1;"";[.E82]) -> 0.0127123

Sheet: strstr
A1: # | B1: Test Case | C1: N | G1: N1 | H1: N2 | I1: N3
A2: 1 | B2: strstr: &"p"{\0,h,e,s,\0} &"p"{\0,\0} :=> &"p"{\0,h,e,s,\0} | C2: 1 | D2: 1 | E2: 1 | G2: of:=IF([.C2]=1;"";[.C2]) ->  | H2: of:=IF([.D2]=1;"";[.D2]) ->  | I2: of:=IF([.E2]=1;"";[.E2]) ->  | K2: of:=AVERAGE([.G2:.G19]) -> 0.0859284176470588 | L2: of:=AVERAGE([.H2:.H19]) -> 0.217663333333333 | M2: of:=AVERAGE([.I2:.I19]) -> 0.11335241875 | O2: of:=AVERAGE([.K2:.M2]) -> 0.138981389910131
A3: 2 | B3: strstr: &"ly"{\0,h,e,\0} &"l"{\0,\0} :=> &"ly"{\0,h,e,\0} | C3: 0.218466 | D3: 1 | E3: 0.218466 | G3: of:=IF([.C3]=1;"";[.C3]) -> 0.218466 | H3: of:=IF([.D3]=1;"";[.D3]) ->  | I3: of:=IF([.E3]=1;"";[.E3]) -> 0.218466
A4: 3 | B4: strstr: &"be"{\0,b,e,\0} &"e"{\0,\0} :=> &"e"{\0,b,e,\0,54} | C4: 0.219808 | D4: 1 | E4: 1 | G4: of:=IF([.C4]=1;"";[.C4]) -> 0.219808 | H4: of:=IF([.D4]=1;"";[.D4]) ->  | I4: of:=IF([.E4]=1;"";[.E4]) -> 
A5: 4 | B5: strstr: &"nth"{\0,h,\0} &"n"{\0,\0} :=> &"nth"{\0,h,\0} | C5: 0.0920054 | D5: 1 | E5: 0.0920054 | G5: of:=IF([.C5]=1;"";[.C5]) -> 0.0920054 | H5: of:=IF([.D5]=1;"";[.D5]) ->  | I5: of:=IF([.E5]=1;"";[.E5]) -> 0.0920054
A6: 5 | B6: strstr: &"cth"{\0,b,\0} &"t"{\0,\0} :=> &"th"{\0,b,\0,54} | C6: 0.0905558 | D6: 1 | E6: 0.227384 | G6: of:=IF([.C6]=1;"";[.C6]) -> 0.0905558 | H6: of:=IF([.D6]=1;"";[.D6]) ->  | I6: of:=IF([.E6]=1;"";[.E6]) -> 0.227384
A7: 6 | B7: strstr: &"pres"{\0,\0} &"p"{\0,\0} :=> &"pres"{\0,\0} | C7: 0.0496296 | D7: 1 | E7: 0.0496296 | G7: of:=IF([.C7]=1;"";[.C7]) -> 0.0496296 | H7: of:=IF([.D7]=1;"";[.D7]) ->  | I7: of:=IF([.E7]=1;"";[.E7]) -> 0.0496296
A8: 7 | B8: strstr: &"xpre"{\0,\0} &"p"{\0,\0} :=> &"pre"{\0,\0,54} | C8: 0.0475003 | D8: 1 | E8: 0.090057 | G8: of:=IF([.C8]=1;"";[.C8]) -> 0.0475003 | H8: of:=IF([.D8]=1;"";[.D8]) ->  | I8: of:=IF([.E8]=1;"";[.E8]) -> 0.090057
A9: 8 | B9: strstr: &"sthes"{\0} &"s"{\0,\0} :=> &"sthes"{\0} | C9: 0.0332025 | D9: 1 | E9: 0.0332025 | G9: of:=IF([.C9]=1;"";[.C9]) -> 0.0332025 | H9: of:=IF([.D9]=1;"";[.D9]) ->  | I9: of:=IF([.E9]=1;"";[.E9]) -> 0.0332025
A10: 9 | B10: strstr: &"yesth"{\0} &"e"{\0,\0} :=> &"esth"{\0,54} | C10: 0.0322095 | D10: 1 | E10: 0.0505869 | G10: of:=IF([.C10]=1;"";[.C10]) -> 0.0322095 | H10: of:=IF([.D10]=1;"";[.D10]) ->  | I10: of:=IF([.E10]=1;"";[.E10]) -> 0.0505869
A11: 10 | B11: strstr: &"he"{\0,d,i,\0} &"he"{\0} :=> &"he"{\0,d,i,\0} | C11: 0.226983 | D11: 0.226983 | E11: 0.226983 | G11: of:=IF([.C11]=1;"";[.C11]) -> 0.226983 | H11: of:=IF([.D11]=1;"";[.D11]) -> 0.226983 | I11: of:=IF([.E11]=1;"";[.E11]) -> 0.226983
A12: 11 | B12: strstr: &"xpr"{\0,d,\0} &"xp"{\0} :=> &"xpr"{\0,d,\0} | C12: 0.085063 | D12: 0.209845 | E12: 0.085063 | G12: of:=IF([.C12]=1;"";[.C12]) -> 0.085063 | H12: of:=IF([.D12]=1;"";[.D12]) -> 0.209845 | I12: of:=IF([.E12]=1;"";[.E12]) -> 0.085063
A13: 12 | B13: strstr: &"zze"{\0,a,\0} &"ze"{\0} :=> &"ze"{\0,a,\0,54} | C13: 0.0780661 | D13: 0.208818 | E13: 0.208818 | G13: of:=IF([.C13]=1;"";[.C13]) -> 0.0780661 | H13: of:=IF([.D13]=1;"";[.D13]) -> 0.208818 | I13: of:=IF([.E13]=1;"";[.E13]) -> 0.208818
A14: 13 | B14: strstr: &"for"{\0,p,\0} &"or"{\0} :=> &"or"{\0,p,\0,54} | C14: 0.0899511 | D14: 0.224112 | E14: 0.224112 | G14: of:=IF([.C14]=1;"";[.C14]) -> 0.0899511 | H14: of:=IF([.D14]=1;"";[.D14]) -> 0.224112 | I14: of:=IF([.E14]=1;"";[.E14]) -> 0.224112
A15: 14 | B15: strstr: &"kest"{\0,\0} &"ke"{\0} :=> &"kest"{\0,\0} | C15: 0.0491188 | D15: 0.217558 | E15: 0.0491188 | G15: of:=IF([.C15]=1;"";[.C15]) -> 0.0491188 | H15: of:=IF([.D15]=1;"";[.D15]) -> 0.217558 | I15: of:=IF([.E15]=1;"";[.E15]) -> 0.0491188
A16: 15 | B16: strstr: &"jjut"{\0,\0} &"ju"{\0} :=> &"jut"{\0,\0,54} | C16: 0.0352605 | D16: 0.208818 | E16: 0.0850061 | G16: of:=IF([.C16]=1;"";[.C16]) -> 0.0352605 | H16: of:=IF([.D16]=1;"";[.D16]) -> 0.208818 | I16: of:=IF([.E16]=1;"";[.E16]) -> 0.0850061
A17: 16 | B17: strstr: &"gest"{\0,\0} &"es"{\0} :=> &"est"{\0,\0,54} | C17: 0.049323 | D17: 0.224112 | E17: 0.091083 | G17: of:=IF([.C17]=1;"";[.C17]) -> 0.049323 | H17: of:=IF([.D17]=1;"";[.D17]) -> 0.224112 | I17: of:=IF([.E17]=1;"";[.E17]) -> 0.091083
A18: 17 | B18: strstr: &"fores"{\0} &"fo"{\0} :=> &"fores"{\0} | C18: 0.0325019 | D18: 0.219808 | E18: 0.0325019 | G18: of:=IF([.C18]=1;"";[.C18]) -> 0.0325019 | H18: of:=IF([.D18]=1;"";[.D18]) -> 0.219808 | I18: of:=IF([.E18]=1;"";[.E18]) -> 0.0325019
A19: 18 | B19: strstr: &"ddint"{\0} &"di"{\0} :=> &"dint"{\0,54} | C19: 0.0311386 | D19: 0.218916 | E19: 0.0496215 | G19: of:=IF([.C19]=1;"";[.C19]) -> 0.0311386 | H19: of:=IF([.D19]=1;"";[.D19]) -> 0.218916 | I19: of:=IF([.E19]=1;"";[.E19]) -> 0.0496215
A20: 19 | B20: strstr: &"resth"{\0} &"es"{\0} :=> &"esth"{\0,54} | C20: 0.0330663 | D20: 0.224112 | E20: 0.0505869 | G20: of:=IF([.C20]=1;"";[.C20]) -> 0.0330663 | H20: of:=IF([.D20]=1;"";[.D20]) -> 0.224112 | I20: of:=IF([.E20]=1;"";[.E20]) -> 0.0505869 | K20: of:=AVERAGE([.G20:.G24]) -> 0.03270726 | L20: of:=AVERAGE([.H20:.H24]) -> 0.221289 | M20: of:=AVERAGE([.I20:.I24]) -> 0.03982414 | O20: of:=AVERAGE([.K20:.M20]) -> 0.0979401333333333
A21: 1 | B21: strnstr: &"mesth"{\0} &""{\0,p,\0} 2 :=> &"mesth"{\0} | C21: 0.0327469 | D21: 1 | E21: 0.0327469 | G21: of:=IF([.C21]=1;"";[.C21]) -> 0.0327469 | H21: of:=IF([.D21]=1;"";[.D21]) ->  | I21: of:=IF([.E21]=1;"";[.E21]) -> 0.0327469
A22: 2 | B22: strnstr: &"kesth"{\0} &"k"{\0,\0} 2 :=> &"kesth"{\0} | C22: 0.0324076 | D22: 1 | E22: 0.0324076 | G22: of:=IF([.C22]=1;"";[.C22]) -> 0.0324076 | H22: of:=IF([.D22]=1;"";[.D22]) ->  | I22: of:=IF([.E22]=1;"";[.E22]) -> 0.0324076
A23: 3 | B23: strnstr: &"gesth"{\0} &"e"{\0,\0} 2 :=> &"esth"{\0,54} | C23: 0.0325231 | D23: 1 | E23: 0.0505869 | G23: of:=IF([.C23]=1;"";[.C23]) -> 0.0325231 | H23: of:=IF([.D23]=1;"";[.D23]) ->  | I23: of:=IF([.E23]=1;"";[.E23]) -> 0.0505869
A24: 4 | B24: strnstr: &"cthes"{\0} &"ct"{\0} 2 :=> &"cthes"{\0} | C24: 0.0327924 | D24: 0.218466 | E24: 0.0327924 | G24: of:=IF([.C24]=1;"";[.C24]) -> 0.0327924 | H24: of:=IF([.D24]=1;"";[.D24]) -> 0.218466 | I24: of:=IF([.E24]=1;"";[.E24]) -> 0.0327924
A25: 1 | B25: strpbrk: &"ruthe"{\0} &"aeiou"{\0} :=> &"uthe"{\0,54} | C25: 0.0319925 | D25: 0.0299288 | E25: 0.0504892 | G25: of:=IF([.C25]=1;"";[.C25]) -> 0.0319925 | H25: of:=IF([.D25]=1;"";[.D25]) -> 0.0299288 | I25: of:=IF([.E25]=1;"";[.E25]) -> 0.0504892 | K25: of:=AVERAGE([.G25:.G34]) -> 0.03245889 | L25: of:=AVERAGE([.H25:.H34]) -> 0.0299288 | M25: of:=AVERAGE([.I25:.I34]) -> 0.04191776 | O25: of:=AVERAGE([.K25:.M25]) -> 0.0347684833333333
A26: 2 | B26: strpbrk: &"vores"{\0} &"aeiou"{\0} :=> &"ores"{\0,54} | C26: 0.0316954 | D26: 0.0299288 | E26: 0.0504117 | G26: of:=IF([.C26]=1;"";[.C26]) -> 0.0316954 | H26: of:=IF([.D26]=1;"";[.D26]) -> 0.0299288 | I26: of:=IF([.E26]=1;"";[.E26]) -> 0.0504117
A27: 3 | B27: strpbrk: &"pinth"{\0} &"aeiou"{\0} :=> &"inth"{\0,54} | C27: 0.0322117 | D27: 0.0299288 | E27: 0.050893 | G27: of:=IF([.C27]=1;"";[.C27]) -> 0.0322117 | H27: of:=IF([.D27]=1;"";[.D27]) -> 0.0299288 | I27: of:=IF([.E27]=1;"";[.E27]) -> 0.050893
A28: 4 | B28: strpbrk: &"xesth"{\0} &"aeiou"{\0} :=> &"esth"{\0,54} | C28: 0.031433 | D28: 0.0299288 | E28: 0.0505869 | G28: of:=IF([.C28]=1;"";[.C28]) -> 0.031433 | H28: of:=IF([.D28]=1;"";[.D28]) -> 0.0299288 | I28: of:=IF([.E28]=1;"";[.E28]) -> 0.0505869
A29: 5 | B29: strpbrk: &"zathe"{\0} &"aeiou"{\0} :=> &"athe"{\0,54} | C29: 0.031669 | D29: 0.0299288 | E29: 0.0512095 | G29: of:=IF([.C29]=1;"";[.C29]) -> 0.031669 | H29: of:=IF([.D29]=1;"";[.D29]) -> 0.0299288 | I29: of:=IF([.E29]=1;"";[.E29]) -> 0.0512095
A30: 6 | B30: strpbrk: &"uthes"{\0} &"aeiou"{\0} :=> &"uthes"{\0} | C30: 0.0329073 | D30: 0.0299288 | E30: 0.0329073 | G30: of:=IF([.C30]=1;"";[.C30]) -> 0.0329073 | H30: of:=IF([.D30]=1;"";[.D30]) -> 0.0299288 | I30: of:=IF([.E30]=1;"";[.E30]) -> 0.0329073
A31: 7 | B31: strpbrk: &"orest"{\0} &"aeiou"{\0} :=> &"orest"{\0} | C31: 0.0327935 | D31: 0.0299288 | E31: 0.0327935 | G31: of:=IF([.C31]=1;"";[.C31]) -> 0.0327935 | H31: of:=IF([.D31]=1;"";[.D31]) -> 0.0299288 | I31: of:=IF([.E31]=1;"";[.E31]) -> 0.0327935
A32: 8 | B32: strpbrk: &"inthe"{\0} &"aeiou"{\0} :=> &"inthe"{\0} | C32: 0.0333747 | D32: 0.0299288 | E32: 0.0333747 | G32: of:=IF([.C32]=1;"";[.C32]) -> 0.0333747 | H32: of:=IF([.D32]=1;"";[.D32]) -> 0.0299288 | I32: of:=IF([.E32]=1;"";[.E32]) -> 0.0333747
A33: 9 | B33: strpbrk: &"esthe"{\0} &"aeiou"{\0} :=> &"esthe"{\0} | C33: 0.0332025 | D33: 0.0299288 | E33: 0.0332025 | G33: of:=IF([.C33]=1;"";[.C33]) -> 0.0332025 | H33: of:=IF([.D33]=1;"";[.D33]) -> 0.0299288 | I33: of:=IF([.E33]=1;"";[.E33]) -> 0.0332025
A34: 10 | B34: strpbrk: &"athes"{\0} &"aeiou"{\0} :=> &"athes"{\0} | C34: 0.0333093 | D34: 0.0299288 | E34: 0.0333093 | G34: of:=IF([.C34]=1;"";[.C34]) -> 0.0333093 | H34: of:=IF([.D34]=1;"";[.D34]) -> 0.0299288 | I34: of:=IF([.E34]=1;"";[.E34]) -> 0.0333093