Sheet: strlen
A1: strlen: &"\x01"{\0,\0,\0,\0,\0} :=> 1; | J1: # | K1: Test Case | L1: N | P1: FINAL
A2: strlen: &"\x01\x01"{\0,\0,\0,\0} :=> 2; | J2: 1 | K2: strlen: &"b"{\0,p,r,e,\0} :=> 1 | L2: 1 | N2: of:=IF([.L2]=1;"";[.L2]) ->  | P2: of:=AVERAGE([.N2:.N6]) -> 0.09895515
A3: strlen: &"\x01\x01\x01"{\0,\0,\0} :=> 3; | J3: 2 | K3: strlen: &"re"{\0,p,r,\0} :=> 2 | L3: 0.225356 | N3: of:=IF([.L3]=1;"";[.L3]) -> 0.225356
A4: strlen: &"\x01\x01\x01\x01"{\0,\0} :=> 4; | J4: 3 | K4: strlen: &"pre"{\0,p,\0} :=> 3 | L4: 0.090057 | N4: of:=IF([.L4]=1;"";[.L4]) -> 0.090057
A5: strlen: &"\x01\x01\x01\x01\x01"{\0} :=> 5; | J5: 4 | K5: strlen: &"xpre"{\0,\0} :=> 4 | L5: 0.0475003 | N5: of:=IF([.L5]=1;"";[.L5]) -> 0.0475003
A6: strnlen: &""{\0,\0,\0,\0,\0,\0} 6 :=> 0; 1; | J6: 5 | K6: strlen: &"uthes"{\0} :=> 5 | L6: 0.0329073 | N6: of:=IF([.L6]=1;"";[.L6]) -> 0.0329073
A7: strnlen: &"\x01"{\0,\0,\0,\0,\0} 6 :=> 1; | J7: 1 | K7: strnlen: &""{\0,p,r,e,s,\0} 6 :=> 0 | L7: 1 | N7: of:=IF([.L7]=1;"";[.L7]) ->  | P7: of:=AVERAGE([.N7:.N12]) -> 0.09606575
A8: strnlen: &"\x01\x01"{\0,\0,\0,\0} 6 :=> 2; | J8: 2 | K8: strnlen: &"i"{\0,p,r,e,\0} 6 :=> 1 | L8: 1 | N8: of:=IF([.L8]=1;"";[.L8]) -> 
A9: strnlen: &"\x01\x01\x01"{\0,\0,\0} 6 :=> 3; | J9: 3 | K9: strnlen: &"ze"{\0,p,r,\0} 6 :=> 2 | L9: 0.208818 | N9: of:=IF([.L9]=1;"";[.L9]) -> 0.208818
A10: strnlen: &"\x01\x01\x01\x01"{\0,\0} 6 :=> 4; | J10: 4 | K10: strnlen: &"int"{\0,p,\0} 6 :=> 3 | L10: 0.0917447 | N10: of:=IF([.L10]=1;"";[.L10]) -> 0.0917447
A11: strnlen: &"\x01\x01\x01\x01\x01"{\0} 6 :=> 5; | J11: 5 | K11: strnlen: &"nthe"{\0,\0} 6 :=> 4 | L11: 0.0509534 | N11: of:=IF([.L11]=1;"";[.L11]) -> 0.0509534
J12: 6 | K12: strnlen: &"mesth"{\0} 6 :=> 5 | L12: 0.0327469 | N12: of:=IF([.L12]=1;"";[.L12]) -> 0.0327469

Sheet: strcmp
A1: # | B1: Test Case | C1: N1 | D1: N2 | L1: FINAL
A2: 1 | B2: strcmp: &"v"{\0,p,r,e,\0} &"v"{\0,p,r,e,\0} :=> 0 | C2: 1 | D2: 1 | F2: of:=IF([.C2]=1;"";[.C2]) ->  | G2: of:=IF([.D2]=1;"";[.D2]) ->  | H2: of:=IF([.E2]=1;"";[.E2]) ->   | I2: of:=AVERAGE([.F2:.F16]) -> 0.0517346357142857 | J2: of:=AVERAGE([.G2:.G16]) -> 0.0479195642857143 | L2: of:=AVERAGE([.I2:.J2]) -> 0.0498271
A3: 2 | B3: strcmp: &"re"{\0,p,r,\0} &"re"{\0,p,r,\0} :=> 0 | C3: 0.225356 | D3: 0.225356 | F3: of:=IF([.C3]=1;"";[.C3]) -> 0.225356 | G3: of:=IF([.D3]=1;"";[.D3]) -> 0.225356 | H3: of:=IF([.E3]=1;"";[.E3]) ->  
A4: 3 | B4: strcmp: &"ves"{\0,p,\0} &"ves"{\0,p,\0} :=> 0 | C4: 0.0906651 | D4: 0.0906651 | F4: of:=IF([.C4]=1;"";[.C4]) -> 0.0906651 | G4: of:=IF([.D4]=1;"";[.D4]) -> 0.0906651 | H4: of:=IF([.E4]=1;"";[.E4]) ->  
A5: 4 | B5: strcmp: &"athe"{\0,\0} &"athe"{\0,\0} :=> 0 | C5: 0.0512095 | D5: 0.0512095 | F5: of:=IF([.C5]=1;"";[.C5]) -> 0.0512095 | G5: of:=IF([.D5]=1;"";[.D5]) -> 0.0512095 | H5: of:=IF([.E5]=1;"";[.E5]) ->  
A6: 5 | B6: strcmp: &"sthes"{\0} &"sthes"{\0} :=> 0 | C6: 0.0332025 | D6: 0.0332025 | F6: of:=IF([.C6]=1;"";[.C6]) -> 0.0332025 | G6: of:=IF([.D6]=1;"";[.D6]) -> 0.0332025 | H6: of:=IF([.E6]=1;"";[.E6]) ->  
A7: 6 | B7: strcmp: &"besth"{\0} &"bestd"{\0} :=> 1 | C7: 0.0325987 | D7: 0.0296544 | F7: of:=IF([.C7]=1;"";[.C7]) -> 0.0325987 | G7: of:=IF([.D7]=1;"";[.D7]) -> 0.0296544 | H7: of:=IF([.E7]=1;"";[.E7]) ->  
A8: 7 | B8: strcmp: &"lyest"{\0} &"lyesx"{\0} :=> -1 | C8: 0.0314814 | D8: 0 | F8: of:=IF([.C8]=1;"";[.C8]) -> 0.0314814 | G8: of:=IF([.D8]=1;"";[.D8]) -> 0 | H8: of:=IF([.E8]=1;"";[.E8]) ->  
A9: 8 | B9: strcmp: &"quthe"{\0} &"qutbe"{\0} :=> 1 | C9: 0.0319508 | D9: 0.0291178 | F9: of:=IF([.C9]=1;"";[.C9]) -> 0.0319508 | G9: of:=IF([.D9]=1;"";[.D9]) -> 0.0291178 | H9: of:=IF([.E9]=1;"";[.E9]) ->  
A10: 9 | B10: strcmp: &"yesth"{\0} &"yesve"{\0} :=> -1 | C10: 0.0322095 | D10: 0.0286748 | F10: of:=IF([.C10]=1;"";[.C10]) -> 0.0322095 | G10: of:=IF([.D10]=1;"";[.D10]) -> 0.0286748 | H10: of:=IF([.E10]=1;"";[.E10]) ->  
A11: 10 | B11: strcmp: &"orest"{\0} &"orcth"{\0} :=> 1 | C11: 0.0327935 | D11: 0.0317312 | F11: of:=IF([.C11]=1;"";[.C11]) -> 0.0327935 | G11: of:=IF([.D11]=1;"";[.D11]) -> 0.0317312 | H11: of:=IF([.E11]=1;"";[.E11]) ->  
A12: 11 | B12: strcmp: &"juthe"{\0} &"juuth"{\0} :=> -1 | C12: 0.0316047 | D12: 0.0275699 | F12: of:=IF([.C12]=1;"";[.C12]) -> 0.0316047 | G12: of:=IF([.D12]=1;"";[.D12]) -> 0.0275699
A13: 12 | B13: strcmp: &"besth"{\0} &"bdint"{\0} :=> 1 | C13: 0.0325987 | D13: 0.0292385 | F13: of:=IF([.C13]=1;"";[.C13]) -> 0.0325987 | G13: of:=IF([.D13]=1;"";[.D13]) -> 0.0292385
A14: 13 | B14: strcmp: &"yesth"{\0} &"yuthe"{\0} :=> -1 | C14: 0.0322095 | D14: 0.0297216 | F14: of:=IF([.C14]=1;"";[.C14]) -> 0.0322095 | G14: of:=IF([.D14]=1;"";[.D14]) -> 0.0297216
A15: 14 | B15: strcmp: &"sthes"{\0} &"gesth"{\0} :=> 1 | C15: 0.0332025 | D15: 0.0325231 | F15: of:=IF([.C15]=1;"";[.C15]) -> 0.0332025 | G15: of:=IF([.D15]=1;"";[.D15]) -> 0.0325231
A16: 15 | B16: strcmp: &"hesth"{\0} &"yesth"{\0} :=> -1 | C16: 0.0332025 | D16: 0.0322095 | F16: of:=IF([.C16]=1;"";[.C16]) -> 0.0332025 | G16: of:=IF([.D16]=1;"";[.D16]) -> 0.0322095
A17: 1 | B17: strncmp: &""{\0,p,r,e,s,\0} &""{\0,p,r,e,s,\0} 5 :=> 0 | C17: 1 | D17: 1 | F17: of:=IF([.C17]=1;"";[.C17]) ->  | G17: of:=IF([.D17]=1;"";[.D17]) ->  | I17: of:=AVERAGE([.F17:.F32]) -> 0.0513528 | J17: of:=AVERAGE([.G17:.G32]) -> 0.0499764071428571 | L17: of:=AVERAGE([.I17:.J17]) -> 0.0506646035714286
A18: 2 | B18: strncmp: &"t"{\0,p,r,e,\0} &"t"{\0,p,r,e,\0} 5 :=> 0 | C18: 1 | D18: 1 | F18: of:=IF([.C18]=1;"";[.C18]) ->  | G18: of:=IF([.D18]=1;"";[.D18]) -> 
A19: 3 | B19: strncmp: &"di"{\0,p,r,\0} &"di"{\0,p,r,\0} 5 :=> 0 | C19: 0.218916 | D19: 0.218916 | F19: of:=IF([.C19]=1;"";[.C19]) -> 0.218916 | G19: of:=IF([.D19]=1;"";[.D19]) -> 0.218916
A20: 4 | B20: strncmp: &"int"{\0,p,\0} &"int"{\0,p,\0} 5 :=> 0 | C20: 0.0917447 | D20: 0.0917447 | F20: of:=IF([.C20]=1;"";[.C20]) -> 0.0917447 | G20: of:=IF([.D20]=1;"";[.D20]) -> 0.0917447
A21: 5 | B21: strncmp: &"pres"{\0,\0} &"pres"{\0,\0} 5 :=> 0 | C21: 0.0496296 | D21: 0.0496296 | F21: of:=IF([.C21]=1;"";[.C21]) -> 0.0496296 | G21: of:=IF([.D21]=1;"";[.D21]) -> 0.0496296
A22: 6 | B22: strncmp: &"fores"{\0} &"fores"{\0} 5 :=> 0 | C22: 0.0325019 | D22: 0.0325019 | F22: of:=IF([.C22]=1;"";[.C22]) -> 0.0325019 | G22: of:=IF([.D22]=1;"";[.D22]) -> 0.0325019
A23: 7 | B23: strncmp: &"winth"{\0} &"wintd"{\0} 5 :=> 1 | C23: 0.0326533 | D23: 0.029704 | F23: of:=IF([.C23]=1;"";[.C23]) -> 0.0326533 | G23: of:=IF([.D23]=1;"";[.D23]) -> 0.029704
A24: 8 | B24: strncmp: &"uthes"{\0} &"uthew"{\0} 5 :=> -1 | C24: 0.0329073 | D24: 0.0321963 | F24: of:=IF([.C24]=1;"";[.C24]) -> 0.0329073 | G24: of:=IF([.D24]=1;"";[.D24]) -> 0.0321963
A25: 9 | B25: strncmp: &"yesth"{\0} &"yesdi"{\0} 5 :=> 1 | C25: 0.0322095 | D25: 0.0298875 | F25: of:=IF([.C25]=1;"";[.C25]) -> 0.0322095 | G25: of:=IF([.D25]=1;"";[.D25]) -> 0.0298875
A26: 10 | B26: strncmp: &"orest"{\0} &"orewi"{\0} 5 :=> -1 | C26: 0.0327935 | D26: 0.0316886 | F26: of:=IF([.C26]=1;"";[.C26]) -> 0.0327935 | G26: of:=IF([.D26]=1;"";[.D26]) -> 0.0316886
A27: 11 | B27: strncmp: &"fores"{\0} &"foqut"{\0} 5 :=> 1 | C27: 0.0325019 | D27: 0.0279121 | F27: of:=IF([.C27]=1;"";[.C27]) -> 0.0325019 | G27: of:=IF([.D27]=1;"";[.D27]) -> 0.0279121
A28: 12 | B28: strncmp: &"gesth"{\0} &"gewin"{\0} 5 :=> -1 | C28: 0.0325231 | D28: 0.0313636 | F28: of:=IF([.C28]=1;"";[.C28]) -> 0.0325231 | G28: of:=IF([.D28]=1;"";[.D28]) -> 0.0313636
A29: 13 | B29: strncmp: &"vesth"{\0} &"vdint"{\0} 5 :=> 1 | C29: 0.0327833 | D29: 0.0274701 | F29: of:=IF([.C29]=1;"";[.C29]) -> 0.0327833 | G29: of:=IF([.D29]=1;"";[.D29]) -> 0.0274701
A30: 14 | B30: strncmp: &"besth"{\0} &"buthe"{\0} 5 :=> -1 | C30: 0.0325987 | D30: 0.0321157 | F30: of:=IF([.C30]=1;"";[.C30]) -> 0.0325987 | G30: of:=IF([.D30]=1;"";[.D30]) -> 0.0321157
A31: 15 | B31: strncmp: &"gesth"{\0} &"athes"{\0} 5 :=> 1 | C31: 0.0325231 | D31: 0.0333093 | F31: of:=IF([.C31]=1;"";[.C31]) -> 0.0325231 | G31: of:=IF([.D31]=1;"";[.D31]) -> 0.0333093
A32: 16 | B32: strncmp: &"winth"{\0} &"xpres"{\0} 5 :=> -1 | C32: 0.0326533 | D32: 0.0312303 | F32: of:=IF([.C32]=1;"";[.C32]) -> 0.0326533 | G32: of:=IF([.D32]=1;"";[.D32]) -> 0.0312303
A33: 1 | B33: sysfs_streq: &""{\0,p,r,e,s,\0} &"athes"{\0} :=> \0 | C33: 1 | D33: 0.0333093 | F33: of:=IF([.C33]=1;"";[.C33]) ->  | G33: of:=IF([.D33]=1;"";[.D33]) -> 0.0333093 | I33: of:=AVERAGE([.F33:.F71]) -> 0.0781540517241379 | J33: of:=AVERAGE([.G33:.G71]) -> 0.0510236285714286 | L33: of:=AVERAGE([.I33:.J33]) -> 0.0645888401477833
A34: 2 | B34: sysfs_streq: &""{\0,p,r,e,s,\0} &"\n"{\0,b,e,s,\0} :=> \x01 | C34: 1 | F34: of:=IF([.C34]=1;"";[.C34]) ->  | G34: of:=IF([.D34]=1;"";[.D34]) ->  
A35: 3 | B35: sysfs_streq: &""{\0,p,r,e,s,\0} &"\nathe"{\0} :=> \0 | C35: 1 | F35: of:=IF([.C35]=1;"";[.C35]) ->  | G35: of:=IF([.D35]=1;"";[.D35]) ->  
A36: 4 | B36: sysfs_streq: &""{\0,p,r,e,s,\0} &""{\0,h,e,s,t,\0} :=> \x01 | C36: 1 | D36: 1 | F36: of:=IF([.C36]=1;"";[.C36]) ->  | G36: of:=IF([.D36]=1;"";[.D36]) -> 
A37: 5 | B37: sysfs_streq: &"winth"{\0} &"quthe"{\0} :=> \0 | C37: 0.0326533 | D37: 0.0319508 | F37: of:=IF([.C37]=1;"";[.C37]) -> 0.0326533 | G37: of:=IF([.D37]=1;"";[.D37]) -> 0.0319508
A38: 6 | B38: sysfs_streq: &"\n"{\0,p,r,e,\0} &""{\0,a,t,h,e,\0} :=> \x01 | C38: 1 | F38: of:=IF([.C38]=1;"";[.C38]) ->  | G38: of:=IF([.D38]=1;"";[.D38]) ->  
A39: 7 | B39: sysfs_streq: &"\n"{\0,a,t,h,\0} &"zesth"{\0} :=> \0 | C39: 0.0316571 | F39: of:=IF([.C39]=1;"";[.C39]) -> 0.0316571 | G39: of:=IF([.D39]=1;"";[.D39]) ->  
A40: 8 | B40: sysfs_streq: &"\nathe"{\0} &"lyest"{\0} :=> \0 | C40: 0.0314814 | F40: of:=IF([.C40]=1;"";[.C40]) -> 0.0314814 | G40: of:=IF([.D40]=1;"";[.D40]) ->  
A41: 9 | B41: sysfs_streq: &"f"{\0,p,r,e,\0} &"fores"{\0} :=> \0 | C41: 1 | D41: 0.0325019 | F41: of:=IF([.C41]=1;"";[.C41]) ->  | G41: of:=IF([.D41]=1;"";[.D41]) -> 0.0325019
A42: 10 | B42: sysfs_streq: &"n"{\0,p,r,e,\0} &"n\n"{\0,a,t,\0} :=> \x01 | C42: 1 | F42: of:=IF([.C42]=1;"";[.C42]) ->  | G42: of:=IF([.D42]=1;"";[.D42]) ->  
A43: 11 | B43: sysfs_streq: &"r"{\0,p,r,e,\0} &"r\nath"{\0} :=> \0 | C43: 1 | F43: of:=IF([.C43]=1;"";[.C43]) ->  | G43: of:=IF([.D43]=1;"";[.D43]) ->  
A44: 12 | B44: sysfs_streq: &"q"{\0,p,r,e,\0} &"q"{\0,h,e,s,\0} :=> \x01 | C44: 1 | D44: 1 | F44: of:=IF([.C44]=1;"";[.C44]) ->  | G44: of:=IF([.D44]=1;"";[.D44]) -> 
A45: 13 | B45: sysfs_streq: &"resth"{\0} &"ruthe"{\0} :=> \0 | C45: 0.0330663 | D45: 0.0319925 | F45: of:=IF([.C45]=1;"";[.C45]) -> 0.0330663 | G45: of:=IF([.D45]=1;"";[.D45]) -> 0.0319925
A46: 14 | B46: sysfs_streq: &"x\n"{\0,b,e,\0} &"x"{\0,b,e,s,\0} :=> \x01 | C46: 1 | F46: of:=IF([.C46]=1;"";[.C46]) ->  | G46: of:=IF([.D46]=1;"";[.D46]) ->  
A47: 15 | B47: sysfs_streq: &"t\n"{\0,b,e,\0} &"thest"{\0} :=> \0 | C47: 0.0332025 | F47: of:=IF([.C47]=1;"";[.C47]) -> 0.0332025 | G47: of:=IF([.D47]=1;"";[.D47]) ->  
A48: 16 | B48: sysfs_streq: &"i\nath"{\0} &"inthe"{\0} :=> \0 | C48: 0.0333747 | F48: of:=IF([.C48]=1;"";[.C48]) -> 0.0333747 | G48: of:=IF([.D48]=1;"";[.D48]) ->  
A49: 17 | B49: sysfs_streq: &"re"{\0,p,r,\0} &"resth"{\0} :=> \0 | C49: 0.225356 | D49: 0.0330663 | F49: of:=IF([.C49]=1;"";[.C49]) -> 0.225356 | G49: of:=IF([.D49]=1;"";[.D49]) -> 0.0330663
A50: 18 | B50: sysfs_streq: &"in"{\0,p,r,\0} &"in\n"{\0,a,\0} :=> \x01 | C50: 0.226579 | F50: of:=IF([.C50]=1;"";[.C50]) -> 0.226579 | G50: of:=IF([.D50]=1;"";[.D50]) ->  
A51: 19 | B51: sysfs_streq: &"or"{\0,p,r,\0} &"or\nat"{\0} :=> \0 | C51: 0.224112 | F51: of:=IF([.C51]=1;"";[.C51]) -> 0.224112 | G51: of:=IF([.D51]=1;"";[.D51]) ->  
A52: 20 | B52: sysfs_streq: &"fo"{\0,p,r,\0} &"fo"{\0,b,e,\0} :=> \x01 | C52: 0.219808 | D52: 0.219808 | F52: of:=IF([.C52]=1;"";[.C52]) -> 0.219808 | G52: of:=IF([.D52]=1;"";[.D52]) -> 0.219808
A53: 21 | B53: sysfs_streq: &"dinth"{\0} &"dilye"{\0} :=> \0 | C53: 0.0326917 | D53: 0.0308215 | F53: of:=IF([.C53]=1;"";[.C53]) -> 0.0326917 | G53: of:=IF([.D53]=1;"";[.D53]) -> 0.0308215
A54: 22 | B54: sysfs_streq: &"in\n"{\0,b,\0} &"in"{\0,b,e,\0} :=> \x01 | C54: 0.226579 | F54: of:=IF([.C54]=1;"";[.C54]) -> 0.226579 | G54: of:=IF([.D54]=1;"";[.D54]) ->  
A55: 23 | B55: sysfs_streq: &"th\n"{\0,b,\0} &"thest"{\0} :=> \0 | C55: 0.0332025 | F55: of:=IF([.C55]=1;"";[.C55]) -> 0.0332025 | G55: of:=IF([.D55]=1;"";[.D55]) ->  
A56: 24 | B56: sysfs_streq: &"es\nat"{\0} &"esthe"{\0} :=> \0 | C56: 0.0332025 | F56: of:=IF([.C56]=1;"";[.C56]) -> 0.0332025 | G56: of:=IF([.D56]=1;"";[.D56]) ->  
A57: 25 | B57: sysfs_streq: &"din"{\0,p,\0} &"dinth"{\0} :=> \0 | C57: 0.090448 | D57: 0.0326917 | F57: of:=IF([.C57]=1;"";[.C57]) -> 0.090448 | G57: of:=IF([.D57]=1;"";[.D57]) -> 0.0326917
A58: 26 | B58: sysfs_streq: &"nth"{\0,p,\0} &"nth\n"{\0,\0} :=> \x01 | C58: 0.0920054 | F58: of:=IF([.C58]=1;"";[.C58]) -> 0.0920054 | G58: of:=IF([.D58]=1;"";[.D58]) ->  
A59: 27 | B59: sysfs_streq: &"pre"{\0,p,\0} &"pre\na"{\0} :=> \0 | C59: 0.090057 | F59: of:=IF([.C59]=1;"";[.C59]) -> 0.090057 | G59: of:=IF([.D59]=1;"";[.D59]) ->  
A60: 28 | B60: sysfs_streq: &"bes"{\0,p,\0} &"bes"{\0,h,\0} :=> \x01 | C60: 0.0899511 | D60: 0.0899511 | F60: of:=IF([.C60]=1;"";[.C60]) -> 0.0899511 | G60: of:=IF([.D60]=1;"";[.D60]) -> 0.0899511
A61: 29 | B61: sysfs_streq: &"orest"{\0} &"orequ"{\0} :=> \0 | C61: 0.0327935 | D61: 0.0303879 | F61: of:=IF([.C61]=1;"";[.C61]) -> 0.0327935 | G61: of:=IF([.D61]=1;"";[.D61]) -> 0.0303879
A62: 30 | B62: sysfs_streq: &"ves\n"{\0,\0} &"ves"{\0,a,\0} :=> \x01 | C62: 0.0906651 | F62: of:=IF([.C62]=1;"";[.C62]) -> 0.0906651 | G62: of:=IF([.D62]=1;"";[.D62]) ->  
A63: 31 | B63: sysfs_streq: &"ges\n"{\0,\0} &"gesth"{\0} :=> \0 | C63: 0.0325231 | F63: of:=IF([.C63]=1;"";[.C63]) -> 0.0325231 | G63: of:=IF([.D63]=1;"";[.D63]) ->  
A64: 32 | B64: sysfs_streq: &"for\na"{\0} &"fores"{\0} :=> \0 | C64: 0.0325019 | F64: of:=IF([.C64]=1;"";[.C64]) -> 0.0325019 | G64: of:=IF([.D64]=1;"";[.D64]) ->  
A65: 33 | B65: sysfs_streq: &"yest"{\0,\0} &"yesth"{\0} :=> \0 | C65: 0.0487686 | D65: 0.0322095 | F65: of:=IF([.C65]=1;"";[.C65]) -> 0.0487686 | G65: of:=IF([.D65]=1;"";[.D65]) -> 0.0322095
A66: 34 | B66: sysfs_streq: &"kest"{\0,\0} &"kest\n"{\0} :=> \x01 | C66: 0.0491188 | F66: of:=IF([.C66]=1;"";[.C66]) -> 0.0491188 | G66: of:=IF([.D66]=1;"";[.D66]) ->  
A67: 35 | B67: sysfs_streq: &"nthe"{\0,\0} &"nthe"{\0,\0} :=> \x01 | C67: 0.0509534 | D67: 0.0509534 | F67: of:=IF([.C67]=1;"";[.C67]) -> 0.0509534 | G67: of:=IF([.D67]=1;"";[.D67]) -> 0.0509534
A68: 36 | B68: sysfs_streq: &"vesth"{\0} &"vestl"{\0} :=> \0 | C68: 0.0327833 | D68: 0.0314844 | F68: of:=IF([.C68]=1;"";[.C68]) -> 0.0327833 | G68: of:=IF([.D68]=1;"";[.D68]) -> 0.0314844
A69: 37 | B69: sysfs_streq: &"hest\n"{\0} &"hest"{\0,\0} :=> \x01 | C69: 0.0505273 | F69: of:=IF([.C69]=1;"";[.C69]) -> 0.0505273 | G69: of:=IF([.D69]=1;"";[.D69]) ->  
A70: 38 | B70: sysfs_streq: &"thes\n"{\0} &"thest"{\0} :=> \0 | C70: 0.0332025 | F70: of:=IF([.C70]=1;"";[.C70]) -> 0.0332025 | G70: of:=IF([.D70]=1;"";[.D70]) ->  
A71: 39 | B71: sysfs_streq: &"sthes"{\0} &"sthes"{\0} :=> \x01 | C71: 0.0332025 | D71: 0.0332025 | F71: of:=IF([.C71]=1;"";[.C71]) -> 0.0332025 | G71: of:=IF([.D71]=1;"";[.D71]) -> 0.0332025

Sheet: strcpy
A1: # | B1: Test Case | C1: N1 | D1: N2 | E1: N3 | O1: FINAL
A2: 1 | B2: strcpy: &""{\0,\x01,\x01,\x01,\x01,\x01} &"x"{\0,p,r,e,\0} :=> &"x"{\0,p,r,e,\0} | C2: 1 | D2: 1 | E2: 1 | G2: of:=IF([.C2]=1;"";[.C2]) ->  | H2: of:=IF([.D2]=1;"";[.D2]) ->  | I2: of:=IF([.E2]=1;"";[.E2]) ->  | K2: of:=AVERAGE([.G2:.G36]) -> 0.0981835166666667 | L2: of:=AVERAGE([.H2:.H36]) -> 0.0977753333333333 | M2: of:=AVERAGE([.I2:.I36]) -> 0.0977753333333333 | O2: of:=AVERAGE([.K2:.M2]) -> 0.0979113944444444
A3: 2 | B3: strcpy: &""{\0,\x01,\x01,\x01,\x01,\x01} &"ke"{\0,p,r,\0} :=> &"ke"{\0,p,r,\0} | C3: 1 | D3: 0.217558 | E3: 0.217558 | G3: of:=IF([.C3]=1;"";[.C3]) ->  | H3: of:=IF([.D3]=1;"";[.D3]) -> 0.217558 | I3: of:=IF([.E3]=1;"";[.E3]) -> 0.217558
A4: 3 | B4: strcpy: &""{\0,\x01,\x01,\x01,\x01,\x01} &"int"{\0,p,\0} :=> &"int"{\0,p,\0} | C4: 1 | D4: 0.0917447 | E4: 0.0917447 | G4: of:=IF([.C4]=1;"";[.C4]) ->  | H4: of:=IF([.D4]=1;"";[.D4]) -> 0.0917447 | I4: of:=IF([.E4]=1;"";[.E4]) -> 0.0917447
A5: 4 | B5: strcpy: &""{\0,\x01,\x01,\x01,\x01,\x01} &"esth"{\0,\0} :=> &"esth"{\0,\0} | C5: 1 | D5: 0.0505869 | E5: 0.0505869 | G5: of:=IF([.C5]=1;"";[.C5]) ->  | H5: of:=IF([.D5]=1;"";[.D5]) -> 0.0505869 | I5: of:=IF([.E5]=1;"";[.E5]) -> 0.0505869
A6: 5 | B6: strcpy: &""{\0,\x01,\x01,\x01,\x01,\x01} &"lyest"{\0} :=> &"lyest"{\0} | C6: 1 | D6: 0.0314814 | E6: 0.0314814 | G6: of:=IF([.C6]=1;"";[.C6]) ->  | H6: of:=IF([.D6]=1;"";[.D6]) -> 0.0314814 | I6: of:=IF([.E6]=1;"";[.E6]) -> 0.0314814
A7: 6 | B7: strcpy: &"c"{\0,\x01,\x01,\x01,\x01} &""{\0,p,r,e,s,\0} :=> &""{\0,\0,p,r,e,\0} | C7: 1 | D7: 1 | E7: 1 | G7: of:=IF([.C7]=1;"";[.C7]) ->  | H7: of:=IF([.D7]=1;"";[.D7]) ->  | I7: of:=IF([.E7]=1;"";[.E7]) -> 
A8: 7 | B8: strcpy: &"h"{\0,\x01,\x01,\x01,\x01} &"t"{\0,p,r,e,\0} :=> &"t"{\0,p,r,e,\0} | C8: 1 | D8: 1 | E8: 1 | G8: of:=IF([.C8]=1;"";[.C8]) ->  | H8: of:=IF([.D8]=1;"";[.D8]) ->  | I8: of:=IF([.E8]=1;"";[.E8]) -> 
A9: 8 | B9: strcpy: &"f"{\0,\x01,\x01,\x01,\x01} &"pr"{\0,p,r,\0} :=> &"pr"{\0,p,r,\0} | C9: 1 | D9: 0.218916 | E9: 0.218916 | G9: of:=IF([.C9]=1;"";[.C9]) ->  | H9: of:=IF([.D9]=1;"";[.D9]) -> 0.218916 | I9: of:=IF([.E9]=1;"";[.E9]) -> 0.218916
A10: 9 | B10: strcpy: &"w"{\0,\x01,\x01,\x01,\x01} &"zes"{\0,p,\0} :=> &"zes"{\0,p,\0} | C10: 1 | D10: 0.0863349 | E10: 0.0863349 | G10: of:=IF([.C10]=1;"";[.C10]) ->  | H10: of:=IF([.D10]=1;"";[.D10]) -> 0.0863349 | I10: of:=IF([.E10]=1;"";[.E10]) -> 0.0863349
A11: 10 | B11: strcpy: &"z"{\0,\x01,\x01,\x01,\x01} &"yest"{\0,\0} :=> &"yest"{\0,\0} | C11: 1 | D11: 0.0487686 | E11: 0.0487686 | G11: of:=IF([.C11]=1;"";[.C11]) ->  | H11: of:=IF([.D11]=1;"";[.D11]) -> 0.0487686 | I11: of:=IF([.E11]=1;"";[.E11]) -> 0.0487686
A12: 11 | B12: strcpy: &"l"{\0,\x01,\x01,\x01,\x01} &"hesth"{\0} :=> &"hesth"{\0} | C12: 1 | D12: 0.0332025 | E12: 0.0332025 | G12: of:=IF([.C12]=1;"";[.C12]) ->  | H12: of:=IF([.D12]=1;"";[.D12]) -> 0.0332025 | I12: of:=IF([.E12]=1;"";[.E12]) -> 0.0332025
A13: 12 | B13: strcpy: &"ly"{\0,\x01,\x01,\x01} &""{\0,p,r,e,s,\0} :=> &""{\0,y,\0,p,r,\0} | C13: 0.218466 | D13: 1 | E13: 1 | G13: of:=IF([.C13]=1;"";[.C13]) -> 0.218466 | H13: of:=IF([.D13]=1;"";[.D13]) ->  | I13: of:=IF([.E13]=1;"";[.E13]) -> 
A14: 13 | B14: strcpy: &"ct"{\0,\x01,\x01,\x01} &"d"{\0,p,r,e,\0} :=> &"d"{\0,\0,p,r,\0} | C14: 0.218466 | D14: 1 | E14: 1 | G14: of:=IF([.C14]=1;"";[.C14]) -> 0.218466 | H14: of:=IF([.D14]=1;"";[.D14]) ->  | I14: of:=IF([.E14]=1;"";[.E14]) -> 
A15: 14 | B15: strcpy: &"th"{\0,\x01,\x01,\x01} &"es"{\0,p,r,\0} :=> &"es"{\0,p,r,\0} | C15: 0.227384 | D15: 0.224112 | E15: 0.224112 | G15: of:=IF([.C15]=1;"";[.C15]) -> 0.227384 | H15: of:=IF([.D15]=1;"";[.D15]) -> 0.224112 | I15: of:=IF([.E15]=1;"";[.E15]) -> 0.224112
A16: 15 | B16: strcpy: &"st"{\0,\x01,\x01,\x01} &"nth"{\0,p,\0} :=> &"nth"{\0,p,\0} | C16: 0.223271 | D16: 0.0920054 | E16: 0.0920054 | G16: of:=IF([.C16]=1;"";[.C16]) -> 0.223271 | H16: of:=IF([.D16]=1;"";[.D16]) -> 0.0920054 | I16: of:=IF([.E16]=1;"";[.E16]) -> 0.0920054
A17: 16 | B17: strcpy: &"qu"{\0,\x01,\x01,\x01} &"rest"{\0,\0} :=> &"rest"{\0,\0} | C17: 0.212836 | D17: 0.0502856 | E17: 0.0502856 | G17: of:=IF([.C17]=1;"";[.C17]) -> 0.212836 | H17: of:=IF([.D17]=1;"";[.D17]) -> 0.0502856 | I17: of:=IF([.E17]=1;"";[.E17]) -> 0.0502856
A18: 17 | B18: strcpy: &"ve"{\0,\x01,\x01,\x01} &"zesth"{\0} :=> &"zesth"{\0} | C18: 0.221991 | D18: 0.0316571 | E18: 0.0316571 | G18: of:=IF([.C18]=1;"";[.C18]) -> 0.221991 | H18: of:=IF([.D18]=1;"";[.D18]) -> 0.0316571 | I18: of:=IF([.E18]=1;"";[.E18]) -> 0.0316571
A19: 18 | B19: strcpy: &"nth"{\0,\x01,\x01} &""{\0,p,r,e,s,\0} :=> &""{\0,t,h,\0,p,\0} | C19: 0.0920054 | D19: 1 | E19: 1 | G19: of:=IF([.C19]=1;"";[.C19]) -> 0.0920054 | H19: of:=IF([.D19]=1;"";[.D19]) ->  | I19: of:=IF([.E19]=1;"";[.E19]) -> 
A20: 19 | B20: strcpy: &"uth"{\0,\x01,\x01} &"g"{\0,p,r,e,\0} :=> &"g"{\0,h,\0,p,\0} | C20: 0.0910004 | D20: 1 | E20: 1 | G20: of:=IF([.C20]=1;"";[.C20]) -> 0.0910004 | H20: of:=IF([.D20]=1;"";[.D20]) ->  | I20: of:=IF([.E20]=1;"";[.E20]) -> 
A21: 20 | B21: strcpy: &"ges"{\0,\x01,\x01} &"he"{\0,p,r,\0} :=> &"he"{\0,\0,p,\0} | C21: 0.0896591 | D21: 0.226983 | E21: 0.226983 | G21: of:=IF([.C21]=1;"";[.C21]) -> 0.0896591 | H21: of:=IF([.D21]=1;"";[.D21]) -> 0.226983 | I21: of:=IF([.E21]=1;"";[.E21]) -> 0.226983
A22: 21 | B22: strcpy: &"jut"{\0,\x01,\x01} &"the"{\0,p,\0} :=> &"the"{\0,p,\0} | C22: 0.0850061 | D22: 0.093369 | E22: 0.093369 | G22: of:=IF([.C22]=1;"";[.C22]) -> 0.0850061 | H22: of:=IF([.D22]=1;"";[.D22]) -> 0.093369 | I22: of:=IF([.E22]=1;"";[.E22]) -> 0.093369
A23: 22 | B23: strcpy: &"ore"{\0,\x01,\x01} &"wint"{\0,\0} :=> &"wint"{\0,\0} | C23: 0.0917628 | D23: 0.0495535 | E23: 0.0495535 | G23: of:=IF([.C23]=1;"";[.C23]) -> 0.0917628 | H23: of:=IF([.D23]=1;"";[.D23]) -> 0.0495535 | I23: of:=IF([.E23]=1;"";[.E23]) -> 0.0495535
A24: 23 | B24: strcpy: &"pre"{\0,\x01,\x01} &"winth"{\0} :=> &"winth"{\0} | C24: 0.090057 | D24: 0.0326533 | E24: 0.0326533 | G24: of:=IF([.C24]=1;"";[.C24]) -> 0.090057 | H24: of:=IF([.D24]=1;"";[.D24]) -> 0.0326533 | I24: of:=IF([.E24]=1;"";[.E24]) -> 0.0326533
A25: 24 | B25: strcpy: &"athe"{\0,\x01} &""{\0,p,r,e,s,\0} :=> &""{\0,t,h,e,\0,\0} | C25: 0.0512095 | D25: 1 | E25: 1 | G25: of:=IF([.C25]=1;"";[.C25]) -> 0.0512095 | H25: of:=IF([.D25]=1;"";[.D25]) ->  | I25: of:=IF([.E25]=1;"";[.E25]) -> 
A26: 25 | B26: strcpy: &"rest"{\0,\x01} &"f"{\0,p,r,e,\0} :=> &"f"{\0,s,t,\0,\0} | C26: 0.0502856 | D26: 1 | E26: 1 | G26: of:=IF([.C26]=1;"";[.C26]) -> 0.0502856 | H26: of:=IF([.D26]=1;"";[.D26]) ->  | I26: of:=IF([.E26]=1;"";[.E26]) -> 
A27: 26 | B27: strcpy: &"rest"{\0,\x01} &"ct"{\0,p,r,\0} :=> &"ct"{\0,t,\0,\0} | C27: 0.0502856 | D27: 0.218466 | E27: 0.218466 | G27: of:=IF([.C27]=1;"";[.C27]) -> 0.0502856 | H27: of:=IF([.D27]=1;"";[.D27]) -> 0.218466 | I27: of:=IF([.E27]=1;"";[.E27]) -> 0.218466
A28: 27 | B28: strcpy: &"wint"{\0,\x01} &"zes"{\0,p,\0} :=> &"zes"{\0,\0,\0} | C28: 0.0495535 | D28: 0.0863349 | E28: 0.0863349 | G28: of:=IF([.C28]=1;"";[.C28]) -> 0.0495535 | H28: of:=IF([.D28]=1;"";[.D28]) -> 0.0863349 | I28: of:=IF([.E28]=1;"";[.E28]) -> 0.0863349
A29: 28 | B29: strcpy: &"lyes"{\0,\x01} &"nthe"{\0,\0} :=> &"nthe"{\0,\0} | C29: 0.0480665 | D29: 0.0509534 | E29: 0.0509534 | G29: of:=IF([.C29]=1;"";[.C29]) -> 0.0480665 | H29: of:=IF([.D29]=1;"";[.D29]) -> 0.0509534 | I29: of:=IF([.E29]=1;"";[.E29]) -> 0.0509534
A30: 29 | B30: strcpy: &"rest"{\0,\x01} &"uthes"{\0} :=> &"uthes"{\0} | C30: 0.0502856 | D30: 0.0329073 | E30: 0.0329073 | G30: of:=IF([.C30]=1;"";[.C30]) -> 0.0502856 | H30: of:=IF([.D30]=1;"";[.D30]) -> 0.0329073 | I30: of:=IF([.E30]=1;"";[.E30]) -> 0.0329073
A31: 30 | B31: strcpy: &"kesth"{\0} &""{\0,p,r,e,s,\0} :=> &""{\0,e,s,t,h,\0} | C31: 0.0324076 | D31: 1 | E31: 1 | G31: of:=IF([.C31]=1;"";[.C31]) -> 0.0324076 | H31: of:=IF([.D31]=1;"";[.D31]) ->  | I31: of:=IF([.E31]=1;"";[.E31]) -> 
A32: 31 | B32: strcpy: &"kesth"{\0} &"r"{\0,p,r,e,\0} :=> &"r"{\0,s,t,h,\0} | C32: 0.0324076 | D32: 1 | E32: 1 | G32: of:=IF([.C32]=1;"";[.C32]) -> 0.0324076 | H32: of:=IF([.D32]=1;"";[.D32]) ->  | I32: of:=IF([.E32]=1;"";[.E32]) -> 
A33: 32 | B33: strcpy: &"sthes"{\0} &"ju"{\0,p,r,\0} :=> &"ju"{\0,e,s,\0} | C33: 0.0332025 | D33: 0.208818 | E33: 0.208818 | G33: of:=IF([.C33]=1;"";[.C33]) -> 0.0332025 | H33: of:=IF([.D33]=1;"";[.D33]) -> 0.208818 | I33: of:=IF([.E33]=1;"";[.E33]) -> 0.208818
A34: 33 | B34: strcpy: &"juthe"{\0} &"kes"{\0,p,\0} :=> &"kes"{\0,e,\0} | C34: 0.0316047 | D34: 0.0892137 | E34: 0.0892137 | G34: of:=IF([.C34]=1;"";[.C34]) -> 0.0316047 | H34: of:=IF([.D34]=1;"";[.D34]) -> 0.0892137 | I34: of:=IF([.E34]=1;"";[.E34]) -> 0.0892137
A35: 34 | B35: strcpy: &"vesth"{\0} &"xpre"{\0,\0} :=> &"xpre"{\0,\0} | C35: 0.0327833 | D35: 0.0475003 | E35: 0.0475003 | G35: of:=IF([.C35]=1;"";[.C35]) -> 0.0327833 | H35: of:=IF([.D35]=1;"";[.D35]) -> 0.0475003 | I35: of:=IF([.E35]=1;"";[.E35]) -> 0.0475003
A36: 35 | B36: strcpy: &"kesth"{\0} &"hesth"{\0} :=> &"hesth"{\0} | C36: 0.0324076 | D36: 0.0332025 | E36: 0.0332025 | G36: of:=IF([.C36]=1;"";[.C36]) -> 0.0324076 | H36: of:=IF([.D36]=1;"";[.D36]) -> 0.0332025 | I36: of:=IF([.E36]=1;"";[.E36]) -> 0.0332025
A37: 1 | B37: strncpy: &""{\0,\x01,\x01,\x01,\x01,\x01} &""{\0,p,r,e,s,\0} 5 :=> &""{\0,\0,\0,\0,\0,\0} | C37: 1 | D37: 1 | E37: 1 | G37: of:=IF([.C37]=1;"";[.C37]) ->  | H37: of:=IF([.D37]=1;"";[.D37]) ->  | I37: of:=IF([.E37]=1;"";[.E37]) ->  | K37: of:=AVERAGE([.G37:.G72]) -> 0.0977454458333333 | L37: of:=AVERAGE([.H37:.H72]) -> 0.0974572916666667 | M37: of:=AVERAGE([.I37:.I72]) -> 0.0974572916666667 | O37: of:=AVERAGE([.K37:.M37]) -> 0.0975533430555555
A38: 2 | B38: strncpy: &""{\0,\x01,\x01,\x01,\x01,\x01} &"j"{\0,p,r,e,\0} 5 :=> &"j"{\0,\0,\0,\0,\0} | C38: 1 | D38: 1 | E38: 1 | G38: of:=IF([.C38]=1;"";[.C38]) ->  | H38: of:=IF([.D38]=1;"";[.D38]) ->  | I38: of:=IF([.E38]=1;"";[.E38]) -> 
A39: 3 | B39: strncpy: &""{\0,\x01,\x01,\x01,\x01,\x01} &"xp"{\0,p,r,\0} 5 :=> &"xp"{\0,\0,\0,\0} | C39: 1 | D39: 0.209845 | E39: 0.209845 | G39: of:=IF([.C39]=1;"";[.C39]) ->  | H39: of:=IF([.D39]=1;"";[.D39]) -> 0.209845 | I39: of:=IF([.E39]=1;"";[.E39]) -> 0.209845
A40: 4 | B40: strncpy: &""{\0,\x01,\x01,\x01,\x01,\x01} &"nth"{\0,p,\0} 5 :=> &"nth"{\0,\0,\0} | C40: 1 | D40: 0.0920054 | E40: 0.0920054 | G40: of:=IF([.C40]=1;"";[.C40]) ->  | H40: of:=IF([.D40]=1;"";[.D40]) -> 0.0920054 | I40: of:=IF([.E40]=1;"";[.E40]) -> 0.0920054
A41: 5 | B41: strncpy: &""{\0,\x01,\x01,\x01,\x01,\x01} &"lyes"{\0,\0} 5 :=> &"lyes"{\0,\0} | C41: 1 | D41: 0.0480665 | E41: 0.0480665 | G41: of:=IF([.C41]=1;"";[.C41]) ->  | H41: of:=IF([.D41]=1;"";[.D41]) -> 0.0480665 | I41: of:=IF([.E41]=1;"";[.E41]) -> 0.0480665
A42: 6 | B42: strncpy: &""{\0,\x01,\x01,\x01,\x01,\x01} &"xpres"{\0} 5 :=> &"xpres"{\0} | C42: 1 | D42: 0.0312303 | E42: 0.0312303 | G42: of:=IF([.C42]=1;"";[.C42]) ->  | H42: of:=IF([.D42]=1;"";[.D42]) -> 0.0312303 | I42: of:=IF([.E42]=1;"";[.E42]) -> 0.0312303
A43: 7 | B43: strncpy: &"c"{\0,\x01,\x01,\x01,\x01} &""{\0,p,r,e,s,\0} 5 :=> &""{\0,\0,\0,\0,\0,\0} | C43: 1 | D43: 1 | E43: 1 | G43: of:=IF([.C43]=1;"";[.C43]) ->  | H43: of:=IF([.D43]=1;"";[.D43]) ->  | I43: of:=IF([.E43]=1;"";[.E43]) -> 
A44: 8 | B44: strncpy: &"o"{\0,\x01,\x01,\x01,\x01} &"t"{\0,p,r,e,\0} 5 :=> &"t"{\0,\0,\0,\0,\0} | C44: 1 | D44: 1 | E44: 1 | G44: of:=IF([.C44]=1;"";[.C44]) ->  | H44: of:=IF([.D44]=1;"";[.D44]) ->  | I44: of:=IF([.E44]=1;"";[.E44]) -> 
A45: 9 | B45: strncpy: &"h"{\0,\x01,\x01,\x01,\x01} &"ye"{\0,p,r,\0} 5 :=> &"ye"{\0,\0,\0,\0} | C45: 1 | D45: 0.215236 | E45: 0.215236 | G45: of:=IF([.C45]=1;"";[.C45]) ->  | H45: of:=IF([.D45]=1;"";[.D45]) -> 0.215236 | I45: of:=IF([.E45]=1;"";[.E45]) -> 0.215236
A46: 10 | B46: strncpy: &"c"{\0,\x01,\x01,\x01,\x01} &"hes"{\0,p,\0} 5 :=> &"hes"{\0,\0,\0} | C46: 1 | D46: 0.0922924 | E46: 0.0922924 | G46: of:=IF([.C46]=1;"";[.C46]) ->  | H46: of:=IF([.D46]=1;"";[.D46]) -> 0.0922924 | I46: of:=IF([.E46]=1;"";[.E46]) -> 0.0922924
A47: 11 | B47: strncpy: &"t"{\0,\x01,\x01,\x01,\x01} &"nthe"{\0,\0} 5 :=> &"nthe"{\0,\0} | C47: 1 | D47: 0.0509534 | E47: 0.0509534 | G47: of:=IF([.C47]=1;"";[.C47]) ->  | H47: of:=IF([.D47]=1;"";[.D47]) -> 0.0509534 | I47: of:=IF([.E47]=1;"";[.E47]) -> 0.0509534
A48: 12 | B48: strncpy: &"w"{\0,\x01,\x01,\x01,\x01} &"fores"{\0} 5 :=> &"fores"{\0} | C48: 1 | D48: 0.0325019 | E48: 0.0325019 | G48: of:=IF([.C48]=1;"";[.C48]) ->  | H48: of:=IF([.D48]=1;"";[.D48]) -> 0.0325019 | I48: of:=IF([.E48]=1;"";[.E48]) -> 0.0325019
A49: 13 | B49: strncpy: &"he"{\0,\x01,\x01,\x01} &""{\0,p,r,e,s,\0} 5 :=> &""{\0,\0,\0,\0,\0,\0} | C49: 0.226983 | D49: 1 | E49: 1 | G49: of:=IF([.C49]=1;"";[.C49]) -> 0.226983 | H49: of:=IF([.D49]=1;"";[.D49]) ->  | I49: of:=IF([.E49]=1;"";[.E49]) -> 
A50: 14 | B50: strncpy: &"ye"{\0,\x01,\x01,\x01} &"o"{\0,p,r,e,\0} 5 :=> &"o"{\0,\0,\0,\0,\0} | C50: 0.215236 | D50: 1 | E50: 1 | G50: of:=IF([.C50]=1;"";[.C50]) -> 0.215236 | H50: of:=IF([.D50]=1;"";[.D50]) ->  | I50: of:=IF([.E50]=1;"";[.E50]) -> 
A51: 15 | B51: strncpy: &"fo"{\0,\x01,\x01,\x01} &"fo"{\0,p,r,\0} 5 :=> &"fo"{\0,\0,\0,\0} | C51: 0.219808 | D51: 0.219808 | E51: 0.219808 | G51: of:=IF([.C51]=1;"";[.C51]) -> 0.219808 | H51: of:=IF([.D51]=1;"";[.D51]) -> 0.219808 | I51: of:=IF([.E51]=1;"";[.E51]) -> 0.219808
A52: 16 | B52: strncpy: &"ju"{\0,\x01,\x01,\x01} &"int"{\0,p,\0} 5 :=> &"int"{\0,\0,\0} | C52: 0.208818 | D52: 0.0917447 | E52: 0.0917447 | G52: of:=IF([.C52]=1;"";[.C52]) -> 0.208818 | H52: of:=IF([.D52]=1;"";[.D52]) -> 0.0917447 | I52: of:=IF([.E52]=1;"";[.E52]) -> 0.0917447
A53: 17 | B53: strncpy: &"ut"{\0,\x01,\x01,\x01} &"inth"{\0,\0} 5 :=> &"inth"{\0,\0} | C53: 0.219808 | D53: 0.050893 | E53: 0.050893 | G53: of:=IF([.C53]=1;"";[.C53]) -> 0.219808 | H53: of:=IF([.D53]=1;"";[.D53]) -> 0.050893 | I53: of:=IF([.E53]=1;"";[.E53]) -> 0.050893
A54: 18 | B54: strncpy: &"fo"{\0,\x01,\x01,\x01} &"juthe"{\0} 5 :=> &"juthe"{\0} | C54: 0.219808 | D54: 0.0316047 | E54: 0.0316047 | G54: of:=IF([.C54]=1;"";[.C54]) -> 0.219808 | H54: of:=IF([.D54]=1;"";[.D54]) -> 0.0316047 | I54: of:=IF([.E54]=1;"";[.E54]) -> 0.0316047
A55: 19 | B55: strncpy: &"bes"{\0,\x01,\x01} &""{\0,p,r,e,s,\0} 5 :=> &""{\0,\0,\0,\0,\0,\0} | C55: 0.0899511 | D55: 1 | E55: 1 | G55: of:=IF([.C55]=1;"";[.C55]) -> 0.0899511 | H55: of:=IF([.D55]=1;"";[.D55]) ->  | I55: of:=IF([.E55]=1;"";[.E55]) -> 
A56: 20 | B56: strncpy: &"sth"{\0,\x01,\x01} &"r"{\0,p,r,e,\0} 5 :=> &"r"{\0,\0,\0,\0,\0} | C56: 0.0921454 | D56: 1 | E56: 1 | G56: of:=IF([.C56]=1;"";[.C56]) -> 0.0921454 | H56: of:=IF([.D56]=1;"";[.D56]) ->  | I56: of:=IF([.E56]=1;"";[.E56]) -> 
A57: 21 | B57: strncpy: &"cth"{\0,\x01,\x01} &"wi"{\0,p,r,\0} 5 :=> &"wi"{\0,\0,\0,\0} | C57: 0.0905558 | D57: 0.218466 | E57: 0.218466 | G57: of:=IF([.C57]=1;"";[.C57]) -> 0.0905558 | H57: of:=IF([.D57]=1;"";[.D57]) -> 0.218466 | I57: of:=IF([.E57]=1;"";[.E57]) -> 0.218466
A58: 22 | B58: strncpy: &"est"{\0,\x01,\x01} &"uth"{\0,p,\0} 5 :=> &"uth"{\0,\0,\0} | C58: 0.091083 | D58: 0.0910004 | E58: 0.0910004 | G58: of:=IF([.C58]=1;"";[.C58]) -> 0.091083 | H58: of:=IF([.D58]=1;"";[.D58]) -> 0.0910004 | I58: of:=IF([.E58]=1;"";[.E58]) -> 0.0910004
A59: 23 | B59: strncpy: &"zes"{\0,\x01,\x01} &"nthe"{\0,\0} 5 :=> &"nthe"{\0,\0} | C59: 0.0863349 | D59: 0.0509534 | E59: 0.0509534 | G59: of:=IF([.C59]=1;"";[.C59]) -> 0.0863349 | H59: of:=IF([.D59]=1;"";[.D59]) -> 0.0509534 | I59: of:=IF([.E59]=1;"";[.E59]) -> 0.0509534
A60: 24 | B60: strncpy: &"pre"{\0,\x01,\x01} &"sthes"{\0} 5 :=> &"sthes"{\0} | C60: 0.090057 | D60: 0.0332025 | E60: 0.0332025 | G60: of:=IF([.C60]=1;"";[.C60]) -> 0.090057 | H60: of:=IF([.D60]=1;"";[.D60]) -> 0.0332025 | I60: of:=IF([.E60]=1;"";[.E60]) -> 0.0332025
A61: 25 | B61: strncpy: &"juth"{\0,\x01} &""{\0,p,r,e,s,\0} 5 :=> &""{\0,\0,\0,\0,\0,\0} | C61: 0.0477583 | D61: 1 | E61: 1 | G61: of:=IF([.C61]=1;"";[.C61]) -> 0.0477583 | H61: of:=IF([.D61]=1;"";[.D61]) ->  | I61: of:=IF([.E61]=1;"";[.E61]) -> 
A62: 26 | B62: strncpy: &"sthe"{\0,\x01} &"j"{\0,p,r,e,\0} 5 :=> &"j"{\0,\0,\0,\0,\0} | C62: 0.051018 | D62: 1 | E62: 1 | G62: of:=IF([.C62]=1;"";[.C62]) -> 0.051018 | H62: of:=IF([.D62]=1;"";[.D62]) ->  | I62: of:=IF([.E62]=1;"";[.E62]) -> 
A63: 27 | B63: strncpy: &"hest"{\0,\x01} &"xp"{\0,p,r,\0} 5 :=> &"xp"{\0,\0,\0,\0} | C63: 0.0505273 | D63: 0.209845 | E63: 0.209845 | G63: of:=IF([.C63]=1;"";[.C63]) -> 0.0505273 | H63: of:=IF([.D63]=1;"";[.D63]) -> 0.209845 | I63: of:=IF([.E63]=1;"";[.E63]) -> 0.209845
A64: 28 | B64: strncpy: &"uthe"{\0,\x01} &"int"{\0,p,\0} 5 :=> &"int"{\0,\0,\0} | C64: 0.0504892 | D64: 0.0917447 | E64: 0.0917447 | G64: of:=IF([.C64]=1;"";[.C64]) -> 0.0504892 | H64: of:=IF([.D64]=1;"";[.D64]) -> 0.0917447 | I64: of:=IF([.E64]=1;"";[.E64]) -> 0.0917447
A65: 29 | B65: strncpy: &"uthe"{\0,\x01} &"mest"{\0,\0} 5 :=> &"mest"{\0,\0} | C65: 0.0504892 | D65: 0.0497193 | E65: 0.0497193 | G65: of:=IF([.C65]=1;"";[.C65]) -> 0.0504892 | H65: of:=IF([.D65]=1;"";[.D65]) -> 0.0497193 | I65: of:=IF([.E65]=1;"";[.E65]) -> 0.0497193
A66: 30 | B66: strncpy: &"dint"{\0,\x01} &"prest"{\0} 5 :=> &"prest"{\0} | C66: 0.0496215 | D66: 0.0323569 | E66: 0.0323569 | G66: of:=IF([.C66]=1;"";[.C66]) -> 0.0496215 | H66: of:=IF([.D66]=1;"";[.D66]) -> 0.0323569 | I66: of:=IF([.E66]=1;"";[.E66]) -> 0.0323569
A67: 31 | B67: strncpy: &"orest"{\0} &""{\0,p,r,e,s,\0} 5 :=> &""{\0,\0,\0,\0,\0,\0} | C67: 0.0327935 | D67: 1 | E67: 1 | G67: of:=IF([.C67]=1;"";[.C67]) -> 0.0327935 | H67: of:=IF([.D67]=1;"";[.D67]) ->  | I67: of:=IF([.E67]=1;"";[.E67]) -> 
A68: 32 | B68: strncpy: &"fores"{\0} &"j"{\0,p,r,e,\0} 5 :=> &"j"{\0,\0,\0,\0,\0} | C68: 0.0325019 | D68: 1 | E68: 1 | G68: of:=IF([.C68]=1;"";[.C68]) -> 0.0325019 | H68: of:=IF([.D68]=1;"";[.D68]) ->  | I68: of:=IF([.E68]=1;"";[.E68]) -> 
A69: 33 | B69: strncpy: &"fores"{\0} &"es"{\0,p,r,\0} 5 :=> &"es"{\0,\0,\0,\0} | C69: 0.0325019 | D69: 0.224112 | E69: 0.224112 | G69: of:=IF([.C69]=1;"";[.C69]) -> 0.0325019 | H69: of:=IF([.D69]=1;"";[.D69]) -> 0.224112 | I69: of:=IF([.E69]=1;"";[.E69]) -> 0.224112
A70: 34 | B70: strncpy: &"besth"{\0} &"uth"{\0,p,\0} 5 :=> &"uth"{\0,\0,\0} | C70: 0.0325987 | D70: 0.0910004 | E70: 0.0910004 | G70: of:=IF([.C70]=1;"";[.C70]) -> 0.0325987 | H70: of:=IF([.D70]=1;"";[.D70]) -> 0.0910004 | I70: of:=IF([.E70]=1;"";[.E70]) -> 0.0910004
A71: 35 | B71: strncpy: &"orest"{\0} &"zest"{\0,\0} 5 :=> &"zest"{\0,\0} | C71: 0.0327935 | D71: 0.0477944 | E71: 0.0477944 | G71: of:=IF([.C71]=1;"";[.C71]) -> 0.0327935 | H71: of:=IF([.D71]=1;"";[.D71]) -> 0.0477944 | I71: of:=IF([.E71]=1;"";[.E71]) -> 0.0477944
A72: 36 | B72: strncpy: &"yesth"{\0} &"besth"{\0} 5 :=> &"besth"{\0} | C72: 0.0322095 | D72: 0.0325987 | E72: 0.0325987 | G72: of:=IF([.C72]=1;"";[.C72]) -> 0.0322095 | H72: of:=IF([.D72]=1;"";[.D72]) -> 0.0325987 | I72: of:=IF([.E72]=1;"";[.E72]) -> 0.0325987

Sheet: strcat
A1: # | B1: Test Case | C1: N1 | D1: N2 | E1: N3
A2: 1 | B2: strcat: &""{\0,\x01,\x01,\x01,\x01,\x01,\x01,\x01,\x01,\x01} &"j"{\0,p,r,\0} :=> &"j"{\0,p,r,e,s,t,h,e,\0} | C2: 1 | D2: 1 | E2: 1 | G2: of:=IF([.C2]=1;"";[.C2]) ->  | H2: of:=IF([.D2]=1;"";[.D2]) ->  | I2: of:=IF([.E2]=1;"";[.E2]) ->  | K2: of:=AVERAGE([.G2:.G41]) -> 0.0702805645161291 | L2: of:=AVERAGE([.H2:.H41]) -> 0.123024490909091 | M2: of:=AVERAGE([.I2:.I41]) -> 0.0457378378378378 | O2: of:=AVERAGE([.K2:.M2]) -> 0.0796809644210193
A3: 2 | B3: strcat: &""{\0,\x01,\x01,\x01,\x01,\x01,\x01,\x01,\x01,\x01} &"re"{\0,p,\0} :=> &"re"{\0,p,r,e,s,t,h,\0} | C3: 1 | D3: 0.225356 | E3: 0.225356 | G3: of:=IF([.C3]=1;"";[.C3]) ->  | H3: of:=IF([.D3]=1;"";[.D3]) -> 0.225356 | I3: of:=IF([.E3]=1;"";[.E3]) -> 0.225356
A4: 3 | B4: strcat: &""{\0,\x01,\x01,\x01,\x01,\x01,\x01,\x01,\x01,\x01} &"kes"{\0,\0} :=> &"kes"{\0,p,r,e,s,t,\0} | C4: 1 | D4: 0.0892137 | E4: 0.0892137 | G4: of:=IF([.C4]=1;"";[.C4]) ->  | H4: of:=IF([.D4]=1;"";[.D4]) -> 0.0892137 | I4: of:=IF([.E4]=1;"";[.E4]) -> 0.0892137
A5: 4 | B5: strcat: &""{\0,\x01,\x01,\x01,\x01,\x01,\x01,\x01,\x01,\x01} &"juth"{\0} :=> &"juth"{\0,p,r,e,s,\0} | C5: 1 | D5: 0.0477583 | E5: 0.0477583 | H5: of:=IF([.D5]=1;"";[.D5]) -> 0.0477583 | I5: of:=IF([.E5]=1;"";[.E5]) -> 0.0477583
A6: 5 | B6: strcat: &"n"{\0,\x01,\x01,\x01,\x01,\x01,\x01,\x01,\x01} &""{\0,p,r,e,\0} :=> &"n"{\0,p,r,e,s,t,h,e,\0} | C6: 1 | D6: 1 | E6: 1 | G6: of:=IF([.C6]=1;"";[.C6]) ->  | H6: of:=IF([.D6]=1;"";[.D6]) ->  | I6: of:=IF([.E6]=1;"";[.E6]) -> 
A7: 6 | B7: strcat: &"s"{\0,\x01,\x01,\x01,\x01,\x01,\x01,\x01,\x01} &"q"{\0,p,r,\0} :=> &"sq"{\0,p,r,e,s,t,h,\0} | C7: 1 | D7: 1 | E7: 0.198519 | G7: of:=IF([.C7]=1;"";[.C7]) ->  | H7: of:=IF([.D7]=1;"";[.D7]) ->  | I7: of:=IF([.E7]=1;"";[.E7]) -> 0.198519
A8: 7 | B8: strcat: &"q"{\0,\x01,\x01,\x01,\x01,\x01,\x01,\x01,\x01} &"th"{\0,p,\0} :=> &"qth"{\0,p,r,e,s,t,\0} | C8: 1 | D8: 0.227384 | E8: 0.0628588 | G8: of:=IF([.C8]=1;"";[.C8]) ->  | H8: of:=IF([.D8]=1;"";[.D8]) -> 0.227384 | I8: of:=IF([.E8]=1;"";[.E8]) -> 0.0628588
A9: 8 | B9: strcat: &"l"{\0,\x01,\x01,\x01,\x01,\x01,\x01,\x01,\x01} &"ges"{\0,\0} :=> &"lges"{\0,p,r,e,s,\0} | C9: 1 | D9: 0.0896591 | E9: 0.0453261 | G9: of:=IF([.C9]=1;"";[.C9]) ->  | H9: of:=IF([.D9]=1;"";[.D9]) -> 0.0896591 | I9: of:=IF([.E9]=1;"";[.E9]) -> 0.0453261
A10: 9 | B10: strcat: &"n"{\0,\x01,\x01,\x01,\x01,\x01,\x01,\x01,\x01} &"athe"{\0} :=> &"nathe"{\0,p,r,e,\0} | C10: 1 | D10: 0.0512095 | E10: 0.0327883 | G10: of:=IF([.C10]=1;"";[.C10]) ->  | H10: of:=IF([.D10]=1;"";[.D10]) -> 0.0512095 | I10: of:=IF([.E10]=1;"";[.E10]) -> 0.0327883
A11: 10 | B11: strcat: &"he"{\0,\x01,\x01,\x01,\x01,\x01,\x01,\x01} &""{\0,p,r,e,\0} :=> &"he"{\0,p,r,e,s,t,h,\0} | C11: 0.226983 | D11: 1 | E11: 0.226983 | G11: of:=IF([.C11]=1;"";[.C11]) -> 0.226983 | H11: of:=IF([.D11]=1;"";[.D11]) ->  | I11: of:=IF([.E11]=1;"";[.E11]) -> 0.226983
A12: 11 | B12: strcat: &"pr"{\0,\x01,\x01,\x01,\x01,\x01,\x01,\x01} &"d"{\0,p,r,\0} :=> &"prd"{\0,p,r,e,s,t,\0} | C12: 0.218916 | D12: 1 | E12: 0.0871094 | G12: of:=IF([.C12]=1;"";[.C12]) -> 0.218916 | H12: of:=IF([.D12]=1;"";[.D12]) ->  | I12: of:=IF([.E12]=1;"";[.E12]) -> 0.0871094
A13: 12 | B13: strcat: &"ct"{\0,\x01,\x01,\x01,\x01,\x01,\x01,\x01} &"ly"{\0,p,\0} :=> &"ctly"{\0,p,r,e,s,\0} | C13: 0.218466 | D13: 0.218466 | E13: 0.0467594 | G13: of:=IF([.C13]=1;"";[.C13]) -> 0.218466 | H13: of:=IF([.D13]=1;"";[.D13]) -> 0.218466 | I13: of:=IF([.E13]=1;"";[.E13]) -> 0.0467594
A14: 13 | B14: strcat: &"ut"{\0,\x01,\x01,\x01,\x01,\x01,\x01,\x01} &"sth"{\0,\0} :=> &"utsth"{\0,p,r,e,\0} | C14: 0.219808 | D14: 0.0921454 | E14: 0.0321647 | G14: of:=IF([.C14]=1;"";[.C14]) -> 0.219808 | H14: of:=IF([.D14]=1;"";[.D14]) -> 0.0921454 | I14: of:=IF([.E14]=1;"";[.E14]) -> 0.0321647
A15: 14 | B15: strcat: &"be"{\0,\x01,\x01,\x01,\x01,\x01,\x01,\x01} &"juth"{\0} :=> &"bejuth"{\0,p,r,\0} | C15: 0.219808 | D15: 0.0477583 | E15: 0.021116 | G15: of:=IF([.C15]=1;"";[.C15]) -> 0.219808 | H15: of:=IF([.D15]=1;"";[.D15]) -> 0.0477583 | I15: of:=IF([.E15]=1;"";[.E15]) -> 0.021116
A16: 15 | B16: strcat: &"nth"{\0,\x01,\x01,\x01,\x01,\x01,\x01} &""{\0,p,r,e,\0} :=> &"nth"{\0,p,r,e,s,t,\0} | C16: 0.0920054 | D16: 1 | E16: 0.0920054 | G16: of:=IF([.C16]=1;"";[.C16]) -> 0.0920054 | H16: of:=IF([.D16]=1;"";[.D16]) ->  | I16: of:=IF([.E16]=1;"";[.E16]) -> 0.0920054
A17: 16 | B17: strcat: &"din"{\0,\x01,\x01,\x01,\x01,\x01,\x01} &"l"{\0,p,r,\0} :=> &"dinl"{\0,p,r,e,s,\0} | C17: 0.090448 | D17: 1 | E17: 0.0475165 | G17: of:=IF([.C17]=1;"";[.C17]) -> 0.090448 | H17: of:=IF([.D17]=1;"";[.D17]) ->  | I17: of:=IF([.E17]=1;"";[.E17]) -> 0.0475165
A18: 17 | B18: strcat: &"din"{\0,\x01,\x01,\x01,\x01,\x01,\x01} &"re"{\0,p,\0} :=> &"dinre"{\0,p,r,e,\0} | C18: 0.090448 | D18: 0.225356 | E18: 0.0305137 | G18: of:=IF([.C18]=1;"";[.C18]) -> 0.090448 | H18: of:=IF([.D18]=1;"";[.D18]) -> 0.225356 | I18: of:=IF([.E18]=1;"";[.E18]) -> 0.0305137
A19: 18 | B19: strcat: &"ges"{\0,\x01,\x01,\x01,\x01,\x01,\x01} &"hes"{\0,\0} :=> &"geshes"{\0,p,r,\0} | C19: 0.0896591 | D19: 0.0922924 | E19: 0.0233261 | G19: of:=IF([.C19]=1;"";[.C19]) -> 0.0896591 | H19: of:=IF([.D19]=1;"";[.D19]) -> 0.0922924 | I19: of:=IF([.E19]=1;"";[.E19]) -> 0.0233261
A20: 19 | B20: strcat: &"xpr"{\0,\x01,\x01,\x01,\x01,\x01,\x01} &"juth"{\0} :=> &"xprjuth"{\0,p,\0} | C20: 0.085063 | D20: 0.0477583 | E20: 0.015625 | G20: of:=IF([.C20]=1;"";[.C20]) -> 0.085063 | H20: of:=IF([.D20]=1;"";[.D20]) -> 0.0477583 | I20: of:=IF([.E20]=1;"";[.E20]) -> 0.015625
A21: 20 | B21: strcat: &"gest"{\0,\x01,\x01,\x01,\x01,\x01} &""{\0,p,r,e,\0} :=> &"gest"{\0,p,r,e,s,\0} | C21: 0.049323 | D21: 1 | E21: 0.049323 | G21: of:=IF([.C21]=1;"";[.C21]) -> 0.049323 | H21: of:=IF([.D21]=1;"";[.D21]) ->  | I21: of:=IF([.E21]=1;"";[.E21]) -> 0.049323
A22: 21 | B22: strcat: &"esth"{\0,\x01,\x01,\x01,\x01,\x01} &"t"{\0,p,r,\0} :=> &"estht"{\0,p,r,e,\0} | C22: 0.0505869 | D22: 1 | E22: 0.0321281 | G22: of:=IF([.C22]=1;"";[.C22]) -> 0.0505869 | H22: of:=IF([.D22]=1;"";[.D22]) ->  | I22: of:=IF([.E22]=1;"";[.E22]) -> 0.0321281
A23: 22 | B23: strcat: &"quth"{\0,\x01,\x01,\x01,\x01,\x01} &"xp"{\0,p,\0} :=> &"quthxp"{\0,p,r,\0} | C23: 0.0483689 | D23: 0.209845 | E23: 0 | G23: of:=IF([.C23]=1;"";[.C23]) -> 0.0483689 | H23: of:=IF([.D23]=1;"";[.D23]) -> 0.209845 | I23: of:=IF([.E23]=1;"";[.E23]) -> 0
A24: 23 | B24: strcat: &"kest"{\0,\x01,\x01,\x01,\x01,\x01} &"nth"{\0,\0} :=> &"kestnth"{\0,p,\0} | C24: 0.0491188 | D24: 0.0920054 | E24: 0.0175259 | G24: of:=IF([.C24]=1;"";[.C24]) -> 0.0491188 | H24: of:=IF([.D24]=1;"";[.D24]) -> 0.0920054 | I24: of:=IF([.E24]=1;"";[.E24]) -> 0.0175259
A25: 24 | B25: strcat: &"cthe"{\0,\x01,\x01,\x01,\x01,\x01} &"nthe"{\0} :=> &"cthenthe"{\0,\0} | C25: 0.0502835 | D25: 0.0509534 | E25: 0.015323 | G25: of:=IF([.C25]=1;"";[.C25]) -> 0.0502835 | H25: of:=IF([.D25]=1;"";[.D25]) -> 0.0509534 | I25: of:=IF([.E25]=1;"";[.E25]) -> 0.015323
A26: 25 | B26: strcat: &"lyest"{\0,\x01,\x01,\x01,\x01} &""{\0,p,r,e,\0} :=> &"lyest"{\0,p,r,e,\0} | C26: 0.0314814 | D26: 1 | E26: 0.0314814 | G26: of:=IF([.C26]=1;"";[.C26]) -> 0.0314814 | H26: of:=IF([.D26]=1;"";[.D26]) ->  | I26: of:=IF([.E26]=1;"";[.E26]) -> 0.0314814
A27: 26 | B27: strcat: &"besth"{\0,\x01,\x01,\x01,\x01} &"p"{\0,p,r,\0} :=> &"besthp"{\0,p,r,\0} | C27: 0.0325987 | D27: 1 | E27: 0.0213719 | G27: of:=IF([.C27]=1;"";[.C27]) -> 0.0325987 | H27: of:=IF([.D27]=1;"";[.D27]) ->  | I27: of:=IF([.E27]=1;"";[.E27]) -> 0.0213719
A28: 27 | B28: strcat: &"lyest"{\0,\x01,\x01,\x01,\x01} &"es"{\0,p,\0} :=> &"lyestes"{\0,p,\0} | C28: 0.0314814 | D28: 0.224112 | E28: 0.0179512 | G28: of:=IF([.C28]=1;"";[.C28]) -> 0.0314814 | H28: of:=IF([.D28]=1;"";[.D28]) -> 0.224112 | I28: of:=IF([.E28]=1;"";[.E28]) -> 0.0179512
A29: 28 | B29: strcat: &"vesth"{\0,\x01,\x01,\x01,\x01} &"jut"{\0,\0} :=> &"vesthjut"{\0,\0} | C29: 0.0327833 | D29: 0.0850061 | E29: 0.0128104 | G29: of:=IF([.C29]=1;"";[.C29]) -> 0.0327833 | H29: of:=IF([.D29]=1;"";[.D29]) -> 0.0850061 | I29: of:=IF([.E29]=1;"";[.E29]) -> 0.0128104
A30: 29 | B30: strcat: &"nthes"{\0,\x01,\x01,\x01,\x01} &"thes"{\0} :=> &"nthesthes"{\0} | C30: 0.0331665 | D30: 0.051146 | E30: 0.0131085 | G30: of:=IF([.C30]=1;"";[.C30]) -> 0.0331665 | H30: of:=IF([.D30]=1;"";[.D30]) -> 0.051146 | I30: of:=IF([.E30]=1;"";[.E30]) -> 0.0131085
A31: 30 | B31: strcat: &"esthes"{\0,\x01,\x01,\x01} &""{\0,p,r,e,\0} :=> &"esthes"{\0,p,r,\0} | C31: 0.0240579 | D31: 1 | E31: 0.0240579 | G31: of:=IF([.C31]=1;"";[.C31]) -> 0.0240579 | H31: of:=IF([.D31]=1;"";[.D31]) ->  | I31: of:=IF([.E31]=1;"";[.E31]) -> 0.0240579
A32: 31 | B32: strcat: &"kesthe"{\0,\x01,\x01,\x01} &"m"{\0,p,r,\0} :=> &"kesthem"{\0,p,\0} | C32: 0.0237035 | D32: 1 | E32: 0.018255 | G32: of:=IF([.C32]=1;"";[.C32]) -> 0.0237035 | H32: of:=IF([.D32]=1;"";[.D32]) ->  | I32: of:=IF([.E32]=1;"";[.E32]) -> 0.018255
A33: 32 | B33: strcat: &"resthe"{\0,\x01,\x01,\x01} &"ze"{\0,p,\0} :=> &"restheze"{\0,\0} | C33: 0.0241245 | D33: 0.208818 | E33: 0.0142539 | G33: of:=IF([.C33]=1;"";[.C33]) -> 0.0241245 | H33: of:=IF([.D33]=1;"";[.D33]) -> 0.208818 | I33: of:=IF([.E33]=1;"";[.E33]) -> 0.0142539
A34: 33 | B34: strcat: &"winthe"{\0,\x01,\x01,\x01} &"sth"{\0,\0} :=> &"winthesth"{\0} | C34: 0.0238607 | D34: 0.0921454 | E34: 0.0129791 | G34: of:=IF([.C34]=1;"";[.C34]) -> 0.0238607 | H34: of:=IF([.D34]=1;"";[.D34]) -> 0.0921454 | I34: of:=IF([.E34]=1;"";[.E34]) -> 0.0129791
A35: 34 | B35: strcat: &"zesthe"{\0,\x01,\x01,\x01} &&10 :=> &"zesthesthe"{} | C35: 0.0232225 | D35: 0.0111675 | G35: of:=IF([.C35]=1;"";[.C35]) -> 0.0232225 | H35: of:=IF([.D35]=1;"";[.D35]) -> 0.0111675 | I35: of:=IF([.E35]=1;"";[.E35]) ->  
A36: 35 | B36: strcat: &"winthes"{\0,\x01,\x01} &""{\0,p,r,e,\0} :=> &"winthes"{\0,p,\0} | C36: 0.0185891 | D36: 1 | E36: 0.0185891 | G36: of:=IF([.C36]=1;"";[.C36]) -> 0.0185891 | H36: of:=IF([.D36]=1;"";[.D36]) ->  | I36: of:=IF([.E36]=1;"";[.E36]) -> 0.0185891
A37: 36 | B37: strcat: &"xpresth"{\0,\x01,\x01} &"e"{\0,p,r,\0} :=> &"xpresthe"{\0,\0} | C37: 0.01794 | D37: 1 | E37: 0.0148196 | G37: of:=IF([.C37]=1;"";[.C37]) -> 0.01794 | H37: of:=IF([.D37]=1;"";[.D37]) ->  | I37: of:=IF([.E37]=1;"";[.E37]) -> 0.0148196
A38: 37 | B38: strcat: &"sthesth"{\0,\x01,\x01} &"he"{\0,p,\0} :=> &"sthesthhe"{\0} | C38: 0.0188151 | D38: 0.226983 | E38: 0.0122318 | G38: of:=IF([.C38]=1;"";[.C38]) -> 0.0188151 | H38: of:=IF([.D38]=1;"";[.D38]) -> 0.226983 | I38: of:=IF([.E38]=1;"";[.E38]) -> 0.0122318
A39: 38 | B39: strcat: &"kesthest"{\0,\x01} &""{\0,p,r,e,\0} :=> &"kesthest"{\0,\0} | C39: 0.0151206 | D39: 1 | E39: 0.0151206 | G39: of:=IF([.C39]=1;"";[.C39]) -> 0.0151206 | H39: of:=IF([.D39]=1;"";[.D39]) ->  | I39: of:=IF([.E39]=1;"";[.E39]) -> 0.0151206
A40: 39 | B40: strcat: &"oresthes"{\0,\x01} &"s"{\0,p,r,\0} :=> &"oresthess"{\0} | C40: 0.0153582 | D40: 1 | E40: 0.0129217 | G40: of:=IF([.C40]=1;"";[.C40]) -> 0.0153582 | H40: of:=IF([.D40]=1;"";[.D40]) ->  | I40: of:=IF([.E40]=1;"";[.E40]) -> 0.0129217
A41: 40 | B41: strcat: &"nthesthes"{\0} &""{\0,p,r,e,\0} :=> &"nthesthes"{\0} | C41: 0.0131085 | D41: 1 | E41: 0.0131085 | G41: of:=IF([.C41]=1;"";[.C41]) -> 0.0131085 | H41: of:=IF([.D41]=1;"";[.D41]) ->  | I41: of:=IF([.E41]=1;"";[.E41]) -> 0.0131085
A42: 1 | B42: strncat: &""{\0,\x01,\x01,\x01,\x01,\x01,\x01,\x01,\x01,\x01} &""{\0,p,r,e,\0} 4 :=> &""{\0,p,r,e,s,t,h,e,s,\0} | C42: 1 | D42: 1 | E42: 1 | G42: of:=IF([.C42]=1;"";[.C42]) ->  | H42: of:=IF([.D42]=1;"";[.D42]) ->  | I42: of:=IF([.E42]=1;"";[.E42]) ->  | K42: of:=AVERAGE([.G42:.G82]) -> 0.0702917838709678 | L42: of:=AVERAGE([.H42:.H82]) -> 0.123327577272727 | M42: of:=AVERAGE([.I42:.I82]) -> 0.0451975675675676 | O42: of:=AVERAGE([.K42:.M42]) -> 0.0796056429037542
A43: 2 | B43: strncat: &""{\0,\x01,\x01,\x01,\x01,\x01,\x01,\x01,\x01,\x01} &"h"{\0,p,r,\0} 4 :=> &"h"{\0,p,r,e,s,t,h,e,\0} | C43: 1 | D43: 1 | E43: 1 | G43: of:=IF([.C43]=1;"";[.C43]) ->  | H43: of:=IF([.D43]=1;"";[.D43]) ->  | I43: of:=IF([.E43]=1;"";[.E43]) -> 
A44: 3 | B44: strncat: &""{\0,\x01,\x01,\x01,\x01,\x01,\x01,\x01,\x01,\x01} &"re"{\0,p,\0} 4 :=> &"re"{\0,p,r,e,s,t,h,\0} | C44: 1 | D44: 0.225356 | E44: 0.225356 | G44: of:=IF([.C44]=1;"";[.C44]) ->  | H44: of:=IF([.D44]=1;"";[.D44]) -> 0.225356 | I44: of:=IF([.E44]=1;"";[.E44]) -> 0.225356
A45: 4 | B45: strncat: &""{\0,\x01,\x01,\x01,\x01,\x01,\x01,\x01,\x01,\x01} &"ath"{\0,\0} 4 :=> &"ath"{\0,p,r,e,s,t,\0} | C45: 1 | D45: 0.0925605 | E45: 0.0925605 | G45: of:=IF([.C45]=1;"";[.C45]) ->  | H45: of:=IF([.D45]=1;"";[.D45]) -> 0.0925605 | I45: of:=IF([.E45]=1;"";[.E45]) -> 0.0925605
A46: 5 | B46: strncat: &""{\0,\x01,\x01,\x01,\x01,\x01,\x01,\x01,\x01,\x01} &"best"{\0} 4 :=> &"best"{\0,p,r,e,s,\0} | C46: 1 | D46: 0.0494569 | E46: 0.0494569 | G46: of:=IF([.C46]=1;"";[.C46]) ->  | H46: of:=IF([.D46]=1;"";[.D46]) -> 0.0494569 | I46: of:=IF([.E46]=1;"";[.E46]) -> 0.0494569
A47: 6 | B47: strncat: &"g"{\0,\x01,\x01,\x01,\x01,\x01,\x01,\x01,\x01} &""{\0,p,r,e,\0} 4 :=> &"g"{\0,p,r,e,s,t,h,e,\0} | C47: 1 | D47: 1 | E47: 1 | G47: of:=IF([.C47]=1;"";[.C47]) ->  | H47: of:=IF([.D47]=1;"";[.D47]) ->  | I47: of:=IF([.E47]=1;"";[.E47]) -> 
A48: 7 | B48: strncat: &"m"{\0,\x01,\x01,\x01,\x01,\x01,\x01,\x01,\x01} &"d"{\0,p,r,\0} 4 :=> &"md"{\0,p,r,e,s,t,h,\0} | C48: 1 | D48: 1 | E48: 0.180593 | G48: of:=IF([.C48]=1;"";[.C48]) ->  | H48: of:=IF([.D48]=1;"";[.D48]) ->  | I48: of:=IF([.E48]=1;"";[.E48]) -> 0.180593
A49: 8 | B49: strncat: &"t"{\0,\x01,\x01,\x01,\x01,\x01,\x01,\x01,\x01} &"fo"{\0,p,\0} 4 :=> &"tfo"{\0,p,r,e,s,t,\0} | C49: 1 | D49: 0.219808 | E49: 0.0812958 | G49: of:=IF([.C49]=1;"";[.C49]) ->  | H49: of:=IF([.D49]=1;"";[.D49]) -> 0.219808 | I49: of:=IF([.E49]=1;"";[.E49]) -> 0.0812958
A50: 9 | B50: strncat: &"j"{\0,\x01,\x01,\x01,\x01,\x01,\x01,\x01,\x01} &"xpr"{\0,\0} 4 :=> &"jxpr"{\0,p,r,e,s,\0} | C50: 1 | D50: 0.085063 | E50: 0 | G50: of:=IF([.C50]=1;"";[.C50]) ->  | H50: of:=IF([.D50]=1;"";[.D50]) -> 0.085063 | I50: of:=IF([.E50]=1;"";[.E50]) -> 0
A51: 10 | B51: strncat: &"t"{\0,\x01,\x01,\x01,\x01,\x01,\x01,\x01,\x01} &"inth"{\0} 4 :=> &"tinth"{\0,p,r,e,\0} | C51: 1 | D51: 0.050893 | E51: 0.0330617 | G51: of:=IF([.C51]=1;"";[.C51]) ->  | H51: of:=IF([.D51]=1;"";[.D51]) -> 0.050893 | I51: of:=IF([.E51]=1;"";[.E51]) -> 0.0330617
A52: 11 | B52: strncat: &"st"{\0,\x01,\x01,\x01,\x01,\x01,\x01,\x01} &""{\0,p,r,e,\0} 4 :=> &"st"{\0,p,r,e,s,t,h,\0} | C52: 0.223271 | D52: 1 | E52: 0.223271 | G52: of:=IF([.C52]=1;"";[.C52]) -> 0.223271 | H52: of:=IF([.D52]=1;"";[.D52]) ->  | I52: of:=IF([.E52]=1;"";[.E52]) -> 0.223271
A53: 12 | B53: strncat: &"fo"{\0,\x01,\x01,\x01,\x01,\x01,\x01,\x01} &"d"{\0,p,r,\0} 4 :=> &"fod"{\0,p,r,e,s,t,\0} | C53: 0.219808 | D53: 1 | E53: 0.0869363 | G53: of:=IF([.C53]=1;"";[.C53]) -> 0.219808 | H53: of:=IF([.D53]=1;"";[.D53]) ->  | I53: of:=IF([.E53]=1;"";[.E53]) -> 0.0869363
A54: 13 | B54: strncat: &"nt"{\0,\x01,\x01,\x01,\x01,\x01,\x01,\x01} &"ke"{\0,p,\0} 4 :=> &"ntke"{\0,p,r,e,s,\0} | C54: 0.222847 | D54: 0.217558 | E54: 0.0430733 | G54: of:=IF([.C54]=1;"";[.C54]) -> 0.222847 | H54: of:=IF([.D54]=1;"";[.D54]) -> 0.217558 | I54: of:=IF([.E54]=1;"";[.E54]) -> 0.0430733
A55: 14 | B55: strncat: &"ze"{\0,\x01,\x01,\x01,\x01,\x01,\x01,\x01} &"mes"{\0,\0} 4 :=> &"zemes"{\0,p,r,e,\0} | C55: 0.208818 | D55: 0.0905241 | E55: 0.0307694 | G55: of:=IF([.C55]=1;"";[.C55]) -> 0.208818 | H55: of:=IF([.D55]=1;"";[.D55]) -> 0.0905241 | I55: of:=IF([.E55]=1;"";[.E55]) -> 0.0307694
A56: 15 | B56: strncat: &"be"{\0,\x01,\x01,\x01,\x01,\x01,\x01,\x01} &"inth"{\0} 4 :=> &"beinth"{\0,p,r,\0} | C56: 0.219808 | D56: 0.050893 | E56: 0.0232806 | G56: of:=IF([.C56]=1;"";[.C56]) -> 0.219808 | H56: of:=IF([.D56]=1;"";[.D56]) -> 0.050893 | I56: of:=IF([.E56]=1;"";[.E56]) -> 0.0232806
A57: 16 | B57: strncat: &"for"{\0,\x01,\x01,\x01,\x01,\x01,\x01} &""{\0,p,r,e,\0} 4 :=> &"for"{\0,p,r,e,s,t,\0} | C57: 0.0899511 | D57: 1 | E57: 0.0899511 | G57: of:=IF([.C57]=1;"";[.C57]) -> 0.0899511 | H57: of:=IF([.D57]=1;"";[.D57]) ->  | I57: of:=IF([.E57]=1;"";[.E57]) -> 0.0899511
A58: 17 | B58: strncat: &"bes"{\0,\x01,\x01,\x01,\x01,\x01,\x01} &"u"{\0,p,r,\0} 4 :=> &"besu"{\0,p,r,e,s,\0} | C58: 0.0899511 | D58: 1 | E58: 0.0484725 | G58: of:=IF([.C58]=1;"";[.C58]) -> 0.0899511 | H58: of:=IF([.D58]=1;"";[.D58]) ->  | I58: of:=IF([.E58]=1;"";[.E58]) -> 0.0484725
A59: 18 | B59: strncat: &"mes"{\0,\x01,\x01,\x01,\x01,\x01,\x01} &"be"{\0,p,\0} 4 :=> &"mesbe"{\0,p,r,e,\0} | C59: 0.0905241 | D59: 0.219808 | E59: 0.0302069 | G59: of:=IF([.C59]=1;"";[.C59]) -> 0.0905241 | H59: of:=IF([.D59]=1;"";[.D59]) -> 0.219808 | I59: of:=IF([.E59]=1;"";[.E59]) -> 0.0302069
A60: 19 | B60: strncat: &"mes"{\0,\x01,\x01,\x01,\x01,\x01,\x01} &"ath"{\0,\0} 4 :=> &"mesath"{\0,p,r,\0} | C60: 0.0905241 | D60: 0.0925605 | E60: 0.0235335 | G60: of:=IF([.C60]=1;"";[.C60]) -> 0.0905241 | H60: of:=IF([.D60]=1;"";[.D60]) -> 0.0925605 | I60: of:=IF([.E60]=1;"";[.E60]) -> 0.0235335
A61: 20 | B61: strncat: &"pre"{\0,\x01,\x01,\x01,\x01,\x01,\x01} &"ores"{\0} 4 :=> &"preores"{\0,p,\0} | C61: 0.090057 | D61: 0.0504117 | E61: 0.0179558 | G61: of:=IF([.C61]=1;"";[.C61]) -> 0.090057 | H61: of:=IF([.D61]=1;"";[.D61]) -> 0.0504117 | I61: of:=IF([.E61]=1;"";[.E61]) -> 0.0179558
A62: 21 | B62: strncat: &"nthe"{\0,\x01,\x01,\x01,\x01,\x01} &""{\0,p,r,e,\0} 4 :=> &"nthe"{\0,p,r,e,s,\0} | C62: 0.0509534 | D62: 1 | E62: 0.0509534 | G62: of:=IF([.C62]=1;"";[.C62]) -> 0.0509534 | H62: of:=IF([.D62]=1;"";[.D62]) ->  | I62: of:=IF([.E62]=1;"";[.E62]) -> 0.0509534
A63: 22 | B63: strncat: &"rest"{\0,\x01,\x01,\x01,\x01,\x01} &"v"{\0,p,r,\0} 4 :=> &"restv"{\0,p,r,e,\0} | C63: 0.0502856 | D63: 1 | E63: 0.0295671 | G63: of:=IF([.C63]=1;"";[.C63]) -> 0.0502856 | H63: of:=IF([.D63]=1;"";[.D63]) ->  | I63: of:=IF([.E63]=1;"";[.E63]) -> 0.0295671
A64: 23 | B64: strncat: &"sthe"{\0,\x01,\x01,\x01,\x01,\x01} &"ve"{\0,p,\0} 4 :=> &"stheve"{\0,p,r,\0} | C64: 0.051018 | D64: 0.221991 | E64: 0.0235159 | G64: of:=IF([.C64]=1;"";[.C64]) -> 0.051018 | H64: of:=IF([.D64]=1;"";[.D64]) -> 0.221991 | I64: of:=IF([.E64]=1;"";[.E64]) -> 0.0235159
A65: 24 | B65: strncat: &"uthe"{\0,\x01,\x01,\x01,\x01,\x01} &"hes"{\0,\0} 4 :=> &"uthehes"{\0,p,\0} | C65: 0.0504892 | D65: 0.0922924 | E65: 0.0179705 | G65: of:=IF([.C65]=1;"";[.C65]) -> 0.0504892 | H65: of:=IF([.D65]=1;"";[.D65]) -> 0.0922924 | I65: of:=IF([.E65]=1;"";[.E65]) -> 0.0179705
A66: 25 | B66: strncat: &"vest"{\0,\x01,\x01,\x01,\x01,\x01} &"thes"{\0} 4 :=> &"vestthes"{\0,\0} | C66: 0.0497838 | D66: 0.051146 | E66: 0.0150212 | G66: of:=IF([.C66]=1;"";[.C66]) -> 0.0497838 | H66: of:=IF([.D66]=1;"";[.D66]) -> 0.051146 | I66: of:=IF([.E66]=1;"";[.E66]) -> 0.0150212
A67: 26 | B67: strncat: &"gesth"{\0,\x01,\x01,\x01,\x01} &""{\0,p,r,e,\0} 4 :=> &"gesth"{\0,p,r,e,\0} | C67: 0.0325231 | D67: 1 | E67: 0.0325231 | G67: of:=IF([.C67]=1;"";[.C67]) -> 0.0325231 | H67: of:=IF([.D67]=1;"";[.D67]) ->  | I67: of:=IF([.E67]=1;"";[.E67]) -> 0.0325231
A68: 27 | B68: strncat: &"besth"{\0,\x01,\x01,\x01,\x01} &"w"{\0,p,r,\0} 4 :=> &"besthw"{\0,p,r,\0} | C68: 0.0325987 | D68: 1 | E68: 0.0222205 | G68: of:=IF([.C68]=1;"";[.C68]) -> 0.0325987 | H68: of:=IF([.D68]=1;"";[.D68]) ->  | I68: of:=IF([.E68]=1;"";[.E68]) -> 0.0222205
A69: 28 | B69: strncat: &"sthes"{\0,\x01,\x01,\x01,\x01} &"wi"{\0,p,\0} 4 :=> &"stheswi"{\0,p,\0} | C69: 0.0332025 | D69: 0.218466 | E69: 0.017746 | G69: of:=IF([.C69]=1;"";[.C69]) -> 0.0332025 | H69: of:=IF([.D69]=1;"";[.D69]) -> 0.218466 | I69: of:=IF([.E69]=1;"";[.E69]) -> 0.017746
A70: 29 | B70: strncat: &"inthe"{\0,\x01,\x01,\x01,\x01} &"lye"{\0,\0} 4 :=> &"inthelye"{\0,\0} | C70: 0.0333747 | D70: 0.0866641 | E70: 0.0148638 | G70: of:=IF([.C70]=1;"";[.C70]) -> 0.0333747 | H70: of:=IF([.D70]=1;"";[.D70]) -> 0.0866641 | I70: of:=IF([.E70]=1;"";[.E70]) -> 0.0148638
A71: 30 | B71: strncat: &"xpres"{\0,\x01,\x01,\x01,\x01} &"mest"{\0} 4 :=> &"xpresmest"{\0} | C71: 0.0312303 | D71: 0.0497193 | E71: 0.0121244 | G71: of:=IF([.C71]=1;"";[.C71]) -> 0.0312303 | H71: of:=IF([.D71]=1;"";[.D71]) -> 0.0497193 | I71: of:=IF([.E71]=1;"";[.E71]) -> 0.0121244
A72: 31 | B72: strncat: &"zesthe"{\0,\x01,\x01,\x01} &""{\0,p,r,e,\0} 4 :=> &"zesthe"{\0,p,r,\0} | C72: 0.0232225 | D72: 1 | E72: 0.0232225 | G72: of:=IF([.C72]=1;"";[.C72]) -> 0.0232225 | H72: of:=IF([.D72]=1;"";[.D72]) ->  | I72: of:=IF([.E72]=1;"";[.E72]) -> 0.0232225
A73: 32 | B73: strncat: &"forest"{\0,\x01,\x01,\x01} &"u"{\0,p,r,\0} 4 :=> &"forestu"{\0,p,\0} | C73: 0.0235688 | D73: 1 | E73: 0.0180595 | G73: of:=IF([.C73]=1;"";[.C73]) -> 0.0235688 | H73: of:=IF([.D73]=1;"";[.D73]) ->  | I73: of:=IF([.E73]=1;"";[.E73]) -> 0.0180595
A74: 33 | B74: strncat: &"dinthe"{\0,\x01,\x01,\x01} &"es"{\0,p,\0} 4 :=> &"dinthees"{\0,\0} | C74: 0.0238852 | D74: 0.224112 | E74: 0.0150939 | G74: of:=IF([.C74]=1;"";[.C74]) -> 0.0238852 | H74: of:=IF([.D74]=1;"";[.D74]) -> 0.224112 | I74: of:=IF([.E74]=1;"";[.E74]) -> 0.0150939
A75: 34 | B75: strncat: &"presth"{\0,\x01,\x01,\x01} &"yes"{\0,\0} 4 :=> &"presthyes"{\0} | C75: 0.023692 | D75: 0.0884511 | E75: 0.0122889 | G75: of:=IF([.C75]=1;"";[.C75]) -> 0.023692 | H75: of:=IF([.D75]=1;"";[.D75]) -> 0.0884511 | I75: of:=IF([.E75]=1;"";[.E75]) -> 0.0122889
A76: 35 | B76: strncat: &"besthe"{\0,\x01,\x01,\x01} &&10 4 :=> &"besthesthe"{} | C76: 0.0238258 | D76: 0.0113601 | G76: of:=IF([.C76]=1;"";[.C76]) -> 0.0238258 | H76: of:=IF([.D76]=1;"";[.D76]) -> 0.0113601 | I76: of:=IF([.E76]=1;"";[.E76]) ->  
A77: 36 | B77: strncat: &"mesthes"{\0,\x01,\x01} &""{\0,p,r,e,\0} 4 :=> &"mesthes"{\0,p,\0} | C77: 0.0186305 | D77: 1 | E77: 0.0186305 | G77: of:=IF([.C77]=1;"";[.C77]) -> 0.0186305 | H77: of:=IF([.D77]=1;"";[.D77]) ->  | I77: of:=IF([.E77]=1;"";[.E77]) -> 0.0186305
A78: 37 | B78: strncat: &"mesthes"{\0,\x01,\x01} &"y"{\0,p,r,\0} 4 :=> &"mesthesy"{\0,\0} | C78: 0.0186305 | D78: 1 | E78: 0.0147767 | G78: of:=IF([.C78]=1;"";[.C78]) -> 0.0186305 | H78: of:=IF([.D78]=1;"";[.D78]) ->  | I78: of:=IF([.E78]=1;"";[.E78]) -> 0.0147767
A79: 38 | B79: strncat: &"sthesth"{\0,\x01,\x01} &"or"{\0,p,\0} 4 :=> &"sthesthor"{\0} | C79: 0.0188151 | D79: 0.224112 | E79: 0.0129653 | G79: of:=IF([.C79]=1;"";[.C79]) -> 0.0188151 | H79: of:=IF([.D79]=1;"";[.D79]) -> 0.224112 | I79: of:=IF([.E79]=1;"";[.E79]) -> 0.0129653
A80: 39 | B80: strncat: &"foresthe"{\0,\x01} &""{\0,p,r,e,\0} 4 :=> &"foresthe"{\0,\0} | C80: 0.0152395 | D80: 1 | E80: 0.0152395 | G80: of:=IF([.C80]=1;"";[.C80]) -> 0.0152395 | H80: of:=IF([.D80]=1;"";[.D80]) ->  | I80: of:=IF([.E80]=1;"";[.E80]) -> 0.0152395
A81: 40 | B81: strncat: &"uthesthe"{\0,\x01} &"u"{\0,p,r,\0} 4 :=> &"uthestheu"{\0} | C81: 0.0153723 | D81: 1 | E81: 0.0126086 | G81: of:=IF([.C81]=1;"";[.C81]) -> 0.0153723 | H81: of:=IF([.D81]=1;"";[.D81]) ->  | I81: of:=IF([.E81]=1;"";[.E81]) -> 0.0126086
A82: 41 | B82: strncat: &"athesthes"{\0} &""{\0,p,r,e,\0} 4 :=> &"athesthes"{\0} | C82: 0.0131444 | D82: 1 | E82: 0.0131444 | G82: of:=IF([.C82]=1;"";[.C82]) -> 0.0131444 | H82: of:=IF([.D82]=1;"";[.D82]) ->  | I82: of:=IF([.E82]=1;"";[.E82]) -> 0.0131444

Sheet: strstr
A1: # | B1: Test Case | C1: N | G1: N1 | H1: N2 | I1: N3
A2: 1 | B2: strstr: &"s"{\0,h,e,s,\0} &"s"{\0,\0} :=> &"s"{\0,h,e,s,\0} | C2: 1 | D2: 1 | E2: 1 | G2: of:=IF([.C2]=1;"";[.C2]) ->  | H2: of:=IF([.D2]=1;"";[.D2]) ->  | I2: of:=IF([.E2]=1;"";[.E2]) ->  | K2: of:=AVERAGE([.G2:.G19]) -> 0.0875107 | L2: of:=AVERAGE([.H2:.H19]) -> 0.220979222222222 | M2: of:=AVERAGE([.I2:.I19]) -> 0.114679475 | O2: of:=AVERAGE([.K2:.M2]) -> 0.141056465740741
A3: 2 | B3: strstr: &"st"{\0,h,e,\0} &"s"{\0,\0} :=> &"st"{\0,h,e,\0} | C3: 0.223271 | D3: 1 | E3: 0.223271 | G3: of:=IF([.C3]=1;"";[.C3]) -> 0.223271 | H3: of:=IF([.D3]=1;"";[.D3]) ->  | I3: of:=IF([.E3]=1;"";[.E3]) -> 0.223271
A4: 3 | B4: strstr: &"ut"{\0,b,e,\0} &"t"{\0,\0} :=> &"t"{\0,b,e,\0,54} | C4: 0.219808 | D4: 1 | E4: 1 | G4: of:=IF([.C4]=1;"";[.C4]) -> 0.219808 | H4: of:=IF([.D4]=1;"";[.D4]) ->  | I4: of:=IF([.E4]=1;"";[.E4]) -> 
A5: 4 | B5: strstr: &"sth"{\0,h,\0} &"s"{\0,\0} :=> &"sth"{\0,h,\0} | C5: 0.0921454 | D5: 1 | E5: 0.0921454 | G5: of:=IF([.C5]=1;"";[.C5]) -> 0.0921454 | H5: of:=IF([.D5]=1;"";[.D5]) ->  | I5: of:=IF([.E5]=1;"";[.E5]) -> 0.0921454
A6: 5 | B6: strstr: &"mes"{\0,b,\0} &"e"{\0,\0} :=> &"es"{\0,b,\0,54} | C6: 0.0905241 | D6: 1 | E6: 0.224112 | G6: of:=IF([.C6]=1;"";[.C6]) -> 0.0905241 | H6: of:=IF([.D6]=1;"";[.D6]) ->  | I6: of:=IF([.E6]=1;"";[.E6]) -> 0.224112
A7: 6 | B7: strstr: &"athe"{\0,\0} &"a"{\0,\0} :=> &"athe"{\0,\0} | C7: 0.0512095 | D7: 1 | E7: 0.0512095 | G7: of:=IF([.C7]=1;"";[.C7]) -> 0.0512095 | H7: of:=IF([.D7]=1;"";[.D7]) ->  | I7: of:=IF([.E7]=1;"";[.E7]) -> 0.0512095
A8: 7 | B8: strstr: &"nthe"{\0,\0} &"t"{\0,\0} :=> &"the"{\0,\0,54} | C8: 0.0509534 | D8: 1 | E8: 0.093369 | G8: of:=IF([.C8]=1;"";[.C8]) -> 0.0509534 | H8: of:=IF([.D8]=1;"";[.D8]) ->  | I8: of:=IF([.E8]=1;"";[.E8]) -> 0.093369
A9: 8 | B9: strstr: &"hesth"{\0} &"h"{\0,\0} :=> &"hesth"{\0} | C9: 0.0332025 | D9: 1 | E9: 0.0332025 | G9: of:=IF([.C9]=1;"";[.C9]) -> 0.0332025 | H9: of:=IF([.D9]=1;"";[.D9]) ->  | I9: of:=IF([.E9]=1;"";[.E9]) -> 0.0332025
A10: 9 | B10: strstr: &"sthes"{\0} &"t"{\0,\0} :=> &"thes"{\0,54} | C10: 0.0332025 | D10: 1 | E10: 0.051146 | G10: of:=IF([.C10]=1;"";[.C10]) -> 0.0332025 | H10: of:=IF([.D10]=1;"";[.D10]) ->  | I10: of:=IF([.E10]=1;"";[.E10]) -> 0.051146
A11: 10 | B11: strstr: &"xp"{\0,d,i,\0} &"xp"{\0} :=> &"xp"{\0,d,i,\0} | C11: 0.209845 | D11: 0.209845 | E11: 0.209845 | G11: of:=IF([.C11]=1;"";[.C11]) -> 0.209845 | H11: of:=IF([.D11]=1;"";[.D11]) -> 0.209845 | I11: of:=IF([.E11]=1;"";[.E11]) -> 0.209845
A12: 11 | B12: strstr: &"est"{\0,d,\0} &"es"{\0} :=> &"est"{\0,d,\0} | C12: 0.091083 | D12: 0.224112 | E12: 0.091083 | G12: of:=IF([.C12]=1;"";[.C12]) -> 0.091083 | H12: of:=IF([.D12]=1;"";[.D12]) -> 0.224112 | I12: of:=IF([.E12]=1;"";[.E12]) -> 0.091083
A13: 12 | B13: strstr: &"sst"{\0,a,\0} &"st"{\0} :=> &"st"{\0,a,\0,54} | C13: 0.0893898 | D13: 0.223271 | E13: 0.223271 | G13: of:=IF([.C13]=1;"";[.C13]) -> 0.0893898 | H13: of:=IF([.D13]=1;"";[.D13]) -> 0.223271 | I13: of:=IF([.E13]=1;"";[.E13]) -> 0.223271
A14: 13 | B14: strstr: &"win"{\0,p,\0} &"in"{\0} :=> &"in"{\0,p,\0,54} | C14: 0.0902992 | D14: 0.226579 | E14: 0.226579 | G14: of:=IF([.C14]=1;"";[.C14]) -> 0.0902992 | H14: of:=IF([.D14]=1;"";[.D14]) -> 0.226579 | I14: of:=IF([.E14]=1;"";[.E14]) -> 0.226579
A15: 14 | B15: strstr: &"yest"{\0,\0} &"ye"{\0} :=> &"yest"{\0,\0} | C15: 0.0487686 | D15: 0.215236 | E15: 0.0487686 | G15: of:=IF([.C15]=1;"";[.C15]) -> 0.0487686 | H15: of:=IF([.D15]=1;"";[.D15]) -> 0.215236 | I15: of:=IF([.E15]=1;"";[.E15]) -> 0.0487686
A16: 15 | B16: strstr: &"eest"{\0,\0} &"es"{\0} :=> &"est"{\0,\0,54} | C16: 0.049323 | D16: 0.224112 | E16: 0.091083 | G16: of:=IF([.C16]=1;"";[.C16]) -> 0.049323 | H16: of:=IF([.D16]=1;"";[.D16]) -> 0.224112 | I16: of:=IF([.E16]=1;"";[.E16]) -> 0.091083
A17: 16 | B17: strstr: &"cthe"{\0,\0} &"th"{\0} :=> &"the"{\0,\0,54} | C17: 0.0502835 | D17: 0.227384 | E17: 0.093369 | G17: of:=IF([.C17]=1;"";[.C17]) -> 0.0502835 | H17: of:=IF([.D17]=1;"";[.D17]) -> 0.227384 | I17: of:=IF([.E17]=1;"";[.E17]) -> 0.093369
A18: 17 | B18: strstr: &"winth"{\0} &"wi"{\0} :=> &"winth"{\0} | C18: 0.0326533 | D18: 0.218466 | E18: 0.0326533 | G18: of:=IF([.C18]=1;"";[.C18]) -> 0.0326533 | H18: of:=IF([.D18]=1;"";[.D18]) -> 0.218466 | I18: of:=IF([.E18]=1;"";[.E18]) -> 0.0326533
A19: 18 | B19: strstr: &"ffore"{\0} &"fo"{\0} :=> &"fore"{\0,54} | C19: 0.0317201 | D19: 0.219808 | E19: 0.0497643 | G19: of:=IF([.C19]=1;"";[.C19]) -> 0.0317201 | H19: of:=IF([.D19]=1;"";[.D19]) -> 0.219808 | I19: of:=IF([.E19]=1;"";[.E19]) -> 0.0497643
A20: 19 | B20: strstr: &"hesth"{\0} &"es"{\0} :=> &"esth"{\0,54} | C20: 0.0332025 | D20: 0.224112 | E20: 0.0505869 | G20: of:=IF([.C20]=1;"";[.C20]) -> 0.0332025 | H20: of:=IF([.D20]=1;"";[.D20]) -> 0.224112 | I20: of:=IF([.E20]=1;"";[.E20]) -> 0.0505869 | K20: of:=AVERAGE([.G20:.G24]) -> 0.0328903 | L20: of:=AVERAGE([.H20:.H24]) -> 0.225748 | M20: of:=AVERAGE([.I20:.I24]) -> 0.03997994 | O20: of:=AVERAGE([.K20:.M20]) -> 0.0995394133333333
A21: 1 | B21: strnstr: &"nthes"{\0} &""{\0,p,\0} 2 :=> &"nthes"{\0} | C21: 0.0331665 | D21: 1 | E21: 0.0331665 | G21: of:=IF([.C21]=1;"";[.C21]) -> 0.0331665 | H21: of:=IF([.D21]=1;"";[.D21]) ->  | I21: of:=IF([.E21]=1;"";[.E21]) -> 0.0331665
A22: 2 | B22: strnstr: &"prest"{\0} &"p"{\0,\0} 2 :=> &"prest"{\0} | C22: 0.0323569 | D22: 1 | E22: 0.0323569 | G22: of:=IF([.C22]=1;"";[.C22]) -> 0.0323569 | H22: of:=IF([.D22]=1;"";[.D22]) ->  | I22: of:=IF([.E22]=1;"";[.E22]) -> 0.0323569
A23: 3 | B23: strnstr: &"gesth"{\0} &"e"{\0,\0} 2 :=> &"esth"{\0,54} | C23: 0.0325231 | D23: 1 | E23: 0.0505869 | G23: of:=IF([.C23]=1;"";[.C23]) -> 0.0325231 | H23: of:=IF([.D23]=1;"";[.D23]) ->  | I23: of:=IF([.E23]=1;"";[.E23]) -> 0.0505869
A24: 4 | B24: strnstr: &"thest"{\0} &"th"{\0} 2 :=> &"thest"{\0} | C24: 0.0332025 | D24: 0.227384 | E24: 0.0332025 | G24: of:=IF([.C24]=1;"";[.C24]) -> 0.0332025 | H24: of:=IF([.D24]=1;"";[.D24]) -> 0.227384 | I24: of:=IF([.E24]=1;"";[.E24]) -> 0.0332025
A25: 1 | B25: strpbrk: &"wuthe"{\0} &"aeiou"{\0} :=> &"uthe"{\0,54} | C25: 0.0283243 | D25: 0.0299288 | E25: 0.0504892 | G25: of:=IF([.C25]=1;"";[.C25]) -> 0.0283243 | H25: of:=IF([.D25]=1;"";[.D25]) -> 0.0299288 | I25: of:=IF([.E25]=1;"";[.E25]) -> 0.0504892 | K25: of:=AVERAGE([.G25:.G34]) -> 0.03222039 | L25: of:=AVERAGE([.H25:.H34]) -> 0.0299288 | M25: of:=AVERAGE([.I25:.I34]) -> 0.04191776 | O25: of:=AVERAGE([.K25:.M25]) -> 0.0346889833333333
A26: 2 | B26: strpbrk: &"zores"{\0} &"aeiou"{\0} :=> &"ores"{\0,54} | C26: 0.0305998 | D26: 0.0299288 | E26: 0.0504117 | G26: of:=IF([.C26]=1;"";[.C26]) -> 0.0305998 | H26: of:=IF([.D26]=1;"";[.D26]) -> 0.0299288 | I26: of:=IF([.E26]=1;"";[.E26]) -> 0.0504117
A27: 3 | B27: strpbrk: &"cinth"{\0} &"aeiou"{\0} :=> &"inth"{\0,54} | C27: 0.0324968 | D27: 0.0299288 | E27: 0.050893 | G27: of:=IF([.C27]=1;"";[.C27]) -> 0.0324968 | H27: of:=IF([.D27]=1;"";[.D27]) -> 0.0299288 | I27: of:=IF([.E27]=1;"";[.E27]) -> 0.050893
A28: 4 | B28: strpbrk: &"westh"{\0} &"aeiou"{\0} :=> &"esth"{\0,54} | C28: 0.0323685 | D28: 0.0299288 | E28: 0.0505869 | G28: of:=IF([.C28]=1;"";[.C28]) -> 0.0323685 | H28: of:=IF([.D28]=1;"";[.D28]) -> 0.0299288 | I28: of:=IF([.E28]=1;"";[.E28]) -> 0.0505869
A29: 5 | B29: strpbrk: &"wathe"{\0} &"aeiou"{\0} :=> &"athe"{\0,54} | C29: 0.0328272 | D29: 0.0299288 | E29: 0.0512095 | G29: of:=IF([.C29]=1;"";[.C29]) -> 0.0328272 | H29: of:=IF([.D29]=1;"";[.D29]) -> 0.0299288 | I29: of:=IF([.E29]=1;"";[.E29]) -> 0.0512095
A30: 6 | B30: strpbrk: &"uthes"{\0} &"aeiou"{\0} :=> &"uthes"{\0} | C30: 0.0329073 | D30: 0.0299288 | E30: 0.0329073 | G30: of:=IF([.C30]=1;"";[.C30]) -> 0.0329073 | H30: of:=IF([.D30]=1;"";[.D30]) -> 0.0299288 | I30: of:=IF([.E30]=1;"";[.E30]) -> 0.0329073
A31: 7 | B31: strpbrk: &"orest"{\0} &"aeiou"{\0} :=> &"orest"{\0} | C31: 0.0327935 | D31: 0.0299288 | E31: 0.0327935 | G31: of:=IF([.C31]=1;"";[.C31]) -> 0.0327935 | H31: of:=IF([.D31]=1;"";[.D31]) -> 0.0299288 | I31: of:=IF([.E31]=1;"";[.E31]) -> 0.0327935
A32: 8 | B32: strpbrk: &"inthe"{\0} &"aeiou"{\0} :=> &"inthe"{\0} | C32: 0.0333747 | D32: 0.0299288 | E32: 0.0333747 | G32: of:=IF([.C32]=1;"";[.C32]) -> 0.0333747 | H32: of:=IF([.D32]=1;"";[.D32]) -> 0.0299288 | I32: of:=IF([.E32]=1;"";[.E32]) -> 0.0333747
A33: 9 | B33: strpbrk: &"esthe"{\0} &"aeiou"{\0} :=> &"esthe"{\0} | C33: 0.0332025 | D33: 0.0299288 | E33: 0.0332025 | G33: of:=IF([.C33]=1;"";[.C33]) -> 0.0332025 | H33: of:=IF([.D33]=1;"";[.D33]) -> 0.0299288 | I33: of:=IF([.E33]=1;"";[.E33]) -> 0.0332025
A34: 10 | B34: strpbrk: &"athes"{\0} &"aeiou"{\0} :=> &"athes"{\0} | C34: 0.0333093 | D34: 0.0299288 | E34: 0.0333093 | G34: of:=IF([.C34]=1;"";[.C34]) -> 0.0333093 | H34: of:=IF([.D34]=1;"";[.D34]) -> 0.0299288 | I34: of:=IF([.E34]=1;"";[.E34]) -> 0.0333093