Sheet: strlen
A1: strlen: &"\x01"{\0,\0,\0,\0,\0} :=> 1; | J1: # | K1: Test Case | L1: N | P1: FINAL
A2: strlen: &"\x01\x01"{\0,\0,\0,\0} :=> 2; | J2: 1 | K2: strlen: &"q"{\0,p,r,e,\0} :=> 1 | L2: 1 | N2: of:=IF([.L2]=1;"";[.L2]) ->  | P2: of:=AVERAGE([.N2:.N6]) -> 0.099052825
A3: strlen: &"\x01\x01\x01"{\0,\0,\0} :=> 3; | J3: 2 | K3: strlen: &"me"{\0,p,r,\0} :=> 2 | L3: 0.22156 | N3: of:=IF([.L3]=1;"";[.L3]) -> 0.22156
A4: strlen: &"\x01\x01\x01\x01"{\0,\0} :=> 4; | J4: 3 | K4: strlen: &"cth"{\0,p,\0} :=> 3 | L4: 0.0905558 | N4: of:=IF([.L4]=1;"";[.L4]) -> 0.0905558
A5: strlen: &"\x01\x01\x01\x01\x01"{\0} :=> 5; | J5: 4 | K5: strlen: &"inth"{\0,\0} :=> 4 | L5: 0.050893 | N5: of:=IF([.L5]=1;"";[.L5]) -> 0.050893
A6: strnlen: &""{\0,\0,\0,\0,\0,\0} 6 :=> 0; 1; | J6: 5 | K6: strlen: &"esthe"{\0} :=> 5 | L6: 0.0332025 | N6: of:=IF([.L6]=1;"";[.L6]) -> 0.0332025
A7: strnlen: &"\x01"{\0,\0,\0,\0,\0} 6 :=> 1; | J7: 1 | K7: strnlen: &""{\0,p,r,e,s,\0} 6 :=> 0 | L7: 1 | N7: of:=IF([.L7]=1;"";[.L7]) ->  | P7: of:=AVERAGE([.N7:.N12]) -> 0.0981281
A8: strnlen: &"\x01\x01"{\0,\0,\0,\0} 6 :=> 2; | J8: 2 | K8: strnlen: &"z"{\0,p,r,e,\0} 6 :=> 1 | L8: 1 | N8: of:=IF([.L8]=1;"";[.L8]) -> 
A9: strnlen: &"\x01\x01\x01"{\0,\0,\0} 6 :=> 3; | J9: 3 | K9: strnlen: &"ut"{\0,p,r,\0} 6 :=> 2 | L9: 0.219808 | N9: of:=IF([.L9]=1;"";[.L9]) -> 0.219808
A10: strnlen: &"\x01\x01\x01\x01"{\0,\0} 6 :=> 4; | J10: 4 | K10: strnlen: &"cth"{\0,p,\0} 6 :=> 3 | L10: 0.0905558 | N10: of:=IF([.L10]=1;"";[.L10]) -> 0.0905558
A11: strnlen: &"\x01\x01\x01\x01\x01"{\0} 6 :=> 5; | J11: 5 | K11: strnlen: &"best"{\0,\0} 6 :=> 4 | L11: 0.0494569 | N11: of:=IF([.L11]=1;"";[.L11]) -> 0.0494569
J12: 6 | K12: strnlen: &"dinth"{\0} 6 :=> 5 | L12: 0.0326917 | N12: of:=IF([.L12]=1;"";[.L12]) -> 0.0326917

Sheet: strcmp
A1: # | B1: Test Case | C1: N1 | D1: N2 | L1: FINAL
A2: 1 | B2: strcmp: &"u"{\0,p,r,e,\0} &"u"{\0,p,r,e,\0} :=> 0 | C2: 1 | D2: 1 | F2: of:=IF([.C2]=1;"";[.C2]) ->  | G2: of:=IF([.D2]=1;"";[.D2]) ->  | H2: of:=IF([.E2]=1;"";[.E2]) ->   | I2: of:=AVERAGE([.F2:.F16]) -> 0.05114235 | J2: of:=AVERAGE([.G2:.G16]) -> 0.0498403 | L2: of:=AVERAGE([.I2:.J2]) -> 0.050491325
A3: 2 | B3: strcmp: &"fo"{\0,p,r,\0} &"fo"{\0,p,r,\0} :=> 0 | C3: 0.219808 | D3: 0.219808 | F3: of:=IF([.C3]=1;"";[.C3]) -> 0.219808 | G3: of:=IF([.D3]=1;"";[.D3]) -> 0.219808 | H3: of:=IF([.E3]=1;"";[.E3]) ->  
A4: 3 | B4: strcmp: &"yes"{\0,p,\0} &"yes"{\0,p,\0} :=> 0 | C4: 0.0884511 | D4: 0.0884511 | F4: of:=IF([.C4]=1;"";[.C4]) -> 0.0884511 | G4: of:=IF([.D4]=1;"";[.D4]) -> 0.0884511 | H4: of:=IF([.E4]=1;"";[.E4]) ->  
A5: 4 | B5: strcmp: &"mest"{\0,\0} &"mest"{\0,\0} :=> 0 | C5: 0.0497193 | D5: 0.0497193 | F5: of:=IF([.C5]=1;"";[.C5]) -> 0.0497193 | G5: of:=IF([.D5]=1;"";[.D5]) -> 0.0497193 | H5: of:=IF([.E5]=1;"";[.E5]) ->  
A6: 5 | B6: strcmp: &"besth"{\0} &"besth"{\0} :=> 0 | C6: 0.0325987 | D6: 0.0325987 | F6: of:=IF([.C6]=1;"";[.C6]) -> 0.0325987 | G6: of:=IF([.D6]=1;"";[.D6]) -> 0.0325987 | H6: of:=IF([.E6]=1;"";[.E6]) ->  
A7: 6 | B7: strcmp: &"sthes"{\0} &"sther"{\0} :=> 1 | C7: 0.0332025 | D7: 0.0333768 | F7: of:=IF([.C7]=1;"";[.C7]) -> 0.0332025 | G7: of:=IF([.D7]=1;"";[.D7]) -> 0.0333768 | H7: of:=IF([.E7]=1;"";[.E7]) ->  
A8: 7 | B8: strcmp: &"winth"{\0} &"wintx"{\0} :=> -1 | C8: 0.0326533 | D8: 0.0259331 | F8: of:=IF([.C8]=1;"";[.C8]) -> 0.0326533 | G8: of:=IF([.D8]=1;"";[.D8]) -> 0.0259331 | H8: of:=IF([.E8]=1;"";[.E8]) ->  
A9: 8 | B9: strcmp: &"gesth"{\0} &"gesdi"{\0} :=> 1 | C9: 0.0325231 | D9: 0.0301785 | F9: of:=IF([.C9]=1;"";[.C9]) -> 0.0325231 | G9: of:=IF([.D9]=1;"";[.D9]) -> 0.0301785 | H9: of:=IF([.E9]=1;"";[.E9]) ->  
A10: 9 | B10: strcmp: &"dinth"{\0} &"dinve"{\0} :=> -1 | C10: 0.0326917 | D10: 0.0311574 | F10: of:=IF([.C10]=1;"";[.C10]) -> 0.0326917 | G10: of:=IF([.D10]=1;"";[.D10]) -> 0.0311574 | H10: of:=IF([.E10]=1;"";[.E10]) ->  
A11: 10 | B11: strcmp: &"prest"{\0} &"prcth"{\0} :=> 1 | C11: 0.0323569 | D11: 0.0313088 | F11: of:=IF([.C11]=1;"";[.C11]) -> 0.0323569 | G11: of:=IF([.D11]=1;"";[.D11]) -> 0.0313088 | H11: of:=IF([.E11]=1;"";[.E11]) ->  
A12: 11 | B12: strcmp: &"cthes"{\0} &"ctxpr"{\0} :=> -1 | C12: 0.0327924 | D12: 0.0245696 | F12: of:=IF([.C12]=1;"";[.C12]) -> 0.0327924 | G12: of:=IF([.D12]=1;"";[.D12]) -> 0.0245696
A13: 12 | B13: strcmp: &"uthes"{\0} &"upres"{\0} :=> 1 | C13: 0.0329073 | D13: 0.0316063 | F13: of:=IF([.C13]=1;"";[.C13]) -> 0.0329073 | G13: of:=IF([.D13]=1;"";[.D13]) -> 0.0316063
A14: 13 | B14: strcmp: &"thest"{\0} &"tinth"{\0} :=> -1 | C14: 0.0332025 | D14: 0.0330617 | F14: of:=IF([.C14]=1;"";[.C14]) -> 0.0332025 | G14: of:=IF([.D14]=1;"";[.D14]) -> 0.0330617
A15: 14 | B15: strcmp: &"juthe"{\0} &"cthes"{\0} :=> 1 | C15: 0.0316047 | D15: 0.0327924 | F15: of:=IF([.C15]=1;"";[.C15]) -> 0.0316047 | G15: of:=IF([.D15]=1;"";[.D15]) -> 0.0327924
A16: 15 | B16: strcmp: &"lyest"{\0} &"sthes"{\0} :=> -1 | C16: 0.0314814 | D16: 0.0332025 | F16: of:=IF([.C16]=1;"";[.C16]) -> 0.0314814 | G16: of:=IF([.D16]=1;"";[.D16]) -> 0.0332025
A17: 1 | B17: strncmp: &""{\0,p,r,e,s,\0} &""{\0,p,r,e,s,\0} 5 :=> 0 | C17: 1 | D17: 1 | F17: of:=IF([.C17]=1;"";[.C17]) ->  | G17: of:=IF([.D17]=1;"";[.D17]) ->  | I17: of:=AVERAGE([.F17:.F32]) -> 0.0506746357142857 | J17: of:=AVERAGE([.G17:.G32]) -> 0.0490796071428571 | L17: of:=AVERAGE([.I17:.J17]) -> 0.0498771214285714
A18: 2 | B18: strncmp: &"b"{\0,p,r,e,\0} &"b"{\0,p,r,e,\0} 5 :=> 0 | C18: 1 | D18: 1 | F18: of:=IF([.C18]=1;"";[.C18]) ->  | G18: of:=IF([.D18]=1;"";[.D18]) -> 
A19: 3 | B19: strncmp: &"ze"{\0,p,r,\0} &"ze"{\0,p,r,\0} 5 :=> 0 | C19: 0.208818 | D19: 0.208818 | F19: of:=IF([.C19]=1;"";[.C19]) -> 0.208818 | G19: of:=IF([.D19]=1;"";[.D19]) -> 0.208818
A20: 4 | B20: strncmp: &"ore"{\0,p,\0} &"ore"{\0,p,\0} 5 :=> 0 | C20: 0.0917628 | D20: 0.0917628 | F20: of:=IF([.C20]=1;"";[.C20]) -> 0.0917628 | G20: of:=IF([.D20]=1;"";[.D20]) -> 0.0917628
A21: 5 | B21: strncmp: &"rest"{\0,\0} &"rest"{\0,\0} 5 :=> 0 | C21: 0.0502856 | D21: 0.0502856 | F21: of:=IF([.C21]=1;"";[.C21]) -> 0.0502856 | G21: of:=IF([.D21]=1;"";[.D21]) -> 0.0502856
A22: 6 | B22: strncmp: &"xpres"{\0} &"xpres"{\0} 5 :=> 0 | C22: 0.0312303 | D22: 0.0312303 | F22: of:=IF([.C22]=1;"";[.C22]) -> 0.0312303 | G22: of:=IF([.D22]=1;"";[.D22]) -> 0.0312303
A23: 7 | B23: strncmp: &"prest"{\0} &"presq"{\0} 5 :=> 1 | C23: 0.0323569 | D23: 0.0302557 | F23: of:=IF([.C23]=1;"";[.C23]) -> 0.0323569 | G23: of:=IF([.D23]=1;"";[.D23]) -> 0.0302557
A24: 8 | B24: strncmp: &"uthes"{\0} &"uthew"{\0} 5 :=> -1 | C24: 0.0329073 | D24: 0.0321963 | F24: of:=IF([.C24]=1;"";[.C24]) -> 0.0329073 | G24: of:=IF([.D24]=1;"";[.D24]) -> 0.0321963
A25: 9 | B25: strncmp: &"xpres"{\0} &"xprdi"{\0} 5 :=> 1 | C25: 0.0312303 | D25: 0.0300907 | F25: of:=IF([.C25]=1;"";[.C25]) -> 0.0312303 | G25: of:=IF([.D25]=1;"";[.D25]) -> 0.0300907
A26: 10 | B26: strncmp: &"inthe"{\0} &"intxp"{\0} 5 :=> -1 | C26: 0.0333747 | D26: 0.0253433 | F26: of:=IF([.C26]=1;"";[.C26]) -> 0.0333747 | G26: of:=IF([.D26]=1;"";[.D26]) -> 0.0253433
A27: 11 | B27: strncmp: &"gesth"{\0} &"gequt"{\0} 5 :=> 1 | C27: 0.0325231 | D27: 0.0295593 | F27: of:=IF([.C27]=1;"";[.C27]) -> 0.0325231 | G27: of:=IF([.D27]=1;"";[.D27]) -> 0.0295593
A28: 12 | B28: strncmp: &"prest"{\0} &"prges"{\0} 5 :=> -1 | C28: 0.0323569 | D28: 0.0310071 | F28: of:=IF([.C28]=1;"";[.C28]) -> 0.0323569 | G28: of:=IF([.D28]=1;"";[.D28]) -> 0.0310071
A29: 13 | B29: strncmp: &"inthe"{\0} &"ijuth"{\0} 5 :=> 1 | C29: 0.0333747 | D29: 0.0287171 | F29: of:=IF([.C29]=1;"";[.C29]) -> 0.0333747 | G29: of:=IF([.D29]=1;"";[.D29]) -> 0.0287171
A30: 14 | B30: strncmp: &"resth"{\0} &"ruthe"{\0} 5 :=> -1 | C30: 0.0330663 | D30: 0.0319925 | F30: of:=IF([.C30]=1;"";[.C30]) -> 0.0330663 | G30: of:=IF([.D30]=1;"";[.D30]) -> 0.0319925
A31: 15 | B31: strncmp: &"vesth"{\0} &"sthes"{\0} 5 :=> 1 | C31: 0.0327833 | D31: 0.0332025 | F31: of:=IF([.C31]=1;"";[.C31]) -> 0.0327833 | G31: of:=IF([.D31]=1;"";[.D31]) -> 0.0332025
A32: 16 | B32: strncmp: &"inthe"{\0} &"winth"{\0} 5 :=> -1 | C32: 0.0333747 | D32: 0.0326533 | F32: of:=IF([.C32]=1;"";[.C32]) -> 0.0333747 | G32: of:=IF([.D32]=1;"";[.D32]) -> 0.0326533
A33: 1 | B33: sysfs_streq: &""{\0,p,r,e,s,\0} &"prest"{\0} :=> \0 | C33: 1 | D33: 0.0323569 | F33: of:=IF([.C33]=1;"";[.C33]) ->  | G33: of:=IF([.D33]=1;"";[.D33]) -> 0.0323569 | I33: of:=AVERAGE([.F33:.F71]) -> 0.0770632068965517 | J33: of:=AVERAGE([.G33:.G71]) -> 0.0503540785714286 | L33: of:=AVERAGE([.I33:.J33]) -> 0.0637086427339902
A34: 2 | B34: sysfs_streq: &""{\0,p,r,e,s,\0} &"\n"{\0,b,e,s,\0} :=> \x01 | C34: 1 | F34: of:=IF([.C34]=1;"";[.C34]) ->  | G34: of:=IF([.D34]=1;"";[.D34]) ->  
A35: 3 | B35: sysfs_streq: &""{\0,p,r,e,s,\0} &"\nathe"{\0} :=> \0 | C35: 1 | F35: of:=IF([.C35]=1;"";[.C35]) ->  | G35: of:=IF([.D35]=1;"";[.D35]) ->  
A36: 4 | B36: sysfs_streq: &""{\0,p,r,e,s,\0} &""{\0,h,e,s,t,\0} :=> \x01 | C36: 1 | D36: 1 | F36: of:=IF([.C36]=1;"";[.C36]) ->  | G36: of:=IF([.D36]=1;"";[.D36]) -> 
A37: 5 | B37: sysfs_streq: &"kesth"{\0} &"thest"{\0} :=> \0 | C37: 0.0324076 | D37: 0.0332025 | F37: of:=IF([.C37]=1;"";[.C37]) -> 0.0324076 | G37: of:=IF([.D37]=1;"";[.D37]) -> 0.0332025
A38: 6 | B38: sysfs_streq: &"\n"{\0,p,r,e,\0} &""{\0,a,t,h,e,\0} :=> \x01 | C38: 1 | F38: of:=IF([.C38]=1;"";[.C38]) ->  | G38: of:=IF([.D38]=1;"";[.D38]) ->  
A39: 7 | B39: sysfs_streq: &"\n"{\0,a,t,h,\0} &"gesth"{\0} :=> \0 | C39: 0.0325231 | F39: of:=IF([.C39]=1;"";[.C39]) -> 0.0325231 | G39: of:=IF([.D39]=1;"";[.D39]) ->  
A40: 8 | B40: sysfs_streq: &"\nathe"{\0} &"uthes"{\0} :=> \0 | C40: 0.0329073 | F40: of:=IF([.C40]=1;"";[.C40]) -> 0.0329073 | G40: of:=IF([.D40]=1;"";[.D40]) ->  
A41: 9 | B41: sysfs_streq: &"l"{\0,p,r,e,\0} &"lyest"{\0} :=> \0 | C41: 1 | D41: 0.0314814 | F41: of:=IF([.C41]=1;"";[.C41]) ->  | G41: of:=IF([.D41]=1;"";[.D41]) -> 0.0314814
A42: 10 | B42: sysfs_streq: &"b"{\0,p,r,e,\0} &"b\n"{\0,a,t,\0} :=> \x01 | C42: 1 | F42: of:=IF([.C42]=1;"";[.C42]) ->  | G42: of:=IF([.D42]=1;"";[.D42]) ->  
A43: 11 | B43: sysfs_streq: &"f"{\0,p,r,e,\0} &"f\nath"{\0} :=> \0 | C43: 1 | F43: of:=IF([.C43]=1;"";[.C43]) ->  | G43: of:=IF([.D43]=1;"";[.D43]) ->  
A44: 12 | B44: sysfs_streq: &"k"{\0,p,r,e,\0} &"k"{\0,h,e,s,\0} :=> \x01 | C44: 1 | D44: 1 | F44: of:=IF([.C44]=1;"";[.C44]) ->  | G44: of:=IF([.D44]=1;"";[.D44]) -> 
A45: 13 | B45: sysfs_streq: &"winth"{\0} &"wmest"{\0} :=> \0 | C45: 0.0326533 | D45: 0.0297834 | F45: of:=IF([.C45]=1;"";[.C45]) -> 0.0326533 | G45: of:=IF([.D45]=1;"";[.D45]) -> 0.0297834
A46: 14 | B46: sysfs_streq: &"m\n"{\0,b,e,\0} &"m"{\0,b,e,s,\0} :=> \x01 | C46: 1 | F46: of:=IF([.C46]=1;"";[.C46]) ->  | G46: of:=IF([.D46]=1;"";[.D46]) ->  
A47: 15 | B47: sysfs_streq: &"k\n"{\0,b,e,\0} &"kesth"{\0} :=> \0 | C47: 0.0324076 | F47: of:=IF([.C47]=1;"";[.C47]) -> 0.0324076 | G47: of:=IF([.D47]=1;"";[.D47]) ->  
A48: 16 | B48: sysfs_streq: &"d\nath"{\0} &"dinth"{\0} :=> \0 | C48: 0.0326917 | F48: of:=IF([.C48]=1;"";[.C48]) -> 0.0326917 | G48: of:=IF([.D48]=1;"";[.D48]) ->  
A49: 17 | B49: sysfs_streq: &"ye"{\0,p,r,\0} &"yesth"{\0} :=> \0 | C49: 0.215236 | D49: 0.0322095 | F49: of:=IF([.C49]=1;"";[.C49]) -> 0.215236 | G49: of:=IF([.D49]=1;"";[.D49]) -> 0.0322095
A50: 18 | B50: sysfs_streq: &"ge"{\0,p,r,\0} &"ge\n"{\0,a,\0} :=> \x01 | C50: 0.218916 | F50: of:=IF([.C50]=1;"";[.C50]) -> 0.218916 | G50: of:=IF([.D50]=1;"";[.D50]) ->  
A51: 19 | B51: sysfs_streq: &"ve"{\0,p,r,\0} &"ve\nat"{\0} :=> \0 | C51: 0.221991 | F51: of:=IF([.C51]=1;"";[.C51]) -> 0.221991 | G51: of:=IF([.D51]=1;"";[.D51]) ->  
A52: 20 | B52: sysfs_streq: &"be"{\0,p,r,\0} &"be"{\0,b,e,\0} :=> \x01 | C52: 0.219808 | D52: 0.219808 | F52: of:=IF([.C52]=1;"";[.C52]) -> 0.219808 | G52: of:=IF([.D52]=1;"";[.D52]) -> 0.219808
A53: 21 | B53: sysfs_streq: &"zesth"{\0} &"zeyes"{\0} :=> \0 | C53: 0.0316571 | D53: 0.0300435 | F53: of:=IF([.C53]=1;"";[.C53]) -> 0.0316571 | G53: of:=IF([.D53]=1;"";[.D53]) -> 0.0300435
A54: 22 | B54: sysfs_streq: &"ve\n"{\0,b,\0} &"ve"{\0,b,e,\0} :=> \x01 | C54: 0.221991 | F54: of:=IF([.C54]=1;"";[.C54]) -> 0.221991 | G54: of:=IF([.D54]=1;"";[.D54]) ->  
A55: 23 | B55: sysfs_streq: &"at\n"{\0,b,\0} &"athes"{\0} :=> \0 | C55: 0.0333093 | F55: of:=IF([.C55]=1;"";[.C55]) -> 0.0333093 | G55: of:=IF([.D55]=1;"";[.D55]) ->  
A56: 24 | B56: sysfs_streq: &"in\nat"{\0} &"inthe"{\0} :=> \0 | C56: 0.0333747 | F56: of:=IF([.C56]=1;"";[.C56]) -> 0.0333747 | G56: of:=IF([.D56]=1;"";[.D56]) ->  
A57: 25 | B57: sysfs_streq: &"int"{\0,p,\0} &"inthe"{\0} :=> \0 | C57: 0.0917447 | D57: 0.0333747 | F57: of:=IF([.C57]=1;"";[.C57]) -> 0.0917447 | G57: of:=IF([.D57]=1;"";[.D57]) -> 0.0333747
A58: 26 | B58: sysfs_streq: &"din"{\0,p,\0} &"din\n"{\0,\0} :=> \x01 | C58: 0.090448 | F58: of:=IF([.C58]=1;"";[.C58]) -> 0.090448 | G58: of:=IF([.D58]=1;"";[.D58]) ->  
A59: 27 | B59: sysfs_streq: &"mes"{\0,p,\0} &"mes\na"{\0} :=> \0 | C59: 0.0905241 | F59: of:=IF([.C59]=1;"";[.C59]) -> 0.0905241 | G59: of:=IF([.D59]=1;"";[.D59]) ->  
A60: 28 | B60: sysfs_streq: &"zes"{\0,p,\0} &"zes"{\0,h,\0} :=> \x01 | C60: 0.0863349 | D60: 0.0863349 | F60: of:=IF([.C60]=1;"";[.C60]) -> 0.0863349 | G60: of:=IF([.D60]=1;"";[.D60]) -> 0.0863349
A61: 29 | B61: sysfs_streq: &"yesth"{\0} &"yesdi"{\0} :=> \0 | C61: 0.0322095 | D61: 0.0298875 | F61: of:=IF([.C61]=1;"";[.C61]) -> 0.0322095 | G61: of:=IF([.D61]=1;"";[.D61]) -> 0.0298875
A62: 30 | B62: sysfs_streq: &"nth\n"{\0,\0} &"nth"{\0,a,\0} :=> \x01 | C62: 0.0920054 | F62: of:=IF([.C62]=1;"";[.C62]) -> 0.0920054 | G62: of:=IF([.D62]=1;"";[.D62]) ->  
A63: 31 | B63: sysfs_streq: &"zes\n"{\0,\0} &"zesth"{\0} :=> \0 | C63: 0.0316571 | F63: of:=IF([.C63]=1;"";[.C63]) -> 0.0316571 | G63: of:=IF([.D63]=1;"";[.D63]) ->  
A64: 32 | B64: sysfs_streq: &"res\na"{\0} &"resth"{\0} :=> \0 | C64: 0.0330663 | F64: of:=IF([.C64]=1;"";[.C64]) -> 0.0330663 | G64: of:=IF([.D64]=1;"";[.D64]) ->  
A65: 33 | B65: sysfs_streq: &"inth"{\0,\0} &"inthe"{\0} :=> \0 | C65: 0.050893 | D65: 0.0333747 | F65: of:=IF([.C65]=1;"";[.C65]) -> 0.050893 | G65: of:=IF([.D65]=1;"";[.D65]) -> 0.0333747
A66: 34 | B66: sysfs_streq: &"ores"{\0,\0} &"ores\n"{\0} :=> \x01 | C66: 0.0504117 | F66: of:=IF([.C66]=1;"";[.C66]) -> 0.0504117 | G66: of:=IF([.D66]=1;"";[.D66]) ->  
A67: 35 | B67: sysfs_streq: &"kest"{\0,\0} &"kest"{\0,\0} :=> \x01 | C67: 0.0491188 | D67: 0.0491188 | F67: of:=IF([.C67]=1;"";[.C67]) -> 0.0491188 | G67: of:=IF([.D67]=1;"";[.D67]) -> 0.0491188
A68: 36 | B68: sysfs_streq: &"gesth"{\0} &"gestl"{\0} :=> \0 | C68: 0.0325231 | D68: 0.0312344 | F68: of:=IF([.C68]=1;"";[.C68]) -> 0.0325231 | G68: of:=IF([.D68]=1;"";[.D68]) -> 0.0312344
A69: 37 | B69: sysfs_streq: &"zest\n"{\0} &"zest"{\0,\0} :=> \x01 | C69: 0.0477944 | F69: of:=IF([.C69]=1;"";[.C69]) -> 0.0477944 | G69: of:=IF([.D69]=1;"";[.D69]) ->  
A70: 38 | B70: sysfs_streq: &"lyes\n"{\0} &"lyest"{\0} :=> \0 | C70: 0.0314814 | F70: of:=IF([.C70]=1;"";[.C70]) -> 0.0314814 | G70: of:=IF([.D70]=1;"";[.D70]) ->  
A71: 39 | B71: sysfs_streq: &"mesth"{\0} &"mesth"{\0} :=> \x01 | C71: 0.0327469 | D71: 0.0327469 | F71: of:=IF([.C71]=1;"";[.C71]) -> 0.0327469 | G71: of:=IF([.D71]=1;"";[.D71]) -> 0.0327469

Sheet: strcpy
A1: # | B1: Test Case | C1: N1 | D1: N2 | E1: N3 | O1: FINAL
A2: 1 | B2: strcpy: &""{\0,\x01,\x01,\x01,\x01,\x01} &"y"{\0,p,r,e,\0} :=> &"y"{\0,p,r,e,\0} | C2: 1 | D2: 1 | E2: 1 | G2: of:=IF([.C2]=1;"";[.C2]) ->  | H2: of:=IF([.D2]=1;"";[.D2]) ->  | I2: of:=IF([.E2]=1;"";[.E2]) ->  | K2: of:=AVERAGE([.G2:.G36]) -> 0.0977069541666666 | L2: of:=AVERAGE([.H2:.H36]) -> 0.0994465083333333 | M2: of:=AVERAGE([.I2:.I36]) -> 0.0994465083333333 | O2: of:=AVERAGE([.K2:.M2]) -> 0.0988666569444444
A3: 2 | B3: strcpy: &""{\0,\x01,\x01,\x01,\x01,\x01} &"or"{\0,p,r,\0} :=> &"or"{\0,p,r,\0} | C3: 1 | D3: 0.224112 | E3: 0.224112 | G3: of:=IF([.C3]=1;"";[.C3]) ->  | H3: of:=IF([.D3]=1;"";[.D3]) -> 0.224112 | I3: of:=IF([.E3]=1;"";[.E3]) -> 0.224112
A4: 3 | B4: strcpy: &""{\0,\x01,\x01,\x01,\x01,\x01} &"bes"{\0,p,\0} :=> &"bes"{\0,p,\0} | C4: 1 | D4: 0.0899511 | E4: 0.0899511 | G4: of:=IF([.C4]=1;"";[.C4]) ->  | H4: of:=IF([.D4]=1;"";[.D4]) -> 0.0899511 | I4: of:=IF([.E4]=1;"";[.E4]) -> 0.0899511
A5: 4 | B5: strcpy: &""{\0,\x01,\x01,\x01,\x01,\x01} &"gest"{\0,\0} :=> &"gest"{\0,\0} | C5: 1 | D5: 0.049323 | E5: 0.049323 | G5: of:=IF([.C5]=1;"";[.C5]) ->  | H5: of:=IF([.D5]=1;"";[.D5]) -> 0.049323 | I5: of:=IF([.E5]=1;"";[.E5]) -> 0.049323
A6: 5 | B6: strcpy: &""{\0,\x01,\x01,\x01,\x01,\x01} &"esthe"{\0} :=> &"esthe"{\0} | C6: 1 | D6: 0.0332025 | E6: 0.0332025 | G6: of:=IF([.C6]=1;"";[.C6]) ->  | H6: of:=IF([.D6]=1;"";[.D6]) -> 0.0332025 | I6: of:=IF([.E6]=1;"";[.E6]) -> 0.0332025
A7: 6 | B7: strcpy: &"f"{\0,\x01,\x01,\x01,\x01} &""{\0,p,r,e,s,\0} :=> &""{\0,\0,p,r,e,\0} | C7: 1 | D7: 1 | E7: 1 | G7: of:=IF([.C7]=1;"";[.C7]) ->  | H7: of:=IF([.D7]=1;"";[.D7]) ->  | I7: of:=IF([.E7]=1;"";[.E7]) -> 
A8: 7 | B8: strcpy: &"r"{\0,\x01,\x01,\x01,\x01} &"d"{\0,p,r,e,\0} :=> &"d"{\0,p,r,e,\0} | C8: 1 | D8: 1 | E8: 1 | G8: of:=IF([.C8]=1;"";[.C8]) ->  | H8: of:=IF([.D8]=1;"";[.D8]) ->  | I8: of:=IF([.E8]=1;"";[.E8]) -> 
A9: 8 | B9: strcpy: &"s"{\0,\x01,\x01,\x01,\x01} &"he"{\0,p,r,\0} :=> &"he"{\0,p,r,\0} | C9: 1 | D9: 0.226983 | E9: 0.226983 | G9: of:=IF([.C9]=1;"";[.C9]) ->  | H9: of:=IF([.D9]=1;"";[.D9]) -> 0.226983 | I9: of:=IF([.E9]=1;"";[.E9]) -> 0.226983
A10: 9 | B10: strcpy: &"u"{\0,\x01,\x01,\x01,\x01} &"uth"{\0,p,\0} :=> &"uth"{\0,p,\0} | C10: 1 | D10: 0.0910004 | E10: 0.0910004 | G10: of:=IF([.C10]=1;"";[.C10]) ->  | H10: of:=IF([.D10]=1;"";[.D10]) -> 0.0910004 | I10: of:=IF([.E10]=1;"";[.E10]) -> 0.0910004
A11: 10 | B11: strcpy: &"g"{\0,\x01,\x01,\x01,\x01} &"kest"{\0,\0} :=> &"kest"{\0,\0} | C11: 1 | D11: 0.0491188 | E11: 0.0491188 | G11: of:=IF([.C11]=1;"";[.C11]) ->  | H11: of:=IF([.D11]=1;"";[.D11]) -> 0.0491188 | I11: of:=IF([.E11]=1;"";[.E11]) -> 0.0491188
A12: 11 | B12: strcpy: &"p"{\0,\x01,\x01,\x01,\x01} &"mesth"{\0} :=> &"mesth"{\0} | C12: 1 | D12: 0.0327469 | E12: 0.0327469 | G12: of:=IF([.C12]=1;"";[.C12]) ->  | H12: of:=IF([.D12]=1;"";[.D12]) -> 0.0327469 | I12: of:=IF([.E12]=1;"";[.E12]) -> 0.0327469
A13: 12 | B13: strcpy: &"at"{\0,\x01,\x01,\x01} &""{\0,p,r,e,s,\0} :=> &""{\0,t,\0,p,r,\0} | C13: 0.224529 | D13: 1 | E13: 1 | G13: of:=IF([.C13]=1;"";[.C13]) -> 0.224529 | H13: of:=IF([.D13]=1;"";[.D13]) ->  | I13: of:=IF([.E13]=1;"";[.E13]) -> 
A14: 13 | B14: strcpy: &"ut"{\0,\x01,\x01,\x01} &"x"{\0,p,r,e,\0} :=> &"x"{\0,\0,p,r,\0} | C14: 0.219808 | D14: 1 | E14: 1 | G14: of:=IF([.C14]=1;"";[.C14]) -> 0.219808 | H14: of:=IF([.D14]=1;"";[.D14]) ->  | I14: of:=IF([.E14]=1;"";[.E14]) -> 
A15: 14 | B15: strcpy: &"he"{\0,\x01,\x01,\x01} &"nt"{\0,p,r,\0} :=> &"nt"{\0,p,r,\0} | C15: 0.226983 | D15: 0.222847 | E15: 0.222847 | G15: of:=IF([.C15]=1;"";[.C15]) -> 0.226983 | H15: of:=IF([.D15]=1;"";[.D15]) -> 0.222847 | I15: of:=IF([.E15]=1;"";[.E15]) -> 0.222847
A16: 15 | B16: strcpy: &"ju"{\0,\x01,\x01,\x01} &"est"{\0,p,\0} :=> &"est"{\0,p,\0} | C16: 0.208818 | D16: 0.091083 | E16: 0.091083 | G16: of:=IF([.C16]=1;"";[.C16]) -> 0.208818 | H16: of:=IF([.D16]=1;"";[.D16]) -> 0.091083 | I16: of:=IF([.E16]=1;"";[.E16]) -> 0.091083
A17: 16 | B17: strcpy: &"ct"{\0,\x01,\x01,\x01} &"zest"{\0,\0} :=> &"zest"{\0,\0} | C17: 0.218466 | D17: 0.0477944 | E17: 0.0477944 | G17: of:=IF([.C17]=1;"";[.C17]) -> 0.218466 | H17: of:=IF([.D17]=1;"";[.D17]) -> 0.0477944 | I17: of:=IF([.E17]=1;"";[.E17]) -> 0.0477944
A18: 17 | B18: strcpy: &"ze"{\0,\x01,\x01,\x01} &"resth"{\0} :=> &"resth"{\0} | C18: 0.208818 | D18: 0.0330663 | E18: 0.0330663 | G18: of:=IF([.C18]=1;"";[.C18]) -> 0.208818 | H18: of:=IF([.D18]=1;"";[.D18]) -> 0.0330663 | I18: of:=IF([.E18]=1;"";[.E18]) -> 0.0330663
A19: 18 | B19: strcpy: &"win"{\0,\x01,\x01} &""{\0,p,r,e,s,\0} :=> &""{\0,i,n,\0,p,\0} | C19: 0.0902992 | D19: 1 | E19: 1 | G19: of:=IF([.C19]=1;"";[.C19]) -> 0.0902992 | H19: of:=IF([.D19]=1;"";[.D19]) ->  | I19: of:=IF([.E19]=1;"";[.E19]) -> 
A20: 19 | B20: strcpy: &"zes"{\0,\x01,\x01} &"m"{\0,p,r,e,\0} :=> &"m"{\0,s,\0,p,\0} | C20: 0.0863349 | D20: 1 | E20: 1 | G20: of:=IF([.C20]=1;"";[.C20]) -> 0.0863349 | H20: of:=IF([.D20]=1;"";[.D20]) ->  | I20: of:=IF([.E20]=1;"";[.E20]) -> 
A21: 20 | B21: strcpy: &"sth"{\0,\x01,\x01} &"es"{\0,p,r,\0} :=> &"es"{\0,\0,p,\0} | C21: 0.0921454 | D21: 0.224112 | E21: 0.224112 | G21: of:=IF([.C21]=1;"";[.C21]) -> 0.0921454 | H21: of:=IF([.D21]=1;"";[.D21]) -> 0.224112 | I21: of:=IF([.E21]=1;"";[.E21]) -> 0.224112
A22: 21 | B22: strcpy: &"cth"{\0,\x01,\x01} &"uth"{\0,p,\0} :=> &"uth"{\0,p,\0} | C22: 0.0905558 | D22: 0.0910004 | E22: 0.0910004 | G22: of:=IF([.C22]=1;"";[.C22]) -> 0.0905558 | H22: of:=IF([.D22]=1;"";[.D22]) -> 0.0910004 | I22: of:=IF([.E22]=1;"";[.E22]) -> 0.0910004
A23: 22 | B23: strcpy: &"win"{\0,\x01,\x01} &"inth"{\0,\0} :=> &"inth"{\0,\0} | C23: 0.0902992 | D23: 0.050893 | E23: 0.050893 | G23: of:=IF([.C23]=1;"";[.C23]) -> 0.0902992 | H23: of:=IF([.D23]=1;"";[.D23]) -> 0.050893 | I23: of:=IF([.E23]=1;"";[.E23]) -> 0.050893
A24: 23 | B24: strcpy: &"res"{\0,\x01,\x01} &"prest"{\0} :=> &"prest"{\0} | C24: 0.0917628 | D24: 0.0323569 | E24: 0.0323569 | G24: of:=IF([.C24]=1;"";[.C24]) -> 0.0917628 | H24: of:=IF([.D24]=1;"";[.D24]) -> 0.0323569 | I24: of:=IF([.E24]=1;"";[.E24]) -> 0.0323569
A25: 24 | B25: strcpy: &"cthe"{\0,\x01} &""{\0,p,r,e,s,\0} :=> &""{\0,t,h,e,\0,\0} | C25: 0.0502835 | D25: 1 | E25: 1 | G25: of:=IF([.C25]=1;"";[.C25]) -> 0.0502835 | H25: of:=IF([.D25]=1;"";[.D25]) ->  | I25: of:=IF([.E25]=1;"";[.E25]) -> 
A26: 25 | B26: strcpy: &"cthe"{\0,\x01} &"y"{\0,p,r,e,\0} :=> &"y"{\0,h,e,\0,\0} | C26: 0.0502835 | D26: 1 | E26: 1 | G26: of:=IF([.C26]=1;"";[.C26]) -> 0.0502835 | H26: of:=IF([.D26]=1;"";[.D26]) ->  | I26: of:=IF([.E26]=1;"";[.E26]) -> 
A27: 26 | B27: strcpy: &"nthe"{\0,\x01} &"or"{\0,p,r,\0} :=> &"or"{\0,e,\0,\0} | C27: 0.0509534 | D27: 0.224112 | E27: 0.224112 | G27: of:=IF([.C27]=1;"";[.C27]) -> 0.0509534 | H27: of:=IF([.D27]=1;"";[.D27]) -> 0.224112 | I27: of:=IF([.E27]=1;"";[.E27]) -> 0.224112
A28: 27 | B28: strcpy: &"wint"{\0,\x01} &"est"{\0,p,\0} :=> &"est"{\0,\0,\0} | C28: 0.0495535 | D28: 0.091083 | E28: 0.091083 | G28: of:=IF([.C28]=1;"";[.C28]) -> 0.0495535 | H28: of:=IF([.D28]=1;"";[.D28]) -> 0.091083 | I28: of:=IF([.E28]=1;"";[.E28]) -> 0.091083
A29: 28 | B29: strcpy: &"lyes"{\0,\x01} &"athe"{\0,\0} :=> &"athe"{\0,\0} | C29: 0.0480665 | D29: 0.0512095 | E29: 0.0512095 | G29: of:=IF([.C29]=1;"";[.C29]) -> 0.0480665 | H29: of:=IF([.D29]=1;"";[.D29]) -> 0.0512095 | I29: of:=IF([.E29]=1;"";[.E29]) -> 0.0512095
A30: 29 | B30: strcpy: &"cthe"{\0,\x01} &"vesth"{\0} :=> &"vesth"{\0} | C30: 0.0502835 | D30: 0.0327833 | E30: 0.0327833 | G30: of:=IF([.C30]=1;"";[.C30]) -> 0.0502835 | H30: of:=IF([.D30]=1;"";[.D30]) -> 0.0327833 | I30: of:=IF([.E30]=1;"";[.E30]) -> 0.0327833
A31: 30 | B31: strcpy: &"dinth"{\0} &""{\0,p,r,e,s,\0} :=> &""{\0,i,n,t,h,\0} | C31: 0.0326917 | D31: 1 | E31: 1 | G31: of:=IF([.C31]=1;"";[.C31]) -> 0.0326917 | H31: of:=IF([.D31]=1;"";[.D31]) ->  | I31: of:=IF([.E31]=1;"";[.E31]) -> 
A32: 31 | B32: strcpy: &"lyest"{\0} &"x"{\0,p,r,e,\0} :=> &"x"{\0,e,s,t,\0} | C32: 0.0314814 | D32: 1 | E32: 1 | G32: of:=IF([.C32]=1;"";[.C32]) -> 0.0314814 | H32: of:=IF([.D32]=1;"";[.D32]) ->  | I32: of:=IF([.E32]=1;"";[.E32]) -> 
A33: 32 | B33: strcpy: &"besth"{\0} &"es"{\0,p,r,\0} :=> &"es"{\0,t,h,\0} | C33: 0.0325987 | D33: 0.224112 | E33: 0.224112 | G33: of:=IF([.C33]=1;"";[.C33]) -> 0.0325987 | H33: of:=IF([.D33]=1;"";[.D33]) -> 0.224112 | I33: of:=IF([.E33]=1;"";[.E33]) -> 0.224112
A34: 33 | B34: strcpy: &"inthe"{\0} &"ath"{\0,p,\0} :=> &"ath"{\0,e,\0} | C34: 0.0333747 | D34: 0.0925605 | E34: 0.0925605 | G34: of:=IF([.C34]=1;"";[.C34]) -> 0.0333747 | H34: of:=IF([.D34]=1;"";[.D34]) -> 0.0925605 | I34: of:=IF([.E34]=1;"";[.E34]) -> 0.0925605
A35: 34 | B35: strcpy: &"inthe"{\0} &"vest"{\0,\0} :=> &"vest"{\0,\0} | C35: 0.0333747 | D35: 0.0497838 | E35: 0.0497838 | G35: of:=IF([.C35]=1;"";[.C35]) -> 0.0333747 | H35: of:=IF([.D35]=1;"";[.D35]) -> 0.0497838 | I35: of:=IF([.E35]=1;"";[.E35]) -> 0.0497838
A36: 35 | B36: strcpy: &"thest"{\0} &"lyest"{\0} :=> &"lyest"{\0} | C36: 0.0332025 | D36: 0.0314814 | E36: 0.0314814 | G36: of:=IF([.C36]=1;"";[.C36]) -> 0.0332025 | H36: of:=IF([.D36]=1;"";[.D36]) -> 0.0314814 | I36: of:=IF([.E36]=1;"";[.E36]) -> 0.0314814
A37: 1 | B37: strncpy: &""{\0,\x01,\x01,\x01,\x01,\x01} &""{\0,p,r,e,s,\0} 5 :=> &""{\0,\0,\0,\0,\0,\0} | C37: 1 | D37: 1 | E37: 1 | G37: of:=IF([.C37]=1;"";[.C37]) ->  | H37: of:=IF([.D37]=1;"";[.D37]) ->  | I37: of:=IF([.E37]=1;"";[.E37]) ->  | K37: of:=AVERAGE([.G37:.G72]) -> 0.0978101291666667 | L37: of:=AVERAGE([.H37:.H72]) -> 0.0985689875 | M37: of:=AVERAGE([.I37:.I72]) -> 0.0985689875 | O37: of:=AVERAGE([.K37:.M37]) -> 0.0983160347222222
A38: 2 | B38: strncpy: &""{\0,\x01,\x01,\x01,\x01,\x01} &"s"{\0,p,r,e,\0} 5 :=> &"s"{\0,\0,\0,\0,\0} | C38: 1 | D38: 1 | E38: 1 | G38: of:=IF([.C38]=1;"";[.C38]) ->  | H38: of:=IF([.D38]=1;"";[.D38]) ->  | I38: of:=IF([.E38]=1;"";[.E38]) -> 
A39: 3 | B39: strncpy: &""{\0,\x01,\x01,\x01,\x01,\x01} &"fo"{\0,p,r,\0} 5 :=> &"fo"{\0,\0,\0,\0} | C39: 1 | D39: 0.219808 | E39: 0.219808 | G39: of:=IF([.C39]=1;"";[.C39]) ->  | H39: of:=IF([.D39]=1;"";[.D39]) -> 0.219808 | I39: of:=IF([.E39]=1;"";[.E39]) -> 0.219808
A40: 4 | B40: strncpy: &""{\0,\x01,\x01,\x01,\x01,\x01} &"hes"{\0,p,\0} 5 :=> &"hes"{\0,\0,\0} | C40: 1 | D40: 0.0922924 | E40: 0.0922924 | G40: of:=IF([.C40]=1;"";[.C40]) ->  | H40: of:=IF([.D40]=1;"";[.D40]) -> 0.0922924 | I40: of:=IF([.E40]=1;"";[.E40]) -> 0.0922924
A41: 5 | B41: strncpy: &""{\0,\x01,\x01,\x01,\x01,\x01} &"nthe"{\0,\0} 5 :=> &"nthe"{\0,\0} | C41: 1 | D41: 0.0509534 | E41: 0.0509534 | G41: of:=IF([.C41]=1;"";[.C41]) ->  | H41: of:=IF([.D41]=1;"";[.D41]) -> 0.0509534 | I41: of:=IF([.E41]=1;"";[.E41]) -> 0.0509534
A42: 6 | B42: strncpy: &""{\0,\x01,\x01,\x01,\x01,\x01} &"resth"{\0} 5 :=> &"resth"{\0} | C42: 1 | D42: 0.0330663 | E42: 0.0330663 | G42: of:=IF([.C42]=1;"";[.C42]) ->  | H42: of:=IF([.D42]=1;"";[.D42]) -> 0.0330663 | I42: of:=IF([.E42]=1;"";[.E42]) -> 0.0330663
A43: 7 | B43: strncpy: &"r"{\0,\x01,\x01,\x01,\x01} &""{\0,p,r,e,s,\0} 5 :=> &""{\0,\0,\0,\0,\0,\0} | C43: 1 | D43: 1 | E43: 1 | G43: of:=IF([.C43]=1;"";[.C43]) ->  | H43: of:=IF([.D43]=1;"";[.D43]) ->  | I43: of:=IF([.E43]=1;"";[.E43]) -> 
A44: 8 | B44: strncpy: &"x"{\0,\x01,\x01,\x01,\x01} &"k"{\0,p,r,e,\0} 5 :=> &"k"{\0,\0,\0,\0,\0} | C44: 1 | D44: 1 | E44: 1 | G44: of:=IF([.C44]=1;"";[.C44]) ->  | H44: of:=IF([.D44]=1;"";[.D44]) ->  | I44: of:=IF([.E44]=1;"";[.E44]) -> 
A45: 9 | B45: strncpy: &"c"{\0,\x01,\x01,\x01,\x01} &"pr"{\0,p,r,\0} 5 :=> &"pr"{\0,\0,\0,\0} | C45: 1 | D45: 0.218916 | E45: 0.218916 | G45: of:=IF([.C45]=1;"";[.C45]) ->  | H45: of:=IF([.D45]=1;"";[.D45]) -> 0.218916 | I45: of:=IF([.E45]=1;"";[.E45]) -> 0.218916
A46: 10 | B46: strncpy: &"p"{\0,\x01,\x01,\x01,\x01} &"jut"{\0,p,\0} 5 :=> &"jut"{\0,\0,\0} | C46: 1 | D46: 0.0850061 | E46: 0.0850061 | G46: of:=IF([.C46]=1;"";[.C46]) ->  | H46: of:=IF([.D46]=1;"";[.D46]) -> 0.0850061 | I46: of:=IF([.E46]=1;"";[.E46]) -> 0.0850061
A47: 11 | B47: strncpy: &"e"{\0,\x01,\x01,\x01,\x01} &"pres"{\0,\0} 5 :=> &"pres"{\0,\0} | C47: 1 | D47: 0.0496296 | E47: 0.0496296 | G47: of:=IF([.C47]=1;"";[.C47]) ->  | H47: of:=IF([.D47]=1;"";[.D47]) -> 0.0496296 | I47: of:=IF([.E47]=1;"";[.E47]) -> 0.0496296
A48: 12 | B48: strncpy: &"y"{\0,\x01,\x01,\x01,\x01} &"kesth"{\0} 5 :=> &"kesth"{\0} | C48: 1 | D48: 0.0324076 | E48: 0.0324076 | G48: of:=IF([.C48]=1;"";[.C48]) ->  | H48: of:=IF([.D48]=1;"";[.D48]) -> 0.0324076 | I48: of:=IF([.E48]=1;"";[.E48]) -> 0.0324076
A49: 13 | B49: strncpy: &"or"{\0,\x01,\x01,\x01} &""{\0,p,r,e,s,\0} 5 :=> &""{\0,\0,\0,\0,\0,\0} | C49: 0.224112 | D49: 1 | E49: 1 | G49: of:=IF([.C49]=1;"";[.C49]) -> 0.224112 | H49: of:=IF([.D49]=1;"";[.D49]) ->  | I49: of:=IF([.E49]=1;"";[.E49]) -> 
A50: 14 | B50: strncpy: &"ke"{\0,\x01,\x01,\x01} &"h"{\0,p,r,e,\0} 5 :=> &"h"{\0,\0,\0,\0,\0} | C50: 0.217558 | D50: 1 | E50: 1 | G50: of:=IF([.C50]=1;"";[.C50]) -> 0.217558 | H50: of:=IF([.D50]=1;"";[.D50]) ->  | I50: of:=IF([.E50]=1;"";[.E50]) -> 
A51: 15 | B51: strncpy: &"di"{\0,\x01,\x01,\x01} &"es"{\0,p,r,\0} 5 :=> &"es"{\0,\0,\0,\0} | C51: 0.218916 | D51: 0.224112 | E51: 0.224112 | G51: of:=IF([.C51]=1;"";[.C51]) -> 0.218916 | H51: of:=IF([.D51]=1;"";[.D51]) -> 0.224112 | I51: of:=IF([.E51]=1;"";[.E51]) -> 0.224112
A52: 16 | B52: strncpy: &"xp"{\0,\x01,\x01,\x01} &"ore"{\0,p,\0} 5 :=> &"ore"{\0,\0,\0} | C52: 0.209845 | D52: 0.0917628 | E52: 0.0917628 | G52: of:=IF([.C52]=1;"";[.C52]) -> 0.209845 | H52: of:=IF([.D52]=1;"";[.D52]) -> 0.0917628 | I52: of:=IF([.E52]=1;"";[.E52]) -> 0.0917628
A53: 17 | B53: strncpy: &"es"{\0,\x01,\x01,\x01} &"nthe"{\0,\0} 5 :=> &"nthe"{\0,\0} | C53: 0.224112 | D53: 0.0509534 | E53: 0.0509534 | G53: of:=IF([.C53]=1;"";[.C53]) -> 0.224112 | H53: of:=IF([.D53]=1;"";[.D53]) -> 0.0509534 | I53: of:=IF([.E53]=1;"";[.E53]) -> 0.0509534
A54: 18 | B54: strncpy: &"di"{\0,\x01,\x01,\x01} &"sthes"{\0} 5 :=> &"sthes"{\0} | C54: 0.218916 | D54: 0.0332025 | E54: 0.0332025 | G54: of:=IF([.C54]=1;"";[.C54]) -> 0.218916 | H54: of:=IF([.D54]=1;"";[.D54]) -> 0.0332025 | I54: of:=IF([.E54]=1;"";[.E54]) -> 0.0332025
A55: 19 | B55: strncpy: &"bes"{\0,\x01,\x01} &""{\0,p,r,e,s,\0} 5 :=> &""{\0,\0,\0,\0,\0,\0} | C55: 0.0899511 | D55: 1 | E55: 1 | G55: of:=IF([.C55]=1;"";[.C55]) -> 0.0899511 | H55: of:=IF([.D55]=1;"";[.D55]) ->  | I55: of:=IF([.E55]=1;"";[.E55]) -> 
A56: 20 | B56: strncpy: &"hes"{\0,\x01,\x01} &"s"{\0,p,r,e,\0} 5 :=> &"s"{\0,\0,\0,\0,\0} | C56: 0.0922924 | D56: 1 | E56: 1 | G56: of:=IF([.C56]=1;"";[.C56]) -> 0.0922924 | H56: of:=IF([.D56]=1;"";[.D56]) ->  | I56: of:=IF([.E56]=1;"";[.E56]) -> 
A57: 21 | B57: strncpy: &"kes"{\0,\x01,\x01} &"th"{\0,p,r,\0} 5 :=> &"th"{\0,\0,\0,\0} | C57: 0.0892137 | D57: 0.227384 | E57: 0.227384 | G57: of:=IF([.C57]=1;"";[.C57]) -> 0.0892137 | H57: of:=IF([.D57]=1;"";[.D57]) -> 0.227384 | I57: of:=IF([.E57]=1;"";[.E57]) -> 0.227384
A58: 22 | B58: strncpy: &"pre"{\0,\x01,\x01} &"yes"{\0,p,\0} 5 :=> &"yes"{\0,\0,\0} | C58: 0.090057 | D58: 0.0884511 | E58: 0.0884511 | G58: of:=IF([.C58]=1;"";[.C58]) -> 0.090057 | H58: of:=IF([.D58]=1;"";[.D58]) -> 0.0884511 | I58: of:=IF([.E58]=1;"";[.E58]) -> 0.0884511
A59: 23 | B59: strncpy: &"jut"{\0,\x01,\x01} &"inth"{\0,\0} 5 :=> &"inth"{\0,\0} | C59: 0.0850061 | D59: 0.050893 | E59: 0.050893 | G59: of:=IF([.C59]=1;"";[.C59]) -> 0.0850061 | H59: of:=IF([.D59]=1;"";[.D59]) -> 0.050893 | I59: of:=IF([.E59]=1;"";[.E59]) -> 0.050893
A60: 24 | B60: strncpy: &"pre"{\0,\x01,\x01} &"xpres"{\0} 5 :=> &"xpres"{\0} | C60: 0.090057 | D60: 0.0312303 | E60: 0.0312303 | G60: of:=IF([.C60]=1;"";[.C60]) -> 0.090057 | H60: of:=IF([.D60]=1;"";[.D60]) -> 0.0312303 | I60: of:=IF([.E60]=1;"";[.E60]) -> 0.0312303
A61: 25 | B61: strncpy: &"juth"{\0,\x01} &""{\0,p,r,e,s,\0} 5 :=> &""{\0,\0,\0,\0,\0,\0} | C61: 0.0477583 | D61: 1 | E61: 1 | G61: of:=IF([.C61]=1;"";[.C61]) -> 0.0477583 | H61: of:=IF([.D61]=1;"";[.D61]) ->  | I61: of:=IF([.E61]=1;"";[.E61]) -> 
A62: 26 | B62: strncpy: &"thes"{\0,\x01} &"w"{\0,p,r,e,\0} 5 :=> &"w"{\0,\0,\0,\0,\0} | C62: 0.051146 | D62: 1 | E62: 1 | G62: of:=IF([.C62]=1;"";[.C62]) -> 0.051146 | H62: of:=IF([.D62]=1;"";[.D62]) ->  | I62: of:=IF([.E62]=1;"";[.E62]) -> 
A63: 27 | B63: strncpy: &"athe"{\0,\x01} &"ct"{\0,p,r,\0} 5 :=> &"ct"{\0,\0,\0,\0} | C63: 0.0512095 | D63: 0.218466 | E63: 0.218466 | G63: of:=IF([.C63]=1;"";[.C63]) -> 0.0512095 | H63: of:=IF([.D63]=1;"";[.D63]) -> 0.218466 | I63: of:=IF([.E63]=1;"";[.E63]) -> 0.218466
A64: 28 | B64: strncpy: &"athe"{\0,\x01} &"sth"{\0,p,\0} 5 :=> &"sth"{\0,\0,\0} | C64: 0.0512095 | D64: 0.0921454 | E64: 0.0921454 | G64: of:=IF([.C64]=1;"";[.C64]) -> 0.0512095 | H64: of:=IF([.D64]=1;"";[.D64]) -> 0.0921454 | I64: of:=IF([.E64]=1;"";[.E64]) -> 0.0921454
A65: 29 | B65: strncpy: &"sthe"{\0,\x01} &"fore"{\0,\0} 5 :=> &"fore"{\0,\0} | C65: 0.051018 | D65: 0.0497643 | E65: 0.0497643 | G65: of:=IF([.C65]=1;"";[.C65]) -> 0.051018 | H65: of:=IF([.D65]=1;"";[.D65]) -> 0.0497643 | I65: of:=IF([.E65]=1;"";[.E65]) -> 0.0497643
A66: 30 | B66: strncpy: &"best"{\0,\x01} &"sthes"{\0} 5 :=> &"sthes"{\0} | C66: 0.0494569 | D66: 0.0332025 | E66: 0.0332025 | G66: of:=IF([.C66]=1;"";[.C66]) -> 0.0494569 | H66: of:=IF([.D66]=1;"";[.D66]) -> 0.0332025 | I66: of:=IF([.E66]=1;"";[.E66]) -> 0.0332025
A67: 31 | B67: strncpy: &"hesth"{\0} &""{\0,p,r,e,s,\0} 5 :=> &""{\0,\0,\0,\0,\0,\0} | C67: 0.0332025 | D67: 1 | E67: 1 | G67: of:=IF([.C67]=1;"";[.C67]) -> 0.0332025 | H67: of:=IF([.D67]=1;"";[.D67]) ->  | I67: of:=IF([.E67]=1;"";[.E67]) -> 
A68: 32 | B68: strncpy: &"fores"{\0} &"n"{\0,p,r,e,\0} 5 :=> &"n"{\0,\0,\0,\0,\0} | C68: 0.0325019 | D68: 1 | E68: 1 | G68: of:=IF([.C68]=1;"";[.C68]) -> 0.0325019 | H68: of:=IF([.D68]=1;"";[.D68]) ->  | I68: of:=IF([.E68]=1;"";[.E68]) -> 
A69: 33 | B69: strncpy: &"besth"{\0} &"or"{\0,p,r,\0} 5 :=> &"or"{\0,\0,\0,\0} | C69: 0.0325987 | D69: 0.224112 | E69: 0.224112 | G69: of:=IF([.C69]=1;"";[.C69]) -> 0.0325987 | H69: of:=IF([.D69]=1;"";[.D69]) -> 0.224112 | I69: of:=IF([.E69]=1;"";[.E69]) -> 0.224112
A70: 34 | B70: strncpy: &"uthes"{\0} &"zes"{\0,p,\0} 5 :=> &"zes"{\0,\0,\0} | C70: 0.0329073 | D70: 0.0863349 | E70: 0.0863349 | G70: of:=IF([.C70]=1;"";[.C70]) -> 0.0329073 | H70: of:=IF([.D70]=1;"";[.D70]) -> 0.0863349 | I70: of:=IF([.E70]=1;"";[.E70]) -> 0.0863349
A71: 35 | B71: strncpy: &"orest"{\0} &"yest"{\0,\0} 5 :=> &"yest"{\0,\0} | C71: 0.0327935 | D71: 0.0487686 | E71: 0.0487686 | G71: of:=IF([.C71]=1;"";[.C71]) -> 0.0327935 | H71: of:=IF([.D71]=1;"";[.D71]) -> 0.0487686 | I71: of:=IF([.E71]=1;"";[.E71]) -> 0.0487686
A72: 36 | B72: strncpy: &"juthe"{\0} &"orest"{\0} 5 :=> &"orest"{\0} | C72: 0.0316047 | D72: 0.0327935 | E72: 0.0327935 | G72: of:=IF([.C72]=1;"";[.C72]) -> 0.0316047 | H72: of:=IF([.D72]=1;"";[.D72]) -> 0.0327935 | I72: of:=IF([.E72]=1;"";[.E72]) -> 0.0327935

Sheet: strcat
A1: # | B1: Test Case | C1: N1 | D1: N2 | E1: N3
A2: 1 | B2: strcat: &""{\0,\x01,\x01,\x01,\x01,\x01,\x01,\x01,\x01,\x01} &"q"{\0,p,r,\0} :=> &"q"{\0,p,r,e,s,t,h,e,\0} | C2: 1 | D2: 1 | E2: 1 | G2: of:=IF([.C2]=1;"";[.C2]) ->  | H2: of:=IF([.D2]=1;"";[.D2]) ->  | I2: of:=IF([.E2]=1;"";[.E2]) ->  | K2: of:=AVERAGE([.G2:.G41]) -> 0.0703389 | L2: of:=AVERAGE([.H2:.H41]) -> 0.122905204545455 | M2: of:=AVERAGE([.I2:.I41]) -> 0.0466608405405406 | O2: of:=AVERAGE([.K2:.M2]) -> 0.079968315028665
A3: 2 | B3: strcat: &""{\0,\x01,\x01,\x01,\x01,\x01,\x01,\x01,\x01,\x01} &"in"{\0,p,\0} :=> &"in"{\0,p,r,e,s,t,h,\0} | C3: 1 | D3: 0.226579 | E3: 0.226579 | G3: of:=IF([.C3]=1;"";[.C3]) ->  | H3: of:=IF([.D3]=1;"";[.D3]) -> 0.226579 | I3: of:=IF([.E3]=1;"";[.E3]) -> 0.226579
A4: 3 | B4: strcat: &""{\0,\x01,\x01,\x01,\x01,\x01,\x01,\x01,\x01,\x01} &"est"{\0,\0} :=> &"est"{\0,p,r,e,s,t,\0} | C4: 1 | D4: 0.091083 | E4: 0.091083 | G4: of:=IF([.C4]=1;"";[.C4]) ->  | H4: of:=IF([.D4]=1;"";[.D4]) -> 0.091083 | I4: of:=IF([.E4]=1;"";[.E4]) -> 0.091083
A5: 4 | B5: strcat: &""{\0,\x01,\x01,\x01,\x01,\x01,\x01,\x01,\x01,\x01} &"yest"{\0} :=> &"yest"{\0,p,r,e,s,\0} | C5: 1 | D5: 0.0487686 | E5: 0.0487686 | H5: of:=IF([.D5]=1;"";[.D5]) -> 0.0487686 | I5: of:=IF([.E5]=1;"";[.E5]) -> 0.0487686
A6: 5 | B6: strcat: &"h"{\0,\x01,\x01,\x01,\x01,\x01,\x01,\x01,\x01} &""{\0,p,r,e,\0} :=> &"h"{\0,p,r,e,s,t,h,e,\0} | C6: 1 | D6: 1 | E6: 1 | G6: of:=IF([.C6]=1;"";[.C6]) ->  | H6: of:=IF([.D6]=1;"";[.D6]) ->  | I6: of:=IF([.E6]=1;"";[.E6]) -> 
A7: 6 | B7: strcat: &"d"{\0,\x01,\x01,\x01,\x01,\x01,\x01,\x01,\x01} &"o"{\0,p,r,\0} :=> &"do"{\0,p,r,e,s,t,h,\0} | C7: 1 | D7: 1 | E7: 0.215236 | G7: of:=IF([.C7]=1;"";[.C7]) ->  | H7: of:=IF([.D7]=1;"";[.D7]) ->  | I7: of:=IF([.E7]=1;"";[.E7]) -> 0.215236
A8: 7 | B8: strcat: &"x"{\0,\x01,\x01,\x01,\x01,\x01,\x01,\x01,\x01} &"be"{\0,p,\0} :=> &"xbe"{\0,p,r,e,s,t,\0} | C8: 1 | D8: 0.219808 | E8: 0.0698368 | G8: of:=IF([.C8]=1;"";[.C8]) ->  | H8: of:=IF([.D8]=1;"";[.D8]) -> 0.219808 | I8: of:=IF([.E8]=1;"";[.E8]) -> 0.0698368
A9: 8 | B9: strcat: &"r"{\0,\x01,\x01,\x01,\x01,\x01,\x01,\x01,\x01} &"ges"{\0,\0} :=> &"rges"{\0,p,r,e,s,\0} | C9: 1 | D9: 0.0896591 | E9: 0.0478468 | G9: of:=IF([.C9]=1;"";[.C9]) ->  | H9: of:=IF([.D9]=1;"";[.D9]) -> 0.0896591 | I9: of:=IF([.E9]=1;"";[.E9]) -> 0.0478468
A10: 9 | B10: strcat: &"g"{\0,\x01,\x01,\x01,\x01,\x01,\x01,\x01,\x01} &"thes"{\0} :=> &"gthes"{\0,p,r,e,\0} | C10: 1 | D10: 0.051146 | E10: 0.0316065 | G10: of:=IF([.C10]=1;"";[.C10]) ->  | H10: of:=IF([.D10]=1;"";[.D10]) -> 0.051146 | I10: of:=IF([.E10]=1;"";[.E10]) -> 0.0316065
A11: 10 | B11: strcat: &"re"{\0,\x01,\x01,\x01,\x01,\x01,\x01,\x01} &""{\0,p,r,e,\0} :=> &"re"{\0,p,r,e,s,t,h,\0} | C11: 0.225356 | D11: 1 | E11: 0.225356 | G11: of:=IF([.C11]=1;"";[.C11]) -> 0.225356 | H11: of:=IF([.D11]=1;"";[.D11]) ->  | I11: of:=IF([.E11]=1;"";[.E11]) -> 0.225356
A12: 11 | B12: strcat: &"ze"{\0,\x01,\x01,\x01,\x01,\x01,\x01,\x01} &"q"{\0,p,r,\0} :=> &"zeq"{\0,p,r,e,s,t,\0} | C12: 0.208818 | D12: 1 | E12: 0.0806293 | G12: of:=IF([.C12]=1;"";[.C12]) -> 0.208818 | H12: of:=IF([.D12]=1;"";[.D12]) ->  | I12: of:=IF([.E12]=1;"";[.E12]) -> 0.0806293
A13: 12 | B13: strcat: &"di"{\0,\x01,\x01,\x01,\x01,\x01,\x01,\x01} &"in"{\0,p,\0} :=> &"diin"{\0,p,r,e,s,\0} | C13: 0.218916 | D13: 0.226579 | E13: 0.0448058 | G13: of:=IF([.C13]=1;"";[.C13]) -> 0.218916 | H13: of:=IF([.D13]=1;"";[.D13]) -> 0.226579 | I13: of:=IF([.E13]=1;"";[.E13]) -> 0.0448058
A14: 13 | B14: strcat: &"ge"{\0,\x01,\x01,\x01,\x01,\x01,\x01,\x01} &"jut"{\0,\0} :=> &"gejut"{\0,p,r,e,\0} | C14: 0.218916 | D14: 0.0850061 | E14: 0.0283026 | G14: of:=IF([.C14]=1;"";[.C14]) -> 0.218916 | H14: of:=IF([.D14]=1;"";[.D14]) -> 0.0850061 | I14: of:=IF([.E14]=1;"";[.E14]) -> 0.0283026
A15: 14 | B15: strcat: &"he"{\0,\x01,\x01,\x01,\x01,\x01,\x01,\x01} &"wint"{\0} :=> &"hewint"{\0,p,r,\0} | C15: 0.226983 | D15: 0.0495535 | E15: 0.0232399 | G15: of:=IF([.C15]=1;"";[.C15]) -> 0.226983 | H15: of:=IF([.D15]=1;"";[.D15]) -> 0.0495535 | I15: of:=IF([.E15]=1;"";[.E15]) -> 0.0232399
A16: 15 | B16: strcat: &"ore"{\0,\x01,\x01,\x01,\x01,\x01,\x01} &""{\0,p,r,e,\0} :=> &"ore"{\0,p,r,e,s,t,\0} | C16: 0.0917628 | D16: 1 | E16: 0.0917628 | G16: of:=IF([.C16]=1;"";[.C16]) -> 0.0917628 | H16: of:=IF([.D16]=1;"";[.D16]) ->  | I16: of:=IF([.E16]=1;"";[.E16]) -> 0.0917628
A17: 16 | B17: strcat: &"the"{\0,\x01,\x01,\x01,\x01,\x01,\x01} &"k"{\0,p,r,\0} :=> &"thek"{\0,p,r,e,s,\0} | C17: 0.093369 | D17: 1 | E17: 0.0486867 | G17: of:=IF([.C17]=1;"";[.C17]) -> 0.093369 | H17: of:=IF([.D17]=1;"";[.D17]) ->  | I17: of:=IF([.E17]=1;"";[.E17]) -> 0.0486867
A18: 17 | B18: strcat: &"din"{\0,\x01,\x01,\x01,\x01,\x01,\x01} &"ze"{\0,p,\0} :=> &"dinze"{\0,p,r,e,\0} | C18: 0.090448 | D18: 0.208818 | E18: 0.028889 | G18: of:=IF([.C18]=1;"";[.C18]) -> 0.090448 | H18: of:=IF([.D18]=1;"";[.D18]) -> 0.208818 | I18: of:=IF([.E18]=1;"";[.E18]) -> 0.028889
A19: 18 | B19: strcat: &"res"{\0,\x01,\x01,\x01,\x01,\x01,\x01} &"lye"{\0,\0} :=> &"reslye"{\0,p,r,\0} | C19: 0.0917628 | D19: 0.0866641 | E19: 0.0223506 | G19: of:=IF([.C19]=1;"";[.C19]) -> 0.0917628 | H19: of:=IF([.D19]=1;"";[.D19]) -> 0.0866641 | I19: of:=IF([.E19]=1;"";[.E19]) -> 0.0223506
A20: 19 | B20: strcat: &"qut"{\0,\x01,\x01,\x01,\x01,\x01,\x01} &"vest"{\0} :=> &"qutvest"{\0,p,\0} | C20: 0.086312 | D20: 0.0497838 | E20: 0.0164685 | G20: of:=IF([.C20]=1;"";[.C20]) -> 0.086312 | H20: of:=IF([.D20]=1;"";[.D20]) -> 0.0497838 | I20: of:=IF([.E20]=1;"";[.E20]) -> 0.0164685
A21: 20 | B21: strcat: &"thes"{\0,\x01,\x01,\x01,\x01,\x01} &""{\0,p,r,e,\0} :=> &"thes"{\0,p,r,e,s,\0} | C21: 0.051146 | D21: 1 | E21: 0.051146 | G21: of:=IF([.C21]=1;"";[.C21]) -> 0.051146 | H21: of:=IF([.D21]=1;"";[.D21]) ->  | I21: of:=IF([.E21]=1;"";[.E21]) -> 0.051146
A22: 21 | B22: strcat: &"vest"{\0,\x01,\x01,\x01,\x01,\x01} &"k"{\0,p,r,\0} :=> &"vestk"{\0,p,r,e,\0} | C22: 0.0497838 | D22: 1 | E22: 0.0290828 | G22: of:=IF([.C22]=1;"";[.C22]) -> 0.0497838 | H22: of:=IF([.D22]=1;"";[.D22]) ->  | I22: of:=IF([.E22]=1;"";[.E22]) -> 0.0290828
A23: 22 | B23: strcat: &"pres"{\0,\x01,\x01,\x01,\x01,\x01} &"re"{\0,p,\0} :=> &"presre"{\0,p,r,\0} | C23: 0.0496296 | D23: 0.225356 | E23: 0.0223949 | G23: of:=IF([.C23]=1;"";[.C23]) -> 0.0496296 | H23: of:=IF([.D23]=1;"";[.D23]) -> 0.225356 | I23: of:=IF([.E23]=1;"";[.E23]) -> 0.0223949
A24: 23 | B24: strcat: &"juth"{\0,\x01,\x01,\x01,\x01,\x01} &"kes"{\0,\0} :=> &"juthkes"{\0,p,\0} | C24: 0.0477583 | D24: 0.0892137 | E24: 0.0161469 | G24: of:=IF([.C24]=1;"";[.C24]) -> 0.0477583 | H24: of:=IF([.D24]=1;"";[.D24]) -> 0.0892137 | I24: of:=IF([.E24]=1;"";[.E24]) -> 0.0161469
A25: 24 | B25: strcat: &"mest"{\0,\x01,\x01,\x01,\x01,\x01} &"xpre"{\0} :=> &"mestxpre"{\0,\0} | C25: 0.0497193 | D25: 0.0475003 | E25: 0.0124907 | G25: of:=IF([.C25]=1;"";[.C25]) -> 0.0497193 | H25: of:=IF([.D25]=1;"";[.D25]) -> 0.0475003 | I25: of:=IF([.E25]=1;"";[.E25]) -> 0.0124907
A26: 25 | B26: strcat: &"lyest"{\0,\x01,\x01,\x01,\x01} &""{\0,p,r,e,\0} :=> &"lyest"{\0,p,r,e,\0} | C26: 0.0314814 | D26: 1 | E26: 0.0314814 | G26: of:=IF([.C26]=1;"";[.C26]) -> 0.0314814 | H26: of:=IF([.D26]=1;"";[.D26]) ->  | I26: of:=IF([.E26]=1;"";[.E26]) -> 0.0314814
A27: 26 | B27: strcat: &"xpres"{\0,\x01,\x01,\x01,\x01} &"m"{\0,p,r,\0} :=> &"xpresm"{\0,p,r,\0} | C27: 0.0312303 | D27: 1 | E27: 0.022011 | G27: of:=IF([.C27]=1;"";[.C27]) -> 0.0312303 | H27: of:=IF([.D27]=1;"";[.D27]) ->  | I27: of:=IF([.E27]=1;"";[.E27]) -> 0.022011
A28: 27 | B28: strcat: &"mesth"{\0,\x01,\x01,\x01,\x01} &"th"{\0,p,\0} :=> &"mesthth"{\0,p,\0} | C28: 0.0327469 | D28: 0.227384 | E28: 0.0182773 | G28: of:=IF([.C28]=1;"";[.C28]) -> 0.0327469 | H28: of:=IF([.D28]=1;"";[.D28]) -> 0.227384 | I28: of:=IF([.E28]=1;"";[.E28]) -> 0.0182773
A29: 28 | B29: strcat: &"resth"{\0,\x01,\x01,\x01,\x01} &"din"{\0,\0} :=> &"resthdin"{\0,\0} | C29: 0.0330663 | D29: 0.090448 | E29: 0.0144104 | G29: of:=IF([.C29]=1;"";[.C29]) -> 0.0330663 | H29: of:=IF([.D29]=1;"";[.D29]) -> 0.090448 | I29: of:=IF([.E29]=1;"";[.E29]) -> 0.0144104
A30: 29 | B30: strcat: &"resth"{\0,\x01,\x01,\x01,\x01} &"thes"{\0} :=> &"resththes"{\0} | C30: 0.0330663 | D30: 0.051146 | E30: 0.0128894 | G30: of:=IF([.C30]=1;"";[.C30]) -> 0.0330663 | H30: of:=IF([.D30]=1;"";[.D30]) -> 0.051146 | I30: of:=IF([.E30]=1;"";[.E30]) -> 0.0128894
A31: 30 | B31: strcat: &"sthest"{\0,\x01,\x01,\x01} &""{\0,p,r,e,\0} :=> &"sthest"{\0,p,r,\0} | C31: 0.0240127 | D31: 1 | E31: 0.0240127 | G31: of:=IF([.C31]=1;"";[.C31]) -> 0.0240127 | H31: of:=IF([.D31]=1;"";[.D31]) ->  | I31: of:=IF([.E31]=1;"";[.E31]) -> 0.0240127
A32: 31 | B32: strcat: &"xprest"{\0,\x01,\x01,\x01} &"u"{\0,p,r,\0} :=> &"xprestu"{\0,p,\0} | C32: 0.0227599 | D32: 1 | E32: 0.0175075 | G32: of:=IF([.C32]=1;"";[.C32]) -> 0.0227599 | H32: of:=IF([.D32]=1;"";[.D32]) ->  | I32: of:=IF([.E32]=1;"";[.E32]) -> 0.0175075
A33: 32 | B33: strcat: &"uthest"{\0,\x01,\x01,\x01} &"di"{\0,p,\0} :=> &"uthestdi"{\0,\0} | C33: 0.0238258 | D33: 0.218916 | E33: 0.01418 | G33: of:=IF([.C33]=1;"";[.C33]) -> 0.0238258 | H33: of:=IF([.D33]=1;"";[.D33]) -> 0.218916 | I33: of:=IF([.E33]=1;"";[.E33]) -> 0.01418
A34: 33 | B34: strcat: &"nthest"{\0,\x01,\x01,\x01} &"ves"{\0,\0} :=> &"nthestves"{\0} | C34: 0.0239899 | D34: 0.0906651 | E34: 0.0121096 | G34: of:=IF([.C34]=1;"";[.C34]) -> 0.0239899 | H34: of:=IF([.D34]=1;"";[.D34]) -> 0.0906651 | I34: of:=IF([.E34]=1;"";[.E34]) -> 0.0121096
A35: 34 | B35: strcat: &"winthe"{\0,\x01,\x01,\x01} &&10 :=> &"winthesthe"{} | C35: 0.0238607 | D35: 0.0113712 | G35: of:=IF([.C35]=1;"";[.C35]) -> 0.0238607 | H35: of:=IF([.D35]=1;"";[.D35]) -> 0.0113712 | I35: of:=IF([.E35]=1;"";[.E35]) ->  
A36: 35 | B36: strcat: &"resthes"{\0,\x01,\x01} &""{\0,p,r,e,\0} :=> &"resthes"{\0,p,\0} | C36: 0.0187717 | D36: 1 | E36: 0.0187717 | G36: of:=IF([.C36]=1;"";[.C36]) -> 0.0187717 | H36: of:=IF([.D36]=1;"";[.D36]) ->  | I36: of:=IF([.E36]=1;"";[.E36]) -> 0.0187717
A37: 36 | B37: strcat: &"nthesth"{\0,\x01,\x01} &"w"{\0,p,r,\0} :=> &"nthesthw"{\0,\0} | C37: 0.0187993 | D37: 1 | E37: 0.014618 | G37: of:=IF([.C37]=1;"";[.C37]) -> 0.0187993 | H37: of:=IF([.D37]=1;"";[.D37]) ->  | I37: of:=IF([.E37]=1;"";[.E37]) -> 0.014618
A38: 37 | B38: strcat: &"cthesth"{\0,\x01,\x01} &"ly"{\0,p,\0} :=> &"cthesthly"{\0} | C38: 0.0186341 | D38: 0.218466 | E38: 0.0123784 | G38: of:=IF([.C38]=1;"";[.C38]) -> 0.0186341 | H38: of:=IF([.D38]=1;"";[.D38]) -> 0.218466 | I38: of:=IF([.E38]=1;"";[.E38]) -> 0.0123784
A39: 38 | B39: strcat: &"mesthest"{\0,\x01} &""{\0,p,r,e,\0} :=> &"mesthest"{\0,\0} | C39: 0.0152312 | D39: 1 | E39: 0.0152312 | G39: of:=IF([.C39]=1;"";[.C39]) -> 0.0152312 | H39: of:=IF([.D39]=1;"";[.D39]) ->  | I39: of:=IF([.E39]=1;"";[.E39]) -> 0.0152312
A40: 39 | B40: strcat: &"mesthest"{\0,\x01} &"u"{\0,p,r,\0} :=> &"mesthestu"{\0} | C40: 0.0152312 | D40: 1 | E40: 0.0127457 | G40: of:=IF([.C40]=1;"";[.C40]) -> 0.0152312 | H40: of:=IF([.D40]=1;"";[.D40]) ->  | I40: of:=IF([.E40]=1;"";[.E40]) -> 0.0127457
A41: 40 | B41: strcat: &"thesthest"{\0} &""{\0,p,r,e,\0} :=> &"thesthest"{\0} | C41: 0.0131176 | D41: 1 | E41: 0.0131176 | G41: of:=IF([.C41]=1;"";[.C41]) -> 0.0131176 | H41: of:=IF([.D41]=1;"";[.D41]) ->  | I41: of:=IF([.E41]=1;"";[.E41]) -> 0.0131176
A42: 1 | B42: strncat: &""{\0,\x01,\x01,\x01,\x01,\x01,\x01,\x01,\x01,\x01} &""{\0,p,r,e,\0} 4 :=> &""{\0,p,r,e,s,t,h,e,s,\0} | C42: 1 | D42: 1 | E42: 1 | G42: of:=IF([.C42]=1;"";[.C42]) ->  | H42: of:=IF([.D42]=1;"";[.D42]) ->  | I42: of:=IF([.E42]=1;"";[.E42]) ->  | K42: of:=AVERAGE([.G42:.G82]) -> 0.0699927903225807 | L42: of:=AVERAGE([.H42:.H82]) -> 0.122072677272727 | M42: of:=AVERAGE([.I42:.I82]) -> 0.0458067378378378 | O42: of:=AVERAGE([.K42:.M42]) -> 0.0792907351443819
A43: 2 | B43: strncat: &""{\0,\x01,\x01,\x01,\x01,\x01,\x01,\x01,\x01,\x01} &"t"{\0,p,r,\0} 4 :=> &"t"{\0,p,r,e,s,t,h,e,\0} | C43: 1 | D43: 1 | E43: 1 | G43: of:=IF([.C43]=1;"";[.C43]) ->  | H43: of:=IF([.D43]=1;"";[.D43]) ->  | I43: of:=IF([.E43]=1;"";[.E43]) -> 
A44: 3 | B44: strncat: &""{\0,\x01,\x01,\x01,\x01,\x01,\x01,\x01,\x01,\x01} &"ly"{\0,p,\0} 4 :=> &"ly"{\0,p,r,e,s,t,h,\0} | C44: 1 | D44: 0.218466 | E44: 0.218466 | G44: of:=IF([.C44]=1;"";[.C44]) ->  | H44: of:=IF([.D44]=1;"";[.D44]) -> 0.218466 | I44: of:=IF([.E44]=1;"";[.E44]) -> 0.218466
A45: 4 | B45: strncat: &""{\0,\x01,\x01,\x01,\x01,\x01,\x01,\x01,\x01,\x01} &"int"{\0,\0} 4 :=> &"int"{\0,p,r,e,s,t,\0} | C45: 1 | D45: 0.0917447 | E45: 0.0917447 | G45: of:=IF([.C45]=1;"";[.C45]) ->  | H45: of:=IF([.D45]=1;"";[.D45]) -> 0.0917447 | I45: of:=IF([.E45]=1;"";[.E45]) -> 0.0917447
A46: 5 | B46: strncat: &""{\0,\x01,\x01,\x01,\x01,\x01,\x01,\x01,\x01,\x01} &"uthe"{\0} 4 :=> &"uthe"{\0,p,r,e,s,\0} | C46: 1 | D46: 0.0504892 | E46: 0.0504892 | G46: of:=IF([.C46]=1;"";[.C46]) ->  | H46: of:=IF([.D46]=1;"";[.D46]) -> 0.0504892 | I46: of:=IF([.E46]=1;"";[.E46]) -> 0.0504892
A47: 6 | B47: strncat: &"w"{\0,\x01,\x01,\x01,\x01,\x01,\x01,\x01,\x01} &""{\0,p,r,e,\0} 4 :=> &"w"{\0,p,r,e,s,t,h,e,\0} | C47: 1 | D47: 1 | E47: 1 | G47: of:=IF([.C47]=1;"";[.C47]) ->  | H47: of:=IF([.D47]=1;"";[.D47]) ->  | I47: of:=IF([.E47]=1;"";[.E47]) -> 
A48: 7 | B48: strncat: &"z"{\0,\x01,\x01,\x01,\x01,\x01,\x01,\x01,\x01} &"o"{\0,p,r,\0} 4 :=> &"zo"{\0,p,r,e,s,t,h,\0} | C48: 1 | D48: 1 | E48: 0.197793 | G48: of:=IF([.C48]=1;"";[.C48]) ->  | H48: of:=IF([.D48]=1;"";[.D48]) ->  | I48: of:=IF([.E48]=1;"";[.E48]) -> 0.197793
A49: 8 | B49: strncat: &"l"{\0,\x01,\x01,\x01,\x01,\x01,\x01,\x01,\x01} &"qu"{\0,p,\0} 4 :=> &"lqu"{\0,p,r,e,s,t,\0} | C49: 1 | D49: 0.212836 | E49: 0.0667491 | G49: of:=IF([.C49]=1;"";[.C49]) ->  | H49: of:=IF([.D49]=1;"";[.D49]) -> 0.212836 | I49: of:=IF([.E49]=1;"";[.E49]) -> 0.0667491
A50: 9 | B50: strncat: &"w"{\0,\x01,\x01,\x01,\x01,\x01,\x01,\x01,\x01} &"for"{\0,\0} 4 :=> &"wfor"{\0,p,r,e,s,\0} | C50: 1 | D50: 0.0899511 | E50: 0.0436278 | G50: of:=IF([.C50]=1;"";[.C50]) ->  | H50: of:=IF([.D50]=1;"";[.D50]) -> 0.0899511 | I50: of:=IF([.E50]=1;"";[.E50]) -> 0.0436278
A51: 10 | B51: strncat: &"x"{\0,\x01,\x01,\x01,\x01,\x01,\x01,\x01,\x01} &"pres"{\0} 4 :=> &"xpres"{\0,p,r,e,\0} | C51: 1 | D51: 0.0496296 | E51: 0.0312303 | G51: of:=IF([.C51]=1;"";[.C51]) ->  | H51: of:=IF([.D51]=1;"";[.D51]) -> 0.0496296 | I51: of:=IF([.E51]=1;"";[.E51]) -> 0.0312303
A52: 11 | B52: strncat: &"ju"{\0,\x01,\x01,\x01,\x01,\x01,\x01,\x01} &""{\0,p,r,e,\0} 4 :=> &"ju"{\0,p,r,e,s,t,h,\0} | C52: 0.208818 | D52: 1 | E52: 0.208818 | G52: of:=IF([.C52]=1;"";[.C52]) -> 0.208818 | H52: of:=IF([.D52]=1;"";[.D52]) ->  | I52: of:=IF([.E52]=1;"";[.E52]) -> 0.208818
A53: 12 | B53: strncat: &"wi"{\0,\x01,\x01,\x01,\x01,\x01,\x01,\x01} &"z"{\0,p,r,\0} 4 :=> &"wiz"{\0,p,r,e,s,t,\0} | C53: 0.218466 | D53: 1 | E53: 0.0847576 | G53: of:=IF([.C53]=1;"";[.C53]) -> 0.218466 | H53: of:=IF([.D53]=1;"";[.D53]) ->  | I53: of:=IF([.E53]=1;"";[.E53]) -> 0.0847576
A54: 13 | B54: strncat: &"ke"{\0,\x01,\x01,\x01,\x01,\x01,\x01,\x01} &"re"{\0,p,\0} 4 :=> &"kere"{\0,p,r,e,s,\0} | C54: 0.217558 | D54: 0.225356 | E54: 0.0497268 | G54: of:=IF([.C54]=1;"";[.C54]) -> 0.217558 | H54: of:=IF([.D54]=1;"";[.D54]) -> 0.225356 | I54: of:=IF([.E54]=1;"";[.E54]) -> 0.0497268
A55: 14 | B55: strncat: &"ye"{\0,\x01,\x01,\x01,\x01,\x01,\x01,\x01} &"win"{\0,\0} 4 :=> &"yewin"{\0,p,r,e,\0} | C55: 0.215236 | D55: 0.0902992 | E55: 0.0310612 | G55: of:=IF([.C55]=1;"";[.C55]) -> 0.215236 | H55: of:=IF([.D55]=1;"";[.D55]) -> 0.0902992 | I55: of:=IF([.E55]=1;"";[.E55]) -> 0.0310612
A56: 15 | B56: strncat: &"ge"{\0,\x01,\x01,\x01,\x01,\x01,\x01,\x01} &"thes"{\0} 4 :=> &"gethes"{\0,p,r,\0} | C56: 0.218916 | D56: 0.051146 | E56: 0.0235684 | G56: of:=IF([.C56]=1;"";[.C56]) -> 0.218916 | H56: of:=IF([.D56]=1;"";[.D56]) -> 0.051146 | I56: of:=IF([.E56]=1;"";[.E56]) -> 0.0235684
A57: 16 | B57: strncat: &"ore"{\0,\x01,\x01,\x01,\x01,\x01,\x01} &""{\0,p,r,e,\0} 4 :=> &"ore"{\0,p,r,e,s,t,\0} | C57: 0.0917628 | D57: 1 | E57: 0.0917628 | G57: of:=IF([.C57]=1;"";[.C57]) -> 0.0917628 | H57: of:=IF([.D57]=1;"";[.D57]) ->  | I57: of:=IF([.E57]=1;"";[.E57]) -> 0.0917628
A58: 17 | B58: strncat: &"the"{\0,\x01,\x01,\x01,\x01,\x01,\x01} &"k"{\0,p,r,\0} 4 :=> &"thek"{\0,p,r,e,s,\0} | C58: 0.093369 | D58: 1 | E58: 0.0486867 | G58: of:=IF([.C58]=1;"";[.C58]) -> 0.093369 | H58: of:=IF([.D58]=1;"";[.D58]) ->  | I58: of:=IF([.E58]=1;"";[.E58]) -> 0.0486867
A59: 18 | B59: strncat: &"uth"{\0,\x01,\x01,\x01,\x01,\x01,\x01} &"pr"{\0,p,\0} 4 :=> &"uthpr"{\0,p,r,e,\0} | C59: 0.0910004 | D59: 0.218916 | E59: 0.0286764 | G59: of:=IF([.C59]=1;"";[.C59]) -> 0.0910004 | H59: of:=IF([.D59]=1;"";[.D59]) -> 0.218916 | I59: of:=IF([.E59]=1;"";[.E59]) -> 0.0286764
A60: 19 | B60: strncat: &"the"{\0,\x01,\x01,\x01,\x01,\x01,\x01} &"win"{\0,\0} 4 :=> &"thewin"{\0,p,r,\0} | C60: 0.093369 | D60: 0.0902992 | E60: 0.0234753 | G60: of:=IF([.C60]=1;"";[.C60]) -> 0.093369 | H60: of:=IF([.D60]=1;"";[.D60]) -> 0.0902992 | I60: of:=IF([.E60]=1;"";[.E60]) -> 0.0234753
A61: 20 | B61: strncat: &"win"{\0,\x01,\x01,\x01,\x01,\x01,\x01} &"dint"{\0} 4 :=> &"windint"{\0,p,\0} | C61: 0.0902992 | D61: 0.0496215 | E61: 0.0182485 | G61: of:=IF([.C61]=1;"";[.C61]) -> 0.0902992 | H61: of:=IF([.D61]=1;"";[.D61]) -> 0.0496215 | I61: of:=IF([.E61]=1;"";[.E61]) -> 0.0182485
A62: 21 | B62: strncat: &"fore"{\0,\x01,\x01,\x01,\x01,\x01} &""{\0,p,r,e,\0} 4 :=> &"fore"{\0,p,r,e,s,\0} | C62: 0.0497643 | D62: 1 | E62: 0.0497643 | G62: of:=IF([.C62]=1;"";[.C62]) -> 0.0497643 | H62: of:=IF([.D62]=1;"";[.D62]) ->  | I62: of:=IF([.E62]=1;"";[.E62]) -> 0.0497643
A63: 22 | B63: strncat: &"sthe"{\0,\x01,\x01,\x01,\x01,\x01} &"j"{\0,p,r,\0} 4 :=> &"sthej"{\0,p,r,e,\0} | C63: 0.051018 | D63: 1 | E63: 0.0306072 | G63: of:=IF([.C63]=1;"";[.C63]) -> 0.051018 | H63: of:=IF([.D63]=1;"";[.D63]) ->  | I63: of:=IF([.E63]=1;"";[.E63]) -> 0.0306072
A64: 23 | B64: strncat: &"juth"{\0,\x01,\x01,\x01,\x01,\x01} &"qu"{\0,p,\0} 4 :=> &"juthqu"{\0,p,r,\0} | C64: 0.0477583 | D64: 0.212836 | E64: 0.0197839 | G64: of:=IF([.C64]=1;"";[.C64]) -> 0.0477583 | H64: of:=IF([.D64]=1;"";[.D64]) -> 0.212836 | I64: of:=IF([.E64]=1;"";[.E64]) -> 0.0197839
A65: 24 | B65: strncat: &"sthe"{\0,\x01,\x01,\x01,\x01,\x01} &"mes"{\0,\0} 4 :=> &"sthemes"{\0,p,\0} | C65: 0.051018 | D65: 0.0905241 | E65: 0.0184035 | G65: of:=IF([.C65]=1;"";[.C65]) -> 0.051018 | H65: of:=IF([.D65]=1;"";[.D65]) -> 0.0905241 | I65: of:=IF([.E65]=1;"";[.E65]) -> 0.0184035
A66: 25 | B66: strncat: &"dint"{\0,\x01,\x01,\x01,\x01,\x01} &"nthe"{\0} 4 :=> &"dintnthe"{\0,\0} | C66: 0.0496215 | D66: 0.0509534 | E66: 0.0146004 | G66: of:=IF([.C66]=1;"";[.C66]) -> 0.0496215 | H66: of:=IF([.D66]=1;"";[.D66]) -> 0.0509534 | I66: of:=IF([.E66]=1;"";[.E66]) -> 0.0146004
A67: 26 | B67: strncat: &"resth"{\0,\x01,\x01,\x01,\x01} &""{\0,p,r,e,\0} 4 :=> &"resth"{\0,p,r,e,\0} | C67: 0.0330663 | D67: 1 | E67: 0.0330663 | G67: of:=IF([.C67]=1;"";[.C67]) -> 0.0330663 | H67: of:=IF([.D67]=1;"";[.D67]) ->  | I67: of:=IF([.E67]=1;"";[.E67]) -> 0.0330663
A68: 27 | B68: strncat: &"xpres"{\0,\x01,\x01,\x01,\x01} &"p"{\0,p,r,\0} 4 :=> &"xpresp"{\0,p,r,\0} | C68: 0.0312303 | D68: 1 | E68: 0.022322 | G68: of:=IF([.C68]=1;"";[.C68]) -> 0.0312303 | H68: of:=IF([.D68]=1;"";[.D68]) ->  | I68: of:=IF([.E68]=1;"";[.E68]) -> 0.022322
A69: 28 | B69: strncat: &"orest"{\0,\x01,\x01,\x01,\x01} &"me"{\0,p,\0} 4 :=> &"orestme"{\0,p,\0} | C69: 0.0327935 | D69: 0.22156 | E69: 0.0178274 | G69: of:=IF([.C69]=1;"";[.C69]) -> 0.0327935 | H69: of:=IF([.D69]=1;"";[.D69]) -> 0.22156 | I69: of:=IF([.E69]=1;"";[.E69]) -> 0.0178274
A70: 29 | B70: strncat: &"hesth"{\0,\x01,\x01,\x01,\x01} &"ore"{\0,\0} 4 :=> &"hesthore"{\0,\0} | C70: 0.0332025 | D70: 0.0917628 | E70: 0.0152395 | G70: of:=IF([.C70]=1;"";[.C70]) -> 0.0332025 | H70: of:=IF([.D70]=1;"";[.D70]) -> 0.0917628 | I70: of:=IF([.E70]=1;"";[.E70]) -> 0.0152395
A71: 30 | B71: strncat: &"nthes"{\0,\x01,\x01,\x01,\x01} &"kest"{\0} 4 :=> &"ntheskest"{\0} | C71: 0.0331665 | D71: 0.0491188 | E71: 0.0125255 | G71: of:=IF([.C71]=1;"";[.C71]) -> 0.0331665 | H71: of:=IF([.D71]=1;"";[.D71]) -> 0.0491188 | I71: of:=IF([.E71]=1;"";[.E71]) -> 0.0125255
A72: 31 | B72: strncat: &"cthest"{\0,\x01,\x01,\x01} &""{\0,p,r,e,\0} 4 :=> &"cthest"{\0,p,r,\0} | C72: 0.0237529 | D72: 1 | E72: 0.0237529 | G72: of:=IF([.C72]=1;"";[.C72]) -> 0.0237529 | H72: of:=IF([.D72]=1;"";[.D72]) ->  | I72: of:=IF([.E72]=1;"";[.E72]) -> 0.0237529
A73: 32 | B73: strncat: &"uthest"{\0,\x01,\x01,\x01} &"c"{\0,p,r,\0} 4 :=> &"uthestc"{\0,p,\0} | C73: 0.0238258 | D73: 1 | E73: 0.0179326 | G73: of:=IF([.C73]=1;"";[.C73]) -> 0.0238258 | H73: of:=IF([.D73]=1;"";[.D73]) ->  | I73: of:=IF([.E73]=1;"";[.E73]) -> 0.0179326
A74: 33 | B74: strncat: &"nthest"{\0,\x01,\x01,\x01} &"ze"{\0,p,\0} 4 :=> &"nthestze"{\0,\0} | C74: 0.0239899 | D74: 0.208818 | E74: 0.0142003 | G74: of:=IF([.C74]=1;"";[.C74]) -> 0.0239899 | H74: of:=IF([.D74]=1;"";[.D74]) -> 0.208818 | I74: of:=IF([.E74]=1;"";[.E74]) -> 0.0142003
A75: 34 | B75: strncat: &"uthest"{\0,\x01,\x01,\x01} &"pre"{\0,\0} 4 :=> &"uthestpre"{\0} | C75: 0.0238258 | D75: 0.090057 | E75: 0.0121461 | G75: of:=IF([.C75]=1;"";[.C75]) -> 0.0238258 | H75: of:=IF([.D75]=1;"";[.D75]) -> 0.090057 | I75: of:=IF([.E75]=1;"";[.E75]) -> 0.0121461
A76: 35 | B76: strncat: &"oresth"{\0,\x01,\x01,\x01} &&10 4 :=> &"oresthesth"{} | C76: 0.0239715 | D76: 0.0114063 | G76: of:=IF([.C76]=1;"";[.C76]) -> 0.0239715 | H76: of:=IF([.D76]=1;"";[.D76]) -> 0.0114063 | I76: of:=IF([.E76]=1;"";[.E76]) ->  
A77: 36 | B77: strncat: &"xpresth"{\0,\x01,\x01} &""{\0,p,r,e,\0} 4 :=> &"xpresth"{\0,p,\0} | C77: 0.01794 | D77: 1 | E77: 0.01794 | G77: of:=IF([.C77]=1;"";[.C77]) -> 0.01794 | H77: of:=IF([.D77]=1;"";[.D77]) ->  | I77: of:=IF([.E77]=1;"";[.E77]) -> 0.01794
A78: 37 | B78: strncat: &"uthesth"{\0,\x01,\x01} &"g"{\0,p,r,\0} 4 :=> &"uthesthg"{\0,\0} | C78: 0.0186849 | D78: 1 | E78: 0.0139236 | G78: of:=IF([.C78]=1;"";[.C78]) -> 0.0186849 | H78: of:=IF([.D78]=1;"";[.D78]) ->  | I78: of:=IF([.E78]=1;"";[.E78]) -> 0.0139236
A79: 38 | B79: strncat: &"oresthe"{\0,\x01,\x01} &"fo"{\0,p,\0} 4 :=> &"oresthefo"{\0} | C79: 0.0187717 | D79: 0.219808 | E79: 0.0127315 | G79: of:=IF([.C79]=1;"";[.C79]) -> 0.0187717 | H79: of:=IF([.D79]=1;"";[.D79]) -> 0.219808 | I79: of:=IF([.E79]=1;"";[.E79]) -> 0.0127315
A80: 39 | B80: strncat: &"oresthes"{\0,\x01} &""{\0,p,r,e,\0} 4 :=> &"oresthes"{\0,\0} | C80: 0.0153582 | D80: 1 | E80: 0.0153582 | G80: of:=IF([.C80]=1;"";[.C80]) -> 0.0153582 | H80: of:=IF([.D80]=1;"";[.D80]) ->  | I80: of:=IF([.E80]=1;"";[.E80]) -> 0.0153582
A81: 40 | B81: strncat: &"vesthest"{\0,\x01} &"q"{\0,p,r,\0} 4 :=> &"vesthestq"{\0} | C81: 0.0152431 | D81: 1 | E81: 0.0108632 | G81: of:=IF([.C81]=1;"";[.C81]) -> 0.0152431 | H81: of:=IF([.D81]=1;"";[.D81]) ->  | I81: of:=IF([.E81]=1;"";[.E81]) -> 0.0108632
A82: 41 | B82: strncat: &"winthesth"{\0} &""{\0,p,r,e,\0} 4 :=> &"winthesth"{\0} | C82: 0.0129791 | D82: 1 | E82: 0.0129791 | G82: of:=IF([.C82]=1;"";[.C82]) -> 0.0129791 | H82: of:=IF([.D82]=1;"";[.D82]) ->  | I82: of:=IF([.E82]=1;"";[.E82]) -> 0.0129791

Sheet: strstr
A1: # | B1: Test Case | C1: N | G1: N1 | H1: N2 | I1: N3
A2: 1 | B2: strstr: &"e"{\0,h,e,s,\0} &"e"{\0,\0} :=> &"e"{\0,h,e,s,\0} | C2: 1 | D2: 1 | E2: 1 | G2: of:=IF([.C2]=1;"";[.C2]) ->  | H2: of:=IF([.D2]=1;"";[.D2]) ->  | I2: of:=IF([.E2]=1;"";[.E2]) ->  | K2: of:=AVERAGE([.G2:.G19]) -> 0.0869879588235294 | L2: of:=AVERAGE([.H2:.H19]) -> 0.222233111111111 | M2: of:=AVERAGE([.I2:.I19]) -> 0.114542275 | O2: of:=AVERAGE([.K2:.M2]) -> 0.141254448311547
A3: 2 | B3: strstr: &"ly"{\0,h,e,\0} &"l"{\0,\0} :=> &"ly"{\0,h,e,\0} | C3: 0.218466 | D3: 1 | E3: 0.218466 | G3: of:=IF([.C3]=1;"";[.C3]) -> 0.218466 | H3: of:=IF([.D3]=1;"";[.D3]) ->  | I3: of:=IF([.E3]=1;"";[.E3]) -> 0.218466
A4: 3 | B4: strstr: &"ut"{\0,b,e,\0} &"t"{\0,\0} :=> &"t"{\0,b,e,\0,54} | C4: 0.219808 | D4: 1 | E4: 1 | G4: of:=IF([.C4]=1;"";[.C4]) -> 0.219808 | H4: of:=IF([.D4]=1;"";[.D4]) ->  | I4: of:=IF([.E4]=1;"";[.E4]) -> 
A5: 4 | B5: strstr: &"the"{\0,h,\0} &"t"{\0,\0} :=> &"the"{\0,h,\0} | C5: 0.093369 | D5: 1 | E5: 0.093369 | G5: of:=IF([.C5]=1;"";[.C5]) -> 0.093369 | H5: of:=IF([.D5]=1;"";[.D5]) ->  | I5: of:=IF([.E5]=1;"";[.E5]) -> 0.093369
A6: 5 | B6: strstr: &"pre"{\0,b,\0} &"r"{\0,\0} :=> &"re"{\0,b,\0,54} | C6: 0.090057 | D6: 1 | E6: 0.225356 | G6: of:=IF([.C6]=1;"";[.C6]) -> 0.090057 | H6: of:=IF([.D6]=1;"";[.D6]) ->  | I6: of:=IF([.E6]=1;"";[.E6]) -> 0.225356
A7: 6 | B7: strstr: &"quth"{\0,\0} &"q"{\0,\0} :=> &"quth"{\0,\0} | C7: 0.0483689 | D7: 1 | E7: 0.0483689 | G7: of:=IF([.C7]=1;"";[.C7]) -> 0.0483689 | H7: of:=IF([.D7]=1;"";[.D7]) ->  | I7: of:=IF([.E7]=1;"";[.E7]) -> 0.0483689
A8: 7 | B8: strstr: &"rest"{\0,\0} &"e"{\0,\0} :=> &"est"{\0,\0,54} | C8: 0.0502856 | D8: 1 | E8: 0.091083 | G8: of:=IF([.C8]=1;"";[.C8]) -> 0.0502856 | H8: of:=IF([.D8]=1;"";[.D8]) ->  | I8: of:=IF([.E8]=1;"";[.E8]) -> 0.091083
A9: 8 | B9: strstr: &"thest"{\0} &"t"{\0,\0} :=> &"thest"{\0} | C9: 0.0332025 | D9: 1 | E9: 0.0332025 | G9: of:=IF([.C9]=1;"";[.C9]) -> 0.0332025 | H9: of:=IF([.D9]=1;"";[.D9]) ->  | I9: of:=IF([.E9]=1;"";[.E9]) -> 0.0332025
A10: 9 | B10: strstr: &"winth"{\0} &"i"{\0,\0} :=> &"inth"{\0,54} | C10: 0.0326533 | D10: 1 | E10: 0.050893 | G10: of:=IF([.C10]=1;"";[.C10]) -> 0.0326533 | H10: of:=IF([.D10]=1;"";[.D10]) ->  | I10: of:=IF([.E10]=1;"";[.E10]) -> 0.050893
A11: 10 | B11: strstr: &"ve"{\0,d,i,\0} &"ve"{\0} :=> &"ve"{\0,d,i,\0} | C11: 0.221991 | D11: 0.221991 | E11: 0.221991 | G11: of:=IF([.C11]=1;"";[.C11]) -> 0.221991 | H11: of:=IF([.D11]=1;"";[.D11]) -> 0.221991 | I11: of:=IF([.E11]=1;"";[.E11]) -> 0.221991
A12: 11 | B12: strstr: &"lye"{\0,d,\0} &"ly"{\0} :=> &"lye"{\0,d,\0} | C12: 0.0866641 | D12: 0.218466 | E12: 0.0866641 | G12: of:=IF([.C12]=1;"";[.C12]) -> 0.0866641 | H12: of:=IF([.D12]=1;"";[.D12]) -> 0.218466 | I12: of:=IF([.E12]=1;"";[.E12]) -> 0.0866641
A13: 12 | B13: strstr: &"tth"{\0,a,\0} &"th"{\0} :=> &"th"{\0,a,\0,54} | C13: 0.0894829 | D13: 0.227384 | E13: 0.227384 | G13: of:=IF([.C13]=1;"";[.C13]) -> 0.0894829 | H13: of:=IF([.D13]=1;"";[.D13]) -> 0.227384 | I13: of:=IF([.E13]=1;"";[.E13]) -> 0.227384
A14: 13 | B14: strstr: &"jut"{\0,p,\0} &"ut"{\0} :=> &"ut"{\0,p,\0,54} | C14: 0.0850061 | D14: 0.219808 | E14: 0.219808 | G14: of:=IF([.C14]=1;"";[.C14]) -> 0.0850061 | H14: of:=IF([.D14]=1;"";[.D14]) -> 0.219808 | I14: of:=IF([.E14]=1;"";[.E14]) -> 0.219808
A15: 14 | B15: strstr: &"fore"{\0,\0} &"fo"{\0} :=> &"fore"{\0,\0} | C15: 0.0497643 | D15: 0.219808 | E15: 0.0497643 | G15: of:=IF([.C15]=1;"";[.C15]) -> 0.0497643 | H15: of:=IF([.D15]=1;"";[.D15]) -> 0.219808 | I15: of:=IF([.E15]=1;"";[.E15]) -> 0.0497643
A16: 15 | B16: strstr: &"hhes"{\0,\0} &"he"{\0} :=> &"hes"{\0,\0,54} | C16: 0.0445601 | D16: 0.226983 | E16: 0.0922924 | G16: of:=IF([.C16]=1;"";[.C16]) -> 0.0445601 | H16: of:=IF([.D16]=1;"";[.D16]) -> 0.226983 | I16: of:=IF([.E16]=1;"";[.E16]) -> 0.0922924
A17: 16 | B17: strstr: &"athe"{\0,\0} &"th"{\0} :=> &"the"{\0,\0,54} | C17: 0.0512095 | D17: 0.227384 | E17: 0.093369 | G17: of:=IF([.C17]=1;"";[.C17]) -> 0.0512095 | H17: of:=IF([.D17]=1;"";[.D17]) -> 0.227384 | I17: of:=IF([.E17]=1;"";[.E17]) -> 0.093369
A18: 17 | B18: strstr: &"besth"{\0} &"be"{\0} :=> &"besth"{\0} | C18: 0.0325987 | D18: 0.219808 | E18: 0.0325987 | G18: of:=IF([.C18]=1;"";[.C18]) -> 0.0325987 | H18: of:=IF([.D18]=1;"";[.D18]) -> 0.219808 | I18: of:=IF([.E18]=1;"";[.E18]) -> 0.0325987
A19: 18 | B19: strstr: &"llyes"{\0} &"ly"{\0} :=> &"lyes"{\0,54} | C19: 0.0313083 | D19: 0.218466 | E19: 0.0480665 | G19: of:=IF([.C19]=1;"";[.C19]) -> 0.0313083 | H19: of:=IF([.D19]=1;"";[.D19]) -> 0.218466 | I19: of:=IF([.E19]=1;"";[.E19]) -> 0.0480665
A20: 19 | B20: strstr: &"mesth"{\0} &"es"{\0} :=> &"esth"{\0,54} | C20: 0.0327469 | D20: 0.224112 | E20: 0.0505869 | G20: of:=IF([.C20]=1;"";[.C20]) -> 0.0327469 | H20: of:=IF([.D20]=1;"";[.D20]) -> 0.224112 | I20: of:=IF([.E20]=1;"";[.E20]) -> 0.0505869 | K20: of:=AVERAGE([.G20:.G24]) -> 0.03252366 | L20: of:=AVERAGE([.H20:.H24]) -> 0.222836 | M20: of:=AVERAGE([.I20:.I24]) -> 0.03977152 | O20: of:=AVERAGE([.K20:.M20]) -> 0.09837706
A21: 1 | B21: strnstr: &"dinth"{\0} &""{\0,p,\0} 2 :=> &"dinth"{\0} | C21: 0.0326917 | D21: 1 | E21: 0.0326917 | G21: of:=IF([.C21]=1;"";[.C21]) -> 0.0326917 | H21: of:=IF([.D21]=1;"";[.D21]) ->  | I21: of:=IF([.E21]=1;"";[.E21]) -> 0.0326917
A22: 2 | B22: strnstr: &"esthe"{\0} &"e"{\0,\0} 2 :=> &"esthe"{\0} | C22: 0.0332025 | D22: 1 | E22: 0.0332025 | G22: of:=IF([.C22]=1;"";[.C22]) -> 0.0332025 | H22: of:=IF([.D22]=1;"";[.D22]) ->  | I22: of:=IF([.E22]=1;"";[.E22]) -> 0.0332025
A23: 3 | B23: strnstr: &"xpres"{\0} &"p"{\0,\0} 2 :=> &"pres"{\0,54} | C23: 0.0312303 | D23: 1 | E23: 0.0496296 | G23: of:=IF([.C23]=1;"";[.C23]) -> 0.0312303 | H23: of:=IF([.D23]=1;"";[.D23]) ->  | I23: of:=IF([.E23]=1;"";[.E23]) -> 0.0496296
A24: 4 | B24: strnstr: &"mesth"{\0} &"me"{\0} 2 :=> &"mesth"{\0} | C24: 0.0327469 | D24: 0.22156 | E24: 0.0327469 | G24: of:=IF([.C24]=1;"";[.C24]) -> 0.0327469 | H24: of:=IF([.D24]=1;"";[.D24]) -> 0.22156 | I24: of:=IF([.E24]=1;"";[.E24]) -> 0.0327469
A25: 1 | B25: strpbrk: &"wuthe"{\0} &"aeiou"{\0} :=> &"uthe"{\0,54} | C25: 0.0283243 | D25: 0.0299288 | E25: 0.0504892 | G25: of:=IF([.C25]=1;"";[.C25]) -> 0.0283243 | H25: of:=IF([.D25]=1;"";[.D25]) -> 0.0299288 | I25: of:=IF([.E25]=1;"";[.E25]) -> 0.0504892 | K25: of:=AVERAGE([.G25:.G34]) -> 0.03235135 | L25: of:=AVERAGE([.H25:.H34]) -> 0.0299288 | M25: of:=AVERAGE([.I25:.I34]) -> 0.04191776 | O25: of:=AVERAGE([.K25:.M25]) -> 0.0347326366666667
A26: 2 | B26: strpbrk: &"sores"{\0} &"aeiou"{\0} :=> &"ores"{\0,54} | C26: 0.0323501 | D26: 0.0299288 | E26: 0.0504117 | G26: of:=IF([.C26]=1;"";[.C26]) -> 0.0323501 | H26: of:=IF([.D26]=1;"";[.D26]) -> 0.0299288 | I26: of:=IF([.E26]=1;"";[.E26]) -> 0.0504117
A27: 3 | B27: strpbrk: &"minth"{\0} &"aeiou"{\0} :=> &"inth"{\0,54} | C27: 0.0326146 | D27: 0.0299288 | E27: 0.050893 | G27: of:=IF([.C27]=1;"";[.C27]) -> 0.0326146 | H27: of:=IF([.D27]=1;"";[.D27]) -> 0.0299288 | I27: of:=IF([.E27]=1;"";[.E27]) -> 0.050893
A28: 4 | B28: strpbrk: &"zesth"{\0} &"aeiou"{\0} :=> &"esth"{\0,54} | C28: 0.0316571 | D28: 0.0299288 | E28: 0.0505869 | G28: of:=IF([.C28]=1;"";[.C28]) -> 0.0316571 | H28: of:=IF([.D28]=1;"";[.D28]) -> 0.0299288 | I28: of:=IF([.E28]=1;"";[.E28]) -> 0.0505869
A29: 5 | B29: strpbrk: &"tathe"{\0} &"aeiou"{\0} :=> &"athe"{\0,54} | C29: 0.0329801 | D29: 0.0299288 | E29: 0.0512095 | G29: of:=IF([.C29]=1;"";[.C29]) -> 0.0329801 | H29: of:=IF([.D29]=1;"";[.D29]) -> 0.0299288 | I29: of:=IF([.E29]=1;"";[.E29]) -> 0.0512095
A30: 6 | B30: strpbrk: &"uthes"{\0} &"aeiou"{\0} :=> &"uthes"{\0} | C30: 0.0329073 | D30: 0.0299288 | E30: 0.0329073 | G30: of:=IF([.C30]=1;"";[.C30]) -> 0.0329073 | H30: of:=IF([.D30]=1;"";[.D30]) -> 0.0299288 | I30: of:=IF([.E30]=1;"";[.E30]) -> 0.0329073
A31: 7 | B31: strpbrk: &"orest"{\0} &"aeiou"{\0} :=> &"orest"{\0} | C31: 0.0327935 | D31: 0.0299288 | E31: 0.0327935 | G31: of:=IF([.C31]=1;"";[.C31]) -> 0.0327935 | H31: of:=IF([.D31]=1;"";[.D31]) -> 0.0299288 | I31: of:=IF([.E31]=1;"";[.E31]) -> 0.0327935
A32: 8 | B32: strpbrk: &"inthe"{\0} &"aeiou"{\0} :=> &"inthe"{\0} | C32: 0.0333747 | D32: 0.0299288 | E32: 0.0333747 | G32: of:=IF([.C32]=1;"";[.C32]) -> 0.0333747 | H32: of:=IF([.D32]=1;"";[.D32]) -> 0.0299288 | I32: of:=IF([.E32]=1;"";[.E32]) -> 0.0333747
A33: 9 | B33: strpbrk: &"esthe"{\0} &"aeiou"{\0} :=> &"esthe"{\0} | C33: 0.0332025 | D33: 0.0299288 | E33: 0.0332025 | G33: of:=IF([.C33]=1;"";[.C33]) -> 0.0332025 | H33: of:=IF([.D33]=1;"";[.D33]) -> 0.0299288 | I33: of:=IF([.E33]=1;"";[.E33]) -> 0.0332025
A34: 10 | B34: strpbrk: &"athes"{\0} &"aeiou"{\0} :=> &"athes"{\0} | C34: 0.0333093 | D34: 0.0299288 | E34: 0.0333093 | G34: of:=IF([.C34]=1;"";[.C34]) -> 0.0333093 | H34: of:=IF([.D34]=1;"";[.D34]) -> 0.0299288 | I34: of:=IF([.E34]=1;"";[.E34]) -> 0.0333093