Sheet: strlen
A1: strlen: &"\x01"{\0,\0,\0,\0,\0} :=> 1; | J1: # | K1: Test Case | L1: N | P1: FINAL
A2: strlen: &"\x01\x01"{\0,\0,\0,\0} :=> 2; | J2: 1 | K2: strlen: &"l"{\0,p,k,g,\0} :=> 1 | L2: 1 | N2: of:=IF([.L2]=1;"";[.L2]) ->  | P2: of:=AVERAGE([.N2:.N6]) -> 0.0881863
A3: strlen: &"\x01\x01\x01"{\0,\0,\0} :=> 3; | J3: 2 | K3: strlen: &"ke"{\0,p,g,\0} :=> 2 | L3: 0.217558 | N3: of:=IF([.L3]=1;"";[.L3]) -> 0.217558
A4: strlen: &"\x01\x01\x01\x01"{\0,\0} :=> 4; | J4: 3 | K4: strlen: &"sik"{\0,p,\0} :=> 3 | L4: 0.0856426 | N4: of:=IF([.L4]=1;"";[.L4]) -> 0.0856426
A5: strlen: &"\x01\x01\x01\x01\x01"{\0} :=> 5; | J5: 4 | K5: strlen: &"qfkg"{\0,\0} :=> 4 | L5: 0.023262 | N5: of:=IF([.L5]=1;"";[.L5]) -> 0.023262
A6: strnlen: &""{\0,\0,\0,\0,\0,\0} 6 :=> 0; 1; | J6: 5 | K6: strlen: &"ffffc"{\0} :=> 5 | L6: 0.0262826 | N6: of:=IF([.L6]=1;"";[.L6]) -> 0.0262826
A7: strnlen: &"\x01"{\0,\0,\0,\0,\0} 6 :=> 1; | J7: 1 | K7: strnlen: &""{\0,p,q,l,t,\0} 6 :=> 0 | L7: 1 | N7: of:=IF([.L7]=1;"";[.L7]) ->  | P7: of:=AVERAGE([.N7:.N12]) -> 0.08585525
A8: strnlen: &"\x01\x01"{\0,\0,\0,\0} 6 :=> 2; | J8: 2 | K8: strnlen: &"q"{\0,p,b,r,\0} 6 :=> 1 | L8: 1 | N8: of:=IF([.L8]=1;"";[.L8]) -> 
A9: strnlen: &"\x01\x01\x01"{\0,\0,\0} 6 :=> 3; | J9: 3 | K9: strnlen: &"oo"{\0,p,u,\0} 6 :=> 2 | L9: 0.216638 | N9: of:=IF([.L9]=1;"";[.L9]) -> 0.216638
A10: strnlen: &"\x01\x01\x01\x01"{\0,\0} 6 :=> 4; | J10: 4 | K10: strnlen: &"aqb"{\0,p,\0} 6 :=> 3 | L10: 0.0559734 | N10: of:=IF([.L10]=1;"";[.L10]) -> 0.0559734
A11: strnlen: &"\x01\x01\x01\x01\x01"{\0} 6 :=> 5; | J11: 5 | K11: strnlen: &"hbse"{\0,\0} 6 :=> 4 | L11: 0.0439417 | N11: of:=IF([.L11]=1;"";[.L11]) -> 0.0439417
J12: 6 | K12: strnlen: &"yhonx"{\0} 6 :=> 5 | L12: 0.0268679 | N12: of:=IF([.L12]=1;"";[.L12]) -> 0.0268679

Sheet: strcmp
A1: # | B1: Test Case | C1: N1 | D1: N2 | L1: FINAL
A2: 1 | B2: strcmp: &"w"{\0,p,g,u,\0} &"w"{\0,p,c,i,\0} :=> 0 | C2: 1 | D2: 1 | F2: of:=IF([.C2]=1;"";[.C2]) ->  | G2: of:=IF([.D2]=1;"";[.D2]) ->  | H2: of:=IF([.E2]=1;"";[.E2]) ->   | I2: of:=AVERAGE([.F2:.F16]) -> 0.0448256142857143 | J2: of:=AVERAGE([.G2:.G16]) -> 0.0448887285714286 | L2: of:=AVERAGE([.I2:.J2]) -> 0.0448571714285714
A3: 2 | B3: strcmp: &"ds"{\0,p,a,\0} &"ds"{\0,p,a,\0} :=> 0 | C3: 0.213322 | D3: 0.213322 | F3: of:=IF([.C3]=1;"";[.C3]) -> 0.213322 | G3: of:=IF([.D3]=1;"";[.D3]) -> 0.213322 | H3: of:=IF([.E3]=1;"";[.E3]) ->  
A4: 3 | B4: strcmp: &"hbb"{\0,p,\0} &"hbb"{\0,p,\0} :=> 0 | C4: 0.0764738 | D4: 0.0764738 | F4: of:=IF([.C4]=1;"";[.C4]) -> 0.0764738 | G4: of:=IF([.D4]=1;"";[.D4]) -> 0.0764738 | H4: of:=IF([.E4]=1;"";[.E4]) ->  
A5: 4 | B5: strcmp: &"fije"{\0,\0} &"fije"{\0,\0} :=> 0 | C5: 0.0418538 | D5: 0.0418538 | F5: of:=IF([.C5]=1;"";[.C5]) -> 0.0418538 | G5: of:=IF([.D5]=1;"";[.D5]) -> 0.0418538 | H5: of:=IF([.E5]=1;"";[.E5]) ->  
A6: 5 | B6: strcmp: &"djuon"{\0} &"djuon"{\0} :=> 0 | C6: 0.0272288 | D6: 0.0272288 | F6: of:=IF([.C6]=1;"";[.C6]) -> 0.0272288 | G6: of:=IF([.D6]=1;"";[.D6]) -> 0.0272288 | H6: of:=IF([.E6]=1;"";[.E6]) ->  
A7: 6 | B7: strcmp: &"htuam"{\0} &"htuab"{\0} :=> 1 | C7: 0.0297862 | D7: 0.0296411 | F7: of:=IF([.C7]=1;"";[.C7]) -> 0.0297862 | G7: of:=IF([.D7]=1;"";[.D7]) -> 0.0296411 | H7: of:=IF([.E7]=1;"";[.E7]) ->  
A8: 7 | B8: strcmp: &"ftkgr"{\0} &"ftkgv"{\0} :=> -1 | C8: 0.0249251 | D8: 0.0205638 | F8: of:=IF([.C8]=1;"";[.C8]) -> 0.0249251 | G8: of:=IF([.D8]=1;"";[.D8]) -> 0.0205638 | H8: of:=IF([.E8]=1;"";[.E8]) ->  
A9: 8 | B9: strcmp: &"jkonm"{\0} &"jkogu"{\0} :=> 1 | C9: 0.0245045 | D9: 0.0239105 | F9: of:=IF([.C9]=1;"";[.C9]) -> 0.0245045 | G9: of:=IF([.D9]=1;"";[.D9]) -> 0.0239105 | H9: of:=IF([.E9]=1;"";[.E9]) ->  
A10: 9 | B10: strcmp: &"zmnlb"{\0} &"zmnsh"{\0} :=> -1 | C10: 0.0244371 | D10: 0.0263905 | F10: of:=IF([.C10]=1;"";[.C10]) -> 0.0244371 | G10: of:=IF([.D10]=1;"";[.D10]) -> 0.0263905 | H10: of:=IF([.E10]=1;"";[.E10]) ->  
A11: 10 | B11: strcmp: &"dkhon"{\0} &"dkfel"{\0} :=> 1 | C11: 0.0263766 | D11: 0.0252709 | F11: of:=IF([.C11]=1;"";[.C11]) -> 0.0263766 | G11: of:=IF([.D11]=1;"";[.D11]) -> 0.0252709 | H11: of:=IF([.E11]=1;"";[.E11]) ->  
A12: 11 | B12: strcmp: &"whcya"{\0} &"whidv"{\0} :=> -1 | C12: 0.0263011 | D12: 0.0300107 | F12: of:=IF([.C12]=1;"";[.C12]) -> 0.0263011 | G12: of:=IF([.D12]=1;"";[.D12]) -> 0.0300107
A13: 12 | B13: strcmp: &"shcen"{\0} &"sgaux"{\0} :=> 1 | C13: 0.0287634 | D13: 0.0259865 | F13: of:=IF([.C13]=1;"";[.C13]) -> 0.0287634 | G13: of:=IF([.D13]=1;"";[.D13]) -> 0.0259865
A14: 13 | B14: strcmp: &"llffy"{\0} &"lrret"{\0} :=> -1 | C14: 0.0283573 | D14: 0.0295897 | F14: of:=IF([.C14]=1;"";[.C14]) -> 0.0283573 | G14: of:=IF([.D14]=1;"";[.D14]) -> 0.0295897
A15: 14 | B15: strcmp: &"zhoay"{\0} &"hnrld"{\0} :=> 1 | C15: 0.0276651 | D15: 0.0278928 | F15: of:=IF([.C15]=1;"";[.C15]) -> 0.0276651 | G15: of:=IF([.D15]=1;"";[.D15]) -> 0.0278928
A16: 15 | B16: strcmp: &"tbsae"{\0} &"xewhe"{\0} :=> -1 | C16: 0.0275638 | D16: 0.0303073 | F16: of:=IF([.C16]=1;"";[.C16]) -> 0.0275638 | G16: of:=IF([.D16]=1;"";[.D16]) -> 0.0303073
A17: 1 | B17: strncmp: &""{\0,p,m,o,l,\0} &""{\0,p,a,m,a,\0} 5 :=> 0 | C17: 1 | D17: 1 | F17: of:=IF([.C17]=1;"";[.C17]) ->  | G17: of:=IF([.D17]=1;"";[.D17]) ->  | I17: of:=AVERAGE([.F17:.F32]) -> 0.0439758357142857 | J17: of:=AVERAGE([.G17:.G32]) -> 0.0443716571428571 | L17: of:=AVERAGE([.I17:.J17]) -> 0.0441737464285714
A18: 2 | B18: strncmp: &"k"{\0,p,o,a,\0} &"k"{\0,p,n,e,\0} 5 :=> 0 | C18: 1 | D18: 1 | F18: of:=IF([.C18]=1;"";[.C18]) ->  | G18: of:=IF([.D18]=1;"";[.D18]) -> 
A19: 3 | B19: strncmp: &"qi"{\0,p,j,\0} &"qi"{\0,p,o,\0} 5 :=> 0 | C19: 0.188031 | D19: 0.188031 | F19: of:=IF([.C19]=1;"";[.C19]) -> 0.188031 | G19: of:=IF([.D19]=1;"";[.D19]) -> 0.188031
A20: 4 | B20: strncmp: &"ava"{\0,p,\0} &"ava"{\0,p,\0} 5 :=> 0 | C20: 0.0850115 | D20: 0.0850115 | F20: of:=IF([.C20]=1;"";[.C20]) -> 0.0850115 | G20: of:=IF([.D20]=1;"";[.D20]) -> 0.0850115
A21: 5 | B21: strncmp: &"pwax"{\0,\0} &"pwax"{\0,\0} 5 :=> 0 | C21: 0.0407111 | D21: 0.0407111 | F21: of:=IF([.C21]=1;"";[.C21]) -> 0.0407111 | G21: of:=IF([.D21]=1;"";[.D21]) -> 0.0407111
A22: 6 | B22: strncmp: &"zocae"{\0} &"zocae"{\0} 5 :=> 0 | C22: 0.0278877 | D22: 0.0278877 | F22: of:=IF([.C22]=1;"";[.C22]) -> 0.0278877 | G22: of:=IF([.D22]=1;"";[.D22]) -> 0.0278877
A23: 7 | B23: strncmp: &"btdum"{\0} &"btdub"{\0} 5 :=> 1 | C23: 0.0266226 | D23: 0.0265529 | F23: of:=IF([.C23]=1;"";[.C23]) -> 0.0266226 | G23: of:=IF([.D23]=1;"";[.D23]) -> 0.0265529
A24: 8 | B24: strncmp: &"boboo"{\0} &"bobot"{\0} 5 :=> -1 | C24: 0.029745 | D24: 0.0299234 | F24: of:=IF([.C24]=1;"";[.C24]) -> 0.029745 | G24: of:=IF([.D24]=1;"";[.D24]) -> 0.0299234
A25: 9 | B25: strncmp: &"jcoxw"{\0} &"jcoad"{\0} 5 :=> 1 | C25: 0.0224836 | D25: 0.0254976 | F25: of:=IF([.C25]=1;"";[.C25]) -> 0.0224836 | G25: of:=IF([.D25]=1;"";[.D25]) -> 0.0254976
A26: 10 | B26: strncmp: &"drrue"{\0} &"drryt"{\0} 5 :=> -1 | C26: 0.0292261 | D26: 0.0284791 | F26: of:=IF([.C26]=1;"";[.C26]) -> 0.0292261 | G26: of:=IF([.D26]=1;"";[.D26]) -> 0.0284791
A27: 11 | B27: strncmp: &"gaqud"{\0} &"gapse"{\0} 5 :=> 1 | C27: 0.0280095 | D27: 0.0299228 | F27: of:=IF([.C27]=1;"";[.C27]) -> 0.0280095 | G27: of:=IF([.D27]=1;"";[.D27]) -> 0.0299228
A28: 12 | B28: strncmp: &"olsid"{\0} &"olvge"{\0} 5 :=> -1 | C28: 0.0308543 | D28: 0.0259987 | F28: of:=IF([.C28]=1;"";[.C28]) -> 0.0308543 | G28: of:=IF([.D28]=1;"";[.D28]) -> 0.0259987
A29: 13 | B29: strncmp: &"ccasw"{\0} &"carnb"{\0} 5 :=> 1 | C29: 0.029462 | D29: 0.0296317 | F29: of:=IF([.C29]=1;"";[.C29]) -> 0.029462 | G29: of:=IF([.D29]=1;"";[.D29]) -> 0.0296317
A30: 14 | B30: strncmp: &"snteq"{\0} &"stedg"{\0} 5 :=> -1 | C30: 0.0294308 | D30: 0.0312078 | F30: of:=IF([.C30]=1;"";[.C30]) -> 0.0294308 | G30: of:=IF([.D30]=1;"";[.D30]) -> 0.0312078
A31: 15 | B31: strncmp: &"viacw"{\0} &"hrvgu"{\0} 5 :=> 1 | C31: 0.0252616 | D31: 0.0259732 | F31: of:=IF([.C31]=1;"";[.C31]) -> 0.0252616 | G31: of:=IF([.D31]=1;"";[.D31]) -> 0.0259732
A32: 16 | B32: strncmp: &"ywpka"{\0} &"zgitc"{\0} 5 :=> -1 | C32: 0.0229249 | D32: 0.0263747 | F32: of:=IF([.C32]=1;"";[.C32]) -> 0.0229249 | G32: of:=IF([.D32]=1;"";[.D32]) -> 0.0263747
A33: 1 | B33: sysfs_streq: &""{\0,p,e,d,i,\0} &"uokkr"{\0} :=> \0 | C33: 1 | D33: 0.0248563 | F33: of:=IF([.C33]=1;"";[.C33]) ->  | G33: of:=IF([.D33]=1;"";[.D33]) -> 0.0248563 | I33: of:=AVERAGE([.F33:.F71]) -> 0.0700223482758621 | J33: of:=AVERAGE([.G33:.G71]) -> 0.0447365857142857 | L33: of:=AVERAGE([.I33:.J33]) -> 0.0573794669950739
A34: 2 | B34: sysfs_streq: &""{\0,p,o,d,v,\0} &"\n"{\0,b,b,e,\0} :=> \x01 | C34: 1 | F34: of:=IF([.C34]=1;"";[.C34]) ->  | G34: of:=IF([.D34]=1;"";[.D34]) ->  
A35: 3 | B35: sysfs_streq: &""{\0,p,t,h,m,\0} &"\nabey"{\0} :=> \0 | C35: 1 | F35: of:=IF([.C35]=1;"";[.C35]) ->  | G35: of:=IF([.D35]=1;"";[.D35]) ->  
A36: 4 | B36: sysfs_streq: &""{\0,p,e,d,e,\0} &""{\0,h,s,t,e,\0} :=> \x01 | C36: 1 | D36: 1 | F36: of:=IF([.C36]=1;"";[.C36]) ->  | G36: of:=IF([.D36]=1;"";[.D36]) -> 
A37: 5 | B37: sysfs_streq: &"zqask"{\0} &"cilll"{\0} :=> \0 | C37: 0.0208724 | D37: 0.0313299 | F37: of:=IF([.C37]=1;"";[.C37]) -> 0.0208724 | G37: of:=IF([.D37]=1;"";[.D37]) -> 0.0313299
A38: 6 | B38: sysfs_streq: &"\n"{\0,p,s,w,\0} &""{\0,a,y,x,f,\0} :=> \x01 | C38: 1 | F38: of:=IF([.C38]=1;"";[.C38]) ->  | G38: of:=IF([.D38]=1;"";[.D38]) ->  
A39: 7 | B39: sysfs_streq: &"\n"{\0,a,u,a,\0} &"daldc"{\0} :=> \0 | C39: 0.0290734 | F39: of:=IF([.C39]=1;"";[.C39]) -> 0.0290734 | G39: of:=IF([.D39]=1;"";[.D39]) ->  
A40: 8 | B40: sysfs_streq: &"\nareb"{\0} &"vivee"{\0} :=> \0 | C40: 0.0310388 | F40: of:=IF([.C40]=1;"";[.C40]) -> 0.0310388 | G40: of:=IF([.D40]=1;"";[.D40]) ->  
A41: 9 | B41: sysfs_streq: &"x"{\0,p,d,g,\0} &"xldno"{\0} :=> \0 | C41: 1 | D41: 0.0261594 | F41: of:=IF([.C41]=1;"";[.C41]) ->  | G41: of:=IF([.D41]=1;"";[.D41]) -> 0.0261594
A42: 10 | B42: sysfs_streq: &"i"{\0,p,w,h,\0} &"i\n"{\0,a,p,\0} :=> \x01 | C42: 1 | F42: of:=IF([.C42]=1;"";[.C42]) ->  | G42: of:=IF([.D42]=1;"";[.D42]) ->  
A43: 11 | B43: sysfs_streq: &"e"{\0,p,y,o,\0} &"e\nawp"{\0} :=> \0 | C43: 1 | F43: of:=IF([.C43]=1;"";[.C43]) ->  | G43: of:=IF([.D43]=1;"";[.D43]) ->  
A44: 12 | B44: sysfs_streq: &"q"{\0,p,i,c,\0} &"q"{\0,h,d,a,\0} :=> \x01 | C44: 1 | D44: 1 | F44: of:=IF([.C44]=1;"";[.C44]) ->  | G44: of:=IF([.D44]=1;"";[.D44]) -> 
A45: 13 | B45: sysfs_streq: &"urkfg"{\0} &"ubslx"{\0} :=> \0 | C45: 0.0255643 | D45: 0.0242226 | F45: of:=IF([.C45]=1;"";[.C45]) -> 0.0255643 | G45: of:=IF([.D45]=1;"";[.D45]) -> 0.0242226
A46: 14 | B46: sysfs_streq: &"a\n"{\0,b,p,\0} &"a"{\0,b,y,y,\0} :=> \x01 | C46: 1 | F46: of:=IF([.C46]=1;"";[.C46]) ->  | G46: of:=IF([.D46]=1;"";[.D46]) ->  
A47: 15 | B47: sysfs_streq: &"o\n"{\0,b,l,\0} &"onfnd"{\0} :=> \0 | C47: 0.0276339 | F47: of:=IF([.C47]=1;"";[.C47]) -> 0.0276339 | G47: of:=IF([.D47]=1;"";[.D47]) ->  
A48: 16 | B48: sysfs_streq: &"m\naor"{\0} &"msggm"{\0} :=> \0 | C48: 0.025226 | F48: of:=IF([.C48]=1;"";[.C48]) -> 0.025226 | G48: of:=IF([.D48]=1;"";[.D48]) ->  
A49: 17 | B49: sysfs_streq: &"ju"{\0,p,a,\0} &"jukwa"{\0} :=> \0 | C49: 0.208818 | D49: 0.0263176 | F49: of:=IF([.C49]=1;"";[.C49]) -> 0.208818 | G49: of:=IF([.D49]=1;"";[.D49]) -> 0.0263176
A50: 18 | B50: sysfs_streq: &"ws"{\0,p,s,\0} &"ws\n"{\0,a,\0} :=> \x01 | C50: 0.2083 | F50: of:=IF([.C50]=1;"";[.C50]) -> 0.2083 | G50: of:=IF([.D50]=1;"";[.D50]) ->  
A51: 19 | B51: sysfs_streq: &"om"{\0,p,a,\0} &"om\nah"{\0} :=> \0 | C51: 0.220689 | F51: of:=IF([.C51]=1;"";[.C51]) -> 0.220689 | G51: of:=IF([.D51]=1;"";[.D51]) ->  
A52: 20 | B52: sysfs_streq: &"oh"{\0,p,g,\0} &"oh"{\0,b,u,\0} :=> \x01 | C52: 0.205266 | D52: 0.205266 | F52: of:=IF([.C52]=1;"";[.C52]) -> 0.205266 | G52: of:=IF([.D52]=1;"";[.D52]) -> 0.205266
A53: 21 | B53: sysfs_streq: &"henii"{\0} &"hetar"{\0} :=> \0 | C53: 0.0297008 | D53: 0.0322414 | F53: of:=IF([.C53]=1;"";[.C53]) -> 0.0297008 | G53: of:=IF([.D53]=1;"";[.D53]) -> 0.0322414
A54: 22 | B54: sysfs_streq: &"xe\n"{\0,b,\0} &"xe"{\0,b,h,\0} :=> \x01 | C54: 0.206238 | F54: of:=IF([.C54]=1;"";[.C54]) -> 0.206238 | G54: of:=IF([.D54]=1;"";[.D54]) ->  
A55: 23 | B55: sysfs_streq: &"vi\n"{\0,b,\0} &"vihbu"{\0} :=> \0 | C55: 0.0264821 | F55: of:=IF([.C55]=1;"";[.C55]) -> 0.0264821 | G55: of:=IF([.D55]=1;"";[.D55]) ->  
A56: 24 | B56: sysfs_streq: &"pe\nao"{\0} &"peydq"{\0} :=> \0 | C56: 0.0265693 | F56: of:=IF([.C56]=1;"";[.C56]) -> 0.0265693 | G56: of:=IF([.D56]=1;"";[.D56]) ->  
A57: 25 | B57: sysfs_streq: &"iog"{\0,p,\0} &"iogya"{\0} :=> \0 | C57: 0.0862429 | D57: 0.028184 | F57: of:=IF([.C57]=1;"";[.C57]) -> 0.0862429 | G57: of:=IF([.D57]=1;"";[.D57]) -> 0.028184
A58: 26 | B58: sysfs_streq: &"quj"{\0,p,\0} &"quj\n"{\0,\0} :=> \x01 | C58: 0.0745979 | F58: of:=IF([.C58]=1;"";[.C58]) -> 0.0745979 | G58: of:=IF([.D58]=1;"";[.D58]) ->  
A59: 27 | B59: sysfs_streq: &"qup"{\0,p,\0} &"qup\na"{\0} :=> \0 | C59: 0.0845727 | F59: of:=IF([.C59]=1;"";[.C59]) -> 0.0845727 | G59: of:=IF([.D59]=1;"";[.D59]) ->  
A60: 28 | B60: sysfs_streq: &"zyc"{\0,p,\0} &"zyc"{\0,h,\0} :=> \x01 | C60: 0.0736899 | D60: 0.0736899 | F60: of:=IF([.C60]=1;"";[.C60]) -> 0.0736899 | G60: of:=IF([.D60]=1;"";[.D60]) -> 0.0736899
A61: 29 | B61: sysfs_streq: &"mpiry"{\0} &"mpigu"{\0} :=> \0 | C61: 0.0301231 | D61: 0.0297018 | F61: of:=IF([.C61]=1;"";[.C61]) -> 0.0301231 | G61: of:=IF([.D61]=1;"";[.D61]) -> 0.0297018
A62: 30 | B62: sysfs_streq: &"zoe\n"{\0,\0} &"zoe"{\0,a,\0} :=> \x01 | C62: 0.0776858 | F62: of:=IF([.C62]=1;"";[.C62]) -> 0.0776858 | G62: of:=IF([.D62]=1;"";[.D62]) ->  
A63: 31 | B63: sysfs_streq: &"hkp\n"{\0,\0} &"hkpac"{\0} :=> \0 | C63: 0.0254138 | F63: of:=IF([.C63]=1;"";[.C63]) -> 0.0254138 | G63: of:=IF([.D63]=1;"";[.D63]) ->  
A64: 32 | B64: sysfs_streq: &"kop\na"{\0} &"kopuc"{\0} :=> \0 | C64: 0.0284916 | F64: of:=IF([.C64]=1;"";[.C64]) -> 0.0284916 | G64: of:=IF([.D64]=1;"";[.D64]) ->  
A65: 33 | B65: sysfs_streq: &"vomp"{\0,\0} &"vompe"{\0} :=> \0 | C65: 0.0466578 | D65: 0.0303809 | F65: of:=IF([.C65]=1;"";[.C65]) -> 0.0466578 | G65: of:=IF([.D65]=1;"";[.D65]) -> 0.0303809
A66: 34 | B66: sysfs_streq: &"alox"{\0,\0} &"alox\n"{\0} :=> \x01 | C66: 0.0456426 | F66: of:=IF([.C66]=1;"";[.C66]) -> 0.0456426 | G66: of:=IF([.D66]=1;"";[.D66]) ->  
A67: 35 | B67: sysfs_streq: &"prwu"{\0,\0} &"prwu"{\0,\0} :=> \x01 | C67: 0.0386928 | D67: 0.0386928 | F67: of:=IF([.C67]=1;"";[.C67]) -> 0.0386928 | G67: of:=IF([.D67]=1;"";[.D67]) -> 0.0386928
A68: 36 | B68: sysfs_streq: &"eatyl"{\0} &"eatyi"{\0} :=> \0 | C68: 0.0301485 | D68: 0.0305368 | F68: of:=IF([.C68]=1;"";[.C68]) -> 0.0301485 | G68: of:=IF([.D68]=1;"";[.D68]) -> 0.0305368
A69: 37 | B69: sysfs_streq: &"fyan\n"{\0} &"fyan"{\0,\0} :=> \x01 | C69: 0.0436313 | F69: of:=IF([.C69]=1;"";[.C69]) -> 0.0436313 | G69: of:=IF([.D69]=1;"";[.D69]) ->  
A70: 38 | B70: sysfs_streq: &"saea\n"{\0} &"saeae"{\0} :=> \0 | C70: 0.0288526 | F70: of:=IF([.C70]=1;"";[.C70]) -> 0.0288526 | G70: of:=IF([.D70]=1;"";[.D70]) ->  
A71: 39 | B71: sysfs_streq: &"huccp"{\0} &"huccp"{\0} :=> \x01 | C71: 0.0247328 | D71: 0.0247328 | F71: of:=IF([.C71]=1;"";[.C71]) -> 0.0247328 | G71: of:=IF([.D71]=1;"";[.D71]) -> 0.0247328

Sheet: strcpy
A1: # | B1: Test Case | C1: N1 | D1: N2 | E1: N3 | O1: FINAL
A2: 1 | B2: strcpy: &""{\0,\x01,\x01,\x01,\x01,\x01} &"y"{\0,p,v,t,\0} :=> &"y"{\0,p,p,u,\0} | C2: 1 | D2: 1 | E2: 1 | G2: of:=IF([.C2]=1;"";[.C2]) ->  | H2: of:=IF([.D2]=1;"";[.D2]) ->  | I2: of:=IF([.E2]=1;"";[.E2]) ->  | K2: of:=AVERAGE([.G2:.G36]) -> 0.0848842 | L2: of:=AVERAGE([.H2:.H36]) -> 0.0845108125 | M2: of:=AVERAGE([.I2:.I36]) -> 0.0845108125 | O2: of:=AVERAGE([.K2:.M2]) -> 0.084635275
A3: 2 | B3: strcpy: &""{\0,\x01,\x01,\x01,\x01,\x01} &"je"{\0,p,d,\0} :=> &"je"{\0,p,d,\0} | C3: 1 | D3: 0.205048 | E3: 0.205048 | G3: of:=IF([.C3]=1;"";[.C3]) ->  | H3: of:=IF([.D3]=1;"";[.D3]) -> 0.205048 | I3: of:=IF([.E3]=1;"";[.E3]) -> 0.205048
A4: 3 | B4: strcpy: &""{\0,\x01,\x01,\x01,\x01,\x01} &"rby"{\0,p,\0} :=> &"rby"{\0,p,\0} | C4: 1 | D4: 0.0827957 | E4: 0.0827957 | G4: of:=IF([.C4]=1;"";[.C4]) ->  | H4: of:=IF([.D4]=1;"";[.D4]) -> 0.0827957 | I4: of:=IF([.E4]=1;"";[.E4]) -> 0.0827957
A5: 4 | B5: strcpy: &""{\0,\x01,\x01,\x01,\x01,\x01} &"piap"{\0,\0} :=> &"piap"{\0,\0} | C5: 1 | D5: 0.0463821 | E5: 0.0463821 | G5: of:=IF([.C5]=1;"";[.C5]) ->  | H5: of:=IF([.D5]=1;"";[.D5]) -> 0.0463821 | I5: of:=IF([.E5]=1;"";[.E5]) -> 0.0463821
A6: 5 | B6: strcpy: &""{\0,\x01,\x01,\x01,\x01,\x01} &"wahia"{\0} :=> &"wahia"{\0} | C6: 1 | D6: 0.0297402 | E6: 0.0297402 | G6: of:=IF([.C6]=1;"";[.C6]) ->  | H6: of:=IF([.D6]=1;"";[.D6]) -> 0.0297402 | I6: of:=IF([.E6]=1;"";[.E6]) -> 0.0297402
A7: 6 | B7: strcpy: &"q"{\0,\x01,\x01,\x01,\x01} &""{\0,p,r,k,w,\0} :=> &""{\0,\0,p,i,s,\0} | C7: 1 | D7: 1 | E7: 1 | G7: of:=IF([.C7]=1;"";[.C7]) ->  | H7: of:=IF([.D7]=1;"";[.D7]) ->  | I7: of:=IF([.E7]=1;"";[.E7]) -> 
A8: 7 | B8: strcpy: &"y"{\0,\x01,\x01,\x01,\x01} &"z"{\0,p,d,a,\0} :=> &"z"{\0,p,q,u,\0} | C8: 1 | D8: 1 | E8: 1 | G8: of:=IF([.C8]=1;"";[.C8]) ->  | H8: of:=IF([.D8]=1;"";[.D8]) ->  | I8: of:=IF([.E8]=1;"";[.E8]) -> 
A9: 8 | B9: strcpy: &"d"{\0,\x01,\x01,\x01,\x01} &"aj"{\0,p,c,\0} :=> &"aj"{\0,p,e,\0} | C9: 1 | D9: 0.203053 | E9: 0.203053 | G9: of:=IF([.C9]=1;"";[.C9]) ->  | H9: of:=IF([.D9]=1;"";[.D9]) -> 0.203053 | I9: of:=IF([.E9]=1;"";[.E9]) -> 0.203053
A10: 9 | B10: strcpy: &"a"{\0,\x01,\x01,\x01,\x01} &"fee"{\0,p,\0} :=> &"fee"{\0,p,\0} | C10: 1 | D10: 0.0869587 | E10: 0.0869587 | G10: of:=IF([.C10]=1;"";[.C10]) ->  | H10: of:=IF([.D10]=1;"";[.D10]) -> 0.0869587 | I10: of:=IF([.E10]=1;"";[.E10]) -> 0.0869587
A11: 10 | B11: strcpy: &"b"{\0,\x01,\x01,\x01,\x01} &"fcdt"{\0,\0} :=> &"fcdt"{\0,\0} | C11: 1 | D11: 0.0332077 | E11: 0.0332077 | G11: of:=IF([.C11]=1;"";[.C11]) ->  | H11: of:=IF([.D11]=1;"";[.D11]) -> 0.0332077 | I11: of:=IF([.E11]=1;"";[.E11]) -> 0.0332077
A12: 11 | B12: strcpy: &"k"{\0,\x01,\x01,\x01,\x01} &"zeswm"{\0} :=> &"zeswm"{\0} | C12: 1 | D12: 0.0273237 | E12: 0.0273237 | G12: of:=IF([.C12]=1;"";[.C12]) ->  | H12: of:=IF([.D12]=1;"";[.D12]) -> 0.0273237 | I12: of:=IF([.E12]=1;"";[.E12]) -> 0.0273237
A13: 12 | B13: strcpy: &"zp"{\0,\x01,\x01,\x01} &""{\0,p,s,w,l,\0} :=> &""{\0,p,\0,p,o,\0} | C13: 0.174983 | D13: 1 | E13: 1 | G13: of:=IF([.C13]=1;"";[.C13]) -> 0.174983 | H13: of:=IF([.D13]=1;"";[.D13]) ->  | I13: of:=IF([.E13]=1;"";[.E13]) -> 
A14: 13 | B14: strcpy: &"xo"{\0,\x01,\x01,\x01} &"c"{\0,p,b,n,\0} :=> &"c"{\0,\0,p,u,\0} | C14: 0.19365 | D14: 1 | E14: 1 | G14: of:=IF([.C14]=1;"";[.C14]) -> 0.19365 | H14: of:=IF([.D14]=1;"";[.D14]) ->  | I14: of:=IF([.E14]=1;"";[.E14]) -> 
A15: 14 | B15: strcpy: &"bb"{\0,\x01,\x01,\x01} &"zs"{\0,p,y,\0} :=> &"zs"{\0,p,t,\0} | C15: 0.202885 | D15: 0.174983 | E15: 0.174983 | G15: of:=IF([.C15]=1;"";[.C15]) -> 0.202885 | H15: of:=IF([.D15]=1;"";[.D15]) -> 0.174983 | I15: of:=IF([.E15]=1;"";[.E15]) -> 0.174983
A16: 15 | B16: strcpy: &"uc"{\0,\x01,\x01,\x01} &"ruj"{\0,p,\0} :=> &"ruj"{\0,p,\0} | C16: 0.214762 | D16: 0.0747343 | E16: 0.0747343 | G16: of:=IF([.C16]=1;"";[.C16]) -> 0.214762 | H16: of:=IF([.D16]=1;"";[.D16]) -> 0.0747343 | I16: of:=IF([.E16]=1;"";[.E16]) -> 0.0747343
A17: 16 | B17: strcpy: &"kg"{\0,\x01,\x01,\x01} &"rchf"{\0,\0} :=> &"rchf"{\0,\0} | C17: 0.185944 | D17: 0.0428209 | E17: 0.0428209 | G17: of:=IF([.C17]=1;"";[.C17]) -> 0.185944 | H17: of:=IF([.D17]=1;"";[.D17]) -> 0.0428209 | I17: of:=IF([.E17]=1;"";[.E17]) -> 0.0428209
A18: 17 | B18: strcpy: &"hl"{\0,\x01,\x01,\x01} &"psurv"{\0} :=> &"psurv"{\0} | C18: 0.202885 | D18: 0.0302255 | E18: 0.0302255 | G18: of:=IF([.C18]=1;"";[.C18]) -> 0.202885 | H18: of:=IF([.D18]=1;"";[.D18]) -> 0.0302255 | I18: of:=IF([.E18]=1;"";[.E18]) -> 0.0302255
A19: 18 | B19: strcpy: &"bni"{\0,\x01,\x01} &""{\0,p,k,h,m,\0} :=> &""{\0,n,i,\0,p,\0} | C19: 0.0751789 | D19: 1 | E19: 1 | G19: of:=IF([.C19]=1;"";[.C19]) -> 0.0751789 | H19: of:=IF([.D19]=1;"";[.D19]) ->  | I19: of:=IF([.E19]=1;"";[.E19]) -> 
A20: 19 | B20: strcpy: &"nmt"{\0,\x01,\x01} &"x"{\0,p,e,j,\0} :=> &"x"{\0,t,\0,p,\0} | C20: 0.0726972 | D20: 1 | E20: 1 | G20: of:=IF([.C20]=1;"";[.C20]) -> 0.0726972 | H20: of:=IF([.D20]=1;"";[.D20]) ->  | I20: of:=IF([.E20]=1;"";[.E20]) -> 
A21: 20 | B21: strcpy: &"qaf"{\0,\x01,\x01} &"mv"{\0,p,g,\0} :=> &"mv"{\0,\0,p,\0} | C21: 0.0658666 | D21: 0.169938 | E21: 0.169938 | G21: of:=IF([.C21]=1;"";[.C21]) -> 0.0658666 | H21: of:=IF([.D21]=1;"";[.D21]) -> 0.169938 | I21: of:=IF([.E21]=1;"";[.E21]) -> 0.169938
A22: 21 | B22: strcpy: &"zaa"{\0,\x01,\x01} &"jkb"{\0,p,\0} :=> &"jkb"{\0,p,\0} | C22: 0.0755493 | D22: 0.061828 | E22: 0.061828 | G22: of:=IF([.C22]=1;"";[.C22]) -> 0.0755493 | H22: of:=IF([.D22]=1;"";[.D22]) -> 0.061828 | I22: of:=IF([.E22]=1;"";[.E22]) -> 0.061828
A23: 22 | B23: strcpy: &"rvi"{\0,\x01,\x01} &"trow"{\0,\0} :=> &"trow"{\0,\0} | C23: 0.0881292 | D23: 0.0481765 | E23: 0.0481765 | G23: of:=IF([.C23]=1;"";[.C23]) -> 0.0881292 | H23: of:=IF([.D23]=1;"";[.D23]) -> 0.0481765 | I23: of:=IF([.E23]=1;"";[.E23]) -> 0.0481765
A24: 23 | B24: strcpy: &"jui"{\0,\x01,\x01} &"meyew"{\0} :=> &"meyew"{\0} | C24: 0.0826895 | D24: 0.0304062 | E24: 0.0304062 | G24: of:=IF([.C24]=1;"";[.C24]) -> 0.0826895 | H24: of:=IF([.D24]=1;"";[.D24]) -> 0.0304062 | I24: of:=IF([.E24]=1;"";[.E24]) -> 0.0304062
A25: 24 | B25: strcpy: &"nuaf"{\0,\x01} &""{\0,p,i,c,q,\0} :=> &""{\0,u,a,f,\0,\0} | C25: 0.04495 | D25: 1 | E25: 1 | G25: of:=IF([.C25]=1;"";[.C25]) -> 0.04495 | H25: of:=IF([.D25]=1;"";[.D25]) ->  | I25: of:=IF([.E25]=1;"";[.E25]) -> 
A26: 25 | B26: strcpy: &"kbki"{\0,\x01} &"z"{\0,p,e,f,\0} :=> &"z"{\0,k,i,\0,\0} | C26: 0.0347847 | D26: 1 | E26: 1 | G26: of:=IF([.C26]=1;"";[.C26]) -> 0.0347847 | H26: of:=IF([.D26]=1;"";[.D26]) ->  | I26: of:=IF([.E26]=1;"";[.E26]) -> 
A27: 26 | B27: strcpy: &"iskb"{\0,\x01} &"tf"{\0,p,e,\0} :=> &"tf"{\0,b,\0,\0} | C27: 0.0426802 | D27: 0.197488 | E27: 0.197488 | G27: of:=IF([.C27]=1;"";[.C27]) -> 0.0426802 | H27: of:=IF([.D27]=1;"";[.D27]) -> 0.197488 | I27: of:=IF([.E27]=1;"";[.E27]) -> 0.197488
A28: 27 | B28: strcpy: &"fmmi"{\0,\x01} &"qtr"{\0,p,\0} :=> &"qtr"{\0,\0,\0} | C28: 0.0419136 | D28: 0.060979 | E28: 0.060979 | G28: of:=IF([.C28]=1;"";[.C28]) -> 0.0419136 | H28: of:=IF([.D28]=1;"";[.D28]) -> 0.060979 | I28: of:=IF([.E28]=1;"";[.E28]) -> 0.060979
A29: 28 | B29: strcpy: &"gylw"{\0,\x01} &"vnpj"{\0,\0} :=> &"vnpj"{\0,\0} | C29: 0.0409068 | D29: 0.0333959 | E29: 0.0333959 | G29: of:=IF([.C29]=1;"";[.C29]) -> 0.0409068 | H29: of:=IF([.D29]=1;"";[.D29]) -> 0.0333959 | I29: of:=IF([.E29]=1;"";[.E29]) -> 0.0333959
A30: 29 | B30: strcpy: &"duac"{\0,\x01} &"ekmsm"{\0} :=> &"ekmsm"{\0} | C30: 0.0462282 | D30: 0.0263221 | E30: 0.0263221 | G30: of:=IF([.C30]=1;"";[.C30]) -> 0.0462282 | H30: of:=IF([.D30]=1;"";[.D30]) -> 0.0263221 | I30: of:=IF([.E30]=1;"";[.E30]) -> 0.0263221
A31: 30 | B31: strcpy: &"qvckg"{\0} &""{\0,p,r,a,u,\0} :=> &""{\0,v,c,k,g,\0} | C31: 0.0192645 | D31: 1 | E31: 1 | G31: of:=IF([.C31]=1;"";[.C31]) -> 0.0192645 | H31: of:=IF([.D31]=1;"";[.D31]) ->  | I31: of:=IF([.E31]=1;"";[.E31]) -> 
A32: 31 | B32: strcpy: &"moqvo"{\0} &"s"{\0,p,y,w,\0} :=> &"s"{\0,q,v,o,\0} | C32: 0.0209298 | D32: 1 | E32: 1 | G32: of:=IF([.C32]=1;"";[.C32]) -> 0.0209298 | H32: of:=IF([.D32]=1;"";[.D32]) ->  | I32: of:=IF([.E32]=1;"";[.E32]) -> 
A33: 32 | B33: strcpy: &"vinty"{\0} &"ol"{\0,p,c,\0} :=> &"ol"{\0,t,y,\0} | C33: 0.0316466 | D33: 0.218466 | E33: 0.218466 | G33: of:=IF([.C33]=1;"";[.C33]) -> 0.0316466 | H33: of:=IF([.D33]=1;"";[.D33]) -> 0.218466 | I33: of:=IF([.E33]=1;"";[.E33]) -> 0.218466
A34: 33 | B34: strcpy: &"cotoq"{\0} &"wcy"{\0,p,\0} :=> &"wcy"{\0,q,\0} | C34: 0.0287496 | D34: 0.0734877 | E34: 0.0734877 | G34: of:=IF([.C34]=1;"";[.C34]) -> 0.0287496 | H34: of:=IF([.D34]=1;"";[.D34]) -> 0.0734877 | I34: of:=IF([.E34]=1;"";[.E34]) -> 0.0734877
A35: 34 | B35: strcpy: &"cveea"{\0} &"ffma"{\0,\0} :=> &"ffma"{\0,\0} | C35: 0.0242518 | D35: 0.0424051 | E35: 0.0424051 | G35: of:=IF([.C35]=1;"";[.C35]) -> 0.0242518 | H35: of:=IF([.D35]=1;"";[.D35]) -> 0.0424051 | I35: of:=IF([.E35]=1;"";[.E35]) -> 0.0424051
A36: 35 | B36: strcpy: &"psbna"{\0} &"dnucy"{\0} :=> &"dnucy"{\0} | C36: 0.0256953 | D36: 0.0280942 | E36: 0.0280942 | G36: of:=IF([.C36]=1;"";[.C36]) -> 0.0256953 | H36: of:=IF([.D36]=1;"";[.D36]) -> 0.0280942 | I36: of:=IF([.E36]=1;"";[.E36]) -> 0.0280942
A37: 1 | B37: strncpy: &""{\0,\x01,\x01,\x01,\x01,\x01} &""{\0,p,s,p,s,\0} 5 :=> &""{\0,\0,\0,\0,\0,\0} | C37: 1 | D37: 1 | E37: 1 | G37: of:=IF([.C37]=1;"";[.C37]) ->  | H37: of:=IF([.D37]=1;"";[.D37]) ->  | I37: of:=IF([.E37]=1;"";[.E37]) ->  | K37: of:=AVERAGE([.G37:.G72]) -> 0.0867547875 | L37: of:=AVERAGE([.H37:.H72]) -> 0.0869909041666667 | M37: of:=AVERAGE([.I37:.I72]) -> 0.0869909041666667 | O37: of:=AVERAGE([.K37:.M37]) -> 0.0869121986111111
A38: 2 | B38: strncpy: &""{\0,\x01,\x01,\x01,\x01,\x01} &"n"{\0,p,k,u,\0} 5 :=> &"n"{\0,\0,\0,\0,\0} | C38: 1 | D38: 1 | E38: 1 | G38: of:=IF([.C38]=1;"";[.C38]) ->  | H38: of:=IF([.D38]=1;"";[.D38]) ->  | I38: of:=IF([.E38]=1;"";[.E38]) -> 
A39: 3 | B39: strncpy: &""{\0,\x01,\x01,\x01,\x01,\x01} &"ar"{\0,p,a,\0} 5 :=> &"ar"{\0,\0,\0,\0} | C39: 1 | D39: 0.223692 | E39: 0.223692 | G39: of:=IF([.C39]=1;"";[.C39]) ->  | H39: of:=IF([.D39]=1;"";[.D39]) -> 0.223692 | I39: of:=IF([.E39]=1;"";[.E39]) -> 0.223692
A40: 4 | B40: strncpy: &""{\0,\x01,\x01,\x01,\x01,\x01} &"kpl"{\0,p,\0} 5 :=> &"kpl"{\0,\0,\0} | C40: 1 | D40: 0.0765854 | E40: 0.0765854 | G40: of:=IF([.C40]=1;"";[.C40]) ->  | H40: of:=IF([.D40]=1;"";[.D40]) -> 0.0765854 | I40: of:=IF([.E40]=1;"";[.E40]) -> 0.0765854
A41: 5 | B41: strncpy: &""{\0,\x01,\x01,\x01,\x01,\x01} &"gnvi"{\0,\0} 5 :=> &"gnvi"{\0,\0} | C41: 1 | D41: 0.0452431 | E41: 0.0452431 | G41: of:=IF([.C41]=1;"";[.C41]) ->  | H41: of:=IF([.D41]=1;"";[.D41]) -> 0.0452431 | I41: of:=IF([.E41]=1;"";[.E41]) -> 0.0452431
A42: 6 | B42: strncpy: &""{\0,\x01,\x01,\x01,\x01,\x01} &"vlglb"{\0} 5 :=> &"vlglb"{\0} | C42: 1 | D42: 0.0238722 | E42: 0.0238722 | G42: of:=IF([.C42]=1;"";[.C42]) ->  | H42: of:=IF([.D42]=1;"";[.D42]) -> 0.0238722 | I42: of:=IF([.E42]=1;"";[.E42]) -> 0.0238722
A43: 7 | B43: strncpy: &"p"{\0,\x01,\x01,\x01,\x01} &""{\0,p,m,s,k,\0} 5 :=> &""{\0,\0,\0,\0,\0,\0} | C43: 1 | D43: 1 | E43: 1 | G43: of:=IF([.C43]=1;"";[.C43]) ->  | H43: of:=IF([.D43]=1;"";[.D43]) ->  | I43: of:=IF([.E43]=1;"";[.E43]) -> 
A44: 8 | B44: strncpy: &"n"{\0,\x01,\x01,\x01,\x01} &"z"{\0,p,d,m,\0} 5 :=> &"z"{\0,\0,\0,\0,\0} | C44: 1 | D44: 1 | E44: 1 | G44: of:=IF([.C44]=1;"";[.C44]) ->  | H44: of:=IF([.D44]=1;"";[.D44]) ->  | I44: of:=IF([.E44]=1;"";[.E44]) -> 
A45: 9 | B45: strncpy: &"y"{\0,\x01,\x01,\x01,\x01} &"cb"{\0,p,p,\0} 5 :=> &"cb"{\0,\0,\0,\0} | C45: 1 | D45: 0.166477 | E45: 0.166477 | G45: of:=IF([.C45]=1;"";[.C45]) ->  | H45: of:=IF([.D45]=1;"";[.D45]) -> 0.166477 | I45: of:=IF([.E45]=1;"";[.E45]) -> 0.166477
A46: 10 | B46: strncpy: &"w"{\0,\x01,\x01,\x01,\x01} &"due"{\0,p,\0} 5 :=> &"due"{\0,\0,\0} | C46: 1 | D46: 0.0847273 | E46: 0.0847273 | G46: of:=IF([.C46]=1;"";[.C46]) ->  | H46: of:=IF([.D46]=1;"";[.D46]) -> 0.0847273 | I46: of:=IF([.E46]=1;"";[.E46]) -> 0.0847273
A47: 11 | B47: strncpy: &"g"{\0,\x01,\x01,\x01,\x01} &"xwob"{\0,\0} 5 :=> &"xwob"{\0,\0} | C47: 1 | D47: 0.0414285 | E47: 0.0414285 | G47: of:=IF([.C47]=1;"";[.C47]) ->  | H47: of:=IF([.D47]=1;"";[.D47]) -> 0.0414285 | I47: of:=IF([.E47]=1;"";[.E47]) -> 0.0414285
A48: 12 | B48: strncpy: &"a"{\0,\x01,\x01,\x01,\x01} &"kppcr"{\0} 5 :=> &"kppcr"{\0} | C48: 1 | D48: 0.0247238 | E48: 0.0247238 | G48: of:=IF([.C48]=1;"";[.C48]) ->  | H48: of:=IF([.D48]=1;"";[.D48]) -> 0.0247238 | I48: of:=IF([.E48]=1;"";[.E48]) -> 0.0247238
A49: 13 | B49: strncpy: &"rk"{\0,\x01,\x01,\x01} &""{\0,p,a,i,a,\0} 5 :=> &""{\0,\0,\0,\0,\0,\0} | C49: 0.215236 | D49: 1 | E49: 1 | G49: of:=IF([.C49]=1;"";[.C49]) -> 0.215236 | H49: of:=IF([.D49]=1;"";[.D49]) ->  | I49: of:=IF([.E49]=1;"";[.E49]) -> 
A50: 14 | B50: strncpy: &"kt"{\0,\x01,\x01,\x01} &"l"{\0,p,b,j,\0} 5 :=> &"l"{\0,\0,\0,\0,\0} | C50: 0.190189 | D50: 1 | E50: 1 | G50: of:=IF([.C50]=1;"";[.C50]) -> 0.190189 | H50: of:=IF([.D50]=1;"";[.D50]) ->  | I50: of:=IF([.E50]=1;"";[.E50]) -> 
A51: 15 | B51: strncpy: &"pr"{\0,\x01,\x01,\x01} &"de"{\0,p,w,\0} 5 :=> &"de"{\0,\0,\0,\0} | C51: 0.218916 | D51: 0.22156 | E51: 0.22156 | G51: of:=IF([.C51]=1;"";[.C51]) -> 0.218916 | H51: of:=IF([.D51]=1;"";[.D51]) -> 0.22156 | I51: of:=IF([.E51]=1;"";[.E51]) -> 0.22156
A52: 16 | B52: strncpy: &"fe"{\0,\x01,\x01,\x01} &"org"{\0,p,\0} 5 :=> &"org"{\0,\0,\0} | C52: 0.215706 | D52: 0.0878215 | E52: 0.0878215 | G52: of:=IF([.C52]=1;"";[.C52]) -> 0.215706 | H52: of:=IF([.D52]=1;"";[.D52]) -> 0.0878215 | I52: of:=IF([.E52]=1;"";[.E52]) -> 0.0878215
A53: 17 | B53: strncpy: &"qt"{\0,\x01,\x01,\x01} &"hohc"{\0,\0} 5 :=> &"hohc"{\0,\0} | C53: 0.138419 | D53: 0.0412884 | E53: 0.0412884 | G53: of:=IF([.C53]=1;"";[.C53]) -> 0.138419 | H53: of:=IF([.D53]=1;"";[.D53]) -> 0.0412884 | I53: of:=IF([.E53]=1;"";[.E53]) -> 0.0412884
A54: 18 | B54: strncpy: &"ve"{\0,\x01,\x01,\x01} &"nvefl"{\0} 5 :=> &"nvefl"{\0} | C54: 0.221991 | D54: 0.0293763 | E54: 0.0293763 | G54: of:=IF([.C54]=1;"";[.C54]) -> 0.221991 | H54: of:=IF([.D54]=1;"";[.D54]) -> 0.0293763 | I54: of:=IF([.E54]=1;"";[.E54]) -> 0.0293763
A55: 19 | B55: strncpy: &"ura"{\0,\x01,\x01} &""{\0,p,j,m,a,\0} 5 :=> &""{\0,\0,\0,\0,\0,\0} | C55: 0.0889865 | D55: 1 | E55: 1 | G55: of:=IF([.C55]=1;"";[.C55]) -> 0.0889865 | H55: of:=IF([.D55]=1;"";[.D55]) ->  | I55: of:=IF([.E55]=1;"";[.E55]) -> 
A56: 20 | B56: strncpy: &"kte"{\0,\x01,\x01} &"r"{\0,p,r,s,\0} 5 :=> &"r"{\0,\0,\0,\0,\0} | C56: 0.0799961 | D56: 1 | E56: 1 | G56: of:=IF([.C56]=1;"";[.C56]) -> 0.0799961 | H56: of:=IF([.D56]=1;"";[.D56]) ->  | I56: of:=IF([.E56]=1;"";[.E56]) -> 
A57: 21 | B57: strncpy: &"ibw"{\0,\x01,\x01} &"fs"{\0,p,k,\0} 5 :=> &"fs"{\0,\0,\0,\0} | C57: 0.0753045 | D57: 0.197975 | E57: 0.197975 | G57: of:=IF([.C57]=1;"";[.C57]) -> 0.0753045 | H57: of:=IF([.D57]=1;"";[.D57]) -> 0.197975 | I57: of:=IF([.E57]=1;"";[.E57]) -> 0.197975
A58: 22 | B58: strncpy: &"yux"{\0,\x01,\x01} &"lfr"{\0,p,\0} 5 :=> &"lfr"{\0,\0,\0} | C58: 0.0706511 | D58: 0.0835682 | E58: 0.0835682 | G58: of:=IF([.C58]=1;"";[.C58]) -> 0.0706511 | H58: of:=IF([.D58]=1;"";[.D58]) -> 0.0835682 | I58: of:=IF([.E58]=1;"";[.E58]) -> 0.0835682
A59: 23 | B59: strncpy: &"plc"{\0,\x01,\x01} &"shbn"{\0,\0} 5 :=> &"shbn"{\0,\0} | C59: 0.0811982 | D59: 0.0392862 | E59: 0.0392862 | G59: of:=IF([.C59]=1;"";[.C59]) -> 0.0811982 | H59: of:=IF([.D59]=1;"";[.D59]) -> 0.0392862 | I59: of:=IF([.E59]=1;"";[.E59]) -> 0.0392862
A60: 24 | B60: strncpy: &"rvd"{\0,\x01,\x01} &"fwisl"{\0} 5 :=> &"fwisl"{\0} | C60: 0.0714386 | D60: 0.0268904 | E60: 0.0268904 | G60: of:=IF([.C60]=1;"";[.C60]) -> 0.0714386 | H60: of:=IF([.D60]=1;"";[.D60]) -> 0.0268904 | I60: of:=IF([.E60]=1;"";[.E60]) -> 0.0268904
A61: 25 | B61: strncpy: &"yrsv"{\0,\x01} &""{\0,p,d,u,a,\0} 5 :=> &""{\0,\0,\0,\0,\0,\0} | C61: 0.0410968 | D61: 1 | E61: 1 | G61: of:=IF([.C61]=1;"";[.C61]) -> 0.0410968 | H61: of:=IF([.D61]=1;"";[.D61]) ->  | I61: of:=IF([.E61]=1;"";[.E61]) -> 
A62: 26 | B62: strncpy: &"iioi"{\0,\x01} &"n"{\0,p,y,m,\0} 5 :=> &"n"{\0,\0,\0,\0,\0} | C62: 0.0431974 | D62: 1 | E62: 1 | G62: of:=IF([.C62]=1;"";[.C62]) -> 0.0431974 | H62: of:=IF([.D62]=1;"";[.D62]) ->  | I62: of:=IF([.E62]=1;"";[.E62]) -> 
A63: 27 | B63: strncpy: &"biyl"{\0,\x01} &"le"{\0,p,a,\0} 5 :=> &"le"{\0,\0,\0,\0} | C63: 0.0404998 | D63: 0.218014 | E63: 0.218014 | G63: of:=IF([.C63]=1;"";[.C63]) -> 0.0404998 | H63: of:=IF([.D63]=1;"";[.D63]) -> 0.218014 | I63: of:=IF([.E63]=1;"";[.E63]) -> 0.218014
A64: 28 | B64: strncpy: &"jksc"{\0,\x01} &"akj"{\0,p,\0} 5 :=> &"akj"{\0,\0,\0} | C64: 0.0378146 | D64: 0.068434 | E64: 0.068434 | G64: of:=IF([.C64]=1;"";[.C64]) -> 0.0378146 | H64: of:=IF([.D64]=1;"";[.D64]) -> 0.068434 | I64: of:=IF([.E64]=1;"";[.E64]) -> 0.068434
A65: 29 | B65: strncpy: &"lili"{\0,\x01} &"ycya"{\0,\0} 5 :=> &"ycya"{\0,\0} | C65: 0.0488951 | D65: 0.0415512 | E65: 0.0415512 | G65: of:=IF([.C65]=1;"";[.C65]) -> 0.0488951 | H65: of:=IF([.D65]=1;"";[.D65]) -> 0.0415512 | I65: of:=IF([.E65]=1;"";[.E65]) -> 0.0415512
A66: 30 | B66: strncpy: &"ebff"{\0,\x01} &"yvvvc"{\0} 5 :=> &"yvvvc"{\0} | C66: 0.0378937 | D66: 0.0192031 | E66: 0.0192031 | G66: of:=IF([.C66]=1;"";[.C66]) -> 0.0378937 | H66: of:=IF([.D66]=1;"";[.D66]) -> 0.0192031 | I66: of:=IF([.E66]=1;"";[.E66]) -> 0.0192031
A67: 31 | B67: strncpy: &"wisek"{\0} &""{\0,p,a,t,b,\0} 5 :=> &""{\0,\0,\0,\0,\0,\0} | C67: 0.0306837 | D67: 1 | E67: 1 | G67: of:=IF([.C67]=1;"";[.C67]) -> 0.0306837 | H67: of:=IF([.D67]=1;"";[.D67]) ->  | I67: of:=IF([.E67]=1;"";[.E67]) -> 
A68: 32 | B68: strncpy: &"uqlwa"{\0} &"b"{\0,p,k,l,\0} 5 :=> &"b"{\0,\0,\0,\0,\0} | C68: 0.0187453 | D68: 1 | E68: 1 | G68: of:=IF([.C68]=1;"";[.C68]) -> 0.0187453 | H68: of:=IF([.D68]=1;"";[.D68]) ->  | I68: of:=IF([.E68]=1;"";[.E68]) -> 
A69: 33 | B69: strncpy: &"jastu"{\0} &"zb"{\0,p,w,\0} 5 :=> &"zb"{\0,\0,\0,\0} | C69: 0.0298133 | D69: 0.182248 | E69: 0.182248 | G69: of:=IF([.C69]=1;"";[.C69]) -> 0.0298133 | H69: of:=IF([.D69]=1;"";[.D69]) -> 0.182248 | I69: of:=IF([.E69]=1;"";[.E69]) -> 0.182248
A70: 34 | B70: strncpy: &"ohufr"{\0} &"hrc"{\0,p,\0} 5 :=> &"hrc"{\0,\0,\0} | C70: 0.0277801 | D70: 0.084102 | E70: 0.084102 | G70: of:=IF([.C70]=1;"";[.C70]) -> 0.0277801 | H70: of:=IF([.D70]=1;"";[.D70]) -> 0.084102 | I70: of:=IF([.E70]=1;"";[.E70]) -> 0.084102
A71: 35 | B71: strncpy: &"uctut"{\0} &"cpcd"{\0,\0} 5 :=> &"cpcd"{\0,\0} | C71: 0.0304509 | D71: 0.0306523 | E71: 0.0306523 | G71: of:=IF([.C71]=1;"";[.C71]) -> 0.0304509 | H71: of:=IF([.D71]=1;"";[.D71]) -> 0.0306523 | I71: of:=IF([.E71]=1;"";[.E71]) -> 0.0306523
A72: 36 | B72: strncpy: &"mukix"{\0} &"usowt"{\0} 5 :=> &"usowt"{\0} | C72: 0.0272122 | D72: 0.0290618 | E72: 0.0290618 | G72: of:=IF([.C72]=1;"";[.C72]) -> 0.0272122 | H72: of:=IF([.D72]=1;"";[.D72]) -> 0.0290618 | I72: of:=IF([.E72]=1;"";[.E72]) -> 0.0290618

Sheet: strcat
A1: # | B1: Test Case | C1: N1 | D1: N2 | E1: N3
A2: 1 | B2: strcat: &""{\0,\x01,\x01,\x01,\x01,\x01,\x01,\x01,\x01,\x01} &"f"{\0,p,t,\0} :=> &"f"{\0,p,h,n,u,p,o,l,\0} | C2: 1 | D2: 1 | E2: 1 | G2: of:=IF([.C2]=1;"";[.C2]) ->  | H2: of:=IF([.D2]=1;"";[.D2]) ->  | I2: of:=IF([.E2]=1;"";[.E2]) ->  | K2: of:=AVERAGE([.G2:.G41]) -> 0.0630558070967742 | L2: of:=AVERAGE([.H2:.H41]) -> 0.11255265 | M2: of:=AVERAGE([.I2:.I41]) -> 0.0415131545945946 | O2: of:=AVERAGE([.K2:.M2]) -> 0.0723738705637896
A3: 2 | B3: strcat: &""{\0,\x01,\x01,\x01,\x01,\x01,\x01,\x01,\x01,\x01} &"sc"{\0,p,\0} :=> &"sc"{\0,p,b,n,b,y,r,\0} | C3: 1 | D3: 0.213806 | E3: 0.213806 | G3: of:=IF([.C3]=1;"";[.C3]) ->  | H3: of:=IF([.D3]=1;"";[.D3]) -> 0.213806 | I3: of:=IF([.E3]=1;"";[.E3]) -> 0.213806
A4: 3 | B4: strcat: &""{\0,\x01,\x01,\x01,\x01,\x01,\x01,\x01,\x01,\x01} &"cya"{\0,\0} :=> &"cya"{\0,p,d,y,o,n,\0} | C4: 1 | D4: 0.0797389 | E4: 0.0797389 | G4: of:=IF([.C4]=1;"";[.C4]) ->  | H4: of:=IF([.D4]=1;"";[.D4]) -> 0.0797389 | I4: of:=IF([.E4]=1;"";[.E4]) -> 0.0797389
A5: 4 | B5: strcat: &""{\0,\x01,\x01,\x01,\x01,\x01,\x01,\x01,\x01,\x01} &"hsyl"{\0} :=> &"hsyl"{\0,p,b,h,y,\0} | C5: 1 | D5: 0.0420128 | E5: 0.0420128 | H5: of:=IF([.D5]=1;"";[.D5]) -> 0.0420128 | I5: of:=IF([.E5]=1;"";[.E5]) -> 0.0420128
A6: 5 | B6: strcat: &"r"{\0,\x01,\x01,\x01,\x01,\x01,\x01,\x01,\x01} &""{\0,p,o,r,\0} :=> &"r"{\0,p,y,i,a,e,c,k,\0} | C6: 1 | D6: 1 | E6: 1 | G6: of:=IF([.C6]=1;"";[.C6]) ->  | H6: of:=IF([.D6]=1;"";[.D6]) ->  | I6: of:=IF([.E6]=1;"";[.E6]) -> 
A7: 6 | B7: strcat: &"o"{\0,\x01,\x01,\x01,\x01,\x01,\x01,\x01,\x01} &"n"{\0,p,b,\0} :=> &"on"{\0,p,p,d,k,h,g,\0} | C7: 1 | D7: 1 | E7: 0.224943 | G7: of:=IF([.C7]=1;"";[.C7]) ->  | H7: of:=IF([.D7]=1;"";[.D7]) ->  | I7: of:=IF([.E7]=1;"";[.E7]) -> 0.224943
A8: 7 | B8: strcat: &"s"{\0,\x01,\x01,\x01,\x01,\x01,\x01,\x01,\x01} &"ro"{\0,p,\0} :=> &"sro"{\0,p,o,v,y,y,\0} | C8: 1 | D8: 0.22156 | E8: 0.0830705 | G8: of:=IF([.C8]=1;"";[.C8]) ->  | H8: of:=IF([.D8]=1;"";[.D8]) -> 0.22156 | I8: of:=IF([.E8]=1;"";[.E8]) -> 0.0830705
A9: 8 | B9: strcat: &"n"{\0,\x01,\x01,\x01,\x01,\x01,\x01,\x01,\x01} &"yrs"{\0,\0} :=> &"nyrs"{\0,p,f,a,r,\0} | C9: 1 | D9: 0.0831461 | E9: 0.0450002 | G9: of:=IF([.C9]=1;"";[.C9]) ->  | H9: of:=IF([.D9]=1;"";[.D9]) -> 0.0831461 | I9: of:=IF([.E9]=1;"";[.E9]) -> 0.0450002
A10: 9 | B10: strcat: &"x"{\0,\x01,\x01,\x01,\x01,\x01,\x01,\x01,\x01} &"pret"{\0} :=> &"xpret"{\0,p,d,m,\0} | C10: 1 | D10: 0.0489261 | E10: 0.0308505 | G10: of:=IF([.C10]=1;"";[.C10]) ->  | H10: of:=IF([.D10]=1;"";[.D10]) -> 0.0489261 | I10: of:=IF([.E10]=1;"";[.E10]) -> 0.0308505
A11: 10 | B11: strcat: &"qi"{\0,\x01,\x01,\x01,\x01,\x01,\x01,\x01} &""{\0,p,i,b,\0} :=> &"qi"{\0,p,h,c,a,o,g,\0} | C11: 0.188031 | D11: 1 | E11: 0.188031 | G11: of:=IF([.C11]=1;"";[.C11]) -> 0.188031 | H11: of:=IF([.D11]=1;"";[.D11]) ->  | I11: of:=IF([.E11]=1;"";[.E11]) -> 0.188031
A12: 11 | B12: strcat: &"pr"{\0,\x01,\x01,\x01,\x01,\x01,\x01,\x01} &"k"{\0,p,j,\0} :=> &"prk"{\0,p,o,m,e,e,\0} | C12: 0.218916 | D12: 1 | E12: 0.0868069 | G12: of:=IF([.C12]=1;"";[.C12]) -> 0.218916 | H12: of:=IF([.D12]=1;"";[.D12]) ->  | I12: of:=IF([.E12]=1;"";[.E12]) -> 0.0868069
A13: 12 | B13: strcat: &"cc"{\0,\x01,\x01,\x01,\x01,\x01,\x01,\x01} &"ka"{\0,p,\0} :=> &"ccka"{\0,p,l,a,d,\0} | C13: 0.210352 | D13: 0.204058 | E13: 0.0440294 | G13: of:=IF([.C13]=1;"";[.C13]) -> 0.210352 | H13: of:=IF([.D13]=1;"";[.D13]) -> 0.204058 | I13: of:=IF([.E13]=1;"";[.E13]) -> 0.0440294
A14: 13 | B14: strcat: &"cu"{\0,\x01,\x01,\x01,\x01,\x01,\x01,\x01} &"veb"{\0,\0} :=> &"cuveb"{\0,p,i,t,\0} | C14: 0.214286 | D14: 0.0858498 | E14: 0.0280114 | G14: of:=IF([.C14]=1;"";[.C14]) -> 0.214286 | H14: of:=IF([.D14]=1;"";[.D14]) -> 0.0858498 | I14: of:=IF([.E14]=1;"";[.E14]) -> 0.0280114
A15: 14 | B15: strcat: &"kn"{\0,\x01,\x01,\x01,\x01,\x01,\x01,\x01} &"jidg"{\0} :=> &"knjidg"{\0,p,m,\0} | C15: 0.20725 | D15: 0.0424941 | E15: 0.0190271 | G15: of:=IF([.C15]=1;"";[.C15]) -> 0.20725 | H15: of:=IF([.D15]=1;"";[.D15]) -> 0.0424941 | I15: of:=IF([.E15]=1;"";[.E15]) -> 0.0190271
A16: 15 | B16: strcat: &"tvy"{\0,\x01,\x01,\x01,\x01,\x01,\x01} &""{\0,p,f,v,\0} :=> &"tvy"{\0,p,m,u,s,j,\0} | C16: 0.071475 | D16: 1 | E16: 0.071475 | G16: of:=IF([.C16]=1;"";[.C16]) -> 0.071475 | H16: of:=IF([.D16]=1;"";[.D16]) ->  | I16: of:=IF([.E16]=1;"";[.E16]) -> 0.071475
A17: 16 | B17: strcat: &"xek"{\0,\x01,\x01,\x01,\x01,\x01,\x01} &"q"{\0,p,d,\0} :=> &"xekq"{\0,p,i,c,b,\0} | C17: 0.0805722 | D17: 1 | E17: 0 | G17: of:=IF([.C17]=1;"";[.C17]) -> 0.0805722 | H17: of:=IF([.D17]=1;"";[.D17]) ->  | I17: of:=IF([.E17]=1;"";[.E17]) -> 0
A18: 17 | B18: strcat: &"bfy"{\0,\x01,\x01,\x01,\x01,\x01,\x01} &"zb"{\0,p,\0} :=> &"bfyzb"{\0,p,r,t,\0} | C18: 0.0644977 | D18: 0.182248 | E18: 0.0204983 | G18: of:=IF([.C18]=1;"";[.C18]) -> 0.0644977 | H18: of:=IF([.D18]=1;"";[.D18]) -> 0.182248 | I18: of:=IF([.E18]=1;"";[.E18]) -> 0.0204983
A19: 18 | B19: strcat: &"ptw"{\0,\x01,\x01,\x01,\x01,\x01,\x01} &"hil"{\0,\0} :=> &"ptwhil"{\0,p,y,\0} | C19: 0.0827077 | D19: 0.0889933 | E19: 0.0216799 | G19: of:=IF([.C19]=1;"";[.C19]) -> 0.0827077 | H19: of:=IF([.D19]=1;"";[.D19]) -> 0.0889933 | I19: of:=IF([.E19]=1;"";[.E19]) -> 0.0216799
A20: 19 | B20: strcat: &"kex"{\0,\x01,\x01,\x01,\x01,\x01,\x01} &"ggnj"{\0} :=> &"kexggnj"{\0,p,\0} | C20: 0.0862237 | D20: 0.0421128 | E20: 0.0120867 | G20: of:=IF([.C20]=1;"";[.C20]) -> 0.0862237 | H20: of:=IF([.D20]=1;"";[.D20]) -> 0.0421128 | I20: of:=IF([.E20]=1;"";[.E20]) -> 0.0120867
A21: 20 | B21: strcat: &"sctm"{\0,\x01,\x01,\x01,\x01,\x01} &""{\0,p,r,q,\0} :=> &"sctm"{\0,p,y,y,r,\0} | C21: 0.0454451 | D21: 1 | E21: 0.0454451 | G21: of:=IF([.C21]=1;"";[.C21]) -> 0.0454451 | H21: of:=IF([.D21]=1;"";[.D21]) ->  | I21: of:=IF([.E21]=1;"";[.E21]) -> 0.0454451
A22: 21 | B22: strcat: &"cumf"{\0,\x01,\x01,\x01,\x01,\x01} &"x"{\0,p,t,\0} :=> &"cumfx"{\0,p,y,m,\0} | C22: 0.0429061 | D22: 1 | E22: 0.0207074 | G22: of:=IF([.C22]=1;"";[.C22]) -> 0.0429061 | H22: of:=IF([.D22]=1;"";[.D22]) ->  | I22: of:=IF([.E22]=1;"";[.E22]) -> 0.0207074
A23: 22 | B23: strcat: &"vutw"{\0,\x01,\x01,\x01,\x01,\x01} &"kg"{\0,p,\0} :=> &"vutwkg"{\0,p,l,\0} | C23: 0.0424753 | D23: 0.185944 | E23: 0.0176325 | G23: of:=IF([.C23]=1;"";[.C23]) -> 0.0424753 | H23: of:=IF([.D23]=1;"";[.D23]) -> 0.185944 | I23: of:=IF([.E23]=1;"";[.E23]) -> 0.0176325
A24: 23 | B24: strcat: &"ynye"{\0,\x01,\x01,\x01,\x01,\x01} &"oaf"{\0,\0} :=> &"ynyeoaf"{\0,p,\0} | C24: 0.0444291 | D24: 0.0830234 | E24: 0.0157764 | G24: of:=IF([.C24]=1;"";[.C24]) -> 0.0444291 | H24: of:=IF([.D24]=1;"";[.D24]) -> 0.0830234 | I24: of:=IF([.E24]=1;"";[.E24]) -> 0.0157764
A25: 24 | B25: strcat: &"ocwn"{\0,\x01,\x01,\x01,\x01,\x01} &"hdmf"{\0} :=> &"ocwnhdmf"{\0,\0} | C25: 0.0365873 | D25: 0.0394123 | E25: 0.0104379 | G25: of:=IF([.C25]=1;"";[.C25]) -> 0.0365873 | H25: of:=IF([.D25]=1;"";[.D25]) -> 0.0394123 | I25: of:=IF([.E25]=1;"";[.E25]) -> 0.0104379
A26: 25 | B26: strcat: &"rmbof"{\0,\x01,\x01,\x01,\x01} &""{\0,p,r,e,\0} :=> &"rmbof"{\0,p,o,g,\0} | C26: 0.030161 | D26: 1 | E26: 0.030161 | G26: of:=IF([.C26]=1;"";[.C26]) -> 0.030161 | H26: of:=IF([.D26]=1;"";[.D26]) ->  | I26: of:=IF([.E26]=1;"";[.E26]) -> 0.030161
A27: 26 | B27: strcat: &"yttin"{\0,\x01,\x01,\x01,\x01} &"t"{\0,p,p,\0} :=> &"yttint"{\0,p,i,\0} | C27: 0.0302996 | D27: 1 | E27: 0.0221442 | G27: of:=IF([.C27]=1;"";[.C27]) -> 0.0302996 | H27: of:=IF([.D27]=1;"";[.D27]) ->  | I27: of:=IF([.E27]=1;"";[.E27]) -> 0.0221442
A28: 27 | B28: strcat: &"qudqi"{\0,\x01,\x01,\x01,\x01} &"ui"{\0,p,\0} :=> &"qudqiui"{\0,p,\0} | C28: 0.0253718 | D28: 0.212346 | E28: 0.0141377 | G28: of:=IF([.C28]=1;"";[.C28]) -> 0.0253718 | H28: of:=IF([.D28]=1;"";[.D28]) -> 0.212346 | I28: of:=IF([.E28]=1;"";[.E28]) -> 0.0141377
A29: 28 | B29: strcat: &"mfthk"{\0,\x01,\x01,\x01,\x01} &"rua"{\0,\0} :=> &"mfthkrua"{\0,\0} | C29: 0.0262729 | D29: 0.0842685 | E29: 0.011871 | G29: of:=IF([.C29]=1;"";[.C29]) -> 0.0262729 | H29: of:=IF([.D29]=1;"";[.D29]) -> 0.0842685 | I29: of:=IF([.E29]=1;"";[.E29]) -> 0.011871
A30: 29 | B30: strcat: &"extam"{\0,\x01,\x01,\x01,\x01} &"pkwi"{\0} :=> &"extampkwi"{\0} | C30: 0.0297416 | D30: 0.0392967 | E30: 0.0104852 | G30: of:=IF([.C30]=1;"";[.C30]) -> 0.0297416 | H30: of:=IF([.D30]=1;"";[.D30]) -> 0.0392967 | I30: of:=IF([.E30]=1;"";[.E30]) -> 0.0104852
A31: 30 | B31: strcat: &"viuvac"{\0,\x01,\x01,\x01} &""{\0,p,h,l,\0} :=> &"viuvac"{\0,p,b,\0} | C31: 0.0198191 | D31: 1 | E31: 0.0198191 | G31: of:=IF([.C31]=1;"";[.C31]) -> 0.0198191 | H31: of:=IF([.D31]=1;"";[.D31]) ->  | I31: of:=IF([.E31]=1;"";[.E31]) -> 0.0198191
A32: 31 | B32: strcat: &"rhmitt"{\0,\x01,\x01,\x01} &"v"{\0,p,p,\0} :=> &"rhmittv"{\0,p,\0} | C32: 0.0205741 | D32: 1 | E32: 0.0150336 | G32: of:=IF([.C32]=1;"";[.C32]) -> 0.0205741 | H32: of:=IF([.D32]=1;"";[.D32]) ->  | I32: of:=IF([.E32]=1;"";[.E32]) -> 0.0150336
A33: 32 | B33: strcat: &"xwceri"{\0,\x01,\x01,\x01} &"kv"{\0,p,\0} :=> &"xwcerikv"{\0,\0} | C33: 0.0193589 | D33: 0.178726 | E33: 0.0114699 | G33: of:=IF([.C33]=1;"";[.C33]) -> 0.0193589 | H33: of:=IF([.D33]=1;"";[.D33]) -> 0.178726 | I33: of:=IF([.E33]=1;"";[.E33]) -> 0.0114699
A34: 33 | B34: strcat: &"ffobry"{\0,\x01,\x01,\x01} &"meb"{\0,\0} :=> &"ffobrymeb"{\0} | C34: 0.0213509 | D34: 0.0857163 | E34: 0.0112265 | G34: of:=IF([.C34]=1;"";[.C34]) -> 0.0213509 | H34: of:=IF([.D34]=1;"";[.D34]) -> 0.0857163 | I34: of:=IF([.E34]=1;"";[.E34]) -> 0.0112265
A35: 34 | B35: strcat: &"zvalfv"{\0,\x01,\x01,\x01} &&10 :=> &"zvalfvapsa"{} | C35: 0.0167409 | D35: 0.0083672 | G35: of:=IF([.C35]=1;"";[.C35]) -> 0.0167409 | H35: of:=IF([.D35]=1;"";[.D35]) -> 0.0083672 | I35: of:=IF([.E35]=1;"";[.E35]) ->  
A36: 35 | B36: strcat: &"hajmski"{\0,\x01,\x01} &""{\0,p,i,b,\0} :=> &"hajmski"{\0,p,\0} | C36: 0.0142749 | D36: 1 | E36: 0.0142749 | G36: of:=IF([.C36]=1;"";[.C36]) -> 0.0142749 | H36: of:=IF([.D36]=1;"";[.D36]) ->  | I36: of:=IF([.E36]=1;"";[.E36]) -> 0.0142749
A37: 36 | B37: strcat: &"herbtat"{\0,\x01,\x01} &"j"{\0,p,i,\0} :=> &"herbtatj"{\0,\0} | C37: 0.0170349 | D37: 1 | E37: 0.0125226 | G37: of:=IF([.C37]=1;"";[.C37]) -> 0.0170349 | H37: of:=IF([.D37]=1;"";[.D37]) ->  | I37: of:=IF([.E37]=1;"";[.E37]) -> 0.0125226
A38: 37 | B38: strcat: &"yxcyagr"{\0,\x01,\x01} &"en"{\0,p,\0} :=> &"yxcyagren"{\0} | C38: 0.0140527 | D38: 0.224112 | E38: 0.0103042 | G38: of:=IF([.C38]=1;"";[.C38]) -> 0.0140527 | H38: of:=IF([.D38]=1;"";[.D38]) -> 0.224112 | I38: of:=IF([.E38]=1;"";[.E38]) -> 0.0103042
A39: 38 | B39: strcat: &"unooitdb"{\0,\x01} &""{\0,p,d,a,\0} :=> &"unooitdb"{\0,\0} | C39: 0.012698 | D39: 1 | E39: 0.012698 | G39: of:=IF([.C39]=1;"";[.C39]) -> 0.012698 | H39: of:=IF([.D39]=1;"";[.D39]) ->  | I39: of:=IF([.E39]=1;"";[.E39]) -> 0.012698
A40: 39 | B40: strcat: &"nktseopn"{\0,\x01} &"w"{\0,p,a,\0} :=> &"nktseopnw"{\0} | C40: 0.0120923 | D40: 1 | E40: 0.0100397 | G40: of:=IF([.C40]=1;"";[.C40]) -> 0.0120923 | H40: of:=IF([.D40]=1;"";[.D40]) ->  | I40: of:=IF([.E40]=1;"";[.E40]) -> 0.0100397
A41: 40 | B41: strcat: &"jlklwdfac"{\0} &""{\0,p,t,c,\0} :=> &"jlklwdfac"{\0} | C41: 0.00873222 | D41: 1 | E41: 0.00873222 | G41: of:=IF([.C41]=1;"";[.C41]) -> 0.00873222 | H41: of:=IF([.D41]=1;"";[.D41]) ->  | I41: of:=IF([.E41]=1;"";[.E41]) -> 0.00873222
A42: 1 | B42: strncat: &""{\0,\x01,\x01,\x01,\x01,\x01,\x01,\x01,\x01,\x01} &""{\0,p,w,p,\0} 4 :=> &""{\0,p,t,g,s,q,i,d,m,\0} | C42: 1 | D42: 1 | E42: 1 | G42: of:=IF([.C42]=1;"";[.C42]) ->  | H42: of:=IF([.D42]=1;"";[.D42]) ->  | I42: of:=IF([.E42]=1;"";[.E42]) ->  | K42: of:=AVERAGE([.G42:.G82]) -> 0.0597219161290323 | L42: of:=AVERAGE([.H42:.H82]) -> 0.111989302272727 | M42: of:=AVERAGE([.I42:.I82]) -> 0.0405615156756757 | O42: of:=AVERAGE([.K42:.M42]) -> 0.0707575780258117
A43: 2 | B43: strncat: &""{\0,\x01,\x01,\x01,\x01,\x01,\x01,\x01,\x01,\x01} &"y"{\0,p,a,\0} 4 :=> &"y"{\0,p,u,e,r,l,k,c,\0} | C43: 1 | D43: 1 | E43: 1 | G43: of:=IF([.C43]=1;"";[.C43]) ->  | H43: of:=IF([.D43]=1;"";[.D43]) ->  | I43: of:=IF([.E43]=1;"";[.E43]) -> 
A44: 3 | B44: strncat: &""{\0,\x01,\x01,\x01,\x01,\x01,\x01,\x01,\x01,\x01} &"xo"{\0,p,\0} 4 :=> &"xo"{\0,p,d,g,m,t,o,\0} | C44: 1 | D44: 0.19365 | E44: 0.19365 | G44: of:=IF([.C44]=1;"";[.C44]) ->  | H44: of:=IF([.D44]=1;"";[.D44]) -> 0.19365 | I44: of:=IF([.E44]=1;"";[.E44]) -> 0.19365
A45: 4 | B45: strncat: &""{\0,\x01,\x01,\x01,\x01,\x01,\x01,\x01,\x01,\x01} &"klb"{\0,\0} 4 :=> &"klb"{\0,p,t,q,u,r,\0} | C45: 1 | D45: 0.0775795 | E45: 0.0775795 | G45: of:=IF([.C45]=1;"";[.C45]) ->  | H45: of:=IF([.D45]=1;"";[.D45]) -> 0.0775795 | I45: of:=IF([.E45]=1;"";[.E45]) -> 0.0775795
A46: 5 | B46: strncat: &""{\0,\x01,\x01,\x01,\x01,\x01,\x01,\x01,\x01,\x01} &"fnep"{\0} 4 :=> &"fnep"{\0,p,t,b,a,\0} | C46: 1 | D46: 0.0415826 | E46: 0.0415826 | G46: of:=IF([.C46]=1;"";[.C46]) ->  | H46: of:=IF([.D46]=1;"";[.D46]) -> 0.0415826 | I46: of:=IF([.E46]=1;"";[.E46]) -> 0.0415826
A47: 6 | B47: strncat: &"y"{\0,\x01,\x01,\x01,\x01,\x01,\x01,\x01,\x01} &""{\0,p,k,y,\0} 4 :=> &"y"{\0,p,e,v,u,e,i,k,\0} | C47: 1 | D47: 1 | E47: 1 | G47: of:=IF([.C47]=1;"";[.C47]) ->  | H47: of:=IF([.D47]=1;"";[.D47]) ->  | I47: of:=IF([.E47]=1;"";[.E47]) -> 
A48: 7 | B48: strncat: &"n"{\0,\x01,\x01,\x01,\x01,\x01,\x01,\x01,\x01} &"s"{\0,p,l,\0} 4 :=> &"ns"{\0,p,s,a,k,m,n,\0} | C48: 1 | D48: 1 | E48: 0.219808 | G48: of:=IF([.C48]=1;"";[.C48]) ->  | H48: of:=IF([.D48]=1;"";[.D48]) ->  | I48: of:=IF([.E48]=1;"";[.E48]) -> 0.219808
A49: 8 | B49: strncat: &"t"{\0,\x01,\x01,\x01,\x01,\x01,\x01,\x01,\x01} &"na"{\0,p,\0} 4 :=> &"tna"{\0,p,m,h,g,t,\0} | C49: 1 | D49: 0.218014 | E49: 0.0824332 | G49: of:=IF([.C49]=1;"";[.C49]) ->  | H49: of:=IF([.D49]=1;"";[.D49]) -> 0.218014 | I49: of:=IF([.E49]=1;"";[.E49]) -> 0.0824332
A50: 9 | B50: strncat: &"u"{\0,\x01,\x01,\x01,\x01,\x01,\x01,\x01,\x01} &"puq"{\0,\0} 4 :=> &"upuq"{\0,p,a,e,d,\0} | C50: 1 | D50: 0.0739635 | E50: 0.0408799 | G50: of:=IF([.C50]=1;"";[.C50]) ->  | H50: of:=IF([.D50]=1;"";[.D50]) -> 0.0739635 | I50: of:=IF([.E50]=1;"";[.E50]) -> 0.0408799
A51: 10 | B51: strncat: &"h"{\0,\x01,\x01,\x01,\x01,\x01,\x01,\x01,\x01} &"jtgb"{\0} 4 :=> &"hjtgb"{\0,p,e,f,\0} | C51: 1 | D51: 0.0298392 | E51: 0.0173069 | G51: of:=IF([.C51]=1;"";[.C51]) ->  | H51: of:=IF([.D51]=1;"";[.D51]) -> 0.0298392 | I51: of:=IF([.E51]=1;"";[.E51]) -> 0.0173069
A52: 11 | B52: strncat: &"hc"{\0,\x01,\x01,\x01,\x01,\x01,\x01,\x01} &""{\0,p,l,b,\0} 4 :=> &"hc"{\0,p,t,h,a,q,b,\0} | C52: 0.185944 | D52: 1 | E52: 0.185944 | G52: of:=IF([.C52]=1;"";[.C52]) -> 0.185944 | H52: of:=IF([.D52]=1;"";[.D52]) ->  | I52: of:=IF([.E52]=1;"";[.E52]) -> 0.185944
A53: 12 | B53: strncat: &"tv"{\0,\x01,\x01,\x01,\x01,\x01,\x01,\x01} &"a"{\0,p,a,\0} 4 :=> &"tva"{\0,p,b,y,x,f,\0} | C53: 0.18696 | D53: 1 | E53: 0.0756894 | G53: of:=IF([.C53]=1;"";[.C53]) -> 0.18696 | H53: of:=IF([.D53]=1;"";[.D53]) ->  | I53: of:=IF([.E53]=1;"";[.E53]) -> 0.0756894
A54: 13 | B54: strncat: &"lw"{\0,\x01,\x01,\x01,\x01,\x01,\x01,\x01} &"fo"{\0,p,\0} 4 :=> &"lwfo"{\0,p,t,c,a,\0} | C54: 0.199947 | D54: 0.219808 | E54: 0.0404324 | G54: of:=IF([.C54]=1;"";[.C54]) -> 0.199947 | H54: of:=IF([.D54]=1;"";[.D54]) -> 0.219808 | I54: of:=IF([.E54]=1;"";[.E54]) -> 0.0404324
A55: 14 | B55: strncat: &"pd"{\0,\x01,\x01,\x01,\x01,\x01,\x01,\x01} &"gdt"{\0,\0} 4 :=> &"pdgdt"{\0,p,h,i,\0} | C55: 0.181858 | D55: 0.0706635 | E55: 0.0231527 | G55: of:=IF([.C55]=1;"";[.C55]) -> 0.181858 | H55: of:=IF([.D55]=1;"";[.D55]) -> 0.0706635 | I55: of:=IF([.E55]=1;"";[.E55]) -> 0.0231527
A56: 15 | B56: strncat: &"ba"{\0,\x01,\x01,\x01,\x01,\x01,\x01,\x01} &"nvop"{\0} 4 :=> &"banvop"{\0,p,n,\0} | C56: 0.215236 | D56: 0.0450526 | E56: 0.0215564 | G56: of:=IF([.C56]=1;"";[.C56]) -> 0.215236 | H56: of:=IF([.D56]=1;"";[.D56]) -> 0.0450526 | I56: of:=IF([.E56]=1;"";[.E56]) -> 0.0215564
A57: 16 | B57: strncat: &"dig"{\0,\x01,\x01,\x01,\x01,\x01,\x01} &""{\0,p,b,j,\0} 4 :=> &"dig"{\0,p,a,m,f,w,\0} | C57: 0.0874077 | D57: 1 | E57: 0.0874077 | G57: of:=IF([.C57]=1;"";[.C57]) -> 0.0874077 | H57: of:=IF([.D57]=1;"";[.D57]) ->  | I57: of:=IF([.E57]=1;"";[.E57]) -> 0.0874077
A58: 17 | B58: strncat: &"xoi"{\0,\x01,\x01,\x01,\x01,\x01,\x01} &"y"{\0,p,g,\0} 4 :=> &"xoiy"{\0,p,p,a,b,\0} | C58: 0.0778485 | D58: 1 | E58: 0.0391506 | G58: of:=IF([.C58]=1;"";[.C58]) -> 0.0778485 | H58: of:=IF([.D58]=1;"";[.D58]) ->  | I58: of:=IF([.E58]=1;"";[.E58]) -> 0.0391506
A59: 18 | B59: strncat: &"yjm"{\0,\x01,\x01,\x01,\x01,\x01,\x01} &"gw"{\0,p,\0} 4 :=> &"yjmgw"{\0,p,a,l,\0} | C59: 0.0533054 | D59: 0.183021 | E59: 0.01715 | G59: of:=IF([.C59]=1;"";[.C59]) -> 0.0533054 | H59: of:=IF([.D59]=1;"";[.D59]) -> 0.183021 | I59: of:=IF([.E59]=1;"";[.E59]) -> 0.01715
A60: 19 | B60: strncat: &"jiu"{\0,\x01,\x01,\x01,\x01,\x01,\x01} &"hkb"{\0,\0} 4 :=> &"jiuhkb"{\0,p,i,\0} | C60: 0.0741059 | D60: 0.0676807 | E60: 0.0157353 | G60: of:=IF([.C60]=1;"";[.C60]) -> 0.0741059 | H60: of:=IF([.D60]=1;"";[.D60]) -> 0.0676807 | I60: of:=IF([.E60]=1;"";[.E60]) -> 0.0157353
A61: 20 | B61: strncat: &"ehb"{\0,\x01,\x01,\x01,\x01,\x01,\x01} &"zeav"{\0} 4 :=> &"ehbzeav"{\0,p,\0} | C61: 0.077076 | D61: 0.0464203 | E61: 0.0133953 | G61: of:=IF([.C61]=1;"";[.C61]) -> 0.077076 | H61: of:=IF([.D61]=1;"";[.D61]) -> 0.0464203 | I61: of:=IF([.E61]=1;"";[.E61]) -> 0.0133953
A62: 21 | B62: strncat: &"impu"{\0,\x01,\x01,\x01,\x01,\x01} &""{\0,p,d,k,\0} 4 :=> &"impu"{\0,p,l,o,f,\0} | C62: 0.0465131 | D62: 1 | E62: 0.0465131 | G62: of:=IF([.C62]=1;"";[.C62]) -> 0.0465131 | H62: of:=IF([.D62]=1;"";[.D62]) ->  | I62: of:=IF([.E62]=1;"";[.E62]) -> 0.0465131
A63: 22 | B63: strncat: &"iclv"{\0,\x01,\x01,\x01,\x01,\x01} &"v"{\0,p,w,\0} 4 :=> &"iclvv"{\0,p,u,a,\0} | C63: 0.0456765 | D63: 1 | E63: 0.0260332 | G63: of:=IF([.C63]=1;"";[.C63]) -> 0.0456765 | H63: of:=IF([.D63]=1;"";[.D63]) ->  | I63: of:=IF([.E63]=1;"";[.E63]) -> 0.0260332
A64: 23 | B64: strncat: &"ruij"{\0,\x01,\x01,\x01,\x01,\x01} &"ss"{\0,p,\0} 4 :=> &"ruijss"{\0,p,l,\0} | C64: 0.0422833 | D64: 0.218916 | E64: 0.0165701 | G64: of:=IF([.C64]=1;"";[.C64]) -> 0.0422833 | H64: of:=IF([.D64]=1;"";[.D64]) -> 0.218916 | I64: of:=IF([.E64]=1;"";[.E64]) -> 0.0165701
A65: 24 | B65: strncat: &"nsqi"{\0,\x01,\x01,\x01,\x01,\x01} &"ajo"{\0,\0} 4 :=> &"nsqiajo"{\0,p,\0} | C65: 0.0406803 | D65: 0.0796231 | E65: 0.0147224 | G65: of:=IF([.C65]=1;"";[.C65]) -> 0.0406803 | H65: of:=IF([.D65]=1;"";[.D65]) -> 0.0796231 | I65: of:=IF([.E65]=1;"";[.E65]) -> 0.0147224
A66: 25 | B66: strncat: &"nxce"{\0,\x01,\x01,\x01,\x01,\x01} &"hnrh"{\0} 4 :=> &"nxcehnrh"{\0,\0} | C66: 0.0424217 | D66: 0.0410627 | E66: 0.011728 | G66: of:=IF([.C66]=1;"";[.C66]) -> 0.0424217 | H66: of:=IF([.D66]=1;"";[.D66]) -> 0.0410627 | I66: of:=IF([.E66]=1;"";[.E66]) -> 0.011728
A67: 26 | B67: strncat: &"zpfov"{\0,\x01,\x01,\x01,\x01} &""{\0,p,d,u,\0} 4 :=> &"zpfov"{\0,p,k,l,\0} | C67: 0.0248009 | D67: 1 | E67: 0.0248009 | G67: of:=IF([.C67]=1;"";[.C67]) -> 0.0248009 | H67: of:=IF([.D67]=1;"";[.D67]) ->  | I67: of:=IF([.E67]=1;"";[.E67]) -> 0.0248009
A68: 27 | B68: strncat: &"pqiff"{\0,\x01,\x01,\x01,\x01} &"s"{\0,p,r,\0} 4 :=> &"pqiffs"{\0,p,e,\0} | C68: 0.0215749 | D68: 1 | E68: 0.0155064 | G68: of:=IF([.C68]=1;"";[.C68]) -> 0.0215749 | H68: of:=IF([.D68]=1;"";[.D68]) ->  | I68: of:=IF([.E68]=1;"";[.E68]) -> 0.0155064
A69: 28 | B69: strncat: &"cpgym"{\0,\x01,\x01,\x01,\x01} &"gu"{\0,p,\0} 4 :=> &"cpgymgu"{\0,p,\0} | C69: 0.0227851 | D69: 0.211356 | E69: 0.0121451 | G69: of:=IF([.C69]=1;"";[.C69]) -> 0.0227851 | H69: of:=IF([.D69]=1;"";[.D69]) -> 0.211356 | I69: of:=IF([.E69]=1;"";[.E69]) -> 0.0121451
A70: 29 | B70: strncat: &"bioga"{\0,\x01,\x01,\x01,\x01} &"wua"{\0,\0} 4 :=> &"biogawua"{\0,\0} | C70: 0.0298288 | D70: 0.0710593 | E70: 0.0122363 | G70: of:=IF([.C70]=1;"";[.C70]) -> 0.0298288 | H70: of:=IF([.D70]=1;"";[.D70]) -> 0.0710593 | I70: of:=IF([.E70]=1;"";[.E70]) -> 0.0122363
A71: 30 | B71: strncat: &"vtddc"{\0,\x01,\x01,\x01,\x01} &"lssc"{\0} 4 :=> &"vtddclssc"{\0} | C71: 0.0222068 | D71: 0.0465769 | E71: 0.00949908 | G71: of:=IF([.C71]=1;"";[.C71]) -> 0.0222068 | H71: of:=IF([.D71]=1;"";[.D71]) -> 0.0465769 | I71: of:=IF([.E71]=1;"";[.E71]) -> 0.00949908
A72: 31 | B72: strncat: &"zbsaea"{\0,\x01,\x01,\x01} &""{\0,p,y,g,\0} 4 :=> &"zbsaea"{\0,p,t,\0} | C72: 0.0194223 | D72: 1 | E72: 0.0194223 | G72: of:=IF([.C72]=1;"";[.C72]) -> 0.0194223 | H72: of:=IF([.D72]=1;"";[.D72]) ->  | I72: of:=IF([.E72]=1;"";[.E72]) -> 0.0194223
A73: 32 | B73: strncat: &"awycib"{\0,\x01,\x01,\x01} &"j"{\0,p,r,\0} 4 :=> &"awycibj"{\0,p,\0} | C73: 0.0195794 | D73: 1 | E73: 0.0147524 | G73: of:=IF([.C73]=1;"";[.C73]) -> 0.0195794 | H73: of:=IF([.D73]=1;"";[.D73]) ->  | I73: of:=IF([.E73]=1;"";[.E73]) -> 0.0147524
A74: 33 | B74: strncat: &"zfsued"{\0,\x01,\x01,\x01} &"rv"{\0,p,\0} 4 :=> &"zfsuedrv"{\0,\0} | C74: 0.017453 | D74: 0.22025 | E74: 0.01151 | G74: of:=IF([.C74]=1;"";[.C74]) -> 0.017453 | H74: of:=IF([.D74]=1;"";[.D74]) -> 0.22025 | I74: of:=IF([.E74]=1;"";[.E74]) -> 0.01151
A75: 34 | B75: strncat: &"yewcie"{\0,\x01,\x01,\x01} &"moj"{\0,\0} 4 :=> &"yewciemoj"{\0} | C75: 0.020108 | D75: 0.0815294 | E75: 0.0107319 | G75: of:=IF([.C75]=1;"";[.C75]) -> 0.020108 | H75: of:=IF([.D75]=1;"";[.D75]) -> 0.0815294 | I75: of:=IF([.E75]=1;"";[.E75]) -> 0.0107319
A76: 35 | B76: strncat: &"mkpryx"{\0,\x01,\x01,\x01} &&10 4 :=> &"mkpryxxtth"{} | C76: 0.0158618 | D76: 0.00765035 | G76: of:=IF([.C76]=1;"";[.C76]) -> 0.0158618 | H76: of:=IF([.D76]=1;"";[.D76]) -> 0.00765035 | I76: of:=IF([.E76]=1;"";[.E76]) ->  
A77: 36 | B77: strncat: &"btcttib"{\0,\x01,\x01} &""{\0,p,b,u,\0} 4 :=> &"btcttib"{\0,p,\0} | C77: 0.0160445 | D77: 1 | E77: 0.0160445 | G77: of:=IF([.C77]=1;"";[.C77]) -> 0.0160445 | H77: of:=IF([.D77]=1;"";[.D77]) ->  | I77: of:=IF([.E77]=1;"";[.E77]) -> 0.0160445
A78: 37 | B78: strncat: &"quanfwm"{\0,\x01,\x01} &"r"{\0,p,y,\0} 4 :=> &"quanfwmr"{\0,\0} | C78: 0.0144059 | D78: 1 | E78: 0.0111321 | G78: of:=IF([.C78]=1;"";[.C78]) -> 0.0144059 | H78: of:=IF([.D78]=1;"";[.D78]) ->  | I78: of:=IF([.E78]=1;"";[.E78]) -> 0.0111321
A79: 38 | B79: strncat: &"joamfkv"{\0,\x01,\x01} &"wa"{\0,p,\0} 4 :=> &"joamfkvwa"{\0} | C79: 0.0132282 | D79: 0.218466 | E79: 0 | G79: of:=IF([.C79]=1;"";[.C79]) -> 0.0132282 | H79: of:=IF([.D79]=1;"";[.D79]) -> 0.218466 | I79: of:=IF([.E79]=1;"";[.E79]) -> 0
A80: 39 | B80: strncat: &"gymyngaj"{\0,\x01} &""{\0,p,j,a,\0} 4 :=> &"gymyngaj"{\0,\0} | C80: 0.0124343 | D80: 1 | E80: 0.0124343 | G80: of:=IF([.C80]=1;"";[.C80]) -> 0.0124343 | H80: of:=IF([.D80]=1;"";[.D80]) ->  | I80: of:=IF([.E80]=1;"";[.E80]) -> 0.0124343
A81: 40 | B81: strncat: &"vsimedwi"{\0,\x01} &"u"{\0,p,p,\0} 4 :=> &"vsimedwiu"{\0} | C81: 0.0130471 | D81: 1 | E81: 0.0108051 | G81: of:=IF([.C81]=1;"";[.C81]) -> 0.0130471 | H81: of:=IF([.D81]=1;"";[.D81]) ->  | I81: of:=IF([.E81]=1;"";[.E81]) -> 0.0108051
A82: 41 | B82: strncat: &"narracusg"{\0} &""{\0,p,h,k,\0} 4 :=> &"narracusg"{\0} | C82: 0.011335 | D82: 1 | E82: 0.011335 | G82: of:=IF([.C82]=1;"";[.C82]) -> 0.011335 | H82: of:=IF([.D82]=1;"";[.D82]) ->  | I82: of:=IF([.E82]=1;"";[.E82]) -> 0.011335

Sheet: strstr
A1: # | B1: Test Case | C1: N | G1: N1 | H1: N2 | I1: N3
A2: 1 | B2: strstr: &"b"{\0,h,k,t,\0} &"b"{\0,\0} :=> &"b"{\0,h,k,t,\0} | C2: 1 | D2: 1 | E2: 1 | G2: of:=IF([.C2]=1;"";[.C2]) ->  | H2: of:=IF([.D2]=1;"";[.D2]) ->  | I2: of:=IF([.E2]=1;"";[.E2]) ->  | K2: of:=AVERAGE([.G2:.G19]) -> 0.0779405647058824 | L2: of:=AVERAGE([.H2:.H19]) -> 0.203271444444444 | M2: of:=AVERAGE([.I2:.I19]) -> 0.1005986375 | O2: of:=AVERAGE([.K2:.M2]) -> 0.127270215550109
A3: 2 | B3: strstr: &"xa"{\0,h,g,\0} &"x"{\0,\0} :=> &"xa"{\0,h,g,\0} | C3: 0.203502 | D3: 1 | E3: 0.203502 | G3: of:=IF([.C3]=1;"";[.C3]) -> 0.203502 | H3: of:=IF([.D3]=1;"";[.D3]) ->  | I3: of:=IF([.E3]=1;"";[.E3]) -> 0.203502
A4: 3 | B4: strstr: &"he"{\0,b,m,\0} &"e"{\0,\0} :=> &"e"{\0,b,m,\0,54} | C4: 0.226983 | D4: 1 | E4: 1 | G4: of:=IF([.C4]=1;"";[.C4]) -> 0.226983 | H4: of:=IF([.D4]=1;"";[.D4]) ->  | I4: of:=IF([.E4]=1;"";[.E4]) -> 
A5: 4 | B5: strstr: &"crl"{\0,h,\0} &"c"{\0,\0} :=> &"crl"{\0,h,\0} | C5: 0.084417 | D5: 1 | E5: 0.084417 | G5: of:=IF([.C5]=1;"";[.C5]) -> 0.084417 | H5: of:=IF([.D5]=1;"";[.D5]) ->  | I5: of:=IF([.E5]=1;"";[.E5]) -> 0.084417
A6: 5 | B6: strstr: &"tyh"{\0,b,\0} &"y"{\0,\0} :=> &"yh"{\0,b,\0,54} | C6: 0.0762403 | D6: 1 | E6: 0.185724 | G6: of:=IF([.C6]=1;"";[.C6]) -> 0.0762403 | H6: of:=IF([.D6]=1;"";[.D6]) ->  | I6: of:=IF([.E6]=1;"";[.E6]) -> 0.185724
A7: 6 | B7: strstr: &"dfgk"{\0,\0} &"d"{\0,\0} :=> &"dfgk"{\0,\0} | C7: 0.033456 | D7: 1 | E7: 0.033456 | G7: of:=IF([.C7]=1;"";[.C7]) -> 0.033456 | H7: of:=IF([.D7]=1;"";[.D7]) ->  | I7: of:=IF([.E7]=1;"";[.E7]) -> 0.033456
A8: 7 | B8: strstr: &"fegt"{\0,\0} &"e"{\0,\0} :=> &"egt"{\0,\0,54} | C8: 0.0446197 | D8: 1 | E8: 0.0817226 | G8: of:=IF([.C8]=1;"";[.C8]) -> 0.0446197 | H8: of:=IF([.D8]=1;"";[.D8]) ->  | I8: of:=IF([.E8]=1;"";[.E8]) -> 0.0817226
A9: 8 | B9: strstr: &"kepyn"{\0} &"k"{\0,\0} :=> &"kepyn"{\0} | C9: 0.0281262 | D9: 1 | E9: 0.0281262 | G9: of:=IF([.C9]=1;"";[.C9]) -> 0.0281262 | H9: of:=IF([.D9]=1;"";[.D9]) ->  | I9: of:=IF([.E9]=1;"";[.E9]) -> 0.0281262
A10: 9 | B10: strstr: &"uptxo"{\0} &"p"{\0,\0} :=> &"ptxo"{\0,54} | C10: 0.0226865 | D10: 1 | E10: 0.033708 | G10: of:=IF([.C10]=1;"";[.C10]) -> 0.0226865 | H10: of:=IF([.D10]=1;"";[.D10]) ->  | I10: of:=IF([.E10]=1;"";[.E10]) -> 0.033708
A11: 10 | B11: strstr: &"pc"{\0,d,g,\0} &"pc"{\0} :=> &"pc"{\0,d,g,\0} | C11: 0.181308 | D11: 0.181308 | E11: 0.181308 | G11: of:=IF([.C11]=1;"";[.C11]) -> 0.181308 | H11: of:=IF([.D11]=1;"";[.D11]) -> 0.181308 | I11: of:=IF([.E11]=1;"";[.E11]) -> 0.181308
A12: 11 | B12: strstr: &"ddp"{\0,d,\0} &"dd"{\0} :=> &"ddp"{\0,d,\0} | C12: 0.0737376 | D12: 0.208818 | E12: 0.0737376 | G12: of:=IF([.C12]=1;"";[.C12]) -> 0.0737376 | H12: of:=IF([.D12]=1;"";[.D12]) -> 0.208818 | I12: of:=IF([.E12]=1;"";[.E12]) -> 0.0737376
A13: 12 | B13: strstr: &"lla"{\0,a,\0} &"la"{\0} :=> &"la"{\0,a,\0,54} | C13: 0.0891341 | D13: 0.22025 | E13: 0.22025 | G13: of:=IF([.C13]=1;"";[.C13]) -> 0.0891341 | H13: of:=IF([.D13]=1;"";[.D13]) -> 0.22025 | I13: of:=IF([.E13]=1;"";[.E13]) -> 0.22025
A14: 13 | B14: strstr: &"qui"{\0,p,\0} &"ui"{\0} :=> &"ui"{\0,p,\0,54} | C14: 0.0839598 | D14: 0.212346 | E14: 0.212346 | G14: of:=IF([.C14]=1;"";[.C14]) -> 0.0839598 | H14: of:=IF([.D14]=1;"";[.D14]) -> 0.212346 | I14: of:=IF([.E14]=1;"";[.E14]) -> 0.212346
A15: 14 | B15: strstr: &"aewe"{\0,\0} &"ae"{\0} :=> &"aewe"{\0,\0} | C15: 0.0450641 | D15: 0.204279 | E15: 0.0450641 | G15: of:=IF([.C15]=1;"";[.C15]) -> 0.0450641 | H15: of:=IF([.D15]=1;"";[.D15]) -> 0.204279 | I15: of:=IF([.E15]=1;"";[.E15]) -> 0.0450641
A16: 15 | B16: strstr: &"zzqu"{\0,\0} &"zq"{\0} :=> &"zqu"{\0,\0,54} | C16: 0.0350362 | D16: 0.155927 | E16: 0.0655802 | G16: of:=IF([.C16]=1;"";[.C16]) -> 0.0350362 | H16: of:=IF([.D16]=1;"";[.D16]) -> 0.155927 | I16: of:=IF([.E16]=1;"";[.E16]) -> 0.0655802
A17: 16 | B17: strstr: &"hboo"{\0,\0} &"bo"{\0} :=> &"boo"{\0,\0,54} | C17: 0.0441055 | D17: 0.215706 | E17: 0.0862339 | G17: of:=IF([.C17]=1;"";[.C17]) -> 0.0441055 | H17: of:=IF([.D17]=1;"";[.D17]) -> 0.215706 | I17: of:=IF([.E17]=1;"";[.E17]) -> 0.0862339
A18: 17 | B18: strstr: &"flajk"{\0} &"fl"{\0} :=> &"flajk"{\0} | C18: 0.0245561 | D18: 0.208818 | E18: 0.0245561 | G18: of:=IF([.C18]=1;"";[.C18]) -> 0.0245561 | H18: of:=IF([.D18]=1;"";[.D18]) -> 0.208818 | I18: of:=IF([.E18]=1;"";[.E18]) -> 0.0245561
A19: 18 | B19: strstr: &"vvend"{\0} &"ve"{\0} :=> &"vend"{\0,54} | C19: 0.0280575 | D19: 0.221991 | E19: 0.0498465 | G19: of:=IF([.C19]=1;"";[.C19]) -> 0.0280575 | H19: of:=IF([.D19]=1;"";[.D19]) -> 0.221991 | I19: of:=IF([.E19]=1;"";[.E19]) -> 0.0498465
A20: 19 | B20: strstr: &"nogrc"{\0} &"og"{\0} :=> &"ogrc"{\0,54} | C20: 0.029701 | D20: 0.211356 | E20: 0.0455663 | G20: of:=IF([.C20]=1;"";[.C20]) -> 0.029701 | H20: of:=IF([.D20]=1;"";[.D20]) -> 0.211356 | I20: of:=IF([.E20]=1;"";[.E20]) -> 0.0455663 | K20: of:=AVERAGE([.G20:.G24]) -> 0.02882334 | L20: of:=AVERAGE([.H20:.H24]) -> 0.214911 | M20: of:=AVERAGE([.I20:.I24]) -> 0.03505592 | O20: of:=AVERAGE([.K20:.M20]) -> 0.0929300866666667
A21: 1 | B21: strnstr: &"noeve"{\0} &""{\0,p,\0} 2 :=> &"noeve"{\0} | C21: 0.03009 | D21: 1 | E21: 0.03009 | G21: of:=IF([.C21]=1;"";[.C21]) -> 0.03009 | H21: of:=IF([.D21]=1;"";[.D21]) ->  | I21: of:=IF([.E21]=1;"";[.E21]) -> 0.03009
A22: 2 | B22: strnstr: &"pebuj"{\0} &"p"{\0,\0} 2 :=> &"pebuj"{\0} | C22: 0.0270689 | D22: 1 | E22: 0.0270689 | G22: of:=IF([.C22]=1;"";[.C22]) -> 0.0270689 | H22: of:=IF([.D22]=1;"";[.D22]) ->  | I22: of:=IF([.E22]=1;"";[.E22]) -> 0.0270689
A23: 3 | B23: strnstr: &"qufst"{\0} &"u"{\0,\0} 2 :=> &"ufst"{\0,54} | C23: 0.0280176 | D23: 1 | E23: 0.0433152 | G23: of:=IF([.C23]=1;"";[.C23]) -> 0.0280176 | H23: of:=IF([.D23]=1;"";[.D23]) ->  | I23: of:=IF([.E23]=1;"";[.E23]) -> 0.0433152
A24: 4 | B24: strnstr: &"ctsrm"{\0} &"ct"{\0} 2 :=> &"ctsrm"{\0} | C24: 0.0292392 | D24: 0.218466 | E24: 0.0292392 | G24: of:=IF([.C24]=1;"";[.C24]) -> 0.0292392 | H24: of:=IF([.D24]=1;"";[.D24]) -> 0.218466 | I24: of:=IF([.E24]=1;"";[.E24]) -> 0.0292392
A25: 1 | B25: strpbrk: &"kuyau"{\0} &"aeiou"{\0} :=> &"uyau"{\0,54} | C25: 0.0262148 | D25: 0.0299288 | E25: 0.0426961 | G25: of:=IF([.C25]=1;"";[.C25]) -> 0.0262148 | H25: of:=IF([.D25]=1;"";[.D25]) -> 0.0299288 | I25: of:=IF([.E25]=1;"";[.E25]) -> 0.0426961 | K25: of:=AVERAGE([.G25:.G34]) -> 0.02586056 | L25: of:=AVERAGE([.H25:.H34]) -> 0.0299288 | M25: of:=AVERAGE([.I25:.I34]) -> 0.03384389 | O25: of:=AVERAGE([.K25:.M25]) -> 0.02987775
A26: 2 | B26: strpbrk: &"soafo"{\0} &"aeiou"{\0} :=> &"oafo"{\0,54} | C26: 0.0297863 | D26: 0.0299288 | E26: 0.0457821 | G26: of:=IF([.C26]=1;"";[.C26]) -> 0.0297863 | H26: of:=IF([.D26]=1;"";[.D26]) -> 0.0299288 | I26: of:=IF([.E26]=1;"";[.E26]) -> 0.0457821
A27: 3 | B27: strpbrk: &"ciaku"{\0} &"aeiou"{\0} :=> &"iaku"{\0,54} | C27: 0.0282477 | D27: 0.0299288 | E27: 0.0432172 | G27: of:=IF([.C27]=1;"";[.C27]) -> 0.0282477 | H27: of:=IF([.D27]=1;"";[.D27]) -> 0.0299288 | I27: of:=IF([.E27]=1;"";[.E27]) -> 0.0432172
A28: 4 | B28: strpbrk: &"ceagt"{\0} &"aeiou"{\0} :=> &"eagt"{\0,54} | C28: 0.0300538 | D28: 0.0299288 | E28: 0.0458272 | G28: of:=IF([.C28]=1;"";[.C28]) -> 0.0300538 | H28: of:=IF([.D28]=1;"";[.D28]) -> 0.0299288 | I28: of:=IF([.E28]=1;"";[.E28]) -> 0.0458272
A29: 5 | B29: strpbrk: &"zagnf"{\0} &"aeiou"{\0} :=> &"agnf"{\0,54} | C29: 0.0283018 | D29: 0.0299288 | E29: 0.0449151 | G29: of:=IF([.C29]=1;"";[.C29]) -> 0.0283018 | H29: of:=IF([.D29]=1;"";[.D29]) -> 0.0299288 | I29: of:=IF([.E29]=1;"";[.E29]) -> 0.0449151
A30: 6 | B30: strpbrk: &"ufhul"{\0} &"aeiou"{\0} :=> &"ufhul"{\0} | C30: 0.0243667 | D30: 0.0299288 | E30: 0.0243667 | G30: of:=IF([.C30]=1;"";[.C30]) -> 0.0243667 | H30: of:=IF([.D30]=1;"";[.D30]) -> 0.0299288 | I30: of:=IF([.E30]=1;"";[.E30]) -> 0.0243667
A31: 7 | B31: strpbrk: &"oqfsf"{\0} &"aeiou"{\0} :=> &"oqfsf"{\0} | C31: 0.0168286 | D31: 0.0299288 | E31: 0.0168286 | G31: of:=IF([.C31]=1;"";[.C31]) -> 0.0168286 | H31: of:=IF([.D31]=1;"";[.D31]) -> 0.0299288 | I31: of:=IF([.E31]=1;"";[.E31]) -> 0.0168286
A32: 8 | B32: strpbrk: &"ifecm"{\0} &"aeiou"{\0} :=> &"ifecm"{\0} | C32: 0.0267192 | D32: 0.0299288 | E32: 0.0267192 | G32: of:=IF([.C32]=1;"";[.C32]) -> 0.0267192 | H32: of:=IF([.D32]=1;"";[.D32]) -> 0.0299288 | I32: of:=IF([.E32]=1;"";[.E32]) -> 0.0267192
A33: 9 | B33: strpbrk: &"eftpb"{\0} &"aeiou"{\0} :=> &"eftpb"{\0} | C33: 0.0257879 | D33: 0.0299288 | E33: 0.0257879 | G33: of:=IF([.C33]=1;"";[.C33]) -> 0.0257879 | H33: of:=IF([.D33]=1;"";[.D33]) -> 0.0299288 | I33: of:=IF([.E33]=1;"";[.E33]) -> 0.0257879
A34: 10 | B34: strpbrk: &"aljks"{\0} &"aeiou"{\0} :=> &"aljks"{\0} | C34: 0.0222988 | D34: 0.0299288 | E34: 0.0222988 | G34: of:=IF([.C34]=1;"";[.C34]) -> 0.0222988 | H34: of:=IF([.D34]=1;"";[.D34]) -> 0.0299288 | I34: of:=IF([.E34]=1;"";[.E34]) -> 0.0222988