Sheet: strlen
A1: strlen: &"\x01"{\0,\0,\0,\0,\0} :=> 1; | J1: # | K1: Test Case | L1: N | P1: FINAL
A2: strlen: &"\x01\x01"{\0,\0,\0,\0} :=> 2; | J2: 1 | K2: strlen: &"p"{\0,p,o,v,\0} :=> 1 | L2: 1 | N2: of:=IF([.L2]=1;"";[.L2]) ->  | P2: of:=AVERAGE([.N2:.N6]) -> 0.0878475
A3: strlen: &"\x01\x01\x01"{\0,\0,\0} :=> 3; | J3: 2 | K3: strlen: &"fa"{\0,p,t,\0} :=> 2 | L3: 0.213806 | N3: of:=IF([.L3]=1;"";[.L3]) -> 0.213806
A4: strlen: &"\x01\x01\x01\x01"{\0,\0} :=> 4; | J4: 3 | K4: strlen: &"jiu"{\0,p,\0} :=> 3 | L4: 0.0741059 | N4: of:=IF([.L4]=1;"";[.L4]) -> 0.0741059
A5: strlen: &"\x01\x01\x01\x01\x01"{\0} :=> 5; | J5: 4 | K5: strlen: &"dklh"{\0,\0} :=> 4 | L5: 0.03662 | N5: of:=IF([.L5]=1;"";[.L5]) -> 0.03662
A6: strnlen: &""{\0,\0,\0,\0,\0,\0} 6 :=> 0; 1; | J6: 5 | K6: strlen: &"sudvu"{\0} :=> 5 | L6: 0.0268581 | N6: of:=IF([.L6]=1;"";[.L6]) -> 0.0268581
A7: strnlen: &"\x01"{\0,\0,\0,\0,\0} 6 :=> 1; | J7: 1 | K7: strnlen: &""{\0,p,g,k,d,\0} 6 :=> 0 | L7: 1 | N7: of:=IF([.L7]=1;"";[.L7]) ->  | P7: of:=AVERAGE([.N7:.N12]) -> 0.09373115
A8: strnlen: &"\x01\x01"{\0,\0,\0,\0} 6 :=> 2; | J8: 2 | K8: strnlen: &"l"{\0,p,t,f,\0} 6 :=> 1 | L8: 1 | N8: of:=IF([.L8]=1;"";[.L8]) -> 
A9: strnlen: &"\x01\x01\x01"{\0,\0,\0} 6 :=> 3; | J9: 3 | K9: strnlen: &"he"{\0,p,t,\0} 6 :=> 2 | L9: 0.226983 | N9: of:=IF([.L9]=1;"";[.L9]) -> 0.226983
A10: strnlen: &"\x01\x01\x01\x01"{\0,\0} 6 :=> 4; | J10: 4 | K10: strnlen: &"pgs"{\0,p,\0} 6 :=> 3 | L10: 0.0777835 | N10: of:=IF([.L10]=1;"";[.L10]) -> 0.0777835
A11: strnlen: &"\x01\x01\x01\x01\x01"{\0} 6 :=> 5; | J11: 5 | K11: strnlen: &"gmik"{\0,\0} 6 :=> 4 | L11: 0.0430643 | N11: of:=IF([.L11]=1;"";[.L11]) -> 0.0430643
J12: 6 | K12: strnlen: &"yabbb"{\0} 6 :=> 5 | L12: 0.0270938 | N12: of:=IF([.L12]=1;"";[.L12]) -> 0.0270938

Sheet: strcmp
A1: # | B1: Test Case | C1: N1 | D1: N2 | L1: FINAL
A2: 1 | B2: strcmp: &"t"{\0,p,u,o,\0} &"t"{\0,p,b,t,\0} :=> 0 | C2: 1 | D2: 1 | F2: of:=IF([.C2]=1;"";[.C2]) ->  | G2: of:=IF([.D2]=1;"";[.D2]) ->  | H2: of:=IF([.E2]=1;"";[.E2]) ->   | I2: of:=AVERAGE([.F2:.F16]) -> 0.0376599357142857 | J2: of:=AVERAGE([.G2:.G16]) -> 0.03726695 | L2: of:=AVERAGE([.I2:.J2]) -> 0.0374634428571429
A3: 2 | B3: strcmp: &"vh"{\0,p,a,\0} &"vh"{\0,p,o,\0} :=> 0 | C3: 0.127187 | D3: 0.127187 | F3: of:=IF([.C3]=1;"";[.C3]) -> 0.127187 | G3: of:=IF([.D3]=1;"";[.D3]) -> 0.127187 | H3: of:=IF([.E3]=1;"";[.E3]) ->  
A4: 3 | B4: strcmp: &"clk"{\0,p,\0} &"clk"{\0,p,\0} :=> 0 | C4: 0.0822007 | D4: 0.0822007 | F4: of:=IF([.C4]=1;"";[.C4]) -> 0.0822007 | G4: of:=IF([.D4]=1;"";[.D4]) -> 0.0822007 | H4: of:=IF([.E4]=1;"";[.E4]) ->  
A5: 4 | B5: strcmp: &"ziqa"{\0,\0} &"ziqa"{\0,\0} :=> 0 | C5: 0.0341661 | D5: 0.0341661 | F5: of:=IF([.C5]=1;"";[.C5]) -> 0.0341661 | G5: of:=IF([.D5]=1;"";[.D5]) -> 0.0341661 | H5: of:=IF([.E5]=1;"";[.E5]) ->  
A6: 5 | B6: strcmp: &"npofu"{\0} &"npofu"{\0} :=> 0 | C6: 0.0287702 | D6: 0.0287702 | F6: of:=IF([.C6]=1;"";[.C6]) -> 0.0287702 | G6: of:=IF([.D6]=1;"";[.D6]) -> 0.0287702 | H6: of:=IF([.E6]=1;"";[.E6]) ->  
A7: 6 | B7: strcmp: &"eanmb"{\0} &"eanma"{\0} :=> 1 | C7: 0.0302707 | D7: 0.0308793 | F7: of:=IF([.C7]=1;"";[.C7]) -> 0.0302707 | G7: of:=IF([.D7]=1;"";[.D7]) -> 0.0308793 | H7: of:=IF([.E7]=1;"";[.E7]) ->  
A8: 7 | B8: strcmp: &"oyaqv"{\0} &"oyaqz"{\0} :=> -1 | C8: 0.0206712 | D8: 0 | F8: of:=IF([.C8]=1;"";[.C8]) -> 0.0206712 | G8: of:=IF([.D8]=1;"";[.D8]) -> 0 | H8: of:=IF([.E8]=1;"";[.E8]) ->  
A9: 8 | B9: strcmp: &"merek"{\0} &"merbl"{\0} :=> 1 | C9: 0.0314635 | D9: 0.0305348 | F9: of:=IF([.C9]=1;"";[.C9]) -> 0.0314635 | G9: of:=IF([.D9]=1;"";[.D9]) -> 0.0305348 | H9: of:=IF([.E9]=1;"";[.E9]) ->  
A10: 9 | B10: strcmp: &"qiylh"{\0} &"qiyra"{\0} :=> -1 | C10: 0.0232147 | D10: 0.0251735 | F10: of:=IF([.C10]=1;"";[.C10]) -> 0.0232147 | G10: of:=IF([.D10]=1;"";[.D10]) -> 0.0251735 | H10: of:=IF([.E10]=1;"";[.E10]) ->  
A11: 10 | B11: strcmp: &"qibjs"{\0} &"qiask"{\0} :=> 1 | C11: 0.0206917 | D11: 0.0279004 | F11: of:=IF([.C11]=1;"";[.C11]) -> 0.0206917 | G11: of:=IF([.D11]=1;"";[.D11]) -> 0.0279004 | H11: of:=IF([.E11]=1;"";[.E11]) ->  
A12: 11 | B12: strcmp: &"wegxb"{\0} &"wessd"{\0} :=> -1 | C12: 0.0200042 | D12: 0.0300351 | F12: of:=IF([.C12]=1;"";[.C12]) -> 0.0200042 | G12: of:=IF([.D12]=1;"";[.D12]) -> 0.0300351
A13: 12 | B13: strcmp: &"ihtlo"{\0} &"iddsg"{\0} :=> 1 | C13: 0.0274733 | D13: 0.0273763 | F13: of:=IF([.C13]=1;"";[.C13]) -> 0.0274733 | G13: of:=IF([.D13]=1;"";[.D13]) -> 0.0273763
A14: 13 | B14: strcmp: &"hunam"{\0} &"hydoy"{\0} :=> -1 | C14: 0.0300521 | D14: 0.026998 | F14: of:=IF([.C14]=1;"";[.C14]) -> 0.0300521 | G14: of:=IF([.D14]=1;"";[.D14]) -> 0.026998
A15: 14 | B15: strcmp: &"pybuw"{\0} &"jnoeh"{\0} :=> 1 | C15: 0.025351 | D15: 0.0240897 | F15: of:=IF([.C15]=1;"";[.C15]) -> 0.025351 | G15: of:=IF([.D15]=1;"";[.D15]) -> 0.0240897
A16: 15 | B16: strcmp: &"ryxce"{\0} &"ukybe"{\0} :=> -1 | C16: 0.0257227 | D16: 0.0264262 | F16: of:=IF([.C16]=1;"";[.C16]) -> 0.0257227 | G16: of:=IF([.D16]=1;"";[.D16]) -> 0.0264262
A17: 1 | B17: strncmp: &""{\0,p,s,m,c,\0} &""{\0,p,s,y,s,\0} 5 :=> 0 | C17: 1 | D17: 1 | F17: of:=IF([.C17]=1;"";[.C17]) ->  | G17: of:=IF([.D17]=1;"";[.D17]) ->  | I17: of:=AVERAGE([.F17:.F32]) -> 0.0440681642857143 | J17: of:=AVERAGE([.G17:.G32]) -> 0.0422486428571429 | L17: of:=AVERAGE([.I17:.J17]) -> 0.0431584035714286
A18: 2 | B18: strncmp: &"d"{\0,p,l,o,\0} &"d"{\0,p,d,i,\0} 5 :=> 0 | C18: 1 | D18: 1 | F18: of:=IF([.C18]=1;"";[.C18]) ->  | G18: of:=IF([.D18]=1;"";[.D18]) -> 
A19: 3 | B19: strncmp: &"ui"{\0,p,o,\0} &"ui"{\0,p,e,\0} 5 :=> 0 | C19: 0.212346 | D19: 0.212346 | F19: of:=IF([.C19]=1;"";[.C19]) -> 0.212346 | G19: of:=IF([.D19]=1;"";[.D19]) -> 0.212346
A20: 4 | B20: strncmp: &"cuv"{\0,p,\0} &"cuv"{\0,p,\0} 5 :=> 0 | C20: 0.078078 | D20: 0.078078 | F20: of:=IF([.C20]=1;"";[.C20]) -> 0.078078 | G20: of:=IF([.D20]=1;"";[.D20]) -> 0.078078
A21: 5 | B21: strncmp: &"srfp"{\0,\0} &"srfp"{\0,\0} 5 :=> 0 | C21: 0.0349505 | D21: 0.0349505 | F21: of:=IF([.C21]=1;"";[.C21]) -> 0.0349505 | G21: of:=IF([.D21]=1;"";[.D21]) -> 0.0349505
A22: 6 | B22: strncmp: &"vesfb"{\0} &"vesfb"{\0} 5 :=> 0 | C22: 0.0260247 | D22: 0.0260247 | F22: of:=IF([.C22]=1;"";[.C22]) -> 0.0260247 | G22: of:=IF([.D22]=1;"";[.D22]) -> 0.0260247
A23: 7 | B23: strncmp: &"ybbja"{\0} &"ybbjP"{\0} 5 :=> 1 | C23: 0.0251949 | D23: 0 | F23: of:=IF([.C23]=1;"";[.C23]) -> 0.0251949 | G23: of:=IF([.D23]=1;"";[.D23]) -> 0
A24: 8 | B24: strncmp: &"pegeu"{\0} &"pegew"{\0} 5 :=> -1 | C24: 0.0294333 | D24: 0.0303726 | F24: of:=IF([.C24]=1;"";[.C24]) -> 0.0294333 | G24: of:=IF([.D24]=1;"";[.D24]) -> 0.0303726
A25: 9 | B25: strncmp: &"nstdf"{\0} &"nstaw"{\0} 5 :=> 1 | C25: 0.0272742 | D25: 0.0309142 | F25: of:=IF([.C25]=1;"";[.C25]) -> 0.0272742 | G25: of:=IF([.D25]=1;"";[.D25]) -> 0.0309142
A26: 10 | B26: strncmp: &"suucr"{\0} &"suuiq"{\0} 5 :=> -1 | C26: 0.0268578 | D26: 0.0254731 | F26: of:=IF([.C26]=1;"";[.C26]) -> 0.0268578 | G26: of:=IF([.D26]=1;"";[.D26]) -> 0.0254731
A27: 11 | B27: strncmp: &"rnrrg"{\0} &"rnavl"{\0} 5 :=> 1 | C27: 0.0283301 | D27: 0.0269611 | F27: of:=IF([.C27]=1;"";[.C27]) -> 0.0283301 | G27: of:=IF([.D27]=1;"";[.D27]) -> 0.0269611
A28: 12 | B28: strncmp: &"phpiu"{\0} &"phvua"{\0} 5 :=> -1 | C28: 0.0256959 | D28: 0.0242881 | F28: of:=IF([.C28]=1;"";[.C28]) -> 0.0256959 | G28: of:=IF([.D28]=1;"";[.D28]) -> 0.0242881
A29: 13 | B29: strncmp: &"vvudl"{\0} &"vgluk"{\0} 5 :=> 1 | C29: 0.0237654 | D29: 0.0242945 | F29: of:=IF([.C29]=1;"";[.C29]) -> 0.0237654 | G29: of:=IF([.D29]=1;"";[.D29]) -> 0.0242945
A30: 14 | B30: strncmp: &"bmsnu"{\0} &"buery"{\0} 5 :=> -1 | C30: 0.0264526 | D30: 0.030688 | F30: of:=IF([.C30]=1;"";[.C30]) -> 0.0264526 | G30: of:=IF([.D30]=1;"";[.D30]) -> 0.030688
A31: 15 | B31: strncmp: &"pswtm"{\0} &"bypfn"{\0} 5 :=> 1 | C31: 0.0264551 | D31: 0.0237366 | F31: of:=IF([.C31]=1;"";[.C31]) -> 0.0264551 | G31: of:=IF([.D31]=1;"";[.D31]) -> 0.0237366
A32: 16 | B32: strncmp: &"hhyta"{\0} &"mvvar"{\0} 5 :=> -1 | C32: 0.0260958 | D32: 0.0233536 | F32: of:=IF([.C32]=1;"";[.C32]) -> 0.0260958 | G32: of:=IF([.D32]=1;"";[.D32]) -> 0.0233536
A33: 1 | B33: sysfs_streq: &""{\0,p,i,c,j,\0} &"zlitt"{\0} :=> \0 | C33: 1 | D33: 0.0288629 | F33: of:=IF([.C33]=1;"";[.C33]) ->  | G33: of:=IF([.D33]=1;"";[.D33]) -> 0.0288629 | I33: of:=AVERAGE([.F33:.F71]) -> 0.069067924137931 | J33: of:=AVERAGE([.G33:.G71]) -> 0.0457149714285714 | L33: of:=AVERAGE([.I33:.J33]) -> 0.0573914477832512
A34: 2 | B34: sysfs_streq: &""{\0,p,s,a,q,\0} &"\n"{\0,b,e,u,\0} :=> \x01 | C34: 1 | F34: of:=IF([.C34]=1;"";[.C34]) ->  | G34: of:=IF([.D34]=1;"";[.D34]) ->  
A35: 3 | B35: sysfs_streq: &""{\0,p,l,o,p,\0} &"\nakwt"{\0} :=> \0 | C35: 1 | F35: of:=IF([.C35]=1;"";[.C35]) ->  | G35: of:=IF([.D35]=1;"";[.D35]) ->  
A36: 4 | B36: sysfs_streq: &""{\0,p,e,k,s,\0} &""{\0,h,n,o,v,\0} :=> \x01 | C36: 1 | D36: 1 | F36: of:=IF([.C36]=1;"";[.C36]) ->  | G36: of:=IF([.D36]=1;"";[.D36]) -> 
A37: 5 | B37: sysfs_streq: &"hjfsk"{\0} &"nrwar"{\0} :=> \0 | C37: 0.0185685 | D37: 0.0283968 | F37: of:=IF([.C37]=1;"";[.C37]) -> 0.0185685 | G37: of:=IF([.D37]=1;"";[.D37]) -> 0.0283968
A38: 6 | B38: sysfs_streq: &"\n"{\0,p,n,o,\0} &""{\0,a,i,e,x,\0} :=> \x01 | C38: 1 | F38: of:=IF([.C38]=1;"";[.C38]) ->  | G38: of:=IF([.D38]=1;"";[.D38]) ->  
A39: 7 | B39: sysfs_streq: &"\n"{\0,a,w,k,\0} &"yikwh"{\0} :=> \0 | C39: 0.0271816 | F39: of:=IF([.C39]=1;"";[.C39]) -> 0.0271816 | G39: of:=IF([.D39]=1;"";[.D39]) ->  
A40: 8 | B40: sysfs_streq: &"\naiqi"{\0} &"glcat"{\0} :=> \0 | C40: 0.0291137 | F40: of:=IF([.C40]=1;"";[.C40]) -> 0.0291137 | G40: of:=IF([.D40]=1;"";[.D40]) ->  
A41: 9 | B41: sysfs_streq: &"x"{\0,p,g,o,\0} &"xikvl"{\0} :=> \0 | C41: 1 | D41: 0.022919 | F41: of:=IF([.C41]=1;"";[.C41]) ->  | G41: of:=IF([.D41]=1;"";[.D41]) -> 0.022919
A42: 10 | B42: sysfs_streq: &"c"{\0,p,s,c,\0} &"c\n"{\0,a,b,\0} :=> \x01 | C42: 1 | F42: of:=IF([.C42]=1;"";[.C42]) ->  | G42: of:=IF([.D42]=1;"";[.D42]) ->  
A43: 11 | B43: sysfs_streq: &"z"{\0,p,i,q,\0} &"z\nats"{\0} :=> \0 | C43: 1 | F43: of:=IF([.C43]=1;"";[.C43]) ->  | G43: of:=IF([.D43]=1;"";[.D43]) ->  
A44: 12 | B44: sysfs_streq: &"z"{\0,p,y,c,\0} &"z"{\0,h,u,o,\0} :=> \x01 | C44: 1 | D44: 1 | F44: of:=IF([.C44]=1;"";[.C44]) ->  | G44: of:=IF([.D44]=1;"";[.D44]) -> 
A45: 13 | B45: sysfs_streq: &"hnnjn"{\0} &"hseyf"{\0} :=> \0 | C45: 0.0233313 | D45: 0.0271706 | F45: of:=IF([.C45]=1;"";[.C45]) -> 0.0233313 | G45: of:=IF([.D45]=1;"";[.D45]) -> 0.0271706
A46: 14 | B46: sysfs_streq: &"e\n"{\0,b,i,\0} &"e"{\0,b,b,m,\0} :=> \x01 | C46: 1 | F46: of:=IF([.C46]=1;"";[.C46]) ->  | G46: of:=IF([.D46]=1;"";[.D46]) ->  
A47: 15 | B47: sysfs_streq: &"a\n"{\0,b,v,\0} &"aitmw"{\0} :=> \0 | C47: 0.0267448 | F47: of:=IF([.C47]=1;"";[.C47]) -> 0.0267448 | G47: of:=IF([.D47]=1;"";[.D47]) ->  
A48: 16 | B48: sysfs_streq: &"t\narc"{\0} &"tudmd"{\0} :=> \0 | C48: 0.0261333 | F48: of:=IF([.C48]=1;"";[.C48]) -> 0.0261333 | G48: of:=IF([.D48]=1;"";[.D48]) ->  
A49: 17 | B49: sysfs_streq: &"yi"{\0,p,y,\0} &"yiisa"{\0} :=> \0 | C49: 0.207882 | D49: 0.0281546 | F49: of:=IF([.C49]=1;"";[.C49]) -> 0.207882 | G49: of:=IF([.D49]=1;"";[.D49]) -> 0.0281546
A50: 18 | B50: sysfs_streq: &"ps"{\0,p,y,\0} &"ps\n"{\0,a,\0} :=> \x01 | C50: 0.209333 | F50: of:=IF([.C50]=1;"";[.C50]) -> 0.209333 | G50: of:=IF([.D50]=1;"";[.D50]) ->  
A51: 19 | B51: sysfs_streq: &"zm"{\0,p,o,\0} &"zm\nae"{\0} :=> \0 | C51: 0.183327 | F51: of:=IF([.C51]=1;"";[.C51]) -> 0.183327 | G51: of:=IF([.D51]=1;"";[.D51]) ->  
A52: 20 | B52: sysfs_streq: &"qu"{\0,p,a,\0} &"qu"{\0,b,u,\0} :=> \x01 | C52: 0.212836 | D52: 0.212836 | F52: of:=IF([.C52]=1;"";[.C52]) -> 0.212836 | G52: of:=IF([.D52]=1;"";[.D52]) -> 0.212836
A53: 21 | B53: sysfs_streq: &"vinwb"{\0} &"vimdg"{\0} :=> \0 | C53: 0.027557 | D53: 0.02678 | F53: of:=IF([.C53]=1;"";[.C53]) -> 0.027557 | G53: of:=IF([.D53]=1;"";[.D53]) -> 0.02678
A54: 22 | B54: sysfs_streq: &"at\n"{\0,b,\0} &"at"{\0,b,t,\0} :=> \x01 | C54: 0.224529 | F54: of:=IF([.C54]=1;"";[.C54]) -> 0.224529 | G54: of:=IF([.D54]=1;"";[.D54]) ->  
A55: 23 | B55: sysfs_streq: &"ui\n"{\0,b,\0} &"uipda"{\0} :=> \0 | C55: 0.0266709 | F55: of:=IF([.C55]=1;"";[.C55]) -> 0.0266709 | G55: of:=IF([.D55]=1;"";[.D55]) ->  
A56: 24 | B56: sysfs_streq: &"fr\nae"{\0} &"frpeu"{\0} :=> \0 | C56: 0.0288322 | F56: of:=IF([.C56]=1;"";[.C56]) -> 0.0288322 | G56: of:=IF([.D56]=1;"";[.D56]) ->  
A57: 25 | B57: sysfs_streq: &"aor"{\0,p,\0} &"aorrg"{\0} :=> \0 | C57: 0.0819653 | D57: 0.0286554 | F57: of:=IF([.C57]=1;"";[.C57]) -> 0.0819653 | G57: of:=IF([.D57]=1;"";[.D57]) -> 0.0286554
A58: 26 | B58: sysfs_streq: &"bld"{\0,p,\0} &"bld\n"{\0,\0} :=> \x01 | C58: 0.0865267 | F58: of:=IF([.C58]=1;"";[.C58]) -> 0.0865267 | G58: of:=IF([.D58]=1;"";[.D58]) ->  
A59: 27 | B59: sysfs_streq: &"dhb"{\0,p,\0} &"dhb\na"{\0} :=> \0 | C59: 0.0738335 | F59: of:=IF([.C59]=1;"";[.C59]) -> 0.0738335 | G59: of:=IF([.D59]=1;"";[.D59]) ->  
A60: 28 | B60: sysfs_streq: &"ioo"{\0,p,\0} &"ioo"{\0,h,\0} :=> \x01 | C60: 0.0879628 | D60: 0.0879628 | F60: of:=IF([.C60]=1;"";[.C60]) -> 0.0879628 | G60: of:=IF([.D60]=1;"";[.D60]) -> 0.0879628
A61: 29 | B61: sysfs_streq: &"tijes"{\0} &"tijca"{\0} :=> \0 | C61: 0.028438 | D61: 0.024356 | F61: of:=IF([.C61]=1;"";[.C61]) -> 0.028438 | G61: of:=IF([.D61]=1;"";[.D61]) -> 0.024356
A62: 30 | B62: sysfs_streq: &"bvo\n"{\0,\0} &"bvo"{\0,a,\0} :=> \x01 | C62: 0.0763741 | F62: of:=IF([.C62]=1;"";[.C62]) -> 0.0763741 | G62: of:=IF([.D62]=1;"";[.D62]) ->  
A63: 31 | B63: sysfs_streq: &"gyt\n"{\0,\0} &"gytko"{\0} :=> \0 | C63: 0.0244659 | F63: of:=IF([.C63]=1;"";[.C63]) -> 0.0244659 | G63: of:=IF([.D63]=1;"";[.D63]) ->  
A64: 32 | B64: sysfs_streq: &"mhy\na"{\0} &"mhydd"{\0} :=> \0 | C64: 0.0245034 | F64: of:=IF([.C64]=1;"";[.C64]) -> 0.0245034 | G64: of:=IF([.D64]=1;"";[.D64]) ->  
A65: 33 | B65: sysfs_streq: &"qtmh"{\0,\0} &"qtmhy"{\0} :=> \0 | C65: 0.0299471 | D65: 0.0200344 | F65: of:=IF([.C65]=1;"";[.C65]) -> 0.0299471 | G65: of:=IF([.D65]=1;"";[.D65]) -> 0.0200344
A66: 34 | B66: sysfs_streq: &"sixi"{\0,\0} &"sixi\n"{\0} :=> \x01 | C66: 0.0437662 | F66: of:=IF([.C66]=1;"";[.C66]) -> 0.0437662 | G66: of:=IF([.D66]=1;"";[.D66]) ->  
A67: 35 | B67: sysfs_streq: &"tgrp"{\0,\0} &"tgrp"{\0,\0} :=> \x01 | C67: 0.0424736 | D67: 0.0424736 | F67: of:=IF([.C67]=1;"";[.C67]) -> 0.0424736 | G67: of:=IF([.D67]=1;"";[.D67]) -> 0.0424736
A68: 36 | B68: sysfs_streq: &"muraa"{\0} &"murab"{\0} :=> \0 | C68: 0.0285907 | D68: 0.030461 | F68: of:=IF([.C68]=1;"";[.C68]) -> 0.0285907 | G68: of:=IF([.D68]=1;"";[.D68]) -> 0.030461
A69: 37 | B69: sysfs_streq: &"adlf\n"{\0} &"adlf"{\0,\0} :=> \x01 | C69: 0.0446083 | F69: of:=IF([.C69]=1;"";[.C69]) -> 0.0446083 | G69: of:=IF([.D69]=1;"";[.D69]) ->  
A70: 38 | B70: sysfs_streq: &"afks\n"{\0} &"afkss"{\0} :=> \0 | C70: 0.0265274 | F70: of:=IF([.C70]=1;"";[.C70]) -> 0.0265274 | G70: of:=IF([.D70]=1;"";[.D70]) ->  
A71: 39 | B71: sysfs_streq: &"ffied"{\0} &"ffied"{\0} :=> \x01 | C71: 0.0309465 | D71: 0.0309465 | F71: of:=IF([.C71]=1;"";[.C71]) -> 0.0309465 | G71: of:=IF([.D71]=1;"";[.D71]) -> 0.0309465

Sheet: strcpy
A1: # | B1: Test Case | C1: N1 | D1: N2 | E1: N3 | O1: FINAL
A2: 1 | B2: strcpy: &""{\0,\x01,\x01,\x01,\x01,\x01} &"u"{\0,p,d,l,\0} :=> &"u"{\0,p,y,a,\0} | C2: 1 | D2: 1 | E2: 1 | G2: of:=IF([.C2]=1;"";[.C2]) ->  | H2: of:=IF([.D2]=1;"";[.D2]) ->  | I2: of:=IF([.E2]=1;"";[.E2]) ->  | K2: of:=AVERAGE([.G2:.G36]) -> 0.0884571541666667 | L2: of:=AVERAGE([.H2:.H36]) -> 0.090763925 | M2: of:=AVERAGE([.I2:.I36]) -> 0.090763925 | O2: of:=AVERAGE([.K2:.M2]) -> 0.0899950013888889
A3: 2 | B3: strcpy: &""{\0,\x01,\x01,\x01,\x01,\x01} &"th"{\0,p,r,\0} :=> &"th"{\0,p,h,\0} | C3: 1 | D3: 0.227384 | E3: 0.227384 | G3: of:=IF([.C3]=1;"";[.C3]) ->  | H3: of:=IF([.D3]=1;"";[.D3]) -> 0.227384 | I3: of:=IF([.E3]=1;"";[.E3]) -> 0.227384
A4: 3 | B4: strcpy: &""{\0,\x01,\x01,\x01,\x01,\x01} &"des"{\0,p,\0} :=> &"des"{\0,p,\0} | C4: 1 | D4: 0.0905241 | E4: 0.0905241 | G4: of:=IF([.C4]=1;"";[.C4]) ->  | H4: of:=IF([.D4]=1;"";[.D4]) -> 0.0905241 | I4: of:=IF([.E4]=1;"";[.E4]) -> 0.0905241
A5: 4 | B5: strcpy: &""{\0,\x01,\x01,\x01,\x01,\x01} &"bdsr"{\0,\0} :=> &"bdsr"{\0,\0} | C5: 1 | D5: 0.0401033 | E5: 0.0401033 | G5: of:=IF([.C5]=1;"";[.C5]) ->  | H5: of:=IF([.D5]=1;"";[.D5]) -> 0.0401033 | I5: of:=IF([.E5]=1;"";[.E5]) -> 0.0401033
A6: 5 | B6: strcpy: &""{\0,\x01,\x01,\x01,\x01,\x01} &"llrcs"{\0} :=> &"llrcs"{\0} | C6: 1 | D6: 0.0282705 | E6: 0.0282705 | G6: of:=IF([.C6]=1;"";[.C6]) ->  | H6: of:=IF([.D6]=1;"";[.D6]) -> 0.0282705 | I6: of:=IF([.E6]=1;"";[.E6]) -> 0.0282705
A7: 6 | B7: strcpy: &"r"{\0,\x01,\x01,\x01,\x01} &""{\0,p,n,m,y,\0} :=> &""{\0,\0,p,p,e,\0} | C7: 1 | D7: 1 | E7: 1 | G7: of:=IF([.C7]=1;"";[.C7]) ->  | H7: of:=IF([.D7]=1;"";[.D7]) ->  | I7: of:=IF([.E7]=1;"";[.E7]) -> 
A8: 7 | B8: strcpy: &"m"{\0,\x01,\x01,\x01,\x01} &"t"{\0,p,s,b,\0} :=> &"t"{\0,p,h,a,\0} | C8: 1 | D8: 1 | E8: 1 | G8: of:=IF([.C8]=1;"";[.C8]) ->  | H8: of:=IF([.D8]=1;"";[.D8]) ->  | I8: of:=IF([.E8]=1;"";[.E8]) -> 
A9: 8 | B9: strcpy: &"m"{\0,\x01,\x01,\x01,\x01} &"ao"{\0,p,a,\0} :=> &"ao"{\0,p,o,\0} | C9: 1 | D9: 0.195692 | E9: 0.195692 | G9: of:=IF([.C9]=1;"";[.C9]) ->  | H9: of:=IF([.D9]=1;"";[.D9]) -> 0.195692 | I9: of:=IF([.E9]=1;"";[.E9]) -> 0.195692
A10: 9 | B10: strcpy: &"n"{\0,\x01,\x01,\x01,\x01} &"blo"{\0,p,\0} :=> &"blo"{\0,p,\0} | C10: 1 | D10: 0.0866717 | E10: 0.0866717 | G10: of:=IF([.C10]=1;"";[.C10]) ->  | H10: of:=IF([.D10]=1;"";[.D10]) -> 0.0866717 | I10: of:=IF([.E10]=1;"";[.E10]) -> 0.0866717
A11: 10 | B11: strcpy: &"o"{\0,\x01,\x01,\x01,\x01} &"uyex"{\0,\0} :=> &"uyex"{\0,\0} | C11: 1 | D11: 0.0444136 | E11: 0.0444136 | G11: of:=IF([.C11]=1;"";[.C11]) ->  | H11: of:=IF([.D11]=1;"";[.D11]) -> 0.0444136 | I11: of:=IF([.E11]=1;"";[.E11]) -> 0.0444136
A12: 11 | B12: strcpy: &"j"{\0,\x01,\x01,\x01,\x01} &"cprgv"{\0} :=> &"cprgv"{\0} | C12: 1 | D12: 0.0211022 | E12: 0.0211022 | G12: of:=IF([.C12]=1;"";[.C12]) ->  | H12: of:=IF([.D12]=1;"";[.D12]) -> 0.0211022 | I12: of:=IF([.E12]=1;"";[.E12]) -> 0.0211022
A13: 12 | B13: strcpy: &"xc"{\0,\x01,\x01,\x01} &""{\0,p,i,q,l,\0} :=> &""{\0,c,\0,p,a,\0} | C13: 0.203502 | D13: 1 | E13: 1 | G13: of:=IF([.C13]=1;"";[.C13]) -> 0.203502 | H13: of:=IF([.D13]=1;"";[.D13]) ->  | I13: of:=IF([.E13]=1;"";[.E13]) -> 
A14: 13 | B14: strcpy: &"ft"{\0,\x01,\x01,\x01} &"k"{\0,p,t,l,\0} :=> &"k"{\0,\0,p,a,\0} | C14: 0.212346 | D14: 1 | E14: 1 | G14: of:=IF([.C14]=1;"";[.C14]) -> 0.212346 | H14: of:=IF([.D14]=1;"";[.D14]) ->  | I14: of:=IF([.E14]=1;"";[.E14]) -> 
A15: 14 | B15: strcpy: &"qu"{\0,\x01,\x01,\x01} &"ct"{\0,p,t,\0} :=> &"ct"{\0,p,k,\0} | C15: 0.212836 | D15: 0.218466 | E15: 0.218466 | G15: of:=IF([.C15]=1;"";[.C15]) -> 0.212836 | H15: of:=IF([.D15]=1;"";[.D15]) -> 0.218466 | I15: of:=IF([.E15]=1;"";[.E15]) -> 0.218466
A16: 15 | B16: strcpy: &"yu"{\0,\x01,\x01,\x01} &"juq"{\0,p,\0} :=> &"juq"{\0,p,\0} | C16: 0.187534 | D16: 0.0728445 | E16: 0.0728445 | G16: of:=IF([.C16]=1;"";[.C16]) -> 0.187534 | H16: of:=IF([.D16]=1;"";[.D16]) -> 0.0728445 | I16: of:=IF([.E16]=1;"";[.E16]) -> 0.0728445
A17: 16 | B17: strcpy: &"ey"{\0,\x01,\x01,\x01} &"djck"{\0,\0} :=> &"djck"{\0,\0} | C17: 0.215236 | D17: 0.0353974 | E17: 0.0353974 | G17: of:=IF([.C17]=1;"";[.C17]) -> 0.215236 | H17: of:=IF([.D17]=1;"";[.D17]) -> 0.0353974 | I17: of:=IF([.E17]=1;"";[.E17]) -> 0.0353974
A18: 17 | B18: strcpy: &"ym"{\0,\x01,\x01,\x01} &"mmyrl"{\0} :=> &"mmyrl"{\0} | C18: 0.205591 | D18: 0.0278305 | E18: 0.0278305 | G18: of:=IF([.C18]=1;"";[.C18]) -> 0.205591 | H18: of:=IF([.D18]=1;"";[.D18]) -> 0.0278305 | I18: of:=IF([.E18]=1;"";[.E18]) -> 0.0278305
A19: 18 | B19: strcpy: &"wil"{\0,\x01,\x01} &""{\0,p,p,a,y,\0} :=> &""{\0,i,l,\0,p,\0} | C19: 0.0882755 | D19: 1 | E19: 1 | G19: of:=IF([.C19]=1;"";[.C19]) -> 0.0882755 | H19: of:=IF([.D19]=1;"";[.D19]) ->  | I19: of:=IF([.E19]=1;"";[.E19]) -> 
A20: 19 | B20: strcpy: &"rba"{\0,\x01,\x01} &"j"{\0,p,f,l,\0} :=> &"j"{\0,a,\0,p,\0} | C20: 0.0827957 | D20: 1 | E20: 1 | G20: of:=IF([.C20]=1;"";[.C20]) -> 0.0827957 | H20: of:=IF([.D20]=1;"";[.D20]) ->  | I20: of:=IF([.E20]=1;"";[.E20]) -> 
A21: 20 | B21: strcpy: &"yfo"{\0,\x01,\x01} &"it"{\0,p,j,\0} :=> &"it"{\0,\0,p,\0} | C21: 0.0774712 | D21: 0.222847 | E21: 0.222847 | G21: of:=IF([.C21]=1;"";[.C21]) -> 0.0774712 | H21: of:=IF([.D21]=1;"";[.D21]) -> 0.222847 | I21: of:=IF([.E21]=1;"";[.E21]) -> 0.222847
A22: 21 | B22: strcpy: &"jpi"{\0,\x01,\x01} &"xce"{\0,p,\0} :=> &"xce"{\0,p,\0} | C22: 0.0574837 | D22: 0.0836692 | E22: 0.0836692 | G22: of:=IF([.C22]=1;"";[.C22]) -> 0.0574837 | H22: of:=IF([.D22]=1;"";[.D22]) -> 0.0836692 | I22: of:=IF([.E22]=1;"";[.E22]) -> 0.0836692
A23: 22 | B23: strcpy: &"upa"{\0,\x01,\x01} &"hlaj"{\0,\0} :=> &"hlaj"{\0,\0} | C23: 0.0862147 | D23: 0.0435028 | E23: 0.0435028 | G23: of:=IF([.C23]=1;"";[.C23]) -> 0.0862147 | H23: of:=IF([.D23]=1;"";[.D23]) -> 0.0435028 | I23: of:=IF([.E23]=1;"";[.E23]) -> 0.0435028
A24: 23 | B24: strcpy: &"ria"{\0,\x01,\x01} &"fikar"{\0} :=> &"fikar"{\0} | C24: 0.0882615 | D24: 0.0294123 | E24: 0.0294123 | G24: of:=IF([.C24]=1;"";[.C24]) -> 0.0882615 | H24: of:=IF([.D24]=1;"";[.D24]) -> 0.0294123 | I24: of:=IF([.E24]=1;"";[.E24]) -> 0.0294123
A25: 24 | B25: strcpy: &"sidr"{\0,\x01} &""{\0,p,p,y,g,\0} :=> &""{\0,i,d,r,\0,\0} | C25: 0.0472059 | D25: 1 | E25: 1 | G25: of:=IF([.C25]=1;"";[.C25]) -> 0.0472059 | H25: of:=IF([.D25]=1;"";[.D25]) ->  | I25: of:=IF([.E25]=1;"";[.E25]) -> 
A26: 25 | B26: strcpy: &"bdln"{\0,\x01} &"m"{\0,p,u,r,\0} :=> &"m"{\0,l,n,\0,\0} | C26: 0.0385716 | D26: 1 | E26: 1 | G26: of:=IF([.C26]=1;"";[.C26]) -> 0.0385716 | H26: of:=IF([.D26]=1;"";[.D26]) ->  | I26: of:=IF([.E26]=1;"";[.E26]) -> 
A27: 26 | B27: strcpy: &"nyas"{\0,\x01} &"tr"{\0,p,g,\0} :=> &"tr"{\0,s,\0,\0} | C27: 0.0454538 | D27: 0.218916 | E27: 0.218916 | G27: of:=IF([.C27]=1;"";[.C27]) -> 0.0454538 | H27: of:=IF([.D27]=1;"";[.D27]) -> 0.218916 | I27: of:=IF([.E27]=1;"";[.E27]) -> 0.218916
A28: 27 | B28: strcpy: &"fben"{\0,\x01} &"mut"{\0,p,\0} :=> &"mut"{\0,\0,\0} | C28: 0.0410562 | D28: 0.0859929 | E28: 0.0859929 | G28: of:=IF([.C28]=1;"";[.C28]) -> 0.0410562 | H28: of:=IF([.D28]=1;"";[.D28]) -> 0.0859929 | I28: of:=IF([.E28]=1;"";[.E28]) -> 0.0859929
A29: 28 | B29: strcpy: &"ebap"{\0,\x01} &"pbio"{\0,\0} :=> &"pbio"{\0,\0} | C29: 0.0454756 | D29: 0.0429642 | E29: 0.0429642 | G29: of:=IF([.C29]=1;"";[.C29]) -> 0.0454756 | H29: of:=IF([.D29]=1;"";[.D29]) -> 0.0429642 | I29: of:=IF([.E29]=1;"";[.E29]) -> 0.0429642
A30: 29 | B30: strcpy: &"jjod"{\0,\x01} &"bhljy"{\0} :=> &"bhljy"{\0} | C30: 0.0346613 | D30: 0.0166413 | E30: 0.0166413 | G30: of:=IF([.C30]=1;"";[.C30]) -> 0.0346613 | H30: of:=IF([.D30]=1;"";[.D30]) -> 0.0166413 | I30: of:=IF([.E30]=1;"";[.E30]) -> 0.0166413
A31: 30 | B31: strcpy: &"vaspi"{\0} &""{\0,p,p,q,v,\0} :=> &""{\0,a,s,p,i,\0} | C31: 0.0300099 | D31: 1 | E31: 1 | G31: of:=IF([.C31]=1;"";[.C31]) -> 0.0300099 | H31: of:=IF([.D31]=1;"";[.D31]) ->  | I31: of:=IF([.E31]=1;"";[.E31]) -> 
A32: 31 | B32: strcpy: &"lmekh"{\0} &"p"{\0,p,f,h,\0} :=> &"p"{\0,e,k,h,\0} | C32: 0.0275075 | D32: 1 | E32: 1 | G32: of:=IF([.C32]=1;"";[.C32]) -> 0.0275075 | H32: of:=IF([.D32]=1;"";[.D32]) ->  | I32: of:=IF([.E32]=1;"";[.E32]) -> 
A33: 32 | B33: strcpy: &"lunxr"{\0} &"ps"{\0,p,k,\0} :=> &"ps"{\0,x,r,\0} | C33: 0.0208942 | D33: 0.209333 | E33: 0.209333 | G33: of:=IF([.C33]=1;"";[.C33]) -> 0.0208942 | H33: of:=IF([.D33]=1;"";[.D33]) -> 0.209333 | I33: of:=IF([.E33]=1;"";[.E33]) -> 0.209333
A34: 33 | B34: strcpy: &"icaua"{\0} &"mkt"{\0,p,\0} :=> &"mkt"{\0,a,\0} | C34: 0.0304228 | D34: 0.0638252 | E34: 0.0638252 | G34: of:=IF([.C34]=1;"";[.C34]) -> 0.0304228 | H34: of:=IF([.D34]=1;"";[.D34]) -> 0.0638252 | I34: of:=IF([.E34]=1;"";[.E34]) -> 0.0638252
A35: 34 | B35: strcpy: &"glnxv"{\0} &"cuip"{\0,\0} :=> &"cuip"{\0,\0} | C35: 0.0230004 | D35: 0.0451525 | E35: 0.0451525 | G35: of:=IF([.C35]=1;"";[.C35]) -> 0.0230004 | H35: of:=IF([.D35]=1;"";[.D35]) -> 0.0451525 | I35: of:=IF([.E35]=1;"";[.E35]) -> 0.0451525
A36: 35 | B36: strcpy: &"pfpfa"{\0} &"jeoky"{\0} :=> &"jeoky"{\0} | C36: 0.0211652 | D36: 0.027378 | E36: 0.027378 | G36: of:=IF([.C36]=1;"";[.C36]) -> 0.0211652 | H36: of:=IF([.D36]=1;"";[.D36]) -> 0.027378 | I36: of:=IF([.E36]=1;"";[.E36]) -> 0.027378
A37: 1 | B37: strncpy: &""{\0,\x01,\x01,\x01,\x01,\x01} &""{\0,p,g,q,q,\0} 5 :=> &""{\0,\0,\0,\0,\0,\0} | C37: 1 | D37: 1 | E37: 1 | G37: of:=IF([.C37]=1;"";[.C37]) ->  | H37: of:=IF([.D37]=1;"";[.D37]) ->  | I37: of:=IF([.E37]=1;"";[.E37]) ->  | K37: of:=AVERAGE([.G37:.G72]) -> 0.0882144458333333 | L37: of:=AVERAGE([.H37:.H72]) -> 0.0878104125 | M37: of:=AVERAGE([.I37:.I72]) -> 0.0878104125 | O37: of:=AVERAGE([.K37:.M37]) -> 0.0879450902777778
A38: 2 | B38: strncpy: &""{\0,\x01,\x01,\x01,\x01,\x01} &"b"{\0,p,h,v,\0} 5 :=> &"b"{\0,\0,\0,\0,\0} | C38: 1 | D38: 1 | E38: 1 | G38: of:=IF([.C38]=1;"";[.C38]) ->  | H38: of:=IF([.D38]=1;"";[.D38]) ->  | I38: of:=IF([.E38]=1;"";[.E38]) -> 
A39: 3 | B39: strncpy: &""{\0,\x01,\x01,\x01,\x01,\x01} &"hy"{\0,p,u,\0} 5 :=> &"hy"{\0,\0,\0,\0} | C39: 1 | D39: 0.205862 | E39: 0.205862 | G39: of:=IF([.C39]=1;"";[.C39]) ->  | H39: of:=IF([.D39]=1;"";[.D39]) -> 0.205862 | I39: of:=IF([.E39]=1;"";[.E39]) -> 0.205862
A40: 4 | B40: strncpy: &""{\0,\x01,\x01,\x01,\x01,\x01} &"gey"{\0,p,\0} 5 :=> &"gey"{\0,\0,\0} | C40: 1 | D40: 0.0868069 | E40: 0.0868069 | G40: of:=IF([.C40]=1;"";[.C40]) ->  | H40: of:=IF([.D40]=1;"";[.D40]) -> 0.0868069 | I40: of:=IF([.E40]=1;"";[.E40]) -> 0.0868069
A41: 5 | B41: strncpy: &""{\0,\x01,\x01,\x01,\x01,\x01} &"hntt"{\0,\0} 5 :=> &"hntt"{\0,\0} | C41: 1 | D41: 0.0461611 | E41: 0.0461611 | G41: of:=IF([.C41]=1;"";[.C41]) ->  | H41: of:=IF([.D41]=1;"";[.D41]) -> 0.0461611 | I41: of:=IF([.E41]=1;"";[.E41]) -> 0.0461611
A42: 6 | B42: strncpy: &""{\0,\x01,\x01,\x01,\x01,\x01} &"qiuuh"{\0} 5 :=> &"qiuuh"{\0} | C42: 1 | D42: 0.0219775 | E42: 0.0219775 | G42: of:=IF([.C42]=1;"";[.C42]) ->  | H42: of:=IF([.D42]=1;"";[.D42]) -> 0.0219775 | I42: of:=IF([.E42]=1;"";[.E42]) -> 0.0219775
A43: 7 | B43: strncpy: &"m"{\0,\x01,\x01,\x01,\x01} &""{\0,p,t,r,c,\0} 5 :=> &""{\0,\0,\0,\0,\0,\0} | C43: 1 | D43: 1 | E43: 1 | G43: of:=IF([.C43]=1;"";[.C43]) ->  | H43: of:=IF([.D43]=1;"";[.D43]) ->  | I43: of:=IF([.E43]=1;"";[.E43]) -> 
A44: 8 | B44: strncpy: &"k"{\0,\x01,\x01,\x01,\x01} &"s"{\0,p,e,n,\0} 5 :=> &"s"{\0,\0,\0,\0,\0} | C44: 1 | D44: 1 | E44: 1 | G44: of:=IF([.C44]=1;"";[.C44]) ->  | H44: of:=IF([.D44]=1;"";[.D44]) ->  | I44: of:=IF([.E44]=1;"";[.E44]) -> 
A45: 9 | B45: strncpy: &"f"{\0,\x01,\x01,\x01,\x01} &"xw"{\0,p,i,\0} 5 :=> &"xw"{\0,\0,\0,\0} | C45: 1 | D45: 0.184161 | E45: 0.184161 | G45: of:=IF([.C45]=1;"";[.C45]) ->  | H45: of:=IF([.D45]=1;"";[.D45]) -> 0.184161 | I45: of:=IF([.E45]=1;"";[.E45]) -> 0.184161
A46: 10 | B46: strncpy: &"y"{\0,\x01,\x01,\x01,\x01} &"qug"{\0,p,\0} 5 :=> &"qug"{\0,\0,\0} | C46: 1 | D46: 0.0844211 | E46: 0.0844211 | G46: of:=IF([.C46]=1;"";[.C46]) ->  | H46: of:=IF([.D46]=1;"";[.D46]) -> 0.0844211 | I46: of:=IF([.E46]=1;"";[.E46]) -> 0.0844211
A47: 11 | B47: strncpy: &"s"{\0,\x01,\x01,\x01,\x01} &"xpro"{\0,\0} 5 :=> &"xpro"{\0,\0} | C47: 1 | D47: 0.0469654 | E47: 0.0469654 | G47: of:=IF([.C47]=1;"";[.C47]) ->  | H47: of:=IF([.D47]=1;"";[.D47]) -> 0.0469654 | I47: of:=IF([.E47]=1;"";[.E47]) -> 0.0469654
A48: 12 | B48: strncpy: &"w"{\0,\x01,\x01,\x01,\x01} &"bjuea"{\0} 5 :=> &"bjuea"{\0} | C48: 1 | D48: 0.0283735 | E48: 0.0283735 | G48: of:=IF([.C48]=1;"";[.C48]) ->  | H48: of:=IF([.D48]=1;"";[.D48]) -> 0.0283735 | I48: of:=IF([.E48]=1;"";[.E48]) -> 0.0283735
A49: 13 | B49: strncpy: &"mb"{\0,\x01,\x01,\x01} &""{\0,p,b,i,a,\0} 5 :=> &""{\0,\0,\0,\0,\0,\0} | C49: 0.211853 | D49: 1 | E49: 1 | G49: of:=IF([.C49]=1;"";[.C49]) -> 0.211853 | H49: of:=IF([.D49]=1;"";[.D49]) ->  | I49: of:=IF([.E49]=1;"";[.E49]) -> 
A50: 14 | B50: strncpy: &"to"{\0,\x01,\x01,\x01} &"c"{\0,p,p,o,\0} 5 :=> &"c"{\0,\0,\0,\0,\0} | C50: 0.223271 | D50: 1 | E50: 1 | G50: of:=IF([.C50]=1;"";[.C50]) -> 0.223271 | H50: of:=IF([.D50]=1;"";[.D50]) ->  | I50: of:=IF([.E50]=1;"";[.E50]) -> 
A51: 15 | B51: strncpy: &"mv"{\0,\x01,\x01,\x01} &"ub"{\0,p,p,\0} 5 :=> &"ub"{\0,\0,\0,\0} | C51: 0.169938 | D51: 0.212346 | E51: 0.212346 | G51: of:=IF([.C51]=1;"";[.C51]) -> 0.169938 | H51: of:=IF([.D51]=1;"";[.D51]) -> 0.212346 | I51: of:=IF([.E51]=1;"";[.E51]) -> 0.212346
A52: 16 | B52: strncpy: &"ws"{\0,\x01,\x01,\x01} &"ndw"{\0,p,\0} 5 :=> &"ndw"{\0,\0,\0} | C52: 0.2083 | D52: 0.0837287 | E52: 0.0837287 | G52: of:=IF([.C52]=1;"";[.C52]) -> 0.2083 | H52: of:=IF([.D52]=1;"";[.D52]) -> 0.0837287 | I52: of:=IF([.E52]=1;"";[.E52]) -> 0.0837287
A53: 17 | B53: strncpy: &"bj"{\0,\x01,\x01,\x01} &"sewt"{\0,\0} 5 :=> &"sewt"{\0,\0} | C53: 0.197854 | D53: 0.0445233 | E53: 0.0445233 | G53: of:=IF([.C53]=1;"";[.C53]) -> 0.197854 | H53: of:=IF([.D53]=1;"";[.D53]) -> 0.0445233 | I53: of:=IF([.E53]=1;"";[.E53]) -> 0.0445233
A54: 18 | B54: strncpy: &"ai"{\0,\x01,\x01,\x01} &"ptlmo"{\0} 5 :=> &"ptlmo"{\0} | C54: 0.219808 | D54: 0.0287502 | E54: 0.0287502 | G54: of:=IF([.C54]=1;"";[.C54]) -> 0.219808 | H54: of:=IF([.D54]=1;"";[.D54]) -> 0.0287502 | I54: of:=IF([.E54]=1;"";[.E54]) -> 0.0287502
A55: 19 | B55: strncpy: &"lay"{\0,\x01,\x01} &""{\0,p,l,k,l,\0} 5 :=> &""{\0,\0,\0,\0,\0,\0} | C55: 0.0881292 | D55: 1 | E55: 1 | G55: of:=IF([.C55]=1;"";[.C55]) -> 0.0881292 | H55: of:=IF([.D55]=1;"";[.D55]) ->  | I55: of:=IF([.E55]=1;"";[.E55]) -> 
A56: 20 | B56: strncpy: &"gfs"{\0,\x01,\x01} &"k"{\0,p,t,s,\0} 5 :=> &"k"{\0,\0,\0,\0,\0} | C56: 0.0709117 | D56: 1 | E56: 1 | G56: of:=IF([.C56]=1;"";[.C56]) -> 0.0709117 | H56: of:=IF([.D56]=1;"";[.D56]) ->  | I56: of:=IF([.E56]=1;"";[.E56]) -> 
A57: 21 | B57: strncpy: &"rpa"{\0,\x01,\x01} &"aa"{\0,p,v,\0} 5 :=> &"aa"{\0,\0,\0,\0} | C57: 0.0844504 | D57: 0.193065 | E57: 0.193065 | G57: of:=IF([.C57]=1;"";[.C57]) -> 0.0844504 | H57: of:=IF([.D57]=1;"";[.D57]) -> 0.193065 | I57: of:=IF([.E57]=1;"";[.E57]) -> 0.193065
A58: 22 | B58: strncpy: &"mtt"{\0,\x01,\x01} &"vgn"{\0,p,\0} 5 :=> &"vgn"{\0,\0,\0} | C58: 0.0749143 | D58: 0.0698772 | E58: 0.0698772 | G58: of:=IF([.C58]=1;"";[.C58]) -> 0.0749143 | H58: of:=IF([.D58]=1;"";[.D58]) -> 0.0698772 | I58: of:=IF([.E58]=1;"";[.E58]) -> 0.0698772
A59: 23 | B59: strncpy: &"ksm"{\0,\x01,\x01} &"ylbu"{\0,\0} 5 :=> &"ylbu"{\0,\0} | C59: 0.0822249 | D59: 0.0424855 | E59: 0.0424855 | G59: of:=IF([.C59]=1;"";[.C59]) -> 0.0822249 | H59: of:=IF([.D59]=1;"";[.D59]) -> 0.0424855 | I59: of:=IF([.E59]=1;"";[.E59]) -> 0.0424855
A60: 24 | B60: strncpy: &"ftm"{\0,\x01,\x01} &"ptike"{\0} 5 :=> &"ptike"{\0} | C60: 0.0822426 | D60: 0.0298951 | E60: 0.0298951 | G60: of:=IF([.C60]=1;"";[.C60]) -> 0.0822426 | H60: of:=IF([.D60]=1;"";[.D60]) -> 0.0298951 | I60: of:=IF([.E60]=1;"";[.E60]) -> 0.0298951
A61: 25 | B61: strncpy: &"vana"{\0,\x01} &""{\0,p,e,m,b,\0} 5 :=> &""{\0,\0,\0,\0,\0,\0} | C61: 0.0478032 | D61: 1 | E61: 1 | G61: of:=IF([.C61]=1;"";[.C61]) -> 0.0478032 | H61: of:=IF([.D61]=1;"";[.D61]) ->  | I61: of:=IF([.E61]=1;"";[.E61]) -> 
A62: 26 | B62: strncpy: &"srtb"{\0,\x01} &"e"{\0,p,b,k,\0} 5 :=> &"e"{\0,\0,\0,\0,\0} | C62: 0.0426083 | D62: 1 | E62: 1 | G62: of:=IF([.C62]=1;"";[.C62]) -> 0.0426083 | H62: of:=IF([.D62]=1;"";[.D62]) ->  | I62: of:=IF([.E62]=1;"";[.E62]) -> 
A63: 27 | B63: strncpy: &"eclw"{\0,\x01} &"lc"{\0,p,m,\0} 5 :=> &"lc"{\0,\0,\0,\0} | C63: 0.0445299 | D63: 0.199652 | E63: 0.199652 | G63: of:=IF([.C63]=1;"";[.C63]) -> 0.0445299 | H63: of:=IF([.D63]=1;"";[.D63]) -> 0.199652 | I63: of:=IF([.E63]=1;"";[.E63]) -> 0.199652
A64: 28 | B64: strncpy: &"idqb"{\0,\x01} &"mge"{\0,p,\0} 5 :=> &"mge"{\0,\0,\0} | C64: 0.0321383 | D64: 0.0730166 | E64: 0.0730166 | G64: of:=IF([.C64]=1;"";[.C64]) -> 0.0321383 | H64: of:=IF([.D64]=1;"";[.D64]) -> 0.0730166 | I64: of:=IF([.E64]=1;"";[.E64]) -> 0.0730166
A65: 29 | B65: strncpy: &"gktm"{\0,\x01} &"bsva"{\0,\0} 5 :=> &"bsva"{\0,\0} | C65: 0.035879 | D65: 0.0409759 | E65: 0.0409759 | G65: of:=IF([.C65]=1;"";[.C65]) -> 0.035879 | H65: of:=IF([.D65]=1;"";[.D65]) -> 0.0409759 | I65: of:=IF([.E65]=1;"";[.E65]) -> 0.0409759
A66: 30 | B66: strncpy: &"pskp"{\0,\x01} &"qqayc"{\0} 5 :=> &"qqayc"{\0} | C66: 0.040439 | D66: 0.017301 | E66: 0.017301 | G66: of:=IF([.C66]=1;"";[.C66]) -> 0.040439 | H66: of:=IF([.D66]=1;"";[.D66]) -> 0.017301 | I66: of:=IF([.E66]=1;"";[.E66]) -> 0.017301
A67: 31 | B67: strncpy: &"thyfy"{\0} &""{\0,p,r,t,l,\0} 5 :=> &""{\0,\0,\0,\0,\0,\0} | C67: 0.0263579 | D67: 1 | E67: 1 | G67: of:=IF([.C67]=1;"";[.C67]) -> 0.0263579 | H67: of:=IF([.D67]=1;"";[.D67]) ->  | I67: of:=IF([.E67]=1;"";[.E67]) -> 
A68: 32 | B68: strncpy: &"mlahm"{\0} &"t"{\0,p,c,t,\0} 5 :=> &"t"{\0,\0,\0,\0,\0} | C68: 0.0263289 | D68: 1 | E68: 1 | G68: of:=IF([.C68]=1;"";[.C68]) -> 0.0263289 | H68: of:=IF([.D68]=1;"";[.D68]) ->  | I68: of:=IF([.E68]=1;"";[.E68]) -> 
A69: 33 | B69: strncpy: &"ngmve"{\0} &"ts"{\0,p,s,\0} 5 :=> &"ts"{\0,\0,\0,\0} | C69: 0.0256264 | D69: 0.218916 | E69: 0.218916 | G69: of:=IF([.C69]=1;"";[.C69]) -> 0.0256264 | H69: of:=IF([.D69]=1;"";[.D69]) -> 0.218916 | I69: of:=IF([.E69]=1;"";[.E69]) -> 0.218916
A70: 34 | B70: strncpy: &"znall"{\0} &"aad"{\0,p,\0} 5 :=> &"aad"{\0,\0,\0} | C70: 0.0274391 | D70: 0.0794456 | E70: 0.0794456 | G70: of:=IF([.C70]=1;"";[.C70]) -> 0.0274391 | H70: of:=IF([.D70]=1;"";[.D70]) -> 0.0794456 | I70: of:=IF([.E70]=1;"";[.E70]) -> 0.0794456
A71: 35 | B71: strncpy: &"ylqun"{\0} &"johy"{\0,\0} 5 :=> &"johy"{\0,\0} | C71: 0.0244032 | D71: 0.0426305 | E71: 0.0426305 | G71: of:=IF([.C71]=1;"";[.C71]) -> 0.0244032 | H71: of:=IF([.D71]=1;"";[.D71]) -> 0.0426305 | I71: of:=IF([.E71]=1;"";[.E71]) -> 0.0426305
A72: 36 | B72: strncpy: &"ggecr"{\0} &"iwaak"{\0} 5 :=> &"iwaak"{\0} | C72: 0.0296964 | D72: 0.0261128 | E72: 0.0261128 | G72: of:=IF([.C72]=1;"";[.C72]) -> 0.0296964 | H72: of:=IF([.D72]=1;"";[.D72]) -> 0.0261128 | I72: of:=IF([.E72]=1;"";[.E72]) -> 0.0261128

Sheet: strcat
A1: # | B1: Test Case | C1: N1 | D1: N2 | E1: N3
A2: 1 | B2: strcat: &""{\0,\x01,\x01,\x01,\x01,\x01,\x01,\x01,\x01,\x01} &"q"{\0,p,l,\0} :=> &"q"{\0,p,o,h,e,t,l,f,\0} | C2: 1 | D2: 1 | E2: 1 | G2: of:=IF([.C2]=1;"";[.C2]) ->  | H2: of:=IF([.D2]=1;"";[.D2]) ->  | I2: of:=IF([.E2]=1;"";[.E2]) ->  | K2: of:=AVERAGE([.G2:.G41]) -> 0.0621583367741935 | L2: of:=AVERAGE([.H2:.H41]) -> 0.108028284090909 | M2: of:=AVERAGE([.I2:.I41]) -> 0.0392630975675676 | O2: of:=AVERAGE([.K2:.M2]) -> 0.0698165728108901
A3: 2 | B3: strcat: &""{\0,\x01,\x01,\x01,\x01,\x01,\x01,\x01,\x01,\x01} &"wl"{\0,p,\0} :=> &"wl"{\0,p,o,i,s,e,d,\0} | C3: 1 | D3: 0.202034 | E3: 0.202034 | G3: of:=IF([.C3]=1;"";[.C3]) ->  | H3: of:=IF([.D3]=1;"";[.D3]) -> 0.202034 | I3: of:=IF([.E3]=1;"";[.E3]) -> 0.202034
A4: 3 | B4: strcat: &""{\0,\x01,\x01,\x01,\x01,\x01,\x01,\x01,\x01,\x01} &"kng"{\0,\0} :=> &"kng"{\0,p,r,p,w,m,\0} | C4: 1 | D4: 0.0855581 | E4: 0.0855581 | G4: of:=IF([.C4]=1;"";[.C4]) ->  | H4: of:=IF([.D4]=1;"";[.D4]) -> 0.0855581 | I4: of:=IF([.E4]=1;"";[.E4]) -> 0.0855581
A5: 4 | B5: strcat: &""{\0,\x01,\x01,\x01,\x01,\x01,\x01,\x01,\x01,\x01} &"xbgu"{\0} :=> &"xbgu"{\0,p,r,b,e,\0} | C5: 1 | D5: 0.031363 | E5: 0.031363 | H5: of:=IF([.D5]=1;"";[.D5]) -> 0.031363 | I5: of:=IF([.E5]=1;"";[.E5]) -> 0.031363
A6: 5 | B6: strcat: &"d"{\0,\x01,\x01,\x01,\x01,\x01,\x01,\x01,\x01} &""{\0,p,a,m,\0} :=> &"d"{\0,p,p,d,u,r,s,s,\0} | C6: 1 | D6: 1 | E6: 1 | G6: of:=IF([.C6]=1;"";[.C6]) ->  | H6: of:=IF([.D6]=1;"";[.D6]) ->  | I6: of:=IF([.E6]=1;"";[.E6]) -> 
A7: 6 | B7: strcat: &"d"{\0,\x01,\x01,\x01,\x01,\x01,\x01,\x01,\x01} &"g"{\0,p,k,\0} :=> &"dg"{\0,p,c,a,f,u,f,\0} | C7: 1 | D7: 1 | E7: 0.207409 | G7: of:=IF([.C7]=1;"";[.C7]) ->  | H7: of:=IF([.D7]=1;"";[.D7]) ->  | I7: of:=IF([.E7]=1;"";[.E7]) -> 0.207409
A8: 7 | B8: strcat: &"p"{\0,\x01,\x01,\x01,\x01,\x01,\x01,\x01,\x01} &"bl"{\0,p,\0} :=> &"pbl"{\0,p,y,v,a,y,\0} | C8: 1 | D8: 0.215706 | E8: 0.0773874 | G8: of:=IF([.C8]=1;"";[.C8]) ->  | H8: of:=IF([.D8]=1;"";[.D8]) -> 0.215706 | I8: of:=IF([.E8]=1;"";[.E8]) -> 0.0773874
A9: 8 | B9: strcat: &"f"{\0,\x01,\x01,\x01,\x01,\x01,\x01,\x01,\x01} &"jaa"{\0,\0} :=> &"fjaa"{\0,p,d,p,f,\0} | C9: 1 | D9: 0.0740629 | E9: 0.0347949 | G9: of:=IF([.C9]=1;"";[.C9]) ->  | H9: of:=IF([.D9]=1;"";[.D9]) -> 0.0740629 | I9: of:=IF([.E9]=1;"";[.E9]) -> 0.0347949
A10: 9 | B10: strcat: &"c"{\0,\x01,\x01,\x01,\x01,\x01,\x01,\x01,\x01} &"vasv"{\0} :=> &"cvasv"{\0,p,s,f,\0} | C10: 1 | D10: 0.0426664 | E10: 0.0216293 | G10: of:=IF([.C10]=1;"";[.C10]) ->  | H10: of:=IF([.D10]=1;"";[.D10]) -> 0.0426664 | I10: of:=IF([.E10]=1;"";[.E10]) -> 0.0216293
A11: 10 | B11: strcat: &"ms"{\0,\x01,\x01,\x01,\x01,\x01,\x01,\x01} &""{\0,p,i,j,\0} :=> &"ms"{\0,p,s,w,a,y,d,\0} | C11: 0.211356 | D11: 1 | E11: 0.211356 | G11: of:=IF([.C11]=1;"";[.C11]) -> 0.211356 | H11: of:=IF([.D11]=1;"";[.D11]) ->  | I11: of:=IF([.E11]=1;"";[.E11]) -> 0.211356
A12: 11 | B12: strcat: &"he"{\0,\x01,\x01,\x01,\x01,\x01,\x01,\x01} &"m"{\0,p,a,\0} :=> &"hem"{\0,p,o,i,t,p,\0} | C12: 0.226983 | D12: 1 | E12: 0.0902779 | G12: of:=IF([.C12]=1;"";[.C12]) -> 0.226983 | H12: of:=IF([.D12]=1;"";[.D12]) ->  | I12: of:=IF([.E12]=1;"";[.E12]) -> 0.0902779
A13: 12 | B13: strcat: &"lm"{\0,\x01,\x01,\x01,\x01,\x01,\x01,\x01} &"td"{\0,p,\0} :=> &"lmtd"{\0,p,i,u,r,\0} | C13: 0.206613 | D13: 0.192671 | E13: 0.037455 | G13: of:=IF([.C13]=1;"";[.C13]) -> 0.206613 | H13: of:=IF([.D13]=1;"";[.D13]) -> 0.192671 | I13: of:=IF([.E13]=1;"";[.E13]) -> 0.037455
A14: 13 | B14: strcat: &"iq"{\0,\x01,\x01,\x01,\x01,\x01,\x01,\x01} &"nqe"{\0,\0} :=> &"iqnqe"{\0,p,l,w,\0} | C14: 0.197549 | D14: 0.0447761 | E14: 0 | G14: of:=IF([.C14]=1;"";[.C14]) -> 0.197549 | H14: of:=IF([.D14]=1;"";[.D14]) -> 0.0447761 | I14: of:=IF([.E14]=1;"";[.E14]) -> 0
A15: 14 | B15: strcat: &"th"{\0,\x01,\x01,\x01,\x01,\x01,\x01,\x01} &"advc"{\0} :=> &"thadvc"{\0,p,m,\0} | C15: 0.227384 | D15: 0.0407029 | E15: 0.0203987 | G15: of:=IF([.C15]=1;"";[.C15]) -> 0.227384 | H15: of:=IF([.D15]=1;"";[.D15]) -> 0.0407029 | I15: of:=IF([.E15]=1;"";[.E15]) -> 0.0203987
A16: 15 | B16: strcat: &"bvg"{\0,\x01,\x01,\x01,\x01,\x01,\x01} &""{\0,p,a,o,\0} :=> &"bvg"{\0,p,b,w,e,r,\0} | C16: 0.0646498 | D16: 1 | E16: 0.0646498 | G16: of:=IF([.C16]=1;"";[.C16]) -> 0.0646498 | H16: of:=IF([.D16]=1;"";[.D16]) ->  | I16: of:=IF([.E16]=1;"";[.E16]) -> 0.0646498
A17: 16 | B17: strcat: &"ywa"{\0,\x01,\x01,\x01,\x01,\x01,\x01} &"z"{\0,p,g,\0} :=> &"ywaz"{\0,p,u,b,s,\0} | C17: 0.0808183 | D17: 1 | E17: 0.0426171 | G17: of:=IF([.C17]=1;"";[.C17]) -> 0.0808183 | H17: of:=IF([.D17]=1;"";[.D17]) ->  | I17: of:=IF([.E17]=1;"";[.E17]) -> 0.0426171
A18: 17 | B18: strcat: &"wlv"{\0,\x01,\x01,\x01,\x01,\x01,\x01} &"wy"{\0,p,\0} :=> &"wlvwy"{\0,p,r,t,\0} | C18: 0.0786254 | D18: 0.199593 | E18: 0 | G18: of:=IF([.C18]=1;"";[.C18]) -> 0.0786254 | H18: of:=IF([.D18]=1;"";[.D18]) -> 0.199593 | I18: of:=IF([.E18]=1;"";[.E18]) -> 0
A19: 18 | B19: strcat: &"jtc"{\0,\x01,\x01,\x01,\x01,\x01,\x01} &"tbo"{\0,\0} :=> &"jtctbo"{\0,p,y,\0} | C19: 0.0616429 | D19: 0.0807619 | E19: 0.016997 | G19: of:=IF([.C19]=1;"";[.C19]) -> 0.0616429 | H19: of:=IF([.D19]=1;"";[.D19]) -> 0.0807619 | I19: of:=IF([.E19]=1;"";[.E19]) -> 0.016997
A20: 19 | B20: strcat: &"rir"{\0,\x01,\x01,\x01,\x01,\x01,\x01} &"lhma"{\0} :=> &"rirlhma"{\0,p,\0} | C20: 0.0882615 | D20: 0.0414282 | E20: 0.0156107 | G20: of:=IF([.C20]=1;"";[.C20]) -> 0.0882615 | H20: of:=IF([.D20]=1;"";[.D20]) -> 0.0414282 | I20: of:=IF([.E20]=1;"";[.E20]) -> 0.0156107
A21: 20 | B21: strcat: &"pbsr"{\0,\x01,\x01,\x01,\x01,\x01} &""{\0,p,c,y,\0} :=> &"pbsr"{\0,p,e,m,a,\0} | C21: 0.0399105 | D21: 1 | E21: 0.0399105 | G21: of:=IF([.C21]=1;"";[.C21]) -> 0.0399105 | H21: of:=IF([.D21]=1;"";[.D21]) ->  | I21: of:=IF([.E21]=1;"";[.E21]) -> 0.0399105
A22: 21 | B22: strcat: &"ictv"{\0,\x01,\x01,\x01,\x01,\x01} &"u"{\0,p,m,\0} :=> &"ictvu"{\0,p,m,p,\0} | C22: 0.043426 | D22: 1 | E22: 0.0262267 | G22: of:=IF([.C22]=1;"";[.C22]) -> 0.043426 | H22: of:=IF([.D22]=1;"";[.D22]) ->  | I22: of:=IF([.E22]=1;"";[.E22]) -> 0.0262267
A23: 22 | B23: strcat: &"kmth"{\0,\x01,\x01,\x01,\x01,\x01} &"hc"{\0,p,\0} :=> &"kmthhc"{\0,p,t,\0} | C23: 0.0391723 | D23: 0.185944 | E23: 0.016327 | G23: of:=IF([.C23]=1;"";[.C23]) -> 0.0391723 | H23: of:=IF([.D23]=1;"";[.D23]) -> 0.185944 | I23: of:=IF([.E23]=1;"";[.E23]) -> 0.016327
A24: 23 | B24: strcat: &"ylyh"{\0,\x01,\x01,\x01,\x01,\x01} &"uoa"{\0,\0} :=> &"ylyhuoa"{\0,p,\0} | C24: 0.0408221 | D24: 0.079493 | E24: 0.0144928 | G24: of:=IF([.C24]=1;"";[.C24]) -> 0.0408221 | H24: of:=IF([.D24]=1;"";[.D24]) -> 0.079493 | I24: of:=IF([.E24]=1;"";[.E24]) -> 0.0144928
A25: 24 | B25: strcat: &"cquf"{\0,\x01,\x01,\x01,\x01,\x01} &"mkut"{\0} :=> &"cqufmkut"{\0,\0} | C25: 0.0417026 | D25: 0.037209 | E25: 0.0105121 | G25: of:=IF([.C25]=1;"";[.C25]) -> 0.0417026 | H25: of:=IF([.D25]=1;"";[.D25]) -> 0.037209 | I25: of:=IF([.E25]=1;"";[.E25]) -> 0.0105121
A26: 25 | B26: strcat: &"mlvla"{\0,\x01,\x01,\x01,\x01} &""{\0,p,l,j,\0} :=> &"mlvla"{\0,p,n,g,\0} | C26: 0.024685 | D26: 1 | E26: 0.024685 | G26: of:=IF([.C26]=1;"";[.C26]) -> 0.024685 | H26: of:=IF([.D26]=1;"";[.D26]) ->  | I26: of:=IF([.E26]=1;"";[.E26]) -> 0.024685
A27: 26 | B27: strcat: &"qsuaw"{\0,\x01,\x01,\x01,\x01} &"h"{\0,p,s,\0} :=> &"qsuawh"{\0,p,d,\0} | C27: 0.0210808 | D27: 1 | E27: 0.0159457 | G27: of:=IF([.C27]=1;"";[.C27]) -> 0.0210808 | H27: of:=IF([.D27]=1;"";[.D27]) ->  | I27: of:=IF([.E27]=1;"";[.E27]) -> 0.0159457
A28: 27 | B28: strcat: &"qtrqq"{\0,\x01,\x01,\x01,\x01} &"fy"{\0,p,\0} :=> &"qtrqqfy"{\0,p,\0} | C28: 0.0153754 | D28: 0.198096 | E28: 0.0070054 | G28: of:=IF([.C28]=1;"";[.C28]) -> 0.0153754 | H28: of:=IF([.D28]=1;"";[.D28]) -> 0.198096 | I28: of:=IF([.E28]=1;"";[.E28]) -> 0.0070054
A29: 28 | B29: strcat: &"xhgdm"{\0,\x01,\x01,\x01,\x01} &"lue"{\0,\0} :=> &"xhgdmlue"{\0,\0} | C29: 0.022881 | D29: 0.0845727 | E29: 0.0106787 | G29: of:=IF([.C29]=1;"";[.C29]) -> 0.022881 | H29: of:=IF([.D29]=1;"";[.D29]) -> 0.0845727 | I29: of:=IF([.E29]=1;"";[.E29]) -> 0.0106787
A30: 29 | B30: strcat: &"cayem"{\0,\x01,\x01,\x01,\x01} &"hour"{\0} :=> &"cayemhour"{\0} | C30: 0.0306771 | D30: 0.0485694 | E30: 0.0112247 | G30: of:=IF([.C30]=1;"";[.C30]) -> 0.0306771 | H30: of:=IF([.D30]=1;"";[.D30]) -> 0.0485694 | I30: of:=IF([.E30]=1;"";[.E30]) -> 0.0112247
A31: 30 | B31: strcat: &"vaqutk"{\0,\x01,\x01,\x01} &""{\0,p,t,t,\0} :=> &"vaqutk"{\0,p,p,\0} | C31: 0.0189811 | D31: 1 | E31: 0.0189811 | G31: of:=IF([.C31]=1;"";[.C31]) -> 0.0189811 | H31: of:=IF([.D31]=1;"";[.D31]) ->  | I31: of:=IF([.E31]=1;"";[.E31]) -> 0.0189811
A32: 31 | B32: strcat: &"euqsrm"{\0,\x01,\x01,\x01} &"o"{\0,p,a,\0} :=> &"euqsrmo"{\0,p,\0} | C32: 0.013852 | D32: 1 | E32: 0.0113241 | G32: of:=IF([.C32]=1;"";[.C32]) -> 0.013852 | H32: of:=IF([.D32]=1;"";[.D32]) ->  | I32: of:=IF([.E32]=1;"";[.E32]) -> 0.0113241
A33: 32 | B33: strcat: &"giqiva"{\0,\x01,\x01,\x01} &"mg"{\0,p,\0} :=> &"giqivamg"{\0,\0} | C33: 0.0190924 | D33: 0.17338 | E33: 0.0113584 | G33: of:=IF([.C33]=1;"";[.C33]) -> 0.0190924 | H33: of:=IF([.D33]=1;"";[.D33]) -> 0.17338 | I33: of:=IF([.E33]=1;"";[.E33]) -> 0.0113584
A34: 33 | B34: strcat: &"ibbtci"{\0,\x01,\x01,\x01} &"leg"{\0,\0} :=> &"ibbtcileg"{\0} | C34: 0.0195847 | D34: 0.0859045 | E34: 0.0108213 | G34: of:=IF([.C34]=1;"";[.C34]) -> 0.0195847 | H34: of:=IF([.D34]=1;"";[.D34]) -> 0.0859045 | I34: of:=IF([.E34]=1;"";[.E34]) -> 0.0108213
A35: 34 | B35: strcat: &"puueow"{\0,\x01,\x01,\x01} &&10 :=> &"puueowcctr"{} | C35: 0.0193804 | D35: 0.00885915 | G35: of:=IF([.C35]=1;"";[.C35]) -> 0.0193804 | H35: of:=IF([.D35]=1;"";[.D35]) -> 0.00885915 | I35: of:=IF([.E35]=1;"";[.E35]) ->  
A36: 35 | B36: strcat: &"fcedgoi"{\0,\x01,\x01} &""{\0,p,c,h,\0} :=> &"fcedgoi"{\0,p,\0} | C36: 0.0151471 | D36: 1 | E36: 0.0151471 | G36: of:=IF([.C36]=1;"";[.C36]) -> 0.0151471 | H36: of:=IF([.D36]=1;"";[.D36]) ->  | I36: of:=IF([.E36]=1;"";[.E36]) -> 0.0151471
A37: 36 | B37: strcat: &"ehuihwp"{\0,\x01,\x01} &"q"{\0,p,r,\0} :=> &"ehuihwpq"{\0,\0} | C37: 0.013342 | D37: 1 | E37: 0.00937522 | G37: of:=IF([.C37]=1;"";[.C37]) -> 0.013342 | H37: of:=IF([.D37]=1;"";[.D37]) ->  | I37: of:=IF([.E37]=1;"";[.E37]) -> 0.00937522
A38: 37 | B38: strcat: &"sionajr"{\0,\x01,\x01} &"to"{\0,p,\0} :=> &"sionajrto"{\0} | C38: 0.0134574 | D38: 0.223271 | E38: 0.00982796 | G38: of:=IF([.C38]=1;"";[.C38]) -> 0.0134574 | H38: of:=IF([.D38]=1;"";[.D38]) -> 0.223271 | I38: of:=IF([.E38]=1;"";[.E38]) -> 0.00982796
A39: 38 | B39: strcat: &"vdlddaka"{\0,\x01} &""{\0,p,y,o,\0} :=> &"vdlddaka"{\0,\0} | C39: 0.011711 | D39: 1 | E39: 0.011711 | G39: of:=IF([.C39]=1;"";[.C39]) -> 0.011711 | H39: of:=IF([.D39]=1;"";[.D39]) ->  | I39: of:=IF([.E39]=1;"";[.E39]) -> 0.011711
A40: 39 | B40: strcat: &"vyhsaqbt"{\0,\x01} &"o"{\0,p,s,\0} :=> &"vyhsaqbto"{\0} | C40: 0.00956325 | D40: 1 | E40: 0.00846054 | G40: of:=IF([.C40]=1;"";[.C40]) -> 0.00956325 | H40: of:=IF([.D40]=1;"";[.D40]) ->  | I40: of:=IF([.E40]=1;"";[.E40]) -> 0.00846054
A41: 40 | B41: strcat: &"bgggoukdy"{\0} &""{\0,p,y,d,\0} :=> &"bgggoukdy"{\0} | C41: 0.00918139 | D41: 1 | E41: 0.00918139 | G41: of:=IF([.C41]=1;"";[.C41]) -> 0.00918139 | H41: of:=IF([.D41]=1;"";[.D41]) ->  | I41: of:=IF([.E41]=1;"";[.E41]) -> 0.00918139
A42: 1 | B42: strncat: &""{\0,\x01,\x01,\x01,\x01,\x01,\x01,\x01,\x01,\x01} &""{\0,p,c,s,\0} 4 :=> &""{\0,p,h,h,i,a,a,h,e,\0} | C42: 1 | D42: 1 | E42: 1 | G42: of:=IF([.C42]=1;"";[.C42]) ->  | H42: of:=IF([.D42]=1;"";[.D42]) ->  | I42: of:=IF([.E42]=1;"";[.E42]) ->  | K42: of:=AVERAGE([.G42:.G82]) -> 0.0583850338709678 | L42: of:=AVERAGE([.H42:.H82]) -> 0.109102045454545 | M42: of:=AVERAGE([.I42:.I82]) -> 0.0374790716216216 | O42: of:=AVERAGE([.K42:.M42]) -> 0.0683220503157116
A43: 2 | B43: strncat: &""{\0,\x01,\x01,\x01,\x01,\x01,\x01,\x01,\x01,\x01} &"o"{\0,p,e,\0} 4 :=> &"o"{\0,p,c,m,m,i,t,b,\0} | C43: 1 | D43: 1 | E43: 1 | G43: of:=IF([.C43]=1;"";[.C43]) ->  | H43: of:=IF([.D43]=1;"";[.D43]) ->  | I43: of:=IF([.E43]=1;"";[.E43]) -> 
A44: 3 | B44: strncat: &""{\0,\x01,\x01,\x01,\x01,\x01,\x01,\x01,\x01,\x01} &"wg"{\0,p,\0} 4 :=> &"wg"{\0,p,u,a,g,j,i,\0} | C44: 1 | D44: 0.162567 | E44: 0.162567 | G44: of:=IF([.C44]=1;"";[.C44]) ->  | H44: of:=IF([.D44]=1;"";[.D44]) -> 0.162567 | I44: of:=IF([.E44]=1;"";[.E44]) -> 0.162567
A45: 4 | B45: strncat: &""{\0,\x01,\x01,\x01,\x01,\x01,\x01,\x01,\x01,\x01} &"gms"{\0,\0} 4 :=> &"gms"{\0,p,p,s,q,i,\0} | C45: 1 | D45: 0.0779486 | E45: 0.0779486 | G45: of:=IF([.C45]=1;"";[.C45]) ->  | H45: of:=IF([.D45]=1;"";[.D45]) -> 0.0779486 | I45: of:=IF([.E45]=1;"";[.E45]) -> 0.0779486
A46: 5 | B46: strncat: &""{\0,\x01,\x01,\x01,\x01,\x01,\x01,\x01,\x01,\x01} &"sclv"{\0} 4 :=> &"sclv"{\0,p,c,o,r,\0} | C46: 1 | D46: 0.0446045 | E46: 0.0446045 | G46: of:=IF([.C46]=1;"";[.C46]) ->  | H46: of:=IF([.D46]=1;"";[.D46]) -> 0.0446045 | I46: of:=IF([.E46]=1;"";[.E46]) -> 0.0446045
A47: 6 | B47: strncat: &"m"{\0,\x01,\x01,\x01,\x01,\x01,\x01,\x01,\x01} &""{\0,p,s,o,\0} 4 :=> &"m"{\0,p,p,h,u,a,i,d,\0} | C47: 1 | D47: 1 | E47: 1 | G47: of:=IF([.C47]=1;"";[.C47]) ->  | H47: of:=IF([.D47]=1;"";[.D47]) ->  | I47: of:=IF([.E47]=1;"";[.E47]) -> 
A48: 7 | B48: strncat: &"z"{\0,\x01,\x01,\x01,\x01,\x01,\x01,\x01,\x01} &"s"{\0,p,s,\0} 4 :=> &"zs"{\0,p,b,d,v,a,v,\0} | C48: 1 | D48: 1 | E48: 0.174983 | G48: of:=IF([.C48]=1;"";[.C48]) ->  | H48: of:=IF([.D48]=1;"";[.D48]) ->  | I48: of:=IF([.E48]=1;"";[.E48]) -> 0.174983
A49: 8 | B49: strncat: &"i"{\0,\x01,\x01,\x01,\x01,\x01,\x01,\x01,\x01} &"nv"{\0,p,\0} 4 :=> &"inv"{\0,p,p,i,e,a,\0} | C49: 1 | D49: 0.209845 | E49: 0.0874368 | G49: of:=IF([.C49]=1;"";[.C49]) ->  | H49: of:=IF([.D49]=1;"";[.D49]) -> 0.209845 | I49: of:=IF([.E49]=1;"";[.E49]) -> 0.0874368
A50: 9 | B50: strncat: &"o"{\0,\x01,\x01,\x01,\x01,\x01,\x01,\x01,\x01} &"nny"{\0,\0} 4 :=> &"onny"{\0,p,q,i,b,\0} | C50: 1 | D50: 0.0844211 | E50: 0.0471438 | G50: of:=IF([.C50]=1;"";[.C50]) ->  | H50: of:=IF([.D50]=1;"";[.D50]) -> 0.0844211 | I50: of:=IF([.E50]=1;"";[.E50]) -> 0.0471438
A51: 10 | B51: strncat: &"q"{\0,\x01,\x01,\x01,\x01,\x01,\x01,\x01,\x01} &"usji"{\0} 4 :=> &"qusji"{\0,p,r,l,\0} | C51: 1 | D51: 0.0367705 | E51: 0.0243475 | G51: of:=IF([.C51]=1;"";[.C51]) ->  | H51: of:=IF([.D51]=1;"";[.D51]) -> 0.0367705 | I51: of:=IF([.E51]=1;"";[.E51]) -> 0.0243475
A52: 11 | B52: strncat: &"qe"{\0,\x01,\x01,\x01,\x01,\x01,\x01,\x01} &""{\0,p,n,g,\0} 4 :=> &"qe"{\0,p,e,y,p,r,h,\0} | C52: 0.106758 | D52: 1 | E52: 0.106758 | G52: of:=IF([.C52]=1;"";[.C52]) -> 0.106758 | H52: of:=IF([.D52]=1;"";[.D52]) ->  | I52: of:=IF([.E52]=1;"";[.E52]) -> 0.106758
A53: 12 | B53: strncat: &"pd"{\0,\x01,\x01,\x01,\x01,\x01,\x01,\x01} &"y"{\0,p,r,\0} 4 :=> &"pdy"{\0,p,i,d,f,y,\0} | C53: 0.181858 | D53: 1 | E53: 0.0728723 | G53: of:=IF([.C53]=1;"";[.C53]) -> 0.181858 | H53: of:=IF([.D53]=1;"";[.D53]) ->  | I53: of:=IF([.E53]=1;"";[.E53]) -> 0.0728723
A54: 13 | B54: strncat: &"za"{\0,\x01,\x01,\x01,\x01,\x01,\x01,\x01} &"pr"{\0,p,\0} 4 :=> &"zapr"{\0,p,u,y,l,\0} | C54: 0.205157 | D54: 0.218916 | E54: 0.0453787 | G54: of:=IF([.C54]=1;"";[.C54]) -> 0.205157 | H54: of:=IF([.D54]=1;"";[.D54]) -> 0.218916 | I54: of:=IF([.E54]=1;"";[.E54]) -> 0.0453787
A55: 14 | B55: strncat: &"cl"{\0,\x01,\x01,\x01,\x01,\x01,\x01,\x01} &"lur"{\0,\0} 4 :=> &"cllur"{\0,p,e,m,\0} | C55: 0.213806 | D55: 0.0861723 | E55: 0.0303536 | G55: of:=IF([.C55]=1;"";[.C55]) -> 0.213806 | H55: of:=IF([.D55]=1;"";[.D55]) -> 0.0861723 | I55: of:=IF([.E55]=1;"";[.E55]) -> 0.0303536
A56: 15 | B56: strncat: &"ec"{\0,\x01,\x01,\x01,\x01,\x01,\x01,\x01} &"ymca"{\0} 4 :=> &"ecymca"{\0,p,t,\0} | C56: 0.219808 | D56: 0.040736 | E56: 0.0193851 | G56: of:=IF([.C56]=1;"";[.C56]) -> 0.219808 | H56: of:=IF([.D56]=1;"";[.D56]) -> 0.040736 | I56: of:=IF([.E56]=1;"";[.E56]) -> 0.0193851
A57: 16 | B57: strncat: &"lbo"{\0,\x01,\x01,\x01,\x01,\x01,\x01} &""{\0,p,e,v,\0} 4 :=> &"lbo"{\0,p,w,b,u,r,\0} | C57: 0.081085 | D57: 1 | E57: 0.081085 | G57: of:=IF([.C57]=1;"";[.C57]) -> 0.081085 | H57: of:=IF([.D57]=1;"";[.D57]) ->  | I57: of:=IF([.E57]=1;"";[.E57]) -> 0.081085
A58: 17 | B58: strncat: &"ped"{\0,\x01,\x01,\x01,\x01,\x01,\x01} &"o"{\0,p,o,\0} 4 :=> &"pedo"{\0,p,u,j,m,\0} | C58: 0.0896711 | D58: 1 | E58: 0.0481379 | G58: of:=IF([.C58]=1;"";[.C58]) -> 0.0896711 | H58: of:=IF([.D58]=1;"";[.D58]) ->  | I58: of:=IF([.E58]=1;"";[.E58]) -> 0.0481379
A59: 18 | B59: strncat: &"wbr"{\0,\x01,\x01,\x01,\x01,\x01,\x01} &"ms"{\0,p,\0} 4 :=> &"wbrms"{\0,p,h,a,\0} | C59: 0.0763144 | D59: 0.211356 | E59: 0.0271905 | G59: of:=IF([.C59]=1;"";[.C59]) -> 0.0763144 | H59: of:=IF([.D59]=1;"";[.D59]) -> 0.211356 | I59: of:=IF([.E59]=1;"";[.E59]) -> 0.0271905
A60: 19 | B60: strncat: &"uyk"{\0,\x01,\x01,\x01,\x01,\x01,\x01} &"nsi"{\0,\0} 4 :=> &"uyknsi"{\0,p,p,\0} | C60: 0.0716343 | D60: 0.088709 | E60: 0.0192831 | G60: of:=IF([.C60]=1;"";[.C60]) -> 0.0716343 | H60: of:=IF([.D60]=1;"";[.D60]) -> 0.088709 | I60: of:=IF([.E60]=1;"";[.E60]) -> 0.0192831
A61: 20 | B61: strncat: &"qfi"{\0,\x01,\x01,\x01,\x01,\x01,\x01} &"siqw"{\0} 4 :=> &"qfisiqw"{\0,p,\0} | C61: 0.0492925 | D61: 0.0278395 | E61: 0.00885318 | G61: of:=IF([.C61]=1;"";[.C61]) -> 0.0492925 | H61: of:=IF([.D61]=1;"";[.D61]) -> 0.0278395 | I61: of:=IF([.E61]=1;"";[.E61]) -> 0.00885318
A62: 21 | B62: strncat: &"kssa"{\0,\x01,\x01,\x01,\x01,\x01} &""{\0,p,l,a,\0} 4 :=> &"kssa"{\0,p,r,a,i,\0} | C62: 0.0466766 | D62: 1 | E62: 0.0466766 | G62: of:=IF([.C62]=1;"";[.C62]) -> 0.0466766 | H62: of:=IF([.D62]=1;"";[.D62]) ->  | I62: of:=IF([.E62]=1;"";[.E62]) -> 0.0466766
A63: 22 | B63: strncat: &"blpu"{\0,\x01,\x01,\x01,\x01,\x01} &"h"{\0,p,e,\0} 4 :=> &"blpuh"{\0,p,j,r,\0} | C63: 0.0446702 | D63: 1 | E63: 0.0265942 | G63: of:=IF([.C63]=1;"";[.C63]) -> 0.0446702 | H63: of:=IF([.D63]=1;"";[.D63]) ->  | I63: of:=IF([.E63]=1;"";[.E63]) -> 0.0265942
A64: 23 | B64: strncat: &"firw"{\0,\x01,\x01,\x01,\x01,\x01} &"hh"{\0,p,\0} 4 :=> &"firwhh"{\0,p,g,\0} | C64: 0.0450012 | D64: 0.18491 | E64: 0.0196173 | G64: of:=IF([.C64]=1;"";[.C64]) -> 0.0450012 | H64: of:=IF([.D64]=1;"";[.D64]) -> 0.18491 | I64: of:=IF([.E64]=1;"";[.E64]) -> 0.0196173
A65: 24 | B65: strncat: &"flea"{\0,\x01,\x01,\x01,\x01,\x01} &"orr"{\0,\0} 4 :=> &"fleaorr"{\0,p,\0} | C65: 0.0466834 | D65: 0.0878215 | E65: 0.0162566 | G65: of:=IF([.C65]=1;"";[.C65]) -> 0.0466834 | H65: of:=IF([.D65]=1;"";[.D65]) -> 0.0878215 | I65: of:=IF([.E65]=1;"";[.E65]) -> 0.0162566
A66: 25 | B66: strncat: &"uldp"{\0,\x01,\x01,\x01,\x01,\x01} &"pbws"{\0} 4 :=> &"uldppbws"{\0,\0} | C66: 0.0423313 | D66: 0.0379457 | E66: 0.0113632 | G66: of:=IF([.C66]=1;"";[.C66]) -> 0.0423313 | H66: of:=IF([.D66]=1;"";[.D66]) -> 0.0379457 | I66: of:=IF([.E66]=1;"";[.E66]) -> 0.0113632
A67: 26 | B67: strncat: &"kktmp"{\0,\x01,\x01,\x01,\x01} &""{\0,p,c,o,\0} 4 :=> &"kktmp"{\0,p,h,n,\0} | C67: 0.0252263 | D67: 1 | E67: 0.0252263 | G67: of:=IF([.C67]=1;"";[.C67]) -> 0.0252263 | H67: of:=IF([.D67]=1;"";[.D67]) ->  | I67: of:=IF([.E67]=1;"";[.E67]) -> 0.0252263
A68: 27 | B68: strncat: &"dbluf"{\0,\x01,\x01,\x01,\x01} &"x"{\0,p,w,\0} 4 :=> &"dblufx"{\0,p,l,\0} | C68: 0.0270534 | D68: 1 | E68: 0.0151501 | G68: of:=IF([.C68]=1;"";[.C68]) -> 0.0270534 | H68: of:=IF([.D68]=1;"";[.D68]) ->  | I68: of:=IF([.E68]=1;"";[.E68]) -> 0.0151501
A69: 28 | B69: strncat: &"begfw"{\0,\x01,\x01,\x01,\x01} &"tx"{\0,p,\0} 4 :=> &"begfwtx"{\0,p,\0} | C69: 0.0244448 | D69: 0.151927 | E69: 0.0117027 | G69: of:=IF([.C69]=1;"";[.C69]) -> 0.0244448 | H69: of:=IF([.D69]=1;"";[.D69]) -> 0.151927 | I69: of:=IF([.E69]=1;"";[.E69]) -> 0.0117027
A70: 29 | B70: strncat: &"becul"{\0,\x01,\x01,\x01,\x01} &"nib"{\0,\0} 4 :=> &"beculnib"{\0,\0} | C70: 0.0307066 | D70: 0.0850874 | E70: 0.0132607 | G70: of:=IF([.C70]=1;"";[.C70]) -> 0.0307066 | H70: of:=IF([.D70]=1;"";[.D70]) -> 0.0850874 | I70: of:=IF([.E70]=1;"";[.E70]) -> 0.0132607
A71: 30 | B71: strncat: &"hnqbl"{\0,\x01,\x01,\x01,\x01} &"zaaf"{\0} 4 :=> &"hnqblzaaf"{\0} | C71: 0.0213364 | D71: 0.0412289 | E71: 0.00822361 | G71: of:=IF([.C71]=1;"";[.C71]) -> 0.0213364 | H71: of:=IF([.D71]=1;"";[.D71]) -> 0.0412289 | I71: of:=IF([.E71]=1;"";[.E71]) -> 0.00822361
A72: 31 | B72: strncat: &"zgslnf"{\0,\x01,\x01,\x01} &""{\0,p,f,u,\0} 4 :=> &"zgslnf"{\0,p,i,\0} | C72: 0.017794 | D72: 1 | E72: 0.017794 | G72: of:=IF([.C72]=1;"";[.C72]) -> 0.017794 | H72: of:=IF([.D72]=1;"";[.D72]) ->  | I72: of:=IF([.E72]=1;"";[.E72]) -> 0.017794
A73: 32 | B73: strncat: &"qscrva"{\0,\x01,\x01,\x01} &"z"{\0,p,d,\0} 4 :=> &"qscrvaz"{\0,p,\0} | C73: 0.0160326 | D73: 1 | E73: 0.012525 | G73: of:=IF([.C73]=1;"";[.C73]) -> 0.0160326 | H73: of:=IF([.D73]=1;"";[.D73]) ->  | I73: of:=IF([.E73]=1;"";[.E73]) -> 0.012525
A74: 33 | B74: strncat: &"blkrqi"{\0,\x01,\x01,\x01} &"sp"{\0,p,\0} 4 :=> &"blkrqisp"{\0,\0} | C74: 0.0174403 | D74: 0.214762 | E74: 0.0116206 | G74: of:=IF([.C74]=1;"";[.C74]) -> 0.0174403 | H74: of:=IF([.D74]=1;"";[.D74]) -> 0.214762 | I74: of:=IF([.E74]=1;"";[.E74]) -> 0.0116206
A75: 34 | B75: strncat: &"cescgw"{\0,\x01,\x01,\x01} &"lfs"{\0,\0} 4 :=> &"cescgwlfs"{\0} | C75: 0.0143884 | D75: 0.078026 | E75: 0.0080218 | G75: of:=IF([.C75]=1;"";[.C75]) -> 0.0143884 | H75: of:=IF([.D75]=1;"";[.D75]) -> 0.078026 | I75: of:=IF([.E75]=1;"";[.E75]) -> 0.0080218
A76: 35 | B76: strncat: &"quatat"{\0,\x01,\x01,\x01} &&10 4 :=> &"quatatckst"{} | C76: 0.0224272 | D76: 0.010185 | G76: of:=IF([.C76]=1;"";[.C76]) -> 0.0224272 | H76: of:=IF([.D76]=1;"";[.D76]) -> 0.010185 | I76: of:=IF([.E76]=1;"";[.E76]) ->  
A77: 36 | B77: strncat: &"rrvcebk"{\0,\x01,\x01} &""{\0,p,i,p,\0} 4 :=> &"rrvcebk"{\0,p,\0} | C77: 0.0137068 | D77: 1 | E77: 0.0137068 | G77: of:=IF([.C77]=1;"";[.C77]) -> 0.0137068 | H77: of:=IF([.D77]=1;"";[.D77]) ->  | I77: of:=IF([.E77]=1;"";[.E77]) -> 0.0137068
A78: 37 | B78: strncat: &"quxshas"{\0,\x01,\x01} &"y"{\0,p,u,\0} 4 :=> &"quxshasy"{\0,\0} | C78: 0.014802 | D78: 1 | E78: 0.0120133 | G78: of:=IF([.C78]=1;"";[.C78]) -> 0.014802 | H78: of:=IF([.D78]=1;"";[.D78]) ->  | I78: of:=IF([.E78]=1;"";[.E78]) -> 0.0120133
A79: 38 | B79: strncat: &"wptnquy"{\0,\x01,\x01} &"ly"{\0,p,\0} 4 :=> &"wptnquyly"{\0} | C79: 0.0136467 | D79: 0.218466 | E79: 0.00960035 | G79: of:=IF([.C79]=1;"";[.C79]) -> 0.0136467 | H79: of:=IF([.D79]=1;"";[.D79]) -> 0.218466 | I79: of:=IF([.E79]=1;"";[.E79]) -> 0.00960035
A80: 39 | B80: strncat: &"vysoglqu"{\0,\x01} &""{\0,p,t,e,\0} 4 :=> &"vysoglqu"{\0,\0} | C80: 0.01132 | D80: 1 | E80: 0.01132 | G80: of:=IF([.C80]=1;"";[.C80]) -> 0.01132 | H80: of:=IF([.D80]=1;"";[.D80]) ->  | I80: of:=IF([.E80]=1;"";[.E80]) -> 0.01132
A81: 40 | B81: strncat: &"wdhfkcka"{\0,\x01} &"t"{\0,p,p,\0} 4 :=> &"wdhfkckat"{\0} | C81: 0.00984117 | D81: 1 | E81: 0.00870153 | G81: of:=IF([.C81]=1;"";[.C81]) -> 0.00984117 | H81: of:=IF([.D81]=1;"";[.D81]) ->  | I81: of:=IF([.E81]=1;"";[.E81]) -> 0.00870153
A82: 41 | B82: strncat: &"lyxamvadp"{\0} &""{\0,p,h,a,\0} 4 :=> &"lyxamvadp"{\0} | C82: 0.00902238 | D82: 1 | E82: 0.00902238 | G82: of:=IF([.C82]=1;"";[.C82]) -> 0.00902238 | H82: of:=IF([.D82]=1;"";[.D82]) ->  | I82: of:=IF([.E82]=1;"";[.E82]) -> 0.00902238

Sheet: strstr
A1: # | B1: Test Case | C1: N | G1: N1 | H1: N2 | I1: N3
A2: 1 | B2: strstr: &"t"{\0,h,n,a,\0} &"t"{\0,\0} :=> &"t"{\0,h,n,a,\0} | C2: 1 | D2: 1 | E2: 1 | G2: of:=IF([.C2]=1;"";[.C2]) ->  | H2: of:=IF([.D2]=1;"";[.D2]) ->  | I2: of:=IF([.E2]=1;"";[.E2]) ->  | K2: of:=AVERAGE([.G2:.G19]) -> 0.0753117647058824 | L2: of:=AVERAGE([.H2:.H19]) -> 0.201102444444444 | M2: of:=AVERAGE([.I2:.I19]) -> 0.101496375 | O2: of:=AVERAGE([.K2:.M2]) -> 0.125970194716776
A3: 2 | B3: strstr: &"da"{\0,h,n,\0} &"d"{\0,\0} :=> &"da"{\0,h,n,\0} | C3: 0.216174 | D3: 1 | E3: 0.216174 | G3: of:=IF([.C3]=1;"";[.C3]) -> 0.216174 | H3: of:=IF([.D3]=1;"";[.D3]) ->  | I3: of:=IF([.E3]=1;"";[.E3]) -> 0.216174
A4: 3 | B4: strstr: &"rx"{\0,b,v,\0} &"x"{\0,\0} :=> &"x"{\0,b,v,\0,54} | C4: 0.179137 | D4: 1 | E4: 1 | G4: of:=IF([.C4]=1;"";[.C4]) -> 0.179137 | H4: of:=IF([.D4]=1;"";[.D4]) ->  | I4: of:=IF([.E4]=1;"";[.E4]) -> 
A5: 4 | B5: strstr: &"yrw"{\0,h,\0} &"y"{\0,\0} :=> &"yrw"{\0,h,\0} | C5: 0.0774921 | D5: 1 | E5: 0.0774921 | G5: of:=IF([.C5]=1;"";[.C5]) -> 0.0774921 | H5: of:=IF([.D5]=1;"";[.D5]) ->  | I5: of:=IF([.E5]=1;"";[.E5]) -> 0.0774921
A6: 5 | B6: strstr: &"lkd"{\0,b,\0} &"k"{\0,\0} :=> &"kd"{\0,b,\0,54} | C6: 0.0741728 | D6: 1 | E6: 0.188031 | G6: of:=IF([.C6]=1;"";[.C6]) -> 0.0741728 | H6: of:=IF([.D6]=1;"";[.D6]) ->  | I6: of:=IF([.E6]=1;"";[.E6]) -> 0.188031
A7: 6 | B7: strstr: &"nyen"{\0,\0} &"n"{\0,\0} :=> &"nyen"{\0,\0} | C7: 0.0473804 | D7: 1 | E7: 0.0473804 | G7: of:=IF([.C7]=1;"";[.C7]) -> 0.0473804 | H7: of:=IF([.D7]=1;"";[.D7]) ->  | I7: of:=IF([.E7]=1;"";[.E7]) -> 0.0473804
A8: 7 | B8: strstr: &"yeck"{\0,\0} &"e"{\0,\0} :=> &"eck"{\0,\0,54} | C8: 0.0469802 | D8: 1 | E8: 0.0870897 | G8: of:=IF([.C8]=1;"";[.C8]) -> 0.0469802 | H8: of:=IF([.D8]=1;"";[.D8]) ->  | I8: of:=IF([.E8]=1;"";[.E8]) -> 0.0870897
A9: 8 | B9: strstr: &"binto"{\0} &"b"{\0,\0} :=> &"binto"{\0} | C9: 0.0318358 | D9: 1 | E9: 0.0318358 | G9: of:=IF([.C9]=1;"";[.C9]) -> 0.0318358 | H9: of:=IF([.D9]=1;"";[.D9]) ->  | I9: of:=IF([.E9]=1;"";[.E9]) -> 0.0318358
A10: 9 | B10: strstr: &"hrptv"{\0} &"r"{\0,\0} :=> &"rptv"{\0,54} | C10: 0.0264582 | D10: 1 | E10: 0.0407046 | G10: of:=IF([.C10]=1;"";[.C10]) -> 0.0264582 | H10: of:=IF([.D10]=1;"";[.D10]) ->  | I10: of:=IF([.E10]=1;"";[.E10]) -> 0.0407046
A11: 10 | B11: strstr: &"za"{\0,d,l,\0} &"za"{\0} :=> &"za"{\0,d,l,\0} | C11: 0.205157 | D11: 0.205157 | E11: 0.205157 | G11: of:=IF([.C11]=1;"";[.C11]) -> 0.205157 | H11: of:=IF([.D11]=1;"";[.D11]) -> 0.205157 | I11: of:=IF([.E11]=1;"";[.E11]) -> 0.205157
A12: 11 | B12: strstr: &"cjt"{\0,d,\0} &"cj"{\0} :=> &"cjt"{\0,d,\0} | C12: 0.0397949 | D12: 0.11996 | E12: 0.0397949 | G12: of:=IF([.C12]=1;"";[.C12]) -> 0.0397949 | H12: of:=IF([.D12]=1;"";[.D12]) -> 0.11996 | I12: of:=IF([.E12]=1;"";[.E12]) -> 0.0397949
A13: 12 | B13: strstr: &"hhs"{\0,a,\0} &"hs"{\0} :=> &"hs"{\0,a,\0,54} | C13: 0.0728455 | D13: 0.204664 | E13: 0.204664 | G13: of:=IF([.C13]=1;"";[.C13]) -> 0.0728455 | H13: of:=IF([.D13]=1;"";[.D13]) -> 0.204664 | I13: of:=IF([.E13]=1;"";[.E13]) -> 0.204664
A14: 13 | B14: strstr: &"yah"{\0,p,\0} &"ah"{\0} :=> &"ah"{\0,p,\0,54} | C14: 0.078238 | D14: 0.203053 | E14: 0.203053 | G14: of:=IF([.C14]=1;"";[.C14]) -> 0.078238 | H14: of:=IF([.D14]=1;"";[.D14]) -> 0.203053 | I14: of:=IF([.E14]=1;"";[.E14]) -> 0.203053
A15: 14 | B15: strstr: &"ogep"{\0,\0} &"og"{\0} :=> &"ogep"{\0,\0} | C15: 0.0462884 | D15: 0.211356 | E15: 0.0462884 | G15: of:=IF([.C15]=1;"";[.C15]) -> 0.0462884 | H15: of:=IF([.D15]=1;"";[.D15]) -> 0.211356 | I15: of:=IF([.E15]=1;"";[.E15]) -> 0.0462884
A16: 15 | B16: strstr: &"rrae"{\0,\0} &"ra"{\0} :=> &"rae"{\0,\0,54} | C16: 0.045342 | D16: 0.22156 | E16: 0.0840566 | G16: of:=IF([.C16]=1;"";[.C16]) -> 0.045342 | H16: of:=IF([.D16]=1;"";[.D16]) -> 0.22156 | I16: of:=IF([.E16]=1;"";[.E16]) -> 0.0840566
A17: 16 | B17: strstr: &"drud"{\0,\0} &"ru"{\0} :=> &"rud"{\0,\0,54} | C17: 0.0452283 | D17: 0.213322 | E17: 0.0842685 | G17: of:=IF([.C17]=1;"";[.C17]) -> 0.0452283 | H17: of:=IF([.D17]=1;"";[.D17]) -> 0.213322 | I17: of:=IF([.E17]=1;"";[.E17]) -> 0.0842685
A18: 17 | B18: strstr: &"mirox"{\0} &"mi"{\0} :=> &"mirox"{\0} | C18: 0.0295749 | D18: 0.218014 | E18: 0.0295749 | G18: of:=IF([.C18]=1;"";[.C18]) -> 0.0295749 | H18: of:=IF([.D18]=1;"";[.D18]) -> 0.218014 | I18: of:=IF([.E18]=1;"";[.E18]) -> 0.0295749
A19: 18 | B19: strstr: &"qqufc"{\0} &"qu"{\0} :=> &"qufc"{\0,54} | C19: 0.0182005 | D19: 0.212836 | E19: 0.0383771 | G19: of:=IF([.C19]=1;"";[.C19]) -> 0.0182005 | H19: of:=IF([.D19]=1;"";[.D19]) -> 0.212836 | I19: of:=IF([.E19]=1;"";[.E19]) -> 0.0383771
A20: 19 | B20: strstr: &"lmohe"{\0} &"mo"{\0} :=> &"mohe"{\0,54} | C20: 0.0294908 | D20: 0.218014 | E20: 0.0469024 | G20: of:=IF([.C20]=1;"";[.C20]) -> 0.0294908 | H20: of:=IF([.D20]=1;"";[.D20]) -> 0.218014 | I20: of:=IF([.E20]=1;"";[.E20]) -> 0.0469024 | K20: of:=AVERAGE([.G20:.G24]) -> 0.02631722 | L20: of:=AVERAGE([.H20:.H24]) -> 0.205832 | M20: of:=AVERAGE([.I20:.I24]) -> 0.0321571 | O20: of:=AVERAGE([.K20:.M20]) -> 0.0881021066666667
A21: 1 | B21: strnstr: &"asoam"{\0} &""{\0,p,\0} 2 :=> &"asoam"{\0} | C21: 0.0304877 | D21: 1 | E21: 0.0304877 | G21: of:=IF([.C21]=1;"";[.C21]) -> 0.0304877 | H21: of:=IF([.D21]=1;"";[.D21]) ->  | I21: of:=IF([.E21]=1;"";[.E21]) -> 0.0304877
A22: 2 | B22: strnstr: &"gdmay"{\0} &"g"{\0,\0} 2 :=> &"gdmay"{\0} | C22: 0.0275081 | D22: 1 | E22: 0.0275081 | G22: of:=IF([.C22]=1;"";[.C22]) -> 0.0275081 | H22: of:=IF([.D22]=1;"";[.D22]) ->  | I22: of:=IF([.E22]=1;"";[.E22]) -> 0.0275081
A23: 3 | B23: strnstr: &"bwqir"{\0} &"w"{\0,\0} 2 :=> &"wqir"{\0,54} | C23: 0.0199811 | D23: 1 | E23: 0.0317689 | G23: of:=IF([.C23]=1;"";[.C23]) -> 0.0199811 | H23: of:=IF([.D23]=1;"";[.D23]) ->  | I23: of:=IF([.E23]=1;"";[.E23]) -> 0.0317689
A24: 4 | B24: strnstr: &"xoxfu"{\0} &"xo"{\0} 2 :=> &"xoxfu"{\0} | C24: 0.0241184 | D24: 0.19365 | E24: 0.0241184 | G24: of:=IF([.C24]=1;"";[.C24]) -> 0.0241184 | H24: of:=IF([.D24]=1;"";[.D24]) -> 0.19365 | I24: of:=IF([.E24]=1;"";[.E24]) -> 0.0241184
A25: 1 | B25: strpbrk: &"zuahh"{\0} &"aeiou"{\0} :=> &"uahh"{\0,54} | C25: 0.0244738 | D25: 0.0299288 | E25: 0.0399709 | G25: of:=IF([.C25]=1;"";[.C25]) -> 0.0244738 | H25: of:=IF([.D25]=1;"";[.D25]) -> 0.0299288 | I25: of:=IF([.E25]=1;"";[.E25]) -> 0.0399709 | K25: of:=AVERAGE([.G25:.G34]) -> 0.02641902 | L25: of:=AVERAGE([.H25:.H34]) -> 0.0299288 | M25: of:=AVERAGE([.I25:.I34]) -> 0.03400017 | O25: of:=AVERAGE([.K25:.M25]) -> 0.0301159966666667
A26: 2 | B26: strpbrk: &"zoyph"{\0} &"aeiou"{\0} :=> &"oyph"{\0,54} | C26: 0.0264379 | D26: 0.0299288 | E26: 0.0425066 | G26: of:=IF([.C26]=1;"";[.C26]) -> 0.0264379 | H26: of:=IF([.D26]=1;"";[.D26]) -> 0.0299288 | I26: of:=IF([.E26]=1;"";[.E26]) -> 0.0425066
A27: 3 | B27: strpbrk: &"cimrm"{\0} &"aeiou"{\0} :=> &"imrm"{\0,54} | C27: 0.0273287 | D27: 0.0299288 | E27: 0.0415814 | G27: of:=IF([.C27]=1;"";[.C27]) -> 0.0273287 | H27: of:=IF([.D27]=1;"";[.D27]) -> 0.0299288 | I27: of:=IF([.E27]=1;"";[.E27]) -> 0.0415814
A28: 4 | B28: strpbrk: &"zepab"{\0} &"aeiou"{\0} :=> &"epab"{\0,54} | C28: 0.0296105 | D28: 0.0299288 | E28: 0.0467923 | G28: of:=IF([.C28]=1;"";[.C28]) -> 0.0296105 | H28: of:=IF([.D28]=1;"";[.D28]) -> 0.0299288 | I28: of:=IF([.E28]=1;"";[.E28]) -> 0.0467923
A29: 5 | B29: strpbrk: &"tauuo"{\0} &"aeiou"{\0} :=> &"auuo"{\0,54} | C29: 0.0260118 | D29: 0.0299288 | E29: 0.038823 | G29: of:=IF([.C29]=1;"";[.C29]) -> 0.0260118 | H29: of:=IF([.D29]=1;"";[.D29]) -> 0.0299288 | I29: of:=IF([.E29]=1;"";[.E29]) -> 0.038823
A30: 6 | B30: strpbrk: &"ulwtq"{\0} &"aeiou"{\0} :=> &"ulwtq"{\0} | C30: 0.0212358 | D30: 0.0299288 | E30: 0.0212358 | G30: of:=IF([.C30]=1;"";[.C30]) -> 0.0212358 | H30: of:=IF([.D30]=1;"";[.D30]) -> 0.0299288 | I30: of:=IF([.E30]=1;"";[.E30]) -> 0.0212358
A31: 7 | B31: strpbrk: &"owtje"{\0} &"aeiou"{\0} :=> &"owtje"{\0} | C31: 0.0240434 | D31: 0.0299288 | E31: 0.0240434 | G31: of:=IF([.C31]=1;"";[.C31]) -> 0.0240434 | H31: of:=IF([.D31]=1;"";[.D31]) -> 0.0299288 | I31: of:=IF([.E31]=1;"";[.E31]) -> 0.0240434
A32: 8 | B32: strpbrk: &"imfjo"{\0} &"aeiou"{\0} :=> &"imfjo"{\0} | C32: 0.0241266 | D32: 0.0299288 | E32: 0.0241266 | G32: of:=IF([.C32]=1;"";[.C32]) -> 0.0241266 | H32: of:=IF([.D32]=1;"";[.D32]) -> 0.0299288 | I32: of:=IF([.E32]=1;"";[.E32]) -> 0.0241266
A33: 9 | B33: strpbrk: &"echio"{\0} &"aeiou"{\0} :=> &"echio"{\0} | C33: 0.0315554 | D33: 0.0299288 | E33: 0.0315554 | G33: of:=IF([.C33]=1;"";[.C33]) -> 0.0315554 | H33: of:=IF([.D33]=1;"";[.D33]) -> 0.0299288 | I33: of:=IF([.E33]=1;"";[.E33]) -> 0.0315554
A34: 10 | B34: strpbrk: &"arwaf"{\0} &"aeiou"{\0} :=> &"arwaf"{\0} | C34: 0.0293663 | D34: 0.0299288 | E34: 0.0293663 | G34: of:=IF([.C34]=1;"";[.C34]) -> 0.0293663 | H34: of:=IF([.D34]=1;"";[.D34]) -> 0.0299288 | I34: of:=IF([.E34]=1;"";[.E34]) -> 0.0293663