Sheet: strlen
A1: strlen: &"\x01"{\0,\0,\0,\0,\0} :=> 1; | J1: # | K1: Test Case | L1: N | P1: FINAL
A2: strlen: &"\x01\x01"{\0,\0,\0,\0} :=> 2; | J2: 1 | K2: strlen: &"v"{\0,p,m,n,\0} :=> 1 | L2: 1 | N2: of:=IF([.L2]=1;"";[.L2]) ->  | P2: of:=AVERAGE([.N2:.N6]) -> 0.0871774
A3: strlen: &"\x01\x01\x01"{\0,\0,\0} :=> 3; | J3: 2 | K3: strlen: &"yt"{\0,p,w,\0} :=> 2 | L3: 0.202091 | N3: of:=IF([.L3]=1;"";[.L3]) -> 0.202091
A4: strlen: &"\x01\x01\x01\x01"{\0,\0} :=> 4; | J4: 3 | K4: strlen: &"rvs"{\0,p,\0} :=> 3 | L4: 0.0777903 | N4: of:=IF([.L4]=1;"";[.L4]) -> 0.0777903
A5: strlen: &"\x01\x01\x01\x01\x01"{\0} :=> 5; | J5: 4 | K5: strlen: &"sjai"{\0,\0} :=> 4 | L5: 0.0378329 | N5: of:=IF([.L5]=1;"";[.L5]) -> 0.0378329
A6: strnlen: &""{\0,\0,\0,\0,\0,\0} 6 :=> 0; 1; | J6: 5 | K6: strlen: &"ideex"{\0} :=> 5 | L6: 0.0309954 | N6: of:=IF([.L6]=1;"";[.L6]) -> 0.0309954
A7: strnlen: &"\x01"{\0,\0,\0,\0,\0} 6 :=> 1; | J7: 1 | K7: strnlen: &""{\0,p,a,t,n,\0} 6 :=> 0 | L7: 1 | N7: of:=IF([.L7]=1;"";[.L7]) ->  | P7: of:=AVERAGE([.N7:.N12]) -> 0.091972675
A8: strnlen: &"\x01\x01"{\0,\0,\0,\0} 6 :=> 2; | J8: 2 | K8: strnlen: &"o"{\0,p,m,p,\0} 6 :=> 1 | L8: 1 | N8: of:=IF([.L8]=1;"";[.L8]) -> 
A9: strnlen: &"\x01\x01\x01"{\0,\0,\0} 6 :=> 3; | J9: 3 | K9: strnlen: &"ig"{\0,p,a,\0} 6 :=> 2 | L9: 0.2171 | N9: of:=IF([.L9]=1;"";[.L9]) -> 0.2171
A10: strnlen: &"\x01\x01\x01\x01"{\0,\0} 6 :=> 4; | J10: 4 | K10: strnlen: &"ddv"{\0,p,\0} 6 :=> 3 | L10: 0.0802704 | N10: of:=IF([.L10]=1;"";[.L10]) -> 0.0802704
A11: strnlen: &"\x01\x01\x01\x01\x01"{\0} 6 :=> 5; | J11: 5 | K11: strnlen: &"pdok"{\0,\0} 6 :=> 4 | L11: 0.0409048 | N11: of:=IF([.L11]=1;"";[.L11]) -> 0.0409048
J12: 6 | K12: strnlen: &"ioflk"{\0} 6 :=> 5 | L12: 0.0296155 | N12: of:=IF([.L12]=1;"";[.L12]) -> 0.0296155

Sheet: strcmp
A1: # | B1: Test Case | C1: N1 | D1: N2 | L1: FINAL
A2: 1 | B2: strcmp: &"t"{\0,p,m,p,\0} &"t"{\0,p,y,k,\0} :=> 0 | C2: 1 | D2: 1 | F2: of:=IF([.C2]=1;"";[.C2]) ->  | G2: of:=IF([.D2]=1;"";[.D2]) ->  | H2: of:=IF([.E2]=1;"";[.E2]) ->   | I2: of:=AVERAGE([.F2:.F16]) -> 0.0441128142857143 | J2: of:=AVERAGE([.G2:.G16]) -> 0.0439479571428571 | L2: of:=AVERAGE([.I2:.J2]) -> 0.0440303857142857
A3: 2 | B3: strcmp: &"hw"{\0,p,h,\0} &"hw"{\0,p,o,\0} :=> 0 | C3: 0.197427 | D3: 0.197427 | F3: of:=IF([.C3]=1;"";[.C3]) -> 0.197427 | G3: of:=IF([.D3]=1;"";[.D3]) -> 0.197427 | H3: of:=IF([.E3]=1;"";[.E3]) ->  
A4: 3 | B4: strcmp: &"hab"{\0,p,\0} &"hab"{\0,p,\0} :=> 0 | C4: 0.0882054 | D4: 0.0882054 | F4: of:=IF([.C4]=1;"";[.C4]) -> 0.0882054 | G4: of:=IF([.D4]=1;"";[.D4]) -> 0.0882054 | H4: of:=IF([.E4]=1;"";[.E4]) ->  
A5: 4 | B5: strcmp: &"brmn"{\0,\0} &"brmn"{\0,\0} :=> 0 | C5: 0.0430363 | D5: 0.0430363 | F5: of:=IF([.C5]=1;"";[.C5]) -> 0.0430363 | G5: of:=IF([.D5]=1;"";[.D5]) -> 0.0430363 | H5: of:=IF([.E5]=1;"";[.E5]) ->  
A6: 5 | B6: strcmp: &"macnd"{\0} &"macnd"{\0} :=> 0 | C6: 0.0276269 | D6: 0.0276269 | F6: of:=IF([.C6]=1;"";[.C6]) -> 0.0276269 | G6: of:=IF([.D6]=1;"";[.D6]) -> 0.0276269 | H6: of:=IF([.E6]=1;"";[.E6]) ->  
A7: 6 | B7: strcmp: &"jnehc"{\0} &"jneha"{\0} :=> 1 | C7: 0.0228177 | D7: 0.0253046 | F7: of:=IF([.C7]=1;"";[.C7]) -> 0.0228177 | G7: of:=IF([.D7]=1;"";[.D7]) -> 0.0253046 | H7: of:=IF([.E7]=1;"";[.E7]) ->  
A8: 7 | B8: strcmp: &"pyscs"{\0} &"pyscz"{\0} :=> -1 | C8: 0.0277502 | D8: 0.0258858 | F8: of:=IF([.C8]=1;"";[.C8]) -> 0.0277502 | G8: of:=IF([.D8]=1;"";[.D8]) -> 0.0258858 | H8: of:=IF([.E8]=1;"";[.E8]) ->  
A9: 8 | B9: strcmp: &"arcca"{\0} &"arcbc"{\0} :=> 1 | C9: 0.0304242 | D9: 0.0243085 | F9: of:=IF([.C9]=1;"";[.C9]) -> 0.0304242 | G9: of:=IF([.D9]=1;"";[.D9]) -> 0.0243085 | H9: of:=IF([.E9]=1;"";[.E9]) ->  
A10: 9 | B10: strcmp: &"syejm"{\0} &"syewe"{\0} :=> -1 | C10: 0.0236669 | D10: 0.029391 | F10: of:=IF([.C10]=1;"";[.C10]) -> 0.0236669 | G10: of:=IF([.D10]=1;"";[.D10]) -> 0.029391 | H10: of:=IF([.E10]=1;"";[.E10]) ->  
A11: 10 | B11: strcmp: &"qujfe"{\0} &"qudpk"{\0} :=> 1 | C11: 0.0212527 | D11: 0.0248672 | F11: of:=IF([.C11]=1;"";[.C11]) -> 0.0212527 | G11: of:=IF([.D11]=1;"";[.D11]) -> 0.0248672 | H11: of:=IF([.E11]=1;"";[.E11]) ->  
A12: 11 | B12: strcmp: &"orwyn"{\0} &"orzup"{\0} :=> -1 | C12: 0.0273208 | D12: 0.0263992 | F12: of:=IF([.C12]=1;"";[.C12]) -> 0.0273208 | G12: of:=IF([.D12]=1;"";[.D12]) -> 0.0263992
A13: 12 | B13: strcmp: &"fxeoo"{\0} &"fvoqw"{\0} :=> 1 | C13: 0.0214377 | D13: 0.0155039 | F13: of:=IF([.C13]=1;"";[.C13]) -> 0.0214377 | G13: of:=IF([.D13]=1;"";[.D13]) -> 0.0155039
A14: 13 | B14: strcmp: &"hiffa"{\0} &"hloap"{\0} :=> -1 | C14: 0.0300322 | D14: 0.0287506 | F14: of:=IF([.C14]=1;"";[.C14]) -> 0.0300322 | G14: of:=IF([.D14]=1;"";[.D14]) -> 0.0287506
A15: 14 | B15: strcmp: &"htate"{\0} &"ardpe"{\0} :=> 1 | C15: 0.0316158 | D15: 0.0282939 | F15: of:=IF([.C15]=1;"";[.C15]) -> 0.0316158 | G15: of:=IF([.D15]=1;"";[.D15]) -> 0.0282939
A16: 15 | B16: strcmp: &"yhovn"{\0} &"zisal"{\0} :=> -1 | C16: 0.0249656 | D16: 0.0302711 | F16: of:=IF([.C16]=1;"";[.C16]) -> 0.0249656 | G16: of:=IF([.D16]=1;"";[.D16]) -> 0.0302711
A17: 1 | B17: strncmp: &""{\0,p,p,e,t,\0} &""{\0,p,a,w,s,\0} 5 :=> 0 | C17: 1 | D17: 1 | F17: of:=IF([.C17]=1;"";[.C17]) ->  | G17: of:=IF([.D17]=1;"";[.D17]) ->  | I17: of:=AVERAGE([.F17:.F32]) -> 0.0436289214285714 | J17: of:=AVERAGE([.G17:.G32]) -> 0.0406463214285714 | L17: of:=AVERAGE([.I17:.J17]) -> 0.0421376214285714
A18: 2 | B18: strncmp: &"c"{\0,p,w,s,\0} &"c"{\0,p,t,a,\0} 5 :=> 0 | C18: 1 | D18: 1 | F18: of:=IF([.C18]=1;"";[.C18]) ->  | G18: of:=IF([.D18]=1;"";[.D18]) -> 
A19: 3 | B19: strncmp: &"zh"{\0,p,k,\0} &"zh"{\0,p,h,\0} 5 :=> 0 | C19: 0.185724 | D19: 0.185724 | F19: of:=IF([.C19]=1;"";[.C19]) -> 0.185724 | G19: of:=IF([.D19]=1;"";[.D19]) -> 0.185724
A20: 4 | B20: strncmp: &"run"{\0,p,\0} &"run"{\0,p,\0} 5 :=> 0 | C20: 0.0860472 | D20: 0.0860472 | F20: of:=IF([.C20]=1;"";[.C20]) -> 0.0860472 | G20: of:=IF([.D20]=1;"";[.D20]) -> 0.0860472
A21: 5 | B21: strncmp: &"oquh"{\0,\0} &"oquh"{\0,\0} 5 :=> 0 | C21: 0.0376936 | D21: 0.0376936 | F21: of:=IF([.C21]=1;"";[.C21]) -> 0.0376936 | G21: of:=IF([.D21]=1;"";[.D21]) -> 0.0376936
A22: 6 | B22: strncmp: &"bungl"{\0} &"bungl"{\0} 5 :=> 0 | C22: 0.0301501 | D22: 0.0301501 | F22: of:=IF([.C22]=1;"";[.C22]) -> 0.0301501 | G22: of:=IF([.D22]=1;"";[.D22]) -> 0.0301501
A23: 7 | B23: strncmp: &"sddga"{\0} &"sddgN"{\0} 5 :=> 1 | C23: 0.0278322 | D23: 0 | F23: of:=IF([.C23]=1;"";[.C23]) -> 0.0278322 | G23: of:=IF([.D23]=1;"";[.D23]) -> 0
A24: 8 | B24: strncmp: &"gssgl"{\0} &"gssgs"{\0} 5 :=> -1 | C24: 0.0270151 | D24: 0.0271333 | F24: of:=IF([.C24]=1;"";[.C24]) -> 0.0270151 | G24: of:=IF([.D24]=1;"";[.D24]) -> 0.0271333
A25: 9 | B25: strncmp: &"bssig"{\0} &"bssfm"{\0} 5 :=> 1 | C25: 0.030227 | D25: 0.0261883 | F25: of:=IF([.C25]=1;"";[.C25]) -> 0.030227 | G25: of:=IF([.D25]=1;"";[.D25]) -> 0.0261883
A26: 10 | B26: strncmp: &"vhwfr"{\0} &"vhwnr"{\0} 5 :=> -1 | C26: 0.0193285 | D26: 0.0199627 | F26: of:=IF([.C26]=1;"";[.C26]) -> 0.0193285 | G26: of:=IF([.D26]=1;"";[.D26]) -> 0.0199627
A27: 11 | B27: strncmp: &"loynb"{\0} &"lomal"{\0} 5 :=> 1 | C27: 0.0273299 | D27: 0.0314748 | F27: of:=IF([.C27]=1;"";[.C27]) -> 0.0273299 | G27: of:=IF([.D27]=1;"";[.D27]) -> 0.0314748
A28: 12 | B28: strncmp: &"rveje"{\0} &"rvgal"{\0} 5 :=> -1 | C28: 0.028266 | D28: 0.0270506 | F28: of:=IF([.C28]=1;"";[.C28]) -> 0.028266 | G28: of:=IF([.D28]=1;"";[.D28]) -> 0.0270506
A29: 13 | B29: strncmp: &"wdjot"{\0} &"wcbls"{\0} 5 :=> 1 | C29: 0.0264699 | D29: 0.023582 | F29: of:=IF([.C29]=1;"";[.C29]) -> 0.0264699 | G29: of:=IF([.D29]=1;"";[.D29]) -> 0.023582
A30: 14 | B30: strncmp: &"upupa"{\0} &"uxlki"{\0} 5 :=> -1 | C30: 0.0297466 | D30: 0.0243271 | F30: of:=IF([.C30]=1;"";[.C30]) -> 0.0297466 | G30: of:=IF([.D30]=1;"";[.D30]) -> 0.0243271
A31: 15 | B31: strncmp: &"tcakm"{\0} &"mdivi"{\0} 5 :=> 1 | C31: 0.0271859 | D31: 0.0275857 | F31: of:=IF([.C31]=1;"";[.C31]) -> 0.0271859 | G31: of:=IF([.D31]=1;"";[.D31]) -> 0.0275857
A32: 16 | B32: strncmp: &"rpgeo"{\0} &"zguvn"{\0} 5 :=> -1 | C32: 0.0277889 | D32: 0.0221291 | F32: of:=IF([.C32]=1;"";[.C32]) -> 0.0277889 | G32: of:=IF([.D32]=1;"";[.D32]) -> 0.0221291
A33: 1 | B33: sysfs_streq: &""{\0,p,s,u,t,\0} &"xploi"{\0} :=> \0 | C33: 1 | D33: 0.0295737 | F33: of:=IF([.C33]=1;"";[.C33]) ->  | G33: of:=IF([.D33]=1;"";[.D33]) -> 0.0295737 | I33: of:=AVERAGE([.F33:.F71]) -> 0.0644267724137931 | J33: of:=AVERAGE([.G33:.G71]) -> 0.0395582571428571 | L33: of:=AVERAGE([.I33:.J33]) -> 0.0519925147783251
A34: 2 | B34: sysfs_streq: &""{\0,p,g,h,b,\0} &"\n"{\0,b,s,y,\0} :=> \x01 | C34: 1 | F34: of:=IF([.C34]=1;"";[.C34]) ->  | G34: of:=IF([.D34]=1;"";[.D34]) ->  
A35: 3 | B35: sysfs_streq: &""{\0,p,o,v,e,\0} &"\nahdr"{\0} :=> \0 | C35: 1 | F35: of:=IF([.C35]=1;"";[.C35]) ->  | G35: of:=IF([.D35]=1;"";[.D35]) ->  
A36: 4 | B36: sysfs_streq: &""{\0,p,u,a,p,\0} &""{\0,h,k,l,s,\0} :=> \x01 | C36: 1 | D36: 1 | F36: of:=IF([.C36]=1;"";[.C36]) ->  | G36: of:=IF([.D36]=1;"";[.D36]) -> 
A37: 5 | B37: sysfs_streq: &"kevcq"{\0} &"jnext"{\0} :=> \0 | C37: 0.0261023 | D37: 0.0249208 | F37: of:=IF([.C37]=1;"";[.C37]) -> 0.0261023 | G37: of:=IF([.D37]=1;"";[.D37]) -> 0.0249208
A38: 6 | B38: sysfs_streq: &"\n"{\0,p,a,f,\0} &""{\0,a,n,b,s,\0} :=> \x01 | C38: 1 | F38: of:=IF([.C38]=1;"";[.C38]) ->  | G38: of:=IF([.D38]=1;"";[.D38]) ->  
A39: 7 | B39: sysfs_streq: &"\n"{\0,a,t,d,\0} &"dsole"{\0} :=> \0 | C39: 0.0304144 | F39: of:=IF([.C39]=1;"";[.C39]) -> 0.0304144 | G39: of:=IF([.D39]=1;"";[.D39]) ->  
A40: 8 | B40: sysfs_streq: &"\naibp"{\0} &"urlif"{\0} :=> \0 | C40: 0.0303476 | F40: of:=IF([.C40]=1;"";[.C40]) -> 0.0303476 | G40: of:=IF([.D40]=1;"";[.D40]) ->  
A41: 9 | B41: sysfs_streq: &"t"{\0,p,d,g,\0} &"tupfa"{\0} :=> \0 | C41: 1 | D41: 0.027374 | F41: of:=IF([.C41]=1;"";[.C41]) ->  | G41: of:=IF([.D41]=1;"";[.D41]) -> 0.027374
A42: 10 | B42: sysfs_streq: &"j"{\0,p,l,l,\0} &"j\n"{\0,a,v,\0} :=> \x01 | C42: 1 | F42: of:=IF([.C42]=1;"";[.C42]) ->  | G42: of:=IF([.D42]=1;"";[.D42]) ->  
A43: 11 | B43: sysfs_streq: &"m"{\0,p,i,a,\0} &"m\naay"{\0} :=> \0 | C43: 1 | F43: of:=IF([.C43]=1;"";[.C43]) ->  | G43: of:=IF([.D43]=1;"";[.D43]) ->  
A44: 12 | B44: sysfs_streq: &"s"{\0,p,a,f,\0} &"s"{\0,h,b,e,\0} :=> \x01 | C44: 1 | D44: 1 | F44: of:=IF([.C44]=1;"";[.C44]) ->  | G44: of:=IF([.D44]=1;"";[.D44]) -> 
A45: 13 | B45: sysfs_streq: &"vaolx"{\0} &"vgaya"{\0} :=> \0 | C45: 0.0238172 | D45: 0.0255533 | F45: of:=IF([.C45]=1;"";[.C45]) -> 0.0238172 | G45: of:=IF([.D45]=1;"";[.D45]) -> 0.0255533
A46: 14 | B46: sysfs_streq: &"f\n"{\0,b,h,\0} &"f"{\0,b,g,y,\0} :=> \x01 | C46: 1 | F46: of:=IF([.C46]=1;"";[.C46]) ->  | G46: of:=IF([.D46]=1;"";[.D46]) ->  
A47: 15 | B47: sysfs_streq: &"r\n"{\0,b,i,\0} &"rugng"{\0} :=> \0 | C47: 0.0298375 | F47: of:=IF([.C47]=1;"";[.C47]) -> 0.0298375 | G47: of:=IF([.D47]=1;"";[.D47]) ->  
A48: 16 | B48: sysfs_streq: &"b\naju"{\0} &"bfthq"{\0} :=> \0 | C48: 0.0233611 | F48: of:=IF([.C48]=1;"";[.C48]) -> 0.0233611 | G48: of:=IF([.D48]=1;"";[.D48]) ->  
A49: 17 | B49: sysfs_streq: &"yv"{\0,p,l,\0} &"yvieg"{\0} :=> \0 | C49: 0.180513 | D49: 0.0273046 | F49: of:=IF([.C49]=1;"";[.C49]) -> 0.180513 | G49: of:=IF([.D49]=1;"";[.D49]) -> 0.0273046
A50: 18 | B50: sysfs_streq: &"de"{\0,p,d,\0} &"de\n"{\0,a,\0} :=> \x01 | C50: 0.22156 | F50: of:=IF([.C50]=1;"";[.C50]) -> 0.22156 | G50: of:=IF([.D50]=1;"";[.D50]) ->  
A51: 19 | B51: sysfs_streq: &"gm"{\0,p,a,\0} &"gm\nae"{\0} :=> \0 | C51: 0.19487 | F51: of:=IF([.C51]=1;"";[.C51]) -> 0.19487 | G51: of:=IF([.D51]=1;"";[.D51]) ->  
A52: 20 | B52: sysfs_streq: &"zc"{\0,p,l,\0} &"zc"{\0,b,r,\0} :=> \x01 | C52: 0.162347 | D52: 0.162347 | F52: of:=IF([.C52]=1;"";[.C52]) -> 0.162347 | G52: of:=IF([.D52]=1;"";[.D52]) -> 0.162347
A53: 21 | B53: sysfs_streq: &"xnava"{\0} &"xnwhv"{\0} :=> \0 | C53: 0.0246638 | D53: 0.0211693 | F53: of:=IF([.C53]=1;"";[.C53]) -> 0.0246638 | G53: of:=IF([.D53]=1;"";[.D53]) -> 0.0211693
A54: 22 | B54: sysfs_streq: &"zq\n"{\0,b,\0} &"zq"{\0,b,n,\0} :=> \x01 | C54: 0.155927 | F54: of:=IF([.C54]=1;"";[.C54]) -> 0.155927 | G54: of:=IF([.D54]=1;"";[.D54]) ->  
A55: 23 | B55: sysfs_streq: &"dl\n"{\0,b,\0} &"dlwps"{\0} :=> \0 | C55: 0.0248615 | F55: of:=IF([.C55]=1;"";[.C55]) -> 0.0248615 | G55: of:=IF([.D55]=1;"";[.D55]) ->  
A56: 24 | B56: sysfs_streq: &"ze\nav"{\0} &"zesiy"{\0} :=> \0 | C56: 0.0282096 | F56: of:=IF([.C56]=1;"";[.C56]) -> 0.0282096 | G56: of:=IF([.D56]=1;"";[.D56]) ->  
A57: 25 | B57: sysfs_streq: &"wnt"{\0,p,\0} &"wntcr"{\0} :=> \0 | C57: 0.0869425 | D57: 0.0294787 | F57: of:=IF([.C57]=1;"";[.C57]) -> 0.0869425 | G57: of:=IF([.D57]=1;"";[.D57]) -> 0.0294787
A58: 26 | B58: sysfs_streq: &"efa"{\0,p,\0} &"efa\n"{\0,\0} :=> \x01 | C58: 0.0848808 | F58: of:=IF([.C58]=1;"";[.C58]) -> 0.0848808 | G58: of:=IF([.D58]=1;"";[.D58]) ->  
A59: 27 | B59: sysfs_streq: &"qat"{\0,p,\0} &"qat\na"{\0} :=> \0 | C59: 0.0691307 | F59: of:=IF([.C59]=1;"";[.C59]) -> 0.0691307 | G59: of:=IF([.D59]=1;"";[.D59]) ->  
A60: 28 | B60: sysfs_streq: &"pnw"{\0,p,\0} &"pnw"{\0,h,\0} :=> \x01 | C60: 0.0697196 | D60: 0.0697196 | F60: of:=IF([.C60]=1;"";[.C60]) -> 0.0697196 | G60: of:=IF([.D60]=1;"";[.D60]) -> 0.0697196
A61: 29 | B61: sysfs_streq: &"pwsag"{\0} &"pwski"{\0} :=> \0 | C61: 0.0269456 | D61: 0.0260972 | F61: of:=IF([.C61]=1;"";[.C61]) -> 0.0269456 | G61: of:=IF([.D61]=1;"";[.D61]) -> 0.0260972
A62: 30 | B62: sysfs_streq: &"vej\n"{\0,\0} &"vej"{\0,a,\0} :=> \x01 | C62: 0.0809009 | F62: of:=IF([.C62]=1;"";[.C62]) -> 0.0809009 | G62: of:=IF([.D62]=1;"";[.D62]) ->  
A63: 31 | B63: sysfs_streq: &"lac\n"{\0,\0} &"lacyp"{\0} :=> \0 | C63: 0.0287952 | F63: of:=IF([.C63]=1;"";[.C63]) -> 0.0287952 | G63: of:=IF([.D63]=1;"";[.D63]) ->  
A64: 32 | B64: sysfs_streq: &"dfk\na"{\0} &"dfkai"{\0} :=> \0 | C64: 0.0248185 | F64: of:=IF([.C64]=1;"";[.C64]) -> 0.0248185 | G64: of:=IF([.D64]=1;"";[.D64]) ->  
A65: 33 | B65: sysfs_streq: &"ixin"{\0,\0} &"ixins"{\0} :=> \0 | C65: 0.0446007 | D65: 0.0292629 | F65: of:=IF([.C65]=1;"";[.C65]) -> 0.0446007 | G65: of:=IF([.D65]=1;"";[.D65]) -> 0.0292629
A66: 34 | B66: sysfs_streq: &"oisa"{\0,\0} &"oisa\n"{\0} :=> \x01 | C66: 0.0474559 | F66: of:=IF([.C66]=1;"";[.C66]) -> 0.0474559 | G66: of:=IF([.D66]=1;"";[.D66]) ->  
A67: 35 | B67: sysfs_streq: &"qtyv"{\0,\0} &"qtyv"{\0,\0} :=> \x01 | C67: 0.0307406 | D67: 0.0307406 | F67: of:=IF([.C67]=1;"";[.C67]) -> 0.0307406 | G67: of:=IF([.D67]=1;"";[.D67]) -> 0.0307406
A68: 36 | B68: sysfs_streq: &"dqufk"{\0} &"dqufj"{\0} :=> \0 | C68: 0.0240529 | D68: 0.023216 | F68: of:=IF([.C68]=1;"";[.C68]) -> 0.0240529 | G68: of:=IF([.D68]=1;"";[.D68]) -> 0.023216
A69: 37 | B69: sysfs_streq: &"rphk\n"{\0} &"rphk"{\0,\0} :=> \x01 | C69: 0.0400744 | F69: of:=IF([.C69]=1;"";[.C69]) -> 0.0400744 | G69: of:=IF([.D69]=1;"";[.D69]) ->  
A70: 38 | B70: sysfs_streq: &"whck\n"{\0} &"whckp"{\0} :=> \0 | C70: 0.0254282 | F70: of:=IF([.C70]=1;"";[.C70]) -> 0.0254282 | G70: of:=IF([.D70]=1;"";[.D70]) ->  
A71: 39 | B71: sysfs_streq: &"kmbif"{\0} &"kmbif"{\0} :=> \x01 | C71: 0.0270579 | D71: 0.0270579 | F71: of:=IF([.C71]=1;"";[.C71]) -> 0.0270579 | G71: of:=IF([.D71]=1;"";[.D71]) -> 0.0270579

Sheet: strcpy
A1: # | B1: Test Case | C1: N1 | D1: N2 | E1: N3 | O1: FINAL
A2: 1 | B2: strcpy: &""{\0,\x01,\x01,\x01,\x01,\x01} &"z"{\0,p,b,r,\0} :=> &"z"{\0,p,w,n,\0} | C2: 1 | D2: 1 | E2: 1 | G2: of:=IF([.C2]=1;"";[.C2]) ->  | H2: of:=IF([.D2]=1;"";[.D2]) ->  | I2: of:=IF([.E2]=1;"";[.E2]) ->  | K2: of:=AVERAGE([.G2:.G36]) -> 0.0878602666666666 | L2: of:=AVERAGE([.H2:.H36]) -> 0.087251525 | M2: of:=AVERAGE([.I2:.I36]) -> 0.087251525 | O2: of:=AVERAGE([.K2:.M2]) -> 0.0874544388888889
A3: 2 | B3: strcpy: &""{\0,\x01,\x01,\x01,\x01,\x01} &"op"{\0,p,s,\0} :=> &"op"{\0,p,q,\0} | C3: 1 | D3: 0.216638 | E3: 0.216638 | G3: of:=IF([.C3]=1;"";[.C3]) ->  | H3: of:=IF([.D3]=1;"";[.D3]) -> 0.216638 | I3: of:=IF([.E3]=1;"";[.E3]) -> 0.216638
A4: 3 | B4: strcpy: &""{\0,\x01,\x01,\x01,\x01,\x01} &"zne"{\0,p,\0} :=> &"zne"{\0,p,\0} | C4: 1 | D4: 0.0733173 | E4: 0.0733173 | G4: of:=IF([.C4]=1;"";[.C4]) ->  | H4: of:=IF([.D4]=1;"";[.D4]) -> 0.0733173 | I4: of:=IF([.E4]=1;"";[.E4]) -> 0.0733173
A5: 4 | B5: strcpy: &""{\0,\x01,\x01,\x01,\x01,\x01} &"kfaw"{\0,\0} :=> &"kfaw"{\0,\0} | C5: 1 | D5: 0.0416675 | E5: 0.0416675 | G5: of:=IF([.C5]=1;"";[.C5]) ->  | H5: of:=IF([.D5]=1;"";[.D5]) -> 0.0416675 | I5: of:=IF([.E5]=1;"";[.E5]) -> 0.0416675
A6: 5 | B6: strcpy: &""{\0,\x01,\x01,\x01,\x01,\x01} &"phaxa"{\0} :=> &"phaxa"{\0} | C6: 1 | D6: 0.0284344 | E6: 0.0284344 | G6: of:=IF([.C6]=1;"";[.C6]) ->  | H6: of:=IF([.D6]=1;"";[.D6]) -> 0.0284344 | I6: of:=IF([.E6]=1;"";[.E6]) -> 0.0284344
A7: 6 | B7: strcpy: &"r"{\0,\x01,\x01,\x01,\x01} &""{\0,p,y,w,n,\0} :=> &""{\0,\0,p,i,y,\0} | C7: 1 | D7: 1 | E7: 1 | G7: of:=IF([.C7]=1;"";[.C7]) ->  | H7: of:=IF([.D7]=1;"";[.D7]) ->  | I7: of:=IF([.E7]=1;"";[.E7]) -> 
A8: 7 | B8: strcpy: &"r"{\0,\x01,\x01,\x01,\x01} &"r"{\0,p,r,p,\0} :=> &"r"{\0,p,n,a,\0} | C8: 1 | D8: 1 | E8: 1 | G8: of:=IF([.C8]=1;"";[.C8]) ->  | H8: of:=IF([.D8]=1;"";[.D8]) ->  | I8: of:=IF([.E8]=1;"";[.E8]) -> 
A9: 8 | B9: strcpy: &"f"{\0,\x01,\x01,\x01,\x01} &"id"{\0,p,d,\0} :=> &"id"{\0,p,d,\0} | C9: 1 | D9: 0.219808 | E9: 0.219808 | G9: of:=IF([.C9]=1;"";[.C9]) ->  | H9: of:=IF([.D9]=1;"";[.D9]) -> 0.219808 | I9: of:=IF([.E9]=1;"";[.E9]) -> 0.219808
A10: 9 | B10: strcpy: &"s"{\0,\x01,\x01,\x01,\x01} &"ttf"{\0,p,\0} :=> &"ttf"{\0,p,\0} | C10: 1 | D10: 0.0799401 | E10: 0.0799401 | G10: of:=IF([.C10]=1;"";[.C10]) ->  | H10: of:=IF([.D10]=1;"";[.D10]) -> 0.0799401 | I10: of:=IF([.E10]=1;"";[.E10]) -> 0.0799401
A11: 10 | B11: strcpy: &"c"{\0,\x01,\x01,\x01,\x01} &"caja"{\0,\0} :=> &"caja"{\0,\0} | C11: 1 | D11: 0.0430495 | E11: 0.0430495 | G11: of:=IF([.C11]=1;"";[.C11]) ->  | H11: of:=IF([.D11]=1;"";[.D11]) -> 0.0430495 | I11: of:=IF([.E11]=1;"";[.E11]) -> 0.0430495
A12: 11 | B12: strcpy: &"n"{\0,\x01,\x01,\x01,\x01} &"wrjmm"{\0} :=> &"wrjmm"{\0} | C12: 1 | D12: 0.022406 | E12: 0.022406 | G12: of:=IF([.C12]=1;"";[.C12]) ->  | H12: of:=IF([.D12]=1;"";[.D12]) -> 0.022406 | I12: of:=IF([.E12]=1;"";[.E12]) -> 0.022406
A13: 12 | B13: strcpy: &"ki"{\0,\x01,\x01,\x01} &""{\0,p,d,i,b,\0} :=> &""{\0,i,\0,p,l,\0} | C13: 0.213322 | D13: 1 | E13: 1 | G13: of:=IF([.C13]=1;"";[.C13]) -> 0.213322 | H13: of:=IF([.D13]=1;"";[.D13]) ->  | I13: of:=IF([.E13]=1;"";[.E13]) -> 
A14: 13 | B14: strcpy: &"es"{\0,\x01,\x01,\x01} &"g"{\0,p,y,g,\0} :=> &"g"{\0,\0,p,c,\0} | C14: 0.224112 | D14: 1 | E14: 1 | G14: of:=IF([.C14]=1;"";[.C14]) -> 0.224112 | H14: of:=IF([.D14]=1;"";[.D14]) ->  | I14: of:=IF([.E14]=1;"";[.E14]) -> 
A15: 14 | B15: strcpy: &"ip"{\0,\x01,\x01,\x01} &"al"{\0,p,t,\0} :=> &"al"{\0,p,u,\0} | C15: 0.210856 | D15: 0.222847 | E15: 0.222847 | G15: of:=IF([.C15]=1;"";[.C15]) -> 0.210856 | H15: of:=IF([.D15]=1;"";[.D15]) -> 0.222847 | I15: of:=IF([.E15]=1;"";[.E15]) -> 0.222847
A16: 15 | B16: strcpy: &"jc"{\0,\x01,\x01,\x01} &"zax"{\0,p,\0} :=> &"zax"{\0,p,\0} | C16: 0.159409 | D16: 0.0796957 | E16: 0.0796957 | G16: of:=IF([.C16]=1;"";[.C16]) -> 0.159409 | H16: of:=IF([.D16]=1;"";[.D16]) -> 0.0796957 | I16: of:=IF([.E16]=1;"";[.E16]) -> 0.0796957
A17: 16 | B17: strcpy: &"th"{\0,\x01,\x01,\x01} &"wfkd"{\0,\0} :=> &"wfkd"{\0,\0} | C17: 0.227384 | D17: 0.0338093 | E17: 0.0338093 | G17: of:=IF([.C17]=1;"";[.C17]) -> 0.227384 | H17: of:=IF([.D17]=1;"";[.D17]) -> 0.0338093 | I17: of:=IF([.E17]=1;"";[.E17]) -> 0.0338093
A18: 17 | B18: strcpy: &"dw"{\0,\x01,\x01,\x01} &"ikjdd"{\0} :=> &"ikjdd"{\0} | C18: 0.201345 | D18: 0.021012 | E18: 0.021012 | G18: of:=IF([.C18]=1;"";[.C18]) -> 0.201345 | H18: of:=IF([.D18]=1;"";[.D18]) -> 0.021012 | I18: of:=IF([.E18]=1;"";[.E18]) -> 0.021012
A19: 18 | B19: strcpy: &"gom"{\0,\x01,\x01} &""{\0,p,t,h,m,\0} :=> &""{\0,o,m,\0,p,\0} | C19: 0.0867469 | D19: 1 | E19: 1 | G19: of:=IF([.C19]=1;"";[.C19]) -> 0.0867469 | H19: of:=IF([.D19]=1;"";[.D19]) ->  | I19: of:=IF([.E19]=1;"";[.E19]) -> 
A20: 19 | B20: strcpy: &"rtr"{\0,\x01,\x01} &"q"{\0,p,r,d,\0} :=> &"q"{\0,r,\0,p,\0} | C20: 0.0879924 | D20: 1 | E20: 1 | G20: of:=IF([.C20]=1;"";[.C20]) -> 0.0879924 | H20: of:=IF([.D20]=1;"";[.D20]) ->  | I20: of:=IF([.E20]=1;"";[.E20]) -> 
A21: 20 | B21: strcpy: &"jel"{\0,\x01,\x01} &"no"{\0,p,t,\0} :=> &"no"{\0,\0,p,\0} | C21: 0.0837758 | D21: 0.218466 | E21: 0.218466 | G21: of:=IF([.C21]=1;"";[.C21]) -> 0.0837758 | H21: of:=IF([.D21]=1;"";[.D21]) -> 0.218466 | I21: of:=IF([.E21]=1;"";[.E21]) -> 0.218466
A22: 21 | B22: strcpy: &"iay"{\0,\x01,\x01} &"qed"{\0,p,\0} :=> &"qed"{\0,p,\0} | C22: 0.0872664 | D22: 0.0504013 | E22: 0.0504013 | G22: of:=IF([.C22]=1;"";[.C22]) -> 0.0872664 | H22: of:=IF([.D22]=1;"";[.D22]) -> 0.0504013 | I22: of:=IF([.E22]=1;"";[.E22]) -> 0.0504013
A23: 22 | B23: strcpy: &"kbr"{\0,\x01,\x01} &"wlfr"{\0,\0} :=> &"wlfr"{\0,\0} | C23: 0.0760691 | D23: 0.0435161 | E23: 0.0435161 | G23: of:=IF([.C23]=1;"";[.C23]) -> 0.0760691 | H23: of:=IF([.D23]=1;"";[.D23]) -> 0.0435161 | I23: of:=IF([.E23]=1;"";[.E23]) -> 0.0435161
A24: 23 | B24: strcpy: &"cid"{\0,\x01,\x01} &"qbttc"{\0} :=> &"qbttc"{\0} | C24: 0.0875433 | D24: 0.0217919 | E24: 0.0217919 | G24: of:=IF([.C24]=1;"";[.C24]) -> 0.0875433 | H24: of:=IF([.D24]=1;"";[.D24]) -> 0.0217919 | I24: of:=IF([.E24]=1;"";[.E24]) -> 0.0217919
A25: 24 | B25: strcpy: &"jpki"{\0,\x01} &""{\0,p,b,t,h,\0} :=> &""{\0,p,k,i,\0,\0} | C25: 0.0302387 | D25: 1 | E25: 1 | G25: of:=IF([.C25]=1;"";[.C25]) -> 0.0302387 | H25: of:=IF([.D25]=1;"";[.D25]) ->  | I25: of:=IF([.E25]=1;"";[.E25]) -> 
A26: 25 | B26: strcpy: &"wgpa"{\0,\x01} &"e"{\0,p,m,o,\0} :=> &"e"{\0,p,a,\0,\0} | C26: 0.0340859 | D26: 1 | E26: 1 | G26: of:=IF([.C26]=1;"";[.C26]) -> 0.0340859 | H26: of:=IF([.D26]=1;"";[.D26]) ->  | I26: of:=IF([.E26]=1;"";[.E26]) -> 
A27: 26 | B27: strcpy: &"pmfp"{\0,\x01} &"nl"{\0,p,p,\0} :=> &"nl"{\0,p,\0,\0} | C27: 0.0335704 | D27: 0.208818 | E27: 0.208818 | G27: of:=IF([.C27]=1;"";[.C27]) -> 0.0335704 | H27: of:=IF([.D27]=1;"";[.D27]) -> 0.208818 | I27: of:=IF([.E27]=1;"";[.E27]) -> 0.208818
A28: 27 | B28: strcpy: &"zyaa"{\0,\x01} &"tra"{\0,p,\0} :=> &"tra"{\0,\0,\0} | C28: 0.0385087 | D28: 0.0888414 | E28: 0.0888414 | G28: of:=IF([.C28]=1;"";[.C28]) -> 0.0385087 | H28: of:=IF([.D28]=1;"";[.D28]) -> 0.0888414 | I28: of:=IF([.E28]=1;"";[.E28]) -> 0.0888414
A29: 28 | B29: strcpy: &"ahql"{\0,\x01} &"mkei"{\0,\0} :=> &"mkei"{\0,\0} | C29: 0.02641 | D29: 0.0396028 | E29: 0.0396028 | G29: of:=IF([.C29]=1;"";[.C29]) -> 0.02641 | H29: of:=IF([.D29]=1;"";[.D29]) -> 0.0396028 | I29: of:=IF([.E29]=1;"";[.E29]) -> 0.0396028
A30: 29 | B30: strcpy: &"wosn"{\0,\x01} &"nsbit"{\0} :=> &"nsbit"{\0} | C30: 0.0452001 | D30: 0.0294261 | E30: 0.0294261 | G30: of:=IF([.C30]=1;"";[.C30]) -> 0.0452001 | H30: of:=IF([.D30]=1;"";[.D30]) -> 0.0294261 | I30: of:=IF([.E30]=1;"";[.E30]) -> 0.0294261
A31: 30 | B31: strcpy: &"haquw"{\0} &""{\0,p,i,d,q,\0} :=> &""{\0,a,q,u,w,\0} | C31: 0.0264962 | D31: 1 | E31: 1 | G31: of:=IF([.C31]=1;"";[.C31]) -> 0.0264962 | H31: of:=IF([.D31]=1;"";[.D31]) ->  | I31: of:=IF([.E31]=1;"";[.E31]) -> 
A32: 31 | B32: strcpy: &"bckhk"{\0} &"s"{\0,p,p,o,\0} :=> &"s"{\0,k,h,k,\0} | C32: 0.0237562 | D32: 1 | E32: 1 | G32: of:=IF([.C32]=1;"";[.C32]) -> 0.0237562 | H32: of:=IF([.D32]=1;"";[.D32]) ->  | I32: of:=IF([.E32]=1;"";[.E32]) -> 
A33: 32 | B33: strcpy: &"iieeo"{\0} &"cb"{\0,p,d,\0} :=> &"cb"{\0,e,o,\0} | C33: 0.0281349 | D33: 0.166477 | E33: 0.166477 | G33: of:=IF([.C33]=1;"";[.C33]) -> 0.0281349 | H33: of:=IF([.D33]=1;"";[.D33]) -> 0.166477 | I33: of:=IF([.E33]=1;"";[.E33]) -> 0.166477
A34: 33 | B34: strcpy: &"dfcku"{\0} &"lvs"{\0,p,\0} :=> &"lvs"{\0,u,\0} | C34: 0.0233716 | D34: 0.0737593 | E34: 0.0737593 | G34: of:=IF([.C34]=1;"";[.C34]) -> 0.0233716 | H34: of:=IF([.D34]=1;"";[.D34]) -> 0.0737593 | I34: of:=IF([.E34]=1;"";[.E34]) -> 0.0737593
A35: 34 | B35: strcpy: &"ifnmy"{\0} &"hwnj"{\0,\0} :=> &"hwnj"{\0,\0} | C35: 0.0255698 | D35: 0.0411275 | E35: 0.0411275 | G35: of:=IF([.C35]=1;"";[.C35]) -> 0.0255698 | H35: of:=IF([.D35]=1;"";[.D35]) -> 0.0411275 | I35: of:=IF([.E35]=1;"";[.E35]) -> 0.0411275
A36: 35 | B36: strcpy: &"kuanj"{\0} &"sfaie"{\0} :=> &"sfaie"{\0} | C36: 0.027482 | D36: 0.0291844 | E36: 0.0291844 | G36: of:=IF([.C36]=1;"";[.C36]) -> 0.027482 | H36: of:=IF([.D36]=1;"";[.D36]) -> 0.0291844 | I36: of:=IF([.E36]=1;"";[.E36]) -> 0.0291844
A37: 1 | B37: strncpy: &""{\0,\x01,\x01,\x01,\x01,\x01} &""{\0,p,m,h,b,\0} 5 :=> &""{\0,\0,\0,\0,\0,\0} | C37: 1 | D37: 1 | E37: 1 | G37: of:=IF([.C37]=1;"";[.C37]) ->  | H37: of:=IF([.D37]=1;"";[.D37]) ->  | I37: of:=IF([.E37]=1;"";[.E37]) ->  | K37: of:=AVERAGE([.G37:.G72]) -> 0.0899355666666667 | L37: of:=AVERAGE([.H37:.H72]) -> 0.0863562208333333 | M37: of:=AVERAGE([.I37:.I72]) -> 0.0863562208333333 | O37: of:=AVERAGE([.K37:.M37]) -> 0.0875493361111111
A38: 2 | B38: strncpy: &""{\0,\x01,\x01,\x01,\x01,\x01} &"a"{\0,p,c,k,\0} 5 :=> &"a"{\0,\0,\0,\0,\0} | C38: 1 | D38: 1 | E38: 1 | G38: of:=IF([.C38]=1;"";[.C38]) ->  | H38: of:=IF([.D38]=1;"";[.D38]) ->  | I38: of:=IF([.E38]=1;"";[.E38]) -> 
A39: 3 | B39: strncpy: &""{\0,\x01,\x01,\x01,\x01,\x01} &"ai"{\0,p,g,\0} 5 :=> &"ai"{\0,\0,\0,\0} | C39: 1 | D39: 0.219808 | E39: 0.219808 | G39: of:=IF([.C39]=1;"";[.C39]) ->  | H39: of:=IF([.D39]=1;"";[.D39]) -> 0.219808 | I39: of:=IF([.E39]=1;"";[.E39]) -> 0.219808
A40: 4 | B40: strncpy: &""{\0,\x01,\x01,\x01,\x01,\x01} &"qbu"{\0,p,\0} 5 :=> &"qbu"{\0,\0,\0} | C40: 1 | D40: 0.0600515 | E40: 0.0600515 | G40: of:=IF([.C40]=1;"";[.C40]) ->  | H40: of:=IF([.D40]=1;"";[.D40]) -> 0.0600515 | I40: of:=IF([.E40]=1;"";[.E40]) -> 0.0600515
A41: 5 | B41: strncpy: &""{\0,\x01,\x01,\x01,\x01,\x01} &"gxfl"{\0,\0} 5 :=> &"gxfl"{\0,\0} | C41: 1 | D41: 0.0303629 | E41: 0.0303629 | G41: of:=IF([.C41]=1;"";[.C41]) ->  | H41: of:=IF([.D41]=1;"";[.D41]) -> 0.0303629 | I41: of:=IF([.E41]=1;"";[.E41]) -> 0.0303629
A42: 6 | B42: strncpy: &""{\0,\x01,\x01,\x01,\x01,\x01} &"wgixu"{\0} 5 :=> &"wgixu"{\0} | C42: 1 | D42: 0.023341 | E42: 0.023341 | G42: of:=IF([.C42]=1;"";[.C42]) ->  | H42: of:=IF([.D42]=1;"";[.D42]) -> 0.023341 | I42: of:=IF([.E42]=1;"";[.E42]) -> 0.023341
A43: 7 | B43: strncpy: &"b"{\0,\x01,\x01,\x01,\x01} &""{\0,p,i,n,d,\0} 5 :=> &""{\0,\0,\0,\0,\0,\0} | C43: 1 | D43: 1 | E43: 1 | G43: of:=IF([.C43]=1;"";[.C43]) ->  | H43: of:=IF([.D43]=1;"";[.D43]) ->  | I43: of:=IF([.E43]=1;"";[.E43]) -> 
A44: 8 | B44: strncpy: &"n"{\0,\x01,\x01,\x01,\x01} &"a"{\0,p,e,o,\0} 5 :=> &"a"{\0,\0,\0,\0,\0} | C44: 1 | D44: 1 | E44: 1 | G44: of:=IF([.C44]=1;"";[.C44]) ->  | H44: of:=IF([.D44]=1;"";[.D44]) ->  | I44: of:=IF([.E44]=1;"";[.E44]) -> 
A45: 9 | B45: strncpy: &"x"{\0,\x01,\x01,\x01,\x01} &"ri"{\0,p,i,\0} 5 :=> &"ri"{\0,\0,\0,\0} | C45: 1 | D45: 0.221126 | E45: 0.221126 | G45: of:=IF([.C45]=1;"";[.C45]) ->  | H45: of:=IF([.D45]=1;"";[.D45]) -> 0.221126 | I45: of:=IF([.E45]=1;"";[.E45]) -> 0.221126
A46: 10 | B46: strncpy: &"v"{\0,\x01,\x01,\x01,\x01} &"frl"{\0,p,\0} 5 :=> &"frl"{\0,\0,\0} | C46: 1 | D46: 0.0848644 | E46: 0.0848644 | G46: of:=IF([.C46]=1;"";[.C46]) ->  | H46: of:=IF([.D46]=1;"";[.D46]) -> 0.0848644 | I46: of:=IF([.E46]=1;"";[.E46]) -> 0.0848644
A47: 11 | B47: strncpy: &"a"{\0,\x01,\x01,\x01,\x01} &"wlds"{\0,\0} 5 :=> &"wlds"{\0,\0} | C47: 1 | D47: 0.0444656 | E47: 0.0444656 | G47: of:=IF([.C47]=1;"";[.C47]) ->  | H47: of:=IF([.D47]=1;"";[.D47]) -> 0.0444656 | I47: of:=IF([.E47]=1;"";[.E47]) -> 0.0444656
A48: 12 | B48: strncpy: &"a"{\0,\x01,\x01,\x01,\x01} &"hetni"{\0} 5 :=> &"hetni"{\0} | C48: 1 | D48: 0.0303264 | E48: 0.0303264 | G48: of:=IF([.C48]=1;"";[.C48]) ->  | H48: of:=IF([.D48]=1;"";[.D48]) -> 0.0303264 | I48: of:=IF([.E48]=1;"";[.E48]) -> 0.0303264
A49: 13 | B49: strncpy: &"fa"{\0,\x01,\x01,\x01} &""{\0,p,a,p,o,\0} 5 :=> &""{\0,\0,\0,\0,\0,\0} | C49: 0.213806 | D49: 1 | E49: 1 | G49: of:=IF([.C49]=1;"";[.C49]) -> 0.213806 | H49: of:=IF([.D49]=1;"";[.D49]) ->  | I49: of:=IF([.E49]=1;"";[.E49]) -> 
A50: 14 | B50: strncpy: &"rt"{\0,\x01,\x01,\x01} &"q"{\0,p,o,p,\0} 5 :=> &"q"{\0,\0,\0,\0,\0} | C50: 0.218916 | D50: 1 | E50: 1 | G50: of:=IF([.C50]=1;"";[.C50]) -> 0.218916 | H50: of:=IF([.D50]=1;"";[.D50]) ->  | I50: of:=IF([.E50]=1;"";[.E50]) -> 
A51: 15 | B51: strncpy: &"un"{\0,\x01,\x01,\x01} &"js"{\0,p,p,\0} 5 :=> &"js"{\0,\0,\0,\0} | C51: 0.218466 | D51: 0.144251 | E51: 0.144251 | G51: of:=IF([.C51]=1;"";[.C51]) -> 0.218466 | H51: of:=IF([.D51]=1;"";[.D51]) -> 0.144251 | I51: of:=IF([.E51]=1;"";[.E51]) -> 0.144251
A52: 16 | B52: strncpy: &"ml"{\0,\x01,\x01,\x01} &"kij"{\0,p,\0} 5 :=> &"kij"{\0,\0,\0} | C52: 0.191943 | D52: 0.0775831 | E52: 0.0775831 | G52: of:=IF([.C52]=1;"";[.C52]) -> 0.191943 | H52: of:=IF([.D52]=1;"";[.D52]) -> 0.0775831 | I52: of:=IF([.E52]=1;"";[.E52]) -> 0.0775831
A53: 17 | B53: strncpy: &"cy"{\0,\x01,\x01,\x01} &"kiaf"{\0,\0} 5 :=> &"kiaf"{\0,\0} | C53: 0.207934 | D53: 0.0458231 | E53: 0.0458231 | G53: of:=IF([.C53]=1;"";[.C53]) -> 0.207934 | H53: of:=IF([.D53]=1;"";[.D53]) -> 0.0458231 | I53: of:=IF([.E53]=1;"";[.E53]) -> 0.0458231
A54: 18 | B54: strncpy: &"aj"{\0,\x01,\x01,\x01} &"brjln"{\0} 5 :=> &"brjln"{\0} | C54: 0.203053 | D54: 0.0202312 | E54: 0.0202312 | G54: of:=IF([.C54]=1;"";[.C54]) -> 0.203053 | H54: of:=IF([.D54]=1;"";[.D54]) -> 0.0202312 | I54: of:=IF([.E54]=1;"";[.E54]) -> 0.0202312
A55: 19 | B55: strncpy: &"hds"{\0,\x01,\x01} &""{\0,p,l,c,t,\0} 5 :=> &""{\0,\0,\0,\0,\0,\0} | C55: 0.0788938 | D55: 1 | E55: 1 | G55: of:=IF([.C55]=1;"";[.C55]) -> 0.0788938 | H55: of:=IF([.D55]=1;"";[.D55]) ->  | I55: of:=IF([.E55]=1;"";[.E55]) -> 
A56: 20 | B56: strncpy: &"lmp"{\0,\x01,\x01} &"j"{\0,p,g,u,\0} 5 :=> &"j"{\0,\0,\0,\0,\0} | C56: 0.0834551 | D56: 1 | E56: 1 | G56: of:=IF([.C56]=1;"";[.C56]) -> 0.0834551 | H56: of:=IF([.D56]=1;"";[.D56]) ->  | I56: of:=IF([.E56]=1;"";[.E56]) -> 
A57: 21 | B57: strncpy: &"enp"{\0,\x01,\x01} &"gs"{\0,p,n,\0} 5 :=> &"gs"{\0,\0,\0,\0} | C57: 0.0822578 | D57: 0.209845 | E57: 0.209845 | G57: of:=IF([.C57]=1;"";[.C57]) -> 0.0822578 | H57: of:=IF([.D57]=1;"";[.D57]) -> 0.209845 | I57: of:=IF([.E57]=1;"";[.E57]) -> 0.209845
A58: 22 | B58: strncpy: &"rgp"{\0,\x01,\x01} &"dsi"{\0,p,\0} 5 :=> &"dsi"{\0,\0,\0} | C58: 0.0728965 | D58: 0.0866088 | E58: 0.0866088 | G58: of:=IF([.C58]=1;"";[.C58]) -> 0.0728965 | H58: of:=IF([.D58]=1;"";[.D58]) -> 0.0866088 | I58: of:=IF([.E58]=1;"";[.E58]) -> 0.0866088
A59: 23 | B59: strncpy: &"gec"{\0,\x01,\x01} &"vogy"{\0,\0} 5 :=> &"vogy"{\0,\0} | C59: 0.0882791 | D59: 0.0434276 | E59: 0.0434276 | G59: of:=IF([.C59]=1;"";[.C59]) -> 0.0882791 | H59: of:=IF([.D59]=1;"";[.D59]) -> 0.0434276 | I59: of:=IF([.E59]=1;"";[.E59]) -> 0.0434276
A60: 24 | B60: strncpy: &"ask"{\0,\x01,\x01} &"znjio"{\0} 5 :=> &"znjio"{\0} | C60: 0.0859825 | D60: 0.023958 | E60: 0.023958 | G60: of:=IF([.C60]=1;"";[.C60]) -> 0.0859825 | H60: of:=IF([.D60]=1;"";[.D60]) -> 0.023958 | I60: of:=IF([.E60]=1;"";[.E60]) -> 0.023958
A61: 25 | B61: strncpy: &"ndem"{\0,\x01} &""{\0,p,f,t,j,\0} 5 :=> &""{\0,\0,\0,\0,\0,\0} | C61: 0.0488747 | D61: 1 | E61: 1 | G61: of:=IF([.C61]=1;"";[.C61]) -> 0.0488747 | H61: of:=IF([.D61]=1;"";[.D61]) ->  | I61: of:=IF([.E61]=1;"";[.E61]) -> 
A62: 26 | B62: strncpy: &"clov"{\0,\x01} &"j"{\0,p,p,l,\0} 5 :=> &"j"{\0,\0,\0,\0,\0} | C62: 0.0465847 | D62: 1 | E62: 1 | G62: of:=IF([.C62]=1;"";[.C62]) -> 0.0465847 | H62: of:=IF([.D62]=1;"";[.D62]) ->  | I62: of:=IF([.E62]=1;"";[.E62]) -> 
A63: 27 | B63: strncpy: &"xhul"{\0,\x01} &"kl"{\0,p,r,\0} 5 :=> &"kl"{\0,\0,\0,\0} | C63: 0.0429581 | D63: 0.204113 | E63: 0.204113 | G63: of:=IF([.C63]=1;"";[.C63]) -> 0.0429581 | H63: of:=IF([.D63]=1;"";[.D63]) -> 0.204113 | I63: of:=IF([.E63]=1;"";[.E63]) -> 0.204113
A64: 28 | B64: strncpy: &"dviw"{\0,\x01} &"faa"{\0,p,\0} 5 :=> &"faa"{\0,\0,\0} | C64: 0.0413541 | D64: 0.0780867 | E64: 0.0780867 | G64: of:=IF([.C64]=1;"";[.C64]) -> 0.0413541 | H64: of:=IF([.D64]=1;"";[.D64]) -> 0.0780867 | I64: of:=IF([.E64]=1;"";[.E64]) -> 0.0780867
A65: 29 | B65: strncpy: &"gnan"{\0,\x01} &"vlsw"{\0,\0} 5 :=> &"vlsw"{\0,\0} | C65: 0.0475035 | D65: 0.0390626 | E65: 0.0390626 | G65: of:=IF([.C65]=1;"";[.C65]) -> 0.0475035 | H65: of:=IF([.D65]=1;"";[.D65]) -> 0.0390626 | I65: of:=IF([.E65]=1;"";[.E65]) -> 0.0390626
A66: 30 | B66: strncpy: &"ixvs"{\0,\x01} &"uexow"{\0} 5 :=> &"uexow"{\0} | C66: 0.0349845 | D66: 0.0282192 | E66: 0.0282192 | G66: of:=IF([.C66]=1;"";[.C66]) -> 0.0349845 | H66: of:=IF([.D66]=1;"";[.D66]) -> 0.0282192 | I66: of:=IF([.E66]=1;"";[.E66]) -> 0.0282192
A67: 31 | B67: strncpy: &"zsniy"{\0} &""{\0,p,m,p,g,\0} 5 :=> &""{\0,\0,\0,\0,\0,\0} | C67: 0.024046 | D67: 1 | E67: 1 | G67: of:=IF([.C67]=1;"";[.C67]) -> 0.024046 | H67: of:=IF([.D67]=1;"";[.D67]) ->  | I67: of:=IF([.E67]=1;"";[.E67]) -> 
A68: 32 | B68: strncpy: &"fboec"{\0} &"p"{\0,p,o,t,\0} 5 :=> &"p"{\0,\0,\0,\0,\0} | C68: 0.0257948 | D68: 1 | E68: 1 | G68: of:=IF([.C68]=1;"";[.C68]) -> 0.0257948 | H68: of:=IF([.D68]=1;"";[.D68]) ->  | I68: of:=IF([.E68]=1;"";[.E68]) -> 
A69: 33 | B69: strncpy: &"saneo"{\0} &"wl"{\0,p,g,\0} 5 :=> &"wl"{\0,\0,\0,\0} | C69: 0.0311499 | D69: 0.202034 | E69: 0.202034 | G69: of:=IF([.C69]=1;"";[.C69]) -> 0.0311499 | H69: of:=IF([.D69]=1;"";[.D69]) -> 0.202034 | I69: of:=IF([.E69]=1;"";[.E69]) -> 0.202034
A70: 34 | B70: strncpy: &"tmljl"{\0} &"ehi"{\0,p,\0} 5 :=> &"ehi"{\0,\0,\0} | C70: 0.0190235 | D70: 0.0839906 | E70: 0.0839906 | G70: of:=IF([.C70]=1;"";[.C70]) -> 0.0190235 | H70: of:=IF([.D70]=1;"";[.D70]) -> 0.0839906 | I70: of:=IF([.E70]=1;"";[.E70]) -> 0.0839906
A71: 35 | B71: strncpy: &"zfaqu"{\0} &"cdif"{\0,\0} 5 :=> &"cdif"{\0,\0} | C71: 0.0226865 | D71: 0.0416288 | E71: 0.0416288 | G71: of:=IF([.C71]=1;"";[.C71]) -> 0.0226865 | H71: of:=IF([.D71]=1;"";[.D71]) -> 0.0416288 | I71: of:=IF([.E71]=1;"";[.E71]) -> 0.0416288
A72: 36 | B72: strncpy: &"nibii"{\0} &"qupue"{\0} 5 :=> &"qupue"{\0} | C72: 0.0276105 | D72: 0.0293408 | E72: 0.0293408 | G72: of:=IF([.C72]=1;"";[.C72]) -> 0.0276105 | H72: of:=IF([.D72]=1;"";[.D72]) -> 0.0293408 | I72: of:=IF([.E72]=1;"";[.E72]) -> 0.0293408

Sheet: strcat
A1: # | B1: Test Case | C1: N1 | D1: N2 | E1: N3
A2: 1 | B2: strcat: &""{\0,\x01,\x01,\x01,\x01,\x01,\x01,\x01,\x01,\x01} &"z"{\0,p,a,\0} :=> &"z"{\0,p,h,q,u,j,o,x,\0} | C2: 1 | D2: 1 | E2: 1 | G2: of:=IF([.C2]=1;"";[.C2]) ->  | H2: of:=IF([.D2]=1;"";[.D2]) ->  | I2: of:=IF([.E2]=1;"";[.E2]) ->  | K2: of:=AVERAGE([.G2:.G41]) -> 0.0622687648387097 | L2: of:=AVERAGE([.H2:.H41]) -> 0.108728416363636 | M2: of:=AVERAGE([.I2:.I41]) -> 0.0406824908108108 | O2: of:=AVERAGE([.K2:.M2]) -> 0.0705598906710523
A3: 2 | B3: strcat: &""{\0,\x01,\x01,\x01,\x01,\x01,\x01,\x01,\x01,\x01} &"dq"{\0,p,\0} :=> &"dq"{\0,p,u,k,l,l,e,\0} | C3: 1 | D3: 0.189362 | E3: 0.189362 | G3: of:=IF([.C3]=1;"";[.C3]) ->  | H3: of:=IF([.D3]=1;"";[.D3]) -> 0.189362 | I3: of:=IF([.E3]=1;"";[.E3]) -> 0.189362
A4: 3 | B4: strcat: &""{\0,\x01,\x01,\x01,\x01,\x01,\x01,\x01,\x01,\x01} &"oww"{\0,\0} :=> &"oww"{\0,p,i,x,b,l,\0} | C4: 1 | D4: 0.0659792 | E4: 0.0659792 | G4: of:=IF([.C4]=1;"";[.C4]) ->  | H4: of:=IF([.D4]=1;"";[.D4]) -> 0.0659792 | I4: of:=IF([.E4]=1;"";[.E4]) -> 0.0659792
A5: 4 | B5: strcat: &""{\0,\x01,\x01,\x01,\x01,\x01,\x01,\x01,\x01,\x01} &"gnvo"{\0} :=> &"gnvo"{\0,p,a,k,d,\0} | C5: 1 | D5: 0.0441768 | E5: 0.0441768 | H5: of:=IF([.D5]=1;"";[.D5]) -> 0.0441768 | I5: of:=IF([.E5]=1;"";[.E5]) -> 0.0441768
A6: 5 | B6: strcat: &"m"{\0,\x01,\x01,\x01,\x01,\x01,\x01,\x01,\x01} &""{\0,p,r,y,\0} :=> &"m"{\0,p,s,w,a,w,n,f,\0} | C6: 1 | D6: 1 | E6: 1 | G6: of:=IF([.C6]=1;"";[.C6]) ->  | H6: of:=IF([.D6]=1;"";[.D6]) ->  | I6: of:=IF([.E6]=1;"";[.E6]) -> 
A7: 6 | B7: strcat: &"o"{\0,\x01,\x01,\x01,\x01,\x01,\x01,\x01,\x01} &"c"{\0,p,r,\0} :=> &"oc"{\0,p,l,u,c,i,b,\0} | C7: 1 | D7: 1 | E7: 0.214286 | G7: of:=IF([.C7]=1;"";[.C7]) ->  | H7: of:=IF([.D7]=1;"";[.D7]) ->  | I7: of:=IF([.E7]=1;"";[.E7]) -> 0.214286
A8: 7 | B8: strcat: &"s"{\0,\x01,\x01,\x01,\x01,\x01,\x01,\x01,\x01} &"qu"{\0,p,\0} :=> &"squ"{\0,p,e,k,s,u,\0} | C8: 1 | D8: 0.212836 | E8: 0.0795568 | G8: of:=IF([.C8]=1;"";[.C8]) ->  | H8: of:=IF([.D8]=1;"";[.D8]) -> 0.212836 | I8: of:=IF([.E8]=1;"";[.E8]) -> 0.0795568
A9: 8 | B9: strcat: &"d"{\0,\x01,\x01,\x01,\x01,\x01,\x01,\x01,\x01} &"jij"{\0,\0} :=> &"djij"{\0,p,w,c,k,\0} | C9: 1 | D9: 0.0713569 | E9: 0.0371436 | G9: of:=IF([.C9]=1;"";[.C9]) ->  | H9: of:=IF([.D9]=1;"";[.D9]) -> 0.0713569 | I9: of:=IF([.E9]=1;"";[.E9]) -> 0.0371436
A10: 9 | B10: strcat: &"j"{\0,\x01,\x01,\x01,\x01,\x01,\x01,\x01,\x01} &"sosa"{\0} :=> &"jsosa"{\0,p,c,v,\0} | C10: 1 | D10: 0.0475294 | E10: 0.0242921 | G10: of:=IF([.C10]=1;"";[.C10]) ->  | H10: of:=IF([.D10]=1;"";[.D10]) -> 0.0475294 | I10: of:=IF([.E10]=1;"";[.E10]) -> 0.0242921
A11: 10 | B11: strcat: &"pp"{\0,\x01,\x01,\x01,\x01,\x01,\x01,\x01} &""{\0,p,a,h,\0} :=> &"pp"{\0,p,l,d,c,d,y,\0} | C11: 0.213806 | D11: 1 | E11: 0.213806 | G11: of:=IF([.C11]=1;"";[.C11]) -> 0.213806 | H11: of:=IF([.D11]=1;"";[.D11]) ->  | I11: of:=IF([.E11]=1;"";[.E11]) -> 0.213806
A12: 11 | B12: strcat: &"gm"{\0,\x01,\x01,\x01,\x01,\x01,\x01,\x01} &"k"{\0,p,y,\0} :=> &"gmk"{\0,p,i,q,t,e,\0} | C12: 0.19487 | D12: 1 | E12: 0.065079 | G12: of:=IF([.C12]=1;"";[.C12]) -> 0.19487 | H12: of:=IF([.D12]=1;"";[.D12]) ->  | I12: of:=IF([.E12]=1;"";[.E12]) -> 0.065079
A13: 12 | B13: strcat: &"pu"{\0,\x01,\x01,\x01,\x01,\x01,\x01,\x01} &"sn"{\0,p,\0} :=> &"pusn"{\0,p,e,d,n,\0} | C13: 0.212836 | D13: 0.203891 | E13: 0.0449165 | G13: of:=IF([.C13]=1;"";[.C13]) -> 0.212836 | H13: of:=IF([.D13]=1;"";[.D13]) -> 0.203891 | I13: of:=IF([.E13]=1;"";[.E13]) -> 0.0449165
A14: 13 | B14: strcat: &"ax"{\0,\x01,\x01,\x01,\x01,\x01,\x01,\x01} &"ojp"{\0,\0} :=> &"axojp"{\0,p,g,n,\0} | C14: 0.206399 | D14: 0.0545561 | E14: 0.0198944 | G14: of:=IF([.C14]=1;"";[.C14]) -> 0.206399 | H14: of:=IF([.D14]=1;"";[.D14]) -> 0.0545561 | I14: of:=IF([.E14]=1;"";[.E14]) -> 0.0198944
A15: 14 | B15: strcat: &"pi"{\0,\x01,\x01,\x01,\x01,\x01,\x01,\x01} &"onbu"{\0} :=> &"pionbu"{\0,p,g,\0} | C15: 0.213322 | D15: 0.0452931 | E15: 0.0213237 | G15: of:=IF([.C15]=1;"";[.C15]) -> 0.213322 | H15: of:=IF([.D15]=1;"";[.D15]) -> 0.0452931 | I15: of:=IF([.E15]=1;"";[.E15]) -> 0.0213237
A16: 15 | B16: strcat: &"gay"{\0,\x01,\x01,\x01,\x01,\x01,\x01} &""{\0,p,t,a,\0} :=> &"gay"{\0,p,e,l,m,v,\0} | C16: 0.0865204 | D16: 1 | E16: 0.0865204 | G16: of:=IF([.C16]=1;"";[.C16]) -> 0.0865204 | H16: of:=IF([.D16]=1;"";[.D16]) ->  | I16: of:=IF([.E16]=1;"";[.E16]) -> 0.0865204
A17: 16 | B17: strcat: &"swy"{\0,\x01,\x01,\x01,\x01,\x01,\x01} &"w"{\0,p,f,\0} :=> &"swyw"{\0,p,l,o,k,\0} | C17: 0.0771527 | D17: 1 | E17: 0.0400677 | G17: of:=IF([.C17]=1;"";[.C17]) -> 0.0771527 | H17: of:=IF([.D17]=1;"";[.D17]) ->  | I17: of:=IF([.E17]=1;"";[.E17]) -> 0.0400677
A18: 17 | B18: strcat: &"cof"{\0,\x01,\x01,\x01,\x01,\x01,\x01} &"kn"{\0,p,\0} :=> &"cofkn"{\0,p,f,g,\0} | C18: 0.0899771 | D18: 0.20725 | E18: 0.0272305 | G18: of:=IF([.C18]=1;"";[.C18]) -> 0.0899771 | H18: of:=IF([.D18]=1;"";[.D18]) -> 0.20725 | I18: of:=IF([.E18]=1;"";[.E18]) -> 0.0272305
A19: 18 | B19: strcat: &"qva"{\0,\x01,\x01,\x01,\x01,\x01,\x01} &"vya"{\0,\0} :=> &"qvavya"{\0,p,p,\0} | C19: 0.0585001 | D19: 0.0765746 | E19: 0.015828 | G19: of:=IF([.C19]=1;"";[.C19]) -> 0.0585001 | H19: of:=IF([.D19]=1;"";[.D19]) -> 0.0765746 | I19: of:=IF([.E19]=1;"";[.E19]) -> 0.015828
A20: 19 | B20: strcat: &"yon"{\0,\x01,\x01,\x01,\x01,\x01,\x01} &"xpso"{\0} :=> &"yonxpso"{\0,p,\0} | C20: 0.087432 | D20: 0.0450969 | E20: 0.015792 | G20: of:=IF([.C20]=1;"";[.C20]) -> 0.087432 | H20: of:=IF([.D20]=1;"";[.D20]) -> 0.0450969 | I20: of:=IF([.E20]=1;"";[.E20]) -> 0.015792
A21: 20 | B21: strcat: &"gnyu"{\0,\x01,\x01,\x01,\x01,\x01} &""{\0,p,s,j,\0} :=> &"gnyu"{\0,p,l,i,l,\0} | C21: 0.0414346 | D21: 1 | E21: 0.0414346 | G21: of:=IF([.C21]=1;"";[.C21]) -> 0.0414346 | H21: of:=IF([.D21]=1;"";[.D21]) ->  | I21: of:=IF([.E21]=1;"";[.E21]) -> 0.0414346
A22: 21 | B22: strcat: &"mtpk"{\0,\x01,\x01,\x01,\x01,\x01} &"d"{\0,p,e,\0} :=> &"mtpkd"{\0,p,a,x,\0} | C22: 0.0350305 | D22: 1 | E22: 0.0217599 | G22: of:=IF([.C22]=1;"";[.C22]) -> 0.0350305 | H22: of:=IF([.D22]=1;"";[.D22]) ->  | I22: of:=IF([.E22]=1;"";[.E22]) -> 0.0217599
A23: 22 | B23: strcat: &"kbea"{\0,\x01,\x01,\x01,\x01,\x01} &"uq"{\0,p,\0} :=> &"kbeauq"{\0,p,t,\0} | C23: 0.0439225 | D23: 0.181229 | E23: 0.0188859 | G23: of:=IF([.C23]=1;"";[.C23]) -> 0.0439225 | H23: of:=IF([.D23]=1;"";[.D23]) -> 0.181229 | I23: of:=IF([.E23]=1;"";[.E23]) -> 0.0188859
A24: 23 | B24: strcat: &"dnbr"{\0,\x01,\x01,\x01,\x01,\x01} &"wdc"{\0,\0} :=> &"dnbrwdc"{\0,p,\0} | C24: 0.0419561 | D24: 0.073594 | E24: 0.0139092 | G24: of:=IF([.C24]=1;"";[.C24]) -> 0.0419561 | H24: of:=IF([.D24]=1;"";[.D24]) -> 0.073594 | I24: of:=IF([.E24]=1;"";[.E24]) -> 0.0139092
A25: 24 | B25: strcat: &"licp"{\0,\x01,\x01,\x01,\x01,\x01} &"oajd"{\0} :=> &"licpoajd"{\0,\0} | C25: 0.0400232 | D25: 0.0362047 | E25: 0.0107656 | G25: of:=IF([.C25]=1;"";[.C25]) -> 0.0400232 | H25: of:=IF([.D25]=1;"";[.D25]) -> 0.0362047 | I25: of:=IF([.E25]=1;"";[.E25]) -> 0.0107656
A26: 25 | B26: strcat: &"qajui"{\0,\x01,\x01,\x01,\x01} &""{\0,p,o,c,\0} :=> &"qajui"{\0,p,p,s,\0} | C26: 0.0236045 | D26: 1 | E26: 0.0236045 | G26: of:=IF([.C26]=1;"";[.C26]) -> 0.0236045 | H26: of:=IF([.D26]=1;"";[.D26]) ->  | I26: of:=IF([.E26]=1;"";[.E26]) -> 0.0236045
A27: 26 | B27: strcat: &"jslim"{\0,\x01,\x01,\x01,\x01} &"b"{\0,p,e,\0} :=> &"jslimb"{\0,p,j,\0} | C27: 0.0239636 | D27: 1 | E27: 0.0175843 | G27: of:=IF([.C27]=1;"";[.C27]) -> 0.0239636 | H27: of:=IF([.D27]=1;"";[.D27]) ->  | I27: of:=IF([.E27]=1;"";[.E27]) -> 0.0175843
A28: 27 | B28: strcat: &"ddphe"{\0,\x01,\x01,\x01,\x01} &"pa"{\0,p,\0} :=> &"ddphepa"{\0,p,\0} | C28: 0.0273096 | D28: 0.218014 | E28: 0.0156067 | G28: of:=IF([.C28]=1;"";[.C28]) -> 0.0273096 | H28: of:=IF([.D28]=1;"";[.D28]) -> 0.218014 | I28: of:=IF([.E28]=1;"";[.E28]) -> 0.0156067
A29: 28 | B29: strcat: &"duikf"{\0,\x01,\x01,\x01,\x01} &"atl"{\0,\0} :=> &"duikfatl"{\0,\0} | C29: 0.0269941 | D29: 0.0874671 | E29: 0.0127297 | G29: of:=IF([.C29]=1;"";[.C29]) -> 0.0269941 | H29: of:=IF([.D29]=1;"";[.D29]) -> 0.0874671 | I29: of:=IF([.E29]=1;"";[.E29]) -> 0.0127297
A30: 29 | B30: strcat: &"lcqav"{\0,\x01,\x01,\x01,\x01} &"kree"{\0} :=> &"lcqavkree"{\0} | C30: 0.0227907 | D30: 0.0455791 | E30: 0.00851865 | G30: of:=IF([.C30]=1;"";[.C30]) -> 0.0227907 | H30: of:=IF([.D30]=1;"";[.D30]) -> 0.0455791 | I30: of:=IF([.E30]=1;"";[.E30]) -> 0.00851865
A31: 30 | B31: strcat: &"ylugwn"{\0,\x01,\x01,\x01} &""{\0,p,l,p,\0} :=> &"ylugwn"{\0,p,g,\0} | C31: 0.0189384 | D31: 1 | E31: 0.0189384 | G31: of:=IF([.C31]=1;"";[.C31]) -> 0.0189384 | H31: of:=IF([.D31]=1;"";[.D31]) ->  | I31: of:=IF([.E31]=1;"";[.E31]) -> 0.0189384
A32: 31 | B32: strcat: &"dmvkfu"{\0,\x01,\x01,\x01} &"t"{\0,p,r,\0} :=> &"dmvkfut"{\0,p,\0} | C32: 0.0147349 | D32: 1 | E32: 0.0120071 | G32: of:=IF([.C32]=1;"";[.C32]) -> 0.0147349 | H32: of:=IF([.D32]=1;"";[.D32]) ->  | I32: of:=IF([.E32]=1;"";[.E32]) -> 0.0120071
A33: 32 | B33: strcat: &"nhhinb"{\0,\x01,\x01,\x01} &"va"{\0,p,\0} :=> &"nhhinbva"{\0,\0} | C33: 0.0193658 | D33: 0.212346 | E33: 0.0118233 | G33: of:=IF([.C33]=1;"";[.C33]) -> 0.0193658 | H33: of:=IF([.D33]=1;"";[.D33]) -> 0.212346 | I33: of:=IF([.E33]=1;"";[.E33]) -> 0.0118233
A34: 33 | B34: strcat: &"cewuvm"{\0,\x01,\x01,\x01} &"vod"{\0,\0} :=> &"cewuvmvod"{\0} | C34: 0.0151948 | D34: 0.0839313 | E34: 0.00810171 | G34: of:=IF([.C34]=1;"";[.C34]) -> 0.0151948 | H34: of:=IF([.D34]=1;"";[.D34]) -> 0.0839313 | I34: of:=IF([.E34]=1;"";[.E34]) -> 0.00810171
A35: 34 | B35: strcat: &"oushmj"{\0,\x01,\x01,\x01} &&10 :=> &"oushmjokce"{} | C35: 0.0185054 | D35: 0.00829296 | G35: of:=IF([.C35]=1;"";[.C35]) -> 0.0185054 | H35: of:=IF([.D35]=1;"";[.D35]) -> 0.00829296 | I35: of:=IF([.E35]=1;"";[.E35]) ->  
A36: 35 | B36: strcat: &"fvtbdwo"{\0,\x01,\x01} &""{\0,p,p,t,\0} :=> &"fvtbdwo"{\0,p,\0} | C36: 0.0115014 | D36: 1 | E36: 0.0115014 | G36: of:=IF([.C36]=1;"";[.C36]) -> 0.0115014 | H36: of:=IF([.D36]=1;"";[.D36]) ->  | I36: of:=IF([.E36]=1;"";[.E36]) -> 0.0115014
A37: 36 | B37: strcat: &"gggshtr"{\0,\x01,\x01} &"o"{\0,p,o,\0} :=> &"gggshtro"{\0,\0} | C37: 0.0160035 | D37: 1 | E37: 0.0132431 | G37: of:=IF([.C37]=1;"";[.C37]) -> 0.0160035 | H37: of:=IF([.D37]=1;"";[.D37]) ->  | I37: of:=IF([.E37]=1;"";[.E37]) -> 0.0132431
A38: 37 | B38: strcat: &"ucaweag"{\0,\x01,\x01} &"cd"{\0,p,\0} :=> &"ucaweagcd"{\0} | C38: 0.016938 | D38: 0.181465 | E38: 0.00984129 | G38: of:=IF([.C38]=1;"";[.C38]) -> 0.016938 | H38: of:=IF([.D38]=1;"";[.D38]) -> 0.181465 | I38: of:=IF([.E38]=1;"";[.E38]) -> 0.00984129
A39: 38 | B39: strcat: &"lqbwhsob"{\0,\x01} &""{\0,p,i,u,\0} :=> &"lqbwhsob"{\0,\0} | C39: 0.00937401 | D39: 1 | E39: 0.00937401 | G39: of:=IF([.C39]=1;"";[.C39]) -> 0.00937401 | H39: of:=IF([.D39]=1;"";[.D39]) ->  | I39: of:=IF([.E39]=1;"";[.E39]) -> 0.00937401
A40: 39 | B40: strcat: &"bikavsdh"{\0,\x01} &"i"{\0,p,v,\0} :=> &"bikavsdhi"{\0} | C40: 0.0116189 | D40: 1 | E40: 0.0100562 | G40: of:=IF([.C40]=1;"";[.C40]) -> 0.0116189 | H40: of:=IF([.D40]=1;"";[.D40]) ->  | I40: of:=IF([.E40]=1;"";[.E40]) -> 0.0100562
A41: 40 | B41: strcat: &"gajibaiho"{\0} &""{\0,p,t,t,\0} :=> &"gajibaiho"{\0} | C41: 0.0103119 | D41: 1 | E41: 0.0103119 | G41: of:=IF([.C41]=1;"";[.C41]) -> 0.0103119 | H41: of:=IF([.D41]=1;"";[.D41]) ->  | I41: of:=IF([.E41]=1;"";[.E41]) -> 0.0103119
A42: 1 | B42: strncat: &""{\0,\x01,\x01,\x01,\x01,\x01,\x01,\x01,\x01,\x01} &""{\0,p,m,b,\0} 4 :=> &""{\0,p,h,v,r,i,b,a,u,\0} | C42: 1 | D42: 1 | E42: 1 | G42: of:=IF([.C42]=1;"";[.C42]) ->  | H42: of:=IF([.D42]=1;"";[.D42]) ->  | I42: of:=IF([.E42]=1;"";[.E42]) ->  | K42: of:=AVERAGE([.G42:.G82]) -> 0.0626536348387097 | L42: of:=AVERAGE([.H42:.H82]) -> 0.110068625454545 | M42: of:=AVERAGE([.I42:.I82]) -> 0.041217544054054 | O42: of:=AVERAGE([.K42:.M42]) -> 0.0713132681157697
A43: 2 | B43: strncat: &""{\0,\x01,\x01,\x01,\x01,\x01,\x01,\x01,\x01,\x01} &"r"{\0,p,g,\0} 4 :=> &"r"{\0,p,g,i,u,x,y,n,\0} | C43: 1 | D43: 1 | E43: 1 | G43: of:=IF([.C43]=1;"";[.C43]) ->  | H43: of:=IF([.D43]=1;"";[.D43]) ->  | I43: of:=IF([.E43]=1;"";[.E43]) -> 
A44: 3 | B44: strncat: &""{\0,\x01,\x01,\x01,\x01,\x01,\x01,\x01,\x01,\x01} &"un"{\0,p,\0} 4 :=> &"un"{\0,p,i,n,b,a,v,\0} | C44: 1 | D44: 0.218466 | E44: 0.218466 | G44: of:=IF([.C44]=1;"";[.C44]) ->  | H44: of:=IF([.D44]=1;"";[.D44]) -> 0.218466 | I44: of:=IF([.E44]=1;"";[.E44]) -> 0.218466
A45: 4 | B45: strncat: &""{\0,\x01,\x01,\x01,\x01,\x01,\x01,\x01,\x01,\x01} &"mwr"{\0,\0} 4 :=> &"mwr"{\0,p,c,c,i,g,\0} | C45: 1 | D45: 0.0697275 | E45: 0.0697275 | G45: of:=IF([.C45]=1;"";[.C45]) ->  | H45: of:=IF([.D45]=1;"";[.D45]) -> 0.0697275 | I45: of:=IF([.E45]=1;"";[.E45]) -> 0.0697275
A46: 5 | B46: strncat: &""{\0,\x01,\x01,\x01,\x01,\x01,\x01,\x01,\x01,\x01} &"kwnj"{\0} 4 :=> &"kwnj"{\0,p,d,e,n,\0} | C46: 1 | D46: 0.0402117 | E46: 0.0402117 | G46: of:=IF([.C46]=1;"";[.C46]) ->  | H46: of:=IF([.D46]=1;"";[.D46]) -> 0.0402117 | I46: of:=IF([.E46]=1;"";[.E46]) -> 0.0402117
A47: 6 | B47: strncat: &"z"{\0,\x01,\x01,\x01,\x01,\x01,\x01,\x01,\x01} &""{\0,p,t,f,\0} 4 :=> &"z"{\0,p,s,e,g,n,u,n,\0} | C47: 1 | D47: 1 | E47: 1 | G47: of:=IF([.C47]=1;"";[.C47]) ->  | H47: of:=IF([.D47]=1;"";[.D47]) ->  | I47: of:=IF([.E47]=1;"";[.E47]) -> 
A48: 7 | B48: strncat: &"f"{\0,\x01,\x01,\x01,\x01,\x01,\x01,\x01,\x01} &"m"{\0,p,o,\0} 4 :=> &"fm"{\0,p,s,i,r,f,s,\0} | C48: 1 | D48: 1 | E48: 0.185355 | G48: of:=IF([.C48]=1;"";[.C48]) ->  | H48: of:=IF([.D48]=1;"";[.D48]) ->  | I48: of:=IF([.E48]=1;"";[.E48]) -> 0.185355
A49: 8 | B49: strncat: &"a"{\0,\x01,\x01,\x01,\x01,\x01,\x01,\x01,\x01} &"po"{\0,p,\0} 4 :=> &"apo"{\0,p,o,y,c,a,\0} | C49: 1 | D49: 0.218014 | E49: 0.0865204 | G49: of:=IF([.C49]=1;"";[.C49]) ->  | H49: of:=IF([.D49]=1;"";[.D49]) -> 0.218014 | I49: of:=IF([.E49]=1;"";[.E49]) -> 0.0865204
A50: 9 | B50: strncat: &"m"{\0,\x01,\x01,\x01,\x01,\x01,\x01,\x01,\x01} &"psb"{\0,\0} 4 :=> &"mpsb"{\0,p,g,p,g,\0} | C50: 1 | D50: 0.0791444 | E50: 0.0436304 | G50: of:=IF([.C50]=1;"";[.C50]) ->  | H50: of:=IF([.D50]=1;"";[.D50]) -> 0.0791444 | I50: of:=IF([.E50]=1;"";[.E50]) -> 0.0436304
A51: 10 | B51: strncat: &"z"{\0,\x01,\x01,\x01,\x01,\x01,\x01,\x01,\x01} &"pcys"{\0} 4 :=> &"zpcys"{\0,p,r,y,\0} | C51: 1 | D51: 0.0399562 | E51: 0.0233767 | G51: of:=IF([.C51]=1;"";[.C51]) ->  | H51: of:=IF([.D51]=1;"";[.D51]) -> 0.0399562 | I51: of:=IF([.E51]=1;"";[.E51]) -> 0.0233767
A52: 11 | B52: strncat: &"lw"{\0,\x01,\x01,\x01,\x01,\x01,\x01,\x01} &""{\0,p,r,s,\0} 4 :=> &"lw"{\0,p,o,m,p,f,u,\0} | C52: 0.199947 | D52: 1 | E52: 0.199947 | G52: of:=IF([.C52]=1;"";[.C52]) -> 0.199947 | H52: of:=IF([.D52]=1;"";[.D52]) ->  | I52: of:=IF([.E52]=1;"";[.E52]) -> 0.199947
A53: 12 | B53: strncat: &"zl"{\0,\x01,\x01,\x01,\x01,\x01,\x01,\x01} &"r"{\0,p,r,\0} 4 :=> &"zlr"{\0,p,a,q,i,c,\0} | C53: 0.190189 | D53: 1 | E53: 0.0731961 | G53: of:=IF([.C53]=1;"";[.C53]) -> 0.190189 | H53: of:=IF([.D53]=1;"";[.D53]) ->  | I53: of:=IF([.E53]=1;"";[.E53]) -> 0.0731961
A54: 13 | B54: strncat: &"xu"{\0,\x01,\x01,\x01,\x01,\x01,\x01,\x01} &"cy"{\0,p,\0} 4 :=> &"xucy"{\0,p,g,d,s,\0} | C54: 0.196751 | D54: 0.207934 | E54: 0.0425795 | G54: of:=IF([.C54]=1;"";[.C54]) -> 0.196751 | H54: of:=IF([.D54]=1;"";[.D54]) -> 0.207934 | I54: of:=IF([.E54]=1;"";[.E54]) -> 0.0425795
A55: 14 | B55: strncat: &"xs"{\0,\x01,\x01,\x01,\x01,\x01,\x01,\x01} &"bdc"{\0,\0} 4 :=> &"xsbdc"{\0,p,l,b,\0} | C55: 0.171077 | D55: 0.0708141 | E55: 0.0219649 | G55: of:=IF([.C55]=1;"";[.C55]) -> 0.171077 | H55: of:=IF([.D55]=1;"";[.D55]) -> 0.0708141 | I55: of:=IF([.E55]=1;"";[.E55]) -> 0.0219649
A56: 15 | B56: strncat: &"ff"{\0,\x01,\x01,\x01,\x01,\x01,\x01,\x01} &"toma"{\0} 4 :=> &"fftoma"{\0,p,e,\0} | C56: 0.214762 | D56: 0.0488861 | E56: 0.0222019 | G56: of:=IF([.C56]=1;"";[.C56]) -> 0.214762 | H56: of:=IF([.D56]=1;"";[.D56]) -> 0.0488861 | I56: of:=IF([.E56]=1;"";[.E56]) -> 0.0222019
A57: 16 | B57: strncat: &"yop"{\0,\x01,\x01,\x01,\x01,\x01,\x01} &""{\0,p,k,j,\0} 4 :=> &"yop"{\0,p,k,f,y,a,\0} | C57: 0.0848398 | D57: 1 | E57: 0.0848398 | G57: of:=IF([.C57]=1;"";[.C57]) -> 0.0848398 | H57: of:=IF([.D57]=1;"";[.D57]) ->  | I57: of:=IF([.E57]=1;"";[.E57]) -> 0.0848398
A58: 17 | B58: strncat: &"fog"{\0,\x01,\x01,\x01,\x01,\x01,\x01} &"d"{\0,p,y,\0} 4 :=> &"fogd"{\0,p,o,o,a,\0} | C58: 0.0858315 | D58: 1 | E58: 0.0425947 | G58: of:=IF([.C58]=1;"";[.C58]) -> 0.0858315 | H58: of:=IF([.D58]=1;"";[.D58]) ->  | I58: of:=IF([.E58]=1;"";[.E58]) -> 0.0425947
A59: 18 | B59: strncat: &"ate"{\0,\x01,\x01,\x01,\x01,\x01,\x01} &"qi"{\0,p,\0} 4 :=> &"ateqi"{\0,p,o,j,\0} | C59: 0.0913563 | D59: 0.188031 | E59: 0.028221 | G59: of:=IF([.C59]=1;"";[.C59]) -> 0.0913563 | H59: of:=IF([.D59]=1;"";[.D59]) -> 0.188031 | I59: of:=IF([.E59]=1;"";[.E59]) -> 0.028221
A60: 19 | B60: strncat: &"ker"{\0,\x01,\x01,\x01,\x01,\x01,\x01} &"xcy"{\0,\0} 4 :=> &"kerxcy"{\0,p,e,\0} | C60: 0.0898698 | D60: 0.0796517 | E60: 0.0193129 | G60: of:=IF([.C60]=1;"";[.C60]) -> 0.0898698 | H60: of:=IF([.D60]=1;"";[.D60]) -> 0.0796517 | I60: of:=IF([.E60]=1;"";[.E60]) -> 0.0193129
A61: 20 | B61: strncat: &"nes"{\0,\x01,\x01,\x01,\x01,\x01,\x01} &"khes"{\0} 4 :=> &"neskhes"{\0,p,\0} | C61: 0.0905241 | D61: 0.0461662 | E61: 0.0169093 | G61: of:=IF([.C61]=1;"";[.C61]) -> 0.0905241 | H61: of:=IF([.D61]=1;"";[.D61]) -> 0.0461662 | I61: of:=IF([.E61]=1;"";[.E61]) -> 0.0169093
A62: 21 | B62: strncat: &"nhfl"{\0,\x01,\x01,\x01,\x01,\x01} &""{\0,p,r,a,\0} 4 :=> &"nhfl"{\0,p,n,t,v,\0} | C62: 0.0398984 | D62: 1 | E62: 0.0398984 | G62: of:=IF([.C62]=1;"";[.C62]) -> 0.0398984 | H62: of:=IF([.D62]=1;"";[.D62]) ->  | I62: of:=IF([.E62]=1;"";[.E62]) -> 0.0398984
A63: 22 | B63: strncat: &"vemn"{\0,\x01,\x01,\x01,\x01,\x01} &"n"{\0,p,o,\0} 4 :=> &"vemnn"{\0,p,t,k,\0} | C63: 0.0449159 | D63: 1 | E63: 0.0289028 | G63: of:=IF([.C63]=1;"";[.C63]) -> 0.0449159 | H63: of:=IF([.D63]=1;"";[.D63]) ->  | I63: of:=IF([.E63]=1;"";[.E63]) -> 0.0289028
A64: 23 | B64: strncat: &"evea"{\0,\x01,\x01,\x01,\x01,\x01} &"xy"{\0,p,\0} 4 :=> &"eveaxy"{\0,p,c,\0} | C64: 0.0483526 | D64: 0.183327 | E64: 0.0200577 | G64: of:=IF([.C64]=1;"";[.C64]) -> 0.0483526 | H64: of:=IF([.D64]=1;"";[.D64]) -> 0.183327 | I64: of:=IF([.E64]=1;"";[.E64]) -> 0.0200577
A65: 24 | B65: strncat: &"yngo"{\0,\x01,\x01,\x01,\x01,\x01} &"tra"{\0,\0} 4 :=> &"yngotra"{\0,p,\0} | C65: 0.0454595 | D65: 0.0888414 | E65: 0.0168955 | G65: of:=IF([.C65]=1;"";[.C65]) -> 0.0454595 | H65: of:=IF([.D65]=1;"";[.D65]) -> 0.0888414 | I65: of:=IF([.E65]=1;"";[.E65]) -> 0.0168955
A66: 25 | B66: strncat: &"ypej"{\0,\x01,\x01,\x01,\x01,\x01} &"rsea"{\0} 4 :=> &"ypejrsea"{\0,\0} | C66: 0.0418447 | D66: 0.0489585 | E66: 0.0106821 | G66: of:=IF([.C66]=1;"";[.C66]) -> 0.0418447 | H66: of:=IF([.D66]=1;"";[.D66]) -> 0.0489585 | I66: of:=IF([.E66]=1;"";[.E66]) -> 0.0106821
A67: 26 | B67: strncat: &"zaada"{\0,\x01,\x01,\x01,\x01} &""{\0,p,b,b,\0} 4 :=> &"zaada"{\0,p,l,a,\0} | C67: 0.027614 | D67: 1 | E67: 0.027614 | G67: of:=IF([.C67]=1;"";[.C67]) -> 0.027614 | H67: of:=IF([.D67]=1;"";[.D67]) ->  | I67: of:=IF([.E67]=1;"";[.E67]) -> 0.027614
A68: 27 | B68: strncat: &"wquka"{\0,\x01,\x01,\x01,\x01} &"v"{\0,p,j,\0} 4 :=> &"wqukav"{\0,p,k,\0} | C68: 0.0212964 | D68: 1 | E68: 0.0160203 | G68: of:=IF([.C68]=1;"";[.C68]) -> 0.0212964 | H68: of:=IF([.D68]=1;"";[.D68]) ->  | I68: of:=IF([.E68]=1;"";[.E68]) -> 0.0160203
A69: 28 | B69: strncat: &"rwior"{\0,\x01,\x01,\x01,\x01} &"oj"{\0,p,\0} 4 :=> &"rwioroj"{\0,p,\0} | C69: 0.0301667 | D69: 0.199829 | E69: 0.0164323 | G69: of:=IF([.C69]=1;"";[.C69]) -> 0.0301667 | H69: of:=IF([.D69]=1;"";[.D69]) -> 0.199829 | I69: of:=IF([.E69]=1;"";[.E69]) -> 0.0164323
A70: 29 | B70: strncat: &"irmmp"{\0,\x01,\x01,\x01,\x01} &"nbp"{\0,\0} 4 :=> &"irmmpnbp"{\0,\0} | C70: 0.0299319 | D70: 0.0690233 | E70: 0.0113524 | G70: of:=IF([.C70]=1;"";[.C70]) -> 0.0299319 | H70: of:=IF([.D70]=1;"";[.D70]) -> 0.0690233 | I70: of:=IF([.E70]=1;"";[.E70]) -> 0.0113524
A71: 30 | B71: strncat: &"gnewn"{\0,\x01,\x01,\x01,\x01} &"igsc"{\0} 4 :=> &"gnewnigsc"{\0} | C71: 0.0297395 | D71: 0.045609 | E71: 0.0113982 | G71: of:=IF([.C71]=1;"";[.C71]) -> 0.0297395 | H71: of:=IF([.D71]=1;"";[.D71]) -> 0.045609 | I71: of:=IF([.E71]=1;"";[.E71]) -> 0.0113982
A72: 31 | B72: strncat: &"wmffkd"{\0,\x01,\x01,\x01} &""{\0,p,g,w,\0} 4 :=> &"wmffkd"{\0,p,s,\0} | C72: 0.0164398 | D72: 1 | E72: 0.0164398 | G72: of:=IF([.C72]=1;"";[.C72]) -> 0.0164398 | H72: of:=IF([.D72]=1;"";[.D72]) ->  | I72: of:=IF([.E72]=1;"";[.E72]) -> 0.0164398
A73: 32 | B73: strncat: &"swoebp"{\0,\x01,\x01,\x01} &"o"{\0,p,i,\0} 4 :=> &"swoebpo"{\0,p,\0} | C73: 0.0184302 | D73: 1 | E73: 0.0145963 | G73: of:=IF([.C73]=1;"";[.C73]) -> 0.0184302 | H73: of:=IF([.D73]=1;"";[.D73]) ->  | I73: of:=IF([.E73]=1;"";[.E73]) -> 0.0145963
A74: 33 | B74: strncat: &"ascseb"{\0,\x01,\x01,\x01} &"ug"{\0,p,\0} 4 :=> &"ascsebug"{\0,\0} | C74: 0.0213094 | D74: 0.213806 | E74: 0.0134168 | G74: of:=IF([.C74]=1;"";[.C74]) -> 0.0213094 | H74: of:=IF([.D74]=1;"";[.D74]) -> 0.213806 | I74: of:=IF([.E74]=1;"";[.E74]) -> 0.0134168
A75: 34 | B75: strncat: &"hkskiy"{\0,\x01,\x01,\x01} &"tcx"{\0,\0} 4 :=> &"hkskiytcx"{\0} | C75: 0.0179989 | D75: 0.0474247 | E75: 0.0075291 | G75: of:=IF([.C75]=1;"";[.C75]) -> 0.0179989 | H75: of:=IF([.D75]=1;"";[.D75]) -> 0.0474247 | I75: of:=IF([.E75]=1;"";[.E75]) -> 0.0075291
A76: 35 | B76: strncat: &"zmjata"{\0,\x01,\x01,\x01} &&10 4 :=> &"zmjatagwsb"{} | C76: 0.0170856 | D76: 0.00784296 | G76: of:=IF([.C76]=1;"";[.C76]) -> 0.0170856 | H76: of:=IF([.D76]=1;"";[.D76]) -> 0.00784296 | I76: of:=IF([.E76]=1;"";[.E76]) ->  
A77: 36 | B77: strncat: &"faeomrw"{\0,\x01,\x01} &""{\0,p,w,d,\0} 4 :=> &"faeomrw"{\0,p,\0} | C77: 0.0146548 | D77: 1 | E77: 0.0146548 | G77: of:=IF([.C77]=1;"";[.C77]) -> 0.0146548 | H77: of:=IF([.D77]=1;"";[.D77]) ->  | I77: of:=IF([.E77]=1;"";[.E77]) -> 0.0146548
A78: 37 | B78: strncat: &"pufrulb"{\0,\x01,\x01} &"x"{\0,p,o,\0} 4 :=> &"pufrulbx"{\0,\0} | C78: 0.0156932 | D78: 1 | E78: 0 | G78: of:=IF([.C78]=1;"";[.C78]) -> 0.0156932 | H78: of:=IF([.D78]=1;"";[.D78]) ->  | I78: of:=IF([.E78]=1;"";[.E78]) -> 0
A79: 38 | B79: strncat: &"jctmveo"{\0,\x01,\x01} &"xp"{\0,p,\0} 4 :=> &"jctmveoxp"{\0} | C79: 0.0130532 | D79: 0.209845 | E79: 0.00908068 | G79: of:=IF([.C79]=1;"";[.C79]) -> 0.0130532 | H79: of:=IF([.D79]=1;"";[.D79]) -> 0.209845 | I79: of:=IF([.E79]=1;"";[.E79]) -> 0.00908068
A80: 39 | B80: strncat: &"loambwhk"{\0,\x01} &""{\0,p,l,w,\0} 4 :=> &"loambwhk"{\0,\0} | C80: 0.0120141 | D80: 1 | E80: 0.0120141 | G80: of:=IF([.C80]=1;"";[.C80]) -> 0.0120141 | H80: of:=IF([.D80]=1;"";[.D80]) ->  | I80: of:=IF([.E80]=1;"";[.E80]) -> 0.0120141
A81: 40 | B81: strncat: &"okcmetev"{\0,\x01} &"r"{\0,p,i,\0} 4 :=> &"okcmetevr"{\0} | C81: 0.0116986 | D81: 1 | E81: 0.00949127 | G81: of:=IF([.C81]=1;"";[.C81]) -> 0.0116986 | H81: of:=IF([.D81]=1;"";[.D81]) ->  | I81: of:=IF([.E81]=1;"";[.E81]) -> 0.00949127
A82: 41 | B82: strncat: &"wympbfiaw"{\0} &""{\0,p,s,b,\0} 4 :=> &"wympbfiaw"{\0} | C82: 0.00951778 | D82: 1 | E82: 0.00951778 | G82: of:=IF([.C82]=1;"";[.C82]) -> 0.00951778 | H82: of:=IF([.D82]=1;"";[.D82]) ->  | I82: of:=IF([.E82]=1;"";[.E82]) -> 0.00951778

Sheet: strstr
A1: # | B1: Test Case | C1: N | G1: N1 | H1: N2 | I1: N3
A2: 1 | B2: strstr: &"h"{\0,h,n,a,\0} &"h"{\0,\0} :=> &"h"{\0,h,n,a,\0} | C2: 1 | D2: 1 | E2: 1 | G2: of:=IF([.C2]=1;"";[.C2]) ->  | H2: of:=IF([.D2]=1;"";[.D2]) ->  | I2: of:=IF([.E2]=1;"";[.E2]) ->  | K2: of:=AVERAGE([.G2:.G19]) -> 0.0727968352941176 | L2: of:=AVERAGE([.H2:.H19]) -> 0.198381333333333 | M2: of:=AVERAGE([.I2:.I19]) -> 0.09361168125 | O2: of:=AVERAGE([.K2:.M2]) -> 0.121596616625817
A3: 2 | B3: strstr: &"jl"{\0,h,l,\0} &"j"{\0,\0} :=> &"jl"{\0,h,l,\0} | C3: 0.145795 | D3: 1 | E3: 0.145795 | G3: of:=IF([.C3]=1;"";[.C3]) -> 0.145795 | H3: of:=IF([.D3]=1;"";[.D3]) ->  | I3: of:=IF([.E3]=1;"";[.E3]) -> 0.145795
A4: 3 | B4: strstr: &"wn"{\0,b,c,\0} &"n"{\0,\0} :=> &"n"{\0,b,c,\0,54} | C4: 0.211853 | D4: 1 | E4: 1 | G4: of:=IF([.C4]=1;"";[.C4]) -> 0.211853 | H4: of:=IF([.D4]=1;"";[.D4]) ->  | I4: of:=IF([.E4]=1;"";[.E4]) -> 
A5: 4 | B5: strstr: &"oog"{\0,h,\0} &"o"{\0,\0} :=> &"oog"{\0,h,\0} | C5: 0.0848398 | D5: 1 | E5: 0.0848398 | G5: of:=IF([.C5]=1;"";[.C5]) -> 0.0848398 | H5: of:=IF([.D5]=1;"";[.D5]) ->  | I5: of:=IF([.E5]=1;"";[.E5]) -> 0.0848398
A6: 5 | B6: strstr: &"erc"{\0,b,\0} &"r"{\0,\0} :=> &"rc"{\0,b,\0,54} | C6: 0.0887867 | D6: 1 | E6: 0.214286 | G6: of:=IF([.C6]=1;"";[.C6]) -> 0.0887867 | H6: of:=IF([.D6]=1;"";[.D6]) ->  | I6: of:=IF([.E6]=1;"";[.E6]) -> 0.214286
A7: 6 | B7: strstr: &"ipht"{\0,\0} &"i"{\0,\0} :=> &"ipht"{\0,\0} | C7: 0.0448694 | D7: 1 | E7: 0.0448694 | G7: of:=IF([.C7]=1;"";[.C7]) -> 0.0448694 | H7: of:=IF([.D7]=1;"";[.D7]) ->  | I7: of:=IF([.E7]=1;"";[.E7]) -> 0.0448694
A8: 7 | B8: strstr: &"ynjf"{\0,\0} &"n"{\0,\0} :=> &"njf"{\0,\0,54} | C8: 0.0319414 | D8: 1 | E8: 0.0573284 | G8: of:=IF([.C8]=1;"";[.C8]) -> 0.0319414 | H8: of:=IF([.D8]=1;"";[.D8]) ->  | I8: of:=IF([.E8]=1;"";[.E8]) -> 0.0573284
A9: 8 | B9: strstr: &"bydya"{\0} &"b"{\0,\0} :=> &"bydya"{\0} | C9: 0.026892 | D9: 1 | E9: 0.026892 | G9: of:=IF([.C9]=1;"";[.C9]) -> 0.026892 | H9: of:=IF([.D9]=1;"";[.D9]) ->  | I9: of:=IF([.E9]=1;"";[.E9]) -> 0.026892
A10: 9 | B10: strstr: &"oksrk"{\0} &"k"{\0,\0} :=> &"ksrk"{\0,54} | C10: 0.0281184 | D10: 1 | E10: 0.0436997 | G10: of:=IF([.C10]=1;"";[.C10]) -> 0.0281184 | H10: of:=IF([.D10]=1;"";[.D10]) ->  | I10: of:=IF([.E10]=1;"";[.E10]) -> 0.0436997
A11: 10 | B11: strstr: &"tt"{\0,d,b,\0} &"tt"{\0} :=> &"tt"{\0,d,b,\0} | C11: 0.215236 | D11: 0.215236 | E11: 0.215236 | G11: of:=IF([.C11]=1;"";[.C11]) -> 0.215236 | H11: of:=IF([.D11]=1;"";[.D11]) -> 0.215236 | I11: of:=IF([.E11]=1;"";[.E11]) -> 0.215236
A12: 11 | B12: strstr: &"pry"{\0,d,\0} &"pr"{\0} :=> &"pry"{\0,d,\0} | C12: 0.0871094 | D12: 0.218916 | E12: 0.0871094 | G12: of:=IF([.C12]=1;"";[.C12]) -> 0.0871094 | H12: of:=IF([.D12]=1;"";[.D12]) -> 0.218916 | I12: of:=IF([.E12]=1;"";[.E12]) -> 0.0871094
A13: 12 | B13: strstr: &"qqf"{\0,a,\0} &"qf"{\0} :=> &"qf"{\0,a,\0,54} | C13: 0.0306161 | D13: 0.106758 | E13: 0.106758 | G13: of:=IF([.C13]=1;"";[.C13]) -> 0.0306161 | H13: of:=IF([.D13]=1;"";[.D13]) -> 0.106758 | I13: of:=IF([.E13]=1;"";[.E13]) -> 0.106758
A14: 13 | B14: strstr: &"qbw"{\0,p,\0} &"bw"{\0} :=> &"bw"{\0,p,\0,54} | C14: 0.0538792 | D14: 0.187534 | E14: 0.187534 | G14: of:=IF([.C14]=1;"";[.C14]) -> 0.0538792 | H14: of:=IF([.D14]=1;"";[.D14]) -> 0.187534 | I14: of:=IF([.E14]=1;"";[.E14]) -> 0.187534
A15: 14 | B15: strstr: &"uayv"{\0,\0} &"ua"{\0} :=> &"uayv"{\0,\0} | C15: 0.0412437 | D15: 0.212836 | E15: 0.0412437 | G15: of:=IF([.C15]=1;"";[.C15]) -> 0.0412437 | H15: of:=IF([.D15]=1;"";[.D15]) -> 0.212836 | I15: of:=IF([.E15]=1;"";[.E15]) -> 0.0412437
A16: 15 | B16: strstr: &"iinj"{\0,\0} &"in"{\0} :=> &"inj"{\0,\0,54} | C16: 0.0421038 | D16: 0.226579 | E16: 0.0839427 | G16: of:=IF([.C16]=1;"";[.C16]) -> 0.0421038 | H16: of:=IF([.D16]=1;"";[.D16]) -> 0.226579 | I16: of:=IF([.E16]=1;"";[.E16]) -> 0.0839427
A17: 16 | B17: strstr: &"byns"{\0,\0} &"yn"{\0} :=> &"yns"{\0,\0,54} | C17: 0.0452568 | D17: 0.203502 | E17: 0.0832702 | G17: of:=IF([.C17]=1;"";[.C17]) -> 0.0452568 | H17: of:=IF([.D17]=1;"";[.D17]) -> 0.203502 | I17: of:=IF([.E17]=1;"";[.E17]) -> 0.0832702
A18: 17 | B18: strstr: &"yrmme"{\0} &"yr"{\0} :=> &"yrmme"{\0} | C18: 0.0290834 | D18: 0.202715 | E18: 0.0290834 | G18: of:=IF([.C18]=1;"";[.C18]) -> 0.0290834 | H18: of:=IF([.D18]=1;"";[.D18]) -> 0.202715 | I18: of:=IF([.E18]=1;"";[.E18]) -> 0.0290834
A19: 18 | B19: strstr: &"eeood"{\0} &"eo"{\0} :=> &"eood"{\0,54} | C19: 0.0299221 | D19: 0.211356 | E19: 0.0458992 | G19: of:=IF([.C19]=1;"";[.C19]) -> 0.0299221 | H19: of:=IF([.D19]=1;"";[.D19]) -> 0.211356 | I19: of:=IF([.E19]=1;"";[.E19]) -> 0.0458992
A20: 19 | B20: strstr: &"werlv"{\0} &"er"{\0} :=> &"erlv"{\0,54} | C20: 0.0298902 | D20: 0.226174 | E20: 0.0460975 | G20: of:=IF([.C20]=1;"";[.C20]) -> 0.0298902 | H20: of:=IF([.D20]=1;"";[.D20]) -> 0.226174 | I20: of:=IF([.E20]=1;"";[.E20]) -> 0.0460975 | K20: of:=AVERAGE([.G20:.G24]) -> 0.02590188 | L20: of:=AVERAGE([.H20:.H24]) -> 0.2118005 | M20: of:=AVERAGE([.I20:.I24]) -> 0.0322662 | O20: of:=AVERAGE([.K20:.M20]) -> 0.0899895266666667
A21: 1 | B21: strnstr: &"llgmd"{\0} &""{\0,p,\0} 2 :=> &"llgmd"{\0} | C21: 0.0246236 | D21: 1 | E21: 0.0246236 | G21: of:=IF([.C21]=1;"";[.C21]) -> 0.0246236 | H21: of:=IF([.D21]=1;"";[.D21]) ->  | I21: of:=IF([.E21]=1;"";[.E21]) -> 0.0246236
A22: 2 | B22: strnstr: &"dqaip"{\0} &"d"{\0,\0} 2 :=> &"dqaip"{\0} | C22: 0.0232622 | D22: 1 | E22: 0.0232622 | G22: of:=IF([.C22]=1;"";[.C22]) -> 0.0232622 | H22: of:=IF([.D22]=1;"";[.D22]) ->  | I22: of:=IF([.E22]=1;"";[.E22]) -> 0.0232622
A23: 3 | B23: strnstr: &"tddpp"{\0} &"d"{\0,\0} 2 :=> &"ddpp"{\0,54} | C23: 0.0251006 | D23: 1 | E23: 0.0407149 | G23: of:=IF([.C23]=1;"";[.C23]) -> 0.0251006 | H23: of:=IF([.D23]=1;"";[.D23]) ->  | I23: of:=IF([.E23]=1;"";[.E23]) -> 0.0407149
A24: 4 | B24: strnstr: &"hwaaw"{\0} &"hw"{\0} 2 :=> &"hwaaw"{\0} | C24: 0.0266328 | D24: 0.197427 | E24: 0.0266328 | G24: of:=IF([.C24]=1;"";[.C24]) -> 0.0266328 | H24: of:=IF([.D24]=1;"";[.D24]) -> 0.197427 | I24: of:=IF([.E24]=1;"";[.E24]) -> 0.0266328
A25: 1 | B25: strpbrk: &"duagh"{\0} &"aeiou"{\0} :=> &"uagh"{\0,54} | C25: 0.0297115 | D25: 0.0299288 | E25: 0.046315 | G25: of:=IF([.C25]=1;"";[.C25]) -> 0.0297115 | H25: of:=IF([.D25]=1;"";[.D25]) -> 0.0299288 | I25: of:=IF([.E25]=1;"";[.E25]) -> 0.046315 | K25: of:=AVERAGE([.G25:.G34]) -> 0.02669061 | L25: of:=AVERAGE([.H25:.H34]) -> 0.0299288 | M25: of:=AVERAGE([.I25:.I34]) -> 0.03422723 | O25: of:=AVERAGE([.K25:.M25]) -> 0.0302822133333333
A26: 2 | B26: strpbrk: &"wooam"{\0} &"aeiou"{\0} :=> &"ooam"{\0,54} | C26: 0.0299238 | D26: 0.0299288 | E26: 0.0462236 | G26: of:=IF([.C26]=1;"";[.C26]) -> 0.0299238 | H26: of:=IF([.D26]=1;"";[.D26]) -> 0.0299288 | I26: of:=IF([.E26]=1;"";[.E26]) -> 0.0462236
A27: 3 | B27: strpbrk: &"kidra"{\0} &"aeiou"{\0} :=> &"idra"{\0,54} | C27: 0.0303032 | D27: 0.0299288 | E27: 0.0473928 | G27: of:=IF([.C27]=1;"";[.C27]) -> 0.0303032 | H27: of:=IF([.D27]=1;"";[.D27]) -> 0.0299288 | I27: of:=IF([.E27]=1;"";[.E27]) -> 0.0473928
A28: 4 | B28: strpbrk: &"nejfk"{\0} &"aeiou"{\0} :=> &"ejfk"{\0,54} | C28: 0.0202033 | D28: 0.0299288 | E28: 0.028796 | G28: of:=IF([.C28]=1;"";[.C28]) -> 0.0202033 | H28: of:=IF([.D28]=1;"";[.D28]) -> 0.0299288 | I28: of:=IF([.E28]=1;"";[.E28]) -> 0.028796
A29: 5 | B29: strpbrk: &"maths"{\0} &"aeiou"{\0} :=> &"aths"{\0,54} | C29: 0.0310145 | D29: 0.0299288 | E29: 0.0477951 | G29: of:=IF([.C29]=1;"";[.C29]) -> 0.0310145 | H29: of:=IF([.D29]=1;"";[.D29]) -> 0.0299288 | I29: of:=IF([.E29]=1;"";[.E29]) -> 0.0477951
A30: 6 | B30: strpbrk: &"umeso"{\0} &"aeiou"{\0} :=> &"umeso"{\0} | C30: 0.0311469 | D30: 0.0299288 | E30: 0.0311469 | G30: of:=IF([.C30]=1;"";[.C30]) -> 0.0311469 | H30: of:=IF([.D30]=1;"";[.D30]) -> 0.0299288 | I30: of:=IF([.E30]=1;"";[.E30]) -> 0.0311469
A31: 7 | B31: strpbrk: &"opdkm"{\0} &"aeiou"{\0} :=> &"opdkm"{\0} | C31: 0.0226351 | D31: 0.0299288 | E31: 0.0226351 | G31: of:=IF([.C31]=1;"";[.C31]) -> 0.0226351 | H31: of:=IF([.D31]=1;"";[.D31]) -> 0.0299288 | I31: of:=IF([.E31]=1;"";[.E31]) -> 0.0226351
A32: 8 | B32: strpbrk: &"injda"{\0} &"aeiou"{\0} :=> &"injda"{\0} | C32: 0.0249979 | D32: 0.0299288 | E32: 0.0249979 | G32: of:=IF([.C32]=1;"";[.C32]) -> 0.0249979 | H32: of:=IF([.D32]=1;"";[.D32]) -> 0.0299288 | I32: of:=IF([.E32]=1;"";[.E32]) -> 0.0249979
A33: 9 | B33: strpbrk: &"efpfo"{\0} &"aeiou"{\0} :=> &"efpfo"{\0} | C33: 0.0232562 | D33: 0.0299288 | E33: 0.0232562 | G33: of:=IF([.C33]=1;"";[.C33]) -> 0.0232562 | H33: of:=IF([.D33]=1;"";[.D33]) -> 0.0299288 | I33: of:=IF([.E33]=1;"";[.E33]) -> 0.0232562
A34: 10 | B34: strpbrk: &"abvsv"{\0} &"aeiou"{\0} :=> &"abvsv"{\0} | C34: 0.0237137 | D34: 0.0299288 | E34: 0.0237137 | G34: of:=IF([.C34]=1;"";[.C34]) -> 0.0237137 | H34: of:=IF([.D34]=1;"";[.D34]) -> 0.0299288 | I34: of:=IF([.E34]=1;"";[.E34]) -> 0.0237137