Sheet: strlen
A1: strlen: &"\x01"{\0,\0,\0,\0,\0} :=> 1; | J1: # | K1: Test Case | L1: N | P1: FINAL
A2: strlen: &"\x01\x01"{\0,\0,\0,\0} :=> 2; | J2: 1 | K2: strlen: &"s"{\0,p,n,p,\0} :=> 1 | L2: 1 | N2: of:=IF([.L2]=1;"";[.L2]) ->  | P2: of:=AVERAGE([.N2:.N6]) -> 0.0909529
A3: strlen: &"\x01\x01\x01"{\0,\0,\0} :=> 3; | J3: 2 | K3: strlen: &"en"{\0,p,a,\0} :=> 2 | L3: 0.224112 | N3: of:=IF([.L3]=1;"";[.L3]) -> 0.224112
A4: strlen: &"\x01\x01\x01\x01"{\0,\0} :=> 4; | J4: 3 | K4: strlen: &"bvu"{\0,p,\0} :=> 3 | L4: 0.0700694 | N4: of:=IF([.L4]=1;"";[.L4]) -> 0.0700694
A5: strlen: &"\x01\x01\x01\x01\x01"{\0} :=> 5; | J5: 4 | K5: strlen: &"dulw"{\0,\0} :=> 4 | L5: 0.0441589 | N5: of:=IF([.L5]=1;"";[.L5]) -> 0.0441589
A6: strnlen: &""{\0,\0,\0,\0,\0,\0} 6 :=> 0; 1; | J6: 5 | K6: strlen: &"ybuum"{\0} :=> 5 | L6: 0.0254713 | N6: of:=IF([.L6]=1;"";[.L6]) -> 0.0254713
A7: strnlen: &"\x01"{\0,\0,\0,\0,\0} 6 :=> 1; | J7: 1 | K7: strnlen: &""{\0,p,t,o,n,\0} 6 :=> 0 | L7: 1 | N7: of:=IF([.L7]=1;"";[.L7]) ->  | P7: of:=AVERAGE([.N7:.N12]) -> 0.086555725
A8: strnlen: &"\x01\x01"{\0,\0,\0,\0} 6 :=> 2; | J8: 2 | K8: strnlen: &"g"{\0,p,t,o,\0} 6 :=> 1 | L8: 1 | N8: of:=IF([.L8]=1;"";[.L8]) -> 
A9: strnlen: &"\x01\x01\x01"{\0,\0,\0} 6 :=> 3; | J9: 3 | K9: strnlen: &"da"{\0,p,y,\0} 6 :=> 2 | L9: 0.216174 | N9: of:=IF([.L9]=1;"";[.L9]) -> 0.216174
A10: strnlen: &"\x01\x01\x01\x01"{\0,\0} 6 :=> 4; | J10: 4 | K10: strnlen: &"ypj"{\0,p,\0} 6 :=> 3 | L10: 0.0684415 | N10: of:=IF([.L10]=1;"";[.L10]) -> 0.0684415
A11: strnlen: &"\x01\x01\x01\x01\x01"{\0} 6 :=> 5; | J11: 5 | K11: strnlen: &"romj"{\0,\0} 6 :=> 4 | L11: 0.0395562 | N11: of:=IF([.L11]=1;"";[.L11]) -> 0.0395562
J12: 6 | K12: strnlen: &"bdbke"{\0} 6 :=> 5 | L12: 0.0220512 | N12: of:=IF([.L12]=1;"";[.L12]) -> 0.0220512

Sheet: strcmp
A1: # | B1: Test Case | C1: N1 | D1: N2 | L1: FINAL
A2: 1 | B2: strcmp: &"v"{\0,p,a,p,\0} &"v"{\0,p,s,u,\0} :=> 0 | C2: 1 | D2: 1 | F2: of:=IF([.C2]=1;"";[.C2]) ->  | G2: of:=IF([.D2]=1;"";[.D2]) ->  | H2: of:=IF([.E2]=1;"";[.E2]) ->   | I2: of:=AVERAGE([.F2:.F16]) -> 0.04478245 | J2: of:=AVERAGE([.G2:.G16]) -> 0.0456972071428571 | L2: of:=AVERAGE([.I2:.J2]) -> 0.0452398285714286
A3: 2 | B3: strcmp: &"fu"{\0,p,m,\0} &"fu"{\0,p,r,\0} :=> 0 | C3: 0.210856 | D3: 0.210856 | F3: of:=IF([.C3]=1;"";[.C3]) -> 0.210856 | G3: of:=IF([.D3]=1;"";[.D3]) -> 0.210856 | H3: of:=IF([.E3]=1;"";[.E3]) ->  
A4: 3 | B4: strcmp: &"vow"{\0,p,\0} &"vow"{\0,p,\0} :=> 0 | C4: 0.0849463 | D4: 0.0849463 | F4: of:=IF([.C4]=1;"";[.C4]) -> 0.0849463 | G4: of:=IF([.D4]=1;"";[.D4]) -> 0.0849463 | H4: of:=IF([.E4]=1;"";[.E4]) ->  
A5: 4 | B5: strcmp: &"sbst"{\0,\0} &"sbst"{\0,\0} :=> 0 | C5: 0.0444534 | D5: 0.0444534 | F5: of:=IF([.C5]=1;"";[.C5]) -> 0.0444534 | G5: of:=IF([.D5]=1;"";[.D5]) -> 0.0444534 | H5: of:=IF([.E5]=1;"";[.E5]) ->  
A6: 5 | B6: strcmp: &"oenja"{\0} &"oenja"{\0} :=> 0 | C6: 0.0274785 | D6: 0.0274785 | F6: of:=IF([.C6]=1;"";[.C6]) -> 0.0274785 | G6: of:=IF([.D6]=1;"";[.D6]) -> 0.0274785 | H6: of:=IF([.E6]=1;"";[.E6]) ->  
A7: 6 | B7: strcmp: &"iequy"{\0} &"iequw"{\0} :=> 1 | C7: 0.0281719 | D7: 0.0268806 | F7: of:=IF([.C7]=1;"";[.C7]) -> 0.0281719 | G7: of:=IF([.D7]=1;"";[.D7]) -> 0.0268806 | H7: of:=IF([.E7]=1;"";[.E7]) ->  
A8: 7 | B8: strcmp: &"wlidw"{\0} &"wlidz"{\0} :=> -1 | C8: 0.0285346 | D8: 0.0264181 | F8: of:=IF([.C8]=1;"";[.C8]) -> 0.0285346 | G8: of:=IF([.D8]=1;"";[.D8]) -> 0.0264181 | H8: of:=IF([.E8]=1;"";[.E8]) ->  
A9: 8 | B9: strcmp: &"jkljk"{\0} &"jklhb"{\0} :=> 1 | C9: 0.0183137 | D9: 0.0220864 | F9: of:=IF([.C9]=1;"";[.C9]) -> 0.0183137 | G9: of:=IF([.D9]=1;"";[.D9]) -> 0.0220864 | H9: of:=IF([.E9]=1;"";[.E9]) ->  
A10: 9 | B10: strcmp: &"ketiv"{\0} &"ketyi"{\0} :=> -1 | C10: 0.03114 | D10: 0.0298212 | F10: of:=IF([.C10]=1;"";[.C10]) -> 0.03114 | G10: of:=IF([.D10]=1;"";[.D10]) -> 0.0298212 | H10: of:=IF([.E10]=1;"";[.E10]) ->  
A11: 10 | B11: strcmp: &"usccb"{\0} &"usadu"{\0} :=> 1 | C11: 0.0256359 | D11: 0.0305581 | F11: of:=IF([.C11]=1;"";[.C11]) -> 0.0256359 | G11: of:=IF([.D11]=1;"";[.D11]) -> 0.0305581 | H11: of:=IF([.E11]=1;"";[.E11]) ->  
A12: 11 | B12: strcmp: &"kojja"{\0} &"koqus"{\0} :=> -1 | C12: 0.0209231 | D12: 0.02638 | F12: of:=IF([.C12]=1;"";[.C12]) -> 0.0209231 | G12: of:=IF([.D12]=1;"";[.D12]) -> 0.02638
A13: 12 | B13: strcmp: &"apakw"{\0} &"aigsb"{\0} :=> 1 | C13: 0.0279501 | D13: 0.0287565 | F13: of:=IF([.C13]=1;"";[.C13]) -> 0.0279501 | G13: of:=IF([.D13]=1;"";[.D13]) -> 0.0287565
A14: 13 | B14: strcmp: &"cnxei"{\0} &"cygrk"{\0} :=> -1 | C14: 0.0243297 | D14: 0.026898 | F14: of:=IF([.C14]=1;"";[.C14]) -> 0.0243297 | G14: of:=IF([.D14]=1;"";[.D14]) -> 0.026898
A15: 14 | B15: strcmp: &"fchfu"{\0} &"brewl"{\0} :=> 1 | C15: 0.024435 | D15: 0.0293059 | F15: of:=IF([.C15]=1;"";[.C15]) -> 0.024435 | G15: of:=IF([.D15]=1;"";[.D15]) -> 0.0293059
A16: 15 | B16: strcmp: &"shtsm"{\0} &"uqiaw"{\0} :=> -1 | C16: 0.0297861 | D16: 0.0249219 | F16: of:=IF([.C16]=1;"";[.C16]) -> 0.0297861 | G16: of:=IF([.D16]=1;"";[.D16]) -> 0.0249219
A17: 1 | B17: strncmp: &""{\0,p,u,r,s,\0} &""{\0,p,h,s,d,\0} 5 :=> 0 | C17: 1 | D17: 1 | F17: of:=IF([.C17]=1;"";[.C17]) ->  | G17: of:=IF([.D17]=1;"";[.D17]) ->  | I17: of:=AVERAGE([.F17:.F32]) -> 0.0448839857142857 | J17: of:=AVERAGE([.G17:.G32]) -> 0.0398056714285714 | L17: of:=AVERAGE([.I17:.J17]) -> 0.0423448285714286
A18: 2 | B18: strncmp: &"i"{\0,p,j,a,\0} &"i"{\0,p,d,o,\0} 5 :=> 0 | C18: 1 | D18: 1 | F18: of:=IF([.C18]=1;"";[.C18]) ->  | G18: of:=IF([.D18]=1;"";[.D18]) -> 
A19: 3 | B19: strncmp: &"eg"{\0,p,s,\0} &"eg"{\0,p,m,\0} 5 :=> 0 | C19: 0.213322 | D19: 0.213322 | F19: of:=IF([.C19]=1;"";[.C19]) -> 0.213322 | G19: of:=IF([.D19]=1;"";[.D19]) -> 0.213322
A20: 4 | B20: strncmp: &"yam"{\0,p,\0} &"yam"{\0,p,\0} 5 :=> 0 | C20: 0.082678 | D20: 0.082678 | F20: of:=IF([.C20]=1;"";[.C20]) -> 0.082678 | G20: of:=IF([.D20]=1;"";[.D20]) -> 0.082678
A21: 5 | B21: strncmp: &"yfok"{\0,\0} &"yfok"{\0,\0} 5 :=> 0 | C21: 0.0421011 | D21: 0.0421011 | F21: of:=IF([.C21]=1;"";[.C21]) -> 0.0421011 | G21: of:=IF([.D21]=1;"";[.D21]) -> 0.0421011
A22: 6 | B22: strncmp: &"jfpba"{\0} &"jfpba"{\0} 5 :=> 0 | C22: 0.0181991 | D22: 0.0181991 | F22: of:=IF([.C22]=1;"";[.C22]) -> 0.0181991 | G22: of:=IF([.D22]=1;"";[.D22]) -> 0.0181991
A23: 7 | B23: strncmp: &"bwwkg"{\0} &"bwwkd"{\0} 5 :=> 1 | C23: 0.0195442 | D23: 0.0196692 | F23: of:=IF([.C23]=1;"";[.C23]) -> 0.0195442 | G23: of:=IF([.D23]=1;"";[.D23]) -> 0.0196692
A24: 8 | B24: strncmp: &"ndetm"{\0} &"ndett"{\0} 5 :=> -1 | C24: 0.0307259 | D24: 0.0313832 | F24: of:=IF([.C24]=1;"";[.C24]) -> 0.0307259 | G24: of:=IF([.D24]=1;"";[.D24]) -> 0.0313832
A25: 9 | B25: strncmp: &"ainai"{\0} &"ainUp"{\0} 5 :=> 1 | C25: 0.0317391 | D25: 0 | F25: of:=IF([.C25]=1;"";[.C25]) -> 0.0317391 | G25: of:=IF([.D25]=1;"";[.D25]) -> 0
A26: 10 | B26: strncmp: &"jtblt"{\0} &"jtbxl"{\0} 5 :=> -1 | C26: 0.0229933 | D26: 0 | F26: of:=IF([.C26]=1;"";[.C26]) -> 0.0229933 | G26: of:=IF([.D26]=1;"";[.D26]) -> 0
A27: 11 | B27: strncmp: &"okdiv"{\0} &"okcan"{\0} 5 :=> 1 | C27: 0.0277335 | D27: 0.0269653 | F27: of:=IF([.C27]=1;"";[.C27]) -> 0.0277335 | G27: of:=IF([.D27]=1;"";[.D27]) -> 0.0269653
A28: 12 | B28: strncmp: &"taiac"{\0} &"tawmc"{\0} 5 :=> -1 | C28: 0.0311197 | D28: 0.0255014 | F28: of:=IF([.C28]=1;"";[.C28]) -> 0.0311197 | G28: of:=IF([.D28]=1;"";[.D28]) -> 0.0255014
A29: 13 | B29: strncmp: &"jevex"{\0} &"jdmfp"{\0} 5 :=> 1 | C29: 0.0296074 | D29: 0.0194273 | F29: of:=IF([.C29]=1;"";[.C29]) -> 0.0296074 | G29: of:=IF([.D29]=1;"";[.D29]) -> 0.0194273
A30: 14 | B30: strncmp: &"dflau"{\0} &"dglga"{\0} 5 :=> -1 | C30: 0.0278915 | D30: 0.0272575 | F30: of:=IF([.C30]=1;"";[.C30]) -> 0.0278915 | G30: of:=IF([.D30]=1;"";[.D30]) -> 0.0272575
A31: 15 | B31: strncmp: &"diekl"{\0} &"abtxq"{\0} 5 :=> 1 | C31: 0.0289504 | D31: 0.0207529 | F31: of:=IF([.C31]=1;"";[.C31]) -> 0.0289504 | G31: of:=IF([.D31]=1;"";[.D31]) -> 0.0207529
A32: 16 | B32: strncmp: &"prmjk"{\0} &"yncel"{\0} 5 :=> -1 | C32: 0.0217706 | D32: 0.0300224 | F32: of:=IF([.C32]=1;"";[.C32]) -> 0.0217706 | G32: of:=IF([.D32]=1;"";[.D32]) -> 0.0300224
A33: 1 | B33: sysfs_streq: &""{\0,p,e,e,h,\0} &"dsafg"{\0} :=> \0 | C33: 1 | D33: 0.027076 | F33: of:=IF([.C33]=1;"";[.C33]) ->  | G33: of:=IF([.D33]=1;"";[.D33]) -> 0.027076 | I33: of:=AVERAGE([.F33:.F71]) -> 0.0679246724137931 | J33: of:=AVERAGE([.G33:.G71]) -> 0.0438724714285714 | L33: of:=AVERAGE([.I33:.J33]) -> 0.0558985719211823
A34: 2 | B34: sysfs_streq: &""{\0,p,p,g,e,\0} &"\n"{\0,b,e,i,\0} :=> \x01 | C34: 1 | F34: of:=IF([.C34]=1;"";[.C34]) ->  | G34: of:=IF([.D34]=1;"";[.D34]) ->  
A35: 3 | B35: sysfs_streq: &""{\0,p,b,y,h,\0} &"\naeak"{\0} :=> \0 | C35: 1 | F35: of:=IF([.C35]=1;"";[.C35]) ->  | G35: of:=IF([.D35]=1;"";[.D35]) ->  
A36: 4 | B36: sysfs_streq: &""{\0,p,n,l,t,\0} &""{\0,h,i,v,r,\0} :=> \x01 | C36: 1 | D36: 1 | F36: of:=IF([.C36]=1;"";[.C36]) ->  | G36: of:=IF([.D36]=1;"";[.D36]) -> 
A37: 5 | B37: sysfs_streq: &"owbwm"{\0} &"iryoc"{\0} :=> \0 | C37: 0.0242892 | D37: 0.0297415 | F37: of:=IF([.C37]=1;"";[.C37]) -> 0.0242892 | G37: of:=IF([.D37]=1;"";[.D37]) -> 0.0297415
A38: 6 | B38: sysfs_streq: &"\n"{\0,p,o,w,\0} &""{\0,a,m,p,a,\0} :=> \x01 | C38: 1 | F38: of:=IF([.C38]=1;"";[.C38]) ->  | G38: of:=IF([.D38]=1;"";[.D38]) ->  
A39: 7 | B39: sysfs_streq: &"\n"{\0,a,u,n,\0} &"kdeya"{\0} :=> \0 | C39: 0.0272467 | F39: of:=IF([.C39]=1;"";[.C39]) -> 0.0272467 | G39: of:=IF([.D39]=1;"";[.D39]) ->  
A40: 8 | B40: sysfs_streq: &"\napis"{\0} &"etesa"{\0} :=> \0 | C40: 0.0318594 | F40: of:=IF([.C40]=1;"";[.C40]) -> 0.0318594 | G40: of:=IF([.D40]=1;"";[.D40]) ->  
A41: 9 | B41: sysfs_streq: &"x"{\0,p,y,y,\0} &"xiaey"{\0} :=> \0 | C41: 1 | D41: 0.02825 | F41: of:=IF([.C41]=1;"";[.C41]) ->  | G41: of:=IF([.D41]=1;"";[.D41]) -> 0.02825
A42: 10 | B42: sysfs_streq: &"n"{\0,p,l,c,\0} &"n\n"{\0,a,a,\0} :=> \x01 | C42: 1 | F42: of:=IF([.C42]=1;"";[.C42]) ->  | G42: of:=IF([.D42]=1;"";[.D42]) ->  
A43: 11 | B43: sysfs_streq: &"x"{\0,p,l,o,\0} &"x\navk"{\0} :=> \0 | C43: 1 | F43: of:=IF([.C43]=1;"";[.C43]) ->  | G43: of:=IF([.D43]=1;"";[.D43]) ->  
A44: 12 | B44: sysfs_streq: &"k"{\0,p,p,l,\0} &"k"{\0,h,b,d,\0} :=> \x01 | C44: 1 | D44: 1 | F44: of:=IF([.C44]=1;"";[.C44]) ->  | G44: of:=IF([.D44]=1;"";[.D44]) -> 
A45: 13 | B45: sysfs_streq: &"frvuf"{\0} &"fovuk"{\0} :=> \0 | C45: 0.0272708 | D45: 0.0267432 | F45: of:=IF([.C45]=1;"";[.C45]) -> 0.0272708 | G45: of:=IF([.D45]=1;"";[.D45]) -> 0.0267432
A46: 14 | B46: sysfs_streq: &"c\n"{\0,b,e,\0} &"c"{\0,b,e,w,\0} :=> \x01 | C46: 1 | F46: of:=IF([.C46]=1;"";[.C46]) ->  | G46: of:=IF([.D46]=1;"";[.D46]) ->  
A47: 15 | B47: sysfs_streq: &"u\n"{\0,b,b,\0} &"unnqa"{\0} :=> \0 | C47: 0.0235553 | F47: of:=IF([.C47]=1;"";[.C47]) -> 0.0235553 | G47: of:=IF([.D47]=1;"";[.D47]) ->  
A48: 16 | B48: sysfs_streq: &"d\namy"{\0} &"dshwr"{\0} :=> \0 | C48: 0.0277748 | F48: of:=IF([.C48]=1;"";[.C48]) -> 0.0277748 | G48: of:=IF([.D48]=1;"";[.D48]) ->  
A49: 17 | B49: sysfs_streq: &"pm"{\0,p,u,\0} &"pmtah"{\0} :=> \0 | C49: 0.200999 | D49: 0.0255862 | F49: of:=IF([.C49]=1;"";[.C49]) -> 0.200999 | G49: of:=IF([.D49]=1;"";[.D49]) -> 0.0255862
A50: 18 | B50: sysfs_streq: &"wt"{\0,p,s,\0} &"wt\n"{\0,a,\0} :=> \x01 | C50: 0.196192 | F50: of:=IF([.C50]=1;"";[.C50]) -> 0.196192 | G50: of:=IF([.D50]=1;"";[.D50]) ->  
A51: 19 | B51: sysfs_streq: &"ut"{\0,p,k,\0} &"ut\nas"{\0} :=> \0 | C51: 0.219808 | F51: of:=IF([.C51]=1;"";[.C51]) -> 0.219808 | G51: of:=IF([.D51]=1;"";[.D51]) ->  
A52: 20 | B52: sysfs_streq: &"um"{\0,p,h,\0} &"um"{\0,b,a,\0} :=> \x01 | C52: 0.213322 | D52: 0.213322 | F52: of:=IF([.C52]=1;"";[.C52]) -> 0.213322 | G52: of:=IF([.D52]=1;"";[.D52]) -> 0.213322
A53: 21 | B53: sysfs_streq: &"lkken"{\0} &"lkhme"{\0} :=> \0 | C53: 0.0276217 | D53: 0.0268678 | F53: of:=IF([.C53]=1;"";[.C53]) -> 0.0276217 | G53: of:=IF([.D53]=1;"";[.D53]) -> 0.0268678
A54: 22 | B54: sysfs_streq: &"jc\n"{\0,b,\0} &"jc"{\0,b,b,\0} :=> \x01 | C54: 0.159409 | F54: of:=IF([.C54]=1;"";[.C54]) -> 0.159409 | G54: of:=IF([.D54]=1;"";[.D54]) ->  
A55: 23 | B55: sysfs_streq: &"zy\n"{\0,b,\0} &"zyrcx"{\0} :=> \0 | C55: 0.0180718 | F55: of:=IF([.C55]=1;"";[.C55]) -> 0.0180718 | G55: of:=IF([.D55]=1;"";[.D55]) ->  
A56: 24 | B56: sysfs_streq: &"ra\nar"{\0} &"radav"{\0} :=> \0 | C56: 0.0307805 | F56: of:=IF([.C56]=1;"";[.C56]) -> 0.0307805 | G56: of:=IF([.D56]=1;"";[.D56]) ->  
A57: 25 | B57: sysfs_streq: &"hrk"{\0,p,\0} &"hrkgr"{\0} :=> \0 | C57: 0.0844002 | D57: 0.0271561 | F57: of:=IF([.C57]=1;"";[.C57]) -> 0.0844002 | G57: of:=IF([.D57]=1;"";[.D57]) -> 0.0271561
A58: 26 | B58: sysfs_streq: &"oad"{\0,p,\0} &"oad\n"{\0,\0} :=> \x01 | C58: 0.0852504 | F58: of:=IF([.C58]=1;"";[.C58]) -> 0.0852504 | G58: of:=IF([.D58]=1;"";[.D58]) ->  
A59: 27 | B59: sysfs_streq: &"udt"{\0,p,\0} &"udt\na"{\0} :=> \0 | C59: 0.0776339 | F59: of:=IF([.C59]=1;"";[.C59]) -> 0.0776339 | G59: of:=IF([.D59]=1;"";[.D59]) ->  
A60: 28 | B60: sysfs_streq: &"evo"{\0,p,\0} &"evo"{\0,h,\0} :=> \x01 | C60: 0.0843722 | D60: 0.0843722 | F60: of:=IF([.C60]=1;"";[.C60]) -> 0.0843722 | G60: of:=IF([.D60]=1;"";[.D60]) -> 0.0843722
A61: 29 | B61: sysfs_streq: &"agetc"{\0} &"agede"{\0} :=> \0 | C61: 0.0299168 | D61: 0.0314246 | F61: of:=IF([.C61]=1;"";[.C61]) -> 0.0299168 | G61: of:=IF([.D61]=1;"";[.D61]) -> 0.0314246
A62: 30 | B62: sysfs_streq: &"sec\n"{\0,\0} &"sec"{\0,a,\0} :=> \x01 | C62: 0.0892696 | F62: of:=IF([.C62]=1;"";[.C62]) -> 0.0892696 | G62: of:=IF([.D62]=1;"";[.D62]) ->  
A63: 31 | B63: sysfs_streq: &"ast\n"{\0,\0} &"astuq"{\0} :=> \0 | C63: 0.0281708 | F63: of:=IF([.C63]=1;"";[.C63]) -> 0.0281708 | G63: of:=IF([.D63]=1;"";[.D63]) ->  
A64: 32 | B64: sysfs_streq: &"rys\na"{\0} &"rysol"{\0} :=> \0 | C64: 0.0301481 | F64: of:=IF([.C64]=1;"";[.C64]) -> 0.0301481 | G64: of:=IF([.D64]=1;"";[.D64]) ->  
A65: 33 | B65: sysfs_streq: &"hgsu"{\0,\0} &"hgsux"{\0} :=> \0 | C65: 0.0401886 | D65: 0.0249368 | F65: of:=IF([.C65]=1;"";[.C65]) -> 0.0401886 | G65: of:=IF([.D65]=1;"";[.D65]) -> 0.0249368
A66: 34 | B66: sysfs_streq: &"tote"{\0,\0} &"tote\n"{\0} :=> \x01 | C66: 0.0492615 | F66: of:=IF([.C66]=1;"";[.C66]) -> 0.0492615 | G66: of:=IF([.D66]=1;"";[.D66]) ->  
A67: 35 | B67: sysfs_streq: &"kjjt"{\0,\0} &"kjjt"{\0,\0} :=> \x01 | C67: 0.0230824 | D67: 0.0230824 | F67: of:=IF([.C67]=1;"";[.C67]) -> 0.0230824 | G67: of:=IF([.D67]=1;"";[.D67]) -> 0.0230824
A68: 36 | B68: sysfs_streq: &"ydjyc"{\0} &"ydjyv"{\0} :=> \0 | C68: 0.0189186 | D68: 0.0178478 | F68: of:=IF([.C68]=1;"";[.C68]) -> 0.0189186 | G68: of:=IF([.D68]=1;"";[.D68]) -> 0.0178478
A69: 37 | B69: sysfs_streq: &"oklm\n"{\0} &"oklm"{\0,\0} :=> \x01 | C69: 0.0429895 | F69: of:=IF([.C69]=1;"";[.C69]) -> 0.0429895 | G69: of:=IF([.D69]=1;"";[.D69]) ->  
A70: 38 | B70: sysfs_streq: &"lmis\n"{\0} &"lmish"{\0} :=> \0 | C70: 0.0302047 | F70: of:=IF([.C70]=1;"";[.C70]) -> 0.0302047 | G70: of:=IF([.D70]=1;"";[.D70]) ->  
A71: 39 | B71: sysfs_streq: &"klyix"{\0} &"klyix"{\0} :=> \x01 | C71: 0.027808 | D71: 0.027808 | F71: of:=IF([.C71]=1;"";[.C71]) -> 0.027808 | G71: of:=IF([.D71]=1;"";[.D71]) -> 0.027808

Sheet: strcpy
A1: # | B1: Test Case | C1: N1 | D1: N2 | E1: N3 | O1: FINAL
A2: 1 | B2: strcpy: &""{\0,\x01,\x01,\x01,\x01,\x01} &"w"{\0,p,g,a,\0} :=> &"w"{\0,p,i,o,\0} | C2: 1 | D2: 1 | E2: 1 | G2: of:=IF([.C2]=1;"";[.C2]) ->  | H2: of:=IF([.D2]=1;"";[.D2]) ->  | I2: of:=IF([.E2]=1;"";[.E2]) ->  | K2: of:=AVERAGE([.G2:.G36]) -> 0.0859130666666666 | L2: of:=AVERAGE([.H2:.H36]) -> 0.0913920458333333 | M2: of:=AVERAGE([.I2:.I36]) -> 0.0913920458333333 | O2: of:=AVERAGE([.K2:.M2]) -> 0.0895657194444444
A3: 2 | B3: strcpy: &""{\0,\x01,\x01,\x01,\x01,\x01} &"rt"{\0,p,e,\0} :=> &"rt"{\0,p,r,\0} | C3: 1 | D3: 0.218916 | E3: 0.218916 | G3: of:=IF([.C3]=1;"";[.C3]) ->  | H3: of:=IF([.D3]=1;"";[.D3]) -> 0.218916 | I3: of:=IF([.E3]=1;"";[.E3]) -> 0.218916
A4: 3 | B4: strcpy: &""{\0,\x01,\x01,\x01,\x01,\x01} &"pgn"{\0,p,\0} :=> &"pgn"{\0,p,\0} | C4: 1 | D4: 0.077934 | E4: 0.077934 | G4: of:=IF([.C4]=1;"";[.C4]) ->  | H4: of:=IF([.D4]=1;"";[.D4]) -> 0.077934 | I4: of:=IF([.E4]=1;"";[.E4]) -> 0.077934
A5: 4 | B5: strcpy: &""{\0,\x01,\x01,\x01,\x01,\x01} &"xyim"{\0,\0} :=> &"xyim"{\0,\0} | C5: 1 | D5: 0.0409073 | E5: 0.0409073 | G5: of:=IF([.C5]=1;"";[.C5]) ->  | H5: of:=IF([.D5]=1;"";[.D5]) -> 0.0409073 | I5: of:=IF([.E5]=1;"";[.E5]) -> 0.0409073
A6: 5 | B6: strcpy: &""{\0,\x01,\x01,\x01,\x01,\x01} &"hocsp"{\0} :=> &"hocsp"{\0} | C6: 1 | D6: 0.029329 | E6: 0.029329 | G6: of:=IF([.C6]=1;"";[.C6]) ->  | H6: of:=IF([.D6]=1;"";[.D6]) -> 0.029329 | I6: of:=IF([.E6]=1;"";[.E6]) -> 0.029329
A7: 6 | B7: strcpy: &"t"{\0,\x01,\x01,\x01,\x01} &""{\0,p,e,x,t,\0} :=> &""{\0,\0,p,m,u,\0} | C7: 1 | D7: 1 | E7: 1 | G7: of:=IF([.C7]=1;"";[.C7]) ->  | H7: of:=IF([.D7]=1;"";[.D7]) ->  | I7: of:=IF([.E7]=1;"";[.E7]) -> 
A8: 7 | B8: strcpy: &"w"{\0,\x01,\x01,\x01,\x01} &"j"{\0,p,j,a,\0} :=> &"j"{\0,p,r,k,\0} | C8: 1 | D8: 1 | E8: 1 | G8: of:=IF([.C8]=1;"";[.C8]) ->  | H8: of:=IF([.D8]=1;"";[.D8]) ->  | I8: of:=IF([.E8]=1;"";[.E8]) -> 
A9: 8 | B9: strcpy: &"k"{\0,\x01,\x01,\x01,\x01} &"ft"{\0,p,u,\0} :=> &"ft"{\0,p,d,\0} | C9: 1 | D9: 0.212346 | E9: 0.212346 | G9: of:=IF([.C9]=1;"";[.C9]) ->  | H9: of:=IF([.D9]=1;"";[.D9]) -> 0.212346 | I9: of:=IF([.E9]=1;"";[.E9]) -> 0.212346
A10: 9 | B10: strcpy: &"h"{\0,\x01,\x01,\x01,\x01} &"dna"{\0,p,\0} :=> &"dna"{\0,p,\0} | C10: 1 | D10: 0.0828165 | E10: 0.0828165 | G10: of:=IF([.C10]=1;"";[.C10]) ->  | H10: of:=IF([.D10]=1;"";[.D10]) -> 0.0828165 | I10: of:=IF([.E10]=1;"";[.E10]) -> 0.0828165
A11: 10 | B11: strcpy: &"t"{\0,\x01,\x01,\x01,\x01} &"xeua"{\0,\0} :=> &"xeua"{\0,\0} | C11: 1 | D11: 0.0431455 | E11: 0.0431455 | G11: of:=IF([.C11]=1;"";[.C11]) ->  | H11: of:=IF([.D11]=1;"";[.D11]) -> 0.0431455 | I11: of:=IF([.E11]=1;"";[.E11]) -> 0.0431455
A12: 11 | B12: strcpy: &"o"{\0,\x01,\x01,\x01,\x01} &"nalik"{\0} :=> &"nalik"{\0} | C12: 1 | D12: 0.0307985 | E12: 0.0307985 | G12: of:=IF([.C12]=1;"";[.C12]) ->  | H12: of:=IF([.D12]=1;"";[.D12]) -> 0.0307985 | I12: of:=IF([.E12]=1;"";[.E12]) -> 0.0307985
A13: 12 | B13: strcpy: &"qa"{\0,\x01,\x01,\x01} &""{\0,p,q,s,f,\0} :=> &""{\0,a,\0,p,e,\0} | C13: 0.157876 | D13: 1 | E13: 1 | G13: of:=IF([.C13]=1;"";[.C13]) -> 0.157876 | H13: of:=IF([.D13]=1;"";[.D13]) ->  | I13: of:=IF([.E13]=1;"";[.E13]) -> 
A14: 13 | B14: strcpy: &"xs"{\0,\x01,\x01,\x01} &"n"{\0,p,m,o,\0} :=> &"n"{\0,\0,p,j,\0} | C14: 0.171077 | D14: 1 | E14: 1 | G14: of:=IF([.C14]=1;"";[.C14]) -> 0.171077 | H14: of:=IF([.D14]=1;"";[.D14]) ->  | I14: of:=IF([.E14]=1;"";[.E14]) -> 
A15: 14 | B15: strcpy: &"ny"{\0,\x01,\x01,\x01} &"sc"{\0,p,e,\0} :=> &"sc"{\0,p,h,\0} | C15: 0.213806 | D15: 0.213806 | E15: 0.213806 | G15: of:=IF([.C15]=1;"";[.C15]) -> 0.213806 | H15: of:=IF([.D15]=1;"";[.D15]) -> 0.213806 | I15: of:=IF([.E15]=1;"";[.E15]) -> 0.213806
A16: 15 | B16: strcpy: &"oc"{\0,\x01,\x01,\x01} &"rfs"{\0,p,\0} :=> &"rfs"{\0,p,\0} | C16: 0.214286 | D16: 0.0774077 | E16: 0.0774077 | G16: of:=IF([.C16]=1;"";[.C16]) -> 0.214286 | H16: of:=IF([.D16]=1;"";[.D16]) -> 0.0774077 | I16: of:=IF([.E16]=1;"";[.E16]) -> 0.0774077
A17: 16 | B17: strcpy: &"ib"{\0,\x01,\x01,\x01} &"tnyg"{\0,\0} :=> &"tnyg"{\0,\0} | C17: 0.210352 | D17: 0.0401713 | E17: 0.0401713 | G17: of:=IF([.C17]=1;"";[.C17]) -> 0.210352 | H17: of:=IF([.D17]=1;"";[.D17]) -> 0.0401713 | I17: of:=IF([.E17]=1;"";[.E17]) -> 0.0401713
A18: 17 | B18: strcpy: &"uy"{\0,\x01,\x01,\x01} &"eklum"{\0} :=> &"eklum"{\0} | C18: 0.202489 | D18: 0.0281029 | E18: 0.0281029 | G18: of:=IF([.C18]=1;"";[.C18]) -> 0.202489 | H18: of:=IF([.D18]=1;"";[.D18]) -> 0.0281029 | I18: of:=IF([.E18]=1;"";[.E18]) -> 0.0281029
A19: 18 | B19: strcpy: &"yng"{\0,\x01,\x01} &""{\0,p,n,m,g,\0} :=> &""{\0,n,g,\0,p,\0} | C19: 0.0843179 | D19: 1 | E19: 1 | G19: of:=IF([.C19]=1;"";[.C19]) -> 0.0843179 | H19: of:=IF([.D19]=1;"";[.D19]) ->  | I19: of:=IF([.E19]=1;"";[.E19]) -> 
A20: 19 | B20: strcpy: &"soc"{\0,\x01,\x01} &"w"{\0,p,s,a,\0} :=> &"w"{\0,c,\0,p,\0} | C20: 0.0862147 | D20: 1 | E20: 1 | G20: of:=IF([.C20]=1;"";[.C20]) -> 0.0862147 | H20: of:=IF([.D20]=1;"";[.D20]) ->  | I20: of:=IF([.E20]=1;"";[.E20]) -> 
A21: 20 | B21: strcpy: &"zrh"{\0,\x01,\x01} &"ma"{\0,p,l,\0} :=> &"ma"{\0,\0,p,\0} | C21: 0.0683018 | D21: 0.219364 | E21: 0.219364 | G21: of:=IF([.C21]=1;"";[.C21]) -> 0.0683018 | H21: of:=IF([.D21]=1;"";[.D21]) -> 0.219364 | I21: of:=IF([.E21]=1;"";[.E21]) -> 0.219364
A22: 21 | B22: strcpy: &"grs"{\0,\x01,\x01} &"rvl"{\0,p,\0} :=> &"rvl"{\0,p,\0} | C22: 0.0870761 | D22: 0.0744123 | E22: 0.0744123 | G22: of:=IF([.C22]=1;"";[.C22]) -> 0.0870761 | H22: of:=IF([.D22]=1;"";[.D22]) -> 0.0744123 | I22: of:=IF([.E22]=1;"";[.E22]) -> 0.0744123
A23: 22 | B23: strcpy: &"zaq"{\0,\x01,\x01} &"drig"{\0,\0} :=> &"drig"{\0,\0} | C23: 0.0766819 | D23: 0.0469413 | E23: 0.0469413 | G23: of:=IF([.C23]=1;"";[.C23]) -> 0.0766819 | H23: of:=IF([.D23]=1;"";[.D23]) -> 0.0469413 | I23: of:=IF([.E23]=1;"";[.E23]) -> 0.0469413
A24: 23 | B24: strcpy: &"jnc"{\0,\x01,\x01} &"acllb"{\0} :=> &"acllb"{\0} | C24: 0.0680298 | D24: 0.0293089 | E24: 0.0293089 | G24: of:=IF([.C24]=1;"";[.C24]) -> 0.0680298 | H24: of:=IF([.D24]=1;"";[.D24]) -> 0.0293089 | I24: of:=IF([.E24]=1;"";[.E24]) -> 0.0293089
A25: 24 | B25: strcpy: &"eren"{\0,\x01} &""{\0,p,p,r,k,\0} :=> &""{\0,r,e,n,\0,\0} | C25: 0.0507205 | D25: 1 | E25: 1 | G25: of:=IF([.C25]=1;"";[.C25]) -> 0.0507205 | H25: of:=IF([.D25]=1;"";[.D25]) ->  | I25: of:=IF([.E25]=1;"";[.E25]) -> 
A26: 25 | B26: strcpy: &"lnka"{\0,\x01} &"r"{\0,p,a,m,\0} :=> &"r"{\0,k,a,\0,\0} | C26: 0.0413791 | D26: 1 | E26: 1 | G26: of:=IF([.C26]=1;"";[.C26]) -> 0.0413791 | H26: of:=IF([.D26]=1;"";[.D26]) ->  | I26: of:=IF([.E26]=1;"";[.E26]) -> 
A27: 26 | B27: strcpy: &"boox"{\0,\x01} &"ct"{\0,p,o,\0} :=> &"ct"{\0,x,\0,\0} | C27: 0.0444742 | D27: 0.218466 | E27: 0.218466 | G27: of:=IF([.C27]=1;"";[.C27]) -> 0.0444742 | H27: of:=IF([.D27]=1;"";[.D27]) -> 0.218466 | I27: of:=IF([.E27]=1;"";[.E27]) -> 0.218466
A28: 27 | B28: strcpy: &"hkul"{\0,\x01} &"lat"{\0,p,\0} :=> &"lat"{\0,\0,\0} | C28: 0.0389663 | D28: 0.0902298 | E28: 0.0902298 | G28: of:=IF([.C28]=1;"";[.C28]) -> 0.0389663 | H28: of:=IF([.D28]=1;"";[.D28]) -> 0.0902298 | I28: of:=IF([.E28]=1;"";[.E28]) -> 0.0902298
A29: 28 | B29: strcpy: &"wgrv"{\0,\x01} &"bspw"{\0,\0} :=> &"bspw"{\0,\0} | C29: 0.0389586 | D29: 0.0406302 | E29: 0.0406302 | G29: of:=IF([.C29]=1;"";[.C29]) -> 0.0389586 | H29: of:=IF([.D29]=1;"";[.D29]) -> 0.0406302 | I29: of:=IF([.E29]=1;"";[.E29]) -> 0.0406302
A30: 29 | B30: strcpy: &"wagn"{\0,\x01} &"lllve"{\0} :=> &"lllve"{\0} | C30: 0.0462121 | D30: 0.0305852 | E30: 0.0305852 | G30: of:=IF([.C30]=1;"";[.C30]) -> 0.0462121 | H30: of:=IF([.D30]=1;"";[.D30]) -> 0.0305852 | I30: of:=IF([.E30]=1;"";[.E30]) -> 0.0305852
A31: 30 | B31: strcpy: &"skgfo"{\0} &""{\0,p,g,j,a,\0} :=> &""{\0,k,g,f,o,\0} | C31: 0.0250875 | D31: 1 | E31: 1 | G31: of:=IF([.C31]=1;"";[.C31]) -> 0.0250875 | H31: of:=IF([.D31]=1;"";[.D31]) ->  | I31: of:=IF([.E31]=1;"";[.E31]) -> 
A32: 31 | B32: strcpy: &"hvucl"{\0} &"e"{\0,p,b,f,\0} :=> &"e"{\0,u,c,l,\0} | C32: 0.0246417 | D32: 1 | E32: 1 | G32: of:=IF([.C32]=1;"";[.C32]) -> 0.0246417 | H32: of:=IF([.D32]=1;"";[.D32]) ->  | I32: of:=IF([.E32]=1;"";[.E32]) -> 
A33: 32 | B33: strcpy: &"ekhom"{\0} &"fy"{\0,p,u,\0} :=> &"fy"{\0,o,m,\0} | C33: 0.028434 | D33: 0.198096 | E33: 0.198096 | G33: of:=IF([.C33]=1;"";[.C33]) -> 0.028434 | H33: of:=IF([.D33]=1;"";[.D33]) -> 0.198096 | I33: of:=IF([.E33]=1;"";[.E33]) -> 0.198096
A34: 33 | B34: strcpy: &"wurcu"{\0} &"khi"{\0,p,\0} :=> &"khi"{\0,u,\0} | C34: 0.0264635 | D34: 0.0807324 | E34: 0.0807324 | G34: of:=IF([.C34]=1;"";[.C34]) -> 0.0264635 | H34: of:=IF([.D34]=1;"";[.D34]) -> 0.0807324 | I34: of:=IF([.E34]=1;"";[.E34]) -> 0.0807324
A35: 34 | B35: strcpy: &"ridbo"{\0} &"bdau"{\0,\0} :=> &"bdau"{\0,\0} | C35: 0.0288597 | D35: 0.0421204 | E35: 0.0421204 | G35: of:=IF([.C35]=1;"";[.C35]) -> 0.0288597 | H35: of:=IF([.D35]=1;"";[.D35]) -> 0.0421204 | I35: of:=IF([.E35]=1;"";[.E35]) -> 0.0421204
A36: 35 | B36: strcpy: &"qircy"{\0} &"rbtcy"{\0} :=> &"rbtcy"{\0} | C36: 0.0272082 | D36: 0.0268419 | E36: 0.0268419 | G36: of:=IF([.C36]=1;"";[.C36]) -> 0.0272082 | H36: of:=IF([.D36]=1;"";[.D36]) -> 0.0268419 | I36: of:=IF([.E36]=1;"";[.E36]) -> 0.0268419
A37: 1 | B37: strncpy: &""{\0,\x01,\x01,\x01,\x01,\x01} &""{\0,p,l,k,u,\0} 5 :=> &""{\0,\0,\0,\0,\0,\0} | C37: 1 | D37: 1 | E37: 1 | G37: of:=IF([.C37]=1;"";[.C37]) ->  | H37: of:=IF([.D37]=1;"";[.D37]) ->  | I37: of:=IF([.E37]=1;"";[.E37]) ->  | K37: of:=AVERAGE([.G37:.G72]) -> 0.0877365791666667 | L37: of:=AVERAGE([.H37:.H72]) -> 0.0861235125 | M37: of:=AVERAGE([.I37:.I72]) -> 0.0861235125 | O37: of:=AVERAGE([.K37:.M37]) -> 0.0866612013888889
A38: 2 | B38: strncpy: &""{\0,\x01,\x01,\x01,\x01,\x01} &"p"{\0,p,h,r,\0} 5 :=> &"p"{\0,\0,\0,\0,\0} | C38: 1 | D38: 1 | E38: 1 | G38: of:=IF([.C38]=1;"";[.C38]) ->  | H38: of:=IF([.D38]=1;"";[.D38]) ->  | I38: of:=IF([.E38]=1;"";[.E38]) -> 
A39: 3 | B39: strncpy: &""{\0,\x01,\x01,\x01,\x01,\x01} &"be"{\0,p,t,\0} 5 :=> &"be"{\0,\0,\0,\0} | C39: 1 | D39: 0.219808 | E39: 0.219808 | G39: of:=IF([.C39]=1;"";[.C39]) ->  | H39: of:=IF([.D39]=1;"";[.D39]) -> 0.219808 | I39: of:=IF([.E39]=1;"";[.E39]) -> 0.219808
A40: 4 | B40: strncpy: &""{\0,\x01,\x01,\x01,\x01,\x01} &"ufo"{\0,p,\0} 5 :=> &"ufo"{\0,\0,\0} | C40: 1 | D40: 0.0834159 | E40: 0.0834159 | G40: of:=IF([.C40]=1;"";[.C40]) ->  | H40: of:=IF([.D40]=1;"";[.D40]) -> 0.0834159 | I40: of:=IF([.E40]=1;"";[.E40]) -> 0.0834159
A41: 5 | B41: strncpy: &""{\0,\x01,\x01,\x01,\x01,\x01} &"mfhj"{\0,\0} 5 :=> &"mfhj"{\0,\0} | C41: 1 | D41: 0.0293953 | E41: 0.0293953 | G41: of:=IF([.C41]=1;"";[.C41]) ->  | H41: of:=IF([.D41]=1;"";[.D41]) -> 0.0293953 | I41: of:=IF([.E41]=1;"";[.E41]) -> 0.0293953
A42: 6 | B42: strncpy: &""{\0,\x01,\x01,\x01,\x01,\x01} &"zcqiw"{\0} 5 :=> &"zcqiw"{\0} | C42: 1 | D42: 0.020694 | E42: 0.020694 | G42: of:=IF([.C42]=1;"";[.C42]) ->  | H42: of:=IF([.D42]=1;"";[.D42]) -> 0.020694 | I42: of:=IF([.E42]=1;"";[.E42]) -> 0.020694
A43: 7 | B43: strncpy: &"k"{\0,\x01,\x01,\x01,\x01} &""{\0,p,l,u,d,\0} 5 :=> &""{\0,\0,\0,\0,\0,\0} | C43: 1 | D43: 1 | E43: 1 | G43: of:=IF([.C43]=1;"";[.C43]) ->  | H43: of:=IF([.D43]=1;"";[.D43]) ->  | I43: of:=IF([.E43]=1;"";[.E43]) -> 
A44: 8 | B44: strncpy: &"r"{\0,\x01,\x01,\x01,\x01} &"l"{\0,p,w,r,\0} 5 :=> &"l"{\0,\0,\0,\0,\0} | C44: 1 | D44: 1 | E44: 1 | G44: of:=IF([.C44]=1;"";[.C44]) ->  | H44: of:=IF([.D44]=1;"";[.D44]) ->  | I44: of:=IF([.E44]=1;"";[.E44]) -> 
A45: 9 | B45: strncpy: &"w"{\0,\x01,\x01,\x01,\x01} &"hr"{\0,p,l,\0} 5 :=> &"hr"{\0,\0,\0,\0} | C45: 1 | D45: 0.211356 | E45: 0.211356 | G45: of:=IF([.C45]=1;"";[.C45]) ->  | H45: of:=IF([.D45]=1;"";[.D45]) -> 0.211356 | I45: of:=IF([.E45]=1;"";[.E45]) -> 0.211356
A46: 10 | B46: strncpy: &"x"{\0,\x01,\x01,\x01,\x01} &"pje"{\0,p,\0} 5 :=> &"pje"{\0,\0,\0} | C46: 1 | D46: 0.0696067 | E46: 0.0696067 | G46: of:=IF([.C46]=1;"";[.C46]) ->  | H46: of:=IF([.D46]=1;"";[.D46]) -> 0.0696067 | I46: of:=IF([.E46]=1;"";[.E46]) -> 0.0696067
A47: 11 | B47: strncpy: &"i"{\0,\x01,\x01,\x01,\x01} &"gswf"{\0,\0} 5 :=> &"gswf"{\0,\0} | C47: 1 | D47: 0.0396934 | E47: 0.0396934 | G47: of:=IF([.C47]=1;"";[.C47]) ->  | H47: of:=IF([.D47]=1;"";[.D47]) -> 0.0396934 | I47: of:=IF([.E47]=1;"";[.E47]) -> 0.0396934
A48: 12 | B48: strncpy: &"v"{\0,\x01,\x01,\x01,\x01} &"zmfts"{\0} 5 :=> &"zmfts"{\0} | C48: 1 | D48: 0.0257648 | E48: 0.0257648 | G48: of:=IF([.C48]=1;"";[.C48]) ->  | H48: of:=IF([.D48]=1;"";[.D48]) -> 0.0257648 | I48: of:=IF([.E48]=1;"";[.E48]) -> 0.0257648
A49: 13 | B49: strncpy: &"fk"{\0,\x01,\x01,\x01} &""{\0,p,y,j,m,\0} 5 :=> &""{\0,\0,\0,\0,\0,\0} | C49: 0.178726 | D49: 1 | E49: 1 | G49: of:=IF([.C49]=1;"";[.C49]) -> 0.178726 | H49: of:=IF([.D49]=1;"";[.D49]) ->  | I49: of:=IF([.E49]=1;"";[.E49]) -> 
A50: 14 | B50: strncpy: &"sv"{\0,\x01,\x01,\x01} &"o"{\0,p,c,b,\0} 5 :=> &"o"{\0,\0,\0,\0,\0} | C50: 0.186599 | D50: 1 | E50: 1 | G50: of:=IF([.C50]=1;"";[.C50]) -> 0.186599 | H50: of:=IF([.D50]=1;"";[.D50]) ->  | I50: of:=IF([.E50]=1;"";[.E50]) -> 
A51: 15 | B51: strncpy: &"gh"{\0,\x01,\x01,\x01} &"xs"{\0,p,o,\0} 5 :=> &"xs"{\0,\0,\0,\0} | C51: 0.216638 | D51: 0.171077 | E51: 0.171077 | G51: of:=IF([.C51]=1;"";[.C51]) -> 0.216638 | H51: of:=IF([.D51]=1;"";[.D51]) -> 0.171077 | I51: of:=IF([.E51]=1;"";[.E51]) -> 0.171077
A52: 16 | B52: strncpy: &"mk"{\0,\x01,\x01,\x01} &"cnh"{\0,p,\0} 5 :=> &"cnh"{\0,\0,\0} | C52: 0.168677 | D52: 0.0690975 | E52: 0.0690975 | G52: of:=IF([.C52]=1;"";[.C52]) -> 0.168677 | H52: of:=IF([.D52]=1;"";[.D52]) -> 0.0690975 | I52: of:=IF([.E52]=1;"";[.E52]) -> 0.0690975
A53: 17 | B53: strncpy: &"xp"{\0,\x01,\x01,\x01} &"auva"{\0,\0} 5 :=> &"auva"{\0,\0} | C53: 0.209845 | D53: 0.0424444 | E53: 0.0424444 | G53: of:=IF([.C53]=1;"";[.C53]) -> 0.209845 | H53: of:=IF([.D53]=1;"";[.D53]) -> 0.0424444 | I53: of:=IF([.E53]=1;"";[.E53]) -> 0.0424444
A54: 18 | B54: strncpy: &"of"{\0,\x01,\x01,\x01} &"gsorc"{\0} 5 :=> &"gsorc"{\0} | C54: 0.22242 | D54: 0.0302727 | E54: 0.0302727 | G54: of:=IF([.C54]=1;"";[.C54]) -> 0.22242 | H54: of:=IF([.D54]=1;"";[.D54]) -> 0.0302727 | I54: of:=IF([.E54]=1;"";[.E54]) -> 0.0302727
A55: 19 | B55: strncpy: &"zis"{\0,\x01,\x01} &""{\0,p,h,t,m,\0} 5 :=> &""{\0,\0,\0,\0,\0,\0} | C55: 0.0838544 | D55: 1 | E55: 1 | G55: of:=IF([.C55]=1;"";[.C55]) -> 0.0838544 | H55: of:=IF([.D55]=1;"";[.D55]) ->  | I55: of:=IF([.E55]=1;"";[.E55]) -> 
A56: 20 | B56: strncpy: &"cof"{\0,\x01,\x01} &"v"{\0,p,c,e,\0} 5 :=> &"v"{\0,\0,\0,\0,\0} | C56: 0.0899771 | D56: 1 | E56: 1 | G56: of:=IF([.C56]=1;"";[.C56]) -> 0.0899771 | H56: of:=IF([.D56]=1;"";[.D56]) ->  | I56: of:=IF([.E56]=1;"";[.E56]) -> 
A57: 21 | B57: strncpy: &"joe"{\0,\x01,\x01} &"ew"{\0,p,m,\0} 5 :=> &"ew"{\0,\0,\0,\0} | C57: 0.0809699 | D57: 0.215706 | E57: 0.215706 | G57: of:=IF([.C57]=1;"";[.C57]) -> 0.0809699 | H57: of:=IF([.D57]=1;"";[.D57]) -> 0.215706 | I57: of:=IF([.E57]=1;"";[.E57]) -> 0.215706
A58: 22 | B58: strncpy: &"ald"{\0,\x01,\x01} &"vea"{\0,p,\0} 5 :=> &"vea"{\0,\0,\0} | C58: 0.0888106 | D58: 0.0898383 | E58: 0.0898383 | G58: of:=IF([.C58]=1;"";[.C58]) -> 0.0888106 | H58: of:=IF([.D58]=1;"";[.D58]) -> 0.0898383 | I58: of:=IF([.E58]=1;"";[.E58]) -> 0.0898383
A59: 23 | B59: strncpy: &"dvu"{\0,\x01,\x01} &"faek"{\0,\0} 5 :=> &"faek"{\0,\0} | C59: 0.0740765 | D59: 0.0435582 | E59: 0.0435582 | G59: of:=IF([.C59]=1;"";[.C59]) -> 0.0740765 | H59: of:=IF([.D59]=1;"";[.D59]) -> 0.0435582 | I59: of:=IF([.E59]=1;"";[.E59]) -> 0.0435582
A60: 24 | B60: strncpy: &"fyo"{\0,\x01,\x01} &"laaol"{\0} 5 :=> &"laaol"{\0} | C60: 0.0789793 | D60: 0.0271671 | E60: 0.0271671 | G60: of:=IF([.C60]=1;"";[.C60]) -> 0.0789793 | H60: of:=IF([.D60]=1;"";[.D60]) -> 0.0271671 | I60: of:=IF([.E60]=1;"";[.E60]) -> 0.0271671
A61: 25 | B61: strncpy: &"exxy"{\0,\x01} &""{\0,p,p,o,j,\0} 5 :=> &""{\0,\0,\0,\0,\0,\0} | C61: 0.0363028 | D61: 1 | E61: 1 | G61: of:=IF([.C61]=1;"";[.C61]) -> 0.0363028 | H61: of:=IF([.D61]=1;"";[.D61]) ->  | I61: of:=IF([.E61]=1;"";[.E61]) -> 
A62: 26 | B62: strncpy: &"xcdy"{\0,\x01} &"l"{\0,p,k,t,\0} 5 :=> &"l"{\0,\0,\0,\0,\0} | C62: 0.0389543 | D62: 1 | E62: 1 | G62: of:=IF([.C62]=1;"";[.C62]) -> 0.0389543 | H62: of:=IF([.D62]=1;"";[.D62]) ->  | I62: of:=IF([.E62]=1;"";[.E62]) -> 
A63: 27 | B63: strncpy: &"rusr"{\0,\x01} &"ze"{\0,p,e,\0} 5 :=> &"ze"{\0,\0,\0,\0} | C63: 0.0446011 | D63: 0.208818 | E63: 0.208818 | G63: of:=IF([.C63]=1;"";[.C63]) -> 0.0446011 | H63: of:=IF([.D63]=1;"";[.D63]) -> 0.208818 | I63: of:=IF([.E63]=1;"";[.E63]) -> 0.208818
A64: 28 | B64: strncpy: &"aifu"{\0,\x01} &"csp"{\0,p,\0} 5 :=> &"csp"{\0,\0,\0} | C64: 0.0461352 | D64: 0.0823734 | E64: 0.0823734 | G64: of:=IF([.C64]=1;"";[.C64]) -> 0.0461352 | H64: of:=IF([.D64]=1;"";[.D64]) -> 0.0823734 | I64: of:=IF([.E64]=1;"";[.E64]) -> 0.0823734
A65: 29 | B65: strncpy: &"serb"{\0,\x01} &"ywar"{\0,\0} 5 :=> &"ywar"{\0,\0} | C65: 0.0475242 | D65: 0.0452924 | E65: 0.0452924 | G65: of:=IF([.C65]=1;"";[.C65]) -> 0.0475242 | H65: of:=IF([.D65]=1;"";[.D65]) -> 0.0452924 | I65: of:=IF([.E65]=1;"";[.E65]) -> 0.0452924
A66: 30 | B66: strncpy: &"jesh"{\0,\x01} &"ssyro"{\0} 5 :=> &"ssyro"{\0} | C66: 0.0464731 | D66: 0.0289771 | E66: 0.0289771 | G66: of:=IF([.C66]=1;"";[.C66]) -> 0.0464731 | H66: of:=IF([.D66]=1;"";[.D66]) -> 0.0289771 | I66: of:=IF([.E66]=1;"";[.E66]) -> 0.0289771
A67: 31 | B67: strncpy: &"rbjoa"{\0} &""{\0,p,i,t,e,\0} 5 :=> &""{\0,\0,\0,\0,\0,\0} | C67: 0.0269548 | D67: 1 | E67: 1 | G67: of:=IF([.C67]=1;"";[.C67]) -> 0.0269548 | H67: of:=IF([.D67]=1;"";[.D67]) ->  | I67: of:=IF([.E67]=1;"";[.E67]) -> 
A68: 32 | B68: strncpy: &"avovl"{\0} &"u"{\0,p,c,t,\0} 5 :=> &"u"{\0,\0,\0,\0,\0} | C68: 0.0264155 | D68: 1 | E68: 1 | G68: of:=IF([.C68]=1;"";[.C68]) -> 0.0264155 | H68: of:=IF([.D68]=1;"";[.D68]) ->  | I68: of:=IF([.E68]=1;"";[.E68]) -> 
A69: 33 | B69: strncpy: &"lvylc"{\0} &"xf"{\0,p,v,\0} 5 :=> &"xf"{\0,\0,\0,\0} | C69: 0.0257323 | D69: 0.180111 | E69: 0.180111 | G69: of:=IF([.C69]=1;"";[.C69]) -> 0.0257323 | H69: of:=IF([.D69]=1;"";[.D69]) -> 0.180111 | I69: of:=IF([.E69]=1;"";[.E69]) -> 0.180111
A70: 34 | B70: strncpy: &"eibcy"{\0} &"jba"{\0,p,\0} 5 :=> &"jba"{\0,\0,\0} | C70: 0.026683 | D70: 0.0578959 | E70: 0.0578959 | G70: of:=IF([.C70]=1;"";[.C70]) -> 0.026683 | H70: of:=IF([.D70]=1;"";[.D70]) -> 0.0578959 | I70: of:=IF([.E70]=1;"";[.E70]) -> 0.0578959
A71: 35 | B71: strncpy: &"heinn"{\0} &"vcto"{\0,\0} 5 :=> &"vcto"{\0,\0} | C71: 0.0314657 | D71: 0.0431416 | E71: 0.0431416 | G71: of:=IF([.C71]=1;"";[.C71]) -> 0.0314657 | H71: of:=IF([.D71]=1;"";[.D71]) -> 0.0431416 | I71: of:=IF([.E71]=1;"";[.E71]) -> 0.0431416
A72: 36 | B72: strncpy: &"eaggt"{\0} &"seeda"{\0} 5 :=> &"seeda"{\0} | C72: 0.0288631 | D72: 0.0314596 | E72: 0.0314596 | G72: of:=IF([.C72]=1;"";[.C72]) -> 0.0288631 | H72: of:=IF([.D72]=1;"";[.D72]) -> 0.0314596 | I72: of:=IF([.E72]=1;"";[.E72]) -> 0.0314596

Sheet: strcat
A1: # | B1: Test Case | C1: N1 | D1: N2 | E1: N3
A2: 1 | B2: strcat: &""{\0,\x01,\x01,\x01,\x01,\x01,\x01,\x01,\x01,\x01} &"k"{\0,p,e,\0} :=> &"k"{\0,p,c,e,i,f,k,m,\0} | C2: 1 | D2: 1 | E2: 1 | G2: of:=IF([.C2]=1;"";[.C2]) ->  | H2: of:=IF([.D2]=1;"";[.D2]) ->  | I2: of:=IF([.E2]=1;"";[.E2]) ->  | K2: of:=AVERAGE([.G2:.G41]) -> 0.061881129032258 | L2: of:=AVERAGE([.H2:.H41]) -> 0.111597618636364 | M2: of:=AVERAGE([.I2:.I41]) -> 0.0428121291891892 | O2: of:=AVERAGE([.K2:.M2]) -> 0.0720969589526036
A3: 2 | B3: strcat: &""{\0,\x01,\x01,\x01,\x01,\x01,\x01,\x01,\x01,\x01} &"ay"{\0,p,\0} :=> &"ay"{\0,p,p,u,o,k,i,\0} | C3: 1 | D3: 0.218014 | E3: 0.218014 | G3: of:=IF([.C3]=1;"";[.C3]) ->  | H3: of:=IF([.D3]=1;"";[.D3]) -> 0.218014 | I3: of:=IF([.E3]=1;"";[.E3]) -> 0.218014
A4: 3 | B4: strcat: &""{\0,\x01,\x01,\x01,\x01,\x01,\x01,\x01,\x01,\x01} &"oti"{\0,\0} :=> &"oti"{\0,p,g,y,b,w,\0} | C4: 1 | D4: 0.0893898 | E4: 0.0893898 | G4: of:=IF([.C4]=1;"";[.C4]) ->  | H4: of:=IF([.D4]=1;"";[.D4]) -> 0.0893898 | I4: of:=IF([.E4]=1;"";[.E4]) -> 0.0893898
A5: 4 | B5: strcat: &""{\0,\x01,\x01,\x01,\x01,\x01,\x01,\x01,\x01,\x01} &"lexe"{\0} :=> &"lexe"{\0,p,n,m,k,\0} | C5: 1 | D5: 0.0453462 | E5: 0.0453462 | H5: of:=IF([.D5]=1;"";[.D5]) -> 0.0453462 | I5: of:=IF([.E5]=1;"";[.E5]) -> 0.0453462
A6: 5 | B6: strcat: &"t"{\0,\x01,\x01,\x01,\x01,\x01,\x01,\x01,\x01} &""{\0,p,f,s,\0} :=> &"t"{\0,p,t,i,l,e,x,l,\0} | C6: 1 | D6: 1 | E6: 1 | G6: of:=IF([.C6]=1;"";[.C6]) ->  | H6: of:=IF([.D6]=1;"";[.D6]) ->  | I6: of:=IF([.E6]=1;"";[.E6]) -> 
A7: 6 | B7: strcat: &"t"{\0,\x01,\x01,\x01,\x01,\x01,\x01,\x01,\x01} &"w"{\0,p,f,\0} :=> &"tw"{\0,p,h,r,e,x,h,\0} | C7: 1 | D7: 1 | E7: 0.210856 | G7: of:=IF([.C7]=1;"";[.C7]) ->  | H7: of:=IF([.D7]=1;"";[.D7]) ->  | I7: of:=IF([.E7]=1;"";[.E7]) -> 0.210856
A8: 7 | B8: strcat: &"t"{\0,\x01,\x01,\x01,\x01,\x01,\x01,\x01,\x01} &"ew"{\0,p,\0} :=> &"tew"{\0,p,l,d,u,n,\0} | C8: 1 | D8: 0.215706 | E8: 0.0884731 | G8: of:=IF([.C8]=1;"";[.C8]) ->  | H8: of:=IF([.D8]=1;"";[.D8]) -> 0.215706 | I8: of:=IF([.E8]=1;"";[.E8]) -> 0.0884731
A9: 8 | B9: strcat: &"y"{\0,\x01,\x01,\x01,\x01,\x01,\x01,\x01,\x01} &"kky"{\0,\0} :=> &"ykky"{\0,p,t,d,i,\0} | C9: 1 | D9: 0.072329 | E9: 0.036121 | G9: of:=IF([.C9]=1;"";[.C9]) ->  | H9: of:=IF([.D9]=1;"";[.D9]) -> 0.072329 | I9: of:=IF([.E9]=1;"";[.E9]) -> 0.036121
A10: 9 | B10: strcat: &"f"{\0,\x01,\x01,\x01,\x01,\x01,\x01,\x01,\x01} &"yius"{\0} :=> &"fyius"{\0,p,f,h,\0} | C10: 1 | D10: 0.0438311 | E10: 0.0271662 | G10: of:=IF([.C10]=1;"";[.C10]) ->  | H10: of:=IF([.D10]=1;"";[.D10]) -> 0.0438311 | I10: of:=IF([.E10]=1;"";[.E10]) -> 0.0271662
A11: 10 | B11: strcat: &"zk"{\0,\x01,\x01,\x01,\x01,\x01,\x01,\x01} &""{\0,p,h,b,\0} :=> &"zk"{\0,p,i,y,g,n,k,\0} | C11: 0.177645 | D11: 1 | E11: 0.177645 | G11: of:=IF([.C11]=1;"";[.C11]) -> 0.177645 | H11: of:=IF([.D11]=1;"";[.D11]) ->  | I11: of:=IF([.E11]=1;"";[.E11]) -> 0.177645
A12: 11 | B12: strcat: &"ds"{\0,\x01,\x01,\x01,\x01,\x01,\x01,\x01} &"q"{\0,p,a,\0} :=> &"dsq"{\0,p,o,g,y,t,\0} | C12: 0.213322 | D12: 1 | E12: 0.0797023 | G12: of:=IF([.C12]=1;"";[.C12]) -> 0.213322 | H12: of:=IF([.D12]=1;"";[.D12]) ->  | I12: of:=IF([.E12]=1;"";[.E12]) -> 0.0797023
A13: 12 | B13: strcat: &"ag"{\0,\x01,\x01,\x01,\x01,\x01,\x01,\x01} &"eb"{\0,p,\0} :=> &"ageb"{\0,p,h,i,a,\0} | C13: 0.216174 | D13: 0.209333 | E13: 0.0461261 | G13: of:=IF([.C13]=1;"";[.C13]) -> 0.216174 | H13: of:=IF([.D13]=1;"";[.D13]) -> 0.209333 | I13: of:=IF([.E13]=1;"";[.E13]) -> 0.0461261
A14: 13 | B14: strcat: &"kw"{\0,\x01,\x01,\x01,\x01,\x01,\x01,\x01} &"erv"{\0,\0} :=> &"kwerv"{\0,p,j,k,\0} | C14: 0.190869 | D14: 0.0907583 | E14: 0.0292128 | G14: of:=IF([.C14]=1;"";[.C14]) -> 0.190869 | H14: of:=IF([.D14]=1;"";[.D14]) -> 0.0907583 | I14: of:=IF([.E14]=1;"";[.E14]) -> 0.0292128
A15: 14 | B15: strcat: &"zh"{\0,\x01,\x01,\x01,\x01,\x01,\x01,\x01} &"mdrx"{\0} :=> &"zhmdrx"{\0,p,t,\0} | C15: 0.185724 | D15: 0.0360811 | E15: 0.0159744 | G15: of:=IF([.C15]=1;"";[.C15]) -> 0.185724 | H15: of:=IF([.D15]=1;"";[.D15]) -> 0.0360811 | I15: of:=IF([.E15]=1;"";[.E15]) -> 0.0159744
A16: 15 | B16: strcat: &"cop"{\0,\x01,\x01,\x01,\x01,\x01,\x01} &""{\0,p,c,a,\0} :=> &"cop"{\0,p,t,a,v,k,\0} | C16: 0.0881009 | D16: 1 | E16: 0.0881009 | G16: of:=IF([.C16]=1;"";[.C16]) -> 0.0881009 | H16: of:=IF([.D16]=1;"";[.D16]) ->  | I16: of:=IF([.E16]=1;"";[.E16]) -> 0.0881009
A17: 16 | B17: strcat: &"gge"{\0,\x01,\x01,\x01,\x01,\x01,\x01} &"p"{\0,p,p,\0} :=> &"ggep"{\0,p,e,t,t,\0} | C17: 0.0838216 | D17: 1 | E17: 0.0455064 | G17: of:=IF([.C17]=1;"";[.C17]) -> 0.0838216 | H17: of:=IF([.D17]=1;"";[.D17]) ->  | I17: of:=IF([.E17]=1;"";[.E17]) -> 0.0455064
A18: 17 | B18: strcat: &"qve"{\0,\x01,\x01,\x01,\x01,\x01,\x01} &"ka"{\0,p,\0} :=> &"qveka"{\0,p,a,e,\0} | C18: 0.0606164 | D18: 0.204058 | E18: 0.0222069 | G18: of:=IF([.C18]=1;"";[.C18]) -> 0.0606164 | H18: of:=IF([.D18]=1;"";[.D18]) -> 0.204058 | I18: of:=IF([.E18]=1;"";[.E18]) -> 0.0222069
A19: 18 | B19: strcat: &"wio"{\0,\x01,\x01,\x01,\x01,\x01,\x01} &"vyc"{\0,\0} :=> &"wiovyc"{\0,p,i,\0} | C19: 0.0885562 | D19: 0.0754023 | E19: 0.0202913 | G19: of:=IF([.C19]=1;"";[.C19]) -> 0.0885562 | H19: of:=IF([.D19]=1;"";[.D19]) -> 0.0754023 | I19: of:=IF([.E19]=1;"";[.E19]) -> 0.0202913
A20: 19 | B20: strcat: &"dst"{\0,\x01,\x01,\x01,\x01,\x01,\x01} &"gylm"{\0} :=> &"dstgylm"{\0,p,\0} | C20: 0.0875578 | D20: 0.0418109 | E20: 0.0150623 | G20: of:=IF([.C20]=1;"";[.C20]) -> 0.0875578 | H20: of:=IF([.D20]=1;"";[.D20]) -> 0.0418109 | I20: of:=IF([.E20]=1;"";[.E20]) -> 0.0150623
A21: 20 | B21: strcat: &"pofy"{\0,\x01,\x01,\x01,\x01,\x01} &""{\0,p,i,a,\0} :=> &"pofy"{\0,p,o,v,e,\0} | C21: 0.045188 | D21: 1 | E21: 0.045188 | G21: of:=IF([.C21]=1;"";[.C21]) -> 0.045188 | H21: of:=IF([.D21]=1;"";[.D21]) ->  | I21: of:=IF([.E21]=1;"";[.E21]) -> 0.045188
A22: 21 | B22: strcat: &"yipc"{\0,\x01,\x01,\x01,\x01,\x01} &"q"{\0,p,o,\0} :=> &"yipcq"{\0,p,c,o,\0} | C22: 0.0398241 | D22: 1 | E22: 0.0248853 | G22: of:=IF([.C22]=1;"";[.C22]) -> 0.0398241 | H22: of:=IF([.D22]=1;"";[.D22]) ->  | I22: of:=IF([.E22]=1;"";[.E22]) -> 0.0248853
A23: 22 | B23: strcat: &"iuli"{\0,\x01,\x01,\x01,\x01,\x01} &"rc"{\0,p,\0} :=> &"iulirc"{\0,p,t,\0} | C23: 0.045482 | D23: 0.214286 | E23: 0.0212649 | G23: of:=IF([.C23]=1;"";[.C23]) -> 0.045482 | H23: of:=IF([.D23]=1;"";[.D23]) -> 0.214286 | I23: of:=IF([.E23]=1;"";[.E23]) -> 0.0212649
A24: 23 | B24: strcat: &"yycn"{\0,\x01,\x01,\x01,\x01,\x01} &"viv"{\0,\0} :=> &"yycnviv"{\0,p,\0} | C24: 0.0313587 | D24: 0.0869711 | E24: 0.0127925 | G24: of:=IF([.C24]=1;"";[.C24]) -> 0.0313587 | H24: of:=IF([.D24]=1;"";[.D24]) -> 0.0869711 | I24: of:=IF([.E24]=1;"";[.E24]) -> 0.0127925
A25: 24 | B25: strcat: &"mnci"{\0,\x01,\x01,\x01,\x01,\x01} &"ctta"{\0} :=> &"mncictta"{\0,\0} | C25: 0.0443128 | D25: 0.0475127 | E25: 0.0135581 | G25: of:=IF([.C25]=1;"";[.C25]) -> 0.0443128 | H25: of:=IF([.D25]=1;"";[.D25]) -> 0.0475127 | I25: of:=IF([.E25]=1;"";[.E25]) -> 0.0135581
A26: 25 | B26: strcat: &"nthll"{\0,\x01,\x01,\x01,\x01} &""{\0,p,h,d,\0} :=> &"nthll"{\0,p,e,i,\0} | C26: 0.0308686 | D26: 1 | E26: 0.0308686 | G26: of:=IF([.C26]=1;"";[.C26]) -> 0.0308686 | H26: of:=IF([.D26]=1;"";[.D26]) ->  | I26: of:=IF([.E26]=1;"";[.E26]) -> 0.0308686
A27: 26 | B27: strcat: &"enutm"{\0,\x01,\x01,\x01,\x01} &"j"{\0,p,n,\0} :=> &"enutmj"{\0,p,r,\0} | C27: 0.0300161 | D27: 1 | E27: 0.0186621 | G27: of:=IF([.C27]=1;"";[.C27]) -> 0.0300161 | H27: of:=IF([.D27]=1;"";[.D27]) ->  | I27: of:=IF([.E27]=1;"";[.E27]) -> 0.0186621
A28: 27 | B28: strcat: &"yilbi"{\0,\x01,\x01,\x01,\x01} &"jo"{\0,p,\0} :=> &"yilbijo"{\0,p,\0} | C28: 0.0283173 | D28: 0.2083 | E28: 0.0149501 | G28: of:=IF([.C28]=1;"";[.C28]) -> 0.0283173 | H28: of:=IF([.D28]=1;"";[.D28]) -> 0.2083 | I28: of:=IF([.E28]=1;"";[.E28]) -> 0.0149501
A29: 28 | B29: strcat: &"toraw"{\0,\x01,\x01,\x01,\x01} &"uuw"{\0,\0} :=> &"torawuuw"{\0,\0} | C29: 0.0313647 | D29: 0.0658178 | E29: 0.0112531 | G29: of:=IF([.C29]=1;"";[.C29]) -> 0.0313647 | H29: of:=IF([.D29]=1;"";[.D29]) -> 0.0658178 | I29: of:=IF([.E29]=1;"";[.E29]) -> 0.0112531
A30: 29 | B30: strcat: &"gfpab"{\0,\x01,\x01,\x01,\x01} &"zdve"{\0} :=> &"gfpabzdve"{\0} | C30: 0.0230941 | D30: 0.039486 | E30: 0.00782919 | G30: of:=IF([.C30]=1;"";[.C30]) -> 0.0230941 | H30: of:=IF([.D30]=1;"";[.D30]) -> 0.039486 | I30: of:=IF([.E30]=1;"";[.E30]) -> 0.00782919
A31: 30 | B31: strcat: &"ngdkgh"{\0,\x01,\x01,\x01} &""{\0,p,v,t,\0} :=> &"ngdkgh"{\0,p,p,\0} | C31: 0.0174564 | D31: 1 | E31: 0.0174564 | G31: of:=IF([.C31]=1;"";[.C31]) -> 0.0174564 | H31: of:=IF([.D31]=1;"";[.D31]) ->  | I31: of:=IF([.E31]=1;"";[.E31]) -> 0.0174564
A32: 31 | B32: strcat: &"tullgl"{\0,\x01,\x01,\x01} &"u"{\0,p,l,\0} :=> &"tullglu"{\0,p,\0} | C32: 0.0205942 | D32: 1 | E32: 0.0159389 | G32: of:=IF([.C32]=1;"";[.C32]) -> 0.0205942 | H32: of:=IF([.D32]=1;"";[.D32]) ->  | I32: of:=IF([.E32]=1;"";[.E32]) -> 0.0159389
A33: 32 | B33: strcat: &"binhie"{\0,\x01,\x01,\x01} &"bt"{\0,p,\0} :=> &"binhiebt"{\0,\0} | C33: 0.0217401 | D33: 0.200124 | E33: 0.0131421 | G33: of:=IF([.C33]=1;"";[.C33]) -> 0.0217401 | H33: of:=IF([.D33]=1;"";[.D33]) -> 0.200124 | I33: of:=IF([.E33]=1;"";[.E33]) -> 0.0131421
A34: 33 | B34: strcat: &"kkdasf"{\0,\x01,\x01,\x01} &"frw"{\0,\0} :=> &"kkdasffrw"{\0} | C34: 0.0183938 | D34: 0.0814402 | E34: 0.00999875 | G34: of:=IF([.C34]=1;"";[.C34]) -> 0.0183938 | H34: of:=IF([.D34]=1;"";[.D34]) -> 0.0814402 | I34: of:=IF([.E34]=1;"";[.E34]) -> 0.00999875
A35: 34 | B35: strcat: &"ombvgf"{\0,\x01,\x01,\x01} &&10 :=> &"ombvgffaou"{} | C35: 0.0167844 | D35: 0.00825211 | G35: of:=IF([.C35]=1;"";[.C35]) -> 0.0167844 | H35: of:=IF([.D35]=1;"";[.D35]) -> 0.00825211 | I35: of:=IF([.E35]=1;"";[.E35]) ->  
A36: 35 | B36: strcat: &"iplsccr"{\0,\x01,\x01} &""{\0,p,t,g,\0} :=> &"iplsccr"{\0,p,\0} | C36: 0.0162856 | D36: 1 | E36: 0.0162856 | G36: of:=IF([.C36]=1;"";[.C36]) -> 0.0162856 | H36: of:=IF([.D36]=1;"";[.D36]) ->  | I36: of:=IF([.E36]=1;"";[.E36]) -> 0.0162856
A37: 36 | B37: strcat: &"kttwnap"{\0,\x01,\x01} &"u"{\0,p,j,\0} :=> &"kttwnapu"{\0,\0} | C37: 0.0155838 | D37: 1 | E37: 0.012724 | G37: of:=IF([.C37]=1;"";[.C37]) -> 0.0155838 | H37: of:=IF([.D37]=1;"";[.D37]) ->  | I37: of:=IF([.E37]=1;"";[.E37]) -> 0.012724
A38: 37 | B38: strcat: &"wrgaebn"{\0,\x01,\x01} &"jd"{\0,p,\0} :=> &"wrgaebnjd"{\0} | C38: 0.0144871 | D38: 0.160898 | E38: 0.00895754 | G38: of:=IF([.C38]=1;"";[.C38]) -> 0.0144871 | H38: of:=IF([.D38]=1;"";[.D38]) -> 0.160898 | I38: of:=IF([.E38]=1;"";[.E38]) -> 0.00895754
A39: 38 | B39: strcat: &"tvntuthu"{\0,\x01} &""{\0,p,a,a,\0} :=> &"tvntuthu"{\0,\0} | C39: 0.0122788 | D39: 1 | E39: 0.0122788 | G39: of:=IF([.C39]=1;"";[.C39]) -> 0.0122788 | H39: of:=IF([.D39]=1;"";[.D39]) ->  | I39: of:=IF([.E39]=1;"";[.E39]) -> 0.0122788
A40: 39 | B40: strcat: &"yppgffse"{\0,\x01} &"f"{\0,p,w,\0} :=> &"yppgffsef"{\0} | C40: 0.0116532 | D40: 1 | E40: 0.0099758 | G40: of:=IF([.C40]=1;"";[.C40]) -> 0.0116532 | H40: of:=IF([.D40]=1;"";[.D40]) ->  | I40: of:=IF([.E40]=1;"";[.E40]) -> 0.0099758
A41: 40 | B41: strcat: &"ukaswospp"{\0} &""{\0,p,i,r,\0} :=> &"ukaswospp"{\0} | C41: 0.0108443 | D41: 1 | E41: 0.0108443 | G41: of:=IF([.C41]=1;"";[.C41]) -> 0.0108443 | H41: of:=IF([.D41]=1;"";[.D41]) ->  | I41: of:=IF([.E41]=1;"";[.E41]) -> 0.0108443
A42: 1 | B42: strncat: &""{\0,\x01,\x01,\x01,\x01,\x01,\x01,\x01,\x01,\x01} &""{\0,p,i,r,\0} 4 :=> &""{\0,p,w,v,k,o,w,l,e,\0} | C42: 1 | D42: 1 | E42: 1 | G42: of:=IF([.C42]=1;"";[.C42]) ->  | H42: of:=IF([.D42]=1;"";[.D42]) ->  | I42: of:=IF([.E42]=1;"";[.E42]) ->  | K42: of:=AVERAGE([.G42:.G82]) -> 0.0626014329032258 | L42: of:=AVERAGE([.H42:.H82]) -> 0.110428795 | M42: of:=AVERAGE([.I42:.I82]) -> 0.0406896275675676 | O42: of:=AVERAGE([.K42:.M42]) -> 0.0712399518235978
A43: 2 | B43: strncat: &""{\0,\x01,\x01,\x01,\x01,\x01,\x01,\x01,\x01,\x01} &"m"{\0,p,e,\0} 4 :=> &"m"{\0,p,i,v,v,v,e,a,\0} | C43: 1 | D43: 1 | E43: 1 | G43: of:=IF([.C43]=1;"";[.C43]) ->  | H43: of:=IF([.D43]=1;"";[.D43]) ->  | I43: of:=IF([.E43]=1;"";[.E43]) -> 
A44: 3 | B44: strncat: &""{\0,\x01,\x01,\x01,\x01,\x01,\x01,\x01,\x01,\x01} &"pm"{\0,p,\0} 4 :=> &"pm"{\0,p,i,o,b,v,r,\0} | C44: 1 | D44: 0.200999 | E44: 0.200999 | G44: of:=IF([.C44]=1;"";[.C44]) ->  | H44: of:=IF([.D44]=1;"";[.D44]) -> 0.200999 | I44: of:=IF([.E44]=1;"";[.E44]) -> 0.200999
A45: 4 | B45: strncat: &""{\0,\x01,\x01,\x01,\x01,\x01,\x01,\x01,\x01,\x01} &"xtk"{\0,\0} 4 :=> &"xtk"{\0,p,n,w,h,t,\0} | C45: 1 | D45: 0.0733392 | E45: 0.0733392 | G45: of:=IF([.C45]=1;"";[.C45]) ->  | H45: of:=IF([.D45]=1;"";[.D45]) -> 0.0733392 | I45: of:=IF([.E45]=1;"";[.E45]) -> 0.0733392
A46: 5 | B46: strncat: &""{\0,\x01,\x01,\x01,\x01,\x01,\x01,\x01,\x01,\x01} &"esma"{\0} 4 :=> &"esma"{\0,p,q,u,c,\0} | C46: 1 | D46: 0.0472351 | E46: 0.0472351 | G46: of:=IF([.C46]=1;"";[.C46]) ->  | H46: of:=IF([.D46]=1;"";[.D46]) -> 0.0472351 | I46: of:=IF([.E46]=1;"";[.E46]) -> 0.0472351
A47: 6 | B47: strncat: &"g"{\0,\x01,\x01,\x01,\x01,\x01,\x01,\x01,\x01} &""{\0,p,o,h,\0} 4 :=> &"g"{\0,p,r,e,w,n,a,x,\0} | C47: 1 | D47: 1 | E47: 1 | G47: of:=IF([.C47]=1;"";[.C47]) ->  | H47: of:=IF([.D47]=1;"";[.D47]) ->  | I47: of:=IF([.E47]=1;"";[.E47]) -> 
A48: 7 | B48: strncat: &"s"{\0,\x01,\x01,\x01,\x01,\x01,\x01,\x01,\x01} &"c"{\0,p,c,\0} 4 :=> &"sc"{\0,p,g,u,a,c,k,\0} | C48: 1 | D48: 1 | E48: 0.213806 | G48: of:=IF([.C48]=1;"";[.C48]) ->  | H48: of:=IF([.D48]=1;"";[.D48]) ->  | I48: of:=IF([.E48]=1;"";[.E48]) -> 0.213806
A49: 8 | B49: strncat: &"w"{\0,\x01,\x01,\x01,\x01,\x01,\x01,\x01,\x01} &"bj"{\0,p,\0} 4 :=> &"wbj"{\0,p,b,o,e,c,\0} | C49: 1 | D49: 0.197854 | E49: 0.0723886 | G49: of:=IF([.C49]=1;"";[.C49]) ->  | H49: of:=IF([.D49]=1;"";[.D49]) -> 0.197854 | I49: of:=IF([.E49]=1;"";[.E49]) -> 0.0723886
A50: 9 | B50: strncat: &"g"{\0,\x01,\x01,\x01,\x01,\x01,\x01,\x01,\x01} &"zvi"{\0,\0} 4 :=> &"gzvi"{\0,p,i,p,a,\0} | C50: 1 | D50: 0.0728965 | E50: 0.0334887 | G50: of:=IF([.C50]=1;"";[.C50]) ->  | H50: of:=IF([.D50]=1;"";[.D50]) -> 0.0728965 | I50: of:=IF([.E50]=1;"";[.E50]) -> 0.0334887
A51: 10 | B51: strncat: &"n"{\0,\x01,\x01,\x01,\x01,\x01,\x01,\x01,\x01} &"rqut"{\0} 4 :=> &"nrqut"{\0,p,s,a,\0} | C51: 1 | D51: 0.0421065 | E51: 0.0263381 | G51: of:=IF([.C51]=1;"";[.C51]) ->  | H51: of:=IF([.D51]=1;"";[.D51]) -> 0.0421065 | I51: of:=IF([.E51]=1;"";[.E51]) -> 0.0263381
A52: 11 | B52: strncat: &"jd"{\0,\x01,\x01,\x01,\x01,\x01,\x01,\x01} &""{\0,p,i,e,\0} 4 :=> &"jd"{\0,p,m,c,u,k,a,\0} | C52: 0.160898 | D52: 1 | E52: 0.160898 | G52: of:=IF([.C52]=1;"";[.C52]) -> 0.160898 | H52: of:=IF([.D52]=1;"";[.D52]) ->  | I52: of:=IF([.E52]=1;"";[.E52]) -> 0.160898
A53: 12 | B53: strncat: &"ie"{\0,\x01,\x01,\x01,\x01,\x01,\x01,\x01} &"t"{\0,p,g,\0} 4 :=> &"iet"{\0,p,r,o,t,y,\0} | C53: 0.218466 | D53: 1 | E53: 0.0879912 | G53: of:=IF([.C53]=1;"";[.C53]) -> 0.218466 | H53: of:=IF([.D53]=1;"";[.D53]) ->  | I53: of:=IF([.E53]=1;"";[.E53]) -> 0.0879912
A54: 13 | B54: strncat: &"ck"{\0,\x01,\x01,\x01,\x01,\x01,\x01,\x01} &"kc"{\0,p,\0} 4 :=> &"ckkc"{\0,p,g,m,n,\0} | C54: 0.215236 | D54: 0.171077 | E54: 0.0361231 | G54: of:=IF([.C54]=1;"";[.C54]) -> 0.215236 | H54: of:=IF([.D54]=1;"";[.D54]) -> 0.171077 | I54: of:=IF([.E54]=1;"";[.E54]) -> 0.0361231
A55: 14 | B55: strncat: &"rn"{\0,\x01,\x01,\x01,\x01,\x01,\x01,\x01} &"vda"{\0,\0} 4 :=> &"rnvda"{\0,p,t,i,\0} | C55: 0.215706 | D55: 0.070379 | E55: 0.0256217 | G55: of:=IF([.C55]=1;"";[.C55]) -> 0.215706 | H55: of:=IF([.D55]=1;"";[.D55]) -> 0.070379 | I55: of:=IF([.E55]=1;"";[.E55]) -> 0.0256217
A56: 15 | B56: strncat: &"ro"{\0,\x01,\x01,\x01,\x01,\x01,\x01,\x01} &"rdbi"{\0} 4 :=> &"rordbi"{\0,p,h,\0} | C56: 0.22156 | D56: 0.0428425 | E56: 0.0209838 | G56: of:=IF([.C56]=1;"";[.C56]) -> 0.22156 | H56: of:=IF([.D56]=1;"";[.D56]) -> 0.0428425 | I56: of:=IF([.E56]=1;"";[.E56]) -> 0.0209838
A57: 16 | B57: strncat: &"scu"{\0,\x01,\x01,\x01,\x01,\x01,\x01} &""{\0,p,n,p,\0} 4 :=> &"scu"{\0,p,k,r,a,c,\0} | C57: 0.0848808 | D57: 1 | E57: 0.0848808 | G57: of:=IF([.C57]=1;"";[.C57]) -> 0.0848808 | H57: of:=IF([.D57]=1;"";[.D57]) ->  | I57: of:=IF([.E57]=1;"";[.E57]) -> 0.0848808
A58: 17 | B58: strncat: &"xxt"{\0,\x01,\x01,\x01,\x01,\x01,\x01} &"o"{\0,p,i,\0} 4 :=> &"xxto"{\0,p,u,n,a,\0} | C58: 0.0705557 | D58: 1 | E58: 0.0403954 | G58: of:=IF([.C58]=1;"";[.C58]) -> 0.0705557 | H58: of:=IF([.D58]=1;"";[.D58]) ->  | I58: of:=IF([.E58]=1;"";[.E58]) -> 0.0403954
A59: 18 | B59: strncat: &"ckb"{\0,\x01,\x01,\x01,\x01,\x01,\x01} &"ou"{\0,p,\0} 4 :=> &"ckbou"{\0,p,h,v,\0} | C59: 0.0771842 | D59: 0.221991 | E59: 0.0282621 | G59: of:=IF([.C59]=1;"";[.C59]) -> 0.0771842 | H59: of:=IF([.D59]=1;"";[.D59]) -> 0.221991 | I59: of:=IF([.E59]=1;"";[.E59]) -> 0.0282621
A60: 19 | B60: strncat: &"faj"{\0,\x01,\x01,\x01,\x01,\x01,\x01} &"avl"{\0,\0} 4 :=> &"fajavl"{\0,p,h,\0} | C60: 0.0813024 | D60: 0.0733085 | E60: 0.0182048 | G60: of:=IF([.C60]=1;"";[.C60]) -> 0.0813024 | H60: of:=IF([.D60]=1;"";[.D60]) -> 0.0733085 | I60: of:=IF([.E60]=1;"";[.E60]) -> 0.0182048
A61: 20 | B61: strncat: &"oom"{\0,\x01,\x01,\x01,\x01,\x01,\x01} &"lglu"{\0} 4 :=> &"oomlglu"{\0,p,\0} | C61: 0.0878239 | D61: 0.0423581 | E61: 0.0151061 | G61: of:=IF([.C61]=1;"";[.C61]) -> 0.0878239 | H61: of:=IF([.D61]=1;"";[.D61]) -> 0.0423581 | I61: of:=IF([.E61]=1;"";[.E61]) -> 0.0151061
A62: 21 | B62: strncat: &"quhy"{\0,\x01,\x01,\x01,\x01,\x01} &""{\0,p,i,x,\0} 4 :=> &"quhy"{\0,p,i,g,m,\0} | C62: 0.0404248 | D62: 1 | E62: 0.0404248 | G62: of:=IF([.C62]=1;"";[.C62]) -> 0.0404248 | H62: of:=IF([.D62]=1;"";[.D62]) ->  | I62: of:=IF([.E62]=1;"";[.E62]) -> 0.0404248
A63: 22 | B63: strncat: &"quna"{\0,\x01,\x01,\x01,\x01,\x01} &"o"{\0,p,a,\0} 4 :=> &"qunao"{\0,p,t,s,\0} | C63: 0.0468391 | D63: 1 | E63: 0.0285566 | G63: of:=IF([.C63]=1;"";[.C63]) -> 0.0468391 | H63: of:=IF([.D63]=1;"";[.D63]) ->  | I63: of:=IF([.E63]=1;"";[.E63]) -> 0.0285566
A64: 23 | B64: strncat: &"mnct"{\0,\x01,\x01,\x01,\x01,\x01} &"oo"{\0,p,\0} 4 :=> &"mnctoo"{\0,p,s,\0} | C64: 0.0445617 | D64: 0.216638 | E64: 0.0213307 | G64: of:=IF([.C64]=1;"";[.C64]) -> 0.0445617 | H64: of:=IF([.D64]=1;"";[.D64]) -> 0.216638 | I64: of:=IF([.E64]=1;"";[.E64]) -> 0.0213307
A65: 24 | B65: strncat: &"fosh"{\0,\x01,\x01,\x01,\x01,\x01} &"eff"{\0,\0} 4 :=> &"fosheff"{\0,p,\0} | C65: 0.0477238 | D65: 0.0851845 | E65: 0.0173256 | G65: of:=IF([.C65]=1;"";[.C65]) -> 0.0477238 | H65: of:=IF([.D65]=1;"";[.D65]) -> 0.0851845 | I65: of:=IF([.E65]=1;"";[.E65]) -> 0.0173256
A66: 25 | B66: strncat: &"qtkc"{\0,\x01,\x01,\x01,\x01,\x01} &"saov"{\0} 4 :=> &"qtkcsaov"{\0,\0} | C66: 0.0267144 | D66: 0.0439758 | E66: 0.00927013 | G66: of:=IF([.C66]=1;"";[.C66]) -> 0.0267144 | H66: of:=IF([.D66]=1;"";[.D66]) -> 0.0439758 | I66: of:=IF([.E66]=1;"";[.E66]) -> 0.00927013
A67: 26 | B67: strncat: &"crlfe"{\0,\x01,\x01,\x01,\x01} &""{\0,p,p,p,\0} 4 :=> &"crlfe"{\0,p,c,e,\0} | C67: 0.0290532 | D67: 1 | E67: 0.0290532 | G67: of:=IF([.C67]=1;"";[.C67]) -> 0.0290532 | H67: of:=IF([.D67]=1;"";[.D67]) ->  | I67: of:=IF([.E67]=1;"";[.E67]) -> 0.0290532
A68: 27 | B68: strncat: &"bvncs"{\0,\x01,\x01,\x01,\x01} &"e"{\0,p,f,\0} 4 :=> &"bvncse"{\0,p,m,\0} | C68: 0.0246073 | D68: 1 | E68: 0.0184225 | G68: of:=IF([.C68]=1;"";[.C68]) -> 0.0246073 | H68: of:=IF([.D68]=1;"";[.D68]) ->  | I68: of:=IF([.E68]=1;"";[.E68]) -> 0.0184225
A69: 28 | B69: strncat: &"tpmsj"{\0,\x01,\x01,\x01,\x01} &"nj"{\0,p,\0} 4 :=> &"tpmsjnj"{\0,p,\0} | C69: 0.0231095 | D69: 0.199415 | E69: 0.0115049 | G69: of:=IF([.C69]=1;"";[.C69]) -> 0.0231095 | H69: of:=IF([.D69]=1;"";[.D69]) -> 0.199415 | I69: of:=IF([.E69]=1;"";[.E69]) -> 0.0115049
A70: 29 | B70: strncat: &"kfavi"{\0,\x01,\x01,\x01,\x01} &"jsw"{\0,\0} 4 :=> &"kfavijsw"{\0,\0} | C70: 0.0278703 | D70: 0.0595019 | E70: 0.0102833 | G70: of:=IF([.C70]=1;"";[.C70]) -> 0.0278703 | H70: of:=IF([.D70]=1;"";[.D70]) -> 0.0595019 | I70: of:=IF([.E70]=1;"";[.E70]) -> 0.0102833
A71: 30 | B71: strncat: &"ftagb"{\0,\x01,\x01,\x01,\x01} &"hhcu"{\0} 4 :=> &"ftagbhhcu"{\0} | C71: 0.0270304 | D71: 0.0378638 | E71: 0.00899459 | G71: of:=IF([.C71]=1;"";[.C71]) -> 0.0270304 | H71: of:=IF([.D71]=1;"";[.D71]) -> 0.0378638 | I71: of:=IF([.E71]=1;"";[.E71]) -> 0.00899459
A72: 31 | B72: strncat: &"pambdo"{\0,\x01,\x01,\x01} &""{\0,p,y,o,\0} 4 :=> &"pambdo"{\0,p,n,\0} | C72: 0.0201123 | D72: 1 | E72: 0.0201123 | G72: of:=IF([.C72]=1;"";[.C72]) -> 0.0201123 | H72: of:=IF([.D72]=1;"";[.D72]) ->  | I72: of:=IF([.E72]=1;"";[.E72]) -> 0.0201123
A73: 32 | B73: strncat: &"avijug"{\0,\x01,\x01,\x01} &"o"{\0,p,l,\0} 4 :=> &"avijugo"{\0,p,\0} | C73: 0.0200966 | D73: 1 | E73: 0.015612 | G73: of:=IF([.C73]=1;"";[.C73]) -> 0.0200966 | H73: of:=IF([.D73]=1;"";[.D73]) ->  | I73: of:=IF([.E73]=1;"";[.E73]) -> 0.015612
A74: 33 | B74: strncat: &"rviafe"{\0,\x01,\x01,\x01} &"id"{\0,p,\0} 4 :=> &"rviafeid"{\0,\0} | C74: 0.0218236 | D74: 0.219808 | E74: 0.0138274 | G74: of:=IF([.C74]=1;"";[.C74]) -> 0.0218236 | H74: of:=IF([.D74]=1;"";[.D74]) -> 0.219808 | I74: of:=IF([.E74]=1;"";[.E74]) -> 0.0138274
A75: 34 | B75: strncat: &"wiprwi"{\0,\x01,\x01,\x01} &"ufo"{\0,\0} 4 :=> &"wiprwiufo"{\0} | C75: 0.0210795 | D75: 0.0834159 | E75: 0.0109005 | G75: of:=IF([.C75]=1;"";[.C75]) -> 0.0210795 | H75: of:=IF([.D75]=1;"";[.D75]) -> 0.0834159 | I75: of:=IF([.E75]=1;"";[.E75]) -> 0.0109005
A76: 35 | B76: strncat: &"vjefut"{\0,\x01,\x01,\x01} &&10 4 :=> &"vjefutijep"{} | C76: 0.0147448 | D76: 0.00743619 | G76: of:=IF([.C76]=1;"";[.C76]) -> 0.0147448 | H76: of:=IF([.D76]=1;"";[.D76]) -> 0.00743619 | I76: of:=IF([.E76]=1;"";[.E76]) ->  
A77: 36 | B77: strncat: &"qbodqwr"{\0,\x01,\x01} &""{\0,p,f,i,\0} 4 :=> &"qbodqwr"{\0,p,\0} | C77: 0.00927232 | D77: 1 | E77: 0.00927232 | G77: of:=IF([.C77]=1;"";[.C77]) -> 0.00927232 | H77: of:=IF([.D77]=1;"";[.D77]) ->  | I77: of:=IF([.E77]=1;"";[.E77]) -> 0.00927232
A78: 37 | B78: strncat: &"wenvcso"{\0,\x01,\x01} &"f"{\0,p,j,\0} 4 :=> &"wenvcsof"{\0,\0} | C78: 0.0154392 | D78: 1 | E78: 0.012842 | G78: of:=IF([.C78]=1;"";[.C78]) -> 0.0154392 | H78: of:=IF([.D78]=1;"";[.D78]) ->  | I78: of:=IF([.E78]=1;"";[.E78]) -> 0.012842
A79: 38 | B79: strncat: &"jrkbiqi"{\0,\x01,\x01} &"ut"{\0,p,\0} 4 :=> &"jrkbiqiut"{\0} | C79: 0.0112122 | D79: 0.219808 | E79: 0.00816268 | G79: of:=IF([.C79]=1;"";[.C79]) -> 0.0112122 | H79: of:=IF([.D79]=1;"";[.D79]) -> 0.219808 | I79: of:=IF([.E79]=1;"";[.E79]) -> 0.00816268
A80: 39 | B80: strncat: &"jeakykok"{\0,\x01} &""{\0,p,o,w,\0} 4 :=> &"jeakykok"{\0,\0} | C80: 0.0117759 | D80: 1 | E80: 0.0117759 | G80: of:=IF([.C80]=1;"";[.C80]) -> 0.0117759 | H80: of:=IF([.D80]=1;"";[.D80]) ->  | I80: of:=IF([.E80]=1;"";[.E80]) -> 0.0117759
A81: 40 | B81: strncat: &"easyvcra"{\0,\x01} &"p"{\0,p,s,\0} 4 :=> &"easyvcrap"{\0} | C81: 0.0120862 | D81: 1 | E81: 0.0103288 | G81: of:=IF([.C81]=1;"";[.C81]) -> 0.0120862 | H81: of:=IF([.D81]=1;"";[.D81]) ->  | I81: of:=IF([.E81]=1;"";[.E81]) -> 0.0103288
A82: 41 | B82: strncat: &"bampovooa"{\0} &""{\0,p,s,t,\0} 4 :=> &"bampovooa"{\0} | C82: 0.0114543 | D82: 1 | E82: 0.0114543 | G82: of:=IF([.C82]=1;"";[.C82]) -> 0.0114543 | H82: of:=IF([.D82]=1;"";[.D82]) ->  | I82: of:=IF([.E82]=1;"";[.E82]) -> 0.0114543

Sheet: strstr
A1: # | B1: Test Case | C1: N | G1: N1 | H1: N2 | I1: N3
A2: 1 | B2: strstr: &"l"{\0,h,l,d,\0} &"l"{\0,\0} :=> &"l"{\0,h,l,d,\0} | C2: 1 | D2: 1 | E2: 1 | G2: of:=IF([.C2]=1;"";[.C2]) ->  | H2: of:=IF([.D2]=1;"";[.D2]) ->  | I2: of:=IF([.E2]=1;"";[.E2]) ->  | K2: of:=AVERAGE([.G2:.G19]) -> 0.0776421058823529 | L2: of:=AVERAGE([.H2:.H19]) -> 0.202753333333333 | M2: of:=AVERAGE([.I2:.I19]) -> 0.10146590625 | O2: of:=AVERAGE([.K2:.M2]) -> 0.127287115155229
A3: 2 | B3: strstr: &"ng"{\0,h,i,\0} &"n"{\0,\0} :=> &"ng"{\0,h,i,\0} | C3: 0.223271 | D3: 1 | E3: 0.223271 | G3: of:=IF([.C3]=1;"";[.C3]) -> 0.223271 | H3: of:=IF([.D3]=1;"";[.D3]) ->  | I3: of:=IF([.E3]=1;"";[.E3]) -> 0.223271
A4: 3 | B4: strstr: &"ka"{\0,b,t,\0} &"a"{\0,\0} :=> &"a"{\0,b,t,\0,54} | C4: 0.204058 | D4: 1 | E4: 1 | G4: of:=IF([.C4]=1;"";[.C4]) -> 0.204058 | H4: of:=IF([.D4]=1;"";[.D4]) ->  | I4: of:=IF([.E4]=1;"";[.E4]) -> 
A5: 4 | B5: strstr: &"trb"{\0,h,\0} &"t"{\0,\0} :=> &"trb"{\0,h,\0} | C5: 0.0839264 | D5: 1 | E5: 0.0839264 | G5: of:=IF([.C5]=1;"";[.C5]) -> 0.0839264 | H5: of:=IF([.D5]=1;"";[.D5]) ->  | I5: of:=IF([.E5]=1;"";[.E5]) -> 0.0839264
A6: 5 | B6: strstr: &"ctm"{\0,b,\0} &"t"{\0,\0} :=> &"tm"{\0,b,\0,54} | C6: 0.0841335 | D6: 1 | E6: 0.207409 | G6: of:=IF([.C6]=1;"";[.C6]) -> 0.0841335 | H6: of:=IF([.D6]=1;"";[.D6]) ->  | I6: of:=IF([.E6]=1;"";[.E6]) -> 0.207409
A7: 6 | B7: strstr: &"fkgb"{\0,\0} &"f"{\0,\0} :=> &"fkgb"{\0,\0} | C7: 0.0327366 | D7: 1 | E7: 0.0327366 | G7: of:=IF([.C7]=1;"";[.C7]) -> 0.0327366 | H7: of:=IF([.D7]=1;"";[.D7]) ->  | I7: of:=IF([.E7]=1;"";[.E7]) -> 0.0327366
A8: 7 | B8: strstr: &"xnon"{\0,\0} &"n"{\0,\0} :=> &"non"{\0,\0,54} | C8: 0.0384434 | D8: 1 | E8: 0.0897772 | G8: of:=IF([.C8]=1;"";[.C8]) -> 0.0384434 | H8: of:=IF([.D8]=1;"";[.D8]) ->  | I8: of:=IF([.E8]=1;"";[.E8]) -> 0.0897772
A9: 8 | B9: strstr: &"tgxpl"{\0} &"t"{\0,\0} :=> &"tgxpl"{\0} | C9: 0.0219414 | D9: 1 | E9: 0.0219414 | G9: of:=IF([.C9]=1;"";[.C9]) -> 0.0219414 | H9: of:=IF([.D9]=1;"";[.D9]) ->  | I9: of:=IF([.E9]=1;"";[.E9]) -> 0.0219414
A10: 9 | B10: strstr: &"awidv"{\0} &"w"{\0,\0} :=> &"widv"{\0,54} | C10: 0.0292739 | D10: 1 | E10: 0.0458743 | G10: of:=IF([.C10]=1;"";[.C10]) -> 0.0292739 | H10: of:=IF([.D10]=1;"";[.D10]) ->  | I10: of:=IF([.E10]=1;"";[.E10]) -> 0.0458743
A11: 10 | B11: strstr: &"um"{\0,d,c,\0} &"um"{\0} :=> &"um"{\0,d,c,\0} | C11: 0.213322 | D11: 0.213322 | E11: 0.213322 | G11: of:=IF([.C11]=1;"";[.C11]) -> 0.213322 | H11: of:=IF([.D11]=1;"";[.D11]) -> 0.213322 | I11: of:=IF([.E11]=1;"";[.E11]) -> 0.213322
A12: 11 | B12: strstr: &"yiu"{\0,d,\0} &"yi"{\0} :=> &"yiu"{\0,d,\0} | C12: 0.0789237 | D12: 0.207882 | E12: 0.0789237 | G12: of:=IF([.C12]=1;"";[.C12]) -> 0.0789237 | H12: of:=IF([.D12]=1;"";[.D12]) -> 0.207882 | I12: of:=IF([.E12]=1;"";[.E12]) -> 0.0789237
A13: 12 | B13: strstr: &"jjp"{\0,a,\0} &"jp"{\0} :=> &"jp"{\0,a,\0,54} | C13: 0.0420351 | D13: 0.131946 | E13: 0.131946 | G13: of:=IF([.C13]=1;"";[.C13]) -> 0.0420351 | H13: of:=IF([.D13]=1;"";[.D13]) -> 0.131946 | I13: of:=IF([.E13]=1;"";[.E13]) -> 0.131946
A14: 13 | B14: strstr: &"zey"{\0,p,\0} &"ey"{\0} :=> &"ey"{\0,p,\0,54} | C14: 0.0835885 | D14: 0.215236 | E14: 0.215236 | G14: of:=IF([.C14]=1;"";[.C14]) -> 0.0835885 | H14: of:=IF([.D14]=1;"";[.D14]) -> 0.215236 | I14: of:=IF([.E14]=1;"";[.E14]) -> 0.215236
A15: 14 | B15: strstr: &"gibl"{\0,\0} &"gi"{\0} :=> &"gibl"{\0,\0} | C15: 0.0454183 | D15: 0.213322 | E15: 0.0454183 | G15: of:=IF([.C15]=1;"";[.C15]) -> 0.0454183 | H15: of:=IF([.D15]=1;"";[.D15]) -> 0.213322 | I15: of:=IF([.E15]=1;"";[.E15]) -> 0.0454183
A16: 15 | B16: strstr: &"nnkp"{\0,\0} &"nk"{\0} :=> &"nkp"{\0,\0,54} | C16: 0.0410868 | D16: 0.210856 | E16: 0.0748182 | G16: of:=IF([.C16]=1;"";[.C16]) -> 0.0410868 | H16: of:=IF([.D16]=1;"";[.D16]) -> 0.210856 | I16: of:=IF([.E16]=1;"";[.E16]) -> 0.0748182
A17: 16 | B17: strstr: &"ziav"{\0,\0} &"ia"{\0} :=> &"iav"{\0,\0,54} | C17: 0.0449282 | D17: 0.217558 | E17: 0.0866767 | G17: of:=IF([.C17]=1;"";[.C17]) -> 0.0449282 | H17: of:=IF([.D17]=1;"";[.D17]) -> 0.217558 | I17: of:=IF([.E17]=1;"";[.E17]) -> 0.0866767
A18: 17 | B18: strstr: &"wtdns"{\0} &"wt"{\0} :=> &"wtdns"{\0} | C18: 0.0260857 | D18: 0.196192 | E18: 0.0260857 | G18: of:=IF([.C18]=1;"";[.C18]) -> 0.0260857 | H18: of:=IF([.D18]=1;"";[.D18]) -> 0.196192 | I18: of:=IF([.E18]=1;"";[.E18]) -> 0.0260857
A19: 18 | B19: strstr: &"uunug"{\0} &"un"{\0} :=> &"unug"{\0,54} | C19: 0.0267433 | D19: 0.218466 | E19: 0.046092 | G19: of:=IF([.C19]=1;"";[.C19]) -> 0.0267433 | H19: of:=IF([.D19]=1;"";[.D19]) -> 0.218466 | I19: of:=IF([.E19]=1;"";[.E19]) -> 0.046092
A20: 19 | B20: strstr: &"teonc"{\0} &"eo"{\0} :=> &"eonc"{\0,54} | C20: 0.0312924 | D20: 0.211356 | E20: 0.0476699 | G20: of:=IF([.C20]=1;"";[.C20]) -> 0.0312924 | H20: of:=IF([.D20]=1;"";[.D20]) -> 0.211356 | I20: of:=IF([.E20]=1;"";[.E20]) -> 0.0476699 | K20: of:=AVERAGE([.G20:.G24]) -> 0.02977038 | L20: of:=AVERAGE([.H20:.H24]) -> 0.216458 | M20: of:=AVERAGE([.I20:.I24]) -> 0.03621778 | O20: of:=AVERAGE([.K20:.M20]) -> 0.09414872
A21: 1 | B21: strnstr: &"ghpoc"{\0} &""{\0,p,\0} 2 :=> &"ghpoc"{\0} | C21: 0.0274264 | D21: 1 | E21: 0.0274264 | G21: of:=IF([.C21]=1;"";[.C21]) -> 0.0274264 | H21: of:=IF([.D21]=1;"";[.D21]) ->  | I21: of:=IF([.E21]=1;"";[.E21]) -> 0.0274264
A22: 2 | B22: strnstr: &"douno"{\0} &"d"{\0,\0} 2 :=> &"douno"{\0} | C22: 0.0309241 | D22: 1 | E22: 0.0309241 | G22: of:=IF([.C22]=1;"";[.C22]) -> 0.0309241 | H22: of:=IF([.D22]=1;"";[.D22]) ->  | I22: of:=IF([.E22]=1;"";[.E22]) -> 0.0309241
A23: 3 | B23: strnstr: &"unshl"{\0} &"n"{\0,\0} 2 :=> &"nshl"{\0,54} | C23: 0.0296936 | D23: 1 | E23: 0.0455531 | G23: of:=IF([.C23]=1;"";[.C23]) -> 0.0296936 | H23: of:=IF([.D23]=1;"";[.D23]) ->  | I23: of:=IF([.E23]=1;"";[.E23]) -> 0.0455531
A24: 4 | B24: strnstr: &"ronyw"{\0} &"ro"{\0} 2 :=> &"ronyw"{\0} | C24: 0.0295154 | D24: 0.22156 | E24: 0.0295154 | G24: of:=IF([.C24]=1;"";[.C24]) -> 0.0295154 | H24: of:=IF([.D24]=1;"";[.D24]) -> 0.22156 | I24: of:=IF([.E24]=1;"";[.E24]) -> 0.0295154
A25: 1 | B25: strpbrk: &"cubwo"{\0} &"aeiou"{\0} :=> &"ubwo"{\0,54} | C25: 0.0274284 | D25: 0.0299288 | E25: 0.0420635 | G25: of:=IF([.C25]=1;"";[.C25]) -> 0.0274284 | H25: of:=IF([.D25]=1;"";[.D25]) -> 0.0299288 | I25: of:=IF([.E25]=1;"";[.E25]) -> 0.0420635 | K25: of:=AVERAGE([.G25:.G34]) -> 0.02762731 | L25: of:=AVERAGE([.H25:.H34]) -> 0.0299288 | M25: of:=AVERAGE([.I25:.I34]) -> 0.03589482 | O25: of:=AVERAGE([.K25:.M25]) -> 0.03115031
A26: 2 | B26: strpbrk: &"domwe"{\0} &"aeiou"{\0} :=> &"omwe"{\0,54} | C26: 0.0269738 | D26: 0.0299288 | E26: 0.0411297 | G26: of:=IF([.C26]=1;"";[.C26]) -> 0.0269738 | H26: of:=IF([.D26]=1;"";[.D26]) -> 0.0299288 | I26: of:=IF([.E26]=1;"";[.E26]) -> 0.0411297
A27: 3 | B27: strpbrk: &"qiawa"{\0} &"aeiou"{\0} :=> &"iawa"{\0,54} | C27: 0.0277305 | D27: 0.0299288 | E27: 0.0464833 | G27: of:=IF([.C27]=1;"";[.C27]) -> 0.0277305 | H27: of:=IF([.D27]=1;"";[.D27]) -> 0.0299288 | I27: of:=IF([.E27]=1;"";[.E27]) -> 0.0464833
A28: 4 | B28: strpbrk: &"xeesy"{\0} &"aeiou"{\0} :=> &"eesy"{\0,54} | C28: 0.0294559 | D28: 0.0299288 | E28: 0.0468945 | G28: of:=IF([.C28]=1;"";[.C28]) -> 0.0294559 | H28: of:=IF([.D28]=1;"";[.D28]) -> 0.0299288 | I28: of:=IF([.E28]=1;"";[.E28]) -> 0.0468945
A29: 5 | B29: strpbrk: &"kagew"{\0} &"aeiou"{\0} :=> &"agew"{\0,54} | C29: 0.0293648 | D29: 0.0299288 | E29: 0.0470575 | G29: of:=IF([.C29]=1;"";[.C29]) -> 0.0293648 | H29: of:=IF([.D29]=1;"";[.D29]) -> 0.0299288 | I29: of:=IF([.E29]=1;"";[.E29]) -> 0.0470575
A30: 6 | B30: strpbrk: &"ufmii"{\0} &"aeiou"{\0} :=> &"ufmii"{\0} | C30: 0.0250367 | D30: 0.0299288 | E30: 0.0250367 | G30: of:=IF([.C30]=1;"";[.C30]) -> 0.0250367 | H30: of:=IF([.D30]=1;"";[.D30]) -> 0.0299288 | I30: of:=IF([.E30]=1;"";[.E30]) -> 0.0250367
A31: 7 | B31: strpbrk: &"oyiog"{\0} &"aeiou"{\0} :=> &"oyiog"{\0} | C31: 0.028822 | D31: 0.0299288 | E31: 0.028822 | G31: of:=IF([.C31]=1;"";[.C31]) -> 0.028822 | H31: of:=IF([.D31]=1;"";[.D31]) -> 0.0299288 | I31: of:=IF([.E31]=1;"";[.E31]) -> 0.028822
A32: 8 | B32: strpbrk: &"iafua"{\0} &"aeiou"{\0} :=> &"iafua"{\0} | C32: 0.0292077 | D32: 0.0299288 | E32: 0.0292077 | G32: of:=IF([.C32]=1;"";[.C32]) -> 0.0292077 | H32: of:=IF([.D32]=1;"";[.D32]) -> 0.0299288 | I32: of:=IF([.E32]=1;"";[.E32]) -> 0.0292077
A33: 9 | B33: strpbrk: &"ejikn"{\0} &"aeiou"{\0} :=> &"ejikn"{\0} | C33: 0.0255075 | D33: 0.0299288 | E33: 0.0255075 | G33: of:=IF([.C33]=1;"";[.C33]) -> 0.0255075 | H33: of:=IF([.D33]=1;"";[.D33]) -> 0.0299288 | I33: of:=IF([.E33]=1;"";[.E33]) -> 0.0255075
A34: 10 | B34: strpbrk: &"amkea"{\0} &"aeiou"{\0} :=> &"amkea"{\0} | C34: 0.0267458 | D34: 0.0299288 | E34: 0.0267458 | G34: of:=IF([.C34]=1;"";[.C34]) -> 0.0267458 | H34: of:=IF([.D34]=1;"";[.D34]) -> 0.0299288 | I34: of:=IF([.E34]=1;"";[.E34]) -> 0.0267458