Sheet: strlen
A1: strlen: &"\x01"{\0,\0,\0,\0,\0} :=> 1; | J1: # | K1: Test Case | L1: N | P1: FINAL
A2: strlen: &"\x01\x01"{\0,\0,\0,\0} :=> 2; | J2: 1 | K2: strlen: &"h"{\0,p,j,f,\0} :=> 1 | L2: 1 | N2: of:=IF([.L2]=1;"";[.L2]) ->  | P2: of:=AVERAGE([.N2:.N6]) -> 0.083343
A3: strlen: &"\x01\x01\x01"{\0,\0,\0} :=> 3; | J3: 2 | K3: strlen: &"zu"{\0,p,d,\0} :=> 2 | L3: 0.189501 | N3: of:=IF([.L3]=1;"";[.L3]) -> 0.189501
A4: strlen: &"\x01\x01\x01\x01"{\0,\0} :=> 4; | J4: 3 | K4: strlen: &"mul"{\0,p,\0} :=> 3 | L4: 0.0852879 | N4: of:=IF([.L4]=1;"";[.L4]) -> 0.0852879
A5: strlen: &"\x01\x01\x01\x01\x01"{\0} :=> 5; | J5: 4 | K5: strlen: &"juyh"{\0,\0} :=> 4 | L5: 0.0395086 | N5: of:=IF([.L5]=1;"";[.L5]) -> 0.0395086
A6: strnlen: &""{\0,\0,\0,\0,\0,\0} 6 :=> 0; 1; | J6: 5 | K6: strlen: &"rorqf"{\0} :=> 5 | L6: 0.0190745 | N6: of:=IF([.L6]=1;"";[.L6]) -> 0.0190745
A7: strnlen: &"\x01"{\0,\0,\0,\0,\0} 6 :=> 1; | J7: 1 | K7: strnlen: &""{\0,p,p,r,u,\0} 6 :=> 0 | L7: 1 | N7: of:=IF([.L7]=1;"";[.L7]) ->  | P7: of:=AVERAGE([.N7:.N12]) -> 0.085886875
A8: strnlen: &"\x01\x01"{\0,\0,\0,\0} 6 :=> 2; | J8: 2 | K8: strnlen: &"h"{\0,p,p,t,\0} 6 :=> 1 | L8: 1 | N8: of:=IF([.L8]=1;"";[.L8]) -> 
A9: strnlen: &"\x01\x01\x01"{\0,\0,\0} 6 :=> 3; | J9: 3 | K9: strnlen: &"rh"{\0,p,p,\0} 6 :=> 2 | L9: 0.20192 | N9: of:=IF([.L9]=1;"";[.L9]) -> 0.20192
A10: strnlen: &"\x01\x01\x01\x01"{\0,\0} 6 :=> 4; | J10: 4 | K10: strnlen: &"zki"{\0,p,\0} 6 :=> 3 | L10: 0.0729241 | N10: of:=IF([.L10]=1;"";[.L10]) -> 0.0729241
A11: strnlen: &"\x01\x01\x01\x01\x01"{\0} 6 :=> 5; | J11: 5 | K11: strnlen: &"bshh"{\0,\0} 6 :=> 4 | L11: 0.0414498 | N11: of:=IF([.L11]=1;"";[.L11]) -> 0.0414498
J12: 6 | K12: strnlen: &"sdsyn"{\0} 6 :=> 5 | L12: 0.0272536 | N12: of:=IF([.L12]=1;"";[.L12]) -> 0.0272536

Sheet: strcmp
A1: # | B1: Test Case | C1: N1 | D1: N2 | L1: FINAL
A2: 1 | B2: strcmp: &"m"{\0,p,p,k,\0} &"m"{\0,p,o,v,\0} :=> 0 | C2: 1 | D2: 1 | F2: of:=IF([.C2]=1;"";[.C2]) ->  | G2: of:=IF([.D2]=1;"";[.D2]) ->  | H2: of:=IF([.E2]=1;"";[.E2]) ->   | I2: of:=AVERAGE([.F2:.F16]) -> 0.0417554214285714 | J2: of:=AVERAGE([.G2:.G16]) -> 0.0415278071428571 | L2: of:=AVERAGE([.I2:.J2]) -> 0.0416416142857143
A3: 2 | B3: strcmp: &"ku"{\0,p,w,\0} &"ku"{\0,p,g,\0} :=> 0 | C3: 0.193586 | D3: 0.193586 | F3: of:=IF([.C3]=1;"";[.C3]) -> 0.193586 | G3: of:=IF([.D3]=1;"";[.D3]) -> 0.193586 | H3: of:=IF([.E3]=1;"";[.E3]) ->  
A4: 3 | B4: strcmp: &"pky"{\0,p,\0} &"pky"{\0,p,\0} :=> 0 | C4: 0.0724413 | D4: 0.0724413 | F4: of:=IF([.C4]=1;"";[.C4]) -> 0.0724413 | G4: of:=IF([.D4]=1;"";[.D4]) -> 0.0724413 | H4: of:=IF([.E4]=1;"";[.E4]) ->  
A5: 4 | B5: strcmp: &"sqvl"{\0,\0} &"sqvl"{\0,\0} :=> 0 | C5: 0.028242 | D5: 0.028242 | F5: of:=IF([.C5]=1;"";[.C5]) -> 0.028242 | G5: of:=IF([.D5]=1;"";[.D5]) -> 0.028242 | H5: of:=IF([.E5]=1;"";[.E5]) ->  
A6: 5 | B6: strcmp: &"sywpf"{\0} &"sywpf"{\0} :=> 0 | C6: 0.0231123 | D6: 0.0231123 | F6: of:=IF([.C6]=1;"";[.C6]) -> 0.0231123 | G6: of:=IF([.D6]=1;"";[.D6]) -> 0.0231123 | H6: of:=IF([.E6]=1;"";[.E6]) ->  
A7: 6 | B7: strcmp: &"evson"{\0} &"evsoc"{\0} :=> 1 | C7: 0.0285046 | D7: 0.0277248 | F7: of:=IF([.C7]=1;"";[.C7]) -> 0.0285046 | G7: of:=IF([.D7]=1;"";[.D7]) -> 0.0277248 | H7: of:=IF([.E7]=1;"";[.E7]) ->  
A8: 7 | B8: strcmp: &"wtyuw"{\0} &"wtyuz"{\0} :=> -1 | C8: 0.0241583 | D8: 0.0246623 | F8: of:=IF([.C8]=1;"";[.C8]) -> 0.0241583 | G8: of:=IF([.D8]=1;"";[.D8]) -> 0.0246623 | H8: of:=IF([.E8]=1;"";[.E8]) ->  
A9: 8 | B9: strcmp: &"gpnry"{\0} &"gpnmk"{\0} :=> 1 | C9: 0.0231933 | D9: 0.0205858 | F9: of:=IF([.C9]=1;"";[.C9]) -> 0.0231933 | G9: of:=IF([.D9]=1;"";[.D9]) -> 0.0205858 | H9: of:=IF([.E9]=1;"";[.E9]) ->  
A10: 9 | B10: strcmp: &"ofppj"{\0} &"ofptu"{\0} :=> -1 | C10: 0.02248 | D10: 0.0251198 | F10: of:=IF([.C10]=1;"";[.C10]) -> 0.02248 | G10: of:=IF([.D10]=1;"";[.D10]) -> 0.0251198 | H10: of:=IF([.E10]=1;"";[.E10]) ->  
A11: 10 | B11: strcmp: &"menne"{\0} &"medne"{\0} :=> 1 | C11: 0.0313944 | D11: 0.0305913 | F11: of:=IF([.C11]=1;"";[.C11]) -> 0.0313944 | G11: of:=IF([.D11]=1;"";[.D11]) -> 0.0305913 | H11: of:=IF([.E11]=1;"";[.E11]) ->  
A12: 11 | B12: strcmp: &"rngal"{\0} &"rntca"{\0} :=> -1 | C12: 0.0311526 | D12: 0.0302201 | F12: of:=IF([.C12]=1;"";[.C12]) -> 0.0311526 | G12: of:=IF([.D12]=1;"";[.D12]) -> 0.0302201
A13: 12 | B13: strcmp: &"ssghk"{\0} &"sfarl"{\0} :=> 1 | C13: 0.0255238 | D13: 0.0290032 | F13: of:=IF([.C13]=1;"";[.C13]) -> 0.0255238 | G13: of:=IF([.D13]=1;"";[.D13]) -> 0.0290032
A14: 13 | B14: strcmp: &"bjust"{\0} &"bosvo"{\0} :=> -1 | C14: 0.0288825 | D14: 0.0273723 | F14: of:=IF([.C14]=1;"";[.C14]) -> 0.0288825 | G14: of:=IF([.D14]=1;"";[.D14]) -> 0.0273723
A15: 14 | B15: strcmp: &"zoequ"{\0} &"cnjma"{\0} :=> 1 | C15: 0.0269799 | D15: 0.022006 | F15: of:=IF([.C15]=1;"";[.C15]) -> 0.0269799 | G15: of:=IF([.D15]=1;"";[.D15]) -> 0.022006
A16: 15 | B16: strcmp: &"fpidr"{\0} &"jaibv"{\0} :=> -1 | C16: 0.0249249 | D16: 0.0267221 | F16: of:=IF([.C16]=1;"";[.C16]) -> 0.0249249 | G16: of:=IF([.D16]=1;"";[.D16]) -> 0.0267221
A17: 1 | B17: strncmp: &""{\0,p,n,p,s,\0} &""{\0,p,k,r,e,\0} 5 :=> 0 | C17: 1 | D17: 1 | F17: of:=IF([.C17]=1;"";[.C17]) ->  | G17: of:=IF([.D17]=1;"";[.D17]) ->  | I17: of:=AVERAGE([.F17:.F32]) -> 0.0410538285714286 | J17: of:=AVERAGE([.G17:.G32]) -> 0.0379860928571429 | L17: of:=AVERAGE([.I17:.J17]) -> 0.0395199607142857
A18: 2 | B18: strncmp: &"n"{\0,p,l,f,\0} &"n"{\0,p,p,r,\0} 5 :=> 0 | C18: 1 | D18: 1 | F18: of:=IF([.C18]=1;"";[.C18]) ->  | G18: of:=IF([.D18]=1;"";[.D18]) -> 
A19: 3 | B19: strncmp: &"cf"{\0,p,g,\0} &"cf"{\0,p,t,\0} 5 :=> 0 | C19: 0.154159 | D19: 0.154159 | F19: of:=IF([.C19]=1;"";[.C19]) -> 0.154159 | G19: of:=IF([.D19]=1;"";[.D19]) -> 0.154159
A20: 4 | B20: strncmp: &"qia"{\0,p,\0} &"qia"{\0,p,\0} 5 :=> 0 | C20: 0.0775255 | D20: 0.0775255 | F20: of:=IF([.C20]=1;"";[.C20]) -> 0.0775255 | G20: of:=IF([.D20]=1;"";[.D20]) -> 0.0775255
A21: 5 | B21: strncmp: &"lnkl"{\0,\0} &"lnkl"{\0,\0} 5 :=> 0 | C21: 0.0413866 | D21: 0.0413866 | F21: of:=IF([.C21]=1;"";[.C21]) -> 0.0413866 | G21: of:=IF([.D21]=1;"";[.D21]) -> 0.0413866
A22: 6 | B22: strncmp: &"vdyco"{\0} &"vdyco"{\0} 5 :=> 0 | C22: 0.0247661 | D22: 0.0247661 | F22: of:=IF([.C22]=1;"";[.C22]) -> 0.0247661 | G22: of:=IF([.D22]=1;"";[.D22]) -> 0.0247661
A23: 7 | B23: strncmp: &"pyoor"{\0} &"pyoop"{\0} 5 :=> 1 | C23: 0.0293418 | D23: 0.0287786 | F23: of:=IF([.C23]=1;"";[.C23]) -> 0.0293418 | G23: of:=IF([.D23]=1;"";[.D23]) -> 0.0287786
A24: 8 | B24: strncmp: &"kvcyp"{\0} &"kvcyw"{\0} 5 :=> -1 | C24: 0.0231186 | D24: 0.0228859 | F24: of:=IF([.C24]=1;"";[.C24]) -> 0.0231186 | G24: of:=IF([.D24]=1;"";[.D24]) -> 0.0228859
A25: 9 | B25: strncmp: &"blful"{\0} &"blfhy"{\0} 5 :=> 1 | C25: 0.0291882 | D25: 0.0243089 | F25: of:=IF([.C25]=1;"";[.C25]) -> 0.0291882 | G25: of:=IF([.D25]=1;"";[.D25]) -> 0.0243089
A26: 10 | B26: strncmp: &"mvogr"{\0} &"mvojk"{\0} 5 :=> -1 | C26: 0.0254585 | D26: 0.0210691 | F26: of:=IF([.C26]=1;"";[.C26]) -> 0.0254585 | G26: of:=IF([.D26]=1;"";[.D26]) -> 0.0210691
A27: 11 | B27: strncmp: &"utgys"{\0} &"utbbk"{\0} 5 :=> 1 | C27: 0.0274416 | D27: 0.0237056 | F27: of:=IF([.C27]=1;"";[.C27]) -> 0.0274416 | G27: of:=IF([.D27]=1;"";[.D27]) -> 0.0237056
A28: 12 | B28: strncmp: &"rswas"{\0} &"rsxnl"{\0} 5 :=> -1 | C28: 0.0301407 | D28: 0 | F28: of:=IF([.C28]=1;"";[.C28]) -> 0.0301407 | G28: of:=IF([.D28]=1;"";[.D28]) -> 0
A29: 13 | B29: strncmp: &"utidh"{\0} &"ubeja"{\0} 5 :=> 1 | C29: 0.0294576 | D29: 0.0271462 | F29: of:=IF([.C29]=1;"";[.C29]) -> 0.0294576 | G29: of:=IF([.D29]=1;"";[.D29]) -> 0.0271462
A30: 14 | B30: strncmp: &"oeyik"{\0} &"opyro"{\0} 5 :=> -1 | C30: 0.0282913 | D30: 0.0284633 | F30: of:=IF([.C30]=1;"";[.C30]) -> 0.0282913 | G30: of:=IF([.D30]=1;"";[.D30]) -> 0.0284633
A31: 15 | B31: strncmp: &"kahrk"{\0} &"fejer"{\0} 5 :=> 1 | C31: 0.0277348 | D31: 0.0282308 | F31: of:=IF([.C31]=1;"";[.C31]) -> 0.0277348 | G31: of:=IF([.D31]=1;"";[.D31]) -> 0.0282308
A32: 16 | B32: strncmp: &"vgrta"{\0} &"ymiau"{\0} 5 :=> -1 | C32: 0.0267433 | D32: 0.0293797 | F32: of:=IF([.C32]=1;"";[.C32]) -> 0.0267433 | G32: of:=IF([.D32]=1;"";[.D32]) -> 0.0293797
A33: 1 | B33: sysfs_streq: &""{\0,p,i,c,b,\0} &"mosal"{\0} :=> \0 | C33: 1 | D33: 0.0311458 | F33: of:=IF([.C33]=1;"";[.C33]) ->  | G33: of:=IF([.D33]=1;"";[.D33]) -> 0.0311458 | I33: of:=AVERAGE([.F33:.F71]) -> 0.0675103206896552 | J33: of:=AVERAGE([.G33:.G71]) -> 0.0448021714285714 | L33: of:=AVERAGE([.I33:.J33]) -> 0.0561562460591133
A34: 2 | B34: sysfs_streq: &""{\0,p,y,e,d,\0} &"\n"{\0,b,m,w,\0} :=> \x01 | C34: 1 | F34: of:=IF([.C34]=1;"";[.C34]) ->  | G34: of:=IF([.D34]=1;"";[.D34]) ->  
A35: 3 | B35: sysfs_streq: &""{\0,p,n,j,l,\0} &"\nauna"{\0} :=> \0 | C35: 1 | F35: of:=IF([.C35]=1;"";[.C35]) ->  | G35: of:=IF([.D35]=1;"";[.D35]) ->  
A36: 4 | B36: sysfs_streq: &""{\0,p,r,t,k,\0} &""{\0,h,t,i,r,\0} :=> \x01 | C36: 1 | D36: 1 | F36: of:=IF([.C36]=1;"";[.C36]) ->  | G36: of:=IF([.D36]=1;"";[.D36]) -> 
A37: 5 | B37: sysfs_streq: &"wfymg"{\0} &"gexmk"{\0} :=> \0 | C37: 0.022491 | D37: 0.0228664 | F37: of:=IF([.C37]=1;"";[.C37]) -> 0.022491 | G37: of:=IF([.D37]=1;"";[.D37]) -> 0.0228664
A38: 6 | B38: sysfs_streq: &"\n"{\0,p,e,l,\0} &""{\0,a,f,f,r,\0} :=> \x01 | C38: 1 | F38: of:=IF([.C38]=1;"";[.C38]) ->  | G38: of:=IF([.D38]=1;"";[.D38]) ->  
A39: 7 | B39: sysfs_streq: &"\n"{\0,a,h,a,\0} &"nqwhp"{\0} :=> \0 | C39: 0.0172386 | F39: of:=IF([.C39]=1;"";[.C39]) -> 0.0172386 | G39: of:=IF([.D39]=1;"";[.D39]) ->  
A40: 8 | B40: sysfs_streq: &"\naaag"{\0} &"mnivy"{\0} :=> \0 | C40: 0.027356 | F40: of:=IF([.C40]=1;"";[.C40]) -> 0.027356 | G40: of:=IF([.D40]=1;"";[.D40]) ->  
A41: 9 | B41: sysfs_streq: &"q"{\0,p,l,a,\0} &"qblee"{\0} :=> \0 | C41: 1 | D41: 0.0236381 | F41: of:=IF([.C41]=1;"";[.C41]) ->  | G41: of:=IF([.D41]=1;"";[.D41]) -> 0.0236381
A42: 10 | B42: sysfs_streq: &"s"{\0,p,m,a,\0} &"s\n"{\0,a,l,\0} :=> \x01 | C42: 1 | F42: of:=IF([.C42]=1;"";[.C42]) ->  | G42: of:=IF([.D42]=1;"";[.D42]) ->  
A43: 11 | B43: sysfs_streq: &"y"{\0,p,b,f,\0} &"y\nacy"{\0} :=> \0 | C43: 1 | F43: of:=IF([.C43]=1;"";[.C43]) ->  | G43: of:=IF([.D43]=1;"";[.D43]) ->  
A44: 12 | B44: sysfs_streq: &"c"{\0,p,g,r,\0} &"c"{\0,h,l,q,\0} :=> \x01 | C44: 1 | D44: 1 | F44: of:=IF([.C44]=1;"";[.C44]) ->  | G44: of:=IF([.D44]=1;"";[.D44]) -> 
A45: 13 | B45: sysfs_streq: &"vexxb"{\0} &"vvlae"{\0} :=> \0 | C45: 0.0230927 | D45: 0.0231332 | F45: of:=IF([.C45]=1;"";[.C45]) -> 0.0230927 | G45: of:=IF([.D45]=1;"";[.D45]) -> 0.0231332
A46: 14 | B46: sysfs_streq: &"p\n"{\0,b,f,\0} &"p"{\0,b,r,e,\0} :=> \x01 | C46: 1 | F46: of:=IF([.C46]=1;"";[.C46]) ->  | G46: of:=IF([.D46]=1;"";[.D46]) ->  
A47: 15 | B47: sysfs_streq: &"w\n"{\0,b,w,\0} &"wkmuu"{\0} :=> \0 | C47: 0.0229594 | F47: of:=IF([.C47]=1;"";[.C47]) -> 0.0229594 | G47: of:=IF([.D47]=1;"";[.D47]) ->  
A48: 16 | B48: sysfs_streq: &"q\naya"{\0} &"qlekr"{\0} :=> \0 | C48: 0.0201077 | F48: of:=IF([.C48]=1;"";[.C48]) -> 0.0201077 | G48: of:=IF([.D48]=1;"";[.D48]) ->  
A49: 17 | B49: sysfs_streq: &"sj"{\0,p,s,\0} &"sjnoc"{\0} :=> \0 | C49: 0.167287 | D49: 0.0218614 | F49: of:=IF([.C49]=1;"";[.C49]) -> 0.167287 | G49: of:=IF([.D49]=1;"";[.D49]) -> 0.0218614
A50: 18 | B50: sysfs_streq: &"ji"{\0,p,s,\0} &"ji\n"{\0,a,\0} :=> \x01 | C50: 0.192142 | F50: of:=IF([.C50]=1;"";[.C50]) -> 0.192142 | G50: of:=IF([.D50]=1;"";[.D50]) ->  
A51: 19 | B51: sysfs_streq: &"fe"{\0,p,f,\0} &"fe\nao"{\0} :=> \0 | C51: 0.215706 | F51: of:=IF([.C51]=1;"";[.C51]) -> 0.215706 | G51: of:=IF([.D51]=1;"";[.D51]) ->  
A52: 20 | B52: sysfs_streq: &"by"{\0,p,p,\0} &"by"{\0,b,t,\0} :=> \x01 | C52: 0.215236 | D52: 0.215236 | F52: of:=IF([.C52]=1;"";[.C52]) -> 0.215236 | G52: of:=IF([.D52]=1;"";[.D52]) -> 0.215236
A53: 21 | B53: sysfs_streq: &"wafvu"{\0} &"wabtf"{\0} :=> \0 | C53: 0.023659 | D53: 0.0275454 | F53: of:=IF([.C53]=1;"";[.C53]) -> 0.023659 | G53: of:=IF([.D53]=1;"";[.D53]) -> 0.0275454
A54: 22 | B54: sysfs_streq: &"er\n"{\0,b,\0} &"er"{\0,b,r,\0} :=> \x01 | C54: 0.226174 | F54: of:=IF([.C54]=1;"";[.C54]) -> 0.226174 | G54: of:=IF([.D54]=1;"";[.D54]) ->  
A55: 23 | B55: sysfs_streq: &"tr\n"{\0,b,\0} &"troan"{\0} :=> \0 | C55: 0.0311443 | F55: of:=IF([.C55]=1;"";[.C55]) -> 0.0311443 | G55: of:=IF([.D55]=1;"";[.D55]) ->  
A56: 24 | B56: sysfs_streq: &"jp\nax"{\0} &"jpims"{\0} :=> \0 | C56: 0.0223462 | F56: of:=IF([.C56]=1;"";[.C56]) -> 0.0223462 | G56: of:=IF([.D56]=1;"";[.D56]) ->  
A57: 25 | B57: sysfs_streq: &"yma"{\0,p,\0} &"ymadq"{\0} :=> \0 | C57: 0.0838177 | D57: 0.027573 | F57: of:=IF([.C57]=1;"";[.C57]) -> 0.0838177 | G57: of:=IF([.D57]=1;"";[.D57]) -> 0.027573
A58: 26 | B58: sysfs_streq: &"nvr"{\0,p,\0} &"nvr\n"{\0,\0} :=> \x01 | C58: 0.0743646 | F58: of:=IF([.C58]=1;"";[.C58]) -> 0.0743646 | G58: of:=IF([.D58]=1;"";[.D58]) ->  
A59: 27 | B59: sysfs_streq: &"pgc"{\0,p,\0} &"pgc\na"{\0} :=> \0 | C59: 0.0629647 | F59: of:=IF([.C59]=1;"";[.C59]) -> 0.0629647 | G59: of:=IF([.D59]=1;"";[.D59]) ->  
A60: 28 | B60: sysfs_streq: &"nrr"{\0,p,\0} &"nrr"{\0,h,\0} :=> \x01 | C60: 0.0799519 | D60: 0.0799519 | F60: of:=IF([.C60]=1;"";[.C60]) -> 0.0799519 | G60: of:=IF([.D60]=1;"";[.D60]) -> 0.0799519
A61: 29 | B61: sysfs_streq: &"flumu"{\0} &"fludl"{\0} :=> \0 | C61: 0.0287601 | D61: 0.0283478 | F61: of:=IF([.C61]=1;"";[.C61]) -> 0.0287601 | G61: of:=IF([.D61]=1;"";[.D61]) -> 0.0283478
A62: 30 | B62: sysfs_streq: &"ons\n"{\0,\0} &"ons"{\0,a,\0} :=> \x01 | C62: 0.0902181 | F62: of:=IF([.C62]=1;"";[.C62]) -> 0.0902181 | G62: of:=IF([.D62]=1;"";[.D62]) ->  
A63: 31 | B63: sysfs_streq: &"gar\n"{\0,\0} &"gargd"{\0} :=> \0 | C63: 0.0282238 | F63: of:=IF([.C63]=1;"";[.C63]) -> 0.0282238 | G63: of:=IF([.D63]=1;"";[.D63]) ->  
A64: 32 | B64: sysfs_streq: &"gac\na"{\0} &"gacqt"{\0} :=> \0 | C64: 0.0222279 | F64: of:=IF([.C64]=1;"";[.C64]) -> 0.0222279 | G64: of:=IF([.D64]=1;"";[.D64]) ->  
A65: 33 | B65: sysfs_streq: &"fahr"{\0,\0} &"fahro"{\0} :=> \0 | C65: 0.0438291 | D65: 0.0289595 | F65: of:=IF([.C65]=1;"";[.C65]) -> 0.0438291 | G65: of:=IF([.D65]=1;"";[.D65]) -> 0.0289595
A66: 34 | B66: sysfs_streq: &"nckj"{\0,\0} &"nckj\n"{\0} :=> \x01 | C66: 0.0390989 | F66: of:=IF([.C66]=1;"";[.C66]) -> 0.0390989 | G66: of:=IF([.D66]=1;"";[.D66]) ->  
A67: 35 | B67: sysfs_streq: &"hlrr"{\0,\0} &"hlrr"{\0,\0} :=> \x01 | C67: 0.0421833 | D67: 0.0421833 | F67: of:=IF([.C67]=1;"";[.C67]) -> 0.0421833 | G67: of:=IF([.D67]=1;"";[.D67]) -> 0.0421833
A68: 36 | B68: sysfs_streq: &"deffu"{\0} &"deffh"{\0} :=> \0 | C68: 0.0299001 | D68: 0.0257008 | F68: of:=IF([.C68]=1;"";[.C68]) -> 0.0299001 | G68: of:=IF([.D68]=1;"";[.D68]) -> 0.0257008
A69: 37 | B69: sysfs_streq: &"ovit\n"{\0} &"ovit"{\0,\0} :=> \x01 | C69: 0.0478889 | F69: of:=IF([.C69]=1;"";[.C69]) -> 0.0478889 | G69: of:=IF([.D69]=1;"";[.D69]) ->  
A70: 38 | B70: sysfs_streq: &"ebee\n"{\0} &"ebeej"{\0} :=> \0 | C70: 0.0283425 | F70: of:=IF([.C70]=1;"";[.C70]) -> 0.0283425 | G70: of:=IF([.D70]=1;"";[.D70]) ->  
A71: 39 | B71: sysfs_streq: &"juelf"{\0} &"juelf"{\0} :=> \x01 | C71: 0.0290878 | D71: 0.0290878 | F71: of:=IF([.C71]=1;"";[.C71]) -> 0.0290878 | G71: of:=IF([.D71]=1;"";[.D71]) -> 0.0290878

Sheet: strcpy
A1: # | B1: Test Case | C1: N1 | D1: N2 | E1: N3 | O1: FINAL
A2: 1 | B2: strcpy: &""{\0,\x01,\x01,\x01,\x01,\x01} &"h"{\0,p,s,j,\0} :=> &"h"{\0,p,a,k,\0} | C2: 1 | D2: 1 | E2: 1 | G2: of:=IF([.C2]=1;"";[.C2]) ->  | H2: of:=IF([.D2]=1;"";[.D2]) ->  | I2: of:=IF([.E2]=1;"";[.E2]) ->  | K2: of:=AVERAGE([.G2:.G36]) -> 0.0852209875 | L2: of:=AVERAGE([.H2:.H36]) -> 0.0903495166666667 | M2: of:=AVERAGE([.I2:.I36]) -> 0.0903495166666667 | O2: of:=AVERAGE([.K2:.M2]) -> 0.0886400069444444
A3: 2 | B3: strcpy: &""{\0,\x01,\x01,\x01,\x01,\x01} &"us"{\0,p,p,\0} :=> &"us"{\0,p,w,\0} | C3: 1 | D3: 0.219364 | E3: 0.219364 | G3: of:=IF([.C3]=1;"";[.C3]) ->  | H3: of:=IF([.D3]=1;"";[.D3]) -> 0.219364 | I3: of:=IF([.E3]=1;"";[.E3]) -> 0.219364
A4: 3 | B4: strcpy: &""{\0,\x01,\x01,\x01,\x01,\x01} &"ybr"{\0,p,\0} :=> &"ybr"{\0,p,\0} | C4: 1 | D4: 0.0790564 | E4: 0.0790564 | G4: of:=IF([.C4]=1;"";[.C4]) ->  | H4: of:=IF([.D4]=1;"";[.D4]) -> 0.0790564 | I4: of:=IF([.E4]=1;"";[.E4]) -> 0.0790564
A5: 4 | B5: strcpy: &""{\0,\x01,\x01,\x01,\x01,\x01} &"forc"{\0,\0} :=> &"forc"{\0,\0} | C5: 1 | D5: 0.0481209 | E5: 0.0481209 | G5: of:=IF([.C5]=1;"";[.C5]) ->  | H5: of:=IF([.D5]=1;"";[.D5]) -> 0.0481209 | I5: of:=IF([.E5]=1;"";[.E5]) -> 0.0481209
A6: 5 | B6: strcpy: &""{\0,\x01,\x01,\x01,\x01,\x01} &"lxmer"{\0} :=> &"lxmer"{\0} | C6: 1 | D6: 0.0229327 | E6: 0.0229327 | G6: of:=IF([.C6]=1;"";[.C6]) ->  | H6: of:=IF([.D6]=1;"";[.D6]) -> 0.0229327 | I6: of:=IF([.E6]=1;"";[.E6]) -> 0.0229327
A7: 6 | B7: strcpy: &"q"{\0,\x01,\x01,\x01,\x01} &""{\0,p,a,k,y,\0} :=> &""{\0,\0,p,j,a,\0} | C7: 1 | D7: 1 | E7: 1 | G7: of:=IF([.C7]=1;"";[.C7]) ->  | H7: of:=IF([.D7]=1;"";[.D7]) ->  | I7: of:=IF([.E7]=1;"";[.E7]) -> 
A8: 7 | B8: strcpy: &"e"{\0,\x01,\x01,\x01,\x01} &"m"{\0,p,s,i,\0} :=> &"m"{\0,p,i,p,\0} | C8: 1 | D8: 1 | E8: 1 | G8: of:=IF([.C8]=1;"";[.C8]) ->  | H8: of:=IF([.D8]=1;"";[.D8]) ->  | I8: of:=IF([.E8]=1;"";[.E8]) -> 
A9: 8 | B9: strcpy: &"v"{\0,\x01,\x01,\x01,\x01} &"tf"{\0,p,h,\0} :=> &"tf"{\0,p,b,\0} | C9: 1 | D9: 0.197488 | E9: 0.197488 | G9: of:=IF([.C9]=1;"";[.C9]) ->  | H9: of:=IF([.D9]=1;"";[.D9]) -> 0.197488 | I9: of:=IF([.E9]=1;"";[.E9]) -> 0.197488
A10: 9 | B10: strcpy: &"t"{\0,\x01,\x01,\x01,\x01} &"brs"{\0,p,\0} :=> &"brs"{\0,p,\0} | C10: 1 | D10: 0.0859695 | E10: 0.0859695 | G10: of:=IF([.C10]=1;"";[.C10]) ->  | H10: of:=IF([.D10]=1;"";[.D10]) -> 0.0859695 | I10: of:=IF([.E10]=1;"";[.E10]) -> 0.0859695
A11: 10 | B11: strcpy: &"n"{\0,\x01,\x01,\x01,\x01} &"wsaj"{\0,\0} :=> &"wsaj"{\0,\0} | C11: 1 | D11: 0.0440341 | E11: 0.0440341 | G11: of:=IF([.C11]=1;"";[.C11]) ->  | H11: of:=IF([.D11]=1;"";[.D11]) -> 0.0440341 | I11: of:=IF([.E11]=1;"";[.E11]) -> 0.0440341
A12: 11 | B12: strcpy: &"y"{\0,\x01,\x01,\x01,\x01} &"uthrc"{\0} :=> &"uthrc"{\0} | C12: 1 | D12: 0.0307938 | E12: 0.0307938 | G12: of:=IF([.C12]=1;"";[.C12]) ->  | H12: of:=IF([.D12]=1;"";[.D12]) -> 0.0307938 | I12: of:=IF([.E12]=1;"";[.E12]) -> 0.0307938
A13: 12 | B13: strcpy: &"ej"{\0,\x01,\x01,\x01} &""{\0,p,s,w,m,\0} :=> &""{\0,j,\0,p,y,\0} | C13: 0.194359 | D13: 1 | E13: 1 | G13: of:=IF([.C13]=1;"";[.C13]) -> 0.194359 | H13: of:=IF([.D13]=1;"";[.D13]) ->  | I13: of:=IF([.E13]=1;"";[.E13]) -> 
A14: 13 | B14: strcpy: &"ry"{\0,\x01,\x01,\x01} &"n"{\0,p,d,k,\0} :=> &"n"{\0,\0,p,a,\0} | C14: 0.216174 | D14: 1 | E14: 1 | G14: of:=IF([.C14]=1;"";[.C14]) -> 0.216174 | H14: of:=IF([.D14]=1;"";[.D14]) ->  | I14: of:=IF([.E14]=1;"";[.E14]) -> 
A15: 14 | B15: strcpy: &"qv"{\0,\x01,\x01,\x01} &"wo"{\0,p,i,\0} :=> &"wo"{\0,p,o,\0} | C15: 0.135488 | D15: 0.216638 | E15: 0.216638 | G15: of:=IF([.C15]=1;"";[.C15]) -> 0.135488 | H15: of:=IF([.D15]=1;"";[.D15]) -> 0.216638 | I15: of:=IF([.E15]=1;"";[.E15]) -> 0.216638
A16: 15 | B16: strcpy: &"tc"{\0,\x01,\x01,\x01} &"zfl"{\0,p,\0} :=> &"zfl"{\0,p,\0} | C16: 0.207303 | D16: 0.0620031 | E16: 0.0620031 | G16: of:=IF([.C16]=1;"";[.C16]) -> 0.207303 | H16: of:=IF([.D16]=1;"";[.D16]) -> 0.0620031 | I16: of:=IF([.E16]=1;"";[.E16]) -> 0.0620031
A17: 16 | B17: strcpy: &"pe"{\0,\x01,\x01,\x01} &"aqia"{\0,\0} :=> &"aqia"{\0,\0} | C17: 0.219364 | D17: 0.0401535 | E17: 0.0401535 | G17: of:=IF([.C17]=1;"";[.C17]) -> 0.219364 | H17: of:=IF([.D17]=1;"";[.D17]) -> 0.0401535 | I17: of:=IF([.E17]=1;"";[.E17]) -> 0.0401535
A18: 17 | B18: strcpy: &"lv"{\0,\x01,\x01,\x01} &"mlvak"{\0} :=> &"mlvak"{\0} | C18: 0.206077 | D18: 0.0269431 | E18: 0.0269431 | G18: of:=IF([.C18]=1;"";[.C18]) -> 0.206077 | H18: of:=IF([.D18]=1;"";[.D18]) -> 0.0269431 | I18: of:=IF([.E18]=1;"";[.E18]) -> 0.0269431
A19: 18 | B19: strcpy: &"hog"{\0,\x01,\x01} &""{\0,p,c,y,p,\0} :=> &""{\0,o,g,\0,p,\0} | C19: 0.0858315 | D19: 1 | E19: 1 | G19: of:=IF([.C19]=1;"";[.C19]) -> 0.0858315 | H19: of:=IF([.D19]=1;"";[.D19]) ->  | I19: of:=IF([.E19]=1;"";[.E19]) -> 
A20: 19 | B20: strcpy: &"ivo"{\0,\x01,\x01} &"m"{\0,p,j,f,\0} :=> &"m"{\0,o,\0,p,\0} | C20: 0.0845172 | D20: 1 | E20: 1 | G20: of:=IF([.C20]=1;"";[.C20]) -> 0.0845172 | H20: of:=IF([.D20]=1;"";[.D20]) ->  | I20: of:=IF([.E20]=1;"";[.E20]) -> 
A21: 20 | B21: strcpy: &"bcp"{\0,\x01,\x01} &"eg"{\0,p,t,\0} :=> &"eg"{\0,\0,p,\0} | C21: 0.0614401 | D21: 0.213322 | E21: 0.213322 | G21: of:=IF([.C21]=1;"";[.C21]) -> 0.0614401 | H21: of:=IF([.D21]=1;"";[.D21]) -> 0.213322 | I21: of:=IF([.E21]=1;"";[.E21]) -> 0.213322
A22: 21 | B22: strcpy: &"qud"{\0,\x01,\x01} &"des"{\0,p,\0} :=> &"des"{\0,p,\0} | C22: 0.0841147 | D22: 0.0905241 | E22: 0.0905241 | G22: of:=IF([.C22]=1;"";[.C22]) -> 0.0841147 | H22: of:=IF([.D22]=1;"";[.D22]) -> 0.0905241 | I22: of:=IF([.E22]=1;"";[.E22]) -> 0.0905241
A23: 22 | B23: strcpy: &"xsd"{\0,\x01,\x01} &"oulc"{\0,\0} :=> &"oulc"{\0,\0} | C23: 0.0681258 | D23: 0.0453026 | E23: 0.0453026 | G23: of:=IF([.C23]=1;"";[.C23]) -> 0.0681258 | H23: of:=IF([.D23]=1;"";[.D23]) -> 0.0453026 | I23: of:=IF([.E23]=1;"";[.E23]) -> 0.0453026
A24: 23 | B24: strcpy: &"brn"{\0,\x01,\x01} &"sudib"{\0} :=> &"sudib"{\0} | C24: 0.0845478 | D24: 0.0296875 | E24: 0.0296875 | G24: of:=IF([.C24]=1;"";[.C24]) -> 0.0845478 | H24: of:=IF([.D24]=1;"";[.D24]) -> 0.0296875 | I24: of:=IF([.E24]=1;"";[.E24]) -> 0.0296875
A25: 24 | B25: strcpy: &"ksai"{\0,\x01} &""{\0,p,u,g,o,\0} :=> &""{\0,s,a,i,\0,\0} | C25: 0.0468033 | D25: 1 | E25: 1 | G25: of:=IF([.C25]=1;"";[.C25]) -> 0.0468033 | H25: of:=IF([.D25]=1;"";[.D25]) ->  | I25: of:=IF([.E25]=1;"";[.E25]) -> 
A26: 25 | B26: strcpy: &"rqlf"{\0,\x01} &"c"{\0,p,j,s,\0} :=> &"c"{\0,l,f,\0,\0} | C26: 0.0277187 | D26: 1 | E26: 1 | G26: of:=IF([.C26]=1;"";[.C26]) -> 0.0277187 | H26: of:=IF([.D26]=1;"";[.D26]) ->  | I26: of:=IF([.E26]=1;"";[.E26]) -> 
A27: 26 | B27: strcpy: &"zids"{\0,\x01} &"ok"{\0,p,s,\0} :=> &"ok"{\0,s,\0,\0} | C27: 0.0448388 | D27: 0.211356 | E27: 0.211356 | G27: of:=IF([.C27]=1;"";[.C27]) -> 0.0448388 | H27: of:=IF([.D27]=1;"";[.D27]) -> 0.211356 | I27: of:=IF([.E27]=1;"";[.E27]) -> 0.211356
A28: 27 | B28: strcpy: &"pwby"{\0,\x01} &"fut"{\0,p,\0} :=> &"fut"{\0,\0,\0} | C28: 0.0381145 | D28: 0.085669 | E28: 0.085669 | G28: of:=IF([.C28]=1;"";[.C28]) -> 0.0381145 | H28: of:=IF([.D28]=1;"";[.D28]) -> 0.085669 | I28: of:=IF([.E28]=1;"";[.E28]) -> 0.085669
A29: 28 | B29: strcpy: &"toet"{\0,\x01} &"nvya"{\0,\0} :=> &"nvya"{\0,\0} | C29: 0.0468966 | D29: 0.0414956 | E29: 0.0414956 | G29: of:=IF([.C29]=1;"";[.C29]) -> 0.0468966 | H29: of:=IF([.D29]=1;"";[.D29]) -> 0.0414956 | I29: of:=IF([.E29]=1;"";[.E29]) -> 0.0414956
A30: 29 | B30: strcpy: &"yawt"{\0,\x01} &"yktym"{\0} :=> &"yktym"{\0} | C30: 0.0414209 | D30: 0.0247433 | E30: 0.0247433 | G30: of:=IF([.C30]=1;"";[.C30]) -> 0.0414209 | H30: of:=IF([.D30]=1;"";[.D30]) -> 0.0247433 | I30: of:=IF([.E30]=1;"";[.E30]) -> 0.0247433
A31: 30 | B31: strcpy: &"fhayn"{\0} &""{\0,p,j,i,s,\0} :=> &""{\0,h,a,y,n,\0} | C31: 0.0252521 | D31: 1 | E31: 1 | G31: of:=IF([.C31]=1;"";[.C31]) -> 0.0252521 | H31: of:=IF([.D31]=1;"";[.D31]) ->  | I31: of:=IF([.E31]=1;"";[.E31]) -> 
A32: 31 | B32: strcpy: &"inghs"{\0} &"x"{\0,p,u,r,\0} :=> &"x"{\0,g,h,s,\0} | C32: 0.0306329 | D32: 1 | E32: 1 | G32: of:=IF([.C32]=1;"";[.C32]) -> 0.0306329 | H32: of:=IF([.D32]=1;"";[.D32]) ->  | I32: of:=IF([.E32]=1;"";[.E32]) -> 
A33: 32 | B33: strcpy: &"xnsuc"{\0} &"sn"{\0,p,l,\0} :=> &"sn"{\0,u,c,\0} | C33: 0.024971 | D33: 0.203891 | E33: 0.203891 | G33: of:=IF([.C33]=1;"";[.C33]) -> 0.024971 | H33: of:=IF([.D33]=1;"";[.D33]) -> 0.203891 | I33: of:=IF([.E33]=1;"";[.E33]) -> 0.203891
A34: 33 | B34: strcpy: &"yeuup"{\0} &"usg"{\0,p,\0} :=> &"usg"{\0,p,\0} | C34: 0.0259959 | D34: 0.0780867 | E34: 0.0780867 | G34: of:=IF([.C34]=1;"";[.C34]) -> 0.0259959 | H34: of:=IF([.D34]=1;"";[.D34]) -> 0.0780867 | I34: of:=IF([.E34]=1;"";[.E34]) -> 0.0780867
A35: 34 | B35: strcpy: &"sjast"{\0} &"vimp"{\0,\0} :=> &"vimp"{\0,\0} | C35: 0.0258147 | D35: 0.0472644 | E35: 0.0472644 | G35: of:=IF([.C35]=1;"";[.C35]) -> 0.0258147 | H35: of:=IF([.D35]=1;"";[.D35]) -> 0.0472644 | I35: of:=IF([.E35]=1;"";[.E35]) -> 0.0472644
A36: 35 | B36: strcpy: &"unqsr"{\0} &"bkodm"{\0} :=> &"bkodm"{\0} | C36: 0.0195022 | D36: 0.0235491 | E36: 0.0235491 | G36: of:=IF([.C36]=1;"";[.C36]) -> 0.0195022 | H36: of:=IF([.D36]=1;"";[.D36]) -> 0.0235491 | I36: of:=IF([.E36]=1;"";[.E36]) -> 0.0235491
A37: 1 | B37: strncpy: &""{\0,\x01,\x01,\x01,\x01,\x01} &""{\0,p,l,e,b,\0} 5 :=> &""{\0,\0,\0,\0,\0,\0} | C37: 1 | D37: 1 | E37: 1 | G37: of:=IF([.C37]=1;"";[.C37]) ->  | H37: of:=IF([.D37]=1;"";[.D37]) ->  | I37: of:=IF([.E37]=1;"";[.E37]) ->  | K37: of:=AVERAGE([.G37:.G72]) -> 0.0845170541666667 | L37: of:=AVERAGE([.H37:.H72]) -> 0.0900851458333333 | M37: of:=AVERAGE([.I37:.I72]) -> 0.0900851458333333 | O37: of:=AVERAGE([.K37:.M37]) -> 0.0882291152777778
A38: 2 | B38: strncpy: &""{\0,\x01,\x01,\x01,\x01,\x01} &"m"{\0,p,d,n,\0} 5 :=> &"m"{\0,\0,\0,\0,\0} | C38: 1 | D38: 1 | E38: 1 | G38: of:=IF([.C38]=1;"";[.C38]) ->  | H38: of:=IF([.D38]=1;"";[.D38]) ->  | I38: of:=IF([.E38]=1;"";[.E38]) -> 
A39: 3 | B39: strncpy: &""{\0,\x01,\x01,\x01,\x01,\x01} &"ac"{\0,p,d,\0} 5 :=> &"ac"{\0,\0,\0,\0} | C39: 1 | D39: 0.218916 | E39: 0.218916 | G39: of:=IF([.C39]=1;"";[.C39]) ->  | H39: of:=IF([.D39]=1;"";[.D39]) -> 0.218916 | I39: of:=IF([.E39]=1;"";[.E39]) -> 0.218916
A40: 4 | B40: strncpy: &""{\0,\x01,\x01,\x01,\x01,\x01} &"lov"{\0,p,\0} 5 :=> &"lov"{\0,\0,\0} | C40: 1 | D40: 0.0866717 | E40: 0.0866717 | G40: of:=IF([.C40]=1;"";[.C40]) ->  | H40: of:=IF([.D40]=1;"";[.D40]) -> 0.0866717 | I40: of:=IF([.E40]=1;"";[.E40]) -> 0.0866717
A41: 5 | B41: strncpy: &""{\0,\x01,\x01,\x01,\x01,\x01} &"ceha"{\0,\0} 5 :=> &"ceha"{\0,\0} | C41: 1 | D41: 0.0467127 | E41: 0.0467127 | G41: of:=IF([.C41]=1;"";[.C41]) ->  | H41: of:=IF([.D41]=1;"";[.D41]) -> 0.0467127 | I41: of:=IF([.E41]=1;"";[.E41]) -> 0.0467127
A42: 6 | B42: strncpy: &""{\0,\x01,\x01,\x01,\x01,\x01} &"yhwkb"{\0} 5 :=> &"yhwkb"{\0} | C42: 1 | D42: 0.0226632 | E42: 0.0226632 | G42: of:=IF([.C42]=1;"";[.C42]) ->  | H42: of:=IF([.D42]=1;"";[.D42]) -> 0.0226632 | I42: of:=IF([.E42]=1;"";[.E42]) -> 0.0226632
A43: 7 | B43: strncpy: &"t"{\0,\x01,\x01,\x01,\x01} &""{\0,p,b,j,u,\0} 5 :=> &""{\0,\0,\0,\0,\0,\0} | C43: 1 | D43: 1 | E43: 1 | G43: of:=IF([.C43]=1;"";[.C43]) ->  | H43: of:=IF([.D43]=1;"";[.D43]) ->  | I43: of:=IF([.E43]=1;"";[.E43]) -> 
A44: 8 | B44: strncpy: &"r"{\0,\x01,\x01,\x01,\x01} &"i"{\0,p,j,u,\0} 5 :=> &"i"{\0,\0,\0,\0,\0} | C44: 1 | D44: 1 | E44: 1 | G44: of:=IF([.C44]=1;"";[.C44]) ->  | H44: of:=IF([.D44]=1;"";[.D44]) ->  | I44: of:=IF([.E44]=1;"";[.E44]) -> 
A45: 9 | B45: strncpy: &"h"{\0,\x01,\x01,\x01,\x01} &"ke"{\0,p,u,\0} 5 :=> &"ke"{\0,\0,\0,\0} | C45: 1 | D45: 0.217558 | E45: 0.217558 | G45: of:=IF([.C45]=1;"";[.C45]) ->  | H45: of:=IF([.D45]=1;"";[.D45]) -> 0.217558 | I45: of:=IF([.E45]=1;"";[.E45]) -> 0.217558
A46: 10 | B46: strncpy: &"e"{\0,\x01,\x01,\x01,\x01} &"zpg"{\0,p,\0} 5 :=> &"zpg"{\0,\0,\0} | C46: 1 | D46: 0.0672614 | E46: 0.0672614 | G46: of:=IF([.C46]=1;"";[.C46]) ->  | H46: of:=IF([.D46]=1;"";[.D46]) -> 0.0672614 | I46: of:=IF([.E46]=1;"";[.E46]) -> 0.0672614
A47: 11 | B47: strncpy: &"s"{\0,\x01,\x01,\x01,\x01} &"caod"{\0,\0} 5 :=> &"caod"{\0,\0} | C47: 1 | D47: 0.0440267 | E47: 0.0440267 | G47: of:=IF([.C47]=1;"";[.C47]) ->  | H47: of:=IF([.D47]=1;"";[.D47]) -> 0.0440267 | I47: of:=IF([.E47]=1;"";[.E47]) -> 0.0440267
A48: 12 | B48: strncpy: &"l"{\0,\x01,\x01,\x01,\x01} &"ysseo"{\0} 5 :=> &"ysseo"{\0} | C48: 1 | D48: 0.0301068 | E48: 0.0301068 | G48: of:=IF([.C48]=1;"";[.C48]) ->  | H48: of:=IF([.D48]=1;"";[.D48]) -> 0.0301068 | I48: of:=IF([.E48]=1;"";[.E48]) -> 0.0301068
A49: 13 | B49: strncpy: &"zr"{\0,\x01,\x01,\x01} &""{\0,p,i,x,c,\0} 5 :=> &""{\0,\0,\0,\0,\0,\0} | C49: 0.172927 | D49: 1 | E49: 1 | G49: of:=IF([.C49]=1;"";[.C49]) -> 0.172927 | H49: of:=IF([.D49]=1;"";[.D49]) ->  | I49: of:=IF([.E49]=1;"";[.E49]) -> 
A50: 14 | B50: strncpy: &"ol"{\0,\x01,\x01,\x01} &"m"{\0,p,k,d,\0} 5 :=> &"m"{\0,\0,\0,\0,\0} | C50: 0.218466 | D50: 1 | E50: 1 | G50: of:=IF([.C50]=1;"";[.C50]) -> 0.218466 | H50: of:=IF([.D50]=1;"";[.D50]) ->  | I50: of:=IF([.E50]=1;"";[.E50]) -> 
A51: 15 | B51: strncpy: &"ei"{\0,\x01,\x01,\x01} &"ed"{\0,p,c,\0} 5 :=> &"ed"{\0,\0,\0,\0} | C51: 0.214762 | D51: 0.223692 | E51: 0.223692 | G51: of:=IF([.C51]=1;"";[.C51]) -> 0.214762 | H51: of:=IF([.D51]=1;"";[.D51]) -> 0.223692 | I51: of:=IF([.E51]=1;"";[.E51]) -> 0.223692
A52: 16 | B52: strncpy: &"qq"{\0,\x01,\x01,\x01} &"btp"{\0,p,\0} 5 :=> &"btp"{\0,\0,\0} | C52: 0.11996 | D52: 0.0739622 | E52: 0.0739622 | G52: of:=IF([.C52]=1;"";[.C52]) -> 0.11996 | H52: of:=IF([.D52]=1;"";[.D52]) -> 0.0739622 | I52: of:=IF([.E52]=1;"";[.E52]) -> 0.0739622
A53: 17 | B53: strncpy: &"qu"{\0,\x01,\x01,\x01} &"xmuk"{\0,\0} 5 :=> &"xmuk"{\0,\0} | C53: 0.212836 | D53: 0.0369193 | E53: 0.0369193 | G53: of:=IF([.C53]=1;"";[.C53]) -> 0.212836 | H53: of:=IF([.D53]=1;"";[.D53]) -> 0.0369193 | I53: of:=IF([.E53]=1;"";[.E53]) -> 0.0369193
A54: 18 | B54: strncpy: &"ms"{\0,\x01,\x01,\x01} &"ldldl"{\0} 5 :=> &"ldldl"{\0} | C54: 0.211356 | D54: 0.0289259 | E54: 0.0289259 | G54: of:=IF([.C54]=1;"";[.C54]) -> 0.211356 | H54: of:=IF([.D54]=1;"";[.D54]) -> 0.0289259 | I54: of:=IF([.E54]=1;"";[.E54]) -> 0.0289259
A55: 19 | B55: strncpy: &"gli"{\0,\x01,\x01} &""{\0,p,l,l,m,\0} 5 :=> &""{\0,\0,\0,\0,\0,\0} | C55: 0.0853604 | D55: 1 | E55: 1 | G55: of:=IF([.C55]=1;"";[.C55]) -> 0.0853604 | H55: of:=IF([.D55]=1;"";[.D55]) ->  | I55: of:=IF([.E55]=1;"";[.E55]) -> 
A56: 20 | B56: strncpy: &"ykw"{\0,\x01,\x01} &"l"{\0,p,b,j,\0} 5 :=> &"l"{\0,\0,\0,\0,\0} | C56: 0.0683264 | D56: 1 | E56: 1 | G56: of:=IF([.C56]=1;"";[.C56]) -> 0.0683264 | H56: of:=IF([.D56]=1;"";[.D56]) ->  | I56: of:=IF([.E56]=1;"";[.E56]) -> 
A57: 21 | B57: strncpy: &"vln"{\0,\x01,\x01} &"wk"{\0,p,n,\0} 5 :=> &"wk"{\0,\0,\0,\0} | C57: 0.0676797 | D57: 0.191004 | E57: 0.191004 | G57: of:=IF([.C57]=1;"";[.C57]) -> 0.0676797 | H57: of:=IF([.D57]=1;"";[.D57]) -> 0.191004 | I57: of:=IF([.E57]=1;"";[.E57]) -> 0.191004
A58: 22 | B58: strncpy: &"uet"{\0,\x01,\x01} &"tcq"{\0,p,\0} 5 :=> &"tcq"{\0,\0,\0} | C58: 0.0866415 | D58: 0.0771667 | E58: 0.0771667 | G58: of:=IF([.C58]=1;"";[.C58]) -> 0.0866415 | H58: of:=IF([.D58]=1;"";[.D58]) -> 0.0771667 | I58: of:=IF([.E58]=1;"";[.E58]) -> 0.0771667
A59: 23 | B59: strncpy: &"evi"{\0,\x01,\x01} &"tslg"{\0,\0} 5 :=> &"tslg"{\0,\0} | C59: 0.0868219 | D59: 0.0434514 | E59: 0.0434514 | G59: of:=IF([.C59]=1;"";[.C59]) -> 0.0868219 | H59: of:=IF([.D59]=1;"";[.D59]) -> 0.0434514 | I59: of:=IF([.E59]=1;"";[.E59]) -> 0.0434514
A60: 24 | B60: strncpy: &"uvg"{\0,\x01,\x01} &"hupnd"{\0} 5 :=> &"hupnd"{\0} | C60: 0.0651197 | D60: 0.0270829 | E60: 0.0270829 | G60: of:=IF([.C60]=1;"";[.C60]) -> 0.0651197 | H60: of:=IF([.D60]=1;"";[.D60]) -> 0.0270829 | I60: of:=IF([.E60]=1;"";[.E60]) -> 0.0270829
A61: 25 | B61: strncpy: &"dmam"{\0,\x01} &""{\0,p,y,l,o,\0} 5 :=> &""{\0,\0,\0,\0,\0,\0} | C61: 0.0457911 | D61: 1 | E61: 1 | G61: of:=IF([.C61]=1;"";[.C61]) -> 0.0457911 | H61: of:=IF([.D61]=1;"";[.D61]) ->  | I61: of:=IF([.E61]=1;"";[.E61]) -> 
A62: 26 | B62: strncpy: &"ydoh"{\0,\x01} &"k"{\0,p,s,n,\0} 5 :=> &"k"{\0,\0,\0,\0,\0} | C62: 0.0421065 | D62: 1 | E62: 1 | G62: of:=IF([.C62]=1;"";[.C62]) -> 0.0421065 | H62: of:=IF([.D62]=1;"";[.D62]) ->  | I62: of:=IF([.E62]=1;"";[.E62]) -> 
A63: 27 | B63: strncpy: &"buxe"{\0,\x01} &"pi"{\0,p,g,\0} 5 :=> &"pi"{\0,\0,\0,\0} | C63: 0.0419853 | D63: 0.213322 | E63: 0.213322 | G63: of:=IF([.C63]=1;"";[.C63]) -> 0.0419853 | H63: of:=IF([.D63]=1;"";[.D63]) -> 0.213322 | I63: of:=IF([.E63]=1;"";[.E63]) -> 0.213322
A64: 28 | B64: strncpy: &"hdax"{\0,\x01} &"ton"{\0,p,\0} 5 :=> &"ton"{\0,\0,\0} | C64: 0.0424475 | D64: 0.0913532 | E64: 0.0913532 | G64: of:=IF([.C64]=1;"";[.C64]) -> 0.0424475 | H64: of:=IF([.D64]=1;"";[.D64]) -> 0.0913532 | I64: of:=IF([.E64]=1;"";[.E64]) -> 0.0913532
A65: 29 | B65: strncpy: &"lfta"{\0,\x01} &"bcob"{\0,\0} 5 :=> &"bcob"{\0,\0} | C65: 0.0456141 | D65: 0.0425654 | E65: 0.0425654 | G65: of:=IF([.C65]=1;"";[.C65]) -> 0.0456141 | H65: of:=IF([.D65]=1;"";[.D65]) -> 0.0425654 | I65: of:=IF([.E65]=1;"";[.E65]) -> 0.0425654
A66: 30 | B66: strncpy: &"wnxm"{\0,\x01} &"yteqw"{\0} 5 :=> &"yteqw"{\0} | C66: 0.0365042 | D66: 0.0192296 | E66: 0.0192296 | G66: of:=IF([.C66]=1;"";[.C66]) -> 0.0365042 | H66: of:=IF([.D66]=1;"";[.D66]) -> 0.0192296 | I66: of:=IF([.E66]=1;"";[.E66]) -> 0.0192296
A67: 31 | B67: strncpy: &"dwsce"{\0} &""{\0,p,k,e,k,\0} 5 :=> &""{\0,\0,\0,\0,\0,\0} | C67: 0.0285492 | D67: 1 | E67: 1 | G67: of:=IF([.C67]=1;"";[.C67]) -> 0.0285492 | H67: of:=IF([.D67]=1;"";[.D67]) ->  | I67: of:=IF([.E67]=1;"";[.E67]) -> 
A68: 32 | B68: strncpy: &"wafml"{\0} &"t"{\0,p,k,o,\0} 5 :=> &"t"{\0,\0,\0,\0,\0} | C68: 0.025639 | D68: 1 | E68: 1 | G68: of:=IF([.C68]=1;"";[.C68]) -> 0.025639 | H68: of:=IF([.D68]=1;"";[.D68]) ->  | I68: of:=IF([.E68]=1;"";[.E68]) -> 
A69: 33 | B69: strncpy: &"behwl"{\0} &"un"{\0,p,m,\0} 5 :=> &"un"{\0,\0,\0,\0} | C69: 0.0269821 | D69: 0.218466 | E69: 0.218466 | G69: of:=IF([.C69]=1;"";[.C69]) -> 0.0269821 | H69: of:=IF([.D69]=1;"";[.D69]) -> 0.218466 | I69: of:=IF([.E69]=1;"";[.E69]) -> 0.218466
A70: 34 | B70: strncpy: &"wdmyc"{\0} &"kkn"{\0,p,\0} 5 :=> &"kkn"{\0,\0,\0} | C70: 0.0258898 | D70: 0.0740719 | E70: 0.0740719 | G70: of:=IF([.C70]=1;"";[.C70]) -> 0.0258898 | H70: of:=IF([.D70]=1;"";[.D70]) -> 0.0740719 | I70: of:=IF([.E70]=1;"";[.E70]) -> 0.0740719
A71: 35 | B71: strncpy: &"dtomf"{\0} &"htsy"{\0,\0} 5 :=> &"htsy"{\0,\0} | C71: 0.0273934 | D71: 0.0455135 | E71: 0.0455135 | G71: of:=IF([.C71]=1;"";[.C71]) -> 0.0273934 | H71: of:=IF([.D71]=1;"";[.D71]) -> 0.0455135 | I71: of:=IF([.E71]=1;"";[.E71]) -> 0.0455135
A72: 36 | B72: strncpy: &"maxea"{\0} &"vuwpb"{\0} 5 :=> &"vuwpb"{\0} | C72: 0.0292505 | D72: 0.021401 | E72: 0.021401 | G72: of:=IF([.C72]=1;"";[.C72]) -> 0.0292505 | H72: of:=IF([.D72]=1;"";[.D72]) -> 0.021401 | I72: of:=IF([.E72]=1;"";[.E72]) -> 0.021401

Sheet: strcat
A1: # | B1: Test Case | C1: N1 | D1: N2 | E1: N3
A2: 1 | B2: strcat: &""{\0,\x01,\x01,\x01,\x01,\x01,\x01,\x01,\x01,\x01} &"b"{\0,p,i,\0} :=> &"b"{\0,p,a,v,a,t,m,k,\0} | C2: 1 | D2: 1 | E2: 1 | G2: of:=IF([.C2]=1;"";[.C2]) ->  | H2: of:=IF([.D2]=1;"";[.D2]) ->  | I2: of:=IF([.E2]=1;"";[.E2]) ->  | K2: of:=AVERAGE([.G2:.G41]) -> 0.0610631180645161 | L2: of:=AVERAGE([.H2:.H41]) -> 0.108808894545455 | M2: of:=AVERAGE([.I2:.I41]) -> 0.039089157027027 | O2: of:=AVERAGE([.K2:.M2]) -> 0.0696537232123326
A3: 2 | B3: strcat: &""{\0,\x01,\x01,\x01,\x01,\x01,\x01,\x01,\x01,\x01} &"fh"{\0,p,\0} :=> &"fh"{\0,p,u,g,i,p,n,\0} | C3: 1 | D3: 0.161794 | E3: 0.161794 | G3: of:=IF([.C3]=1;"";[.C3]) ->  | H3: of:=IF([.D3]=1;"";[.D3]) -> 0.161794 | I3: of:=IF([.E3]=1;"";[.E3]) -> 0.161794
A4: 3 | B4: strcat: &""{\0,\x01,\x01,\x01,\x01,\x01,\x01,\x01,\x01,\x01} &"jkn"{\0,\0} :=> &"jkn"{\0,p,k,k,f,m,\0} | C4: 1 | D4: 0.0665555 | E4: 0.0665555 | G4: of:=IF([.C4]=1;"";[.C4]) ->  | H4: of:=IF([.D4]=1;"";[.D4]) -> 0.0665555 | I4: of:=IF([.E4]=1;"";[.E4]) -> 0.0665555
A5: 4 | B5: strcat: &""{\0,\x01,\x01,\x01,\x01,\x01,\x01,\x01,\x01,\x01} &"pmki"{\0} :=> &"pmki"{\0,p,u,a,u,\0} | C5: 1 | D5: 0.0373987 | E5: 0.0373987 | H5: of:=IF([.D5]=1;"";[.D5]) -> 0.0373987 | I5: of:=IF([.E5]=1;"";[.E5]) -> 0.0373987
A6: 5 | B6: strcat: &"t"{\0,\x01,\x01,\x01,\x01,\x01,\x01,\x01,\x01} &""{\0,p,u,c,\0} :=> &"t"{\0,p,r,p,c,h,e,k,\0} | C6: 1 | D6: 1 | E6: 1 | G6: of:=IF([.C6]=1;"";[.C6]) ->  | H6: of:=IF([.D6]=1;"";[.D6]) ->  | I6: of:=IF([.E6]=1;"";[.E6]) -> 
A7: 6 | B7: strcat: &"b"{\0,\x01,\x01,\x01,\x01,\x01,\x01,\x01,\x01} &"g"{\0,p,y,\0} :=> &"bg"{\0,p,g,y,g,f,a,\0} | C7: 1 | D7: 1 | E7: 0.160898 | G7: of:=IF([.C7]=1;"";[.C7]) ->  | H7: of:=IF([.D7]=1;"";[.D7]) ->  | I7: of:=IF([.E7]=1;"";[.E7]) -> 0.160898
A8: 7 | B8: strcat: &"h"{\0,\x01,\x01,\x01,\x01,\x01,\x01,\x01,\x01} &"fo"{\0,p,\0} :=> &"hfo"{\0,p,j,r,g,v,\0} | C8: 1 | D8: 0.219808 | E8: 0.0780719 | G8: of:=IF([.C8]=1;"";[.C8]) ->  | H8: of:=IF([.D8]=1;"";[.D8]) -> 0.219808 | I8: of:=IF([.E8]=1;"";[.E8]) -> 0.0780719
A9: 8 | B9: strcat: &"n"{\0,\x01,\x01,\x01,\x01,\x01,\x01,\x01,\x01} &"yag"{\0,\0} :=> &"nyag"{\0,p,r,s,p,\0} | C9: 1 | D9: 0.0822568 | E9: 0.0445988 | G9: of:=IF([.C9]=1;"";[.C9]) ->  | H9: of:=IF([.D9]=1;"";[.D9]) -> 0.0822568 | I9: of:=IF([.E9]=1;"";[.E9]) -> 0.0445988
A10: 9 | B10: strcat: &"v"{\0,\x01,\x01,\x01,\x01,\x01,\x01,\x01,\x01} &"rgvo"{\0} :=> &"vrgvo"{\0,p,m,p,\0} | C10: 1 | D10: 0.0361831 | E10: 0.0221694 | G10: of:=IF([.C10]=1;"";[.C10]) ->  | H10: of:=IF([.D10]=1;"";[.D10]) -> 0.0361831 | I10: of:=IF([.E10]=1;"";[.E10]) -> 0.0221694
A11: 10 | B11: strcat: &"mm"{\0,\x01,\x01,\x01,\x01,\x01,\x01,\x01} &""{\0,p,t,s,\0} :=> &"mm"{\0,p,w,i,d,c,o,\0} | C11: 0.212346 | D11: 1 | E11: 0.212346 | G11: of:=IF([.C11]=1;"";[.C11]) -> 0.212346 | H11: of:=IF([.D11]=1;"";[.D11]) ->  | I11: of:=IF([.E11]=1;"";[.E11]) -> 0.212346
A12: 11 | B12: strcat: &"tm"{\0,\x01,\x01,\x01,\x01,\x01,\x01,\x01} &"e"{\0,p,y,\0} :=> &"tme"{\0,p,n,y,f,y,\0} | C12: 0.207409 | D12: 1 | E12: 0.0850852 | G12: of:=IF([.C12]=1;"";[.C12]) -> 0.207409 | H12: of:=IF([.D12]=1;"";[.D12]) ->  | I12: of:=IF([.E12]=1;"";[.E12]) -> 0.0850852
A13: 12 | B13: strcat: &"bw"{\0,\x01,\x01,\x01,\x01,\x01,\x01,\x01} &"de"{\0,p,\0} :=> &"bwde"{\0,p,y,j,l,\0} | C13: 0.187534 | D13: 0.22156 | E13: 0.0405129 | G13: of:=IF([.C13]=1;"";[.C13]) -> 0.187534 | H13: of:=IF([.D13]=1;"";[.D13]) -> 0.22156 | I13: of:=IF([.E13]=1;"";[.E13]) -> 0.0405129
A14: 13 | B14: strcat: &"vt"{\0,\x01,\x01,\x01,\x01,\x01,\x01,\x01} &"wkd"{\0,\0} :=> &"vtwkd"{\0,p,w,s,\0} | C14: 0.162567 | D14: 0.0698584 | E14: 0.0217425 | G14: of:=IF([.C14]=1;"";[.C14]) -> 0.162567 | H14: of:=IF([.D14]=1;"";[.D14]) -> 0.0698584 | I14: of:=IF([.E14]=1;"";[.E14]) -> 0.0217425
A15: 14 | B15: strcat: &"kl"{\0,\x01,\x01,\x01,\x01,\x01,\x01,\x01} &"hncr"{\0} :=> &"klhncr"{\0,p,m,\0} | C15: 0.204113 | D15: 0.0454823 | E15: 0.019484 | G15: of:=IF([.C15]=1;"";[.C15]) -> 0.204113 | H15: of:=IF([.D15]=1;"";[.D15]) -> 0.0454823 | I15: of:=IF([.E15]=1;"";[.E15]) -> 0.019484
A16: 15 | B16: strcat: &"iao"{\0,\x01,\x01,\x01,\x01,\x01,\x01} &""{\0,p,m,p,\0} :=> &"iao"{\0,p,i,e,a,p,\0} | C16: 0.0800421 | D16: 1 | E16: 0.0800421 | G16: of:=IF([.C16]=1;"";[.C16]) -> 0.0800421 | H16: of:=IF([.D16]=1;"";[.D16]) ->  | I16: of:=IF([.E16]=1;"";[.E16]) -> 0.0800421
A17: 16 | B17: strcat: &"wep"{\0,\x01,\x01,\x01,\x01,\x01,\x01} &"s"{\0,p,c,\0} :=> &"weps"{\0,p,u,l,s,\0} | C17: 0.0862301 | D17: 1 | E17: 0.0457377 | G17: of:=IF([.C17]=1;"";[.C17]) -> 0.0862301 | H17: of:=IF([.D17]=1;"";[.D17]) ->  | I17: of:=IF([.E17]=1;"";[.E17]) -> 0.0457377
A18: 17 | B18: strcat: &"cku"{\0,\x01,\x01,\x01,\x01,\x01,\x01} &"lm"{\0,p,\0} :=> &"ckulm"{\0,p,a,y,\0} | C18: 0.0786738 | D18: 0.206613 | E18: 0.0276338 | G18: of:=IF([.C18]=1;"";[.C18]) -> 0.0786738 | H18: of:=IF([.D18]=1;"";[.D18]) -> 0.206613 | I18: of:=IF([.E18]=1;"";[.E18]) -> 0.0276338
A19: 18 | B19: strcat: &"plo"{\0,\x01,\x01,\x01,\x01,\x01,\x01} &"thl"{\0,\0} :=> &"plothl"{\0,p,s,\0} | C19: 0.0871192 | D19: 0.0853508 | E19: 0.0218633 | G19: of:=IF([.C19]=1;"";[.C19]) -> 0.0871192 | H19: of:=IF([.D19]=1;"";[.D19]) -> 0.0853508 | I19: of:=IF([.E19]=1;"";[.E19]) -> 0.0218633
A20: 19 | B20: strcat: &"jdh"{\0,\x01,\x01,\x01,\x01,\x01,\x01} &"kmcv"{\0} :=> &"jdhkmcv"{\0,p,\0} | C20: 0.0624857 | D20: 0.0281204 | E20: 0.00930721 | G20: of:=IF([.C20]=1;"";[.C20]) -> 0.0624857 | H20: of:=IF([.D20]=1;"";[.D20]) -> 0.0281204 | I20: of:=IF([.E20]=1;"";[.E20]) -> 0.00930721
A21: 20 | B21: strcat: &"ywgs"{\0,\x01,\x01,\x01,\x01,\x01} &""{\0,p,u,e,\0} :=> &"ywgs"{\0,p,a,d,j,\0} | C21: 0.0356414 | D21: 1 | E21: 0.0356414 | G21: of:=IF([.C21]=1;"";[.C21]) -> 0.0356414 | H21: of:=IF([.D21]=1;"";[.D21]) ->  | I21: of:=IF([.E21]=1;"";[.E21]) -> 0.0356414
A22: 21 | B22: strcat: &"natr"{\0,\x01,\x01,\x01,\x01,\x01} &"e"{\0,p,l,\0} :=> &"natre"{\0,p,i,p,\0} | C22: 0.0486059 | D22: 1 | E22: 0.0319533 | G22: of:=IF([.C22]=1;"";[.C22]) -> 0.0486059 | H22: of:=IF([.D22]=1;"";[.D22]) ->  | I22: of:=IF([.E22]=1;"";[.E22]) -> 0.0319533
A23: 22 | B23: strcat: &"pemi"{\0,\x01,\x01,\x01,\x01,\x01} &"vs"{\0,p,\0} :=> &"pemivs"{\0,p,l,\0} | C23: 0.047726 | D23: 0.186527 | E23: 0.020526 | G23: of:=IF([.C23]=1;"";[.C23]) -> 0.047726 | H23: of:=IF([.D23]=1;"";[.D23]) -> 0.186527 | I23: of:=IF([.E23]=1;"";[.E23]) -> 0.020526
A24: 23 | B24: strcat: &"auak"{\0,\x01,\x01,\x01,\x01,\x01} &"aha"{\0,\0} :=> &"auakaha"{\0,p,\0} | C24: 0.0455058 | D24: 0.0840414 | E24: 0.015889 | G24: of:=IF([.C24]=1;"";[.C24]) -> 0.0455058 | H24: of:=IF([.D24]=1;"";[.D24]) -> 0.0840414 | I24: of:=IF([.E24]=1;"";[.E24]) -> 0.015889
A25: 24 | B25: strcat: &"nnhq"{\0,\x01,\x01,\x01,\x01,\x01} &"heka"{\0} :=> &"nnhqheka"{\0,\0} | C25: 0.0387341 | D25: 0.0452973 | E25: 0 | G25: of:=IF([.C25]=1;"";[.C25]) -> 0.0387341 | H25: of:=IF([.D25]=1;"";[.D25]) -> 0.0452973 | I25: of:=IF([.E25]=1;"";[.E25]) -> 0
A26: 25 | B26: strcat: &"hyomw"{\0,\x01,\x01,\x01,\x01} &""{\0,p,r,s,\0} :=> &"hyomw"{\0,p,a,t,\0} | C26: 0.0258962 | D26: 1 | E26: 0.0258962 | G26: of:=IF([.C26]=1;"";[.C26]) -> 0.0258962 | H26: of:=IF([.D26]=1;"";[.D26]) ->  | I26: of:=IF([.E26]=1;"";[.E26]) -> 0.0258962
A27: 26 | B27: strcat: &"knyte"{\0,\x01,\x01,\x01,\x01} &"a"{\0,p,u,\0} :=> &"knytea"{\0,p,r,\0} | C27: 0.0287158 | D27: 1 | E27: 0.0210669 | G27: of:=IF([.C27]=1;"";[.C27]) -> 0.0287158 | H27: of:=IF([.D27]=1;"";[.D27]) ->  | I27: of:=IF([.E27]=1;"";[.E27]) -> 0.0210669
A28: 27 | B28: strcat: &"uoile"{\0,\x01,\x01,\x01,\x01} &"ej"{\0,p,\0} :=> &"uoileej"{\0,p,\0} | C28: 0.0290257 | D28: 0.194359 | E28: 0.0156676 | G28: of:=IF([.C28]=1;"";[.C28]) -> 0.0290257 | H28: of:=IF([.D28]=1;"";[.D28]) -> 0.194359 | I28: of:=IF([.E28]=1;"";[.E28]) -> 0.0156676
A29: 28 | B29: strcat: &"rdwds"{\0,\x01,\x01,\x01,\x01} &"evi"{\0,\0} :=> &"rdwdsevi"{\0,\0} | C29: 0.0272038 | D29: 0.0868219 | E29: 0.0129446 | G29: of:=IF([.C29]=1;"";[.C29]) -> 0.0272038 | H29: of:=IF([.D29]=1;"";[.D29]) -> 0.0868219 | I29: of:=IF([.E29]=1;"";[.E29]) -> 0.0129446
A30: 29 | B30: strcat: &"viyaf"{\0,\x01,\x01,\x01,\x01} &"wymb"{\0} :=> &"viyafwymb"{\0} | C30: 0.0267461 | D30: 0.0422788 | E30: 0.0094177 | G30: of:=IF([.C30]=1;"";[.C30]) -> 0.0267461 | H30: of:=IF([.D30]=1;"";[.D30]) -> 0.0422788 | I30: of:=IF([.E30]=1;"";[.E30]) -> 0.0094177
A31: 30 | B31: strcat: &"vuefof"{\0,\x01,\x01,\x01} &""{\0,p,c,j,\0} :=> &"vuefof"{\0,p,o,\0} | C31: 0.0205916 | D31: 1 | E31: 0.0205916 | G31: of:=IF([.C31]=1;"";[.C31]) -> 0.0205916 | H31: of:=IF([.D31]=1;"";[.D31]) ->  | I31: of:=IF([.E31]=1;"";[.E31]) -> 0.0205916
A32: 31 | B32: strcat: &"xalvrt"{\0,\x01,\x01,\x01} &"g"{\0,p,g,\0} :=> &"xalvrtg"{\0,p,\0} | C32: 0.0194579 | D32: 1 | E32: 0.0145828 | G32: of:=IF([.C32]=1;"";[.C32]) -> 0.0194579 | H32: of:=IF([.D32]=1;"";[.D32]) ->  | I32: of:=IF([.E32]=1;"";[.E32]) -> 0.0145828
A33: 32 | B33: strcat: &"obyetv"{\0,\x01,\x01,\x01} &"aq"{\0,p,\0} :=> &"obyetvaq"{\0,\0} | C33: 0.0200391 | D33: 0.196689 | E33: 0.012298 | G33: of:=IF([.C33]=1;"";[.C33]) -> 0.0200391 | H33: of:=IF([.D33]=1;"";[.D33]) -> 0.196689 | I33: of:=IF([.E33]=1;"";[.E33]) -> 0.012298
A34: 33 | B34: strcat: &"kasyaq"{\0,\x01,\x01,\x01} &"vgu"{\0,\0} :=> &"kasyaqvgu"{\0} | C34: 0.0194046 | D34: 0.0701439 | E34: 0.00821519 | G34: of:=IF([.C34]=1;"";[.C34]) -> 0.0194046 | H34: of:=IF([.D34]=1;"";[.D34]) -> 0.0701439 | I34: of:=IF([.E34]=1;"";[.E34]) -> 0.00821519
A35: 34 | B35: strcat: &"luodqb"{\0,\x01,\x01,\x01} &&10 :=> &"luodqbsdud"{} | C35: 0.0154867 | D35: 0.00774038 | G35: of:=IF([.C35]=1;"";[.C35]) -> 0.0154867 | H35: of:=IF([.D35]=1;"";[.D35]) -> 0.00774038 | I35: of:=IF([.E35]=1;"";[.E35]) ->  
A36: 35 | B36: strcat: &"ejeyefa"{\0,\x01,\x01} &""{\0,p,t,p,\0} :=> &"ejeyefa"{\0,p,\0} | C36: 0.015485 | D36: 1 | E36: 0.015485 | G36: of:=IF([.C36]=1;"";[.C36]) -> 0.015485 | H36: of:=IF([.D36]=1;"";[.D36]) ->  | I36: of:=IF([.E36]=1;"";[.E36]) -> 0.015485
A37: 36 | B37: strcat: &"lglpsar"{\0,\x01,\x01} &"r"{\0,p,n,\0} :=> &"lglpsarr"{\0,\0} | C37: 0.0156131 | D37: 1 | E37: 0.0127572 | G37: of:=IF([.C37]=1;"";[.C37]) -> 0.0156131 | H37: of:=IF([.D37]=1;"";[.D37]) ->  | I37: of:=IF([.E37]=1;"";[.E37]) -> 0.0127572
A38: 37 | B38: strcat: &"uduppas"{\0,\x01,\x01} &"pr"{\0,p,\0} :=> &"uduppaspr"{\0} | C38: 0.0167452 | D38: 0.218916 | E38: 0.0115877 | G38: of:=IF([.C38]=1;"";[.C38]) -> 0.0167452 | H38: of:=IF([.D38]=1;"";[.D38]) -> 0.218916 | I38: of:=IF([.E38]=1;"";[.E38]) -> 0.0115877
A39: 38 | B39: strcat: &"limqitwt"{\0,\x01} &""{\0,p,u,i,\0} :=> &"limqitwt"{\0,\0} | C39: 0.0102376 | D39: 1 | E39: 0.0102376 | G39: of:=IF([.C39]=1;"";[.C39]) -> 0.0102376 | H39: of:=IF([.D39]=1;"";[.D39]) ->  | I39: of:=IF([.E39]=1;"";[.E39]) -> 0.0102376
A40: 39 | B40: strcat: &"gxulxiaj"{\0,\x01} &"u"{\0,p,h,\0} :=> &"gxulxiaju"{\0} | C40: 0.00941896 | D40: 1 | E40: 0.00814381 | G40: of:=IF([.C40]=1;"";[.C40]) -> 0.00941896 | H40: of:=IF([.D40]=1;"";[.D40]) ->  | I40: of:=IF([.E40]=1;"";[.E40]) -> 0.00814381
A41: 40 | B41: strcat: &"ujibayjnk"{\0} &""{\0,p,y,s,\0} :=> &"ujibayjnk"{\0} | C41: 0.0081562 | D41: 1 | E41: 0.0081562 | G41: of:=IF([.C41]=1;"";[.C41]) -> 0.0081562 | H41: of:=IF([.D41]=1;"";[.D41]) ->  | I41: of:=IF([.E41]=1;"";[.E41]) -> 0.0081562
A42: 1 | B42: strncat: &""{\0,\x01,\x01,\x01,\x01,\x01,\x01,\x01,\x01,\x01} &""{\0,p,r,m,\0} 4 :=> &""{\0,p,i,g,o,v,i,s,q,\0} | C42: 1 | D42: 1 | E42: 1 | G42: of:=IF([.C42]=1;"";[.C42]) ->  | H42: of:=IF([.D42]=1;"";[.D42]) ->  | I42: of:=IF([.E42]=1;"";[.E42]) ->  | K42: of:=AVERAGE([.G42:.G82]) -> 0.0643801387096774 | L42: of:=AVERAGE([.H42:.H82]) -> 0.108242010454545 | M42: of:=AVERAGE([.I42:.I82]) -> 0.0406303589189189 | O42: of:=AVERAGE([.K42:.M42]) -> 0.0710841693610473
A43: 2 | B43: strncat: &""{\0,\x01,\x01,\x01,\x01,\x01,\x01,\x01,\x01,\x01} &"u"{\0,p,o,\0} 4 :=> &"u"{\0,p,t,i,n,v,o,r,\0} | C43: 1 | D43: 1 | E43: 1 | G43: of:=IF([.C43]=1;"";[.C43]) ->  | H43: of:=IF([.D43]=1;"";[.D43]) ->  | I43: of:=IF([.E43]=1;"";[.E43]) -> 
A44: 3 | B44: strncat: &""{\0,\x01,\x01,\x01,\x01,\x01,\x01,\x01,\x01,\x01} &"ij"{\0,p,\0} 4 :=> &"ij"{\0,p,m,b,o,w,d,\0} | C44: 1 | D44: 0.191943 | E44: 0.191943 | G44: of:=IF([.C44]=1;"";[.C44]) ->  | H44: of:=IF([.D44]=1;"";[.D44]) -> 0.191943 | I44: of:=IF([.E44]=1;"";[.E44]) -> 0.191943
A45: 4 | B45: strncat: &""{\0,\x01,\x01,\x01,\x01,\x01,\x01,\x01,\x01,\x01} &"cts"{\0,\0} 4 :=> &"cts"{\0,p,r,i,f,u,\0} | C45: 1 | D45: 0.0878477 | E45: 0.0878477 | G45: of:=IF([.C45]=1;"";[.C45]) ->  | H45: of:=IF([.D45]=1;"";[.D45]) -> 0.0878477 | I45: of:=IF([.E45]=1;"";[.E45]) -> 0.0878477
A46: 5 | B46: strncat: &""{\0,\x01,\x01,\x01,\x01,\x01,\x01,\x01,\x01,\x01} &"zioa"{\0} 4 :=> &"zioa"{\0,p,k,r,s,\0} | C46: 1 | D46: 0.0446702 | E46: 0.0446702 | G46: of:=IF([.C46]=1;"";[.C46]) ->  | H46: of:=IF([.D46]=1;"";[.D46]) -> 0.0446702 | I46: of:=IF([.E46]=1;"";[.E46]) -> 0.0446702
A47: 6 | B47: strncat: &"c"{\0,\x01,\x01,\x01,\x01,\x01,\x01,\x01,\x01} &""{\0,p,a,d,\0} 4 :=> &"c"{\0,p,k,n,m,g,a,t,\0} | C47: 1 | D47: 1 | E47: 1 | G47: of:=IF([.C47]=1;"";[.C47]) ->  | H47: of:=IF([.D47]=1;"";[.D47]) ->  | I47: of:=IF([.E47]=1;"";[.E47]) -> 
A48: 7 | B48: strncat: &"a"{\0,\x01,\x01,\x01,\x01,\x01,\x01,\x01,\x01} &"g"{\0,p,s,\0} 4 :=> &"ag"{\0,p,m,r,d,v,r,\0} | C48: 1 | D48: 1 | E48: 0.216174 | G48: of:=IF([.C48]=1;"";[.C48]) ->  | H48: of:=IF([.D48]=1;"";[.D48]) ->  | I48: of:=IF([.E48]=1;"";[.E48]) -> 0.216174
A49: 8 | B49: strncat: &"v"{\0,\x01,\x01,\x01,\x01,\x01,\x01,\x01,\x01} &"xv"{\0,p,\0} 4 :=> &"vxv"{\0,p,o,r,a,v,\0} | C49: 1 | D49: 0.171731 | E49: 0 | G49: of:=IF([.C49]=1;"";[.C49]) ->  | H49: of:=IF([.D49]=1;"";[.D49]) -> 0.171731 | I49: of:=IF([.E49]=1;"";[.E49]) -> 0
A50: 9 | B50: strncat: &"e"{\0,\x01,\x01,\x01,\x01,\x01,\x01,\x01,\x01} &"yfi"{\0,\0} 4 :=> &"eyfi"{\0,p,g,l,l,\0} | C50: 1 | D50: 0.0768361 | E50: 0.0423234 | G50: of:=IF([.C50]=1;"";[.C50]) ->  | H50: of:=IF([.D50]=1;"";[.D50]) -> 0.0768361 | I50: of:=IF([.E50]=1;"";[.E50]) -> 0.0423234
A51: 10 | B51: strncat: &"z"{\0,\x01,\x01,\x01,\x01,\x01,\x01,\x01,\x01} &"eqtm"{\0} 4 :=> &"zeqtm"{\0,p,i,s,\0} | C51: 1 | D51: 0.0326774 | E51: 0.0217668 | G51: of:=IF([.C51]=1;"";[.C51]) ->  | H51: of:=IF([.D51]=1;"";[.D51]) -> 0.0326774 | I51: of:=IF([.E51]=1;"";[.E51]) -> 0.0217668
A52: 11 | B52: strncat: &"ye"{\0,\x01,\x01,\x01,\x01,\x01,\x01,\x01} &""{\0,p,h,n,\0} 4 :=> &"ye"{\0,p,s,d,m,r,l,\0} | C52: 0.215236 | D52: 1 | E52: 0.215236 | G52: of:=IF([.C52]=1;"";[.C52]) -> 0.215236 | H52: of:=IF([.D52]=1;"";[.D52]) ->  | I52: of:=IF([.E52]=1;"";[.E52]) -> 0.215236
A53: 12 | B53: strncat: &"tn"{\0,\x01,\x01,\x01,\x01,\x01,\x01,\x01} &"m"{\0,p,a,\0} 4 :=> &"tnm"{\0,p,s,s,q,u,\0} | C53: 0.202602 | D53: 1 | E53: 0.0791771 | G53: of:=IF([.C53]=1;"";[.C53]) -> 0.202602 | H53: of:=IF([.D53]=1;"";[.D53]) ->  | I53: of:=IF([.E53]=1;"";[.E53]) -> 0.0791771
A54: 13 | B54: strncat: &"ag"{\0,\x01,\x01,\x01,\x01,\x01,\x01,\x01} &"nh"{\0,p,\0} 4 :=> &"agnh"{\0,p,b,b,e,\0} | C54: 0.216174 | D54: 0.203278 | E54: 0.0440446 | G54: of:=IF([.C54]=1;"";[.C54]) -> 0.216174 | H54: of:=IF([.D54]=1;"";[.D54]) -> 0.203278 | I54: of:=IF([.E54]=1;"";[.E54]) -> 0.0440446
A55: 14 | B55: strncat: &"yh"{\0,\x01,\x01,\x01,\x01,\x01,\x01,\x01} &"hof"{\0,\0} 4 :=> &"yhhof"{\0,p,g,q,\0} | C55: 0.185724 | D55: 0.0894076 | E55: 0.0259605 | G55: of:=IF([.C55]=1;"";[.C55]) -> 0.185724 | H55: of:=IF([.D55]=1;"";[.D55]) -> 0.0894076 | I55: of:=IF([.E55]=1;"";[.E55]) -> 0.0259605
A56: 15 | B56: strncat: &"ar"{\0,\x01,\x01,\x01,\x01,\x01,\x01,\x01} &"jult"{\0} 4 :=> &"arjult"{\0,p,u,\0} | C56: 0.223692 | D56: 0.0453864 | E56: 0.019733 | G56: of:=IF([.C56]=1;"";[.C56]) -> 0.223692 | H56: of:=IF([.D56]=1;"";[.D56]) -> 0.0453864 | I56: of:=IF([.E56]=1;"";[.E56]) -> 0.019733
A57: 16 | B57: strncat: &"ctb"{\0,\x01,\x01,\x01,\x01,\x01,\x01} &""{\0,p,v,i,\0} 4 :=> &"ctb"{\0,p,s,j,u,a,\0} | C57: 0.0815876 | D57: 1 | E57: 0.0815876 | G57: of:=IF([.C57]=1;"";[.C57]) -> 0.0815876 | H57: of:=IF([.D57]=1;"";[.D57]) ->  | I57: of:=IF([.E57]=1;"";[.E57]) -> 0.0815876
A58: 17 | B58: strncat: &"sth"{\0,\x01,\x01,\x01,\x01,\x01,\x01} &"y"{\0,p,m,\0} 4 :=> &"sthy"{\0,p,t,m,a,\0} | C58: 0.0921454 | D58: 1 | E58: 0.0478019 | G58: of:=IF([.C58]=1;"";[.C58]) -> 0.0921454 | H58: of:=IF([.D58]=1;"";[.D58]) ->  | I58: of:=IF([.E58]=1;"";[.E58]) -> 0.0478019
A59: 18 | B59: strncat: &"tni"{\0,\x01,\x01,\x01,\x01,\x01,\x01} &"oy"{\0,p,\0} 4 :=> &"tnioy"{\0,p,c,q,\0} | C59: 0.0825701 | D59: 0.207514 | E59: 0.0289435 | G59: of:=IF([.C59]=1;"";[.C59]) -> 0.0825701 | H59: of:=IF([.D59]=1;"";[.D59]) -> 0.207514 | I59: of:=IF([.E59]=1;"";[.E59]) -> 0.0289435
A60: 19 | B60: strncat: &"ibi"{\0,\x01,\x01,\x01,\x01,\x01,\x01} &"fio"{\0,\0} 4 :=> &"ibifio"{\0,p,c,\0} | C60: 0.0833285 | D60: 0.0882615 | E60: 0.0214592 | G60: of:=IF([.C60]=1;"";[.C60]) -> 0.0833285 | H60: of:=IF([.D60]=1;"";[.D60]) -> 0.0882615 | I60: of:=IF([.E60]=1;"";[.E60]) -> 0.0214592
A61: 20 | B61: strncat: &"rfr"{\0,\x01,\x01,\x01,\x01,\x01,\x01} &"utbm"{\0} 4 :=> &"rfrutbm"{\0,p,\0} | C61: 0.0829059 | D61: 0.0411188 | E61: 0.0150326 | G61: of:=IF([.C61]=1;"";[.C61]) -> 0.0829059 | H61: of:=IF([.D61]=1;"";[.D61]) -> 0.0411188 | I61: of:=IF([.E61]=1;"";[.E61]) -> 0.0150326
A62: 21 | B62: strncat: &"knnk"{\0,\x01,\x01,\x01,\x01,\x01} &""{\0,p,k,l,\0} 4 :=> &"knnk"{\0,p,g,h,m,\0} | C62: 0.0442266 | D62: 1 | E62: 0.0442266 | G62: of:=IF([.C62]=1;"";[.C62]) -> 0.0442266 | H62: of:=IF([.D62]=1;"";[.D62]) ->  | I62: of:=IF([.E62]=1;"";[.E62]) -> 0.0442266
A63: 22 | B63: strncat: &"gryr"{\0,\x01,\x01,\x01,\x01,\x01} &"p"{\0,p,n,\0} 4 :=> &"gryrp"{\0,p,k,d,\0} | C63: 0.0445757 | D63: 1 | E63: 0.0284041 | G63: of:=IF([.C63]=1;"";[.C63]) -> 0.0445757 | H63: of:=IF([.D63]=1;"";[.D63]) ->  | I63: of:=IF([.E63]=1;"";[.E63]) -> 0.0284041
A64: 23 | B64: strncat: &"zolc"{\0,\x01,\x01,\x01,\x01,\x01} &"fs"{\0,p,\0} 4 :=> &"zolcfs"{\0,p,o,\0} | C64: 0.0420642 | D64: 0.197975 | E64: 0.0162265 | G64: of:=IF([.C64]=1;"";[.C64]) -> 0.0420642 | H64: of:=IF([.D64]=1;"";[.D64]) -> 0.197975 | I64: of:=IF([.E64]=1;"";[.E64]) -> 0.0162265
A65: 24 | B65: strncat: &"iadc"{\0,\x01,\x01,\x01,\x01,\x01} &"xsk"{\0,\0} 4 :=> &"iadcxsk"{\0,p,\0} | C65: 0.0441701 | D65: 0.0696985 | E65: 0.0105263 | G65: of:=IF([.C65]=1;"";[.C65]) -> 0.0441701 | H65: of:=IF([.D65]=1;"";[.D65]) -> 0.0696985 | I65: of:=IF([.E65]=1;"";[.E65]) -> 0.0105263
A66: 25 | B66: strncat: &"kevn"{\0,\x01,\x01,\x01,\x01,\x01} &"falh"{\0} 4 :=> &"kevnfalh"{\0,\0} | C66: 0.0412383 | D66: 0.0437015 | E66: 0.012073 | G66: of:=IF([.C66]=1;"";[.C66]) -> 0.0412383 | H66: of:=IF([.D66]=1;"";[.D66]) -> 0.0437015 | I66: of:=IF([.E66]=1;"";[.E66]) -> 0.012073
A67: 26 | B67: strncat: &"wbawa"{\0,\x01,\x01,\x01,\x01} &""{\0,p,p,r,\0} 4 :=> &"wbawa"{\0,p,r,r,\0} | C67: 0.0277069 | D67: 1 | E67: 0.0277069 | G67: of:=IF([.C67]=1;"";[.C67]) -> 0.0277069 | H67: of:=IF([.D67]=1;"";[.D67]) ->  | I67: of:=IF([.E67]=1;"";[.E67]) -> 0.0277069
A68: 27 | B68: strncat: &"uovdy"{\0,\x01,\x01,\x01,\x01} &"o"{\0,p,l,\0} 4 :=> &"uovdyo"{\0,p,p,\0} | C68: 0.0244105 | D68: 1 | E68: 0.01785 | G68: of:=IF([.C68]=1;"";[.C68]) -> 0.0244105 | H68: of:=IF([.D68]=1;"";[.D68]) ->  | I68: of:=IF([.E68]=1;"";[.E68]) -> 0.01785
A69: 28 | B69: strncat: &"moply"{\0,\x01,\x01,\x01,\x01} &"pr"{\0,p,\0} 4 :=> &"moplypr"{\0,p,\0} | C69: 0.03061 | D69: 0.218916 | E69: 0.0165659 | G69: of:=IF([.C69]=1;"";[.C69]) -> 0.03061 | H69: of:=IF([.D69]=1;"";[.D69]) -> 0.218916 | I69: of:=IF([.E69]=1;"";[.E69]) -> 0.0165659
A70: 29 | B70: strncat: &"benib"{\0,\x01,\x01,\x01,\x01} &"grm"{\0,\0} 4 :=> &"benibgrm"{\0,\0} | C70: 0.030795 | D70: 0.0853361 | E70: 0.0123062 | G70: of:=IF([.C70]=1;"";[.C70]) -> 0.030795 | H70: of:=IF([.D70]=1;"";[.D70]) -> 0.0853361 | I70: of:=IF([.E70]=1;"";[.E70]) -> 0.0123062
A71: 30 | B71: strncat: &"qtpee"{\0,\x01,\x01,\x01,\x01} &"ytga"{\0} 4 :=> &"qtpeeytga"{\0} | C71: 0.0222435 | D71: 0.0416175 | E71: 0.00896439 | G71: of:=IF([.C71]=1;"";[.C71]) -> 0.0222435 | H71: of:=IF([.D71]=1;"";[.D71]) -> 0.0416175 | I71: of:=IF([.E71]=1;"";[.E71]) -> 0.00896439
A72: 31 | B72: strncat: &"dootnn"{\0,\x01,\x01,\x01} &""{\0,p,u,k,\0} 4 :=> &"dootnn"{\0,p,t,\0} | C72: 0.0209801 | D72: 1 | E72: 0.0209801 | G72: of:=IF([.C72]=1;"";[.C72]) -> 0.0209801 | H72: of:=IF([.D72]=1;"";[.D72]) ->  | I72: of:=IF([.E72]=1;"";[.E72]) -> 0.0209801
A73: 32 | B73: strncat: &"radios"{\0,\x01,\x01,\x01} &"q"{\0,p,t,\0} 4 :=> &"radiosq"{\0,p,\0} | C73: 0.0225779 | D73: 1 | E73: 0.0167695 | G73: of:=IF([.C73]=1;"";[.C73]) -> 0.0225779 | H73: of:=IF([.D73]=1;"";[.D73]) ->  | I73: of:=IF([.E73]=1;"";[.E73]) -> 0.0167695
A74: 33 | B74: strncat: &"slbkab"{\0,\x01,\x01,\x01} &"hu"{\0,p,\0} 4 :=> &"slbkabhu"{\0,\0} | C74: 0.0172867 | D74: 0.209333 | E74: 0.0104389 | G74: of:=IF([.C74]=1;"";[.C74]) -> 0.0172867 | H74: of:=IF([.D74]=1;"";[.D74]) -> 0.209333 | I74: of:=IF([.E74]=1;"";[.E74]) -> 0.0104389
A75: 34 | B75: strncat: &"nhwclo"{\0,\x01,\x01,\x01} &"kbe"{\0,\0} 4 :=> &"nhwclokbe"{\0} | C75: 0.0185533 | D75: 0.0784931 | E75: 0.0098372 | G75: of:=IF([.C75]=1;"";[.C75]) -> 0.0185533 | H75: of:=IF([.D75]=1;"";[.D75]) -> 0.0784931 | I75: of:=IF([.E75]=1;"";[.E75]) -> 0.0098372
A76: 35 | B76: strncat: &"viwenn"{\0,\x01,\x01,\x01} &&10 4 :=> &"viwennmaty"{} | C76: 0.0206305 | D76: 0.00978683 | G76: of:=IF([.C76]=1;"";[.C76]) -> 0.0206305 | H76: of:=IF([.D76]=1;"";[.D76]) -> 0.00978683 | I76: of:=IF([.E76]=1;"";[.E76]) ->  
A77: 36 | B77: strncat: &"ktuxomn"{\0,\x01,\x01} &""{\0,p,i,l,\0} 4 :=> &"ktuxomn"{\0,p,\0} | C77: 0.0139458 | D77: 1 | E77: 0.0139458 | G77: of:=IF([.C77]=1;"";[.C77]) -> 0.0139458 | H77: of:=IF([.D77]=1;"";[.D77]) ->  | I77: of:=IF([.E77]=1;"";[.E77]) -> 0.0139458
A78: 37 | B78: strncat: &"twhuxei"{\0,\x01,\x01} &"f"{\0,p,m,\0} 4 :=> &"twhuxeif"{\0,\0} | C78: 0.0153376 | D78: 1 | E78: 0.0125658 | G78: of:=IF([.C78]=1;"";[.C78]) -> 0.0153376 | H78: of:=IF([.D78]=1;"";[.D78]) ->  | I78: of:=IF([.E78]=1;"";[.E78]) -> 0.0125658
A79: 38 | B79: strncat: &"dhugrid"{\0,\x01,\x01} &"jl"{\0,p,\0} 4 :=> &"dhugridjl"{\0} | C79: 0.0159739 | D79: 0.145795 | E79: 0.00926982 | G79: of:=IF([.C79]=1;"";[.C79]) -> 0.0159739 | H79: of:=IF([.D79]=1;"";[.D79]) -> 0.145795 | I79: of:=IF([.E79]=1;"";[.E79]) -> 0.00926982
A80: 39 | B80: strncat: &"wfucnxec"{\0,\x01} &""{\0,p,r,u,\0} 4 :=> &"wfucnxec"{\0,\0} | C80: 0.0110551 | D80: 1 | E80: 0.0110551 | G80: of:=IF([.C80]=1;"";[.C80]) -> 0.0110551 | H80: of:=IF([.D80]=1;"";[.D80]) ->  | I80: of:=IF([.E80]=1;"";[.E80]) -> 0.0110551
A81: 40 | B81: strncat: &"zwsybblp"{\0,\x01} &"r"{\0,p,u,\0} 4 :=> &"zwsybblpr"{\0} | C81: 0.0113153 | D81: 1 | E81: 0.00978827 | G81: of:=IF([.C81]=1;"";[.C81]) -> 0.0113153 | H81: of:=IF([.D81]=1;"";[.D81]) ->  | I81: of:=IF([.E81]=1;"";[.E81]) -> 0.00978827
A82: 41 | B82: strncat: &"spuurdgyc"{\0} &""{\0,p,t,p,\0} 4 :=> &"spuurdgyc"{\0} | C82: 0.0101218 | D82: 1 | E82: 0.0101218 | G82: of:=IF([.C82]=1;"";[.C82]) -> 0.0101218 | H82: of:=IF([.D82]=1;"";[.D82]) ->  | I82: of:=IF([.E82]=1;"";[.E82]) -> 0.0101218

Sheet: strstr
A1: # | B1: Test Case | C1: N | G1: N1 | H1: N2 | I1: N3
A2: 1 | B2: strstr: &"j"{\0,h,a,w,\0} &"j"{\0,\0} :=> &"j"{\0,h,a,w,\0} | C2: 1 | D2: 1 | E2: 1 | G2: of:=IF([.C2]=1;"";[.C2]) ->  | H2: of:=IF([.D2]=1;"";[.D2]) ->  | I2: of:=IF([.E2]=1;"";[.E2]) ->  | K2: of:=AVERAGE([.G2:.G19]) -> 0.0789554529411765 | L2: of:=AVERAGE([.H2:.H19]) -> 0.206474444444444 | M2: of:=AVERAGE([.I2:.I19]) -> 0.10478025625 | O2: of:=AVERAGE([.K2:.M2]) -> 0.130070051211874
A3: 2 | B3: strstr: &"qu"{\0,h,e,\0} &"q"{\0,\0} :=> &"qu"{\0,h,e,\0} | C3: 0.212836 | D3: 1 | E3: 0.212836 | G3: of:=IF([.C3]=1;"";[.C3]) -> 0.212836 | H3: of:=IF([.D3]=1;"";[.D3]) ->  | I3: of:=IF([.E3]=1;"";[.E3]) -> 0.212836
A4: 3 | B4: strstr: &"vo"{\0,b,l,\0} &"o"{\0,\0} :=> &"o"{\0,b,l,\0,54} | C4: 0.210352 | D4: 1 | E4: 1 | G4: of:=IF([.C4]=1;"";[.C4]) -> 0.210352 | H4: of:=IF([.D4]=1;"";[.D4]) ->  | I4: of:=IF([.E4]=1;"";[.E4]) -> 
A5: 4 | B5: strstr: &"esw"{\0,h,\0} &"e"{\0,\0} :=> &"esw"{\0,h,\0} | C5: 0.084646 | D5: 1 | E5: 0.084646 | G5: of:=IF([.C5]=1;"";[.C5]) -> 0.084646 | H5: of:=IF([.D5]=1;"";[.D5]) ->  | I5: of:=IF([.E5]=1;"";[.E5]) -> 0.084646
A6: 5 | B6: strstr: &"zit"{\0,b,\0} &"i"{\0,\0} :=> &"it"{\0,b,\0,54} | C6: 0.0838544 | D6: 1 | E6: 0.222847 | G6: of:=IF([.C6]=1;"";[.C6]) -> 0.0838544 | H6: of:=IF([.D6]=1;"";[.D6]) ->  | I6: of:=IF([.E6]=1;"";[.E6]) -> 0.222847
A7: 6 | B7: strstr: &"fovu"{\0,\0} &"f"{\0,\0} :=> &"fovu"{\0,\0} | C7: 0.0431242 | D7: 1 | E7: 0.0431242 | G7: of:=IF([.C7]=1;"";[.C7]) -> 0.0431242 | H7: of:=IF([.D7]=1;"";[.D7]) ->  | I7: of:=IF([.E7]=1;"";[.E7]) -> 0.0431242
A8: 7 | B8: strstr: &"emya"{\0,\0} &"m"{\0,\0} :=> &"mya"{\0,\0,54} | C8: 0.0439598 | D8: 1 | E8: 0.0795938 | G8: of:=IF([.C8]=1;"";[.C8]) -> 0.0439598 | H8: of:=IF([.D8]=1;"";[.D8]) ->  | I8: of:=IF([.E8]=1;"";[.E8]) -> 0.0795938
A9: 8 | B9: strstr: &"riidr"{\0} &"r"{\0,\0} :=> &"riidr"{\0} | C9: 0.0284341 | D9: 1 | E9: 0.0284341 | G9: of:=IF([.C9]=1;"";[.C9]) -> 0.0284341 | H9: of:=IF([.D9]=1;"";[.D9]) ->  | I9: of:=IF([.E9]=1;"";[.E9]) -> 0.0284341
A10: 9 | B10: strstr: &"xeckp"{\0} &"e"{\0,\0} :=> &"eckp"{\0,54} | C10: 0.0271055 | D10: 1 | E10: 0.0425587 | G10: of:=IF([.C10]=1;"";[.C10]) -> 0.0271055 | H10: of:=IF([.D10]=1;"";[.D10]) ->  | I10: of:=IF([.E10]=1;"";[.E10]) -> 0.0425587
A11: 10 | B11: strstr: &"kb"{\0,d,f,\0} &"kb"{\0} :=> &"kb"{\0,d,f,\0} | C11: 0.189015 | D11: 0.189015 | E11: 0.189015 | G11: of:=IF([.C11]=1;"";[.C11]) -> 0.189015 | H11: of:=IF([.D11]=1;"";[.D11]) -> 0.189015 | I11: of:=IF([.E11]=1;"";[.E11]) -> 0.189015
A12: 11 | B12: strstr: &"xtx"{\0,d,\0} &"xt"{\0} :=> &"xtx"{\0,d,\0} | C12: 0.0628145 | D12: 0.206985 | E12: 0.0628145 | G12: of:=IF([.C12]=1;"";[.C12]) -> 0.0628145 | H12: of:=IF([.D12]=1;"";[.D12]) -> 0.206985 | I12: of:=IF([.E12]=1;"";[.E12]) -> 0.0628145
A13: 12 | B13: strstr: &"lli"{\0,a,\0} &"li"{\0} :=> &"li"{\0,a,\0,54} | C13: 0.0895579 | D13: 0.22156 | E13: 0.22156 | G13: of:=IF([.C13]=1;"";[.C13]) -> 0.0895579 | H13: of:=IF([.D13]=1;"";[.D13]) -> 0.22156 | I13: of:=IF([.E13]=1;"";[.E13]) -> 0.22156
A14: 13 | B14: strstr: &"ime"{\0,p,\0} &"me"{\0} :=> &"me"{\0,p,\0,54} | C14: 0.088251 | D14: 0.22156 | E14: 0.22156 | G14: of:=IF([.C14]=1;"";[.C14]) -> 0.088251 | H14: of:=IF([.D14]=1;"";[.D14]) -> 0.22156 | I14: of:=IF([.E14]=1;"";[.E14]) -> 0.22156
A15: 14 | B15: strstr: &"vvof"{\0,\0} &"vv"{\0} :=> &"vvof"{\0,\0} | C15: 0.0402874 | D15: 0.172835 | E15: 0.0402874 | G15: of:=IF([.C15]=1;"";[.C15]) -> 0.0402874 | H15: of:=IF([.D15]=1;"";[.D15]) -> 0.172835 | I15: of:=IF([.E15]=1;"";[.E15]) -> 0.0402874
A16: 15 | B16: strstr: &"ccyl"{\0,\0} &"cy"{\0} :=> &"cyl"{\0,\0,54} | C16: 0.0429182 | D16: 0.207934 | E16: 0.0795816 | G16: of:=IF([.C16]=1;"";[.C16]) -> 0.0429182 | H16: of:=IF([.D16]=1;"";[.D16]) -> 0.207934 | I16: of:=IF([.E16]=1;"";[.E16]) -> 0.0795816
A17: 16 | B17: strstr: &"frck"{\0,\0} &"rc"{\0} :=> &"rck"{\0,\0,54} | C17: 0.0462573 | D17: 0.214286 | E17: 0.0853348 | G17: of:=IF([.C17]=1;"";[.C17]) -> 0.0462573 | H17: of:=IF([.D17]=1;"";[.D17]) -> 0.214286 | I17: of:=IF([.E17]=1;"";[.E17]) -> 0.0853348
A18: 17 | B18: strstr: &"lsqbo"{\0} &"ls"{\0} :=> &"lsqbo"{\0} | C18: 0.0221621 | D18: 0.214762 | E18: 0.0221621 | G18: of:=IF([.C18]=1;"";[.C18]) -> 0.0221621 | H18: of:=IF([.D18]=1;"";[.D18]) -> 0.214762 | I18: of:=IF([.E18]=1;"";[.E18]) -> 0.0221621
A19: 18 | B19: strstr: &"eebdm"{\0} &"eb"{\0} :=> &"ebdm"{\0,54} | C19: 0.0266673 | D19: 0.209333 | E19: 0.0401289 | G19: of:=IF([.C19]=1;"";[.C19]) -> 0.0266673 | H19: of:=IF([.D19]=1;"";[.D19]) -> 0.209333 | I19: of:=IF([.E19]=1;"";[.E19]) -> 0.0401289
A20: 19 | B20: strstr: &"wtthw"{\0} &"tt"{\0} :=> &"tthw"{\0,54} | C20: 0.0278251 | D20: 0.215236 | E20: 0.045365 | G20: of:=IF([.C20]=1;"";[.C20]) -> 0.0278251 | H20: of:=IF([.D20]=1;"";[.D20]) -> 0.215236 | I20: of:=IF([.E20]=1;"";[.E20]) -> 0.045365 | K20: of:=AVERAGE([.G20:.G24]) -> 0.02734374 | L20: of:=AVERAGE([.H20:.H24]) -> 0.1964405 | M20: of:=AVERAGE([.I20:.I24]) -> 0.03418252 | O20: of:=AVERAGE([.K20:.M20]) -> 0.08598892
A21: 1 | B21: strnstr: &"dddbg"{\0} &""{\0,p,\0} 2 :=> &"dddbg"{\0} | C21: 0.0229404 | D21: 1 | E21: 0.0229404 | G21: of:=IF([.C21]=1;"";[.C21]) -> 0.0229404 | H21: of:=IF([.D21]=1;"";[.D21]) ->  | I21: of:=IF([.E21]=1;"";[.E21]) -> 0.0229404
A22: 2 | B22: strnstr: &"fanox"{\0} &"f"{\0,\0} 2 :=> &"fanox"{\0} | C22: 0.0296338 | D22: 1 | E22: 0.0296338 | G22: of:=IF([.C22]=1;"";[.C22]) -> 0.0296338 | H22: of:=IF([.D22]=1;"";[.D22]) ->  | I22: of:=IF([.E22]=1;"";[.E22]) -> 0.0296338
A23: 3 | B23: strnstr: &"isitt"{\0} &"s"{\0,\0} 2 :=> &"sitt"{\0,54} | C23: 0.0314917 | D23: 1 | E23: 0.0481457 | G23: of:=IF([.C23]=1;"";[.C23]) -> 0.0314917 | H23: of:=IF([.D23]=1;"";[.D23]) ->  | I23: of:=IF([.E23]=1;"";[.E23]) -> 0.0481457
A24: 4 | B24: strnstr: &"zkyms"{\0} &"zk"{\0} 2 :=> &"zkyms"{\0} | C24: 0.0248277 | D24: 0.177645 | E24: 0.0248277 | G24: of:=IF([.C24]=1;"";[.C24]) -> 0.0248277 | H24: of:=IF([.D24]=1;"";[.D24]) -> 0.177645 | I24: of:=IF([.E24]=1;"";[.E24]) -> 0.0248277
A25: 1 | B25: strpbrk: &"yueai"{\0} &"aeiou"{\0} :=> &"ueai"{\0,54} | C25: 0.0283365 | D25: 0.0299288 | E25: 0.0477549 | G25: of:=IF([.C25]=1;"";[.C25]) -> 0.0283365 | H25: of:=IF([.D25]=1;"";[.D25]) -> 0.0299288 | I25: of:=IF([.E25]=1;"";[.E25]) -> 0.0477549 | K25: of:=AVERAGE([.G25:.G34]) -> 0.02792486 | L25: of:=AVERAGE([.H25:.H34]) -> 0.0299288 | M25: of:=AVERAGE([.I25:.I34]) -> 0.03641176 | O25: of:=AVERAGE([.K25:.M25]) -> 0.0314218066666667
A26: 2 | B26: strpbrk: &"dotam"{\0} &"aeiou"{\0} :=> &"otam"{\0,54} | C26: 0.0307482 | D26: 0.0299288 | E26: 0.0479196 | G26: of:=IF([.C26]=1;"";[.C26]) -> 0.0307482 | H26: of:=IF([.D26]=1;"";[.D26]) -> 0.0299288 | I26: of:=IF([.E26]=1;"";[.E26]) -> 0.0479196
A27: 3 | B27: strpbrk: &"gibnf"{\0} &"aeiou"{\0} :=> &"ibnf"{\0,54} | C27: 0.0260806 | D27: 0.0299288 | E27: 0.0397814 | G27: of:=IF([.C27]=1;"";[.C27]) -> 0.0260806 | H27: of:=IF([.D27]=1;"";[.D27]) -> 0.0299288 | I27: of:=IF([.E27]=1;"";[.E27]) -> 0.0397814
A28: 4 | B28: strpbrk: &"feskr"{\0} &"aeiou"{\0} :=> &"eskr"{\0,54} | C28: 0.0286575 | D28: 0.0299288 | E28: 0.0440761 | G28: of:=IF([.C28]=1;"";[.C28]) -> 0.0286575 | H28: of:=IF([.D28]=1;"";[.D28]) -> 0.0299288 | I28: of:=IF([.E28]=1;"";[.E28]) -> 0.0440761
A29: 5 | B29: strpbrk: &"qahwe"{\0} &"aeiou"{\0} :=> &"ahwe"{\0,54} | C29: 0.0231509 | D29: 0.0299288 | E29: 0.0423107 | G29: of:=IF([.C29]=1;"";[.C29]) -> 0.0231509 | H29: of:=IF([.D29]=1;"";[.D29]) -> 0.0299288 | I29: of:=IF([.E29]=1;"";[.E29]) -> 0.0423107
A30: 6 | B30: strpbrk: &"utiio"{\0} &"aeiou"{\0} :=> &"utiio"{\0} | C30: 0.0293 | D30: 0.0299288 | E30: 0.0293 | G30: of:=IF([.C30]=1;"";[.C30]) -> 0.0293 | H30: of:=IF([.D30]=1;"";[.D30]) -> 0.0299288 | I30: of:=IF([.E30]=1;"";[.E30]) -> 0.0293
A31: 7 | B31: strpbrk: &"obyio"{\0} &"aeiou"{\0} :=> &"obyio"{\0} | C31: 0.0294301 | D31: 0.0299288 | E31: 0.0294301 | G31: of:=IF([.C31]=1;"";[.C31]) -> 0.0294301 | H31: of:=IF([.D31]=1;"";[.D31]) -> 0.0299288 | I31: of:=IF([.E31]=1;"";[.E31]) -> 0.0294301
A32: 8 | B32: strpbrk: &"ikaaj"{\0} &"aeiou"{\0} :=> &"ikaaj"{\0} | C32: 0.0259935 | D32: 0.0299288 | E32: 0.0259935 | G32: of:=IF([.C32]=1;"";[.C32]) -> 0.0259935 | H32: of:=IF([.D32]=1;"";[.D32]) -> 0.0299288 | I32: of:=IF([.E32]=1;"";[.E32]) -> 0.0259935
A33: 9 | B33: strpbrk: &"eyunt"{\0} &"aeiou"{\0} :=> &"eyunt"{\0} | C33: 0.0284029 | D33: 0.0299288 | E33: 0.0284029 | G33: of:=IF([.C33]=1;"";[.C33]) -> 0.0284029 | H33: of:=IF([.D33]=1;"";[.D33]) -> 0.0299288 | I33: of:=IF([.E33]=1;"";[.E33]) -> 0.0284029
A34: 10 | B34: strpbrk: &"apmow"{\0} &"aeiou"{\0} :=> &"apmow"{\0} | C34: 0.0291484 | D34: 0.0299288 | E34: 0.0291484 | G34: of:=IF([.C34]=1;"";[.C34]) -> 0.0291484 | H34: of:=IF([.D34]=1;"";[.D34]) -> 0.0299288 | I34: of:=IF([.E34]=1;"";[.E34]) -> 0.0291484