Sheet: strlen
A1: strlen: &"\x01"{\0,\0,\0,\0,\0} :=> 1; | J1: # | K1: Test Case | L1: N | P1: FINAL
A2: strlen: &"\x01\x01"{\0,\0,\0,\0} :=> 2; | J2: 1 | K2: strlen: &"o"{\0,p,m,r,\0} :=> 1 | L2: 1 | N2: of:=IF([.L2]=1;"";[.L2]) ->  | P2: of:=AVERAGE([.N2:.N6]) -> 0.09240335
A3: strlen: &"\x01\x01\x01"{\0,\0,\0} :=> 3; | J3: 2 | K3: strlen: &"ot"{\0,p,a,\0} :=> 2 | L3: 0.218916 | N3: of:=IF([.L3]=1;"";[.L3]) -> 0.218916
A4: strlen: &"\x01\x01\x01\x01"{\0,\0} :=> 4; | J4: 3 | K4: strlen: &"fud"{\0,p,\0} :=> 3 | L4: 0.0834881 | N4: of:=IF([.L4]=1;"";[.L4]) -> 0.0834881
A5: strlen: &"\x01\x01\x01\x01\x01"{\0} :=> 5; | J5: 4 | K5: strlen: &"hffl"{\0,\0} :=> 4 | L5: 0.0413873 | N5: of:=IF([.L5]=1;"";[.L5]) -> 0.0413873
A6: strnlen: &""{\0,\0,\0,\0,\0,\0} 6 :=> 0; 1; | J6: 5 | K6: strlen: &"bynwk"{\0} :=> 5 | L6: 0.025822 | N6: of:=IF([.L6]=1;"";[.L6]) -> 0.025822
A7: strnlen: &"\x01"{\0,\0,\0,\0,\0} 6 :=> 1; | J7: 1 | K7: strnlen: &""{\0,p,i,o,m,\0} 6 :=> 0 | L7: 1 | N7: of:=IF([.L7]=1;"";[.L7]) ->  | P7: of:=AVERAGE([.N7:.N12]) -> 0.092166725
A8: strnlen: &"\x01\x01"{\0,\0,\0,\0} 6 :=> 2; | J8: 2 | K8: strnlen: &"m"{\0,p,c,k,\0} 6 :=> 1 | L8: 1 | N8: of:=IF([.L8]=1;"";[.L8]) -> 
A9: strnlen: &"\x01\x01\x01"{\0,\0,\0} 6 :=> 3; | J9: 3 | K9: strnlen: &"om"{\0,p,a,\0} 6 :=> 2 | L9: 0.220689 | N9: of:=IF([.L9]=1;"";[.L9]) -> 0.220689
A10: strnlen: &"\x01\x01\x01\x01"{\0,\0} 6 :=> 4; | J10: 4 | K10: strnlen: &"eck"{\0,p,\0} 6 :=> 3 | L10: 0.0870897 | N10: of:=IF([.L10]=1;"";[.L10]) -> 0.0870897
A11: strnlen: &"\x01\x01\x01\x01\x01"{\0} 6 :=> 5; | J11: 5 | K11: strnlen: &"noqt"{\0,\0} 6 :=> 4 | L11: 0.0315543 | N11: of:=IF([.L11]=1;"";[.L11]) -> 0.0315543
J12: 6 | K12: strnlen: &"blunm"{\0} 6 :=> 5 | L12: 0.0293339 | N12: of:=IF([.L12]=1;"";[.L12]) -> 0.0293339

Sheet: strcmp
A1: # | B1: Test Case | C1: N1 | D1: N2 | L1: FINAL
A2: 1 | B2: strcmp: &"d"{\0,p,h,n,\0} &"d"{\0,p,m,t,\0} :=> 0 | C2: 1 | D2: 1 | F2: of:=IF([.C2]=1;"";[.C2]) ->  | G2: of:=IF([.D2]=1;"";[.D2]) ->  | H2: of:=IF([.E2]=1;"";[.E2]) ->   | I2: of:=AVERAGE([.F2:.F16]) -> 0.0443280857142857 | J2: of:=AVERAGE([.G2:.G16]) -> 0.0446408 | L2: of:=AVERAGE([.I2:.J2]) -> 0.0444844428571428
A3: 2 | B3: strcmp: &"ja"{\0,p,c,\0} &"ja"{\0,p,c,\0} :=> 0 | C3: 0.200124 | D3: 0.200124 | F3: of:=IF([.C3]=1;"";[.C3]) -> 0.200124 | G3: of:=IF([.D3]=1;"";[.D3]) -> 0.200124 | H3: of:=IF([.E3]=1;"";[.E3]) ->  
A4: 3 | B4: strcmp: &"iub"{\0,p,\0} &"iub"{\0,p,\0} :=> 0 | C4: 0.0802767 | D4: 0.0802767 | F4: of:=IF([.C4]=1;"";[.C4]) -> 0.0802767 | G4: of:=IF([.D4]=1;"";[.D4]) -> 0.0802767 | H4: of:=IF([.E4]=1;"";[.E4]) ->  
A5: 4 | B5: strcmp: &"xtsv"{\0,\0} &"xtsv"{\0,\0} :=> 0 | C5: 0.0415035 | D5: 0.0415035 | F5: of:=IF([.C5]=1;"";[.C5]) -> 0.0415035 | G5: of:=IF([.D5]=1;"";[.D5]) -> 0.0415035 | H5: of:=IF([.E5]=1;"";[.E5]) ->  
A6: 5 | B6: strcmp: &"yakng"{\0} &"yakng"{\0} :=> 0 | C6: 0.0287844 | D6: 0.0287844 | F6: of:=IF([.C6]=1;"";[.C6]) -> 0.0287844 | G6: of:=IF([.D6]=1;"";[.D6]) -> 0.0287844 | H6: of:=IF([.E6]=1;"";[.E6]) ->  
A7: 6 | B7: strcmp: &"ttoet"{\0} &"ttoeo"{\0} :=> 1 | C7: 0.0301847 | D7: 0.0295501 | F7: of:=IF([.C7]=1;"";[.C7]) -> 0.0301847 | G7: of:=IF([.D7]=1;"";[.D7]) -> 0.0295501 | H7: of:=IF([.E7]=1;"";[.E7]) ->  
A8: 7 | B8: strcmp: &"rirsu"{\0} &"rirsy"{\0} :=> -1 | C8: 0.0310401 | D8: 0.0302421 | F8: of:=IF([.C8]=1;"";[.C8]) -> 0.0310401 | G8: of:=IF([.D8]=1;"";[.D8]) -> 0.0302421 | H8: of:=IF([.E8]=1;"";[.E8]) ->  
A9: 8 | B9: strcmp: &"hhopo"{\0} &"hhodl"{\0} :=> 1 | C9: 0.0280257 | D9: 0.0270757 | F9: of:=IF([.C9]=1;"";[.C9]) -> 0.0280257 | G9: of:=IF([.D9]=1;"";[.D9]) -> 0.0270757 | H9: of:=IF([.E9]=1;"";[.E9]) ->  
A10: 9 | B10: strcmp: &"wiwri"{\0} &"wiwty"{\0} :=> -1 | C10: 0.0276459 | D10: 0.0265216 | F10: of:=IF([.C10]=1;"";[.C10]) -> 0.0276459 | G10: of:=IF([.D10]=1;"";[.D10]) -> 0.0265216 | H10: of:=IF([.E10]=1;"";[.E10]) ->  
A11: 10 | B11: strcmp: &"lnmkw"{\0} &"lnasm"{\0} :=> 1 | C11: 0.0224855 | D11: 0.0285331 | F11: of:=IF([.C11]=1;"";[.C11]) -> 0.0224855 | G11: of:=IF([.D11]=1;"";[.D11]) -> 0.0285331 | H11: of:=IF([.E11]=1;"";[.E11]) ->  
A12: 11 | B12: strcmp: &"zbutf"{\0} &"zbyvo"{\0} :=> -1 | C12: 0.0261373 | D12: 0.0242432 | F12: of:=IF([.C12]=1;"";[.C12]) -> 0.0261373 | G12: of:=IF([.D12]=1;"";[.D12]) -> 0.0242432
A13: 12 | B13: strcmp: &"qukyu"{\0} &"qtint"{\0} :=> 1 | C13: 0.0251266 | D13: 0.0248969 | F13: of:=IF([.C13]=1;"";[.C13]) -> 0.0251266 | G13: of:=IF([.D13]=1;"";[.D13]) -> 0.0248969
A14: 13 | B14: strcmp: &"hrmlg"{\0} &"hyret"{\0} :=> -1 | C14: 0.0262655 | D14: 0.0292029 | F14: of:=IF([.C14]=1;"";[.C14]) -> 0.0262655 | G14: of:=IF([.D14]=1;"";[.D14]) -> 0.0292029
A15: 14 | B15: strcmp: &"ybdnt"{\0} &"ttklk"{\0} :=> 1 | C15: 0.0260099 | D15: 0.0258597 | F15: of:=IF([.C15]=1;"";[.C15]) -> 0.0260099 | G15: of:=IF([.D15]=1;"";[.D15]) -> 0.0258597
A16: 15 | B16: strcmp: &"mmdri"{\0} &"tkerr"{\0} :=> -1 | C16: 0.0269834 | D16: 0.0281573 | F16: of:=IF([.C16]=1;"";[.C16]) -> 0.0269834 | G16: of:=IF([.D16]=1;"";[.D16]) -> 0.0281573
A17: 1 | B17: strncmp: &""{\0,p,l,g,s,\0} &""{\0,p,t,a,k,\0} 5 :=> 0 | C17: 1 | D17: 1 | F17: of:=IF([.C17]=1;"";[.C17]) ->  | G17: of:=IF([.D17]=1;"";[.D17]) ->  | I17: of:=AVERAGE([.F17:.F32]) -> 0.0460396571428571 | J17: of:=AVERAGE([.G17:.G32]) -> 0.0437654428571429 | L17: of:=AVERAGE([.I17:.J17]) -> 0.04490255
A18: 2 | B18: strncmp: &"u"{\0,p,i,n,\0} &"u"{\0,p,t,n,\0} 5 :=> 0 | C18: 1 | D18: 1 | F18: of:=IF([.C18]=1;"";[.C18]) ->  | G18: of:=IF([.D18]=1;"";[.D18]) -> 
A19: 3 | B19: strncmp: &"er"{\0,p,l,\0} &"er"{\0,p,h,\0} 5 :=> 0 | C19: 0.226174 | D19: 0.226174 | F19: of:=IF([.C19]=1;"";[.C19]) -> 0.226174 | G19: of:=IF([.D19]=1;"";[.D19]) -> 0.226174
A20: 4 | B20: strncmp: &"joh"{\0,p,\0} &"joh"{\0,p,\0} 5 :=> 0 | C20: 0.0803163 | D20: 0.0803163 | F20: of:=IF([.C20]=1;"";[.C20]) -> 0.0803163 | G20: of:=IF([.D20]=1;"";[.D20]) -> 0.0803163
A21: 5 | B21: strncmp: &"nmpy"{\0,\0} &"nmpy"{\0,\0} 5 :=> 0 | C21: 0.0436617 | D21: 0.0436617 | F21: of:=IF([.C21]=1;"";[.C21]) -> 0.0436617 | G21: of:=IF([.D21]=1;"";[.D21]) -> 0.0436617
A22: 6 | B22: strncmp: &"bbylu"{\0} &"bbylu"{\0} 5 :=> 0 | C22: 0.0277715 | D22: 0.0277715 | F22: of:=IF([.C22]=1;"";[.C22]) -> 0.0277715 | G22: of:=IF([.D22]=1;"";[.D22]) -> 0.0277715
A23: 7 | B23: strncmp: &"ndueh"{\0} &"ndued"{\0} 5 :=> 1 | C23: 0.0294612 | D23: 0.0309775 | F23: of:=IF([.C23]=1;"";[.C23]) -> 0.0294612 | G23: of:=IF([.D23]=1;"";[.D23]) -> 0.0309775
A24: 8 | B24: strncmp: &"uqutp"{\0} &"uquty"{\0} 5 :=> -1 | C24: 0.0255616 | D24: 0.0272603 | F24: of:=IF([.C24]=1;"";[.C24]) -> 0.0255616 | G24: of:=IF([.D24]=1;"";[.D24]) -> 0.0272603
A25: 9 | B25: strncmp: &"fgkds"{\0} &"fgkca"{\0} 5 :=> 1 | C25: 0.0221121 | D25: 0.0213114 | F25: of:=IF([.C25]=1;"";[.C25]) -> 0.0221121 | G25: of:=IF([.D25]=1;"";[.D25]) -> 0.0213114
A26: 10 | B26: strncmp: &"nwaft"{\0} &"nwalx"{\0} 5 :=> -1 | C26: 0.028273 | D26: 0.0247061 | F26: of:=IF([.C26]=1;"";[.C26]) -> 0.028273 | G26: of:=IF([.D26]=1;"";[.D26]) -> 0.0247061
A27: 11 | B27: strncmp: &"hgaks"{\0} &"hgEdo"{\0} 5 :=> 1 | C27: 0.0262839 | D27: 0 | F27: of:=IF([.C27]=1;"";[.C27]) -> 0.0262839 | G27: of:=IF([.D27]=1;"";[.D27]) -> 0
A28: 12 | B28: strncmp: &"frvla"{\0} &"fryad"{\0} 5 :=> -1 | C28: 0.0274098 | D28: 0.0293075 | F28: of:=IF([.C28]=1;"";[.C28]) -> 0.0274098 | G28: of:=IF([.D28]=1;"";[.D28]) -> 0.0293075
A29: 13 | B29: strncmp: &"eureo"{\0} &"ehasj"{\0} 5 :=> 1 | C29: 0.029767 | D29: 0.0261353 | F29: of:=IF([.C29]=1;"";[.C29]) -> 0.029767 | G29: of:=IF([.D29]=1;"";[.D29]) -> 0.0261353
A30: 14 | B30: strncmp: &"oiwtw"{\0} &"onalt"{\0} 5 :=> -1 | C30: 0.0257575 | D30: 0.0312755 | F30: of:=IF([.C30]=1;"";[.C30]) -> 0.0257575 | G30: of:=IF([.D30]=1;"";[.D30]) -> 0.0312755
A31: 15 | B31: strncmp: &"sbmvo"{\0} &"mtssj"{\0} 5 :=> 1 | C31: 0.0230385 | D31: 0.0239666 | F31: of:=IF([.C31]=1;"";[.C31]) -> 0.0230385 | G31: of:=IF([.D31]=1;"";[.D31]) -> 0.0239666
A32: 16 | B32: strncmp: &"dgipa"{\0} &"pjbso"{\0} 5 :=> -1 | C32: 0.0289671 | D32: 0.0198525 | F32: of:=IF([.C32]=1;"";[.C32]) -> 0.0289671 | G32: of:=IF([.D32]=1;"";[.D32]) -> 0.0198525
A33: 1 | B33: sysfs_streq: &""{\0,p,f,n,s,\0} &"mrlag"{\0} :=> \0 | C33: 1 | D33: 0.0273435 | F33: of:=IF([.C33]=1;"";[.C33]) ->  | G33: of:=IF([.D33]=1;"";[.D33]) -> 0.0273435 | I33: of:=AVERAGE([.F33:.F71]) -> 0.0670287586206897 | J33: of:=AVERAGE([.G33:.G71]) -> 0.0447233142857143 | L33: of:=AVERAGE([.I33:.J33]) -> 0.055876036453202
A34: 2 | B34: sysfs_streq: &""{\0,p,e,g,r,\0} &"\n"{\0,b,b,j,\0} :=> \x01 | C34: 1 | F34: of:=IF([.C34]=1;"";[.C34]) ->  | G34: of:=IF([.D34]=1;"";[.D34]) ->  
A35: 3 | B35: sysfs_streq: &""{\0,p,m,u,v,\0} &"\namnh"{\0} :=> \0 | C35: 1 | F35: of:=IF([.C35]=1;"";[.C35]) ->  | G35: of:=IF([.D35]=1;"";[.D35]) ->  
A36: 4 | B36: sysfs_streq: &""{\0,p,u,v,i,\0} &""{\0,h,n,b,o,\0} :=> \x01 | C36: 1 | D36: 1 | F36: of:=IF([.C36]=1;"";[.C36]) ->  | G36: of:=IF([.D36]=1;"";[.D36]) -> 
A37: 5 | B37: sysfs_streq: &"ollfl"{\0} &"qlacp"{\0} :=> \0 | C37: 0.0295114 | D37: 0.0186752 | F37: of:=IF([.C37]=1;"";[.C37]) -> 0.0295114 | G37: of:=IF([.D37]=1;"";[.D37]) -> 0.0186752
A38: 6 | B38: sysfs_streq: &"\n"{\0,p,h,l,\0} &""{\0,a,a,c,a,\0} :=> \x01 | C38: 1 | F38: of:=IF([.C38]=1;"";[.C38]) ->  | G38: of:=IF([.D38]=1;"";[.D38]) ->  
A39: 7 | B39: sysfs_streq: &"\n"{\0,a,o,b,\0} &"yllam"{\0} :=> \0 | C39: 0.0299313 | F39: of:=IF([.C39]=1;"";[.C39]) -> 0.0299313 | G39: of:=IF([.D39]=1;"";[.D39]) ->  
A40: 8 | B40: sysfs_streq: &"\namcr"{\0} &"ppoco"{\0} :=> \0 | C40: 0.0303983 | F40: of:=IF([.C40]=1;"";[.C40]) -> 0.0303983 | G40: of:=IF([.D40]=1;"";[.D40]) ->  
A41: 9 | B41: sysfs_streq: &"m"{\0,p,p,y,\0} &"mvmvt"{\0} :=> \0 | C41: 1 | D41: 0.0155464 | F41: of:=IF([.C41]=1;"";[.C41]) ->  | G41: of:=IF([.D41]=1;"";[.D41]) -> 0.0155464
A42: 10 | B42: sysfs_streq: &"x"{\0,p,v,i,\0} &"x\n"{\0,a,e,\0} :=> \x01 | C42: 1 | F42: of:=IF([.C42]=1;"";[.C42]) ->  | G42: of:=IF([.D42]=1;"";[.D42]) ->  
A43: 11 | B43: sysfs_streq: &"c"{\0,p,w,o,\0} &"c\nadv"{\0} :=> \0 | C43: 1 | F43: of:=IF([.C43]=1;"";[.C43]) ->  | G43: of:=IF([.D43]=1;"";[.D43]) ->  
A44: 12 | B44: sysfs_streq: &"n"{\0,p,t,h,\0} &"n"{\0,h,r,c,\0} :=> \x01 | C44: 1 | D44: 1 | F44: of:=IF([.C44]=1;"";[.C44]) ->  | G44: of:=IF([.D44]=1;"";[.D44]) -> 
A45: 13 | B45: sysfs_streq: &"bargm"{\0} &"behgn"{\0} :=> \0 | C45: 0.0287021 | D45: 0.0259595 | F45: of:=IF([.C45]=1;"";[.C45]) -> 0.0287021 | G45: of:=IF([.D45]=1;"";[.D45]) -> 0.0259595
A46: 14 | B46: sysfs_streq: &"n\n"{\0,b,d,\0} &"n"{\0,b,f,r,\0} :=> \x01 | C46: 1 | F46: of:=IF([.C46]=1;"";[.C46]) ->  | G46: of:=IF([.D46]=1;"";[.D46]) ->  
A47: 15 | B47: sysfs_streq: &"b\n"{\0,b,g,\0} &"bexxo"{\0} :=> \0 | C47: 0.0253095 | F47: of:=IF([.C47]=1;"";[.C47]) -> 0.0253095 | G47: of:=IF([.D47]=1;"";[.D47]) ->  
A48: 16 | B48: sysfs_streq: &"f\nacn"{\0} &"fjuab"{\0} :=> \0 | C48: 0.0253496 | F48: of:=IF([.C48]=1;"";[.C48]) -> 0.0253496 | G48: of:=IF([.D48]=1;"";[.D48]) ->  
A49: 17 | B49: sysfs_streq: &"lh"{\0,p,t,\0} &"lhbss"{\0} :=> \0 | C49: 0.191743 | D49: 0.0265104 | F49: of:=IF([.C49]=1;"";[.C49]) -> 0.191743 | G49: of:=IF([.D49]=1;"";[.D49]) -> 0.0265104
A50: 18 | B50: sysfs_streq: &"nc"{\0,p,c,\0} &"nc\n"{\0,a,\0} :=> \x01 | C50: 0.218916 | F50: of:=IF([.C50]=1;"";[.C50]) -> 0.218916 | G50: of:=IF([.D50]=1;"";[.D50]) ->  
A51: 19 | B51: sysfs_streq: &"jf"{\0,p,o,\0} &"jf\nav"{\0} :=> \0 | C51: 0.140671 | F51: of:=IF([.C51]=1;"";[.C51]) -> 0.140671 | G51: of:=IF([.D51]=1;"";[.D51]) ->  
A52: 20 | B52: sysfs_streq: &"rk"{\0,p,e,\0} &"rk"{\0,b,b,\0} :=> \x01 | C52: 0.215236 | D52: 0.215236 | F52: of:=IF([.C52]=1;"";[.C52]) -> 0.215236 | G52: of:=IF([.D52]=1;"";[.D52]) -> 0.215236
A53: 21 | B53: sysfs_streq: &"iatys"{\0} &"ialti"{\0} :=> \0 | C53: 0.030549 | D53: 0.0311052 | F53: of:=IF([.C53]=1;"";[.C53]) -> 0.030549 | G53: of:=IF([.D53]=1;"";[.D53]) -> 0.0311052
A54: 22 | B54: sysfs_streq: &"dq\n"{\0,b,\0} &"dq"{\0,b,c,\0} :=> \x01 | C54: 0.189362 | F54: of:=IF([.C54]=1;"";[.C54]) -> 0.189362 | G54: of:=IF([.D54]=1;"";[.D54]) ->  
A55: 23 | B55: sysfs_streq: &"ae\n"{\0,b,\0} &"aeksa"{\0} :=> \0 | C55: 0.0283496 | F55: of:=IF([.C55]=1;"";[.C55]) -> 0.0283496 | G55: of:=IF([.D55]=1;"";[.D55]) ->  
A56: 24 | B56: sysfs_streq: &"sd\nan"{\0} &"sdaio"{\0} :=> \0 | C56: 0.0298022 | F56: of:=IF([.C56]=1;"";[.C56]) -> 0.0298022 | G56: of:=IF([.D56]=1;"";[.D56]) ->  
A57: 25 | B57: sysfs_streq: &"mpo"{\0,p,\0} &"mpoiv"{\0} :=> \0 | C57: 0.0871192 | D57: 0.030117 | F57: of:=IF([.C57]=1;"";[.C57]) -> 0.0871192 | G57: of:=IF([.D57]=1;"";[.D57]) -> 0.030117
A58: 26 | B58: sysfs_streq: &"rka"{\0,p,\0} &"rka\n"{\0,\0} :=> \x01 | C58: 0.0820605 | F58: of:=IF([.C58]=1;"";[.C58]) -> 0.0820605 | G58: of:=IF([.D58]=1;"";[.D58]) ->  
A59: 27 | B59: sysfs_streq: &"ste"{\0,p,\0} &"ste\na"{\0} :=> \0 | C59: 0.0909466 | F59: of:=IF([.C59]=1;"";[.C59]) -> 0.0909466 | G59: of:=IF([.D59]=1;"";[.D59]) ->  
A60: 28 | B60: sysfs_streq: &"bba"{\0,p,\0} &"bba"{\0,h,\0} :=> \x01 | C60: 0.0816828 | D60: 0.0816828 | F60: of:=IF([.C60]=1;"";[.C60]) -> 0.0816828 | G60: of:=IF([.D60]=1;"";[.D60]) -> 0.0816828
A61: 29 | B61: sysfs_streq: &"vijjr"{\0} &"vijae"{\0} :=> \0 | C61: 0.0166006 | D61: 0.0262397 | F61: of:=IF([.C61]=1;"";[.C61]) -> 0.0166006 | G61: of:=IF([.D61]=1;"";[.D61]) -> 0.0262397
A62: 30 | B62: sysfs_streq: &"rfv\n"{\0,\0} &"rfv"{\0,a,\0} :=> \x01 | C62: 0.0664708 | F62: of:=IF([.C62]=1;"";[.C62]) -> 0.0664708 | G62: of:=IF([.D62]=1;"";[.D62]) ->  
A63: 31 | B63: sysfs_streq: &"wng\n"{\0,\0} &"wngiv"{\0} :=> \0 | C63: 0.0301851 | F63: of:=IF([.C63]=1;"";[.C63]) -> 0.0301851 | G63: of:=IF([.D63]=1;"";[.D63]) ->  
A64: 32 | B64: sysfs_streq: &"urr\na"{\0} &"urrhn"{\0} :=> \0 | C64: 0.0283092 | F64: of:=IF([.C64]=1;"";[.C64]) -> 0.0283092 | G64: of:=IF([.D64]=1;"";[.D64]) ->  
A65: 33 | B65: sysfs_streq: &"othe"{\0,\0} &"othei"{\0} :=> \0 | C65: 0.0503525 | D65: 0.0320412 | F65: of:=IF([.C65]=1;"";[.C65]) -> 0.0503525 | G65: of:=IF([.D65]=1;"";[.D65]) -> 0.0320412
A66: 34 | B66: sysfs_streq: &"alya"{\0,\0} &"alya\n"{\0} :=> \x01 | C66: 0.0461709 | F66: of:=IF([.C66]=1;"";[.C66]) -> 0.0461709 | G66: of:=IF([.D66]=1;"";[.D66]) ->  
A67: 35 | B67: sysfs_streq: &"njio"{\0,\0} &"njio"{\0,\0} :=> \x01 | C67: 0.0415605 | D67: 0.0415605 | F67: of:=IF([.C67]=1;"";[.C67]) -> 0.0415605 | G67: of:=IF([.D67]=1;"";[.D67]) -> 0.0415605
A68: 36 | B68: sysfs_streq: &"ynsqa"{\0} &"ynsqi"{\0} :=> \0 | C68: 0.0234186 | D68: 0.0258785 | F68: of:=IF([.C68]=1;"";[.C68]) -> 0.0234186 | G68: of:=IF([.D68]=1;"";[.D68]) -> 0.0258785
A69: 37 | B69: sysfs_streq: &"yfju\n"{\0} &"yfju"{\0,\0} :=> \x01 | C69: 0.03491 | F69: of:=IF([.C69]=1;"";[.C69]) -> 0.03491 | G69: of:=IF([.D69]=1;"";[.D69]) ->  
A70: 38 | B70: sysfs_streq: &"phbf\n"{\0} &"phbfg"{\0} :=> \0 | C70: 0.0219852 | F70: of:=IF([.C70]=1;"";[.C70]) -> 0.0219852 | G70: of:=IF([.D70]=1;"";[.D70]) ->  
A71: 39 | B71: sysfs_streq: &"gskhe"{\0} &"gskhe"{\0} :=> \x01 | C71: 0.0282305 | D71: 0.0282305 | F71: of:=IF([.C71]=1;"";[.C71]) -> 0.0282305 | G71: of:=IF([.D71]=1;"";[.D71]) -> 0.0282305

Sheet: strcpy
A1: # | B1: Test Case | C1: N1 | D1: N2 | E1: N3 | O1: FINAL
A2: 1 | B2: strcpy: &""{\0,\x01,\x01,\x01,\x01,\x01} &"i"{\0,p,g,f,\0} :=> &"i"{\0,p,h,e,\0} | C2: 1 | D2: 1 | E2: 1 | G2: of:=IF([.C2]=1;"";[.C2]) ->  | H2: of:=IF([.D2]=1;"";[.D2]) ->  | I2: of:=IF([.E2]=1;"";[.E2]) ->  | K2: of:=AVERAGE([.G2:.G36]) -> 0.0927239916666667 | L2: of:=AVERAGE([.H2:.H36]) -> 0.0840721166666667 | M2: of:=AVERAGE([.I2:.I36]) -> 0.0840721166666667 | O2: of:=AVERAGE([.K2:.M2]) -> 0.086956075
A3: 2 | B3: strcpy: &""{\0,\x01,\x01,\x01,\x01,\x01} &"qi"{\0,p,l,\0} :=> &"qi"{\0,p,f,\0} | C3: 1 | D3: 0.188031 | E3: 0.188031 | G3: of:=IF([.C3]=1;"";[.C3]) ->  | H3: of:=IF([.D3]=1;"";[.D3]) -> 0.188031 | I3: of:=IF([.E3]=1;"";[.E3]) -> 0.188031
A4: 3 | B4: strcpy: &""{\0,\x01,\x01,\x01,\x01,\x01} &"dkj"{\0,p,\0} :=> &"dkj"{\0,p,\0} | C4: 1 | D4: 0.0594884 | E4: 0.0594884 | G4: of:=IF([.C4]=1;"";[.C4]) ->  | H4: of:=IF([.D4]=1;"";[.D4]) -> 0.0594884 | I4: of:=IF([.E4]=1;"";[.E4]) -> 0.0594884
A5: 4 | B5: strcpy: &""{\0,\x01,\x01,\x01,\x01,\x01} &"qbwo"{\0,\0} :=> &"qbwo"{\0,\0} | C5: 1 | D5: 0.0316233 | E5: 0.0316233 | G5: of:=IF([.C5]=1;"";[.C5]) ->  | H5: of:=IF([.D5]=1;"";[.D5]) -> 0.0316233 | I5: of:=IF([.E5]=1;"";[.E5]) -> 0.0316233
A6: 5 | B6: strcpy: &""{\0,\x01,\x01,\x01,\x01,\x01} &"xvgts"{\0} :=> &"xvgts"{\0} | C6: 1 | D6: 0.0225792 | E6: 0.0225792 | G6: of:=IF([.C6]=1;"";[.C6]) ->  | H6: of:=IF([.D6]=1;"";[.D6]) -> 0.0225792 | I6: of:=IF([.E6]=1;"";[.E6]) -> 0.0225792
A7: 6 | B7: strcpy: &"h"{\0,\x01,\x01,\x01,\x01} &""{\0,p,l,r,n,\0} :=> &""{\0,\0,p,g,w,\0} | C7: 1 | D7: 1 | E7: 1 | G7: of:=IF([.C7]=1;"";[.C7]) ->  | H7: of:=IF([.D7]=1;"";[.D7]) ->  | I7: of:=IF([.E7]=1;"";[.E7]) -> 
A8: 7 | B8: strcpy: &"a"{\0,\x01,\x01,\x01,\x01} &"y"{\0,p,a,c,\0} :=> &"y"{\0,p,k,o,\0} | C8: 1 | D8: 1 | E8: 1 | G8: of:=IF([.C8]=1;"";[.C8]) ->  | H8: of:=IF([.D8]=1;"";[.D8]) ->  | I8: of:=IF([.E8]=1;"";[.E8]) -> 
A9: 8 | B9: strcpy: &"d"{\0,\x01,\x01,\x01,\x01} &"ea"{\0,p,s,\0} :=> &"ea"{\0,p,r,\0} | C9: 1 | D9: 0.22156 | E9: 0.22156 | G9: of:=IF([.C9]=1;"";[.C9]) ->  | H9: of:=IF([.D9]=1;"";[.D9]) -> 0.22156 | I9: of:=IF([.E9]=1;"";[.E9]) -> 0.22156
A10: 9 | B10: strcpy: &"y"{\0,\x01,\x01,\x01,\x01} &"tdt"{\0,p,\0} :=> &"tdt"{\0,p,\0} | C10: 1 | D10: 0.0716916 | E10: 0.0716916 | G10: of:=IF([.C10]=1;"";[.C10]) ->  | H10: of:=IF([.D10]=1;"";[.D10]) -> 0.0716916 | I10: of:=IF([.E10]=1;"";[.E10]) -> 0.0716916
A11: 10 | B11: strcpy: &"s"{\0,\x01,\x01,\x01,\x01} &"tmdg"{\0,\0} :=> &"tmdg"{\0,\0} | C11: 1 | D11: 0.0392256 | E11: 0.0392256 | G11: of:=IF([.C11]=1;"";[.C11]) ->  | H11: of:=IF([.D11]=1;"";[.D11]) -> 0.0392256 | I11: of:=IF([.E11]=1;"";[.E11]) -> 0.0392256
A12: 11 | B12: strcpy: &"k"{\0,\x01,\x01,\x01,\x01} &"lklan"{\0} :=> &"lklan"{\0} | C12: 1 | D12: 0.029416 | E12: 0.029416 | G12: of:=IF([.C12]=1;"";[.C12]) ->  | H12: of:=IF([.D12]=1;"";[.D12]) -> 0.029416 | I12: of:=IF([.E12]=1;"";[.E12]) -> 0.029416
A13: 12 | B13: strcpy: &"fo"{\0,\x01,\x01,\x01} &""{\0,p,f,m,m,\0} :=> &""{\0,o,\0,p,y,\0} | C13: 0.219808 | D13: 1 | E13: 1 | G13: of:=IF([.C13]=1;"";[.C13]) -> 0.219808 | H13: of:=IF([.D13]=1;"";[.D13]) ->  | I13: of:=IF([.E13]=1;"";[.E13]) -> 
A14: 13 | B14: strcpy: &"du"{\0,\x01,\x01,\x01} &"p"{\0,p,f,i,\0} :=> &"p"{\0,\0,p,y,\0} | C14: 0.213322 | D14: 1 | E14: 1 | G14: of:=IF([.C14]=1;"";[.C14]) -> 0.213322 | H14: of:=IF([.D14]=1;"";[.D14]) ->  | I14: of:=IF([.E14]=1;"";[.E14]) -> 
A15: 14 | B15: strcpy: &"se"{\0,\x01,\x01,\x01} &"qt"{\0,p,o,\0} :=> &"qt"{\0,p,i,\0} | C15: 0.221991 | D15: 0.138419 | E15: 0.138419 | G15: of:=IF([.C15]=1;"";[.C15]) -> 0.221991 | H15: of:=IF([.D15]=1;"";[.D15]) -> 0.138419 | I15: of:=IF([.E15]=1;"";[.E15]) -> 0.138419
A16: 15 | B16: strcpy: &"ci"{\0,\x01,\x01,\x01} &"egr"{\0,p,\0} :=> &"egr"{\0,p,\0} | C16: 0.216638 | D16: 0.0848781 | E16: 0.0848781 | G16: of:=IF([.C16]=1;"";[.C16]) -> 0.216638 | H16: of:=IF([.D16]=1;"";[.D16]) -> 0.0848781 | I16: of:=IF([.E16]=1;"";[.E16]) -> 0.0848781
A17: 16 | B17: strcpy: &"el"{\0,\x01,\x01,\x01} &"fsdd"{\0,\0} :=> &"fsdd"{\0,\0} | C17: 0.219808 | D17: 0.0413573 | E17: 0.0413573 | G17: of:=IF([.C17]=1;"";[.C17]) -> 0.219808 | H17: of:=IF([.D17]=1;"";[.D17]) -> 0.0413573 | I17: of:=IF([.E17]=1;"";[.E17]) -> 0.0413573
A18: 17 | B18: strcpy: &"ac"{\0,\x01,\x01,\x01} &"vasio"{\0} :=> &"vasio"{\0} | C18: 0.218916 | D18: 0.0310772 | E18: 0.0310772 | G18: of:=IF([.C18]=1;"";[.C18]) -> 0.218916 | H18: of:=IF([.D18]=1;"";[.D18]) -> 0.0310772 | I18: of:=IF([.E18]=1;"";[.E18]) -> 0.0310772
A19: 18 | B19: strcpy: &"dtw"{\0,\x01,\x01} &""{\0,p,u,r,u,\0} :=> &""{\0,t,w,\0,p,\0} | C19: 0.0770555 | D19: 1 | E19: 1 | G19: of:=IF([.C19]=1;"";[.C19]) -> 0.0770555 | H19: of:=IF([.D19]=1;"";[.D19]) ->  | I19: of:=IF([.E19]=1;"";[.E19]) -> 
A20: 19 | B20: strcpy: &"znw"{\0,\x01,\x01} &"x"{\0,p,d,m,\0} :=> &"x"{\0,w,\0,p,\0} | C20: 0.0672327 | D20: 1 | E20: 1 | G20: of:=IF([.C20]=1;"";[.C20]) -> 0.0672327 | H20: of:=IF([.D20]=1;"";[.D20]) ->  | I20: of:=IF([.E20]=1;"";[.E20]) -> 
A21: 20 | B21: strcpy: &"sev"{\0,\x01,\x01} &"kd"{\0,p,t,\0} :=> &"kd"{\0,\0,p,\0} | C21: 0.0880868 | D21: 0.188031 | E21: 0.188031 | G21: of:=IF([.C21]=1;"";[.C21]) -> 0.0880868 | H21: of:=IF([.D21]=1;"";[.D21]) -> 0.188031 | I21: of:=IF([.E21]=1;"";[.E21]) -> 0.188031
A22: 21 | B22: strcpy: &"sak"{\0,\x01,\x01} &"lon"{\0,p,\0} :=> &"lon"{\0,p,\0} | C22: 0.0860472 | D22: 0.0896283 | E22: 0.0896283 | G22: of:=IF([.C22]=1;"";[.C22]) -> 0.0860472 | H22: of:=IF([.D22]=1;"";[.D22]) -> 0.0896283 | I22: of:=IF([.E22]=1;"";[.E22]) -> 0.0896283
A23: 22 | B23: strcpy: &"bch"{\0,\x01,\x01} &"malw"{\0,\0} :=> &"malw"{\0,\0} | C23: 0.0781262 | D23: 0.0457149 | E23: 0.0457149 | G23: of:=IF([.C23]=1;"";[.C23]) -> 0.0781262 | H23: of:=IF([.D23]=1;"";[.D23]) -> 0.0457149 | I23: of:=IF([.E23]=1;"";[.E23]) -> 0.0457149
A24: 23 | B24: strcpy: &"man"{\0,\x01,\x01} &"ckdlw"{\0} :=> &"ckdlw"{\0} | C24: 0.0903354 | D24: 0.0259285 | E24: 0.0259285 | G24: of:=IF([.C24]=1;"";[.C24]) -> 0.0903354 | H24: of:=IF([.D24]=1;"";[.D24]) -> 0.0259285 | I24: of:=IF([.E24]=1;"";[.E24]) -> 0.0259285
A25: 24 | B25: strcpy: &"aclh"{\0,\x01} &""{\0,p,t,x,t,\0} :=> &""{\0,c,l,h,\0,\0} | C25: 0.0431862 | D25: 1 | E25: 1 | G25: of:=IF([.C25]=1;"";[.C25]) -> 0.0431862 | H25: of:=IF([.D25]=1;"";[.D25]) ->  | I25: of:=IF([.E25]=1;"";[.E25]) -> 
A26: 25 | B26: strcpy: &"owsc"{\0,\x01} &"y"{\0,p,a,f,\0} :=> &"y"{\0,s,c,\0,\0} | C26: 0.0455122 | D26: 1 | E26: 1 | G26: of:=IF([.C26]=1;"";[.C26]) -> 0.0455122 | H26: of:=IF([.D26]=1;"";[.D26]) ->  | I26: of:=IF([.E26]=1;"";[.E26]) -> 
A27: 26 | B27: strcpy: &"iyxf"{\0,\x01} &"hq"{\0,p,v,\0} :=> &"hq"{\0,f,\0,\0} | C27: 0.032143 | D27: 0.1762 | E27: 0.1762 | G27: of:=IF([.C27]=1;"";[.C27]) -> 0.032143 | H27: of:=IF([.D27]=1;"";[.D27]) -> 0.1762 | I27: of:=IF([.E27]=1;"";[.E27]) -> 0.1762
A28: 27 | B28: strcpy: &"moit"{\0,\x01} &"lyi"{\0,p,\0} :=> &"lyi"{\0,\0,\0} | C28: 0.0473903 | D28: 0.084287 | E28: 0.084287 | G28: of:=IF([.C28]=1;"";[.C28]) -> 0.0473903 | H28: of:=IF([.D28]=1;"";[.D28]) -> 0.084287 | I28: of:=IF([.E28]=1;"";[.E28]) -> 0.084287
A29: 28 | B29: strcpy: &"ntsh"{\0,\x01} &"lahr"{\0,\0} :=> &"lahr"{\0,\0} | C29: 0.0483629 | D29: 0.0447055 | E29: 0.0447055 | G29: of:=IF([.C29]=1;"";[.C29]) -> 0.0483629 | H29: of:=IF([.D29]=1;"";[.D29]) -> 0.0447055 | I29: of:=IF([.E29]=1;"";[.E29]) -> 0.0447055
A30: 29 | B30: strcpy: &"iwti"{\0,\x01} &"jical"{\0} :=> &"jical"{\0} | C30: 0.0408559 | D30: 0.0293828 | E30: 0.0293828 | G30: of:=IF([.C30]=1;"";[.C30]) -> 0.0408559 | H30: of:=IF([.D30]=1;"";[.D30]) -> 0.0293828 | I30: of:=IF([.E30]=1;"";[.E30]) -> 0.0293828
A31: 30 | B31: strcpy: &"eahgr"{\0} &""{\0,p,m,w,t,\0} :=> &""{\0,a,h,g,r,\0} | C31: 0.0262536 | D31: 1 | E31: 1 | G31: of:=IF([.C31]=1;"";[.C31]) -> 0.0262536 | H31: of:=IF([.D31]=1;"";[.D31]) ->  | I31: of:=IF([.E31]=1;"";[.E31]) -> 
A32: 31 | B32: strcpy: &"calln"{\0} &"p"{\0,p,l,e,\0} :=> &"p"{\0,l,l,n,\0} | C32: 0.0296531 | D32: 1 | E32: 1 | G32: of:=IF([.C32]=1;"";[.C32]) -> 0.0296531 | H32: of:=IF([.D32]=1;"";[.D32]) ->  | I32: of:=IF([.E32]=1;"";[.E32]) -> 
A33: 32 | B33: strcpy: &"xpkef"{\0} &"li"{\0,p,m,\0} :=> &"li"{\0,e,f,\0} | C33: 0.0272496 | D33: 0.22156 | E33: 0.22156 | G33: of:=IF([.C33]=1;"";[.C33]) -> 0.0272496 | H33: of:=IF([.D33]=1;"";[.D33]) -> 0.22156 | I33: of:=IF([.E33]=1;"";[.E33]) -> 0.22156
A34: 33 | B34: strcpy: &"mlmsm"{\0} &"rsw"{\0,p,\0} :=> &"rsw"{\0,m,\0} | C34: 0.026585 | D34: 0.0834771 | E34: 0.0834771 | G34: of:=IF([.C34]=1;"";[.C34]) -> 0.026585 | H34: of:=IF([.D34]=1;"";[.D34]) -> 0.0834771 | I34: of:=IF([.E34]=1;"";[.E34]) -> 0.0834771
A35: 34 | B35: strcpy: &"eayte"{\0} &"zwno"{\0,\0} :=> &"zwno"{\0,\0} | C35: 0.0301667 | D35: 0.0406329 | E35: 0.0406329 | G35: of:=IF([.C35]=1;"";[.C35]) -> 0.0301667 | H35: of:=IF([.D35]=1;"";[.D35]) -> 0.0406329 | I35: of:=IF([.E35]=1;"";[.E35]) -> 0.0406329
A36: 35 | B36: strcpy: &"tmeso"{\0} &"acaoc"{\0} :=> &"acaoc"{\0} | C36: 0.0306505 | D36: 0.0288361 | E36: 0.0288361 | G36: of:=IF([.C36]=1;"";[.C36]) -> 0.0306505 | H36: of:=IF([.D36]=1;"";[.D36]) -> 0.0288361 | I36: of:=IF([.E36]=1;"";[.E36]) -> 0.0288361
A37: 1 | B37: strncpy: &""{\0,\x01,\x01,\x01,\x01,\x01} &""{\0,p,l,d,e,\0} 5 :=> &""{\0,\0,\0,\0,\0,\0} | C37: 1 | D37: 1 | E37: 1 | G37: of:=IF([.C37]=1;"";[.C37]) ->  | H37: of:=IF([.D37]=1;"";[.D37]) ->  | I37: of:=IF([.E37]=1;"";[.E37]) ->  | K37: of:=AVERAGE([.G37:.G72]) -> 0.088388175 | L37: of:=AVERAGE([.H37:.H72]) -> 0.0888772416666667 | M37: of:=AVERAGE([.I37:.I72]) -> 0.0888772416666667 | O37: of:=AVERAGE([.K37:.M37]) -> 0.0887142194444444
A38: 2 | B38: strncpy: &""{\0,\x01,\x01,\x01,\x01,\x01} &"l"{\0,p,s,e,\0} 5 :=> &"l"{\0,\0,\0,\0,\0} | C38: 1 | D38: 1 | E38: 1 | G38: of:=IF([.C38]=1;"";[.C38]) ->  | H38: of:=IF([.D38]=1;"";[.D38]) ->  | I38: of:=IF([.E38]=1;"";[.E38]) -> 
A39: 3 | B39: strncpy: &""{\0,\x01,\x01,\x01,\x01,\x01} &"ar"{\0,p,y,\0} 5 :=> &"ar"{\0,\0,\0,\0} | C39: 1 | D39: 0.223692 | E39: 0.223692 | G39: of:=IF([.C39]=1;"";[.C39]) ->  | H39: of:=IF([.D39]=1;"";[.D39]) -> 0.223692 | I39: of:=IF([.E39]=1;"";[.E39]) -> 0.223692
A40: 4 | B40: strncpy: &""{\0,\x01,\x01,\x01,\x01,\x01} &"ldu"{\0,p,\0} 5 :=> &"ldu"{\0,\0,\0} | C40: 1 | D40: 0.0857609 | E40: 0.0857609 | G40: of:=IF([.C40]=1;"";[.C40]) ->  | H40: of:=IF([.D40]=1;"";[.D40]) -> 0.0857609 | I40: of:=IF([.E40]=1;"";[.E40]) -> 0.0857609
A41: 5 | B41: strncpy: &""{\0,\x01,\x01,\x01,\x01,\x01} &"zyit"{\0,\0} 5 :=> &"zyit"{\0,\0} | C41: 1 | D41: 0.0429402 | E41: 0.0429402 | G41: of:=IF([.C41]=1;"";[.C41]) ->  | H41: of:=IF([.D41]=1;"";[.D41]) -> 0.0429402 | I41: of:=IF([.E41]=1;"";[.E41]) -> 0.0429402
A42: 6 | B42: strncpy: &""{\0,\x01,\x01,\x01,\x01,\x01} &"zptck"{\0} 5 :=> &"zptck"{\0} | C42: 1 | D42: 0.0256351 | E42: 0.0256351 | G42: of:=IF([.C42]=1;"";[.C42]) ->  | H42: of:=IF([.D42]=1;"";[.D42]) -> 0.0256351 | I42: of:=IF([.E42]=1;"";[.E42]) -> 0.0256351
A43: 7 | B43: strncpy: &"s"{\0,\x01,\x01,\x01,\x01} &""{\0,p,i,l,u,\0} 5 :=> &""{\0,\0,\0,\0,\0,\0} | C43: 1 | D43: 1 | E43: 1 | G43: of:=IF([.C43]=1;"";[.C43]) ->  | H43: of:=IF([.D43]=1;"";[.D43]) ->  | I43: of:=IF([.E43]=1;"";[.E43]) -> 
A44: 8 | B44: strncpy: &"q"{\0,\x01,\x01,\x01,\x01} &"h"{\0,p,f,x,\0} 5 :=> &"h"{\0,\0,\0,\0,\0} | C44: 1 | D44: 1 | E44: 1 | G44: of:=IF([.C44]=1;"";[.C44]) ->  | H44: of:=IF([.D44]=1;"";[.D44]) ->  | I44: of:=IF([.E44]=1;"";[.E44]) -> 
A45: 9 | B45: strncpy: &"q"{\0,\x01,\x01,\x01,\x01} &"fn"{\0,p,g,\0} 5 :=> &"fn"{\0,\0,\0,\0} | C45: 1 | D45: 0.177812 | E45: 0.177812 | G45: of:=IF([.C45]=1;"";[.C45]) ->  | H45: of:=IF([.D45]=1;"";[.D45]) -> 0.177812 | I45: of:=IF([.E45]=1;"";[.E45]) -> 0.177812
A46: 10 | B46: strncpy: &"t"{\0,\x01,\x01,\x01,\x01} &"yce"{\0,p,\0} 5 :=> &"yce"{\0,\0,\0} | C46: 1 | D46: 0.0824786 | E46: 0.0824786 | G46: of:=IF([.C46]=1;"";[.C46]) ->  | H46: of:=IF([.D46]=1;"";[.D46]) -> 0.0824786 | I46: of:=IF([.E46]=1;"";[.E46]) -> 0.0824786
A47: 11 | B47: strncpy: &"q"{\0,\x01,\x01,\x01,\x01} &"mndl"{\0,\0} 5 :=> &"mndl"{\0,\0} | C47: 1 | D47: 0.0436169 | E47: 0.0436169 | G47: of:=IF([.C47]=1;"";[.C47]) ->  | H47: of:=IF([.D47]=1;"";[.D47]) -> 0.0436169 | I47: of:=IF([.E47]=1;"";[.E47]) -> 0.0436169
A48: 12 | B48: strncpy: &"v"{\0,\x01,\x01,\x01,\x01} &"jpofr"{\0} 5 :=> &"jpofr"{\0} | C48: 1 | D48: 0.0232095 | E48: 0.0232095 | G48: of:=IF([.C48]=1;"";[.C48]) ->  | H48: of:=IF([.D48]=1;"";[.D48]) -> 0.0232095 | I48: of:=IF([.E48]=1;"";[.E48]) -> 0.0232095
A49: 13 | B49: strncpy: &"mm"{\0,\x01,\x01,\x01} &""{\0,p,f,i,u,\0} 5 :=> &""{\0,\0,\0,\0,\0,\0} | C49: 0.212346 | D49: 1 | E49: 1 | G49: of:=IF([.C49]=1;"";[.C49]) -> 0.212346 | H49: of:=IF([.D49]=1;"";[.D49]) ->  | I49: of:=IF([.E49]=1;"";[.E49]) -> 
A50: 14 | B50: strncpy: &"td"{\0,\x01,\x01,\x01} &"s"{\0,p,b,r,\0} 5 :=> &"s"{\0,\0,\0,\0,\0} | C50: 0.192671 | D50: 1 | E50: 1 | G50: of:=IF([.C50]=1;"";[.C50]) -> 0.192671 | H50: of:=IF([.D50]=1;"";[.D50]) ->  | I50: of:=IF([.E50]=1;"";[.E50]) -> 
A51: 15 | B51: strncpy: &"ze"{\0,\x01,\x01,\x01} &"vc"{\0,p,m,\0} 5 :=> &"vc"{\0,\0,\0,\0} | C51: 0.208818 | D51: 0.183708 | E51: 0.183708 | G51: of:=IF([.C51]=1;"";[.C51]) -> 0.208818 | H51: of:=IF([.D51]=1;"";[.D51]) -> 0.183708 | I51: of:=IF([.E51]=1;"";[.E51]) -> 0.183708
A52: 16 | B52: strncpy: &"ur"{\0,\x01,\x01,\x01} &"puf"{\0,p,\0} 5 :=> &"puf"{\0,\0,\0} | C52: 0.219364 | D52: 0.0812924 | E52: 0.0812924 | G52: of:=IF([.C52]=1;"";[.C52]) -> 0.219364 | H52: of:=IF([.D52]=1;"";[.D52]) -> 0.0812924 | I52: of:=IF([.E52]=1;"";[.E52]) -> 0.0812924
A53: 17 | B53: strncpy: &"jr"{\0,\x01,\x01,\x01} &"ixck"{\0,\0} 5 :=> &"ixck"{\0,\0} | C53: 0.127187 | D53: 0.0430994 | E53: 0.0430994 | G53: of:=IF([.C53]=1;"";[.C53]) -> 0.127187 | H53: of:=IF([.D53]=1;"";[.D53]) -> 0.0430994 | I53: of:=IF([.E53]=1;"";[.E53]) -> 0.0430994
A54: 18 | B54: strncpy: &"ea"{\0,\x01,\x01,\x01} &"systs"{\0} 5 :=> &"systs"{\0} | C54: 0.22156 | D54: 0.0298473 | E54: 0.0298473 | G54: of:=IF([.C54]=1;"";[.C54]) -> 0.22156 | H54: of:=IF([.D54]=1;"";[.D54]) -> 0.0298473 | I54: of:=IF([.E54]=1;"";[.E54]) -> 0.0298473
A55: 19 | B55: strncpy: &"kyv"{\0,\x01,\x01} &""{\0,p,m,o,u,\0} 5 :=> &""{\0,\0,\0,\0,\0,\0} | C55: 0.0704792 | D55: 1 | E55: 1 | G55: of:=IF([.C55]=1;"";[.C55]) -> 0.0704792 | H55: of:=IF([.D55]=1;"";[.D55]) ->  | I55: of:=IF([.E55]=1;"";[.E55]) -> 
A56: 20 | B56: strncpy: &"anv"{\0,\x01,\x01} &"u"{\0,p,m,b,\0} 5 :=> &"u"{\0,\0,\0,\0,\0} | C56: 0.0871856 | D56: 1 | E56: 1 | G56: of:=IF([.C56]=1;"";[.C56]) -> 0.0871856 | H56: of:=IF([.D56]=1;"";[.D56]) ->  | I56: of:=IF([.E56]=1;"";[.E56]) -> 
A57: 21 | B57: strncpy: &"hrp"{\0,\x01,\x01} &"nn"{\0,p,a,\0} 5 :=> &"nn"{\0,\0,\0,\0} | C57: 0.082381 | D57: 0.212836 | E57: 0.212836 | G57: of:=IF([.C57]=1;"";[.C57]) -> 0.082381 | H57: of:=IF([.D57]=1;"";[.D57]) -> 0.212836 | I57: of:=IF([.E57]=1;"";[.E57]) -> 0.212836
A58: 22 | B58: strncpy: &"tuc"{\0,\x01,\x01} &"gbe"{\0,p,\0} 5 :=> &"gbe"{\0,\0,\0} | C58: 0.0854866 | D58: 0.0748891 | E58: 0.0748891 | G58: of:=IF([.C58]=1;"";[.C58]) -> 0.0854866 | H58: of:=IF([.D58]=1;"";[.D58]) -> 0.0748891 | I58: of:=IF([.E58]=1;"";[.E58]) -> 0.0748891
A59: 23 | B59: strncpy: &"nfl"{\0,\x01,\x01} &"fday"{\0,\0} 5 :=> &"fday"{\0,\0} | C59: 0.0817496 | D59: 0.0384882 | E59: 0.0384882 | G59: of:=IF([.C59]=1;"";[.C59]) -> 0.0817496 | H59: of:=IF([.D59]=1;"";[.D59]) -> 0.0384882 | I59: of:=IF([.E59]=1;"";[.E59]) -> 0.0384882
A60: 24 | B60: strncpy: &"mio"{\0,\x01,\x01} &"lersm"{\0} 5 :=> &"lersm"{\0} | C60: 0.0884094 | D60: 0.0308262 | E60: 0.0308262 | G60: of:=IF([.C60]=1;"";[.C60]) -> 0.0884094 | H60: of:=IF([.D60]=1;"";[.D60]) -> 0.0308262 | I60: of:=IF([.E60]=1;"";[.E60]) -> 0.0308262
A61: 25 | B61: strncpy: &"alsl"{\0,\x01} &""{\0,p,t,x,p,\0} 5 :=> &""{\0,\0,\0,\0,\0,\0} | C61: 0.0466238 | D61: 1 | E61: 1 | G61: of:=IF([.C61]=1;"";[.C61]) -> 0.0466238 | H61: of:=IF([.D61]=1;"";[.D61]) ->  | I61: of:=IF([.E61]=1;"";[.E61]) -> 
A62: 26 | B62: strncpy: &"rjew"{\0,\x01} &"h"{\0,p,p,c,\0} 5 :=> &"h"{\0,\0,\0,\0,\0} | C62: 0.0398758 | D62: 1 | E62: 1 | G62: of:=IF([.C62]=1;"";[.C62]) -> 0.0398758 | H62: of:=IF([.D62]=1;"";[.D62]) ->  | I62: of:=IF([.E62]=1;"";[.E62]) -> 
A63: 27 | B63: strncpy: &"trin"{\0,\x01} &"gh"{\0,p,p,\0} 5 :=> &"gh"{\0,\0,\0,\0} | C63: 0.0493657 | D63: 0.216638 | E63: 0.216638 | G63: of:=IF([.C63]=1;"";[.C63]) -> 0.0493657 | H63: of:=IF([.D63]=1;"";[.D63]) -> 0.216638 | I63: of:=IF([.E63]=1;"";[.E63]) -> 0.216638
A64: 28 | B64: strncpy: &"domu"{\0,\x01} &"lul"{\0,p,\0} 5 :=> &"lul"{\0,\0,\0} | C64: 0.0466108 | D64: 0.0856044 | E64: 0.0856044 | G64: of:=IF([.C64]=1;"";[.C64]) -> 0.0466108 | H64: of:=IF([.D64]=1;"";[.D64]) -> 0.0856044 | I64: of:=IF([.E64]=1;"";[.E64]) -> 0.0856044
A65: 29 | B65: strncpy: &"anby"{\0,\x01} &"kemp"{\0,\0} 5 :=> &"kemp"{\0,\0} | C65: 0.0454701 | D65: 0.0473309 | E65: 0.0473309 | G65: of:=IF([.C65]=1;"";[.C65]) -> 0.0454701 | H65: of:=IF([.D65]=1;"";[.D65]) -> 0.0473309 | I65: of:=IF([.E65]=1;"";[.E65]) -> 0.0473309
A66: 30 | B66: strncpy: &"roew"{\0,\x01} &"jehco"{\0} 5 :=> &"jehco"{\0} | C66: 0.0461367 | D66: 0.0264149 | E66: 0.0264149 | G66: of:=IF([.C66]=1;"";[.C66]) -> 0.0461367 | H66: of:=IF([.D66]=1;"";[.D66]) -> 0.0264149 | I66: of:=IF([.E66]=1;"";[.E66]) -> 0.0264149
A67: 31 | B67: strncpy: &"bibae"{\0} &""{\0,p,l,s,u,\0} 5 :=> &""{\0,\0,\0,\0,\0,\0} | C67: 0.0284308 | D67: 1 | E67: 1 | G67: of:=IF([.C67]=1;"";[.C67]) -> 0.0284308 | H67: of:=IF([.D67]=1;"";[.D67]) ->  | I67: of:=IF([.E67]=1;"";[.E67]) -> 
A68: 32 | B68: strncpy: &"kkdup"{\0} &"f"{\0,p,t,i,\0} 5 :=> &"f"{\0,\0,\0,\0,\0} | C68: 0.0252791 | D68: 1 | E68: 1 | G68: of:=IF([.C68]=1;"";[.C68]) -> 0.0252791 | H68: of:=IF([.D68]=1;"";[.D68]) ->  | I68: of:=IF([.E68]=1;"";[.E68]) -> 
A69: 33 | B69: strncpy: &"kerwe"{\0} &"oc"{\0,p,u,\0} 5 :=> &"oc"{\0,\0,\0,\0} | C69: 0.0299369 | D69: 0.214286 | E69: 0.214286 | G69: of:=IF([.C69]=1;"";[.C69]) -> 0.0299369 | H69: of:=IF([.D69]=1;"";[.D69]) -> 0.214286 | I69: of:=IF([.E69]=1;"";[.E69]) -> 0.214286
A70: 34 | B70: strncpy: &"wavim"{\0} &"yfo"{\0,p,\0} 5 :=> &"yfo"{\0,\0,\0} | C70: 0.0305725 | D70: 0.0774712 | E70: 0.0774712 | G70: of:=IF([.C70]=1;"";[.C70]) -> 0.0305725 | H70: of:=IF([.D70]=1;"";[.D70]) -> 0.0774712 | I70: of:=IF([.E70]=1;"";[.E70]) -> 0.0774712
A71: 35 | B71: strncpy: &"effia"{\0} &"rroh"{\0,\0} 5 :=> &"rroh"{\0,\0} | C71: 0.0301242 | D71: 0.0454879 | E71: 0.0454879 | G71: of:=IF([.C71]=1;"";[.C71]) -> 0.0301242 | H71: of:=IF([.D71]=1;"";[.D71]) -> 0.0454879 | I71: of:=IF([.E71]=1;"";[.E71]) -> 0.0454879
A72: 36 | B72: strncpy: &"ypbme"{\0} &"mpdqt"{\0} 5 :=> &"mpdqt"{\0} | C72: 0.0252524 | D72: 0.0196887 | E72: 0.0196887 | G72: of:=IF([.C72]=1;"";[.C72]) -> 0.0252524 | H72: of:=IF([.D72]=1;"";[.D72]) -> 0.0196887 | I72: of:=IF([.E72]=1;"";[.E72]) -> 0.0196887

Sheet: strcat
A1: # | B1: Test Case | C1: N1 | D1: N2 | E1: N3
A2: 1 | B2: strcat: &""{\0,\x01,\x01,\x01,\x01,\x01,\x01,\x01,\x01,\x01} &"g"{\0,p,i,\0} :=> &"g"{\0,p,i,o,q,u,g,o,\0} | C2: 1 | D2: 1 | E2: 1 | G2: of:=IF([.C2]=1;"";[.C2]) ->  | H2: of:=IF([.D2]=1;"";[.D2]) ->  | I2: of:=IF([.E2]=1;"";[.E2]) ->  | K2: of:=AVERAGE([.G2:.G41]) -> 0.0633467225806452 | L2: of:=AVERAGE([.H2:.H41]) -> 0.113402448636364 | M2: of:=AVERAGE([.I2:.I41]) -> 0.0410576281081081 | O2: of:=AVERAGE([.K2:.M2]) -> 0.0726022664417056
A3: 2 | B3: strcat: &""{\0,\x01,\x01,\x01,\x01,\x01,\x01,\x01,\x01,\x01} &"cy"{\0,p,\0} :=> &"cy"{\0,p,h,r,r,o,d,\0} | C3: 1 | D3: 0.207934 | E3: 0.207934 | G3: of:=IF([.C3]=1;"";[.C3]) ->  | H3: of:=IF([.D3]=1;"";[.D3]) -> 0.207934 | I3: of:=IF([.E3]=1;"";[.E3]) -> 0.207934
A4: 3 | B4: strcat: &""{\0,\x01,\x01,\x01,\x01,\x01,\x01,\x01,\x01,\x01} &"ufu"{\0,\0} :=> &"ufu"{\0,p,e,k,r,b,\0} | C4: 1 | D4: 0.0806868 | E4: 0.0806868 | G4: of:=IF([.C4]=1;"";[.C4]) ->  | H4: of:=IF([.D4]=1;"";[.D4]) -> 0.0806868 | I4: of:=IF([.E4]=1;"";[.E4]) -> 0.0806868
A5: 4 | B5: strcat: &""{\0,\x01,\x01,\x01,\x01,\x01,\x01,\x01,\x01,\x01} &"bmhl"{\0} :=> &"bmhl"{\0,p,l,a,f,\0} | C5: 1 | D5: 0.0364546 | E5: 0.0364546 | H5: of:=IF([.D5]=1;"";[.D5]) -> 0.0364546 | I5: of:=IF([.E5]=1;"";[.E5]) -> 0.0364546
A6: 5 | B6: strcat: &"e"{\0,\x01,\x01,\x01,\x01,\x01,\x01,\x01,\x01} &""{\0,p,t,d,\0} :=> &"e"{\0,p,q,u,v,o,b,i,\0} | C6: 1 | D6: 1 | E6: 1 | G6: of:=IF([.C6]=1;"";[.C6]) ->  | H6: of:=IF([.D6]=1;"";[.D6]) ->  | I6: of:=IF([.E6]=1;"";[.E6]) -> 
A7: 6 | B7: strcat: &"u"{\0,\x01,\x01,\x01,\x01,\x01,\x01,\x01,\x01} &"w"{\0,p,l,\0} :=> &"uw"{\0,p,e,m,v,l,e,\0} | C7: 1 | D7: 1 | E7: 0.186527 | G7: of:=IF([.C7]=1;"";[.C7]) ->  | H7: of:=IF([.D7]=1;"";[.D7]) ->  | I7: of:=IF([.E7]=1;"";[.E7]) -> 0.186527
A8: 7 | B8: strcat: &"h"{\0,\x01,\x01,\x01,\x01,\x01,\x01,\x01,\x01} &"hd"{\0,p,\0} :=> &"hhd"{\0,p,o,k,o,b,\0} | C8: 1 | D8: 0.196005 | E8: 0.0703692 | G8: of:=IF([.C8]=1;"";[.C8]) ->  | H8: of:=IF([.D8]=1;"";[.D8]) -> 0.196005 | I8: of:=IF([.E8]=1;"";[.E8]) -> 0.0703692
A9: 8 | B9: strcat: &"h"{\0,\x01,\x01,\x01,\x01,\x01,\x01,\x01,\x01} &"pwy"{\0,\0} :=> &"hpwy"{\0,p,u,g,a,\0} | C9: 1 | D9: 0.0705502 | E9: 0.0353296 | G9: of:=IF([.C9]=1;"";[.C9]) ->  | H9: of:=IF([.D9]=1;"";[.D9]) -> 0.0705502 | I9: of:=IF([.E9]=1;"";[.E9]) -> 0.0353296
A10: 9 | B10: strcat: &"i"{\0,\x01,\x01,\x01,\x01,\x01,\x01,\x01,\x01} &"fgst"{\0} :=> &"ifgst"{\0,p,g,l,\0} | C10: 1 | D10: 0.0419641 | E10: 0.0273378 | G10: of:=IF([.C10]=1;"";[.C10]) ->  | H10: of:=IF([.D10]=1;"";[.D10]) -> 0.0419641 | I10: of:=IF([.E10]=1;"";[.E10]) -> 0.0273378
A11: 10 | B11: strcat: &"ur"{\0,\x01,\x01,\x01,\x01,\x01,\x01,\x01} &""{\0,p,o,i,\0} :=> &"ur"{\0,p,b,u,e,w,n,\0} | C11: 0.219364 | D11: 1 | E11: 0.219364 | G11: of:=IF([.C11]=1;"";[.C11]) -> 0.219364 | H11: of:=IF([.D11]=1;"";[.D11]) ->  | I11: of:=IF([.E11]=1;"";[.E11]) -> 0.219364
A12: 11 | B12: strcat: &"ue"{\0,\x01,\x01,\x01,\x01,\x01,\x01,\x01} &"q"{\0,p,d,\0} :=> &"ueq"{\0,p,l,p,r,t,\0} | C12: 0.214286 | D12: 1 | E12: 0.0823137 | G12: of:=IF([.C12]=1;"";[.C12]) -> 0.214286 | H12: of:=IF([.D12]=1;"";[.D12]) ->  | I12: of:=IF([.E12]=1;"";[.E12]) -> 0.0823137
A13: 12 | B13: strcat: &"iu"{\0,\x01,\x01,\x01,\x01,\x01,\x01,\x01} &"cc"{\0,p,\0} :=> &"iucc"{\0,p,m,v,k,\0} | C13: 0.20123 | D13: 0.210352 | E13: 0.0435577 | G13: of:=IF([.C13]=1;"";[.C13]) -> 0.20123 | H13: of:=IF([.D13]=1;"";[.D13]) -> 0.210352 | I13: of:=IF([.E13]=1;"";[.E13]) -> 0.0435577
A14: 13 | B14: strcat: &"ad"{\0,\x01,\x01,\x01,\x01,\x01,\x01,\x01} &"smp"{\0,\0} :=> &"adsmp"{\0,p,a,r,\0} | C14: 0.218466 | D14: 0.084167 | E14: 0.0296034 | G14: of:=IF([.C14]=1;"";[.C14]) -> 0.218466 | H14: of:=IF([.D14]=1;"";[.D14]) -> 0.084167 | I14: of:=IF([.E14]=1;"";[.E14]) -> 0.0296034
A15: 14 | B15: strcat: &"in"{\0,\x01,\x01,\x01,\x01,\x01,\x01,\x01} &"nyxw"{\0} :=> &"innyxw"{\0,p,c,\0} | C15: 0.226579 | D15: 0.0354956 | E15: 0.0179582 | G15: of:=IF([.C15]=1;"";[.C15]) -> 0.226579 | H15: of:=IF([.D15]=1;"";[.D15]) -> 0.0354956 | I15: of:=IF([.E15]=1;"";[.E15]) -> 0.0179582
A16: 15 | B16: strcat: &"hny"{\0,\x01,\x01,\x01,\x01,\x01,\x01} &""{\0,p,i,o,\0} :=> &"hny"{\0,p,n,c,o,r,\0} | C16: 0.0824916 | D16: 1 | E16: 0.0824916 | G16: of:=IF([.C16]=1;"";[.C16]) -> 0.0824916 | H16: of:=IF([.D16]=1;"";[.D16]) ->  | I16: of:=IF([.E16]=1;"";[.E16]) -> 0.0824916
A17: 16 | B17: strcat: &"dfd"{\0,\x01,\x01,\x01,\x01,\x01,\x01} &"o"{\0,p,q,\0} :=> &"dfdo"{\0,p,b,b,a,\0} | C17: 0.0621245 | D17: 1 | E17: 0.0354537 | G17: of:=IF([.C17]=1;"";[.C17]) -> 0.0621245 | H17: of:=IF([.D17]=1;"";[.D17]) ->  | I17: of:=IF([.E17]=1;"";[.E17]) -> 0.0354537
A18: 17 | B18: strcat: &"qix"{\0,\x01,\x01,\x01,\x01,\x01,\x01} &"yt"{\0,p,\0} :=> &"qixyt"{\0,p,g,y,\0} | C18: 0.0737163 | D18: 0.202091 | E18: 0.0236196 | G18: of:=IF([.C18]=1;"";[.C18]) -> 0.0737163 | H18: of:=IF([.D18]=1;"";[.D18]) -> 0.202091 | I18: of:=IF([.E18]=1;"";[.E18]) -> 0.0236196
A19: 18 | B19: strcat: &"joe"{\0,\x01,\x01,\x01,\x01,\x01,\x01} &"roa"{\0,\0} :=> &"joeroa"{\0,p,r,\0} | C19: 0.0809699 | D19: 0.0862147 | E19: 0.021363 | G19: of:=IF([.C19]=1;"";[.C19]) -> 0.0809699 | H19: of:=IF([.D19]=1;"";[.D19]) -> 0.0862147 | I19: of:=IF([.E19]=1;"";[.E19]) -> 0.021363
A20: 19 | B20: strcat: &"utg"{\0,\x01,\x01,\x01,\x01,\x01,\x01} &"zixc"{\0} :=> &"utgzixc"{\0,p,\0} | C20: 0.0805372 | D20: 0.0413805 | E20: 0.0131375 | G20: of:=IF([.C20]=1;"";[.C20]) -> 0.0805372 | H20: of:=IF([.D20]=1;"";[.D20]) -> 0.0413805 | I20: of:=IF([.E20]=1;"";[.E20]) -> 0.0131375
A21: 20 | B21: strcat: &"wrvu"{\0,\x01,\x01,\x01,\x01,\x01} &""{\0,p,t,l,\0} :=> &"wrvu"{\0,p,m,n,y,\0} | C21: 0.0418506 | D21: 1 | E21: 0.0418506 | G21: of:=IF([.C21]=1;"";[.C21]) -> 0.0418506 | H21: of:=IF([.D21]=1;"";[.D21]) ->  | I21: of:=IF([.E21]=1;"";[.E21]) -> 0.0418506
A22: 21 | B22: strcat: &"oyet"{\0,\x01,\x01,\x01,\x01,\x01} &"n"{\0,p,o,\0} :=> &"oyetn"{\0,p,t,u,\0} | C22: 0.0457879 | D22: 1 | E22: 0.0285673 | G22: of:=IF([.C22]=1;"";[.C22]) -> 0.0457879 | H22: of:=IF([.D22]=1;"";[.D22]) ->  | I22: of:=IF([.E22]=1;"";[.E22]) -> 0.0285673
A23: 22 | B23: strcat: &"bwwu"{\0,\x01,\x01,\x01,\x01,\x01} &"us"{\0,p,\0} :=> &"bwwuus"{\0,p,y,\0} | C23: 0.0290775 | D23: 0.219364 | E23: 0.0139426 | G23: of:=IF([.C23]=1;"";[.C23]) -> 0.0290775 | H23: of:=IF([.D23]=1;"";[.D23]) -> 0.219364 | I23: of:=IF([.E23]=1;"";[.E23]) -> 0.0139426
A24: 23 | B24: strcat: &"ymmr"{\0,\x01,\x01,\x01,\x01,\x01} &"ysv"{\0,\0} :=> &"ymmrysv"{\0,p,\0} | C24: 0.0397974 | D24: 0.0754319 | E24: 0.0140393 | G24: of:=IF([.C24]=1;"";[.C24]) -> 0.0397974 | H24: of:=IF([.D24]=1;"";[.D24]) -> 0.0754319 | I24: of:=IF([.E24]=1;"";[.E24]) -> 0.0140393
A25: 24 | B25: strcat: &"lhra"{\0,\x01,\x01,\x01,\x01,\x01} &"htll"{\0} :=> &"lhrahtll"{\0,\0} | C25: 0.0432 | D25: 0.0465348 | E25: 0.0127351 | G25: of:=IF([.C25]=1;"";[.C25]) -> 0.0432 | H25: of:=IF([.D25]=1;"";[.D25]) -> 0.0465348 | I25: of:=IF([.E25]=1;"";[.E25]) -> 0.0127351
A26: 25 | B26: strcat: &"phaun"{\0,\x01,\x01,\x01,\x01} &""{\0,p,l,b,\0} :=> &"phaun"{\0,p,i,d,\0} | C26: 0.0302137 | D26: 1 | E26: 0.0302137 | G26: of:=IF([.C26]=1;"";[.C26]) -> 0.0302137 | H26: of:=IF([.D26]=1;"";[.D26]) ->  | I26: of:=IF([.E26]=1;"";[.E26]) -> 0.0302137
A27: 26 | B27: strcat: &"vursb"{\0,\x01,\x01,\x01,\x01} &"u"{\0,p,y,\0} :=> &"vursbu"{\0,p,y,\0} | C27: 0.0272698 | D27: 1 | E27: 0.0198244 | G27: of:=IF([.C27]=1;"";[.C27]) -> 0.0272698 | H27: of:=IF([.D27]=1;"";[.D27]) ->  | I27: of:=IF([.E27]=1;"";[.E27]) -> 0.0198244
A28: 27 | B28: strcat: &"tiywh"{\0,\x01,\x01,\x01,\x01} &"ff"{\0,p,\0} :=> &"tiywhff"{\0,p,\0} | C28: 0.0270881 | D28: 0.214762 | E28: 0.0144973 | G28: of:=IF([.C28]=1;"";[.C28]) -> 0.0270881 | H28: of:=IF([.D28]=1;"";[.D28]) -> 0.214762 | I28: of:=IF([.E28]=1;"";[.E28]) -> 0.0144973
A29: 28 | B29: strcat: &"prjkn"{\0,\x01,\x01,\x01,\x01} &"rhm"{\0,\0} :=> &"prjknrhm"{\0,\0} | C29: 0.0227466 | D29: 0.076876 | E29: 0.0102929 | G29: of:=IF([.C29]=1;"";[.C29]) -> 0.0227466 | H29: of:=IF([.D29]=1;"";[.D29]) -> 0.076876 | I29: of:=IF([.E29]=1;"";[.E29]) -> 0.0102929
A30: 29 | B30: strcat: &"pitrq"{\0,\x01,\x01,\x01,\x01} &"mbea"{\0} :=> &"pitrqmbea"{\0} | C30: 0.0280453 | D30: 0.0473928 | E30: 0 | G30: of:=IF([.C30]=1;"";[.C30]) -> 0.0280453 | H30: of:=IF([.D30]=1;"";[.D30]) -> 0.0473928 | I30: of:=IF([.E30]=1;"";[.E30]) -> 0
A31: 30 | B31: strcat: &"jawgft"{\0,\x01,\x01,\x01} &""{\0,p,l,o,\0} :=> &"jawgft"{\0,p,m,\0} | C31: 0.0164087 | D31: 1 | E31: 0.0164087 | G31: of:=IF([.C31]=1;"";[.C31]) -> 0.0164087 | H31: of:=IF([.D31]=1;"";[.D31]) ->  | I31: of:=IF([.E31]=1;"";[.E31]) -> 0.0164087
A32: 31 | B32: strcat: &"jefrph"{\0,\x01,\x01,\x01} &"h"{\0,p,y,\0} :=> &"jefrphh"{\0,p,\0} | C32: 0.0204039 | D32: 1 | E32: 0.01485 | G32: of:=IF([.C32]=1;"";[.C32]) -> 0.0204039 | H32: of:=IF([.D32]=1;"";[.D32]) ->  | I32: of:=IF([.E32]=1;"";[.E32]) -> 0.01485
A33: 32 | B33: strcat: &"ejopfy"{\0,\x01,\x01,\x01} &"gh"{\0,p,\0} :=> &"ejopfygh"{\0,\0} | C33: 0.0180161 | D33: 0.216638 | E33: 0.0111303 | G33: of:=IF([.C33]=1;"";[.C33]) -> 0.0180161 | H33: of:=IF([.D33]=1;"";[.D33]) -> 0.216638 | I33: of:=IF([.E33]=1;"";[.E33]) -> 0.0111303
A34: 33 | B34: strcat: &"rtwrue"{\0,\x01,\x01,\x01} &"rgo"{\0,\0} :=> &"rtwruergo"{\0} | C34: 0.020839 | D34: 0.0844225 | E34: 0.0113408 | G34: of:=IF([.C34]=1;"";[.C34]) -> 0.020839 | H34: of:=IF([.D34]=1;"";[.D34]) -> 0.0844225 | I34: of:=IF([.E34]=1;"";[.E34]) -> 0.0113408
A35: 34 | B35: strcat: &"dcrpku"{\0,\x01,\x01,\x01} &&10 :=> &"dcrpkuxoru"{} | C35: 0.0177783 | D35: 0.00828337 | G35: of:=IF([.C35]=1;"";[.C35]) -> 0.0177783 | H35: of:=IF([.D35]=1;"";[.D35]) -> 0.00828337 | I35: of:=IF([.E35]=1;"";[.E35]) ->  
A36: 35 | B36: strcat: &"svuibub"{\0,\x01,\x01} &""{\0,p,u,f,\0} :=> &"svuibub"{\0,p,\0} | C36: 0.0143965 | D36: 1 | E36: 0.0143965 | G36: of:=IF([.C36]=1;"";[.C36]) -> 0.0143965 | H36: of:=IF([.D36]=1;"";[.D36]) ->  | I36: of:=IF([.E36]=1;"";[.E36]) -> 0.0143965
A37: 36 | B37: strcat: &"mavrdfm"{\0,\x01,\x01} &"s"{\0,p,p,\0} :=> &"mavrdfms"{\0,\0} | C37: 0.0140599 | D37: 1 | E37: 0.0115662 | G37: of:=IF([.C37]=1;"";[.C37]) -> 0.0140599 | H37: of:=IF([.D37]=1;"";[.D37]) ->  | I37: of:=IF([.E37]=1;"";[.E37]) -> 0.0115662
A38: 37 | B38: strcat: &"drelvym"{\0,\x01,\x01} &"dr"{\0,p,\0} :=> &"drelvymdr"{\0} | C38: 0.0157507 | D38: 0.211853 | E38: 0.0102257 | G38: of:=IF([.C38]=1;"";[.C38]) -> 0.0157507 | H38: of:=IF([.D38]=1;"";[.D38]) -> 0.211853 | I38: of:=IF([.E38]=1;"";[.E38]) -> 0.0102257
A39: 38 | B39: strcat: &"jdngjirs"{\0,\x01} &""{\0,p,m,p,\0} :=> &"jdngjirs"{\0,\0} | C39: 0.0101844 | D39: 1 | E39: 0.0101844 | G39: of:=IF([.C39]=1;"";[.C39]) -> 0.0101844 | H39: of:=IF([.D39]=1;"";[.D39]) ->  | I39: of:=IF([.E39]=1;"";[.E39]) -> 0.0101844
A40: 39 | B40: strcat: &"ycflaoac"{\0,\x01} &"i"{\0,p,t,\0} :=> &"ycflaoaci"{\0} | C40: 0.0110385 | D40: 1 | E40: 0.00953404 | G40: of:=IF([.C40]=1;"";[.C40]) -> 0.0110385 | H40: of:=IF([.D40]=1;"";[.D40]) ->  | I40: of:=IF([.E40]=1;"";[.E40]) -> 0.00953404
A41: 40 | B41: strcat: &"jjagarecu"{\0} &""{\0,p,m,o,\0} :=> &"jjagarecu"{\0} | C41: 0.010031 | D41: 1 | E41: 0.010031 | G41: of:=IF([.C41]=1;"";[.C41]) -> 0.010031 | H41: of:=IF([.D41]=1;"";[.D41]) ->  | I41: of:=IF([.E41]=1;"";[.E41]) -> 0.010031
A42: 1 | B42: strncat: &""{\0,\x01,\x01,\x01,\x01,\x01,\x01,\x01,\x01,\x01} &""{\0,p,a,l,\0} 4 :=> &""{\0,p,r,v,n,t,w,h,c,\0} | C42: 1 | D42: 1 | E42: 1 | G42: of:=IF([.C42]=1;"";[.C42]) ->  | H42: of:=IF([.D42]=1;"";[.D42]) ->  | I42: of:=IF([.E42]=1;"";[.E42]) ->  | K42: of:=AVERAGE([.G42:.G82]) -> 0.0600800229032258 | L42: of:=AVERAGE([.H42:.H82]) -> 0.109751550909091 | M42: of:=AVERAGE([.I42:.I82]) -> 0.0411667862162162 | O42: of:=AVERAGE([.K42:.M42]) -> 0.0703327866761776
A43: 2 | B43: strncat: &""{\0,\x01,\x01,\x01,\x01,\x01,\x01,\x01,\x01,\x01} &"a"{\0,p,k,\0} 4 :=> &"a"{\0,p,y,q,v,d,g,r,\0} | C43: 1 | D43: 1 | E43: 1 | G43: of:=IF([.C43]=1;"";[.C43]) ->  | H43: of:=IF([.D43]=1;"";[.D43]) ->  | I43: of:=IF([.E43]=1;"";[.E43]) -> 
A44: 3 | B44: strncat: &""{\0,\x01,\x01,\x01,\x01,\x01,\x01,\x01,\x01,\x01} &"gr"{\0,p,\0} 4 :=> &"gr"{\0,p,m,i,a,s,a,\0} | C44: 1 | D44: 0.214762 | E44: 0.214762 | G44: of:=IF([.C44]=1;"";[.C44]) ->  | H44: of:=IF([.D44]=1;"";[.D44]) -> 0.214762 | I44: of:=IF([.E44]=1;"";[.E44]) -> 0.214762
A45: 4 | B45: strncat: &""{\0,\x01,\x01,\x01,\x01,\x01,\x01,\x01,\x01,\x01} &"ouf"{\0,\0} 4 :=> &"ouf"{\0,p,d,o,w,b,\0} | C45: 1 | D45: 0.084078 | E45: 0.084078 | G45: of:=IF([.C45]=1;"";[.C45]) ->  | H45: of:=IF([.D45]=1;"";[.D45]) -> 0.084078 | I45: of:=IF([.E45]=1;"";[.E45]) -> 0.084078
A46: 5 | B46: strncat: &""{\0,\x01,\x01,\x01,\x01,\x01,\x01,\x01,\x01,\x01} &"hoss"{\0} 4 :=> &"hoss"{\0,p,u,l,t,\0} | C46: 1 | D46: 0.0478555 | E46: 0.0478555 | G46: of:=IF([.C46]=1;"";[.C46]) ->  | H46: of:=IF([.D46]=1;"";[.D46]) -> 0.0478555 | I46: of:=IF([.E46]=1;"";[.E46]) -> 0.0478555
A47: 6 | B47: strncat: &"p"{\0,\x01,\x01,\x01,\x01,\x01,\x01,\x01,\x01} &""{\0,p,g,a,\0} 4 :=> &"p"{\0,p,e,p,c,y,b,y,\0} | C47: 1 | D47: 1 | E47: 1 | G47: of:=IF([.C47]=1;"";[.C47]) ->  | H47: of:=IF([.D47]=1;"";[.D47]) ->  | I47: of:=IF([.E47]=1;"";[.E47]) -> 
A48: 7 | B48: strncat: &"c"{\0,\x01,\x01,\x01,\x01,\x01,\x01,\x01,\x01} &"p"{\0,p,l,\0} 4 :=> &"cp"{\0,p,m,w,h,r,m,\0} | C48: 1 | D48: 1 | E48: 0.163112 | G48: of:=IF([.C48]=1;"";[.C48]) ->  | H48: of:=IF([.D48]=1;"";[.D48]) ->  | I48: of:=IF([.E48]=1;"";[.E48]) -> 0.163112
A49: 8 | B49: strncat: &"z"{\0,\x01,\x01,\x01,\x01,\x01,\x01,\x01,\x01} &"hk"{\0,p,\0} 4 :=> &"zhk"{\0,p,q,u,c,n,\0} | C49: 1 | D49: 0.182636 | E49: 0.0667363 | G49: of:=IF([.C49]=1;"";[.C49]) ->  | H49: of:=IF([.D49]=1;"";[.D49]) -> 0.182636 | I49: of:=IF([.E49]=1;"";[.E49]) -> 0.0667363
A50: 9 | B50: strncat: &"c"{\0,\x01,\x01,\x01,\x01,\x01,\x01,\x01,\x01} &"rbn"{\0,\0} 4 :=> &"crbn"{\0,p,r,m,v,\0} | C50: 1 | D50: 0.0718231 | E50: 0.0398917 | G50: of:=IF([.C50]=1;"";[.C50]) ->  | H50: of:=IF([.D50]=1;"";[.D50]) -> 0.0718231 | I50: of:=IF([.E50]=1;"";[.E50]) -> 0.0398917
A51: 10 | B51: strncat: &"g"{\0,\x01,\x01,\x01,\x01,\x01,\x01,\x01,\x01} &"kdim"{\0} 4 :=> &"gkdim"{\0,p,d,g,\0} | C51: 1 | D51: 0.0430637 | E51: 0.0247064 | G51: of:=IF([.C51]=1;"";[.C51]) ->  | H51: of:=IF([.D51]=1;"";[.D51]) -> 0.0430637 | I51: of:=IF([.E51]=1;"";[.E51]) -> 0.0247064
A52: 11 | B52: strncat: &"qu"{\0,\x01,\x01,\x01,\x01,\x01,\x01,\x01} &""{\0,p,q,v,\0} 4 :=> &"qu"{\0,p,u,f,a,i,b,\0} | C52: 0.212836 | D52: 1 | E52: 0.212836 | G52: of:=IF([.C52]=1;"";[.C52]) -> 0.212836 | H52: of:=IF([.D52]=1;"";[.D52]) ->  | I52: of:=IF([.E52]=1;"";[.E52]) -> 0.212836
A53: 12 | B53: strncat: &"nl"{\0,\x01,\x01,\x01,\x01,\x01,\x01,\x01} &"v"{\0,p,h,\0} 4 :=> &"nlv"{\0,p,e,b,y,r,\0} | C53: 0.208818 | D53: 1 | E53: 0.0807307 | G53: of:=IF([.C53]=1;"";[.C53]) -> 0.208818 | H53: of:=IF([.D53]=1;"";[.D53]) ->  | I53: of:=IF([.E53]=1;"";[.E53]) -> 0.0807307
A54: 13 | B54: strncat: &"ya"{\0,\x01,\x01,\x01,\x01,\x01,\x01,\x01} &"ce"{\0,p,\0} 4 :=> &"yace"{\0,p,y,t,s,\0} | C54: 0.20378 | D54: 0.221126 | E54: 0.045996 | G54: of:=IF([.C54]=1;"";[.C54]) -> 0.20378 | H54: of:=IF([.D54]=1;"";[.D54]) -> 0.221126 | I54: of:=IF([.E54]=1;"";[.E54]) -> 0.045996
A55: 14 | B55: strncat: &"vo"{\0,\x01,\x01,\x01,\x01,\x01,\x01,\x01} &"kgg"{\0,\0} 4 :=> &"vokgg"{\0,p,w,m,\0} | C55: 0.210352 | D55: 0.0735595 | E55: 0.0261735 | G55: of:=IF([.C55]=1;"";[.C55]) -> 0.210352 | H55: of:=IF([.D55]=1;"";[.D55]) -> 0.0735595 | I55: of:=IF([.E55]=1;"";[.E55]) -> 0.0261735
A56: 15 | B56: strncat: &"qe"{\0,\x01,\x01,\x01,\x01,\x01,\x01,\x01} &"mhen"{\0} 4 :=> &"qemhen"{\0,p,a,\0} | C56: 0.106758 | D56: 0.0438508 | E56: 0.0146192 | G56: of:=IF([.C56]=1;"";[.C56]) -> 0.106758 | H56: of:=IF([.D56]=1;"";[.D56]) -> 0.0438508 | I56: of:=IF([.E56]=1;"";[.E56]) -> 0.0146192
A57: 16 | B57: strncat: &"yoc"{\0,\x01,\x01,\x01,\x01,\x01,\x01} &""{\0,p,w,y,\0} 4 :=> &"yoc"{\0,p,h,f,t,u,\0} | C57: 0.084102 | D57: 1 | E57: 0.084102 | G57: of:=IF([.C57]=1;"";[.C57]) -> 0.084102 | H57: of:=IF([.D57]=1;"";[.D57]) ->  | I57: of:=IF([.E57]=1;"";[.E57]) -> 0.084102
A58: 17 | B58: strncat: &"oby"{\0,\x01,\x01,\x01,\x01,\x01,\x01} &"c"{\0,p,n,\0} 4 :=> &"obyc"{\0,p,u,o,v,\0} | C58: 0.0844002 | D58: 1 | E58: 0.0435657 | G58: of:=IF([.C58]=1;"";[.C58]) -> 0.0844002 | H58: of:=IF([.D58]=1;"";[.D58]) ->  | I58: of:=IF([.E58]=1;"";[.E58]) -> 0.0435657
A59: 18 | B59: strncat: &"ptp"{\0,\x01,\x01,\x01,\x01,\x01,\x01} &"mt"{\0,p,\0} 4 :=> &"ptpmt"{\0,p,d,h,\0} | C59: 0.0769713 | D59: 0.182092 | E59: 0.024191 | G59: of:=IF([.C59]=1;"";[.C59]) -> 0.0769713 | H59: of:=IF([.D59]=1;"";[.D59]) -> 0.182092 | I59: of:=IF([.E59]=1;"";[.E59]) -> 0.024191
A60: 19 | B60: strncat: &"uph"{\0,\x01,\x01,\x01,\x01,\x01,\x01} &"spc"{\0,\0} 4 :=> &"uphspc"{\0,p,f,\0} | C60: 0.0837822 | D60: 0.0745246 | E60: 0.018953 | G60: of:=IF([.C60]=1;"";[.C60]) -> 0.0837822 | H60: of:=IF([.D60]=1;"";[.D60]) -> 0.0745246 | I60: of:=IF([.E60]=1;"";[.E60]) -> 0.018953
A61: 20 | B61: strncat: &"ksn"{\0,\x01,\x01,\x01,\x01,\x01,\x01} &"rnoa"{\0} 4 :=> &"ksnrnoa"{\0,p,\0} | C61: 0.0806692 | D61: 0.0462192 | E61: 0.0155297 | G61: of:=IF([.C61]=1;"";[.C61]) -> 0.0806692 | H61: of:=IF([.D61]=1;"";[.D61]) -> 0.0462192 | I61: of:=IF([.E61]=1;"";[.E61]) -> 0.0155297
A62: 21 | B62: strncat: &"zquj"{\0,\x01,\x01,\x01,\x01,\x01} &""{\0,p,c,u,\0} 4 :=> &"zquj"{\0,p,c,k,g,\0} | C62: 0.0333083 | D62: 1 | E62: 0.0333083 | G62: of:=IF([.C62]=1;"";[.C62]) -> 0.0333083 | H62: of:=IF([.D62]=1;"";[.D62]) ->  | I62: of:=IF([.E62]=1;"";[.E62]) -> 0.0333083
A63: 22 | B63: strncat: &"plii"{\0,\x01,\x01,\x01,\x01,\x01} &"p"{\0,p,u,\0} 4 :=> &"pliip"{\0,p,u,b,\0} | C63: 0.043897 | D63: 1 | E63: 0.028189 | G63: of:=IF([.C63]=1;"";[.C63]) -> 0.043897 | H63: of:=IF([.D63]=1;"";[.D63]) ->  | I63: of:=IF([.E63]=1;"";[.E63]) -> 0.028189
A64: 23 | B64: strncat: &"cyso"{\0,\x01,\x01,\x01,\x01,\x01} &"kd"{\0,p,\0} 4 :=> &"cysokd"{\0,p,n,\0} | C64: 0.0451817 | D64: 0.188031 | E64: 0.0195364 | G64: of:=IF([.C64]=1;"";[.C64]) -> 0.0451817 | H64: of:=IF([.D64]=1;"";[.D64]) -> 0.188031 | I64: of:=IF([.E64]=1;"";[.E64]) -> 0.0195364
A65: 24 | B65: strncat: &"avnx"{\0,\x01,\x01,\x01,\x01,\x01} &"hue"{\0,\0} 4 :=> &"avnxhue"{\0,p,\0} | C65: 0.0382268 | D65: 0.0834574 | E65: 0.0138256 | G65: of:=IF([.C65]=1;"";[.C65]) -> 0.0382268 | H65: of:=IF([.D65]=1;"";[.D65]) -> 0.0834574 | I65: of:=IF([.E65]=1;"";[.E65]) -> 0.0138256
A66: 25 | B66: strncat: &"cfoa"{\0,\x01,\x01,\x01,\x01,\x01} &"sigv"{\0} 4 :=> &"cfoasigv"{\0,\0} | C66: 0.0370964 | D66: 0.0377485 | E66: 0.0106319 | G66: of:=IF([.C66]=1;"";[.C66]) -> 0.0370964 | H66: of:=IF([.D66]=1;"";[.D66]) -> 0.0377485 | I66: of:=IF([.E66]=1;"";[.E66]) -> 0.0106319
A67: 26 | B67: strncat: &"shweq"{\0,\x01,\x01,\x01,\x01} &""{\0,p,c,y,\0} 4 :=> &"shweq"{\0,p,l,g,\0} | C67: 0.0280505 | D67: 1 | E67: 0.0280505 | G67: of:=IF([.C67]=1;"";[.C67]) -> 0.0280505 | H67: of:=IF([.D67]=1;"";[.D67]) ->  | I67: of:=IF([.E67]=1;"";[.E67]) -> 0.0280505
A68: 27 | B68: strncat: &"vyaed"{\0,\x01,\x01,\x01,\x01} &"z"{\0,p,a,\0} 4 :=> &"vyaedz"{\0,p,t,\0} | C68: 0.027361 | D68: 1 | E68: 0.0179959 | G68: of:=IF([.C68]=1;"";[.C68]) -> 0.027361 | H68: of:=IF([.D68]=1;"";[.D68]) ->  | I68: of:=IF([.E68]=1;"";[.E68]) -> 0.0179959
A69: 28 | B69: strncat: &"kwlft"{\0,\x01,\x01,\x01,\x01} &"hn"{\0,p,\0} 4 :=> &"kwlfthn"{\0,p,\0} | C69: 0.0261954 | D69: 0.206773 | E69: 0.0151224 | G69: of:=IF([.C69]=1;"";[.C69]) -> 0.0261954 | H69: of:=IF([.D69]=1;"";[.D69]) -> 0.206773 | I69: of:=IF([.E69]=1;"";[.E69]) -> 0.0151224
A70: 29 | B70: strncat: &"wscke"{\0,\x01,\x01,\x01,\x01} &"nna"{\0,\0} 4 :=> &"wsckenna"{\0,\0} | C70: 0.0293841 | D70: 0.0857478 | E70: 0.0136294 | G70: of:=IF([.C70]=1;"";[.C70]) -> 0.0293841 | H70: of:=IF([.D70]=1;"";[.D70]) -> 0.0857478 | I70: of:=IF([.E70]=1;"";[.E70]) -> 0.0136294
A71: 30 | B71: strncat: &"croxy"{\0,\x01,\x01,\x01,\x01} &"fgle"{\0} 4 :=> &"croxyfgle"{\0} | C71: 0.0265557 | D71: 0.0410929 | E71: 0.00944897 | G71: of:=IF([.C71]=1;"";[.C71]) -> 0.0265557 | H71: of:=IF([.D71]=1;"";[.D71]) -> 0.0410929 | I71: of:=IF([.E71]=1;"";[.E71]) -> 0.00944897
A72: 31 | B72: strncat: &"yognyh"{\0,\x01,\x01,\x01} &""{\0,p,y,y,\0} 4 :=> &"yognyh"{\0,p,o,\0} | C72: 0.0193166 | D72: 1 | E72: 0.0193166 | G72: of:=IF([.C72]=1;"";[.C72]) -> 0.0193166 | H72: of:=IF([.D72]=1;"";[.D72]) ->  | I72: of:=IF([.E72]=1;"";[.E72]) -> 0.0193166
A73: 32 | B73: strncat: &"iahyud"{\0,\x01,\x01,\x01} &"l"{\0,p,s,\0} 4 :=> &"iahyudl"{\0,p,\0} | C73: 0.0190521 | D73: 1 | E73: 0.0146921 | G73: of:=IF([.C73]=1;"";[.C73]) -> 0.0190521 | H73: of:=IF([.D73]=1;"";[.D73]) ->  | I73: of:=IF([.E73]=1;"";[.E73]) -> 0.0146921
A74: 33 | B74: strncat: &"glewae"{\0,\x01,\x01,\x01} &"ny"{\0,p,\0} 4 :=> &"glewaeny"{\0,\0} | C74: 0.0209058 | D74: 0.213806 | E74: 0.0134402 | G74: of:=IF([.C74]=1;"";[.C74]) -> 0.0209058 | H74: of:=IF([.D74]=1;"";[.D74]) -> 0.213806 | I74: of:=IF([.E74]=1;"";[.E74]) -> 0.0134402
A75: 34 | B75: strncat: &"govlrn"{\0,\x01,\x01,\x01} &"qir"{\0,\0} 4 :=> &"govlrnqir"{\0} | C75: 0.0187247 | D75: 0.0775255 | E75: 0.0095263 | G75: of:=IF([.C75]=1;"";[.C75]) -> 0.0187247 | H75: of:=IF([.D75]=1;"";[.D75]) -> 0.0775255 | I75: of:=IF([.E75]=1;"";[.E75]) -> 0.0095263
A76: 35 | B76: strncat: &"umiwpe"{\0,\x01,\x01,\x01} &&10 4 :=> &"umiwpenlic"{} | C76: 0.0185871 | D76: 0.00925862 | G76: of:=IF([.C76]=1;"";[.C76]) -> 0.0185871 | H76: of:=IF([.D76]=1;"";[.D76]) -> 0.00925862 | I76: of:=IF([.E76]=1;"";[.E76]) ->  
A77: 36 | B77: strncat: &"sclcidh"{\0,\x01,\x01} &""{\0,p,o,e,\0} 4 :=> &"sclcidh"{\0,p,\0} | C77: 0.0154686 | D77: 1 | E77: 0.0154686 | G77: of:=IF([.C77]=1;"";[.C77]) -> 0.0154686 | H77: of:=IF([.D77]=1;"";[.D77]) ->  | I77: of:=IF([.E77]=1;"";[.E77]) -> 0.0154686
A78: 37 | B78: strncat: &"cydwdal"{\0,\x01,\x01} &"y"{\0,p,f,\0} 4 :=> &"cydwdaly"{\0,\0} | C78: 0.0148866 | D78: 1 | E78: 0.0123387 | G78: of:=IF([.C78]=1;"";[.C78]) -> 0.0148866 | H78: of:=IF([.D78]=1;"";[.D78]) ->  | I78: of:=IF([.E78]=1;"";[.E78]) -> 0.0123387
A79: 38 | B79: strncat: &"beregja"{\0,\x01,\x01} &"uh"{\0,p,\0} 4 :=> &"beregjauh"{\0} | C79: 0.014616 | D79: 0.185503 | E79: 0.00974571 | G79: of:=IF([.C79]=1;"";[.C79]) -> 0.014616 | H79: of:=IF([.D79]=1;"";[.D79]) -> 0.185503 | I79: of:=IF([.E79]=1;"";[.E79]) -> 0.00974571
A80: 39 | B80: strncat: &"ceymjegb"{\0,\x01} &""{\0,p,o,t,\0} 4 :=> &"ceymjegb"{\0,\0} | C80: 0.0108541 | D80: 1 | E80: 0.0108541 | G80: of:=IF([.C80]=1;"";[.C80]) -> 0.0108541 | H80: of:=IF([.D80]=1;"";[.D80]) ->  | I80: of:=IF([.E80]=1;"";[.E80]) -> 0.0108541
A81: 40 | B81: strncat: &"eranlndf"{\0,\x01} &"l"{\0,p,p,\0} 4 :=> &"eranlndfl"{\0} | C81: 0.0131986 | D81: 1 | E81: 0.011067 | G81: of:=IF([.C81]=1;"";[.C81]) -> 0.0131986 | H81: of:=IF([.D81]=1;"";[.D81]) ->  | I81: of:=IF([.E81]=1;"";[.E81]) -> 0.011067
A82: 41 | B82: strncat: &"usvgtpiaa"{\0} &""{\0,p,b,i,\0} 4 :=> &"usvgtpiaa"{\0} | C82: 0.00914471 | D82: 1 | E82: 0.00914471 | G82: of:=IF([.C82]=1;"";[.C82]) -> 0.00914471 | H82: of:=IF([.D82]=1;"";[.D82]) ->  | I82: of:=IF([.E82]=1;"";[.E82]) -> 0.00914471

Sheet: strstr
A1: # | B1: Test Case | C1: N | G1: N1 | H1: N2 | I1: N3
A2: 1 | B2: strstr: &"m"{\0,h,f,r,\0} &"m"{\0,\0} :=> &"m"{\0,h,f,r,\0} | C2: 1 | D2: 1 | E2: 1 | G2: of:=IF([.C2]=1;"";[.C2]) ->  | H2: of:=IF([.D2]=1;"";[.D2]) ->  | I2: of:=IF([.E2]=1;"";[.E2]) ->  | K2: of:=AVERAGE([.G2:.G19]) -> 0.0771797176470588 | L2: of:=AVERAGE([.H2:.H19]) -> 0.195818 | M2: of:=AVERAGE([.I2:.I19]) -> 0.0976641375 | O2: of:=AVERAGE([.K2:.M2]) -> 0.123553951715686
A3: 2 | B3: strstr: &"fl"{\0,h,w,\0} &"f"{\0,\0} :=> &"fl"{\0,h,w,\0} | C3: 0.208818 | D3: 1 | E3: 0.208818 | G3: of:=IF([.C3]=1;"";[.C3]) -> 0.208818 | H3: of:=IF([.D3]=1;"";[.D3]) ->  | I3: of:=IF([.E3]=1;"";[.E3]) -> 0.208818
A4: 3 | B4: strstr: &"en"{\0,b,u,\0} &"n"{\0,\0} :=> &"n"{\0,b,u,\0,54} | C4: 0.224112 | D4: 1 | E4: 1 | G4: of:=IF([.C4]=1;"";[.C4]) -> 0.224112 | H4: of:=IF([.D4]=1;"";[.D4]) ->  | I4: of:=IF([.E4]=1;"";[.E4]) -> 
A5: 4 | B5: strstr: &"rvr"{\0,h,\0} &"r"{\0,\0} :=> &"rvr"{\0,h,\0} | C5: 0.0773003 | D5: 1 | E5: 0.0773003 | G5: of:=IF([.C5]=1;"";[.C5]) -> 0.0773003 | H5: of:=IF([.D5]=1;"";[.D5]) ->  | I5: of:=IF([.E5]=1;"";[.E5]) -> 0.0773003
A6: 5 | B6: strstr: &"nta"{\0,b,\0} &"t"{\0,\0} :=> &"ta"{\0,b,\0,54} | C6: 0.0896887 | D6: 1 | E6: 0.22025 | G6: of:=IF([.C6]=1;"";[.C6]) -> 0.0896887 | H6: of:=IF([.D6]=1;"";[.D6]) ->  | I6: of:=IF([.E6]=1;"";[.E6]) -> 0.22025
A7: 6 | B7: strstr: &"ywtb"{\0,\0} &"y"{\0,\0} :=> &"ywtb"{\0,\0} | C7: 0.0390739 | D7: 1 | E7: 0.0390739 | G7: of:=IF([.C7]=1;"";[.C7]) -> 0.0390739 | H7: of:=IF([.D7]=1;"";[.D7]) ->  | I7: of:=IF([.E7]=1;"";[.E7]) -> 0.0390739
A8: 7 | B8: strstr: &"wlgv"{\0,\0} &"l"{\0,\0} :=> &"lgv"{\0,\0,54} | C8: 0.0333672 | D8: 1 | E8: 0.0607637 | G8: of:=IF([.C8]=1;"";[.C8]) -> 0.0333672 | H8: of:=IF([.D8]=1;"";[.D8]) ->  | I8: of:=IF([.E8]=1;"";[.E8]) -> 0.0607637
A9: 8 | B9: strstr: &"hckdb"{\0} &"h"{\0,\0} :=> &"hckdb"{\0} | C9: 0.0238778 | D9: 1 | E9: 0.0238778 | G9: of:=IF([.C9]=1;"";[.C9]) -> 0.0238778 | H9: of:=IF([.D9]=1;"";[.D9]) ->  | I9: of:=IF([.E9]=1;"";[.E9]) -> 0.0238778
A10: 9 | B10: strstr: &"vevgr"{\0} &"e"{\0,\0} :=> &"evgr"{\0,54} | C10: 0.026671 | D10: 1 | E10: 0.0397639 | G10: of:=IF([.C10]=1;"";[.C10]) -> 0.026671 | H10: of:=IF([.D10]=1;"";[.D10]) ->  | I10: of:=IF([.E10]=1;"";[.E10]) -> 0.0397639
A11: 10 | B11: strstr: &"ed"{\0,d,v,\0} &"ed"{\0} :=> &"ed"{\0,d,v,\0} | C11: 0.223692 | D11: 0.223692 | E11: 0.223692 | G11: of:=IF([.C11]=1;"";[.C11]) -> 0.223692 | H11: of:=IF([.D11]=1;"";[.D11]) -> 0.223692 | I11: of:=IF([.E11]=1;"";[.E11]) -> 0.223692
A12: 11 | B12: strstr: &"rpk"{\0,d,\0} &"rp"{\0} :=> &"rpk"{\0,d,\0} | C12: 0.0746357 | D12: 0.208818 | E12: 0.0746357 | G12: of:=IF([.C12]=1;"";[.C12]) -> 0.0746357 | H12: of:=IF([.D12]=1;"";[.D12]) -> 0.208818 | I12: of:=IF([.E12]=1;"";[.E12]) -> 0.0746357
A13: 12 | B13: strstr: &"jjp"{\0,a,\0} &"jp"{\0} :=> &"jp"{\0,a,\0,54} | C13: 0.0420351 | D13: 0.131946 | E13: 0.131946 | G13: of:=IF([.C13]=1;"";[.C13]) -> 0.0420351 | H13: of:=IF([.D13]=1;"";[.D13]) -> 0.131946 | I13: of:=IF([.E13]=1;"";[.E13]) -> 0.131946
A14: 13 | B14: strstr: &"twi"{\0,p,\0} &"wi"{\0} :=> &"wi"{\0,p,\0,54} | C14: 0.0852504 | D14: 0.218466 | E14: 0.218466 | G14: of:=IF([.C14]=1;"";[.C14]) -> 0.0852504 | H14: of:=IF([.D14]=1;"";[.D14]) -> 0.218466 | I14: of:=IF([.E14]=1;"";[.E14]) -> 0.218466
A15: 14 | B15: strstr: &"nvof"{\0,\0} &"nv"{\0} :=> &"nvof"{\0,\0} | C15: 0.0458507 | D15: 0.209845 | E15: 0.0458507 | G15: of:=IF([.C15]=1;"";[.C15]) -> 0.0458507 | H15: of:=IF([.D15]=1;"";[.D15]) -> 0.209845 | I15: of:=IF([.E15]=1;"";[.E15]) -> 0.0458507
A16: 15 | B16: strstr: &"jjbf"{\0,\0} &"jb"{\0} :=> &"jbf"{\0,\0,54} | C16: 0.0213655 | D16: 0.131946 | E16: 0.0465971 | G16: of:=IF([.C16]=1;"";[.C16]) -> 0.0213655 | H16: of:=IF([.D16]=1;"";[.D16]) -> 0.131946 | I16: of:=IF([.E16]=1;"";[.E16]) -> 0.0465971
A17: 16 | B17: strstr: &"wnos"{\0,\0} &"no"{\0} :=> &"nos"{\0,\0,54} | C17: 0.0466297 | D17: 0.218466 | E17: 0.0874113 | G17: of:=IF([.C17]=1;"";[.C17]) -> 0.0466297 | H17: of:=IF([.D17]=1;"";[.D17]) -> 0.218466 | I17: of:=IF([.E17]=1;"";[.E17]) -> 0.0874113
A18: 17 | B18: strstr: &"gaiuo"{\0} &"ga"{\0} :=> &"gaiuo"{\0} | C18: 0.0279099 | D18: 0.215236 | E18: 0.0279099 | G18: of:=IF([.C18]=1;"";[.C18]) -> 0.0279099 | H18: of:=IF([.D18]=1;"";[.D18]) -> 0.215236 | I18: of:=IF([.E18]=1;"";[.E18]) -> 0.0279099
A19: 18 | B19: strstr: &"uufhu"{\0} &"uf"{\0} :=> &"ufhu"{\0,54} | C19: 0.0217773 | D19: 0.203947 | E19: 0.0362699 | G19: of:=IF([.C19]=1;"";[.C19]) -> 0.0217773 | H19: of:=IF([.D19]=1;"";[.D19]) -> 0.203947 | I19: of:=IF([.E19]=1;"";[.E19]) -> 0.0362699
A20: 19 | B20: strstr: &"zmyxf"{\0} &"my"{\0} :=> &"myxf"{\0,54} | C20: 0.0210516 | D20: 0.207461 | E20: 0.034278 | G20: of:=IF([.C20]=1;"";[.C20]) -> 0.0210516 | H20: of:=IF([.D20]=1;"";[.D20]) -> 0.207461 | I20: of:=IF([.E20]=1;"";[.E20]) -> 0.034278 | K20: of:=AVERAGE([.G20:.G24]) -> 0.02508484 | L20: of:=AVERAGE([.H20:.H24]) -> 0.187674 | M20: of:=AVERAGE([.I20:.I24]) -> 0.0308451 | O20: of:=AVERAGE([.K20:.M20]) -> 0.0812013133333333
A21: 1 | B21: strnstr: &"oixve"{\0} &""{\0,p,\0} 2 :=> &"oixve"{\0} | C21: 0.0257362 | D21: 1 | E21: 0.0257362 | G21: of:=IF([.C21]=1;"";[.C21]) -> 0.0257362 | H21: of:=IF([.D21]=1;"";[.D21]) ->  | I21: of:=IF([.E21]=1;"";[.E21]) -> 0.0257362
A22: 2 | B22: strnstr: &"ivyea"{\0} &"i"{\0,\0} 2 :=> &"ivyea"{\0} | C22: 0.0290339 | D22: 1 | E22: 0.0290339 | G22: of:=IF([.C22]=1;"";[.C22]) -> 0.0290339 | H22: of:=IF([.D22]=1;"";[.D22]) ->  | I22: of:=IF([.E22]=1;"";[.E22]) -> 0.0290339
A23: 3 | B23: strnstr: &"colro"{\0} &"o"{\0,\0} 2 :=> &"olro"{\0,54} | C23: 0.0298751 | D23: 1 | E23: 0.04545 | G23: of:=IF([.C23]=1;"";[.C23]) -> 0.0298751 | H23: of:=IF([.D23]=1;"";[.D23]) ->  | I23: of:=IF([.E23]=1;"";[.E23]) -> 0.04545
A24: 4 | B24: strnstr: &"ljbil"{\0} &"lj"{\0} 2 :=> &"ljbil"{\0} | C24: 0.0197274 | D24: 0.167887 | E24: 0.0197274 | G24: of:=IF([.C24]=1;"";[.C24]) -> 0.0197274 | H24: of:=IF([.D24]=1;"";[.D24]) -> 0.167887 | I24: of:=IF([.E24]=1;"";[.E24]) -> 0.0197274
A25: 1 | B25: strpbrk: &"gurkw"{\0} &"aeiou"{\0} :=> &"urkw"{\0,54} | C25: 0.0279008 | D25: 0.0299288 | E25: 0.0433055 | G25: of:=IF([.C25]=1;"";[.C25]) -> 0.0279008 | H25: of:=IF([.D25]=1;"";[.D25]) -> 0.0299288 | I25: of:=IF([.E25]=1;"";[.E25]) -> 0.0433055 | K25: of:=AVERAGE([.G25:.G34]) -> 0.02733282 | L25: of:=AVERAGE([.H25:.H34]) -> 0.0299288 | M25: of:=AVERAGE([.I25:.I34]) -> 0.03508111 | O25: of:=AVERAGE([.K25:.M25]) -> 0.03078091
A26: 2 | B26: strpbrk: &"douea"{\0} &"aeiou"{\0} :=> &"ouea"{\0,54} | C26: 0.0308312 | D26: 0.0299288 | E26: 0.0480706 | G26: of:=IF([.C26]=1;"";[.C26]) -> 0.0308312 | H26: of:=IF([.D26]=1;"";[.D26]) -> 0.0299288 | I26: of:=IF([.E26]=1;"";[.E26]) -> 0.0480706
A27: 3 | B27: strpbrk: &"micdv"{\0} &"aeiou"{\0} :=> &"icdv"{\0,54} | C27: 0.0269577 | D27: 0.0299288 | E27: 0.0407512 | G27: of:=IF([.C27]=1;"";[.C27]) -> 0.0269577 | H27: of:=IF([.D27]=1;"";[.D27]) -> 0.0299288 | I27: of:=IF([.E27]=1;"";[.E27]) -> 0.0407512
A28: 4 | B28: strpbrk: &"yexwf"{\0} &"aeiou"{\0} :=> &"exwf"{\0,54} | C28: 0.0250267 | D28: 0.0299288 | E28: 0.0376873 | G28: of:=IF([.C28]=1;"";[.C28]) -> 0.0250267 | H28: of:=IF([.D28]=1;"";[.D28]) -> 0.0299288 | I28: of:=IF([.E28]=1;"";[.E28]) -> 0.0376873
A29: 5 | B29: strpbrk: &"yalam"{\0} &"aeiou"{\0} :=> &"alam"{\0,54} | C29: 0.0301067 | D29: 0.0299288 | E29: 0.0484914 | G29: of:=IF([.C29]=1;"";[.C29]) -> 0.0301067 | H29: of:=IF([.D29]=1;"";[.D29]) -> 0.0299288 | I29: of:=IF([.E29]=1;"";[.E29]) -> 0.0484914
A30: 6 | B30: strpbrk: &"ukavh"{\0} &"aeiou"{\0} :=> &"ukavh"{\0} | C30: 0.0204722 | D30: 0.0299288 | E30: 0.0204722 | G30: of:=IF([.C30]=1;"";[.C30]) -> 0.0204722 | H30: of:=IF([.D30]=1;"";[.D30]) -> 0.0299288 | I30: of:=IF([.E30]=1;"";[.E30]) -> 0.0204722
A31: 7 | B31: strpbrk: &"oacic"{\0} &"aeiou"{\0} :=> &"oacic"{\0} | C31: 0.0304184 | D31: 0.0299288 | E31: 0.0304184 | G31: of:=IF([.C31]=1;"";[.C31]) -> 0.0304184 | H31: of:=IF([.D31]=1;"";[.D31]) -> 0.0299288 | I31: of:=IF([.E31]=1;"";[.E31]) -> 0.0304184
A32: 8 | B32: strpbrk: &"ivntg"{\0} &"aeiou"{\0} :=> &"ivntg"{\0} | C32: 0.0259509 | D32: 0.0299288 | E32: 0.0259509 | G32: of:=IF([.C32]=1;"";[.C32]) -> 0.0259509 | H32: of:=IF([.D32]=1;"";[.D32]) -> 0.0299288 | I32: of:=IF([.E32]=1;"";[.E32]) -> 0.0259509
A33: 9 | B33: strpbrk: &"eopks"{\0} &"aeiou"{\0} :=> &"eopks"{\0} | C33: 0.0270449 | D33: 0.0299288 | E33: 0.0270449 | G33: of:=IF([.C33]=1;"";[.C33]) -> 0.0270449 | H33: of:=IF([.D33]=1;"";[.D33]) -> 0.0299288 | I33: of:=IF([.E33]=1;"";[.E33]) -> 0.0270449
A34: 10 | B34: strpbrk: &"auood"{\0} &"aeiou"{\0} :=> &"auood"{\0} | C34: 0.0286187 | D34: 0.0299288 | E34: 0.0286187 | G34: of:=IF([.C34]=1;"";[.C34]) -> 0.0286187 | H34: of:=IF([.D34]=1;"";[.D34]) -> 0.0299288 | I34: of:=IF([.E34]=1;"";[.E34]) -> 0.0286187