Sheet: strlen
A1: strlen: &"\x01"{\0,\0,\0,\0,\0} :=> 1; | J1: # | K1: Test Case | L1: N | P1: FINAL
A2: strlen: &"\x01\x01"{\0,\0,\0,\0} :=> 2; | J2: 1 | K2: strlen: &"i"{\0,p,w,a,\0} :=> 1 | L2: 1 | N2: of:=IF([.L2]=1;"";[.L2]) ->  | P2: of:=AVERAGE([.N2:.N6]) -> 0.0908433
A3: strlen: &"\x01\x01\x01"{\0,\0,\0} :=> 3; | J3: 2 | K3: strlen: &"je"{\0,p,i,\0} :=> 2 | L3: 0.205048 | N3: of:=IF([.L3]=1;"";[.L3]) -> 0.205048
A4: strlen: &"\x01\x01\x01\x01"{\0,\0} :=> 4; | J4: 3 | K4: strlen: &"ivi"{\0,p,\0} :=> 3 | L4: 0.0869711 | N4: of:=IF([.L4]=1;"";[.L4]) -> 0.0869711
A5: strlen: &"\x01\x01\x01\x01\x01"{\0} :=> 5; | J5: 4 | K5: strlen: &"wkei"{\0,\0} :=> 4 | L5: 0.0430247 | N5: of:=IF([.L5]=1;"";[.L5]) -> 0.0430247
A6: strnlen: &""{\0,\0,\0,\0,\0,\0} 6 :=> 0; 1; | J6: 5 | K6: strlen: &"uihis"{\0} :=> 5 | L6: 0.0283294 | N6: of:=IF([.L6]=1;"";[.L6]) -> 0.0283294
A7: strnlen: &"\x01"{\0,\0,\0,\0,\0} 6 :=> 1; | J7: 1 | K7: strnlen: &""{\0,p,i,e,n,\0} 6 :=> 0 | L7: 1 | N7: of:=IF([.L7]=1;"";[.L7]) ->  | P7: of:=AVERAGE([.N7:.N12]) -> 0.08963915
A8: strnlen: &"\x01\x01"{\0,\0,\0,\0} 6 :=> 2; | J8: 2 | K8: strnlen: &"f"{\0,p,m,n,\0} 6 :=> 1 | L8: 1 | N8: of:=IF([.L8]=1;"";[.L8]) -> 
A9: strnlen: &"\x01\x01\x01"{\0,\0,\0} 6 :=> 3; | J9: 3 | K9: strnlen: &"gu"{\0,p,w,\0} 6 :=> 2 | L9: 0.211356 | N9: of:=IF([.L9]=1;"";[.L9]) -> 0.211356
A10: strnlen: &"\x01\x01\x01\x01"{\0,\0} 6 :=> 4; | J10: 4 | K10: strnlen: &"mdg"{\0,p,\0} 6 :=> 3 | L10: 0.0722473 | N10: of:=IF([.L10]=1;"";[.L10]) -> 0.0722473
A11: strnlen: &"\x01\x01\x01\x01\x01"{\0} 6 :=> 5; | J11: 5 | K11: strnlen: &"saio"{\0,\0} 6 :=> 4 | L11: 0.0483109 | N11: of:=IF([.L11]=1;"";[.L11]) -> 0.0483109
J12: 6 | K12: strnlen: &"ynhmu"{\0} 6 :=> 5 | L12: 0.0266424 | N12: of:=IF([.L12]=1;"";[.L12]) -> 0.0266424

Sheet: strcmp
A1: # | B1: Test Case | C1: N1 | D1: N2 | L1: FINAL
A2: 1 | B2: strcmp: &"p"{\0,p,o,k,\0} &"p"{\0,p,n,j,\0} :=> 0 | C2: 1 | D2: 1 | F2: of:=IF([.C2]=1;"";[.C2]) ->  | G2: of:=IF([.D2]=1;"";[.D2]) ->  | H2: of:=IF([.E2]=1;"";[.E2]) ->   | I2: of:=AVERAGE([.F2:.F16]) -> 0.0444622357142857 | J2: of:=AVERAGE([.G2:.G16]) -> 0.0437634714285714 | L2: of:=AVERAGE([.I2:.J2]) -> 0.0441128535714286
A3: 2 | B3: strcmp: &"ml"{\0,p,d,\0} &"ml"{\0,p,y,\0} :=> 0 | C3: 0.191943 | D3: 0.191943 | F3: of:=IF([.C3]=1;"";[.C3]) -> 0.191943 | G3: of:=IF([.D3]=1;"";[.D3]) -> 0.191943 | H3: of:=IF([.E3]=1;"";[.E3]) ->  
A4: 3 | B4: strcmp: &"oso"{\0,p,\0} &"oso"{\0,p,\0} :=> 0 | C4: 0.0872664 | D4: 0.0872664 | F4: of:=IF([.C4]=1;"";[.C4]) -> 0.0872664 | G4: of:=IF([.D4]=1;"";[.D4]) -> 0.0872664 | H4: of:=IF([.E4]=1;"";[.E4]) ->  
A5: 4 | B5: strcmp: &"btia"{\0,\0} &"btia"{\0,\0} :=> 0 | C5: 0.0455481 | D5: 0.0455481 | F5: of:=IF([.C5]=1;"";[.C5]) -> 0.0455481 | G5: of:=IF([.D5]=1;"";[.D5]) -> 0.0455481 | H5: of:=IF([.E5]=1;"";[.E5]) ->  
A6: 5 | B6: strcmp: &"tarep"{\0} &"tarep"{\0} :=> 0 | C6: 0.0317625 | D6: 0.0317625 | F6: of:=IF([.C6]=1;"";[.C6]) -> 0.0317625 | G6: of:=IF([.D6]=1;"";[.D6]) -> 0.0317625 | H6: of:=IF([.E6]=1;"";[.E6]) ->  
A7: 6 | B7: strcmp: &"xyahv"{\0} &"xyahd"{\0} :=> 1 | C7: 0.0228265 | D7: 0.0242188 | F7: of:=IF([.C7]=1;"";[.C7]) -> 0.0228265 | G7: of:=IF([.D7]=1;"";[.D7]) -> 0.0242188 | H7: of:=IF([.E7]=1;"";[.E7]) ->  
A8: 7 | B8: strcmp: &"layum"{\0} &"layun"{\0} :=> -1 | C8: 0.0280365 | D8: 0.0284208 | F8: of:=IF([.C8]=1;"";[.C8]) -> 0.0280365 | G8: of:=IF([.D8]=1;"";[.D8]) -> 0.0284208 | H8: of:=IF([.E8]=1;"";[.E8]) ->  
A9: 8 | B9: strcmp: &"blmyr"{\0} &"blmua"{\0} :=> 1 | C9: 0.0276455 | D9: 0.0287683 | F9: of:=IF([.C9]=1;"";[.C9]) -> 0.0276455 | G9: of:=IF([.D9]=1;"";[.D9]) -> 0.0287683 | H9: of:=IF([.E9]=1;"";[.E9]) ->  
A10: 9 | B10: strcmp: &"hcidd"{\0} &"hciqa"{\0} :=> -1 | C10: 0.0274312 | D10: 0.0219962 | F10: of:=IF([.C10]=1;"";[.C10]) -> 0.0274312 | G10: of:=IF([.D10]=1;"";[.D10]) -> 0.0219962 | H10: of:=IF([.E10]=1;"";[.E10]) ->  
A11: 10 | B11: strcmp: &"screu"{\0} &"scgfc"{\0} :=> 1 | C11: 0.0295653 | D11: 0.0161383 | F11: of:=IF([.C11]=1;"";[.C11]) -> 0.0295653 | G11: of:=IF([.D11]=1;"";[.D11]) -> 0.0161383 | H11: of:=IF([.E11]=1;"";[.E11]) ->  
A12: 11 | B12: strcmp: &"ffyuj"{\0} &"ffzup"{\0} :=> -1 | C12: 0.0239813 | D12: 0.0223522 | F12: of:=IF([.C12]=1;"";[.C12]) -> 0.0239813 | G12: of:=IF([.D12]=1;"";[.D12]) -> 0.0223522
A13: 12 | B13: strcmp: &"knpsu"{\0} &"keuav"{\0} :=> 1 | C13: 0.0274184 | D13: 0.0290464 | F13: of:=IF([.C13]=1;"";[.C13]) -> 0.0274184 | G13: of:=IF([.D13]=1;"";[.D13]) -> 0.0290464
A14: 13 | B14: strcmp: &"ajlla"{\0} &"alabt"{\0} :=> -1 | C14: 0.0237968 | D14: 0.0296516 | F14: of:=IF([.C14]=1;"";[.C14]) -> 0.0237968 | G14: of:=IF([.D14]=1;"";[.D14]) -> 0.0296516
A15: 14 | B15: strcmp: &"prckh"{\0} &"ftrnr"{\0} :=> 1 | C15: 0.0284339 | D15: 0.028677 | F15: of:=IF([.C15]=1;"";[.C15]) -> 0.0284339 | G15: of:=IF([.D15]=1;"";[.D15]) -> 0.028677
A16: 15 | B16: strcmp: &"hesju"{\0} &"vvoni"{\0} :=> -1 | C16: 0.0268159 | D16: 0.026899 | F16: of:=IF([.C16]=1;"";[.C16]) -> 0.0268159 | G16: of:=IF([.D16]=1;"";[.D16]) -> 0.026899
A17: 1 | B17: strncmp: &""{\0,p,l,o,v,\0} &""{\0,p,t,u,w,\0} 5 :=> 0 | C17: 1 | D17: 1 | F17: of:=IF([.C17]=1;"";[.C17]) ->  | G17: of:=IF([.D17]=1;"";[.D17]) ->  | I17: of:=AVERAGE([.F17:.F32]) -> 0.0422263928571429 | J17: of:=AVERAGE([.G17:.G32]) -> 0.0400194285714286 | L17: of:=AVERAGE([.I17:.J17]) -> 0.0411229107142857
A18: 2 | B18: strncmp: &"d"{\0,p,i,s,\0} &"d"{\0,p,l,s,\0} 5 :=> 0 | C18: 1 | D18: 1 | F18: of:=IF([.C18]=1;"";[.C18]) ->  | G18: of:=IF([.D18]=1;"";[.D18]) -> 
A19: 3 | B19: strncmp: &"bn"{\0,p,b,\0} &"bn"{\0,p,y,\0} 5 :=> 0 | C19: 0.180192 | D19: 0.180192 | F19: of:=IF([.C19]=1;"";[.C19]) -> 0.180192 | G19: of:=IF([.D19]=1;"";[.D19]) -> 0.180192
A20: 4 | B20: strncmp: &"hyi"{\0,p,\0} &"hyi"{\0,p,\0} 5 :=> 0 | C20: 0.0803736 | D20: 0.0803736 | F20: of:=IF([.C20]=1;"";[.C20]) -> 0.0803736 | G20: of:=IF([.D20]=1;"";[.D20]) -> 0.0803736
A21: 5 | B21: strncmp: &"qusa"{\0,\0} &"qusa"{\0,\0} 5 :=> 0 | C21: 0.0470323 | D21: 0.0470323 | F21: of:=IF([.C21]=1;"";[.C21]) -> 0.0470323 | G21: of:=IF([.D21]=1;"";[.D21]) -> 0.0470323
A22: 6 | B22: strncmp: &"egiog"{\0} &"egiog"{\0} 5 :=> 0 | C22: 0.0297158 | D22: 0.0297158 | F22: of:=IF([.C22]=1;"";[.C22]) -> 0.0297158 | G22: of:=IF([.D22]=1;"";[.D22]) -> 0.0297158
A23: 7 | B23: strncmp: &"qioay"{\0} &"qioam"{\0} 5 :=> 1 | C23: 0.0279563 | D23: 0.0279229 | F23: of:=IF([.C23]=1;"";[.C23]) -> 0.0279563 | G23: of:=IF([.D23]=1;"";[.D23]) -> 0.0279229
A24: 8 | B24: strncmp: &"ekfxp"{\0} &"ekfxw"{\0} 5 :=> -1 | C24: 0.0198321 | D24: 0.0184064 | F24: of:=IF([.C24]=1;"";[.C24]) -> 0.0198321 | G24: of:=IF([.D24]=1;"";[.D24]) -> 0.0184064
A25: 9 | B25: strncmp: &"tvoao"{\0} &"tvoPp"{\0} 5 :=> 1 | C25: 0.0254601 | D25: 0 | F25: of:=IF([.C25]=1;"";[.C25]) -> 0.0254601 | G25: of:=IF([.D25]=1;"";[.D25]) -> 0
A26: 10 | B26: strncmp: &"jswyp"{\0} &"jswzo"{\0} 5 :=> -1 | C26: 0.0211976 | D26: 0.0173476 | F26: of:=IF([.C26]=1;"";[.C26]) -> 0.0211976 | G26: of:=IF([.D26]=1;"";[.D26]) -> 0.0173476
A27: 11 | B27: strncmp: &"cfywa"{\0} &"cfkap"{\0} 5 :=> 1 | C27: 0.0225864 | D27: 0.0215299 | F27: of:=IF([.C27]=1;"";[.C27]) -> 0.0225864 | G27: of:=IF([.D27]=1;"";[.D27]) -> 0.0215299
A28: 12 | B28: strncmp: &"qigpt"{\0} &"qinlr"{\0} 5 :=> -1 | C28: 0.0245691 | D28: 0.0268497 | F28: of:=IF([.C28]=1;"";[.C28]) -> 0.0245691 | G28: of:=IF([.D28]=1;"";[.D28]) -> 0.0268497
A29: 13 | B29: strncmp: &"kbnws"{\0} &"kalts"{\0} 5 :=> 1 | C29: 0.0235003 | D29: 0.0296515 | F29: of:=IF([.C29]=1;"";[.C29]) -> 0.0235003 | G29: of:=IF([.D29]=1;"";[.D29]) -> 0.0296515
A30: 14 | B30: strncmp: &"denwn"{\0} &"dqusi"{\0} 5 :=> -1 | C30: 0.0294325 | D30: 0.0282551 | F30: of:=IF([.C30]=1;"";[.C30]) -> 0.0294325 | G30: of:=IF([.D30]=1;"";[.D30]) -> 0.0282551
A31: 15 | B31: strncmp: &"isatp"{\0} &"giyvo"{\0} 5 :=> 1 | C31: 0.0295559 | D31: 0.0245806 | F31: of:=IF([.C31]=1;"";[.C31]) -> 0.0295559 | G31: of:=IF([.D31]=1;"";[.D31]) -> 0.0245806
A32: 16 | B32: strncmp: &"oilup"{\0} &"zldig"{\0} 5 :=> -1 | C32: 0.0297655 | D32: 0.0284146 | F32: of:=IF([.C32]=1;"";[.C32]) -> 0.0297655 | G32: of:=IF([.D32]=1;"";[.D32]) -> 0.0284146
A33: 1 | B33: sysfs_streq: &""{\0,p,s,o,h,\0} &"quobo"{\0} :=> \0 | C33: 1 | D33: 0.0282153 | F33: of:=IF([.C33]=1;"";[.C33]) ->  | G33: of:=IF([.D33]=1;"";[.D33]) -> 0.0282153 | I33: of:=AVERAGE([.F33:.F71]) -> 0.0687026724137931 | J33: of:=AVERAGE([.G33:.G71]) -> 0.0456909357142857 | L33: of:=AVERAGE([.I33:.J33]) -> 0.0571968040640394
A34: 2 | B34: sysfs_streq: &""{\0,p,s,k,e,\0} &"\n"{\0,b,j,d,\0} :=> \x01 | C34: 1 | F34: of:=IF([.C34]=1;"";[.C34]) ->  | G34: of:=IF([.D34]=1;"";[.D34]) ->  
A35: 3 | B35: sysfs_streq: &""{\0,p,t,c,t,\0} &"\naylr"{\0} :=> \0 | C35: 1 | F35: of:=IF([.C35]=1;"";[.C35]) ->  | G35: of:=IF([.D35]=1;"";[.D35]) ->  
A36: 4 | B36: sysfs_streq: &""{\0,p,y,r,e,\0} &""{\0,h,a,s,o,\0} :=> \x01 | C36: 1 | D36: 1 | F36: of:=IF([.C36]=1;"";[.C36]) ->  | G36: of:=IF([.D36]=1;"";[.D36]) -> 
A37: 5 | B37: sysfs_streq: &"otdea"{\0} &"eaphe"{\0} :=> \0 | C37: 0.0292637 | D37: 0.0308967 | F37: of:=IF([.C37]=1;"";[.C37]) -> 0.0292637 | G37: of:=IF([.D37]=1;"";[.D37]) -> 0.0308967
A38: 6 | B38: sysfs_streq: &"\n"{\0,p,h,e,\0} &""{\0,a,o,k,k,\0} :=> \x01 | C38: 1 | F38: of:=IF([.C38]=1;"";[.C38]) ->  | G38: of:=IF([.D38]=1;"";[.D38]) ->  
A39: 7 | B39: sysfs_streq: &"\n"{\0,a,g,i,\0} &"wuixb"{\0} :=> \0 | C39: 0.0216432 | F39: of:=IF([.C39]=1;"";[.C39]) -> 0.0216432 | G39: of:=IF([.D39]=1;"";[.D39]) ->  
A40: 8 | B40: sysfs_streq: &"\namib"{\0} &"omunh"{\0} :=> \0 | C40: 0.0293105 | F40: of:=IF([.C40]=1;"";[.C40]) -> 0.0293105 | G40: of:=IF([.D40]=1;"";[.D40]) ->  
A41: 9 | B41: sysfs_streq: &"c"{\0,p,p,f,\0} &"chfmo"{\0} :=> \0 | C41: 1 | D41: 0.0258899 | F41: of:=IF([.C41]=1;"";[.C41]) ->  | G41: of:=IF([.D41]=1;"";[.D41]) -> 0.0258899
A42: 10 | B42: sysfs_streq: &"m"{\0,p,l,t,\0} &"m\n"{\0,a,h,\0} :=> \x01 | C42: 1 | F42: of:=IF([.C42]=1;"";[.C42]) ->  | G42: of:=IF([.D42]=1;"";[.D42]) ->  
A43: 11 | B43: sysfs_streq: &"x"{\0,p,e,x,\0} &"x\naba"{\0} :=> \0 | C43: 1 | F43: of:=IF([.C43]=1;"";[.C43]) ->  | G43: of:=IF([.D43]=1;"";[.D43]) ->  
A44: 12 | B44: sysfs_streq: &"i"{\0,p,j,n,\0} &"i"{\0,h,s,c,\0} :=> \x01 | C44: 1 | D44: 1 | F44: of:=IF([.C44]=1;"";[.C44]) ->  | G44: of:=IF([.D44]=1;"";[.D44]) -> 
A45: 13 | B45: sysfs_streq: &"dvsao"{\0} &"dnnci"{\0} :=> \0 | C45: 0.0255396 | D45: 0.0291539 | F45: of:=IF([.C45]=1;"";[.C45]) -> 0.0255396 | G45: of:=IF([.D45]=1;"";[.D45]) -> 0.0291539
A46: 14 | B46: sysfs_streq: &"p\n"{\0,b,j,\0} &"p"{\0,b,j,y,\0} :=> \x01 | C46: 1 | F46: of:=IF([.C46]=1;"";[.C46]) ->  | G46: of:=IF([.D46]=1;"";[.D46]) ->  
A47: 15 | B47: sysfs_streq: &"e\n"{\0,b,b,\0} &"ehaat"{\0} :=> \0 | C47: 0.0285191 | F47: of:=IF([.C47]=1;"";[.C47]) -> 0.0285191 | G47: of:=IF([.D47]=1;"";[.D47]) ->  
A48: 16 | B48: sysfs_streq: &"g\nafe"{\0} &"gergl"{\0} :=> \0 | C48: 0.0302925 | F48: of:=IF([.C48]=1;"";[.C48]) -> 0.0302925 | G48: of:=IF([.D48]=1;"";[.D48]) ->  
A49: 17 | B49: sysfs_streq: &"zq"{\0,p,j,\0} &"zqtkg"{\0} :=> \0 | C49: 0.155927 | D49: 0.0162551 | F49: of:=IF([.C49]=1;"";[.C49]) -> 0.155927 | G49: of:=IF([.D49]=1;"";[.D49]) -> 0.0162551
A50: 18 | B50: sysfs_streq: &"cu"{\0,p,w,\0} &"cu\n"{\0,a,\0} :=> \x01 | C50: 0.214286 | F50: of:=IF([.C50]=1;"";[.C50]) -> 0.214286 | G50: of:=IF([.D50]=1;"";[.D50]) ->  
A51: 19 | B51: sysfs_streq: &"ds"{\0,p,m,\0} &"ds\nat"{\0} :=> \0 | C51: 0.213322 | F51: of:=IF([.C51]=1;"";[.C51]) -> 0.213322 | G51: of:=IF([.D51]=1;"";[.D51]) ->  
A52: 20 | B52: sysfs_streq: &"xa"{\0,p,o,\0} &"xa"{\0,b,h,\0} :=> \x01 | C52: 0.203502 | D52: 0.203502 | F52: of:=IF([.C52]=1;"";[.C52]) -> 0.203502 | G52: of:=IF([.D52]=1;"";[.D52]) -> 0.203502
A53: 21 | B53: sysfs_streq: &"panvy"{\0} &"pagsk"{\0} :=> \0 | C53: 0.02903 | D53: 0.0292616 | F53: of:=IF([.C53]=1;"";[.C53]) -> 0.02903 | G53: of:=IF([.D53]=1;"";[.D53]) -> 0.0292616
A54: 22 | B54: sysfs_streq: &"ky\n"{\0,b,\0} &"ky"{\0,b,d,\0} :=> \x01 | C54: 0.201172 | F54: of:=IF([.C54]=1;"";[.C54]) -> 0.201172 | G54: of:=IF([.D54]=1;"";[.D54]) ->  
A55: 23 | B55: sysfs_streq: &"xu\n"{\0,b,\0} &"xujyj"{\0} :=> \0 | C55: 0.0158991 | F55: of:=IF([.C55]=1;"";[.C55]) -> 0.0158991 | G55: of:=IF([.D55]=1;"";[.D55]) ->  
A56: 24 | B56: sysfs_streq: &"ee\nai"{\0} &"eeyrt"{\0} :=> \0 | C56: 0.029429 | F56: of:=IF([.C56]=1;"";[.C56]) -> 0.029429 | G56: of:=IF([.D56]=1;"";[.D56]) ->  
A57: 25 | B57: sysfs_streq: &"nyo"{\0,p,\0} &"nyohn"{\0} :=> \0 | C57: 0.0839512 | D57: 0.0280117 | F57: of:=IF([.C57]=1;"";[.C57]) -> 0.0839512 | G57: of:=IF([.D57]=1;"";[.D57]) -> 0.0280117
A58: 26 | B58: sysfs_streq: &"tdo"{\0,p,\0} &"tdo\n"{\0,\0} :=> \x01 | C58: 0.0783763 | F58: of:=IF([.C58]=1;"";[.C58]) -> 0.0783763 | G58: of:=IF([.D58]=1;"";[.D58]) ->  
A59: 27 | B59: sysfs_streq: &"tiv"{\0,p,\0} &"tiv\na"{\0} :=> \0 | C59: 0.0886448 | F59: of:=IF([.C59]=1;"";[.C59]) -> 0.0886448 | G59: of:=IF([.D59]=1;"";[.D59]) ->  
A60: 28 | B60: sysfs_streq: &"ons"{\0,p,\0} &"ons"{\0,h,\0} :=> \x01 | C60: 0.0902181 | D60: 0.0902181 | F60: of:=IF([.C60]=1;"";[.C60]) -> 0.0902181 | G60: of:=IF([.D60]=1;"";[.D60]) -> 0.0902181
A61: 29 | B61: sysfs_streq: &"rsokl"{\0} &"rsosa"{\0} :=> \0 | C61: 0.0292718 | D61: 0.0309379 | F61: of:=IF([.C61]=1;"";[.C61]) -> 0.0292718 | G61: of:=IF([.D61]=1;"";[.D61]) -> 0.0309379
A62: 30 | B62: sysfs_streq: &"ywl\n"{\0,\0} &"ywl"{\0,a,\0} :=> \x01 | C62: 0.0759174 | F62: of:=IF([.C62]=1;"";[.C62]) -> 0.0759174 | G62: of:=IF([.D62]=1;"";[.D62]) ->  
A63: 31 | B63: sysfs_streq: &"kwd\n"{\0,\0} &"kwdsw"{\0} :=> \0 | C63: 0.0255064 | F63: of:=IF([.C63]=1;"";[.C63]) -> 0.0255064 | G63: of:=IF([.D63]=1;"";[.D63]) ->  
A64: 32 | B64: sysfs_streq: &"war\na"{\0} &"warup"{\0} :=> \0 | C64: 0.0305619 | F64: of:=IF([.C64]=1;"";[.C64]) -> 0.0305619 | G64: of:=IF([.D64]=1;"";[.D64]) ->  
A65: 33 | B65: sysfs_streq: &"ytit"{\0,\0} &"ytitt"{\0} :=> \0 | C65: 0.0465861 | D65: 0.0300133 | F65: of:=IF([.C65]=1;"";[.C65]) -> 0.0465861 | G65: of:=IF([.D65]=1;"";[.D65]) -> 0.0300133
A66: 34 | B66: sysfs_streq: &"iame"{\0,\0} &"iame\n"{\0} :=> \x01 | C66: 0.0479101 | F66: of:=IF([.C66]=1;"";[.C66]) -> 0.0479101 | G66: of:=IF([.D66]=1;"";[.D66]) ->  
A67: 35 | B67: sysfs_streq: &"yulw"{\0,\0} &"yulw"{\0,\0} :=> \x01 | C67: 0.0405241 | D67: 0.0405241 | F67: of:=IF([.C67]=1;"";[.C67]) -> 0.0405241 | G67: of:=IF([.D67]=1;"";[.D67]) -> 0.0405241
A68: 36 | B68: sysfs_streq: &"gsiws"{\0} &"gsiwl"{\0} :=> \0 | C68: 0.0271419 | D68: 0.0266723 | F68: of:=IF([.C68]=1;"";[.C68]) -> 0.0271419 | G68: of:=IF([.D68]=1;"";[.D68]) -> 0.0266723
A69: 37 | B69: sysfs_streq: &"oalo\n"{\0} &"oalo"{\0,\0} :=> \x01 | C69: 0.0471683 | F69: of:=IF([.C69]=1;"";[.C69]) -> 0.0471683 | G69: of:=IF([.D69]=1;"";[.D69]) ->  
A70: 38 | B70: sysfs_streq: &"ztyb\n"{\0} &"ztybw"{\0} :=> \0 | C70: 0.0233422 | F70: of:=IF([.C70]=1;"";[.C70]) -> 0.0233422 | G70: of:=IF([.D70]=1;"";[.D70]) ->  
A71: 39 | B71: sysfs_streq: &"dshra"{\0} &"dshra"{\0} :=> \x01 | C71: 0.0301212 | D71: 0.0301212 | F71: of:=IF([.C71]=1;"";[.C71]) -> 0.0301212 | G71: of:=IF([.D71]=1;"";[.D71]) -> 0.0301212

Sheet: strcpy
A1: # | B1: Test Case | C1: N1 | D1: N2 | E1: N3 | O1: FINAL
A2: 1 | B2: strcpy: &""{\0,\x01,\x01,\x01,\x01,\x01} &"f"{\0,p,i,s,\0} :=> &"f"{\0,p,y,e,\0} | C2: 1 | D2: 1 | E2: 1 | G2: of:=IF([.C2]=1;"";[.C2]) ->  | H2: of:=IF([.D2]=1;"";[.D2]) ->  | I2: of:=IF([.E2]=1;"";[.E2]) ->  | K2: of:=AVERAGE([.G2:.G36]) -> 0.0866862166666667 | L2: of:=AVERAGE([.H2:.H36]) -> 0.0848119708333333 | M2: of:=AVERAGE([.I2:.I36]) -> 0.0848119708333333 | O2: of:=AVERAGE([.K2:.M2]) -> 0.0854367194444444
A3: 2 | B3: strcpy: &""{\0,\x01,\x01,\x01,\x01,\x01} &"al"{\0,p,v,\0} :=> &"al"{\0,p,u,\0} | C3: 1 | D3: 0.222847 | E3: 0.222847 | G3: of:=IF([.C3]=1;"";[.C3]) ->  | H3: of:=IF([.D3]=1;"";[.D3]) -> 0.222847 | I3: of:=IF([.E3]=1;"";[.E3]) -> 0.222847
A4: 3 | B4: strcpy: &""{\0,\x01,\x01,\x01,\x01,\x01} &"yph"{\0,p,\0} :=> &"yph"{\0,p,\0} | C4: 1 | D4: 0.0795262 | E4: 0.0795262 | G4: of:=IF([.C4]=1;"";[.C4]) ->  | H4: of:=IF([.D4]=1;"";[.D4]) -> 0.0795262 | I4: of:=IF([.E4]=1;"";[.E4]) -> 0.0795262
A5: 4 | B5: strcpy: &""{\0,\x01,\x01,\x01,\x01,\x01} &"tybf"{\0,\0} :=> &"tybf"{\0,\0} | C5: 1 | D5: 0.0366619 | E5: 0.0366619 | G5: of:=IF([.C5]=1;"";[.C5]) ->  | H5: of:=IF([.D5]=1;"";[.D5]) -> 0.0366619 | I5: of:=IF([.E5]=1;"";[.E5]) -> 0.0366619
A6: 5 | B6: strcpy: &""{\0,\x01,\x01,\x01,\x01,\x01} &"zmfex"{\0} :=> &"zmfex"{\0} | C6: 1 | D6: 0.025714 | E6: 0.025714 | G6: of:=IF([.C6]=1;"";[.C6]) ->  | H6: of:=IF([.D6]=1;"";[.D6]) -> 0.025714 | I6: of:=IF([.E6]=1;"";[.E6]) -> 0.025714
A7: 6 | B7: strcpy: &"y"{\0,\x01,\x01,\x01,\x01} &""{\0,p,e,a,k,\0} :=> &""{\0,\0,p,t,o,\0} | C7: 1 | D7: 1 | E7: 1 | G7: of:=IF([.C7]=1;"";[.C7]) ->  | H7: of:=IF([.D7]=1;"";[.D7]) ->  | I7: of:=IF([.E7]=1;"";[.E7]) -> 
A8: 7 | B8: strcpy: &"p"{\0,\x01,\x01,\x01,\x01} &"j"{\0,p,l,n,\0} :=> &"j"{\0,p,e,w,\0} | C8: 1 | D8: 1 | E8: 1 | G8: of:=IF([.C8]=1;"";[.C8]) ->  | H8: of:=IF([.D8]=1;"";[.D8]) ->  | I8: of:=IF([.E8]=1;"";[.E8]) -> 
A9: 8 | B9: strcpy: &"r"{\0,\x01,\x01,\x01,\x01} &"yq"{\0,p,r,\0} :=> &"yq"{\0,p,t,\0} | C9: 1 | D9: 0.131946 | E9: 0.131946 | G9: of:=IF([.C9]=1;"";[.C9]) ->  | H9: of:=IF([.D9]=1;"";[.D9]) -> 0.131946 | I9: of:=IF([.E9]=1;"";[.E9]) -> 0.131946
A10: 9 | B10: strcpy: &"q"{\0,\x01,\x01,\x01,\x01} &"nuk"{\0,p,\0} :=> &"nuk"{\0,p,\0} | C10: 1 | D10: 0.0789333 | E10: 0.0789333 | G10: of:=IF([.C10]=1;"";[.C10]) ->  | H10: of:=IF([.D10]=1;"";[.D10]) -> 0.0789333 | I10: of:=IF([.E10]=1;"";[.E10]) -> 0.0789333
A11: 10 | B11: strcpy: &"l"{\0,\x01,\x01,\x01,\x01} &"aidm"{\0,\0} :=> &"aidm"{\0,\0} | C11: 1 | D11: 0.0461685 | E11: 0.0461685 | G11: of:=IF([.C11]=1;"";[.C11]) ->  | H11: of:=IF([.D11]=1;"";[.D11]) -> 0.0461685 | I11: of:=IF([.E11]=1;"";[.E11]) -> 0.0461685
A12: 11 | B12: strcpy: &"b"{\0,\x01,\x01,\x01,\x01} &"ijskn"{\0} :=> &"ijskn"{\0} | C12: 1 | D12: 0.0214395 | E12: 0.0214395 | G12: of:=IF([.C12]=1;"";[.C12]) ->  | H12: of:=IF([.D12]=1;"";[.D12]) -> 0.0214395 | I12: of:=IF([.E12]=1;"";[.E12]) -> 0.0214395
A13: 12 | B13: strcpy: &"sb"{\0,\x01,\x01,\x01} &""{\0,p,t,w,h,\0} :=> &""{\0,b,\0,p,o,\0} | C13: 0.200533 | D13: 1 | E13: 1 | G13: of:=IF([.C13]=1;"";[.C13]) -> 0.200533 | H13: of:=IF([.D13]=1;"";[.D13]) ->  | I13: of:=IF([.E13]=1;"";[.E13]) -> 
A14: 13 | B14: strcpy: &"uw"{\0,\x01,\x01,\x01} &"i"{\0,p,a,w,\0} :=> &"i"{\0,\0,p,w,\0} | C14: 0.186527 | D14: 1 | E14: 1 | G14: of:=IF([.C14]=1;"";[.C14]) -> 0.186527 | H14: of:=IF([.D14]=1;"";[.D14]) ->  | I14: of:=IF([.E14]=1;"";[.E14]) -> 
A15: 14 | B15: strcpy: &"uf"{\0,\x01,\x01,\x01} &"dg"{\0,p,y,\0} :=> &"dg"{\0,p,l,\0} | C15: 0.203947 | D15: 0.207409 | E15: 0.207409 | G15: of:=IF([.C15]=1;"";[.C15]) -> 0.203947 | H15: of:=IF([.D15]=1;"";[.D15]) -> 0.207409 | I15: of:=IF([.E15]=1;"";[.E15]) -> 0.207409
A16: 15 | B16: strcpy: &"ov"{\0,\x01,\x01,\x01} &"ubv"{\0,p,\0} :=> &"ubv"{\0,p,\0} | C16: 0.215706 | D16: 0.0769527 | E16: 0.0769527 | G16: of:=IF([.C16]=1;"";[.C16]) -> 0.215706 | H16: of:=IF([.D16]=1;"";[.D16]) -> 0.0769527 | I16: of:=IF([.E16]=1;"";[.E16]) -> 0.0769527
A17: 16 | B17: strcpy: &"tl"{\0,\x01,\x01,\x01} &"sdbv"{\0,\0} :=> &"sdbv"{\0,\0} | C17: 0.211853 | D17: 0.0382618 | E17: 0.0382618 | G17: of:=IF([.C17]=1;"";[.C17]) -> 0.211853 | H17: of:=IF([.D17]=1;"";[.D17]) -> 0.0382618 | I17: of:=IF([.E17]=1;"";[.E17]) -> 0.0382618
A18: 17 | B18: strcpy: &"kj"{\0,\x01,\x01,\x01} &"ykonb"{\0} :=> &"ykonb"{\0} | C18: 0.164079 | D18: 0.0256063 | E18: 0.0256063 | G18: of:=IF([.C18]=1;"";[.C18]) -> 0.164079 | H18: of:=IF([.D18]=1;"";[.D18]) -> 0.0256063 | I18: of:=IF([.E18]=1;"";[.E18]) -> 0.0256063
A19: 18 | B19: strcpy: &"jeo"{\0,\x01,\x01} &""{\0,p,j,o,r,\0} :=> &""{\0,e,o,\0,p,\0} | C19: 0.0811887 | D19: 1 | E19: 1 | G19: of:=IF([.C19]=1;"";[.C19]) -> 0.0811887 | H19: of:=IF([.D19]=1;"";[.D19]) ->  | I19: of:=IF([.E19]=1;"";[.E19]) -> 
A20: 19 | B20: strcpy: &"quh"{\0,\x01,\x01} &"r"{\0,p,t,v,\0} :=> &"r"{\0,h,\0,p,\0} | C20: 0.0753558 | D20: 1 | E20: 1 | G20: of:=IF([.C20]=1;"";[.C20]) -> 0.0753558 | H20: of:=IF([.D20]=1;"";[.D20]) ->  | I20: of:=IF([.E20]=1;"";[.E20]) -> 
A21: 20 | B21: strcpy: &"pic"{\0,\x01,\x01} &"um"{\0,p,m,\0} :=> &"um"{\0,\0,p,\0} | C21: 0.0870206 | D21: 0.213322 | E21: 0.213322 | G21: of:=IF([.C21]=1;"";[.C21]) -> 0.0870206 | H21: of:=IF([.D21]=1;"";[.D21]) -> 0.213322 | I21: of:=IF([.E21]=1;"";[.E21]) -> 0.213322
A22: 21 | B22: strcpy: &"xif"{\0,\x01,\x01} &"fci"{\0,p,\0} :=> &"fci"{\0,p,\0} | C22: 0.081446 | D22: 0.0723476 | E22: 0.0723476 | G22: of:=IF([.C22]=1;"";[.C22]) -> 0.081446 | H22: of:=IF([.D22]=1;"";[.D22]) -> 0.0723476 | I22: of:=IF([.E22]=1;"";[.E22]) -> 0.0723476
A23: 22 | B23: strcpy: &"pek"{\0,\x01,\x01} &"dwrb"{\0,\0} :=> &"dwrb"{\0,\0} | C23: 0.0846489 | D23: 0.041815 | E23: 0.041815 | G23: of:=IF([.C23]=1;"";[.C23]) -> 0.0846489 | H23: of:=IF([.D23]=1;"";[.D23]) -> 0.041815 | I23: of:=IF([.E23]=1;"";[.E23]) -> 0.041815
A24: 23 | B24: strcpy: &"nkd"{\0,\x01,\x01} &"pgstg"{\0} :=> &"pgstg"{\0} | C24: 0.0756089 | D24: 0.0269293 | E24: 0.0269293 | G24: of:=IF([.C24]=1;"";[.C24]) -> 0.0756089 | H24: of:=IF([.D24]=1;"";[.D24]) -> 0.0269293 | I24: of:=IF([.E24]=1;"";[.E24]) -> 0.0269293
A25: 24 | B25: strcpy: &"eydl"{\0,\x01} &""{\0,p,b,v,r,\0} :=> &""{\0,y,d,l,\0,\0} | C25: 0.0423486 | D25: 1 | E25: 1 | G25: of:=IF([.C25]=1;"";[.C25]) -> 0.0423486 | H25: of:=IF([.D25]=1;"";[.D25]) ->  | I25: of:=IF([.E25]=1;"";[.E25]) -> 
A26: 25 | B26: strcpy: &"nccr"{\0,\x01} &"b"{\0,p,e,j,\0} :=> &"b"{\0,c,r,\0,\0} | C26: 0.0460057 | D26: 1 | E26: 1 | G26: of:=IF([.C26]=1;"";[.C26]) -> 0.0460057 | H26: of:=IF([.D26]=1;"";[.D26]) ->  | I26: of:=IF([.E26]=1;"";[.E26]) -> 
A27: 26 | B27: strcpy: &"uioo"{\0,\x01} &"os"{\0,p,o,\0} :=> &"os"{\0,o,\0,\0} | C27: 0.0469475 | D27: 0.217558 | E27: 0.217558 | G27: of:=IF([.C27]=1;"";[.C27]) -> 0.0469475 | H27: of:=IF([.D27]=1;"";[.D27]) -> 0.217558 | I27: of:=IF([.E27]=1;"";[.E27]) -> 0.217558
A28: 27 | B28: strcpy: &"yswd"{\0,\x01} &"koo"{\0,p,\0} :=> &"koo"{\0,\0,\0} | C28: 0.0415526 | D28: 0.0810216 | E28: 0.0810216 | G28: of:=IF([.C28]=1;"";[.C28]) -> 0.0415526 | H28: of:=IF([.D28]=1;"";[.D28]) -> 0.0810216 | I28: of:=IF([.E28]=1;"";[.E28]) -> 0.0810216
A29: 28 | B29: strcpy: &"cfwo"{\0,\x01} &"yhhi"{\0,\0} :=> &"yhhi"{\0,\0} | C29: 0.0323674 | D29: 0.0385839 | E29: 0.0385839 | G29: of:=IF([.C29]=1;"";[.C29]) -> 0.0323674 | H29: of:=IF([.D29]=1;"";[.D29]) -> 0.0385839 | I29: of:=IF([.E29]=1;"";[.E29]) -> 0.0385839
A30: 29 | B30: strcpy: &"meac"{\0,\x01} &"ksuot"{\0} :=> &"ksuot"{\0} | C30: 0.0486975 | D30: 0.0287049 | E30: 0.0287049 | G30: of:=IF([.C30]=1;"";[.C30]) -> 0.0486975 | H30: of:=IF([.D30]=1;"";[.D30]) -> 0.0287049 | I30: of:=IF([.E30]=1;"";[.E30]) -> 0.0287049
A31: 30 | B31: strcpy: &"poxyf"{\0} &""{\0,p,u,x,n,\0} :=> &""{\0,o,x,y,f,\0} | C31: 0.0242631 | D31: 1 | E31: 1 | G31: of:=IF([.C31]=1;"";[.C31]) -> 0.0242631 | H31: of:=IF([.D31]=1;"";[.D31]) ->  | I31: of:=IF([.E31]=1;"";[.E31]) -> 
A32: 31 | B32: strcpy: &"bvlbl"{\0} &"w"{\0,p,b,y,\0} :=> &"w"{\0,l,b,l,\0} | C32: 0.0239427 | D32: 1 | E32: 1 | G32: of:=IF([.C32]=1;"";[.C32]) -> 0.0239427 | H32: of:=IF([.D32]=1;"";[.D32]) ->  | I32: of:=IF([.E32]=1;"";[.E32]) -> 
A33: 32 | B33: strcpy: &"sreax"{\0} &"mr"{\0,p,u,\0} :=> &"mr"{\0,a,x,\0} | C33: 0.0292948 | D33: 0.181858 | E33: 0.181858 | G33: of:=IF([.C33]=1;"";[.C33]) -> 0.0292948 | H33: of:=IF([.D33]=1;"";[.D33]) -> 0.181858 | I33: of:=IF([.E33]=1;"";[.E33]) -> 0.181858
A34: 33 | B34: strcpy: &"viuhi"{\0} &"iba"{\0,p,\0} :=> &"iba"{\0,i,\0} | C34: 0.0269795 | D34: 0.0840793 | E34: 0.0840793 | G34: of:=IF([.C34]=1;"";[.C34]) -> 0.0269795 | H34: of:=IF([.D34]=1;"";[.D34]) -> 0.0840793 | I34: of:=IF([.E34]=1;"";[.E34]) -> 0.0840793
A35: 34 | B35: strcpy: &"jccnn"{\0} &"vccj"{\0,\0} :=> &"vccj"{\0,\0} | C35: 0.0218702 | D35: 0.0278018 | E35: 0.0278018 | G35: of:=IF([.C35]=1;"";[.C35]) -> 0.0218702 | H35: of:=IF([.D35]=1;"";[.D35]) -> 0.0278018 | I35: of:=IF([.E35]=1;"";[.E35]) -> 0.0278018
A36: 35 | B36: strcpy: &"hriha"{\0} &"hllde"{\0} :=> &"hllde"{\0} | C36: 0.0282857 | D36: 0.0299997 | E36: 0.0299997 | G36: of:=IF([.C36]=1;"";[.C36]) -> 0.0282857 | H36: of:=IF([.D36]=1;"";[.D36]) -> 0.0299997 | I36: of:=IF([.E36]=1;"";[.E36]) -> 0.0299997
A37: 1 | B37: strncpy: &""{\0,\x01,\x01,\x01,\x01,\x01} &""{\0,p,o,f,t,\0} 5 :=> &""{\0,\0,\0,\0,\0,\0} | C37: 1 | D37: 1 | E37: 1 | G37: of:=IF([.C37]=1;"";[.C37]) ->  | H37: of:=IF([.D37]=1;"";[.D37]) ->  | I37: of:=IF([.E37]=1;"";[.E37]) ->  | K37: of:=AVERAGE([.G37:.G72]) -> 0.0859916291666667 | L37: of:=AVERAGE([.H37:.H72]) -> 0.0864695916666667 | M37: of:=AVERAGE([.I37:.I72]) -> 0.0864695916666667 | O37: of:=AVERAGE([.K37:.M37]) -> 0.0863102708333333
A38: 2 | B38: strncpy: &""{\0,\x01,\x01,\x01,\x01,\x01} &"r"{\0,p,o,x,\0} 5 :=> &"r"{\0,\0,\0,\0,\0} | C38: 1 | D38: 1 | E38: 1 | G38: of:=IF([.C38]=1;"";[.C38]) ->  | H38: of:=IF([.D38]=1;"";[.D38]) ->  | I38: of:=IF([.E38]=1;"";[.E38]) -> 
A39: 3 | B39: strncpy: &""{\0,\x01,\x01,\x01,\x01,\x01} &"zy"{\0,p,r,\0} 5 :=> &"zy"{\0,\0,\0,\0} | C39: 1 | D39: 0.192076 | E39: 0.192076 | G39: of:=IF([.C39]=1;"";[.C39]) ->  | H39: of:=IF([.D39]=1;"";[.D39]) -> 0.192076 | I39: of:=IF([.E39]=1;"";[.E39]) -> 0.192076
A40: 4 | B40: strncpy: &""{\0,\x01,\x01,\x01,\x01,\x01} &"drv"{\0,p,\0} 5 :=> &"drv"{\0,\0,\0} | C40: 1 | D40: 0.0861311 | E40: 0.0861311 | G40: of:=IF([.C40]=1;"";[.C40]) ->  | H40: of:=IF([.D40]=1;"";[.D40]) -> 0.0861311 | I40: of:=IF([.E40]=1;"";[.E40]) -> 0.0861311
A41: 5 | B41: strncpy: &""{\0,\x01,\x01,\x01,\x01,\x01} &"zraf"{\0,\0} 5 :=> &"zraf"{\0,\0} | C41: 1 | D41: 0.0403254 | E41: 0.0403254 | G41: of:=IF([.C41]=1;"";[.C41]) ->  | H41: of:=IF([.D41]=1;"";[.D41]) -> 0.0403254 | I41: of:=IF([.E41]=1;"";[.E41]) -> 0.0403254
A42: 6 | B42: strncpy: &""{\0,\x01,\x01,\x01,\x01,\x01} &"ligmo"{\0} 5 :=> &"ligmo"{\0} | C42: 1 | D42: 0.0290452 | E42: 0.0290452 | G42: of:=IF([.C42]=1;"";[.C42]) ->  | H42: of:=IF([.D42]=1;"";[.D42]) -> 0.0290452 | I42: of:=IF([.E42]=1;"";[.E42]) -> 0.0290452
A43: 7 | B43: strncpy: &"w"{\0,\x01,\x01,\x01,\x01} &""{\0,p,o,j,l,\0} 5 :=> &""{\0,\0,\0,\0,\0,\0} | C43: 1 | D43: 1 | E43: 1 | G43: of:=IF([.C43]=1;"";[.C43]) ->  | H43: of:=IF([.D43]=1;"";[.D43]) ->  | I43: of:=IF([.E43]=1;"";[.E43]) -> 
A44: 8 | B44: strncpy: &"x"{\0,\x01,\x01,\x01,\x01} &"q"{\0,p,t,a,\0} 5 :=> &"q"{\0,\0,\0,\0,\0} | C44: 1 | D44: 1 | E44: 1 | G44: of:=IF([.C44]=1;"";[.C44]) ->  | H44: of:=IF([.D44]=1;"";[.D44]) ->  | I44: of:=IF([.E44]=1;"";[.E44]) -> 
A45: 9 | B45: strncpy: &"d"{\0,\x01,\x01,\x01,\x01} &"at"{\0,p,l,\0} 5 :=> &"at"{\0,\0,\0,\0} | C45: 1 | D45: 0.224529 | E45: 0.224529 | G45: of:=IF([.C45]=1;"";[.C45]) ->  | H45: of:=IF([.D45]=1;"";[.D45]) -> 0.224529 | I45: of:=IF([.E45]=1;"";[.E45]) -> 0.224529
A46: 10 | B46: strncpy: &"c"{\0,\x01,\x01,\x01,\x01} &"wkf"{\0,p,\0} 5 :=> &"wkf"{\0,\0,\0} | C46: 1 | D46: 0.0700468 | E46: 0.0700468 | G46: of:=IF([.C46]=1;"";[.C46]) ->  | H46: of:=IF([.D46]=1;"";[.D46]) -> 0.0700468 | I46: of:=IF([.E46]=1;"";[.E46]) -> 0.0700468
A47: 11 | B47: strncpy: &"p"{\0,\x01,\x01,\x01,\x01} &"quyl"{\0,\0} 5 :=> &"quyl"{\0,\0} | C47: 1 | D47: 0.0424969 | E47: 0.0424969 | G47: of:=IF([.C47]=1;"";[.C47]) ->  | H47: of:=IF([.D47]=1;"";[.D47]) -> 0.0424969 | I47: of:=IF([.E47]=1;"";[.E47]) -> 0.0424969
A48: 12 | B48: strncpy: &"i"{\0,\x01,\x01,\x01,\x01} &"aornc"{\0} 5 :=> &"aornc"{\0} | C48: 1 | D48: 0.0292676 | E48: 0.0292676 | G48: of:=IF([.C48]=1;"";[.C48]) ->  | H48: of:=IF([.D48]=1;"";[.D48]) -> 0.0292676 | I48: of:=IF([.E48]=1;"";[.E48]) -> 0.0292676
A49: 13 | B49: strncpy: &"ra"{\0,\x01,\x01,\x01} &""{\0,p,h,a,m,\0} 5 :=> &""{\0,\0,\0,\0,\0,\0} | C49: 0.22156 | D49: 1 | E49: 1 | G49: of:=IF([.C49]=1;"";[.C49]) -> 0.22156 | H49: of:=IF([.D49]=1;"";[.D49]) ->  | I49: of:=IF([.E49]=1;"";[.E49]) -> 
A50: 14 | B50: strncpy: &"zt"{\0,\x01,\x01,\x01} &"s"{\0,p,r,l,\0} 5 :=> &"s"{\0,\0,\0,\0,\0} | C50: 0.17374 | D50: 1 | E50: 1 | G50: of:=IF([.C50]=1;"";[.C50]) -> 0.17374 | H50: of:=IF([.D50]=1;"";[.D50]) ->  | I50: of:=IF([.E50]=1;"";[.E50]) -> 
A51: 15 | B51: strncpy: &"xa"{\0,\x01,\x01,\x01} &"nb"{\0,p,i,\0} 5 :=> &"nb"{\0,\0,\0,\0} | C51: 0.203502 | D51: 0.199534 | E51: 0.199534 | G51: of:=IF([.C51]=1;"";[.C51]) -> 0.203502 | H51: of:=IF([.D51]=1;"";[.D51]) -> 0.199534 | I51: of:=IF([.E51]=1;"";[.E51]) -> 0.199534
A52: 16 | B52: strncpy: &"wn"{\0,\x01,\x01,\x01} &"ymv"{\0,p,\0} 5 :=> &"ymv"{\0,\0,\0} | C52: 0.211853 | D52: 0.0683338 | E52: 0.0683338 | G52: of:=IF([.C52]=1;"";[.C52]) -> 0.211853 | H52: of:=IF([.D52]=1;"";[.D52]) -> 0.0683338 | I52: of:=IF([.E52]=1;"";[.E52]) -> 0.0683338
A53: 17 | B53: strncpy: &"ka"{\0,\x01,\x01,\x01} &"bayb"{\0,\0} 5 :=> &"bayb"{\0,\0} | C53: 0.204058 | D53: 0.0442456 | E53: 0.0442456 | G53: of:=IF([.C53]=1;"";[.C53]) -> 0.204058 | H53: of:=IF([.D53]=1;"";[.D53]) -> 0.0442456 | I53: of:=IF([.E53]=1;"";[.E53]) -> 0.0442456
A54: 18 | B54: strncpy: &"zv"{\0,\x01,\x01,\x01} &"iqify"{\0} 5 :=> &"iqify"{\0} | C54: 0.17374 | D54: 0.0250134 | E54: 0.0250134 | G54: of:=IF([.C54]=1;"";[.C54]) -> 0.17374 | H54: of:=IF([.D54]=1;"";[.D54]) -> 0.0250134 | I54: of:=IF([.E54]=1;"";[.E54]) -> 0.0250134
A55: 19 | B55: strncpy: &"vkk"{\0,\x01,\x01} &""{\0,p,y,f,n,\0} 5 :=> &""{\0,\0,\0,\0,\0,\0} | C55: 0.0591417 | D55: 1 | E55: 1 | G55: of:=IF([.C55]=1;"";[.C55]) -> 0.0591417 | H55: of:=IF([.D55]=1;"";[.D55]) ->  | I55: of:=IF([.E55]=1;"";[.E55]) -> 
A56: 20 | B56: strncpy: &"ube"{\0,\x01,\x01} &"f"{\0,p,s,q,\0} 5 :=> &"f"{\0,\0,\0,\0,\0} | C56: 0.086153 | D56: 1 | E56: 1 | G56: of:=IF([.C56]=1;"";[.C56]) -> 0.086153 | H56: of:=IF([.D56]=1;"";[.D56]) ->  | I56: of:=IF([.E56]=1;"";[.E56]) -> 
A57: 21 | B57: strncpy: &"tya"{\0,\x01,\x01} &"pa"{\0,p,u,\0} 5 :=> &"pa"{\0,\0,\0,\0} | C57: 0.0821145 | D57: 0.218014 | E57: 0.218014 | G57: of:=IF([.C57]=1;"";[.C57]) -> 0.0821145 | H57: of:=IF([.D57]=1;"";[.D57]) -> 0.218014 | I57: of:=IF([.E57]=1;"";[.E57]) -> 0.218014
A58: 22 | B58: strncpy: &"roi"{\0,\x01,\x01} &"iju"{\0,p,\0} 5 :=> &"iju"{\0,\0,\0} | C58: 0.0867018 | D58: 0.0762698 | E58: 0.0762698 | G58: of:=IF([.C58]=1;"";[.C58]) -> 0.0867018 | H58: of:=IF([.D58]=1;"";[.D58]) -> 0.0762698 | I58: of:=IF([.E58]=1;"";[.E58]) -> 0.0762698
A59: 23 | B59: strncpy: &"kbn"{\0,\x01,\x01} &"xhti"{\0,\0} 5 :=> &"xhti"{\0,\0} | C59: 0.0669553 | D59: 0.0443935 | E59: 0.0443935 | G59: of:=IF([.C59]=1;"";[.C59]) -> 0.0669553 | H59: of:=IF([.D59]=1;"";[.D59]) -> 0.0443935 | I59: of:=IF([.E59]=1;"";[.E59]) -> 0.0443935
A60: 24 | B60: strncpy: &"vaw"{\0,\x01,\x01} &"phalp"{\0} 5 :=> &"phalp"{\0} | C60: 0.0833343 | D60: 0.0298864 | E60: 0.0298864 | G60: of:=IF([.C60]=1;"";[.C60]) -> 0.0833343 | H60: of:=IF([.D60]=1;"";[.D60]) -> 0.0298864 | I60: of:=IF([.E60]=1;"";[.E60]) -> 0.0298864
A61: 25 | B61: strncpy: &"zpri"{\0,\x01} &""{\0,p,e,s,n,\0} 5 :=> &""{\0,\0,\0,\0,\0,\0} | C61: 0.0415536 | D61: 1 | E61: 1 | G61: of:=IF([.C61]=1;"";[.C61]) -> 0.0415536 | H61: of:=IF([.D61]=1;"";[.D61]) ->  | I61: of:=IF([.E61]=1;"";[.E61]) -> 
A62: 26 | B62: strncpy: &"gefs"{\0,\x01} &"m"{\0,p,h,l,\0} 5 :=> &"m"{\0,\0,\0,\0,\0} | C62: 0.0441829 | D62: 1 | E62: 1 | G62: of:=IF([.C62]=1;"";[.C62]) -> 0.0441829 | H62: of:=IF([.D62]=1;"";[.D62]) ->  | I62: of:=IF([.E62]=1;"";[.E62]) -> 
A63: 27 | B63: strncpy: &"iiwh"{\0,\x01} &"jp"{\0,p,k,\0} 5 :=> &"jp"{\0,\0,\0,\0} | C63: 0.0395279 | D63: 0.131946 | E63: 0.131946 | G63: of:=IF([.C63]=1;"";[.C63]) -> 0.0395279 | H63: of:=IF([.D63]=1;"";[.D63]) -> 0.131946 | I63: of:=IF([.E63]=1;"";[.E63]) -> 0.131946
A64: 28 | B64: strncpy: &"xtab"{\0,\x01} &"pem"{\0,p,\0} 5 :=> &"pem"{\0,\0,\0} | C64: 0.0458999 | D64: 0.0878453 | E64: 0.0878453 | G64: of:=IF([.C64]=1;"";[.C64]) -> 0.0458999 | H64: of:=IF([.D64]=1;"";[.D64]) -> 0.0878453 | I64: of:=IF([.E64]=1;"";[.E64]) -> 0.0878453
A65: 29 | B65: strncpy: &"fkci"{\0,\x01} &"vigu"{\0,\0} 5 :=> &"vigu"{\0,\0} | C65: 0.0352703 | D65: 0.0464271 | E65: 0.0464271 | G65: of:=IF([.C65]=1;"";[.C65]) -> 0.0352703 | H65: of:=IF([.D65]=1;"";[.D65]) -> 0.0464271 | I65: of:=IF([.E65]=1;"";[.E65]) -> 0.0464271
A66: 30 | B66: strncpy: &"wysl"{\0,\x01} &"yjmuy"{\0} 5 :=> &"yjmuy"{\0} | C66: 0.042929 | D66: 0.0203744 | E66: 0.0203744 | G66: of:=IF([.C66]=1;"";[.C66]) -> 0.042929 | H66: of:=IF([.D66]=1;"";[.D66]) -> 0.0203744 | I66: of:=IF([.E66]=1;"";[.E66]) -> 0.0203744
A67: 31 | B67: strncpy: &"niipp"{\0} &""{\0,p,l,o,n,\0} 5 :=> &""{\0,\0,\0,\0,\0,\0} | C67: 0.0277202 | D67: 1 | E67: 1 | G67: of:=IF([.C67]=1;"";[.C67]) -> 0.0277202 | H67: of:=IF([.D67]=1;"";[.D67]) ->  | I67: of:=IF([.E67]=1;"";[.E67]) -> 
A68: 32 | B68: strncpy: &"lrhox"{\0} &"u"{\0,p,y,g,\0} 5 :=> &"u"{\0,\0,\0,\0,\0} | C68: 0.0268698 | D68: 1 | E68: 1 | G68: of:=IF([.C68]=1;"";[.C68]) -> 0.0268698 | H68: of:=IF([.D68]=1;"";[.D68]) ->  | I68: of:=IF([.E68]=1;"";[.E68]) -> 
A69: 33 | B69: strncpy: &"dunyu"{\0} &"ns"{\0,p,e,\0} 5 :=> &"ns"{\0,\0,\0,\0} | C69: 0.0275974 | D69: 0.219808 | E69: 0.219808 | G69: of:=IF([.C69]=1;"";[.C69]) -> 0.0275974 | H69: of:=IF([.D69]=1;"";[.D69]) -> 0.219808 | I69: of:=IF([.E69]=1;"";[.E69]) -> 0.219808
A70: 34 | B70: strncpy: &"jupht"{\0} &"bar"{\0,p,\0} 5 :=> &"bar"{\0,\0,\0} | C70: 0.028829 | D70: 0.0883187 | E70: 0.0883187 | G70: of:=IF([.C70]=1;"";[.C70]) -> 0.028829 | H70: of:=IF([.D70]=1;"";[.D70]) -> 0.0883187 | I70: of:=IF([.E70]=1;"";[.E70]) -> 0.0883187
A71: 35 | B71: strncpy: &"nwoao"{\0} &"qvno"{\0,\0} 5 :=> &"qvno"{\0,\0} | C71: 0.0268182 | D71: 0.0302859 | E71: 0.0302859 | G71: of:=IF([.C71]=1;"";[.C71]) -> 0.0268182 | H71: of:=IF([.D71]=1;"";[.D71]) -> 0.0302859 | I71: of:=IF([.E71]=1;"";[.E71]) -> 0.0302859
A72: 36 | B72: strncpy: &"hyjat"{\0} &"xeeat"{\0} 5 :=> &"xeeat"{\0} | C72: 0.0237473 | D72: 0.0306563 | E72: 0.0306563 | G72: of:=IF([.C72]=1;"";[.C72]) -> 0.0237473 | H72: of:=IF([.D72]=1;"";[.D72]) -> 0.0306563 | I72: of:=IF([.E72]=1;"";[.E72]) -> 0.0306563

Sheet: strcat
A1: # | B1: Test Case | C1: N1 | D1: N2 | E1: N3
A2: 1 | B2: strcat: &""{\0,\x01,\x01,\x01,\x01,\x01,\x01,\x01,\x01,\x01} &"p"{\0,p,b,\0} :=> &"p"{\0,p,o,r,g,e,l,d,\0} | C2: 1 | D2: 1 | E2: 1 | G2: of:=IF([.C2]=1;"";[.C2]) ->  | H2: of:=IF([.D2]=1;"";[.D2]) ->  | I2: of:=IF([.E2]=1;"";[.E2]) ->  | K2: of:=AVERAGE([.G2:.G41]) -> 0.0624095032258064 | L2: of:=AVERAGE([.H2:.H41]) -> 0.108344589090909 | M2: of:=AVERAGE([.I2:.I41]) -> 0.0345845710810811 | O2: of:=AVERAGE([.K2:.M2]) -> 0.0684462211325989
A3: 2 | B3: strcat: &""{\0,\x01,\x01,\x01,\x01,\x01,\x01,\x01,\x01,\x01} &"ry"{\0,p,\0} :=> &"ry"{\0,p,m,b,e,n,n,\0} | C3: 1 | D3: 0.216174 | E3: 0.216174 | G3: of:=IF([.C3]=1;"";[.C3]) ->  | H3: of:=IF([.D3]=1;"";[.D3]) -> 0.216174 | I3: of:=IF([.E3]=1;"";[.E3]) -> 0.216174
A4: 3 | B4: strcat: &""{\0,\x01,\x01,\x01,\x01,\x01,\x01,\x01,\x01,\x01} &"qic"{\0,\0} :=> &"qic"{\0,p,e,l,p,u,\0} | C4: 1 | D4: 0.0786642 | E4: 0.0786642 | G4: of:=IF([.C4]=1;"";[.C4]) ->  | H4: of:=IF([.D4]=1;"";[.D4]) -> 0.0786642 | I4: of:=IF([.E4]=1;"";[.E4]) -> 0.0786642
A5: 4 | B5: strcat: &""{\0,\x01,\x01,\x01,\x01,\x01,\x01,\x01,\x01,\x01} &"oofk"{\0} :=> &"oofk"{\0,p,a,r,p,\0} | C5: 1 | D5: 0.0420144 | E5: 0.0420144 | H5: of:=IF([.D5]=1;"";[.D5]) -> 0.0420144 | I5: of:=IF([.E5]=1;"";[.E5]) -> 0.0420144
A6: 5 | B6: strcat: &"u"{\0,\x01,\x01,\x01,\x01,\x01,\x01,\x01,\x01} &""{\0,p,t,o,\0} :=> &"u"{\0,p,a,i,e,y,n,i,\0} | C6: 1 | D6: 1 | E6: 1 | G6: of:=IF([.C6]=1;"";[.C6]) ->  | H6: of:=IF([.D6]=1;"";[.D6]) ->  | I6: of:=IF([.E6]=1;"";[.E6]) -> 
A7: 6 | B7: strcat: &"q"{\0,\x01,\x01,\x01,\x01,\x01,\x01,\x01,\x01} &"w"{\0,p,o,\0} :=> &"qw"{\0,p,q,u,s,w,s,\0} | C7: 1 | D7: 1 | E7: 0.106758 | G7: of:=IF([.C7]=1;"";[.C7]) ->  | H7: of:=IF([.D7]=1;"";[.D7]) ->  | I7: of:=IF([.E7]=1;"";[.E7]) -> 0.106758
A8: 7 | B8: strcat: &"q"{\0,\x01,\x01,\x01,\x01,\x01,\x01,\x01,\x01} &"gf"{\0,p,\0} :=> &"qgf"{\0,p,l,a,b,o,\0} | C8: 1 | D8: 0.184836 | E8: 0 | G8: of:=IF([.C8]=1;"";[.C8]) ->  | H8: of:=IF([.D8]=1;"";[.D8]) -> 0.184836 | I8: of:=IF([.E8]=1;"";[.E8]) -> 0
A9: 8 | B9: strcat: &"v"{\0,\x01,\x01,\x01,\x01,\x01,\x01,\x01,\x01} &"dso"{\0,\0} :=> &"vdso"{\0,p,e,m,g,\0} | C9: 1 | D9: 0.0859045 | E9: 0.0393261 | G9: of:=IF([.C9]=1;"";[.C9]) ->  | H9: of:=IF([.D9]=1;"";[.D9]) -> 0.0859045 | I9: of:=IF([.E9]=1;"";[.E9]) -> 0.0393261
A10: 9 | B10: strcat: &"s"{\0,\x01,\x01,\x01,\x01,\x01,\x01,\x01,\x01} &"yaft"{\0} :=> &"syaft"{\0,p,l,l,\0} | C10: 1 | D10: 0.0437335 | E10: 0.027803 | G10: of:=IF([.C10]=1;"";[.C10]) ->  | H10: of:=IF([.D10]=1;"";[.D10]) -> 0.0437335 | I10: of:=IF([.E10]=1;"";[.E10]) -> 0.027803
A11: 10 | B11: strcat: &"sp"{\0,\x01,\x01,\x01,\x01,\x01,\x01,\x01} &""{\0,p,a,o,\0} :=> &"sp"{\0,p,u,e,x,c,h,\0} | C11: 0.214762 | D11: 1 | E11: 0.214762 | G11: of:=IF([.C11]=1;"";[.C11]) -> 0.214762 | H11: of:=IF([.D11]=1;"";[.D11]) ->  | I11: of:=IF([.E11]=1;"";[.E11]) -> 0.214762
A12: 11 | B12: strcat: &"aq"{\0,\x01,\x01,\x01,\x01,\x01,\x01,\x01} &"x"{\0,p,n,\0} :=> &"aqx"{\0,p,p,s,i,r,\0} | C12: 0.196689 | D12: 1 | E12: 0 | G12: of:=IF([.C12]=1;"";[.C12]) -> 0.196689 | H12: of:=IF([.D12]=1;"";[.D12]) ->  | I12: of:=IF([.E12]=1;"";[.E12]) -> 0
A13: 12 | B13: strcat: &"tm"{\0,\x01,\x01,\x01,\x01,\x01,\x01,\x01} &"fr"{\0,p,\0} :=> &"tmfr"{\0,p,e,a,e,\0} | C13: 0.207409 | D13: 0.215706 | E13: 0.0422953 | G13: of:=IF([.C13]=1;"";[.C13]) -> 0.207409 | H13: of:=IF([.D13]=1;"";[.D13]) -> 0.215706 | I13: of:=IF([.E13]=1;"";[.E13]) -> 0.0422953
A14: 13 | B14: strcat: &"sg"{\0,\x01,\x01,\x01,\x01,\x01,\x01,\x01} &"kuw"{\0,\0} :=> &"sgkuw"{\0,p,h,a,\0} | C14: 0.188173 | D14: 0.0701603 | E14: 0.0211257 | G14: of:=IF([.C14]=1;"";[.C14]) -> 0.188173 | H14: of:=IF([.D14]=1;"";[.D14]) -> 0.0701603 | I14: of:=IF([.E14]=1;"";[.E14]) -> 0.0211257
A15: 14 | B15: strcat: &"rf"{\0,\x01,\x01,\x01,\x01,\x01,\x01,\x01} &"gass"{\0} :=> &"rfgass"{\0,p,a,\0} | C15: 0.206238 | D15: 0.04789 | E15: 0.0199142 | G15: of:=IF([.C15]=1;"";[.C15]) -> 0.206238 | H15: of:=IF([.D15]=1;"";[.D15]) -> 0.04789 | I15: of:=IF([.E15]=1;"";[.E15]) -> 0.0199142
A16: 15 | B16: strcat: &"aos"{\0,\x01,\x01,\x01,\x01,\x01,\x01} &""{\0,p,k,p,\0} :=> &"aos"{\0,p,c,l,e,u,\0} | C16: 0.0800421 | D16: 1 | E16: 0.0800421 | G16: of:=IF([.C16]=1;"";[.C16]) -> 0.0800421 | H16: of:=IF([.D16]=1;"";[.D16]) ->  | I16: of:=IF([.E16]=1;"";[.E16]) -> 0.0800421
A17: 16 | B17: strcat: &"hri"{\0,\x01,\x01,\x01,\x01,\x01,\x01} &"l"{\0,p,q,\0} :=> &"hril"{\0,p,a,x,w,\0} | C17: 0.0862429 | D17: 1 | E17: 0.0473202 | G17: of:=IF([.C17]=1;"";[.C17]) -> 0.0862429 | H17: of:=IF([.D17]=1;"";[.D17]) ->  | I17: of:=IF([.E17]=1;"";[.E17]) -> 0.0473202
A18: 17 | B18: strcat: &"zox"{\0,\x01,\x01,\x01,\x01,\x01,\x01} &"jk"{\0,p,\0} :=> &"zoxjk"{\0,p,m,n,\0} | C18: 0.0756869 | D18: 0.163112 | E18: 0 | G18: of:=IF([.C18]=1;"";[.C18]) -> 0.0756869 | H18: of:=IF([.D18]=1;"";[.D18]) -> 0.163112 | I18: of:=IF([.E18]=1;"";[.E18]) -> 0
A19: 18 | B19: strcat: &"sik"{\0,\x01,\x01,\x01,\x01,\x01,\x01} &"teb"{\0,\0} :=> &"sikteb"{\0,p,j,\0} | C19: 0.0856426 | D19: 0.0863757 | E19: 0.0203127 | G19: of:=IF([.C19]=1;"";[.C19]) -> 0.0856426 | H19: of:=IF([.D19]=1;"";[.D19]) -> 0.0863757 | I19: of:=IF([.E19]=1;"";[.E19]) -> 0.0203127
A20: 19 | B20: strcat: &"nng"{\0,\x01,\x01,\x01,\x01,\x01,\x01} &"albe"{\0} :=> &"nngalbe"{\0,p,\0} | C20: 0.087398 | D20: 0.0458749 | E20: 0.0167178 | G20: of:=IF([.C20]=1;"";[.C20]) -> 0.087398 | H20: of:=IF([.D20]=1;"";[.D20]) -> 0.0458749 | I20: of:=IF([.E20]=1;"";[.E20]) -> 0.0167178
A21: 20 | B21: strcat: &"gafh"{\0,\x01,\x01,\x01,\x01,\x01} &""{\0,p,e,t,\0} :=> &"gafh"{\0,p,t,n,n,\0} | C21: 0.037838 | D21: 1 | E21: 0.037838 | G21: of:=IF([.C21]=1;"";[.C21]) -> 0.037838 | H21: of:=IF([.D21]=1;"";[.D21]) ->  | I21: of:=IF([.E21]=1;"";[.E21]) -> 0.037838
A22: 21 | B22: strcat: &"qiws"{\0,\x01,\x01,\x01,\x01,\x01} &"g"{\0,p,l,\0} :=> &"qiwsg"{\0,p,o,x,\0} | C22: 0.0379191 | D22: 1 | E22: 0.0232991 | G22: of:=IF([.C22]=1;"";[.C22]) -> 0.0379191 | H22: of:=IF([.D22]=1;"";[.D22]) ->  | I22: of:=IF([.E22]=1;"";[.E22]) -> 0.0232991
A23: 22 | B23: strcat: &"zsov"{\0,\x01,\x01,\x01,\x01,\x01} &"ak"{\0,p,\0} :=> &"zsovak"{\0,p,s,\0} | C23: 0.0407594 | D23: 0.213322 | E23: 0.0193069 | G23: of:=IF([.C23]=1;"";[.C23]) -> 0.0407594 | H23: of:=IF([.D23]=1;"";[.D23]) -> 0.213322 | I23: of:=IF([.E23]=1;"";[.E23]) -> 0.0193069
A24: 23 | B24: strcat: &"zupe"{\0,\x01,\x01,\x01,\x01,\x01} &"ppu"{\0,\0} :=> &"zupeppu"{\0,p,\0} | C24: 0.0429713 | D24: 0.0844211 | E24: 0.0156996 | G24: of:=IF([.C24]=1;"";[.C24]) -> 0.0429713 | H24: of:=IF([.D24]=1;"";[.D24]) -> 0.0844211 | I24: of:=IF([.E24]=1;"";[.E24]) -> 0.0156996
A25: 24 | B25: strcat: &"qanq"{\0,\x01,\x01,\x01,\x01,\x01} &"nfec"{\0} :=> &"qanqnfec"{\0,\0} | C25: 0.0361622 | D25: 0.0461845 | E25: 0 | G25: of:=IF([.C25]=1;"";[.C25]) -> 0.0361622 | H25: of:=IF([.D25]=1;"";[.D25]) -> 0.0461845 | I25: of:=IF([.E25]=1;"";[.E25]) -> 0
A26: 25 | B26: strcat: &"warga"{\0,\x01,\x01,\x01,\x01} &""{\0,p,o,j,\0} :=> &"warga"{\0,p,h,d,\0} | C26: 0.0306393 | D26: 1 | E26: 0.0306393 | G26: of:=IF([.C26]=1;"";[.C26]) -> 0.0306393 | H26: of:=IF([.D26]=1;"";[.D26]) ->  | I26: of:=IF([.E26]=1;"";[.E26]) -> 0.0306393
A27: 26 | B27: strcat: &"sskot"{\0,\x01,\x01,\x01,\x01} &"l"{\0,p,i,\0} :=> &"sskotl"{\0,p,l,\0} | C27: 0.0287045 | D27: 1 | E27: 0.0205932 | G27: of:=IF([.C27]=1;"";[.C27]) -> 0.0287045 | H27: of:=IF([.D27]=1;"";[.D27]) ->  | I27: of:=IF([.E27]=1;"";[.E27]) -> 0.0205932
A28: 27 | B28: strcat: &"veatd"{\0,\x01,\x01,\x01,\x01} &"lq"{\0,p,\0} :=> &"veatdlq"{\0,p,\0} | C28: 0.0297231 | D28: 0.159409 | E28: 0.0142557 | G28: of:=IF([.C28]=1;"";[.C28]) -> 0.0297231 | H28: of:=IF([.D28]=1;"";[.D28]) -> 0.159409 | I28: of:=IF([.E28]=1;"";[.E28]) -> 0.0142557
A29: 28 | B29: strcat: &"hwogw"{\0,\x01,\x01,\x01,\x01} &"yth"{\0,\0} :=> &"hwogwyth"{\0,\0} | C29: 0.0257431 | D29: 0.0850836 | E29: 0.0118153 | G29: of:=IF([.C29]=1;"";[.C29]) -> 0.0257431 | H29: of:=IF([.D29]=1;"";[.D29]) -> 0.0850836 | I29: of:=IF([.E29]=1;"";[.E29]) -> 0.0118153
A30: 29 | B30: strcat: &"btgjn"{\0,\x01,\x01,\x01,\x01} &"oxwe"{\0} :=> &"btgjnoxwe"{\0} | C30: 0.0188929 | D30: 0.0400819 | E30: 0.0079588 | G30: of:=IF([.C30]=1;"";[.C30]) -> 0.0188929 | H30: of:=IF([.D30]=1;"";[.D30]) -> 0.0400819 | I30: of:=IF([.E30]=1;"";[.E30]) -> 0.0079588
A31: 30 | B31: strcat: &"rckvei"{\0,\x01,\x01,\x01} &""{\0,p,q,i,\0} :=> &"rckvei"{\0,p,o,\0} | C31: 0.0198242 | D31: 1 | E31: 0.0198242 | G31: of:=IF([.C31]=1;"";[.C31]) -> 0.0198242 | H31: of:=IF([.D31]=1;"";[.D31]) ->  | I31: of:=IF([.E31]=1;"";[.E31]) -> 0.0198242
A32: 31 | B32: strcat: &"ksyvyw"{\0,\x01,\x01,\x01} &"l"{\0,p,m,\0} :=> &"ksyvywl"{\0,p,\0} | C32: 0.0175263 | D32: 1 | E32: 0.0134938 | G32: of:=IF([.C32]=1;"";[.C32]) -> 0.0175263 | H32: of:=IF([.D32]=1;"";[.D32]) ->  | I32: of:=IF([.E32]=1;"";[.E32]) -> 0.0134938
A33: 32 | B33: strcat: &"vasuan"{\0,\x01,\x01,\x01} &"jc"{\0,p,\0} :=> &"vasuanjc"{\0,\0} | C33: 0.0221732 | D33: 0.159409 | E33: 0.0119556 | G33: of:=IF([.C33]=1;"";[.C33]) -> 0.0221732 | H33: of:=IF([.D33]=1;"";[.D33]) -> 0.159409 | I33: of:=IF([.E33]=1;"";[.E33]) -> 0.0119556
A34: 33 | B34: strcat: &"jearra"{\0,\x01,\x01,\x01} &"omu"{\0,\0} :=> &"jearraomu"{\0} | C34: 0.021916 | D34: 0.0862685 | E34: 0.0112711 | G34: of:=IF([.C34]=1;"";[.C34]) -> 0.021916 | H34: of:=IF([.D34]=1;"";[.D34]) -> 0.0862685 | I34: of:=IF([.E34]=1;"";[.E34]) -> 0.0112711
A35: 34 | B35: strcat: &"iyhauf"{\0,\x01,\x01,\x01} &&10 :=> &"iyhauffece"{} | C35: 0.0184386 | D35: 0.00914786 | G35: of:=IF([.C35]=1;"";[.C35]) -> 0.0184386 | H35: of:=IF([.D35]=1;"";[.D35]) -> 0.00914786 | I35: of:=IF([.E35]=1;"";[.E35]) ->  
A36: 35 | B36: strcat: &"isunftv"{\0,\x01,\x01} &""{\0,p,t,k,\0} :=> &"isunftv"{\0,p,\0} | C36: 0.0157319 | D36: 1 | E36: 0.0157319 | G36: of:=IF([.C36]=1;"";[.C36]) -> 0.0157319 | H36: of:=IF([.D36]=1;"";[.D36]) ->  | I36: of:=IF([.E36]=1;"";[.E36]) -> 0.0157319
A37: 36 | B37: strcat: &"xexsluo"{\0,\x01,\x01} &"y"{\0,p,i,\0} :=> &"xexsluoy"{\0,\0} | C37: 0.0140452 | D37: 1 | E37: 0.0114708 | G37: of:=IF([.C37]=1;"";[.C37]) -> 0.0140452 | H37: of:=IF([.D37]=1;"";[.D37]) ->  | I37: of:=IF([.E37]=1;"";[.E37]) -> 0.0114708
A38: 37 | B38: strcat: &"roxqtay"{\0,\x01,\x01} &"ec"{\0,p,\0} :=> &"roxqtayec"{\0} | C38: 0.0123815 | D38: 0.219808 | E38: 0.00907213 | G38: of:=IF([.C38]=1;"";[.C38]) -> 0.0123815 | H38: of:=IF([.D38]=1;"";[.D38]) -> 0.219808 | I38: of:=IF([.E38]=1;"";[.E38]) -> 0.00907213
A39: 38 | B39: strcat: &"ofwntvsu"{\0,\x01} &""{\0,p,a,s,\0} :=> &"ofwntvsu"{\0,\0} | C39: 0.0113857 | D39: 1 | E39: 0.0113857 | G39: of:=IF([.C39]=1;"";[.C39]) -> 0.0113857 | H39: of:=IF([.D39]=1;"";[.D39]) ->  | I39: of:=IF([.E39]=1;"";[.E39]) -> 0.0113857
A40: 39 | B40: strcat: &"aiiaguth"{\0,\x01} &"v"{\0,p,u,\0} :=> &"aiiaguthv"{\0} | C40: 0.0134245 | D40: 1 | E40: 0.0105772 | G40: of:=IF([.C40]=1;"";[.C40]) -> 0.0134245 | H40: of:=IF([.D40]=1;"";[.D40]) ->  | I40: of:=IF([.E40]=1;"";[.E40]) -> 0.0105772
A41: 40 | B41: strcat: &"dciafrlhd"{\0} &""{\0,p,a,r,\0} :=> &"dciafrlhd"{\0} | C41: 0.0102111 | D41: 1 | E41: 0.0102111 | G41: of:=IF([.C41]=1;"";[.C41]) -> 0.0102111 | H41: of:=IF([.D41]=1;"";[.D41]) ->  | I41: of:=IF([.E41]=1;"";[.E41]) -> 0.0102111
A42: 1 | B42: strncat: &""{\0,\x01,\x01,\x01,\x01,\x01,\x01,\x01,\x01,\x01} &""{\0,p,f,t,\0} 4 :=> &""{\0,p,l,n,c,e,c,i,e,\0} | C42: 1 | D42: 1 | E42: 1 | G42: of:=IF([.C42]=1;"";[.C42]) ->  | H42: of:=IF([.D42]=1;"";[.D42]) ->  | I42: of:=IF([.E42]=1;"";[.E42]) ->  | K42: of:=AVERAGE([.G42:.G82]) -> 0.0611342832258064 | L42: of:=AVERAGE([.H42:.H82]) -> 0.111627954545455 | M42: of:=AVERAGE([.I42:.I82]) -> 0.0403925391891892 | O42: of:=AVERAGE([.K42:.M42]) -> 0.0710515923201501
A43: 2 | B43: strncat: &""{\0,\x01,\x01,\x01,\x01,\x01,\x01,\x01,\x01,\x01} &"l"{\0,p,p,\0} 4 :=> &"l"{\0,p,l,e,g,a,n,m,\0} | C43: 1 | D43: 1 | E43: 1 | G43: of:=IF([.C43]=1;"";[.C43]) ->  | H43: of:=IF([.D43]=1;"";[.D43]) ->  | I43: of:=IF([.E43]=1;"";[.E43]) -> 
A44: 3 | B44: strncat: &""{\0,\x01,\x01,\x01,\x01,\x01,\x01,\x01,\x01,\x01} &"ng"{\0,p,\0} 4 :=> &"ng"{\0,p,w,q,u,c,y,\0} | C44: 1 | D44: 0.223271 | E44: 0.223271 | G44: of:=IF([.C44]=1;"";[.C44]) ->  | H44: of:=IF([.D44]=1;"";[.D44]) -> 0.223271 | I44: of:=IF([.E44]=1;"";[.E44]) -> 0.223271
A45: 4 | B45: strncat: &""{\0,\x01,\x01,\x01,\x01,\x01,\x01,\x01,\x01,\x01} &"awr"{\0,\0} 4 :=> &"awr"{\0,p,b,e,e,d,\0} | C45: 1 | D45: 0.0812752 | E45: 0.0812752 | G45: of:=IF([.C45]=1;"";[.C45]) ->  | H45: of:=IF([.D45]=1;"";[.D45]) -> 0.0812752 | I45: of:=IF([.E45]=1;"";[.E45]) -> 0.0812752
A46: 5 | B46: strncat: &""{\0,\x01,\x01,\x01,\x01,\x01,\x01,\x01,\x01,\x01} &"pkan"{\0} 4 :=> &"pkan"{\0,p,l,a,b,\0} | C46: 1 | D46: 0.0419969 | E46: 0.0419969 | G46: of:=IF([.C46]=1;"";[.C46]) ->  | H46: of:=IF([.D46]=1;"";[.D46]) -> 0.0419969 | I46: of:=IF([.E46]=1;"";[.E46]) -> 0.0419969
A47: 6 | B47: strncat: &"l"{\0,\x01,\x01,\x01,\x01,\x01,\x01,\x01,\x01} &""{\0,p,e,a,\0} 4 :=> &"l"{\0,p,d,l,y,c,i,m,\0} | C47: 1 | D47: 1 | E47: 1 | G47: of:=IF([.C47]=1;"";[.C47]) ->  | H47: of:=IF([.D47]=1;"";[.D47]) ->  | I47: of:=IF([.E47]=1;"";[.E47]) -> 
A48: 7 | B48: strncat: &"m"{\0,\x01,\x01,\x01,\x01,\x01,\x01,\x01,\x01} &"m"{\0,p,a,\0} 4 :=> &"mm"{\0,p,t,p,a,a,e,\0} | C48: 1 | D48: 1 | E48: 0.212346 | G48: of:=IF([.C48]=1;"";[.C48]) ->  | H48: of:=IF([.D48]=1;"";[.D48]) ->  | I48: of:=IF([.E48]=1;"";[.E48]) -> 0.212346
A49: 8 | B49: strncat: &"q"{\0,\x01,\x01,\x01,\x01,\x01,\x01,\x01,\x01} &"te"{\0,p,\0} 4 :=> &"qte"{\0,p,f,e,x,p,\0} | C49: 1 | D49: 0.223692 | E49: 0.062041 | G49: of:=IF([.C49]=1;"";[.C49]) ->  | H49: of:=IF([.D49]=1;"";[.D49]) -> 0.223692 | I49: of:=IF([.E49]=1;"";[.E49]) -> 0.062041
A50: 9 | B50: strncat: &"l"{\0,\x01,\x01,\x01,\x01,\x01,\x01,\x01,\x01} &"whn"{\0,\0} 4 :=> &"lwhn"{\0,p,m,k,l,\0} | C50: 1 | D50: 0.0837879 | E50: 0.0433107 | G50: of:=IF([.C50]=1;"";[.C50]) ->  | H50: of:=IF([.D50]=1;"";[.D50]) -> 0.0837879 | I50: of:=IF([.E50]=1;"";[.E50]) -> 0.0433107
A51: 10 | B51: strncat: &"o"{\0,\x01,\x01,\x01,\x01,\x01,\x01,\x01,\x01} &"xxrx"{\0} 4 :=> &"oxxrx"{\0,p,u,x,\0} | C51: 1 | D51: 0.0252098 | E51: 0.0170366 | G51: of:=IF([.C51]=1;"";[.C51]) ->  | H51: of:=IF([.D51]=1;"";[.D51]) -> 0.0252098 | I51: of:=IF([.E51]=1;"";[.E51]) -> 0.0170366
A52: 11 | B52: strncat: &"wy"{\0,\x01,\x01,\x01,\x01,\x01,\x01,\x01} &""{\0,p,i,p,\0} 4 :=> &"wy"{\0,p,a,a,u,s,t,\0} | C52: 0.199593 | D52: 1 | E52: 0.199593 | G52: of:=IF([.C52]=1;"";[.C52]) -> 0.199593 | H52: of:=IF([.D52]=1;"";[.D52]) ->  | I52: of:=IF([.E52]=1;"";[.E52]) -> 0.199593
A53: 12 | B53: strncat: &"fy"{\0,\x01,\x01,\x01,\x01,\x01,\x01,\x01} &"o"{\0,p,m,\0} 4 :=> &"fyo"{\0,p,d,i,d,s,\0} | C53: 0.198096 | D53: 1 | E53: 0.0789793 | G53: of:=IF([.C53]=1;"";[.C53]) -> 0.198096 | H53: of:=IF([.D53]=1;"";[.D53]) ->  | I53: of:=IF([.E53]=1;"";[.E53]) -> 0.0789793
A54: 13 | B54: strncat: &"zk"{\0,\x01,\x01,\x01,\x01,\x01,\x01,\x01} &"gi"{\0,p,\0} 4 :=> &"zkgi"{\0,p,d,o,s,\0} | C54: 0.177645 | D54: 0.213322 | E54: 0.0367548 | G54: of:=IF([.C54]=1;"";[.C54]) -> 0.177645 | H54: of:=IF([.D54]=1;"";[.D54]) -> 0.213322 | I54: of:=IF([.E54]=1;"";[.E54]) -> 0.0367548
A55: 14 | B55: strncat: &"nd"{\0,\x01,\x01,\x01,\x01,\x01,\x01,\x01} &"zgp"{\0,\0} 4 :=> &"ndzgp"{\0,p,k,h,\0} | C55: 0.223692 | D55: 0.0622619 | E55: 0.0216712 | G55: of:=IF([.C55]=1;"";[.C55]) -> 0.223692 | H55: of:=IF([.D55]=1;"";[.D55]) -> 0.0622619 | I55: of:=IF([.E55]=1;"";[.E55]) -> 0.0216712
A56: 15 | B56: strncat: &"bi"{\0,\x01,\x01,\x01,\x01,\x01,\x01,\x01} &"ybke"{\0} 4 :=> &"biybke"{\0,p,g,\0} | C56: 0.212836 | D56: 0.0363933 | E56: 0.0166844 | G56: of:=IF([.C56]=1;"";[.C56]) -> 0.212836 | H56: of:=IF([.D56]=1;"";[.D56]) -> 0.0363933 | I56: of:=IF([.E56]=1;"";[.E56]) -> 0.0166844
A57: 16 | B57: strncat: &"qbo"{\0,\x01,\x01,\x01,\x01,\x01,\x01} &""{\0,p,r,i,\0} 4 :=> &"qbo"{\0,p,g,h,m,p,\0} | C57: 0.0602626 | D57: 1 | E57: 0.0602626 | G57: of:=IF([.C57]=1;"";[.C57]) -> 0.0602626 | H57: of:=IF([.D57]=1;"";[.D57]) ->  | I57: of:=IF([.E57]=1;"";[.E57]) -> 0.0602626
A58: 17 | B58: strncat: &"njf"{\0,\x01,\x01,\x01,\x01,\x01,\x01} &"d"{\0,p,h,\0} 4 :=> &"njfd"{\0,p,a,a,d,\0} | C58: 0.0573284 | D58: 1 | E58: 0.027234 | G58: of:=IF([.C58]=1;"";[.C58]) -> 0.0573284 | H58: of:=IF([.D58]=1;"";[.D58]) ->  | I58: of:=IF([.E58]=1;"";[.E58]) -> 0.027234
A59: 18 | B59: strncat: &"vtb"{\0,\x01,\x01,\x01,\x01,\x01,\x01} &"au"{\0,p,\0} 4 :=> &"vtbau"{\0,p,e,a,\0} | C59: 0.0644083 | D59: 0.213806 | E59: 0.0242776 | G59: of:=IF([.C59]=1;"";[.C59]) -> 0.0644083 | H59: of:=IF([.D59]=1;"";[.D59]) -> 0.213806 | I59: of:=IF([.E59]=1;"";[.E59]) -> 0.0242776
A60: 19 | B60: strncat: &"vyo"{\0,\x01,\x01,\x01,\x01,\x01,\x01} &"baf"{\0,\0} 4 :=> &"vyobaf"{\0,p,b,\0} | C60: 0.0788436 | D60: 0.0844002 | E60: 0.0200425 | G60: of:=IF([.C60]=1;"";[.C60]) -> 0.0788436 | H60: of:=IF([.D60]=1;"";[.D60]) -> 0.0844002 | I60: of:=IF([.E60]=1;"";[.E60]) -> 0.0200425
A61: 20 | B61: strncat: &"vee"{\0,\x01,\x01,\x01,\x01,\x01,\x01} &"nlck"{\0} 4 :=> &"veenlck"{\0,p,\0} | C61: 0.0889798 | D61: 0.0431822 | E61: 0.0165118 | G61: of:=IF([.C61]=1;"";[.C61]) -> 0.0889798 | H61: of:=IF([.D61]=1;"";[.D61]) -> 0.0431822 | I61: of:=IF([.E61]=1;"";[.E61]) -> 0.0165118
A62: 21 | B62: strncat: &"squu"{\0,\x01,\x01,\x01,\x01,\x01} &""{\0,p,y,b,\0} 4 :=> &"squu"{\0,p,t,n,c,\0} | C62: 0.0384908 | D62: 1 | E62: 0.0384908 | G62: of:=IF([.C62]=1;"";[.C62]) -> 0.0384908 | H62: of:=IF([.D62]=1;"";[.D62]) ->  | I62: of:=IF([.E62]=1;"";[.E62]) -> 0.0384908
A63: 22 | B63: strncat: &"ihgf"{\0,\x01,\x01,\x01,\x01,\x01} &"o"{\0,p,t,\0} 4 :=> &"ihgfo"{\0,p,i,a,\0} | C63: 0.0335166 | D63: 1 | E63: 0.0229067 | G63: of:=IF([.C63]=1;"";[.C63]) -> 0.0335166 | H63: of:=IF([.D63]=1;"";[.D63]) ->  | I63: of:=IF([.E63]=1;"";[.E63]) -> 0.0229067
A64: 23 | B64: strncat: &"wecy"{\0,\x01,\x01,\x01,\x01,\x01} &"gh"{\0,p,\0} 4 :=> &"wecygh"{\0,p,t,\0} | C64: 0.0461763 | D64: 0.216638 | E64: 0.0199888 | G64: of:=IF([.C64]=1;"";[.C64]) -> 0.0461763 | H64: of:=IF([.D64]=1;"";[.D64]) -> 0.216638 | I64: of:=IF([.E64]=1;"";[.E64]) -> 0.0199888
A65: 24 | B65: strncat: &"dnag"{\0,\x01,\x01,\x01,\x01,\x01} &"gtj"{\0,\0} 4 :=> &"dnaggtj"{\0,p,\0} | C65: 0.045182 | D65: 0.0673118 | E65: 0.0140386 | G65: of:=IF([.C65]=1;"";[.C65]) -> 0.045182 | H65: of:=IF([.D65]=1;"";[.D65]) -> 0.0673118 | I65: of:=IF([.E65]=1;"";[.E65]) -> 0.0140386
A66: 25 | B66: strncat: &"lgeg"{\0,\x01,\x01,\x01,\x01,\x01} &"uast"{\0} 4 :=> &"lgeguast"{\0,\0} | C66: 0.0438595 | D66: 0.0481616 | E66: 0.013331 | G66: of:=IF([.C66]=1;"";[.C66]) -> 0.0438595 | H66: of:=IF([.D66]=1;"";[.D66]) -> 0.0481616 | I66: of:=IF([.E66]=1;"";[.E66]) -> 0.013331
A67: 26 | B67: strncat: &"fvelo"{\0,\x01,\x01,\x01,\x01} &""{\0,p,g,t,\0} 4 :=> &"fvelo"{\0,p,w,b,\0} | C67: 0.0265036 | D67: 1 | E67: 0.0265036 | G67: of:=IF([.C67]=1;"";[.C67]) -> 0.0265036 | H67: of:=IF([.D67]=1;"";[.D67]) ->  | I67: of:=IF([.E67]=1;"";[.E67]) -> 0.0265036
A68: 27 | B68: strncat: &"ptrey"{\0,\x01,\x01,\x01,\x01} &"t"{\0,p,t,\0} 4 :=> &"ptreyt"{\0,p,d,\0} | C68: 0.0305596 | D68: 1 | E68: 0.021246 | G68: of:=IF([.C68]=1;"";[.C68]) -> 0.0305596 | H68: of:=IF([.D68]=1;"";[.D68]) ->  | I68: of:=IF([.E68]=1;"";[.E68]) -> 0.021246
A69: 28 | B69: strncat: &"ikumi"{\0,\x01,\x01,\x01,\x01} &"aa"{\0,p,\0} 4 :=> &"ikumiaa"{\0,p,\0} | C69: 0.0278096 | D69: 0.193065 | E69: 0.0150679 | G69: of:=IF([.C69]=1;"";[.C69]) -> 0.0278096 | H69: of:=IF([.D69]=1;"";[.D69]) -> 0.193065 | I69: of:=IF([.E69]=1;"";[.E69]) -> 0.0150679
A70: 29 | B70: strncat: &"zopcq"{\0,\x01,\x01,\x01,\x01} &"wpg"{\0,\0} 4 :=> &"zopcqwpg"{\0,\0} | C70: 0.0245647 | D70: 0.0686855 | E70: 0.00799854 | G70: of:=IF([.C70]=1;"";[.C70]) -> 0.0245647 | H70: of:=IF([.D70]=1;"";[.D70]) -> 0.0686855 | I70: of:=IF([.E70]=1;"";[.E70]) -> 0.00799854
A71: 30 | B71: strncat: &"xisth"{\0,\x01,\x01,\x01,\x01} &"kuca"{\0} 4 :=> &"xisthkuca"{\0} | C71: 0.0310933 | D71: 0.0437102 | E71: 0.0107343 | G71: of:=IF([.C71]=1;"";[.C71]) -> 0.0310933 | H71: of:=IF([.D71]=1;"";[.D71]) -> 0.0437102 | I71: of:=IF([.E71]=1;"";[.E71]) -> 0.0107343
A72: 31 | B72: strncat: &"uyaron"{\0,\x01,\x01,\x01} &""{\0,p,e,k,\0} 4 :=> &"uyaron"{\0,p,d,\0} | C72: 0.0214481 | D72: 1 | E72: 0.0214481 | G72: of:=IF([.C72]=1;"";[.C72]) -> 0.0214481 | H72: of:=IF([.D72]=1;"";[.D72]) ->  | I72: of:=IF([.E72]=1;"";[.E72]) -> 0.0214481
A73: 32 | B73: strncat: &"butodm"{\0,\x01,\x01,\x01} &"i"{\0,p,a,\0} 4 :=> &"butodmi"{\0,p,\0} | C73: 0.0215581 | D73: 1 | E73: 0.0167787 | G73: of:=IF([.C73]=1;"";[.C73]) -> 0.0215581 | H73: of:=IF([.D73]=1;"";[.D73]) ->  | I73: of:=IF([.E73]=1;"";[.E73]) -> 0.0167787
A74: 33 | B74: strncat: &"turbiq"{\0,\x01,\x01,\x01} &"zw"{\0,p,\0} 4 :=> &"turbiqzw"{\0,\0} | C74: 0.0202394 | D74: 0.176969 | E74: 0 | G74: of:=IF([.C74]=1;"";[.C74]) -> 0.0202394 | H74: of:=IF([.D74]=1;"";[.D74]) -> 0.176969 | I74: of:=IF([.E74]=1;"";[.E74]) -> 0
A75: 34 | B75: strncat: &"rlytga"{\0,\x01,\x01,\x01} &"ccu"{\0,\0} 4 :=> &"rlytgaccu"{\0} | C75: 0.0198459 | D75: 0.0837822 | E75: 0.0107787 | G75: of:=IF([.C75]=1;"";[.C75]) -> 0.0198459 | H75: of:=IF([.D75]=1;"";[.D75]) -> 0.0837822 | I75: of:=IF([.E75]=1;"";[.E75]) -> 0.0107787
A76: 35 | B76: strncat: &"rnquey"{\0,\x01,\x01,\x01} &&10 4 :=> &"rnqueypnqb"{} | C76: 0.0202121 | D76: 0.0073353 | G76: of:=IF([.C76]=1;"";[.C76]) -> 0.0202121 | H76: of:=IF([.D76]=1;"";[.D76]) -> 0.0073353 | I76: of:=IF([.E76]=1;"";[.E76]) ->  
A77: 36 | B77: strncat: &"mviqird"{\0,\x01,\x01} &""{\0,p,s,a,\0} 4 :=> &"mviqird"{\0,p,\0} | C77: 0.0137483 | D77: 1 | E77: 0.0137483 | G77: of:=IF([.C77]=1;"";[.C77]) -> 0.0137483 | H77: of:=IF([.D77]=1;"";[.D77]) ->  | I77: of:=IF([.E77]=1;"";[.E77]) -> 0.0137483
A78: 37 | B78: strncat: &"moghara"{\0,\x01,\x01} &"d"{\0,p,b,\0} 4 :=> &"mogharad"{\0,\0} | C78: 0.0174204 | D78: 1 | E78: 0.0142137 | G78: of:=IF([.C78]=1;"";[.C78]) -> 0.0174204 | H78: of:=IF([.D78]=1;"";[.D78]) ->  | I78: of:=IF([.E78]=1;"";[.E78]) -> 0.0142137
A79: 38 | B79: strncat: &"kbysodf"{\0,\x01,\x01} &"ke"{\0,p,\0} 4 :=> &"kbysodfke"{\0} | C79: 0.0149472 | D79: 0.217558 | E79: 0.00985473 | G79: of:=IF([.C79]=1;"";[.C79]) -> 0.0149472 | H79: of:=IF([.D79]=1;"";[.D79]) -> 0.217558 | I79: of:=IF([.E79]=1;"";[.E79]) -> 0.00985473
A80: 39 | B80: strncat: &"rufuiglc"{\0,\x01} &""{\0,p,h,n,\0} 4 :=> &"rufuiglc"{\0,\0} | C80: 0.0125325 | D80: 1 | E80: 0.0125325 | G80: of:=IF([.C80]=1;"";[.C80]) -> 0.0125325 | H80: of:=IF([.D80]=1;"";[.D80]) ->  | I80: of:=IF([.E80]=1;"";[.E80]) -> 0.0125325
A81: 40 | B81: strncat: &"uddereif"{\0,\x01} &"f"{\0,p,c,\0} 4 :=> &"uddereiff"{\0} | C81: 0.0139649 | D81: 1 | E81: 0.0117692 | G81: of:=IF([.C81]=1;"";[.C81]) -> 0.0139649 | H81: of:=IF([.D81]=1;"";[.D81]) ->  | I81: of:=IF([.E81]=1;"";[.E81]) -> 0.0117692
A82: 41 | B82: strncat: &"ckfomcquo"{\0} &""{\0,p,l,u,\0} 4 :=> &"ckfomcquo"{\0} | C82: 0.00980518 | D82: 1 | E82: 0.00980518 | G82: of:=IF([.C82]=1;"";[.C82]) -> 0.00980518 | H82: of:=IF([.D82]=1;"";[.D82]) ->  | I82: of:=IF([.E82]=1;"";[.E82]) -> 0.00980518

Sheet: strstr
A1: # | B1: Test Case | C1: N | G1: N1 | H1: N2 | I1: N3
A2: 1 | B2: strstr: &"y"{\0,h,j,m,\0} &"y"{\0,\0} :=> &"y"{\0,h,j,m,\0} | C2: 1 | D2: 1 | E2: 1 | G2: of:=IF([.C2]=1;"";[.C2]) ->  | H2: of:=IF([.D2]=1;"";[.D2]) ->  | I2: of:=IF([.E2]=1;"";[.E2]) ->  | K2: of:=AVERAGE([.G2:.G19]) -> 0.074516094117647 | L2: of:=AVERAGE([.H2:.H19]) -> 0.203613 | M2: of:=AVERAGE([.I2:.I19]) -> 0.1029259875 | O2: of:=AVERAGE([.K2:.M2]) -> 0.127018360539216
A3: 2 | B3: strstr: &"kf"{\0,h,c,\0} &"k"{\0,\0} :=> &"kf"{\0,h,c,\0} | C3: 0.188665 | D3: 1 | E3: 0.188665 | G3: of:=IF([.C3]=1;"";[.C3]) -> 0.188665 | H3: of:=IF([.D3]=1;"";[.D3]) ->  | I3: of:=IF([.E3]=1;"";[.E3]) -> 0.188665
A4: 3 | B4: strstr: &"yu"{\0,b,m,\0} &"u"{\0,\0} :=> &"u"{\0,b,m,\0,54} | C4: 0.187534 | D4: 1 | E4: 1 | G4: of:=IF([.C4]=1;"";[.C4]) -> 0.187534 | H4: of:=IF([.D4]=1;"";[.D4]) ->  | I4: of:=IF([.E4]=1;"";[.E4]) -> 
A5: 4 | B5: strstr: &"adh"{\0,h,\0} &"a"{\0,\0} :=> &"adh"{\0,h,\0} | C5: 0.0798083 | D5: 1 | E5: 0.0798083 | G5: of:=IF([.C5]=1;"";[.C5]) -> 0.0798083 | H5: of:=IF([.D5]=1;"";[.D5]) ->  | I5: of:=IF([.E5]=1;"";[.E5]) -> 0.0798083
A6: 5 | B6: strstr: &"ync"{\0,b,\0} &"n"{\0,\0} :=> &"nc"{\0,b,\0,54} | C6: 0.0829998 | D6: 1 | E6: 0.218916 | G6: of:=IF([.C6]=1;"";[.C6]) -> 0.0829998 | H6: of:=IF([.D6]=1;"";[.D6]) ->  | I6: of:=IF([.E6]=1;"";[.E6]) -> 0.218916
A7: 6 | B7: strstr: &"kpgr"{\0,\0} &"k"{\0,\0} :=> &"kpgr"{\0,\0} | C7: 0.0393365 | D7: 1 | E7: 0.0393365 | G7: of:=IF([.C7]=1;"";[.C7]) -> 0.0393365 | H7: of:=IF([.D7]=1;"";[.D7]) ->  | I7: of:=IF([.E7]=1;"";[.E7]) -> 0.0393365
A8: 7 | B8: strstr: &"cndn"{\0,\0} &"n"{\0,\0} :=> &"ndn"{\0,\0,54} | C8: 0.0398138 | D8: 1 | E8: 0.0845378 | G8: of:=IF([.C8]=1;"";[.C8]) -> 0.0398138 | H8: of:=IF([.D8]=1;"";[.D8]) ->  | I8: of:=IF([.E8]=1;"";[.E8]) -> 0.0845378
A9: 8 | B9: strstr: &"gmyry"{\0} &"g"{\0,\0} :=> &"gmyry"{\0} | C9: 0.0267696 | D9: 1 | E9: 0.0267696 | G9: of:=IF([.C9]=1;"";[.C9]) -> 0.0267696 | H9: of:=IF([.D9]=1;"";[.D9]) ->  | I9: of:=IF([.E9]=1;"";[.E9]) -> 0.0267696
A10: 9 | B10: strstr: &"eacig"{\0} &"a"{\0,\0} :=> &"acig"{\0,54} | C10: 0.0309299 | D10: 1 | E10: 0.0473276 | G10: of:=IF([.C10]=1;"";[.C10]) -> 0.0309299 | H10: of:=IF([.D10]=1;"";[.D10]) ->  | I10: of:=IF([.E10]=1;"";[.E10]) -> 0.0473276
A11: 10 | B11: strstr: &"kp"{\0,d,u,\0} &"kp"{\0} :=> &"kp"{\0,d,u,\0} | C11: 0.185577 | D11: 0.185577 | E11: 0.185577 | G11: of:=IF([.C11]=1;"";[.C11]) -> 0.185577 | H11: of:=IF([.D11]=1;"";[.D11]) -> 0.185577 | I11: of:=IF([.E11]=1;"";[.E11]) -> 0.185577
A12: 11 | B12: strstr: &"eiv"{\0,d,\0} &"ei"{\0} :=> &"eiv"{\0,d,\0} | C12: 0.0859319 | D12: 0.214762 | E12: 0.0859319 | G12: of:=IF([.C12]=1;"";[.C12]) -> 0.0859319 | H12: of:=IF([.D12]=1;"";[.D12]) -> 0.214762 | I12: of:=IF([.E12]=1;"";[.E12]) -> 0.0859319
A13: 12 | B13: strstr: &"hho"{\0,a,\0} &"ho"{\0} :=> &"ho"{\0,a,\0,54} | C13: 0.0771266 | D13: 0.219808 | E13: 0.219808 | G13: of:=IF([.C13]=1;"";[.C13]) -> 0.0771266 | H13: of:=IF([.D13]=1;"";[.D13]) -> 0.219808 | I13: of:=IF([.E13]=1;"";[.E13]) -> 0.219808
A14: 13 | B14: strstr: &"mwh"{\0,p,\0} &"wh"{\0} :=> &"wh"{\0,p,\0,54} | C14: 0.0730166 | D14: 0.218014 | E14: 0.218014 | G14: of:=IF([.C14]=1;"";[.C14]) -> 0.0730166 | H14: of:=IF([.D14]=1;"";[.D14]) -> 0.218014 | I14: of:=IF([.E14]=1;"";[.E14]) -> 0.218014
A15: 14 | B15: strstr: &"pauv"{\0,\0} &"pa"{\0} :=> &"pauv"{\0,\0} | C15: 0.0431963 | D15: 0.218014 | E15: 0.0431963 | G15: of:=IF([.C15]=1;"";[.C15]) -> 0.0431963 | H15: of:=IF([.D15]=1;"";[.D15]) -> 0.218014 | I15: of:=IF([.E15]=1;"";[.E15]) -> 0.0431963
A16: 15 | B16: strstr: &"bbar"{\0,\0} &"ba"{\0} :=> &"bar"{\0,\0,54} | C16: 0.0456958 | D16: 0.215236 | E16: 0.0883187 | G16: of:=IF([.C16]=1;"";[.C16]) -> 0.0456958 | H16: of:=IF([.D16]=1;"";[.D16]) -> 0.215236 | I16: of:=IF([.E16]=1;"";[.E16]) -> 0.0883187
A17: 16 | B17: strstr: &"nffx"{\0,\0} &"ff"{\0} :=> &"ffx"{\0,\0,54} | C17: 0.0319761 | D17: 0.214762 | E17: 0.0561203 | G17: of:=IF([.C17]=1;"";[.C17]) -> 0.0319761 | H17: of:=IF([.D17]=1;"";[.D17]) -> 0.214762 | I17: of:=IF([.E17]=1;"";[.E17]) -> 0.0561203
A18: 17 | B18: strstr: &"qvihv"{\0} &"qv"{\0} :=> &"qvihv"{\0} | C18: 0.0190606 | D18: 0.135488 | E18: 0.0190606 | G18: of:=IF([.C18]=1;"";[.C18]) -> 0.0190606 | H18: of:=IF([.D18]=1;"";[.D18]) -> 0.135488 | I18: of:=IF([.E18]=1;"";[.E18]) -> 0.0190606
A19: 18 | B19: strstr: &"ffusk"{\0} &"fu"{\0} :=> &"fusk"{\0,54} | C19: 0.0293358 | D19: 0.210856 | E19: 0.0454282 | G19: of:=IF([.C19]=1;"";[.C19]) -> 0.0293358 | H19: of:=IF([.D19]=1;"";[.D19]) -> 0.210856 | I19: of:=IF([.E19]=1;"";[.E19]) -> 0.0454282
A20: 19 | B20: strstr: &"bsddt"{\0} &"sd"{\0} :=> &"sddt"{\0,54} | C20: 0.0262534 | D20: 0.203446 | E20: 0.0405967 | G20: of:=IF([.C20]=1;"";[.C20]) -> 0.0262534 | H20: of:=IF([.D20]=1;"";[.D20]) -> 0.203446 | I20: of:=IF([.E20]=1;"";[.E20]) -> 0.0405967 | K20: of:=AVERAGE([.G20:.G24]) -> 0.0256728 | L20: of:=AVERAGE([.H20:.H24]) -> 0.2054275 | M20: of:=AVERAGE([.I20:.I24]) -> 0.03134058 | O20: of:=AVERAGE([.K20:.M20]) -> 0.0874802933333333
A21: 1 | B21: strnstr: &"edhvn"{\0} &""{\0,p,\0} 2 :=> &"edhvn"{\0} | C21: 0.0230802 | D21: 1 | E21: 0.0230802 | G21: of:=IF([.C21]=1;"";[.C21]) -> 0.0230802 | H21: of:=IF([.D21]=1;"";[.D21]) ->  | I21: of:=IF([.E21]=1;"";[.E21]) -> 0.0230802
A22: 2 | B22: strnstr: &"vvgun"{\0} &"v"{\0,\0} 2 :=> &"vvgun"{\0} | C22: 0.0230449 | D22: 1 | E22: 0.0230449 | G22: of:=IF([.C22]=1;"";[.C22]) -> 0.0230449 | H22: of:=IF([.D22]=1;"";[.D22]) ->  | I22: of:=IF([.E22]=1;"";[.E22]) -> 0.0230449
A23: 3 | B23: strnstr: &"pioxy"{\0} &"i"{\0,\0} 2 :=> &"ioxy"{\0,54} | C23: 0.0264577 | D23: 1 | E23: 0.0404533 | G23: of:=IF([.C23]=1;"";[.C23]) -> 0.0264577 | H23: of:=IF([.D23]=1;"";[.D23]) ->  | I23: of:=IF([.E23]=1;"";[.E23]) -> 0.0404533
A24: 4 | B24: strnstr: &"tmosc"{\0} &"tm"{\0} 2 :=> &"tmosc"{\0} | C24: 0.0295278 | D24: 0.207409 | E24: 0.0295278 | G24: of:=IF([.C24]=1;"";[.C24]) -> 0.0295278 | H24: of:=IF([.D24]=1;"";[.D24]) -> 0.207409 | I24: of:=IF([.E24]=1;"";[.E24]) -> 0.0295278
A25: 1 | B25: strpbrk: &"rujkr"{\0} &"aeiou"{\0} :=> &"ujkr"{\0,54} | C25: 0.0220043 | D25: 0.0299288 | E25: 0.0326263 | G25: of:=IF([.C25]=1;"";[.C25]) -> 0.0220043 | H25: of:=IF([.D25]=1;"";[.D25]) -> 0.0299288 | I25: of:=IF([.E25]=1;"";[.E25]) -> 0.0326263 | K25: of:=AVERAGE([.G25:.G34]) -> 0.02766614 | L25: of:=AVERAGE([.H25:.H34]) -> 0.0299288 | M25: of:=AVERAGE([.I25:.I34]) -> 0.03485273 | O25: of:=AVERAGE([.K25:.M25]) -> 0.03081589
A26: 2 | B26: strpbrk: &"wojon"{\0} &"aeiou"{\0} :=> &"ojon"{\0,54} | C26: 0.0289222 | D26: 0.0299288 | E26: 0.0444236 | G26: of:=IF([.C26]=1;"";[.C26]) -> 0.0289222 | H26: of:=IF([.D26]=1;"";[.D26]) -> 0.0299288 | I26: of:=IF([.E26]=1;"";[.E26]) -> 0.0444236
A27: 3 | B27: strpbrk: &"tiaak"{\0} &"aeiou"{\0} :=> &"iaak"{\0,54} | C27: 0.0286944 | D27: 0.0299288 | E27: 0.0431396 | G27: of:=IF([.C27]=1;"";[.C27]) -> 0.0286944 | H27: of:=IF([.D27]=1;"";[.D27]) -> 0.0299288 | I27: of:=IF([.E27]=1;"";[.E27]) -> 0.0431396
A28: 4 | B28: strpbrk: &"yehro"{\0} &"aeiou"{\0} :=> &"ehro"{\0,54} | C28: 0.0292195 | D28: 0.0299288 | E28: 0.0451518 | G28: of:=IF([.C28]=1;"";[.C28]) -> 0.0292195 | H28: of:=IF([.D28]=1;"";[.D28]) -> 0.0299288 | I28: of:=IF([.E28]=1;"";[.E28]) -> 0.0451518
A29: 5 | B29: strpbrk: &"wahtu"{\0} &"aeiou"{\0} :=> &"ahtu"{\0,54} | C29: 0.0290652 | D29: 0.0299288 | E29: 0.0444302 | G29: of:=IF([.C29]=1;"";[.C29]) -> 0.0290652 | H29: of:=IF([.D29]=1;"";[.D29]) -> 0.0299288 | I29: of:=IF([.E29]=1;"";[.E29]) -> 0.0444302
A30: 6 | B30: strpbrk: &"ursvu"{\0} &"aeiou"{\0} :=> &"ursvu"{\0} | C30: 0.0261703 | D30: 0.0299288 | E30: 0.0261703 | G30: of:=IF([.C30]=1;"";[.C30]) -> 0.0261703 | H30: of:=IF([.D30]=1;"";[.D30]) -> 0.0299288 | I30: of:=IF([.E30]=1;"";[.E30]) -> 0.0261703
A31: 7 | B31: strpbrk: &"opsnh"{\0} &"aeiou"{\0} :=> &"opsnh"{\0} | C31: 0.0276899 | D31: 0.0299288 | E31: 0.0276899 | G31: of:=IF([.C31]=1;"";[.C31]) -> 0.0276899 | H31: of:=IF([.D31]=1;"";[.D31]) -> 0.0299288 | I31: of:=IF([.E31]=1;"";[.E31]) -> 0.0276899
A32: 8 | B32: strpbrk: &"ixcth"{\0} &"aeiou"{\0} :=> &"ixcth"{\0} | C32: 0.0292199 | D32: 0.0299288 | E32: 0.0292199 | G32: of:=IF([.C32]=1;"";[.C32]) -> 0.0292199 | H32: of:=IF([.D32]=1;"";[.D32]) -> 0.0299288 | I32: of:=IF([.E32]=1;"";[.E32]) -> 0.0292199
A33: 9 | B33: strpbrk: &"emlgy"{\0} &"aeiou"{\0} :=> &"emlgy"{\0} | C33: 0.0259289 | D33: 0.0299288 | E33: 0.0259289 | G33: of:=IF([.C33]=1;"";[.C33]) -> 0.0259289 | H33: of:=IF([.D33]=1;"";[.D33]) -> 0.0299288 | I33: of:=IF([.E33]=1;"";[.E33]) -> 0.0259289
A34: 10 | B34: strpbrk: &"aonic"{\0} &"aeiou"{\0} :=> &"aonic"{\0} | C34: 0.0297468 | D34: 0.0299288 | E34: 0.0297468 | G34: of:=IF([.C34]=1;"";[.C34]) -> 0.0297468 | H34: of:=IF([.D34]=1;"";[.D34]) -> 0.0299288 | I34: of:=IF([.E34]=1;"";[.E34]) -> 0.0297468