Sheet: strlen
A1: strlen: &"\x01"{\0,\0,\0,\0,\0} :=> 1; | J1: # | K1: Test Case | L1: N | P1: FINAL
A2: strlen: &"\x01\x01"{\0,\0,\0,\0} :=> 2; | J2: 1 | K2: strlen: &"g"{\0,p,t,r,\0} :=> 1 | L2: 1 | N2: of:=IF([.L2]=1;"";[.L2]) ->  | P2: of:=AVERAGE([.N2:.N6]) -> 0.09167855
A3: strlen: &"\x01\x01\x01"{\0,\0,\0} :=> 3; | J3: 2 | K3: strlen: &"de"{\0,p,g,\0} :=> 2 | L3: 0.22156 | N3: of:=IF([.L3]=1;"";[.L3]) -> 0.22156
A4: strlen: &"\x01\x01\x01\x01"{\0,\0} :=> 4; | J4: 3 | K4: strlen: &"cdw"{\0,p,\0} :=> 3 | L4: 0.0708253 | N4: of:=IF([.L4]=1;"";[.L4]) -> 0.0708253
A5: strlen: &"\x01\x01\x01\x01\x01"{\0} :=> 5; | J5: 4 | K5: strlen: &"ooab"{\0,\0} :=> 4 | L5: 0.0459609 | N5: of:=IF([.L5]=1;"";[.L5]) -> 0.0459609
A6: strnlen: &""{\0,\0,\0,\0,\0,\0} 6 :=> 0; 1; | J6: 5 | K6: strlen: &"nnywa"{\0} :=> 5 | L6: 0.028368 | N6: of:=IF([.L6]=1;"";[.L6]) -> 0.028368
A7: strnlen: &"\x01"{\0,\0,\0,\0,\0} 6 :=> 1; | J7: 1 | K7: strnlen: &""{\0,p,t,w,r,\0} 6 :=> 0 | L7: 1 | N7: of:=IF([.L7]=1;"";[.L7]) ->  | P7: of:=AVERAGE([.N7:.N12]) -> 0.0964223
A8: strnlen: &"\x01\x01"{\0,\0,\0,\0} 6 :=> 2; | J8: 2 | K8: strnlen: &"a"{\0,p,s,p,\0} 6 :=> 1 | L8: 1 | N8: of:=IF([.L8]=1;"";[.L8]) -> 
A9: strnlen: &"\x01\x01\x01"{\0,\0,\0} 6 :=> 3; | J9: 3 | K9: strnlen: &"to"{\0,p,n,\0} 6 :=> 2 | L9: 0.223271 | N9: of:=IF([.L9]=1;"";[.L9]) -> 0.223271
A10: strnlen: &"\x01\x01\x01\x01"{\0,\0} 6 :=> 4; | J10: 4 | K10: strnlen: &"coc"{\0,p,\0} 6 :=> 3 | L10: 0.0873347 | N10: of:=IF([.L10]=1;"";[.L10]) -> 0.0873347
A11: strnlen: &"\x01\x01\x01\x01\x01"{\0} 6 :=> 5; | J11: 5 | K11: strnlen: &"ppen"{\0,\0} 6 :=> 4 | L11: 0.0479843 | N11: of:=IF([.L11]=1;"";[.L11]) -> 0.0479843
J12: 6 | K12: strnlen: &"vypup"{\0} 6 :=> 5 | L12: 0.0270992 | N12: of:=IF([.L12]=1;"";[.L12]) -> 0.0270992

Sheet: strcmp
A1: # | B1: Test Case | C1: N1 | D1: N2 | L1: FINAL
A2: 1 | B2: strcmp: &"f"{\0,p,e,c,\0} &"f"{\0,p,s,h,\0} :=> 0 | C2: 1 | D2: 1 | F2: of:=IF([.C2]=1;"";[.C2]) ->  | G2: of:=IF([.D2]=1;"";[.D2]) ->  | H2: of:=IF([.E2]=1;"";[.E2]) ->   | I2: of:=AVERAGE([.F2:.F16]) -> 0.0423706214285714 | J2: of:=AVERAGE([.G2:.G16]) -> 0.0423958142857143 | L2: of:=AVERAGE([.I2:.J2]) -> 0.0423832178571428
A3: 2 | B3: strcmp: &"do"{\0,p,t,\0} &"do"{\0,p,h,\0} :=> 0 | C3: 0.215236 | D3: 0.215236 | F3: of:=IF([.C3]=1;"";[.C3]) -> 0.215236 | G3: of:=IF([.D3]=1;"";[.D3]) -> 0.215236 | H3: of:=IF([.E3]=1;"";[.E3]) ->  
A4: 3 | B4: strcmp: &"nlv"{\0,p,\0} &"nlv"{\0,p,\0} :=> 0 | C4: 0.0807307 | D4: 0.0807307 | F4: of:=IF([.C4]=1;"";[.C4]) -> 0.0807307 | G4: of:=IF([.D4]=1;"";[.D4]) -> 0.0807307 | H4: of:=IF([.E4]=1;"";[.E4]) ->  
A5: 4 | B5: strcmp: &"ceqs"{\0,\0} &"ceqs"{\0,\0} :=> 0 | C5: 0.0309991 | D5: 0.0309991 | F5: of:=IF([.C5]=1;"";[.C5]) -> 0.0309991 | G5: of:=IF([.D5]=1;"";[.D5]) -> 0.0309991 | H5: of:=IF([.E5]=1;"";[.E5]) ->  
A6: 5 | B6: strcmp: &"jesek"{\0} &"jesek"{\0} :=> 0 | C6: 0.029688 | D6: 0.029688 | F6: of:=IF([.C6]=1;"";[.C6]) -> 0.029688 | G6: of:=IF([.D6]=1;"";[.D6]) -> 0.029688 | H6: of:=IF([.E6]=1;"";[.E6]) ->  
A7: 6 | B7: strcmp: &"xctfk"{\0} &"xctfi"{\0} :=> 1 | C7: 0.0249766 | D7: 0.0279463 | F7: of:=IF([.C7]=1;"";[.C7]) -> 0.0249766 | G7: of:=IF([.D7]=1;"";[.D7]) -> 0.0279463 | H7: of:=IF([.E7]=1;"";[.E7]) ->  
A8: 7 | B8: strcmp: &"eqiat"{\0} &"eqiay"{\0} :=> -1 | C8: 0.0277761 | D8: 0.0273126 | F8: of:=IF([.C8]=1;"";[.C8]) -> 0.0277761 | G8: of:=IF([.D8]=1;"";[.D8]) -> 0.0273126 | H8: of:=IF([.E8]=1;"";[.E8]) ->  
A9: 8 | B9: strcmp: &"mkbyg"{\0} &"mkbot"{\0} :=> 1 | C9: 0.0221871 | D9: 0.0243923 | F9: of:=IF([.C9]=1;"";[.C9]) -> 0.0221871 | G9: of:=IF([.D9]=1;"";[.D9]) -> 0.0243923 | H9: of:=IF([.E9]=1;"";[.E9]) ->  
A10: 9 | B10: strcmp: &"momvi"{\0} &"momzd"{\0} :=> -1 | C10: 0.0268636 | D10: 0.022126 | F10: of:=IF([.C10]=1;"";[.C10]) -> 0.0268636 | G10: of:=IF([.D10]=1;"";[.D10]) -> 0.022126 | H10: of:=IF([.E10]=1;"";[.E10]) ->  
A11: 10 | B11: strcmp: &"mivnf"{\0} &"mirat"{\0} :=> 1 | C11: 0.0266732 | D11: 0.0315323 | F11: of:=IF([.C11]=1;"";[.C11]) -> 0.0266732 | G11: of:=IF([.D11]=1;"";[.D11]) -> 0.0315323 | H11: of:=IF([.E11]=1;"";[.E11]) ->  
A12: 11 | B12: strcmp: &"jdine"{\0} &"jdwhf"{\0} :=> -1 | C12: 0.0267403 | D12: 0.0226852 | F12: of:=IF([.C12]=1;"";[.C12]) -> 0.0267403 | G12: of:=IF([.D12]=1;"";[.D12]) -> 0.0226852
A13: 12 | B13: strcmp: &"tkwrt"{\0} &"tiovn"{\0} :=> 1 | C13: 0.0251257 | D13: 0.0278303 | F13: of:=IF([.C13]=1;"";[.C13]) -> 0.0251257 | G13: of:=IF([.D13]=1;"";[.D13]) -> 0.0278303
A14: 13 | B14: strcmp: &"sumyr"{\0} &"sxflf"{\0} :=> -1 | C14: 0.0282245 | D14: 0 | F14: of:=IF([.C14]=1;"";[.C14]) -> 0.0282245 | G14: of:=IF([.D14]=1;"";[.D14]) -> 0
A15: 14 | B15: strcmp: &"quidt"{\0} &"peove"{\0} :=> 1 | C15: 0.0279678 | D15: 0.030454 | F15: of:=IF([.C15]=1;"";[.C15]) -> 0.0279678 | G15: of:=IF([.D15]=1;"";[.D15]) -> 0.030454
A16: 15 | B16: strcmp: &"Prefl"{\0} &"ahgdf"{\0} :=> -1 | C16: 0 | D16: 0.0226086 | F16: of:=IF([.C16]=1;"";[.C16]) -> 0 | G16: of:=IF([.D16]=1;"";[.D16]) -> 0.0226086
A17: 1 | B17: strncmp: &""{\0,p,a,j,h,\0} &""{\0,p,g,b,r,\0} 5 :=> 0 | C17: 1 | D17: 1 | F17: of:=IF([.C17]=1;"";[.C17]) ->  | G17: of:=IF([.D17]=1;"";[.D17]) ->  | I17: of:=AVERAGE([.F17:.F32]) -> 0.0435599571428571 | J17: of:=AVERAGE([.G17:.G32]) -> 0.0425977357142857 | L17: of:=AVERAGE([.I17:.J17]) -> 0.0430788464285714
A18: 2 | B18: strncmp: &"t"{\0,p,l,e,\0} &"t"{\0,p,t,c,\0} 5 :=> 0 | C18: 1 | D18: 1 | F18: of:=IF([.C18]=1;"";[.C18]) ->  | G18: of:=IF([.D18]=1;"";[.D18]) -> 
A19: 3 | B19: strncmp: &"rk"{\0,p,a,\0} &"rk"{\0,p,m,\0} 5 :=> 0 | C19: 0.215236 | D19: 0.215236 | F19: of:=IF([.C19]=1;"";[.C19]) -> 0.215236 | G19: of:=IF([.D19]=1;"";[.D19]) -> 0.215236
A20: 4 | B20: strncmp: &"gea"{\0,p,\0} &"gea"{\0,p,\0} 5 :=> 0 | C20: 0.0888414 | D20: 0.0888414 | F20: of:=IF([.C20]=1;"";[.C20]) -> 0.0888414 | G20: of:=IF([.D20]=1;"";[.D20]) -> 0.0888414
A21: 5 | B21: strncmp: &"jivm"{\0,\0} &"jivm"{\0,\0} 5 :=> 0 | C21: 0.033271 | D21: 0.033271 | F21: of:=IF([.C21]=1;"";[.C21]) -> 0.033271 | G21: of:=IF([.D21]=1;"";[.D21]) -> 0.033271
A22: 6 | B22: strncmp: &"kewlq"{\0} &"kewlq"{\0} 5 :=> 0 | C22: 0.0244463 | D22: 0.0244463 | F22: of:=IF([.C22]=1;"";[.C22]) -> 0.0244463 | G22: of:=IF([.D22]=1;"";[.D22]) -> 0.0244463
A23: 7 | B23: strncmp: &"xtari"{\0} &"xtara"{\0} 5 :=> 1 | C23: 0.0307264 | D23: 0.0307609 | F23: of:=IF([.C23]=1;"";[.C23]) -> 0.0307264 | G23: of:=IF([.D23]=1;"";[.D23]) -> 0.0307609
A24: 8 | B24: strncmp: &"qwrds"{\0} &"qwrdz"{\0} 5 :=> -1 | C24: 0.0194524 | D24: 0.0174246 | F24: of:=IF([.C24]=1;"";[.C24]) -> 0.0194524 | G24: of:=IF([.D24]=1;"";[.D24]) -> 0.0174246
A25: 9 | B25: strncmp: &"iprxs"{\0} &"iprum"{\0} 5 :=> 1 | C25: 0.0235394 | D25: 0.0295058 | F25: of:=IF([.C25]=1;"";[.C25]) -> 0.0235394 | G25: of:=IF([.D25]=1;"";[.D25]) -> 0.0295058
A26: 10 | B26: strncmp: &"hkpja"{\0} &"hkpke"{\0} 5 :=> -1 | C26: 0.0212497 | D26: 0.0231846 | F26: of:=IF([.C26]=1;"";[.C26]) -> 0.0212497 | G26: of:=IF([.D26]=1;"";[.D26]) -> 0.0231846
A27: 11 | B27: strncmp: &"exuiu"{\0} &"exbid"{\0} 5 :=> 1 | C27: 0.0270614 | D27: 0.0256232 | F27: of:=IF([.C27]=1;"";[.C27]) -> 0.0270614 | G27: of:=IF([.D27]=1;"";[.D27]) -> 0.0256232
A28: 12 | B28: strncmp: &"hfoqu"{\0} &"hfqin"{\0} 5 :=> -1 | C28: 0.0255075 | D28: 0 | F28: of:=IF([.C28]=1;"";[.C28]) -> 0.0255075 | G28: of:=IF([.D28]=1;"";[.D28]) -> 0
A29: 13 | B29: strncmp: &"jijao"{\0} &"jetge"{\0} 5 :=> 1 | C29: 0.0238206 | D29: 0.0280451 | F29: of:=IF([.C29]=1;"";[.C29]) -> 0.0238206 | G29: of:=IF([.D29]=1;"";[.D29]) -> 0.0280451
A30: 14 | B30: strncmp: &"jeywl"{\0} &"jmitr"{\0} 5 :=> -1 | C30: 0.0266579 | D30: 0.0266179 | F30: of:=IF([.C30]=1;"";[.C30]) -> 0.0266579 | G30: of:=IF([.D30]=1;"";[.D30]) -> 0.0266179
A31: 15 | B31: strncmp: &"trbcs"{\0} &"cagha"{\0} 5 :=> 1 | C31: 0.0265017 | D31: 0.0310288 | F31: of:=IF([.C31]=1;"";[.C31]) -> 0.0265017 | G31: of:=IF([.D31]=1;"";[.D31]) -> 0.0310288
A32: 16 | B32: strncmp: &"xxsov"{\0} &"yquep"{\0} 5 :=> -1 | C32: 0.0235277 | D32: 0.0223827 | F32: of:=IF([.C32]=1;"";[.C32]) -> 0.0235277 | G32: of:=IF([.D32]=1;"";[.D32]) -> 0.0223827
A33: 1 | B33: sysfs_streq: &""{\0,p,a,l,t,\0} &"wyatb"{\0} :=> \0 | C33: 1 | D33: 0.0272082 | F33: of:=IF([.C33]=1;"";[.C33]) ->  | G33: of:=IF([.D33]=1;"";[.D33]) -> 0.0272082 | I33: of:=AVERAGE([.F33:.F71]) -> 0.0687881413793103 | J33: of:=AVERAGE([.G33:.G71]) -> 0.0438611571428571 | L33: of:=AVERAGE([.I33:.J33]) -> 0.0563246492610837
A34: 2 | B34: sysfs_streq: &""{\0,p,l,d,m,\0} &"\n"{\0,b,p,p,\0} :=> \x01 | C34: 1 | F34: of:=IF([.C34]=1;"";[.C34]) ->  | G34: of:=IF([.D34]=1;"";[.D34]) ->  
A35: 3 | B35: sysfs_streq: &""{\0,p,a,a,f,\0} &"\namoy"{\0} :=> \0 | C35: 1 | F35: of:=IF([.C35]=1;"";[.C35]) ->  | G35: of:=IF([.D35]=1;"";[.D35]) ->  
A36: 4 | B36: sysfs_streq: &""{\0,p,k,d,s,\0} &""{\0,h,t,x,h,\0} :=> \x01 | C36: 1 | D36: 1 | F36: of:=IF([.C36]=1;"";[.C36]) ->  | G36: of:=IF([.D36]=1;"";[.D36]) -> 
A37: 5 | B37: sysfs_streq: &"welvo"{\0} &"jsbyo"{\0} :=> \0 | C37: 0.0292484 | D37: 0.0225865 | F37: of:=IF([.C37]=1;"";[.C37]) -> 0.0292484 | G37: of:=IF([.D37]=1;"";[.D37]) -> 0.0225865
A38: 6 | B38: sysfs_streq: &"\n"{\0,p,o,s,\0} &""{\0,a,c,k,r,\0} :=> \x01 | C38: 1 | F38: of:=IF([.C38]=1;"";[.C38]) ->  | G38: of:=IF([.D38]=1;"";[.D38]) ->  
A39: 7 | B39: sysfs_streq: &"\n"{\0,a,s,u,\0} &"bmreq"{\0} :=> \0 | C39: 0.0252787 | F39: of:=IF([.C39]=1;"";[.C39]) -> 0.0252787 | G39: of:=IF([.D39]=1;"";[.D39]) ->  
A40: 8 | B40: sysfs_streq: &"\naaaf"{\0} &"vcomt"{\0} :=> \0 | C40: 0.0255754 | F40: of:=IF([.C40]=1;"";[.C40]) -> 0.0255754 | G40: of:=IF([.D40]=1;"";[.D40]) ->  
A41: 9 | B41: sysfs_streq: &"i"{\0,p,r,e,\0} &"iniln"{\0} :=> \0 | C41: 1 | D41: 0.0297638 | F41: of:=IF([.C41]=1;"";[.C41]) ->  | G41: of:=IF([.D41]=1;"";[.D41]) -> 0.0297638
A42: 10 | B42: sysfs_streq: &"n"{\0,p,h,o,\0} &"n\n"{\0,a,v,\0} :=> \x01 | C42: 1 | F42: of:=IF([.C42]=1;"";[.C42]) ->  | G42: of:=IF([.D42]=1;"";[.D42]) ->  
A43: 11 | B43: sysfs_streq: &"t"{\0,p,p,y,\0} &"t\nacu"{\0} :=> \0 | C43: 1 | F43: of:=IF([.C43]=1;"";[.C43]) ->  | G43: of:=IF([.D43]=1;"";[.D43]) ->  
A44: 12 | B44: sysfs_streq: &"d"{\0,p,o,i,\0} &"d"{\0,h,c,k,\0} :=> \x01 | C44: 1 | D44: 1 | F44: of:=IF([.C44]=1;"";[.C44]) ->  | G44: of:=IF([.D44]=1;"";[.D44]) -> 
A45: 13 | B45: sysfs_streq: &"xssfe"{\0} &"xuasl"{\0} :=> \0 | C45: 0.0254481 | D45: 0.0283543 | F45: of:=IF([.C45]=1;"";[.C45]) -> 0.0254481 | G45: of:=IF([.D45]=1;"";[.D45]) -> 0.0283543
A46: 14 | B46: sysfs_streq: &"k\n"{\0,b,i,\0} &"k"{\0,b,y,s,\0} :=> \x01 | C46: 1 | F46: of:=IF([.C46]=1;"";[.C46]) ->  | G46: of:=IF([.D46]=1;"";[.D46]) ->  
A47: 15 | B47: sysfs_streq: &"w\n"{\0,b,g,\0} &"wfabi"{\0} :=> \0 | C47: 0.0271488 | F47: of:=IF([.C47]=1;"";[.C47]) -> 0.0271488 | G47: of:=IF([.D47]=1;"";[.D47]) ->  
A48: 16 | B48: sysfs_streq: &"z\naab"{\0} &"zbene"{\0} :=> \0 | C48: 0.0286008 | F48: of:=IF([.C48]=1;"";[.C48]) -> 0.0286008 | G48: of:=IF([.D48]=1;"";[.D48]) ->  
A49: 17 | B49: sysfs_streq: &"xc"{\0,p,q,\0} &"xchqt"{\0} :=> \0 | C49: 0.203502 | D49: 0.0203152 | F49: of:=IF([.C49]=1;"";[.C49]) -> 0.203502 | G49: of:=IF([.D49]=1;"";[.D49]) -> 0.0203152
A50: 18 | B50: sysfs_streq: &"je"{\0,p,m,\0} &"je\n"{\0,a,\0} :=> \x01 | C50: 0.205048 | F50: of:=IF([.C50]=1;"";[.C50]) -> 0.205048 | G50: of:=IF([.D50]=1;"";[.D50]) ->  
A51: 19 | B51: sysfs_streq: &"ia"{\0,p,s,\0} &"ia\naa"{\0} :=> \0 | C51: 0.217558 | F51: of:=IF([.C51]=1;"";[.C51]) -> 0.217558 | G51: of:=IF([.D51]=1;"";[.D51]) ->  
A52: 20 | B52: sysfs_streq: &"li"{\0,p,t,\0} &"li"{\0,b,u,\0} :=> \x01 | C52: 0.22156 | D52: 0.22156 | F52: of:=IF([.C52]=1;"";[.C52]) -> 0.22156 | G52: of:=IF([.D52]=1;"";[.D52]) -> 0.22156
A53: 21 | B53: sysfs_streq: &"wrnnb"{\0} &"wrajt"{\0} :=> \0 | C53: 0.0277382 | D53: 0.0231301 | F53: of:=IF([.C53]=1;"";[.C53]) -> 0.0277382 | G53: of:=IF([.D53]=1;"";[.D53]) -> 0.0231301
A54: 22 | B54: sysfs_streq: &"nf\n"{\0,b,\0} &"nf"{\0,b,g,\0} :=> \x01 | C54: 0.209333 | F54: of:=IF([.C54]=1;"";[.C54]) -> 0.209333 | G54: of:=IF([.D54]=1;"";[.D54]) ->  
A55: 23 | B55: sysfs_streq: &"qu\n"{\0,b,\0} &"qunkg"{\0} :=> \0 | C55: 0.0272108 | F55: of:=IF([.C55]=1;"";[.C55]) -> 0.0272108 | G55: of:=IF([.D55]=1;"";[.D55]) ->  
A56: 24 | B56: sysfs_streq: &"pg\nax"{\0} &"pgloc"{\0} :=> \0 | C56: 0.0278986 | F56: of:=IF([.C56]=1;"";[.C56]) -> 0.0278986 | G56: of:=IF([.D56]=1;"";[.D56]) ->  
A57: 25 | B57: sysfs_streq: &"cie"{\0,p,\0} &"cieav"{\0} :=> \0 | C57: 0.0871155 | D57: 0.0308182 | F57: of:=IF([.C57]=1;"";[.C57]) -> 0.0871155 | G57: of:=IF([.D57]=1;"";[.D57]) -> 0.0308182
A58: 26 | B58: sysfs_streq: &"twu"{\0,p,\0} &"twu\n"{\0,\0} :=> \x01 | C58: 0.07053 | F58: of:=IF([.C58]=1;"";[.C58]) -> 0.07053 | G58: of:=IF([.D58]=1;"";[.D58]) ->  
A59: 27 | B59: sysfs_streq: &"kho"{\0,p,\0} &"kho\na"{\0} :=> \0 | C59: 0.0804744 | F59: of:=IF([.C59]=1;"";[.C59]) -> 0.0804744 | G59: of:=IF([.D59]=1;"";[.D59]) ->  
A60: 28 | B60: sysfs_streq: &"hpp"{\0,p,\0} &"hpp"{\0,h,\0} :=> \x01 | C60: 0.0746936 | D60: 0.0746936 | F60: of:=IF([.C60]=1;"";[.C60]) -> 0.0746936 | G60: of:=IF([.D60]=1;"";[.D60]) -> 0.0746936
A61: 29 | B61: sysfs_streq: &"uabny"{\0} &"uabiv"{\0} :=> \0 | C61: 0.0267446 | D61: 0.0296361 | F61: of:=IF([.C61]=1;"";[.C61]) -> 0.0267446 | G61: of:=IF([.D61]=1;"";[.D61]) -> 0.0296361
A62: 30 | B62: sysfs_streq: &"nue\n"{\0,\0} &"nue"{\0,a,\0} :=> \x01 | C62: 0.08426 | F62: of:=IF([.C62]=1;"";[.C62]) -> 0.08426 | G62: of:=IF([.D62]=1;"";[.D62]) ->  
A63: 31 | B63: sysfs_streq: &"nhm\n"{\0,\0} &"nhmnk"{\0} :=> \0 | C63: 0.0260587 | F63: of:=IF([.C63]=1;"";[.C63]) -> 0.0260587 | G63: of:=IF([.D63]=1;"";[.D63]) ->  
A64: 32 | B64: sysfs_streq: &"dna\na"{\0} &"dnanv"{\0} :=> \0 | C64: 0.0295394 | F64: of:=IF([.C64]=1;"";[.C64]) -> 0.0295394 | G64: of:=IF([.D64]=1;"";[.D64]) ->  
A65: 33 | B65: sysfs_streq: &"lfwe"{\0,\0} &"lfwed"{\0} :=> \0 | C65: 0.039616 | D65: 0.0267022 | F65: of:=IF([.C65]=1;"";[.C65]) -> 0.039616 | G65: of:=IF([.D65]=1;"";[.D65]) -> 0.0267022
A66: 34 | B66: sysfs_streq: &"cbca"{\0,\0} &"cbca\n"{\0} :=> \x01 | C66: 0.036112 | F66: of:=IF([.C66]=1;"";[.C66]) -> 0.036112 | G66: of:=IF([.D66]=1;"";[.D66]) ->  
A67: 35 | B67: sysfs_streq: &"guup"{\0,\0} &"guup"{\0,\0} :=> \x01 | C67: 0.0403147 | D67: 0.0403147 | F67: of:=IF([.C67]=1;"";[.C67]) -> 0.0403147 | G67: of:=IF([.D67]=1;"";[.D67]) -> 0.0403147
A68: 36 | B68: sysfs_streq: &"hjatk"{\0} &"hjato"{\0} :=> \0 | C68: 0.0226988 | D68: 0.0253215 | F68: of:=IF([.C68]=1;"";[.C68]) -> 0.0226988 | G68: of:=IF([.D68]=1;"";[.D68]) -> 0.0253215
A69: 37 | B69: sysfs_streq: &"jhey\n"{\0} &"jhey"{\0,\0} :=> \x01 | C69: 0.0325059 | F69: of:=IF([.C69]=1;"";[.C69]) -> 0.0325059 | G69: of:=IF([.D69]=1;"";[.D69]) ->  
A70: 38 | B70: sysfs_streq: &"hnfi\n"{\0} &"hnfic"{\0} :=> \0 | C70: 0.0293919 | F70: of:=IF([.C70]=1;"";[.C70]) -> 0.0293919 | G70: of:=IF([.D70]=1;"";[.D70]) ->  
A71: 39 | B71: sysfs_streq: &"bmqqi"{\0} &"bmqqi"{\0} :=> \x01 | C71: 0.0136518 | D71: 0.0136518 | F71: of:=IF([.C71]=1;"";[.C71]) -> 0.0136518 | G71: of:=IF([.D71]=1;"";[.D71]) -> 0.0136518

Sheet: strcpy
A1: # | B1: Test Case | C1: N1 | D1: N2 | E1: N3 | O1: FINAL
A2: 1 | B2: strcpy: &""{\0,\x01,\x01,\x01,\x01,\x01} &"t"{\0,p,b,i,\0} :=> &"t"{\0,p,o,c,\0} | C2: 1 | D2: 1 | E2: 1 | G2: of:=IF([.C2]=1;"";[.C2]) ->  | H2: of:=IF([.D2]=1;"";[.D2]) ->  | I2: of:=IF([.E2]=1;"";[.E2]) ->  | K2: of:=AVERAGE([.G2:.G36]) -> 0.0889989875 | L2: of:=AVERAGE([.H2:.H36]) -> 0.0916573541666667 | M2: of:=AVERAGE([.I2:.I36]) -> 0.0916573541666667 | O2: of:=AVERAGE([.K2:.M2]) -> 0.0907712319444444
A3: 2 | B3: strcpy: &""{\0,\x01,\x01,\x01,\x01,\x01} &"ei"{\0,p,t,\0} :=> &"ei"{\0,p,y,\0} | C3: 1 | D3: 0.214762 | E3: 0.214762 | G3: of:=IF([.C3]=1;"";[.C3]) ->  | H3: of:=IF([.D3]=1;"";[.D3]) -> 0.214762 | I3: of:=IF([.E3]=1;"";[.E3]) -> 0.214762
A4: 3 | B4: strcpy: &""{\0,\x01,\x01,\x01,\x01,\x01} &"wor"{\0,p,\0} :=> &"wor"{\0,p,\0} | C4: 1 | D4: 0.0889118 | E4: 0.0889118 | G4: of:=IF([.C4]=1;"";[.C4]) ->  | H4: of:=IF([.D4]=1;"";[.D4]) -> 0.0889118 | I4: of:=IF([.E4]=1;"";[.E4]) -> 0.0889118
A5: 4 | B5: strcpy: &""{\0,\x01,\x01,\x01,\x01,\x01} &"vgip"{\0,\0} :=> &"vgip"{\0,\0} | C5: 1 | D5: 0.0389341 | E5: 0.0389341 | G5: of:=IF([.C5]=1;"";[.C5]) ->  | H5: of:=IF([.D5]=1;"";[.D5]) -> 0.0389341 | I5: of:=IF([.E5]=1;"";[.E5]) -> 0.0389341
A6: 5 | B6: strcpy: &""{\0,\x01,\x01,\x01,\x01,\x01} &"clojk"{\0} :=> &"clojk"{\0} | C6: 1 | D6: 0.0245196 | E6: 0.0245196 | G6: of:=IF([.C6]=1;"";[.C6]) ->  | H6: of:=IF([.D6]=1;"";[.D6]) -> 0.0245196 | I6: of:=IF([.E6]=1;"";[.E6]) -> 0.0245196
A7: 6 | B7: strcpy: &"s"{\0,\x01,\x01,\x01,\x01} &""{\0,p,p,c,q,\0} :=> &""{\0,\0,p,n,d,\0} | C7: 1 | D7: 1 | E7: 1 | G7: of:=IF([.C7]=1;"";[.C7]) ->  | H7: of:=IF([.D7]=1;"";[.D7]) ->  | I7: of:=IF([.E7]=1;"";[.E7]) -> 
A8: 7 | B8: strcpy: &"i"{\0,\x01,\x01,\x01,\x01} &"u"{\0,p,l,c,\0} :=> &"u"{\0,p,h,r,\0} | C8: 1 | D8: 1 | E8: 1 | G8: of:=IF([.C8]=1;"";[.C8]) ->  | H8: of:=IF([.D8]=1;"";[.D8]) ->  | I8: of:=IF([.E8]=1;"";[.E8]) -> 
A9: 8 | B9: strcpy: &"a"{\0,\x01,\x01,\x01,\x01} &"ve"{\0,p,y,\0} :=> &"ve"{\0,p,k,\0} | C9: 1 | D9: 0.221991 | E9: 0.221991 | G9: of:=IF([.C9]=1;"";[.C9]) ->  | H9: of:=IF([.D9]=1;"";[.D9]) -> 0.221991 | I9: of:=IF([.E9]=1;"";[.E9]) -> 0.221991
A10: 9 | B10: strcpy: &"a"{\0,\x01,\x01,\x01,\x01} &"cto"{\0,p,\0} :=> &"cto"{\0,p,\0} | C10: 1 | D10: 0.0892428 | E10: 0.0892428 | G10: of:=IF([.C10]=1;"";[.C10]) ->  | H10: of:=IF([.D10]=1;"";[.D10]) -> 0.0892428 | I10: of:=IF([.E10]=1;"";[.E10]) -> 0.0892428
A11: 10 | B11: strcpy: &"g"{\0,\x01,\x01,\x01,\x01} &"oytb"{\0,\0} :=> &"oytb"{\0,\0} | C11: 1 | D11: 0.0412249 | E11: 0.0412249 | G11: of:=IF([.C11]=1;"";[.C11]) ->  | H11: of:=IF([.D11]=1;"";[.D11]) -> 0.0412249 | I11: of:=IF([.E11]=1;"";[.E11]) -> 0.0412249
A12: 11 | B12: strcpy: &"r"{\0,\x01,\x01,\x01,\x01} &"chyrb"{\0} :=> &"chyrb"{\0} | C12: 1 | D12: 0.0278327 | E12: 0.0278327 | G12: of:=IF([.C12]=1;"";[.C12]) ->  | H12: of:=IF([.D12]=1;"";[.D12]) -> 0.0278327 | I12: of:=IF([.E12]=1;"";[.E12]) -> 0.0278327
A13: 12 | B13: strcpy: &"ws"{\0,\x01,\x01,\x01} &""{\0,p,w,m,b,\0} :=> &""{\0,s,\0,p,l,\0} | C13: 0.2083 | D13: 1 | E13: 1 | G13: of:=IF([.C13]=1;"";[.C13]) -> 0.2083 | H13: of:=IF([.D13]=1;"";[.D13]) ->  | I13: of:=IF([.E13]=1;"";[.E13]) -> 
A14: 13 | B14: strcpy: &"by"{\0,\x01,\x01,\x01} &"m"{\0,p,r,k,\0} :=> &"m"{\0,\0,p,a,\0} | C14: 0.215236 | D14: 1 | E14: 1 | G14: of:=IF([.C14]=1;"";[.C14]) -> 0.215236 | H14: of:=IF([.D14]=1;"";[.D14]) ->  | I14: of:=IF([.E14]=1;"";[.E14]) -> 
A15: 14 | B15: strcpy: &"dg"{\0,\x01,\x01,\x01} &"gs"{\0,p,o,\0} :=> &"gs"{\0,p,d,\0} | C15: 0.207409 | D15: 0.209845 | E15: 0.209845 | G15: of:=IF([.C15]=1;"";[.C15]) -> 0.207409 | H15: of:=IF([.D15]=1;"";[.D15]) -> 0.209845 | I15: of:=IF([.E15]=1;"";[.E15]) -> 0.209845
A16: 15 | B16: strcpy: &"tj"{\0,\x01,\x01,\x01} &"tou"{\0,p,\0} :=> &"tou"{\0,p,\0} | C16: 0.167387 | D16: 0.0903929 | E16: 0.0903929 | G16: of:=IF([.C16]=1;"";[.C16]) -> 0.167387 | H16: of:=IF([.D16]=1;"";[.D16]) -> 0.0903929 | I16: of:=IF([.E16]=1;"";[.E16]) -> 0.0903929
A17: 16 | B17: strcpy: &"ef"{\0,\x01,\x01,\x01} &"goth"{\0,\0} :=> &"goth"{\0,\0} | C17: 0.214286 | D17: 0.0483115 | E17: 0.0483115 | G17: of:=IF([.C17]=1;"";[.C17]) -> 0.214286 | H17: of:=IF([.D17]=1;"";[.D17]) -> 0.0483115 | I17: of:=IF([.E17]=1;"";[.E17]) -> 0.0483115
A18: 17 | B18: strcpy: &"ap"{\0,\x01,\x01,\x01} &"filpa"{\0} :=> &"filpa"{\0} | C18: 0.215236 | D18: 0.029887 | E18: 0.029887 | G18: of:=IF([.C18]=1;"";[.C18]) -> 0.215236 | H18: of:=IF([.D18]=1;"";[.D18]) -> 0.029887 | I18: of:=IF([.E18]=1;"";[.E18]) -> 0.029887
A19: 18 | B19: strcpy: &"bsh"{\0,\x01,\x01} &""{\0,p,a,n,n,\0} :=> &""{\0,s,h,\0,p,\0} | C19: 0.084617 | D19: 1 | E19: 1 | G19: of:=IF([.C19]=1;"";[.C19]) -> 0.084617 | H19: of:=IF([.D19]=1;"";[.D19]) ->  | I19: of:=IF([.E19]=1;"";[.E19]) -> 
A20: 19 | B20: strcpy: &"hln"{\0,\x01,\x01} &"x"{\0,p,p,p,\0} :=> &"x"{\0,n,\0,p,\0} | C20: 0.0756738 | D20: 1 | E20: 1 | G20: of:=IF([.C20]=1;"";[.C20]) -> 0.0756738 | H20: of:=IF([.D20]=1;"";[.D20]) ->  | I20: of:=IF([.E20]=1;"";[.E20]) -> 
A21: 20 | B21: strcpy: &"xse"{\0,\x01,\x01} &"wo"{\0,p,u,\0} :=> &"wo"{\0,\0,p,\0} | C21: 0.0730502 | D21: 0.216638 | E21: 0.216638 | G21: of:=IF([.C21]=1;"";[.C21]) -> 0.0730502 | H21: of:=IF([.D21]=1;"";[.D21]) -> 0.216638 | I21: of:=IF([.E21]=1;"";[.E21]) -> 0.216638
A22: 21 | B22: strcpy: &"toa"{\0,\x01,\x01} &"neq"{\0,p,\0} :=> &"neq"{\0,p,\0} | C22: 0.0867469 | D22: 0.0845417 | E22: 0.0845417 | G22: of:=IF([.C22]=1;"";[.C22]) -> 0.0867469 | H22: of:=IF([.D22]=1;"";[.D22]) -> 0.0845417 | I22: of:=IF([.E22]=1;"";[.E22]) -> 0.0845417
A23: 22 | B23: strcpy: &"vsm"{\0,\x01,\x01} &"zaug"{\0,\0} :=> &"zaug"{\0,\0} | C23: 0.0745432 | D23: 0.0444716 | E23: 0.0444716 | G23: of:=IF([.C23]=1;"";[.C23]) -> 0.0745432 | H23: of:=IF([.D23]=1;"";[.D23]) -> 0.0444716 | I23: of:=IF([.E23]=1;"";[.E23]) -> 0.0444716
A24: 23 | B24: strcpy: &"blm"{\0,\x01,\x01} &"vgahe"{\0} :=> &"vgahe"{\0} | C24: 0.0830264 | D24: 0.0260955 | E24: 0.0260955 | G24: of:=IF([.C24]=1;"";[.C24]) -> 0.0830264 | H24: of:=IF([.D24]=1;"";[.D24]) -> 0.0260955 | I24: of:=IF([.E24]=1;"";[.E24]) -> 0.0260955
A25: 24 | B25: strcpy: &"yalv"{\0,\x01} &""{\0,p,r,o,l,\0} :=> &""{\0,a,l,v,\0,\0} | C25: 0.0444084 | D25: 1 | E25: 1 | G25: of:=IF([.C25]=1;"";[.C25]) -> 0.0444084 | H25: of:=IF([.D25]=1;"";[.D25]) ->  | I25: of:=IF([.E25]=1;"";[.E25]) -> 
A26: 25 | B26: strcpy: &"bied"{\0,\x01} &"r"{\0,p,p,y,\0} :=> &"r"{\0,e,d,\0,\0} | C26: 0.047649 | D26: 1 | E26: 1 | G26: of:=IF([.C26]=1;"";[.C26]) -> 0.047649 | H26: of:=IF([.D26]=1;"";[.D26]) ->  | I26: of:=IF([.E26]=1;"";[.E26]) -> 
A27: 26 | B27: strcpy: &"xeje"{\0,\x01} &"kf"{\0,p,d,\0} :=> &"kf"{\0,e,\0,\0} | C27: 0.0407274 | D27: 0.188665 | E27: 0.188665 | G27: of:=IF([.C27]=1;"";[.C27]) -> 0.0407274 | H27: of:=IF([.D27]=1;"";[.D27]) -> 0.188665 | I27: of:=IF([.E27]=1;"";[.E27]) -> 0.188665
A28: 27 | B28: strcpy: &"lkhf"{\0,\x01} &"msc"{\0,p,\0} :=> &"msc"{\0,\0,\0} | C28: 0.0384402 | D28: 0.0839512 | E28: 0.0839512 | G28: of:=IF([.C28]=1;"";[.C28]) -> 0.0384402 | H28: of:=IF([.D28]=1;"";[.D28]) -> 0.0839512 | I28: of:=IF([.E28]=1;"";[.E28]) -> 0.0839512
A29: 28 | B29: strcpy: &"dvyn"{\0,\x01} &"wani"{\0,\0} :=> &"wani"{\0,\0} | C29: 0.0407654 | D29: 0.0487849 | E29: 0.0487849 | G29: of:=IF([.C29]=1;"";[.C29]) -> 0.0407654 | H29: of:=IF([.D29]=1;"";[.D29]) -> 0.0487849 | I29: of:=IF([.E29]=1;"";[.E29]) -> 0.0487849
A30: 29 | B30: strcpy: &"olsh"{\0,\x01} &"rybgr"{\0} :=> &"rybgr"{\0} | C30: 0.0471213 | D30: 0.0241695 | E30: 0.0241695 | G30: of:=IF([.C30]=1;"";[.C30]) -> 0.0471213 | H30: of:=IF([.D30]=1;"";[.D30]) -> 0.0241695 | I30: of:=IF([.E30]=1;"";[.E30]) -> 0.0241695
A31: 30 | B31: strcpy: &"yolhe"{\0} &""{\0,p,b,e,v,\0} :=> &""{\0,o,l,h,e,\0} | C31: 0.0287688 | D31: 1 | E31: 1 | G31: of:=IF([.C31]=1;"";[.C31]) -> 0.0287688 | H31: of:=IF([.D31]=1;"";[.D31]) ->  | I31: of:=IF([.E31]=1;"";[.E31]) -> 
A32: 31 | B32: strcpy: &"usacu"{\0} &"e"{\0,p,s,a,\0} :=> &"e"{\0,a,c,u,\0} | C32: 0.0306729 | D32: 1 | E32: 1 | G32: of:=IF([.C32]=1;"";[.C32]) -> 0.0306729 | H32: of:=IF([.D32]=1;"";[.D32]) ->  | I32: of:=IF([.E32]=1;"";[.E32]) -> 
A33: 32 | B33: strcpy: &"esama"{\0} &"li"{\0,p,h,\0} :=> &"li"{\0,m,a,\0} | C33: 0.0313571 | D33: 0.22156 | E33: 0.22156 | G33: of:=IF([.C33]=1;"";[.C33]) -> 0.0313571 | H33: of:=IF([.D33]=1;"";[.D33]) -> 0.22156 | I33: of:=IF([.E33]=1;"";[.E33]) -> 0.22156
A34: 33 | B34: strcpy: &"cavra"{\0} &"ssf"{\0,p,\0} :=> &"ssf"{\0,a,\0} | C34: 0.0282636 | D34: 0.0820871 | E34: 0.0820871 | G34: of:=IF([.C34]=1;"";[.C34]) -> 0.0282636 | H34: of:=IF([.D34]=1;"";[.D34]) -> 0.0820871 | I34: of:=IF([.E34]=1;"";[.E34]) -> 0.0820871
A35: 34 | B35: strcpy: &"hmcnc"{\0} &"znnw"{\0,\0} :=> &"znnw"{\0,\0} | C35: 0.0233191 | D35: 0.0375849 | E35: 0.0375849 | G35: of:=IF([.C35]=1;"";[.C35]) -> 0.0233191 | H35: of:=IF([.D35]=1;"";[.D35]) -> 0.0375849 | I35: of:=IF([.E35]=1;"";[.E35]) -> 0.0375849
A36: 35 | B36: strcpy: &"tprta"{\0} &"zjowq"{\0} :=> &"zjowq"{\0} | C36: 0.028971 | D36: 0.0153718 | E36: 0.0153718 | G36: of:=IF([.C36]=1;"";[.C36]) -> 0.028971 | H36: of:=IF([.D36]=1;"";[.D36]) -> 0.0153718 | I36: of:=IF([.E36]=1;"";[.E36]) -> 0.0153718
A37: 1 | B37: strncpy: &""{\0,\x01,\x01,\x01,\x01,\x01} &""{\0,p,t,e,a,\0} 5 :=> &""{\0,\0,\0,\0,\0,\0} | C37: 1 | D37: 1 | E37: 1 | G37: of:=IF([.C37]=1;"";[.C37]) ->  | H37: of:=IF([.D37]=1;"";[.D37]) ->  | I37: of:=IF([.E37]=1;"";[.E37]) ->  | K37: of:=AVERAGE([.G37:.G72]) -> 0.0877206708333334 | L37: of:=AVERAGE([.H37:.H72]) -> 0.0857878041666667 | M37: of:=AVERAGE([.I37:.I72]) -> 0.0857878041666667 | O37: of:=AVERAGE([.K37:.M37]) -> 0.0864320930555556
A38: 2 | B38: strncpy: &""{\0,\x01,\x01,\x01,\x01,\x01} &"w"{\0,p,a,m,\0} 5 :=> &"w"{\0,\0,\0,\0,\0} | C38: 1 | D38: 1 | E38: 1 | G38: of:=IF([.C38]=1;"";[.C38]) ->  | H38: of:=IF([.D38]=1;"";[.D38]) ->  | I38: of:=IF([.E38]=1;"";[.E38]) -> 
A39: 3 | B39: strncpy: &""{\0,\x01,\x01,\x01,\x01,\x01} &"kp"{\0,p,o,\0} 5 :=> &"kp"{\0,\0,\0,\0} | C39: 1 | D39: 0.185577 | E39: 0.185577 | G39: of:=IF([.C39]=1;"";[.C39]) ->  | H39: of:=IF([.D39]=1;"";[.D39]) -> 0.185577 | I39: of:=IF([.E39]=1;"";[.E39]) -> 0.185577
A40: 4 | B40: strncpy: &""{\0,\x01,\x01,\x01,\x01,\x01} &"ixf"{\0,p,\0} 5 :=> &"ixf"{\0,\0,\0} | C40: 1 | D40: 0.0712217 | E40: 0.0712217 | G40: of:=IF([.C40]=1;"";[.C40]) ->  | H40: of:=IF([.D40]=1;"";[.D40]) -> 0.0712217 | I40: of:=IF([.E40]=1;"";[.E40]) -> 0.0712217
A41: 5 | B41: strncpy: &""{\0,\x01,\x01,\x01,\x01,\x01} &"lpac"{\0,\0} 5 :=> &"lpac"{\0,\0} | C41: 1 | D41: 0.045841 | E41: 0.045841 | G41: of:=IF([.C41]=1;"";[.C41]) ->  | H41: of:=IF([.D41]=1;"";[.D41]) -> 0.045841 | I41: of:=IF([.E41]=1;"";[.E41]) -> 0.045841
A42: 6 | B42: strncpy: &""{\0,\x01,\x01,\x01,\x01,\x01} &"cboun"{\0} 5 :=> &"cboun"{\0} | C42: 1 | D42: 0.0265089 | E42: 0.0265089 | G42: of:=IF([.C42]=1;"";[.C42]) ->  | H42: of:=IF([.D42]=1;"";[.D42]) -> 0.0265089 | I42: of:=IF([.E42]=1;"";[.E42]) -> 0.0265089
A43: 7 | B43: strncpy: &"v"{\0,\x01,\x01,\x01,\x01} &""{\0,p,o,x,h,\0} 5 :=> &""{\0,\0,\0,\0,\0,\0} | C43: 1 | D43: 1 | E43: 1 | G43: of:=IF([.C43]=1;"";[.C43]) ->  | H43: of:=IF([.D43]=1;"";[.D43]) ->  | I43: of:=IF([.E43]=1;"";[.E43]) -> 
A44: 8 | B44: strncpy: &"d"{\0,\x01,\x01,\x01,\x01} &"r"{\0,p,p,r,\0} 5 :=> &"r"{\0,\0,\0,\0,\0} | C44: 1 | D44: 1 | E44: 1 | G44: of:=IF([.C44]=1;"";[.C44]) ->  | H44: of:=IF([.D44]=1;"";[.D44]) ->  | I44: of:=IF([.E44]=1;"";[.E44]) -> 
A45: 9 | B45: strncpy: &"v"{\0,\x01,\x01,\x01,\x01} &"os"{\0,p,b,\0} 5 :=> &"os"{\0,\0,\0,\0} | C45: 1 | D45: 0.217558 | E45: 0.217558 | G45: of:=IF([.C45]=1;"";[.C45]) ->  | H45: of:=IF([.D45]=1;"";[.D45]) -> 0.217558 | I45: of:=IF([.E45]=1;"";[.E45]) -> 0.217558
A46: 10 | B46: strncpy: &"i"{\0,\x01,\x01,\x01,\x01} &"pwp"{\0,p,\0} 5 :=> &"pwp"{\0,\0,\0} | C46: 1 | D46: 0.0648452 | E46: 0.0648452 | G46: of:=IF([.C46]=1;"";[.C46]) ->  | H46: of:=IF([.D46]=1;"";[.D46]) -> 0.0648452 | I46: of:=IF([.E46]=1;"";[.E46]) -> 0.0648452
A47: 11 | B47: strncpy: &"a"{\0,\x01,\x01,\x01,\x01} &"gdga"{\0,\0} 5 :=> &"gdga"{\0,\0} | C47: 1 | D47: 0.0414773 | E47: 0.0414773 | G47: of:=IF([.C47]=1;"";[.C47]) ->  | H47: of:=IF([.D47]=1;"";[.D47]) -> 0.0414773 | I47: of:=IF([.E47]=1;"";[.E47]) -> 0.0414773
A48: 12 | B48: strncpy: &"r"{\0,\x01,\x01,\x01,\x01} &"sghta"{\0} 5 :=> &"sghta"{\0} | C48: 1 | D48: 0.0280617 | E48: 0.0280617 | G48: of:=IF([.C48]=1;"";[.C48]) ->  | H48: of:=IF([.D48]=1;"";[.D48]) -> 0.0280617 | I48: of:=IF([.E48]=1;"";[.E48]) -> 0.0280617
A49: 13 | B49: strncpy: &"cc"{\0,\x01,\x01,\x01} &""{\0,p,r,u,d,\0} 5 :=> &""{\0,\0,\0,\0,\0,\0} | C49: 0.210352 | D49: 1 | E49: 1 | G49: of:=IF([.C49]=1;"";[.C49]) -> 0.210352 | H49: of:=IF([.D49]=1;"";[.D49]) ->  | I49: of:=IF([.E49]=1;"";[.E49]) -> 
A50: 14 | B50: strncpy: &"ur"{\0,\x01,\x01,\x01} &"l"{\0,p,l,t,\0} 5 :=> &"l"{\0,\0,\0,\0,\0} | C50: 0.219364 | D50: 1 | E50: 1 | G50: of:=IF([.C50]=1;"";[.C50]) -> 0.219364 | H50: of:=IF([.D50]=1;"";[.D50]) ->  | I50: of:=IF([.E50]=1;"";[.E50]) -> 
A51: 15 | B51: strncpy: &"ja"{\0,\x01,\x01,\x01} &"mu"{\0,p,r,\0} 5 :=> &"mu"{\0,\0,\0,\0} | C51: 0.200124 | D51: 0.211853 | E51: 0.211853 | G51: of:=IF([.C51]=1;"";[.C51]) -> 0.200124 | H51: of:=IF([.D51]=1;"";[.D51]) -> 0.211853 | I51: of:=IF([.E51]=1;"";[.E51]) -> 0.211853
A52: 16 | B52: strncpy: &"sb"{\0,\x01,\x01,\x01} &"wlq"{\0,p,\0} 5 :=> &"wlq"{\0,\0,\0} | C52: 0.200533 | D52: 0.0640249 | E52: 0.0640249 | G52: of:=IF([.C52]=1;"";[.C52]) -> 0.200533 | H52: of:=IF([.D52]=1;"";[.D52]) -> 0.0640249 | I52: of:=IF([.E52]=1;"";[.E52]) -> 0.0640249
A53: 17 | B53: strncpy: &"yl"{\0,\x01,\x01,\x01} &"gwoo"{\0,\0} 5 :=> &"gwoo"{\0,\0} | C53: 0.203278 | D53: 0.0419417 | E53: 0.0419417 | G53: of:=IF([.C53]=1;"";[.C53]) -> 0.203278 | H53: of:=IF([.D53]=1;"";[.D53]) -> 0.0419417 | I53: of:=IF([.E53]=1;"";[.E53]) -> 0.0419417
A54: 18 | B54: strncpy: &"me"{\0,\x01,\x01,\x01} &"pivab"{\0} 5 :=> &"pivab"{\0} | C54: 0.22156 | D54: 0.0296358 | E54: 0.0296358 | G54: of:=IF([.C54]=1;"";[.C54]) -> 0.22156 | H54: of:=IF([.D54]=1;"";[.D54]) -> 0.0296358 | I54: of:=IF([.E54]=1;"";[.E54]) -> 0.0296358
A55: 19 | B55: strncpy: &"cna"{\0,\x01,\x01} &""{\0,p,h,y,i,\0} 5 :=> &""{\0,\0,\0,\0,\0,\0} | C55: 0.0730763 | D55: 1 | E55: 1 | G55: of:=IF([.C55]=1;"";[.C55]) -> 0.0730763 | H55: of:=IF([.D55]=1;"";[.D55]) ->  | I55: of:=IF([.E55]=1;"";[.E55]) -> 
A56: 20 | B56: strncpy: &"buq"{\0,\x01,\x01} &"u"{\0,p,e,c,\0} 5 :=> &"u"{\0,\0,\0,\0,\0} | C56: 0.0744986 | D56: 1 | E56: 1 | G56: of:=IF([.C56]=1;"";[.C56]) -> 0.0744986 | H56: of:=IF([.D56]=1;"";[.D56]) ->  | I56: of:=IF([.E56]=1;"";[.E56]) -> 
A57: 21 | B57: strncpy: &"soy"{\0,\x01,\x01} &"my"{\0,p,r,\0} 5 :=> &"my"{\0,\0,\0,\0} | C57: 0.0840282 | D57: 0.207461 | E57: 0.207461 | G57: of:=IF([.C57]=1;"";[.C57]) -> 0.0840282 | H57: of:=IF([.D57]=1;"";[.D57]) -> 0.207461 | I57: of:=IF([.E57]=1;"";[.E57]) -> 0.207461
A58: 22 | B58: strncpy: &"gpw"{\0,\x01,\x01} &"omf"{\0,p,\0} 5 :=> &"omf"{\0,\0,\0} | C58: 0.064248 | D58: 0.0805423 | E58: 0.0805423 | G58: of:=IF([.C58]=1;"";[.C58]) -> 0.064248 | H58: of:=IF([.D58]=1;"";[.D58]) -> 0.0805423 | I58: of:=IF([.E58]=1;"";[.E58]) -> 0.0805423
A59: 23 | B59: strncpy: &"dho"{\0,\x01,\x01} &"zakd"{\0,\0} 5 :=> &"zakd"{\0,\0} | C59: 0.0802001 | D59: 0.0407601 | E59: 0.0407601 | G59: of:=IF([.C59]=1;"";[.C59]) -> 0.0802001 | H59: of:=IF([.D59]=1;"";[.D59]) -> 0.0407601 | I59: of:=IF([.E59]=1;"";[.E59]) -> 0.0407601
A60: 24 | B60: strncpy: &"fmf"{\0,\x01,\x01} &"emslo"{\0} 5 :=> &"emslo"{\0} | C60: 0.0700492 | D60: 0.0296066 | E60: 0.0296066 | G60: of:=IF([.C60]=1;"";[.C60]) -> 0.0700492 | H60: of:=IF([.D60]=1;"";[.D60]) -> 0.0296066 | I60: of:=IF([.E60]=1;"";[.E60]) -> 0.0296066
A61: 25 | B61: strncpy: &"adjp"{\0,\x01} &""{\0,p,l,a,y,\0} 5 :=> &""{\0,\0,\0,\0,\0,\0} | C61: 0.0315167 | D61: 1 | E61: 1 | G61: of:=IF([.C61]=1;"";[.C61]) -> 0.0315167 | H61: of:=IF([.D61]=1;"";[.D61]) ->  | I61: of:=IF([.E61]=1;"";[.E61]) -> 
A62: 26 | B62: strncpy: &"ekno"{\0,\x01} &"d"{\0,p,h,w,\0} 5 :=> &"d"{\0,\0,\0,\0,\0} | C62: 0.0446164 | D62: 1 | E62: 1 | G62: of:=IF([.C62]=1;"";[.C62]) -> 0.0446164 | H62: of:=IF([.D62]=1;"";[.D62]) ->  | I62: of:=IF([.E62]=1;"";[.E62]) -> 
A63: 27 | B63: strncpy: &"mosp"{\0,\x01} &"wp"{\0,p,p,\0} 5 :=> &"wp"{\0,\0,\0,\0} | C63: 0.0469906 | D63: 0.179626 | E63: 0.179626 | G63: of:=IF([.C63]=1;"";[.C63]) -> 0.0469906 | H63: of:=IF([.D63]=1;"";[.D63]) -> 0.179626 | I63: of:=IF([.E63]=1;"";[.E63]) -> 0.179626
A64: 28 | B64: strncpy: &"zovd"{\0,\x01} &"wek"{\0,p,\0} 5 :=> &"wek"{\0,\0,\0} | C64: 0.0371293 | D64: 0.0839492 | E64: 0.0839492 | G64: of:=IF([.C64]=1;"";[.C64]) -> 0.0371293 | H64: of:=IF([.D64]=1;"";[.D64]) -> 0.0839492 | I64: of:=IF([.E64]=1;"";[.E64]) -> 0.0839492
A65: 29 | B65: strncpy: &"wfax"{\0,\x01} &"tual"{\0,\0} 5 :=> &"tual"{\0,\0} | C65: 0.0405423 | D65: 0.0470591 | E65: 0.0470591 | G65: of:=IF([.C65]=1;"";[.C65]) -> 0.0405423 | H65: of:=IF([.D65]=1;"";[.D65]) -> 0.0470591 | I65: of:=IF([.E65]=1;"";[.E65]) -> 0.0470591
A66: 30 | B66: strncpy: &"dtbu"{\0,\x01} &"punwq"{\0} 5 :=> &"punwq"{\0} | C66: 0.0408396 | D66: 0.0222283 | E66: 0.0222283 | G66: of:=IF([.C66]=1;"";[.C66]) -> 0.0408396 | H66: of:=IF([.D66]=1;"";[.D66]) -> 0.0222283 | I66: of:=IF([.E66]=1;"";[.E66]) -> 0.0222283
A67: 31 | B67: strncpy: &"hytsa"{\0} &""{\0,p,p,s,c,\0} 5 :=> &""{\0,\0,\0,\0,\0,\0} | C67: 0.0286054 | D67: 1 | E67: 1 | G67: of:=IF([.C67]=1;"";[.C67]) -> 0.0286054 | H67: of:=IF([.D67]=1;"";[.D67]) ->  | I67: of:=IF([.E67]=1;"";[.E67]) -> 
A68: 32 | B68: strncpy: &"eaymh"{\0} &"v"{\0,p,j,u,\0} 5 :=> &"v"{\0,\0,\0,\0,\0} | C68: 0.0269503 | D68: 1 | E68: 1 | G68: of:=IF([.C68]=1;"";[.C68]) -> 0.0269503 | H68: of:=IF([.D68]=1;"";[.D68]) ->  | I68: of:=IF([.E68]=1;"";[.E68]) -> 
A69: 33 | B69: strncpy: &"xogje"{\0} &"rw"{\0,p,s,\0} 5 :=> &"rw"{\0,\0,\0,\0} | C69: 0.0224629 | D69: 0.201691 | E69: 0.201691 | G69: of:=IF([.C69]=1;"";[.C69]) -> 0.0224629 | H69: of:=IF([.D69]=1;"";[.D69]) -> 0.201691 | I69: of:=IF([.E69]=1;"";[.E69]) -> 0.201691
A70: 34 | B70: strncpy: &"rmvof"{\0} &"dgj"{\0,p,\0} 5 :=> &"dgj"{\0,\0,\0} | C70: 0.0262118 | D70: 0.064033 | E70: 0.064033 | G70: of:=IF([.C70]=1;"";[.C70]) -> 0.0262118 | H70: of:=IF([.D70]=1;"";[.D70]) -> 0.064033 | I70: of:=IF([.E70]=1;"";[.E70]) -> 0.064033
A71: 35 | B71: strncpy: &"racus"{\0} &"avau"{\0,\0} 5 :=> &"avau"{\0,\0} | C71: 0.0309203 | D71: 0.04584 | E71: 0.04584 | G71: of:=IF([.C71]=1;"";[.C71]) -> 0.0309203 | H71: of:=IF([.D71]=1;"";[.D71]) -> 0.04584 | I71: of:=IF([.E71]=1;"";[.E71]) -> 0.04584
A72: 36 | B72: strncpy: &"puppk"{\0} &"ypgof"{\0} 5 :=> &"ypgof"{\0} | C72: 0.0271991 | D72: 0.0275645 | E72: 0.0275645 | G72: of:=IF([.C72]=1;"";[.C72]) -> 0.0271991 | H72: of:=IF([.D72]=1;"";[.D72]) -> 0.0275645 | I72: of:=IF([.E72]=1;"";[.E72]) -> 0.0275645

Sheet: strcat
A1: # | B1: Test Case | C1: N1 | D1: N2 | E1: N3
A2: 1 | B2: strcat: &""{\0,\x01,\x01,\x01,\x01,\x01,\x01,\x01,\x01,\x01} &"m"{\0,p,a,\0} :=> &"m"{\0,p,e,p,w,o,m,m,\0} | C2: 1 | D2: 1 | E2: 1 | G2: of:=IF([.C2]=1;"";[.C2]) ->  | H2: of:=IF([.D2]=1;"";[.D2]) ->  | I2: of:=IF([.E2]=1;"";[.E2]) ->  | K2: of:=AVERAGE([.G2:.G41]) -> 0.0609290041935484 | L2: of:=AVERAGE([.H2:.H41]) -> 0.110852685 | M2: of:=AVERAGE([.I2:.I41]) -> 0.0404705654054054 | O2: of:=AVERAGE([.K2:.M2]) -> 0.0707507515329846
A3: 2 | B3: strcat: &""{\0,\x01,\x01,\x01,\x01,\x01,\x01,\x01,\x01,\x01} &"rq"{\0,p,\0} :=> &"rq"{\0,p,d,l,h,w,c,\0} | C3: 1 | D3: 0.184687 | E3: 0.184687 | G3: of:=IF([.C3]=1;"";[.C3]) ->  | H3: of:=IF([.D3]=1;"";[.D3]) -> 0.184687 | I3: of:=IF([.E3]=1;"";[.E3]) -> 0.184687
A4: 3 | B4: strcat: &""{\0,\x01,\x01,\x01,\x01,\x01,\x01,\x01,\x01,\x01} &"isc"{\0,\0} :=> &"isc"{\0,p,f,i,p,h,\0} | C4: 1 | D4: 0.0875831 | E4: 0.0875831 | G4: of:=IF([.C4]=1;"";[.C4]) ->  | H4: of:=IF([.D4]=1;"";[.D4]) -> 0.0875831 | I4: of:=IF([.E4]=1;"";[.E4]) -> 0.0875831
A5: 4 | B5: strcat: &""{\0,\x01,\x01,\x01,\x01,\x01,\x01,\x01,\x01,\x01} &"ulfa"{\0} :=> &"ulfa"{\0,p,l,d,r,\0} | C5: 1 | D5: 0.0454487 | E5: 0.0454487 | H5: of:=IF([.D5]=1;"";[.D5]) -> 0.0454487 | I5: of:=IF([.E5]=1;"";[.E5]) -> 0.0454487
A6: 5 | B6: strcat: &"m"{\0,\x01,\x01,\x01,\x01,\x01,\x01,\x01,\x01} &""{\0,p,m,s,\0} :=> &"m"{\0,p,l,o,w,i,a,r,\0} | C6: 1 | D6: 1 | E6: 1 | G6: of:=IF([.C6]=1;"";[.C6]) ->  | H6: of:=IF([.D6]=1;"";[.D6]) ->  | I6: of:=IF([.E6]=1;"";[.E6]) -> 
A7: 6 | B7: strcat: &"t"{\0,\x01,\x01,\x01,\x01,\x01,\x01,\x01,\x01} &"z"{\0,p,s,\0} :=> &"tz"{\0,p,k,s,l,l,g,\0} | C7: 1 | D7: 1 | E7: 0.199947 | G7: of:=IF([.C7]=1;"";[.C7]) ->  | H7: of:=IF([.D7]=1;"";[.D7]) ->  | I7: of:=IF([.E7]=1;"";[.E7]) -> 0.199947
A8: 7 | B8: strcat: &"y"{\0,\x01,\x01,\x01,\x01,\x01,\x01,\x01,\x01} &"go"{\0,p,\0} :=> &"ygo"{\0,p,a,u,i,p,\0} | C8: 1 | D8: 0.213322 | E8: 0.0756132 | G8: of:=IF([.C8]=1;"";[.C8]) ->  | H8: of:=IF([.D8]=1;"";[.D8]) -> 0.213322 | I8: of:=IF([.E8]=1;"";[.E8]) -> 0.0756132
A9: 8 | B9: strcat: &"e"{\0,\x01,\x01,\x01,\x01,\x01,\x01,\x01,\x01} &"nav"{\0,\0} :=> &"enav"{\0,p,b,r,i,\0} | C9: 1 | D9: 0.0868219 | E9: 0.0481394 | G9: of:=IF([.C9]=1;"";[.C9]) ->  | H9: of:=IF([.D9]=1;"";[.D9]) -> 0.0868219 | I9: of:=IF([.E9]=1;"";[.E9]) -> 0.0481394
A10: 9 | B10: strcat: &"t"{\0,\x01,\x01,\x01,\x01,\x01,\x01,\x01,\x01} &"apwc"{\0} :=> &"tapwc"{\0,p,s,i,\0} | C10: 1 | D10: 0.0373385 | E10: 0.0251569 | G10: of:=IF([.C10]=1;"";[.C10]) ->  | H10: of:=IF([.D10]=1;"";[.D10]) -> 0.0373385 | I10: of:=IF([.E10]=1;"";[.E10]) -> 0.0251569
A11: 10 | B11: strcat: &"xo"{\0,\x01,\x01,\x01,\x01,\x01,\x01,\x01} &""{\0,p,a,w,\0} :=> &"xo"{\0,p,h,b,o,f,r,\0} | C11: 0.19365 | D11: 1 | E11: 0.19365 | G11: of:=IF([.C11]=1;"";[.C11]) -> 0.19365 | H11: of:=IF([.D11]=1;"";[.D11]) ->  | I11: of:=IF([.E11]=1;"";[.E11]) -> 0.19365
A12: 11 | B12: strcat: &"tt"{\0,\x01,\x01,\x01,\x01,\x01,\x01,\x01} &"c"{\0,p,i,\0} :=> &"ttc"{\0,p,q,v,a,y,\0} | C12: 0.215236 | D12: 1 | E12: 0.0831029 | G12: of:=IF([.C12]=1;"";[.C12]) -> 0.215236 | H12: of:=IF([.D12]=1;"";[.D12]) ->  | I12: of:=IF([.E12]=1;"";[.E12]) -> 0.0831029
A13: 12 | B13: strcat: &"za"{\0,\x01,\x01,\x01,\x01,\x01,\x01,\x01} &"jk"{\0,p,\0} :=> &"zajk"{\0,p,l,v,k,\0} | C13: 0.205157 | D13: 0.163112 | E13: 0.0358746 | G13: of:=IF([.C13]=1;"";[.C13]) -> 0.205157 | H13: of:=IF([.D13]=1;"";[.D13]) -> 0.163112 | I13: of:=IF([.E13]=1;"";[.E13]) -> 0.0358746
A14: 13 | B14: strcat: &"se"{\0,\x01,\x01,\x01,\x01,\x01,\x01,\x01} &"wek"{\0,\0} :=> &"sewek"{\0,p,r,t,\0} | C14: 0.221991 | D14: 0.0839492 | E14: 0.0300102 | G14: of:=IF([.C14]=1;"";[.C14]) -> 0.221991 | H14: of:=IF([.D14]=1;"";[.D14]) -> 0.0839492 | I14: of:=IF([.E14]=1;"";[.E14]) -> 0.0300102
A15: 14 | B15: strcat: &"pw"{\0,\x01,\x01,\x01,\x01,\x01,\x01,\x01} &"vvyc"{\0} :=> &"pwvvyc"{\0,p,h,\0} | C15: 0.18217 | D15: 0.035995 | E15: 0.0115245 | G15: of:=IF([.C15]=1;"";[.C15]) -> 0.18217 | H15: of:=IF([.D15]=1;"";[.D15]) -> 0.035995 | I15: of:=IF([.E15]=1;"";[.E15]) -> 0.0115245
A16: 15 | B16: strcat: &"cwh"{\0,\x01,\x01,\x01,\x01,\x01,\x01} &""{\0,p,r,e,\0} :=> &"cwh"{\0,p,a,v,i,d,\0} | C16: 0.0662463 | D16: 1 | E16: 0.0662463 | G16: of:=IF([.C16]=1;"";[.C16]) -> 0.0662463 | H16: of:=IF([.D16]=1;"";[.D16]) ->  | I16: of:=IF([.E16]=1;"";[.E16]) -> 0.0662463
A17: 16 | B17: strcat: &"gdn"{\0,\x01,\x01,\x01,\x01,\x01,\x01} &"u"{\0,p,g,\0} :=> &"gdnu"{\0,p,l,f,x,\0} | C17: 0.0739452 | D17: 1 | E17: 0.0405615 | G17: of:=IF([.C17]=1;"";[.C17]) -> 0.0739452 | H17: of:=IF([.D17]=1;"";[.D17]) ->  | I17: of:=IF([.E17]=1;"";[.E17]) -> 0.0405615
A18: 17 | B18: strcat: &"ygl"{\0,\x01,\x01,\x01,\x01,\x01,\x01} &"kl"{\0,p,\0} :=> &"yglkl"{\0,p,e,b,\0} | C18: 0.0741707 | D18: 0.204113 | E18: 0.025493 | G18: of:=IF([.C18]=1;"";[.C18]) -> 0.0741707 | H18: of:=IF([.D18]=1;"";[.D18]) -> 0.204113 | I18: of:=IF([.E18]=1;"";[.E18]) -> 0.025493
A19: 18 | B19: strcat: &"vke"{\0,\x01,\x01,\x01,\x01,\x01,\x01} &"gow"{\0,\0} :=> &"vkegow"{\0,p,a,\0} | C19: 0.0669108 | D19: 0.0859045 | E19: 0.0183744 | G19: of:=IF([.C19]=1;"";[.C19]) -> 0.0669108 | H19: of:=IF([.D19]=1;"";[.D19]) -> 0.0859045 | I19: of:=IF([.E19]=1;"";[.E19]) -> 0.0183744
A20: 19 | B20: strcat: &"krv"{\0,\x01,\x01,\x01,\x01,\x01,\x01} &"mflt"{\0} :=> &"krvmflt"{\0,p,\0} | C20: 0.0813457 | D20: 0.042109 | E20: 0.0127608 | G20: of:=IF([.C20]=1;"";[.C20]) -> 0.0813457 | H20: of:=IF([.D20]=1;"";[.D20]) -> 0.042109 | I20: of:=IF([.E20]=1;"";[.E20]) -> 0.0127608
A21: 20 | B21: strcat: &"bmps"{\0,\x01,\x01,\x01,\x01,\x01} &""{\0,p,d,m,\0} :=> &"bmps"{\0,p,v,r,v,\0} | C21: 0.0420965 | D21: 1 | E21: 0.0420965 | G21: of:=IF([.C21]=1;"";[.C21]) -> 0.0420965 | H21: of:=IF([.D21]=1;"";[.D21]) ->  | I21: of:=IF([.E21]=1;"";[.E21]) -> 0.0420965
A22: 21 | B22: strcat: &"ilve"{\0,\x01,\x01,\x01,\x01,\x01} &"x"{\0,p,s,\0} :=> &"ilvex"{\0,p,s,w,\0} | C22: 0.0466503 | D22: 1 | E22: 0.0300109 | G22: of:=IF([.C22]=1;"";[.C22]) -> 0.0466503 | H22: of:=IF([.D22]=1;"";[.D22]) ->  | I22: of:=IF([.E22]=1;"";[.E22]) -> 0.0300109
A23: 22 | B23: strcat: &"rfsy"{\0,\x01,\x01,\x01,\x01,\x01} &"nq"{\0,p,\0} :=> &"rfsynq"{\0,p,l,\0} | C23: 0.0414903 | D23: 0.192934 | E23: 0.0182158 | G23: of:=IF([.C23]=1;"";[.C23]) -> 0.0414903 | H23: of:=IF([.D23]=1;"";[.D23]) -> 0.192934 | I23: of:=IF([.E23]=1;"";[.E23]) -> 0.0182158
A24: 23 | B24: strcat: &"ujct"{\0,\x01,\x01,\x01,\x01,\x01} &"phr"{\0,\0} :=> &"ujctphr"{\0,p,\0} | C24: 0.0343959 | D24: 0.0828646 | E24: 0.0127538 | G24: of:=IF([.C24]=1;"";[.C24]) -> 0.0343959 | H24: of:=IF([.D24]=1;"";[.D24]) -> 0.0828646 | I24: of:=IF([.E24]=1;"";[.E24]) -> 0.0127538
A25: 24 | B25: strcat: &"kjbo"{\0,\x01,\x01,\x01,\x01,\x01} &"vtsf"{\0} :=> &"kjbovtsf"{\0,\0} | C25: 0.0279388 | D25: 0.0370894 | E25: 0.00876637 | G25: of:=IF([.C25]=1;"";[.C25]) -> 0.0279388 | H25: of:=IF([.D25]=1;"";[.D25]) -> 0.0370894 | I25: of:=IF([.E25]=1;"";[.E25]) -> 0.00876637
A26: 25 | B26: strcat: &"ltppm"{\0,\x01,\x01,\x01,\x01} &""{\0,p,u,c,\0} :=> &"ltppm"{\0,p,e,w,\0} | C26: 0.0266939 | D26: 1 | E26: 0.0266939 | G26: of:=IF([.C26]=1;"";[.C26]) -> 0.0266939 | H26: of:=IF([.D26]=1;"";[.D26]) ->  | I26: of:=IF([.E26]=1;"";[.E26]) -> 0.0266939
A27: 26 | B27: strcat: &"dndic"{\0,\x01,\x01,\x01,\x01} &"u"{\0,p,r,\0} :=> &"dndicu"{\0,p,i,\0} | C27: 0.0303822 | D27: 1 | E27: 0.0217665 | G27: of:=IF([.C27]=1;"";[.C27]) -> 0.0303822 | H27: of:=IF([.D27]=1;"";[.D27]) ->  | I27: of:=IF([.E27]=1;"";[.E27]) -> 0.0217665
A28: 27 | B28: strcat: &"hstaw"{\0,\x01,\x01,\x01,\x01} &"un"{\0,p,\0} :=> &"hstawun"{\0,p,\0} | C28: 0.0296786 | D28: 0.218466 | E28: 0.0150991 | G28: of:=IF([.C28]=1;"";[.C28]) -> 0.0296786 | H28: of:=IF([.D28]=1;"";[.D28]) -> 0.218466 | I28: of:=IF([.E28]=1;"";[.E28]) -> 0.0150991
A29: 28 | B29: strcat: &"nxxbi"{\0,\x01,\x01,\x01,\x01} &"inc"{\0,\0} :=> &"nxxbiinc"{\0,\0} | C29: 0.0212816 | D29: 0.090448 | E29: 0.010481 | G29: of:=IF([.C29]=1;"";[.C29]) -> 0.0212816 | H29: of:=IF([.D29]=1;"";[.D29]) -> 0.090448 | I29: of:=IF([.E29]=1;"";[.E29]) -> 0.010481
A30: 29 | B30: strcat: &"duntb"{\0,\x01,\x01,\x01,\x01} &"qwwp"{\0} :=> &"duntbqwwp"{\0} | C30: 0.0292828 | D30: 0.0205288 | E30: 0 | G30: of:=IF([.C30]=1;"";[.C30]) -> 0.0292828 | H30: of:=IF([.D30]=1;"";[.D30]) -> 0.0205288 | I30: of:=IF([.E30]=1;"";[.E30]) -> 0
A31: 30 | B31: strcat: &"ycooyp"{\0,\x01,\x01,\x01} &""{\0,p,i,f,\0} :=> &"ycooyp"{\0,p,j,\0} | C31: 0.0199929 | D31: 1 | E31: 0.0199929 | G31: of:=IF([.C31]=1;"";[.C31]) -> 0.0199929 | H31: of:=IF([.D31]=1;"";[.D31]) ->  | I31: of:=IF([.E31]=1;"";[.E31]) -> 0.0199929
A32: 31 | B32: strcat: &"ppndeg"{\0,\x01,\x01,\x01} &"h"{\0,p,w,\0} :=> &"ppndegh"{\0,p,\0} | C32: 0.0201821 | D32: 1 | E32: 0.0157788 | G32: of:=IF([.C32]=1;"";[.C32]) -> 0.0201821 | H32: of:=IF([.D32]=1;"";[.D32]) ->  | I32: of:=IF([.E32]=1;"";[.E32]) -> 0.0157788
A33: 32 | B33: strcat: &"funkki"{\0,\x01,\x01,\x01} &"uy"{\0,p,\0} :=> &"funkkiuy"{\0,\0} | C33: 0.0196554 | D33: 0.202489 | E33: 0.0119901 | G33: of:=IF([.C33]=1;"";[.C33]) -> 0.0196554 | H33: of:=IF([.D33]=1;"";[.D33]) -> 0.202489 | I33: of:=IF([.E33]=1;"";[.E33]) -> 0.0119901
A34: 33 | B34: strcat: &"hnttmn"{\0,\x01,\x01,\x01} &"sig"{\0,\0} :=> &"hnttmnsig"{\0} | C34: 0.0201146 | D34: 0.0878334 | E34: 0.0111372 | G34: of:=IF([.C34]=1;"";[.C34]) -> 0.0201146 | H34: of:=IF([.D34]=1;"";[.D34]) -> 0.0878334 | I34: of:=IF([.E34]=1;"";[.E34]) -> 0.0111372
A35: 34 | B35: strcat: &"nnhinf"{\0,\x01,\x01,\x01} &&10 :=> &"nnhinfwtre"{} | C35: 0.0212808 | D35: 0.00914297 | G35: of:=IF([.C35]=1;"";[.C35]) -> 0.0212808 | H35: of:=IF([.D35]=1;"";[.D35]) -> 0.00914297 | I35: of:=IF([.E35]=1;"";[.E35]) ->  
A36: 35 | B36: strcat: &"hqugmaw"{\0,\x01,\x01} &""{\0,p,l,v,\0} :=> &"hqugmaw"{\0,p,\0} | C36: 0.0144391 | D36: 1 | E36: 0.0144391 | G36: of:=IF([.C36]=1;"";[.C36]) -> 0.0144391 | H36: of:=IF([.D36]=1;"";[.D36]) ->  | I36: of:=IF([.E36]=1;"";[.E36]) -> 0.0144391
A37: 36 | B37: strcat: &"kbaruve"{\0,\x01,\x01} &"e"{\0,p,h,\0} :=> &"kbaruvee"{\0,\0} | C37: 0.0153556 | D37: 1 | E37: 0.0126985 | G37: of:=IF([.C37]=1;"";[.C37]) -> 0.0153556 | H37: of:=IF([.D37]=1;"";[.D37]) ->  | I37: of:=IF([.E37]=1;"";[.E37]) -> 0.0126985
A38: 37 | B38: strcat: &"ucafcuy"{\0,\x01,\x01} &"in"{\0,p,\0} :=> &"ucafcuyin"{\0} | C38: 0.0146773 | D38: 0.226579 | E38: 0.01041 | G38: of:=IF([.C38]=1;"";[.C38]) -> 0.0146773 | H38: of:=IF([.D38]=1;"";[.D38]) -> 0.226579 | I38: of:=IF([.E38]=1;"";[.E38]) -> 0.01041
A39: 38 | B39: strcat: &"aqubagar"{\0,\x01} &""{\0,p,y,a,\0} :=> &"aqubagar"{\0,\0} | C39: 0.0131723 | D39: 1 | E39: 0.0131723 | G39: of:=IF([.C39]=1;"";[.C39]) -> 0.0131723 | H39: of:=IF([.D39]=1;"";[.D39]) ->  | I39: of:=IF([.E39]=1;"";[.E39]) -> 0.0131723
A40: 39 | B40: strcat: &"havsaqtg"{\0,\x01} &"g"{\0,p,l,\0} :=> &"havsaqtgg"{\0} | C40: 0.0101706 | D40: 1 | E40: 0.00868982 | G40: of:=IF([.C40]=1;"";[.C40]) -> 0.0101706 | H40: of:=IF([.D40]=1;"";[.D40]) ->  | I40: of:=IF([.E40]=1;"";[.E40]) -> 0.00868982
A41: 40 | B41: strcat: &"codmtfnfg"{\0} &""{\0,p,o,e,\0} :=> &"codmtfnfg"{\0} | C41: 0.00904483 | D41: 1 | E41: 0.00904483 | G41: of:=IF([.C41]=1;"";[.C41]) -> 0.00904483 | H41: of:=IF([.D41]=1;"";[.D41]) ->  | I41: of:=IF([.E41]=1;"";[.E41]) -> 0.00904483
A42: 1 | B42: strncat: &""{\0,\x01,\x01,\x01,\x01,\x01,\x01,\x01,\x01,\x01} &""{\0,p,d,w,\0} 4 :=> &""{\0,p,l,k,k,p,e,n,k,\0} | C42: 1 | D42: 1 | E42: 1 | G42: of:=IF([.C42]=1;"";[.C42]) ->  | H42: of:=IF([.D42]=1;"";[.D42]) ->  | I42: of:=IF([.E42]=1;"";[.E42]) ->  | K42: of:=AVERAGE([.G42:.G82]) -> 0.0610185070967742 | L42: of:=AVERAGE([.H42:.H82]) -> 0.112488517272727 | M42: of:=AVERAGE([.I42:.I82]) -> 0.0399922908108108 | O42: of:=AVERAGE([.K42:.M42]) -> 0.0711664383934374
A43: 2 | B43: strncat: &""{\0,\x01,\x01,\x01,\x01,\x01,\x01,\x01,\x01,\x01} &"i"{\0,p,k,\0} 4 :=> &"i"{\0,p,b,b,r,g,r,l,\0} | C43: 1 | D43: 1 | E43: 1 | G43: of:=IF([.C43]=1;"";[.C43]) ->  | H43: of:=IF([.D43]=1;"";[.D43]) ->  | I43: of:=IF([.E43]=1;"";[.E43]) -> 
A44: 3 | B44: strncat: &""{\0,\x01,\x01,\x01,\x01,\x01,\x01,\x01,\x01,\x01} &"by"{\0,p,\0} 4 :=> &"by"{\0,p,w,i,b,s,q,\0} | C44: 1 | D44: 0.215236 | E44: 0.215236 | G44: of:=IF([.C44]=1;"";[.C44]) ->  | H44: of:=IF([.D44]=1;"";[.D44]) -> 0.215236 | I44: of:=IF([.E44]=1;"";[.E44]) -> 0.215236
A45: 4 | B45: strncat: &""{\0,\x01,\x01,\x01,\x01,\x01,\x01,\x01,\x01,\x01} &"dua"{\0,\0} 4 :=> &"dua"{\0,p,a,n,v,d,\0} | C45: 1 | D45: 0.0842685 | E45: 0.0842685 | G45: of:=IF([.C45]=1;"";[.C45]) ->  | H45: of:=IF([.D45]=1;"";[.D45]) -> 0.0842685 | I45: of:=IF([.E45]=1;"";[.E45]) -> 0.0842685
A46: 5 | B46: strncat: &""{\0,\x01,\x01,\x01,\x01,\x01,\x01,\x01,\x01,\x01} &"phgx"{\0} 4 :=> &"phgx"{\0,p,i,c,a,\0} | C46: 1 | D46: 0.0301843 | E46: 0.0301843 | G46: of:=IF([.C46]=1;"";[.C46]) ->  | H46: of:=IF([.D46]=1;"";[.D46]) -> 0.0301843 | I46: of:=IF([.E46]=1;"";[.E46]) -> 0.0301843
A47: 6 | B47: strncat: &"d"{\0,\x01,\x01,\x01,\x01,\x01,\x01,\x01,\x01} &""{\0,p,i,v,\0} 4 :=> &"d"{\0,p,s,i,o,k,v,n,\0} | C47: 1 | D47: 1 | E47: 1 | G47: of:=IF([.C47]=1;"";[.C47]) ->  | H47: of:=IF([.D47]=1;"";[.D47]) ->  | I47: of:=IF([.E47]=1;"";[.E47]) -> 
A48: 7 | B48: strncat: &"y"{\0,\x01,\x01,\x01,\x01,\x01,\x01,\x01,\x01} &"p"{\0,p,r,\0} 4 :=> &"yp"{\0,p,a,m,i,c,y,\0} | C48: 1 | D48: 1 | E48: 0.200766 | G48: of:=IF([.C48]=1;"";[.C48]) ->  | H48: of:=IF([.D48]=1;"";[.D48]) ->  | I48: of:=IF([.E48]=1;"";[.E48]) -> 0.200766
A49: 8 | B49: strncat: &"q"{\0,\x01,\x01,\x01,\x01,\x01,\x01,\x01,\x01} &"ge"{\0,p,\0} 4 :=> &"qge"{\0,p,t,w,n,a,\0} | C49: 1 | D49: 0.218916 | E49: 0 | G49: of:=IF([.C49]=1;"";[.C49]) ->  | H49: of:=IF([.D49]=1;"";[.D49]) -> 0.218916 | I49: of:=IF([.E49]=1;"";[.E49]) -> 0
A50: 9 | B50: strncat: &"r"{\0,\x01,\x01,\x01,\x01,\x01,\x01,\x01,\x01} &"ikk"{\0,\0} 4 :=> &"rikk"{\0,p,k,c,h,\0} | C50: 1 | D50: 0.0749575 | E50: 0.0422123 | G50: of:=IF([.C50]=1;"";[.C50]) ->  | H50: of:=IF([.D50]=1;"";[.D50]) -> 0.0749575 | I50: of:=IF([.E50]=1;"";[.E50]) -> 0.0422123
A51: 10 | B51: strncat: &"v"{\0,\x01,\x01,\x01,\x01,\x01,\x01,\x01,\x01} &"jamf"{\0} 4 :=> &"vjamf"{\0,p,h,r,\0} | C51: 1 | D51: 0.0415351 | E51: 0.0182215 | G51: of:=IF([.C51]=1;"";[.C51]) ->  | H51: of:=IF([.D51]=1;"";[.D51]) -> 0.0415351 | I51: of:=IF([.E51]=1;"";[.E51]) -> 0.0182215
A52: 11 | B52: strncat: &"lp"{\0,\x01,\x01,\x01,\x01,\x01,\x01,\x01} &""{\0,p,c,r,\0} 4 :=> &"lp"{\0,p,t,l,m,l,f,\0} | C52: 0.205646 | D52: 1 | E52: 0.205646 | G52: of:=IF([.C52]=1;"";[.C52]) -> 0.205646 | H52: of:=IF([.D52]=1;"";[.D52]) ->  | I52: of:=IF([.E52]=1;"";[.E52]) -> 0.205646
A53: 12 | B53: strncat: &"qu"{\0,\x01,\x01,\x01,\x01,\x01,\x01,\x01} &"p"{\0,p,j,\0} 4 :=> &"qup"{\0,p,w,l,a,d,\0} | C53: 0.212836 | D53: 1 | E53: 0.0845727 | G53: of:=IF([.C53]=1;"";[.C53]) -> 0.212836 | H53: of:=IF([.D53]=1;"";[.D53]) ->  | I53: of:=IF([.E53]=1;"";[.E53]) -> 0.0845727
A54: 13 | B54: strncat: &"ke"{\0,\x01,\x01,\x01,\x01,\x01,\x01,\x01} &"nf"{\0,p,\0} 4 :=> &"kenf"{\0,p,d,i,m,\0} | C54: 0.217558 | D54: 0.209333 | E54: 0.0470528 | G54: of:=IF([.C54]=1;"";[.C54]) -> 0.217558 | H54: of:=IF([.D54]=1;"";[.D54]) -> 0.209333 | I54: of:=IF([.E54]=1;"";[.E54]) -> 0.0470528
A55: 14 | B55: strncat: &"vk"{\0,\x01,\x01,\x01,\x01,\x01,\x01,\x01} &"ali"{\0,\0} 4 :=> &"vkali"{\0,p,t,t,\0} | C55: 0.156421 | D55: 0.0901151 | E55: 0.0250379 | G55: of:=IF([.C55]=1;"";[.C55]) -> 0.156421 | H55: of:=IF([.D55]=1;"";[.D55]) -> 0.0901151 | I55: of:=IF([.E55]=1;"";[.E55]) -> 0.0250379
A56: 15 | B56: strncat: &"fn"{\0,\x01,\x01,\x01,\x01,\x01,\x01,\x01} &"nacp"{\0} 4 :=> &"fnnacp"{\0,p,o,\0} | C56: 0.177812 | D56: 0.0392794 | E56: 0.0171643 | G56: of:=IF([.C56]=1;"";[.C56]) -> 0.177812 | H56: of:=IF([.D56]=1;"";[.D56]) -> 0.0392794 | I56: of:=IF([.E56]=1;"";[.E56]) -> 0.0171643
A57: 16 | B57: strncat: &"med"{\0,\x01,\x01,\x01,\x01,\x01,\x01} &""{\0,p,j,n,\0} 4 :=> &"med"{\0,p,s,n,c,l,\0} | C57: 0.0903886 | D57: 1 | E57: 0.0903886 | G57: of:=IF([.C57]=1;"";[.C57]) -> 0.0903886 | H57: of:=IF([.D57]=1;"";[.D57]) ->  | I57: of:=IF([.E57]=1;"";[.E57]) -> 0.0903886
A58: 17 | B58: strncat: &"bos"{\0,\x01,\x01,\x01,\x01,\x01,\x01} &"g"{\0,p,t,\0} 4 :=> &"bosg"{\0,p,l,t,e,\0} | C58: 0.0865267 | D58: 1 | E58: 0.0427231 | G58: of:=IF([.C58]=1;"";[.C58]) -> 0.0865267 | H58: of:=IF([.D58]=1;"";[.D58]) ->  | I58: of:=IF([.E58]=1;"";[.E58]) -> 0.0427231
A59: 18 | B59: strncat: &"uqi"{\0,\x01,\x01,\x01,\x01,\x01,\x01} &"sy"{\0,p,\0} 4 :=> &"uqisy"{\0,p,f,e,\0} | C59: 0.0669832 | D59: 0.206985 | E59: 0.0250003 | G59: of:=IF([.C59]=1;"";[.C59]) -> 0.0669832 | H59: of:=IF([.D59]=1;"";[.D59]) -> 0.206985 | I59: of:=IF([.E59]=1;"";[.E59]) -> 0.0250003
A60: 19 | B60: strncat: &"abt"{\0,\x01,\x01,\x01,\x01,\x01,\x01} &"pea"{\0,\0} 4 :=> &"abtpea"{\0,p,l,\0} | C60: 0.0809336 | D60: 0.0889865 | E60: 0.020109 | G60: of:=IF([.C60]=1;"";[.C60]) -> 0.0809336 | H60: of:=IF([.D60]=1;"";[.D60]) -> 0.0889865 | I60: of:=IF([.E60]=1;"";[.E60]) -> 0.020109
A61: 20 | B61: strncat: &"wgr"{\0,\x01,\x01,\x01,\x01,\x01,\x01} &"yaqv"{\0} 4 :=> &"wgryaqv"{\0,p,\0} | C61: 0.0682955 | D61: 0.0308956 | E61: 0.0112218 | G61: of:=IF([.C61]=1;"";[.C61]) -> 0.0682955 | H61: of:=IF([.D61]=1;"";[.D61]) -> 0.0308956 | I61: of:=IF([.E61]=1;"";[.E61]) -> 0.0112218
A62: 21 | B62: strncat: &"gvin"{\0,\x01,\x01,\x01,\x01,\x01} &""{\0,p,a,s,\0} 4 :=> &"gvin"{\0,p,l,m,b,\0} | C62: 0.0385762 | D62: 1 | E62: 0.0385762 | G62: of:=IF([.C62]=1;"";[.C62]) -> 0.0385762 | H62: of:=IF([.D62]=1;"";[.D62]) ->  | I62: of:=IF([.E62]=1;"";[.E62]) -> 0.0385762
A63: 22 | B63: strncat: &"uydl"{\0,\x01,\x01,\x01,\x01,\x01} &"z"{\0,p,r,\0} 4 :=> &"uydlz"{\0,p,f,i,\0} | C63: 0.0406597 | D63: 1 | E63: 0.0245117 | G63: of:=IF([.C63]=1;"";[.C63]) -> 0.0406597 | H63: of:=IF([.D63]=1;"";[.D63]) ->  | I63: of:=IF([.E63]=1;"";[.E63]) -> 0.0245117
A64: 23 | B64: strncat: &"ildw"{\0,\x01,\x01,\x01,\x01,\x01} &"cc"{\0,p,\0} 4 :=> &"ildwcc"{\0,p,p,\0} | C64: 0.0453199 | D64: 0.210352 | E64: 0.0193246 | G64: of:=IF([.C64]=1;"";[.C64]) -> 0.0453199 | H64: of:=IF([.D64]=1;"";[.D64]) -> 0.210352 | I64: of:=IF([.E64]=1;"";[.E64]) -> 0.0193246
A65: 24 | B65: strncat: &"iatp"{\0,\x01,\x01,\x01,\x01,\x01} &"ker"{\0,\0} 4 :=> &"iatpker"{\0,p,\0} | C65: 0.0445869 | D65: 0.0898698 | E65: 0.0156434 | G65: of:=IF([.C65]=1;"";[.C65]) -> 0.0445869 | H65: of:=IF([.D65]=1;"";[.D65]) -> 0.0898698 | I65: of:=IF([.E65]=1;"";[.E65]) -> 0.0156434
A66: 25 | B66: strncat: &"nkac"{\0,\x01,\x01,\x01,\x01,\x01} &"qexa"{\0} 4 :=> &"nkacqexa"{\0,\0} | C66: 0.044601 | D66: 0.0279223 | E66: 0.00942433 | G66: of:=IF([.C66]=1;"";[.C66]) -> 0.044601 | H66: of:=IF([.D66]=1;"";[.D66]) -> 0.0279223 | I66: of:=IF([.E66]=1;"";[.E66]) -> 0.00942433
A67: 26 | B67: strncat: &"porpn"{\0,\x01,\x01,\x01,\x01} &""{\0,p,r,v,\0} 4 :=> &"porpn"{\0,p,a,b,\0} | C67: 0.027342 | D67: 1 | E67: 0.027342 | G67: of:=IF([.C67]=1;"";[.C67]) -> 0.027342 | H67: of:=IF([.D67]=1;"";[.D67]) ->  | I67: of:=IF([.E67]=1;"";[.E67]) -> 0.027342
A68: 27 | B68: strncat: &"honfa"{\0,\x01,\x01,\x01,\x01} &"g"{\0,p,r,\0} 4 :=> &"honfag"{\0,p,r,\0} | C68: 0.0303978 | D68: 1 | E68: 0.021872 | G68: of:=IF([.C68]=1;"";[.C68]) -> 0.0303978 | H68: of:=IF([.D68]=1;"";[.D68]) ->  | I68: of:=IF([.E68]=1;"";[.E68]) -> 0.021872
A69: 28 | B69: strncat: &"nstwr"{\0,\x01,\x01,\x01,\x01} &"vu"{\0,p,\0} 4 :=> &"nstwrvu"{\0,p,\0} | C69: 0.0297391 | D69: 0.188875 | E69: 0.015807 | G69: of:=IF([.C69]=1;"";[.C69]) -> 0.0297391 | H69: of:=IF([.D69]=1;"";[.D69]) -> 0.188875 | I69: of:=IF([.E69]=1;"";[.E69]) -> 0.015807
A70: 29 | B70: strncat: &"zubvs"{\0,\x01,\x01,\x01,\x01} &"ved"{\0,\0} 4 :=> &"zubvsved"{\0,\0} | C70: 0.0237101 | D70: 0.0905294 | E70: 0.0111998 | G70: of:=IF([.C70]=1;"";[.C70]) -> 0.0237101 | H70: of:=IF([.D70]=1;"";[.D70]) -> 0.0905294 | I70: of:=IF([.E70]=1;"";[.E70]) -> 0.0111998
A71: 30 | B71: strncat: &"qvotw"{\0,\x01,\x01,\x01,\x01} &"pfov"{\0} 4 :=> &"qvotwpfov"{\0} | C71: 0.0225828 | D71: 0.0428102 | E71: 0.00860671 | G71: of:=IF([.C71]=1;"";[.C71]) -> 0.0225828 | H71: of:=IF([.D71]=1;"";[.D71]) -> 0.0428102 | I71: of:=IF([.E71]=1;"";[.E71]) -> 0.00860671
A72: 31 | B72: strncat: &"aaccun"{\0,\x01,\x01,\x01} &""{\0,p,c,i,\0} 4 :=> &"aaccun"{\0,p,g,\0} | C72: 0.020401 | D72: 1 | E72: 0.020401 | G72: of:=IF([.C72]=1;"";[.C72]) -> 0.020401 | H72: of:=IF([.D72]=1;"";[.D72]) ->  | I72: of:=IF([.E72]=1;"";[.E72]) -> 0.020401
A73: 32 | B73: strncat: &"blagje"{\0,\x01,\x01,\x01} &"w"{\0,p,a,\0} 4 :=> &"blagjew"{\0,p,\0} | C73: 0.0180845 | D73: 1 | E73: 0.0142849 | G73: of:=IF([.C73]=1;"";[.C73]) -> 0.0180845 | H73: of:=IF([.D73]=1;"";[.D73]) ->  | I73: of:=IF([.E73]=1;"";[.E73]) -> 0.0142849
A74: 33 | B74: strncat: &"ciordd"{\0,\x01,\x01,\x01} &"zt"{\0,p,\0} 4 :=> &"ciorddzt"{\0,\0} | C74: 0.0220143 | D74: 0.17374 | E74: 0.0117023 | G74: of:=IF([.C74]=1;"";[.C74]) -> 0.0220143 | H74: of:=IF([.D74]=1;"";[.D74]) -> 0.17374 | I74: of:=IF([.E74]=1;"";[.E74]) -> 0.0117023
A75: 34 | B75: strncat: &"ofdjor"{\0,\x01,\x01,\x01} &"iat"{\0,\0} 4 :=> &"ofdjoriat"{\0} | C75: 0.0179693 | D75: 0.0893465 | E75: 0.0103627 | G75: of:=IF([.C75]=1;"";[.C75]) -> 0.0179693 | H75: of:=IF([.D75]=1;"";[.D75]) -> 0.0893465 | I75: of:=IF([.E75]=1;"";[.E75]) -> 0.0103627
A76: 35 | B76: strncat: &"sahomo"{\0,\x01,\x01,\x01} &&10 4 :=> &"sahomosyex"{} | C76: 0.0216597 | D76: 0.00992118 | G76: of:=IF([.C76]=1;"";[.C76]) -> 0.0216597 | H76: of:=IF([.D76]=1;"";[.D76]) -> 0.00992118 | I76: of:=IF([.E76]=1;"";[.E76]) ->  
A77: 36 | B77: strncat: &"atwsbrr"{\0,\x01,\x01} &""{\0,p,o,i,\0} 4 :=> &"atwsbrr"{\0,p,\0} | C77: 0.0158519 | D77: 1 | E77: 0.0158519 | G77: of:=IF([.C77]=1;"";[.C77]) -> 0.0158519 | H77: of:=IF([.D77]=1;"";[.D77]) ->  | I77: of:=IF([.E77]=1;"";[.E77]) -> 0.0158519
A78: 37 | B78: strncat: &"iaveqvd"{\0,\x01,\x01} &"m"{\0,p,u,\0} 4 :=> &"iaveqvdm"{\0,\0} | C78: 0.0121272 | D78: 1 | E78: 0.0100082 | G78: of:=IF([.C78]=1;"";[.C78]) -> 0.0121272 | H78: of:=IF([.D78]=1;"";[.D78]) ->  | I78: of:=IF([.E78]=1;"";[.E78]) -> 0.0100082
A79: 38 | B79: strncat: &"wsiswok"{\0,\x01,\x01} &"hi"{\0,p,\0} 4 :=> &"wsiswokhi"{\0} | C79: 0.0163331 | D79: 0.220689 | E79: 0.0109943 | G79: of:=IF([.C79]=1;"";[.C79]) -> 0.0163331 | H79: of:=IF([.D79]=1;"";[.D79]) -> 0.220689 | I79: of:=IF([.E79]=1;"";[.E79]) -> 0.0109943
A80: 39 | B80: strncat: &"arlctmpm"{\0,\x01} &""{\0,p,d,l,\0} 4 :=> &"arlctmpm"{\0,\0} | C80: 0.0128592 | D80: 1 | E80: 0.0128592 | G80: of:=IF([.C80]=1;"";[.C80]) -> 0.0128592 | H80: of:=IF([.D80]=1;"";[.D80]) ->  | I80: of:=IF([.E80]=1;"";[.E80]) -> 0.0128592
A81: 40 | B81: strncat: &"utyaelad"{\0,\x01} &"l"{\0,p,h,\0} 4 :=> &"utyaeladl"{\0} | C81: 0.0134232 | D81: 1 | E81: 0.0112032 | G81: of:=IF([.C81]=1;"";[.C81]) -> 0.0134232 | H81: of:=IF([.D81]=1;"";[.D81]) ->  | I81: of:=IF([.E81]=1;"";[.E81]) -> 0.0112032
A82: 41 | B82: strncat: &"kyuapbves"{\0} &""{\0,p,t,t,\0} 4 :=> &"kyuapbves"{\0} | C82: 0.00993422 | D82: 1 | E82: 0.00993422 | G82: of:=IF([.C82]=1;"";[.C82]) -> 0.00993422 | H82: of:=IF([.D82]=1;"";[.D82]) ->  | I82: of:=IF([.E82]=1;"";[.E82]) -> 0.00993422

Sheet: strstr
A1: # | B1: Test Case | C1: N | G1: N1 | H1: N2 | I1: N3
A2: 1 | B2: strstr: &"i"{\0,h,w,o,\0} &"i"{\0,\0} :=> &"i"{\0,h,w,o,\0} | C2: 1 | D2: 1 | E2: 1 | G2: of:=IF([.C2]=1;"";[.C2]) ->  | H2: of:=IF([.D2]=1;"";[.D2]) ->  | I2: of:=IF([.E2]=1;"";[.E2]) ->  | K2: of:=AVERAGE([.G2:.G19]) -> 0.0757407 | L2: of:=AVERAGE([.H2:.H19]) -> 0.187528444444444 | M2: of:=AVERAGE([.I2:.I19]) -> 0.09953889375 | O2: of:=AVERAGE([.K2:.M2]) -> 0.120936012731481
A3: 2 | B3: strstr: &"oy"{\0,h,t,\0} &"o"{\0,\0} :=> &"oy"{\0,h,t,\0} | C3: 0.207514 | D3: 1 | E3: 0.207514 | G3: of:=IF([.C3]=1;"";[.C3]) -> 0.207514 | H3: of:=IF([.D3]=1;"";[.D3]) ->  | I3: of:=IF([.E3]=1;"";[.E3]) -> 0.207514
A4: 3 | B4: strstr: &"mw"{\0,b,y,\0} &"w"{\0,\0} :=> &"w"{\0,b,y,\0,54} | C4: 0.174098 | D4: 1 | E4: 1 | G4: of:=IF([.C4]=1;"";[.C4]) -> 0.174098 | H4: of:=IF([.D4]=1;"";[.D4]) ->  | I4: of:=IF([.E4]=1;"";[.E4]) -> 
A5: 4 | B5: strstr: &"eut"{\0,h,\0} &"e"{\0,\0} :=> &"eut"{\0,h,\0} | C5: 0.0834884 | D5: 1 | E5: 0.0834884 | G5: of:=IF([.C5]=1;"";[.C5]) -> 0.0834884 | H5: of:=IF([.D5]=1;"";[.D5]) ->  | I5: of:=IF([.E5]=1;"";[.E5]) -> 0.0834884
A6: 5 | B6: strstr: &"lwu"{\0,b,\0} &"w"{\0,\0} :=> &"wu"{\0,b,\0,54} | C6: 0.0675954 | D6: 1 | E6: 0.172378 | G6: of:=IF([.C6]=1;"";[.C6]) -> 0.0675954 | H6: of:=IF([.D6]=1;"";[.D6]) ->  | I6: of:=IF([.E6]=1;"";[.E6]) -> 0.172378
A7: 6 | B7: strstr: &"wbve"{\0,\0} &"w"{\0,\0} :=> &"wbve"{\0,\0} | C7: 0.0401368 | D7: 1 | E7: 0.0401368 | G7: of:=IF([.C7]=1;"";[.C7]) -> 0.0401368 | H7: of:=IF([.D7]=1;"";[.D7]) ->  | I7: of:=IF([.E7]=1;"";[.E7]) -> 0.0401368
A8: 7 | B8: strstr: &"bapi"{\0,\0} &"a"{\0,\0} :=> &"api"{\0,\0,54} | C8: 0.0460515 | D8: 1 | E8: 0.0850278 | G8: of:=IF([.C8]=1;"";[.C8]) -> 0.0460515 | H8: of:=IF([.D8]=1;"";[.D8]) ->  | I8: of:=IF([.E8]=1;"";[.E8]) -> 0.0850278
A9: 8 | B9: strstr: &"iplal"{\0} &"i"{\0,\0} :=> &"iplal"{\0} | C9: 0.0306626 | D9: 1 | E9: 0.0306626 | G9: of:=IF([.C9]=1;"";[.C9]) -> 0.0306626 | H9: of:=IF([.D9]=1;"";[.D9]) ->  | I9: of:=IF([.E9]=1;"";[.E9]) -> 0.0306626
A10: 9 | B10: strstr: &"lboop"{\0} &"b"{\0,\0} :=> &"boop"{\0,54} | C10: 0.0289409 | D10: 1 | E10: 0.0467974 | G10: of:=IF([.C10]=1;"";[.C10]) -> 0.0289409 | H10: of:=IF([.D10]=1;"";[.D10]) ->  | I10: of:=IF([.E10]=1;"";[.E10]) -> 0.0467974
A11: 10 | B11: strstr: &"tt"{\0,d,c,\0} &"tt"{\0} :=> &"tt"{\0,d,c,\0} | C11: 0.215236 | D11: 0.215236 | E11: 0.215236 | G11: of:=IF([.C11]=1;"";[.C11]) -> 0.215236 | H11: of:=IF([.D11]=1;"";[.D11]) -> 0.215236 | I11: of:=IF([.E11]=1;"";[.E11]) -> 0.215236
A12: 11 | B12: strstr: &"yne"{\0,d,\0} &"yn"{\0} :=> &"yne"{\0,d,\0} | C12: 0.0838006 | D12: 0.203502 | E12: 0.0838006 | G12: of:=IF([.C12]=1;"";[.C12]) -> 0.0838006 | H12: of:=IF([.D12]=1;"";[.D12]) -> 0.203502 | I12: of:=IF([.E12]=1;"";[.E12]) -> 0.0838006
A13: 12 | B13: strstr: &"mma"{\0,a,\0} &"ma"{\0} :=> &"ma"{\0,a,\0,54} | C13: 0.0860136 | D13: 0.219364 | E13: 0.219364 | G13: of:=IF([.C13]=1;"";[.C13]) -> 0.0860136 | H13: of:=IF([.D13]=1;"";[.D13]) -> 0.219364 | I13: of:=IF([.E13]=1;"";[.E13]) -> 0.219364
A14: 13 | B14: strstr: &"okd"{\0,p,\0} &"kd"{\0} :=> &"kd"{\0,p,\0,54} | C14: 0.0757524 | D14: 0.188031 | E14: 0.188031 | G14: of:=IF([.C14]=1;"";[.C14]) -> 0.0757524 | H14: of:=IF([.D14]=1;"";[.D14]) -> 0.188031 | I14: of:=IF([.E14]=1;"";[.E14]) -> 0.188031
A15: 14 | B15: strstr: &"wvav"{\0,\0} &"wv"{\0} :=> &"wvav"{\0,\0} | C15: 0.0288513 | D15: 0.106758 | E15: 0.0288513 | G15: of:=IF([.C15]=1;"";[.C15]) -> 0.0288513 | H15: of:=IF([.D15]=1;"";[.D15]) -> 0.106758 | I15: of:=IF([.E15]=1;"";[.E15]) -> 0.0288513
A16: 15 | B16: strstr: &"eewg"{\0,\0} &"ew"{\0} :=> &"ewg"{\0,\0,54} | C16: 0.0389148 | D16: 0.215706 | E16: 0.0685355 | G16: of:=IF([.C16]=1;"";[.C16]) -> 0.0389148 | H16: of:=IF([.D16]=1;"";[.D16]) -> 0.215706 | I16: of:=IF([.E16]=1;"";[.E16]) -> 0.0685355
A17: 16 | B17: strstr: &"slqi"{\0,\0} &"lq"{\0} :=> &"lqi"{\0,\0,54} | C17: 0.0341292 | D17: 0.159409 | E17: 0.0604497 | G17: of:=IF([.C17]=1;"";[.C17]) -> 0.0341292 | H17: of:=IF([.D17]=1;"";[.D17]) -> 0.159409 | I17: of:=IF([.E17]=1;"";[.E17]) -> 0.0604497
A18: 17 | B18: strstr: &"jaylw"{\0} &"ja"{\0} :=> &"jaylw"{\0} | C18: 0.0267842 | D18: 0.200124 | E18: 0.0267842 | G18: of:=IF([.C18]=1;"";[.C18]) -> 0.0267842 | H18: of:=IF([.D18]=1;"";[.D18]) -> 0.200124 | I18: of:=IF([.E18]=1;"";[.E18]) -> 0.0267842
A19: 18 | B19: strstr: &"wwpdm"{\0} &"wp"{\0} :=> &"wpdm"{\0,54} | C19: 0.0196222 | D19: 0.179626 | E19: 0.035565 | G19: of:=IF([.C19]=1;"";[.C19]) -> 0.0196222 | H19: of:=IF([.D19]=1;"";[.D19]) -> 0.179626 | I19: of:=IF([.E19]=1;"";[.E19]) -> 0.035565
A20: 19 | B20: strstr: &"qigeg"{\0} &"ig"{\0} :=> &"igeg"{\0,54} | C20: 0.0279146 | D20: 0.2171 | E20: 0.0468435 | G20: of:=IF([.C20]=1;"";[.C20]) -> 0.0279146 | H20: of:=IF([.D20]=1;"";[.D20]) -> 0.2171 | I20: of:=IF([.E20]=1;"";[.E20]) -> 0.0468435 | K20: of:=AVERAGE([.G20:.G24]) -> 0.02822454 | L20: of:=AVERAGE([.H20:.H24]) -> 0.2144765 | M20: of:=AVERAGE([.I20:.I24]) -> 0.0352916 | O20: of:=AVERAGE([.K20:.M20]) -> 0.0926642133333333
A21: 1 | B21: strnstr: &"gunwt"{\0} &""{\0,p,\0} 2 :=> &"gunwt"{\0} | C21: 0.0270232 | D21: 1 | E21: 0.0270232 | G21: of:=IF([.C21]=1;"";[.C21]) -> 0.0270232 | H21: of:=IF([.D21]=1;"";[.D21]) ->  | I21: of:=IF([.E21]=1;"";[.E21]) -> 0.0270232
A22: 2 | B22: strnstr: &"hmpld"{\0} &"h"{\0,\0} 2 :=> &"hmpld"{\0} | C22: 0.0291437 | D22: 1 | E22: 0.0291437 | G22: of:=IF([.C22]=1;"";[.C22]) -> 0.0291437 | H22: of:=IF([.D22]=1;"";[.D22]) ->  | I22: of:=IF([.E22]=1;"";[.E22]) -> 0.0291437
A23: 3 | B23: strnstr: &"rmpso"{\0} &"m"{\0,\0} 2 :=> &"mpso"{\0,54} | C23: 0.029724 | D23: 1 | E23: 0.0461304 | G23: of:=IF([.C23]=1;"";[.C23]) -> 0.029724 | H23: of:=IF([.D23]=1;"";[.D23]) ->  | I23: of:=IF([.E23]=1;"";[.E23]) -> 0.0461304
A24: 4 | B24: strnstr: &"ysokd"{\0} &"ys"{\0} 2 :=> &"ysokd"{\0} | C24: 0.0273172 | D24: 0.211853 | E24: 0.0273172 | G24: of:=IF([.C24]=1;"";[.C24]) -> 0.0273172 | H24: of:=IF([.D24]=1;"";[.D24]) -> 0.211853 | I24: of:=IF([.E24]=1;"";[.E24]) -> 0.0273172
A25: 1 | B25: strpbrk: &"duiwe"{\0} &"aeiou"{\0} :=> &"uiwe"{\0,54} | C25: 0.0274738 | D25: 0.0299288 | E25: 0.0422715 | G25: of:=IF([.C25]=1;"";[.C25]) -> 0.0274738 | H25: of:=IF([.D25]=1;"";[.D25]) -> 0.0299288 | I25: of:=IF([.E25]=1;"";[.E25]) -> 0.0422715 | K25: of:=AVERAGE([.G25:.G34]) -> 0.02869633 | L25: of:=AVERAGE([.H25:.H34]) -> 0.0299288 | M25: of:=AVERAGE([.I25:.I34]) -> 0.03686076 | O25: of:=AVERAGE([.K25:.M25]) -> 0.03182863
A26: 2 | B26: strpbrk: &"wotrg"{\0} &"aeiou"{\0} :=> &"otrg"{\0,54} | C26: 0.030412 | D26: 0.0299288 | E26: 0.0471045 | G26: of:=IF([.C26]=1;"";[.C26]) -> 0.030412 | H26: of:=IF([.D26]=1;"";[.D26]) -> 0.0299288 | I26: of:=IF([.E26]=1;"";[.E26]) -> 0.0471045
A27: 3 | B27: strpbrk: &"riiex"{\0} &"aeiou"{\0} :=> &"iiex"{\0,54} | C27: 0.0285565 | D27: 0.0299288 | E27: 0.0431748 | G27: of:=IF([.C27]=1;"";[.C27]) -> 0.0285565 | H27: of:=IF([.D27]=1;"";[.D27]) -> 0.0299288 | I27: of:=IF([.E27]=1;"";[.E27]) -> 0.0431748
A28: 4 | B28: strpbrk: &"wesow"{\0} &"aeiou"{\0} :=> &"esow"{\0,54} | C28: 0.0311721 | D28: 0.0299288 | E28: 0.0484122 | G28: of:=IF([.C28]=1;"";[.C28]) -> 0.0311721 | H28: of:=IF([.D28]=1;"";[.D28]) -> 0.0299288 | I28: of:=IF([.E28]=1;"";[.E28]) -> 0.0484122
A29: 5 | B29: strpbrk: &"yassh"{\0} &"aeiou"{\0} :=> &"assh"{\0,54} | C29: 0.0300054 | D29: 0.0299288 | E29: 0.0483011 | G29: of:=IF([.C29]=1;"";[.C29]) -> 0.0300054 | H29: of:=IF([.D29]=1;"";[.D29]) -> 0.0299288 | I29: of:=IF([.E29]=1;"";[.E29]) -> 0.0483011
A30: 6 | B30: strpbrk: &"uetmm"{\0} &"aeiou"{\0} :=> &"uetmm"{\0} | C30: 0.0292619 | D30: 0.0299288 | E30: 0.0292619 | G30: of:=IF([.C30]=1;"";[.C30]) -> 0.0292619 | H30: of:=IF([.D30]=1;"";[.D30]) -> 0.0299288 | I30: of:=IF([.E30]=1;"";[.E30]) -> 0.0292619
A31: 7 | B31: strpbrk: &"owauk"{\0} &"aeiou"{\0} :=> &"owauk"{\0} | C31: 0.0287807 | D31: 0.0299288 | E31: 0.0287807 | G31: of:=IF([.C31]=1;"";[.C31]) -> 0.0287807 | H31: of:=IF([.D31]=1;"";[.D31]) -> 0.0299288 | I31: of:=IF([.E31]=1;"";[.E31]) -> 0.0287807
A32: 8 | B32: strpbrk: &"idtdw"{\0} &"aeiou"{\0} :=> &"idtdw"{\0} | C32: 0.0256304 | D32: 0.0299288 | E32: 0.0256304 | G32: of:=IF([.C32]=1;"";[.C32]) -> 0.0256304 | H32: of:=IF([.D32]=1;"";[.D32]) -> 0.0299288 | I32: of:=IF([.E32]=1;"";[.E32]) -> 0.0256304
A33: 9 | B33: strpbrk: &"ejiad"{\0} &"aeiou"{\0} :=> &"ejiad"{\0} | C33: 0.0267983 | D33: 0.0299288 | E33: 0.0267983 | G33: of:=IF([.C33]=1;"";[.C33]) -> 0.0267983 | H33: of:=IF([.D33]=1;"";[.D33]) -> 0.0299288 | I33: of:=IF([.E33]=1;"";[.E33]) -> 0.0267983
A34: 10 | B34: strpbrk: &"aandg"{\0} &"aeiou"{\0} :=> &"aandg"{\0} | C34: 0.0288722 | D34: 0.0299288 | E34: 0.0288722 | G34: of:=IF([.C34]=1;"";[.C34]) -> 0.0288722 | H34: of:=IF([.D34]=1;"";[.D34]) -> 0.0299288 | I34: of:=IF([.E34]=1;"";[.E34]) -> 0.0288722