Sheet: strlen
A1: strlen: &"\x01"{\0,\0,\0,\0,\0} :=> 1; | J1: # | K1: Test Case | L1: N | P1: FINAL
A2: strlen: &"\x01\x01"{\0,\0,\0,\0} :=> 2; | J2: 1 | K2: strlen: &"b"{\0,p,s,t,\0} :=> 1 | L2: 1 | N2: of:=IF([.L2]=1;"";[.L2]) ->  | P2: of:=AVERAGE([.N2:.N6]) -> 0.090934175
A3: strlen: &"\x01\x01\x01"{\0,\0,\0} :=> 3; | J3: 2 | K3: strlen: &"te"{\0,p,b,\0} :=> 2 | L3: 0.223692 | N3: of:=IF([.L3]=1;"";[.L3]) -> 0.223692
A4: strlen: &"\x01\x01\x01\x01"{\0,\0} :=> 4; | J4: 3 | K4: strlen: &"ewa"{\0,p,\0} :=> 3 | L4: 0.0868156 | N4: of:=IF([.L4]=1;"";[.L4]) -> 0.0868156
A5: strlen: &"\x01\x01\x01\x01\x01"{\0} :=> 5; | J5: 4 | K5: strlen: &"qvyw"{\0,\0} :=> 4 | L5: 0.0303318 | N5: of:=IF([.L5]=1;"";[.L5]) -> 0.0303318
A6: strnlen: &""{\0,\0,\0,\0,\0,\0} 6 :=> 0; 1; | J6: 5 | K6: strlen: &"xxlyc"{\0} :=> 5 | L6: 0.0228973 | N6: of:=IF([.L6]=1;"";[.L6]) -> 0.0228973
A7: strnlen: &"\x01"{\0,\0,\0,\0,\0} 6 :=> 1; | J7: 1 | K7: strnlen: &""{\0,p,c,c,h,\0} 6 :=> 0 | L7: 1 | N7: of:=IF([.L7]=1;"";[.L7]) ->  | P7: of:=AVERAGE([.N7:.N12]) -> 0.083373625
A8: strnlen: &"\x01\x01"{\0,\0,\0,\0} 6 :=> 2; | J8: 2 | K8: strnlen: &"h"{\0,p,h,e,\0} 6 :=> 1 | L8: 1 | N8: of:=IF([.L8]=1;"";[.L8]) -> 
A9: strnlen: &"\x01\x01\x01"{\0,\0,\0} 6 :=> 3; | J9: 3 | K9: strnlen: &"hb"{\0,p,e,\0} 6 :=> 2 | L9: 0.198217 | N9: of:=IF([.L9]=1;"";[.L9]) -> 0.198217
A10: strnlen: &"\x01\x01\x01\x01"{\0,\0} 6 :=> 4; | J10: 4 | K10: strnlen: &"pwm"{\0,p,\0} 6 :=> 3 | L10: 0.0685671 | N10: of:=IF([.L10]=1;"";[.L10]) -> 0.0685671
A11: strnlen: &"\x01\x01\x01\x01\x01"{\0} 6 :=> 5; | J11: 5 | K11: strnlen: &"rnwf"{\0,\0} 6 :=> 4 | L11: 0.0397775 | N11: of:=IF([.L11]=1;"";[.L11]) -> 0.0397775
J12: 6 | K12: strnlen: &"mniml"{\0} 6 :=> 5 | L12: 0.0269329 | N12: of:=IF([.L12]=1;"";[.L12]) -> 0.0269329

Sheet: strcmp
A1: # | B1: Test Case | C1: N1 | D1: N2 | L1: FINAL
A2: 1 | B2: strcmp: &"n"{\0,p,l,m,\0} &"n"{\0,p,m,e,\0} :=> 0 | C2: 1 | D2: 1 | F2: of:=IF([.C2]=1;"";[.C2]) ->  | G2: of:=IF([.D2]=1;"";[.D2]) ->  | H2: of:=IF([.E2]=1;"";[.E2]) ->   | I2: of:=AVERAGE([.F2:.F16]) -> 0.0459038785714286 | J2: of:=AVERAGE([.G2:.G16]) -> 0.0432931071428571 | L2: of:=AVERAGE([.I2:.J2]) -> 0.0445984928571429
A3: 2 | B3: strcmp: &"sf"{\0,p,f,\0} &"sf"{\0,p,r,\0} :=> 0 | C3: 0.200708 | D3: 0.200708 | F3: of:=IF([.C3]=1;"";[.C3]) -> 0.200708 | G3: of:=IF([.D3]=1;"";[.D3]) -> 0.200708 | H3: of:=IF([.E3]=1;"";[.E3]) ->  
A4: 3 | B4: strcmp: &"etr"{\0,p,\0} &"etr"{\0,p,\0} :=> 0 | C4: 0.0881362 | D4: 0.0881362 | F4: of:=IF([.C4]=1;"";[.C4]) -> 0.0881362 | G4: of:=IF([.D4]=1;"";[.D4]) -> 0.0881362 | H4: of:=IF([.E4]=1;"";[.E4]) ->  
A5: 4 | B5: strcmp: &"jays"{\0,\0} &"jays"{\0,\0} :=> 0 | C5: 0.0440431 | D5: 0.0440431 | F5: of:=IF([.C5]=1;"";[.C5]) -> 0.0440431 | G5: of:=IF([.D5]=1;"";[.D5]) -> 0.0440431 | H5: of:=IF([.E5]=1;"";[.E5]) ->  
A6: 5 | B6: strcmp: &"wsidu"{\0} &"wsidu"{\0} :=> 0 | C6: 0.0299102 | D6: 0.0299102 | F6: of:=IF([.C6]=1;"";[.C6]) -> 0.0299102 | G6: of:=IF([.D6]=1;"";[.D6]) -> 0.0299102 | H6: of:=IF([.E6]=1;"";[.E6]) ->  
A7: 6 | B7: strcmp: &"squop"{\0} &"squoa"{\0} :=> 1 | C7: 0.02729 | D7: 0.0268714 | F7: of:=IF([.C7]=1;"";[.C7]) -> 0.02729 | G7: of:=IF([.D7]=1;"";[.D7]) -> 0.0268714 | H7: of:=IF([.E7]=1;"";[.E7]) ->  
A8: 7 | B8: strcmp: &"phfrk"{\0} &"phfrx"{\0} :=> -1 | C8: 0.0273005 | D8: 0.0245816 | F8: of:=IF([.C8]=1;"";[.C8]) -> 0.0273005 | G8: of:=IF([.D8]=1;"";[.D8]) -> 0.0245816 | H8: of:=IF([.E8]=1;"";[.E8]) ->  
A9: 8 | B9: strcmp: &"kntft"{\0} &"kntdk"{\0} :=> 1 | C9: 0.0281685 | D9: 0.0251951 | F9: of:=IF([.C9]=1;"";[.C9]) -> 0.0281685 | G9: of:=IF([.D9]=1;"";[.D9]) -> 0.0251951 | H9: of:=IF([.E9]=1;"";[.E9]) ->  
A10: 9 | B10: strcmp: &"wouer"{\0} &"woulf"{\0} :=> -1 | C10: 0.0313125 | D10: 0.0301334 | F10: of:=IF([.C10]=1;"";[.C10]) -> 0.0313125 | G10: of:=IF([.D10]=1;"";[.D10]) -> 0.0301334 | H10: of:=IF([.E10]=1;"";[.E10]) ->  
A11: 10 | B11: strcmp: &"swoaq"{\0} &"swayo"{\0} :=> 1 | C11: 0.0272734 | D11: 0.0291044 | F11: of:=IF([.C11]=1;"";[.C11]) -> 0.0272734 | G11: of:=IF([.D11]=1;"";[.D11]) -> 0.0291044 | H11: of:=IF([.E11]=1;"";[.E11]) ->  
A12: 11 | B12: strcmp: &"ifjoe"{\0} &"ifqbs"{\0} :=> -1 | C12: 0.0248133 | D12: 0 | F12: of:=IF([.C12]=1;"";[.C12]) -> 0.0248133 | G12: of:=IF([.D12]=1;"";[.D12]) -> 0
A13: 12 | B13: strcmp: &"veryi"{\0} &"vagwk"{\0} :=> 1 | C13: 0.0307366 | D13: 0.0252976 | F13: of:=IF([.C13]=1;"";[.C13]) -> 0.0307366 | G13: of:=IF([.D13]=1;"";[.D13]) -> 0.0252976
A14: 13 | B14: strcmp: &"owtlc"{\0} &"oyckm"{\0} :=> -1 | C14: 0.0270921 | D14: 0.0258963 | F14: of:=IF([.C14]=1;"";[.C14]) -> 0.0270921 | G14: of:=IF([.D14]=1;"";[.D14]) -> 0.0258963
A15: 14 | B15: strcmp: &"howfy"{\0} &"aewye"{\0} :=> 1 | C15: 0.0266349 | D15: 0.0278025 | F15: of:=IF([.C15]=1;"";[.C15]) -> 0.0266349 | G15: of:=IF([.D15]=1;"";[.D15]) -> 0.0278025
A16: 15 | B16: strcmp: &"aggia"{\0} &"vevra"{\0} :=> -1 | C16: 0.029235 | D16: 0.0284237 | F16: of:=IF([.C16]=1;"";[.C16]) -> 0.029235 | G16: of:=IF([.D16]=1;"";[.D16]) -> 0.0284237
A17: 1 | B17: strncmp: &""{\0,p,b,n,a,\0} &""{\0,p,w,n,v,\0} 5 :=> 0 | C17: 1 | D17: 1 | F17: of:=IF([.C17]=1;"";[.C17]) ->  | G17: of:=IF([.D17]=1;"";[.D17]) ->  | I17: of:=AVERAGE([.F17:.F32]) -> 0.0415829214285714 | J17: of:=AVERAGE([.G17:.G32]) -> 0.0421256642857143 | L17: of:=AVERAGE([.I17:.J17]) -> 0.0418542928571429
A18: 2 | B18: strncmp: &"n"{\0,p,a,y,\0} &"n"{\0,p,r,n,\0} 5 :=> 0 | C18: 1 | D18: 1 | F18: of:=IF([.C18]=1;"";[.C18]) ->  | G18: of:=IF([.D18]=1;"";[.D18]) -> 
A19: 3 | B19: strncmp: &"vl"{\0,p,a,\0} &"vl"{\0,p,c,\0} 5 :=> 0 | C19: 0.176458 | D19: 0.176458 | F19: of:=IF([.C19]=1;"";[.C19]) -> 0.176458 | G19: of:=IF([.D19]=1;"";[.D19]) -> 0.176458
A20: 4 | B20: strncmp: &"erm"{\0,p,\0} &"erm"{\0,p,\0} 5 :=> 0 | C20: 0.0889447 | D20: 0.0889447 | F20: of:=IF([.C20]=1;"";[.C20]) -> 0.0889447 | G20: of:=IF([.D20]=1;"";[.D20]) -> 0.0889447
A21: 5 | B21: strncmp: &"ucsp"{\0,\0} &"ucsp"{\0,\0} 5 :=> 0 | C21: 0.0447845 | D21: 0.0447845 | F21: of:=IF([.C21]=1;"";[.C21]) -> 0.0447845 | G21: of:=IF([.D21]=1;"";[.D21]) -> 0.0447845
A22: 6 | B22: strncmp: &"uogtg"{\0} &"uogtg"{\0} 5 :=> 0 | C22: 0.0260713 | D22: 0.0260713 | F22: of:=IF([.C22]=1;"";[.C22]) -> 0.0260713 | G22: of:=IF([.D22]=1;"";[.D22]) -> 0.0260713
A23: 7 | B23: strncmp: &"khsgv"{\0} &"khsgq"{\0} 5 :=> 1 | C23: 0.0209316 | D23: 0.0197392 | F23: of:=IF([.C23]=1;"";[.C23]) -> 0.0209316 | G23: of:=IF([.D23]=1;"";[.D23]) -> 0.0197392
A24: 8 | B24: strncmp: &"frbod"{\0} &"frboi"{\0} 5 :=> -1 | C24: 0.0291946 | D24: 0.0290064 | F24: of:=IF([.C24]=1;"";[.C24]) -> 0.0291946 | G24: of:=IF([.D24]=1;"";[.D24]) -> 0.0290064
A25: 9 | B25: strncmp: &"unmbc"{\0} &"unmav"{\0} 5 :=> 1 | C25: 0.0270077 | D25: 0.0298816 | F25: of:=IF([.C25]=1;"";[.C25]) -> 0.0270077 | G25: of:=IF([.D25]=1;"";[.D25]) -> 0.0298816
A26: 10 | B26: strncmp: &"wdott"{\0} &"wdoxx"{\0} 5 :=> -1 | C26: 0.0286108 | D26: 0.024243 | F26: of:=IF([.C26]=1;"";[.C26]) -> 0.0286108 | G26: of:=IF([.D26]=1;"";[.D26]) -> 0.024243
A27: 11 | B27: strncmp: &"cqihy"{\0} &"cqfyf"{\0} 5 :=> 1 | C27: 0.0236147 | D27: 0.0166471 | F27: of:=IF([.C27]=1;"";[.C27]) -> 0.0236147 | G27: of:=IF([.D27]=1;"";[.D27]) -> 0.0166471
A28: 12 | B28: strncmp: &"ugwdy"{\0} &"ugyun"{\0} 5 :=> -1 | C28: 0.0252451 | D28: 0.0268683 | F28: of:=IF([.C28]=1;"";[.C28]) -> 0.0252451 | G28: of:=IF([.D28]=1;"";[.D28]) -> 0.0268683
A29: 13 | B29: strncmp: &"tkvcu"{\0} &"tgbre"{\0} 5 :=> 1 | C29: 0.0224031 | D29: 0.0257654 | F29: of:=IF([.C29]=1;"";[.C29]) -> 0.0224031 | G29: of:=IF([.D29]=1;"";[.D29]) -> 0.0257654
A30: 14 | B30: strncmp: &"zatkd"{\0} &"zorpo"{\0} 5 :=> -1 | C30: 0.0252288 | D30: 0.0288376 | F30: of:=IF([.C30]=1;"";[.C30]) -> 0.0252288 | G30: of:=IF([.D30]=1;"";[.D30]) -> 0.0288376
A31: 15 | B31: strncmp: &"tkcrm"{\0} &"prhua"{\0} 5 :=> 1 | C31: 0.0238898 | D31: 0.0284386 | F31: of:=IF([.C31]=1;"";[.C31]) -> 0.0238898 | G31: of:=IF([.D31]=1;"";[.D31]) -> 0.0284386
A32: 16 | B32: strncmp: &"qvavd"{\0} &"vccni"{\0} 5 :=> -1 | C32: 0.0197762 | D32: 0.0240736 | F32: of:=IF([.C32]=1;"";[.C32]) -> 0.0197762 | G32: of:=IF([.D32]=1;"";[.D32]) -> 0.0240736
A33: 1 | B33: sysfs_streq: &""{\0,p,e,l,a,\0} &"wutht"{\0} :=> \0 | C33: 1 | D33: 0.0274078 | F33: of:=IF([.C33]=1;"";[.C33]) ->  | G33: of:=IF([.D33]=1;"";[.D33]) -> 0.0274078 | I33: of:=AVERAGE([.F33:.F71]) -> 0.0691169482758621 | J33: of:=AVERAGE([.G33:.G71]) -> 0.0453363214285714 | L33: of:=AVERAGE([.I33:.J33]) -> 0.0572266348522167
A34: 2 | B34: sysfs_streq: &""{\0,p,b,u,t,\0} &"\n"{\0,b,f,l,\0} :=> \x01 | C34: 1 | F34: of:=IF([.C34]=1;"";[.C34]) ->  | G34: of:=IF([.D34]=1;"";[.D34]) ->  
A35: 3 | B35: sysfs_streq: &""{\0,p,h,r,m,\0} &"\nawpi"{\0} :=> \0 | C35: 1 | F35: of:=IF([.C35]=1;"";[.C35]) ->  | G35: of:=IF([.D35]=1;"";[.D35]) ->  
A36: 4 | B36: sysfs_streq: &""{\0,p,c,l,k,\0} &""{\0,h,t,l,s,\0} :=> \x01 | C36: 1 | D36: 1 | F36: of:=IF([.C36]=1;"";[.C36]) ->  | G36: of:=IF([.D36]=1;"";[.D36]) -> 
A37: 5 | B37: sysfs_streq: &"aogtp"{\0} &"eyrog"{\0} :=> \0 | C37: 0.0255503 | D37: 0.0290424 | F37: of:=IF([.C37]=1;"";[.C37]) -> 0.0255503 | G37: of:=IF([.D37]=1;"";[.D37]) -> 0.0290424
A38: 6 | B38: sysfs_streq: &"\n"{\0,p,u,t,\0} &""{\0,a,b,b,n,\0} :=> \x01 | C38: 1 | F38: of:=IF([.C38]=1;"";[.C38]) ->  | G38: of:=IF([.D38]=1;"";[.D38]) ->  
A39: 7 | B39: sysfs_streq: &"\n"{\0,a,a,v,\0} &"gaikv"{\0} :=> \0 | C39: 0.0268302 | F39: of:=IF([.C39]=1;"";[.C39]) -> 0.0268302 | G39: of:=IF([.D39]=1;"";[.D39]) ->  
A40: 8 | B40: sysfs_streq: &"\nafsa"{\0} &"ydtca"{\0} :=> \0 | C40: 0.0262841 | F40: of:=IF([.C40]=1;"";[.C40]) -> 0.0262841 | G40: of:=IF([.D40]=1;"";[.D40]) ->  
A41: 9 | B41: sysfs_streq: &"m"{\0,p,l,m,\0} &"mlexx"{\0} :=> \0 | C41: 1 | D41: 0.0250641 | F41: of:=IF([.C41]=1;"";[.C41]) ->  | G41: of:=IF([.D41]=1;"";[.D41]) -> 0.0250641
A42: 10 | B42: sysfs_streq: &"t"{\0,p,r,b,\0} &"t\n"{\0,a,x,\0} :=> \x01 | C42: 1 | F42: of:=IF([.C42]=1;"";[.C42]) ->  | G42: of:=IF([.D42]=1;"";[.D42]) ->  
A43: 11 | B43: sysfs_streq: &"m"{\0,p,s,e,\0} &"m\narg"{\0} :=> \0 | C43: 1 | F43: of:=IF([.C43]=1;"";[.C43]) ->  | G43: of:=IF([.D43]=1;"";[.D43]) ->  
A44: 12 | B44: sysfs_streq: &"w"{\0,p,f,t,\0} &"w"{\0,h,t,a,\0} :=> \x01 | C44: 1 | D44: 1 | F44: of:=IF([.C44]=1;"";[.C44]) ->  | G44: of:=IF([.D44]=1;"";[.D44]) -> 
A45: 13 | B45: sysfs_streq: &"zodun"{\0} &"zcmel"{\0} :=> \0 | C45: 0.0285229 | D45: 0.0231814 | F45: of:=IF([.C45]=1;"";[.C45]) -> 0.0285229 | G45: of:=IF([.D45]=1;"";[.D45]) -> 0.0231814
A46: 14 | B46: sysfs_streq: &"a\n"{\0,b,n,\0} &"a"{\0,b,h,a,\0} :=> \x01 | C46: 1 | F46: of:=IF([.C46]=1;"";[.C46]) ->  | G46: of:=IF([.D46]=1;"";[.D46]) ->  
A47: 15 | B47: sysfs_streq: &"m\n"{\0,b,o,\0} &"mpsde"{\0} :=> \0 | C47: 0.0290856 | F47: of:=IF([.C47]=1;"";[.C47]) -> 0.0290856 | G47: of:=IF([.D47]=1;"";[.D47]) ->  
A48: 16 | B48: sysfs_streq: &"i\nasa"{\0} &"idoxi"{\0} :=> \0 | C48: 0.0281316 | F48: of:=IF([.C48]=1;"";[.C48]) -> 0.0281316 | G48: of:=IF([.D48]=1;"";[.D48]) ->  
A49: 17 | B49: sysfs_streq: &"eg"{\0,p,a,\0} &"egliw"{\0} :=> \0 | C49: 0.213322 | D49: 0.0274871 | F49: of:=IF([.C49]=1;"";[.C49]) -> 0.213322 | G49: of:=IF([.D49]=1;"";[.D49]) -> 0.0274871
A50: 18 | B50: sysfs_streq: &"rd"{\0,p,g,\0} &"rd\n"{\0,a,\0} :=> \x01 | C50: 0.216174 | F50: of:=IF([.C50]=1;"";[.C50]) -> 0.216174 | G50: of:=IF([.D50]=1;"";[.D50]) ->  
A51: 19 | B51: sysfs_streq: &"xu"{\0,p,i,\0} &"xu\nao"{\0} :=> \0 | C51: 0.196751 | F51: of:=IF([.C51]=1;"";[.C51]) -> 0.196751 | G51: of:=IF([.D51]=1;"";[.D51]) ->  
A52: 20 | B52: sysfs_streq: &"dj"{\0,p,c,\0} &"dj"{\0,b,r,\0} :=> \x01 | C52: 0.194103 | D52: 0.194103 | F52: of:=IF([.C52]=1;"";[.C52]) -> 0.194103 | G52: of:=IF([.D52]=1;"";[.D52]) -> 0.194103
A53: 21 | B53: sysfs_streq: &"vsbfs"{\0} &"vsmii"{\0} :=> \0 | C53: 0.0215801 | D53: 0.0254682 | F53: of:=IF([.C53]=1;"";[.C53]) -> 0.0215801 | G53: of:=IF([.D53]=1;"";[.D53]) -> 0.0254682
A54: 22 | B54: sysfs_streq: &"ky\n"{\0,b,\0} &"ky"{\0,b,a,\0} :=> \x01 | C54: 0.201172 | F54: of:=IF([.C54]=1;"";[.C54]) -> 0.201172 | G54: of:=IF([.D54]=1;"";[.D54]) ->  
A55: 23 | B55: sysfs_streq: &"xa\n"{\0,b,\0} &"xauya"{\0} :=> \0 | C55: 0.0269739 | F55: of:=IF([.C55]=1;"";[.C55]) -> 0.0269739 | G55: of:=IF([.D55]=1;"";[.D55]) ->  
A56: 24 | B56: sysfs_streq: &"nb\nal"{\0} &"nbkor"{\0} :=> \0 | C56: 0.0237387 | F56: of:=IF([.C56]=1;"";[.C56]) -> 0.0237387 | G56: of:=IF([.D56]=1;"";[.D56]) ->  
A57: 25 | B57: sysfs_streq: &"slt"{\0,p,\0} &"sltfu"{\0} :=> \0 | C57: 0.0833285 | D57: 0.0275611 | F57: of:=IF([.C57]=1;"";[.C57]) -> 0.0833285 | G57: of:=IF([.D57]=1;"";[.D57]) -> 0.0275611
A58: 26 | B58: sysfs_streq: &"urk"{\0,p,\0} &"urk\n"{\0,\0} :=> \x01 | C58: 0.0869488 | F58: of:=IF([.C58]=1;"";[.C58]) -> 0.0869488 | G58: of:=IF([.D58]=1;"";[.D58]) ->  
A59: 27 | B59: sysfs_streq: &"zyh"{\0,p,\0} &"zyh\na"{\0} :=> \0 | C59: 0.069482 | F59: of:=IF([.C59]=1;"";[.C59]) -> 0.069482 | G59: of:=IF([.D59]=1;"";[.D59]) ->  
A60: 28 | B60: sysfs_streq: &"nac"{\0,p,\0} &"nac"{\0,h,\0} :=> \x01 | C60: 0.087702 | D60: 0.087702 | F60: of:=IF([.C60]=1;"";[.C60]) -> 0.087702 | G60: of:=IF([.D60]=1;"";[.D60]) -> 0.087702
A61: 29 | B61: sysfs_streq: &"yovvv"{\0} &"yovey"{\0} :=> \0 | C61: 0.0230339 | D61: 0.0301252 | F61: of:=IF([.C61]=1;"";[.C61]) -> 0.0230339 | G61: of:=IF([.D61]=1;"";[.D61]) -> 0.0301252
A62: 30 | B62: sysfs_streq: &"tsi\n"{\0,\0} &"tsi"{\0,a,\0} :=> \x01 | C62: 0.088421 | F62: of:=IF([.C62]=1;"";[.C62]) -> 0.088421 | G62: of:=IF([.D62]=1;"";[.D62]) ->  
A63: 31 | B63: sysfs_streq: &"lul\n"{\0,\0} &"lulck"{\0} :=> \0 | C63: 0.0286063 | F63: of:=IF([.C63]=1;"";[.C63]) -> 0.0286063 | G63: of:=IF([.D63]=1;"";[.D63]) ->  
A64: 32 | B64: sysfs_streq: &"cbe\na"{\0} &"cbepi"{\0} :=> \0 | C64: 0.0259708 | F64: of:=IF([.C64]=1;"";[.C64]) -> 0.0259708 | G64: of:=IF([.D64]=1;"";[.D64]) ->  
A65: 33 | B65: sysfs_streq: &"fabr"{\0,\0} &"fabry"{\0} :=> \0 | C65: 0.0456315 | D65: 0.0295587 | F65: of:=IF([.C65]=1;"";[.C65]) -> 0.0456315 | G65: of:=IF([.D65]=1;"";[.D65]) -> 0.0295587
A66: 34 | B66: sysfs_streq: &"gtce"{\0,\0} &"gtce\n"{\0} :=> \x01 | C66: 0.0445066 | F66: of:=IF([.C66]=1;"";[.C66]) -> 0.0445066 | G66: of:=IF([.D66]=1;"";[.D66]) ->  
A67: 35 | B67: sysfs_streq: &"ksat"{\0,\0} &"ksat"{\0,\0} :=> \x01 | C67: 0.047471 | D67: 0.047471 | F67: of:=IF([.C67]=1;"";[.C67]) -> 0.047471 | G67: of:=IF([.D67]=1;"";[.D67]) -> 0.047471
A68: 36 | B68: sysfs_streq: &"myeiu"{\0} &"myeio"{\0} :=> \0 | C68: 0.0281099 | D68: 0.0296658 | F68: of:=IF([.C68]=1;"";[.C68]) -> 0.0281099 | G68: of:=IF([.D68]=1;"";[.D68]) -> 0.0296658
A69: 37 | B69: sysfs_streq: &"zkji\n"{\0} &"zkji"{\0,\0} :=> \x01 | C69: 0.0315369 | F69: of:=IF([.C69]=1;"";[.C69]) -> 0.0315369 | G69: of:=IF([.D69]=1;"";[.D69]) ->  
A70: 38 | B70: sysfs_streq: &"vajc\n"{\0} &"vajco"{\0} :=> \0 | C70: 0.0245522 | F70: of:=IF([.C70]=1;"";[.C70]) -> 0.0245522 | G70: of:=IF([.D70]=1;"";[.D70]) ->  
A71: 39 | B71: sysfs_streq: &"eercr"{\0} &"eercr"{\0} :=> \x01 | C71: 0.0308707 | D71: 0.0308707 | F71: of:=IF([.C71]=1;"";[.C71]) -> 0.0308707 | G71: of:=IF([.D71]=1;"";[.D71]) -> 0.0308707

Sheet: strcpy
A1: # | B1: Test Case | C1: N1 | D1: N2 | E1: N3 | O1: FINAL
A2: 1 | B2: strcpy: &""{\0,\x01,\x01,\x01,\x01,\x01} &"p"{\0,p,m,t,\0} :=> &"p"{\0,p,i,q,\0} | C2: 1 | D2: 1 | E2: 1 | G2: of:=IF([.C2]=1;"";[.C2]) ->  | H2: of:=IF([.D2]=1;"";[.D2]) ->  | I2: of:=IF([.E2]=1;"";[.E2]) ->  | K2: of:=AVERAGE([.G2:.G36]) -> 0.0855292291666667 | L2: of:=AVERAGE([.H2:.H36]) -> 0.0882804833333333 | M2: of:=AVERAGE([.I2:.I36]) -> 0.0882804833333333 | O2: of:=AVERAGE([.K2:.M2]) -> 0.0873633986111111
A3: 2 | B3: strcpy: &""{\0,\x01,\x01,\x01,\x01,\x01} &"gl"{\0,p,r,\0} :=> &"gl"{\0,p,p,\0} | C3: 1 | D3: 0.208247 | E3: 0.208247 | G3: of:=IF([.C3]=1;"";[.C3]) ->  | H3: of:=IF([.D3]=1;"";[.D3]) -> 0.208247 | I3: of:=IF([.E3]=1;"";[.E3]) -> 0.208247
A4: 3 | B4: strcpy: &""{\0,\x01,\x01,\x01,\x01,\x01} &"msm"{\0,p,\0} :=> &"msm"{\0,p,\0} | C4: 1 | D4: 0.082381 | E4: 0.082381 | G4: of:=IF([.C4]=1;"";[.C4]) ->  | H4: of:=IF([.D4]=1;"";[.D4]) -> 0.082381 | I4: of:=IF([.E4]=1;"";[.E4]) -> 0.082381
A5: 4 | B5: strcpy: &""{\0,\x01,\x01,\x01,\x01,\x01} &"hcal"{\0,\0} :=> &"hcal"{\0,\0} | C5: 1 | D5: 0.0436135 | E5: 0.0436135 | G5: of:=IF([.C5]=1;"";[.C5]) ->  | H5: of:=IF([.D5]=1;"";[.D5]) -> 0.0436135 | I5: of:=IF([.E5]=1;"";[.E5]) -> 0.0436135
A6: 5 | B6: strcpy: &""{\0,\x01,\x01,\x01,\x01,\x01} &"lcmmv"{\0} :=> &"lcmmv"{\0} | C6: 1 | D6: 0.0219822 | E6: 0.0219822 | G6: of:=IF([.C6]=1;"";[.C6]) ->  | H6: of:=IF([.D6]=1;"";[.D6]) -> 0.0219822 | I6: of:=IF([.E6]=1;"";[.E6]) -> 0.0219822
A7: 6 | B7: strcpy: &"f"{\0,\x01,\x01,\x01,\x01} &""{\0,p,d,i,b,\0} :=> &""{\0,\0,p,i,t,\0} | C7: 1 | D7: 1 | E7: 1 | G7: of:=IF([.C7]=1;"";[.C7]) ->  | H7: of:=IF([.D7]=1;"";[.D7]) ->  | I7: of:=IF([.E7]=1;"";[.E7]) -> 
A8: 7 | B8: strcpy: &"g"{\0,\x01,\x01,\x01,\x01} &"a"{\0,p,v,y,\0} :=> &"a"{\0,p,w,r,\0} | C8: 1 | D8: 1 | E8: 1 | G8: of:=IF([.C8]=1;"";[.C8]) ->  | H8: of:=IF([.D8]=1;"";[.D8]) ->  | I8: of:=IF([.E8]=1;"";[.E8]) -> 
A9: 8 | B9: strcpy: &"o"{\0,\x01,\x01,\x01,\x01} &"mi"{\0,p,y,\0} :=> &"mi"{\0,p,p,\0} | C9: 1 | D9: 0.218014 | E9: 0.218014 | G9: of:=IF([.C9]=1;"";[.C9]) ->  | H9: of:=IF([.D9]=1;"";[.D9]) -> 0.218014 | I9: of:=IF([.E9]=1;"";[.E9]) -> 0.218014
A10: 9 | B10: strcpy: &"y"{\0,\x01,\x01,\x01,\x01} &"hup"{\0,p,\0} :=> &"hup"{\0,p,\0} | C10: 1 | D10: 0.0834574 | E10: 0.0834574 | G10: of:=IF([.C10]=1;"";[.C10]) ->  | H10: of:=IF([.D10]=1;"";[.D10]) -> 0.0834574 | I10: of:=IF([.E10]=1;"";[.E10]) -> 0.0834574
A11: 10 | B11: strcpy: &"d"{\0,\x01,\x01,\x01,\x01} &"zvev"{\0,\0} :=> &"zvev"{\0,\0} | C11: 1 | D11: 0.0411174 | E11: 0.0411174 | G11: of:=IF([.C11]=1;"";[.C11]) ->  | H11: of:=IF([.D11]=1;"";[.D11]) -> 0.0411174 | I11: of:=IF([.E11]=1;"";[.E11]) -> 0.0411174
A12: 11 | B12: strcpy: &"z"{\0,\x01,\x01,\x01,\x01} &"zsuxp"{\0} :=> &"zsuxp"{\0} | C12: 1 | D12: 0.0247562 | E12: 0.0247562 | G12: of:=IF([.C12]=1;"";[.C12]) ->  | H12: of:=IF([.D12]=1;"";[.D12]) -> 0.0247562 | I12: of:=IF([.E12]=1;"";[.E12]) -> 0.0247562
A13: 12 | B13: strcpy: &"fo"{\0,\x01,\x01,\x01} &""{\0,p,d,o,o,\0} :=> &""{\0,o,\0,p,b,\0} | C13: 0.219808 | D13: 1 | E13: 1 | G13: of:=IF([.C13]=1;"";[.C13]) -> 0.219808 | H13: of:=IF([.D13]=1;"";[.D13]) ->  | I13: of:=IF([.E13]=1;"";[.E13]) -> 
A14: 13 | B14: strcpy: &"id"{\0,\x01,\x01,\x01} &"y"{\0,p,u,i,\0} :=> &"y"{\0,\0,p,u,\0} | C14: 0.219808 | D14: 1 | E14: 1 | G14: of:=IF([.C14]=1;"";[.C14]) -> 0.219808 | H14: of:=IF([.D14]=1;"";[.D14]) ->  | I14: of:=IF([.E14]=1;"";[.E14]) -> 
A15: 14 | B15: strcpy: &"yw"{\0,\x01,\x01,\x01} &"sk"{\0,p,l,\0} :=> &"sk"{\0,p,i,\0} | C15: 0.197243 | D15: 0.209333 | E15: 0.209333 | G15: of:=IF([.C15]=1;"";[.C15]) -> 0.197243 | H15: of:=IF([.D15]=1;"";[.D15]) -> 0.209333 | I15: of:=IF([.E15]=1;"";[.E15]) -> 0.209333
A16: 15 | B16: strcpy: &"dv"{\0,\x01,\x01,\x01} &"hpp"{\0,p,\0} :=> &"hpp"{\0,p,\0} | C16: 0.204609 | D16: 0.0746936 | E16: 0.0746936 | G16: of:=IF([.C16]=1;"";[.C16]) -> 0.204609 | H16: of:=IF([.D16]=1;"";[.D16]) -> 0.0746936 | I16: of:=IF([.E16]=1;"";[.E16]) -> 0.0746936
A17: 16 | B17: strcpy: &"sr"{\0,\x01,\x01,\x01} &"jnol"{\0,\0} :=> &"jnol"{\0,\0} | C17: 0.201288 | D17: 0.0385695 | E17: 0.0385695 | G17: of:=IF([.C17]=1;"";[.C17]) -> 0.201288 | H17: of:=IF([.D17]=1;"";[.D17]) -> 0.0385695 | I17: of:=IF([.E17]=1;"";[.E17]) -> 0.0385695
A18: 17 | B18: strcpy: &"kv"{\0,\x01,\x01,\x01} &"qslta"{\0} :=> &"qslta"{\0} | C18: 0.178726 | D18: 0.0212518 | E18: 0.0212518 | G18: of:=IF([.C18]=1;"";[.C18]) -> 0.178726 | H18: of:=IF([.D18]=1;"";[.D18]) -> 0.0212518 | I18: of:=IF([.E18]=1;"";[.E18]) -> 0.0212518
A19: 18 | B19: strcpy: &"xso"{\0,\x01,\x01} &""{\0,p,y,a,b,\0} :=> &""{\0,s,o,\0,p,\0} | C19: 0.0720012 | D19: 1 | E19: 1 | G19: of:=IF([.C19]=1;"";[.C19]) -> 0.0720012 | H19: of:=IF([.D19]=1;"";[.D19]) ->  | I19: of:=IF([.E19]=1;"";[.E19]) -> 
A20: 19 | B20: strcpy: &"pfj"{\0,\x01,\x01} &"g"{\0,p,t,i,\0} :=> &"g"{\0,j,\0,p,\0} | C20: 0.0627119 | D20: 1 | E20: 1 | G20: of:=IF([.C20]=1;"";[.C20]) -> 0.0627119 | H20: of:=IF([.D20]=1;"";[.D20]) ->  | I20: of:=IF([.E20]=1;"";[.E20]) -> 
A21: 20 | B21: strcpy: &"owf"{\0,\x01,\x01} &"tt"{\0,p,y,\0} :=> &"tt"{\0,\0,p,\0} | C21: 0.0766471 | D21: 0.215236 | E21: 0.215236 | G21: of:=IF([.C21]=1;"";[.C21]) -> 0.0766471 | H21: of:=IF([.D21]=1;"";[.D21]) -> 0.215236 | I21: of:=IF([.E21]=1;"";[.E21]) -> 0.215236
A22: 21 | B22: strcpy: &"xxa"{\0,\x01,\x01} &"jph"{\0,p,\0} :=> &"jph"{\0,p,\0} | C22: 0.0696041 | D22: 0.0568425 | E22: 0.0568425 | G22: of:=IF([.C22]=1;"";[.C22]) -> 0.0696041 | H22: of:=IF([.D22]=1;"";[.D22]) -> 0.0568425 | I22: of:=IF([.E22]=1;"";[.E22]) -> 0.0568425
A23: 22 | B23: strcpy: &"mmc"{\0,\x01,\x01} &"ehff"{\0,\0} :=> &"ehff"{\0,\0} | C23: 0.0740578 | D23: 0.0408658 | E23: 0.0408658 | G23: of:=IF([.C23]=1;"";[.C23]) -> 0.0740578 | H23: of:=IF([.D23]=1;"";[.D23]) -> 0.0408658 | I23: of:=IF([.E23]=1;"";[.E23]) -> 0.0408658
A24: 23 | B24: strcpy: &"itl"{\0,\x01,\x01} &"gswkm"{\0} :=> &"gswkm"{\0} | C24: 0.0869425 | D24: 0.0246086 | E24: 0.0246086 | G24: of:=IF([.C24]=1;"";[.C24]) -> 0.0869425 | H24: of:=IF([.D24]=1;"";[.D24]) -> 0.0246086 | I24: of:=IF([.E24]=1;"";[.E24]) -> 0.0246086
A25: 24 | B25: strcpy: &"nnam"{\0,\x01} &""{\0,p,h,d,m,\0} :=> &""{\0,n,a,m,\0,\0} | C25: 0.0467092 | D25: 1 | E25: 1 | G25: of:=IF([.C25]=1;"";[.C25]) -> 0.0467092 | H25: of:=IF([.D25]=1;"";[.D25]) ->  | I25: of:=IF([.E25]=1;"";[.E25]) -> 
A26: 25 | B26: strcpy: &"sdee"{\0,\x01} &"h"{\0,p,l,k,\0} :=> &"h"{\0,e,e,\0,\0} | C26: 0.0460057 | D26: 1 | E26: 1 | G26: of:=IF([.C26]=1;"";[.C26]) -> 0.0460057 | H26: of:=IF([.D26]=1;"";[.D26]) ->  | I26: of:=IF([.E26]=1;"";[.E26]) -> 
A27: 26 | B27: strcpy: &"gldf"{\0,\x01} &"at"{\0,p,s,\0} :=> &"at"{\0,f,\0,\0} | C27: 0.042529 | D27: 0.224529 | E27: 0.224529 | G27: of:=IF([.C27]=1;"";[.C27]) -> 0.042529 | H27: of:=IF([.D27]=1;"";[.D27]) -> 0.224529 | I27: of:=IF([.E27]=1;"";[.E27]) -> 0.224529
A28: 27 | B28: strcpy: &"zvlv"{\0,\x01} &"lur"{\0,p,\0} :=> &"lur"{\0,\0,\0} | C28: 0.0341754 | D28: 0.0861723 | E28: 0.0861723 | G28: of:=IF([.C28]=1;"";[.C28]) -> 0.0341754 | H28: of:=IF([.D28]=1;"";[.D28]) -> 0.0861723 | I28: of:=IF([.E28]=1;"";[.E28]) -> 0.0861723
A29: 28 | B29: strcpy: &"ukkn"{\0,\x01} &"jftl"{\0,\0} :=> &"jftl"{\0,\0} | C29: 0.0387619 | D29: 0.0342128 | E29: 0.0342128 | G29: of:=IF([.C29]=1;"";[.C29]) -> 0.0387619 | H29: of:=IF([.D29]=1;"";[.D29]) -> 0.0342128 | I29: of:=IF([.E29]=1;"";[.E29]) -> 0.0342128
A30: 29 | B30: strcpy: &"zbju"{\0,\x01} &"rquqt"{\0} :=> &"rquqt"{\0} | C30: 0.0384165 | D30: 0.0191527 | E30: 0.0191527 | G30: of:=IF([.C30]=1;"";[.C30]) -> 0.0384165 | H30: of:=IF([.D30]=1;"";[.D30]) -> 0.0191527 | I30: of:=IF([.E30]=1;"";[.E30]) -> 0.0191527
A31: 30 | B31: strcpy: &"mrxnt"{\0} &""{\0,p,a,r,y,\0} :=> &""{\0,r,x,n,t,\0} | C31: 0.0205305 | D31: 1 | E31: 1 | G31: of:=IF([.C31]=1;"";[.C31]) -> 0.0205305 | H31: of:=IF([.D31]=1;"";[.D31]) ->  | I31: of:=IF([.E31]=1;"";[.E31]) -> 
A32: 31 | B32: strcpy: &"dawls"{\0} &"k"{\0,p,p,y,\0} :=> &"k"{\0,w,l,s,\0} | C32: 0.0285072 | D32: 1 | E32: 1 | G32: of:=IF([.C32]=1;"";[.C32]) -> 0.0285072 | H32: of:=IF([.D32]=1;"";[.D32]) ->  | I32: of:=IF([.E32]=1;"";[.E32]) -> 
A33: 32 | B33: strcpy: &"vkmgy"{\0} &"rw"{\0,p,i,\0} :=> &"rw"{\0,g,y,\0} | C33: 0.0196762 | D33: 0.201691 | E33: 0.201691 | G33: of:=IF([.C33]=1;"";[.C33]) -> 0.0196762 | H33: of:=IF([.D33]=1;"";[.D33]) -> 0.201691 | I33: of:=IF([.E33]=1;"";[.E33]) -> 0.201691
A34: 33 | B34: strcpy: &"wnioh"{\0} &"axl"{\0,p,\0} :=> &"axl"{\0,h,\0} | C34: 0.0295072 | D34: 0.0703958 | E34: 0.0703958 | G34: of:=IF([.C34]=1;"";[.C34]) -> 0.0295072 | H34: of:=IF([.D34]=1;"";[.D34]) -> 0.0703958 | I34: of:=IF([.E34]=1;"";[.E34]) -> 0.0703958
A35: 34 | B35: strcpy: &"gokoy"{\0} &"powa"{\0,\0} :=> &"powa"{\0,\0} | C35: 0.0275827 | D35: 0.0475957 | E35: 0.0475957 | G35: of:=IF([.C35]=1;"";[.C35]) -> 0.0275827 | H35: of:=IF([.D35]=1;"";[.D35]) -> 0.0475957 | I35: of:=IF([.E35]=1;"";[.E35]) -> 0.0475957
A36: 35 | B36: strcpy: &"wqvoj"{\0} &"omoak"{\0} :=> &"omoak"{\0} | C36: 0.0168534 | D36: 0.0300128 | E36: 0.0300128 | G36: of:=IF([.C36]=1;"";[.C36]) -> 0.0168534 | H36: of:=IF([.D36]=1;"";[.D36]) -> 0.0300128 | I36: of:=IF([.E36]=1;"";[.E36]) -> 0.0300128
A37: 1 | B37: strncpy: &""{\0,\x01,\x01,\x01,\x01,\x01} &""{\0,p,l,t,u,\0} 5 :=> &""{\0,\0,\0,\0,\0,\0} | C37: 1 | D37: 1 | E37: 1 | G37: of:=IF([.C37]=1;"";[.C37]) ->  | H37: of:=IF([.D37]=1;"";[.D37]) ->  | I37: of:=IF([.E37]=1;"";[.E37]) ->  | K37: of:=AVERAGE([.G37:.G72]) -> 0.0862283791666667 | L37: of:=AVERAGE([.H37:.H72]) -> 0.0858017958333333 | M37: of:=AVERAGE([.I37:.I72]) -> 0.0858017958333333 | O37: of:=AVERAGE([.K37:.M37]) -> 0.0859439902777778
A38: 2 | B38: strncpy: &""{\0,\x01,\x01,\x01,\x01,\x01} &"q"{\0,p,s,q,\0} 5 :=> &"q"{\0,\0,\0,\0,\0} | C38: 1 | D38: 1 | E38: 1 | G38: of:=IF([.C38]=1;"";[.C38]) ->  | H38: of:=IF([.D38]=1;"";[.D38]) ->  | I38: of:=IF([.E38]=1;"";[.E38]) -> 
A39: 3 | B39: strncpy: &""{\0,\x01,\x01,\x01,\x01,\x01} &"is"{\0,p,u,\0} 5 :=> &"is"{\0,\0,\0,\0} | C39: 1 | D39: 0.222847 | E39: 0.222847 | G39: of:=IF([.C39]=1;"";[.C39]) ->  | H39: of:=IF([.D39]=1;"";[.D39]) -> 0.222847 | I39: of:=IF([.E39]=1;"";[.E39]) -> 0.222847
A40: 4 | B40: strncpy: &""{\0,\x01,\x01,\x01,\x01,\x01} &"mwp"{\0,p,\0} 5 :=> &"mwp"{\0,\0,\0} | C40: 1 | D40: 0.062536 | E40: 0.062536 | G40: of:=IF([.C40]=1;"";[.C40]) ->  | H40: of:=IF([.D40]=1;"";[.D40]) -> 0.062536 | I40: of:=IF([.E40]=1;"";[.E40]) -> 0.062536
A41: 5 | B41: strncpy: &""{\0,\x01,\x01,\x01,\x01,\x01} &"vtoa"{\0,\0} 5 :=> &"vtoa"{\0,\0} | C41: 1 | D41: 0.0388359 | E41: 0.0388359 | G41: of:=IF([.C41]=1;"";[.C41]) ->  | H41: of:=IF([.D41]=1;"";[.D41]) -> 0.0388359 | I41: of:=IF([.E41]=1;"";[.E41]) -> 0.0388359
A42: 6 | B42: strncpy: &""{\0,\x01,\x01,\x01,\x01,\x01} &"jjdiq"{\0} 5 :=> &"jjdiq"{\0} | C42: 1 | D42: 0.0193483 | E42: 0.0193483 | G42: of:=IF([.C42]=1;"";[.C42]) ->  | H42: of:=IF([.D42]=1;"";[.D42]) -> 0.0193483 | I42: of:=IF([.E42]=1;"";[.E42]) -> 0.0193483
A43: 7 | B43: strncpy: &"f"{\0,\x01,\x01,\x01,\x01} &""{\0,p,e,t,e,\0} 5 :=> &""{\0,\0,\0,\0,\0,\0} | C43: 1 | D43: 1 | E43: 1 | G43: of:=IF([.C43]=1;"";[.C43]) ->  | H43: of:=IF([.D43]=1;"";[.D43]) ->  | I43: of:=IF([.E43]=1;"";[.E43]) -> 
A44: 8 | B44: strncpy: &"h"{\0,\x01,\x01,\x01,\x01} &"u"{\0,p,p,w,\0} 5 :=> &"u"{\0,\0,\0,\0,\0} | C44: 1 | D44: 1 | E44: 1 | G44: of:=IF([.C44]=1;"";[.C44]) ->  | H44: of:=IF([.D44]=1;"";[.D44]) ->  | I44: of:=IF([.E44]=1;"";[.E44]) -> 
A45: 9 | B45: strncpy: &"z"{\0,\x01,\x01,\x01,\x01} &"aj"{\0,p,l,\0} 5 :=> &"aj"{\0,\0,\0,\0} | C45: 1 | D45: 0.203053 | E45: 0.203053 | G45: of:=IF([.C45]=1;"";[.C45]) ->  | H45: of:=IF([.D45]=1;"";[.D45]) -> 0.203053 | I45: of:=IF([.E45]=1;"";[.E45]) -> 0.203053
A46: 10 | B46: strncpy: &"l"{\0,\x01,\x01,\x01,\x01} &"efx"{\0,p,\0} 5 :=> &"efx"{\0,\0,\0} | C46: 1 | D46: 0.0560206 | E46: 0.0560206 | G46: of:=IF([.C46]=1;"";[.C46]) ->  | H46: of:=IF([.D46]=1;"";[.D46]) -> 0.0560206 | I46: of:=IF([.E46]=1;"";[.E46]) -> 0.0560206
A47: 11 | B47: strncpy: &"z"{\0,\x01,\x01,\x01,\x01} &"etug"{\0,\0} 5 :=> &"etug"{\0,\0} | C47: 1 | D47: 0.0467088 | E47: 0.0467088 | G47: of:=IF([.C47]=1;"";[.C47]) ->  | H47: of:=IF([.D47]=1;"";[.D47]) -> 0.0467088 | I47: of:=IF([.E47]=1;"";[.E47]) -> 0.0467088
A48: 12 | B48: strncpy: &"e"{\0,\x01,\x01,\x01,\x01} &"pwqit"{\0} 5 :=> &"pwqit"{\0} | C48: 1 | D48: 0.0199241 | E48: 0.0199241 | G48: of:=IF([.C48]=1;"";[.C48]) ->  | H48: of:=IF([.D48]=1;"";[.D48]) -> 0.0199241 | I48: of:=IF([.E48]=1;"";[.E48]) -> 0.0199241
A49: 13 | B49: strncpy: &"sk"{\0,\x01,\x01,\x01} &""{\0,p,f,i,l,\0} 5 :=> &""{\0,\0,\0,\0,\0,\0} | C49: 0.209333 | D49: 1 | E49: 1 | G49: of:=IF([.C49]=1;"";[.C49]) -> 0.209333 | H49: of:=IF([.D49]=1;"";[.D49]) ->  | I49: of:=IF([.E49]=1;"";[.E49]) -> 
A50: 14 | B50: strncpy: &"ua"{\0,\x01,\x01,\x01} &"s"{\0,p,o,k,\0} 5 :=> &"s"{\0,\0,\0,\0,\0} | C50: 0.212836 | D50: 1 | E50: 1 | G50: of:=IF([.C50]=1;"";[.C50]) -> 0.212836 | H50: of:=IF([.D50]=1;"";[.D50]) ->  | I50: of:=IF([.E50]=1;"";[.E50]) -> 
A51: 15 | B51: strncpy: &"sv"{\0,\x01,\x01,\x01} &"ka"{\0,p,g,\0} 5 :=> &"ka"{\0,\0,\0,\0} | C51: 0.186599 | D51: 0.204058 | E51: 0.204058 | G51: of:=IF([.C51]=1;"";[.C51]) -> 0.186599 | H51: of:=IF([.D51]=1;"";[.D51]) -> 0.204058 | I51: of:=IF([.E51]=1;"";[.E51]) -> 0.204058
A52: 16 | B52: strncpy: &"pw"{\0,\x01,\x01,\x01} &"sfo"{\0,p,\0} 5 :=> &"sfo"{\0,\0,\0} | C52: 0.18217 | D52: 0.0823545 | E52: 0.0823545 | G52: of:=IF([.C52]=1;"";[.C52]) -> 0.18217 | H52: of:=IF([.D52]=1;"";[.D52]) -> 0.0823545 | I52: of:=IF([.E52]=1;"";[.E52]) -> 0.0823545
A53: 17 | B53: strncpy: &"ja"{\0,\x01,\x01,\x01} &"avkl"{\0,\0} 5 :=> &"avkl"{\0,\0} | C53: 0.200124 | D53: 0.0362504 | E53: 0.0362504 | G53: of:=IF([.C53]=1;"";[.C53]) -> 0.200124 | H53: of:=IF([.D53]=1;"";[.D53]) -> 0.0362504 | I53: of:=IF([.E53]=1;"";[.E53]) -> 0.0362504
A54: 18 | B54: strncpy: &"jo"{\0,\x01,\x01,\x01} &"apmet"{\0} 5 :=> &"apmet"{\0} | C54: 0.2083 | D54: 0.0295223 | E54: 0.0295223 | G54: of:=IF([.C54]=1;"";[.C54]) -> 0.2083 | H54: of:=IF([.D54]=1;"";[.D54]) -> 0.0295223 | I54: of:=IF([.E54]=1;"";[.E54]) -> 0.0295223
A55: 19 | B55: strncpy: &"ahh"{\0,\x01,\x01} &""{\0,p,j,e,r,\0} 5 :=> &""{\0,\0,\0,\0,\0,\0} | C55: 0.0723864 | D55: 1 | E55: 1 | G55: of:=IF([.C55]=1;"";[.C55]) -> 0.0723864 | H55: of:=IF([.D55]=1;"";[.D55]) ->  | I55: of:=IF([.E55]=1;"";[.E55]) -> 
A56: 20 | B56: strncpy: &"fya"{\0,\x01,\x01} &"l"{\0,p,w,a,\0} 5 :=> &"l"{\0,\0,\0,\0,\0} | C56: 0.0767063 | D56: 1 | E56: 1 | G56: of:=IF([.C56]=1;"";[.C56]) -> 0.0767063 | H56: of:=IF([.D56]=1;"";[.D56]) ->  | I56: of:=IF([.E56]=1;"";[.E56]) -> 
A57: 21 | B57: strncpy: &"wms"{\0,\x01,\x01} &"pc"{\0,p,q,\0} 5 :=> &"pc"{\0,\0,\0,\0} | C57: 0.0772229 | D57: 0.181308 | E57: 0.181308 | G57: of:=IF([.C57]=1;"";[.C57]) -> 0.0772229 | H57: of:=IF([.D57]=1;"";[.D57]) -> 0.181308 | I57: of:=IF([.E57]=1;"";[.E57]) -> 0.181308
A58: 22 | B58: strncpy: &"gki"{\0,\x01,\x01} &"wly"{\0,p,\0} 5 :=> &"wly"{\0,\0,\0} | C58: 0.0711589 | D58: 0.0823848 | E58: 0.0823848 | G58: of:=IF([.C58]=1;"";[.C58]) -> 0.0711589 | H58: of:=IF([.D58]=1;"";[.D58]) -> 0.0823848 | I58: of:=IF([.E58]=1;"";[.E58]) -> 0.0823848
A59: 23 | B59: strncpy: &"lia"{\0,\x01,\x01} &"xswe"{\0,\0} 5 :=> &"xswe"{\0,\0} | C59: 0.0884001 | D59: 0.0385415 | E59: 0.0385415 | G59: of:=IF([.C59]=1;"";[.C59]) -> 0.0884001 | H59: of:=IF([.D59]=1;"";[.D59]) -> 0.0385415 | I59: of:=IF([.E59]=1;"";[.E59]) -> 0.0385415
A60: 24 | B60: strncpy: &"egu"{\0,\x01,\x01} &"rdsqb"{\0} 5 :=> &"rdsqb"{\0} | C60: 0.0837994 | D60: 0.0221044 | E60: 0.0221044 | G60: of:=IF([.C60]=1;"";[.C60]) -> 0.0837994 | H60: of:=IF([.D60]=1;"";[.D60]) -> 0.0221044 | I60: of:=IF([.E60]=1;"";[.E60]) -> 0.0221044
A61: 25 | B61: strncpy: &"eiqu"{\0,\x01} &""{\0,p,a,b,s,\0} 5 :=> &""{\0,\0,\0,\0,\0,\0} | C61: 0.043363 | D61: 1 | E61: 1 | G61: of:=IF([.C61]=1;"";[.C61]) -> 0.043363 | H61: of:=IF([.D61]=1;"";[.D61]) ->  | I61: of:=IF([.E61]=1;"";[.E61]) -> 
A62: 26 | B62: strncpy: &"luff"{\0,\x01} &"z"{\0,p,d,d,\0} 5 :=> &"z"{\0,\0,\0,\0,\0} | C62: 0.0442942 | D62: 1 | E62: 1 | G62: of:=IF([.C62]=1;"";[.C62]) -> 0.0442942 | H62: of:=IF([.D62]=1;"";[.D62]) ->  | I62: of:=IF([.E62]=1;"";[.E62]) -> 
A63: 27 | B63: strncpy: &"iqil"{\0,\x01} &"ys"{\0,p,g,\0} 5 :=> &"ys"{\0,\0,\0,\0} | C63: 0.040602 | D63: 0.211853 | E63: 0.211853 | G63: of:=IF([.C63]=1;"";[.C63]) -> 0.040602 | H63: of:=IF([.D63]=1;"";[.D63]) -> 0.211853 | I63: of:=IF([.E63]=1;"";[.E63]) -> 0.211853
A64: 28 | B64: strncpy: &"zbcc"{\0,\x01} &"hka"{\0,p,\0} 5 :=> &"hka"{\0,\0,\0} | C64: 0.03725 | D64: 0.0719566 | E64: 0.0719566 | G64: of:=IF([.C64]=1;"";[.C64]) -> 0.03725 | H64: of:=IF([.D64]=1;"";[.D64]) -> 0.0719566 | I64: of:=IF([.E64]=1;"";[.E64]) -> 0.0719566
A65: 29 | B65: strncpy: &"bapa"{\0,\x01} &"vyki"{\0,\0} 5 :=> &"vyki"{\0,\0} | C65: 0.0467242 | D65: 0.0390529 | E65: 0.0390529 | G65: of:=IF([.C65]=1;"";[.C65]) -> 0.0467242 | H65: of:=IF([.D65]=1;"";[.D65]) -> 0.0390529 | I65: of:=IF([.E65]=1;"";[.E65]) -> 0.0390529
A66: 30 | B66: strncpy: &"lquv"{\0,\x01} &"psiho"{\0} 5 :=> &"psiho"{\0} | C66: 0.0349529 | D66: 0.0278477 | E66: 0.0278477 | G66: of:=IF([.C66]=1;"";[.C66]) -> 0.0349529 | H66: of:=IF([.D66]=1;"";[.D66]) -> 0.0278477 | I66: of:=IF([.E66]=1;"";[.E66]) -> 0.0278477
A67: 31 | B67: strncpy: &"mwlsq"{\0} &""{\0,p,g,m,g,\0} 5 :=> &""{\0,\0,\0,\0,\0,\0} | C67: 0.0243373 | D67: 1 | E67: 1 | G67: of:=IF([.C67]=1;"";[.C67]) -> 0.0243373 | H67: of:=IF([.D67]=1;"";[.D67]) ->  | I67: of:=IF([.E67]=1;"";[.E67]) -> 
A68: 32 | B68: strncpy: &"hlksp"{\0} &"d"{\0,p,s,p,\0} 5 :=> &"d"{\0,\0,\0,\0,\0} | C68: 0.0277887 | D68: 1 | E68: 1 | G68: of:=IF([.C68]=1;"";[.C68]) -> 0.0277887 | H68: of:=IF([.D68]=1;"";[.D68]) ->  | I68: of:=IF([.E68]=1;"";[.E68]) -> 
A69: 33 | B69: strncpy: &"fathb"{\0} &"mp"{\0,p,k,\0} 5 :=> &"mp"{\0,\0,\0,\0} | C69: 0.0300091 | D69: 0.2171 | E69: 0.2171 | G69: of:=IF([.C69]=1;"";[.C69]) -> 0.0300091 | H69: of:=IF([.D69]=1;"";[.D69]) -> 0.2171 | I69: of:=IF([.E69]=1;"";[.E69]) -> 0.2171
A70: 34 | B70: strncpy: &"fxyot"{\0} &"aki"{\0,p,\0} 5 :=> &"aki"{\0,\0,\0} | C70: 0.0201627 | D70: 0.0844225 | E70: 0.0844225 | G70: of:=IF([.C70]=1;"";[.C70]) -> 0.0201627 | H70: of:=IF([.D70]=1;"";[.D70]) -> 0.0844225 | I70: of:=IF([.E70]=1;"";[.E70]) -> 0.0844225
A71: 35 | B71: strncpy: &"kbwsv"{\0} &"mdfs"{\0,\0} 5 :=> &"mdfs"{\0,\0} | C71: 0.0231869 | D71: 0.0363181 | E71: 0.0363181 | G71: of:=IF([.C71]=1;"";[.C71]) -> 0.0231869 | H71: of:=IF([.D71]=1;"";[.D71]) -> 0.0363181 | I71: of:=IF([.E71]=1;"";[.E71]) -> 0.0363181
A72: 36 | B72: strncpy: &"cyinq"{\0} &"xyghr"{\0} 5 :=> &"xyghr"{\0} | C72: 0.0277741 | D72: 0.0248947 | E72: 0.0248947 | G72: of:=IF([.C72]=1;"";[.C72]) -> 0.0277741 | H72: of:=IF([.D72]=1;"";[.D72]) -> 0.0248947 | I72: of:=IF([.E72]=1;"";[.E72]) -> 0.0248947

Sheet: strcat
A1: # | B1: Test Case | C1: N1 | D1: N2 | E1: N3
A2: 1 | B2: strcat: &""{\0,\x01,\x01,\x01,\x01,\x01,\x01,\x01,\x01,\x01} &"v"{\0,p,g,\0} :=> &"v"{\0,p,u,n,a,b,n,a,\0} | C2: 1 | D2: 1 | E2: 1 | G2: of:=IF([.C2]=1;"";[.C2]) ->  | H2: of:=IF([.D2]=1;"";[.D2]) ->  | I2: of:=IF([.E2]=1;"";[.E2]) ->  | K2: of:=AVERAGE([.G2:.G41]) -> 0.061811114516129 | L2: of:=AVERAGE([.H2:.H41]) -> 0.112747795909091 | M2: of:=AVERAGE([.I2:.I41]) -> 0.0417196472972973 | O2: of:=AVERAGE([.K2:.M2]) -> 0.0720928525741724
A3: 2 | B3: strcat: &""{\0,\x01,\x01,\x01,\x01,\x01,\x01,\x01,\x01,\x01} &"ap"{\0,p,\0} :=> &"ap"{\0,p,r,t,u,t,h,\0} | C3: 1 | D3: 0.215236 | E3: 0.215236 | G3: of:=IF([.C3]=1;"";[.C3]) ->  | H3: of:=IF([.D3]=1;"";[.D3]) -> 0.215236 | I3: of:=IF([.E3]=1;"";[.E3]) -> 0.215236
A4: 3 | B4: strcat: &""{\0,\x01,\x01,\x01,\x01,\x01,\x01,\x01,\x01,\x01} &"adj"{\0,\0} :=> &"adj"{\0,p,r,p,i,s,\0} | C4: 1 | D4: 0.0797871 | E4: 0.0797871 | G4: of:=IF([.C4]=1;"";[.C4]) ->  | H4: of:=IF([.D4]=1;"";[.D4]) -> 0.0797871 | I4: of:=IF([.E4]=1;"";[.E4]) -> 0.0797871
A5: 4 | B5: strcat: &""{\0,\x01,\x01,\x01,\x01,\x01,\x01,\x01,\x01,\x01} &"ojti"{\0} :=> &"ojti"{\0,p,k,b,k,\0} | C5: 1 | D5: 0.035223 | E5: 0.035223 | H5: of:=IF([.D5]=1;"";[.D5]) -> 0.035223 | I5: of:=IF([.E5]=1;"";[.E5]) -> 0.035223
A6: 5 | B6: strcat: &"k"{\0,\x01,\x01,\x01,\x01,\x01,\x01,\x01,\x01} &""{\0,p,h,g,\0} :=> &"k"{\0,p,w,m,l,d,a,t,\0} | C6: 1 | D6: 1 | E6: 1 | G6: of:=IF([.C6]=1;"";[.C6]) ->  | H6: of:=IF([.D6]=1;"";[.D6]) ->  | I6: of:=IF([.E6]=1;"";[.E6]) -> 
A7: 6 | B7: strcat: &"y"{\0,\x01,\x01,\x01,\x01,\x01,\x01,\x01,\x01} &"b"{\0,p,y,\0} :=> &"yb"{\0,p,a,j,o,b,j,\0} | C7: 1 | D7: 1 | E7: 0.198338 | G7: of:=IF([.C7]=1;"";[.C7]) ->  | H7: of:=IF([.D7]=1;"";[.D7]) ->  | I7: of:=IF([.E7]=1;"";[.E7]) -> 0.198338
A8: 7 | B8: strcat: &"m"{\0,\x01,\x01,\x01,\x01,\x01,\x01,\x01,\x01} &"gh"{\0,p,\0} :=> &"mgh"{\0,p,r,s,q,u,\0} | C8: 1 | D8: 0.216638 | E8: 0.072408 | G8: of:=IF([.C8]=1;"";[.C8]) ->  | H8: of:=IF([.D8]=1;"";[.D8]) -> 0.216638 | I8: of:=IF([.E8]=1;"";[.E8]) -> 0.072408
A9: 8 | B9: strcat: &"e"{\0,\x01,\x01,\x01,\x01,\x01,\x01,\x01,\x01} &"fat"{\0,\0} :=> &"efat"{\0,p,i,u,n,\0} | C9: 1 | D9: 0.0881115 | E9: 0.0472994 | G9: of:=IF([.C9]=1;"";[.C9]) ->  | H9: of:=IF([.D9]=1;"";[.D9]) -> 0.0881115 | I9: of:=IF([.E9]=1;"";[.E9]) -> 0.0472994
A10: 9 | B10: strcat: &"u"{\0,\x01,\x01,\x01,\x01,\x01,\x01,\x01,\x01} &"kfiv"{\0} :=> &"ukfiv"{\0,p,h,r,\0} | C10: 1 | D10: 0.0429208 | E10: 0.026635 | G10: of:=IF([.C10]=1;"";[.C10]) ->  | H10: of:=IF([.D10]=1;"";[.D10]) -> 0.0429208 | I10: of:=IF([.E10]=1;"";[.E10]) -> 0.026635
A11: 10 | B11: strcat: &"fr"{\0,\x01,\x01,\x01,\x01,\x01,\x01,\x01} &""{\0,p,w,l,\0} :=> &"fr"{\0,p,k,w,l,f,r,\0} | C11: 0.215706 | D11: 1 | E11: 0.215706 | G11: of:=IF([.C11]=1;"";[.C11]) -> 0.215706 | H11: of:=IF([.D11]=1;"";[.D11]) ->  | I11: of:=IF([.E11]=1;"";[.E11]) -> 0.215706
A12: 11 | B12: strcat: &"vr"{\0,\x01,\x01,\x01,\x01,\x01,\x01,\x01} &"i"{\0,p,s,\0} :=> &"vri"{\0,p,u,i,k,e,\0} | C12: 0.185059 | D12: 1 | E12: 0.0775461 | G12: of:=IF([.C12]=1;"";[.C12]) -> 0.185059 | H12: of:=IF([.D12]=1;"";[.D12]) ->  | I12: of:=IF([.E12]=1;"";[.E12]) -> 0.0775461
A13: 12 | B13: strcat: &"vy"{\0,\x01,\x01,\x01,\x01,\x01,\x01,\x01} &"no"{\0,p,\0} :=> &"vyno"{\0,p,t,n,y,\0} | C13: 0.197671 | D13: 0.218466 | E13: 0.0425857 | G13: of:=IF([.C13]=1;"";[.C13]) -> 0.197671 | H13: of:=IF([.D13]=1;"";[.D13]) -> 0.218466 | I13: of:=IF([.E13]=1;"";[.E13]) -> 0.0425857
A14: 13 | B14: strcat: &"rj"{\0,\x01,\x01,\x01,\x01,\x01,\x01,\x01} &"reg"{\0,\0} :=> &"rjreg"{\0,p,s,o,\0} | C14: 0.180031 | D14: 0.0882113 | E14: 0.0203957 | G14: of:=IF([.C14]=1;"";[.C14]) -> 0.180031 | H14: of:=IF([.D14]=1;"";[.D14]) -> 0.0882113 | I14: of:=IF([.E14]=1;"";[.E14]) -> 0.0203957
A15: 14 | B15: strcat: &"gr"{\0,\x01,\x01,\x01,\x01,\x01,\x01,\x01} &"emrb"{\0} :=> &"gremrb"{\0,p,i,\0} | C15: 0.214762 | D15: 0.0406014 | E15: 0.0198984 | G15: of:=IF([.C15]=1;"";[.C15]) -> 0.214762 | H15: of:=IF([.D15]=1;"";[.D15]) -> 0.0406014 | I15: of:=IF([.E15]=1;"";[.E15]) -> 0.0198984
A16: 15 | B16: strcat: &"ipt"{\0,\x01,\x01,\x01,\x01,\x01,\x01} &""{\0,p,p,s,\0} :=> &"ipt"{\0,p,l,o,j,i,\0} | C16: 0.0827077 | D16: 1 | E16: 0.0827077 | G16: of:=IF([.C16]=1;"";[.C16]) -> 0.0827077 | H16: of:=IF([.D16]=1;"";[.D16]) ->  | I16: of:=IF([.E16]=1;"";[.E16]) -> 0.0827077
A17: 16 | B17: strcat: &"vav"{\0,\x01,\x01,\x01,\x01,\x01,\x01} &"c"{\0,p,d,\0} :=> &"vavc"{\0,p,h,i,q,\0} | C17: 0.0850115 | D17: 1 | E17: 0.0414301 | G17: of:=IF([.C17]=1;"";[.C17]) -> 0.0850115 | H17: of:=IF([.D17]=1;"";[.D17]) ->  | I17: of:=IF([.E17]=1;"";[.E17]) -> 0.0414301
A18: 17 | B18: strcat: &"dht"{\0,\x01,\x01,\x01,\x01,\x01,\x01} &"ac"{\0,p,\0} :=> &"dhtac"{\0,p,g,g,\0} | C18: 0.078584 | D18: 0.218916 | E18: 0.0287404 | G18: of:=IF([.C18]=1;"";[.C18]) -> 0.078584 | H18: of:=IF([.D18]=1;"";[.D18]) -> 0.218916 | I18: of:=IF([.E18]=1;"";[.E18]) -> 0.0287404
A19: 18 | B19: strcat: &"nyt"{\0,\x01,\x01,\x01,\x01,\x01,\x01} &"uty"{\0,\0} :=> &"nytuty"{\0,p,o,\0} | C19: 0.080994 | D19: 0.0872419 | E19: 0.0209988 | G19: of:=IF([.C19]=1;"";[.C19]) -> 0.080994 | H19: of:=IF([.D19]=1;"";[.D19]) -> 0.0872419 | I19: of:=IF([.E19]=1;"";[.E19]) -> 0.0209988
A20: 19 | B20: strcat: &"wyb"{\0,\x01,\x01,\x01,\x01,\x01,\x01} &"xlag"{\0} :=> &"wybxlag"{\0,p,\0} | C20: 0.0755164 | D20: 0.0412063 | E20: 0 | G20: of:=IF([.C20]=1;"";[.C20]) -> 0.0755164 | H20: of:=IF([.D20]=1;"";[.D20]) -> 0.0412063 | I20: of:=IF([.E20]=1;"";[.E20]) -> 0
A21: 20 | B21: strcat: &"lthd"{\0,\x01,\x01,\x01,\x01,\x01} &""{\0,p,a,i,\0} :=> &"lthd"{\0,p,f,u,p,\0} | C21: 0.0448107 | D21: 1 | E21: 0.0448107 | G21: of:=IF([.C21]=1;"";[.C21]) -> 0.0448107 | H21: of:=IF([.D21]=1;"";[.D21]) ->  | I21: of:=IF([.E21]=1;"";[.E21]) -> 0.0448107
A22: 21 | B22: strcat: &"nqun"{\0,\x01,\x01,\x01,\x01,\x01} &"r"{\0,p,o,\0} :=> &"nqunr"{\0,p,d,w,\0} | C22: 0.0431743 | D22: 1 | E22: 0.0269096 | G22: of:=IF([.C22]=1;"";[.C22]) -> 0.0431743 | H22: of:=IF([.D22]=1;"";[.D22]) ->  | I22: of:=IF([.E22]=1;"";[.E22]) -> 0.0269096
A23: 22 | B23: strcat: &"brbn"{\0,\x01,\x01,\x01,\x01,\x01} &"rt"{\0,p,\0} :=> &"brbnrt"{\0,p,h,\0} | C23: 0.0395273 | D23: 0.218916 | E23: 0.0185166 | G23: of:=IF([.C23]=1;"";[.C23]) -> 0.0395273 | H23: of:=IF([.D23]=1;"";[.D23]) -> 0.218916 | I23: of:=IF([.E23]=1;"";[.E23]) -> 0.0185166
A24: 23 | B24: strcat: &"iunw"{\0,\x01,\x01,\x01,\x01,\x01} &"wde"{\0,\0} :=> &"iunwwde"{\0,p,\0} | C24: 0.0424317 | D24: 0.0814045 | E24: 0.0131236 | G24: of:=IF([.C24]=1;"";[.C24]) -> 0.0424317 | H24: of:=IF([.D24]=1;"";[.D24]) -> 0.0814045 | I24: of:=IF([.E24]=1;"";[.E24]) -> 0.0131236
A25: 24 | B25: strcat: &"vaqi"{\0,\x01,\x01,\x01,\x01,\x01} &"wndn"{\0} :=> &"vaqiwndn"{\0,\0} | C25: 0.0395097 | D25: 0.0453487 | E25: 0.0115374 | G25: of:=IF([.C25]=1;"";[.C25]) -> 0.0395097 | H25: of:=IF([.D25]=1;"";[.D25]) -> 0.0453487 | I25: of:=IF([.E25]=1;"";[.E25]) -> 0.0115374
A26: 25 | B26: strcat: &"glshn"{\0,\x01,\x01,\x01,\x01} &""{\0,p,f,v,\0} :=> &"glshn"{\0,p,d,s,\0} | C26: 0.0288219 | D26: 1 | E26: 0.0288219 | G26: of:=IF([.C26]=1;"";[.C26]) -> 0.0288219 | H26: of:=IF([.D26]=1;"";[.D26]) ->  | I26: of:=IF([.E26]=1;"";[.E26]) -> 0.0288219
A27: 26 | B27: strcat: &"cvagh"{\0,\x01,\x01,\x01,\x01} &"u"{\0,p,j,\0} :=> &"cvaghu"{\0,p,f,\0} | C27: 0.0231748 | D27: 1 | E27: 0.016975 | G27: of:=IF([.C27]=1;"";[.C27]) -> 0.0231748 | H27: of:=IF([.D27]=1;"";[.D27]) ->  | I27: of:=IF([.E27]=1;"";[.E27]) -> 0.016975
A28: 27 | B28: strcat: &"jabfb"{\0,\x01,\x01,\x01,\x01} &"fy"{\0,p,\0} :=> &"jabfbfy"{\0,p,\0} | C28: 0.0213873 | D28: 0.198096 | E28: 0.0109615 | G28: of:=IF([.C28]=1;"";[.C28]) -> 0.0213873 | H28: of:=IF([.D28]=1;"";[.D28]) -> 0.198096 | I28: of:=IF([.E28]=1;"";[.E28]) -> 0.0109615
A29: 28 | B29: strcat: &"voror"{\0,\x01,\x01,\x01,\x01} &"zld"{\0,\0} :=> &"vororzld"{\0,\0} | C29: 0.0313892 | D29: 0.0782362 | E29: 0.0127625 | G29: of:=IF([.C29]=1;"";[.C29]) -> 0.0313892 | H29: of:=IF([.D29]=1;"";[.D29]) -> 0.0782362 | I29: of:=IF([.E29]=1;"";[.E29]) -> 0.0127625
A30: 29 | B30: strcat: &"varfp"{\0,\x01,\x01,\x01,\x01} &"zhjy"{\0} :=> &"varfpzhjy"{\0} | C30: 0.0247272 | D30: 0.0242853 | E30: 0.00643351 | G30: of:=IF([.C30]=1;"";[.C30]) -> 0.0247272 | H30: of:=IF([.D30]=1;"";[.D30]) -> 0.0242853 | I30: of:=IF([.E30]=1;"";[.E30]) -> 0.00643351
A31: 30 | B31: strcat: &"aynjmn"{\0,\x01,\x01,\x01} &""{\0,p,s,e,\0} :=> &"aynjmn"{\0,p,v,\0} | C31: 0.016941 | D31: 1 | E31: 0.016941 | G31: of:=IF([.C31]=1;"";[.C31]) -> 0.016941 | H31: of:=IF([.D31]=1;"";[.D31]) ->  | I31: of:=IF([.E31]=1;"";[.E31]) -> 0.016941
A32: 31 | B32: strcat: &"letelp"{\0,\x01,\x01,\x01} &"h"{\0,p,g,\0} :=> &"letelph"{\0,p,\0} | C32: 0.0219903 | D32: 1 | E32: 0.016808 | G32: of:=IF([.C32]=1;"";[.C32]) -> 0.0219903 | H32: of:=IF([.D32]=1;"";[.D32]) ->  | I32: of:=IF([.E32]=1;"";[.E32]) -> 0.016808
A33: 32 | B33: strcat: &"quboca"{\0,\x01,\x01,\x01} &"oe"{\0,p,\0} :=> &"qubocaoe"{\0,\0} | C33: 0.0214286 | D33: 0.207356 | E33: 0.0128266 | G33: of:=IF([.C33]=1;"";[.C33]) -> 0.0214286 | H33: of:=IF([.D33]=1;"";[.D33]) -> 0.207356 | I33: of:=IF([.E33]=1;"";[.E33]) -> 0.0128266
A34: 33 | B34: strcat: &"asiayn"{\0,\x01,\x01,\x01} &"gmh"{\0,\0} :=> &"asiayngmh"{\0} | C34: 0.0217449 | D34: 0.0687073 | E34: 0.0106019 | G34: of:=IF([.C34]=1;"";[.C34]) -> 0.0217449 | H34: of:=IF([.D34]=1;"";[.D34]) -> 0.0687073 | I34: of:=IF([.E34]=1;"";[.E34]) -> 0.0106019
A35: 34 | B35: strcat: &"qlidur"{\0,\x01,\x01,\x01} &&10 :=> &"qlidurvocd"{} | C35: 0.0165343 | D35: 0.00789721 | G35: of:=IF([.C35]=1;"";[.C35]) -> 0.0165343 | H35: of:=IF([.D35]=1;"";[.D35]) -> 0.00789721 | I35: of:=IF([.E35]=1;"";[.E35]) ->  
A36: 35 | B36: strcat: &"ubtnked"{\0,\x01,\x01} &""{\0,p,o,t,\0} :=> &"ubtnked"{\0,p,\0} | C36: 0.0157874 | D36: 1 | E36: 0.0157874 | G36: of:=IF([.C36]=1;"";[.C36]) -> 0.0157874 | H36: of:=IF([.D36]=1;"";[.D36]) ->  | I36: of:=IF([.E36]=1;"";[.E36]) -> 0.0157874
A37: 36 | B37: strcat: &"iqiupot"{\0,\x01,\x01} &"a"{\0,p,r,\0} :=> &"iqiupota"{\0,\0} | C37: 0.014804 | D37: 1 | E37: 0.0123171 | G37: of:=IF([.C37]=1;"";[.C37]) -> 0.014804 | H37: of:=IF([.D37]=1;"";[.D37]) ->  | I37: of:=IF([.E37]=1;"";[.E37]) -> 0.0123171
A38: 37 | B38: strcat: &"ntscall"{\0,\x01,\x01} &"zk"{\0,p,\0} :=> &"ntscallzk"{\0} | C38: 0.0176106 | D38: 0.177645 | E38: 0.0106054 | G38: of:=IF([.C38]=1;"";[.C38]) -> 0.0176106 | H38: of:=IF([.D38]=1;"";[.D38]) -> 0.177645 | I38: of:=IF([.E38]=1;"";[.E38]) -> 0.0106054
A39: 38 | B39: strcat: &"nearwnpw"{\0,\x01} &""{\0,p,y,l,\0} :=> &"nearwnpw"{\0,\0} | C39: 0.0123065 | D39: 1 | E39: 0.0123065 | G39: of:=IF([.C39]=1;"";[.C39]) -> 0.0123065 | H39: of:=IF([.D39]=1;"";[.D39]) ->  | I39: of:=IF([.E39]=1;"";[.E39]) -> 0.0123065
A40: 39 | B40: strcat: &"dquisauw"{\0,\x01} &"f"{\0,p,r,\0} :=> &"dquisauwf"{\0} | C40: 0.0122522 | D40: 1 | E40: 0.00989729 | G40: of:=IF([.C40]=1;"";[.C40]) -> 0.0122522 | H40: of:=IF([.D40]=1;"";[.D40]) ->  | I40: of:=IF([.E40]=1;"";[.E40]) -> 0.00989729
A41: 40 | B41: strcat: &"nwknekcra"{\0} &""{\0,p,o,y,\0} :=> &"nwknekcra"{\0} | C41: 0.00974805 | D41: 1 | E41: 0.00974805 | G41: of:=IF([.C41]=1;"";[.C41]) -> 0.00974805 | H41: of:=IF([.D41]=1;"";[.D41]) ->  | I41: of:=IF([.E41]=1;"";[.E41]) -> 0.00974805
A42: 1 | B42: strncat: &""{\0,\x01,\x01,\x01,\x01,\x01,\x01,\x01,\x01,\x01} &""{\0,p,h,y,\0} 4 :=> &""{\0,p,u,b,y,e,r,i,h,\0} | C42: 1 | D42: 1 | E42: 1 | G42: of:=IF([.C42]=1;"";[.C42]) ->  | H42: of:=IF([.D42]=1;"";[.D42]) ->  | I42: of:=IF([.E42]=1;"";[.E42]) ->  | K42: of:=AVERAGE([.G42:.G82]) -> 0.0612539322580645 | L42: of:=AVERAGE([.H42:.H82]) -> 0.114509100454545 | M42: of:=AVERAGE([.I42:.I82]) -> 0.0406266162162162 | O42: of:=AVERAGE([.K42:.M42]) -> 0.0721298829762754
A43: 2 | B43: strncat: &""{\0,\x01,\x01,\x01,\x01,\x01,\x01,\x01,\x01,\x01} &"j"{\0,p,w,\0} 4 :=> &"j"{\0,p,t,l,s,o,f,f,\0} | C43: 1 | D43: 1 | E43: 1 | G43: of:=IF([.C43]=1;"";[.C43]) ->  | H43: of:=IF([.D43]=1;"";[.D43]) ->  | I43: of:=IF([.E43]=1;"";[.E43]) -> 
A44: 3 | B44: strncat: &""{\0,\x01,\x01,\x01,\x01,\x01,\x01,\x01,\x01,\x01} &"bb"{\0,p,\0} 4 :=> &"bb"{\0,p,f,l,m,k,v,\0} | C44: 1 | D44: 0.202885 | E44: 0.202885 | G44: of:=IF([.C44]=1;"";[.C44]) ->  | H44: of:=IF([.D44]=1;"";[.D44]) -> 0.202885 | I44: of:=IF([.E44]=1;"";[.E44]) -> 0.202885
A45: 4 | B45: strncat: &""{\0,\x01,\x01,\x01,\x01,\x01,\x01,\x01,\x01,\x01} &"nal"{\0,\0} 4 :=> &"nal"{\0,p,w,r,u,f,\0} | C45: 1 | D45: 0.0889594 | E45: 0.0889594 | G45: of:=IF([.C45]=1;"";[.C45]) ->  | H45: of:=IF([.D45]=1;"";[.D45]) -> 0.0889594 | I45: of:=IF([.E45]=1;"";[.E45]) -> 0.0889594
A46: 5 | B46: strncat: &""{\0,\x01,\x01,\x01,\x01,\x01,\x01,\x01,\x01,\x01} &"hsbw"{\0} 4 :=> &"hsbw"{\0,p,p,s,n,\0} | C46: 1 | D46: 0.0389827 | E46: 0.0389827 | G46: of:=IF([.C46]=1;"";[.C46]) ->  | H46: of:=IF([.D46]=1;"";[.D46]) -> 0.0389827 | I46: of:=IF([.E46]=1;"";[.E46]) -> 0.0389827
A47: 6 | B47: strncat: &"l"{\0,\x01,\x01,\x01,\x01,\x01,\x01,\x01,\x01} &""{\0,p,u,m,\0} 4 :=> &"l"{\0,p,h,o,h,f,n,s,\0} | C47: 1 | D47: 1 | E47: 1 | G47: of:=IF([.C47]=1;"";[.C47]) ->  | H47: of:=IF([.D47]=1;"";[.D47]) ->  | I47: of:=IF([.E47]=1;"";[.E47]) -> 
A48: 7 | B48: strncat: &"k"{\0,\x01,\x01,\x01,\x01,\x01,\x01,\x01,\x01} &"v"{\0,p,d,\0} 4 :=> &"kv"{\0,p,o,o,d,u,l,\0} | C48: 1 | D48: 1 | E48: 0.178726 | G48: of:=IF([.C48]=1;"";[.C48]) ->  | H48: of:=IF([.D48]=1;"";[.D48]) ->  | I48: of:=IF([.E48]=1;"";[.E48]) -> 0.178726
A49: 8 | B49: strncat: &"p"{\0,\x01,\x01,\x01,\x01,\x01,\x01,\x01,\x01} &"hs"{\0,p,\0} 4 :=> &"phs"{\0,p,p,p,t,o,\0} | C49: 1 | D49: 0.204664 | E49: 0.0807591 | G49: of:=IF([.C49]=1;"";[.C49]) ->  | H49: of:=IF([.D49]=1;"";[.D49]) -> 0.204664 | I49: of:=IF([.E49]=1;"";[.E49]) -> 0.0807591
A50: 9 | B50: strncat: &"e"{\0,\x01,\x01,\x01,\x01,\x01,\x01,\x01,\x01} &"adn"{\0,\0} 4 :=> &"eadn"{\0,p,g,u,a,\0} | C50: 1 | D50: 0.082954 | E50: 0.045993 | G50: of:=IF([.C50]=1;"";[.C50]) ->  | H50: of:=IF([.D50]=1;"";[.D50]) -> 0.082954 | I50: of:=IF([.E50]=1;"";[.E50]) -> 0.045993
A51: 10 | B51: strncat: &"f"{\0,\x01,\x01,\x01,\x01,\x01,\x01,\x01,\x01} &"kbvr"{\0} 4 :=> &"fkbvr"{\0,p,l,t,\0} | C51: 1 | D51: 0.0354564 | E51: 0.021358 | G51: of:=IF([.C51]=1;"";[.C51]) ->  | H51: of:=IF([.D51]=1;"";[.D51]) -> 0.0354564 | I51: of:=IF([.E51]=1;"";[.E51]) -> 0.021358
A52: 11 | B52: strncat: &"qi"{\0,\x01,\x01,\x01,\x01,\x01,\x01,\x01} &""{\0,p,d,u,\0} 4 :=> &"qi"{\0,p,y,d,a,l,g,\0} | C52: 0.188031 | D52: 1 | E52: 0.188031 | G52: of:=IF([.C52]=1;"";[.C52]) -> 0.188031 | H52: of:=IF([.D52]=1;"";[.D52]) ->  | I52: of:=IF([.E52]=1;"";[.E52]) -> 0.188031
A53: 12 | B53: strncat: &"ff"{\0,\x01,\x01,\x01,\x01,\x01,\x01,\x01} &"u"{\0,p,t,\0} 4 :=> &"ffu"{\0,p,p,t,e,v,\0} | C53: 0.214762 | D53: 1 | E53: 0.084092 | G53: of:=IF([.C53]=1;"";[.C53]) -> 0.214762 | H53: of:=IF([.D53]=1;"";[.D53]) ->  | I53: of:=IF([.E53]=1;"";[.E53]) -> 0.084092
A54: 13 | B54: strncat: &"ub"{\0,\x01,\x01,\x01,\x01,\x01,\x01,\x01} &"wy"{\0,p,\0} 4 :=> &"ubwy"{\0,p,v,n,y,\0} | C54: 0.212346 | D54: 0.199593 | E54: 0.0398272 | G54: of:=IF([.C54]=1;"";[.C54]) -> 0.212346 | H54: of:=IF([.D54]=1;"";[.D54]) -> 0.199593 | I54: of:=IF([.E54]=1;"";[.E54]) -> 0.0398272
A55: 14 | B55: strncat: &"ik"{\0,\x01,\x01,\x01,\x01,\x01,\x01,\x01} &"rwm"{\0,\0} 4 :=> &"ikrwm"{\0,p,i,s,\0} | C55: 0.210352 | D55: 0.0743845 | E55: 0.0253614 | G55: of:=IF([.C55]=1;"";[.C55]) -> 0.210352 | H55: of:=IF([.D55]=1;"";[.D55]) -> 0.0743845 | I55: of:=IF([.E55]=1;"";[.E55]) -> 0.0253614
A56: 15 | B56: strncat: &"zq"{\0,\x01,\x01,\x01,\x01,\x01,\x01,\x01} &"wsji"{\0} 4 :=> &"zqwsji"{\0,p,s,\0} | C56: 0.155927 | D56: 0.0355235 | E56: 0.0105572 | G56: of:=IF([.C56]=1;"";[.C56]) -> 0.155927 | H56: of:=IF([.D56]=1;"";[.D56]) -> 0.0355235 | I56: of:=IF([.E56]=1;"";[.E56]) -> 0.0105572
A57: 16 | B57: strncat: &"jop"{\0,\x01,\x01,\x01,\x01,\x01,\x01} &""{\0,p,a,d,\0} 4 :=> &"jop"{\0,p,u,f,o,l,\0} | C57: 0.0838568 | D57: 1 | E57: 0.0838568 | G57: of:=IF([.C57]=1;"";[.C57]) -> 0.0838568 | H57: of:=IF([.D57]=1;"";[.D57]) ->  | I57: of:=IF([.E57]=1;"";[.E57]) -> 0.0838568
A58: 17 | B58: strncat: &"sua"{\0,\x01,\x01,\x01,\x01,\x01,\x01} &"g"{\0,p,o,\0} 4 :=> &"suag"{\0,p,t,i,o,\0} | C58: 0.0853147 | D58: 1 | E58: 0.046315 | G58: of:=IF([.C58]=1;"";[.C58]) -> 0.0853147 | H58: of:=IF([.D58]=1;"";[.D58]) ->  | I58: of:=IF([.E58]=1;"";[.E58]) -> 0.046315
A59: 18 | B59: strncat: &"itc"{\0,\x01,\x01,\x01,\x01,\x01,\x01} &"ay"{\0,p,\0} 4 :=> &"itcay"{\0,p,g,r,\0} | C59: 0.0854455 | D59: 0.218014 | E59: 0.0304044 | G59: of:=IF([.C59]=1;"";[.C59]) -> 0.0854455 | H59: of:=IF([.D59]=1;"";[.D59]) -> 0.218014 | I59: of:=IF([.E59]=1;"";[.E59]) -> 0.0304044
A60: 19 | B60: strncat: &"pbw"{\0,\x01,\x01,\x01,\x01,\x01,\x01} &"xph"{\0,\0} 4 :=> &"pbwxph"{\0,p,e,\0} | C60: 0.0691901 | D60: 0.0823902 | E60: 0 | G60: of:=IF([.C60]=1;"";[.C60]) -> 0.0691901 | H60: of:=IF([.D60]=1;"";[.D60]) -> 0.0823902 | I60: of:=IF([.E60]=1;"";[.E60]) -> 0
A61: 20 | B61: strncat: &"dpu"{\0,\x01,\x01,\x01,\x01,\x01,\x01} &"sana"{\0} 4 :=> &"dpusana"{\0,p,\0} | C61: 0.0748704 | D61: 0.0487174 | E61: 0.0161036 | G61: of:=IF([.C61]=1;"";[.C61]) -> 0.0748704 | H61: of:=IF([.D61]=1;"";[.D61]) -> 0.0487174 | I61: of:=IF([.E61]=1;"";[.E61]) -> 0.0161036
A62: 21 | B62: strncat: &"lkva"{\0,\x01,\x01,\x01,\x01,\x01} &""{\0,p,n,c,\0} 4 :=> &"lkva"{\0,p,d,l,y,\0} | C62: 0.0393736 | D62: 1 | E62: 0.0393736 | G62: of:=IF([.C62]=1;"";[.C62]) -> 0.0393736 | H62: of:=IF([.D62]=1;"";[.D62]) ->  | I62: of:=IF([.E62]=1;"";[.E62]) -> 0.0393736
A63: 22 | B63: strncat: &"lvab"{\0,\x01,\x01,\x01,\x01,\x01} &"k"{\0,p,d,\0} 4 :=> &"lvabk"{\0,p,e,h,\0} | C63: 0.044664 | D63: 1 | E63: 0.0245144 | G63: of:=IF([.C63]=1;"";[.C63]) -> 0.044664 | H63: of:=IF([.D63]=1;"";[.D63]) ->  | I63: of:=IF([.E63]=1;"";[.E63]) -> 0.0245144
A64: 23 | B64: strncat: &"fcfo"{\0,\x01,\x01,\x01,\x01,\x01} &"au"{\0,p,\0} 4 :=> &"fcfoau"{\0,p,h,\0} | C64: 0.0325366 | D64: 0.213806 | E64: 0.016266 | G64: of:=IF([.C64]=1;"";[.C64]) -> 0.0325366 | H64: of:=IF([.D64]=1;"";[.D64]) -> 0.213806 | I64: of:=IF([.E64]=1;"";[.E64]) -> 0.016266
A65: 24 | B65: strncat: &"gojn"{\0,\x01,\x01,\x01,\x01,\x01} &"mea"{\0,\0} 4 :=> &"gojnmea"{\0,p,\0} | C65: 0.0357707 | D65: 0.0896985 | E65: 0.0141309 | G65: of:=IF([.C65]=1;"";[.C65]) -> 0.0357707 | H65: of:=IF([.D65]=1;"";[.D65]) -> 0.0896985 | I65: of:=IF([.E65]=1;"";[.E65]) -> 0.0141309
A66: 25 | B66: strncat: &"vosc"{\0,\x01,\x01,\x01,\x01,\x01} &"pnpo"{\0} 4 :=> &"voscpnpo"{\0,\0} | C66: 0.0457468 | D66: 0.0390676 | E66: 0.0108718 | G66: of:=IF([.C66]=1;"";[.C66]) -> 0.0457468 | H66: of:=IF([.D66]=1;"";[.D66]) -> 0.0390676 | I66: of:=IF([.E66]=1;"";[.E66]) -> 0.0108718
A67: 26 | B67: strncat: &"boynu"{\0,\x01,\x01,\x01,\x01} &""{\0,p,b,o,\0} 4 :=> &"boynu"{\0,p,j,b,\0} | C67: 0.0281102 | D67: 1 | E67: 0.0281102 | G67: of:=IF([.C67]=1;"";[.C67]) -> 0.0281102 | H67: of:=IF([.D67]=1;"";[.D67]) ->  | I67: of:=IF([.E67]=1;"";[.E67]) -> 0.0281102
A68: 27 | B68: strncat: &"fslej"{\0,\x01,\x01,\x01,\x01} &"d"{\0,p,i,\0} 4 :=> &"fslejd"{\0,p,f,\0} | C68: 0.0267089 | D68: 1 | E68: 0.01685 | G68: of:=IF([.C68]=1;"";[.C68]) -> 0.0267089 | H68: of:=IF([.D68]=1;"";[.D68]) ->  | I68: of:=IF([.E68]=1;"";[.E68]) -> 0.01685
A69: 28 | B69: strncat: &"pednd"{\0,\x01,\x01,\x01,\x01} &"rs"{\0,p,\0} 4 :=> &"pedndrs"{\0,p,\0} | C69: 0.0305846 | D69: 0.22025 | E69: 0.0170012 | G69: of:=IF([.C69]=1;"";[.C69]) -> 0.0305846 | H69: of:=IF([.D69]=1;"";[.D69]) -> 0.22025 | I69: of:=IF([.E69]=1;"";[.E69]) -> 0.0170012
A70: 29 | B70: strncat: &"ioojo"{\0,\x01,\x01,\x01,\x01} &"xpy"{\0,\0} 4 :=> &"ioojoxpy"{\0,\0} | C70: 0.0286407 | D70: 0.0799885 | E70: 0.0123717 | G70: of:=IF([.C70]=1;"";[.C70]) -> 0.0286407 | H70: of:=IF([.D70]=1;"";[.D70]) -> 0.0799885 | I70: of:=IF([.E70]=1;"";[.E70]) -> 0.0123717
A71: 30 | B71: strncat: &"kiaei"{\0,\x01,\x01,\x01,\x01} &"nhul"{\0} 4 :=> &"kiaeinhul"{\0} | C71: 0.0289846 | D71: 0.0440896 | E71: 0.0111548 | G71: of:=IF([.C71]=1;"";[.C71]) -> 0.0289846 | H71: of:=IF([.D71]=1;"";[.D71]) -> 0.0440896 | I71: of:=IF([.E71]=1;"";[.E71]) -> 0.0111548
A72: 31 | B72: strncat: &"aekror"{\0,\x01,\x01,\x01} &""{\0,p,v,i,\0} 4 :=> &"aekror"{\0,p,s,\0} | C72: 0.0204067 | D72: 1 | E72: 0.0204067 | G72: of:=IF([.C72]=1;"";[.C72]) -> 0.0204067 | H72: of:=IF([.D72]=1;"";[.D72]) ->  | I72: of:=IF([.E72]=1;"";[.E72]) -> 0.0204067
A73: 32 | B73: strncat: &"htebto"{\0,\x01,\x01,\x01} &"o"{\0,p,s,\0} 4 :=> &"htebtoo"{\0,p,\0} | C73: 0.0211742 | D73: 1 | E73: 0.0164664 | G73: of:=IF([.C73]=1;"";[.C73]) -> 0.0211742 | H73: of:=IF([.D73]=1;"";[.D73]) ->  | I73: of:=IF([.E73]=1;"";[.E73]) -> 0.0164664
A74: 33 | B74: strncat: &"mtsdwy"{\0,\x01,\x01,\x01} &"oi"{\0,p,\0} 4 :=> &"mtsdwyoi"{\0,\0} | C74: 0.0180531 | D74: 0.212346 | E74: 0.011643 | G74: of:=IF([.C74]=1;"";[.C74]) -> 0.0180531 | H74: of:=IF([.D74]=1;"";[.D74]) -> 0.212346 | I74: of:=IF([.E74]=1;"";[.E74]) -> 0.011643
A75: 34 | B75: strncat: &"zmegbl"{\0,\x01,\x01,\x01} &"saa"{\0,\0} 4 :=> &"zmegblsaa"{\0} | C75: 0.0182515 | D75: 0.0794456 | E75: 0.00983098 | G75: of:=IF([.C75]=1;"";[.C75]) -> 0.0182515 | H75: of:=IF([.D75]=1;"";[.D75]) -> 0.0794456 | I75: of:=IF([.E75]=1;"";[.E75]) -> 0.00983098
A76: 35 | B76: strncat: &"blrjau"{\0,\x01,\x01,\x01} &&10 4 :=> &"blrjaukifa"{} | C76: 0.018238 | D76: 0.00862031 | G76: of:=IF([.C76]=1;"";[.C76]) -> 0.018238 | H76: of:=IF([.D76]=1;"";[.D76]) -> 0.00862031 | I76: of:=IF([.E76]=1;"";[.E76]) ->  
A77: 36 | B77: strncat: &"liowoma"{\0,\x01,\x01} &""{\0,p,a,g,\0} 4 :=> &"liowoma"{\0,p,\0} | C77: 0.0175441 | D77: 1 | E77: 0.0175441 | G77: of:=IF([.C77]=1;"";[.C77]) -> 0.0175441 | H77: of:=IF([.D77]=1;"";[.D77]) ->  | I77: of:=IF([.E77]=1;"";[.E77]) -> 0.0175441
A78: 37 | B78: strncat: &"jajinxp"{\0,\x01,\x01} &"u"{\0,p,l,\0} 4 :=> &"jajinxpu"{\0,\0} | C78: 0.0144223 | D78: 1 | E78: 0.0118672 | G78: of:=IF([.C78]=1;"";[.C78]) -> 0.0144223 | H78: of:=IF([.D78]=1;"";[.D78]) ->  | I78: of:=IF([.E78]=1;"";[.E78]) -> 0.0118672
A79: 38 | B79: strncat: &"xwfshoj"{\0,\x01,\x01} &"ma"{\0,p,\0} 4 :=> &"xwfshojma"{\0} | C79: 0.0137352 | D79: 0.219364 | E79: 0.00895802 | G79: of:=IF([.C79]=1;"";[.C79]) -> 0.0137352 | H79: of:=IF([.D79]=1;"";[.D79]) -> 0.219364 | I79: of:=IF([.E79]=1;"";[.E79]) -> 0.00895802
A80: 39 | B80: strncat: &"yeumitbu"{\0,\x01} &""{\0,p,e,j,\0} 4 :=> &"yeumitbu"{\0,\0} | C80: 0.0130681 | D80: 1 | E80: 0.0130681 | G80: of:=IF([.C80]=1;"";[.C80]) -> 0.0130681 | H80: of:=IF([.D80]=1;"";[.D80]) ->  | I80: of:=IF([.E80]=1;"";[.E80]) -> 0.0130681
A81: 40 | B81: strncat: &"ojursbox"{\0,\x01} &"h"{\0,p,o,\0} 4 :=> &"ojursboxh"{\0} | C81: 0.0125098 | D81: 1 | E81: 0.0102912 | G81: of:=IF([.C81]=1;"";[.C81]) -> 0.0125098 | H81: of:=IF([.D81]=1;"";[.D81]) ->  | I81: of:=IF([.E81]=1;"";[.E81]) -> 0.0102912
A82: 41 | B82: strncat: &"wlkniholw"{\0} &""{\0,p,e,c,\0} 4 :=> &"wlkniholw"{\0} | C82: 0.0102527 | D82: 1 | E82: 0.0102527 | G82: of:=IF([.C82]=1;"";[.C82]) -> 0.0102527 | H82: of:=IF([.D82]=1;"";[.D82]) ->  | I82: of:=IF([.E82]=1;"";[.E82]) -> 0.0102527

Sheet: strstr
A1: # | B1: Test Case | C1: N | G1: N1 | H1: N2 | I1: N3
A2: 1 | B2: strstr: &"z"{\0,h,j,u,\0} &"z"{\0,\0} :=> &"z"{\0,h,j,u,\0} | C2: 1 | D2: 1 | E2: 1 | G2: of:=IF([.C2]=1;"";[.C2]) ->  | H2: of:=IF([.D2]=1;"";[.D2]) ->  | I2: of:=IF([.E2]=1;"";[.E2]) ->  | K2: of:=AVERAGE([.G2:.G19]) -> 0.0787572352941176 | L2: of:=AVERAGE([.H2:.H19]) -> 0.205965666666667 | M2: of:=AVERAGE([.I2:.I19]) -> 0.1019004875 | O2: of:=AVERAGE([.K2:.M2]) -> 0.128874463153595
A3: 2 | B3: strstr: &"nt"{\0,h,j,\0} &"n"{\0,\0} :=> &"nt"{\0,h,j,\0} | C3: 0.222847 | D3: 1 | E3: 0.222847 | G3: of:=IF([.C3]=1;"";[.C3]) -> 0.222847 | H3: of:=IF([.D3]=1;"";[.D3]) ->  | I3: of:=IF([.E3]=1;"";[.E3]) -> 0.222847
A4: 3 | B4: strstr: &"ja"{\0,b,b,\0} &"a"{\0,\0} :=> &"a"{\0,b,b,\0,54} | C4: 0.200124 | D4: 1 | E4: 1 | G4: of:=IF([.C4]=1;"";[.C4]) -> 0.200124 | H4: of:=IF([.D4]=1;"";[.D4]) ->  | I4: of:=IF([.E4]=1;"";[.E4]) -> 
A5: 4 | B5: strstr: &"alt"{\0,h,\0} &"a"{\0,\0} :=> &"alt"{\0,h,\0} | C5: 0.0872652 | D5: 1 | E5: 0.0872652 | G5: of:=IF([.C5]=1;"";[.C5]) -> 0.0872652 | H5: of:=IF([.D5]=1;"";[.D5]) ->  | I5: of:=IF([.E5]=1;"";[.E5]) -> 0.0872652
A6: 5 | B6: strstr: &"rpu"{\0,b,\0} &"p"{\0,\0} :=> &"pu"{\0,b,\0,54} | C6: 0.0828421 | D6: 1 | E6: 0.212836 | G6: of:=IF([.C6]=1;"";[.C6]) -> 0.0828421 | H6: of:=IF([.D6]=1;"";[.D6]) ->  | I6: of:=IF([.E6]=1;"";[.E6]) -> 0.212836
A7: 6 | B7: strstr: &"ipal"{\0,\0} &"i"{\0,\0} :=> &"ipal"{\0,\0} | C7: 0.0471683 | D7: 1 | E7: 0.0471683 | G7: of:=IF([.C7]=1;"";[.C7]) -> 0.0471683 | H7: of:=IF([.D7]=1;"";[.D7]) ->  | I7: of:=IF([.E7]=1;"";[.E7]) -> 0.0471683
A8: 7 | B8: strstr: &"arje"{\0,\0} &"r"{\0,\0} :=> &"rje"{\0,\0,54} | C8: 0.0408541 | D8: 1 | E8: 0.0714104 | G8: of:=IF([.C8]=1;"";[.C8]) -> 0.0408541 | H8: of:=IF([.D8]=1;"";[.D8]) ->  | I8: of:=IF([.E8]=1;"";[.E8]) -> 0.0714104
A9: 8 | B9: strstr: &"jltag"{\0} &"j"{\0,\0} :=> &"jltag"{\0} | C9: 0.0241309 | D9: 1 | E9: 0.0241309 | G9: of:=IF([.C9]=1;"";[.C9]) -> 0.0241309 | H9: of:=IF([.D9]=1;"";[.D9]) ->  | I9: of:=IF([.E9]=1;"";[.E9]) -> 0.0241309
A10: 9 | B10: strstr: &"rlaeq"{\0} &"l"{\0,\0} :=> &"laeq"{\0,54} | C10: 0.0284084 | D10: 1 | E10: 0.0440884 | G10: of:=IF([.C10]=1;"";[.C10]) -> 0.0284084 | H10: of:=IF([.D10]=1;"";[.D10]) ->  | I10: of:=IF([.E10]=1;"";[.E10]) -> 0.0440884
A11: 10 | B11: strstr: &"sq"{\0,d,d,\0} &"sq"{\0} :=> &"sq"{\0,d,d,\0} | C11: 0.198519 | D11: 0.198519 | E11: 0.198519 | G11: of:=IF([.C11]=1;"";[.C11]) -> 0.198519 | H11: of:=IF([.D11]=1;"";[.D11]) -> 0.198519 | I11: of:=IF([.E11]=1;"";[.E11]) -> 0.198519
A12: 11 | B12: strstr: &"beu"{\0,d,\0} &"be"{\0} :=> &"beu"{\0,d,\0} | C12: 0.0834884 | D12: 0.219808 | E12: 0.0834884 | G12: of:=IF([.C12]=1;"";[.C12]) -> 0.0834884 | H12: of:=IF([.D12]=1;"";[.D12]) -> 0.219808 | I12: of:=IF([.E12]=1;"";[.E12]) -> 0.0834884
A13: 12 | B13: strstr: &"oof"{\0,a,\0} &"of"{\0} :=> &"of"{\0,a,\0,54} | C13: 0.0883745 | D13: 0.22242 | E13: 0.22242 | G13: of:=IF([.C13]=1;"";[.C13]) -> 0.0883745 | H13: of:=IF([.D13]=1;"";[.D13]) -> 0.22242 | I13: of:=IF([.E13]=1;"";[.E13]) -> 0.22242
A14: 13 | B14: strstr: &"oqv"{\0,p,\0} &"qv"{\0} :=> &"qv"{\0,p,\0,54} | C14: 0.0524717 | D14: 0.135488 | E14: 0.135488 | G14: of:=IF([.C14]=1;"";[.C14]) -> 0.0524717 | H14: of:=IF([.D14]=1;"";[.D14]) -> 0.135488 | I14: of:=IF([.E14]=1;"";[.E14]) -> 0.135488
A15: 14 | B15: strstr: &"mboc"{\0,\0} &"mb"{\0} :=> &"mboc"{\0,\0} | C15: 0.0457713 | D15: 0.211853 | E15: 0.0457713 | G15: of:=IF([.C15]=1;"";[.C15]) -> 0.0457713 | H15: of:=IF([.D15]=1;"";[.D15]) -> 0.211853 | I15: of:=IF([.E15]=1;"";[.E15]) -> 0.0457713
A16: 15 | B16: strstr: &"hhro"{\0,\0} &"hr"{\0} :=> &"hro"{\0,\0,54} | C16: 0.0421675 | D16: 0.211356 | E16: 0.0863783 | G16: of:=IF([.C16]=1;"";[.C16]) -> 0.0421675 | H16: of:=IF([.D16]=1;"";[.D16]) -> 0.211356 | I16: of:=IF([.E16]=1;"";[.E16]) -> 0.0863783
A17: 16 | B17: strstr: &"vcih"{\0,\0} &"ci"{\0} :=> &"cih"{\0,\0,54} | C17: 0.0381619 | D17: 0.216638 | E17: 0.077029 | G17: of:=IF([.C17]=1;"";[.C17]) -> 0.0381619 | H17: of:=IF([.D17]=1;"";[.D17]) -> 0.216638 | I17: of:=IF([.E17]=1;"";[.E17]) -> 0.077029
A18: 17 | B18: strstr: &"lsysy"{\0} &"ls"{\0} :=> &"lsysy"{\0} | C18: 0.0282719 | D18: 0.214762 | E18: 0.0282719 | G18: of:=IF([.C18]=1;"";[.C18]) -> 0.0282719 | H18: of:=IF([.D18]=1;"";[.D18]) -> 0.214762 | I18: of:=IF([.E18]=1;"";[.E18]) -> 0.0282719
A19: 18 | B19: strstr: &"nntnb"{\0} &"nt"{\0} :=> &"ntnb"{\0,54} | C19: 0.0280068 | D19: 0.222847 | E19: 0.0432957 | G19: of:=IF([.C19]=1;"";[.C19]) -> 0.0280068 | H19: of:=IF([.D19]=1;"";[.D19]) -> 0.222847 | I19: of:=IF([.E19]=1;"";[.E19]) -> 0.0432957
A20: 19 | B20: strstr: &"esddt"{\0} &"sd"{\0} :=> &"sddt"{\0,54} | C20: 0.027297 | D20: 0.203446 | E20: 0.0405967 | G20: of:=IF([.C20]=1;"";[.C20]) -> 0.027297 | H20: of:=IF([.D20]=1;"";[.D20]) -> 0.203446 | I20: of:=IF([.E20]=1;"";[.E20]) -> 0.0405967 | K20: of:=AVERAGE([.G20:.G24]) -> 0.02863702 | L20: of:=AVERAGE([.H20:.H24]) -> 0.209341 | M20: of:=AVERAGE([.I20:.I24]) -> 0.0345807 | O20: of:=AVERAGE([.K20:.M20]) -> 0.0908529066666667
A21: 1 | B21: strnstr: &"idgsk"{\0} &""{\0,p,\0} 2 :=> &"idgsk"{\0} | C21: 0.0287118 | D21: 1 | E21: 0.0287118 | G21: of:=IF([.C21]=1;"";[.C21]) -> 0.0287118 | H21: of:=IF([.D21]=1;"";[.D21]) ->  | I21: of:=IF([.E21]=1;"";[.E21]) -> 0.0287118
A22: 2 | B22: strnstr: &"uccil"{\0} &"u"{\0,\0} 2 :=> &"uccil"{\0} | C22: 0.0299445 | D22: 1 | E22: 0.0299445 | G22: of:=IF([.C22]=1;"";[.C22]) -> 0.0299445 | H22: of:=IF([.D22]=1;"";[.D22]) ->  | I22: of:=IF([.E22]=1;"";[.E22]) -> 0.0299445
A23: 3 | B23: strnstr: &"oaate"{\0} &"a"{\0,\0} 2 :=> &"aate"{\0,54} | C23: 0.029054 | D23: 1 | E23: 0.0454727 | G23: of:=IF([.C23]=1;"";[.C23]) -> 0.029054 | H23: of:=IF([.D23]=1;"";[.D23]) ->  | I23: of:=IF([.E23]=1;"";[.E23]) -> 0.0454727
A24: 4 | B24: strnstr: &"gajub"{\0} &"ga"{\0} 2 :=> &"gajub"{\0} | C24: 0.0281778 | D24: 0.215236 | E24: 0.0281778 | G24: of:=IF([.C24]=1;"";[.C24]) -> 0.0281778 | H24: of:=IF([.D24]=1;"";[.D24]) -> 0.215236 | I24: of:=IF([.E24]=1;"";[.E24]) -> 0.0281778
A25: 1 | B25: strpbrk: &"ruglw"{\0} &"aeiou"{\0} :=> &"uglw"{\0,54} | C25: 0.0278539 | D25: 0.0299288 | E25: 0.0429546 | G25: of:=IF([.C25]=1;"";[.C25]) -> 0.0278539 | H25: of:=IF([.D25]=1;"";[.D25]) -> 0.0299288 | I25: of:=IF([.E25]=1;"";[.E25]) -> 0.0429546 | K25: of:=AVERAGE([.G25:.G34]) -> 0.02773196 | L25: of:=AVERAGE([.H25:.H34]) -> 0.0299288 | M25: of:=AVERAGE([.I25:.I34]) -> 0.03527044 | O25: of:=AVERAGE([.K25:.M25]) -> 0.0309770666666667
A26: 2 | B26: strpbrk: &"coaji"{\0} &"aeiou"{\0} :=> &"oaji"{\0,54} | C26: 0.0272077 | D26: 0.0299288 | E26: 0.0407517 | G26: of:=IF([.C26]=1;"";[.C26]) -> 0.0272077 | H26: of:=IF([.D26]=1;"";[.D26]) -> 0.0299288 | I26: of:=IF([.E26]=1;"";[.E26]) -> 0.0407517
A27: 3 | B27: strpbrk: &"ninka"{\0} &"aeiou"{\0} :=> &"inka"{\0,54} | C27: 0.0297399 | D27: 0.0299288 | E27: 0.0456359 | G27: of:=IF([.C27]=1;"";[.C27]) -> 0.0297399 | H27: of:=IF([.D27]=1;"";[.D27]) -> 0.0299288 | I27: of:=IF([.E27]=1;"";[.E27]) -> 0.0456359
A28: 4 | B28: strpbrk: &"veamn"{\0} &"aeiou"{\0} :=> &"eamn"{\0,54} | C28: 0.0295386 | D28: 0.0299288 | E28: 0.0447951 | G28: of:=IF([.C28]=1;"";[.C28]) -> 0.0295386 | H28: of:=IF([.D28]=1;"";[.D28]) -> 0.0299288 | I28: of:=IF([.E28]=1;"";[.E28]) -> 0.0447951
A29: 5 | B29: strpbrk: &"haymo"{\0} &"aeiou"{\0} :=> &"aymo"{\0,54} | C29: 0.0301193 | D29: 0.0299288 | E29: 0.0457069 | G29: of:=IF([.C29]=1;"";[.C29]) -> 0.0301193 | H29: of:=IF([.D29]=1;"";[.D29]) -> 0.0299288 | I29: of:=IF([.E29]=1;"";[.E29]) -> 0.0457069
A30: 6 | B30: strpbrk: &"uknyc"{\0} &"aeiou"{\0} :=> &"uknyc"{\0} | C30: 0.0265755 | D30: 0.0299288 | E30: 0.0265755 | G30: of:=IF([.C30]=1;"";[.C30]) -> 0.0265755 | H30: of:=IF([.D30]=1;"";[.D30]) -> 0.0299288 | I30: of:=IF([.E30]=1;"";[.E30]) -> 0.0265755
A31: 7 | B31: strpbrk: &"okahl"{\0} &"aeiou"{\0} :=> &"okahl"{\0} | C31: 0.0268138 | D31: 0.0299288 | E31: 0.0268138 | G31: of:=IF([.C31]=1;"";[.C31]) -> 0.0268138 | H31: of:=IF([.D31]=1;"";[.D31]) -> 0.0299288 | I31: of:=IF([.E31]=1;"";[.E31]) -> 0.0268138
A32: 8 | B32: strpbrk: &"ivtoh"{\0} &"aeiou"{\0} :=> &"ivtoh"{\0} | C32: 0.0253818 | D32: 0.0299288 | E32: 0.0253818 | G32: of:=IF([.C32]=1;"";[.C32]) -> 0.0253818 | H32: of:=IF([.D32]=1;"";[.D32]) -> 0.0299288 | I32: of:=IF([.E32]=1;"";[.E32]) -> 0.0253818
A33: 9 | B33: strpbrk: &"ebmhw"{\0} &"aeiou"{\0} :=> &"ebmhw"{\0} | C33: 0.0235699 | D33: 0.0299288 | E33: 0.0235699 | G33: of:=IF([.C33]=1;"";[.C33]) -> 0.0235699 | H33: of:=IF([.D33]=1;"";[.D33]) -> 0.0299288 | I33: of:=IF([.E33]=1;"";[.E33]) -> 0.0235699
A34: 10 | B34: strpbrk: &"aumor"{\0} &"aeiou"{\0} :=> &"aumor"{\0} | C34: 0.0305192 | D34: 0.0299288 | E34: 0.0305192 | G34: of:=IF([.C34]=1;"";[.C34]) -> 0.0305192 | H34: of:=IF([.D34]=1;"";[.D34]) -> 0.0299288 | I34: of:=IF([.E34]=1;"";[.E34]) -> 0.0305192