Sheet: strlen
A1: strlen: &"\x01"{\0,\0,\0,\0,\0} :=> 1; | J1: # | K1: Test Case | L1: N | P1: FINAL
A2: strlen: &"\x01\x01"{\0,\0,\0,\0} :=> 2; | J2: 1 | K2: strlen: &"r"{\0,p,m,o,\0} :=> 1 | L2: 1 | N2: of:=IF([.L2]=1;"";[.L2]) ->  | P2: of:=AVERAGE([.N2:.N6]) -> 0.086345875
A3: strlen: &"\x01\x01\x01"{\0,\0,\0} :=> 3; | J3: 2 | K3: strlen: &"sk"{\0,p,l,\0} :=> 2 | L3: 0.209333 | N3: of:=IF([.L3]=1;"";[.L3]) -> 0.209333
A4: strlen: &"\x01\x01\x01\x01"{\0,\0} :=> 4; | J4: 3 | K4: strlen: &"bgh"{\0,p,\0} :=> 3 | L4: 0.0682069 | N4: of:=IF([.L4]=1;"";[.L4]) -> 0.0682069
A5: strlen: &"\x01\x01\x01\x01\x01"{\0} :=> 5; | J5: 4 | K5: strlen: &"ojae"{\0,\0} :=> 4 | L5: 0.0405621 | N5: of:=IF([.L5]=1;"";[.L5]) -> 0.0405621
A6: strnlen: &""{\0,\0,\0,\0,\0,\0} 6 :=> 0; 1; | J6: 5 | K6: strlen: &"bwesf"{\0} :=> 5 | L6: 0.0272815 | N6: of:=IF([.L6]=1;"";[.L6]) -> 0.0272815
A7: strnlen: &"\x01"{\0,\0,\0,\0,\0} 6 :=> 1; | J7: 1 | K7: strnlen: &""{\0,p,m,o,t,\0} 6 :=> 0 | L7: 1 | N7: of:=IF([.L7]=1;"";[.L7]) ->  | P7: of:=AVERAGE([.N7:.N12]) -> 0.090708975
A8: strnlen: &"\x01\x01"{\0,\0,\0,\0} 6 :=> 2; | J8: 2 | K8: strnlen: &"i"{\0,p,c,h,\0} 6 :=> 1 | L8: 1 | N8: of:=IF([.L8]=1;"";[.L8]) -> 
A9: strnlen: &"\x01\x01\x01"{\0,\0,\0} 6 :=> 3; | J9: 3 | K9: strnlen: &"io"{\0,p,i,\0} 6 :=> 2 | L9: 0.221126 | N9: of:=IF([.L9]=1;"";[.L9]) -> 0.221126
A10: strnlen: &"\x01\x01\x01\x01"{\0,\0} 6 :=> 4; | J10: 4 | K10: strnlen: &"htr"{\0,p,\0} 6 :=> 3 | L10: 0.0865002 | N10: of:=IF([.L10]=1;"";[.L10]) -> 0.0865002
A11: strnlen: &"\x01\x01\x01\x01\x01"{\0} 6 :=> 5; | J11: 5 | K11: strnlen: &"fhju"{\0,\0} 6 :=> 4 | L11: 0.0308289 | N11: of:=IF([.L11]=1;"";[.L11]) -> 0.0308289
J12: 6 | K12: strnlen: &"plnpn"{\0} 6 :=> 5 | L12: 0.0243808 | N12: of:=IF([.L12]=1;"";[.L12]) -> 0.0243808

Sheet: strcmp
A1: # | B1: Test Case | C1: N1 | D1: N2 | L1: FINAL
A2: 1 | B2: strcmp: &"j"{\0,p,h,n,\0} &"j"{\0,p,s,c,\0} :=> 0 | C2: 1 | D2: 1 | F2: of:=IF([.C2]=1;"";[.C2]) ->  | G2: of:=IF([.D2]=1;"";[.D2]) ->  | H2: of:=IF([.E2]=1;"";[.E2]) ->   | I2: of:=AVERAGE([.F2:.F16]) -> 0.0432769642857143 | J2: of:=AVERAGE([.G2:.G16]) -> 0.0411168785714286 | L2: of:=AVERAGE([.I2:.J2]) -> 0.0421969214285714
A3: 2 | B3: strcmp: &"jk"{\0,p,e,\0} &"jk"{\0,p,e,\0} :=> 0 | C3: 0.163112 | D3: 0.163112 | F3: of:=IF([.C3]=1;"";[.C3]) -> 0.163112 | G3: of:=IF([.D3]=1;"";[.D3]) -> 0.163112 | H3: of:=IF([.E3]=1;"";[.E3]) ->  
A4: 3 | B4: strcmp: &"thw"{\0,p,\0} &"thw"{\0,p,\0} :=> 0 | C4: 0.0835091 | D4: 0.0835091 | F4: of:=IF([.C4]=1;"";[.C4]) -> 0.0835091 | G4: of:=IF([.D4]=1;"";[.D4]) -> 0.0835091 | H4: of:=IF([.E4]=1;"";[.E4]) ->  
A5: 4 | B5: strcmp: &"qufa"{\0,\0} &"qufa"{\0,\0} :=> 0 | C5: 0.0441626 | D5: 0.0441626 | F5: of:=IF([.C5]=1;"";[.C5]) -> 0.0441626 | G5: of:=IF([.D5]=1;"";[.D5]) -> 0.0441626 | H5: of:=IF([.E5]=1;"";[.E5]) ->  
A6: 5 | B6: strcmp: &"zgthe"{\0} &"zgthe"{\0} :=> 0 | C6: 0.0274546 | D6: 0.0274546 | F6: of:=IF([.C6]=1;"";[.C6]) -> 0.0274546 | G6: of:=IF([.D6]=1;"";[.D6]) -> 0.0274546 | H6: of:=IF([.E6]=1;"";[.E6]) ->  
A7: 6 | B7: strcmp: &"dyrir"{\0} &"dyric"{\0} :=> 1 | C7: 0.0289381 | D7: 0.029241 | F7: of:=IF([.C7]=1;"";[.C7]) -> 0.0289381 | G7: of:=IF([.D7]=1;"";[.D7]) -> 0.029241 | H7: of:=IF([.E7]=1;"";[.E7]) ->  
A8: 7 | B8: strcmp: &"deewh"{\0} &"deewq"{\0} :=> -1 | C8: 0.030928 | D8: 0.023857 | F8: of:=IF([.C8]=1;"";[.C8]) -> 0.030928 | G8: of:=IF([.D8]=1;"";[.D8]) -> 0.023857 | H8: of:=IF([.E8]=1;"";[.E8]) ->  
A9: 8 | B9: strcmp: &"wgmfi"{\0} &"wgmbv"{\0} :=> 1 | C9: 0.0228215 | D9: 0.0222418 | F9: of:=IF([.C9]=1;"";[.C9]) -> 0.0228215 | G9: of:=IF([.D9]=1;"";[.D9]) -> 0.0222418 | H9: of:=IF([.E9]=1;"";[.E9]) ->  
A10: 9 | B10: strcmp: &"jasse"{\0} &"jasve"{\0} :=> -1 | C10: 0.0300049 | D10: 0.0273875 | F10: of:=IF([.C10]=1;"";[.C10]) -> 0.0300049 | G10: of:=IF([.D10]=1;"";[.D10]) -> 0.0273875 | H10: of:=IF([.E10]=1;"";[.E10]) ->  
A11: 10 | B11: strcmp: &"urchd"{\0} &"urasa"{\0} :=> 1 | C11: 0.0289293 | D11: 0.0315486 | F11: of:=IF([.C11]=1;"";[.C11]) -> 0.0289293 | G11: of:=IF([.D11]=1;"";[.D11]) -> 0.0315486 | H11: of:=IF([.E11]=1;"";[.E11]) ->  
A12: 11 | B12: strcmp: &"itwot"{\0} &"itzrr"{\0} :=> -1 | C12: 0.0305193 | D12: 0.0256472 | F12: of:=IF([.C12]=1;"";[.C12]) -> 0.0305193 | G12: of:=IF([.D12]=1;"";[.D12]) -> 0.0256472
A13: 12 | B13: strcmp: &"woxpp"{\0} &"wlrje"{\0} :=> 1 | C13: 0.0282848 | D13: 0.0242757 | F13: of:=IF([.C13]=1;"";[.C13]) -> 0.0282848 | G13: of:=IF([.D13]=1;"";[.D13]) -> 0.0242757
A14: 13 | B14: strcmp: &"cyepe"{\0} &"czcui"{\0} :=> -1 | C14: 0.0296062 | D14: 0.0228605 | F14: of:=IF([.C14]=1;"";[.C14]) -> 0.0296062 | G14: of:=IF([.D14]=1;"";[.D14]) -> 0.0228605
A15: 14 | B15: strcmp: &"ldaif"{\0} &"amvva"{\0} :=> 1 | C15: 0.0303765 | D15: 0.0229854 | F15: of:=IF([.C15]=1;"";[.C15]) -> 0.0303765 | G15: of:=IF([.D15]=1;"";[.D15]) -> 0.0229854
A16: 15 | B16: strcmp: &"adtwr"{\0} &"timwh"{\0} :=> -1 | C16: 0.0272306 | D16: 0.0273533 | F16: of:=IF([.C16]=1;"";[.C16]) -> 0.0272306 | G16: of:=IF([.D16]=1;"";[.D16]) -> 0.0273533
A17: 1 | B17: strncmp: &""{\0,p,y,m,o,\0} &""{\0,p,i,g,r,\0} 5 :=> 0 | C17: 1 | D17: 1 | F17: of:=IF([.C17]=1;"";[.C17]) ->  | G17: of:=IF([.D17]=1;"";[.D17]) ->  | I17: of:=AVERAGE([.F17:.F32]) -> 0.0441644142857143 | J17: of:=AVERAGE([.G17:.G32]) -> 0.0412687071428571 | L17: of:=AVERAGE([.I17:.J17]) -> 0.0427165607142857
A18: 2 | B18: strncmp: &"g"{\0,p,y,a,\0} &"g"{\0,p,a,e,\0} 5 :=> 0 | C18: 1 | D18: 1 | F18: of:=IF([.C18]=1;"";[.C18]) ->  | G18: of:=IF([.D18]=1;"";[.D18]) -> 
A19: 3 | B19: strncmp: &"kt"{\0,p,e,\0} &"kt"{\0,p,p,\0} 5 :=> 0 | C19: 0.190189 | D19: 0.190189 | F19: of:=IF([.C19]=1;"";[.C19]) -> 0.190189 | G19: of:=IF([.D19]=1;"";[.D19]) -> 0.190189
A20: 4 | B20: strncmp: &"equ"{\0,p,\0} &"equ"{\0,p,\0} 5 :=> 0 | C20: 0.081868 | D20: 0.081868 | F20: of:=IF([.C20]=1;"";[.C20]) -> 0.081868 | G20: of:=IF([.D20]=1;"";[.D20]) -> 0.081868
A21: 5 | B21: strncmp: &"clln"{\0,\0} &"clln"{\0,\0} 5 :=> 0 | C21: 0.0440617 | D21: 0.0440617 | F21: of:=IF([.C21]=1;"";[.C21]) -> 0.0440617 | G21: of:=IF([.D21]=1;"";[.D21]) -> 0.0440617
A22: 6 | B22: strncmp: &"egolk"{\0} &"egolk"{\0} 5 :=> 0 | C22: 0.0290702 | D22: 0.0290702 | F22: of:=IF([.C22]=1;"";[.C22]) -> 0.0290702 | G22: of:=IF([.D22]=1;"";[.D22]) -> 0.0290702
A23: 7 | B23: strncmp: &"pygha"{\0} &"pyghK"{\0} 5 :=> 1 | C23: 0.0271765 | D23: 0 | F23: of:=IF([.C23]=1;"";[.C23]) -> 0.0271765 | G23: of:=IF([.D23]=1;"";[.D23]) -> 0
A24: 8 | B24: strncmp: &"smyei"{\0} &"smyet"{\0} 5 :=> -1 | C24: 0.0287108 | D24: 0.0290607 | F24: of:=IF([.C24]=1;"";[.C24]) -> 0.0287108 | G24: of:=IF([.D24]=1;"";[.D24]) -> 0.0290607
A25: 9 | B25: strncmp: &"hoarm"{\0} &"hoaap"{\0} 5 :=> 1 | C25: 0.0305046 | D25: 0.0280782 | F25: of:=IF([.C25]=1;"";[.C25]) -> 0.0305046 | G25: of:=IF([.D25]=1;"";[.D25]) -> 0.0280782
A26: 10 | B26: strncmp: &"mokyj"{\0} &"mokzi"{\0} 5 :=> -1 | C26: 0.0237761 | D26: 0.0232319 | F26: of:=IF([.C26]=1;"";[.C26]) -> 0.0237761 | G26: of:=IF([.D26]=1;"";[.D26]) -> 0.0232319
A27: 11 | B27: strncmp: &"yvepo"{\0} &"yvdly"{\0} 5 :=> 1 | C27: 0.0276964 | D27: 0.0231037 | F27: of:=IF([.C27]=1;"";[.C27]) -> 0.0276964 | G27: of:=IF([.D27]=1;"";[.D27]) -> 0.0231037
A28: 12 | B28: strncmp: &"lbyby"{\0} &"lbzon"{\0} 5 :=> -1 | C28: 0.0273814 | D28: 0.0228343 | F28: of:=IF([.C28]=1;"";[.C28]) -> 0.0273814 | G28: of:=IF([.D28]=1;"";[.D28]) -> 0.0228343
A29: 13 | B29: strncmp: &"bytfg"{\0} &"bgecr"{\0} 5 :=> 1 | C29: 0.0250393 | D29: 0.0257841 | F29: of:=IF([.C29]=1;"";[.C29]) -> 0.0250393 | G29: of:=IF([.D29]=1;"";[.D29]) -> 0.0257841
A30: 14 | B30: strncmp: &"wayic"{\0} &"whery"{\0} 5 :=> -1 | C30: 0.0302463 | D30: 0.0319878 | F30: of:=IF([.C30]=1;"";[.C30]) -> 0.0302463 | G30: of:=IF([.D30]=1;"";[.D30]) -> 0.0319878
A31: 15 | B31: strncmp: &"iscyt"{\0} &"detje"{\0} 5 :=> 1 | C31: 0.0287077 | D31: 0.0258645 | F31: of:=IF([.C31]=1;"";[.C31]) -> 0.0287077 | G31: of:=IF([.D31]=1;"";[.D31]) -> 0.0258645
A32: 16 | B32: strncmp: &"bbkeu"{\0} &"cnvgu"{\0} 5 :=> -1 | C32: 0.0238738 | D32: 0.0226278 | F32: of:=IF([.C32]=1;"";[.C32]) -> 0.0238738 | G32: of:=IF([.D32]=1;"";[.D32]) -> 0.0226278
A33: 1 | B33: sysfs_streq: &""{\0,p,y,a,l,\0} &"msrvo"{\0} :=> \0 | C33: 1 | D33: 0.0284519 | F33: of:=IF([.C33]=1;"";[.C33]) ->  | G33: of:=IF([.D33]=1;"";[.D33]) -> 0.0284519 | I33: of:=AVERAGE([.F33:.F71]) -> 0.0690458034482759 | J33: of:=AVERAGE([.G33:.G71]) -> 0.0451183928571429 | L33: of:=AVERAGE([.I33:.J33]) -> 0.0570820981527094
A34: 2 | B34: sysfs_streq: &""{\0,p,l,t,s,\0} &"\n"{\0,b,s,r,\0} :=> \x01 | C34: 1 | F34: of:=IF([.C34]=1;"";[.C34]) ->  | G34: of:=IF([.D34]=1;"";[.D34]) ->  
A35: 3 | B35: sysfs_streq: &""{\0,p,r,k,k,\0} &"\naoqi"{\0} :=> \0 | C35: 1 | F35: of:=IF([.C35]=1;"";[.C35]) ->  | G35: of:=IF([.D35]=1;"";[.D35]) ->  
A36: 4 | B36: sysfs_streq: &""{\0,p,s,y,m,\0} &""{\0,h,i,b,d,\0} :=> \x01 | C36: 1 | D36: 1 | F36: of:=IF([.C36]=1;"";[.C36]) ->  | G36: of:=IF([.D36]=1;"";[.D36]) -> 
A37: 5 | B37: sysfs_streq: &"ypiot"{\0} &"nuali"{\0} :=> \0 | C37: 0.0292856 | D37: 0.0305021 | F37: of:=IF([.C37]=1;"";[.C37]) -> 0.0292856 | G37: of:=IF([.D37]=1;"";[.D37]) -> 0.0305021
A38: 6 | B38: sysfs_streq: &"\n"{\0,p,r,i,\0} &""{\0,a,d,y,a,\0} :=> \x01 | C38: 1 | F38: of:=IF([.C38]=1;"";[.C38]) ->  | G38: of:=IF([.D38]=1;"";[.D38]) ->  
A39: 7 | B39: sysfs_streq: &"\n"{\0,a,u,h,\0} &"dojjp"{\0} :=> \0 | C39: 0.0172207 | F39: of:=IF([.C39]=1;"";[.C39]) -> 0.0172207 | G39: of:=IF([.D39]=1;"";[.D39]) ->  
A40: 8 | B40: sysfs_streq: &"\naqip"{\0} &"geebo"{\0} :=> \0 | C40: 0.0300117 | F40: of:=IF([.C40]=1;"";[.C40]) -> 0.0300117 | G40: of:=IF([.D40]=1;"";[.D40]) ->  
A41: 9 | B41: sysfs_streq: &"z"{\0,p,y,d,\0} &"zvaye"{\0} :=> \0 | C41: 1 | D41: 0.0264186 | F41: of:=IF([.C41]=1;"";[.C41]) ->  | G41: of:=IF([.D41]=1;"";[.D41]) -> 0.0264186
A42: 10 | B42: sysfs_streq: &"q"{\0,p,a,x,\0} &"q\n"{\0,a,d,\0} :=> \x01 | C42: 1 | F42: of:=IF([.C42]=1;"";[.C42]) ->  | G42: of:=IF([.D42]=1;"";[.D42]) ->  
A43: 11 | B43: sysfs_streq: &"p"{\0,p,w,o,\0} &"p\naxm"{\0} :=> \0 | C43: 1 | F43: of:=IF([.C43]=1;"";[.C43]) ->  | G43: of:=IF([.D43]=1;"";[.D43]) ->  
A44: 12 | B44: sysfs_streq: &"k"{\0,p,f,d,\0} &"k"{\0,h,a,m,\0} :=> \x01 | C44: 1 | D44: 1 | F44: of:=IF([.C44]=1;"";[.C44]) ->  | G44: of:=IF([.D44]=1;"";[.D44]) -> 
A45: 13 | B45: sysfs_streq: &"fekhy"{\0} &"fnlft"{\0} :=> \0 | C45: 0.0270335 | D45: 0.0256352 | F45: of:=IF([.C45]=1;"";[.C45]) -> 0.0270335 | G45: of:=IF([.D45]=1;"";[.D45]) -> 0.0256352
A46: 14 | B46: sysfs_streq: &"p\n"{\0,b,v,\0} &"p"{\0,b,y,s,\0} :=> \x01 | C46: 1 | F46: of:=IF([.C46]=1;"";[.C46]) ->  | G46: of:=IF([.D46]=1;"";[.D46]) ->  
A47: 15 | B47: sysfs_streq: &"w\n"{\0,b,r,\0} &"wpfvo"{\0} :=> \0 | C47: 0.0209659 | F47: of:=IF([.C47]=1;"";[.C47]) -> 0.0209659 | G47: of:=IF([.D47]=1;"";[.D47]) ->  
A48: 16 | B48: sysfs_streq: &"o\nago"{\0} &"ojntp"{\0} :=> \0 | C48: 0.0230364 | F48: of:=IF([.C48]=1;"";[.C48]) -> 0.0230364 | G48: of:=IF([.D48]=1;"";[.D48]) ->  
A49: 17 | B49: sysfs_streq: &"ow"{\0,p,d,\0} &"owham"{\0} :=> \0 | C49: 0.218014 | D49: 0.0311089 | F49: of:=IF([.C49]=1;"";[.C49]) -> 0.218014 | G49: of:=IF([.D49]=1;"";[.D49]) -> 0.0311089
A50: 18 | B50: sysfs_streq: &"ne"{\0,p,s,\0} &"ne\n"{\0,a,\0} :=> \x01 | C50: 0.22156 | F50: of:=IF([.C50]=1;"";[.C50]) -> 0.22156 | G50: of:=IF([.D50]=1;"";[.D50]) ->  
A51: 19 | B51: sysfs_streq: &"ov"{\0,p,s,\0} &"ov\nax"{\0} :=> \0 | C51: 0.215706 | F51: of:=IF([.C51]=1;"";[.C51]) -> 0.215706 | G51: of:=IF([.D51]=1;"";[.D51]) ->  
A52: 20 | B52: sysfs_streq: &"qu"{\0,p,u,\0} &"qu"{\0,b,l,\0} :=> \x01 | C52: 0.212836 | D52: 0.212836 | F52: of:=IF([.C52]=1;"";[.C52]) -> 0.212836 | G52: of:=IF([.D52]=1;"";[.D52]) -> 0.212836
A53: 21 | B53: sysfs_streq: &"zichb"{\0} &"zirng"{\0} :=> \0 | C53: 0.0283493 | D53: 0.0296745 | F53: of:=IF([.C53]=1;"";[.C53]) -> 0.0283493 | G53: of:=IF([.D53]=1;"";[.D53]) -> 0.0296745
A54: 22 | B54: sysfs_streq: &"ku\n"{\0,b,\0} &"ku"{\0,b,h,\0} :=> \x01 | C54: 0.193586 | F54: of:=IF([.C54]=1;"";[.C54]) -> 0.193586 | G54: of:=IF([.D54]=1;"";[.D54]) ->  
A55: 23 | B55: sysfs_streq: &"xu\n"{\0,b,\0} &"xuibs"{\0} :=> \0 | C55: 0.0273525 | F55: of:=IF([.C55]=1;"";[.C55]) -> 0.0273525 | G55: of:=IF([.D55]=1;"";[.D55]) ->  
A56: 24 | B56: sysfs_streq: &"dg\nau"{\0} &"dgnxu"{\0} :=> \0 | C56: 0.025852 | F56: of:=IF([.C56]=1;"";[.C56]) -> 0.025852 | G56: of:=IF([.D56]=1;"";[.D56]) ->  
A57: 25 | B57: sysfs_streq: &"ese"{\0,p,\0} &"esegl"{\0} :=> \0 | C57: 0.0906651 | D57: 0.0303755 | F57: of:=IF([.C57]=1;"";[.C57]) -> 0.0906651 | G57: of:=IF([.D57]=1;"";[.D57]) -> 0.0303755
A58: 26 | B58: sysfs_streq: &"dfy"{\0,p,\0} &"dfy\n"{\0,\0} :=> \x01 | C58: 0.0736207 | F58: of:=IF([.C58]=1;"";[.C58]) -> 0.0736207 | G58: of:=IF([.D58]=1;"";[.D58]) ->  
A59: 27 | B59: sysfs_streq: &"kwb"{\0,p,\0} &"kwb\na"{\0} :=> \0 | C59: 0.0703369 | F59: of:=IF([.C59]=1;"";[.C59]) -> 0.0703369 | G59: of:=IF([.D59]=1;"";[.D59]) ->  
A60: 28 | B60: sysfs_streq: &"thv"{\0,p,\0} &"thv"{\0,h,\0} :=> \x01 | C60: 0.0764232 | D60: 0.0764232 | F60: of:=IF([.C60]=1;"";[.C60]) -> 0.0764232 | G60: of:=IF([.D60]=1;"";[.D60]) -> 0.0764232
A61: 29 | B61: sysfs_streq: &"cemtc"{\0} &"cemik"{\0} :=> \0 | C61: 0.027183 | D61: 0.030381 | F61: of:=IF([.C61]=1;"";[.C61]) -> 0.027183 | G61: of:=IF([.D61]=1;"";[.D61]) -> 0.030381
A62: 30 | B62: sysfs_streq: &"fnb\n"{\0,\0} &"fnb"{\0,a,\0} :=> \x01 | C62: 0.0691803 | F62: of:=IF([.C62]=1;"";[.C62]) -> 0.0691803 | G62: of:=IF([.D62]=1;"";[.D62]) ->  
A63: 31 | B63: sysfs_streq: &"akk\n"{\0,\0} &"akkid"{\0} :=> \0 | C63: 0.0275673 | F63: of:=IF([.C63]=1;"";[.C63]) -> 0.0275673 | G63: of:=IF([.D63]=1;"";[.D63]) ->  
A64: 32 | B64: sysfs_streq: &"lak\na"{\0} &"lakss"{\0} :=> \0 | C64: 0.0300495 | F64: of:=IF([.C64]=1;"";[.C64]) -> 0.0300495 | G64: of:=IF([.D64]=1;"";[.D64]) ->  
A65: 33 | B65: sysfs_streq: &"bvkj"{\0,\0} &"bvkjc"{\0} :=> \0 | C65: 0.028844 | D65: 0.0167626 | F65: of:=IF([.C65]=1;"";[.C65]) -> 0.028844 | G65: of:=IF([.D65]=1;"";[.D65]) -> 0.0167626
A66: 34 | B66: sysfs_streq: &"buci"{\0,\0} &"buci\n"{\0} :=> \x01 | C66: 0.046391 | F66: of:=IF([.C66]=1;"";[.C66]) -> 0.046391 | G66: of:=IF([.D66]=1;"";[.D66]) ->  
A67: 35 | B67: sysfs_streq: &"dtka"{\0,\0} &"dtka"{\0,\0} :=> \x01 | C67: 0.0374399 | D67: 0.0374399 | F67: of:=IF([.C67]=1;"";[.C67]) -> 0.0374399 | G67: of:=IF([.D67]=1;"";[.D67]) -> 0.0374399
A68: 36 | B68: sysfs_streq: &"dlmpa"{\0} &"dlmpg"{\0} :=> \0 | C68: 0.0288916 | D68: 0.0271672 | F68: of:=IF([.C68]=1;"";[.C68]) -> 0.0288916 | G68: of:=IF([.D68]=1;"";[.D68]) -> 0.0271672
A69: 37 | B69: sysfs_streq: &"wave\n"{\0} &"wave"{\0,\0} :=> \x01 | C69: 0.0479015 | F69: of:=IF([.C69]=1;"";[.C69]) -> 0.0479015 | G69: of:=IF([.D69]=1;"";[.D69]) ->  
A70: 38 | B70: sysfs_streq: &"hayu\n"{\0} &"hayul"{\0} :=> \0 | C70: 0.0285438 | F70: of:=IF([.C70]=1;"";[.C70]) -> 0.0285438 | G70: of:=IF([.D70]=1;"";[.D70]) ->  
A71: 39 | B71: sysfs_streq: &"mymmi"{\0} &"mymmi"{\0} :=> \x01 | C71: 0.0284809 | D71: 0.0284809 | F71: of:=IF([.C71]=1;"";[.C71]) -> 0.0284809 | G71: of:=IF([.D71]=1;"";[.D71]) -> 0.0284809

Sheet: strcpy
A1: # | B1: Test Case | C1: N1 | D1: N2 | E1: N3 | O1: FINAL
A2: 1 | B2: strcpy: &""{\0,\x01,\x01,\x01,\x01,\x01} &"j"{\0,p,m,n,\0} :=> &"j"{\0,p,s,u,\0} | C2: 1 | D2: 1 | E2: 1 | G2: of:=IF([.C2]=1;"";[.C2]) ->  | H2: of:=IF([.D2]=1;"";[.D2]) ->  | I2: of:=IF([.E2]=1;"";[.E2]) ->  | K2: of:=AVERAGE([.G2:.G36]) -> 0.08705365 | L2: of:=AVERAGE([.H2:.H36]) -> 0.0898102458333333 | M2: of:=AVERAGE([.I2:.I36]) -> 0.0898102458333333 | O2: of:=AVERAGE([.K2:.M2]) -> 0.0888913805555556
A3: 2 | B3: strcpy: &""{\0,\x01,\x01,\x01,\x01,\x01} &"rs"{\0,p,s,\0} :=> &"rs"{\0,p,r,\0} | C3: 1 | D3: 0.22025 | E3: 0.22025 | G3: of:=IF([.C3]=1;"";[.C3]) ->  | H3: of:=IF([.D3]=1;"";[.D3]) -> 0.22025 | I3: of:=IF([.E3]=1;"";[.E3]) -> 0.22025
A4: 3 | B4: strcpy: &""{\0,\x01,\x01,\x01,\x01,\x01} &"vop"{\0,p,\0} :=> &"vop"{\0,p,\0} | C4: 1 | D4: 0.0845172 | E4: 0.0845172 | G4: of:=IF([.C4]=1;"";[.C4]) ->  | H4: of:=IF([.D4]=1;"";[.D4]) -> 0.0845172 | I4: of:=IF([.E4]=1;"";[.E4]) -> 0.0845172
A5: 4 | B5: strcpy: &""{\0,\x01,\x01,\x01,\x01,\x01} &"tasi"{\0,\0} :=> &"tasi"{\0,\0} | C5: 1 | D5: 0.0488282 | E5: 0.0488282 | G5: of:=IF([.C5]=1;"";[.C5]) ->  | H5: of:=IF([.D5]=1;"";[.D5]) -> 0.0488282 | I5: of:=IF([.E5]=1;"";[.E5]) -> 0.0488282
A6: 5 | B6: strcpy: &""{\0,\x01,\x01,\x01,\x01,\x01} &"ojsgo"{\0} :=> &"ojsgo"{\0} | C6: 1 | D6: 0.0209859 | E6: 0.0209859 | G6: of:=IF([.C6]=1;"";[.C6]) ->  | H6: of:=IF([.D6]=1;"";[.D6]) -> 0.0209859 | I6: of:=IF([.E6]=1;"";[.E6]) -> 0.0209859
A7: 6 | B7: strcpy: &"x"{\0,\x01,\x01,\x01,\x01} &""{\0,p,o,n,t,\0} :=> &""{\0,\0,p,f,i,\0} | C7: 1 | D7: 1 | E7: 1 | G7: of:=IF([.C7]=1;"";[.C7]) ->  | H7: of:=IF([.D7]=1;"";[.D7]) ->  | I7: of:=IF([.E7]=1;"";[.E7]) -> 
A8: 7 | B8: strcpy: &"f"{\0,\x01,\x01,\x01,\x01} &"j"{\0,p,h,c,\0} :=> &"j"{\0,p,s,h,\0} | C8: 1 | D8: 1 | E8: 1 | G8: of:=IF([.C8]=1;"";[.C8]) ->  | H8: of:=IF([.D8]=1;"";[.D8]) ->  | I8: of:=IF([.E8]=1;"";[.E8]) -> 
A9: 8 | B9: strcpy: &"i"{\0,\x01,\x01,\x01,\x01} &"wk"{\0,p,r,\0} :=> &"wk"{\0,p,y,\0} | C9: 1 | D9: 0.191004 | E9: 0.191004 | G9: of:=IF([.C9]=1;"";[.C9]) ->  | H9: of:=IF([.D9]=1;"";[.D9]) -> 0.191004 | I9: of:=IF([.E9]=1;"";[.E9]) -> 0.191004
A10: 9 | B10: strcpy: &"h"{\0,\x01,\x01,\x01,\x01} &"gem"{\0,p,\0} :=> &"gem"{\0,p,\0} | C10: 1 | D10: 0.087702 | E10: 0.087702 | G10: of:=IF([.C10]=1;"";[.C10]) ->  | H10: of:=IF([.D10]=1;"";[.D10]) -> 0.087702 | I10: of:=IF([.E10]=1;"";[.E10]) -> 0.087702
A11: 10 | B11: strcpy: &"q"{\0,\x01,\x01,\x01,\x01} &"joll"{\0,\0} :=> &"joll"{\0,\0} | C11: 1 | D11: 0.0466095 | E11: 0.0466095 | G11: of:=IF([.C11]=1;"";[.C11]) ->  | H11: of:=IF([.D11]=1;"";[.D11]) -> 0.0466095 | I11: of:=IF([.E11]=1;"";[.E11]) -> 0.0466095
A12: 11 | B12: strcpy: &"x"{\0,\x01,\x01,\x01,\x01} &"moxic"{\0} :=> &"moxic"{\0} | C12: 1 | D12: 0.0284674 | E12: 0.0284674 | G12: of:=IF([.C12]=1;"";[.C12]) ->  | H12: of:=IF([.D12]=1;"";[.D12]) -> 0.0284674 | I12: of:=IF([.E12]=1;"";[.E12]) -> 0.0284674
A13: 12 | B13: strcpy: &"ra"{\0,\x01,\x01,\x01} &""{\0,p,o,k,d,\0} :=> &""{\0,a,\0,p,w,\0} | C13: 0.22156 | D13: 1 | E13: 1 | G13: of:=IF([.C13]=1;"";[.C13]) -> 0.22156 | H13: of:=IF([.D13]=1;"";[.D13]) ->  | I13: of:=IF([.E13]=1;"";[.E13]) -> 
A14: 13 | B14: strcpy: &"je"{\0,\x01,\x01,\x01} &"w"{\0,p,r,w,\0} :=> &"w"{\0,\0,p,o,\0} | C14: 0.205048 | D14: 1 | E14: 1 | G14: of:=IF([.C14]=1;"";[.C14]) -> 0.205048 | H14: of:=IF([.D14]=1;"";[.D14]) ->  | I14: of:=IF([.E14]=1;"";[.E14]) -> 
A15: 14 | B15: strcpy: &"ui"{\0,\x01,\x01,\x01} &"gy"{\0,p,r,\0} :=> &"gy"{\0,p,k,\0} | C15: 0.212346 | D15: 0.203557 | E15: 0.203557 | G15: of:=IF([.C15]=1;"";[.C15]) -> 0.212346 | H15: of:=IF([.D15]=1;"";[.D15]) -> 0.203557 | I15: of:=IF([.E15]=1;"";[.E15]) -> 0.203557
A16: 15 | B16: strcpy: &"ja"{\0,\x01,\x01,\x01} &"xoi"{\0,p,\0} :=> &"xoi"{\0,p,\0} | C16: 0.200124 | D16: 0.0778485 | E16: 0.0778485 | G16: of:=IF([.C16]=1;"";[.C16]) -> 0.200124 | H16: of:=IF([.D16]=1;"";[.D16]) -> 0.0778485 | I16: of:=IF([.E16]=1;"";[.E16]) -> 0.0778485
A17: 16 | B17: strcpy: &"bn"{\0,\x01,\x01,\x01} &"caju"{\0,\0} :=> &"caju"{\0,\0} | C17: 0.180192 | D17: 0.0442876 | E17: 0.0442876 | G17: of:=IF([.C17]=1;"";[.C17]) -> 0.180192 | H17: of:=IF([.D17]=1;"";[.D17]) -> 0.0442876 | I17: of:=IF([.E17]=1;"";[.E17]) -> 0.0442876
A18: 17 | B18: strcpy: &"ko"{\0,\x01,\x01,\x01} &"qvaot"{\0} :=> &"qvaot"{\0} | C18: 0.199534 | D18: 0.021757 | E18: 0.021757 | G18: of:=IF([.C18]=1;"";[.C18]) -> 0.199534 | H18: of:=IF([.D18]=1;"";[.D18]) -> 0.021757 | I18: of:=IF([.E18]=1;"";[.E18]) -> 0.021757
A19: 18 | B19: strcpy: &"pmc"{\0,\x01,\x01} &""{\0,p,j,f,o,\0} :=> &""{\0,m,c,\0,p,\0} | C19: 0.0708745 | D19: 1 | E19: 1 | G19: of:=IF([.C19]=1;"";[.C19]) -> 0.0708745 | H19: of:=IF([.D19]=1;"";[.D19]) ->  | I19: of:=IF([.E19]=1;"";[.E19]) -> 
A20: 19 | B20: strcpy: &"apb"{\0,\x01,\x01} &"t"{\0,p,u,f,\0} :=> &"t"{\0,b,\0,p,\0} | C20: 0.0772524 | D20: 1 | E20: 1 | G20: of:=IF([.C20]=1;"";[.C20]) -> 0.0772524 | H20: of:=IF([.D20]=1;"";[.D20]) ->  | I20: of:=IF([.E20]=1;"";[.E20]) -> 
A21: 20 | B21: strcpy: &"pot"{\0,\x01,\x01} &"im"{\0,p,y,\0} :=> &"im"{\0,\0,p,\0} | C21: 0.087702 | D21: 0.2171 | E21: 0.2171 | G21: of:=IF([.C21]=1;"";[.C21]) -> 0.087702 | H21: of:=IF([.D21]=1;"";[.D21]) -> 0.2171 | I21: of:=IF([.E21]=1;"";[.E21]) -> 0.2171
A22: 21 | B22: strcpy: &"lpt"{\0,\x01,\x01} &"onn"{\0,p,\0} :=> &"onn"{\0,p,\0} | C22: 0.0810686 | D22: 0.0879214 | E22: 0.0879214 | G22: of:=IF([.C22]=1;"";[.C22]) -> 0.0810686 | H22: of:=IF([.D22]=1;"";[.D22]) -> 0.0879214 | I22: of:=IF([.E22]=1;"";[.E22]) -> 0.0879214
A23: 22 | B23: strcpy: &"rou"{\0,\x01,\x01} &"mtts"{\0,\0} :=> &"mtts"{\0,\0} | C23: 0.0898383 | D23: 0.0419105 | E23: 0.0419105 | G23: of:=IF([.C23]=1;"";[.C23]) -> 0.0898383 | H23: of:=IF([.D23]=1;"";[.D23]) -> 0.0419105 | I23: of:=IF([.E23]=1;"";[.E23]) -> 0.0419105
A24: 23 | B24: strcpy: &"nvk"{\0,\x01,\x01} &"ibbjn"{\0} :=> &"ibbjn"{\0} | C24: 0.0650061 | D24: 0.0228225 | E24: 0.0228225 | G24: of:=IF([.C24]=1;"";[.C24]) -> 0.0650061 | H24: of:=IF([.D24]=1;"";[.D24]) -> 0.0228225 | I24: of:=IF([.E24]=1;"";[.E24]) -> 0.0228225
A25: 24 | B25: strcpy: &"sajf"{\0,\x01} &""{\0,p,q,u,t,\0} :=> &""{\0,a,j,f,\0,\0} | C25: 0.0338948 | D25: 1 | E25: 1 | G25: of:=IF([.C25]=1;"";[.C25]) -> 0.0338948 | H25: of:=IF([.D25]=1;"";[.D25]) ->  | I25: of:=IF([.E25]=1;"";[.E25]) -> 
A26: 25 | B26: strcpy: &"nasp"{\0,\x01} &"j"{\0,p,b,a,\0} :=> &"j"{\0,s,p,\0,\0} | C26: 0.0476882 | D26: 1 | E26: 1 | G26: of:=IF([.C26]=1;"";[.C26]) -> 0.0476882 | H26: of:=IF([.D26]=1;"";[.D26]) ->  | I26: of:=IF([.E26]=1;"";[.E26]) -> 
A27: 26 | B27: strcpy: &"sicw"{\0,\x01} &"xi"{\0,p,u,\0} :=> &"xi"{\0,w,\0,\0} | C27: 0.0383928 | D27: 0.203502 | E27: 0.203502 | G27: of:=IF([.C27]=1;"";[.C27]) -> 0.0383928 | H27: of:=IF([.D27]=1;"";[.D27]) -> 0.203502 | I27: of:=IF([.E27]=1;"";[.E27]) -> 0.203502
A28: 27 | B28: strcpy: &"uibj"{\0,\x01} &"zlo"{\0,p,\0} :=> &"zlo"{\0,\0,\0} | C28: 0.0427455 | D28: 0.0783672 | E28: 0.0783672 | G28: of:=IF([.C28]=1;"";[.C28]) -> 0.0427455 | H28: of:=IF([.D28]=1;"";[.D28]) -> 0.0783672 | I28: of:=IF([.E28]=1;"";[.E28]) -> 0.0783672
A29: 28 | B29: strcpy: &"pmit"{\0,\x01} &"rynj"{\0,\0} :=> &"rynj"{\0,\0} | C29: 0.0456866 | D29: 0.0425356 | E29: 0.0425356 | G29: of:=IF([.C29]=1;"";[.C29]) -> 0.0456866 | H29: of:=IF([.D29]=1;"";[.D29]) -> 0.0425356 | I29: of:=IF([.E29]=1;"";[.E29]) -> 0.0425356
A30: 29 | B30: strcpy: &"xuxx"{\0,\x01} &"urdup"{\0} :=> &"urdup"{\0} | C30: 0.0355883 | D30: 0.0300409 | E30: 0.0300409 | G30: of:=IF([.C30]=1;"";[.C30]) -> 0.0355883 | H30: of:=IF([.D30]=1;"";[.D30]) -> 0.0300409 | I30: of:=IF([.E30]=1;"";[.E30]) -> 0.0300409
A31: 30 | B31: strcpy: &"ijkme"{\0} &""{\0,p,l,b,d,\0} :=> &""{\0,j,k,m,e,\0} | C31: 0.0224186 | D31: 1 | E31: 1 | G31: of:=IF([.C31]=1;"";[.C31]) -> 0.0224186 | H31: of:=IF([.D31]=1;"";[.D31]) ->  | I31: of:=IF([.E31]=1;"";[.E31]) -> 
A32: 31 | B32: strcpy: &"xugsv"{\0} &"r"{\0,p,t,r,\0} :=> &"r"{\0,g,s,v,\0} | C32: 0.0256784 | D32: 1 | E32: 1 | G32: of:=IF([.C32]=1;"";[.C32]) -> 0.0256784 | H32: of:=IF([.D32]=1;"";[.D32]) ->  | I32: of:=IF([.E32]=1;"";[.E32]) -> 
A33: 32 | B33: strcpy: &"kbtpj"{\0} &"bl"{\0,p,e,\0} :=> &"bl"{\0,p,j,\0} | C33: 0.0221446 | D33: 0.215706 | E33: 0.215706 | G33: of:=IF([.C33]=1;"";[.C33]) -> 0.0221446 | H33: of:=IF([.D33]=1;"";[.D33]) -> 0.215706 | I33: of:=IF([.E33]=1;"";[.E33]) -> 0.215706
A34: 33 | B34: strcpy: &"wicra"{\0} &"wtv"{\0,p,\0} :=> &"wtv"{\0,a,\0} | C34: 0.0310603 | D34: 0.0710469 | E34: 0.0710469 | G34: of:=IF([.C34]=1;"";[.C34]) -> 0.0310603 | H34: of:=IF([.D34]=1;"";[.D34]) -> 0.0710469 | I34: of:=IF([.E34]=1;"";[.E34]) -> 0.0710469
A35: 34 | B35: strcpy: &"kbnta"{\0} &"sclg"{\0,\0} :=> &"sclg"{\0,\0} | C35: 0.0258959 | D35: 0.0432393 | E35: 0.0432393 | G35: of:=IF([.C35]=1;"";[.C35]) -> 0.0258959 | H35: of:=IF([.D35]=1;"";[.D35]) -> 0.0432393 | I35: of:=IF([.E35]=1;"";[.E35]) -> 0.0432393
A36: 35 | B36: strcpy: &"tnywh"{\0} &"rwlnh"{\0} :=> &"rwlnh"{\0} | C36: 0.0275477 | D36: 0.0254393 | E36: 0.0254393 | G36: of:=IF([.C36]=1;"";[.C36]) -> 0.0275477 | H36: of:=IF([.D36]=1;"";[.D36]) -> 0.0254393 | I36: of:=IF([.E36]=1;"";[.E36]) -> 0.0254393
A37: 1 | B37: strncpy: &""{\0,\x01,\x01,\x01,\x01,\x01} &""{\0,p,r,a,w,\0} 5 :=> &""{\0,\0,\0,\0,\0,\0} | C37: 1 | D37: 1 | E37: 1 | G37: of:=IF([.C37]=1;"";[.C37]) ->  | H37: of:=IF([.D37]=1;"";[.D37]) ->  | I37: of:=IF([.E37]=1;"";[.E37]) ->  | K37: of:=AVERAGE([.G37:.G72]) -> 0.0894360583333333 | L37: of:=AVERAGE([.H37:.H72]) -> 0.0866156375 | M37: of:=AVERAGE([.I37:.I72]) -> 0.0866156375 | O37: of:=AVERAGE([.K37:.M37]) -> 0.0875557777777778
A38: 2 | B38: strncpy: &""{\0,\x01,\x01,\x01,\x01,\x01} &"q"{\0,p,m,a,\0} 5 :=> &"q"{\0,\0,\0,\0,\0} | C38: 1 | D38: 1 | E38: 1 | G38: of:=IF([.C38]=1;"";[.C38]) ->  | H38: of:=IF([.D38]=1;"";[.D38]) ->  | I38: of:=IF([.E38]=1;"";[.E38]) -> 
A39: 3 | B39: strncpy: &""{\0,\x01,\x01,\x01,\x01,\x01} &"ql"{\0,p,p,\0} 5 :=> &"ql"{\0,\0,\0,\0} | C39: 1 | D39: 0.11996 | E39: 0.11996 | G39: of:=IF([.C39]=1;"";[.C39]) ->  | H39: of:=IF([.D39]=1;"";[.D39]) -> 0.11996 | I39: of:=IF([.E39]=1;"";[.E39]) -> 0.11996
A40: 4 | B40: strncpy: &""{\0,\x01,\x01,\x01,\x01,\x01} &"drh"{\0,p,\0} 5 :=> &"drh"{\0,\0,\0} | C40: 1 | D40: 0.0803471 | E40: 0.0803471 | G40: of:=IF([.C40]=1;"";[.C40]) ->  | H40: of:=IF([.D40]=1;"";[.D40]) -> 0.0803471 | I40: of:=IF([.E40]=1;"";[.E40]) -> 0.0803471
A41: 5 | B41: strncpy: &""{\0,\x01,\x01,\x01,\x01,\x01} &"wkig"{\0,\0} 5 :=> &"wkig"{\0,\0} | C41: 1 | D41: 0.0427719 | E41: 0.0427719 | G41: of:=IF([.C41]=1;"";[.C41]) ->  | H41: of:=IF([.D41]=1;"";[.D41]) -> 0.0427719 | I41: of:=IF([.E41]=1;"";[.E41]) -> 0.0427719
A42: 6 | B42: strncpy: &""{\0,\x01,\x01,\x01,\x01,\x01} &"intak"{\0} 5 :=> &"intak"{\0} | C42: 1 | D42: 0.0316302 | E42: 0.0316302 | G42: of:=IF([.C42]=1;"";[.C42]) ->  | H42: of:=IF([.D42]=1;"";[.D42]) -> 0.0316302 | I42: of:=IF([.E42]=1;"";[.E42]) -> 0.0316302
A43: 7 | B43: strncpy: &"i"{\0,\x01,\x01,\x01,\x01} &""{\0,p,h,e,r,\0} 5 :=> &""{\0,\0,\0,\0,\0,\0} | C43: 1 | D43: 1 | E43: 1 | G43: of:=IF([.C43]=1;"";[.C43]) ->  | H43: of:=IF([.D43]=1;"";[.D43]) ->  | I43: of:=IF([.E43]=1;"";[.E43]) -> 
A44: 8 | B44: strncpy: &"g"{\0,\x01,\x01,\x01,\x01} &"j"{\0,p,c,u,\0} 5 :=> &"j"{\0,\0,\0,\0,\0} | C44: 1 | D44: 1 | E44: 1 | G44: of:=IF([.C44]=1;"";[.C44]) ->  | H44: of:=IF([.D44]=1;"";[.D44]) ->  | I44: of:=IF([.E44]=1;"";[.E44]) -> 
A45: 9 | B45: strncpy: &"z"{\0,\x01,\x01,\x01,\x01} &"an"{\0,p,s,\0} 5 :=> &"an"{\0,\0,\0,\0} | C45: 1 | D45: 0.225766 | E45: 0.225766 | G45: of:=IF([.C45]=1;"";[.C45]) ->  | H45: of:=IF([.D45]=1;"";[.D45]) -> 0.225766 | I45: of:=IF([.E45]=1;"";[.E45]) -> 0.225766
A46: 10 | B46: strncpy: &"b"{\0,\x01,\x01,\x01,\x01} &"fax"{\0,p,\0} 5 :=> &"fax"{\0,\0,\0} | C46: 1 | D46: 0.0823723 | E46: 0.0823723 | G46: of:=IF([.C46]=1;"";[.C46]) ->  | H46: of:=IF([.D46]=1;"";[.D46]) -> 0.0823723 | I46: of:=IF([.E46]=1;"";[.E46]) -> 0.0823723
A47: 11 | B47: strncpy: &"k"{\0,\x01,\x01,\x01,\x01} &"teak"{\0,\0} 5 :=> &"teak"{\0,\0} | C47: 1 | D47: 0.048171 | E47: 0.048171 | G47: of:=IF([.C47]=1;"";[.C47]) ->  | H47: of:=IF([.D47]=1;"";[.D47]) -> 0.048171 | I47: of:=IF([.E47]=1;"";[.E47]) -> 0.048171
A48: 12 | B48: strncpy: &"w"{\0,\x01,\x01,\x01,\x01} &"mamiy"{\0} 5 :=> &"mamiy"{\0} | C48: 1 | D48: 0.0283612 | E48: 0.0283612 | G48: of:=IF([.C48]=1;"";[.C48]) ->  | H48: of:=IF([.D48]=1;"";[.D48]) -> 0.0283612 | I48: of:=IF([.E48]=1;"";[.E48]) -> 0.0283612
A49: 13 | B49: strncpy: &"fr"{\0,\x01,\x01,\x01} &""{\0,p,l,u,a,\0} 5 :=> &""{\0,\0,\0,\0,\0,\0} | C49: 0.215706 | D49: 1 | E49: 1 | G49: of:=IF([.C49]=1;"";[.C49]) -> 0.215706 | H49: of:=IF([.D49]=1;"";[.D49]) ->  | I49: of:=IF([.E49]=1;"";[.E49]) -> 
A50: 14 | B50: strncpy: &"dv"{\0,\x01,\x01,\x01} &"h"{\0,p,e,t,\0} 5 :=> &"h"{\0,\0,\0,\0,\0} | C50: 0.204609 | D50: 1 | E50: 1 | G50: of:=IF([.C50]=1;"";[.C50]) -> 0.204609 | H50: of:=IF([.D50]=1;"";[.D50]) ->  | I50: of:=IF([.E50]=1;"";[.E50]) -> 
A51: 15 | B51: strncpy: &"mc"{\0,\x01,\x01,\x01} &"ye"{\0,p,y,\0} 5 :=> &"ye"{\0,\0,\0,\0} | C51: 0.181936 | D51: 0.215236 | E51: 0.215236 | G51: of:=IF([.C51]=1;"";[.C51]) -> 0.181936 | H51: of:=IF([.D51]=1;"";[.D51]) -> 0.215236 | I51: of:=IF([.E51]=1;"";[.E51]) -> 0.215236
A52: 16 | B52: strncpy: &"qu"{\0,\x01,\x01,\x01} &"uwq"{\0,p,\0} 5 :=> &"uwq"{\0,\0,\0} | C52: 0.212836 | D52: 0.0536476 | E52: 0.0536476 | G52: of:=IF([.C52]=1;"";[.C52]) -> 0.212836 | H52: of:=IF([.D52]=1;"";[.D52]) -> 0.0536476 | I52: of:=IF([.E52]=1;"";[.E52]) -> 0.0536476
A53: 17 | B53: strncpy: &"if"{\0,\x01,\x01,\x01} &"cadl"{\0,\0} 5 :=> &"cadl"{\0,\0} | C53: 0.213806 | D53: 0.0462366 | E53: 0.0462366 | G53: of:=IF([.C53]=1;"";[.C53]) -> 0.213806 | H53: of:=IF([.D53]=1;"";[.D53]) -> 0.0462366 | I53: of:=IF([.E53]=1;"";[.E53]) -> 0.0462366
A54: 18 | B54: strncpy: &"ma"{\0,\x01,\x01,\x01} &"munqa"{\0} 5 :=> &"munqa"{\0} | C54: 0.219364 | D54: 0.023493 | E54: 0.023493 | G54: of:=IF([.C54]=1;"";[.C54]) -> 0.219364 | H54: of:=IF([.D54]=1;"";[.D54]) -> 0.023493 | I54: of:=IF([.E54]=1;"";[.E54]) -> 0.023493
A55: 19 | B55: strncpy: &"pha"{\0,\x01,\x01} &""{\0,p,n,i,r,\0} 5 :=> &""{\0,\0,\0,\0,\0,\0} | C55: 0.0864495 | D55: 1 | E55: 1 | G55: of:=IF([.C55]=1;"";[.C55]) -> 0.0864495 | H55: of:=IF([.D55]=1;"";[.D55]) ->  | I55: of:=IF([.E55]=1;"";[.E55]) -> 
A56: 20 | B56: strncpy: &"krr"{\0,\x01,\x01} &"y"{\0,p,r,b,\0} 5 :=> &"y"{\0,\0,\0,\0,\0} | C56: 0.0792923 | D56: 1 | E56: 1 | G56: of:=IF([.C56]=1;"";[.C56]) -> 0.0792923 | H56: of:=IF([.D56]=1;"";[.D56]) ->  | I56: of:=IF([.E56]=1;"";[.E56]) -> 
A57: 21 | B57: strncpy: &"rxt"{\0,\x01,\x01} &"cl"{\0,p,t,\0} 5 :=> &"cl"{\0,\0,\0,\0} | C57: 0.0716638 | D57: 0.213806 | E57: 0.213806 | G57: of:=IF([.C57]=1;"";[.C57]) -> 0.0716638 | H57: of:=IF([.D57]=1;"";[.D57]) -> 0.213806 | I57: of:=IF([.E57]=1;"";[.E57]) -> 0.213806
A58: 22 | B58: strncpy: &"rpt"{\0,\x01,\x01} &"lnk"{\0,p,\0} 5 :=> &"lnk"{\0,\0,\0} | C58: 0.0820677 | D58: 0.0780432 | E58: 0.0780432 | G58: of:=IF([.C58]=1;"";[.C58]) -> 0.0820677 | H58: of:=IF([.D58]=1;"";[.D58]) -> 0.0780432 | I58: of:=IF([.E58]=1;"";[.E58]) -> 0.0780432
A59: 23 | B59: strncpy: &"yla"{\0,\x01,\x01} &"ctta"{\0,\0} 5 :=> &"ctta"{\0,\0} | C59: 0.0833307 | D59: 0.0475127 | E59: 0.0475127 | G59: of:=IF([.C59]=1;"";[.C59]) -> 0.0833307 | H59: of:=IF([.D59]=1;"";[.D59]) -> 0.0475127 | I59: of:=IF([.E59]=1;"";[.E59]) -> 0.0475127
A60: 24 | B60: strncpy: &"iuj"{\0,\x01,\x01} &"ialri"{\0} 5 :=> &"ialri"{\0} | C60: 0.0713256 | D60: 0.0298694 | E60: 0.0298694 | G60: of:=IF([.C60]=1;"";[.C60]) -> 0.0713256 | H60: of:=IF([.D60]=1;"";[.D60]) -> 0.0298694 | I60: of:=IF([.E60]=1;"";[.E60]) -> 0.0298694
A61: 25 | B61: strncpy: &"nhru"{\0,\x01} &""{\0,p,i,l,s,\0} 5 :=> &""{\0,\0,\0,\0,\0,\0} | C61: 0.0437953 | D61: 1 | E61: 1 | G61: of:=IF([.C61]=1;"";[.C61]) -> 0.0437953 | H61: of:=IF([.D61]=1;"";[.D61]) ->  | I61: of:=IF([.E61]=1;"";[.E61]) -> 
A62: 26 | B62: strncpy: &"grya"{\0,\x01} &"y"{\0,p,e,m,\0} 5 :=> &"y"{\0,\0,\0,\0,\0} | C62: 0.0447317 | D62: 1 | E62: 1 | G62: of:=IF([.C62]=1;"";[.C62]) -> 0.0447317 | H62: of:=IF([.D62]=1;"";[.D62]) ->  | I62: of:=IF([.E62]=1;"";[.E62]) -> 
A63: 27 | B63: strncpy: &"flam"{\0,\x01} &"xi"{\0,p,c,\0} 5 :=> &"xi"{\0,\0,\0,\0} | C63: 0.0464344 | D63: 0.203502 | E63: 0.203502 | G63: of:=IF([.C63]=1;"";[.C63]) -> 0.0464344 | H63: of:=IF([.D63]=1;"";[.D63]) -> 0.203502 | I63: of:=IF([.E63]=1;"";[.E63]) -> 0.203502
A64: 28 | B64: strncpy: &"tyld"{\0,\x01} &"lbh"{\0,p,\0} 5 :=> &"lbh"{\0,\0,\0} | C64: 0.0449799 | D64: 0.0695259 | E64: 0.0695259 | G64: of:=IF([.C64]=1;"";[.C64]) -> 0.0449799 | H64: of:=IF([.D64]=1;"";[.D64]) -> 0.0695259 | I64: of:=IF([.E64]=1;"";[.E64]) -> 0.0695259
A65: 29 | B65: strncpy: &"xoos"{\0,\x01} &"lknj"{\0,\0} 5 :=> &"lknj"{\0,\0} | C65: 0.0436736 | D65: 0.041676 | E65: 0.041676 | G65: of:=IF([.C65]=1;"";[.C65]) -> 0.0436736 | H65: of:=IF([.D65]=1;"";[.D65]) -> 0.041676 | I65: of:=IF([.E65]=1;"";[.E65]) -> 0.041676
A66: 30 | B66: strncpy: &"pfaw"{\0,\x01} &"pwsis"{\0} 5 :=> &"pwsis"{\0} | C66: 0.0413948 | D66: 0.0275455 | E66: 0.0275455 | G66: of:=IF([.C66]=1;"";[.C66]) -> 0.0413948 | H66: of:=IF([.D66]=1;"";[.D66]) -> 0.0275455 | I66: of:=IF([.E66]=1;"";[.E66]) -> 0.0275455
A67: 31 | B67: strncpy: &"ckcch"{\0} &""{\0,p,a,d,r,\0} 5 :=> &""{\0,\0,\0,\0,\0,\0} | C67: 0.026198 | D67: 1 | E67: 1 | G67: of:=IF([.C67]=1;"";[.C67]) -> 0.026198 | H67: of:=IF([.D67]=1;"";[.D67]) ->  | I67: of:=IF([.E67]=1;"";[.E67]) -> 
A68: 32 | B68: strncpy: &"jafem"{\0} &"r"{\0,p,y,w,\0} 5 :=> &"r"{\0,\0,\0,\0,\0} | C68: 0.0286007 | D68: 1 | E68: 1 | G68: of:=IF([.C68]=1;"";[.C68]) -> 0.0286007 | H68: of:=IF([.D68]=1;"";[.D68]) ->  | I68: of:=IF([.E68]=1;"";[.E68]) -> 
A69: 33 | B69: strncpy: &"owcem"{\0} &"rr"{\0,p,g,\0} 5 :=> &"rr"{\0,\0,\0,\0} | C69: 0.0281449 | D69: 0.213322 | E69: 0.213322 | G69: of:=IF([.C69]=1;"";[.C69]) -> 0.0281449 | H69: of:=IF([.D69]=1;"";[.D69]) -> 0.213322 | I69: of:=IF([.E69]=1;"";[.E69]) -> 0.213322
A70: 34 | B70: strncpy: &"spuro"{\0} &"sks"{\0,p,\0} 5 :=> &"sks"{\0,\0,\0} | C70: 0.0304653 | D70: 0.0823871 | E70: 0.0823871 | G70: of:=IF([.C70]=1;"";[.C70]) -> 0.0304653 | H70: of:=IF([.D70]=1;"";[.D70]) -> 0.0823871 | I70: of:=IF([.E70]=1;"";[.E70]) -> 0.0823871
A71: 35 | B71: strncpy: &"hvcee"{\0} &"glap"{\0,\0} 5 :=> &"glap"{\0,\0} | C71: 0.0249974 | D71: 0.0460193 | E71: 0.0460193 | G71: of:=IF([.C71]=1;"";[.C71]) -> 0.0249974 | H71: of:=IF([.D71]=1;"";[.D71]) -> 0.0460193 | I71: of:=IF([.E71]=1;"";[.E71]) -> 0.0460193
A72: 36 | B72: strncpy: &"anjfn"{\0} &"vautv"{\0} 5 :=> &"vautv"{\0} | C72: 0.0206628 | D72: 0.0275733 | E72: 0.0275733 | G72: of:=IF([.C72]=1;"";[.C72]) -> 0.0206628 | H72: of:=IF([.D72]=1;"";[.D72]) -> 0.0275733 | I72: of:=IF([.E72]=1;"";[.E72]) -> 0.0275733

Sheet: strcat
A1: # | B1: Test Case | C1: N1 | D1: N2 | E1: N3
A2: 1 | B2: strcat: &""{\0,\x01,\x01,\x01,\x01,\x01,\x01,\x01,\x01,\x01} &"r"{\0,p,f,\0} :=> &"r"{\0,p,r,w,c,o,i,k,\0} | C2: 1 | D2: 1 | E2: 1 | G2: of:=IF([.C2]=1;"";[.C2]) ->  | H2: of:=IF([.D2]=1;"";[.D2]) ->  | I2: of:=IF([.E2]=1;"";[.E2]) ->  | K2: of:=AVERAGE([.G2:.G41]) -> 0.0635515977419355 | L2: of:=AVERAGE([.H2:.H41]) -> 0.107287784090909 | M2: of:=AVERAGE([.I2:.I41]) -> 0.0420989478378378 | O2: of:=AVERAGE([.K2:.M2]) -> 0.0709794432235608
A3: 2 | B3: strcat: &""{\0,\x01,\x01,\x01,\x01,\x01,\x01,\x01,\x01,\x01} &"mk"{\0,p,\0} :=> &"mk"{\0,p,i,v,i,e,c,\0} | C3: 1 | D3: 0.168677 | E3: 0.168677 | G3: of:=IF([.C3]=1;"";[.C3]) ->  | H3: of:=IF([.D3]=1;"";[.D3]) -> 0.168677 | I3: of:=IF([.E3]=1;"";[.E3]) -> 0.168677
A4: 3 | B4: strcat: &""{\0,\x01,\x01,\x01,\x01,\x01,\x01,\x01,\x01,\x01} &"vem"{\0,\0} :=> &"vem"{\0,p,h,p,c,l,\0} | C4: 1 | D4: 0.0886861 | E4: 0.0886861 | G4: of:=IF([.C4]=1;"";[.C4]) ->  | H4: of:=IF([.D4]=1;"";[.D4]) -> 0.0886861 | I4: of:=IF([.E4]=1;"";[.E4]) -> 0.0886861
A5: 4 | B5: strcat: &""{\0,\x01,\x01,\x01,\x01,\x01,\x01,\x01,\x01,\x01} &"qfhu"{\0} :=> &"qfhu"{\0,p,p,f,e,\0} | C5: 1 | D5: 0.0235578 | E5: 0.0235578 | H5: of:=IF([.D5]=1;"";[.D5]) -> 0.0235578 | I5: of:=IF([.E5]=1;"";[.E5]) -> 0.0235578
A6: 5 | B6: strcat: &"p"{\0,\x01,\x01,\x01,\x01,\x01,\x01,\x01,\x01} &""{\0,p,i,q,\0} :=> &"p"{\0,p,b,k,i,c,i,j,\0} | C6: 1 | D6: 1 | E6: 1 | G6: of:=IF([.C6]=1;"";[.C6]) ->  | H6: of:=IF([.D6]=1;"";[.D6]) ->  | I6: of:=IF([.E6]=1;"";[.E6]) -> 
A7: 6 | B7: strcat: &"t"{\0,\x01,\x01,\x01,\x01,\x01,\x01,\x01,\x01} &"i"{\0,p,a,\0} :=> &"ti"{\0,p,w,o,g,n,v,\0} | C7: 1 | D7: 1 | E7: 0.223271 | G7: of:=IF([.C7]=1;"";[.C7]) ->  | H7: of:=IF([.D7]=1;"";[.D7]) ->  | I7: of:=IF([.E7]=1;"";[.E7]) -> 0.223271
A8: 7 | B8: strcat: &"n"{\0,\x01,\x01,\x01,\x01,\x01,\x01,\x01,\x01} &"gr"{\0,p,\0} :=> &"ngr"{\0,p,n,o,c,b,\0} | C8: 1 | D8: 0.214762 | E8: 0.0880302 | G8: of:=IF([.C8]=1;"";[.C8]) ->  | H8: of:=IF([.D8]=1;"";[.D8]) -> 0.214762 | I8: of:=IF([.E8]=1;"";[.E8]) -> 0.0880302
A9: 8 | B9: strcat: &"g"{\0,\x01,\x01,\x01,\x01,\x01,\x01,\x01,\x01} &"ftm"{\0,\0} :=> &"gftm"{\0,p,n,t,r,\0} | C9: 1 | D9: 0.0822426 | E9: 0.0404674 | G9: of:=IF([.C9]=1;"";[.C9]) ->  | H9: of:=IF([.D9]=1;"";[.D9]) -> 0.0822426 | I9: of:=IF([.E9]=1;"";[.E9]) -> 0.0404674
A10: 9 | B10: strcat: &"s"{\0,\x01,\x01,\x01,\x01,\x01,\x01,\x01,\x01} &"zait"{\0} :=> &"szait"{\0,p,a,t,\0} | C10: 1 | D10: 0.0465683 | E10: 0.0273551 | G10: of:=IF([.C10]=1;"";[.C10]) ->  | H10: of:=IF([.D10]=1;"";[.D10]) -> 0.0465683 | I10: of:=IF([.E10]=1;"";[.E10]) -> 0.0273551
A11: 10 | B11: strcat: &"ef"{\0,\x01,\x01,\x01,\x01,\x01,\x01,\x01} &""{\0,p,l,v,\0} :=> &"ef"{\0,p,w,i,i,t,p,\0} | C11: 0.214286 | D11: 1 | E11: 0.214286 | G11: of:=IF([.C11]=1;"";[.C11]) -> 0.214286 | H11: of:=IF([.D11]=1;"";[.D11]) ->  | I11: of:=IF([.E11]=1;"";[.E11]) -> 0.214286
A12: 11 | B12: strcat: &"bo"{\0,\x01,\x01,\x01,\x01,\x01,\x01,\x01} &"k"{\0,p,j,\0} :=> &"bok"{\0,p,d,w,n,b,\0} | C12: 0.215706 | D12: 1 | E12: 0.0845478 | G12: of:=IF([.C12]=1;"";[.C12]) -> 0.215706 | H12: of:=IF([.D12]=1;"";[.D12]) ->  | I12: of:=IF([.E12]=1;"";[.E12]) -> 0.0845478
A13: 12 | B13: strcat: &"iy"{\0,\x01,\x01,\x01,\x01,\x01,\x01,\x01} &"pf"{\0,p,\0} :=> &"iypf"{\0,p,r,o,k,\0} | C13: 0.188384 | D13: 0.186816 | E13: 0.0368214 | G13: of:=IF([.C13]=1;"";[.C13]) -> 0.188384 | H13: of:=IF([.D13]=1;"";[.D13]) -> 0.186816 | I13: of:=IF([.E13]=1;"";[.E13]) -> 0.0368214
A14: 13 | B14: strcat: &"st"{\0,\x01,\x01,\x01,\x01,\x01,\x01,\x01} &"khi"{\0,\0} :=> &"stkhi"{\0,p,u,a,\0} | C14: 0.223271 | D14: 0.0807324 | E14: 0.0267696 | G14: of:=IF([.C14]=1;"";[.C14]) -> 0.223271 | H14: of:=IF([.D14]=1;"";[.D14]) -> 0.0807324 | I14: of:=IF([.E14]=1;"";[.E14]) -> 0.0267696
A15: 14 | B15: strcat: &"ij"{\0,\x01,\x01,\x01,\x01,\x01,\x01,\x01} &"aisg"{\0} :=> &"ijaisg"{\0,p,u,\0} | C15: 0.191943 | D15: 0.0439614 | E15: 0.0188165 | G15: of:=IF([.C15]=1;"";[.C15]) -> 0.191943 | H15: of:=IF([.D15]=1;"";[.D15]) -> 0.0439614 | I15: of:=IF([.E15]=1;"";[.E15]) -> 0.0188165
A16: 15 | B16: strcat: &"rit"{\0,\x01,\x01,\x01,\x01,\x01,\x01} &""{\0,p,k,c,\0} :=> &"rit"{\0,p,n,l,v,r,\0} | C16: 0.0899739 | D16: 1 | E16: 0.0899739 | G16: of:=IF([.C16]=1;"";[.C16]) -> 0.0899739 | H16: of:=IF([.D16]=1;"";[.D16]) ->  | I16: of:=IF([.E16]=1;"";[.E16]) -> 0.0899739
A17: 16 | B17: strcat: &"xmn"{\0,\x01,\x01,\x01,\x01,\x01,\x01} &"b"{\0,p,d,\0} :=> &"xmnb"{\0,p,w,h,q,\0} | C17: 0.0658366 | D17: 1 | E17: 0.0353781 | G17: of:=IF([.C17]=1;"";[.C17]) -> 0.0658366 | H17: of:=IF([.D17]=1;"";[.D17]) ->  | I17: of:=IF([.E17]=1;"";[.E17]) -> 0.0353781
A18: 17 | B18: strcat: &"wcu"{\0,\x01,\x01,\x01,\x01,\x01,\x01} &"nt"{\0,p,\0} :=> &"wcunt"{\0,p,o,r,\0} | C18: 0.0752781 | D18: 0.222847 | E18: 0.0280258 | G18: of:=IF([.C18]=1;"";[.C18]) -> 0.0752781 | H18: of:=IF([.D18]=1;"";[.D18]) -> 0.222847 | I18: of:=IF([.E18]=1;"";[.E18]) -> 0.0280258
A19: 18 | B19: strcat: &"gou"{\0,\x01,\x01,\x01,\x01,\x01,\x01} &"kgr"{\0,\0} :=> &"goukgr"{\0,p,u,\0} | C19: 0.0871561 | D19: 0.0760452 | E19: 0.0193253 | G19: of:=IF([.C19]=1;"";[.C19]) -> 0.0871561 | H19: of:=IF([.D19]=1;"";[.D19]) -> 0.0760452 | I19: of:=IF([.E19]=1;"";[.E19]) -> 0.0193253
A20: 19 | B20: strcat: &"kwn"{\0,\x01,\x01,\x01,\x01,\x01,\x01} &"iggm"{\0} :=> &"kwniggm"{\0,p,\0} | C20: 0.0768097 | D20: 0.0423526 | E20: 0.0148514 | G20: of:=IF([.C20]=1;"";[.C20]) -> 0.0768097 | H20: of:=IF([.D20]=1;"";[.D20]) -> 0.0423526 | I20: of:=IF([.E20]=1;"";[.E20]) -> 0.0148514
A21: 20 | B21: strcat: &"wniy"{\0,\x01,\x01,\x01,\x01,\x01} &""{\0,p,l,e,\0} :=> &"wniy"{\0,p,p,r,e,\0} | C21: 0.0423619 | D21: 1 | E21: 0.0423619 | G21: of:=IF([.C21]=1;"";[.C21]) -> 0.0423619 | H21: of:=IF([.D21]=1;"";[.D21]) ->  | I21: of:=IF([.E21]=1;"";[.E21]) -> 0.0423619
A22: 21 | B22: strcat: &"uroc"{\0,\x01,\x01,\x01,\x01,\x01} &"s"{\0,p,a,\0} :=> &"urocs"{\0,p,p,w,\0} | C22: 0.0476905 | D22: 1 | E22: 0.0298214 | G22: of:=IF([.C22]=1;"";[.C22]) -> 0.0476905 | H22: of:=IF([.D22]=1;"";[.D22]) ->  | I22: of:=IF([.E22]=1;"";[.E22]) -> 0.0298214
A23: 22 | B23: strcat: &"jaep"{\0,\x01,\x01,\x01,\x01,\x01} &"mw"{\0,p,\0} :=> &"jaepmw"{\0,p,d,\0} | C23: 0.0426211 | D23: 0.174098 | E23: 0.0175473 | G23: of:=IF([.C23]=1;"";[.C23]) -> 0.0426211 | H23: of:=IF([.D23]=1;"";[.D23]) -> 0.174098 | I23: of:=IF([.E23]=1;"";[.E23]) -> 0.0175473
A24: 23 | B24: strcat: &"tabo"{\0,\x01,\x01,\x01,\x01,\x01} &"mar"{\0,\0} :=> &"tabomar"{\0,p,\0} | C24: 0.0471803 | D24: 0.0896711 | E24: 0.0174714 | G24: of:=IF([.C24]=1;"";[.C24]) -> 0.0471803 | H24: of:=IF([.D24]=1;"";[.D24]) -> 0.0896711 | I24: of:=IF([.E24]=1;"";[.E24]) -> 0.0174714
A25: 24 | B25: strcat: &"brsr"{\0,\x01,\x01,\x01,\x01,\x01} &"jueg"{\0} :=> &"brsrjueg"{\0,\0} | C25: 0.0444459 | D25: 0.0449986 | E25: 0.0120992 | G25: of:=IF([.C25]=1;"";[.C25]) -> 0.0444459 | H25: of:=IF([.D25]=1;"";[.D25]) -> 0.0449986 | I25: of:=IF([.E25]=1;"";[.E25]) -> 0.0120992
A26: 25 | B26: strcat: &"kaiao"{\0,\x01,\x01,\x01,\x01} &""{\0,p,h,e,\0} :=> &"kaiao"{\0,p,s,m,\0} | C26: 0.0279418 | D26: 1 | E26: 0.0279418 | G26: of:=IF([.C26]=1;"";[.C26]) -> 0.0279418 | H26: of:=IF([.D26]=1;"";[.D26]) ->  | I26: of:=IF([.E26]=1;"";[.E26]) -> 0.0279418
A27: 26 | B27: strcat: &"mctog"{\0,\x01,\x01,\x01,\x01} &"a"{\0,p,u,\0} :=> &"mctoga"{\0,p,r,\0} | C27: 0.0276567 | D27: 1 | E27: 0.0200924 | G27: of:=IF([.C27]=1;"";[.C27]) -> 0.0276567 | H27: of:=IF([.D27]=1;"";[.D27]) ->  | I27: of:=IF([.E27]=1;"";[.E27]) -> 0.0200924
A28: 27 | B28: strcat: &"wljog"{\0,\x01,\x01,\x01,\x01} &"tr"{\0,p,\0} :=> &"wljogtr"{\0,p,\0} | C28: 0.0242787 | D28: 0.218916 | E28: 0.0139574 | G28: of:=IF([.C28]=1;"";[.C28]) -> 0.0242787 | H28: of:=IF([.D28]=1;"";[.D28]) -> 0.218916 | I28: of:=IF([.E28]=1;"";[.E28]) -> 0.0139574
A29: 28 | B29: strcat: &"yoxha"{\0,\x01,\x01,\x01,\x01} &"jee"{\0,\0} :=> &"yoxhajee"{\0,\0} | C29: 0.0274244 | D29: 0.0835038 | E29: 0.0123195 | G29: of:=IF([.C29]=1;"";[.C29]) -> 0.0274244 | H29: of:=IF([.D29]=1;"";[.D29]) -> 0.0835038 | I29: of:=IF([.E29]=1;"";[.E29]) -> 0.0123195
A30: 29 | B30: strcat: &"anvac"{\0,\x01,\x01,\x01,\x01} &"tadi"{\0} :=> &"anvactadi"{\0} | C30: 0.0303141 | D30: 0.0480529 | E30: 0.011871 | G30: of:=IF([.C30]=1;"";[.C30]) -> 0.0303141 | H30: of:=IF([.D30]=1;"";[.D30]) -> 0.0480529 | I30: of:=IF([.E30]=1;"";[.E30]) -> 0.011871
A31: 30 | B31: strcat: &"laguax"{\0,\x01,\x01,\x01} &""{\0,p,l,l,\0} :=> &"laguax"{\0,p,y,\0} | C31: 0.0210253 | D31: 1 | E31: 0.0210253 | G31: of:=IF([.C31]=1;"";[.C31]) -> 0.0210253 | H31: of:=IF([.D31]=1;"";[.D31]) ->  | I31: of:=IF([.E31]=1;"";[.E31]) -> 0.0210253
A32: 31 | B32: strcat: &"voryuk"{\0,\x01,\x01,\x01} &"z"{\0,p,l,\0} :=> &"voryukz"{\0,p,\0} | C32: 0.0194275 | D32: 1 | E32: 0.0128836 | G32: of:=IF([.C32]=1;"";[.C32]) -> 0.0194275 | H32: of:=IF([.D32]=1;"";[.D32]) ->  | I32: of:=IF([.E32]=1;"";[.E32]) -> 0.0128836
A33: 32 | B33: strcat: &"ualnly"{\0,\x01,\x01,\x01} &"rg"{\0,p,\0} :=> &"ualnlyrg"{\0,\0} | C33: 0.020574 | D33: 0.213322 | E33: 0.0127357 | G33: of:=IF([.C33]=1;"";[.C33]) -> 0.020574 | H33: of:=IF([.D33]=1;"";[.D33]) -> 0.213322 | I33: of:=IF([.E33]=1;"";[.E33]) -> 0.0127357
A34: 33 | B34: strcat: &"vignsq"{\0,\x01,\x01,\x01} &"equ"{\0,\0} :=> &"vignsqequ"{\0} | C34: 0.0208433 | D34: 0.081868 | E34: 0.00851301 | G34: of:=IF([.C34]=1;"";[.C34]) -> 0.0208433 | H34: of:=IF([.D34]=1;"";[.D34]) -> 0.081868 | I34: of:=IF([.E34]=1;"";[.E34]) -> 0.00851301
A35: 34 | B35: strcat: &"uqufks"{\0,\x01,\x01,\x01} &&10 :=> &"uqufksarpl"{} | C35: 0.017218 | D35: 0.00869245 | G35: of:=IF([.C35]=1;"";[.C35]) -> 0.017218 | H35: of:=IF([.D35]=1;"";[.D35]) -> 0.00869245 | I35: of:=IF([.E35]=1;"";[.E35]) ->  
A36: 35 | B36: strcat: &"zakpnus"{\0,\x01,\x01} &""{\0,p,u,y,\0} :=> &"zakpnus"{\0,p,\0} | C36: 0.0140544 | D36: 1 | E36: 0.0140544 | G36: of:=IF([.C36]=1;"";[.C36]) -> 0.0140544 | H36: of:=IF([.D36]=1;"";[.D36]) ->  | I36: of:=IF([.E36]=1;"";[.E36]) -> 0.0140544
A37: 36 | B37: strcat: &"trrlsnh"{\0,\x01,\x01} &"g"{\0,p,u,\0} :=> &"trrlsnhg"{\0,\0} | C37: 0.0157811 | D37: 1 | E37: 0.01196 | G37: of:=IF([.C37]=1;"";[.C37]) -> 0.0157811 | H37: of:=IF([.D37]=1;"";[.D37]) ->  | I37: of:=IF([.E37]=1;"";[.E37]) -> 0.01196
A38: 37 | B38: strcat: &"ltvyacu"{\0,\x01,\x01} &"pv"{\0,p,\0} :=> &"ltvyacupv"{\0} | C38: 0.0146956 | D38: 0.11996 | E38: 0.00836093 | G38: of:=IF([.C38]=1;"";[.C38]) -> 0.0146956 | H38: of:=IF([.D38]=1;"";[.D38]) -> 0.11996 | I38: of:=IF([.E38]=1;"";[.E38]) -> 0.00836093
A39: 38 | B39: strcat: &"lssnbluc"{\0,\x01} &""{\0,p,t,i,\0} :=> &"lssnbluc"{\0,\0} | C39: 0.0128886 | D39: 1 | E39: 0.0128886 | G39: of:=IF([.C39]=1;"";[.C39]) -> 0.0128886 | H39: of:=IF([.D39]=1;"";[.D39]) ->  | I39: of:=IF([.E39]=1;"";[.E39]) -> 0.0128886
A40: 39 | B40: strcat: &"bictecih"{\0,\x01} &"r"{\0,p,l,\0} :=> &"bictecihr"{\0} | C40: 0.0133405 | D40: 1 | E40: 0.0112244 | G40: of:=IF([.C40]=1;"";[.C40]) -> 0.0133405 | H40: of:=IF([.D40]=1;"";[.D40]) ->  | I40: of:=IF([.E40]=1;"";[.E40]) -> 0.0112244
A41: 40 | B41: strcat: &"anftxalgi"{\0} &""{\0,p,y,k,\0} :=> &"anftxalgi"{\0} | C41: 0.00969143 | D41: 1 | E41: 0.00969143 | G41: of:=IF([.C41]=1;"";[.C41]) -> 0.00969143 | H41: of:=IF([.D41]=1;"";[.D41]) ->  | I41: of:=IF([.E41]=1;"";[.E41]) -> 0.00969143
A42: 1 | B42: strncat: &""{\0,\x01,\x01,\x01,\x01,\x01,\x01,\x01,\x01,\x01} &""{\0,p,r,r,\0} 4 :=> &""{\0,p,i,t,e,k,l,v,g,\0} | C42: 1 | D42: 1 | E42: 1 | G42: of:=IF([.C42]=1;"";[.C42]) ->  | H42: of:=IF([.D42]=1;"";[.D42]) ->  | I42: of:=IF([.E42]=1;"";[.E42]) ->  | K42: of:=AVERAGE([.G42:.G82]) -> 0.0620959370967742 | L42: of:=AVERAGE([.H42:.H82]) -> 0.112559703636364 | M42: of:=AVERAGE([.I42:.I82]) -> 0.0415155772972973 | O42: of:=AVERAGE([.K42:.M42]) -> 0.0720570726768117
A43: 2 | B43: strncat: &""{\0,\x01,\x01,\x01,\x01,\x01,\x01,\x01,\x01,\x01} &"n"{\0,p,b,\0} 4 :=> &"n"{\0,p,y,a,q,i,e,p,\0} | C43: 1 | D43: 1 | E43: 1 | G43: of:=IF([.C43]=1;"";[.C43]) ->  | H43: of:=IF([.D43]=1;"";[.D43]) ->  | I43: of:=IF([.E43]=1;"";[.E43]) -> 
A44: 3 | B44: strncat: &""{\0,\x01,\x01,\x01,\x01,\x01,\x01,\x01,\x01,\x01} &"su"{\0,p,\0} 4 :=> &"su"{\0,p,m,p,b,s,y,\0} | C44: 1 | D44: 0.216638 | E44: 0.216638 | G44: of:=IF([.C44]=1;"";[.C44]) ->  | H44: of:=IF([.D44]=1;"";[.D44]) -> 0.216638 | I44: of:=IF([.E44]=1;"";[.E44]) -> 0.216638
A45: 4 | B45: strncat: &""{\0,\x01,\x01,\x01,\x01,\x01,\x01,\x01,\x01,\x01} &"bge"{\0,\0} 4 :=> &"bge"{\0,p,r,i,m,e,\0} | C45: 1 | D45: 0.0687802 | E45: 0.0687802 | G45: of:=IF([.C45]=1;"";[.C45]) ->  | H45: of:=IF([.D45]=1;"";[.D45]) -> 0.0687802 | I45: of:=IF([.E45]=1;"";[.E45]) -> 0.0687802
A46: 5 | B46: strncat: &""{\0,\x01,\x01,\x01,\x01,\x01,\x01,\x01,\x01,\x01} &"frwy"{\0} 4 :=> &"frwy"{\0,p,d,e,l,\0} | C46: 1 | D46: 0.042247 | E46: 0.042247 | G46: of:=IF([.C46]=1;"";[.C46]) ->  | H46: of:=IF([.D46]=1;"";[.D46]) -> 0.042247 | I46: of:=IF([.E46]=1;"";[.E46]) -> 0.042247
A47: 6 | B47: strncat: &"u"{\0,\x01,\x01,\x01,\x01,\x01,\x01,\x01,\x01} &""{\0,p,l,s,\0} 4 :=> &"u"{\0,p,e,w,e,h,e,r,\0} | C47: 1 | D47: 1 | E47: 1 | G47: of:=IF([.C47]=1;"";[.C47]) ->  | H47: of:=IF([.D47]=1;"";[.D47]) ->  | I47: of:=IF([.E47]=1;"";[.E47]) -> 
A48: 7 | B48: strncat: &"i"{\0,\x01,\x01,\x01,\x01,\x01,\x01,\x01,\x01} &"l"{\0,p,t,\0} 4 :=> &"il"{\0,p,d,b,m,g,a,\0} | C48: 1 | D48: 1 | E48: 0.22025 | G48: of:=IF([.C48]=1;"";[.C48]) ->  | H48: of:=IF([.D48]=1;"";[.D48]) ->  | I48: of:=IF([.E48]=1;"";[.E48]) -> 0.22025
A49: 8 | B49: strncat: &"x"{\0,\x01,\x01,\x01,\x01,\x01,\x01,\x01,\x01} &"va"{\0,p,\0} 4 :=> &"xva"{\0,p,u,i,v,m,\0} | C49: 1 | D49: 0.212346 | E49: 0.0707155 | G49: of:=IF([.C49]=1;"";[.C49]) ->  | H49: of:=IF([.D49]=1;"";[.D49]) -> 0.212346 | I49: of:=IF([.E49]=1;"";[.E49]) -> 0.0707155
A50: 9 | B50: strncat: &"j"{\0,\x01,\x01,\x01,\x01,\x01,\x01,\x01,\x01} &"yar"{\0,\0} 4 :=> &"jyar"{\0,p,r,u,m,\0} | C50: 1 | D50: 0.0845378 | E50: 0.0322728 | G50: of:=IF([.C50]=1;"";[.C50]) ->  | H50: of:=IF([.D50]=1;"";[.D50]) -> 0.0845378 | I50: of:=IF([.E50]=1;"";[.E50]) -> 0.0322728
A51: 10 | B51: strncat: &"e"{\0,\x01,\x01,\x01,\x01,\x01,\x01,\x01,\x01} &"haaj"{\0} 4 :=> &"ehaaj"{\0,p,h,r,\0} | C51: 1 | D51: 0.0424176 | E51: 0.0269269 | G51: of:=IF([.C51]=1;"";[.C51]) ->  | H51: of:=IF([.D51]=1;"";[.D51]) -> 0.0424176 | I51: of:=IF([.E51]=1;"";[.E51]) -> 0.0269269
A52: 11 | B52: strncat: &"as"{\0,\x01,\x01,\x01,\x01,\x01,\x01,\x01} &""{\0,p,k,r,\0} 4 :=> &"as"{\0,p,o,p,e,e,h,\0} | C52: 0.22242 | D52: 1 | E52: 0.22242 | G52: of:=IF([.C52]=1;"";[.C52]) -> 0.22242 | H52: of:=IF([.D52]=1;"";[.D52]) ->  | I52: of:=IF([.E52]=1;"";[.E52]) -> 0.22242
A53: 12 | B53: strncat: &"bv"{\0,\x01,\x01,\x01,\x01,\x01,\x01,\x01} &"v"{\0,p,t,\0} 4 :=> &"bvv"{\0,p,h,v,c,b,\0} | C53: 0.190869 | D53: 1 | E53: 0.0652672 | G53: of:=IF([.C53]=1;"";[.C53]) -> 0.190869 | H53: of:=IF([.D53]=1;"";[.D53]) ->  | I53: of:=IF([.E53]=1;"";[.E53]) -> 0.0652672
A54: 13 | B54: strncat: &"tl"{\0,\x01,\x01,\x01,\x01,\x01,\x01,\x01} &"fe"{\0,p,\0} 4 :=> &"tlfe"{\0,p,p,i,p,\0} | C54: 0.211853 | D54: 0.215706 | E54: 0.0449149 | G54: of:=IF([.C54]=1;"";[.C54]) -> 0.211853 | H54: of:=IF([.D54]=1;"";[.D54]) -> 0.215706 | I54: of:=IF([.E54]=1;"";[.E54]) -> 0.0449149
A55: 14 | B55: strncat: &"tv"{\0,\x01,\x01,\x01,\x01,\x01,\x01,\x01} &"clw"{\0,\0} 4 :=> &"tvclw"{\0,p,g,g,\0} | C55: 0.18696 | D55: 0.0803059 | E55: 0.0240456 | G55: of:=IF([.C55]=1;"";[.C55]) -> 0.18696 | H55: of:=IF([.D55]=1;"";[.D55]) -> 0.0803059 | I55: of:=IF([.E55]=1;"";[.E55]) -> 0.0240456
A56: 15 | B56: strncat: &"yo"{\0,\x01,\x01,\x01,\x01,\x01,\x01,\x01} &"bydm"{\0} 4 :=> &"yobydm"{\0,p,f,\0} | C56: 0.211356 | D56: 0.042114 | E56: 0.0196487 | G56: of:=IF([.C56]=1;"";[.C56]) -> 0.211356 | H56: of:=IF([.D56]=1;"";[.D56]) -> 0.042114 | I56: of:=IF([.E56]=1;"";[.E56]) -> 0.0196487
A57: 16 | B57: strncat: &"lku"{\0,\x01,\x01,\x01,\x01,\x01,\x01} &""{\0,p,t,r,\0} 4 :=> &"lku"{\0,p,a,m,j,e,\0} | C57: 0.0759205 | D57: 1 | E57: 0.0759205 | G57: of:=IF([.C57]=1;"";[.C57]) -> 0.0759205 | H57: of:=IF([.D57]=1;"";[.D57]) ->  | I57: of:=IF([.E57]=1;"";[.E57]) -> 0.0759205
A58: 17 | B58: strncat: &"cpg"{\0,\x01,\x01,\x01,\x01,\x01,\x01} &"u"{\0,p,f,\0} 4 :=> &"cpgu"{\0,p,a,x,e,\0} | C58: 0.0635855 | D58: 1 | E58: 0.0357115 | G58: of:=IF([.C58]=1;"";[.C58]) -> 0.0635855 | H58: of:=IF([.D58]=1;"";[.D58]) ->  | I58: of:=IF([.E58]=1;"";[.E58]) -> 0.0357115
A59: 18 | B59: strncat: &"idl"{\0,\x01,\x01,\x01,\x01,\x01,\x01} &"zv"{\0,p,\0} 4 :=> &"idlzv"{\0,p,u,s,\0} | C59: 0.0844259 | D59: 0.17374 | E59: 0.0240089 | G59: of:=IF([.C59]=1;"";[.C59]) -> 0.0844259 | H59: of:=IF([.D59]=1;"";[.D59]) -> 0.17374 | I59: of:=IF([.E59]=1;"";[.E59]) -> 0.0240089
A60: 19 | B60: strncat: &"tbu"{\0,\x01,\x01,\x01,\x01,\x01,\x01} &"eox"{\0,\0} 4 :=> &"tbueox"{\0,p,o,\0} | C60: 0.080479 | D60: 0.0798112 | E60: 0.0197396 | G60: of:=IF([.C60]=1;"";[.C60]) -> 0.080479 | H60: of:=IF([.D60]=1;"";[.D60]) -> 0.0798112 | I60: of:=IF([.E60]=1;"";[.E60]) -> 0.0197396
A61: 20 | B61: strncat: &"boa"{\0,\x01,\x01,\x01,\x01,\x01,\x01} &"slaq"{\0} 4 :=> &"boaslaq"{\0,p,\0} | C61: 0.0843876 | D61: 0.0436276 | E61: 0.0160886 | G61: of:=IF([.C61]=1;"";[.C61]) -> 0.0843876 | H61: of:=IF([.D61]=1;"";[.D61]) -> 0.0436276 | I61: of:=IF([.E61]=1;"";[.E61]) -> 0.0160886
A62: 21 | B62: strncat: &"mvov"{\0,\x01,\x01,\x01,\x01,\x01} &""{\0,p,y,h,\0} 4 :=> &"mvov"{\0,p,i,g,h,\0} | C62: 0.0390301 | D62: 1 | E62: 0.0390301 | G62: of:=IF([.C62]=1;"";[.C62]) -> 0.0390301 | H62: of:=IF([.D62]=1;"";[.D62]) ->  | I62: of:=IF([.E62]=1;"";[.E62]) -> 0.0390301
A63: 22 | B63: strncat: &"hauj"{\0,\x01,\x01,\x01,\x01,\x01} &"p"{\0,p,l,\0} 4 :=> &"haujp"{\0,p,o,q,\0} | C63: 0.0423896 | D63: 1 | E63: 0.0209283 | G63: of:=IF([.C63]=1;"";[.C63]) -> 0.0423896 | H63: of:=IF([.D63]=1;"";[.D63]) ->  | I63: of:=IF([.E63]=1;"";[.E63]) -> 0.0209283
A64: 23 | B64: strncat: &"bjke"{\0,\x01,\x01,\x01,\x01,\x01} &"er"{\0,p,\0} 4 :=> &"bjkeer"{\0,p,y,\0} | C64: 0.0366665 | D64: 0.226174 | E64: 0.018645 | G64: of:=IF([.C64]=1;"";[.C64]) -> 0.0366665 | H64: of:=IF([.D64]=1;"";[.D64]) -> 0.226174 | I64: of:=IF([.E64]=1;"";[.E64]) -> 0.018645
A65: 24 | B65: strncat: &"ytsh"{\0,\x01,\x01,\x01,\x01,\x01} &"asc"{\0,\0} 4 :=> &"ytshasc"{\0,p,\0} | C65: 0.0453112 | D65: 0.087449 | E65: 0.0168441 | G65: of:=IF([.C65]=1;"";[.C65]) -> 0.0453112 | H65: of:=IF([.D65]=1;"";[.D65]) -> 0.087449 | I65: of:=IF([.E65]=1;"";[.E65]) -> 0.0168441
A66: 25 | B66: strncat: &"mffa"{\0,\x01,\x01,\x01,\x01,\x01} &"byko"{\0} 4 :=> &"mffabyko"{\0,\0} | C66: 0.0430345 | D66: 0.0395325 | E66: 0.0118034 | G66: of:=IF([.C66]=1;"";[.C66]) -> 0.0430345 | H66: of:=IF([.D66]=1;"";[.D66]) -> 0.0395325 | I66: of:=IF([.E66]=1;"";[.E66]) -> 0.0118034
A67: 26 | B67: strncat: &"zgoab"{\0,\x01,\x01,\x01,\x01} &""{\0,p,v,s,\0} 4 :=> &"zgoab"{\0,p,o,r,\0} | C67: 0.0261411 | D67: 1 | E67: 0.0261411 | G67: of:=IF([.C67]=1;"";[.C67]) -> 0.0261411 | H67: of:=IF([.D67]=1;"";[.D67]) ->  | I67: of:=IF([.E67]=1;"";[.E67]) -> 0.0261411
A68: 27 | B68: strncat: &"coris"{\0,\x01,\x01,\x01,\x01} &"b"{\0,p,e,\0} 4 :=> &"corisb"{\0,p,r,\0} | C68: 0.0321938 | D68: 1 | E68: 0.022151 | G68: of:=IF([.C68]=1;"";[.C68]) -> 0.0321938 | H68: of:=IF([.D68]=1;"";[.D68]) ->  | I68: of:=IF([.E68]=1;"";[.E68]) -> 0.022151
A69: 28 | B69: strncat: &"bahkt"{\0,\x01,\x01,\x01,\x01} &"lu"{\0,p,\0} 4 :=> &"bahktlu"{\0,p,\0} | C69: 0.0245082 | D69: 0.212836 | E69: 0.0140947 | G69: of:=IF([.C69]=1;"";[.C69]) -> 0.0245082 | H69: of:=IF([.D69]=1;"";[.D69]) -> 0.212836 | I69: of:=IF([.E69]=1;"";[.E69]) -> 0.0140947
A70: 29 | B70: strncat: &"lvydr"{\0,\x01,\x01,\x01,\x01} &"boi"{\0,\0} 4 :=> &"lvydrboi"{\0,\0} | C70: 0.0260376 | D70: 0.0848644 | E70: 0.0120537 | G70: of:=IF([.C70]=1;"";[.C70]) -> 0.0260376 | H70: of:=IF([.D70]=1;"";[.D70]) -> 0.0848644 | I70: of:=IF([.E70]=1;"";[.E70]) -> 0.0120537
A71: 30 | B71: strncat: &"hrept"{\0,\x01,\x01,\x01,\x01} &"cuqu"{\0} 4 :=> &"hreptcuqu"{\0} | C71: 0.029952 | D71: 0.0408799 | E71: 0.0105825 | G71: of:=IF([.C71]=1;"";[.C71]) -> 0.029952 | H71: of:=IF([.D71]=1;"";[.D71]) -> 0.0408799 | I71: of:=IF([.E71]=1;"";[.E71]) -> 0.0105825
A72: 31 | B72: strncat: &"muntjd"{\0,\x01,\x01,\x01} &""{\0,p,a,r,\0} 4 :=> &"muntjd"{\0,p,o,\0} | C72: 0.0166667 | D72: 1 | E72: 0.0166667 | G72: of:=IF([.C72]=1;"";[.C72]) -> 0.0166667 | H72: of:=IF([.D72]=1;"";[.D72]) ->  | I72: of:=IF([.E72]=1;"";[.E72]) -> 0.0166667
A73: 32 | B73: strncat: &"cobuxw"{\0,\x01,\x01,\x01} &"w"{\0,p,p,\0} 4 :=> &"cobuxww"{\0,p,\0} | C73: 0.0189666 | D73: 1 | E73: 0.012807 | G73: of:=IF([.C73]=1;"";[.C73]) -> 0.0189666 | H73: of:=IF([.D73]=1;"";[.D73]) ->  | I73: of:=IF([.E73]=1;"";[.E73]) -> 0.012807
A74: 33 | B74: strncat: &"tbudwa"{\0,\x01,\x01,\x01} &"xl"{\0,p,\0} 4 :=> &"tbudwaxl"{\0,\0} | C74: 0.0200326 | D74: 0.175681 | E74: 0.0116189 | G74: of:=IF([.C74]=1;"";[.C74]) -> 0.0200326 | H74: of:=IF([.D74]=1;"";[.D74]) -> 0.175681 | I74: of:=IF([.E74]=1;"";[.E74]) -> 0.0116189
A75: 34 | B75: strncat: &"ojnfev"{\0,\x01,\x01,\x01} &"rut"{\0,\0} 4 :=> &"ojnfevrut"{\0} | C75: 0.0175946 | D75: 0.0864698 | E75: 0.00942402 | G75: of:=IF([.C75]=1;"";[.C75]) -> 0.0175946 | H75: of:=IF([.D75]=1;"";[.D75]) -> 0.0864698 | I75: of:=IF([.E75]=1;"";[.E75]) -> 0.00942402
A76: 35 | B76: strncat: &"qetelu"{\0,\x01,\x01,\x01} &&10 4 :=> &"qeteluspyn"{} | C76: 0.015655 | D76: 0.00780958 | G76: of:=IF([.C76]=1;"";[.C76]) -> 0.015655 | H76: of:=IF([.D76]=1;"";[.D76]) -> 0.00780958 | I76: of:=IF([.E76]=1;"";[.E76]) ->  
A77: 36 | B77: strncat: &"bgretcq"{\0,\x01,\x01} &""{\0,p,a,a,\0} 4 :=> &"bgretcq"{\0,p,\0} | C77: 0.0141881 | D77: 1 | E77: 0.0141881 | G77: of:=IF([.C77]=1;"";[.C77]) -> 0.0141881 | H77: of:=IF([.D77]=1;"";[.D77]) ->  | I77: of:=IF([.E77]=1;"";[.E77]) -> 0.0141881
A78: 37 | B78: strncat: &"nfirand"{\0,\x01,\x01} &"w"{\0,p,h,\0} 4 :=> &"nfirandw"{\0,\0} | C78: 0.0174634 | D78: 1 | E78: 0.0137877 | G78: of:=IF([.C78]=1;"";[.C78]) -> 0.0174634 | H78: of:=IF([.D78]=1;"";[.D78]) ->  | I78: of:=IF([.E78]=1;"";[.E78]) -> 0.0137877
A79: 38 | B79: strncat: &"llbeixp"{\0,\x01,\x01} &"ui"{\0,p,\0} 4 :=> &"llbeixpui"{\0} | C79: 0.0158989 | D79: 0.212346 | E79: 0.0109479 | G79: of:=IF([.C79]=1;"";[.C79]) -> 0.0158989 | H79: of:=IF([.D79]=1;"";[.D79]) -> 0.212346 | I79: of:=IF([.E79]=1;"";[.E79]) -> 0.0109479
A80: 39 | B80: strncat: &"crkrkwds"{\0,\x01} &""{\0,p,e,i,\0} 4 :=> &"crkrkwds"{\0,\0} | C80: 0.011961 | D80: 1 | E80: 0.011961 | G80: of:=IF([.C80]=1;"";[.C80]) -> 0.011961 | H80: of:=IF([.D80]=1;"";[.D80]) ->  | I80: of:=IF([.E80]=1;"";[.E80]) -> 0.011961
A81: 40 | B81: strncat: &"dyfycfyc"{\0,\x01} &"w"{\0,p,g,\0} 4 :=> &"dyfycfycw"{\0} | C81: 0.00973778 | D81: 1 | E81: 0.00751697 | G81: of:=IF([.C81]=1;"";[.C81]) -> 0.00973778 | H81: of:=IF([.D81]=1;"";[.D81]) ->  | I81: of:=IF([.E81]=1;"";[.E81]) -> 0.00751697
A82: 41 | B82: strncat: &"iklekvlka"{\0} &""{\0,p,s,t,\0} 4 :=> &"iklekvlka"{\0} | C82: 0.00928827 | D82: 1 | E82: 0.00928827 | G82: of:=IF([.C82]=1;"";[.C82]) -> 0.00928827 | H82: of:=IF([.D82]=1;"";[.D82]) ->  | I82: of:=IF([.E82]=1;"";[.E82]) -> 0.00928827

Sheet: strstr
A1: # | B1: Test Case | C1: N | G1: N1 | H1: N2 | I1: N3
A2: 1 | B2: strstr: &"k"{\0,h,p,i,\0} &"k"{\0,\0} :=> &"k"{\0,h,p,i,\0} | C2: 1 | D2: 1 | E2: 1 | G2: of:=IF([.C2]=1;"";[.C2]) ->  | H2: of:=IF([.D2]=1;"";[.D2]) ->  | I2: of:=IF([.E2]=1;"";[.E2]) ->  | K2: of:=AVERAGE([.G2:.G19]) -> 0.0785351647058823 | L2: of:=AVERAGE([.H2:.H19]) -> 0.185407777777778 | M2: of:=AVERAGE([.I2:.I19]) -> 0.10219061875 | O2: of:=AVERAGE([.K2:.M2]) -> 0.12204452041122
A3: 2 | B3: strstr: &"go"{\0,h,n,\0} &"g"{\0,\0} :=> &"go"{\0,h,n,\0} | C3: 0.213322 | D3: 1 | E3: 0.213322 | G3: of:=IF([.C3]=1;"";[.C3]) -> 0.213322 | H3: of:=IF([.D3]=1;"";[.D3]) ->  | I3: of:=IF([.E3]=1;"";[.E3]) -> 0.213322
A4: 3 | B4: strstr: &"ag"{\0,b,l,\0} &"g"{\0,\0} :=> &"g"{\0,b,l,\0,54} | C4: 0.216174 | D4: 1 | E4: 1 | G4: of:=IF([.C4]=1;"";[.C4]) -> 0.216174 | H4: of:=IF([.D4]=1;"";[.D4]) ->  | I4: of:=IF([.E4]=1;"";[.E4]) -> 
A5: 4 | B5: strstr: &"sib"{\0,h,\0} &"s"{\0,\0} :=> &"sib"{\0,h,\0} | C5: 0.0856426 | D5: 1 | E5: 0.0856426 | G5: of:=IF([.C5]=1;"";[.C5]) -> 0.0856426 | H5: of:=IF([.D5]=1;"";[.D5]) ->  | I5: of:=IF([.E5]=1;"";[.E5]) -> 0.0856426
A6: 5 | B6: strstr: &"fws"{\0,b,\0} &"w"{\0,\0} :=> &"ws"{\0,b,\0,54} | C6: 0.0704884 | D6: 1 | E6: 0.2083 | G6: of:=IF([.C6]=1;"";[.C6]) -> 0.0704884 | H6: of:=IF([.D6]=1;"";[.D6]) ->  | I6: of:=IF([.E6]=1;"";[.E6]) -> 0.2083
A7: 6 | B7: strstr: &"arro"{\0,\0} &"a"{\0,\0} :=> &"arro"{\0,\0} | C7: 0.048171 | D7: 1 | E7: 0.048171 | G7: of:=IF([.C7]=1;"";[.C7]) -> 0.048171 | H7: of:=IF([.D7]=1;"";[.D7]) ->  | I7: of:=IF([.E7]=1;"";[.E7]) -> 0.048171
A8: 7 | B8: strstr: &"mard"{\0,\0} &"a"{\0,\0} :=> &"ard"{\0,\0,54} | C8: 0.0482776 | D8: 1 | E8: 0.0886264 | G8: of:=IF([.C8]=1;"";[.C8]) -> 0.0482776 | H8: of:=IF([.D8]=1;"";[.D8]) ->  | I8: of:=IF([.E8]=1;"";[.E8]) -> 0.0886264
A9: 8 | B9: strstr: &"wtmfe"{\0} &"w"{\0,\0} :=> &"wtmfe"{\0} | C9: 0.0262032 | D9: 1 | E9: 0.0262032 | G9: of:=IF([.C9]=1;"";[.C9]) -> 0.0262032 | H9: of:=IF([.D9]=1;"";[.D9]) ->  | I9: of:=IF([.E9]=1;"";[.E9]) -> 0.0262032
A10: 9 | B10: strstr: &"padst"{\0} &"a"{\0,\0} :=> &"adst"{\0,54} | C10: 0.0308313 | D10: 1 | E10: 0.0476616 | G10: of:=IF([.C10]=1;"";[.C10]) -> 0.0308313 | H10: of:=IF([.D10]=1;"";[.D10]) ->  | I10: of:=IF([.E10]=1;"";[.E10]) -> 0.0476616
A11: 10 | B11: strstr: &"xw"{\0,d,b,\0} &"xw"{\0} :=> &"xw"{\0,d,b,\0} | C11: 0.184161 | D11: 0.184161 | E11: 0.184161 | G11: of:=IF([.C11]=1;"";[.C11]) -> 0.184161 | H11: of:=IF([.D11]=1;"";[.D11]) -> 0.184161 | I11: of:=IF([.E11]=1;"";[.E11]) -> 0.184161
A12: 11 | B12: strstr: &"fbe"{\0,d,\0} &"fb"{\0} :=> &"fbe"{\0,d,\0} | C12: 0.071727 | D12: 0.168873 | E12: 0.071727 | G12: of:=IF([.C12]=1;"";[.C12]) -> 0.071727 | H12: of:=IF([.D12]=1;"";[.D12]) -> 0.168873 | I12: of:=IF([.E12]=1;"";[.E12]) -> 0.071727
A13: 12 | B13: strstr: &"llj"{\0,a,\0} &"lj"{\0} :=> &"lj"{\0,a,\0,54} | C13: 0.0717339 | D13: 0.167887 | E13: 0.167887 | G13: of:=IF([.C13]=1;"";[.C13]) -> 0.0717339 | H13: of:=IF([.D13]=1;"";[.D13]) -> 0.167887 | I13: of:=IF([.E13]=1;"";[.E13]) -> 0.167887
A14: 13 | B14: strstr: &"pom"{\0,p,\0} &"om"{\0} :=> &"om"{\0,p,\0,54} | C14: 0.0882697 | D14: 0.220689 | E14: 0.220689 | G14: of:=IF([.C14]=1;"";[.C14]) -> 0.0882697 | H14: of:=IF([.D14]=1;"";[.D14]) -> 0.220689 | I14: of:=IF([.E14]=1;"";[.E14]) -> 0.220689
A15: 14 | B15: strstr: &"fntr"{\0,\0} &"fn"{\0} :=> &"fntr"{\0,\0} | C15: 0.042218 | D15: 0.177812 | E15: 0.042218 | G15: of:=IF([.C15]=1;"";[.C15]) -> 0.042218 | H15: of:=IF([.D15]=1;"";[.D15]) -> 0.177812 | I15: of:=IF([.E15]=1;"";[.E15]) -> 0.042218
A16: 15 | B16: strstr: &"ooxe"{\0,\0} &"ox"{\0} :=> &"oxe"{\0,\0,54} | C16: 0.0431631 | D16: 0.200708 | E16: 0.0782614 | G16: of:=IF([.C16]=1;"";[.C16]) -> 0.0431631 | H16: of:=IF([.D16]=1;"";[.D16]) -> 0.200708 | I16: of:=IF([.E16]=1;"";[.E16]) -> 0.0782614
A17: 16 | B17: strstr: &"sige"{\0,\0} &"ig"{\0} :=> &"ige"{\0,\0,54} | C17: 0.0478522 | D17: 0.2171 | E17: 0.0874077 | G17: of:=IF([.C17]=1;"";[.C17]) -> 0.0478522 | H17: of:=IF([.D17]=1;"";[.D17]) -> 0.2171 | I17: of:=IF([.E17]=1;"";[.E17]) -> 0.0874077
A18: 17 | B18: strstr: &"fbobr"{\0} &"fb"{\0} :=> &"fbobr"{\0} | C18: 0.0255002 | D18: 0.168873 | E18: 0.0255002 | G18: of:=IF([.C18]=1;"";[.C18]) -> 0.0255002 | H18: of:=IF([.D18]=1;"";[.D18]) -> 0.168873 | I18: of:=IF([.E18]=1;"";[.E18]) -> 0.0255002
A19: 18 | B19: strstr: &"wwgas"{\0} &"wg"{\0} :=> &"wgas"{\0,54} | C19: 0.0213626 | D19: 0.162567 | E19: 0.0392718 | G19: of:=IF([.C19]=1;"";[.C19]) -> 0.0213626 | H19: of:=IF([.D19]=1;"";[.D19]) -> 0.162567 | I19: of:=IF([.E19]=1;"";[.E19]) -> 0.0392718
A20: 19 | B20: strstr: &"minca"{\0} &"in"{\0} :=> &"inca"{\0,54} | C20: 0.0316655 | D20: 0.226579 | E20: 0.0491694 | G20: of:=IF([.C20]=1;"";[.C20]) -> 0.0316655 | H20: of:=IF([.D20]=1;"";[.D20]) -> 0.226579 | I20: of:=IF([.E20]=1;"";[.E20]) -> 0.0491694 | K20: of:=AVERAGE([.G20:.G24]) -> 0.02890426 | L20: of:=AVERAGE([.H20:.H24]) -> 0.2197075 | M20: of:=AVERAGE([.I20:.I24]) -> 0.03613092 | O20: of:=AVERAGE([.K20:.M20]) -> 0.0949142266666667
A21: 1 | B21: strnstr: &"hnkej"{\0} &""{\0,p,\0} 2 :=> &"hnkej"{\0} | C21: 0.0273854 | D21: 1 | E21: 0.0273854 | G21: of:=IF([.C21]=1;"";[.C21]) -> 0.0273854 | H21: of:=IF([.D21]=1;"";[.D21]) ->  | I21: of:=IF([.E21]=1;"";[.E21]) -> 0.0273854
A22: 2 | B22: strnstr: &"rqufi"{\0} &"r"{\0,\0} 2 :=> &"rqufi"{\0} | C22: 0.0265311 | D22: 1 | E22: 0.0265311 | G22: of:=IF([.C22]=1;"";[.C22]) -> 0.0265311 | H22: of:=IF([.D22]=1;"";[.D22]) ->  | I22: of:=IF([.E22]=1;"";[.E22]) -> 0.0265311
A23: 3 | B23: strnstr: &"pbuac"{\0} &"b"{\0,\0} 2 :=> &"buac"{\0,54} | C23: 0.0278065 | D23: 1 | E23: 0.0464359 | G23: of:=IF([.C23]=1;"";[.C23]) -> 0.0278065 | H23: of:=IF([.D23]=1;"";[.D23]) ->  | I23: of:=IF([.E23]=1;"";[.E23]) -> 0.0464359
A24: 4 | B24: strnstr: &"nnsan"{\0} &"nn"{\0} 2 :=> &"nnsan"{\0} | C24: 0.0311328 | D24: 0.212836 | E24: 0.0311328 | G24: of:=IF([.C24]=1;"";[.C24]) -> 0.0311328 | H24: of:=IF([.D24]=1;"";[.D24]) -> 0.212836 | I24: of:=IF([.E24]=1;"";[.E24]) -> 0.0311328
A25: 1 | B25: strpbrk: &"duiqf"{\0} &"aeiou"{\0} :=> &"uiqf"{\0,54} | C25: 0.0188094 | D25: 0.0299288 | E25: 0.0271694 | G25: of:=IF([.C25]=1;"";[.C25]) -> 0.0188094 | H25: of:=IF([.D25]=1;"";[.D25]) -> 0.0299288 | I25: of:=IF([.E25]=1;"";[.E25]) -> 0.0271694 | K25: of:=AVERAGE([.G25:.G34]) -> 0.02643864 | L25: of:=AVERAGE([.H25:.H34]) -> 0.0299288 | M25: of:=AVERAGE([.I25:.I34]) -> 0.0336418 | O25: of:=AVERAGE([.K25:.M25]) -> 0.03000308
A26: 2 | B26: strpbrk: &"wosyb"{\0} &"aeiou"{\0} :=> &"osyb"{\0,54} | C26: 0.0281525 | D26: 0.0299288 | E26: 0.0430474 | G26: of:=IF([.C26]=1;"";[.C26]) -> 0.0281525 | H26: of:=IF([.D26]=1;"";[.D26]) -> 0.0299288 | I26: of:=IF([.E26]=1;"";[.E26]) -> 0.0430474
A27: 3 | B27: strpbrk: &"gildg"{\0} &"aeiou"{\0} :=> &"ildg"{\0,54} | C27: 0.0296621 | D27: 0.0299288 | E27: 0.0462252 | G27: of:=IF([.C27]=1;"";[.C27]) -> 0.0296621 | H27: of:=IF([.D27]=1;"";[.D27]) -> 0.0299288 | I27: of:=IF([.E27]=1;"";[.E27]) -> 0.0462252
A28: 4 | B28: strpbrk: &"cembt"{\0} &"aeiou"{\0} :=> &"embt"{\0,54} | C28: 0.0290481 | D28: 0.0299288 | E28: 0.0440431 | G28: of:=IF([.C28]=1;"";[.C28]) -> 0.0290481 | H28: of:=IF([.D28]=1;"";[.D28]) -> 0.0299288 | I28: of:=IF([.E28]=1;"";[.E28]) -> 0.0440431
A29: 5 | B29: strpbrk: &"gadal"{\0} &"aeiou"{\0} :=> &"adal"{\0,54} | C29: 0.0308059 | D29: 0.0299288 | E29: 0.0480245 | G29: of:=IF([.C29]=1;"";[.C29]) -> 0.0308059 | H29: of:=IF([.D29]=1;"";[.D29]) -> 0.0299288 | I29: of:=IF([.E29]=1;"";[.E29]) -> 0.0480245
A30: 6 | B30: strpbrk: &"uqtlm"{\0} &"aeiou"{\0} :=> &"uqtlm"{\0} | C30: 0.0203668 | D30: 0.0299288 | E30: 0.0203668 | G30: of:=IF([.C30]=1;"";[.C30]) -> 0.0203668 | H30: of:=IF([.D30]=1;"";[.D30]) -> 0.0299288 | I30: of:=IF([.E30]=1;"";[.E30]) -> 0.0203668
A31: 7 | B31: strpbrk: &"ofmyp"{\0} &"aeiou"{\0} :=> &"ofmyp"{\0} | C31: 0.026296 | D31: 0.0299288 | E31: 0.026296 | G31: of:=IF([.C31]=1;"";[.C31]) -> 0.026296 | H31: of:=IF([.D31]=1;"";[.D31]) -> 0.0299288 | I31: of:=IF([.E31]=1;"";[.E31]) -> 0.026296
A32: 8 | B32: strpbrk: &"ivgdu"{\0} &"aeiou"{\0} :=> &"ivgdu"{\0} | C32: 0.0242811 | D32: 0.0299288 | E32: 0.0242811 | G32: of:=IF([.C32]=1;"";[.C32]) -> 0.0242811 | H32: of:=IF([.D32]=1;"";[.D32]) -> 0.0299288 | I32: of:=IF([.E32]=1;"";[.E32]) -> 0.0242811
A33: 9 | B33: strpbrk: &"espff"{\0} &"aeiou"{\0} :=> &"espff"{\0} | C33: 0.0281207 | D33: 0.0299288 | E33: 0.0281207 | G33: of:=IF([.C33]=1;"";[.C33]) -> 0.0281207 | H33: of:=IF([.D33]=1;"";[.D33]) -> 0.0299288 | I33: of:=IF([.E33]=1;"";[.E33]) -> 0.0281207
A34: 10 | B34: strpbrk: &"ambyn"{\0} &"aeiou"{\0} :=> &"ambyn"{\0} | C34: 0.0288438 | D34: 0.0299288 | E34: 0.0288438 | G34: of:=IF([.C34]=1;"";[.C34]) -> 0.0288438 | H34: of:=IF([.D34]=1;"";[.D34]) -> 0.0299288 | I34: of:=IF([.E34]=1;"";[.E34]) -> 0.0288438